swda_filename,ptb_basename,conversation_no,transcript_index,act_tag,caller,utterance_index,subutterance_index,text,pos,trees,ptb_treenumbers
sw08utt/sw_0809_2040.utt,2/sw2040,2040,0,o,A,1,1,"Yes,  /","Yes/UH ,/,","(ROOT (INTJ (UH Yes) (, ,)))",
sw08utt/sw_0809_2040.utt,2/sw2040,2040,1,qr,A,1,2,"{F um, } I was wondering whether you were in favor of statehood, independence, or the status quo for Puerto Rico. /","um/UH ,/, I/PRP was/VBD wondering/VBG whether/IN you/PRP were/VBD in/IN favor/NN of/IN statehood/NN ,/, independence/NN ,/, or/CC the/DT status/NN quo/FW for/IN Puerto/NNP Rico/NNP ./.","(ROOT (S (INTJ (UH um)) (, ,) (NP (PRP I)) (VP (VBD was) (VP (VBG wondering) (SBAR (IN whether) (S (NP (PRP you)) (VP (VBD were) (PP (IN in) (NP (NP (NN favor)) (PP (IN of) (NP (NP (NN statehood)) (, ,) (NP (NN independence)) (, ,) (CC or) (NP (DT the) (NN status)))))) (NP (NP (FW quo)) (PP (IN for) (NP (NNP Puerto) (NNP Rico))))))))) (. .)))",
sw08utt/sw_0809_2040.utt,2/sw2040,2040,2,sd,B,2,1,"I was a resident, although very young [ of the sta-, +  of ] what is now the state of Alaska in nineteen fifty-nine when Alaska stopped being a territory and became a state.  /","I/PRP was/VBD a/DT resident/NN ,/, although/IN very/JJ young/NN of/IN the/DT sta-/NN ,/, of/IN what/WP is/VBZ now/RB the/DT state/NN of/IN Alaska/NNP in/IN nineteen/CD fifty-nine/CD when/WRB Alaska/NNP stopped/VBD being/VBG a/DT territory/NN and/CC became/VBD a/DT state/NN ./.","(ROOT (S (NP (PRP I)) (VP (VBD was) (NP (DT a) (NN resident)) (, ,) (PP (IN although) (NP (NP (JJ very) (NN young)) (PP (IN of) (NP (DT the) (NN sta-))) (, ,) (PP (IN of) (SBAR (WHNP (WP what)) (S (VP (VBZ is) (ADVP (RB now)) (NP (NP (DT the) (NN state)) (PP (IN of) (NP (NP (NNP Alaska)) (PP (IN in) (NP (CD nineteen) (CD fifty-nine)))))) (SBAR (WHADVP (WRB when)) (S (NP (NNP Alaska)) (VP (VP (VBD stopped) (S (VP (VBG being) (NP (DT a) (NN territory))))) (CC and) (VP (VBD became) (NP (DT a) (NN state))))))))))))) (. .)))",
sw08utt/sw_0809_2040.utt,2/sw2040,2040,3,sd,B,2,2,"{F Uh, } {C so } I guess I have a left over positive feeling about the question even though I don't know very much about Puerto Rico.  /","Uh/UH ,/, so/RB I/PRP guess/VBP I/PRP have/VBP a/DT left/VB over/IN positive/JJ feeling/NN about/IN the/DT question/NN even/RB though/IN I/PRP do/VBP n't/RB know/VB very/RB much/RB about/IN Puerto/NNP Rico/NNP ./.","(ROOT (S (INTJ (UH Uh)) (, ,) (ADVP (RB so)) (NP (PRP I)) (VP (VBP guess) (SBAR (S (NP (PRP I)) (VP (VBP have) (S (NP (DT a)) (VP (VB left) (PP (IN over) (NP (NP (JJ positive) (NN feeling)) (PP (IN about) (NP (DT the) (NN question))))) (SBAR (RB even) (IN though) (S (NP (PRP I)) (VP (VBP do) (RB n't) (VP (VB know) (ADVP (RB very) (RB much)) (PP (IN about) (NP (NNP Puerto) (NNP Rico))))))))))))) (. .)))",
sw08utt/sw_0809_2040.utt,2/sw2040,2040,4,sd,B,2,3,"{F Uh, } I know that all the things that happened, relative to that territory in Alaska have been very positive, {F uh, } /","Uh/UH ,/, I/PRP know/VBP that/IN all/PDT the/DT things/NNS that/WDT happened/VBD ,/, relative/JJ to/IN that/DT territory/NN in/IN Alaska/NNP have/VBP been/VBN very/RB positive/JJ ,/, uh/UH ,/,","(ROOT (S (INTJ (UH Uh)) (, ,) (NP (NP (PRP I)) (SBAR (S (VP (VBP know) (SBAR (IN that) (FRAG (NP (NP (PDT all) (DT the) (NNS things)) (SBAR (WHNP (WDT that)) (S (VP (VBD happened))))))))))) (, ,) (NP (NP (JJ relative)) (PP (IN to) (NP (NP (DT that) (NN territory)) (PP (IN in) (NP (NNP Alaska)))))) (VP (VBP have) (VP (VBN been) (ADJP (ADJP (RB very) (JJ positive)) (PRN (, ,) (INTJ (UH uh)) (, ,)))))))",
sw08utt/sw_0809_2040.utt,2/sw2040,2040,5,sv,B,2,4,"{C and } I have a suspicion [ that, + that ] I believe that [ a, +  the ] statehood is a good idea whenever you have a territory the size of Puerto Rico one ought {C either } to make it a full-fledged state [ {C or, } + {C or } ] let it go, one or   the other.  /","and/CC I/PRP have/VBP a/DT suspicion/NN that/IN ,/, that/IN I/PRP believe/VBP that/IN a/DT ,/, the/DT statehood/NN is/VBZ a/DT good/JJ idea/NN whenever/WRB you/PRP have/VBP a/DT territory/NN the/DT size/NN of/IN Puerto/NNP Rico/NNP one/PRP ought/MD either/DT to/TO make/VB it/PRP a/DT full-fledged/JJ state/NN or/CC ,/, or/CC let/VB it/PRP go/VB ,/, one/CD or/CC the/DT other/NN ./.","(ROOT (S (CC and) (NP (PRP I)) (VP (VBP have) (NP (DT a) (NN suspicion)) (SBAR (IN that) (PRN (, ,) (SBAR (IN that) (S (NP (PRP I)) (VP (VBP believe) (ADVP (IN that) (DT a))))) (, ,)) (S (NP (DT the) (NN statehood)) (VP (VBZ is) (NP (NP (DT a) (JJ good) (NN idea)) (SBAR (WHADVP (WRB whenever)) (S (NP (PRP you)) (VP (VBP have) (S (NP (DT a) (NN territory)) (NP (NP (DT the) (NN size)) (PP (IN of) (NP (NP (NNP Puerto) (NNP Rico)) (SBAR (S (NP (PRP one)) (VP (MD ought) (S (VP (DT either) (TO to) (VP (VP (VB make) (S (NP (PRP it)) (NP (DT a) (JJ full-fledged) (NN state)))) (CC or) (, ,) (CC or) (VP (VB let) (S (NP (PRP it)) (VP (VB go)))))))))) (, ,) (NP (CD one)) (CC or) (NP (DT the) (NN other)))))))))))))) (. .)))",
sw08utt/sw_0809_2040.utt,2/sw2040,2040,6,qo,B,2,5,What is your situation? /,What/WP is/VBZ your/PRP$ situation/NN ?/.,(ROOT (SBARQ (WHNP (WP What)) (SQ (VBZ is) (NP (PRP$ your) (NN situation))) (. ?))),
sw08utt/sw_0809_2040.utt,2/sw2040,2040,7,sd,A,3,1,"{D Well, } [ I'm, + I ] guess I don't have [ su-, + such ] close experience [ with, + with, ] {F um, } an area becoming a state as you do.  /","Well/UH ,/, I/PRP 'm/VBP ,/, I/PRP guess/VBP I/PRP do/VBP n't/RB have/VB su-/XX ,/, such/JJ close/JJ experience/NN with/IN ,/, with/IN ,/, um/UH ,/, an/DT area/NN becoming/VBG a/DT state/NN as/IN you/PRP do/VBP ./.","(ROOT (S (INTJ (UH Well)) (, ,) (NP (PRP I)) (VP (VBP 'm) (PRN (, ,) (S (NP (PRP I)) (VP (VBP guess) (SBAR (S (NP (PRP I)) (VP (VBP do) (RB n't) (VP (VB have) (NP (XX su-) (, ,) (JJ such) (JJ close) (NN experience)) (PP (IN with)))))))) (, ,)) (PP (IN with) (PRN (, ,) (INTJ (UH um)) (, ,))) (NP (NP (DT an) (NN area)) (VP (VBG becoming) (NP (DT a) (NN state)) (SBAR (IN as) (S (NP (PRP you)) (VP (VBP do))))))) (. .)))",
sw08utt/sw_0809_2040.utt,2/sw2040,2040,8,sv,A,3,2,"{F Um, } my concern is the economy because as I understand it Puerto Rico has a very low [ sta-, + {F uh, } standard ] of living or  at least, {F um, } annual average income. /","Um/UH ,/, my/PRP$ concern/NN is/VBZ the/DT economy/NN because/IN as/IN I/PRP understand/VBP it/PRP Puerto/NNP Rico/NNP has/VBZ a/DT very/RB low/JJ sta-/XX ,/, uh/UH ,/, standard/NN of/IN living/VBG or/CC at/IN least/JJS ,/, um/UH ,/, annual/JJ average/JJ income/NN ./.","(ROOT (S (INTJ (UH Um)) (, ,) (NP (PRP$ my) (NN concern)) (VP (VBZ is) (NP (DT the) (NN economy)) (SBAR (IN because) (S (SBAR (IN as) (S (NP (PRP I)) (VP (VBP understand) (NP (PRP it))))) (NP (NNP Puerto) (NNP Rico)) (VP (VBZ has) (NP (NP (NP (DT a) (ADJP (ADJP (RB very) (JJ low) (XX sta-)) (PRN (, ,) (INTJ (UH uh)) (, ,))) (NN standard)) (PP (IN of) (NP (VBG living)))) (CC or) (ADVP (IN at) (JJS least)))))) (, ,) (FRAG (INTJ (UH um)) (, ,) (NP (JJ annual) (JJ average) (NN income)))) (. .)))",
sw08utt/sw_0809_2040.utt,2/sw2040,2040,9,sv,A,3,3,"{F Um, } part of this I suppose is justified [ in, + in ] that the climate they don't need, perhaps, the heating and the housing that some of the more northern territories need. /","Um/UH ,/, part/NN of/IN this/DT I/PRP suppose/VBP is/VBZ justified/JJ in/IN ,/, in/IN that/DT the/DT climate/NN they/PRP do/VBP n't/RB need/VB ,/, perhaps/RB ,/, the/DT heating/NN and/CC the/DT housing/NN that/IN some/DT of/IN the/DT more/RBR northern/JJ territories/NNS need/VBP ./.","(ROOT (S (INTJ (UH Um)) (, ,) (NP (NP (NN part)) (PP (IN of) (NP (DT this))) (SBAR (S (NP (PRP I)) (VP (VBP suppose))))) (VP (VBZ is) (ADJP (JJ justified) (PP (IN in))) (, ,) (PP (IN in) (NP (DT that))) (NP (NP (DT the) (NN climate)) (SBAR (S (NP (PRP they)) (VP (VBP do) (RB n't) (VP (VB need) (, ,) (ADVP (RB perhaps)) (, ,) (NP (NP (DT the) (NN heating)) (CC and) (NP (DT the) (NN housing))) (SBAR (IN that) (S (NP (NP (DT some)) (PP (IN of) (NP (DT the) (ADJP (RBR more) (JJ northern)) (NNS territories)))) (VP (VBP need)))))))))) (. .)))",
sw08utt/sw_0809_2040.utt,2/sw2040,2040,10,sv,A,3,4,"However, in that case, I guess I would favor status quo.  /","However/RB ,/, in/IN that/DT case/NN ,/, I/PRP guess/VBP I/PRP would/MD favor/VB status/NN quo/FW ./.","(ROOT (S (ADVP (RB However)) (, ,) (PP (IN in) (NP (DT that) (NN case))) (, ,) (NP (PRP I)) (VP (VBP guess) (SBAR (S (NP (PRP I)) (VP (MD would) (VP (VB favor) (S (NP (NN status)) (NP (FW quo)))))))) (. .)))",
sw08utt/sw_0809_2040.utt,2/sw2040,2040,11,sd,A,3,5,"I have been to Puerto Rico [ and, + and ] found it very, very interesting.  /","I/PRP have/VBP been/VBN to/IN Puerto/NNP Rico/NNP and/CC ,/, and/CC found/VBD it/PRP very/RB ,/, very/RB interesting/JJ ./.","(ROOT (S (NP (PRP I)) (VP (VP (VBP have) (VP (VBN been) (PP (IN to) (NP (NNP Puerto) (NNP Rico))))) (CC and) (, ,) (CC and) (VP (VBD found) (NP (PRP it)) (ADJP (RB very) (, ,) (RB very) (JJ interesting)))) (. .)))",
sw08utt/sw_0809_2040.utt,2/sw2040,2040,12,sd,A,3,6,I did Peace Corps training there. /,I/PRP did/VBD Peace/NNP Corps/NNP training/NN there/RB ./.,(ROOT (S (NP (PRP I)) (VP (VBD did) (NP (NNP Peace) (NNP Corps) (NN training)) (ADVP (RB there))) (. .))),
sw08utt/sw_0809_2040.utt,2/sw2040,2040,13,ba,B,4,1,{F Oh } that's very interesting. /,Oh/UH that/DT 's/BES very/RB interesting/JJ ./.,(ROOT (S (S (INTJ (UH Oh)) (NP (DT that)) (VP (BES 's) (ADJP (RB very) (JJ interesting)))) (. .))),
sw08utt/sw_0809_2040.utt,2/sw2040,2040,14,sd,A,5,1,"{C And so, } {F um, } {D you know, } I saw it, also as a young student  /","And/CC so/RB ,/, um/UH ,/, you/PRP know/VBP ,/, I/PRP saw/VBD it/PRP ,/, also/RB as/IN a/DT young/JJ student/NN","(ROOT (S (CC And) (ADVP (RB so)) (SBAR (PRN (, ,) (INTJ (UH um)) (, ,)) (S (NP (PRP you)) (VP (VBP know)))) (, ,) (NP (PRP I)) (VP (VBD saw) (NP (PRP it)) (, ,) (ADVP (RB also)) (PP (IN as) (NP (DT a) (JJ young) (NN student))))))",
sw08utt/sw_0809_2040.utt,2/sw2040,2040,15,sd,A,5,2,"[ {C and, } + {C and } ] it was very foreign in a certain sense, although I had grown up in California  /","and/CC ,/, and/CC it/PRP was/VBD very/RB foreign/JJ in/IN a/DT certain/JJ sense/NN ,/, although/IN I/PRP had/VBD grown/VBN up/RP in/IN California/NNP","(ROOT (SINV (CC and) (, ,) (CC and) (S (NP (PRP it)) (VP (VBD was) (ADJP (RB very) (JJ foreign)) (PP (IN in) (NP (DT a) (JJ certain) (NN sense))))) (, ,) (VP (PP (IN although) (NP (PRP I))) (VBD had) (VP (VBN grown) (PRT (RP up)) (PP (IN in)))) (NP (NNP California))))",
sw08utt/sw_0809_2040.utt,2/sw2040,2040,16,sd,A,5,3,{C and so }  the Spanish was no problem.  /,and/CC so/RB the/DT Spanish/JJ was/VBD no/DT problem/NN ./.,(ROOT (S (NP (QP (CC and) (RB so)) (DT the) (JJ Spanish)) (VP (VBD was) (NP (DT no) (NN problem))) (. .))),
sw08utt/sw_0809_2040.utt,2/sw2040,2040,17,sd,A,5,4,"{F Um, } [ it was, + it was, ] {D you know, } very lovely  /","Um/UH ,/, it/PRP was/VBD ,/, it/PRP was/VBD ,/, you/PRP know/VBP ,/, very/RB lovely/JJ","(ROOT (NP (S (S (INTJ (UH Um)) (, ,) (NP (PRP it)) (VP (VBD was))) (, ,) (NP (PRP it)) (VP (VP (VBD was)) (PRN (, ,) (S (NP (PRP you)) (VP (VBP know))) (, ,)) (ADVP (RB very) (ADJP (JJ lovely)))))))",
sw08utt/sw_0809_2040.utt,2/sw2040,2040,18,sd,A,5,5,"[ {C and, } + {C and } ] the people seemed very friendly [ and, + and ] nice.  /","and/CC ,/, and/CC the/DT people/NNS seemed/VBD very/RB friendly/JJ and/CC ,/, and/CC nice/JJ ./.","(ROOT (S (CC and) (, ,) (S (CC and) (NP (DT the) (NNS people)) (VP (VBD seemed) (NP (NP (RB very) (JJ friendly)) (CC and) (, ,) (CC and) (NP (JJ nice))))) (. .)))",
sw08utt/sw_0809_2040.utt,2/sw2040,2040,19,sd,A,5,6,"I have, - /","I/PRP have/VBP ,/,","(ROOT (S (NP (PRP I)) (VP (VBP have)) (, ,)))",
sw08utt/sw_0809_2040.utt,2/sw2040,2040,20,sd,A,5,7,"{D actually, } I work with, {F uh, } a girl from Puerto Rico  /","actually/UH ,/, I/PRP work/VBP with/IN ,/, uh/UH ,/, a/DT girl/NN from/IN Puerto/NNP Rico/NNP","(ROOT (S (ADVP (UH actually)) (, ,) (NP (PRP I)) (VP (VBP work) (PP (IN with) (PRN (, ,) (INTJ (UH uh)) (, ,)) (NP (NP (DT a) (NN girl)) (PP (IN from) (NP (NNP Puerto) (NNP Rico))))))))",
sw08utt/sw_0809_2040.utt,2/sw2040,2040,21,sd,A,5,8,"{C and, } I guess I have never thought to ask her what she favors, {F um. } /","and/CC ,/, I/PRP guess/VBP I/PRP have/VBP never/RB thought/VBN to/TO ask/VB her/PRP$ what/WP she/PRP favors/VBZ ,/, um/UH ./.","(ROOT (S (CC and) (, ,) (NP (PRP I)) (VP (VBP guess) (SBAR (S (NP (PRP I)) (VP (VBP have) (ADVP (RB never)) (VP (VBN thought) (S (VP (TO to) (VP (VB ask) (NP (NP (PRP$ her)) (SBAR (WHNP (WP what)) (S (NP (PRP she)) (VP (VBZ favors))))) (, ,) (NP (UH um)))))))))) (. .)))",
sw08utt/sw_0809_2040.utt,2/sw2040,2040,22,qr,B,6,1,"Your concern on the economy was one in terms of, if it became a state would that put even more pressures [ on, + on ] Puerto Rico, or pressures on the U. S. in terms of aid /","Your/PRP$ concern/NN on/IN the/DT economy/NN was/VBD one/CD in/IN terms/NNS of/IN ,/, if/IN it/PRP became/VBD a/DT state/NN would/MD that/DT put/VB even/RB more/JJR pressures/NNS on/IN ,/, on/IN Puerto/NNP Rico/NNP ,/, or/CC pressures/NNS on/IN the/DT U/NNP ./. S/NNP ./. in/IN terms/NNS of/IN aid/NN","(ROOT (S (NP (NP (PRP$ Your) (NN concern)) (PP (IN on) (NP (DT the) (NN economy)))) (VP (VBD was) (NP (NP (CD one)) (PP (IN in) (NP (NP (NNS terms)) (PP (IN of))))) (, ,) (SBAR (IN if) (S (NP (PRP it)) (VP (VBD became) (NP (DT a) (NN state)) (SBAR (SINV (MD would) (NP (DT that)) (VP (VB put) (NP (ADJP (RB even) (JJR more)) (NNS pressures)) (PP (IN on)) (, ,) (PP (IN on) (NP (NP (NNP Puerto) (NNP Rico)) (, ,) (CC or) (NP (NP (NP (NNS pressures)) (PP (IN on) (NP (DT the) (NNP U))) (. .) (NP (NNP S)) (. .)) (PP (IN in) (NP (NP (NNS terms)) (PP (IN of) (NP (NN aid)))))))))))))))))",
sw08utt/sw_0809_2040.utt,2/sw2040,2040,23,%,B,6,2,"{C or, } -/","or/CC ,/,","(ROOT (FRAG (CC or) (ADVP (, ,))))",
sw08utt/sw_0809_2040.utt,2/sw2040,2040,24,sv,A,7,1,"{D Well } probably more [ on, +  in ] terms of the U. S.  {F Um, }  /","Well/UH probably/RB more/JJR on/IN ,/, in/IN terms/NNS of/IN the/DT U/NNP ./. S/NNP ./. Um/UH ,/,","(ROOT (FRAG (PP (NP (UH Well)) (PP (ADVP (RB probably)) (ADJP (ADJP (ADJP (JJR more)) (PRN (PP (IN on)) (, ,))) (PP (IN in) (FRAG (SBAR (WHNP (WHNP (NNS terms)) (PP (IN of) (NP (DT the) (NNP U) (. .) (NNP S)) (. .))) (FRAG (INTJ (UH Um))))))))) (, ,)))",
sw08utt/sw_0809_2040.utt,2/sw2040,2040,25,sd,A,7,2,"{D you know, } [ I'm, + I'm ] not quite sure how the U. S. copes with this sort of thing.  /","you/PRP know/VBP ,/, I/PRP 'm/VBP ,/, I/PRP 'm/VBP not/RB quite/RB sure/JJ how/WRB the/DT U/NNP ./. S/NNP ./. copes/VBZ with/IN this/DT sort/NN of/IN thing/NN ./.","(ROOT (S (S (NP (PRP you)) (VP (VBP know))) (, ,) (S (NP (PRP I)) (VP (VBP 'm))) (, ,) (S (NP (PRP I)) (VP (VBP 'm) (RB not) (ADJP (RB quite) (JJ sure)) (SBAR (WHADVP (WRB how)) (S (NP (DT the) (NP (NP (NNP U) (. .)) (NP (NNP S) (. .)))) (VP (VBZ copes) (PP (IN with) (NP (NP (DT this) (NN sort)) (PP (IN of) (NP (NN thing)))))))))) (. .)))",
sw08utt/sw_0809_2040.utt,2/sw2040,2040,26,sd,A,7,3,"I've live [ abro-, + abroad ] most of my life,  /","I/PRP 've/VBP live/VB abro-/RB ,/, abroad/RB most/RBS of/IN my/PRP$ life/NN ,/,","(ROOT (S (NP (PRP I)) (VP (VBP 've) (S (VP (VB live) (ADVP (RB abro-)) (, ,) (ADVP (RB abroad))) (NP (NP (RBS most)) (PP (IN of) (NP (PRP$ my) (NN life)))))) (, ,)))",
sw08utt/sw_0809_2040.utt,2/sw2040,2040,27,sd,A,7,4,"{C so, } I guess [ I, + I've ] been very cut off.  /","so/RB ,/, I/PRP guess/VBP I/PRP ,/, I/PRP 've/VBP been/VBN very/RB cut/VB off/RP ./.","(ROOT (S (ADVP (RB so)) (PRN (, ,) (S (NP (PRP I)) (VP (VBP guess) (NP (PRP I)))) (, ,)) (NP (PRP I)) (VP (VBP 've) (VP (VBN been) (ADVP (RB very) (S (VP (VB cut) (PRT (RP off))))))) (. .)))",
sw08utt/sw_0809_2040.utt,2/sw2040,2040,28,sd,A,7,5,"I lived actually in Lebanon,  /","I/PRP lived/VBD actually/UH in/IN Lebanon/NNP ,/,","(ROOT (S (NP (PRP I)) (VP (VBD lived) (INTJ (UH actually)) (PP (IN in) (NP (NNP Lebanon)))) (, ,)))",
sw08utt/sw_0809_2040.utt,2/sw2040,2040,29,sd,A,7,6,"{C so, } I was very cut off from [ the, + the ] press as I, {D you know, }  [ and be, + ] was becoming an adult. /","so/RB ,/, I/PRP was/VBD very/RB cut/VB off/RP from/IN the/DT ,/, the/DT press/NN as/IN I/PRP ,/, you/PRP know/VBP ,/, and/CC be/VB ,/, was/VBD becoming/VBG an/DT adult/NN ./.","(ROOT (S (ADVP (RB so)) (PRN (, ,) (S (NP (PRP I)) (VP (VBD was) (ADVP (RB very) (S (VP (VB cut) (PRT (RP off)) (PP (IN from) (NP (NP (DT the)) (, ,) (NP (NP (DT the) (NN press)) (PP (IN as) (NP (PRP I))))))))))) (, ,)) (NP (PRP you)) (VP (VP (VBP know)) (, ,) (CC and) (VP (VB be)) (, ,) (VP (VBD was) (VP (VBG becoming) (NP (DT an) (NN adult))))) (. .)))",
sw08utt/sw_0809_2040.utt,2/sw2040,2040,30,sd,A,7,7,"{C So, } I don't know how the U. S. would cope with, {F uh, } a new state that is so very, very poor. /","So/RB ,/, I/PRP do/VBP n't/RB know/VB how/WRB the/DT U/NNP ./. S/NNP ./. would/MD cope/VB with/IN ,/, uh/UH ,/, a/DT new/JJ state/NN that/WDT is/VBZ so/RB very/RB ,/, very/RB poor/JJ ./.","(ROOT (S (ADVP (RB So)) (, ,) (NP (PRP I)) (VP (VBP do) (RB n't) (VP (VB know) (SBAR (WHADVP (WRB how)) (S (NP (DT the) (NP (NP (NNP U) (. .)) (NP (NNP S) (. .)))) (VP (MD would) (VP (VB cope) (PP (IN with) (PRN (, ,) (INTJ (UH uh)) (, ,))) (NP (NP (DT a) (JJ new) (NN state)) (SBAR (WHNP (WDT that)) (S (VP (VBZ is) (ADVP (RB so)) (ADJP (RB very) (, ,) (RB very) (JJ poor)))))))))))) (. .)))",
sw08utt/sw_0809_2040.utt,2/sw2040,2040,31,b,B,8,1,Uh-huh. /,Uh-huh/UH ./.,(ROOT (INTJ (UH Uh-huh) (. .))),
sw08utt/sw_0809_2040.utt,2/sw2040,2040,32,sv,A,9,1,"{F Um, } I guess, {D you know, } we'd have a lot of aid, [ if, + if ] you consider the inner cities of {D like } New York [ and, + and ] how much aid it needs.  /","Um/UH ,/, I/PRP guess/VBP ,/, you/PRP know/VBP ,/, we/PRP 'd/MD have/VB a/DT lot/NN of/IN aid/NN ,/, if/IN ,/, if/IN you/PRP consider/VBP the/DT inner/JJ cities/NNS of/IN like/UH New/NNP York/NNP and/CC ,/, and/CC how/WRB much/JJ aid/NN it/PRP needs/VBZ ./.","(ROOT (S (S (INTJ (UH Um)) (, ,) (NP (PRP I)) (VP (VBP guess))) (, ,) (NP (PRP you)) (VP (VBP know) (PRN (, ,) (S (NP (PRP we)) (VP (MD 'd) (VP (VB have) (NP (NP (DT a) (NN lot)) (PP (IN of) (NP (NN aid)))) (, ,) (ADVP (IN if))))) (, ,)) (SBAR (IN if) (S (NP (PRP you)) (VP (VBP consider) (NP (NP (DT the) (JJ inner) (NNS cities)) (PP (IN of) (NP (UH like)))) (NP (NP (NNP New) (NNP York)) (CC and) (, ,) (CC and) (SBAR (WHNP (WRB how) (JJ much)) (S (VP (NN aid) (SBAR (S (NP (PRP it)) (VP (VBZ needs)))))))))))) (. .)))",
sw08utt/sw_0809_2040.utt,2/sw2040,2040,33,sv,A,9,2,"I suppose [ the whole country, + {E or } the whole, {F um, } new state ] would require such aid. /","I/PRP suppose/VBP the/DT whole/JJ country/NN ,/, or/CC the/DT whole/NN ,/, um/UH ,/, new/JJ state/NN would/MD require/VB such/JJ aid/NN ./.","(ROOT (S (S (NP (PRP I)) (VP (VBP suppose) (NP (DT the) (JJ whole) (NN country)))) (, ,) (CC or) (S (NP (NP (DT the) (NN whole)) (, ,) (FRAG (INTJ (UH um)) (, ,) (NP (JJ new) (NN state)))) (VP (MD would) (VP (VB require) (NP (JJ such) (NN aid))))) (. .)))",
sw08utt/sw_0809_2040.utt,2/sw2040,2040,34,qy^d,B,10,1,"I guess, {F um, } we're assuming [ that, + that ] Puerto Rico would be per capita significantly more poor perhaps [ than, + than ] {D say } Mississippi  /","I/PRP guess/VBP ,/, um/UH ,/, we/PRP 're/VBP assuming/VBG that/IN ,/, that/IN Puerto/NNP Rico/NNP would/MD be/VB per/IN capita/NNS significantly/RB more/RBR poor/JJ perhaps/RB than/IN ,/, than/IN say/UH Mississippi/NNP","(ROOT (S (NP (PRP I)) (VP (VBP guess) (, ,) (S (INTJ (UH um)) (, ,) (NP (PRP we)) (VP (VBP 're) (VP (VBG assuming) (ADVP (IN that)) (, ,) (SBAR (IN that) (S (NP (NNP Puerto) (NNP Rico)) (VP (MD would) (VP (VB be) (PP (IN per) (NP (NP (NNS capita)) (ADJP (ADJP (RB significantly) (RBR more) (JJ poor)) (PRN (ADVP (RB perhaps)) (ADVP (IN than)))) (, ,) (PP (IN than) (NP (INTJ (UH say)))) (NP (NNP Mississippi))))))))))))))",
sw08utt/sw_0809_2040.utt,2/sw2040,2040,35,%,B,10,2,"{C or, } -/","or/CC ,/,","(ROOT (FRAG (CC or) (ADVP (, ,))))",
sw08utt/sw_0809_2040.utt,2/sw2040,2040,36,na,A,11,1,I think so. /,I/PRP think/VBP so/RB ./.,(ROOT (S (NP (PRP I)) (VP (VBP think) (ADVP (RB so))) (. .))),
sw08utt/sw_0809_2040.utt,2/sw2040,2040,37,bk,B,12,1,"Okay,  /","Okay/UH ,/,","(ROOT (FRAG (PP (UH Okay)) (, ,)))",
sw08utt/sw_0809_2040.utt,2/sw2040,2040,38,sd,B,12,2,"that's something [ that, + that ] I guess I have not much of an image of other [ than, + than ] Puerto Rico as a tropical island and consequently large numbers of barefoot natives or something not in a  (( perjuritive )) sense but in a, in a carefree sense,  I guess.  /","that/DT 's/BES something/NN that/WDT ,/, that/WDT I/PRP guess/VBP I/PRP have/VBP not/RB much/JJ of/IN an/DT image/NN of/IN other/JJ than/IN ,/, than/IN Puerto/NNP Rico/NNP as/IN a/DT tropical/JJ island/NN and/CC consequently/RB large/JJ numbers/NNS of/IN barefoot/JJ natives/NNS or/CC something/NN not/RB in/IN a/DT perjuritive/JJ sense/NN but/CC in/IN  a/DT ,/, in/IN a/DT carefree/JJ sense/NN ,/, I/PRP guess/VBP ./.","(ROOT (S (NP (DT that)) (VP (BES 's) (NP (NP (NN something)) (SBAR (WHNP (WDT that)) (, ,) (S (SBAR (WHNP (WDT that)) (S (NP (PRP I)) (VP (VBP guess) (SBAR (S (NP (PRP I)) (VP (VBP have) (NP (NP (RB not) (JJ much)) (PP (IN of) (NP (NP (DT an) (NN image)) (PP (IN of) (NP (UCP (ADJP (JJ other) (PP (IN than)) (, ,) (PP (IN than) (NP (NP (NNP Puerto) (NNP Rico)) (PP (IN as) (NP (DT a) (JJ tropical) (NN island)))))) (CC and) (ADVP (RB consequently))) (JJ large) (NNS numbers))))) (PP (IN of) (NP (JJ barefoot) (NNS natives) (CC or) (NN something)))) (PP (RB not) (PP (IN in) (NP (DT a) (JJ perjuritive) (NN sense))) (CC but) (PP (IN in) (NP (DT a))) (, ,) (PP (IN in) (NP (DT a) (JJ carefree) (NN sense)))))))))) (, ,) (NP (PRP I)) (VP (VBP guess)))))) (. .)))",
sw08utt/sw_0809_2040.utt,2/sw2040,2040,39,sv,B,12,3,"Although I'm aware of the political problems and unrest, [ and, +  and ] also difficulties they have.  {F Um, } I don't know whether [ state woul-, + statehood would ] improve their economy.  /","Although/IN I/PRP 'm/VBP aware/JJ of/IN the/DT political/JJ problems/NNS and/CC unrest/NN ,/, and/CC ,/, and/CC also/RB difficulties/NNS they/PRP have/VBP ./. Um/UH ,/, I/PRP do/VBP n't/RB know/VB whether/IN state/NN woul/MD ,/, statehood/NN would/MD improve/VB their/PRP$ economy/NN ./.","(ROOT (S (SBAR (IN Although) (S (NP (PRP I)) (VP (VBP 'm) (ADJP (JJ aware) (PP (IN of) (NP (NP (NP (DT the) (JJ political) (NNS problems)) (CC and) (NP (NN unrest))) (, ,) (CC and) (, ,) (CC and) (NP (NP (NP (RB also) (NNS difficulties)) (SBAR (S (NP (PRP they)) (VP (VBP have)) (. .)))) (SBAR (SBAR (S (INTJ (UH Um)) (, ,) (NP (PRP I)) (VP (VBP do) (RB n't) (VP (VB know))))) (SBAR (IN whether) (S (NP (NN state)) (VP (MD woul)))))))))))) (, ,) (NP (NN statehood)) (VP (MD would) (VP (VB improve) (NP (PRP$ their) (NN economy)))) (. .)))",
sw08utt/sw_0809_2040.utt,2/sw2040,2040,40,sd,B,12,4,"[ I don't, +  I don't ] know that [ the ve-, + the act ] of being a state would have any impact [ on, + on ] them. /","I/PRP do/VBP n't/RB ,/, I/PRP do/VBP n't/RB know/VB that/IN the/DT ve-/XX ,/, the/DT act/NN of/IN being/VBG a/DT state/NN would/MD have/VB any/DT impact/NN on/IN ,/, on/IN them/PRP ./.","(ROOT (S (S (NP (PRP I)) (VP (VBP do) (RB n't))) (, ,) (NP (PRP I)) (VP (VBP do) (RB n't) (VP (VB know) (SBAR (IN that) (S (NP (NP (DT the) (XX ve-)) (, ,) (NP (NP (DT the) (NN act)) (PP (IN of) (S (VP (VBG being) (NP (DT a) (NN state))))))) (VP (MD would) (VP (VB have) (NP (DT any) (NN impact)) (PP (IN on)) (, ,) (PP (IN on) (NP (PRP them))))))))) (. .)))",
sw08utt/sw_0809_2040.utt,2/sw2040,2040,41,sv,B,12,5,"{F Uh, } I guess they would have the ability to do some taxing that they don't have now.  /","Uh/UH ,/, I/PRP guess/VBP they/PRP would/MD have/VB the/DT ability/NN to/TO do/VB some/DT taxing/NN that/IN they/PRP do/VBP n't/RB have/VB now/RB ./.","(ROOT (S (INTJ (UH Uh)) (, ,) (NP (PRP I)) (VP (VBP guess) (SBAR (S (NP (PRP they)) (VP (MD would) (VP (VB have) (NP (DT the) (NN ability) (S (VP (TO to) (VP (VB do) (NP (DT some) (NN taxing)) (SBAR (IN that) (S (NP (PRP they)) (VP (VBP do) (RB n't) (VP (VB have) (NP (RB now))))))))))))))) (. .)))",
sw08utt/sw_0809_2040.utt,2/sw2040,2040,42,sd,B,12,6,"{C But } of course if their economy is weak [ the-, + there ] is not much of a base on which to tax.  /","But/CC of/IN course/NN if/IN their/PRP$ economy/NN is/VBZ weak/JJ the-/EX ,/, there/EX is/VBZ not/RB much/JJ of/IN a/DT base/NN on/IN which/WDT to/TO tax/VB ./.","(ROOT (S (CC But) (PP (IN of) (NP (NP (NN course)) (SBAR (IN if) (S (NP (PRP$ their) (NN economy)) (VP (VBZ is) (NP (JJ weak) (EX the-))))))) (, ,) (NP (EX there)) (VP (VBZ is) (RB not) (ADJP (JJ much) (PP (IN of) (NP (NP (DT a) (NN base)) (PP (IN on) (SBAR (WHNP (WDT which)) (S (VP (TO to) (VP (VB tax)))))))))) (. .)))",
