swda_filename,ptb_basename,conversation_no,transcript_index,act_tag,caller,turn_index,subutterance_index,text,pos,trees
K/KB/KBK.xml,KBKRE016,002206,0,,A,1,1,Quite amazing how the Queen Mother  --,,
K/KB/KBK.xml,KBKRE016,002206,1,,A,1,2,--keeps on doing her so many public engagements.,,
K/KB/KBK.xml,KBKRE016,002206,2,,B,2,1,"Yes, she ninety now?",,
K/KB/KBK.xml,KBKRE016,002206,3,,A,3,1,"Ooh over, yes, mm, ninety last year, had a special parade didn't they?",,
K/KB/KBK.xml,KBKRE016,002206,4,,B,4,1,(()) must be advantage of getting ready and being prepared for her and,,
K/KB/KBK.xml,KBKRE016,002206,5,,A,5,1,Mm.,,
K/KB/KBK.xml,KBKRE016,002206,6,,A,5,2,"Yes, she's waited on,(()) ",,
K/KB/KBK.xml,KBKRE016,002206,7,,B,6,1,Taxi-ing from door to door or you know ,,
K/KB/KBK.xml,KBKRE016,002206,8,,A,7,1,Mm ,,
K/KB/KBK.xml,KBKRE016,002206,9,,B,8,1,your plans made up and your meals laid on.,,
