swda_filename,ptb_basename,conversation_no,transcript_index,act_tag,caller,turn_index,subutterance_index,text,pos,trees
K/KB/KBK.xml,KBKRE030,002331,0,,A,1,1,"Thank you, now er.",,
K/KB/KBK.xml,KBKRE030,002331,1,,B,2,1,"You're a  (()) girl aren't you,(()) ",,
K/KB/KBK.xml,KBKRE030,002331,2,,A,3,1,No I've got nothing else to be doing at this moment.,,
K/KB/KBK.xml,KBKRE030,002331,3,,B,4,1,Been up the library.,,
K/KB/KBK.xml,KBKRE030,002331,4,,A,5,1,Good.,,
K/KB/KBK.xml,KBKRE030,002331,5,,B,6,1,More books for the half term.,,
K/KB/KBK.xml,KBKRE030,002331,6,,A,7,1,Good.,,
K/KB/KBK.xml,KBKRE030,002331,7,,B,8,1,"Just six weeks till the end of term because I've got my books for six weeks and they've used, date stamped in them is the last day of term can't be bad can it?",,
K/KB/KBK.xml,KBKRE030,002331,8,,A,9,1,"No it can't, it'll be nice to see the back of them,(()) .",,
K/KB/KBK.xml,KBKRE030,002331,9,,B,10,1,"I think of the vast amount of work I've got planned for six weeks, makes me wish it was about ten.",,
K/KB/KBK.xml,KBKRE030,002331,10,,A,11,1,I'm glad it's not.,,
K/KB/KBK.xml,KBKRE030,002331,11,,B,12,1,<laugh> ,,
K/KB/KBK.xml,KBKRE030,002331,12,,A,13,1,You'll be working twenty four hours a day for those six weeks as it is.,,
K/KB/KBK.xml,KBKRE030,002331,13,,B,14,1,(()) .,,
K/KB/KBK.xml,KBKRE030,002331,14,,B,14,2,Have a lavish party  (()) instead of a ,,
K/KB/KBK.xml,KBKRE030,002331,15,,A,15,1,July twenty seventh.,,
K/KB/KBK.xml,KBKRE030,002331,16,,B,16,1,June.,,
K/KB/KBK.xml,KBKRE030,002331,17,,A,17,1,What are you going to celebrate then?,,
K/KB/KBK.xml,KBKRE030,002331,18,,B,18,1,That all my reports will be done.,,
K/KB/KBK.xml,KBKRE030,002331,19,,A,19,1,<laugh> ,,
K/KB/KBK.xml,KBKRE030,002331,20,,B,20,1,Then that's all I've got to do is my records then.,,
K/KB/KBK.xml,KBKRE030,002331,21,,A,21,1,Who you going to invite to the lunch party?,,
K/KB/KBK.xml,KBKRE030,002331,22,,B,22,1,(()) ,,
K/KB/KBK.xml,KBKRE030,002331,23,,A,23,1,Anybody else completed their reports?,,
K/KB/KBK.xml,KBKRE030,002331,24,,B,24,1,What on all the staff you mean?,,
K/KB/KBK.xml,KBKRE030,002331,25,,A,25,1,"Did I tell you, I mentioned to er Ray about Phil  <<REDACTED (name)>> and he remembered him.",,
K/KB/KBK.xml,KBKRE030,002331,26,,B,26,1,Yes I think you did.,,
K/KB/KBK.xml,KBKRE030,002331,27,,A,27,1,"Some conference in Eastbourne, or whatever.",,
K/KB/KBK.xml,KBKRE030,002331,28,,B,28,1,"You ought to remember him from Becksley, surely (()) ",,
K/KB/KBK.xml,KBKRE030,002331,29,,A,29,1,"Well they didn't teach in the same place, so why should they?",,
K/KB/KBK.xml,KBKRE030,002331,30,,B,30,1,True.,,
K/KB/KBK.xml,KBKRE030,002331,31,,A,31,1,"Erm, I mean, they, they met occasionally, but er, no particular reason to remember.",,
K/KB/KBK.xml,KBKRE030,002331,32,,A,31,2,"I had quite a good chat with Ray the other day, yes, eh.",,
K/KB/KBK.xml,KBKRE030,002331,33,,B,32,1,"Paul looks better, I seen him rushing down the road at great speed to catch the train, not looking as white as he was a few months ago.",,
K/KB/KBK.xml,KBKRE030,002331,34,,A,33,1,Really?,,
K/KB/KBK.xml,KBKRE030,002331,35,,B,34,1,In fact he's getting over his illness.<clock ticking> ,,
K/KB/KBK.xml,KBKRE030,002331,36,,A,35,1,Do you think it was genuine?,,
K/KB/KBK.xml,KBKRE030,002331,37,,B,36,1,What do you mean by that?,,
K/KB/KBK.xml,KBKRE030,002331,38,,B,36,2,"Did I, do I think (()) ?",,
K/KB/KBK.xml,KBKRE030,002331,39,,A,37,1,Yes.,,
K/KB/KBK.xml,KBKRE030,002331,40,,B,38,1,Oh why should he do that?,,
K/KB/KBK.xml,KBKRE030,002331,41,,A,39,1,"Well,(()) .",,
K/KB/KBK.xml,KBKRE030,002331,42,,A,39,2,"I mean it's one of those things, that eh",,
K/KB/KBK.xml,KBKRE030,002331,43,,B,40,1,"Why on earth should he want to (()) , they're only going to sell for his own work if he doesn't.",,
K/KB/KBK.xml,KBKRE030,002331,44,,A,41,1,Yes.,,
K/KB/KBK.xml,KBKRE030,002331,45,,A,41,2,It really is a bit odd the way those two bits of the wood do not connect.,,
K/KB/KBK.xml,KBKRE030,002331,46,,B,42,1,"Do, have you  (()) somewhere.",,
K/KB/KBK.xml,KBKRE030,002331,47,,A,43,1,"Well, the green chain walk went up in through, into the houses.",,
K/KB/KBK.xml,KBKRE030,002331,48,,B,44,1,(()) ,,
K/KB/KBK.xml,KBKRE030,002331,49,,A,45,1,"So eh, I doubt that it does.",,
K/KB/KBK.xml,KBKRE030,002331,50,,B,46,1,(()) .,,
K/KB/KBK.xml,KBKRE030,002331,51,,B,46,2,Have to look on a map.,,
K/KB/KBK.xml,KBKRE030,002331,52,,B,46,3,Thick dog you are Digger.,,
