swda_filename,ptb_basename,conversation_no,transcript_index,act_tag,caller,turn_index,subutterance_index,text,pos,trees
K/KC/KCP.xml,KCPRE000,004601,0,,A,1,1,Press that down to make it sto- stay.,,
K/KC/KCP.xml,KCPRE000,004601,1,,A,1,2,"Right, do you want your story then?",,
K/KC/KCP.xml,KCPRE000,004601,2,,A,1,3,Yes?,,
K/KC/KCP.xml,KCPRE000,004601,3,,A,1,4,Hmm?,,
K/KC/KCP.xml,KCPRE000,004601,4,,A,1,5,"Hmm The Spider Affair, alright?",,
K/KC/KCP.xml,KCPRE000,004601,5,,A,1,6,<cough> Knock it off.,,
K/KC/KCP.xml,KCPRE000,004601,6,,A,1,7,<laugh> <reading> The first lesson that aft- </reading> leave it alone and just forget about it hmm?,,
K/KC/KCP.xml,KCPRE000,004601,7,,A,1,8,<reading> The first lesson that afternoon was mental arithmetic.,,
K/KC/KCP.xml,KCPRE000,004601,8,,A,1,9,"The girls groaned over this, except the quick ones like Irene who delighted in it, but it meant that there was no need for anyone to open the desk because it was all oral work.",,
K/KC/KCP.xml,KCPRE000,004601,9,,A,1,10,Miss Potts was lenient with the girls for it was a very hot afternoon.,,
K/KC/KCP.xml,KCPRE000,004601,10,,A,1,11,Daryl was glad that Miss Potts was not as exacting as usual for arithmetic was not her strong point especially mental arithmetic.,,
K/KC/KCP.xml,KCPRE000,004601,11,,A,1,12,The next lesson to be taken my mam- was to be taken by Mademoiselle Dupont.,,
K/KC/KCP.xml,KCPRE000,004601,12,,A,1,13,It was to be a French conversation lesson in which the girls would endeavour to answer all Mademoiselle's simple questions in French.,,
K/KC/KCP.xml,KCPRE000,004601,13,,A,1,14,"Miss Potts left and Mademoiselle arrived, not quite so beaming as usual because of the heat.",,
K/KC/KCP.xml,KCPRE000,004601,14,,A,1,15,She was too  (()) to enjoy the hot weather and little beads of perspiration shone on her forehead as she sat down at the big desk opposite the row of girls.,,
K/KC/KCP.xml,KCPRE000,004601,15,,A,1,16,"Sit down, she said and the girls sat down thankfully feeling that the only lesson they really enjoy that weather would be swimming lesson.",,
K/KC/KCP.xml,KCPRE000,004601,16,,A,1,17,"The lesson proceeded slowly and hauntingly, the flow of French conversation was not at all brisk on the girls' part and the constant pauses began to irritate Mademoiselle.",,
K/KC/KCP.xml,KCPRE000,004601,17,,A,1,18,Ah!,,
K/KC/KCP.xml,KCPRE000,004601,18,,A,1,19,She cried at last.,,
K/KC/KCP.xml,KCPRE000,004601,19,,A,1,20,It's too hot to make conversation with such stupid ones as you are this afternoon.,,
K/KC/KCP.xml,KCPRE000,004601,20,,A,1,21,Get out your grammar books and I will explain a few things to you that will help your conversation if you can get them into your so stupid heads.,,
K/KC/KCP.xml,KCPRE000,004601,21,,A,1,22,<cough> The girls opened their desks to get out their grammar books.,,
K/KC/KCP.xml,KCPRE000,004601,22,,A,1,23,Gwendoline watched eagerly to see what would happen when Mary-Lou opened hers but nothing did happen.,,
K/KC/KCP.xml,KCPRE000,004601,23,,A,1,24,"Mary-Lou had neither seen the spider nor disturbed it, she shut her desk.",,
K/KC/KCP.xml,KCPRE000,004601,24,,A,1,25,All the girls opened their grammar books at the page Mademoiselle commanded then Mary-Lou found she had her English grammar instead of her French one so she reopened her desk to get the right book.,,
K/KC/KCP.xml,KCPRE000,004601,25,,A,1,26,What are you doing Mary-Lou?,,
K/KC/KCP.xml,KCPRE000,004601,26,,A,1,27,Demanded Mademoiselle who hated desks being opened and shut too often.,,
K/KC/KCP.xml,KCPRE000,004601,27,,A,1,28,What are you doing?mm </reading> ?,,
K/KC/KCP.xml,KCPRE000,004601,28,,B,2,1,I got the wrong book out <laugh>,,
K/KC/KCP.xml,KCPRE000,004601,29,,A,3,1,Probably.,,
K/KC/KCP.xml,KCPRE000,004601,30,,A,3,2,<reading> Mary-Lou stuffed her English grammar into the back of her desk and pulled out a French one.,,
K/KC/KCP.xml,KCPRE000,004601,31,,A,3,3,The spider feeling itself dislodged by the book ran out in a fright.,,
K/KC/KCP.xml,KCPRE000,004601,32,,A,3,4,"It ran almost up to Mary-Lou before she saw it, she let the desk lid with a terrific bang and gave a heart rendering scream.",,
K/KC/KCP.xml,KCPRE000,004601,33,,A,3,5,"Everyone jumped in alarm, Mademoiselle leapt to her feet sending a pile of books clattering from her desk to the floor she glared at Mary-Lou",,
K/KC/KCP.xml,KCPRE000,004601,34,,B,4,1,,,
K/KC/KCP.xml,KCPRE000,004601,35,,B,4,2,<moan> ,,
K/KC/KCP.xml,KCPRE000,004601,36,,B,4,3,,,
K/KC/KCP.xml,KCPRE000,004601,37,,A,5,1,"(()) what is this noise, Mary-Lou have you gone mad?",,
K/KC/KCP.xml,KCPRE000,004601,38,,A,5,2,"Mary-Lou couldn't speak, the sight of the enormous spider apparently running straight at her had completely undone her.",,
K/KC/KCP.xml,KCPRE000,004601,39,,A,5,3,She scraped her chair away from her desk and stared at it as if she expected the spider to jump through the lid.,,
K/KC/KCP.xml,KCPRE000,004601,40,,A,5,4,Mary-Lou!,,
K/KC/KCP.xml,KCPRE000,004601,41,,A,5,5,"Thundered Mademoiselle, tell me what is the matter with you, I demand it?",,
K/KC/KCP.xml,KCPRE000,004601,42,,A,5,6,"Oh, Mademoiselle there's a, there's a simply enormous giant spider in my desk   leave it alone, you'll just knock it off  <reading> stammered Mary-Lou quite pale.",,
K/KC/KCP.xml,KCPRE000,004601,43,,A,5,7,A spider!,,
K/KC/KCP.xml,KCPRE000,004601,44,,A,5,8,"Said Mademoiselle, and you make this fuss and call out so loudly that we all jump in fear.",,
K/KC/KCP.xml,KCPRE000,004601,45,,A,5,9,Mary-Lou be ashamed of yourself.,,
K/KC/KCP.xml,KCPRE000,004601,46,,A,5,10,"I am angry with you, sit down.",,
K/KC/KCP.xml,KCPRE000,004601,47,,A,5,11,"Oh, I, I daren't,M- said Mary-Lou trembling, he might come out Mademoiselle, it's enormous.",,
K/KC/KCP.xml,KCPRE000,004601,48,,A,5,12,Mademoiselle wasn't quite sure whether she really believed in this spider or not.,,
K/KC/KCP.xml,KCPRE000,004601,49,,A,5,13,What with Elissia's deafness last week and one thing and another.,,
K/KC/KCP.xml,KCPRE000,004601,50,,A,5,14,"Irene giggled, Mademoiselle fixed her with a glare.",,
K/KC/KCP.xml,KCPRE000,004601,51,,A,5,15,We will see whether this spider exists or not  she said firmly and I warn you Mary-Lou if this is a again a trick and there is no spider you will go to Miss Potts for punishment I wash my hands of you.,,
K/KC/KCP.xml,KCPRE000,004601,52,,A,5,16,She advanced to the desk she threw open the lid dramatically Mary-Lou drew in her breath and got away as far as she could looking at the inside of her desk with scared eyes    </reading> <cough>,,
K/KC/KCP.xml,KCPRE000,004601,53,,B,6,1,,,
K/KC/KCP.xml,KCPRE000,004601,54,,B,6,2,<scream> ,,
K/KC/KCP.xml,KCPRE000,004601,55,,B,6,3,,,
K/KC/KCP.xml,KCPRE000,004601,56,,A,7,1,Honey you've moved it too far away haven't you?,,
K/KC/KCP.xml,KCPRE000,004601,57,,A,7,2,<sigh> I can see this is going to be a problem  <sigh> hmm?,,
K/KC/KCP.xml,KCPRE000,004601,58,,A,7,3,I can't remember where I've got to now.,,
K/KC/KCP.xml,KCPRE000,004601,59,,A,7,4,<reading> There is no spider to be seen it had of course retreated to the darkest corner it could find again.,,
K/KC/KCP.xml,KCPRE000,004601,60,,A,7,5,Mademoiselle swept the desk with a searching glance and then turned on poor Mary-Lou.,,
K/KC/KCP.xml,KCPRE000,004601,61,,A,7,6,Bad girl!,,
K/KC/KCP.xml,KCPRE000,004601,62,,A,7,7,She said and stamped her foot.,,
K/KC/KCP.xml,KCPRE000,004601,63,,A,7,8,"You so quiet and good, you too deceive me.",,
K/KC/KCP.xml,KCPRE000,004601,64,,A,7,9,The poor Mademoiselle I will not have it.,,
K/KC/KCP.xml,KCPRE000,004601,65,,A,7,10,"Mademoiselle do believe me, begged Mary-Lou in despair, for she could not bear to be scolded like that.",,
K/KC/KCP.xml,KCPRE000,004601,66,,A,7,11,It was there an enormous one.,,
K/KC/KCP.xml,KCPRE000,004601,67,,A,7,12,Mademoiselle rummaged violently among the books in the desk.,,
K/KC/KCP.xml,KCPRE000,004601,68,,A,7,13,"No spider not one, she said.",,
K/KC/KCP.xml,KCPRE000,004601,69,,A,7,14,"Tell me where has it gone, if it is still in there?",,
K/KC/KCP.xml,KCPRE000,004601,70,,A,7,15,"The spider was alarmed by the violent rummaging, it suddenly hurried out from its hiding place and ran onto Mademoiselle's hand and up her arm.",,
K/KC/KCP.xml,KCPRE000,004601,71,,A,7,16,"Mademoiselle stared at the enormous thing as if she really could not believe her eyes, she gave a shriek even louder than Mary-Lou had given.",,
K/KC/KCP.xml,KCPRE000,004601,72,,A,7,17,She was too scared she wa- too was scared of spiders and there was a giant specimen running over her person.,,
K/KC/KCP.xml,KCPRE000,004601,73,,A,7,18,Irene exploded.,,
K/KC/KCP.xml,KCPRE000,004601,74,,A,7,19,That was a signal for the class to enter into the fun and one and all scrambled over to Mademoiselle.,,
K/KC/KCP.xml,KCPRE000,004601,75,,A,7,20,"Ah, where is it the monster?",,
K/KC/KCP.xml,KCPRE000,004601,76,,A,7,21,"Girls, girls can you see it?",,
K/KC/KCP.xml,KCPRE000,004601,77,,A,7,22,Wailed Mademoiselle.,,
K/KC/KCP.xml,KCPRE000,004601,78,,A,7,23,"It's here, said wicked Elissia, with her light finger down Mademoiselle's spine  She gave a scream thinking that it was the spider running there.",,
K/KC/KCP.xml,KCPRE000,004601,79,,A,7,24,"Take it off I beg you Elissia, remove it from me.",,
K/KC/KCP.xml,KCPRE000,004601,80,,A,7,25,"I think it must have gone down your neck Mademoiselle, said Betty, which nearly made Mademoiselle have a fit.",,
K/KC/KCP.xml,KCPRE000,004601,81,,A,7,26,She immediately felt sure that it was all over her and began to shiver and tremble.,,
K/KC/KCP.xml,KCPRE000,004601,82,,A,7,27,Elissia tickled the back of her neck and she leapt in the air.,,
K/KC/KCP.xml,KCPRE000,004601,83,,A,7,28,"Oh, la la, la la, what a miserable woman I am!",,
K/KC/KCP.xml,KCPRE000,004601,84,,A,7,29,"Where is this monster girls, girls tell me where it is gone?",,
K/KC/KCP.xml,KCPRE000,004601,85,,A,7,30,"There was now a complete uproar in the first form room, Miss Potts again in the second form  room was amazingly exasperated.",,
K/KC/KCP.xml,KCPRE000,004601,86,,A,7,31,"What could her form be doing now, had Mademoiselle left them alone, had they all gone mad?",,
K/KC/KCP.xml,KCPRE000,004601,87,,A,7,32,Go on with your maps for a minute she said to the second form who were glancing at one another in astonishment as they heard the noise from the first form room.,,
K/KC/KCP.xml,KCPRE000,004601,88,,A,7,33,She left the room and went rapidly to the door of the first form.,,
K/KC/KCP.xml,KCPRE000,004601,89,,A,7,34,"She opened it, the noise hit her like something solid, worse than breaks she thought grimly.",,
K/KC/KCP.xml,KCPRE000,004601,90,,A,7,35,"First she could not see any mistress there at all and thought the girls were alone and then she caught sight of Mademoiselle's head in the middle of a crowd of girls, what was happening?",,
K/KC/KCP.xml,KCPRE000,004601,91,,A,7,36,Girls!,,
K/KC/KCP.xml,KCPRE000,004601,92,,A,7,37,She said.,,
K/KC/KCP.xml,KCPRE000,004601,93,,A,7,38,But her voice went unheard.,,
K/KC/KCP.xml,KCPRE000,004601,94,,A,7,39,Girls!,,
K/KC/KCP.xml,KCPRE000,004601,95,,A,7,40,Irene suddenly saw her and started to nudge everyone.,,
K/KC/KCP.xml,KCPRE000,004601,96,,A,7,41,"Look out, here's Potty she hissed.",,
K/KC/KCP.xml,KCPRE000,004601,97,,A,7,42,The girls flowed back,,
K/KC/KCP.xml,KCPRE000,004601,98,,B,8,1,Potty,,
K/KC/KCP.xml,KCPRE000,004601,99,,A,9,1,from Mademoiselle as if they were water.,,
K/KC/KCP.xml,KCPRE000,004601,100,,B,10,1,Ah ha.,,
K/KC/KCP.xml,KCPRE000,004601,101,,A,11,1,In a trice everyone was by her desk.,,
K/KC/KCP.xml,KCPRE000,004601,102,,A,11,2,Mademoiselle stood alone trembling wondering what was happening.,,
K/KC/KCP.xml,KCPRE000,004601,103,,A,11,3,Where had the monster of a spider gone?,,
K/KC/KCP.xml,KCPRE000,004601,104,,A,11,4,"Mademoiselle, really, said Miss Potts, almost forgetting the rule the staff had of never finding fault with one another before the girls.",,
K/KC/KCP.xml,KCPRE000,004601,105,,A,11,5,I simply cannot think what has happened to this class you've ta- when you've (()) .,,
K/KC/KCP.xml,KCPRE000,004601,106,,A,11,6,Mademoiselle blinked at Miss Potts.,,
K/KC/KCP.xml,KCPRE000,004601,107,,A,11,7,It was a spider!,,
K/KC/KCP.xml,KCPRE000,004601,108,,A,11,8,"She explained, looking up and down herself.",,
K/KC/KCP.xml,KCPRE000,004601,109,,A,11,9,"Ah, Miss Potts, but a monster of a spider, it ran up my arm and disappeared.",,
K/KC/KCP.xml,KCPRE000,004601,110,,A,11,10,Ah!,,
K/KC/KCP.xml,KCPRE000,004601,111,,A,11,11,Seem to feel it everywhere.,,
K/KC/KCP.xml,KCPRE000,004601,112,,A,11,12,"A spider won't hurt you, said Miss Potts coldly and unfeelingly.",,
K/KC/KCP.xml,KCPRE000,004601,113,,A,11,13,Would you like to go and recover yourself Mademoiselle,,
K/KC/KCP.xml,KCPRE000,004601,114,,B,12,1,,,
K/KC/KCP.xml,KCPRE000,004601,115,,B,12,2,<cough> ,,
K/KC/KCP.xml,KCPRE000,004601,116,,B,12,3,,,
K/KC/KCP.xml,KCPRE000,004601,117,,A,13,1,and let me deal with the first form?,,
K/KC/KCP.xml,KCPRE000,004601,118,,A,13,2,"<cough> Ah no, said Mademoiselle indignantly, the class it is good, the girls they came to help me to get this monster of a spider .",,
K/KC/KCP.xml,KCPRE000,004601,119,,B,14,1,Who's she?,,
K/KC/KCP.xml,KCPRE000,004601,120,,A,15,1,"Gwendoline, I think, look it's on her  leg.",,
K/KC/KCP.xml,KCPRE000,004601,121,,B,16,1,Hmm  yes.,,
K/KC/KCP.xml,KCPRE000,004601,122,,A,17,1,<reading> So big it was Miss Potts.,,
K/KC/KCP.xml,KCPRE000,004601,123,,A,17,2,"Miss Potts looked so disbelieving, Mademoiselle exaggerated the size of the spider and held out her hands to show Miss Potts it was at least as big as a fair sized frog.",,
K/KC/KCP.xml,KCPRE000,004601,124,,A,17,3,The girls had enjoyed everything immensely.,,
K/KC/KCP.xml,KCPRE000,004601,125,,A,17,4,What a French lesson!,,
K/KC/KCP.xml,KCPRE000,004601,126,,A,17,5,"Gwendoline had enjoyed it too, especially as she was the cause of it, though nobody knew that of course.",,
K/KC/KCP.xml,KCPRE000,004601,127,,A,17,6,She sat demurely in her desk watching the two mistresses closely.,,
K/KC/KCP.xml,KCPRE000,004601,128,,A,17,7,"And then suddenly she felt something running up her leg she looked down it was the spider, it had left Mademoiselle a long time ago and had secreted itself under a desk afraid of all the trampling feet around.",,
K/KC/KCP.xml,KCPRE000,004601,129,,A,17,8,"Now, when peace seemed restored the spider wanted to seek a better hiding place.",,
K/KC/KCP.xml,KCPRE000,004601,130,,A,17,9,"It ran over Gwendoline's shoe, up her stocking and above her knee.",,
K/KC/KCP.xml,KCPRE000,004601,131,,B,18,1,,,
K/KC/KCP.xml,KCPRE000,004601,132,,B,18,2,<moan> ,,
K/KC/KCP.xml,KCPRE000,004601,133,,B,18,3,,,
K/KC/KCP.xml,KCPRE000,004601,134,,A,19,1,She gave a piercing scream <laugh>,,
K/KC/KCP.xml,KCPRE000,004601,135,,B,20,1,<sigh> ,,
K/KC/KCP.xml,KCPRE000,004601,136,,A,21,1,everyone jumped again.,,
K/KC/KCP.xml,KCPRE000,004601,137,,A,21,2,Miss Potts turned fiercely.,,
K/KC/KCP.xml,KCPRE000,004601,138,,A,21,3,"Gwendoline go out of the room, how dare you squeal like that.",,
K/KC/KCP.xml,KCPRE000,004601,139,,A,21,4,"No, don't tell me you've seen the spider, I'm tired of the spider, I'm ashamed of you all.",,
K/KC/KCP.xml,KCPRE000,004601,140,,A,21,5,Gwendoline shook herself violently not daring to scream again but,,
K/KC/KCP.xml,KCPRE000,004601,141,,B,22,1,,,
K/KC/KCP.xml,KCPRE000,004601,142,,B,22,2,(()) ,,
K/KC/KCP.xml,KCPRE000,004601,143,,B,22,3,,,
K/KC/KCP.xml,KCPRE000,004601,144,,A,23,1,filled with the utmost horror at the thought of the spider creeping over her.,,
K/KC/KCP.xml,KCPRE000,004601,145,,A,23,2,"It was the spider, she began, it  Gwendoline what did I tell you, I will not hear another word of the wretched spider, said Miss Potts raising her voice angrily.",,
K/KC/KCP.xml,KCPRE000,004601,146,,A,23,3,Go out of the room!,,
K/KC/KCP.xml,KCPRE000,004601,147,,A,23,4,The whole class can go to bed one hour earlier tonight as punishment for this shameful behaviour.,,
K/KC/KCP.xml,KCPRE000,004601,148,,A,23,5,And you Gwendoline can go two hours earlier.,,
K/KC/KCP.xml,KCPRE000,004601,149,,A,23,6,"Weeping, Gwendoline ran from the room.",,
K/KC/KCP.xml,KCPRE000,004601,150,,A,23,7,As soon as she got outside she examined herself carefully and trembling to see if she  see if the spider was still anywhere about her.,,
K/KC/KCP.xml,KCPRE000,004601,151,,B,24,1,Yes.,,
K/KC/KCP.xml,KCPRE000,004601,152,,A,25,1,"To her enormous relief she suddenly saw it running down the passage, she leant against the wall, how tiresome of that spider to come to her when it might have gone to anyone else.",,
K/KC/KCP.xml,KCPRE000,004601,153,,A,25,2,"Now she'd got to have a double punishment, still she would soon put it about that Elissia and Daryl had planted the spider in Mary- Lou's desk.",,
K/KC/KCP.xml,KCPRE000,004601,154,,A,25,3,How sickening of Miss Potts to pounce on her like that.,,
K/KC/KCP.xml,KCPRE000,004601,155,,A,25,4,She couldn't help it if the spider came to her.,,
K/KC/KCP.xml,KCPRE000,004601,156,,A,25,5,"But perhaps, after all it was a good thing that Miss Potts had come into the room and heard it all.",,
K/KC/KCP.xml,KCPRE000,004601,157,,A,25,6,Perhaps Gwendoline might even drop a hint to Miss Potts about Elissia and Daryl putting the spider in the desk.,,
K/KC/KCP.xml,KCPRE000,004601,158,,A,25,7,"Miss Potts came out of the room at this moment, she eyed Gwendoline with dislike.",,
K/KC/KCP.xml,KCPRE000,004601,159,,A,25,8,"Miss Potts the spider ran away down there, said Gwendoline pointing anxiously to  anxious to get back into Miss Potts' good books.",,
K/KC/KCP.xml,KCPRE000,004601,160,,A,25,9,Miss Potts took not the slightest notice but swept into the second form classroom and the door shut.,,
K/KC/KCP.xml,KCPRE000,004601,161,,A,25,10,Gwendoline felt very small.,,
K/KC/KCP.xml,KCPRE000,004601,162,,A,25,11,Now what was she to do?,,
K/KC/KCP.xml,KCPRE000,004601,163,,A,25,12,"Stay out here or go back into the classroom, she didn't want to be found out there if by any chance Miss Graining the Head came by.",,
K/KC/KCP.xml,KCPRE000,004601,164,,A,25,13,"She decided to risk going back, she opened the door and sidled in.",,
K/KC/KCP.xml,KCPRE000,004601,165,,A,25,14,Ha!,,
K/KC/KCP.xml,KCPRE000,004601,166,,A,25,15,"You are back again, and who told you to come?",,
K/KC/KCP.xml,KCPRE000,004601,167,,A,25,16,Demanded Mademoiselle now ashamed of her part in the affair and ready to vent her humiliated feelings on anyone she could.,,
K/KC/KCP.xml,KCPRE000,004601,168,,A,25,17,You screamed and made Miss Potts white and angry .,,
K/KC/KCP.xml,KCPRE000,004601,169,,B,26,1,(()) who did that?,,
K/KC/KCP.xml,KCPRE000,004601,170,,A,27,1,<laugh> Amy I think.,,
K/KC/KCP.xml,KCPRE000,004601,171,,B,28,1,Is that how you spell it?,,
K/KC/KCP.xml,KCPRE000,004601,172,,A,29,1,"No, it's",,
K/KC/KCP.xml,KCPRE000,004601,173,,B,30,1,No,,
K/KC/KCP.xml,KCPRE000,004601,174,,A,31,1,got two Ts.,,
K/KC/KCP.xml,KCPRE000,004601,175,,A,31,2,"<reading> Well Mademoiselle you screamed, too protested Gwendoline in an injured tone, louder than I did, I should think.",,
K/KC/KCP.xml,KCPRE000,004601,176,,A,31,3,"Mademoiselle rose to her in her seat and for all her smallness she seemed enormous to Gwendoline just then, her beady eyes",,
K/KC/KCP.xml,KCPRE000,004601,177,,B,32,1,Who did?,,
K/KC/KCP.xml,KCPRE000,004601,178,,A,33,1,flashed .,,
K/KC/KCP.xml,KCPRE000,004601,179,,A,33,2,Mademoiselle.,,
K/KC/KCP.xml,KCPRE000,004601,180,,A,33,3,"<reading> You would be rude to me, Mademoiselle Dupont, you would argue with me  </reading>",,
K/KC/KCP.xml,KCPRE000,004601,181,,B,34,1,,,
K/KC/KCP.xml,KCPRE000,004601,182,,B,34,2,<cough> ,,
K/KC/KCP.xml,KCPRE000,004601,183,,B,34,3,,,
K/KC/KCP.xml,KCPRE000,004601,184,,A,35,1,Oh dear.,,
K/KC/KCP.xml,KCPRE000,004601,185,,B,36,1,<cough> ,,
K/KC/KCP.xml,KCPRE000,004601,186,,A,37,1,A good  trio aren't we?,,
K/KC/KCP.xml,KCPRE000,004601,187,,B,38,1,Mademoiselle Dupont.,,
K/KC/KCP.xml,KCPRE000,004601,188,,A,39,1,"<reading> You would argue with me who have taught here for twenty years you, you, Gwendoline turned and fled.",,
K/KC/KCP.xml,KCPRE000,004601,189,,A,39,2,She would rather stand outside the door all day long than face Mademoiselle when she looked like that </reading> .,,
K/KC/KCP.xml,KCPRE000,004601,190,,A,39,3,"Alright, I think we'd better give up and have some breakfast.",,
K/KC/KCP.xml,KCPRE000,004601,191,,B,40,1,"Oh, but I only had one.",,
K/KC/KCP.xml,KCPRE000,004601,192,,A,41,1,I know but it's late this morning.,,
K/KC/KCP.xml,KCPRE000,004601,193,,B,42,1,Oh!,,
K/KC/KCP.xml,KCPRE000,004601,194,,B,42,2,Mind the yogurt!,,
K/KC/KCP.xml,KCPRE000,004601,195,,B,42,3,That's not fair.,,
K/KC/KCP.xml,KCPRE000,004601,196,,A,43,1,<laugh> ,,
K/KC/KCP.xml,KCPRE000,004601,197,,A,43,2,,,
K/KC/KCP.xml,KCPRE000,004601,198,,B,44,1,It's half past ten.,,
K/KC/KCP.xml,KCPRE000,004601,199,,B,44,2,Half past ten   (()),,
K/KC/KCP.xml,KCPRE000,004601,200,,B,44,3,Oh!,,
K/KC/KCP.xml,KCPRE000,004601,201,,B,44,4,I only had two!,,
K/KC/KCP.xml,KCPRE000,004601,202,,A,45,1,I know,,
K/KC/KCP.xml,KCPRE000,004601,203,,B,46,1,Mary you've missed Playbus.(()),,
K/KC/KCP.xml,KCPRE000,004601,204,,B,46,2,Yeah,,
K/KC/KCP.xml,KCPRE000,004601,205,,A,47,1,I should think you've missed that haven't you?,,
K/KC/KCP.xml,KCPRE000,004601,206,,B,48,1,No.,,
