swda_filename,ptb_basename,conversation_no,transcript_index,act_tag,caller,turn_index,subutterance_index,text,pos,trees
K/KD/KDY.xml,KDYRE002,006203,0,,A,1,1,I really want little tacky things don't I?,,
K/KD/KDY.xml,KDYRE002,006203,1,,A,1,2,"Little, don't know what I do want really but (())",,
K/KD/KDY.xml,KDYRE002,006203,2,,B,2,1,What for?,,
K/KD/KDY.xml,KDYRE002,006203,3,,A,3,1,Well up the fence there by the side (()) .,,
K/KD/KDY.xml,KDYRE002,006203,4,,A,3,2,"It can't, it can't erm",,
K/KD/KDY.xml,KDYRE002,006203,5,,B,4,1,Well I should put a  small stake or something in.,,
K/KD/KDY.xml,KDYRE002,006203,6,,A,5,1,I just wondered if they got any,,
K/KD/KDY.xml,KDYRE002,006203,7,,B,6,1,"You know a small stake, stick or  (()) of some sort.",,
K/KD/KDY.xml,KDYRE002,006203,8,,A,7,1,No I meant when it goes up you need little things now and again.,,
K/KD/KDY.xml,KDYRE002,006203,9,,A,7,2,I don't know what they're called you know.,,
K/KD/KDY.xml,KDYRE002,006203,10,,A,7,3,(()) into the fence.,,
