swda_filename,ptb_basename,conversation_no,transcript_index,act_tag,caller,turn_index,subutterance_index,text,pos,trees
K/KC/KC4.xml,KC4RE00C,006506,0,,A,1,1,This is Alexander's first day back at school is it?,,
K/KC/KC4.xml,KC4RE00C,006506,1,,B,2,1,Yes.,,
K/KC/KC4.xml,KC4RE00C,006506,2,,A,3,1,Today?,,
K/KC/KC4.xml,KC4RE00C,006506,3,,B,4,1,Well it's only half  --,,
K/KC/KC4.xml,KC4RE00C,006506,4,,B,4,2,--it was only half term  (()) had wasn't it?,,
K/KC/KC4.xml,KC4RE00C,006506,5,,A,5,1,I don't know.,,
K/KC/KC4.xml,KC4RE00C,006506,6,,B,6,1,"Yes, it's only half term.",,
K/KC/KC4.xml,KC4RE00C,006506,7,,B,6,2,I mean now,,
K/KC/KC4.xml,KC4RE00C,006506,8,,A,7,1,"And now he has to stay to July, does he?",,
K/KC/KC4.xml,KC4RE00C,006506,9,,B,8,1,Yes.,,
K/KC/KC4.xml,KC4RE00C,006506,10,,A,9,1,And then he's gonna start travelling daily eh?,,
K/KC/KC4.xml,KC4RE00C,006506,11,,A,9,2,<laugh> It'll be a long day for him won't it?,,
K/KC/KC4.xml,KC4RE00C,006506,12,,B,10,1,Mm.,,
K/KC/KC4.xml,KC4RE00C,006506,13,,A,11,1,"Oh well, we knew that when he was",,
K/KC/KC4.xml,KC4RE00C,006506,14,,B,12,1,Pardon?,,
K/KC/KC4.xml,KC4RE00C,006506,15,,A,13,1,"We knew that when he went, went there, that's why he went boarding.",,
K/KC/KC4.xml,KC4RE00C,006506,16,,B,14,1,Mm.,,
K/KC/KC4.xml,KC4RE00C,006506,17,,A,15,1,"Oh though, it's not bad travelling down there is it?",,
K/KC/KC4.xml,KC4RE00C,006506,18,,B,16,1,"Oh travelling's not bad, I mean,(()) it's only a local train and eh, and it's going, he'll be going in the wrong dir- --",,
K/KC/KC4.xml,KC4RE00C,006506,19,,B,16,2,"--the best direction each time, instead of travelling up to town he'll be travelling out.",,
K/KC/KC4.xml,KC4RE00C,006506,20,,A,17,1,He'll be going the other way.,,
K/KC/KC4.xml,KC4RE00C,006506,21,,B,18,1,"Going the other way, so eh, be no problem.",,
K/KC/KC4.xml,KC4RE00C,006506,22,,A,19,1,Oh there's no problem as far as that's concerned.,,
K/KC/KC4.xml,KC4RE00C,006506,23,,B,20,1,Well you got nearly a mile to walk when he gets to the station.,,
K/KC/KC4.xml,KC4RE00C,006506,24,,A,21,1,He's got nearly a mile to walk?,,
K/KC/KC4.xml,KC4RE00C,006506,25,,B,22,1,Yeah.,,
K/KC/KC4.xml,KC4RE00C,006506,26,,A,23,1,Ain't there any buses?,,
K/KC/KC4.xml,KC4RE00C,006506,27,,B,24,1,"It's not quite as far to the main school, cos the main school goes first and the prep school far, no there's no  (()) up that road, it doesn't go anywhere only to the school.",,
K/KC/KC4.xml,KC4RE00C,006506,28,,A,25,1,Pardon?,,
K/KC/KC4.xml,KC4RE00C,006506,29,,B,26,1,"Doesn't go anywhere only to the school and the eh  <sniff> and the Downs,(()) well,(()) round, but I think there's (()) , no villages  --",,
K/KC/KC4.xml,KC4RE00C,006506,30,,B,26,2,--I don't think Dale and,,
K/KC/KC4.xml,KC4RE00C,006506,31,,A,27,1,Mm.,,
K/KC/KC4.xml,KC4RE00C,006506,32,,B,28,1,"Well I mean,(()) , school doesn't lay on buses or anything from the station  --",,
K/KC/KC4.xml,KC4RE00C,006506,33,,B,28,2,"--Think they do have buses come up from places like Bletchingly and erm, Godstone.",,
K/KC/KC4.xml,KC4RE00C,006506,34,,A,29,1,From where?,,
K/KC/KC4.xml,KC4RE00C,006506,35,,B,30,1,Bletchingly.,,
K/KC/KC4.xml,KC4RE00C,006506,36,,A,31,1,Bletchingly.,,
K/KC/KC4.xml,KC4RE00C,006506,37,,B,32,1,"Bletchingly, yes, it's on the, just below the North Downs.",,
K/KC/KC4.xml,KC4RE00C,006506,38,,A,33,1,Oh.,,
K/KC/KC4.xml,KC4RE00C,006506,39,,B,34,1,Villages along the eh,,
K/KC/KC4.xml,KC4RE00C,006506,40,,A,35,1,Buses coming along that way?,,
K/KC/KC4.xml,KC4RE00C,006506,41,,B,36,1,"Well er yes I think, cos they get a lot of pupils from there",,
K/KC/KC4.xml,KC4RE00C,006506,42,,A,37,1,Oh do they?,,
K/KC/KC4.xml,KC4RE00C,006506,43,,B,38,1,"and the buses, you know, the special buses run, no, the school doesn't run them.",,
K/KC/KC4.xml,KC4RE00C,006506,44,,A,39,1,No.,,
K/KC/KC4.xml,KC4RE00C,006506,45,,B,40,1,"But because there's a demand for it, the buses run to the school and pick them up at the school.",,
K/KC/KC4.xml,KC4RE00C,006506,46,,A,41,1,"How old is he now, fourteen?",,
K/KC/KC4.xml,KC4RE00C,006506,47,,B,42,1,He'll be fourteen in October.,,
K/KC/KC4.xml,KC4RE00C,006506,48,,A,43,1,"Like the same as Tom, he's",,
K/KC/KC4.xml,KC4RE00C,006506,49,,B,44,1,Mm.,,
K/KC/KC4.xml,KC4RE00C,006506,50,,A,45,1,"He's fourteen in July I think,(()) what's a name gave me the dates and I never ruddy well look at them.",,
K/KC/KC4.xml,KC4RE00C,006506,51,,B,46,1,<laugh> Oh well it ain't July yet.,,
K/KC/KC4.xml,KC4RE00C,006506,52,,A,47,1,"Aye, she gave me Amy's about the day before, I thought I look at it now, so, I only just got it in time.",,
K/KC/KC4.xml,KC4RE00C,006506,53,,B,48,1,Erm,,
K/KC/KC4.xml,KC4RE00C,006506,54,,A,49,1,"No, she's got it here, where's Tom?",,
K/KC/KC4.xml,KC4RE00C,006506,55,,A,49,2,Second of August Tom's is.,,
K/KC/KC4.xml,KC4RE00C,006506,56,,B,50,1,Second of August?,,
K/KC/KC4.xml,KC4RE00C,006506,57,,A,51,1,"Aye, and Amy was the sixteenth of May, Zelda is the third of September and Nick is the twenty second of July.",,
K/KC/KC4.xml,KC4RE00C,006506,58,,B,52,1,"Alexander is the eh, eleventh of October.",,
K/KC/KC4.xml,KC4RE00C,006506,59,,B,52,2,Eleventh of the tenth.,,
K/KC/KC4.xml,KC4RE00C,006506,60,,A,53,1,"Nick's  (()) is very eh, expensive in Holland it's cost him a lot of money.",,
K/KC/KC4.xml,KC4RE00C,006506,61,,B,54,1,"Mm, has he?",,
K/KC/KC4.xml,KC4RE00C,006506,62,,B,54,2,"Oh dear, mm ",,
K/KC/KC4.xml,KC4RE00C,006506,63,,A,55,1,"Good job he had his mum's money, because otherwise that'll be (()) .<laugh> ",,
K/KC/KC4.xml,KC4RE00C,006506,64,,B,56,1,Yeah  --,,
K/KC/KC4.xml,KC4RE00C,006506,65,,B,56,2,--What's his salary like there then?,,
K/KC/KC4.xml,KC4RE00C,006506,66,,A,57,1,"I don't know (()) , I've never asked them that.",,
K/KC/KC4.xml,KC4RE00C,006506,67,,A,57,2,I think it's pretty good.,,
K/KC/KC4.xml,KC4RE00C,006506,68,,B,58,1,Mm.,,
K/KC/KC4.xml,KC4RE00C,006506,69,,A,59,1,They wouldn't of gone in the first place.,,
K/KC/KC4.xml,KC4RE00C,006506,70,,B,60,1,No.,,
K/KC/KC4.xml,KC4RE00C,006506,71,,A,61,1,"But you see you  (()) the  (()) of Nick is, you see, he worked on his own for this twelve months.",,
K/KC/KC4.xml,KC4RE00C,006506,72,,B,62,1,Mm.,,
K/KC/KC4.xml,KC4RE00C,006506,73,,A,63,1,Well more than that.,,
K/KC/KC4.xml,KC4RE00C,006506,74,,B,64,1,Mm.,,
K/KC/KC4.xml,KC4RE00C,006506,75,,A,65,1,And people weren't paying him.,,
K/KC/KC4.xml,KC4RE00C,006506,76,,B,66,1,"Oh yeah, this is it.",,
K/KC/KC4.xml,KC4RE00C,006506,77,,A,67,1,"And he's still, one bloke went bankrupt, and he only got  (()) amount off him, he's telling me the other week, he's, he's still five thousand pounds owing to him, though, work he did twelve months ago ",,
K/KC/KC4.xml,KC4RE00C,006506,78,,B,68,1,Course it is yeah.,,
K/KC/KC4.xml,KC4RE00C,006506,79,,B,68,2,"Ah, it's hopeless isn't it?",,
K/KC/KC4.xml,KC4RE00C,006506,80,,A,69,1,"Well there's only one way to deal with them (()) , pay you on a monthly basis, or stop working for them.",,
K/KC/KC4.xml,KC4RE00C,006506,81,,B,70,1,"Oh yes, yeah ",,
K/KC/KC4.xml,KC4RE00C,006506,82,,A,71,1,"But when he went to Holland, his bill was twelve thousand pounds owing to him,(()) .",,
K/KC/KC4.xml,KC4RE00C,006506,83,,B,72,1,Was it?,,
K/KC/KC4.xml,KC4RE00C,006506,84,,B,72,2,--,,
K/KC/KC4.xml,KC4RE00C,006506,85,,B,72,3,--Are they bringing the horses back?,,
K/KC/KC4.xml,KC4RE00C,006506,86,,A,73,1,"Oh I, I, I just, I don't,(()) not to get rid of them bloody horses, alright I know what horses cost.",,
K/KC/KC4.xml,KC4RE00C,006506,87,,B,74,1,Well they are damned expensive.,,
K/KC/KC4.xml,KC4RE00C,006506,88,,A,75,1,Well of course they are and bringing them over here must cost them  (()) five hundred quid.,,
K/KC/KC4.xml,KC4RE00C,006506,89,,B,76,1,"Yeah, it must've cost him that to take them over there.",,
K/KC/KC4.xml,KC4RE00C,006506,90,,A,77,1,Sell them to the knackers yard.<laugh> ,,
K/KC/KC4.xml,KC4RE00C,006506,91,,B,78,1,Wouldn't get much for them there.,,
K/KC/KC4.xml,KC4RE00C,006506,92,,A,79,1,Eh?,,
K/KC/KC4.xml,KC4RE00C,006506,93,,B,80,1,Wouldn't get much for them there.,,
K/KC/KC4.xml,KC4RE00C,006506,94,,A,81,1,"Aye, but you haven't got to pay out have you?",,
K/KC/KC4.xml,KC4RE00C,006506,95,,B,82,1,"Oh no, no.",,
K/KC/KC4.xml,KC4RE00C,006506,96,,A,83,1,"What the hell does it matter, why pay about five hundred pounds and, and that's two horses I've got, that's a thousand pounds.",,
K/KC/KC4.xml,KC4RE00C,006506,97,,B,84,1,Yeah.,,
K/KC/KC4.xml,KC4RE00C,006506,98,,B,84,2,"Well they've got to go into quarantine, and that'll cost them won't he?",,
K/KC/KC4.xml,KC4RE00C,006506,99,,A,85,1,Don't have to go in quarantine horses don't.,,
K/KC/KC4.xml,KC4RE00C,006506,100,,B,86,1,"Don't they, oh.",,
K/KC/KC4.xml,KC4RE00C,006506,101,,A,87,1,"Apparently not, I didn't know what (()) .",,
K/KC/KC4.xml,KC4RE00C,006506,102,,B,88,1,"Oh no , probably not, they don't, they eh, they don't get foot and mouth disease.",,
K/KC/KC4.xml,KC4RE00C,006506,103,,A,89,1,No.,,
K/KC/KC4.xml,KC4RE00C,006506,104,,B,90,1,"They've got, they've, they've got, they haven't got the ",,
K/KC/KC4.xml,KC4RE00C,006506,105,,A,91,1,But you see ,,
K/KC/KC4.xml,KC4RE00C,006506,106,,B,92,1,"hooves, their hooves are not (()) .",,
K/KC/KC4.xml,KC4RE00C,006506,107,,A,93,1,"Charlie , is on his last legs, has been for years and, might as well have him put down,(()) as that Nick keep saying, I think I'll have to have him put down he, when he takes him for a walk he collapses.<laugh> ",,
K/KC/KC4.xml,KC4RE00C,006506,108,,B,94,1,(()) .,,
K/KC/KC4.xml,KC4RE00C,006506,109,,B,94,2,"Well, have him put down over there ",,
K/KC/KC4.xml,KC4RE00C,006506,110,,A,95,1,"But they have to pay for the schooling over there, you know.",,
K/KC/KC4.xml,KC4RE00C,006506,111,,B,96,1,"Yes, I (()) .",,
K/KC/KC4.xml,KC4RE00C,006506,112,,A,97,1,"I don't think Nick realised any of this when he went there, I don't think he looked into it enough.",,
K/KC/KC4.xml,KC4RE00C,006506,113,,B,98,1,No.,,
K/KC/KC4.xml,KC4RE00C,006506,114,,B,98,2,"Don't eh, do the, do the Dutch people have to pay for the schooling?",,
K/KC/KC4.xml,KC4RE00C,006506,115,,B,98,3,The children's schooling?,,
K/KC/KC4.xml,KC4RE00C,006506,116,,A,99,1,I don't know whether it's only a  (()) English.,,
K/KC/KC4.xml,KC4RE00C,006506,117,,B,100,1,Could be that.,,
K/KC/KC4.xml,KC4RE00C,006506,118,,A,101,1,Mm.,,
K/KC/KC4.xml,KC4RE00C,006506,119,,A,101,2,"I know, I don't know, I've no idea.",,
K/KC/KC4.xml,KC4RE00C,006506,120,,B,102,1,They don't pay anything here do they?,,
K/KC/KC4.xml,KC4RE00C,006506,121,,A,103,1,"No, no, no, no charge for schools here at all.",,
K/KC/KC4.xml,KC4RE00C,006506,122,,B,104,1,"Well you see they're always talking about what we don't get in this country, they don't tell you what they don't bloody get abroad.",,
K/KC/KC4.xml,KC4RE00C,006506,123,,A,105,1,Yes (()) .,,
K/KC/KC4.xml,KC4RE00C,006506,124,,A,105,2,"I don't know what their income tax is like is,(()) .",,
K/KC/KC4.xml,KC4RE00C,006506,125,,B,106,1,Well I've got no idea.,,
K/KC/KC4.xml,KC4RE00C,006506,126,,A,107,1,(()) ,,
K/KC/KC4.xml,KC4RE00C,006506,127,,B,108,1,"I mean, I, I just know nothing about it, I know nothing about it at all.",,
K/KC/KC4.xml,KC4RE00C,006506,128,,B,108,2,"I mean the only country I spent a lot of time in, in, in Europe is Austria, and then I only stopped in remote villages, you know, more or less, so er, I mean they rely on eh, tourist trade, they rely on tourist trade, where, where I've",,
K/KC/KC4.xml,KC4RE00C,006506,129,,A,109,1,Eh?,,
K/KC/KC4.xml,KC4RE00C,006506,130,,B,110,1,They rely on tourist trade.,,
K/KC/KC4.xml,KC4RE00C,006506,131,,A,111,1,Oh yes.,,
K/KC/KC4.xml,KC4RE00C,006506,132,,B,112,1,"In Austria , they don't absolute in the (()) , I mean I know nothing about their industrial places at all.",,
K/KC/KC4.xml,KC4RE00C,006506,133,,A,113,1,I don't know their industrial,,
K/KC/KC4.xml,KC4RE00C,006506,134,,B,114,1,"I don't, I don't go to the towns or",,
K/KC/KC4.xml,KC4RE00C,006506,135,,A,115,1,"(()) Holland, can to see (()) , look to me as if there were plenty of it when I was there.",,
K/KC/KC4.xml,KC4RE00C,006506,136,,B,116,1,"Oh I  (()) plenty of industry at the moment, yeah.",,
K/KC/KC4.xml,KC4RE00C,006506,137,,B,116,2,"But I mean what the pay relative to us the cost of living and everything else, I don't know.",,
K/KC/KC4.xml,KC4RE00C,006506,138,,A,117,1,"I don't think the cost of living is any cheaper than it is here, from what I can gather.",,
K/KC/KC4.xml,KC4RE00C,006506,139,,B,118,1,"Mm, well the cost of living is certainly no cheaper in Austria than it is here.",,
K/KC/KC4.xml,KC4RE00C,006506,140,,B,118,2,"I mean, I don't know what sort of taxes they have on eh, on drink and that sort of thing, but I think Austria is more or less the same same sort of tax.",,
K/KC/KC4.xml,KC4RE00C,006506,141,,A,119,1,I don't know whether they have to pay income tax or what they have to do.,,
K/KC/KC4.xml,KC4RE00C,006506,142,,B,120,1,"Oh they're bound, I think they're, well, I don't know whether they thought",,
K/KC/KC4.xml,KC4RE00C,006506,143,,A,121,1,"It's only  (()) not going to stay, she's coming back.",,
K/KC/KC4.xml,KC4RE00C,006506,144,,B,122,1,"They have all sorts of local taxes and that, you know.",,
K/KC/KC4.xml,KC4RE00C,006506,145,,A,123,1,Do they?,,
K/KC/KC4.xml,KC4RE00C,006506,146,,B,124,1,Yes.,,
K/KC/KC4.xml,KC4RE00C,006506,147,,B,124,2,"The, well that's if in place of their age, but their local taxes they, they collect from everybody, you go into a restaurant",,
K/KC/KC4.xml,KC4RE00C,006506,148,,A,125,1,Oh yes I notice (()) .,,
K/KC/KC4.xml,KC4RE00C,006506,149,,B,126,1,"I'm, I'm not talking about VAT now, I'm talking about local tax.",,
K/KC/KC4.xml,KC4RE00C,006506,150,,A,127,1,"No, no , yeah.",,
K/KC/KC4.xml,KC4RE00C,006506,151,,B,128,1,"So everybody who, who uses the services at a place, pays for it, you know.",,
K/KC/KC4.xml,KC4RE00C,006506,152,,B,128,2,"Don't know if you get it on hotel bills, I think they have to pay something, yes.",,
K/KC/KC4.xml,KC4RE00C,006506,153,,B,128,3,"On hotel bills, they don't, but usually they put it, including local tax, or something like, they always use to show it separately at one time, it's a percentage, but now, very often your bill just shows it as a, including local tax.",,
K/KC/KC4.xml,KC4RE00C,006506,154,,A,129,1,Aye.,,
K/KC/KC4.xml,KC4RE00C,006506,155,,B,130,1,"But, oh I don't know.",,
K/KC/KC4.xml,KC4RE00C,006506,156,,B,130,2,"They're always knocking the government in this country, it's not much  (()) the government are, are they?",,
K/KC/KC4.xml,KC4RE00C,006506,157,,B,130,3,"Somebody's knocking them, whatever, ha, whatever  <<REDACTED (name)>> says.<laugh> ",,
