swda_filename,ptb_basename,conversation_no,transcript_index,act_tag,caller,turn_index,subutterance_index,text,pos,trees
K/KC/KC4.xml,KC4RE00B,006505,0,,A,1,1,"What are you doing for your holidays this year, any (()) ?",,
K/KC/KC4.xml,KC4RE00B,006505,1,,B,2,1,I don't really yet.,,
K/KC/KC4.xml,KC4RE00B,006505,2,,B,2,2,I was thinking of going.,,
K/KC/KC4.xml,KC4RE00B,006505,3,,A,3,1,Hm.,,
K/KC/KC4.xml,KC4RE00B,006505,4,,B,4,1,"I was thinking of going to Austria about the end of September October but, if Alexander's not going abroad I don't know, I shall have to  --",,
K/KC/KC4.xml,KC4RE00B,006505,5,,B,4,2,"--change me mind probably, I'll have to have a word with Sue.",,
K/KC/KC4.xml,KC4RE00B,006505,6,,A,5,1,(()) what's Sue doing with her holidays this year?,,
K/KC/KC4.xml,KC4RE00B,006505,7,,B,6,1,There not.,,
K/KC/KC4.xml,KC4RE00B,006505,8,,A,7,1,Aren't they?<laugh> .,,
K/KC/KC4.xml,KC4RE00B,006505,9,,B,8,1,"Well I think there in, well they can't go together, told you the last time you was here, they can't go on holiday together.",,
K/KC/KC4.xml,KC4RE00B,006505,10,,A,9,1,Oh somebody got to business oh.,,
K/KC/KC4.xml,KC4RE00B,006505,11,,B,10,1,They can't leave the business .,,
K/KC/KC4.xml,KC4RE00B,006505,12,,A,11,1,They had more staff last year they could leave in.,,
K/KC/KC4.xml,KC4RE00B,006505,13,,B,12,1,<cough> pardon.,,
K/KC/KC4.xml,KC4RE00B,006505,14,,A,13,1,They had staff they could leave in charge last year.,,
K/KC/KC4.xml,KC4RE00B,006505,15,,B,14,1,Haven't they got anybody now?,,
K/KC/KC4.xml,KC4RE00B,006505,16,,A,15,1,"Well they've only got one, one girl who sort of does clerical and stuff and reception, they haven't got a anybody who knows how to  (()) .",,
K/KC/KC4.xml,KC4RE00B,006505,17,,B,16,1,(()) of there's.,,
K/KC/KC4.xml,KC4RE00B,006505,18,,A,17,1,"Yeah, yeah, they haven't got anybody who knows anything about the business, well not enough about it.",,
K/KC/KC4.xml,KC4RE00B,006505,19,,B,18,1,"(()) really expensive are now, aren't they?",,
K/KC/KC4.xml,KC4RE00B,006505,20,,A,19,1,Yeah ,,
K/KC/KC4.xml,KC4RE00B,006505,21,,B,20,1,I suppose  (()) got a car.,,
K/KC/KC4.xml,KC4RE00B,006505,22,,A,21,1,"You know, moaning about these blokes like the postman going on strike over a seven per cent rise.",,
K/KC/KC4.xml,KC4RE00B,006505,23,,B,22,1,Oh I.,,
K/KC/KC4.xml,KC4RE00B,006505,24,,A,23,1,"I mean, they shouldn't want more than seven per cent because the cost of living, you know, the inflation's gone down, but then when a bloke gets forty five thousand quid, you know eh, on a firm where they've a, they've made a profit, but he got an increase of forty five thousand pound which was of, no, no about forty per cent rather, forty per cent increase in his salary, I mean it's bloody, I mean, how can, how can they expect, you know, the ordinary working man to put up with bloody awful increase, if, if they go and give bosses increases like that, I mean it doesn't make sense.",,
K/KC/KC4.xml,KC4RE00B,006505,25,,B,24,1,"Yes, but it's only, it's only people that are in these higher executive jobs that get these bloody monies.",,
K/KC/KC4.xml,KC4RE00B,006505,26,,A,25,1,"Yeah, but then they shouldn't get it, they shouldn't do it.",,
K/KC/KC4.xml,KC4RE00B,006505,27,,B,26,1,I know.,,
K/KC/KC4.xml,KC4RE00B,006505,28,,A,27,1,"I mean as I say now, how can you turn round to a  --",,
K/KC/KC4.xml,KC4RE00B,006505,29,,A,27,2,"--to a bloke who's, well doesn't matter what his on, eh, what, what ever his, his rate of pay is, how can you turn round to him and say you can't have more than seven per cent, and his got, his got something like a about twenty five, thirty per cent .",,
K/KC/KC4.xml,KC4RE00B,006505,30,,B,28,1,"I think, I think your find that a lot of these big, big money people get paid according to results, and if they get good results they get good money.",,
K/KC/KC4.xml,KC4RE00B,006505,31,,A,29,1,"Yeah, but I don't think this bloke could have particularly good I don't think this bloke had particularly good results.",,
K/KC/KC4.xml,KC4RE00B,006505,32,,B,30,1,And if the results  (()) results fall then they loose it .,,
K/KC/KC4.xml,KC4RE00B,006505,33,,B,30,2,Hm.,,
K/KC/KC4.xml,KC4RE00B,006505,34,,A,31,1,He hadn't had good results.,,
K/KC/KC4.xml,KC4RE00B,006505,35,,B,32,1,"Well as that, from my experience, they only pay ya for what your worth, not what <laugh> , don't pay ya because your good looking or anything like that ",,
K/KC/KC4.xml,KC4RE00B,006505,36,,A,33,1,"If a firm's not doing well they can't pay ya, can it?",,
K/KC/KC4.xml,KC4RE00B,006505,37,,B,34,1,Well (()) .,,
K/KC/KC4.xml,KC4RE00B,006505,38,,A,35,1,"That's, our, our Nick's people would, wouldn't it, and that was it.",,
K/KC/KC4.xml,KC4RE00B,006505,39,,B,36,1,Hm.,,
K/KC/KC4.xml,KC4RE00B,006505,40,,A,37,1,They lost all the bloody trade.,,
K/KC/KC4.xml,KC4RE00B,006505,41,,B,38,1,Hm.,,
K/KC/KC4.xml,KC4RE00B,006505,42,,A,39,1,"I, even Nick, Nick said two years ago things started going down hill  --",,
K/KC/KC4.xml,KC4RE00B,006505,43,,A,39,2,"--The best paid jobs these days, say what you like,(()) don't like, is either in local government or something like that.",,
K/KC/KC4.xml,KC4RE00B,006505,44,,A,39,3,"There over paid vastly, local government.",,
K/KC/KC4.xml,KC4RE00B,006505,45,,B,40,1,Hm.,,
K/KC/KC4.xml,KC4RE00B,006505,46,,B,40,2,Well I don't really know how much they get.,,
K/KC/KC4.xml,KC4RE00B,006505,47,,A,41,1,Pardon.,,
K/KC/KC4.xml,KC4RE00B,006505,48,,B,42,1,I don't really know how much money they get.,,
K/KC/KC4.xml,KC4RE00B,006505,49,,A,43,1,Well you've only got to look at adverts in the ruddy paper for,,
K/KC/KC4.xml,KC4RE00B,006505,50,,B,44,1,"I mean  (()) I no, I'm, I'm thinking more on the ordinary clerical and that executive stuff, not the  (()) jobs .",,
K/KC/KC4.xml,KC4RE00B,006505,51,,A,45,1,"Oh well, I was flicking the .",,
K/KC/KC4.xml,KC4RE00B,006505,52,,B,46,1,"Yeah, yeah.",,
K/KC/KC4.xml,KC4RE00B,006505,53,,A,47,1,(()) .,,
K/KC/KC4.xml,KC4RE00B,006505,54,,B,48,1,"I mean I don't think there particularly well paid, but they, there well paid for what they flipping well do cos they don't, they, they, they'll do it, but I mean eh, that's the fault of the bosses, they should cut down there staff.",,
K/KC/KC4.xml,KC4RE00B,006505,55,,B,48,2,"You can't blame, you can't blame people for hanging about doing nothing if they've twice as many staff as they should've, and there paying them, I mean, that, that's an administrative error, not a  --",,
K/KC/KC4.xml,KC4RE00B,006505,56,,B,48,3,--well it seems to be very rift in local government that there over staffed ,,
K/KC/KC4.xml,KC4RE00B,006505,57,,A,49,1,"I, I think all these, all these people in local government and things, and eh, it was obvious when, you see adverts for jobs, what a bloody salaries there paying them, for a mediocre job.",,
K/KC/KC4.xml,KC4RE00B,006505,58,,B,50,1,Well I never look at the adverts do I?,,
K/KC/KC4.xml,KC4RE00B,006505,59,,B,50,2,I'm not in <laugh> .,,
K/KC/KC4.xml,KC4RE00B,006505,60,,A,51,1,"No, I don't suppose you do now, but, but I have would off worked for local authorities, because at one time they were very poorly paid.",,
K/KC/KC4.xml,KC4RE00B,006505,61,,A,51,2,"But it's all changed now, there the best paid people in the ruddy country.",,
K/KC/KC4.xml,KC4RE00B,006505,62,,B,52,1,Hm ,,
K/KC/KC4.xml,KC4RE00B,006505,63,,A,53,1,"There'll have to have a ruddy cut down (()) , over this staff over this community charge, there've been trouble here next.",,
K/KC/KC4.xml,KC4RE00B,006505,64,,B,54,1,Hm.,,
K/KC/KC4.xml,KC4RE00B,006505,65,,A,55,1,"Think about the money, about a quarter of the staff that they did have.",,
K/KC/KC4.xml,KC4RE00B,006505,66,,A,55,2,"Hm, there see, they are over staffed, there's no doubt about it, aren't they?",,
K/KC/KC4.xml,KC4RE00B,006505,67,,B,56,1,(()) .,,
K/KC/KC4.xml,KC4RE00B,006505,68,,B,56,2,"But I mean I say, that's not the fault of the people who work there, there not going to put themselves out of work.",,
K/KC/KC4.xml,KC4RE00B,006505,69,,B,56,3,"They should never have been taken on in the first place, any bet, that our, our problem should never have been taken on in the first place .",,
K/KC/KC4.xml,KC4RE00B,006505,70,,B,56,4,"Well that's it , this is it, they, they take on staff to increase there own importance.",,
