swda_filename,ptb_basename,conversation_no,transcript_index,act_tag,caller,turn_index,subutterance_index,text,pos,trees
K/KE/KE3.xml,KE3RE023,010603,0,,A,1,1,Just getting used to this damn er choke again,,
K/KE/KE3.xml,KE3RE023,010603,1,,B,2,1,<laugh> .,,
K/KE/KE3.xml,KE3RE023,010603,2,,A,3,1,No.,,
K/KE/KE3.xml,KE3RE023,010603,3,,B,4,1,"They'll service it, and it'll ",,
K/KE/KE3.xml,KE3RE023,010603,4,,A,5,1,"They'll service it ,",,
K/KE/KE3.xml,KE3RE023,010603,5,,B,6,1,be all different again.,,
K/KE/KE3.xml,KE3RE023,010603,6,,A,7,1,"such a pain, it really is.",,
K/KE/KE3.xml,KE3RE023,010603,7,,A,7,2,"I  (()) seemed to do anything to the car, mind with the water pump I think they check, they have to er adjust the timing.",,
K/KE/KE3.xml,KE3RE023,010603,8,,B,8,1,"Mm, mm.",,
K/KE/KE3.xml,KE3RE023,010603,9,,A,9,1,"When they er put the new pump in, but it is such a nuisance.",,
