swda_filename,ptb_basename,conversation_no,transcript_index,act_tag,caller,turn_index,subutterance_index,text,pos,trees
K/KD/KDA.xml,KDARE00E,011606,0,,A,1,1,"You see I can't remember if they're if they're pulling my plonker or not, but that is the sort of thing I do, but I can't remember anything about it.",,
K/KD/KDA.xml,KDARE00E,011606,1,,A,1,2,"The only trouble is I did have quite, well it's easy though that's the thing  --",,
K/KD/KDA.xml,KDARE00E,011606,2,,A,1,3,"--it's just like a, it's just a multi storey car park, so it's quite easy, and you, you know you can get strong when you're pissed don't you, like",,
K/KD/KDA.xml,KDARE00E,011606,3,,B,2,1,What  (()) fucking  (()) .,,
K/KD/KDA.xml,KDARE00E,011606,4,,B,2,2,Well either you have to think it's wrong.,,
K/KD/KDA.xml,KDARE00E,011606,5,,A,3,1,"yeah but I mean, I  (()) it, I  (()) when I'm fucking pissed, I can't  (()) sober, that's why I probably think they're, they're not pulling a plonker cos I've done that sort of thing in the past  --",,
K/KD/KDA.xml,KDARE00E,011606,6,,A,3,2,"--had me fucking climbing on bikes, swinging off the side of the building (()) .",,
K/KD/KDA.xml,KDARE00E,011606,7,,B,4,1,Oh I.,,
K/KD/KDA.xml,KDARE00E,011606,8,,A,5,1,"See I never know whether they're pulling, pulling a plonker or not you know, that's the real (()) , like I said I can't remember doing it, but, I wouldn't put it pass myself and I fucking get stupid, I don't get aggressive or anything I just get stupid, you know, I do shit like that.",,
K/KD/KDA.xml,KDARE00E,011606,9,,A,5,2,"I've nicked bus stop signs, fucking road signs and stuff, I just get stupid, that's if I get that pissed, I mean I probably talking of, talking of fucking all most not knowing you're right name sort of pissed.",,
K/KD/KDA.xml,KDARE00E,011606,10,,B,6,1,(()) .,,
K/KD/KDA.xml,KDARE00E,011606,11,,A,7,1,"That's the thing,apparent- apparently I couldn't even walk straight, and yet there's me fucking climbing up the outside of a building, which to me sounds about right.",,
K/KD/KDA.xml,KDARE00E,011606,12,,A,7,2,"God knows how I didn't kill myself and the sheer of the whole thing was, it wasn't even on the second floor, it was on the ground floor, they were just pulling a (()) .",,
K/KD/KDA.xml,KDARE00E,011606,13,,A,7,3,Cos I count.,,
K/KD/KDA.xml,KDARE00E,011606,14,,B,8,1,"I, I use to go up the (()) .",,
K/KD/KDA.xml,KDARE00E,011606,15,,A,9,1,But norm- nine times out of ten you went the inside of it.,,
K/KD/KDA.xml,KDARE00E,011606,16,,B,10,1,"Oh yeah, just sat there in the outside, down a (()) .",,
K/KD/KDA.xml,KDARE00E,011606,17,,A,11,1,"Well I, see, if, my memory",,
K/KD/KDA.xml,KDARE00E,011606,18,,B,12,1,"Fucking people use to come out and fucking say to me, fucking wanker up there, I wonder if he's gonna jump,(()) the old bill (()) .",,
K/KD/KDA.xml,KDARE00E,011606,19,,A,13,1,"Well, my, my memory right, you go down into, into like a, the ground floor and the top of the, like the bottom of the next floor is about that sort of height, but there is a wall up there sort of thing, which erm, I, I must, which you could probably get on.",,
K/KD/KDA.xml,KDARE00E,011606,20,,A,13,2,"So what they says is that I, I got on at this wall, jumped across onto this other wall, shinned up the outside of this other wall, stood on top of this the first floor wall and jumped up and caught hold of the top of the second floor wall and he reckon in the la- about fucking twenty odd seconds, I was up and over and in, they, they, they  (()) fucking kill yourself, get down, I can't remember none of it.",,
K/KD/KDA.xml,KDARE00E,011606,21,,A,13,3,The on- the only thing I can remember is running after the car.,,
K/KD/KDA.xml,KDARE00E,011606,22,,B,14,1,Why they all just piled in did they?,,
K/KD/KDA.xml,KDARE00E,011606,23,,A,15,1,Well I don't know.,,
K/KD/KDA.xml,KDARE00E,011606,24,,B,16,1,(()) to fuck off?,,
K/KD/KDA.xml,KDARE00E,011606,25,,A,17,1,"Yeah, probably, me and this other mate he'd a, did a, I can, I can remember him saying something about I'll race yeah, it, like I remember just remember him, me and him run- running down ramps and stuff trying to get back down to the ground floor, so   --",,
K/KD/KDA.xml,KDARE00E,011606,26,,A,17,2,--(()) <sawing> .,,
K/KD/KDA.xml,KDARE00E,011606,27,,A,17,3,Actually sometimes I'm pretty glad I don't remember things like that.,,
K/KD/KDA.xml,KDARE00E,011606,28,,A,17,4,You can see why I was in such a bad mood Saturday cos if I'd drunk that much Friday night you can imagine what sort of a hang over I had.,,
K/KD/KDA.xml,KDARE00E,011606,29,,A,17,5,I mean we got up about nine o'clock as well.,,
K/KD/KDA.xml,KDARE00E,011606,30,,A,17,6,"(()) but er I'd meet up in town and  (()) our house like twenty past nine, half past (()) , get, get, get the bit of shopping done before the fucking  (()) crowds I might off wasted me time, we got in there about ten o'clock,(()) right old day.",,
K/KD/KDA.xml,KDARE00E,011606,31,,B,18,1,Yeah.,,
K/KD/KDA.xml,KDARE00E,011606,32,,A,19,1,"By fucking half past ten it's, it's well busy, it's so packed.<sawing> (()) ",,
K/KD/KDA.xml,KDARE00E,011606,33,,B,20,1,Barry's not there.(()) ,,
K/KD/KDA.xml,KDARE00E,011606,34,,A,21,1,I bet you hate it when the glue goes hard (()) .,,
K/KD/KDA.xml,KDARE00E,011606,35,,B,22,1,Yeah.,,
K/KD/KDA.xml,KDARE00E,011606,36,,A,23,1,That's the only thing with bonding (()) .,,
