swda_filename,ptb_basename,conversation_no,transcript_index,act_tag,caller,turn_index,subutterance_index,text,pos,trees
K/KB/KBF.xml,KBFRE005,015006,0,,A,1,1,At this work experience (()) .,,
K/KB/KBF.xml,KBFRE005,015006,1,,B,2,1,In (()) .,,
K/KB/KBF.xml,KBFRE005,015006,2,,A,3,1,Do they?,,
K/KB/KBF.xml,KBFRE005,015006,3,,B,4,1,I asked for some once.,,
K/KB/KBF.xml,KBFRE005,015006,4,,A,5,1,You did?,,
K/KB/KBF.xml,KBFRE005,015006,5,,B,6,1,"No, I never pick up the phone, they do that, pick up one phone and speak for a minute, while that ones ringing they say hold on a minute, and pick up the other one.",,
K/KB/KBF.xml,KBFRE005,015006,6,,A,7,1,What's it about then?,,
K/KB/KBF.xml,KBFRE005,015006,7,,B,8,1,"<cough> , it's only about this erm, I have to do the practice.",,
K/KB/KBF.xml,KBFRE005,015006,8,,A,9,1,Huh?,,
K/KB/KBF.xml,KBFRE005,015006,9,,B,10,1,Have to do the practice.,,
K/KB/KBF.xml,KBFRE005,015006,10,,A,11,1,Know how to do them now?,,
K/KB/KBF.xml,KBFRE005,015006,11,,A,11,2,You should  (()) at Peter's.,,
K/KB/KBF.xml,KBFRE005,015006,12,,B,12,1,I don't know Peter's (()) .,,
K/KB/KBF.xml,KBFRE005,015006,13,,A,13,1,"No, I don't actually.",,
K/KB/KBF.xml,KBFRE005,015006,14,,B,14,1,Cos I don't know his  (()) can't do it.,,
K/KB/KBF.xml,KBFRE005,015006,15,,A,15,1,Quit easy though isn't it?,,
K/KB/KBF.xml,KBFRE005,015006,16,,B,16,1,"All you do is, stick it through, phone your number, push the button, it's gone through.",,
K/KB/KBF.xml,KBFRE005,015006,17,,B,16,2,I get fed up doing the (()) .,,
K/KB/KBF.xml,KBFRE005,015006,18,,A,17,1,"Yeah, but, even when you leave school that's what happens don't it?",,
K/KB/KBF.xml,KBFRE005,015006,19,,A,17,2,"I, I mean you usually start off with the boy  (()) everybody has to start at the bottom,(()) .",,
K/KB/KBF.xml,KBFRE005,015006,20,,B,18,1,(()) .,,
K/KB/KBF.xml,KBFRE005,015006,21,,A,19,1,"Mm, I'm sure.",,
K/KB/KBF.xml,KBFRE005,015006,22,,B,20,1,<cough> ,,
K/KB/KBF.xml,KBFRE005,015006,23,,A,21,1,You make yourself cough more by lying down there.,,
