swda_filename,ptb_basename,conversation_no,transcript_index,act_tag,caller,turn_index,subutterance_index,text,pos,trees
K/KC/KCN.xml,KCNRE01M,027604,0,,A,1,1,Nothing wrong with her!,,
K/KC/KCN.xml,KCNRE01M,027604,1,,B,2,1,No.,,
K/KC/KCN.xml,KCNRE01M,027604,2,,A,3,1,No.,,
K/KC/KCN.xml,KCNRE01M,027604,3,,B,4,1,"Yeah  er    <reading newspaper> Prime Minister, John Major  John Major's anxious wife, Norma  has a job keeping her cool  as she faces the anger of a town  blighted by unemployment.",,
K/KC/KCN.xml,KCNRE01M,027604,4,,B,4,2,"The couple were both shoved and jostled  as around one hundred demonstrators greeted them with jeers and shouts in Bolton, Lancashire.",,
K/KC/KCN.xml,KCNRE01M,027604,5,,B,4,3,Police helmets went flying as officers formed a protective cordon around the Majors.,,
K/KC/KCN.xml,KCNRE01M,027604,6,,B,4,4,"Bricklayer, Tony   <<REDACTED (name)>> one of the town's twelve  thousand jobless said  I came along to show my contempt with his government policies!",,
K/KC/KCN.xml,KCNRE01M,027604,7,,B,4,5,Mr Major abandoned the plan of twenty minutes full campaign  walk about  after just five minutes </reading newspaper> !,,
K/KC/KCN.xml,KCNRE01M,027604,8,,A,5,1,Mm.,,
K/KC/KCN.xml,KCNRE01M,027604,9,,A,5,2,"We don't want them, you see!",,
K/KC/KCN.xml,KCNRE01M,027604,10,,B,6,1,No.,,
K/KC/KCN.xml,KCNRE01M,027604,11,,A,7,1,It looks better all the time don't it?,,
K/KC/KCN.xml,KCNRE01M,027604,12,,B,8,1,"Well i- , if, it would be like that all over the country!",,
K/KC/KCN.xml,KCNRE01M,027604,13,,B,8,2,But in one place (()) !,,
K/KC/KCN.xml,KCNRE01M,027604,14,,A,9,1,Well it is like that all over the country though innit?,,
K/KC/KCN.xml,KCNRE01M,027604,15,,B,10,1,No.,,
K/KC/KCN.xml,KCNRE01M,027604,16,,A,11,1,Well I think the sky is brightening up!,,
K/KC/KCN.xml,KCNRE01M,027604,17,,A,11,2,I do hope so!,,
K/KC/KCN.xml,KCNRE01M,027604,18,,A,11,3,"I mean, you can see that red  (()) bush in the corner quite clear now!",,
K/KC/KCN.xml,KCNRE01M,027604,19,,B,12,1,Can you?,,
K/KC/KCN.xml,KCNRE01M,027604,20,,A,13,1,Mm.,,
K/KC/KCN.xml,KCNRE01M,027604,21,,A,13,2,And I would see it a lot clearer if my glasses were clean!,,
K/KC/KCN.xml,KCNRE01M,027604,22,,B,14,1,Well I saw something here!,,
K/KC/KCN.xml,KCNRE01M,027604,23,,B,14,2,"I don't know what it was, but only a little tiny wee bit  and it was real funny!",,
K/KC/KCN.xml,KCNRE01M,027604,24,,B,14,3,I think (()) .,,
K/KC/KCN.xml,KCNRE01M,027604,25,,B,14,4,I can't find it now!,,
K/KC/KCN.xml,KCNRE01M,027604,26,,B,14,5,It's always the way!,,
K/KC/KCN.xml,KCNRE01M,027604,27,,B,14,6,No!,,
K/KC/KCN.xml,KCNRE01M,027604,28,,A,15,1,Well I got some of (()) .,,
K/KC/KCN.xml,KCNRE01M,027604,29,,B,16,1,I can't remember where it  is.,,
K/KC/KCN.xml,KCNRE01M,027604,30,,A,17,1,"<singing> Mm mm mm mmmm mm mm mm  Oh ho, off to work we go  da da da dum dum da da </singing> .",,
K/KC/KCN.xml,KCNRE01M,027604,31,,B,18,1,What about (()) ?,,
K/KC/KCN.xml,KCNRE01M,027604,32,,B,18,2,James  and Stuart  a couple of  (()) and when he was preg- erm  that's   (()) Douglas Hurd.,,
K/KC/KCN.xml,KCNRE01M,027604,33,,A,19,1,Oh yeah Dougie!,,
K/KC/KCN.xml,KCNRE01M,027604,34,,B,20,1,"He, when he was Foreign Secretary.",,
K/KC/KCN.xml,KCNRE01M,027604,35,,B,20,2,What is he now?,,
K/KC/KCN.xml,KCNRE01M,027604,36,,B,20,3,"Foreign Secretary, you know?",,
K/KC/KCN.xml,KCNRE01M,027604,37,,A,21,1,Mhm.,,
K/KC/KCN.xml,KCNRE01M,027604,38,,B,22,1,"He's so   (()) public, him.",,
K/KC/KCN.xml,KCNRE01M,027604,39,,A,23,1,Oh God!,,
K/KC/KCN.xml,KCNRE01M,027604,40,,A,23,2,Who would imagine!,,
K/KC/KCN.xml,KCNRE01M,027604,41,,B,24,1,<reading newspaper> Foreign Secretary Douglas Hurd is on the telly all the time  telling us he can't put his eye on a labour government  to be firm with Gadaffi of Libya  or sa- or Saddam Hussein of Iraq.,,
K/KC/KCN.xml,KCNRE01M,027604,42,,B,24,2,So here I publish a picture of him ten years ago  when he was Junior Minister  he is enjoying a marvellous a party at London's  Intercontinental Hotel.,,
K/KC/KCN.xml,KCNRE01M,027604,43,,B,24,3,He's forced the Libyan government  a cause for celebration  the tenth anniversary of the coming to power  of their president  Colonel Gadaffi.,,
K/KC/KCN.xml,KCNRE01M,027604,44,,A,25,1,Mhm.,,
K/KC/KCN.xml,KCNRE01M,027604,45,,B,26,1,Previous year Mr Hurd  on behalf of the Foreign office was celebrating in the (()) .,,
K/KC/KCN.xml,KCNRE01M,027604,46,,B,26,2,"The great event, an anniversary",,
K/KC/KCN.xml,KCNRE01M,027604,47,,A,27,1,,,
K/KC/KCN.xml,KCNRE01M,027604,48,,A,27,2,(()) ,,
K/KC/KCN.xml,KCNRE01M,027604,49,,A,27,3,,,
K/KC/KCN.xml,KCNRE01M,027604,50,,B,28,1,of the coming of power  of the  the   (()) dictatorship.,,
K/KC/KCN.xml,KCNRE01M,027604,51,,B,28,2,And who was top man in that dictat- in that dictatorship  to which Iron Man Hurd raised his glass!,,
K/KC/KCN.xml,KCNRE01M,027604,52,,B,28,3,Saddam Hussein !,,
K/KC/KCN.xml,KCNRE01M,027604,53,,A,29,1,Mm.,,
K/KC/KCN.xml,KCNRE01M,027604,54,,A,29,2,(()) didn't it?,,
K/KC/KCN.xml,KCNRE01M,027604,55,,B,30,1,Mm.,,
K/KC/KCN.xml,KCNRE01M,027604,56,,A,31,1,"Mhm, and now they're trying to fight to get him from there!",,
K/KC/KCN.xml,KCNRE01M,027604,57,,B,32,1,Well now they are fighting!,,
K/KC/KCN.xml,KCNRE01M,027604,58,,B,32,2,"I mean the- , they've done it once a- , and  didn't do it!",,
K/KC/KCN.xml,KCNRE01M,027604,59,,B,32,3,That's all creating him back up now isn't it?,,
K/KC/KCN.xml,KCNRE01M,027604,60,,B,32,4,"He was given a, a week",,
K/KC/KCN.xml,KCNRE01M,027604,61,,A,33,1,"<yawning> Ah, ah, ah, ah </yawning> !",,
K/KC/KCN.xml,KCNRE01M,027604,62,,B,34,1,or a fortnight or something  to do something with their lot.,,
K/KC/KCN.xml,KCNRE01M,027604,63,,B,34,2,It isn't raining is it?,,
K/KC/KCN.xml,KCNRE01M,027604,64,,A,35,1,"No, I don't think.",,
K/KC/KCN.xml,KCNRE01M,027604,65,,B,36,1,A bit foggy!,,
K/KC/KCN.xml,KCNRE01M,027604,66,,A,37,1,Dunno.,,
K/KC/KCN.xml,KCNRE01M,027604,67,,A,37,2,"Well, let's hope this weather picks up for when Margaret gets here.",,
K/KC/KCN.xml,KCNRE01M,027604,68,,B,38,1,<laugh> ,,
K/KC/KCN.xml,KCNRE01M,027604,69,,A,39,1,Or she'll be looking a bear skin!,,
K/KC/KCN.xml,KCNRE01M,027604,70,,A,39,2,And her super warm coat!,,
K/KC/KCN.xml,KCNRE01M,027604,71,,B,40,1,<laughing> Oh yes </laughing> !,,
K/KC/KCN.xml,KCNRE01M,027604,72,,A,41,1,<laugh> ,,
K/KC/KCN.xml,KCNRE01M,027604,73,,B,42,1,"Well i- ah, I dunno.",,
K/KC/KCN.xml,KCNRE01M,027604,74,,B,42,2,"Well she won't think it's cold because  I mean, it's sunny every day is it?",,
K/KC/KCN.xml,KCNRE01M,027604,75,,A,43,1,Well she couldn't of had it colder  than when dad was in hospital!,,
K/KC/KCN.xml,KCNRE01M,027604,76,,A,43,2,And by hell it was cold!,,
K/KC/KCN.xml,KCNRE01M,027604,77,,A,43,3,Bitter cold!,,
K/KC/KCN.xml,KCNRE01M,027604,78,,A,43,4,And wet!,,
K/KC/KCN.xml,KCNRE01M,027604,79,,A,43,5,And blowing!,,
K/KC/KCN.xml,KCNRE01M,027604,80,,A,43,6,You couldn't had it worst!,,
K/KC/KCN.xml,KCNRE01M,027604,81,,A,43,7,The only you could of had was the snow!,,
K/KC/KCN.xml,KCNRE01M,027604,82,,A,43,8,"Ooh, but that was!",,
K/KC/KCN.xml,KCNRE01M,027604,83,,A,43,9,Well she shivered!,,
K/KC/KCN.xml,KCNRE01M,027604,84,,A,43,10,And she shivered!,,
K/KC/KCN.xml,KCNRE01M,027604,85,,B,44,1,<laughing> Yeah </laughing> !,,
K/KC/KCN.xml,KCNRE01M,027604,86,,A,45,1,(()) ,,
K/KC/KCN.xml,KCNRE01M,027604,87,,B,46,1,"Yeah, and what, new clothing  (())",,
K/KC/KCN.xml,KCNRE01M,027604,88,,A,47,1,,,
K/KC/KCN.xml,KCNRE01M,027604,89,,A,47,2,<laugh> ,,
K/KC/KCN.xml,KCNRE01M,027604,90,,A,47,3,,,
K/KC/KCN.xml,KCNRE01M,027604,91,,B,48,1,,,
K/KC/KCN.xml,KCNRE01M,027604,92,,B,48,2,(()) ,,
K/KC/KCN.xml,KCNRE01M,027604,93,,B,48,3,,,
K/KC/KCN.xml,KCNRE01M,027604,94,,A,49,1,"and she said as, well what she used to say about it was nobody's business!",,
K/KC/KCN.xml,KCNRE01M,027604,95,,B,50,1,"<laugh> And I mean, if they get a we- , a wet day isn't it just rainy in there, it's lovely and warm!",,
K/KC/KCN.xml,KCNRE01M,027604,96,,B,50,2,"In there, well (()) , but it isn't warm (()) .",,
K/KC/KCN.xml,KCNRE01M,027604,97,,B,50,3,But it is to us who is used to this sodding weather!,,
K/KC/KCN.xml,KCNRE01M,027604,98,,B,50,4,We had lovely weather then!,,
K/KC/KCN.xml,KCNRE01M,027604,99,,B,50,5,"And, and we only had a rain  on one day I think it was.",,
K/KC/KCN.xml,KCNRE01M,027604,100,,B,50,6,"Er, you know, like a shower, one big shower.",,
K/KC/KCN.xml,KCNRE01M,027604,101,,B,50,7,Well normal shower.,,
K/KC/KCN.xml,KCNRE01M,027604,102,,A,51,1,And it must have been cold  (()) bloody flat!,,
K/KC/KCN.xml,KCNRE01M,027604,103,,B,52,1,Mm.,,
K/KC/KCN.xml,KCNRE01M,027604,104,,A,53,1,"Must of been, cos they'd been out all day.",,
K/KC/KCN.xml,KCNRE01M,027604,105,,A,53,2,"No fire, no nothing on!",,
K/KC/KCN.xml,KCNRE01M,027604,106,,A,53,3,"And then to go home, tired and cold in an empty place, and cold and  must of been terrible!",,
K/KC/KCN.xml,KCNRE01M,027604,107,,B,54,1,"Oh I dunno if yo- you  get into bed and the blanket was on,yo- you know, you know?",,
K/KC/KCN.xml,KCNRE01M,027604,108,,B,54,2,"She said she wasn't expecting to go out, out all day (()) !",,
K/KC/KCN.xml,KCNRE01M,027604,109,,A,55,1,<laugh> Well she erm  she can't remember exactly!,,
K/KC/KCN.xml,KCNRE01M,027604,110,,B,56,1,But I mean er  she knew,,
K/KC/KCN.xml,KCNRE01M,027604,111,,A,57,1,But Rowan and her went on Boxing Day.,,
K/KC/KCN.xml,KCNRE01M,027604,112,,A,57,2,When did David and Pam go?,,
K/KC/KCN.xml,KCNRE01M,027604,113,,B,58,1,I've no idea.,,
K/KC/KCN.xml,KCNRE01M,027604,114,,A,59,1,Cos she didn't sleep here.,,
K/KC/KCN.xml,KCNRE01M,027604,115,,A,59,2,So they all must have gone out for the dinner.,,
K/KC/KCN.xml,KCNRE01M,027604,116,,A,59,3,"So they must of stayed until erm  Boxing Day, Christmas Day rather.",,
K/KC/KCN.xml,KCNRE01M,027604,117,,B,60,1,Oh they're coming here for Christmas.,,
K/KC/KCN.xml,KCNRE01M,027604,118,,A,61,1,Wish they was.,,
K/KC/KCN.xml,KCNRE01M,027604,119,,A,61,2,(()) .And they went on Boxing Day dinner.,,
K/KC/KCN.xml,KCNRE01M,027604,120,,A,61,3,They had their dinner and went!,,
K/KC/KCN.xml,KCNRE01M,027604,121,,B,62,1,I've no idea!,,
K/KC/KCN.xml,KCNRE01M,027604,122,,B,62,2,Not the foggiest!,,
K/KC/KCN.xml,KCNRE01M,027604,123,,B,62,3,Didn't they stay at the flat?,,
K/KC/KCN.xml,KCNRE01M,027604,124,,B,62,4,Somebody did!,,
K/KC/KCN.xml,KCNRE01M,027604,125,,A,63,1,"Yeah, David and Pam and Margaret all slept at the flat!",,
K/KC/KCN.xml,KCNRE01M,027604,126,,A,63,2,And they must of come over for Christmas dinner.,,
K/KC/KCN.xml,KCNRE01M,027604,127,,A,63,3,"Yes, because David tucked into his er  Christmas pudding!",,
K/KC/KCN.xml,KCNRE01M,027604,128,,A,63,4,He loved it!,,
K/KC/KCN.xml,KCNRE01M,027604,129,,A,63,5,And Pam was shouting about the bloody cholesterol!,,
K/KC/KCN.xml,KCNRE01M,027604,130,,B,64,1,<laugh> ,,
K/KC/KCN.xml,KCNRE01M,027604,131,,A,65,1,And then they had Boxing Day dinner.,,
K/KC/KCN.xml,KCNRE01M,027604,132,,A,65,2,"And David and Pam must have gone as well, cos  Margaret went with  Rowan.",,
K/KC/KCN.xml,KCNRE01M,027604,133,,A,65,3,"Up Newtown way, they were going up to Ruth.",,
K/KC/KCN.xml,KCNRE01M,027604,134,,A,65,4,And,,
K/KC/KCN.xml,KCNRE01M,027604,135,,B,66,1,Wonder where she got (()) ?,,
K/KC/KCN.xml,KCNRE01M,027604,136,,A,67,1,I shall bloody quiz her about that!,,
K/KC/KCN.xml,KCNRE01M,027604,137,,A,67,2,"And er  David and Pam must of gone the other way  you know, they'd gone their way home, and  (()) had gone her way home.",,
K/KC/KCN.xml,KCNRE01M,027604,138,,A,67,3,But er  and then Astra was here and she was going bloody North!,,
K/KC/KCN.xml,KCNRE01M,027604,139,,A,67,4,She goes ey and it's colder  <laughing> up there </laughing> !,,
K/KC/KCN.xml,KCNRE01M,027604,140,,A,67,5,Well she found it cold here and she (()) .,,
K/KC/KCN.xml,KCNRE01M,027604,141,,A,67,6,Oh it was hysterical because it was blowing a gale!,,
K/KC/KCN.xml,KCNRE01M,027604,142,,A,67,7,Violet and me were over cleaning your flat.,,
K/KC/KCN.xml,KCNRE01M,027604,143,,A,67,8,"That was the day you was taken into hospital  and she was in the bed, cos they were on their way down  so we were changing  <laugh> the bloody beds!",,
K/KC/KCN.xml,KCNRE01M,027604,144,,A,67,9,And you come down through the alley way  and you could not keep your feet on the floor!,,
K/KC/KCN.xml,KCNRE01M,027604,145,,A,67,10,You could move!,,
K/KC/KCN.xml,KCNRE01M,027604,146,,A,67,11,"And we'd got these bags,(()) , I said  just bang all the sheets into bin bags, we can wash them next week if you think I'm starting!",,
K/KC/KCN.xml,KCNRE01M,027604,147,,A,67,12,"But make sure, you know, you  well you take over the house, so we know what's in them in case they get thrown out with the bloody rubbish!",,
K/KC/KCN.xml,KCNRE01M,027604,148,,A,67,13,So we put them all into bin bags and we was trying to carry these bin bags  <laughing> so the wind was taking them like balloons </laughing> !,,
K/KC/KCN.xml,KCNRE01M,027604,149,,A,67,14,And you were hanging on  and trying to keep your feet on the floor!,,
K/KC/KCN.xml,KCNRE01M,027604,150,,A,67,15,"God, I laughed!",,
K/KC/KCN.xml,KCNRE01M,027604,151,,A,67,16,And then er  they came.,,
K/KC/KCN.xml,KCNRE01M,027604,152,,A,67,17,I can't remember what time or anything about it.,,
K/KC/KCN.xml,KCNRE01M,027604,153,,A,67,18,I think they must have come to the flat.,,
K/KC/KCN.xml,KCNRE01M,027604,154,,A,67,19,They'd been for a meal and they came to the flat and they rung us to say they were there.,,
K/KC/KCN.xml,KCNRE01M,027604,155,,A,67,20,"Something like that, I can't remember.",,
K/KC/KCN.xml,KCNRE01M,027604,156,,A,67,21,"And then, the next day they came over.",,
K/KC/KCN.xml,KCNRE01M,027604,157,,B,68,1,I think they came that night.,,
K/KC/KCN.xml,KCNRE01M,027604,158,,A,69,1,The next day they came over.,,
K/KC/KCN.xml,KCNRE01M,027604,159,,A,69,2,And this gale was still blowing!,,
K/KC/KCN.xml,KCNRE01M,027604,160,,A,69,3,And it was blowing!,,
K/KC/KCN.xml,KCNRE01M,027604,161,,A,69,4,You just couldn't,,
K/KC/KCN.xml,KCNRE01M,027604,162,,B,70,1,Well I dare say they went back to the hospital!,,
K/KC/KCN.xml,KCNRE01M,027604,163,,A,71,1,"No, they didn't!",,
K/KC/KCN.xml,KCNRE01M,027604,164,,A,71,2,"No they didn't get, be there till eight!",,
K/KC/KCN.xml,KCNRE01M,027604,165,,A,71,3,Just eight-ish something like that.,,
K/KC/KCN.xml,KCNRE01M,027604,166,,A,71,4,Cos they'd been for a meal on the way as well!,,
K/KC/KCN.xml,KCNRE01M,027604,167,,A,71,5,Cos I've said come over for supper.,,
K/KC/KCN.xml,KCNRE01M,027604,168,,A,71,6,"No, they didn't want supper.",,
K/KC/KCN.xml,KCNRE01M,027604,169,,A,71,7,Cos they'd had this meal.,,
K/KC/KCN.xml,KCNRE01M,027604,170,,A,71,8,"And erm  then the next day  they came over  and David was laughing, he said, do you, do you know the alley way down between  (()) he said, well it blew it her up right against that bloody wall he said!",,
K/KC/KCN.xml,KCNRE01M,027604,171,,A,71,9,Well Aunty couldn't move he said!,,
K/KC/KCN.xml,KCNRE01M,027604,172,,A,71,10,"<laughing> He  I   </laughing> and I said, and you laughed at her?",,
K/KC/KCN.xml,KCNRE01M,027604,173,,A,71,11,Course I did  <laughing> he said </laughing> !,,
K/KC/KCN.xml,KCNRE01M,027604,174,,A,71,12,"And I said, did you help her?",,
K/KC/KCN.xml,KCNRE01M,027604,175,,A,71,13,"No, I didn't.",,
K/KC/KCN.xml,KCNRE01M,027604,176,,A,71,14,Let her battle it out he said!,,
K/KC/KCN.xml,KCNRE01M,027604,177,,A,71,15,Well they came over here then and they'd been up  (()) and they come back  with Gillian and all that and they stayed.,,
K/KC/KCN.xml,KCNRE01M,027604,178,,A,71,16,And they went from here about  nine-ish I suppose?,,
K/KC/KCN.xml,KCNRE01M,027604,179,,A,71,17,They'd had supper anyway.,,
K/KC/KCN.xml,KCNRE01M,027604,180,,A,71,18,Then they were going over and they were gonna go to bed.,,
K/KC/KCN.xml,KCNRE01M,027604,181,,A,71,19,"They'd been to the hospital, and they'd been over the flat so I said to them  well pop the blankets on  and come over here then and have your supper  and go back.",,
K/KC/KCN.xml,KCNRE01M,027604,182,,A,71,20,And the beds will be nice and warm for you to get into.,,
K/KC/KCN.xml,KCNRE01M,027604,183,,A,71,21,"But anyway, they left here about nine o'clock.",,
K/KC/KCN.xml,KCNRE01M,027604,184,,A,71,22,Well  she'd gone out through the door and the wind took her down the  <laughing> bloody street!,,
K/KC/KCN.xml,KCNRE01M,027604,185,,A,71,23,"I said to  (()) though, he said she was going there another way!",,
K/KC/KCN.xml,KCNRE01M,027604,186,,A,71,24,And David was there  (()),,
K/KC/KCN.xml,KCNRE01M,027604,187,,B,72,1,,,
K/KC/KCN.xml,KCNRE01M,027604,188,,B,72,2,(()) ,,
K/KC/KCN.xml,KCNRE01M,027604,189,,B,72,3,,,
K/KC/KCN.xml,KCNRE01M,027604,190,,A,73,1,was laughing !,,
K/KC/KCN.xml,KCNRE01M,027604,191,,A,73,2,And it was just   <laughing> she was running with it!,,
K/KC/KCN.xml,KCNRE01M,027604,192,,A,73,3,There's just her battling against it </laughing> !,,
K/KC/KCN.xml,KCNRE01M,027604,193,,B,74,1,They have mid-winter days just like our high summer!,,
K/KC/KCN.xml,KCNRE01M,027604,194,,A,75,1,<laugh> ,,
K/KC/KCN.xml,KCNRE01M,027604,195,,B,76,1,It was lovely!,,
K/KC/KCN.xml,KCNRE01M,027604,196,,A,77,1,Oh and we laughed about it!,,
K/KC/KCN.xml,KCNRE01M,027604,197,,A,77,2,"And I said, better go and  <laughing> collect her!",,
K/KC/KCN.xml,KCNRE01M,027604,198,,A,77,3,But David said  (()) look at  (()) shifting </laughing> !,,
K/KC/KCN.xml,KCNRE01M,027604,199,,B,78,1,"Yeah  but er you see  on Christmas Day  children were going about in bikinis and  and shorts (()) , or no socks or so-",,
K/KC/KCN.xml,KCNRE01M,027604,200,,A,79,1,Mm.,,
K/KC/KCN.xml,KCNRE01M,027604,201,,B,80,1,"I couldn't, you know,i- ,i- , it's difficult to put it in your head, like when I was there!",,
K/KC/KCN.xml,KCNRE01M,027604,202,,B,80,2,"Oh, it's Christmas Day you know?",,
K/KC/KCN.xml,KCNRE01M,027604,203,,A,81,1,Mm.,,
K/KC/KCN.xml,KCNRE01M,027604,204,,B,82,1,Christmas Day!,,
K/KC/KCN.xml,KCNRE01M,027604,205,,B,82,2,"And I get us up in the morning now  and, she  said  she said the temperature rises to  sometimes a hundred and twenty in the summer!",,
K/KC/KCN.xml,KCNRE01M,027604,206,,B,82,3,And if it's a very hot day you try to stay in.,,
K/KC/KCN.xml,KCNRE01M,027604,207,,A,83,1,"Yeah, but it isn't summer yet!",,
K/KC/KCN.xml,KCNRE01M,027604,208,,B,84,1,Mm?,,
K/KC/KCN.xml,KCNRE01M,027604,209,,A,85,1,It isn't summer yet!,,
K/KC/KCN.xml,KCNRE01M,027604,210,,B,86,1,No!,,
K/KC/KCN.xml,KCNRE01M,027604,211,,B,86,2,"But if, if it'll do that at mid-summer i- , it",,
K/KC/KCN.xml,KCNRE01M,027604,212,,A,87,1,It's about ninety there now!,,
K/KC/KCN.xml,KCNRE01M,027604,213,,A,87,2,Eighties.,,
K/KC/KCN.xml,KCNRE01M,027604,214,,B,88,1,Yes.,,
K/KC/KCN.xml,KCNRE01M,027604,215,,B,88,2,"Eighty to ninety, sure to be!",,
K/KC/KCN.xml,KCNRE01M,027604,216,,B,88,3,And that's one of our terribly hot days!,,
K/KC/KCN.xml,KCNRE01M,027604,217,,B,88,4,"Of course, everywhere i- ,i- , it's all air conditioned and  and it's, obviously.",,
K/KC/KCN.xml,KCNRE01M,027604,218,,B,88,5,Definitely mustn't open a window!,,
K/KC/KCN.xml,KCNRE01M,027604,219,,B,88,6,"Then the, daren't open the window!",,
K/KC/KCN.xml,KCNRE01M,027604,220,,B,88,7,Cos the flies will come in.,,
K/KC/KCN.xml,KCNRE01M,027604,221,,A,89,1,Well she'll have bloody shock if she was here in the summer then!,,
K/KC/KCN.xml,KCNRE01M,027604,222,,B,90,1,"Yes, I think.",,
K/KC/KCN.xml,KCNRE01M,027604,223,,B,90,2,"Of course, I don't know, perhaps they",,
K/KC/KCN.xml,KCNRE01M,027604,224,,A,91,1,Couldn't live in the winter!,,
K/KC/KCN.xml,KCNRE01M,027604,225,,B,92,1,Perhaps their flies are different to ours.<laugh>,,
K/KC/KCN.xml,KCNRE01M,027604,226,,A,93,1,"They are, they're the, the same.",,
K/KC/KCN.xml,KCNRE01M,027604,227,,B,94,1,Th- They're mosquitoes.,,
K/KC/KCN.xml,KCNRE01M,027604,228,,B,94,2,"Now then, she  (()) mosquitoes so they, they bite (()) .",,
K/KC/KCN.xml,KCNRE01M,027604,229,,A,95,1,Anyway you get a mosquito bite (()) .,,
K/KC/KCN.xml,KCNRE01M,027604,230,,B,96,1,"Yeah but, she said they don't da- ,the- they bite you and it's got poison if you're not careful!",,
K/KC/KCN.xml,KCNRE01M,027604,231,,A,97,1,I could never live with the window shut!,,
K/KC/KCN.xml,KCNRE01M,027604,232,,B,98,1,"Of course, the room is air conditioned  all the time.",,
K/KC/KCN.xml,KCNRE01M,027604,233,,B,98,2,They have the batteries going and all.,,
K/KC/KCN.xml,KCNRE01M,027604,234,,A,99,1,Yeah cos they have it  (()) keep pushing!,,
K/KC/KCN.xml,KCNRE01M,027604,235,,A,99,2,Same here!,,
K/KC/KCN.xml,KCNRE01M,027604,236,,A,99,3,One place to another!,,
K/KC/KCN.xml,KCNRE01M,027604,237,,B,100,1,"Yeah, but it- , it's circulating i- , isn't it?",,
K/KC/KCN.xml,KCNRE01M,027604,238,,A,101,1,"Yeah , but it's all the same.",,
K/KC/KCN.xml,KCNRE01M,027604,239,,A,101,2,(()) not too nice.,,
K/KC/KCN.xml,KCNRE01M,027604,240,,B,102,1,,,
K/KC/KCN.xml,KCNRE01M,027604,241,,B,102,2,(()) ,,
K/KC/KCN.xml,KCNRE01M,027604,242,,B,102,3,,,
K/KC/KCN.xml,KCNRE01M,027604,243,,A,103,1,It isn't fresh!,,
K/KC/KCN.xml,KCNRE01M,027604,244,,A,103,2,I was saying Danny the other day  do you remember the time he came and got out his in there?,,
K/KC/KCN.xml,KCNRE01M,027604,245,,A,103,3,"I would get a piece of erm  well I got a piece in the greenhouse  it wouldn't worthy of it then, but it doesn't matter!",,
K/KC/KCN.xml,KCNRE01M,027604,246,,A,103,4,Piece of board  and fix in the doorway  and fix it open.,,
K/KC/KCN.xml,KCNRE01M,027604,247,,A,103,5,"Put it high enough so that the cats wouldn't come, but leave it then.",,
K/KC/KCN.xml,KCNRE01M,027604,248,,A,103,6,It's just a big window open.,,
K/KC/KCN.xml,KCNRE01M,027604,249,,A,103,7,"Cos then yo- , once you have the doors closed as low as that  cos no air gets in!",,
K/KC/KCN.xml,KCNRE01M,027604,250,,B,104,1,"No, actually cos it's not air",,
K/KC/KCN.xml,KCNRE01M,027604,251,,A,105,1,We opened the,,
K/KC/KCN.xml,KCNRE01M,027604,252,,B,106,1,conditioned here!,,
K/KC/KCN.xml,KCNRE01M,027604,253,,B,106,2,They are there!,,
K/KC/KCN.xml,KCNRE01M,027604,254,,A,107,1,You open the top  and then let the cats in at the bottom!,,
K/KC/KCN.xml,KCNRE01M,027604,255,,B,108,1,"Yeah, that's it!",,
K/KC/KCN.xml,KCNRE01M,027604,256,,B,108,2,"And, and circulate air, you see.",,
K/KC/KCN.xml,KCNRE01M,027604,257,,A,109,1,So I put a board across there.,,
K/KC/KCN.xml,KCNRE01M,027604,258,,B,110,1,They've got double windows.,,
K/KC/KCN.xml,KCNRE01M,027604,259,,B,110,2,"Like, they got the window  and then they've got erm  a, a  sliding",,
K/KC/KCN.xml,KCNRE01M,027604,260,,A,111,1,Sliding window inside.,,
K/KC/KCN.xml,KCNRE01M,027604,261,,B,112,1,Yeah.,,
K/KC/KCN.xml,KCNRE01M,027604,262,,B,112,2,"Like a, a, a net  to keep the flies out.",,
K/KC/KCN.xml,KCNRE01M,027604,263,,B,112,3,You can open the outside window.,,
K/KC/KCN.xml,KCNRE01M,027604,264,,A,113,1,What do they call them?,,
K/KC/KCN.xml,KCNRE01M,027604,265,,A,113,2,Yeah.,,
K/KC/KCN.xml,KCNRE01M,027604,266,,A,113,3,Erm,,
K/KC/KCN.xml,KCNRE01M,027604,267,,B,114,1,Mosquito thing.,,
K/KC/KCN.xml,KCNRE01M,027604,268,,B,114,2,Well we used to have them in Middle House.,,
K/KC/KCN.xml,KCNRE01M,027604,269,,B,114,3,"Erm, but ours was a piece of  frame work and a  grating on it, and you stuck that in the window, when you opened the window you push that in  so the air could come in and  mosquitoes couldn't.",,
K/KC/KCN.xml,KCNRE01M,027604,270,,B,114,4,"You used to mo- , mosquitoes dreadful at Middle House when the lake was there.",,
K/KC/KCN.xml,KCNRE01M,027604,271,,A,115,1,It's the damp  warm and damp.,,
K/KC/KCN.xml,KCNRE01M,027604,272,,B,116,1,"No, the lake was mouldy you see!",,
K/KC/KCN.xml,KCNRE01M,027604,273,,A,117,1,"Yeah, oh!",,
K/KC/KCN.xml,KCNRE01M,027604,274,,B,118,1,"Stale, dirty water!",,
K/KC/KCN.xml,KCNRE01M,027604,275,,B,118,2,Was a breeding  place.,,
K/KC/KCN.xml,KCNRE01M,027604,276,,B,118,3,And we'd be out in the middle of that!,,
K/KC/KCN.xml,KCNRE01M,027604,277,,B,118,4,Buzzzz All in your face!,,
K/KC/KCN.xml,KCNRE01M,027604,278,,A,119,1,"Mind you, you do everywhere!",,
K/KC/KCN.xml,KCNRE01M,027604,279,,B,120,1,"Yes, but that was a breeding centre there.",,
K/KC/KCN.xml,KCNRE01M,027604,280,,B,120,2,It was  they were back and forward there by the thousands!,,
K/KC/KCN.xml,KCNRE01M,027604,281,,A,121,1,"<sighing> Oh I knew </sighing> , I shall have to go and er  put my bits back together again!",,
K/KC/KCN.xml,KCNRE01M,027604,282,,A,121,2,I got the clock all on the floor now!,,
K/KC/KCN.xml,KCNRE01M,027604,283,,B,122,1,"Well, yes.",,
K/KC/KCN.xml,KCNRE01M,027604,284,,A,123,1,Anyone put their bloody foot on it!,,
K/KC/KCN.xml,KCNRE01M,027604,285,,A,123,2,"Oh well, the sky is looking a lot brighter.",,
K/KC/KCN.xml,KCNRE01M,027604,286,,A,123,3,Isn't it?,,
K/KC/KCN.xml,KCNRE01M,027604,287,,B,124,1,Well it's still got a lot to do.,,
K/KC/KCN.xml,KCNRE01M,027604,288,,A,125,1,"Er, oh well it's er",,
K/KC/KCN.xml,KCNRE01M,027604,289,,B,126,1,That's if we've got it back!,,
K/KC/KCN.xml,KCNRE01M,027604,290,,A,127,1,It's about somewhere!,,
K/KC/KCN.xml,KCNRE01M,027604,291,,B,128,1,It's poking through somewhere.,,
K/KC/KCN.xml,KCNRE01M,027604,292,,A,129,1,Oh God!,,
K/KC/KCN.xml,KCNRE01M,027604,293,,A,129,2,I shall be satisfied that er er these things are shooting up (()) .,,
K/KC/KCN.xml,KCNRE01M,027604,294,,B,130,1,"I, I  (()) in, in the night.",,
K/KC/KCN.xml,KCNRE01M,027604,295,,A,131,1,"Good God, that one is going now!",,
K/KC/KCN.xml,KCNRE01M,027604,296,,A,131,2,Don't know where the hell it's going!,,
K/KC/KCN.xml,KCNRE01M,027604,297,,A,131,3,That one's going right up!,,
K/KC/KCN.xml,KCNRE01M,027604,298,,A,131,4,It's nearly up on the fence!,,
K/KC/KCN.xml,KCNRE01M,027604,299,,B,132,1,When it was a (()) .,,
K/KC/KCN.xml,KCNRE01M,027604,300,,A,133,1,What?,,
K/KC/KCN.xml,KCNRE01M,027604,301,,B,134,1,The clematis.,,
K/KC/KCN.xml,KCNRE01M,027604,302,,A,135,1,From erm  Wales.,,
K/KC/KCN.xml,KCNRE01M,027604,303,,A,135,2,It's sort of pale innit?,,
K/KC/KCN.xml,KCNRE01M,027604,304,,B,136,1,Which one?,,
K/KC/KCN.xml,KCNRE01M,027604,305,,B,136,2,Which one?,,
K/KC/KCN.xml,KCNRE01M,027604,306,,A,137,1,And the daffs are still looking nice!,,
