swda_filename,ptb_basename,conversation_no,transcript_index,act_tag,caller,turn_index,subutterance_index,text,pos,trees
K/KE/KE2.xml,KE2RE012,038501,0,,A,1,1,"Oh thanks very much, right I'll just go and get the paper",,
K/KE/KE2.xml,KE2RE012,038501,1,,B,2,1,Go and get the paper then okay,,
K/KE/KE2.xml,KE2RE012,038501,2,,A,3,1,Yep,,
K/KE/KE2.xml,KE2RE012,038501,3,,B,4,1,okay,,
K/KE/KE2.xml,KE2RE012,038501,4,,A,5,1,"I don't know where, I thought I left my case here, I don't know what I've done with my case that's all, it's probably downstairs  oh  oh I don't know, mm  still not able to find it  I think I'd better put these plants out  mm that's right, oh, mm  that's not there  right, I'd better switch this, the tape off cos there's not much, be much conversation now for a while",,
