swda_filename,ptb_basename,conversation_no,transcript_index,act_tag,caller,turn_index,subutterance_index,text,pos,trees
K/KE/KE2.xml,KE2RE049,039702,0,,A,1,1,Poker stake is ante A N T E.,,
K/KE/KE2.xml,KE2RE049,039702,1,,B,2,1,Is it?,,
K/KE/KE2.xml,KE2RE049,039702,2,,A,3,1,Mm,,
K/KE/KE2.xml,KE2RE049,039702,3,,B,4,1,Take an ante bet or something,,
K/KE/KE2.xml,KE2RE049,039702,4,,A,5,1,"Well, mm ",,
K/KE/KE2.xml,KE2RE049,039702,5,,B,6,1,"ante post betting that's, that's erm something, no",,
K/KE/KE2.xml,KE2RE049,039702,6,,A,7,1,well that's not that's anti A N T I that means erm ,,
K/KE/KE2.xml,KE2RE049,039702,7,,B,8,1,No it isn't ante A N T E ante post betting on a race,,
K/KE/KE2.xml,KE2RE049,039702,8,,A,9,1,Before a race?,,
K/KE/KE2.xml,KE2RE049,039702,9,,B,10,1,"I don't know when it's for, but it is for when, that's what it's called, you get a list  --",,
K/KE/KE2.xml,KE2RE049,039702,10,,B,10,2,--and it is sort of ante,,
K/KE/KE2.xml,KE2RE049,039702,11,,A,11,1,"It's like ante natal, before",,
K/KE/KE2.xml,KE2RE049,039702,12,,B,12,1,"No it's not, oh could be, ante natal, yes",,
K/KE/KE2.xml,KE2RE049,039702,13,,A,13,1,"before the birth before the, before the race ",,
K/KE/KE2.xml,KE2RE049,039702,14,,B,14,1,"but not ante, you thought that was A N T A or something you put the other thing with anti, but it isn't, or are we at cross purposes, you don't know what you're talking about to me and I don't know what I'm talking about to you so <laugh> ",,
