swda_filename,ptb_basename,conversation_no,transcript_index,act_tag,caller,turn_index,subutterance_index,text,pos,trees
K/KS/KSV.xml,KSVRE00A,043311,0,,A,1,1,What do you mean you'll never beat me?,,
K/KS/KSV.xml,KSVRE00A,043311,1,,B,2,1,"Come on let's go,<cough> <sniff> oh goodness",,
K/KS/KSV.xml,KSVRE00A,043311,2,,A,3,1,"Yeah, have a game if you like",,
K/KS/KSV.xml,KSVRE00A,043311,3,,B,4,1,"It won't, will it?",,
K/KS/KSV.xml,KSVRE00A,043311,4,,A,5,1,"End of February, March, April,<yawning> God it's nearly the end of May before I can start playing again </yawning>",,
K/KS/KSV.xml,KSVRE00A,043311,5,,B,6,1,Oh look,,
K/KS/KSV.xml,KSVRE00A,043311,6,,A,7,1,<yawn> ,,
K/KS/KSV.xml,KSVRE00A,043311,7,,B,8,1,don't go into me you bugger will you?,,
K/KS/KSV.xml,KSVRE00A,043311,8,,A,9,1,Went down and had a fish at Hills Bay on Wednesday,,
K/KS/KSV.xml,KSVRE00A,043311,9,,B,10,1,Why?,,
K/KS/KSV.xml,KSVRE00A,043311,10,,A,11,1,What do you mean why?,,
K/KS/KSV.xml,KSVRE00A,043311,11,,A,11,2,Cos I wanted to,,
K/KS/KSV.xml,KSVRE00A,043311,12,,B,12,1,You fished in Hills Bay?,,
K/KS/KSV.xml,KSVRE00A,043311,13,,A,13,1,Yeah,,
K/KS/KSV.xml,KSVRE00A,043311,14,,B,14,1,What with?,,
K/KS/KSV.xml,KSVRE00A,043311,15,,A,15,1,Er ragworm,,
K/KS/KSV.xml,KSVRE00A,043311,16,,B,16,1,Oh yes,,
K/KS/KSV.xml,KSVRE00A,043311,17,,A,17,1,"Not a damn thing, I froze my nuts off, it was freezing.",,
K/KS/KSV.xml,KSVRE00A,043311,18,,B,18,1,Were you the only person fishing in Hills Bay?,,
K/KS/KSV.xml,KSVRE00A,043311,19,,A,19,1,"Yeah, me and my friend, were",,
K/KS/KSV.xml,KSVRE00A,043311,20,,B,20,1,Oh,,
K/KS/KSV.xml,KSVRE00A,043311,21,,A,21,1,the only two,,
K/KS/KSV.xml,KSVRE00A,043311,22,,B,22,1,Is he a good fisherman?,,
K/KS/KSV.xml,KSVRE00A,043311,23,,A,23,1,Very,,
K/KS/KSV.xml,KSVRE00A,043311,24,,B,24,1,Is he?,,
K/KS/KSV.xml,KSVRE00A,043311,25,,A,25,1,"Oh he's got all proper equipment, he is  (())",,
K/KS/KSV.xml,KSVRE00A,043311,26,,B,26,1,"(()) and he, he, even he didn't catch anything?",,
K/KS/KSV.xml,KSVRE00A,043311,27,,A,27,1,He didn't catch any either.,,
K/KS/KSV.xml,KSVRE00A,043311,28,,B,28,1,"Oh, you see you've got to get  (())",,
K/KS/KSV.xml,KSVRE00A,043311,29,,A,29,1,We gave up after two hours it was too cold,,
K/KS/KSV.xml,KSVRE00A,043311,30,,B,30,1,got to get me with the (()),,
K/KS/KSV.xml,KSVRE00A,043311,31,,A,31,1,Yeah it was just,,
K/KS/KSV.xml,KSVRE00A,043311,32,,B,32,1,I'm a (()),,
K/KS/KSV.xml,KSVRE00A,043311,33,,A,33,1,just freezing.,,
K/KS/KSV.xml,KSVRE00A,043311,34,,B,34,1,"When Ted took me out into the sea, we had fifty fish",,
K/KS/KSV.xml,KSVRE00A,043311,35,,A,35,1,"Oh God yes in the middle of the sea, yeah, you get loads",,
K/KS/KSV.xml,KSVRE00A,043311,36,,B,36,1,Ah,,
K/KS/KSV.xml,KSVRE00A,043311,37,,A,37,1,but we were just down there,,
K/KS/KSV.xml,KSVRE00A,043311,38,,B,38,1,What?,,
K/KS/KSV.xml,KSVRE00A,043311,39,,A,39,1,fish were down there,,
K/KS/KSV.xml,KSVRE00A,043311,40,,B,40,1,Yeah,,
K/KS/KSV.xml,KSVRE00A,043311,41,,A,41,1,it was a bit cold,,
K/KS/KSV.xml,KSVRE00A,043311,42,,B,42,1,Well er,,
K/KS/KSV.xml,KSVRE00A,043311,43,,A,43,1,puncturing ragworms was disgusting,,
K/KS/KSV.xml,KSVRE00A,043311,44,,B,44,1,Oh it's good,,
K/KS/KSV.xml,KSVRE00A,043311,45,,A,45,1,you hold the mouths open,,
K/KS/KSV.xml,KSVRE00A,043311,46,,B,46,1,Oh yeah,,
K/KS/KSV.xml,KSVRE00A,043311,47,,A,47,1,"and stick it down, oh yuck",,
K/KS/KSV.xml,KSVRE00A,043311,48,,B,48,1,Hope they don't bite you,,
K/KS/KSV.xml,KSVRE00A,043311,49,,A,49,1,"Oh yeah, exactly",,
K/KS/KSV.xml,KSVRE00A,043311,50,,B,50,1,Is there any spare boxes in there?,,
K/KS/KSV.xml,KSVRE00A,043311,51,,B,50,2,You look and see if there's any spare boxes  (()),,
K/KS/KSV.xml,KSVRE00A,043311,52,,A,51,1,Yeah there is,,
K/KS/KSV.xml,KSVRE00A,043311,53,,B,52,1,are there?,,
K/KS/KSV.xml,KSVRE00A,043311,54,,A,53,1,Yeah,,
K/KS/KSV.xml,KSVRE00A,043311,55,,B,54,1,"Oh good, coming down here then boyos, there we go, whoops-a- daisy.",,
K/KS/KSV.xml,KSVRE00A,043311,56,,A,55,1,Have a look at some really  (()) knives,,
K/KS/KSV.xml,KSVRE00A,043311,57,,B,56,1,Don't want to thanks,,
K/KS/KSV.xml,KSVRE00A,043311,58,,A,57,1,"They're great prices, they got some lovely penknives",,
K/KS/KSV.xml,KSVRE00A,043311,59,,B,58,1,look at  (()) knives,,
K/KS/KSV.xml,KSVRE00A,043311,60,,A,59,1,Have a look at these penknives,,
K/KS/KSV.xml,KSVRE00A,043311,61,,B,60,1,I want a  (()) what else am I going for you?,,
K/KS/KSV.xml,KSVRE00A,043311,62,,A,61,1,Erm,,
K/KS/KSV.xml,KSVRE00A,043311,63,,B,62,1,"I'm going for a tank stopping unit, look out, get that window down boy",,
K/KS/KSV.xml,KSVRE00A,043311,64,,A,63,1,"Oh meant you, erm a vinegar jar",,
K/KS/KSV.xml,KSVRE00A,043311,65,,B,64,1,"Oh yes that's right, is that as fast down there?",,
K/KS/KSV.xml,KSVRE00A,043311,66,,B,64,2,Oh good,,
K/KS/KSV.xml,KSVRE00A,043311,67,,A,65,1,Yes there's loads,,
K/KS/KSV.xml,KSVRE00A,043311,68,,B,66,1,loads of spaces that's good,,
K/KS/KSV.xml,KSVRE00A,043311,69,,A,67,1,Well you're looking for a new penknife so look at the penknives,,
K/KS/KSV.xml,KSVRE00A,043311,70,,B,68,1,"No I'm not, I'm not looking for a new penknife at all boy",,
K/KS/KSV.xml,KSVRE00A,043311,71,,A,69,1,"Ah there we go, there's loads there",,
K/KS/KSV.xml,KSVRE00A,043311,72,,B,70,1,Where?,,
K/KS/KSV.xml,KSVRE00A,043311,73,,A,71,1,Why is it everyone goes for the most difficult car parking spot?,,
K/KS/KSV.xml,KSVRE00A,043311,74,,B,72,1,"Why, I don't know",,
K/KS/KSV.xml,KSVRE00A,043311,75,,A,73,1,Ha I don't believe,,
K/KS/KSV.xml,KSVRE00A,043311,76,,B,74,1,"Ah phew, you?",,
K/KS/KSV.xml,KSVRE00A,043311,77,,A,75,1,No it's not me,,
K/KS/KSV.xml,KSVRE00A,043311,78,,B,76,1,Sure?,,
K/KS/KSV.xml,KSVRE00A,043311,79,,B,76,2,It must be me then.,,
K/KS/KSV.xml,KSVRE00A,043311,80,,A,77,1,Blooming cheek.,,
