swda_filename,ptb_basename,conversation_no,transcript_index,act_tag,caller,turn_index,subutterance_index,text,pos,trees
K/KB/KB9.xml,KB9RE007,062104,0,,A,1,1,"Hello, hello, what you doing?",,
K/KB/KB9.xml,KB9RE007,062104,1,,A,1,2,What are yous doing?,,
K/KB/KB9.xml,KB9RE007,062104,2,,A,1,3,"Eh, what you doing to mummy, eh?",,
K/KB/KB9.xml,KB9RE007,062104,3,,A,1,4,What you doing to mummy?,,
K/KB/KB9.xml,KB9RE007,062104,4,,A,1,5,What are you doing to mummy?,,
K/KB/KB9.xml,KB9RE007,062104,5,,B,2,1,Urgh who's that in there?,,
K/KB/KB9.xml,KB9RE007,062104,6,,A,3,1,"Oh  right we ready for a run, eh?",,
K/KB/KB9.xml,KB9RE007,062104,7,,A,3,2,"Is that your scarf, is that your scarf?",,
K/KB/KB9.xml,KB9RE007,062104,8,,B,4,1,"Come on puss, shh, shh, shh",,
K/KB/KB9.xml,KB9RE007,062104,9,,A,5,1,Where's it gone Rebecca?,,
K/KB/KB9.xml,KB9RE007,062104,10,,A,5,2,Where's pussy cat?,,
K/KB/KB9.xml,KB9RE007,062104,11,,B,6,1,"puss, puss, puss, puss",,
K/KB/KB9.xml,KB9RE007,062104,12,,A,7,1,<laughing> Where's it gone </laughing> ?,,
K/KB/KB9.xml,KB9RE007,062104,13,,B,8,1,is he there?,,
K/KB/KB9.xml,KB9RE007,062104,14,,A,9,1,Can you see him?,,
K/KB/KB9.xml,KB9RE007,062104,15,,A,9,2,Can you see him?,,
K/KB/KB9.xml,KB9RE007,062104,16,,B,10,1,Where's the cat?,,
K/KB/KB9.xml,KB9RE007,062104,17,,A,11,1,"Go on out, out cat <shooing away>",,
K/KB/KB9.xml,KB9RE007,062104,18,,B,12,1,<laugh> where's he gone?,,
K/KB/KB9.xml,KB9RE007,062104,19,,B,12,2,What's that?,,
K/KB/KB9.xml,KB9RE007,062104,20,,B,12,3,"Ooh big lorry, big lorry, int it?",,
K/KB/KB9.xml,KB9RE007,062104,21,,B,12,4,"Eh, see, what you been doing, eh?",,
K/KB/KB9.xml,KB9RE007,062104,22,,B,12,5,"What you been doing, tell me, did your daddy, did you talk to daddy?",,
K/KB/KB9.xml,KB9RE007,062104,23,,B,12,6,"Eh, did you talk to daddy?",,
K/KB/KB9.xml,KB9RE007,062104,24,,B,12,7,"Oops stuck, is that stuck?",,
K/KB/KB9.xml,KB9RE007,062104,25,,B,12,8,"There we go, are you alright daddy?",,
K/KB/KB9.xml,KB9RE007,062104,26,,B,12,9,"Are you asking alright, ask daddy if he's alright, are you alright daddy?",,
K/KB/KB9.xml,KB9RE007,062104,27,,B,12,10,"Come home to Rebecca, you tell daddy, ask daddy if he's alright, you do it, alright,<laughing> you alright </laughing> , say bye, bye, bye, bye  say bye, bye to daddy  ooh  bye, bye, daddy, say bye, bye to daddy, you alright, yes  daddy alright, daddy alright  what's in there?",,
K/KB/KB9.xml,KB9RE007,062104,28,,B,12,11,"No it's stuck, ooh stuck  int it stuck, stuck  stuck, stuck  stuck, stuck,st- tt, tt, stuck  what's that?",,
K/KB/KB9.xml,KB9RE007,062104,29,,B,12,12,"Ooh, ooh  What's on there?",,
K/KB/KB9.xml,KB9RE007,062104,30,,B,12,13,Eh?,,
K/KB/KB9.xml,KB9RE007,062104,31,,B,12,14,"That's Houses of Parliament that is, okay  <cough> then, okay  talk to daddy  what have you got, is that your ball?",,
K/KB/KB9.xml,KB9RE007,062104,32,,B,12,15,"Wee, catch, catch, ooh  kick  kick, you're spilling your milk, ta  is that your milk?",,
K/KB/KB9.xml,KB9RE007,062104,33,,B,12,16,"La, la, la, la  ooh is it heavy?",,
K/KB/KB9.xml,KB9RE007,062104,34,,B,12,17,Ooh is it heavy?,,
K/KB/KB9.xml,KB9RE007,062104,35,,B,12,18,Where's your book?,,
K/KB/KB9.xml,KB9RE007,062104,36,,B,12,19,"Let's have a look at your book, ooh Rebecca, ooh three little kittens, three little kittens, look at the pussy cats, what are they, pussy cats?",,
K/KB/KB9.xml,KB9RE007,062104,37,,B,12,20,"Yeah a bird, isn't it, that's a bird, that's a cat and that's a mitten  yeah, its feet, its feet  yeah, feet  what's that?",,
K/KB/KB9.xml,KB9RE007,062104,38,,B,12,21,"His tail, is that pussy's tail?",,
K/KB/KB9.xml,KB9RE007,062104,39,,B,12,22,"Ooh some more pussy cats, what's that one?",,
K/KB/KB9.xml,KB9RE007,062104,40,,B,12,23,"Boogie, boogie, ooh you're dancing, you clever girl, ooh  Ribena Berries  look at the horse Rebecca, the horse.",,
