swda_filename,ptb_basename,conversation_no,transcript_index,act_tag,caller,turn_index,subutterance_index,text,pos,trees
K/KB/KBD.xml,KBDRE00F,064204,0,,A,1,1,Yeah.,,
K/KB/KBD.xml,KBDRE00F,064204,1,,A,1,2,I said to him on erm  su- er sa- Saturday night.,,
K/KB/KBD.xml,KBDRE00F,064204,2,,A,1,3,"Oh well, he said to me on Saturday he said  do it Thursday  after",,
K/KB/KBD.xml,KBDRE00F,064204,3,,B,2,1,Yeah.,,
K/KB/KBD.xml,KBDRE00F,064204,4,,A,3,1,"I say, so I said, well I'll arrange for a delivery.",,
K/KB/KBD.xml,KBDRE00F,064204,5,,A,3,2,"But, having said that  he's not the most reliable  person in the world.",,
K/KB/KBD.xml,KBDRE00F,064204,6,,B,4,1,Have you given Peter your order?,,
K/KB/KBD.xml,KBDRE00F,064204,7,,A,5,1,Yeah.,,
K/KB/KBD.xml,KBDRE00F,064204,8,,B,6,1,Oh.,,
K/KB/KBD.xml,KBDRE00F,064204,9,,B,6,2,"And does he have to be, I mean, are we not gonna be there most of the time?",,
K/KB/KBD.xml,KBDRE00F,064204,10,,A,7,1,Yeah.,,
K/KB/KBD.xml,KBDRE00F,064204,11,,A,7,2,Co- yeah we are.,,
K/KB/KBD.xml,KBDRE00F,064204,12,,B,8,1,"Well, you are.",,
K/KB/KBD.xml,KBDRE00F,064204,13,,B,8,2,I'll be back as soon as I can.,,
K/KB/KBD.xml,KBDRE00F,064204,14,,A,9,1,Yeah.,,
K/KB/KBD.xml,KBDRE00F,064204,15,,A,9,2,"I mean, I can be back for  well I mean, I can actually stay there in fact.",,
K/KB/KBD.xml,KBDRE00F,064204,16,,B,10,1,"Well, do you want the latest?",,
K/KB/KBD.xml,KBDRE00F,064204,17,,A,11,1,Yeah.,,
K/KB/KBD.xml,KBDRE00F,064204,18,,B,12,1,"There's, there's Steve <<REDACTED (name)>> , Dave   <<REDACTED (name)>> er, all the men's meeting at the hideaway",,
K/KB/KBD.xml,KBDRE00F,064204,19,,A,13,1,Oh yeah.,,
K/KB/KBD.xml,KBDRE00F,064204,20,,B,14,1,is now going to be at the (()) .,,
K/KB/KBD.xml,KBDRE00F,064204,21,,B,14,2,"We think she should, might stand down gracefully, if she doesn't erm  she, we could refuse to adopt, but she's over there personally.",,
K/KB/KBD.xml,KBDRE00F,064204,22,,B,14,3,"Erm, I'm in two minds about what to do.",,
K/KB/KBD.xml,KBDRE00F,064204,23,,B,14,4,"I could  name names and say  because this is not a party decision, it's",,
K/KB/KBD.xml,KBDRE00F,064204,24,,A,15,1,Yeah.,,
K/KB/KBD.xml,KBDRE00F,064204,25,,B,16,1,"Dave <<REDACTED (name)>> , Steve <<REDACTED (name)>> , etcetera, and (()) .",,
K/KB/KBD.xml,KBDRE00F,064204,26,,B,16,2,"Now, who's Dave <<REDACTED (name)>> ?",,
K/KB/KBD.xml,KBDRE00F,064204,27,,B,16,3,Senior employee of the City Council,,
K/KB/KBD.xml,KBDRE00F,064204,28,,A,17,1,Yeah.,,
K/KB/KBD.xml,KBDRE00F,064204,29,,B,18,1,meeting with  the leader of the Labour group who's  supposedly doing all this to protect his wife.,,
K/KB/KBD.xml,KBDRE00F,064204,30,,B,18,2,"The reason he's married to her  I mean, even (()) .",,
K/KB/KBD.xml,KBDRE00F,064204,31,,B,18,3,"I could, I could really throw the dirt at them  by saying that I'll, you know, if there is a conspiracy  there's, a person here who's been involved in a very iffy part of the budget, who all of a sudden after ten years of  slagging off the town clerk, all of a sudden he's totally on the town clerk's side, together with  Councillor <<REDACTED (name)>> .",,
K/KB/KBD.xml,KBDRE00F,064204,32,,B,18,4,Why?,,
K/KB/KBD.xml,KBDRE00F,064204,33,,B,18,5,"The only person who's involved in both, allowing the town clerk to take these decisions, without any  interference at all",,
K/KB/KBD.xml,KBDRE00F,064204,34,,A,19,1,Mm.,,
K/KB/KBD.xml,KBDRE00F,064204,35,,B,20,1,"and now conspiring with a senior employee of the council, and of course,(()) .",,
K/KB/KBD.xml,KBDRE00F,064204,36,,B,20,2,Just not so.,,
K/KB/KBD.xml,KBDRE00F,064204,37,,A,21,1,Yeah.,,
K/KB/KBD.xml,KBDRE00F,064204,38,,B,22,1,"All of a sudden this erm  worry about this budget heading, is being swept under the carpets and everybody being told is all in been er  cleared up.",,
K/KB/KBD.xml,KBDRE00F,064204,39,,B,22,2,It's Dave  <<REDACTED (name)>> (()) .,,
K/KB/KBD.xml,KBDRE00F,064204,40,,B,22,3,I'd fire him.,,
K/KB/KBD.xml,KBDRE00F,064204,41,,A,23,1,Mm.,,
K/KB/KBD.xml,KBDRE00F,064204,42,,B,24,1,I could really make this into a very great conspiracy for (()) .,,
K/KB/KBD.xml,KBDRE00F,064204,43,,A,25,1,Mm.,,
K/KB/KBD.xml,KBDRE00F,064204,44,,B,26,1,"Apart from which, this meeting that they're supposed to be going to have  is totally out of order anyway.",,
K/KB/KBD.xml,KBDRE00F,064204,45,,B,26,2,Cos nobody's been sent any notices for it or notified about it.,,
K/KB/KBD.xml,KBDRE00F,064204,46,,B,26,3,"So I mean, I, I could",,
K/KB/KBD.xml,KBDRE00F,064204,47,,A,27,1,What the hell are they doing now!,,
K/KB/KBD.xml,KBDRE00F,064204,48,,B,28,1,"get the full meeting cance- I mean, you get Ashdown yesterday, his party rally round him like",,
K/KB/KBD.xml,KBDRE00F,064204,49,,A,29,1,Mm.,,
K/KB/KBD.xml,KBDRE00F,064204,50,,B,30,1,royalty's going of fashion!,,
K/KB/KBD.xml,KBDRE00F,064204,51,,B,30,2,"You get, I mean, Dave  <<REDACTED (name)>> and Steve <<REDACTED (name)>> , alright, they've never been my favourite people  but  all this pious goings-on with Dave <<REDACTED (name)>> , how much he hates the town clerk, and whatever opportunity he could get  he would",,
K/KB/KBD.xml,KBDRE00F,064204,52,,A,31,1,Mm.,,
K/KB/KBD.xml,KBDRE00F,064204,53,,B,32,1,take.,,
K/KB/KBD.xml,KBDRE00F,064204,54,,A,33,1,Mm.,,
K/KB/KBD.xml,KBDRE00F,064204,55,,B,34,1,"First opportunity, real opportunity he gets  he's  doing everything the town clerk wants him to do.",,
K/KB/KBD.xml,KBDRE00F,064204,56,,A,35,1,Yeah.,,
K/KB/KBD.xml,KBDRE00F,064204,57,,B,36,1,"I just, I, I, honestly Barry, I've got to the stage where I believe in this conspiracy (()) .",,
K/KB/KBD.xml,KBDRE00F,064204,58,,A,37,1,Mm.,,
K/KB/KBD.xml,KBDRE00F,064204,59,,A,37,2,"Well certainly some people want  some answers want to be given on this  budget, er me as well, I mean, he can't just suddenly say",,
K/KB/KBD.xml,KBDRE00F,064204,60,,B,38,1,Well,,
K/KB/KBD.xml,KBDRE00F,064204,61,,A,39,1,"it's all been sorted out, don't worry about it.",,
K/KB/KBD.xml,KBDRE00F,064204,62,,B,40,1,Well  I think it will be really stupid.,,
K/KB/KBD.xml,KBDRE00F,064204,63,,B,40,2,(()) But I shall say  Dave   <<REDACTED (name)>>,,
K/KB/KBD.xml,KBDRE00F,064204,64,,A,41,1,And how long (()) ?,,
K/KB/KBD.xml,KBDRE00F,064204,65,,A,41,2,Well I park,,
K/KB/KBD.xml,KBDRE00F,064204,66,,B,42,1,I'll put,,
K/KB/KBD.xml,KBDRE00F,064204,67,,A,43,1,er,,
K/KB/KBD.xml,KBDRE00F,064204,68,,B,44,1,I'll drop you off.,,
K/KB/KBD.xml,KBDRE00F,064204,69,,B,44,2,"Cos I want to go home and (()) , I've got to home cos I've  I've a stack of paperwork on my table.",,
K/KB/KBD.xml,KBDRE00F,064204,70,,B,44,3,I'm not gonna be able to set off much later on remember because,,
K/KB/KBD.xml,KBDRE00F,064204,71,,A,45,1,(()) ,,
K/KB/KBD.xml,KBDRE00F,064204,72,,B,46,1,There's no point in me getting,,
K/KB/KBD.xml,KBDRE00F,064204,73,,A,47,1,Nope.,,
K/KB/KBD.xml,KBDRE00F,064204,74,,B,48,1,I'll have to go up to shop to get some shopping cos there's  nothing to eat in the house.,,
K/KB/KBD.xml,KBDRE00F,064204,75,,B,48,2,So I'll have to do something (()) .,,
K/KB/KBD.xml,KBDRE00F,064204,76,,B,48,3,Alright Barry?(()),,
K/KB/KBD.xml,KBDRE00F,064204,77,,A,49,1,"I just wonder what on earth they're, they're playing at with  ha, cha cha cha cha cha cha.",,
K/KB/KBD.xml,KBDRE00F,064204,78,,A,49,2,"You know, I just don't understand what they're playing but th- you know",,
K/KB/KBD.xml,KBDRE00F,064204,79,,B,50,1,They,,
K/KB/KBD.xml,KBDRE00F,064204,80,,A,51,1,they can only be doing  damage to th- to the election chances I mean,,
K/KB/KBD.xml,KBDRE00F,064204,81,,B,52,1,Well they,,
K/KB/KBD.xml,KBDRE00F,064204,82,,A,53,1,they can't be achieving anything else!,,
K/KB/KBD.xml,KBDRE00F,064204,83,,B,54,1,I mean saying things like  a successor has already been identified.,,
K/KB/KBD.xml,KBDRE00F,064204,84,,B,54,2,I mean  it's just stupid!,,
K/KB/KBD.xml,KBDRE00F,064204,85,,B,54,3,Cos the general view in Morecambe isn't what they say it is.,,
K/KB/KBD.xml,KBDRE00F,064204,86,,A,55,1,"Yeah, but it gives the impression there's a split group innit?",,
K/KB/KBD.xml,KBDRE00F,064204,87,,B,56,1,"Well, you give the impression of a  a faction in the party, now  I could, I could serve this faction quite easily  to  Mike  <<REDACTED (name)>> who'd give me a lot of say  if I said, you know,th- the  the plot thickens, you know, here's a town",,
K/KB/KBD.xml,KBDRE00F,064204,88,,A,57,1,Yeah.,,
K/KB/KBD.xml,KBDRE00F,064204,89,,B,58,1,hall employee,,
K/KB/KBD.xml,KBDRE00F,064204,90,,A,59,1,Yeah.,,
K/KB/KBD.xml,KBDRE00F,064204,91,,B,60,1,always an opponent of the town clerk  also now  erm  trying to cause problems.,,
K/KB/KBD.xml,KBDRE00F,064204,92,,A,61,1,Mm.,,
K/KB/KBD.xml,KBDRE00F,064204,93,,B,62,1,"I mean, that really does make the plot thicken  doesn't it?",,
K/KB/KBD.xml,KBDRE00F,064204,94,,A,63,1,Yeah.,,
K/KB/KBD.xml,KBDRE00F,064204,95,,B,64,1,"I mean, why was Dave  <<REDACTED (name)>> being quoted for (()) , what has it got to with Dave <<REDACTED (name)>> ?",,
K/KB/KBD.xml,KBDRE00F,064204,96,,B,64,2,"He's not an officer of the constitut- he isn't a treasurer, he isn't secretary, he's, he's nothing  as far the constituency's concerned.",,
K/KB/KBD.xml,KBDRE00F,064204,97,,B,64,3,"They, if they want any quotes why don't they go and see chairman, who's Terry?",,
K/KB/KBD.xml,KBDRE00F,064204,98,,A,65,1,Yeah.,,
K/KB/KBD.xml,KBDRE00F,064204,99,,B,66,1,"I mean, this is them deliberately saying things to their friends  and deliberately stirring it.",,
K/KB/KBD.xml,KBDRE00F,064204,100,,B,66,2,"They, oh!",,
K/KB/KBD.xml,KBDRE00F,064204,101,,B,66,3,"Because, I mean, I know where it's coming from, some of it's coming from Stanley <<REDACTED (name)>> , who, who thinks  if I don't stand down it will damage Ruth's chances.",,
K/KB/KBD.xml,KBDRE00F,064204,102,,B,66,4,That's not Ruth's own view of it.,,
K/KB/KBD.xml,KBDRE00F,064204,103,,B,66,5,"Well it, and I don't think with the News of the World round their necks they can afford to start playing silly people.",,
K/KB/KBD.xml,KBDRE00F,064204,104,,B,66,6,"Because I'm, you know, if they sa- if they keep crossing me the way they are, quite frankly I'm  you know, willing to make remarks myself.",,
K/KB/KBD.xml,KBDRE00F,064204,105,,B,66,7,"Although I don't want to do damaging things, but  I don't see why I should be the person con- cons- constantly getting the flack from a group of people who were  you know.",,
K/KB/KBD.xml,KBDRE00F,064204,106,,A,67,1,Yeah.,,
K/KB/KBD.xml,KBDRE00F,064204,107,,B,68,1,Who are genuinely trying to do damage to the party.,,
K/KB/KBD.xml,KBDRE00F,064204,108,,B,68,2,So do you want me to call at the  <<REDACTED (name)>> 's now?,,
K/KB/KBD.xml,KBDRE00F,064204,109,,A,69,1,Yeah.,,
K/KB/KBD.xml,KBDRE00F,064204,110,,A,69,2,"There's, may as well.",,
K/KB/KBD.xml,KBDRE00F,064204,111,,A,69,3,"Well, don't know.",,
K/KB/KBD.xml,KBDRE00F,064204,112,,A,69,4,"Well it doesn't really matter, I'll, I'll be  I mean, what, so  I mean there's  except for seeing Anne there's nothing more to do is there?",,
K/KB/KBD.xml,KBDRE00F,064204,113,,B,70,1,Well except to start getting that rubbish cleared away.,,
K/KB/KBD.xml,KBDRE00F,064204,114,,A,71,1,Well I can't put it away.,,
K/KB/KBD.xml,KBDRE00F,064204,115,,A,71,2,Don't want a pile in the cellar when carpet delivery comes.,,
K/KB/KBD.xml,KBDRE00F,064204,116,,B,72,1,"No, but I pu- put it next to the lift  and as soon as Hughey comes  put it outside and when I come back I'll take it away.",,
K/KB/KBD.xml,KBDRE00F,064204,117,,A,73,1,"No you won't cos I'm meeting Ellial at, at half three.",,
K/KB/KBD.xml,KBDRE00F,064204,118,,B,74,1,"Well I mean, I should be back for half past two.",,
K/KB/KBD.xml,KBDRE00F,064204,119,,B,74,2,"I mean, if you want to just put it in that dustbin place and we'll take it tomorrow.",,
K/KB/KBD.xml,KBDRE00F,064204,120,,A,75,1,Mm.,,
K/KB/KBD.xml,KBDRE00F,064204,121,,B,76,1,"You know, the washing up machine and everything, all, all of that needs cleaning out, all behind the bar needs cleaning.",,
K/KB/KBD.xml,KBDRE00F,064204,122,,B,76,2,We're giving people a very bad impression if we're opening tonight and  nothing's been cleared up.,,
K/KB/KBD.xml,KBDRE00F,064204,123,,B,76,3,I think I'll go for it Barry.,,
K/KB/KBD.xml,KBDRE00F,064204,124,,B,76,4,"I'll, I'll go and see where he is, and say, you know  That washing up and everything wants doing before tonight so you, so if you're gonna say  oh, we're open tonight and the place still looks like a pig stye!",,
K/KB/KBD.xml,KBDRE00F,064204,125,,B,76,5,It ain't gonna give a very good impression.,,
K/KB/KBD.xml,KBDRE00F,064204,126,,A,77,1,"Well he's not gonna want to, he's not,sha- I mean he's  it's not a meeting to look around the place is it really?",,
K/KB/KBD.xml,KBDRE00F,064204,127,,B,78,1,Well it is.,,
K/KB/KBD.xml,KBDRE00F,064204,128,,B,78,2,That's what they're coming for.,,
K/KB/KBD.xml,KBDRE00F,064204,129,,B,78,3,"That's one of the things Richard  <<REDACTED (name)>> is coming for, to look round.",,
K/KB/KBD.xml,KBDRE00F,064204,130,,B,78,4,"We'll come and have a good look round, I've never seen it.",,
K/KB/KBD.xml,KBDRE00F,064204,131,,B,78,5,"I mean, er, you know what that's to do with don't you?",,
K/KB/KBD.xml,KBDRE00F,064204,132,,B,78,6,The repairs notice.,,
K/KB/KBD.xml,KBDRE00F,064204,133,,B,78,7,Even if we only got all those old tickets and things into green bags and started cleaning that out it would  it would look as though we're making some  effort.,,
K/KB/KBD.xml,KBDRE00F,064204,134,,B,78,8,"Er, if I can get  the  <<REDACTED (name)>> and get him to come in  reasonably soon, you know, I'll ring you and tell you whether he's in.",,
K/KB/KBD.xml,KBDRE00F,064204,135,,B,78,9,If we could get him to come in reasonably quickly  you could get all that stuff down and bagged up and we could get rid of it couldn't we?,,
K/KB/KBD.xml,KBDRE00F,064204,136,,A,79,1,Which which tickets are you talking about?,,
K/KB/KBD.xml,KBDRE00F,064204,137,,B,80,1,"Well all the old tickets and stuff, I mean, alright",,
K/KB/KBD.xml,KBDRE00F,064204,138,,A,81,1,Where?,,
K/KB/KBD.xml,KBDRE00F,064204,139,,A,81,2,From where?,,
K/KB/KBD.xml,KBDRE00F,064204,140,,B,82,1,"In, the bottom office.",,
K/KB/KBD.xml,KBDRE00F,064204,141,,A,83,1,Oh yeah.,,
K/KB/KBD.xml,KBDRE00F,064204,142,,B,84,1,"As well as all the junk that's in the cleaner's room, it all wants getting rid of.",,
K/KB/KBD.xml,KBDRE00F,064204,143,,B,84,2,"I mean, what's happening about these speakers then?",,
K/KB/KBD.xml,KBDRE00F,064204,144,,B,84,3,"I mean, is this supposed to be happening tonight or",,
K/KB/KBD.xml,KBDRE00F,064204,145,,A,85,1,No.,,
K/KB/KBD.xml,KBDRE00F,064204,146,,B,86,1,what's,,
K/KB/KBD.xml,KBDRE00F,064204,147,,A,87,1,Well it's  it's a trial.,,
K/KB/KBD.xml,KBDRE00F,064204,148,,A,87,2,Go in then.,,
K/KB/KBD.xml,KBDRE00F,064204,149,,B,88,1,Just stop if there's any mail.,,
K/KB/KBD.xml,KBDRE00F,064204,150,,A,89,1,No there's nothing.,,
K/KB/KBD.xml,KBDRE00F,064204,151,,B,90,1,Oh.,,
K/KB/KBD.xml,KBDRE00F,064204,152,,A,91,1,Okay.,,
K/KB/KBD.xml,KBDRE00F,064204,153,,B,92,1,I'll go and get in and get on with,,
K/KB/KBD.xml,KBDRE00F,064204,154,,A,93,1,Alright.,,
