swda_filename,ptb_basename,conversation_no,transcript_index,act_tag,caller,turn_index,subutterance_index,text,pos,trees
K/KP/KPT.xml,KPTRE004,132405,0,,A,1,1,But the guy is an arsehole  also.,,
K/KP/KPT.xml,KPTRE004,132405,1,,A,1,2,"But he's just, he's just, he's like, he's so  you can read what he's done.",,
K/KP/KPT.xml,KPTRE004,132405,2,,A,1,3,"I mean, you can understand him, so easily.",,
K/KP/KPT.xml,KPTRE004,132405,3,,A,1,4,It started off,,
K/KP/KPT.xml,KPTRE004,132405,4,,B,2,1,(()) ,,
K/KP/KPT.xml,KPTRE004,132405,5,,A,3,1,Acts like a complete dick to try and get attention.,,
K/KP/KPT.xml,KPTRE004,132405,6,,A,3,2,And then he went slightly  relaxed  and now he's being a dick again.,,
K/KP/KPT.xml,KPTRE004,132405,7,,A,3,3,"Like, you know, this morning in erm language  he jumps off a table screaming, ow, ow, ow!",,
K/KP/KPT.xml,KPTRE004,132405,8,,A,3,4,No.,,
K/KP/KPT.xml,KPTRE004,132405,9,,A,3,5,For a start he shouldn't have been on the table.,,
K/KP/KPT.xml,KPTRE004,132405,10,,A,3,6,"Secondly, he doesn't need to  (()) that's just stupid.",,
K/KP/KPT.xml,KPTRE004,132405,11,,B,4,1,"The one that you're, you're, you're taking, right, just means that you  you (()) .<traffic noise>",,
K/KP/KPT.xml,KPTRE004,132405,12,,A,5,1,Yes.,,
K/KP/KPT.xml,KPTRE004,132405,13,,B,6,1,"No, oh oh, you can't.",,
K/KP/KPT.xml,KPTRE004,132405,14,,B,6,2,No.,,
K/KP/KPT.xml,KPTRE004,132405,15,,A,7,1,I thought you said she did it.,,
K/KP/KPT.xml,KPTRE004,132405,16,,B,8,1,"(()) <singing> Mm mm, wo oh </singing> .<whistling>",,
K/KP/KPT.xml,KPTRE004,132405,17,,A,9,1,"Right, and the other thing  sorry, but he also  reckons he's God about girls.",,
K/KP/KPT.xml,KPTRE004,132405,18,,A,9,2,He reckons he knows everything.,,
K/KP/KPT.xml,KPTRE004,132405,19,,B,10,1,He's not.(()),,
K/KP/KPT.xml,KPTRE004,132405,20,,A,11,1,I don't like Elsa either.,,
K/KP/KPT.xml,KPTRE004,132405,21,,B,12,1,Why not?,,
K/KP/KPT.xml,KPTRE004,132405,22,,A,13,1,Ah!,,
K/KP/KPT.xml,KPTRE004,132405,23,,A,13,2,She's just so irritating.,,
K/KP/KPT.xml,KPTRE004,132405,24,,A,13,3,She's just so,,
