14011,"(0,)","Thank you Turan , very much .","[Thank/VB, you/PRP, Turan/NNP, ,/,, very/RB, much/RB, ./.]","(ROOT (S (VP (VB Thank) (S (NP (PRP you)) (NP (NP (NNP Turan)) (, ,) (ADVP (RB very) (RB much))))) (. .)))"
14011,"(1,)",Okay .,"[Okay/UH, ./.]",(ROOT (INTJ (UH Okay) (. .)))
14011,"(2, 3)","Don 't know what , don 't know what they 'll make of all that gobbledegook .    bye bye love .","[Don/NNP, 't/PRP, know/VBP, what/WP, ,/,, don/NNP, 't/PRP, know/VBP, what/WP, they/PRP, 'll/MD, make/VB, of/IN, all/DT, that/DT, gobbledegook/NN, ./., bye/NN, bye/NN, love/NN, ./.]","(ROOT (S (NP (NNP Don) (PRP 't)) (VP (VBP know) (SBAR (WHNP (WP what)) (, ,) (S (NP (NNP don) (PRP 't)) (VP (VBP know) (SBAR (WHNP (WP what)) (S (NP (PRP they)) (VP (MD 'll) (VP (VB make) (FRAG (X (X (ADVP (IN of) (DT all)) (NP (DT that) (NN gobbledegook)) (. .)) (NP (NN bye) (NN bye))) (NP (NN love))))))))))) (. .)))"
14011,"(4,)",Have a good weekend .,"[Have/VB, a/DT, good/JJ, weekend/NN, ./.]",(ROOT (S (VP (VB Have) (NP (DT a) (JJ good) (NN weekend))) (. .)))
14011,"(5,)",See you soon   .,"[See/VB, you/PRP, soon/RB, ./.]",(ROOT (S (VP (VB See) (NP (PRP you)) (ADVP (RB soon))) (. .)))
14011,"(6,)",See you next week .,"[See/VB, you/PRP, next/JJ, week/NN, ./.]",(ROOT (S (VP (VB See) (NP (PRP you)) (NP (JJ next) (NN week))) (. .)))
