14809,"(0,)",You 're gonna come on Saturday aren 't you Michelle ?,"[You/PRP, 're/VBP, gonna/NNS, come/VB, on/IN, Saturday/NNP, aren/NNP, 't/PRP, you/PRP, Michelle/NNP, ?/.]",(ROOT (S (NP (PRP You)) (VP (VBP 're) (NP (NP (NNS gonna) (S (VP (VB come) (PP (IN on) (NP (NNP Saturday) (NNP aren) (PRP 't)))))) (NP (NP (PRP you)) (NP (NNP Michelle))))) (. ?)))
14809,"(1, 2)",Yeah I 'm   Thursday Friday and Saturday I 've got it so  it means that,"[Yeah/UH, I/PRP, 'm/VBP, Thursday/NNP, Friday/NNP, and/CC, Saturday/NNP, I/PRP, 've/VBP, got/VBD, it/PRP, so/IN, it/PRP, means/VBZ, that/IN]",(ROOT (NP (S (S (INTJ (UH Yeah)) (NP (PRP I)) (VP (VBP 'm) (NP (NNP Thursday) (NNP Friday)))) (CC and) (S (NP (NNP Saturday)) (NP (PRP I)) (VP (VBP 've) (VP (VBD got) (NP (PRP it)) (SBAR (IN so) (S (NP (PRP it)) (VP (VBZ means) (ADVP (IN that)))))))))))
14809,"(3, 4)","Er  is that too big , that spike ?","[Er/NN, is/VBZ, that/IN, too/RB, big/JJ, ,/,, that/IN, spike/NNP, ?/.]","(ROOT (S (NP (NN Er)) (VP (VBZ is) (ADJP (IN that) (RB too) (JJ big)) (, ,) (SBAR (IN that) (FRAG (NP (NNP spike))))) (. ?)))"
14809,"(5,)","What colour 's frog 's eyes , black ?","[What/WDT, colour/NN, 's/POS, frog/NN, 's/POS, eyes/NNS, ,/,, black/JJ, ?/.]","(ROOT (FRAG (SBARQ (WHNP (WHNP (WDT What) (NN colour) (POS 's)) (NP (NP (NN frog) (POS 's)) (NP (NP (NNS eyes)) (, ,) (NP (JJ black))))) (. ?))))"
14809,"(6,)",Last time Roger was outside waiting for me for an hour and a half,"[Last/JJ, time/NN, Roger/NNP, was/VBD, outside/JJ, waiting/VBG, for/IN, me/PRP, for/IN, an/DT, hour/NN, and/CC, a/DT, half/NN]",(ROOT (S (NP (JJ Last) (NN time) (NNP Roger)) (VP (VBD was) (ADVP (JJ outside)) (VP (VBG waiting) (PP (IN for) (NP (PRP me))) (PP (IN for) (NP (NP (DT an) (NN hour)) (CC and) (NP (DT a) (NN half))))))))
14809,"(7,)","Suppose so , yeah .","[Suppose/VB, so/RB, ,/,, yeah/UH, ./.]","(ROOT (S (VP (VB Suppose) (ADVP (RB so)) (, ,) (NP (UH yeah))) (. .)))"
