18006,"(0,)",They get some weird trips don 't they ?,"[They/PRP, get/VBP, some/DT, weird/JJ, trips/NNS, don/VBP, 't/PRP, they/PRP, ?/.]",(ROOT (S (NP (PRP They)) (VP (VBP get) (SBAR (S (NP (DT some) (JJ weird) (NNS trips)) (VP (VBP don) (S (NP (PRP 't)) (NP (PRP they))))))) (. ?)))
18006,"(1,)"," I think you have to er , er , you have to be a certain kind of person , you have to be prepared to anything don 't you ?","[I/PRP, think/VBP, you/PRP, have/VB, to/TO, er/NN, ,/,, er/NN, ,/,, you/PRP, have/VBP, to/TO, be/VB, a/DT, certain/JJ, kind/NN, of/IN, person/NN, ,/,, you/PRP, have/VBP, to/TO, be/VB, prepared/VBN, to/TO, anything/NN, don/NNP, 't/PRP, you/PRP, ?/.]","(ROOT (S (NP (PRP I)) (VP (VBP think) (S (NP (PRP you)) (VP (VB have) (S (S (PP (TO to) (NP (NP (NN er)) (, ,) (NP (NN er)))) (, ,) (NP (PRP you)) (VP (VBP have) (S (VP (TO to) (VP (VB be) (NP (NP (DT a) (JJ certain) (NN kind)) (PP (IN of) (NP (NN person))))))))) (, ,) (S (NP (PRP you)) (VP (VBP have) (S (VP (TO to) (VP (VB be) (VP (VBN prepared) (PP (TO to) (NP (NN anything))) (S (VP (NNP don) (S (NP (PRP 't)) (NP (PRP you))))))))))))))) (. ?)))"
18006,"(2,)","I don 't think , I don 't think you 're allowed to say ooh , I don 't think I 'd like to do that .","[I/PRP, don/VBP, 't/PRP, think/VB, ,/,, I/PRP, don/VBP, 't/PRP, think/VB, you/PRP, 're/VBP, allowed/VBN, to/TO, say/VB, ooh/NN, ,/,, I/PRP, don/VBP, 't/PRP, think/VB, I/PRP, 'd/MD, like/VB, to/TO, do/VB, that/DT, ./.]","(ROOT (S (S (NP (PRP I)) (VP (VBP don) (S (NP (PRP 't)) (VP (VB think))))) (, ,) (S (NP (PRP I)) (VP (VBP don) (S (NP (PRP 't)) (VP (VB think) (SBAR (S (NP (PRP you)) (VP (VBP 're) (VP (VBN allowed) (S (VP (TO to) (VP (VB say) (NP (NN ooh))))))))))))) (, ,) (S (NP (PRP I)) (VP (VBP don) (S (NP (PRP 't)) (VP (VB think) (SBAR (S (NP (PRP I)) (VP (MD 'd) (VP (VB like) (S (VP (TO to) (VP (VB do) (NP (DT that))))))))))))) (. .)))"
18006,"(3,)",There 's a job down   don 't they   .,"[There/EX, 's/VBZ, a/DT, job/NN, down/IN, don/NNP, 't/PRP, they/PRP, ./.]",(ROOT (S (NP (EX There)) (VP (VBZ 's) (NP (NP (DT a) (NN job)) (ADVP (IN down)) (SBAR (S (VP (NNP don) (S (NP (PRP 't)) (NP (PRP they)))))))) (. .)))
18006,"(4,)","Only for a bloke actually it 's pretty easy , but for some of the girls I mean they   sometimes has to false herself .","[Only/RB, for/IN, a/DT, bloke/NN, actually/RB, it/PRP, 's/VBZ, pretty/RB, easy/JJ, ,/,, but/CC, for/IN, some/DT, of/IN, the/DT, girls/NNS, I/PRP, mean/VBP, they/PRP, sometimes/RB, has/VBZ, to/TO, false/JJ, herself/PRP, ./.]","(ROOT (S (S (ADVP (RB Only) (PP (IN for) (NP (DT a) (NN bloke)) (ADVP (RB actually)))) (NP (PRP it)) (VP (VBZ 's) (ADJP (RB pretty) (JJ easy)))) (, ,) (CC but) (S (PP (IN for) (NP (NP (DT some)) (PP (IN of) (NP (DT the) (NNS girls))))) (NP (PRP I)) (VP (VBP mean) (SBAR (S (NP (PRP they)) (ADVP (RB sometimes)) (VP (VBZ has) (VP (PP (TO to) (NP (NP (JJ false)) (NP (PRP herself)))))))))) (. .)))"
18006,"(5,)","There was a scene where she had to go upsta- up the top of a windmill weren 't there   windmill wings oh what those things , I don 't think she was too keen on height","[There/EX, was/VBD, a/DT, scene/NN, where/WRB, she/PRP, had/VBD, to/TO, go/VB, upsta-/NN, up/IN, the/DT, top/NN, of/IN, a/DT, windmill/NN, weren/NN, 't/PRP, there/EX, windmill/NN, wings/NNS, oh/UH, what/WDT, those/DT, things/NNS, ,/,, I/PRP, don/VBP, 't/PRP, think/VB, she/PRP, was/VBD, too/RB, keen/JJ, on/IN, height/NN]","(ROOT (S (NP (EX There)) (VP (VBD was) (NP (NP (DT a) (NN scene)) (SBAR (WHADVP (WRB where)) (S (NP (PRP she)) (VP (VP (VBD had) (S (VP (TO to) (VP (VB go) (NP (NP (NN upsta-)) (ADVP (IN up) (NP (DT the) (NN top)) (PP (IN of) (NP (DT a) (NN windmill) (NN weren)))) (SBAR (S (NP (PRP 't))))) (S (NP (EX there))))))) (NP (NP (NN windmill) (NNS wings)) (FRAG (INTJ (UH oh)))))))) (SBAR (WHNP (WDT what)) (S (S (NP (DT those) (NNS things))) (, ,) (NP (PRP I)) (VP (VBP don) (S (NP (PRP 't)) (VP (VB think) (SBAR (S (NP (PRP she)) (VP (VBD was) (ADJP (RB too) (JJ keen)) (PP (IN on) (NP (NN height))))))))))))))"
18006,"(6,)","Wasn 't it the first black   they 'd ever had there , dad ?","[Wasn/NNP, 't/PRP, it/PRP, the/DT, first/JJ, black/JJ, they/PRP, 'd/MD, ever/RB, had/VBD, there/RB, ,/,, dad/NNP, ?/.]","(ROOT (S (NP (NP (NNP Wasn)) (NP (PRP 't)) (NP (NP (PRP it)) (NP (DT the) (JJ first) (JJ black)))) (NP (PRP they)) (VP (MD 'd) (ADVP (RB ever)) (VP (VBD had) (NP (NP (RB there)) (, ,) (NP (NNP dad))))) (. ?)))"
18006,"(7,)",Dunno .,"[Dunno/NNP, ./.]",(ROOT (FRAG (NP (NNP Dunno)) (. .)))
18006,"(8,)",Those black   you only had ,"[Those/DT, black/JJ, you/PRP, only/RB, had/VBD]",(ROOT (S (NP (DT Those)) (ADJP (JJ black) (SBAR (S (NP (PRP you)) (ADVP (RB only)) (VP (VBD had)))))))
