2603,"(0, 1)","We 've just had half an hour in Jubilee park , extremely brisk walk , I feel ext- jolly toasty now .","[We/PRP, 've/VBP, just/RB, had/VBN, half/PDT, an/DT, hour/NN, in/IN, Jubilee/NNP, park/NNP, ,/,, extremely/RB, brisk/JJ, walk/NN, ,/,, I/PRP, feel/VBP, ext-/JJ, jolly/JJ, toasty/JJ, now/RB, ./.]","(ROOT (S (S (NP (PRP We)) (VP (VBP 've) (ADVP (RB just)) (VP (VBN had) (NP (NP (QP (PDT half) (DT an) (NN hour))) (PP (IN in) (NP (NP (NNP Jubilee) (NNP park)) (, ,) (NP (ADJP (RB extremely) (JJ brisk)) (NN walk)))))))) (, ,) (NP (PRP I)) (VP (VBP feel) (NP (NP (ADJP (JJ ext-) (JJ jolly)) (JJ toasty)) (ADVP (RB now)))) (. .)))"
2603,"(2,)",How was your outing ?,"[How/WRB, was/VBD, your/PRP$, outing/NN, ?/.]",(ROOT (SBARQ (WHADVP (WRB How)) (SQ (VBD was) (NP (PRP$ your) (NN outing))) (. ?)))
2603,"(3,)",Oh .,"[Oh/UH, ./.]",(ROOT (INTJ (UH Oh) (. .)))
2603,"(4,)",Good looking buds on there aren 't they ?,"[Good/JJ, looking/VBG, buds/NNS, on/IN, there/EX, aren/NNP, 't/PRP, they/PRP, ?/.]",(ROOT (FRAG (ADJP (JJ Good)) (S (VP (VBG looking) (S (NP (NP (NNS buds)) (PP (IN on) (NP (NP (EX there)) (NP (NP (NNP aren)) (NP (PRP 't)))))) (NP (PRP they))))) (. ?)))
2603,"(5,)",I do miss   that pole sticking up there   .,"[I/PRP, do/VBP, miss/VB, that/IN, pole/NNP, sticking/VBG, up/RB, there/RB, ./.]",(ROOT (S (NP (PRP I)) (VP (VBP do) (VP (VB miss) (SBAR (IN that) (S (NP (NNP pole)) (VP (VBG sticking) (ADVP (RB up) (RB there))))))) (. .)))
2603,"(6,)",Don 't worry about it .,"[Don/NNP, 't/PRP, worry/VBP, about/IN, it/PRP, ./.]",(ROOT (S (NP (NNP Don) (PRP 't)) (VP (VBP worry) (PP (IN about) (NP (PRP it)))) (. .)))
2603,"(7,)"," not quite right , but if I go   it 'll break back off .","[not/RB, quite/RB, right/JJ, ,/,, but/CC, if/IN, I/PRP, go/VBP, it/PRP, 'll/MD, break/VB, back/RP, off/RP, ./.]","(ROOT (S (S (UCP (RB not) (ADVP (RB quite) (JJ right)) (, ,) (CC but) (ADJP (IN if)))) (NP (PRP I)) (VP (VBP go) (SBAR (S (NP (PRP it)) (VP (MD 'll) (VP (VB break) (PRT (RP back)) (PP (RP off))))))) (. .)))"
2603,"(8,)",A well exercised beast there I think .,"[A/DT, well/RB, exercised/VBN, beast/NN, there/EX, I/PRP, think/VBP, ./.]",(ROOT (NP (NP (DT A) (ADJP (RB well) (VBN exercised)) (NN beast)) (NP (NP (EX there)) (SBAR (S (NP (PRP I)) (VP (VBP think))))) (. .)))
