35201,"(0,)", I killed my cat with a fucking spade   We are at the scene of the crime Mr  > what did you see ?,"[I/PRP, killed/VBD, my/PRP$, cat/NN, with/IN, a/DT, fucking/JJ, spade/NNP, We/PRP, are/VBP, at/IN, the/DT, scene/NN, of/IN, the/DT, crime/NN, Mr/NN, >/JJR, what/WP, did/VBD, you/PRP, see/VB, ?/.]",(ROOT (S (S (NP (PRP I)) (VP (VBD killed) (NP (PRP$ my) (NN cat)) (PP (IN with) (NP (DT a) (JJ fucking) (NNP spade))))) (NP (PRP We)) (VP (VBP are) (PP (IN at) (NP (NP (DT the) (NN scene)) (PP (IN of) (NP (DT the) (NN crime) (NN Mr))))) (ADJP (ADJP (JJR >)) (SBAR (WHNP (WP what)) (S (VP (VBD did) (S (NP (PRP you)) (VP (VB see)))))))) (. ?)))
35201,"(1,)","That was Ashley not me , no","[That/DT, was/VBD, Ashley/NNP, not/RB, me/PRP, ,/,, no/DT]","(ROOT (S (NP (DT That)) (VP (VBD was) (NP (NP (NNP Ashley)) (PP (RB not) (NP (NP (PRP me)) (, ,) (NP (DT no))))))))"
35201,"(2,)",You absolute bastard Mr  > what did you see of the crime ?,"[You/PRP, absolute/JJ, bastard/NN, Mr/NN, >/JJR, what/WP, did/VBD, you/PRP, see/VB, of/IN, the/DT, crime/NN, ?/.]",(ROOT (NP (NP (ADVP (PRP You)) (JJ absolute) (NN bastard)) (ADJP (ADJP (NN Mr) (JJR >)) (SBAR (WHNP (WP what)) (S (VP (VBD did) (S (NP (PRP you)) (VP (VB see) (PP (IN of) (NP (DT the) (NN crime))))))))) (. ?)))
35201,"(3,)","What , what , explain to me what you saw please .","[What/WP, ,/,, what/WP, ,/,, explain/VB, to/TO, me/PRP, what/WP, you/PRP, saw/VBD, please/UH, ./.]","(ROOT (FRAG (SBAR (WHNP (WP What)) (, ,) (NP (WP what)) (, ,) (S (VP (VB explain) (PP (TO to) (NP (PRP me))) (SBAR (WHNP (WP what)) (S (NP (PRP you)) (VP (VBD saw) (INTJ (UH please)))))))) (. .)))"
35201,"(4,)","I was walking my dog right   through the common and this great big black fat hairy man came along and sharpened his great big long tool into , into this cattle , the bad thing about it was the fucking cow exploded ","[I/PRP, was/VBD, walking/VBG, my/PRP$, dog/NN, right/RB, through/IN, the/DT, common/JJ, and/CC, this/DT, great/JJ, big/JJ, black/JJ, fat/JJ, hairy/JJ, man/NN, came/VBD, along/RB, and/CC, sharpened/VBD, his/PRP$, great/JJ, big/JJ, long/JJ, tool/NN, into/IN, ,/,, into/IN, this/DT, cattle/NNS, ,/,, the/DT, bad/JJ, thing/NN, about/IN, it/PRP, was/VBD, the/DT, fucking/JJ, cow/NN, exploded/VBD]","(ROOT (S (NP (PRP I)) (VP (VBD was) (VP (VBG walking) (NP (PRP$ my) (NN dog)) (PP (RB right) (IN through) (NP (DT the) (ADJP (JJ common) (CC and) (DT this)) (JJ great) (JJ big) (JJ black) (JJ fat) (JJ hairy) (NN man) (S (VP (VP (VBD came) (ADVP (RB along))) (CC and) (VP (VBD sharpened) (NP (PRP$ his) (JJ great) (JJ big) (JJ long) (NN tool)) (PP (IN into))) (, ,) (PP (IN into) (NP (NP (DT this) (NNS cattle)) (, ,) (NP (NP (DT the) (JJ bad) (NN thing)) (SBAR (IN about) (S (NP (PRP it)) (VP (VBD was) (NP (NP (DT the) (JJ fucking) (NN cow)) (SBAR (S (VP (VBD exploded)))))))))))))))))))"
35201,"(5,)",The cow exploded did you say ?,"[The/DT, cow/NN, exploded/VBD, did/VBD, you/PRP, say/VB, ?/.]",(ROOT (S (NP (DT The) (NN cow)) (VP (VBD exploded) (SBAR (SINV (VBD did) (NP (PRP you)) (VP (VB say))))) (. ?)))
35201,"(6,)",Yes the cow exploded .,"[Yes/UH, the/DT, cow/NN, exploded/VBD, ./.]",(ROOT (S (S (INTJ (UH Yes)) (NP (DT the) (NN cow)) (VP (VBD exploded))) (. .)))
35201,"(7,)",Thank you very much Mr  > for your comment this is Wain  > reporting for news at six .,"[Thank/VB, you/PRP, very/RB, much/JJ, Mr/NN, >/JJR, for/IN, your/PRP$, comment/NN, this/DT, is/VBZ, Wain/NNP, >/JJR, reporting/NN, for/IN, news/NN, at/IN, six/CD, ./.]",(ROOT (S (VP (VB Thank) (S (NP (PRP you)) (ADJP (RB very) (JJ much)) (S (ADJP (ADJP (NN Mr) (JJR >)) (PP (IN for) (NP (NP (PRP$ your) (NN comment)) (SBAR (S (NP (DT this)) (VP (VBZ is) (NP (NP (NNP Wain) (NX (NP (JJR >) (NN reporting)) (PP (IN for) (NP (NN news))))) (PP (IN at) (NP (CD six))))))))))))) (. .)))
