39505,"(0,)","Yes , it 'll be nice to have a cup of tea .","[Yes/UH, ,/,, it/PRP, 'll/MD, be/VB, nice/JJ, to/TO, have/VB, a/DT, cup/NN, of/IN, tea/NN, ./.]","(ROOT (S (INTJ (UH Yes)) (, ,) (NP (PRP it)) (VP (MD 'll) (VP (VB be) (ADJP (JJ nice) (S (VP (TO to) (VP (VB have) (NP (NP (DT a) (NN cup)) (PP (IN of) (NP (NN tea)))))))))) (. .)))"
39505,"(1,)",Shall I carry it through ?,"[Shall/MD, I/PRP, carry/VB, it/PRP, through/IN, ?/.]",(ROOT (SQ (MD Shall) (NP (PRP I)) (VP (VB carry) (NP (PRP it)) (PP (IN through))) (. ?)))
39505,"(2,)",Please .,"[Please/VB, ./.]",(ROOT (S (VP (VB Please)) (. .)))
39505,"(3,)","Now is there going to be enough there , salad- wise ?","[Now/RB, is/VBZ, there/EX, going/VBG, to/TO, be/VB, enough/RB, there/RB, ,/,, salad-/NN, wise/JJ, ?/.]","(ROOT (S (S (NP (RB Now)) (VP (VBZ is) (S (NP (EX there)) (VP (VBG going) (S (VP (TO to) (VP (VB be) (ADVP (RB enough) (RB there))))))))) (, ,) (S (NP (NN salad-)) (ADJP (JJ wise))) (. ?)))"
39505,"(4,)",I mean are you going to  ,"[I/PRP, mean/VBP, are/VBP, you/PRP, going/VBG, to/TO]",(ROOT (S (NP (PRP I)) (VP (VBP mean) (SBAR (S (VP (VBP are) (S (NP (PRP you)) (VP (VBG going) (PP (TO to))))))))))
39505,"(5,)",Oh I would think so yes .,"[Oh/UH, I/PRP, would/MD, think/VB, so/RB, yes/RB, ./.]",(ROOT (S (S (INTJ (UH Oh)) (NP (PRP I)) (VP (MD would) (VP (VB think) (NP (RB so) (RB yes))))) (. .)))
39505,"(6,)","Cos I got that other meat , the red meat to do for a supper but I can do that for tomorrow  ","[Cos/NNP, I/PRP, got/VBD, that/IN, other/JJ, meat/NN, ,/,, the/DT, red/JJ, meat/NN, to/TO, do/VB, for/IN, a/DT, supper/NN, but/CC, I/PRP, can/MD, do/VB, that/DT, for/IN, tomorrow/NN]","(ROOT (FRAG (NP (NP (NNP Cos)) (SBAR (S (S (NP (PRP I)) (VP (VBD got) (SBAR (IN that) (S (NP (NP (JJ other) (NN meat)) (, ,) (NP (DT the) (JJ red) (NN meat))) (VP (TO to) (VP (VB do) (PP (IN for) (NP (DT a) (NN supper))))))))) (CC but) (S (NP (PRP I)) (VP (MD can) (VP (VB do) (NP (NP (DT that)) (PP (IN for) (NP (NN tomorrow))))))))))))"
39505,"(7,)",Well that 's fine isn 't it ?,"[Well/RB, that/DT, 's/VBZ, fine/JJ, isn/NN, 't/PRP, it/PRP, ?/.]",(ROOT (S (ADVP (RB Well)) (NP (DT that)) (VP (VBZ 's) (NP (NP (JJ fine) (NN isn)) (NP (NP (PRP 't)) (NP (PRP it))))) (. ?)))
