5013,"(0,)",Comes down to feet .,"[Comes/VBZ, down/RP, to/TO, feet/NNS, ./.]",(ROOT (S (VP (VBZ Comes) (PRT (RP down)) (PP (TO to) (NP (NNS feet)))) (. .)))
5013,"(1,)",Suppose   they said it shrinks as well .,"[Suppose/VB, they/PRP, said/VBD, it/PRP, shrinks/VBZ, as/RB, well/RB, ./.]",(ROOT (S (VP (VB Suppose) (SBAR (S (NP (PRP they)) (VP (VBD said) (SBAR (S (NP (PRP it)) (VP (VBZ shrinks) (ADVP (RB as) (RB well))))))))) (. .)))
5013,"(2,)","Hm , but it is a bit big , isn 't it ?","[Hm/NNS, ,/,, but/CC, it/PRP, is/VBZ, a/DT, bit/NN, big/JJ, ,/,, isn/JJ, 't/PRP, it/PRP, ?/.]","(ROOT (FRAG (NP (NNS Hm)) (, ,) (CC but) (S (NP (PRP it)) (VP (VBZ is) (ADJP (ADJP (NP (DT a) (NN bit)) (JJ big)) (, ,) (ADJP (JJ isn))) (NP (NP (PRP 't)) (NP (PRP it))))) (. ?)))"
5013,"(3,)","No I think that 's probably alright , they do have them long don 't they ?","[No/DT, I/PRP, think/VBP, that/DT, 's/VBZ, probably/RB, alright/JJ, ,/,, they/PRP, do/VBP, have/VB, them/PRP, long/JJ, don/NNP, 't/PRP, they/PRP, ?/.]","(ROOT (S (S (NP (DT No) (PRP I)) (VP (VBP think) (SBAR (S (NP (DT that)) (VP (VBZ 's) (ADVP (RB probably)) (ADJP (JJ alright))))))) (, ,) (NP (PRP they)) (VP (VBP do) (VP (VB have) (NP (NP (PRP them)) (ADVP (JJ long)) (SBAR (S (VP (NNP don) (S (NP (PRP 't)) (NP (PRP they))))))))) (. ?)))"
5013,"(4,)"," all the other children come up to , they don 't go up to here , I think I 'll have to   this don 't you ?","[all/PDT, the/DT, other/JJ, children/NNS, come/VBP, up/RP, to/TO, ,/,, they/PRP, don/VBP, 't/PRP, go/VB, up/RP, to/TO, here/RB, ,/,, I/PRP, think/VBP, I/PRP, 'll/MD, have/VB, to/TO, this/DT, don/NNP, 't/PRP, you/PRP, ?/.]","(ROOT (S (S (NP (PDT all) (DT the) (JJ other) (NNS children)) (VP (VBP come) (PRT (RP up)) (PP (TO to)))) (, ,) (S (NP (PRP they)) (VP (VBP don) (S (NP (PRP 't)) (VP (VB go) (PRT (RP up)) (PP (TO to) (NP (RB here))))))) (, ,) (S (NP (PRP I)) (VP (VBP think) (SBAR (S (NP (PRP I)) (VP (MD 'll) (VP (VB have) (PP (TO to) (NP (NP (DT this)) (SBAR (S (VP (NNP don) (S (NP (PRP 't)) (NP (PRP you)))))))))))))) (. ?)))"
5013,"(5,)","Let 's have a look , does it say what size it is ?","[Let/VB, 's/PRP, have/VB, a/DT, look/NN, ,/,, does/VBZ, it/PRP, say/VB, what/WP, size/NN, it/PRP, is/VBZ, ?/.]","(ROOT (S (S (VP (VB Let) (S (NP (PRP 's)) (VP (VB have) (NP (DT a) (NN look)))))) (, ,) (VP (VBZ does) (S (NP (PRP it)) (VP (VB say) (NP (NP (WP what) (NN size)) (SBAR (S (NP (PRP it)) (VP (VBZ is)))))))) (. ?)))"
5013,"(6,)",No .,"[No/DT, ./.]",(ROOT (FRAG (NP (DT No)) (. .)))
5013,"(7,)",Age nine to eleven it says .,"[Age/NN, nine/CD, to/TO, eleven/CD, it/PRP, says/VBZ, ./.]",(ROOT (S (NP (NP (NN Age) (CD nine)) (PP (TO to) (NP (CD eleven)))) (NP (PRP it)) (VP (VBZ says)) (. .)))
5013,"(8,)",Age nine .,"[Age/NN, nine/CD, ./.]",(ROOT (NP (NP (NN Age)) (NP (CD nine)) (. .)))
5013,"(9,)",It is a bit big though  .,"[It/PRP, is/VBZ, a/DT, bit/NN, big/JJ, though/RB, ./.]",(ROOT (S (NP (PRP It)) (VP (VBZ is) (ADJP (NP (DT a) (NN bit)) (JJ big)) (ADVP (RB though))) (. .)))
5013,"(10,)",I think it 's a bit big yes .,"[I/PRP, think/VBP, it/PRP, 's/VBZ, a/DT, bit/NN, big/JJ, yes/RB, ./.]",(ROOT (S (NP (PRP I)) (VP (VBP think) (SBAR (S (NP (PRP it)) (VP (VBZ 's) (ADJP (NP (DT a) (NN bit)) (JJ big)) (NP (RB yes)))))) (. .)))
5013,"(11,)","Oh mum , to , it 'll fit Clare .","[Oh/UH, mum/NN, ,/,, to/TO, ,/,, it/PRP, 'll/MD, fit/VB, Clare/NN, ./.]","(ROOT (S (FRAG (PP (NP (UH Oh)) (PP (NP (NP (NN mum)) (, ,)) (PP (TO to))))) (, ,) (NP (PRP it)) (VP (MD 'll) (VP (VB fit) (NP (NN Clare)))) (. .)))"
5013,"(12,)","Yes , I think seven to eight would have fit you better .","[Yes/UH, ,/,, I/PRP, think/VBP, seven/CD, to/TO, eight/CD, would/MD, have/VB, fit/VBN, you/PRP, better/JJR, ./.]","(ROOT (S (INTJ (UH Yes)) (, ,) (NP (PRP I)) (VP (VBP think) (SBAR (S (NP (NP (CD seven)) (PP (TO to) (NP (CD eight)))) (VP (MD would) (VP (VB have) (VP (VBN fit) (S (NP (PRP you)) (ADJP (JJR better))))))))) (. .)))"
5013,"(13,)","Yeah , was there any seven to eight , I think we should of got   .","[Yeah/UH, ,/,, was/VBD, there/EX, any/DT, seven/CD, to/TO, eight/CD, ,/,, I/PRP, think/VBP, we/PRP, should/MD, of/IN, got/VBN, ./.]","(ROOT (S (S (INTJ (UH Yeah)) (, ,) (VP (VBD was) (S (NP (EX there)) (NP (NP (DT any) (CD seven)) (PP (TO to) (NP (CD eight)))))) (, ,)) (NP (PRP I)) (VP (VBP think) (SBAR (S (NP (PRP we)) (VP (MD should) (PP (IN of)) (VP (VBN got)))))) (. .)))"
5013,"(14,)","Stand , stand up and lets see .","[Stand/VB, ,/,, stand/VB, up/RP, and/CC, lets/VBZ, see/VB, ./.]","(ROOT (S (VP (VP (VB Stand)) (, ,) (VP (VB stand) (PRT (RP up))) (CC and) (VP (VBZ lets) (S (VP (VB see))))) (. .)))"
5013,"(15,)",Do you think that 's to big ?,"[Do/VB, you/PRP, think/VB, that/DT, 's/VBZ, to/TO, big/JJ, ?/.]",(ROOT (SQ (VP (VB Do) (S (NP (PRP you)) (VP (VB think) (SBAR (S (NP (DT that)) (VP (VBZ 's) (PP (TO to) (NP (JJ big))))))))) (. ?)))
5013,"(16,)",Shall we go back and see if we can change it ?,"[Shall/MD, we/PRP, go/VB, back/RB, and/CC, see/VB, if/IN, we/PRP, can/MD, change/VB, it/PRP, ?/.]",(ROOT (SQ (MD Shall) (NP (PRP we)) (VP (VP (VB go) (ADVP (RB back))) (CC and) (VP (VB see) (SBAR (IN if) (S (NP (PRP we)) (VP (MD can) (VP (VB change) (NP (PRP it)))))))) (. ?)))
5013,"(17,)",  .,[./.],(ROOT (NP (. .)))
5013,"(18,)",Well we 'll just go back and swop it .,"[Well/RB, we/PRP, 'll/MD, just/RB, go/VB, back/RB, and/CC, swop/VB, it/PRP, ./.]",(ROOT (S (ADVP (RB Well)) (NP (PRP we)) (VP (MD 'll) (ADVP (RB just)) (VP (VP (VB go) (ADVP (RB back))) (CC and) (VP (VB swop) (NP (PRP it))))) (. .)))
5013,"(19,)",Ok .,"[Ok/UH, ./.]",(ROOT (INTJ (UH Ok) (. .)))
