5205,"(0, 1)", have we got the  we haven 't got the thing to draw a straight line have we ?,"[have/VB, we/PRP, got/VBD, the/DT, we/PRP, haven/NN, 't/PRP, got/VBD, the/DT, thing/NN, to/TO, draw/VB, a/DT, straight/JJ, line/NN, have/VBP, we/PRP, ?/.]",(ROOT (SQ (VP (VB have) (S (NP (PRP we)) (VP (VBD got) (NP (NP (DT the) (NP (PRP we)) (NN haven)) (SBAR (S (NP (PRP 't)) (VP (VBD got) (SBAR (S (NP (DT the) (NN thing) (S (VP (TO to) (VP (VB draw) (NP (DT a) (JJ straight) (NN line)))))) (VP (VBP have) (NP (PRP we)))))))))))) (. ?)))
5205,"(2,)",Is that .,"[Is/VBZ, that/IN, ./.]",(ROOT (S (VP (VBZ Is) (ADJP (IN that))) (. .)))
5205,"(3,)","That 's in the , that 's in the box in the corner .","[That/DT, 's/VBZ, in/IN, the/DT, ,/,, that/DT, 's/VBZ, in/IN, the/DT, box/NN, in/IN, the/DT, corner/NN, ./.]","(ROOT (S (NP (DT That)) (VP (VBZ 's) (PP (IN in) (NP (NP (DT the)) (, ,) (SBAR (WHNP (DT that)) (S (VP (VBZ 's) (PP (IN in) (NP (NP (DT the) (NN box)) (PP (IN in) (NP (DT the) (NN corner))))))))))) (. .)))"
5205,"(4, 5, 6)",What in that bluey  what the box  a box or uhum in your little cupboard .,"[What/WDT, in/IN, that/DT, bluey/NNP, what/WP, the/DT, box/NN, a/DT, box/NN, or/CC, uhum/NN, in/IN, your/PRP$, little/JJ, cupboard/NN, ./.]",(ROOT (FRAG (WHNP (WDT What)) (PP (IN in) (NP (NP (DT that) (NNP bluey)) (SBAR (WHNP (WP what)) (S (NP (NP (NP (DT the) (NN box)) (NP (DT a) (NN box))) (CC or) (NP (NP (NN uhum)) (PP (IN in) (NP (PRP$ your) (JJ little) (NN cupboard))))))))) (. .)))
5205,"(7,)",Hm in the kitchen cupboard .,"[Hm/NNS, in/IN, the/DT, kitchen/NN, cupboard/NN, ./.]",(ROOT (NP (NP (NNS Hm)) (PP (IN in) (NP (DT the) (NN kitchen) (NN cupboard))) (. .)))
5205,"(8,)",Yeah .,"[Yeah/UH, ./.]",(ROOT (INTJ (UH Yeah) (. .)))
