swda_filename,ptb_basename,conversation_no,transcript_index,act_tag,caller,turn_index,subutterance_index,text,pos,trees
K/KB/KBK.xml,KBKRE01S,002225,0,,A,1,1,"Question is, how much of it do we pass on?<laugh> ","question/NN1 be/VBZ ,/PUN how/AVQ much/DT0 of/PRF it/PNP do/VDB we/PNP pass/VVI on/AVP ?/PUN ",
K/KB/KBK.xml,KBKRE01S,002225,1,,B,2,1,Is  (()) associate (()) .,be/VBZ associate/AJ0 ./PUN ,
K/KB/KBK.xml,KBKRE01S,002225,2,,A,3,1,"Yes, it's the ","yes/ITJ ,/PUN it/PNP be/VBZ the/AT0 ",
K/KB/KBK.xml,KBKRE01S,002225,3,,B,4,1,(()) what have they said about the offer they've had already?,what/DTQ have/VHB they/PNP say/VVN about/PRP the/AT0 offer/NN1 they/PNP have/VHB have/VHN already/AV0 ?/PUN ,
K/KB/KBK.xml,KBKRE01S,002225,4,,A,5,1,"Erm, yes they have,for- --","erm/UNC ,/PUN yes/ITJ they/PNP have/VHB ,/PUN for/UNC ",
K/KB/KBK.xml,KBKRE01S,002225,5,,A,5,2,"--forgive me, I'll just finish this if you don't mind, I'm, I'm almost there, one O ten point three eight.","forgive/VVB i/PNP ,/PUN i/PNP will/VM0 just/AV0 finish/VVI this/DT0 if/CJS you/PNP do/VDB not/XX0 mind/VVI ,/PUN i/PNP be/VBB ,/PUN i/PNP be/VBB almost/AV0 there/AV0 ,/PUN one/CRD o/ZZ0 ten/CRD point/NN1 three/CRD eight/CRD ./PUN ",
K/KB/KBK.xml,KBKRE01S,002225,6,,A,5,3,Well erm  --,well/AV0 erm/UNC ,
K/KB/KBK.xml,KBKRE01S,002225,7,,A,5,4,"--he came back on the twenty fourth, no, never mind that  <laugh> we  --","he/PNP come/VVD back/AVP on/PRP the/AT0 twenty/CRD fourth/ORD ,/PUN no/ITJ ,/PUN never/AV0 mind/VVB that/CJT we/PNP ",
K/KB/KBK.xml,KBKRE01S,002225,8,,A,5,5,--we've been to-ing and fro-ing have Asian Associates and I and ,we/PNP have/VHB be/VBN to-ing/AJ0 and/CJC fro-ing/NN1 have/VHB asian/AJ0 associate/NN2 and/CJC i/PNP and/CJC ,
K/KB/KBK.xml,KBKRE01S,002225,9,,B,6,1,Is there a deadline on it?,be/VBZ there/EX0 a/AT0 deadline/NN1 on/PRP it/PNP ?/PUN ,
K/KB/KBK.xml,KBKRE01S,002225,10,,A,7,1,"Not as such so they're pressing for an answer, the factory, but erm, he came back and said we'd need firm prices, per kilo price, lump sum price not acceptable, customer offer of sixteen Deutschmark per kilo from (()) , for twelve to fourteen with delivery, your request for those credit verified five months not acceptable, you offer to deliver in eight weeks in which case and we'd get  (()) till twelve weeks, please confirm.","not/XX0 as/CJS such/DT0 so/CJS they/PNP be/VBB press/VVG for/PRP an/AT0 answer/NN1 ,/PUN the/AT0 factory/NN1 ,/PUN but/CJC erm/UNC ,/PUN he/PNP come/VVD back/AVP and/CJC say/VVD we/PNP would/VM0 need/VVI firm/AJ0 price/NN2 ,/PUN per/PRP kilo/NN1 price/NN1 ,/PUN lump/NN1 sum/NN1 price/NN1 not/XX0 acceptable/AJ0 ,/PUN customer/NN1 offer/NN1 of/PRF sixteen/CRD deutschmark/NN1 per/PRP kilo/NN1 from/PRP ,/PUN for/PRP twelve/CRD to/PRP fourteen/CRD with/PRP delivery/NN1 ,/PUN you/DPS request/NN1 for/PRP those/DT0 credit/NN1 verify/VVD-VVN five/CRD month/NN2 not/XX0 acceptable/AJ0 ,/PUN you/PNP offer/VVB to/TO0 deliver/VVI in/PRP eight/CRD week/NN2 in/PRP which/DTQ case/NN1 and/CJC we/PNP would/VM0 get/VVI till/PRP twelve/CRD week/NN2 ,/PUN please/AV0 confirm/VVB ./PUN ",
K/KB/KBK.xml,KBKRE01S,002225,11,,A,7,2,"(()) U S factory is booked, bulk order, pushing delivery out to twelve weeks, Deutschmark sixteen ki- --","u/ZZ0 s/ZZ0 factory/NN1 be/VBZ booked/AJ0-VVN ,/PUN bulk/NN1-VVB order/NN1 ,/PUN push/VVG delivery/NN1 out/AVP to/PRP twelve/CRD week/NN2 ,/PUN deutschmark/NN1 sixteen/CRD ki/UNC ",
K/KB/KBK.xml,KBKRE01S,002225,12,,A,7,3,"--kilos unlikely, could only break our offer down to price per piece or packet.","kilo/NN2 unlikely/AJ0 ,/PUN could/VM0 only/AV0 break/VVI we/DPS offer/NN1 down/AVP to/TO0 price/VVI per/PRP piece/NN1 or/CJC packet/NN1-VVB ./PUN ",
K/KB/KBK.xml,KBKRE01S,002225,13,,A,7,4,Five months were allowed for dispatch of last welding rods and elsie transfers on opening and presentation.,five/CRD month/NN2 be/VBD allow/VVN for/PRP dispatch/NN1 of/PRF last/ORD welding/NN1 rod/NN2 and/CJC elsie/NN1 transfer/NN2 on/PRP opening/NN1-VVG and/CJC presentation/NN1 ./PUN ,
K/KB/KBK.xml,KBKRE01S,002225,14,,A,7,5,"I wrote back saying, get on with it, and incidentally we overestimated the shipment cost, brought it down to about half, got to be awfully careful there, because some of these bits are so big, they (()) , and today he said, customer will make decision only after ten days, since final size of assortment is under preparation, meantime with your offered price and revised delivery time, it looks very difficult to book this order.","i/PNP write/VVD back/AVP say/VVG ,/PUN get/VVB on/AVP with/PRP it/PNP ,/PUN and/CJC incidentally/AV0 we/PNP overestimate/VVD the/AT0 shipment/NN1 cost/NN1-VVB ,/PUN bring/VVD it/PNP down/AVP to/PRP about/AV0 half/DT0 ,/PUN get/VVN-VVD to/TO0 be/VBI awfully/AV0 careful/AJ0 there/AV0 ,/PUN because/CJS some/DT0 of/PRF these/DT0 bit/NN2 be/VBB so/AV0 big/AJ0 ,/PUN they/PNP ,/PUN and/CJC today/AV0 he/PNP say/VVD ,/PUN customer/NN1 will/VM0 make/VVI decision/NN1 only/AV0 after/PRP ten/CRD day/NN2 ,/PUN since/CJS final/AJ0 size/NN1 of/PRF assortment/NN1 be/VBZ under/PRP preparation/NN1 ,/PUN meantime/AV0 with/PRP you/DPS offered/AJ0 price/NN1 and/CJC revised/AJ0 delivery/NN1 time/NN1 ,/PUN it/PNP look/VVZ very/AV0 difficult/AJ0 to/TO0 book/VVI this/DT0 order/NN1 ./PUN ",
K/KB/KBK.xml,KBKRE01S,002225,15,,A,7,6,"Price of electrodes is, seems alright, however plate prices are very high.","price/NN1 of/PRF electrode/NN2 be/VBZ ,/PUN seem/VVZ alright/AJ0 ,/PUN however/AV0 plate/NN1-VVB price/NN2 be/VBB very/AV0 high/AJ0 ./PUN ",
K/KB/KBK.xml,KBKRE01S,002225,16,,A,7,7,Please offer per piece or kilo.,please/AV0 offer/VVB-NN1 per/PRP piece/NN1 or/CJC kilo/NN1 ./PUN ,
K/KB/KBK.xml,KBKRE01S,002225,17,,A,7,8,Now  <<REDACTED (name)>> have changed it from per kilo to per piece.,now/AV0 have/VHB change/VVN it/PNP from/PRP per/PRP kilo/NN1 to/PRP per/PRP piece/NN1 ./PUN ,
K/KB/KBK.xml,KBKRE01S,002225,18,,B,8,1,How had you offered (()) ?,how/AVQ have/VHD you/PNP offer/VVN-VVD ?/PUN ,
K/KB/KBK.xml,KBKRE01S,002225,19,,B,8,2,<phone rings> Would you have the choice?,would/VM0 you/PNP have/VHI the/AT0 choice/NN1 ?/PUN ,
K/KB/KBK.xml,KBKRE01S,002225,20,,A,9,1,"I don't, you'd off- offer per kilo (()) .","i/PNP do/VDB not/XX0 ,/PUN you/PNP would/VM0 off/UNC offer/VVI per/PRP kilo/NN1 ./PUN ",
