swda_filename,ptb_basename,conversation_no,transcript_index,act_tag,caller,turn_index,subutterance_index,text,pos,trees
K/KB/KBK.xml,KBKRE06W,003005,0,,A,1,1,"Yes,Po- Petts Wood was eh an inbetween the wars, trendy suburban development wasn't it?","yes/ITJ ,/PUN po/UNC petts/NP0 wood/NP0 be/VBD eh/ITJ an/AT0 inbetween/PRP the/AT0 war/NN2 ,/PUN trendy/AJ0 suburban/AJ0 development/NN1 be/VBD not/XX0 it/PNP ?/PUN",
K/KB/KBK.xml,KBKRE06W,003005,1,,B,2,1,Well it's still,well/AV0 it/PNP be/VBZ still/AJ0,
K/KB/KBK.xml,KBKRE06W,003005,2,,A,3,1,Commuter land.,commuter/NN1 land/NN1 ./PUN,
K/KB/KBK.xml,KBKRE06W,003005,3,,B,4,1,it's still commuter land.,it/PNP be/VBZ still/AV0 commuter/NN1 land/NN1 ./PUN,
K/KB/KBK.xml,KBKRE06W,003005,4,,A,5,1,Mm.,mm/ITJ ./PUN,
K/KB/KBK.xml,KBKRE06W,003005,5,,B,6,1,"It's not unpleasant at all, these I mean","it/PNP be/VBZ not/XX0 unpleasant/AJ0 [at/PRP all/DT0]/AV0 ,/PUN these/DT0 i/PNP mean/VVB",
K/KB/KBK.xml,KBKRE06W,003005,6,,A,7,1,No I'm not saying it's unpleasant I'm saying it was trendy in those days.,no/ITJ i/PNP be/VBB not/XX0 say/VVG it/PNP be/VBZ unpleasant/AJ0 i/PNP be/VBB say/VVG it/PNP be/VBD trendy/AJ0 in/PRP those/DT0 day/NN2 ./PUN,
K/KB/KBK.xml,KBKRE06W,003005,7,,B,8,1,"Trendy, yeah.","trendy/AJ0 ,/PUN yeah/ITJ ./PUN",
K/KB/KBK.xml,KBKRE06W,003005,8,,A,9,1,But there is an awful lot of sameyness about it unfortunately.,but/CJC there/EX0 be/VBZ an/AT0 awful/AJ0 lot/NN1 of/PRF sameyness/NN1 about/PRP it/PNP unfortunately/AV0 ./PUN,
K/KB/KBK.xml,KBKRE06W,003005,9,,B,10,1,"Well, especially in a long road like this.","well/AV0 ,/PUN especially/AV0 in/PRP a/AT0 long/AJ0 road/NN1 like/PRP this/DT0 ./PUN",
K/KB/KBK.xml,KBKRE06W,003005,10,,A,11,1,Mm.,mm/ITJ ./PUN,
K/KB/KBK.xml,KBKRE06W,003005,11,,B,12,1,Some of the other roads have more individual houses in don't they?,some/DT0 of/PRF the/AT0 other/AJ0 road/NN2 have/VHB more/DT0 individual/AJ0-NN1 house/NN2 in/PRP-AVP do/VDB not/XX0 they/PNP ?/PUN,
K/KB/KBK.xml,KBKRE06W,003005,12,,A,13,1,Well they have bigger  detached houses I'm not  sure how individual they actually are.,well/AV0 they/PNP have/VHB big/AJC detached/AJ0 house/NN2 i/PNP be/VBB not/XX0 sure/AJ0 how/AVQ individual/AJ0 they/PNP actually/AV0 be/VBB ./PUN,
K/KB/KBK.xml,KBKRE06W,003005,13,,B,14,1,But even these aren't all the same.,but/CJC even/AV0 these/DT0 be/VBB not/XX0 all/DT0 the/AT0 same/DT0 ./PUN,
K/KB/KBK.xml,KBKRE06W,003005,14,,A,15,1,Are they not?,be/VBB they/PNP not/XX0 ?/PUN,
K/KB/KBK.xml,KBKRE06W,003005,15,,B,16,1,No  they are all semi-detached but er  there are two or three different styles and they are alternated.,no/ITJ they/PNP be/VBB all/DT0 semi-detached/AJ0 but/CJC er/UNC there/EX0 be/VBB two/CRD or/CJC three/CRD different/AJ0 style/NN2 and/CJC they/PNP be/VBB alternate/VVN ./PUN,
