swda_filename,ptb_basename,conversation_no,transcript_index,act_tag,caller,turn_index,subutterance_index,text,pos,trees
K/KD/KDY.xml,KDYRE003,006204,0,,A,1,1,I tell you what I think sometimes you probably pick up your ashtray  (()) the doors open it was warm.,i/PNP tell/VVB you/PNP what/DTQ i/PNP think/VVB sometimes/AV0 you/PNP probably/AV0 pick/VVB up/AVP-PRP you/DPS ashtray/NN1 the/AT0 door/NN2 open/VVB it/PNP be/VBD warm/AJ0 ./PUN,
K/KD/KDY.xml,KDYRE003,006204,1,,A,1,2,"I think you get hold of your ashtray probably, you might have a cigarette in the other hand or","i/PNP think/VVB you/PNP get/VVB hold/NN1 of/PRF you/DPS ashtray/NN1 probably/AV0 ,/PUN you/PNP might/VM0 have/VHI a/AT0 cigarette/NN1 in/PRP the/AT0 other/AJ0 hand/NN1 or/CJC",
K/KD/KDY.xml,KDYRE003,006204,2,,B,2,1,No I don't.,no/ITJ i/PNP do/VDB not/XX0 ./PUN,
K/KD/KDY.xml,KDYRE003,006204,3,,B,2,2,"What I usu- , what I usually do is  turn the  always when I get up  like when Nick and I saw the, we saw the film","what/DTQ i/PNP usu/UNC ,/PUN what/DTQ i/PNP usually/AV0 do/VDB be/VBZ turn/VVI the/AT0 always/AV0 when/CJS i/PNP get/VVB up/AVP like/AV0 when/CJS-AVQ nick/NP0 and/CJC i/PNP see/VVD the/AT0 ,/PUN we/PNP see/VVD the/AT0 film/NN1",
K/KD/KDY.xml,KDYRE003,006204,4,,A,3,1,He'd gone up hadn't he?,he/PNP have/VHD go/VVN up/AVP have/VHD not/XX0 he/PNP ?/PUN,
K/KD/KDY.xml,KDYRE003,006204,5,,B,4,1,He'd just gone up and I just  I usually get up and turn the fire off and then the television.,he/PNP have/VHD just/AV0 go/VVN up/AVP and/CJC i/PNP just/AV0 i/PNP usually/AV0 get/VVB up/AVP and/CJC turn/VVB the/AT0 fire/NN1 off/AVP and/CJC then/AV0 the/AT0 television/NN1 ./PUN,
K/KD/KDY.xml,KDYRE003,006204,6,,B,4,2,But I must have er  forgot to turn that bloody television off.,but/CJC i/PNP must/VM0 have/VHI er/UNC forget/VVN to/TO0 turn/VVI that/DT0-CJT bloody/AJ0 television/NN1 off/AVP ./PUN,
K/KD/KDY.xml,KDYRE003,006204,7,,A,5,1,Yeah but it was all on you see.,yeah/ITJ but/CJC it/PNP be/VBD all/DT0 on/PRP-AVP you/PNP see/VVB ./PUN,
