swda_filename,ptb_basename,conversation_no,transcript_index,act_tag,caller,turn_index,subutterance_index,text,pos,trees
K/KC/KC4.xml,KC4RE00G,006603,0,,A,1,1,"Don't you ever speak to me like that again,(()) <music> I haven't (()) , I rang, no, no, I  (()) the landlord either, I waited until the next morning.","do/VDB not/XX0 you/PNP ever/AV0 speak/VVI to/PRP i/PNP like/PRP that/DT0 again/AV0 ,/PUN i/PNP have/VHB not/XX0 ,/PUN i/PNP ring/VVD ,/PUN no/ITJ ,/PUN no/ITJ ,/PUN i/PNP the/AT0 landlord/NN1 either/AV0 ,/PUN i/PNP wait/VVD until/PRP the/AT0 next/ORD morning/NN1 ./PUN ",
K/KC/KC4.xml,KC4RE00G,006603,1,,A,1,2,"Rang the landlord the next morning, Saturday morning, and (()) , apparently he has  (()) rang last night (()) , and your wife Debbie took my drink away and  (()) away, I said that's fair enough, so he said (()) .","ring/VVD the/AT0 landlord/NN1 the/AT0 next/ORD morning/NN1 ,/PUN saturday/NP0 morning/NN1 ,/PUN and/CJC ,/PUN apparently/AV0 he/PNP have/VHZ ring/VVD last/ORD night/NN1 ,/PUN and/CJC you/DPS wife/NN1 debbie/NP0 take/VVD i/DPS drink/NN1 away/AV0 and/CJC away/AV0 ,/PUN i/PNP say/VVD that/DT0-CJT be/VBZ fair/AJ0 enough/AV0 ,/PUN so/CJS he/PNP say/VVD ./PUN ",
K/KC/KC4.xml,KC4RE00G,006603,2,,B,2,1,"Oh no it's not, oh no it's not, oh no it's not, no it's not.","oh/ITJ no/ITJ it/PNP be/VBZ not/XX0 ,/PUN oh/ITJ no/ITJ it/PNP be/VBZ not/XX0 ,/PUN oh/ITJ no/ITJ it/PNP be/VBZ not/XX0 ,/PUN no/ITJ it/PNP be/VBZ not/XX0 ./PUN ",
K/KC/KC4.xml,KC4RE00G,006603,3,,A,3,1,"He must of phoned her, I didn't know,(()) said called Debbie.","he/PNP must/VM0 have/VHI phone/VVN she/PNP ,/PUN i/PNP do/VDD not/XX0 know/VVI ,/PUN say/VVD call/VVN debbie/NP0 ./PUN ",
K/KC/KC4.xml,KC4RE00G,006603,4,,B,4,1,No it's bloody not.,no/ITJ it/PNP be/VBZ bloody/AV0-AJ0 not/XX0 ./PUN ,
K/KC/KC4.xml,KC4RE00G,006603,5,,A,5,1,"Took your, took one of your drinks away.","take/VVD you/DPS ,/PUN take/VVD one/CRD of/PRF you/DPS drink/NN2 away/AV0 ./PUN ",
K/KC/KC4.xml,KC4RE00G,006603,6,,B,6,1,"If anybody, if anybody gonna throw your drink away, you should, nobody else.","if/CJS anybody/PNI ,/PUN if/CJS anybody/PNI gon/VVG na/TO0 throw/VVI you/DPS drink/NN1 away/AV0 ,/PUN you/PNP should/VM0 ,/PUN nobody/PNI else/AV0 ./PUN ",
K/KC/KC4.xml,KC4RE00G,006603,7,,A,7,1,"No, so, he said oh,(()) .","no/ITJ ,/PUN so/AV0 ,/PUN he/PNP say/VVD oh/ITJ ,/PUN ./PUN ",
K/KC/KC4.xml,KC4RE00G,006603,8,,A,7,2,(()) fair enough.,fair/AJ0 enough/AV0 ./PUN ,
K/KC/KC4.xml,KC4RE00G,006603,9,,A,7,3,I think I've had enough (()) .,i/PNP think/VVB i/PNP have/VHB have/VHN enough/DT0 ./PUN ,
K/KC/KC4.xml,KC4RE00G,006603,10,,B,8,1,"Said alright, I'll have another one in place of that.","say/VVD alright/AV0 ,/PUN i/PNP will/VM0 have/VHI another/DT0 one/PNI [in/PRP place/NN1 of/PRF]/PRP that/DT0 ./PUN ",
K/KC/KC4.xml,KC4RE00G,006603,11,,A,9,1,"Yeah, anyway, I thought well, there's so  (()) he said keep getting that bloody form, I  (()) if you don't like it (()) .","yeah/ITJ ,/PUN anyway/AV0 ,/PUN i/PNP think/VVD well/AV0 ,/PUN there/EX0 be/VBZ so/AV0 he/PNP say/VVD keep/VVB get/VVG that/DT0 bloody/AJ0 form/NN1-VVB ,/PUN i/PNP if/CJS you/PNP do/VDB not/XX0 like/VVI it/PNP ./PUN ",
K/KC/KC4.xml,KC4RE00G,006603,12,,A,9,2,"I said, well, what I'm ringing about is am I allowed back in there or am I barred?","i/PNP say/VVD ,/PUN well/AV0 ,/PUN what/DTQ i/PNP be/VBB ring/VVG about/PRP-AVP be/VBZ be/VBB i/PNP allow/VVN back/AVP in/PRP there/AV0 or/CJC be/VBB i/PNP bar/VVN ?/PUN ",
K/KC/KC4.xml,KC4RE00G,006603,13,,A,9,3,"He said, no, you're welcome back in here, there was nothing serious, it was only between you and (()) , I said well thank you very much, I'll see you later.","he/PNP say/VVD ,/PUN no/ITJ ,/PUN you/PNP be/VBB welcome/AJ0 back/NN1 in/PRP here/AV0 ,/PUN there/EX0 be/VBD nothing/PNI serious/AJ0 ,/PUN it/PNP be/VBD only/AV0 between/PRP you/PNP and/CJC ,/PUN i/PNP say/VVD well/AV0 thank/VVB you/PNP very/AV0 much/AV0 ,/PUN i/PNP will/VM0 see/VVI you/PNP later/AV0 ./PUN ",
K/KC/KC4.xml,KC4RE00G,006603,14,,B,10,1,"Maria went, bloody hell, erm, I mean, I don't know about (()) , I've never bothered about  (()) anyway, I think he's a bloody dead loss, they were a dead loss when they were in this bloody pub.","maria/NP0 go/VVD ,/PUN bloody/AJ0 hell/NN1 ,/PUN erm/UNC ,/PUN i/PNP mean/VVB ,/PUN i/PNP do/VDB not/XX0 know/VVI about/PRP ,/PUN i/PNP have/VHB never/AV0 bother/VVN about/PRP anyway/AV0 ,/PUN i/PNP think/VVB he/PNP be/VBZ a/AT0 bloody/AJ0 dead/AJ0 loss/NN1 ,/PUN they/PNP be/VBD a/AT0 dead/AJ0 loss/NN1 when/CJS they/PNP be/VBD in/PRP this/DT0 bloody/AJ0 pub/NN1 ./PUN ",
K/KC/KC4.xml,KC4RE00G,006603,15,,A,11,1,Just bloody (()) .,just/AV0 bloody/AJ0-AV0 ./PUN ,
K/KC/KC4.xml,KC4RE00G,006603,16,,B,12,1,"Eh, but, I mean","eh/ITJ ,/PUN but/CJC ,/PUN i/PNP mean/VVB ",
K/KC/KC4.xml,KC4RE00G,006603,17,,A,13,1,I said to her,i/PNP say/VVD to/PRP she/PNP ,
K/KC/KC4.xml,KC4RE00G,006603,18,,B,14,1,"she's never, she never speaks to me.","she/PNP be/VBZ never/AV0 ,/PUN she/PNP never/AV0 speak/VVZ to/PRP i/PNP ./PUN ",
K/KC/KC4.xml,KC4RE00G,006603,19,,A,15,1,"(()) , no she don't like you.",",/PUN no/ITJ she/PNP do/VDB not/XX0 like/VVI you/PNP ./PUN ",
K/KC/KC4.xml,KC4RE00G,006603,20,,B,16,1,And I never speak to her.,and/CJC i/PNP never/AV0 speak/VVB to/PRP she/PNP ./PUN ,
K/KC/KC4.xml,KC4RE00G,006603,21,,A,17,1,Don't like anybody (()) .,do/VDB not/XX0 like/VVI anybody/PNI ./PUN ,
K/KC/KC4.xml,KC4RE00G,006603,22,,B,18,1,"I don't know  (()) bloody well like me, because I told her off one day, told her where to bloody go to.","i/PNP do/VDB not/XX0 know/VVI bloody/AV0 well/AV0 like/PRP i/PNP ,/PUN because/CJS i/PNP tell/VVD she/PNP off/PRP-AVP one/CRD day/NN1 ,/PUN tell/VVD she/PNP where/AVQ to/TO0 bloody/AV0 go/VVB-NN1 to/PRP ./PUN ",
K/KC/KC4.xml,KC4RE00G,006603,23,,A,19,1,"She's (()) , she went up to Kevin and said (()) .","she/PNP be/VBZ ,/PUN she/PNP go/VVD [up/AVP to/PRP]/PRP kevin/NP0 and/CJC say/VVD ./PUN ",
K/KC/KC4.xml,KC4RE00G,006603,24,,A,19,2,"Yeah, anyway","yeah/ITJ ,/PUN anyway/AV0 ",
K/KC/KC4.xml,KC4RE00G,006603,25,,B,20,1,"Oh no, no,(()) when I told her off.","oh/ITJ no/ITJ ,/PUN no/ITJ ,/PUN when/CJS i/PNP tell/VVD she/PNP off/AVP ./PUN ",
K/KC/KC4.xml,KC4RE00G,006603,26,,A,21,1,I don't never see her let alone.,i/PNP do/VDB not/XX0 never/AV0 see/VVI she/PNP [let/VVB alone/AJ0]/PRP ./PUN ,
K/KC/KC4.xml,KC4RE00G,006603,27,,B,22,1,Oh you (()) .,oh/ITJ you/PNP ./PUN ,
K/KC/KC4.xml,KC4RE00G,006603,28,,A,23,1,Anyway what's it got to (()) .,anyway/AV0 what/DTQ be/VBZ it/PNP get/VVN to/TO0 ./PUN ,
K/KC/KC4.xml,KC4RE00G,006603,29,,B,24,1,"This is before I left (()) , I  (()) I, I haven't done (()) .","this/DT0 be/VBZ before/CJS i/PNP leave/VVD ,/PUN i/PNP i/PNP ,/PUN i/PNP have/VHB not/XX0 do/VDN ./PUN ",
K/KC/KC4.xml,KC4RE00G,006603,30,,A,25,1,(()) ,,
K/KC/KC4.xml,KC4RE00G,006603,31,,B,26,1,"I told her she was an interfering old cow, I think.<laugh> ","i/PNP tell/VVD she/PNP she/PNP be/VBD an/AT0 interfering/AJ0 old/AJ0 cow/NN1 ,/PUN i/PNP think/VVB ./PUN ",
K/KC/KC4.xml,KC4RE00G,006603,32,,A,27,1,"(()) , when she was on the phone.",",/PUN when/CJS she/PNP be/VBD on/PRP the/AT0 phone/NN1 ./PUN ",
K/KC/KC4.xml,KC4RE00G,006603,33,,B,28,1,Yeah.,yeah/ITJ ./PUN ,
K/KC/KC4.xml,KC4RE00G,006603,34,,A,29,1,"She didn't have the guts to say wait until the next day, when she saw me  (()) ring me up.","she/PNP do/VDD not/XX0 have/VHI the/AT0 guts/NN2 to/TO0 say/VVI wait/VVB-NN1 until/PRP the/AT0 next/ORD day/NN1 ,/PUN when/AVQ she/PNP see/VVD i/PNP ring/VVI i/PNP up/AVP ./PUN ",
K/KC/KC4.xml,KC4RE00G,006603,35,,B,30,1,"Yeah, yeah, yeah.","yeah/ITJ ,/PUN yeah/ITJ ,/PUN yeah/ITJ ./PUN ",
K/KC/KC4.xml,KC4RE00G,006603,36,,A,31,1,"(()) don't you ever speak to me like that again, and don't ever push me again, I said balls you old cunt.","do/VDB not/XX0 you/PNP ever/AV0 speak/VVI to/PRP i/PNP like/PRP that/DT0 again/AV0 ,/PUN and/CJC do/VDB not/XX0 ever/AV0 push/VVI i/PNP again/AV0 ,/PUN i/PNP say/VVD ball/NN2 you/PNP old/AJ0 cunt/NN1 ./PUN ",
K/KC/KC4.xml,KC4RE00G,006603,37,,B,32,1,<laugh> ,,
K/KC/KC4.xml,KC4RE00G,006603,38,,A,33,1,"And, whether, whether she was still listening I don't know,(()) put the phone down.","and/CJC ,/PUN whether/CJS ,/PUN whether/CJS she/PNP be/VBD still/AV0-AJ0 listen/VVG i/PNP do/VDB not/XX0 know/VVI ,/PUN put/VVB the/AT0 phone/NN1 down/AVP ./PUN ",
K/KC/KC4.xml,KC4RE00G,006603,39,,B,34,1,(()) alright.,alright/AV0 ./PUN ,
K/KC/KC4.xml,KC4RE00G,006603,40,,B,34,2,"Well that's alright, that's alright,(()) .","well/AV0 that/DT0 be/VBZ alright/AJ0 ,/PUN that/DT0 be/VBZ alright/AJ0 ,/PUN ./PUN ",
K/KC/KC4.xml,KC4RE00G,006603,41,,A,35,1,"(()) , but she told Helen, I just called her an old cow and she put the phoned down, well if she thought I said cow, well I don't know but she went and used that (()) .",",/PUN but/CJC she/PNP tell/VVD helen/NP0 ,/PUN i/PNP just/AV0 call/VVD she/PNP an/AT0 old/AJ0 cow/NN1 and/CJC she/PNP put/VVD the/AT0 phone/VVN-VVD down/AVP ,/PUN well/AV0 if/CJS she/PNP think/VVD i/PNP say/VVD cow/NN1 ,/PUN well/AV0 i/PNP do/VDB not/XX0 know/VVI but/CJC she/PNP go/VVD and/CJC use/VVD that/DT0 ./PUN ",
K/KC/KC4.xml,KC4RE00G,006603,42,,B,36,1,Don't worry about it.<laugh> ,do/VDB not/XX0 worry/VVI about/PRP it/PNP ./PUN ,
K/KC/KC4.xml,KC4RE00G,006603,43,,A,37,1,So she told Helen all about it.,so/AV0 she/PNP tell/VVD helen/NP0 all/DT0 about/PRP it/PNP ./PUN ,
K/KC/KC4.xml,KC4RE00G,006603,44,,B,38,1,"Ah yes, well you see, you see, in effect if you called her an old (()) , that could've been, that, that, that, that, that, that, that could've been eh, that could've been eh, that could've been, you know, you could've been given her a, that could've of been a praise, you old cow.<laugh> ","ah/ITJ yes/ITJ ,/PUN well/AV0 you/PNP see/VVB ,/PUN you/PNP see/VVB ,/PUN in/PRP effect/NN1 if/CJS you/PNP call/VVD she/PNP an/AT0 old/AJ0 ,/PUN that/DT0-CJT could/VM0 have/VHI be/VBN ,/PUN that/DT0-CJT ,/PUN that/DT0-CJT ,/PUN that/DT0-CJT ,/PUN that/DT0-CJT ,/PUN that/DT0-CJT ,/PUN that/DT0-CJT ,/PUN that/DT0-CJT could/VM0 have/VHI be/VBN eh/ITJ ,/PUN that/DT0-CJT could/VM0 have/VHI be/VBN eh/ITJ ,/PUN that/DT0-CJT could/VM0 have/VHI be/VBN ,/PUN you/PNP know/VVB ,/PUN you/PNP could/VM0 have/VHI be/VBN give/VVN she/PNP a/AT0 ,/PUN that/DT0-CJT could/VM0 have/VHI of/PRF be/VBN a/AT0 praise/NN1 ,/PUN you/PNP old/AJ0 cow/NN1 ./PUN ",
K/KC/KC4.xml,KC4RE00G,006603,45,,A,39,1,I said balls you old (()) .(()) ,i/PNP say/VVD ball/NN2 you/PNP old/AJ0 ./PUN ,
K/KC/KC4.xml,KC4RE00G,006603,46,,B,40,1,(()) ,,
K/KC/KC4.xml,KC4RE00G,006603,47,,A,41,1,"(()) called an old cow, so she put the phone down.","call/VVN an/AT0 old/AJ0 cow/NN1 ,/PUN so/CJS she/PNP put/VVD the/AT0 phone/NN1 down/AVP ./PUN ",
K/KC/KC4.xml,KC4RE00G,006603,48,,B,42,1,"Do you remember the days we've had (()) , darling?","do/VDB you/PNP remember/VVI the/AT0 day/NN2 we/PNP have/VHB have/VHN ,/PUN darling/NN1 ?/PUN ",
K/KC/KC4.xml,KC4RE00G,006603,49,,A,43,1,Yeah.,yeah/ITJ ./PUN ,
K/KC/KC4.xml,KC4RE00G,006603,50,,B,44,1,Eh?,eh/ITJ ?/PUN ,
K/KC/KC4.xml,KC4RE00G,006603,51,,B,44,2,"An old bugger I was, well I was a young bugger actually then,(()) yeah, yeah.","an/AT0 old/AJ0 bugger/NN1 i/PNP be/VBD ,/PUN well/AV0 i/PNP be/VBD a/AT0 young/AJ0 bugger/NN1 actually/AV0 then/AV0 ,/PUN yeah/ITJ ,/PUN yeah/ITJ ./PUN ",
K/KC/KC4.xml,KC4RE00G,006603,52,,B,44,3,"I, did you, did you remember the first ruddy time I ever went with you?","i/PNP ,/PUN do/VDD you/PNP ,/PUN do/VDD you/PNP remember/VVI the/AT0 first/ORD ruddy/AJ0 time/NN1 i/PNP ever/AV0 go/VVD with/PRP you/PNP ?/PUN ",
K/KC/KC4.xml,KC4RE00G,006603,53,,B,44,4,"Oh yes you bloody well  (()) that, old, old eh, the bloke with a, with a (()) , what's his name?(()) the Canadian bloke, got an artificial leg.","oh/ITJ yes/ITJ you/PNP bloody/AV0 well/AV0 that/DT0-CJT ,/PUN old/AJ0 ,/PUN old/AJ0 eh/ITJ ,/PUN the/AT0 bloke/NN1 with/PRP a/AT0 ,/PUN with/PRP a/AT0 ,/PUN what/DTQ be/VBZ he/DPS name/NN1 ?/PUN the/AT0 canadian/AJ0-NN1 bloke/NN1 ,/PUN get/VVD an/AT0 artificial/AJ0 leg/NN1 ./PUN ",
K/KC/KC4.xml,KC4RE00G,006603,54,,A,45,1,"Oh  (()) oh yeah, yeah, yeah.","oh/ITJ oh/ITJ yeah/ITJ ,/PUN yeah/ITJ ,/PUN yeah/ITJ ./PUN ",
K/KC/KC4.xml,KC4RE00G,006603,55,,B,46,1,"That'll do, that'll do  (()) and, and, and, and, and who was the bloke well dressed?","that/DT0 will/VM0 do/VDI ,/PUN that/DT0 will/VM0 do/VDI and/CJC ,/PUN and/CJC ,/PUN and/CJC ,/PUN and/CJC ,/PUN and/CJC who/PNQ be/VBD the/AT0 bloke/NN1 well/AV0 dress/VVN ?/PUN ",
K/KC/KC4.xml,KC4RE00G,006603,56,,B,46,2,You know and his  (()) where there,you/PNP know/VVB and/CJC he/DPS where/CJS-AVQ there/EX0 ,
K/KC/KC4.xml,KC4RE00G,006603,57,,A,47,1,Dot.,dot/NN1 ./PUN ,
K/KC/KC4.xml,KC4RE00G,006603,58,,B,48,1,"(()) Dot, and the (()) , that was the first time I ever went with you darling, do you realise that?","dot/NN1 ,/PUN and/CJC the/AT0 ,/PUN that/DT0 be/VBD the/AT0 first/ORD time/NN1 i/PNP ever/AV0 go/VVD with/PRP you/PNP darling/NN1 ,/PUN do/VDB you/PNP realise/VVI that/DT0 ?/PUN ",
K/KC/KC4.xml,KC4RE00G,006603,59,,A,49,1,"Erm, yeah (()) .","erm/UNC ,/PUN yeah/ITJ ./PUN ",
K/KC/KC4.xml,KC4RE00G,006603,60,,B,50,1,Eh?,eh/ITJ ?/PUN ,
K/KC/KC4.xml,KC4RE00G,006603,61,,A,51,1,It's called (()) .,it/PNP be/VBZ call/VVN ./PUN ,
K/KC/KC4.xml,KC4RE00G,006603,62,,B,52,1,"Who, who?","who/PNQ ,/PUN who/PNQ ?/PUN ",
K/KC/KC4.xml,KC4RE00G,006603,63,,A,53,1,Me and (()) .,i/PNP and/CJC ./PUN ,
K/KC/KC4.xml,KC4RE00G,006603,64,,B,54,1,"You're not, you're not still there in the house, what you talking about?","you/PNP be/VBB not/XX0 ,/PUN you/PNP be/VBB not/XX0 still/AV0 there/AV0 in/PRP the/AT0 house/NN1 ,/PUN what/DTQ you/PNP talk/VVG about/PRP ?/PUN ",
