swda_filename,ptb_basename,conversation_no,transcript_index,act_tag,caller,turn_index,subutterance_index,text,pos,trees
K/KD/KDE.xml,KDERE00K,006903,0,,A,1,1,Oliver please don't do that to the flowers.,oliver/NP0 please/AV0 do/VDB not/XX0 do/VDI that/DT0 to/PRP the/AT0 flower/NN2 ./PUN,
K/KD/KDE.xml,KDERE00K,006903,1,,B,2,1,No (()),no/ITJ,
K/KD/KDE.xml,KDERE00K,006903,2,,A,3,1,No I don't want you to do anything like that to the flowers at all.,no/ITJ i/PNP do/VDB not/XX0 want/VVI you/PNP to/TO0 do/VDI anything/PNI like/PRP that/DT0 to/PRP the/AT0 flower/NN2 [at/PRP all/DT0]/AV0 ./PUN,
K/KD/KDE.xml,KDERE00K,006903,3,,B,4,1,(()) ,,
K/KD/KDE.xml,KDERE00K,006903,4,,A,5,1,Well I'm sure they don't like you if you keep bashing them.,well/AV0 i/PNP be/VBB sure/AJ0 they/PNP do/VDB not/XX0 like/VVI you/PNP if/CJS you/PNP keep/VVB bash/VVG they/PNP ./PUN,
K/KD/KDE.xml,KDERE00K,006903,5,,A,5,2,"Quickly, in the car.","quickly/AV0 ,/PUN in/PRP the/AT0 car/NN1 ./PUN",
K/KD/KDE.xml,KDERE00K,006903,6,,B,6,1,(()) ,,
K/KD/KDE.xml,KDERE00K,006903,7,,A,7,1,"Come on, in you get.","come/VVB on/AVP ,/PUN in/AVP you/PNP get/VVB ./PUN",
K/KD/KDE.xml,KDERE00K,006903,8,,B,8,1,I make them dead.,i/PNP make/VVB they/PNP dead/AJ0 ./PUN,
K/KD/KDE.xml,KDERE00K,006903,9,,A,9,1,"Come on, in you get.","come/VVB on/AVP ,/PUN in/AVP you/PNP get/VVB ./PUN",
K/KD/KDE.xml,KDERE00K,006903,10,,B,10,1,I make them dead.,i/PNP make/VVB they/PNP dead/AJ0 ./PUN,
K/KD/KDE.xml,KDERE00K,006903,11,,A,11,1,Go up there further.,go/VVB up/AVP there/AV0 further/far/AV0 ./PUN,
K/KD/KDE.xml,KDERE00K,006903,12,,B,12,1,Mm?,mm/ITJ ?/PUN,
K/KD/KDE.xml,KDERE00K,006903,13,,A,13,1,Go up there further so that you can get in the car properly.,go/VVB up/AVP there/AV0 further/far/AV0 [so/AV0 that/CJT]/CJS you/PNP can/VM0 get/VVI in/PRP the/AT0 car/NN1 properly/AV0 ./PUN,
K/KD/KDE.xml,KDERE00K,006903,14,,A,13,2,"Go on, in you get.","go/VVB on/AVP ,/PUN in/AVP you/PNP get/VVB ./PUN",
K/KD/KDE.xml,KDERE00K,006903,15,,B,14,1,I can't.,i/PNP can/VM0 not/XX0 ./PUN,
K/KD/KDE.xml,KDERE00K,006903,16,,A,15,1,"Yes you can, pull the seat forward.","yes/ITJ you/PNP can/VM0 ,/PUN pull/VVB the/AT0 seat/NN1 forward/AV0 ./PUN",
K/KD/KDE.xml,KDERE00K,006903,17,,A,15,2,"Oh Oliver, go up there.","oh/ITJ oliver/NP0 ,/PUN go/VVB up/AVP there/AV0 ./PUN",
K/KD/KDE.xml,KDERE00K,006903,18,,A,15,3,<sigh> . Go on.,./PUN go/VVB on/AVP ./PUN,
K/KD/KDE.xml,KDERE00K,006903,19,,A,15,4,Put this down and then maybe you'll be able to get in.,put/VVB this/DT0 down/AVP and/CJC then/AV0 maybe/AV0 you/PNP will/VM0 be/VBI able/AJ0 to/TO0 get/VVI in/AVP-PRP ./PUN,
