swda_filename,ptb_basename,conversation_no,transcript_index,act_tag,caller,turn_index,subutterance_index,text,pos,trees
K/KD/KDE.xml,KDERE01B,007101,0,,A,1,1,You're always complaining,you/PNP be/VBB always/AV0 complain/VVG ,
K/KD/KDE.xml,KDERE01B,007101,1,,B,2,1,No I'm not,no/ITJ i/PNP be/VBB not/XX0 ,
K/KD/KDE.xml,KDERE01B,007101,2,,A,3,1,about everything I cook.,about/PRP everything/PNI i/PNP cook/VVB ./PUN ,
K/KD/KDE.xml,KDERE01B,007101,3,,A,3,2,It was nice except the courgettes.,it/PNP be/VBD nice/AJ0 except/PRP the/AT0 courgette/NN2 ./PUN ,
K/KD/KDE.xml,KDERE01B,007101,4,,A,3,3,Next time you cook it can you leave out the leeks?,next/ORD time/NN1 you/PNP cook/VVB it/PNP can/VM0 you/PNP leave/VVI out/AVP-PRP the/AT0 leek/NN2 ?/PUN ,
K/KD/KDE.xml,KDERE01B,007101,5,,A,3,4,It was nice but I didn't like the,it/PNP be/VBD nice/AJ0 but/CJC i/PNP do/VDD not/XX0 like/VVI the/AT0 ,
K/KD/KDE.xml,KDERE01B,007101,6,,B,4,1,(()) ,,
K/KD/KDE.xml,KDERE01B,007101,7,,A,5,1,I always use to put onions in it always.,i/PNP always/AV0 use/VVB to/TO0 put/VVI onion/NN2 in/PRP it/PNP always/AV0 ./PUN ,
K/KD/KDE.xml,KDERE01B,007101,8,,B,6,1,Up to ,[up/AVP to/PRP]/PRP ,
K/KD/KDE.xml,KDERE01B,007101,9,,A,7,1,Six months.,six/CRD month/NN2 ./PUN ,
K/KD/KDE.xml,KDERE01B,007101,10,,A,7,2,But I,but/CJC i/PNP ,
K/KD/KDE.xml,KDERE01B,007101,11,,B,8,1,Six months?,six/CRD month/NN2 ?/PUN ,
K/KD/KDE.xml,KDERE01B,007101,12,,A,9,1,Yes but I decided I didn't like it  (()) so I didn't put in any.,yes/ITJ but/CJC i/PNP decide/VVD i/PNP do/VDD not/XX0 like/VVI it/PNP so/AV0 i/PNP do/VDD not/XX0 put/VVI in/PRP-AVP any/DT0 ./PUN ,
K/KD/KDE.xml,KDERE01B,007101,13,,A,9,2,But when I didn't put any you said why can't we have it with the onions any more and I said you said it gave you indigestion.,but/CJC when/CJS i/PNP do/VDD not/XX0 put/VVI any/DT0 you/PNP say/VVD why/AVQ can/VM0 not/XX0 we/PNP have/VHI it/PNP with/PRP the/AT0 onion/NN2 any/DT0 more/DT0 and/CJC i/PNP say/VVD you/PNP say/VVD it/PNP give/VVD you/PNP indigestion/NN1 ./PUN ,
K/KD/KDE.xml,KDERE01B,007101,14,,B,10,1,Hm ,hm/ITJ ,
K/KD/KDE.xml,KDERE01B,007101,15,,A,11,1,(()) In future you decide exactly what you want to eat and you tell me what you want in it.,in/PRP future/NN1-AJ0 you/PNP decide/VVB exactly/AV0 what/DTQ you/PNP want/VVB to/TO0 eat/VVI and/CJC you/PNP tell/VVB i/PNP what/DTQ you/PNP want/VVB in/PRP it/PNP ./PUN ,
K/KD/KDE.xml,KDERE01B,007101,16,,B,12,1,I'm not moaning,i/PNP be/VBB not/XX0 moan/VVG ,
K/KD/KDE.xml,KDERE01B,007101,17,,A,13,1,You are moaning,you/PNP be/VBB moan/VVG ,
K/KD/KDE.xml,KDERE01B,007101,18,,B,14,1,I'm not,i/PNP be/VBB not/XX0 ,
K/KD/KDE.xml,KDERE01B,007101,19,,A,15,1,and its getting on my nerves.,and/CJC it/DPS get/VVG on/PRP-AVP i/DPS nerve/NN2 ./PUN ,
K/KD/KDE.xml,KDERE01B,007101,20,,B,16,1,I'm not,i/PNP be/VBB not/XX0 ,
K/KD/KDE.xml,KDERE01B,007101,21,,A,17,1,(()) ,,
K/KD/KDE.xml,KDERE01B,007101,22,,B,18,1,I just asked why there's onions in it,i/PNP just/AV0 ask/VVD why/AVQ there/EX0 be/VBZ onion/NN2 in/PRP it/PNP ,
K/KD/KDE.xml,KDERE01B,007101,23,,A,19,1,Because I always used to toss it in,because/CJS i/PNP always/AV0 used/VM0 to/TO0 toss/VVI it/PNP in/AVP-PRP ,
K/KD/KDE.xml,KDERE01B,007101,24,,B,20,1,So you just changed your mind and put it in,so/AV0 you/PNP just/AV0 change/VVD you/DPS mind/NN1 and/CJC put/VVB it/PNP in/AVP-PRP ,
K/KD/KDE.xml,KDERE01B,007101,25,,A,21,1,I just decided to put it in to see if it tastes better (()) .,i/PNP just/AV0 decide/VVD to/TO0 put/VVI it/PNP in/AVP to/TO0 see/VVI if/CJS it/PNP taste/VVZ good/AJC ./PUN ,
K/KD/KDE.xml,KDERE01B,007101,26,,A,21,2,If it's a problem throw it all away.,if/CJS it/PNP be/VBZ a/AT0 problem/NN1 throw/VVB-NN1 it/PNP all/DT0 away/AV0 ./PUN ,
K/KD/KDE.xml,KDERE01B,007101,27,,A,21,3,I'm sick to death of it.,i/PNP be/VBB sick/AJ0 to/PRP death/NN1 of/PRF it/PNP ./PUN ,
K/KD/KDE.xml,KDERE01B,007101,28,,A,21,4,--,,
K/KD/KDE.xml,KDERE01B,007101,29,,A,21,5,--and I put pasta and it was nice except ,and/CJC i/PNP put/VVB pasta/NN1 and/CJC it/PNP be/VBD nice/AJ0 except/PRP ,
K/KD/KDE.xml,KDERE01B,007101,30,,B,22,1,I just asked a question.,i/PNP just/AV0 ask/VVD a/AT0 question/NN1 ./PUN ,
K/KD/KDE.xml,KDERE01B,007101,31,,B,22,2,Don't carry on,do/VDB not/XX0 carry/VVI on/AVP ,
K/KD/KDE.xml,KDERE01B,007101,32,,A,23,1,Well why did you say that the other day then?,well/AV0 why/AVQ do/VDD you/PNP say/VVI that/DT0 the/AT0 other/AJ0 day/NN1 then/AV0 ?/PUN ,
K/KD/KDE.xml,KDERE01B,007101,33,,A,23,2,It was nice but the next time you do it can you not put such and such in it.,it/PNP be/VBD nice/AJ0 but/CJC the/AT0 next/ORD time/NN1 you/PNP do/VDB it/PNP can/VM0 you/PNP not/XX0 put/VVI such/DT0 and/CJC such/DT0 in/PRP it/PNP ./PUN ,
K/KD/KDE.xml,KDERE01B,007101,34,,B,24,1,Yes well what is the point (()) ,yes/ITJ well/AV0 what/DTQ be/VBZ the/AT0 point/NN1 ,
K/KD/KDE.xml,KDERE01B,007101,35,,A,25,1,Well what is the point in me cooking?,well/AV0 what/DTQ be/VBZ the/AT0 point/NN1 in/PRP i/DPS cooking/NN1-VVG ?/PUN ,
K/KD/KDE.xml,KDERE01B,007101,36,,A,25,2,Oh yeah it was nice but I'd rather not have that in it.,oh/ITJ yeah/ITJ it/PNP be/VBD nice/AJ0 but/CJC i/PNP would/VM0 rather/AV0 not/XX0 have/VHI that/DT0 in/PRP it/PNP ./PUN ,
K/KD/KDE.xml,KDERE01B,007101,37,,A,25,3,Why have we got that and that?,why/AVQ have/VHB we/PNP get/VVN that/DT0 and/CJC that/DT0 ?/PUN ,
K/KD/KDE.xml,KDERE01B,007101,38,,B,26,1,Two (()) ,two/CRD ,
K/KD/KDE.xml,KDERE01B,007101,39,,A,27,1,It's not Willie it's all the time every week you say something about something.,it/PNP be/VBZ not/XX0 willie/NP0 it/PNP be/VBZ all/DT0 the/AT0 time/NN1 every/AT0 week/NN1 you/PNP say/VVB something/PNI about/PRP something/PNI ./PUN ,
K/KD/KDE.xml,KDERE01B,007101,40,,A,27,2,You tell me what you'd like to eat exactly in future and if I feel like doing it I'll do it.,you/PNP tell/VVB i/PNP what/DTQ you/PNP would/VM0 like/VVI to/TO0 eat/VVI exactly/AV0 in/PRP future/NN1 and/CJC if/CJS i/PNP feel/VVB like/PRP do/VDG it/PNP i/PNP will/VM0 do/VDI it/PNP ./PUN ,
K/KD/KDE.xml,KDERE01B,007101,41,,A,27,3,And if I don't feel like doing it you can do something yourself.,and/CJC if/CJS i/PNP do/VDB not/XX0 feel/VVI like/PRP do/VDG it/PNP you/PNP can/VM0 do/VDI something/PNI yourself/PNX ./PUN ,
K/KD/KDE.xml,KDERE01B,007101,42,,A,27,4,Ah.,ah/ITJ ./PUN ,
K/KD/KDE.xml,KDERE01B,007101,43,,A,27,5,Don't  (()) It's our anniversary ,do/VDB not/XX0 it/PNP be/VBZ we/DPS anniversary/NN1 ,
K/KD/KDE.xml,KDERE01B,007101,44,,A,27,6,Other people seem to  --,other/AJ0 people/NN0 seem/VVB to/TO0 ,
K/KD/KDE.xml,KDERE01B,007101,45,,A,27,7,--complain about their hangers multiplying whenever I've  (()) got hangers disappear.,complain/VVI about/PRP they/DPS hanger/NN2 multiply/VVG whenever/AVQ i/PNP have/VHB get/VVN hanger/NN2 disappear/VVB ./PUN ,
K/KD/KDE.xml,KDERE01B,007101,46,,A,27,8,I've never got enough hangers to hand the clothes back up on the cable.,i/PNP have/VHB never/AV0 get/VVN enough/DT0 hanger/NN2 to/TO0 hand/VVI the/AT0 clothes/NN2 back/AVP up/AVP on/PRP the/AT0 cable/NN1 ./PUN ,
K/KD/KDE.xml,KDERE01B,007101,47,,A,27,9,--,,
K/KD/KDE.xml,KDERE01B,007101,48,,A,27,10,--I don't know whether we should bring those plants in tonight because erm they reckon it's going to become frosty  --,i/PNP do/VDB not/XX0 know/VVI whether/CJS we/PNP should/VM0 bring/VVI those/DT0 plant/NN2 in/AVP-PRP tonight/AV0 because/CJS erm/UNC they/PNP reckon/VVB it/PNP be/VBZ go/VVG to/TO0 become/VVI frosty/AJ0 ,
K/KD/KDE.xml,KDERE01B,007101,49,,A,27,11,--those ones that we haven't planted yet  --,those/DT0 one/NN2 that/CJT we/PNP have/VHB not/XX0 plant/VVN yet/AV0 ,
K/KD/KDE.xml,KDERE01B,007101,50,,A,27,12,--and the hanging baskets.,and/CJC the/AT0 hanging/AJ0-NN1 basket/NN2 ./PUN ,
K/KD/KDE.xml,KDERE01B,007101,51,,A,27,13,Do you mind?,do/VDB you/PNP mind/VVI ?/PUN ,
