swda_filename,ptb_basename,conversation_no,transcript_index,act_tag,caller,turn_index,subutterance_index,text,pos,trees
K/KD/KDA.xml,KDARE00F,011607,0,,A,1,1,When you're fucking pissed out does compare to lot of them  (()) taking sister up to er Black  (()) you know.,when/CJS you/PNP be/VBB fucking/AV0 piss/VVN-VVD out/AVP do/VDZ compare/VVI to/PRP lot/NN1 of/PRF they/PNP take/VVG sister/NN1 [up/AVP to/PRP]/PRP er/UNC black/AJ0 you/PNP know/VVB ./PUN ,
K/KD/KDA.xml,KDARE00F,011607,1,,B,2,1,"Yeah, I could do with some (()) .(()) ","yeah/ITJ ,/PUN i/PNP could/VM0 do/VDI with/PRP some/DT0 ./PUN ",
K/KD/KDA.xml,KDARE00F,011607,2,,A,3,1,The thing is the  (()) said to me  --,the/AT0 thing/NN1 be/VBZ the/AT0 say/VVD-AJ0 to/PRP i/PNP ,
K/KD/KDA.xml,KDARE00F,011607,3,,A,3,2,"--she said, oh  (()) were going out in style and have a drink, had a really nice sandwich there like, it was french loaf about that bit, get nice home cooked  (()) lot's of cheese and onion right, really nice (()) .","she/PNP say/VVD ,/PUN oh/ITJ be/VBD go/VVG out/AVP in/PRP style/NN1 and/CJC have/VHB a/AT0 drink/NN1 ,/PUN have/VHD a/AT0 really/AV0 nice/AJ0 sandwich/NN1 there/AV0 like/AV0 ,/PUN it/PNP be/VBD french/AJ0 loaf/NN1 about/PRP that/DT0 bit/NN1 ,/PUN get/VVB nice/AJ0 home/NN1 cooked/AJ0-VVD lot/NN1 be/VBZ of/PRF cheese/NN1 and/CJC onion/NN1 right/AV0-AJ0 ,/PUN really/AV0 nice/AJ0 ./PUN ",
K/KD/KDA.xml,KDARE00F,011607,4,,A,3,3,Fucking dangling (()) .,fucking/AV0 dangle/VVG ./PUN ,
K/KD/KDA.xml,KDARE00F,011607,5,,B,4,1,"Yeah, I just go and get this and I'll go and pop down to (()) .","yeah/ITJ ,/PUN i/PNP just/AV0 go/VVB and/CJC get/VVB this/DT0 and/CJC i/PNP will/VM0 go/VVI and/CJC pop/VVI down/AVP to/PRP ./PUN ",
K/KD/KDA.xml,KDARE00F,011607,6,,A,5,1,(()) eat sort of thing.,eat/VVB sort/NN1 of/PRF thing/NN1 ./PUN ,
K/KD/KDA.xml,KDARE00F,011607,7,,A,5,2,We eventually got in there about coming up to half past two,we/PNP eventually/AV0 get/VVD in/PRP there/AV0 about/PRP come/VVG [up/AVP to/PRP]/AV0 half/DT0 past/PRP two/CRD ,
K/KD/KDA.xml,KDARE00F,011607,8,,B,6,1,Yeah.,yeah/ITJ ./PUN ,
K/KD/KDA.xml,KDARE00F,011607,9,,A,7,1,"so I mean I'd been dying for this pint all, all day sort of thing, I felt much better after that.","so/AV0 i/PNP mean/VVB i/PNP have/VHD be/VBN die/VVG for/PRP this/DT0 pint/NN1 all/AV0 ,/PUN all/AV0 day/NN1 sort/NN1 of/PRF thing/NN1 ,/PUN i/PNP feel/VVD much/AV0 good/AJC after/PRP that/DT0 ./PUN ",
K/KD/KDA.xml,KDARE00F,011607,10,,A,7,2,"Yes that right, yeah, and that was the start of this erm (()) ","yes/ITJ that/DT0 right/AJ0-AV0 ,/PUN yeah/ITJ ,/PUN and/CJC that/DT0 be/VBD the/AT0 start/NN1 of/PRF this/DT0 erm/UNC ",
K/KD/KDA.xml,KDARE00F,011607,11,,A,7,3,"I said I was  (()) myself but (()) , but what get's me is people stand there chat, I mean your walking behind them and then all of a sudden there just stop dead, and you must be carry on walking  (()) oh god there's about twenty of them there blocking the fucking isle","i/PNP say/VVD i/PNP be/VBD myself/PNX but/CJC ,/PUN but/CJC what/DTQ get/VVB be/VBZ i/PNP be/VBZ people/NN0 stand/VVB-NN1 there/AV0 chat/VVB-NN1 ,/PUN i/PNP mean/VVB you/DPS walk/VVG-AJ0 behind/PRP they/PNP and/CJC then/AV0 [all/DT0 of/PRF a/AT0 sudden/NN1]/AV0 there/AV0 just/AV0 stop/VVB dead/AJ0 ,/PUN and/CJC you/PNP must/VM0 be/VBI carry/VVB on/AVP walk/VVG oh/ITJ god/NN1 there/EX0 be/VBZ about/AV0 twenty/CRD of/PRF they/PNP there/AV0 block/VVG the/AT0 fucking/AJ0 isle/NN1 ",
K/KD/KDA.xml,KDARE00F,011607,12,,B,8,1,Yeah,yeah/ITJ ,
K/KD/KDA.xml,KDARE00F,011607,13,,A,9,1,"and you've got to try and get round them, oh god, there's about six thousand  (()) trying to do the same thing.(()) ","and/CJC you/PNP have/VHB get/VVN to/TO0 try/VVI and/CJC get/VVI round/PRP they/PNP ,/PUN oh/ITJ god/NN1 ,/PUN there/EX0 be/VBZ about/AV0 six/CRD thousand/CRD try/VVG-AJ0 to/TO0 do/VDI the/AT0 same/DT0 thing/NN1 ./PUN ",
K/KD/KDA.xml,KDARE00F,011607,14,,A,9,2,I'll tell you what my idea of hell is  (()) going Christmas shopping with them.,i/PNP will/VM0 tell/VVI you/PNP what/DTQ i/DPS idea/NN1 of/PRF hell/NN1 be/VBZ go/VVG-AJ0 christmas/NN1 shop/VVG-NN1 with/PRP they/PNP ./PUN ,
K/KD/KDA.xml,KDARE00F,011607,15,,A,9,3,"(()) and then you've got women all round the worse one's are the women with the kiddies in the pushchair,(()) and you've got to go round and you (()) .","and/CJC then/AV0 you/PNP have/VHB get/VVN woman/NN2 all/AV0 round/PRP the/AT0 bad/AJC one/PNI 's/POS be/VBB the/AT0 woman/NN2 with/PRP the/AT0 kiddy/NN2 in/PRP the/AT0 pushchair/NN1 ,/PUN and/CJC you/PNP have/VHB get/VVN to/TO0 go/VVI round/AVP and/CJC you/PNP ./PUN ",
K/KD/KDA.xml,KDARE00F,011607,16,,B,10,1,"Tell you what women with pram's and stuff, there  (()) fucking tread on the babies head or something.","tell/VVB you/PNP what/DTQ woman/NN2 with/PRP pram/NN1 's/POS and/CJC stuff/NN1-VVB ,/PUN there/EX0 fucking/AV0 tread/VVB on/PRP-AVP the/AT0 baby/NN2 head/NN1-VVB or/CJC something/PNI ./PUN ",
K/KD/KDA.xml,KDARE00F,011607,17,,B,10,2,Notice that  (()) supermarket's (()) ,notice/VVB-NN1 that/DT0 supermarket/NN1 be/VBZ ,
K/KD/KDA.xml,KDARE00F,011607,18,,A,11,1,(()) .,./PUN ,
K/KD/KDA.xml,KDARE00F,011607,19,,B,12,1,"Yeah, fucking little kid like (()) ","yeah/ITJ ,/PUN fucking/AV0-AJ0 little/AJ0 kid/NN1 like/PRP ",
K/KD/KDA.xml,KDARE00F,011607,20,,B,12,2,it's bad enough standing there trying to be calm and nonchalant like most bloke's do in the fucking underwear department.,it/PNP be/VBZ bad/AJ0 enough/AV0 stand/VVG there/AV0 try/VVG to/TO0 be/VBI calm/AJ0 and/CJC nonchalant/AJ0 like/PRP most/DT0 bloke/NN1 be/VBZ do/VDB in/PRP the/AT0 fucking/AJ0 underwear/NN1 department/NN1 ./PUN ,
K/KD/KDA.xml,KDARE00F,011607,21,,A,13,1,Don't (()) .,do/VDB not/XX0 ./PUN ,
K/KD/KDA.xml,KDARE00F,011607,22,,B,14,1,"Oh, I wasn't and erm, the next thing I know I've nearly fucking been bowled over, sort of the bags in  (()) fucking look behind me (()) , so those two  (()) fucking bought the bags back down fucking legs  (()) and I've just caught this like  (()) running round another, another thing, I thought oh fucking little kid, the next thing I know there's another one  (()) gone pass me like, taken the bags,(()) the handles out of the plastic bags, fucking  (()) and it was a girl that was going first this time, so I  (()) and sure enough there was a little fucking brat boy coming again, so I just went  (()) flying he sort of looked up at me and rubbed his eye like that and  (()) carried on running after the (()) .","oh/ITJ ,/PUN i/PNP be/VBD not/XX0 and/CJC erm/UNC ,/PUN the/AT0 next/ORD thing/NN1 i/PNP know/VVB i/PNP have/VHB nearly/AV0 fucking/AV0 be/VBN bowl/VVN over/AVP-PRP ,/PUN sort/NN1 of/PRF the/AT0 bag/NN2 in/PRP-AVP fucking/AJ0-AV0 look/NN1-VVB behind/PRP i/PNP ,/PUN so/AV0 those/DT0 two/CRD fucking/AV0 buy/VVN-VVD the/AT0 bag/NN2 back/AVP down/PRP-AVP fucking/AJ0 leg/NN2 and/CJC i/PNP have/VHB just/AV0 catch/VVN this/DT0 like/PRP run/VVG round/PRP-AVP another/DT0 ,/PUN another/DT0 thing/NN1 ,/PUN i/PNP think/VVD oh/ITJ fucking/AV0-AJ0 little/AJ0 kid/NN1 ,/PUN the/AT0 next/ORD thing/NN1 i/PNP know/VVB there/EX0 be/VBZ another/DT0 one/PNI go/VVN pass/VVB-NN1 i/PNP like/AV0 ,/PUN take/VVN the/AT0 bag/NN2 ,/PUN the/AT0 handle/NN2 [out/AVP of/PRF]/PRP the/AT0 plastic/NN1 bag/NN2 ,/PUN fucking/AV0-AJ0 and/CJC it/PNP be/VBD a/AT0 girl/NN1 that/CJT-DT0 be/VBD go/VVG first/ORD this/DT0 time/NN1 ,/PUN so/AV0 i/PNP and/CJC sure/AJ0 enough/AV0 there/EX0 be/VBD [a/AT0 little/AV0]/AV0 fucking/AJ0 brat/NN1 boy/NN1 come/VVG again/AV0 ,/PUN so/AV0 i/PNP just/AV0 go/VVD fly/VVG-AJ0 he/PNP [sort/NN1 of/PRF]/AV0 look/VVN-VVD up/AVP at/PRP i/PNP and/CJC rub/VVD he/DPS eye/NN1 like/PRP that/DT0 and/CJC carry/VVD on/AVP run/VVG after/PRP the/AT0 ./PUN ",
K/KD/KDA.xml,KDARE00F,011607,23,,B,14,2,I said you come round here sonny you'll (()) .,i/PNP say/VVD you/PNP come/VVB round/AVP here/AV0 sonny/NN1 you/PNP will/VM0 ./PUN ,
K/KD/KDA.xml,KDARE00F,011607,24,,B,14,3,"I was just about to wind up, right, you know.","i/PNP be/VBD just/AV0 about/AVP to/TO0 wind/VVI up/AVP ,/PUN right/AV0 ,/PUN you/PNP know/VVB ./PUN ",
K/KD/KDA.xml,KDARE00F,011607,25,,A,15,1,(()) brown bread.,brown/AJ0 bread/NN1 ./PUN ,
K/KD/KDA.xml,KDARE00F,011607,26,,B,16,1,"Fucking what, I, I'm, I think it was he's mum or not, some old biddy gave me a right old (()) .","fucking/AV0 what/DTQ ,/PUN i/PNP ,/PUN i/PNP be/VBB ,/PUN i/PNP think/VVB it/PNP be/VBD he/PNP be/VBZ mum/NN1 or/CJC not/XX0 ,/PUN some/DT0 old/AJ0 biddy/NN1 give/VVD i/PNP a/AT0 right/AJ0 old/AJ0 ./PUN ",
K/KD/KDA.xml,KDARE00F,011607,27,,B,16,2,(()) put the handbags of the  (()) and as he came round I sort of went (()) .(()) ,put/VVB the/AT0 handbag/NN2 of/PRF the/AT0 and/CJC as/CJS he/PNP come/VVD round/AVP i/PNP [sort/NN1 of/PRF]/AV0 go/VVD ./PUN ,
K/KD/KDA.xml,KDARE00F,011607,28,,B,16,3,"And you know the only reason you've got a hang over and you know there isn't really any body else to blame but yourself, but that makes you want to look for a scape-goat, but the kid (()) .","and/CJC you/PNP know/VVB the/AT0 only/AJ0 reason/NN1 you/PNP have/VHB get/VVN a/AT0 hang/VVB-NN1 over/AVP and/CJC you/PNP know/VVB there/EX0 be/VBZ not/XX0 really/AV0 any/DT0 body/NN1 else/AV0 to/TO0 blame/VVI but/CJC yourself/PNX ,/PUN but/CJC that/DT0 make/VVZ you/PNP want/VVI to/TO0 look/VVI for/PRP a/AT0 scape-goat/NN1 ,/PUN but/CJC the/AT0 kid/NN1 ./PUN ",
K/KD/KDA.xml,KDARE00F,011607,29,,B,16,4,"There's nothing worse than being in a foul temper and knowing that it's only you, you've got to blame for it.(()) ","there/EX0 be/VBZ nothing/PNI bad/AJC than/CJS be/VBG in/PRP a/AT0 foul/AJ0-NN1 temper/NN1 and/CJC know/VVG that/CJT it/PNP be/VBZ only/AV0 you/PNP ,/PUN you/PNP have/VHB get/VVN to/TO0 blame/VVI for/PRP it/PNP ./PUN ",
K/KD/KDA.xml,KDARE00F,011607,30,,B,16,5,It's really nice and sweet all day and it's fucking making me even angrier.,it/PNP be/VBZ really/AV0 nice/AJ0 and/CJC sweet/AJ0 all/DT0 day/NN1 and/CJC it/PNP be/VBZ fucking/AV0-AJ0 make/VVG i/PNP even/AV0 angry/AJC ./PUN ,
K/KD/KDA.xml,KDARE00F,011607,31,,B,16,6,"I hate going shopping with them, she wants to go next Saturday, I said fuck that.","i/PNP hate/VVB go/VVG shop/VVG with/PRP they/PNP ,/PUN she/PNP want/VVZ to/TO0 go/VVI next/ORD saturday/NP0 ,/PUN i/PNP say/VVD fuck/VVB-NN1 that/DT0 ./PUN ",
K/KD/KDA.xml,KDARE00F,011607,32,,A,17,1,Go on your own.,go/VVB on/AVP you/DPS own/DT0 ./PUN ,
K/KD/KDA.xml,KDARE00F,011607,33,,B,18,1,"Yeah, oh what, I didn't actually say fuck that,(()) I know I've got to go and get your present  (()) you know.(()) ","yeah/ITJ ,/PUN oh/ITJ what/DTQ ,/PUN i/PNP do/VDD not/XX0 actually/AV0 say/VVI fuck/NN1-VVB that/CJT-DT0 ,/PUN i/PNP know/VVB i/PNP have/VHB get/VVN to/TO0 go/VVI and/CJC get/VVI you/DPS present/NN1 you/PNP know/VVB ./PUN ",
K/KD/KDA.xml,KDARE00F,011607,34,,B,18,2,"Friends family and stuff,(()) day sort of thing, that'll be quite a good idea.","friend/NN2 family/NN1 and/CJC stuff/NN1-VVB ,/PUN day/NN1 sort/NN1 of/PRF thing/NN1 ,/PUN that/DT0 will/VM0 be/VBI quite/AV0 a/AT0 good/AJ0 idea/NN1 ./PUN ",
K/KD/KDA.xml,KDARE00F,011607,35,,A,19,1,right.,right/AV0 ./PUN ,
K/KD/KDA.xml,KDARE00F,011607,36,,B,20,1,"She'll, she'll think that's right (()) ","she/PNP will/VM0 ,/PUN she/PNP will/VM0 think/VVI that/DT0 be/VBZ right/AJ0 ",
K/KD/KDA.xml,KDARE00F,011607,37,,A,21,1,(()) .,./PUN ,
K/KD/KDA.xml,KDARE00F,011607,38,,B,22,1,"I know it's good in it?(()) but erm,(()) bought her, I've bought her a Ghost video.","i/PNP know/VVB it/PNP be/VBZ good/AJ0 in/PRP it/PNP ?/PUN but/CJC erm/UNC ,/PUN buy/VVD she/PNP ,/PUN i/PNP have/VHB buy/VVN she/PNP a/AT0 ghost/NN1 video/NN1 ./PUN ",
K/KD/KDA.xml,KDARE00F,011607,39,,A,23,1,A what?,a/AT0 what/DTQ ?/PUN ,
K/KD/KDA.xml,KDARE00F,011607,40,,B,24,1,A Ghost video.,a/AT0 ghost/NN1 video/NN1 ./PUN ,
K/KD/KDA.xml,KDARE00F,011607,41,,A,25,1,Oh yeah.,oh/ITJ yeah/ITJ ./PUN ,
K/KD/KDA.xml,KDARE00F,011607,42,,B,26,1,"Bought her, erm,(()) , bought her a little ","buy/VVD-VVN she/PNP ,/PUN erm/UNC ,/PUN ,/PUN buy/VVD-VVN she/PNP [a/AT0 little/AV0]/AV0 ",
K/KD/KDA.xml,KDARE00F,011607,43,,B,26,2,I was gonna split that (()) .,i/PNP be/VBD gon/VVG na/TO0 split/VVI that/DT0 ./PUN ,
K/KD/KDA.xml,KDARE00F,011607,44,,B,26,3,"I've only got eight more things to get her, I've already spent about, I don't know, sixty quid on her.","i/PNP have/VHB only/AV0 get/VVN eight/CRD more/DT0 thing/NN2 to/TO0 get/VVI she/PNP ,/PUN i/PNP have/VHB already/AV0 spend/VVN about/PRP-AVP ,/PUN i/PNP do/VDB not/XX0 know/VVI ,/PUN sixty/CRD quid/NN0 on/PRP she/PNP ./PUN ",
