swda_filename,ptb_basename,conversation_no,transcript_index,act_tag,caller,turn_index,subutterance_index,text,pos,trees
K/KD/KDA.xml,KDARE03E,013601,0,,A,1,1,Stu done half fucking rabbit on don't he?,stu/NP0 do/VDN half/DT0 fucking/AJ0 rabbit/NN1 on/AVP-PRP do/VDB not/XX0 he/PNP ?/PUN ,
K/KD/KDA.xml,KDARE03E,013601,1,,B,2,1,On and on and on and,on/AVP and/CJC on/AVP and/CJC on/AVP and/CJC ,
K/KD/KDA.xml,KDARE03E,013601,2,,A,3,1,Oh have I upset Phil in some way?,oh/ITJ have/VHB i/PNP upset/VVB phil/NP0 in/PRP some/DT0 way/NN1 ?/PUN ,
K/KD/KDA.xml,KDARE03E,013601,3,,B,4,1,Why?,why/AVQ ?/PUN ,
K/KD/KDA.xml,KDARE03E,013601,4,,A,5,1,"dunno, seems to have got the hump","do/VDB n/XX0 no/VVI ,/PUN seem/VVZ to/TO0 have/VHI get/VVN the/AT0 hump/NN1 ",
K/KD/KDA.xml,KDARE03E,013601,5,,B,6,1,Phil?,phil/NP0 ?/PUN ,
K/KD/KDA.xml,KDARE03E,013601,6,,A,7,1,"Yeah, said good morning Phil, totally fucking ignored me.","yeah/ITJ ,/PUN say/VVD good/AJ0 morning/NN1 phil/NP0 ,/PUN totally/AV0 fucking/AV0 ignore/VVD i/PNP ./PUN ",
