swda_filename,ptb_basename,conversation_no,transcript_index,act_tag,caller,turn_index,subutterance_index,text,pos,trees
K/KB/KBF.xml,KBFRE01D,015402,303,,B,172,2,And they had no mortgage and they had a  a little bungalow and everything.,and/CJC they/PNP have/VHD no/AT0 mortgage/NN1 and/CJC they/PNP have/VHD a/AT0 a/AT0 little/AJ0 bungalow/NN1 and/CJC everything/PNI ./PUN,
K/KB/KBF.xml,KBFRE01D,015402,304,,B,172,3,And erm  th- they went to an auction and she was saying how interesting it was.,and/CJC erm/UNC th/UNC they/PNP go/VVD to/PRP an/AT0 auction/NN1 and/CJC she/PNP be/VBD say/VVG how/AVQ interesting/AJ0 it/PNP be/VBD ./PUN,
K/KB/KBF.xml,KBFRE01D,015402,305,,B,172,4,And she could have a like four bedroom house for fifty five thousand.,and/CJC she/PNP could/VM0 have/VHI a/AT0 like/AV0-AJ0 four/CRD bedroom/NN1 house/NN1 for/PRP fifty/CRD five/CRD thousand/CRD ./PUN,
K/KB/KBF.xml,KBFRE01D,015402,306,,A,173,1,Mm.,mm/ITJ ./PUN,
K/KB/KBF.xml,KBFRE01D,015402,307,,A,173,2,Mm.,mm/ITJ ./PUN,
K/KB/KBF.xml,KBFRE01D,015402,308,,A,173,3,Mm.,mm/ITJ ./PUN,
K/KB/KBF.xml,KBFRE01D,015402,309,,B,174,1,You know.,you/PNP know/VVB ./PUN,
K/KB/KBF.xml,KBFRE01D,015402,310,,B,174,2,"I mean they, and they were in good areas.","i/PNP mean/VVB they/PNP ,/PUN and/CJC they/PNP be/VBD in/PRP good/AJ0 area/NN2 ./PUN",
K/KB/KBF.xml,KBFRE01D,015402,311,,A,175,1,Yeah.,yeah/ITJ ./PUN,
K/KB/KBF.xml,KBFRE01D,015402,312,,B,176,1,"But what it was, they were like  it was like G A N do them er Man and Co And they had sort of like  a job like Dave's and a lot of them what they've done  is they've bought in this area, I mean probably most areas they've bought  the repossessed they've got about eight or nine houses  they're either renting them out or they're leaving them empty.","but/CJC what/DTQ it/PNP be/VBD ,/PUN they/PNP be/VBD like/AV0 it/PNP be/VBD like/PRP g/ZZ0 a/ZZ0 n/ZZ0 do/VDB they/PNP er/UNC man/NN1 and/CJC co/NP0-NN1 and/CJC they/PNP have/VHD [sort/NN1 of/PRF]/AV0 like/PRP a/AT0 job/NN1 like/PRP dave/NP0 's/POS and/CJC a/AT0 lot/NN1 of/PRF they/PNP what/DTQ they/PNP have/VHB do/VDN be/VBZ they/PNP have/VHB buy/VVN in/PRP this/DT0 area/NN1 ,/PUN i/PNP mean/VVB probably/AV0 most/DT0 area/NN2 they/PNP have/VHB buy/VVN the/AT0 repossessed/AJ0 they/PNP have/VHB get/VVN about/AV0 eight/CRD or/CJC nine/CRD house/NN2 they/PNP be/VBB either/AV0 rent/VVG they/PNP out/AVP or/CJC they/PNP be/VBB leave/VVG they/PNP empty/AJ0 ./PUN",
K/KB/KBF.xml,KBFRE01D,015402,313,,B,176,2,The majority of them are empty round here.,the/AT0 majority/NN1 of/PRF they/PNP be/VBB empty/AJ0 round/PRP-AVP here/AV0 ./PUN,
K/KB/KBF.xml,KBFRE01D,015402,314,,A,177,1,Mm.,mm/ITJ ./PUN,
K/KB/KBF.xml,KBFRE01D,015402,315,,B,178,1,And then they'll just hang on to them,and/CJC then/AV0 they/PNP will/VM0 just/AV0 hang/VVI [on/AVP to/PRP]/PRP they/PNP,
K/KB/KBF.xml,KBFRE01D,015402,316,,A,179,1,Mm.,mm/ITJ ./PUN,
K/KB/KBF.xml,KBFRE01D,015402,317,,B,180,1,for about five or six years till the house goes up and then.,for/PRP about/AV0 five/CRD or/CJC six/CRD year/NN2 till/CJS the/AT0 house/NN1 go/VVZ up/AVP and/CJC then/AV0 ./PUN,
K/KB/KBF.xml,KBFRE01D,015402,318,,A,181,1,Mm.,mm/ITJ ./PUN,
K/KB/KBF.xml,KBFRE01D,015402,319,,A,181,2,Mm.,mm/ITJ ./PUN,
K/KB/KBF.xml,KBFRE01D,015402,320,,A,181,3,"They, the building societies are worried about their repossessed houses.","they/PNP ,/PUN the/AT0 building/NN1 society/NN2 be/VBB worried/AJ0 about/PRP they/DPS repossessed/AJ0 house/NN2 ./PUN",
K/KB/KBF.xml,KBFRE01D,015402,321,,A,181,4,They thought that it was going to be all easy.,they/PNP think/VVD that/CJT it/PNP be/VBD go/VVG to/TO0 be/VBI all/DT0 easy/AJ0 ./PUN,
K/KB/KBF.xml,KBFRE01D,015402,322,,A,181,5,I read this in the Telegraph.,i/PNP read/VVB this/DT0 in/PRP the/AT0 telegraph/NN1 ./PUN,
K/KB/KBF.xml,KBFRE01D,015402,323,,B,182,1,Mm.,mm/ITJ ./PUN,
K/KB/KBF.xml,KBFRE01D,015402,324,,A,183,1,"They thought oh, easy we're going to","they/PNP think/VVD oh/ITJ ,/PUN easy/AV0-AJ0 we/PNP be/VBB go/VVG to/PRP",
K/KB/KBF.xml,KBFRE01D,015402,325,,B,184,1,Sell them at,sell/VVB they/PNP at/PRP,
K/KB/KBF.xml,KBFRE01D,015402,326,,A,185,1,parcel them out amongst the estate agents.,parcel/VVB-NN1 they/PNP out/AVP amongst/PRP the/AT0 estate/NN1 agent/NN2 ./PUN,
K/KB/KBF.xml,KBFRE01D,015402,327,,A,185,2,And the estate agents don't want to know.,and/CJC the/AT0 estate/NN1 agent/NN2 do/VDB not/XX0 want/VVI to/TO0 know/VVI ./PUN,
K/KB/KBF.xml,KBFRE01D,015402,328,,A,185,3,Because people don't want to buy a repossessed house.,because/CJS people/NN0 do/VDB not/XX0 want/VVI to/TO0 buy/VVI a/AT0 repossessed/AJ0 house/NN1 ./PUN,
K/KB/KBF.xml,KBFRE01D,015402,329,,A,185,4,For one thing they think it's unlucky.,for/PRP one/CRD thing/NN1 they/PNP think/VVB it/PNP be/VBZ unlucky/AJ0 ./PUN,
K/KB/KBF.xml,KBFRE01D,015402,330,,A,185,5,And the second thing is that repossessed houses very very quickly begin to look dirty and battered.,and/CJC the/AT0 second/ORD thing/NN1 be/VBZ that/CJT repossessed/AJ0 house/NN2 very/AV0 very/AV0 quickly/AV0 begin/VVB to/TO0 look/VVI dirty/AJ0 and/CJC battered/AJ0-VVN ./PUN,
K/KB/KBF.xml,KBFRE01D,015402,331,,B,186,1,Mm.,mm/ITJ ./PUN,
K/KB/KBF.xml,KBFRE01D,015402,332,,A,187,1,And  I mean I remember myself when I was a young girl  that you used to walk along a road and you'd see houses that were going to rack and ruin.,and/CJC i/PNP mean/VVB i/PNP remember/VVB myself/PNX when/CJS i/PNP be/VBD a/AT0 young/AJ0 girl/NN1 that/CJT you/PNP used/VM0 to/TO0 walk/VVI along/PRP-AVP a/AT0 road/NN1 and/CJC you/PNP would/VM0 see/VVI house/NN2 that/CJT be/VBD go/VVG to/TO0 rack/VVI and/CJC ruin/VVI ./PUN,
K/KB/KBF.xml,KBFRE01D,015402,333,,A,187,2,And you see  it's the central heating and the women opening and shutting doors and running round and keep-,and/CJC you/PNP see/VVB it/PNP be/VBZ the/AT0 central/AJ0 heating/NN1 and/CJC the/AT0 woman/NN2 open/VVG-NN1 and/CJC shut/VVG door/NN2 and/CJC run/VVG round/AVP and/CJC keep/UNC,
K/KB/KBF.xml,KBFRE01D,015402,334,,B,188,1,But they don't,but/CJC they/PNP do/VDB not/XX0,
K/KB/KBF.xml,KBFRE01D,015402,335,,A,189,1,It's people who keep the houses going.,it/PNP be/VBZ people/NN0 who/PNQ keep/VVB the/AT0 house/NN2 go/VVG ./PUN,
K/KB/KBF.xml,KBFRE01D,015402,336,,B,190,1,But there was a house on this repossession and  it was sort of like  just a sort of young couple and they'd bought this house and it was like a two bedroom house  and they'd done up beautiful.,but/CJC there/EX0 be/VBD a/AT0 house/NN1 on/PRP this/DT0 repossession/NN1 and/CJC it/PNP be/VBD [sort/NN1 of/PRF]/AV0 like/AV0 just/AV0 a/AT0 sort/NN1 of/PRF young/AJ0 couple/NN1 and/CJC they/PNP have/VHD buy/VVN this/DT0 house/NN1 and/CJC it/PNP be/VBD like/PRP a/AT0 two/CRD bedroom/NN1 house/NN1 and/CJC they/PNP have/VHD do/VDN up/PRP-AVP beautiful/AJ0 ./PUN,
K/KB/KBF.xml,KBFRE01D,015402,337,,A,191,1,Ah.,ah/ITJ ./PUN,
K/KB/KBF.xml,KBFRE01D,015402,338,,B,192,1,Really nice.,really/AV0 nice/AJ0 ./PUN,
K/KB/KBF.xml,KBFRE01D,015402,339,,B,192,2,Well they just fell behind you know I mean,well/AV0 they/PNP just/AV0 fall/VVD behind/PRP you/PNP know/VVB i/PNP mean/VVB,
K/KB/KBF.xml,KBFRE01D,015402,340,,A,193,1,Yeah.,yeah/ITJ ./PUN,
K/KB/KBF.xml,KBFRE01D,015402,341,,B,194,1,"they obviously  I mean, quite an expensive sort of social life and everything.","they/PNP obviously/AV0 i/PNP mean/VVB ,/PUN quite/AV0 an/AT0 expensive/AJ0 sort/NN1 of/PRF social/AJ0 life/NN1 and/CJC everything/PNI ./PUN",
K/KB/KBF.xml,KBFRE01D,015402,342,,A,195,1,Yeah.,yeah/ITJ ./PUN,
K/KB/KBF.xml,KBFRE01D,015402,343,,B,196,1,Whatever.,whatever/DTQ ./PUN,
K/KB/KBF.xml,KBFRE01D,015402,344,,B,196,2,"And they just couldn't, he lost his job which is the same old story and er  anyway they went back to visit and they kee- they go back every two or three weeks to visit this house.","and/CJC they/PNP just/AV0 could/VM0 not/XX0 ,/PUN he/PNP lose/VVD he/DPS job/NN1 which/DTQ be/VBZ the/AT0 same/DT0 old/AJ0 story/NN1 and/CJC er/UNC anyway/AV0 they/PNP go/VVD back/AVP to/TO0 visit/VVI and/CJC they/PNP kee/UNC they/PNP go/VVB back/AVP every/AT0 two/CRD or/CJC three/CRD week/NN2 to/TO0 visit/VVI this/DT0 house/NN1 ./PUN",
K/KB/KBF.xml,KBFRE01D,015402,345,,B,196,3,"They've got a ki- , no they've got kids.","they/PNP have/VHB get/VVN a/AT0 ki/UNC ,/PUN no/ITJ they/PNP have/VHB get/VVN kid/NN2 ./PUN",
K/KB/KBF.xml,KBFRE01D,015402,346,,B,196,4,"They had got  three kiddies that's right, cos the council housed them.","they/PNP have/VHD get/VVN three/CRD kiddy/NN2 that/DT0 be/VBZ right/AJ0 ,/PUN cos/CJS the/AT0 council/NN1 house/VVD-VVN they/PNP ./PUN",
K/KB/KBF.xml,KBFRE01D,015402,347,,B,196,5,And they were in this grotty council house now and they go back and they said  and you saw them going back and saying look at the state of the garden.,and/CJC they/PNP be/VBD in/PRP this/DT0 grotty/AJ0 council/NN1 house/NN1 now/AV0 and/CJC they/PNP go/VVB back/AVP and/CJC they/PNP say/VVD and/CJC you/PNP see/VVD they/PNP go/VVG back/AVP and/CJC say/VVG look/VVB-NN1 at/PRP the/AT0 state/NN1 of/PRF the/AT0 garden/NN1 ./PUN,
K/KB/KBF.xml,KBFRE01D,015402,348,,A,197,1,Yes.,yes/ITJ ./PUN,
K/KB/KBF.xml,KBFRE01D,015402,349,,B,198,1,"Look at the state of the, the woodwork looks tatty and","look/VVB at/PRP the/AT0 state/NN1 of/PRF the/AT0 ,/PUN the/AT0 woodwork/NN1 look/VVZ tatty/AJ0 and/CJC",
K/KB/KBF.xml,KBFRE01D,015402,350,,A,199,1,That's right.,that/DT0 be/VBZ right/AJ0 ./PUN,
K/KB/KBF.xml,KBFRE01D,015402,351,,B,200,1,we spent all these years on this and,we/PNP spend/VVD all/DT0 these/DT0 year/NN2 on/PRP this/DT0 and/CJC,
K/KB/KBF.xml,KBFRE01D,015402,352,,A,201,1,"Yes, yes.","yes/ITJ ,/PUN yes/ITJ ./PUN",
K/KB/KBF.xml,KBFRE01D,015402,353,,B,202,1,all the mail and junk letters all through the door and everything looked tatty.,all/DT0 the/AT0 mail/NN1 and/CJC junk/NN1 letter/NN2 all/DT0 through/PRP the/AT0 door/NN1 and/CJC everything/PNI look/VVD-VVN tatty/AJ0 ./PUN,
K/KB/KBF.xml,KBFRE01D,015402,354,,A,203,1,Mm.,mm/ITJ ./PUN,
K/KB/KBF.xml,KBFRE01D,015402,355,,A,203,2,Mm.,mm/ITJ ./PUN,
K/KB/KBF.xml,KBFRE01D,015402,356,,A,203,3,Mm.,mm/ITJ ./PUN,
K/KB/KBF.xml,KBFRE01D,015402,357,,A,203,4,Mm.,mm/ITJ ./PUN,
K/KB/KBF.xml,KBFRE01D,015402,358,,B,204,1,And they said you know  th- there should have been a way round it where they kept this couple in there.,and/CJC they/PNP say/VVD you/PNP know/VVB th/UNC there/EX0 should/VM0 have/VHI be/VBN a/AT0 way/NN1 round/PRP-AVP it/PNP where/CJS they/PNP keep/VVD this/DT0 couple/NN1 in/PRP there/AV0 ./PUN,
K/KB/KBF.xml,KBFRE01D,015402,359,,A,205,1,There should.,there/EX0 should/VM0 ./PUN,
K/KB/KBF.xml,KBFRE01D,015402,360,,A,205,2,There should.,there/EX0 should/VM0 ./PUN,
K/KB/KBF.xml,KBFRE01D,015402,361,,B,206,1,It's now been empty six months.,it/PNP have/VHZ now/AV0 be/VBN empty/AJ0 six/CRD month/NN2 ./PUN,
K/KB/KBF.xml,KBFRE01D,015402,362,,A,207,1,Even if it's even if people had sold their houses to the local council  (()) .,[even/AV0 if/CJS]/CJS it/PNP be/VBZ [even/AV0 if/CJS]/CJS people/NN0 have/VHD sell/VVN they/DPS house/NN2 to/PRP the/AT0 local/AJ0 council/NN1 ./PUN,
K/KB/KBF.xml,KBFRE01D,015402,363,,A,207,2,"You see in in, on the continent they do not build  council ghettos.","you/PNP see/VVB in/AVP-PRP in/AVP-PRP ,/PUN on/PRP the/AT0 continent/NN1 they/PNP do/VDB not/XX0 build/VVI council/NN1 ghettos/UNC ./PUN",
K/KB/KBF.xml,KBFRE01D,015402,364,,A,207,3,"Li- you know, like you lived in.","li/UNC you/PNP know/VVB ,/PUN like/CJS you/PNP live/VVD in/AVP-PRP ./PUN",
K/KB/KBF.xml,KBFRE01D,015402,365,,A,207,4,Where you walk in and think oh these must be council houses as you're driving through.,where/CJS you/PNP walk/VVB in/AVP and/CJC think/VVB oh/ITJ these/DT0 must/VM0 be/VBI council/NN1 house/NN2 as/CJS you/PNP be/VBB drive/VVG through/AVP-PRP ./PUN,
K/KB/KBF.xml,KBFRE01D,015402,366,,B,208,1,Mm.,mm/ITJ ./PUN,
K/KB/KBF.xml,KBFRE01D,015402,367,,A,209,1,"You, you find a house to rent  that seems right for your  about the price, perhaps a bit high but about right for your  level of income.","you/PNP ,/PUN you/PNP find/VVB a/AT0 house/NN1 to/TO0 rent/VVI that/CJT-DT0 seem/VVZ right/AJ0 for/PRP you/DPS about/PRP the/AT0 price/NN1 ,/PUN perhaps/AV0 [a/AT0 bit/NN1]/AV0 high/AJ0 but/CJC about/PRP right/AJ0 for/PRP you/DPS level/NN1 of/PRF income/NN1 ./PUN",
K/KB/KBF.xml,KBFRE01D,015402,368,,A,209,2,"And you go to the local housing agency er the, the council housing agency, and you get a  grant to help you with your rent.","and/CJC you/PNP go/VVB to/PRP the/AT0 local/AJ0 housing/NN1 agency/NN1 er/UNC the/AT0 ,/PUN the/AT0 council/NN1 housing/NN1 agency/NN1 ,/PUN and/CJC you/PNP get/VVB a/AT0 grant/NN1 to/TO0 help/VVI you/PNP with/PRP you/DPS rent/NN1 ./PUN",
K/KB/KBF.xml,KBFRE01D,015402,369,,A,209,3,So that there aren't special council houses.,[so/AV0 that/CJT]/CJS there/EX0 be/VBB not/XX0 special/AJ0 council/NN1 house/NN2 ./PUN,
K/KB/KBF.xml,KBFRE01D,015402,370,,A,209,4,An- any house could be a council house.,an/UNC any/DT0 house/NN1 could/VM0 be/VBI a/AT0 council/NN1 house/NN1 ./PUN,
K/KB/KBF.xml,KBFRE01D,015402,371,,B,210,1,Mm.,mm/ITJ ./PUN,
K/KB/KBF.xml,KBFRE01D,015402,372,,A,211,1,And it means that,and/CJC it/PNP mean/VVZ that/DT0,
K/KB/KBF.xml,KBFRE01D,015402,373,,B,212,1,I don't think the council can afford to do it now can they?,i/PNP do/VDB not/XX0 think/VVI the/AT0 council/NN1 can/VM0 afford/VVI to/TO0 do/VDI it/PNP now/AV0 can/VM0 they/PNP ?/PUN,
K/KB/KBF.xml,KBFRE01D,015402,374,,A,213,1,No.,no/ITJ ./PUN,
K/KB/KBF.xml,KBFRE01D,015402,375,,A,213,2,"They can't but they, it should, it should have been possible for the councils to have  I don't know it, it  it seems  <sigh> I, I put it down, I remember walking up and down on the beach with John  <<REDACTED (name)>> about eight weeks ago was it?","they/PNP can/VM0 not/XX0 but/CJC they/PNP ,/PUN it/PNP should/VM0 ,/PUN it/PNP should/VM0 have/VHI be/VBN possible/AJ0 for/PRP the/AT0 council/NN2 to/TO0 have/VHI i/PNP do/VDB not/XX0 know/VVI it/PNP ,/PUN it/PNP it/PNP seem/VVZ i/PNP ,/PUN i/PNP put/VVB it/PNP down/AVP ,/PUN i/PNP remember/VVB walk/VVG up/AVP and/CJC down/AVP on/PRP the/AT0 beach/NN1 with/PRP john/NP0 about/AV0 eight/CRD week/NN2 ago/AV0 be/VBD it/PNP ?/PUN",
K/KB/KBF.xml,KBFRE01D,015402,376,,A,213,3,"He came to see me, it was before I had this illness er these two illnesses.","he/PNP come/VVD to/TO0 see/VVI i/PNP ,/PUN it/PNP be/VBD before/CJS i/PNP have/VHD this/DT0 illness/NN1 er/UNC these/DT0 two/CRD illness/NN2 ./PUN",
K/KB/KBF.xml,KBFRE01D,015402,377,,A,213,4,Or was it after the diarrhoea but before the two lovely colds?,or/CJC be/VBD it/PNP after/PRP the/AT0 diarrhoea/NN1 but/CJC before/PRP the/AT0 two/CRD lovely/AJ0 cold/NN2 ?/PUN,
K/KB/KBF.xml,KBFRE01D,015402,378,,A,213,5,"And we were walking up and down on the beach at Aldeburgh  and the most interesting part of our conversation was  that we were saying we both started out as  not conservatives, I've never voted conservative in my life, but we started out as very loyal people.","and/CJC we/PNP be/VBD walk/VVG up/AVP and/CJC down/AVP on/PRP the/AT0 beach/NN1 at/PRP aldeburgh/NP0 and/CJC the/AT0 most/AV0 interesting/AJ0 part/NN1 of/PRF we/DPS conversation/NN1 be/VBD that/CJT we/PNP be/VBD say/VVG we/PNP both/DT0 start/VVD out/AVP as/PRP-CJS not/XX0 conservative/NN2 ,/PUN i/PNP have/VHB never/AV0 vote/VVN conservative/NN1-AJ0 in/PRP i/DPS life/NN1 ,/PUN but/CJC we/PNP start/VVD out/AVP as/AV0 very/AV0 loyal/AJ0 people/NN0 ./PUN",
K/KB/KBF.xml,KBFRE01D,015402,379,,A,213,6,British justice was marvellous.,british/AJ0 justice/NN1 be/VBD marvellous/AJ0 ./PUN,
K/KB/KBF.xml,KBFRE01D,015402,380,,A,213,7,British parliament was wonderful.,british/AJ0 parliament/NN1 be/VBD wonderful/AJ0 ./PUN,
K/KB/KBF.xml,KBFRE01D,015402,381,,A,213,8,The queen is great.,the/AT0 queen/NN1 be/VBZ great/AJ0 ./PUN,
K/KB/KBF.xml,KBFRE01D,015402,382,,A,213,9,And John  <<REDACTED (name)>> said I now don't believe in anything.,and/CJC john/NP0 say/VVD i/PNP now/AV0 do/VDB not/XX0 believe/VVI in/PRP anything/PNI ./PUN,
K/KB/KBF.xml,KBFRE01D,015402,383,,A,213,10,"I mean  you're talking, you're talking about old  middle class rather staid people.","i/PNP mean/VVB you/PNP be/VBB talk/VVG ,/PUN you/PNP be/VBB talk/VVG about/PRP old/AJ0 middle/AJ0 class/NN1 rather/AV0 staid/AJ0 people/NN0 ./PUN",
K/KB/KBF.xml,KBFRE01D,015402,384,,B,214,1,Mm.,mm/ITJ ./PUN,
K/KB/KBF.xml,KBFRE01D,015402,385,,A,215,1,"And, you should be taping this <laugh> .","and/CJC ,/PUN you/PNP should/VM0 be/VBI tape/VVG this/DT0 ./PUN",
K/KB/KBF.xml,KBFRE01D,015402,386,,B,216,1,<laugh> ,,
K/KB/KBF.xml,KBFRE01D,015402,387,,A,217,1,You are!,you/PNP be/VBB !/PUN,
K/KB/KBF.xml,KBFRE01D,015402,388,,A,217,2,<laugh> Don't mean any disloyalty.,do/VDB not/XX0 mean/VVI any/DT0 disloyalty/NN1 ./PUN,
K/KB/KBF.xml,KBFRE01D,015402,389,,A,217,3,Don't take me to the tower.,do/VDB not/XX0 take/VVI i/PNP to/PRP the/AT0 tower/NN1 ./PUN,
K/KB/KBF.xml,KBFRE01D,015402,390,,A,217,4,"<laugh> Erm  but erm  he was saying  he now sees the weaknesses in  and how, how pathetic are governments are.","erm/UNC but/CJC erm/UNC he/PNP be/VBD say/VVG he/PNP now/AV0 see/VVZ the/AT0 weakness/NN2 in/AVP-PRP and/CJC how/AVQ ,/PUN how/AVQ pathetic/AJ0 be/VBB government/NN2 be/VBB ./PUN",
K/KB/KBF.xml,KBFRE01D,015402,391,,B,218,1,Mm.,mm/ITJ ./PUN,
K/KB/KBF.xml,KBFRE01D,015402,392,,B,218,2,Well they reckon now I mean,well/AV0 they/PNP reckon/VVB now/AV0 i/PNP mean/VVB,
K/KB/KBF.xml,KBFRE01D,015402,393,,A,219,1,I mean the poll tax Brenda!,i/PNP mean/VVB the/AT0 poll/NN1 tax/NN1 brenda/NP0 !/PUN,
K/KB/KBF.xml,KBFRE01D,015402,394,,A,219,2,The poll tax!,the/AT0 poll/NN1 tax/NN1 !/PUN,
K/KB/KBF.xml,KBFRE01D,015402,395,,B,220,1,"But they make me die because  you, you you're a day, I mean we got this sort of letter the bailiffs were coming in   (()) because we were a day late.","but/CJC they/PNP make/VVB i/PNP die/VVI because/CJS you/PNP ,/PUN you/PNP you/PNP be/VBB a/AT0 day/NN1 ,/PUN i/PNP mean/VVB we/PNP get/VVD this/DT0 sort/NN1 of/PRF letter/NN1 the/AT0 bailiff/NN2 be/VBD come/VVG in/AVP-PRP because/CJS we/PNP be/VBD a/AT0 day/NN1 late/AV0-AJ0 ./PUN",
K/KB/KBF.xml,KBFRE01D,015402,396,,B,220,2,A day late,a/AT0 day/NN1 late/AV0-AJ0,
K/KB/KBF.xml,KBFRE01D,015402,397,,A,221,1,Ridiculous.,ridiculous/AJ0 ./PUN,
K/KB/KBF.xml,KBFRE01D,015402,398,,B,222,1,on it.,on/PRP it/PNP ./PUN,
K/KB/KBF.xml,KBFRE01D,015402,399,,B,222,2,And I said  there's people out there that don't even pay it!,and/CJC i/PNP say/VVD there/EX0 be/VBZ people/NN0 out/AVP there/AV0 that/CJT-DT0 do/VDB not/XX0 even/AV0 pay/VVI it/PNP !/PUN,
K/KB/KBF.xml,KBFRE01D,015402,400,,B,222,3,You know and  I mean cos Dave totally refuses on on the poll tax to have a standing order or direct debit.,you/PNP know/VVB and/CJC i/PNP mean/VVB cos/CJS dave/NP0 totally/AV0 refuse/VVZ on/PRP on/PRP the/AT0 poll/NN1 tax/NN1 to/TO0 have/VHI a/AT0 standing/NN1-AJ0 order/NN1 or/CJC direct/AJ0 debit/NN1 ./PUN,
K/KB/KBF.xml,KBFRE01D,015402,401,,A,223,1,I have to Brenda.,i/PNP have/VHB to/TO0 brenda/NP0 ./PUN,
K/KB/KBF.xml,KBFRE01D,015402,402,,A,223,2,I have no option.,i/PNP have/VHB no/AT0 option/NN1 ./PUN,
K/KB/KBF.xml,KBFRE01D,015402,403,,B,224,1,Yeah.,yeah/ITJ ./PUN,
K/KB/KBF.xml,KBFRE01D,015402,404,,B,224,2,Well he just totally sort of because I think he knows,well/AV0 he/PNP just/AV0 totally/AV0 [sort/NN1 of/PRF]/AV0 because/CJS i/PNP think/VVB he/PNP know/VVZ,
K/KB/KBF.xml,KBFRE01D,015402,405,,A,225,1,"I, I was","i/PNP ,/PUN i/PNP be/VBD",
K/KB/KBF.xml,KBFRE01D,015402,406,,B,226,1,so many people that don't pay it.,so/AV0 many/DT0 people/NN0 that/CJT do/VDB not/XX0 pay/VVI it/PNP ./PUN,
K/KB/KBF.xml,KBFRE01D,015402,407,,A,227,1,"Well it makes me very bitter because the- , this is the sort of thing that John  <<REDACTED (name)>> and I we were going over  one thing after the other.","well/AV0 it/PNP make/VVZ i/PNP very/AV0 bitter/AJ0 because/CJS the/UNC ,/PUN this/DT0 be/VBZ the/AT0 sort/NN1 of/PRF thing/NN1 that/CJT john/NP0 and/CJC i/PNP we/PNP be/VBD go/VVG over/PRP-AVP one/CRD thing/NN1 after/PRP the/AT0 other/NN1 ./PUN",
K/KB/KBF.xml,KBFRE01D,015402,408,,A,227,2,We we were brought up to believe that if you didn't do the right thing you would be punished.,we/PNP we/PNP be/VBD bring/VVN up/AVP to/TO0 believe/VVI that/CJT if/CJS you/PNP do/VDD not/XX0 do/VDI the/AT0 right/AJ0 thing/NN1 you/PNP would/VM0 be/VBI punish/VVN ./PUN,
K/KB/KBF.xml,KBFRE01D,015402,409,,B,228,1,Mm.,mm/ITJ ./PUN,
K/KB/KBF.xml,KBFRE01D,015402,410,,A,229,1,And  people are getting away with it.,and/CJC people/NN0 be/VBB get/VVG away/AV0 with/PRP it/PNP ./PUN,
K/KB/KBF.xml,KBFRE01D,015402,411,,B,230,1,"But what I can't understand, I mean majority of people I mean erm  you've gotta pay the debt in the end whatever.","but/CJC what/DTQ i/PNP can/VM0 not/XX0 understand/VVI ,/PUN i/PNP mean/VVB majority/NN1 of/PRF people/NN0 i/PNP mean/VVB erm/UNC you/PNP have/VHB get/VVN ta/TO0 pay/VVI the/AT0 debt/NN1 in/PRP the/AT0 end/NN1 whatever/DTQ ./PUN",
K/KB/KBF.xml,KBFRE01D,015402,412,,A,231,1,Course you have.(()),course/AV0 you/PNP have/VHB ./PUN,
K/KB/KBF.xml,KBFRE01D,015402,413,,B,232,1,Why keep putting it off?,why/AVQ keep/VVI put/VVG it/PNP off/AVP ?/PUN,
K/KB/KBF.xml,KBFRE01D,015402,414,,B,232,2,People put it off and that is where they get in the trouble.,people/NN0 put/VVB it/PNP off/AVP and/CJC that/DT0 be/VBZ where/AVQ they/PNP get/VVB in/PRP the/AT0 trouble/NN1 ./PUN,
K/KB/KBF.xml,KBFRE01D,015402,415,,A,233,1,Well I don't know that it's that.,well/AV0 i/PNP do/VDB not/XX0 know/VVI that/CJT it/PNP be/VBZ that/DT0 ./PUN,
K/KB/KBF.xml,KBFRE01D,015402,416,,A,233,2,I think that people who are living in a fixed abode are paying  in the end.,i/PNP think/VVB that/CJT people/NN0 who/PNQ be/VBB live/VVG in/PRP a/AT0 fixed/AJ0 abode/NN1 be/VBB pay/VVG in/PRP the/AT0 end/NN1 ./PUN,
K/KB/KBF.xml,KBFRE01D,015402,417,,A,233,3,They're being taken to court and made to pay.,they/PNP be/VBB be/VBG take/VVN to/PRP court/NN1 and/CJC make/VVD-VVN to/TO0 pay/VVI ./PUN,
K/KB/KBF.xml,KBFRE01D,015402,418,,A,233,4,But it's people like my lodger.,but/CJC it/PNP be/VBZ people/NN0 like/PRP i/DPS lodger/NN1 ./PUN,
K/KB/KBF.xml,KBFRE01D,015402,419,,B,234,1,"Yeah but they were saying now, it's like our, in the like local paper  the poll tax is gonna   (()) prob- , might be even go up double because of the non-payers.","yeah/ITJ but/CJC they/PNP be/VBD say/VVG now/AV0 ,/PUN it/PNP be/VBZ like/PRP we/DPS ,/PUN in/PRP the/AT0 like/AJ0-AV0 local/AJ0 paper/NN1 the/AT0 poll/NN1 tax/NN1 be/VBZ gon/VVG na/TO0 prob/UNC ,/PUN might/VM0 be/VBI even/AV0 go/VVB up/AVP-PRP double/NN1-AJ0 [because/CJS of/PRF]/PRP the/AT0 non-payer/NN2 ./PUN",
K/KB/KBF.xml,KBFRE01D,015402,420,,A,235,1,Yes.,yes/ITJ ./PUN,
K/KB/KBF.xml,KBFRE01D,015402,421,,B,236,1,Because of not,[because/CJS of/PRF]/PRP not/XX0,
K/KB/KBF.xml,KBFRE01D,015402,422,,A,237,1,That makes me very angry.,that/DT0-CJT make/VVZ i/PNP very/AV0 angry/AJ0 ./PUN,
K/KB/KBF.xml,KBFRE01D,015402,423,,B,238,1,"not having to take them all, I mean having to take them to court.","not/XX0 have/VHG to/TO0 take/VVI they/PNP all/DT0 ,/PUN i/PNP mean/VVB have/VHG to/TO0 take/VVI they/PNP to/PRP court/NN1 ./PUN",
K/KB/KBF.xml,KBFRE01D,015402,424,,B,238,2,"And they said, just said in the end  again there was er an article or something and it was saying that  you know that er did did you eventually get the money?","and/CJC they/PNP say/VVD ,/PUN just/AV0 say/VVD in/PRP the/AT0 end/NN1 again/AV0 there/EX0 be/VBD er/UNC an/AT0 article/NN1 or/CJC something/PNI and/CJC it/PNP be/VBD say/VVG that/DT0-CJT you/PNP know/VVB that/CJT-DT0 er/UNC do/VDD do/VDD you/PNP eventually/AV0 get/VVI the/AT0 money/NN1 ?/PUN",
K/KB/KBF.xml,KBFRE01D,015402,425,,B,238,3,And they said no they had to write it off.,and/CJC they/PNP say/VVD no/ITJ they/PNP have/VHD to/TO0 write/VVI it/PNP off/AVP ./PUN,
K/KB/KBF.xml,KBFRE01D,015402,426,,A,239,1,Mm.,mm/ITJ ./PUN,
K/KB/KBF.xml,KBFRE01D,015402,427,,B,240,1,They never ever did pay it.,they/PNP never/AV0 ever/AV0 do/VDD pay/VVI it/PNP ./PUN,
K/KB/KBF.xml,KBFRE01D,015402,428,,A,241,1,Well  they are spending a fortune on hounding Paul.,well/AV0 they/PNP be/VBB spend/VVG a/AT0 fortune/NN1 on/PRP hound/VVG paul/NP0 ./PUN,
K/KB/KBF.xml,KBFRE01D,015402,429,,A,241,2,They don't  <sigh> somebody,they/PNP do/VDB not/XX0 somebody/PNI,
K/KB/KBF.xml,KBFRE01D,015402,430,,B,242,1,Cos he's at no fixed address is he?,cos/CJS he/PNP be/VBZ at/PRP no/AT0 fixed/AJ0 address/NN1 be/VBZ he/PNP ?/PUN,
K/KB/KBF.xml,KBFRE01D,015402,431,,A,243,1,"Well  he, he left  he was with Karen  he came to me  he left me and went down to Gloucester  he dithered about running up and down the road between Gloucester  and here er Stowmarket.","well/AV0 he/PNP ,/PUN he/PNP leave/VVD he/PNP be/VBD with/PRP karen/NP0 he/PNP come/VVD to/PRP i/PNP he/PNP leave/VVD i/PNP and/CJC go/VVD down/AVP to/PRP gloucester/NP0 he/PNP dither/VVD about/PRP run/VVG up/AVP and/CJC down/PRP the/AT0 road/NN1 between/PRP gloucester/NP0 and/CJC here/AV0 er/UNC stowmarket/NP0 ./PUN",
K/KB/KBF.xml,KBFRE01D,015402,432,,B,244,1,Stowmarket.<laugh>,stowmarket/NP0 ./PUN,
K/KB/KBF.xml,KBFRE01D,015402,433,,A,245,1,"Erm  not knowing where he was going to, to park his bottom.","erm/UNC not/XX0 know/VVG where/AVQ he/PNP be/VBD go/VVG to/TO0 ,/PUN to/TO0 park/VVI he/DPS bottom/NN1 ./PUN",
K/KB/KBF.xml,KBFRE01D,015402,434,,A,245,2,"And eventually, well I had a, I had a questionnaire  letters were coming to him which I sent back because I, Paul had never told me where he lived in Gloucester.","and/CJC eventually/AV0 ,/PUN well/AV0 i/PNP have/VHD a/AT0 ,/PUN i/PNP have/VHD a/AT0 questionnaire/NN1 letter/NN2 be/VBD come/VVG to/PRP he/PNP which/DTQ i/PNP send/VVD back/AVP because/CJS i/PNP ,/PUN paul/NP0 have/VHD never/AV0 tell/VVN i/PNP where/AVQ he/PNP live/VVD in/PRP gloucester/NP0 ./PUN",
K/KB/KBF.xml,KBFRE01D,015402,435,,B,246,1,Mm.,mm/ITJ ./PUN,
