swda_filename,ptb_basename,conversation_no,transcript_index,act_tag,caller,turn_index,subutterance_index,text,pos,trees
K/KB/KBF.xml,KBFRE01D,015402,0,,A,1,1,old ferry coming over from  erm Harwich to the Hook of Holland.,old/AJ0 ferry/NN1 come/VVG over/AVP from/PRP erm/UNC harwich/NP0 to/PRP the/AT0 hook/NP0 of/PRF holland/NP0 ./PUN,
K/KB/KBF.xml,KBFRE01D,015402,1,,A,1,2,"And I, I used to  sort of sit in er put  sit myself in my little erm bunk you know?","and/CJC i/PNP ,/PUN i/PNP used/VM0 to/TO0 [sort/NN1 of/PRF]/AV0 sit/VVI in/AVP-PRP er/UNC put/VVB sit/VVB myself/PNX in/PRP i/DPS little/AJ0 erm/UNC bunk/NN1 you/PNP know/VVB ?/PUN",
K/KB/KBF.xml,KBFRE01D,015402,2,,B,2,1,Yeah.<yawn>,yeah/ITJ ./PUN,
K/KB/KBF.xml,KBFRE01D,015402,3,,A,3,1,"And the, the swaying of the ship and I used to sleep like a log.","and/CJC the/AT0 ,/PUN the/AT0 swaying/NN1 of/PRF the/AT0 ship/NN1 and/CJC i/PNP used/VM0 to/TO0 sleep/VVI like/PRP a/AT0 log/NN1 ./PUN",
K/KB/KBF.xml,KBFRE01D,015402,4,,A,3,2,Everybody else round me was being sick.,everybody/PNI else/AV0 round/PRP i/PNP be/VBD be/VBG sick/AJ0 ./PUN,
K/KB/KBF.xml,KBFRE01D,015402,5,,A,3,3,<laugh> Not me.<laugh>,not/XX0 i/PNP ./PUN,
K/KB/KBF.xml,KBFRE01D,015402,6,,B,4,1,<laugh> .,./PUN,
K/KB/KBF.xml,KBFRE01D,015402,7,,B,4,2,I didn't sleep very well at all.,i/PNP do/VDD not/XX0 sleep/VVI very/AV0 well/AV0-AJ0 [at/PRP all/DT0]/AV0 ./PUN,
K/KB/KBF.xml,KBFRE01D,015402,8,,B,4,3,Up and down up and down  all night.,up/AVP and/CJC down/AVP-PRP up/AVP and/CJC down/AVP-PRP all/DT0 night/NN1 ./PUN,
K/KB/KBF.xml,KBFRE01D,015402,9,,A,5,1,You have?,you/PNP have/VHB ?/PUN,
K/KB/KBF.xml,KBFRE01D,015402,10,,B,6,1,Mm.,mm/ITJ ./PUN,
K/KB/KBF.xml,KBFRE01D,015402,11,,A,7,1,Why?,why/AVQ ?/PUN,
K/KB/KBF.xml,KBFRE01D,015402,12,,B,8,1,Don't know.,do/VDB not/XX0 know/VVI ./PUN,
K/KB/KBF.xml,KBFRE01D,015402,13,,B,8,2,I,i/PNP,
K/KB/KBF.xml,KBFRE01D,015402,14,,A,9,1,Excitement?,excitement/NN1 ?/PUN,
K/KB/KBF.xml,KBFRE01D,015402,15,,B,10,1,"I think, a lot of it, you know I was  burning a bit so I think a lot of it was sort of it thinking about that blooming boiler.","i/PNP think/VVB ,/PUN a/AT0 lot/NN1 of/PRF it/PNP ,/PUN you/PNP know/VVB i/PNP be/VBD burn/VVG-AJ0 [a/AT0 bit/NN1]/AV0 so/AV0 i/PNP think/VVB a/AT0 lot/NN1 of/PRF it/PNP be/VBD [sort/NN1 of/PRF]/AV0 it/PNP think/VVG about/PRP that/DT0 blooming/AJ0 boiler/NN1 ./PUN",
K/KB/KBF.xml,KBFRE01D,015402,16,,A,11,1,Yes.,yes/ITJ ./PUN,
K/KB/KBF.xml,KBFRE01D,015402,17,,A,11,2,Yes.,yes/ITJ ./PUN,
K/KB/KBF.xml,KBFRE01D,015402,18,,B,12,1,"And then you know Dave I think drew  he was, he was ever so, ever so restless.","and/CJC then/AV0 you/PNP know/VVB dave/NP0 i/PNP think/VVB draw/VVD he/PNP be/VBD ,/PUN he/PNP be/VBD [ever/AV0 so/AV0]/AV0 ,/PUN [ever/AV0 so/AV0]/AV0 restless/AJ0 ./PUN",
K/KB/KBF.xml,KBFRE01D,015402,19,,B,12,2,<yawning> I don't know whether he was expecting the water to burst  or what it was </yawning> .,i/PNP do/VDB not/XX0 know/VVI whether/CJS he/PNP be/VBD expect/VVG the/AT0 water/NN1 to/TO0 burst/VVI or/CJC what/DTQ it/PNP be/VBD ./PUN,
K/KB/KBF.xml,KBFRE01D,015402,20,,A,13,1,Yeah I know.,yeah/ITJ i/PNP know/VVB ./PUN,
K/KB/KBF.xml,KBFRE01D,015402,21,,A,13,2,Ooh I know.,ooh/ITJ i/PNP know/VVB ./PUN,
K/KB/KBF.xml,KBFRE01D,015402,22,,B,14,1,"Cos when I went to bed I mean, you know I tested it and it didn't seem too bad.","cos/CJS when/CJS i/PNP go/VVD to/PRP bed/NN1 i/PNP mean/VVB ,/PUN you/PNP know/VVB i/PNP test/VVD it/PNP and/CJC it/PNP do/VDD not/XX0 seem/VVI too/AV0 bad/AJ0 ./PUN",
K/KB/KBF.xml,KBFRE01D,015402,23,,A,15,1,No.,no/ITJ ./PUN,
K/KB/KBF.xml,KBFRE01D,015402,24,,A,15,2,No.,no/ITJ ./PUN,
K/KB/KBF.xml,KBFRE01D,015402,25,,B,16,1,"It seemed sort of hot  but er  I mean that's the trouble at the moment because  even if it's something minor thing, it seems so dramatic.","it/PNP seem/VVD [sort/NN1 of/PRF]/AV0 hot/AJ0 but/CJC er/UNC i/PNP mean/VVB that/DT0 be/VBZ the/AT0 trouble/NN1 at/PRP the/AT0 moment/NN1 because/CJS [even/AV0 if/CJS]/CJS it/PNP be/VBZ something/PNI minor/AJ0 thing/NN1 ,/PUN it/PNP seem/VVZ so/AV0 dramatic/AJ0 ./PUN",
K/KB/KBF.xml,KBFRE01D,015402,26,,A,17,1,Exactly.,exactly/AV0 ./PUN,
K/KB/KBF.xml,KBFRE01D,015402,27,,B,18,1,You know especially to me at the moment.,you/PNP know/VVB especially/AV0 to/PRP i/PNP at/PRP the/AT0 moment/NN1 ./PUN,
K/KB/KBF.xml,KBFRE01D,015402,28,,A,19,1,Yes.,yes/ITJ ./PUN,
K/KB/KBF.xml,KBFRE01D,015402,29,,B,20,1,I don't know why.,i/PNP do/VDB not/XX0 know/VVI why/AVQ ./PUN,
K/KB/KBF.xml,KBFRE01D,015402,30,,B,20,2,The smallest thing  I mean it seems such a,the/AT0 small/AJS thing/NN1 i/PNP mean/VVB it/PNP seem/VVZ such/DT0 a/AT0,
K/KB/KBF.xml,KBFRE01D,015402,31,,A,21,1,"Well I think  there must, this must be a very common feeling for a lot of people  that they feel that they're balanced on a knife edge.","well/AV0 i/PNP think/VVB there/EX0 must/VM0 ,/PUN this/DT0 must/VM0 be/VBI a/AT0 very/AV0 common/AJ0 feeling/NN1 for/PRP a/AT0 lot/NN1 of/PRF people/NN0 that/CJT they/PNP feel/VVB that/CJT they/PNP be/VBB balance/VVN-AJ0 on/PRP a/AT0 knife/NN1 edge/NN1 ./PUN",
K/KB/KBF.xml,KBFRE01D,015402,32,,A,21,2,"There's so much  we've had to pay out so much  erm you've had to pay out so much on, on more mortgage than you expected.","there/EX0 be/VBZ so/AV0 much/DT0 we/PNP have/VHB have/VHN to/TO0 pay/VVI out/AVP so/AV0 much/DT0 erm/UNC you/PNP have/VHB have/VHN to/TO0 pay/VVI out/AVP so/AV0 much/DT0 on/PRP-AVP ,/PUN on/PRP-AVP more/DT0 mortgage/NN1 than/CJS you/PNP expect/VVD-VVN ./PUN",
K/KB/KBF.xml,KBFRE01D,015402,33,,B,22,1,Mm.,mm/ITJ ./PUN,
K/KB/KBF.xml,KBFRE01D,015402,34,,B,22,2,"Did you, saying that, did you see that programme on  let me think  <yawning> oh dear </yawning> .","do/VDD you/PNP ,/PUN say/VVG that/DT0-CJT ,/PUN do/VDD you/PNP see/VVI that/DT0 programme/NN1 on/AVP-PRP let/VVB i/PNP think/VVI oh/ITJ dear/ITJ ./PUN",
K/KB/KBF.xml,KBFRE01D,015402,35,,B,22,3,It was on repossession.,it/PNP be/VBD on/PRP repossession/NN1 ./PUN,
K/KB/KBF.xml,KBFRE01D,015402,36,,B,22,4,One day in the week or the week before.,one/CRD day/NN1 in/PRP the/AT0 week/NN1 or/CJC the/AT0 week/NN1 before/AV0 ./PUN,
K/KB/KBF.xml,KBFRE01D,015402,37,,B,22,5,"It was on er channel four I think it was  and it was all about these people that had been, you know encouraged to buy this house and then repossessed.","it/PNP be/VBD on/PRP er/UNC channel/NN1 four/CRD i/PNP think/VVB it/PNP be/VBD and/CJC it/PNP be/VBD all/DT0 about/PRP these/DT0 people/NN0 that/CJT have/VHD be/VBN ,/PUN you/PNP know/VVB encourage/VVN to/TO0 buy/VVI this/DT0 house/NN1 and/CJC then/AV0 repossess/VVN-AJ0 ./PUN",
K/KB/KBF.xml,KBFRE01D,015402,38,,A,23,1,Mm.,mm/ITJ ./PUN,
K/KB/KBF.xml,KBFRE01D,015402,39,,A,23,2,Mm.,mm/ITJ ./PUN,
K/KB/KBF.xml,KBFRE01D,015402,40,,B,24,1,And  did you watch it?,and/CJC do/VDD you/PNP watch/VVI it/PNP ?/PUN,
K/KB/KBF.xml,KBFRE01D,015402,41,,A,25,1,No I didn't see that one.,no/ITJ i/PNP do/VDD not/XX0 see/VVI that/DT0 one/PNI ./PUN,
K/KB/KBF.xml,KBFRE01D,015402,42,,B,26,1,Oh it was horrible.,oh/ITJ it/PNP be/VBD horrible/AJ0 ./PUN,
K/KB/KBF.xml,KBFRE01D,015402,43,,B,26,2,And it was how people you know didn't want to er  and they wouldn't.,and/CJC it/PNP be/VBD how/AVQ people/NN0 you/PNP know/VVB do/VDD not/XX0 want/VVI to/TO0 er/UNC and/CJC they/PNP would/VM0 not/XX0 ./PUN,
K/KB/KBF.xml,KBFRE01D,015402,44,,B,26,3,"And they were saying that you don't give, the local erm MP was saying you know people just give their kids up and walk away.","and/CJC they/PNP be/VBD say/VVG that/CJT you/PNP do/VDB not/XX0 give/VVI ,/PUN the/AT0 local/AJ0 erm/UNC mp/NN1 be/VBD say/VVG you/PNP know/VVB people/NN0 just/AV0 give/VVB they/DPS kid/NN2 up/AVP and/CJC walk/VVB-NN1 away/AV0 ./PUN",
K/KB/KBF.xml,KBFRE01D,015402,45,,A,27,1,Mhm yes.,mhm/ITJ yes/ITJ ./PUN,
K/KB/KBF.xml,KBFRE01D,015402,46,,A,27,2,Mm.,mm/ITJ ./PUN,
K/KB/KBF.xml,KBFRE01D,015402,47,,B,28,1,"And, but it was awful you know.","and/CJC ,/PUN but/CJC it/PNP be/VBD awful/AJ0 you/PNP know/VVB ./PUN",
K/KB/KBF.xml,KBFRE01D,015402,48,,B,28,2,There was so many of them.,there/EX0 be/VBD so/AV0 many/DT0 of/PRF they/PNP ./PUN,
K/KB/KBF.xml,KBFRE01D,015402,49,,A,29,1,It should not happen.,it/PNP should/VM0 not/XX0 happen/VVI ./PUN,
K/KB/KBF.xml,KBFRE01D,015402,50,,A,29,2,"I I mean I think it, somewhere somebody is being greedy.","i/PNP i/PNP mean/VVB i/PNP think/VVB it/PNP ,/PUN somewhere/AV0 somebody/PNI be/VBZ be/VBG greedy/AJ0 ./PUN",
K/KB/KBF.xml,KBFRE01D,015402,51,,A,29,3,It shouldn't happen.,it/PNP should/VM0 not/XX0 happen/VVI ./PUN,
K/KB/KBF.xml,KBFRE01D,015402,52,,A,29,4,And it seems to have happened because  thirty years ago everybody like Jerry and me had a repayment mortgage which meant there were very few endowment mortgages.,and/CJC it/PNP seem/VVZ to/TO0 have/VHI happen/VVN because/CJS thirty/CRD year/NN2 ago/AV0 everybody/PNI like/PRP jerry/NP0 and/CJC i/PNP have/VHD a/AT0 repayment/NN1 mortgage/NN1 which/DTQ mean/VVD there/EX0 be/VBD very/AV0 few/DT0 endowment/NN1 mortgage/NN2 ./PUN,
K/KB/KBF.xml,KBFRE01D,015402,53,,B,30,1,Mm?,mm/ITJ ?/PUN,
K/KB/KBF.xml,KBFRE01D,015402,54,,A,31,1,Now a repayment mortgage  they will extend the term of the mortgage.,now/AV0 a/AT0 repayment/NN1 mortgage/NN1 they/PNP will/VM0 extend/VVI the/AT0 term/NN1 of/PRF the/AT0 mortgage/NN1 ./PUN,
K/KB/KBF.xml,KBFRE01D,015402,55,,B,32,1,Yeah but when we had a when we had  (()),yeah/ITJ but/CJC when/CJS we/PNP have/VHD a/AT0 when/CJS we/PNP have/VHD,
K/KB/KBF.xml,KBFRE01D,015402,56,,A,33,1,And the endowment you can't extend it.,and/CJC the/AT0 endowment/NN1 you/PNP can/VM0 not/XX0 extend/VVI it/PNP ./PUN,
K/KB/KBF.xml,KBFRE01D,015402,57,,A,33,2,Well I think they should make it so that you can extend it.,well/AV0 i/PNP think/VVB they/PNP should/VM0 make/VVI it/PNP [so/AV0 that/CJT]/CJS you/PNP can/VM0 extend/VVI it/PNP ./PUN,
K/KB/KBF.xml,KBFRE01D,015402,58,,B,34,1,Yeah but when they,yeah/ITJ but/CJC when/CJS they/PNP,
K/KB/KBF.xml,KBFRE01D,015402,59,,A,35,1,I just don't think I just don't think repossessions should happen.,i/PNP just/AV0 do/VDB not/XX0 think/VVI i/PNP just/AV0 do/VDB not/XX0 think/VVI repossession/NN2 should/VM0 happen/VVI ./PUN,
K/KB/KBF.xml,KBFRE01D,015402,60,,B,36,1,But repayment now is due as an endowment.,but/CJC repayment/NN1 now/AV0 be/VBZ due/AJ0 as/PRP-CJS an/AT0 endowment/NN1 ./PUN,
K/KB/KBF.xml,KBFRE01D,015402,61,,A,37,1,Well they should do something about it Brenda.,well/AV0 they/PNP should/VM0 do/VDI something/PNI about/PRP it/PNP brenda/NP0 ./PUN,
K/KB/KBF.xml,KBFRE01D,015402,62,,A,37,2,That's all I can say.,that/DT0 be/VBZ all/DT0 i/PNP can/VM0 say/VVI ./PUN,
K/KB/KBF.xml,KBFRE01D,015402,63,,A,37,3,"There should be some  certain fund for bailing out people who are in real, terrible difficulties.","there/EX0 should/VM0 be/VBI some/DT0 certain/AJ0 fund/NN1 for/PRP bail/VVG out/AVP people/NN0 who/PNQ be/VBB in/PRP real/AJ0 ,/PUN terrible/AJ0 difficulty/NN2 ./PUN",
K/KB/KBF.xml,KBFRE01D,015402,64,,A,37,4,Because you see,because/CJS you/PNP see/VVB,
K/KB/KBF.xml,KBFRE01D,015402,65,,B,38,1,Yeah because,yeah/ITJ because/CJS,
K/KB/KBF.xml,KBFRE01D,015402,66,,A,39,1,people  people are not being helped.,people/NN0 people/NN0 be/VBB not/XX0 be/VBG help/VVN ./PUN,
K/KB/KBF.xml,KBFRE01D,015402,67,,A,39,2,It's like my Neil.,it/PNP be/VBZ like/PRP i/DPS neil/NP0 ./PUN,
K/KB/KBF.xml,KBFRE01D,015402,68,,A,39,3,Nobody was helping him.,nobody/PNI be/VBD help/VVG he/PNP ./PUN,
K/KB/KBF.xml,KBFRE01D,015402,69,,B,40,1,"Nobody wants to know, do they?","nobody/PNI want/VVZ to/TO0 know/VVI ,/PUN do/VDB they/PNP ?/PUN",
K/KB/KBF.xml,KBFRE01D,015402,70,,A,41,1,No they don't.,no/ITJ they/PNP do/VDB not/XX0 ./PUN,
K/KB/KBF.xml,KBFRE01D,015402,71,,B,42,1,"Not with things sort of going on there's  and now you think sort of it, it's time when people sort of would  club together.","not/XX0 with/PRP thing/NN2 [sort/NN1 of/PRF]/AV0 go/VVG on/AVP there/AV0 's/POS and/CJC now/AV0 you/PNP think/VVB sort/NN1 of/PRF it/PNP ,/PUN it/PNP be/VBZ time/NN1 when/AVQ people/NN0 [sort/NN1 of/PRF]/AV0 would/VM0 club/NN1 together/AV0 ./PUN",
K/KB/KBF.xml,KBFRE01D,015402,72,,A,43,1,Yes.,yes/ITJ ./PUN,
K/KB/KBF.xml,KBFRE01D,015402,73,,B,44,1,"But it was saying, er this, this programme was saying that that  erm  that they were buying a house.","but/CJC it/PNP be/VBD say/VVG ,/PUN er/UNC this/DT0 ,/PUN this/DT0 programme/NN1 be/VBD say/VVG that/CJT that/DT0 erm/UNC that/CJT they/PNP be/VBD buy/VVG a/AT0 house/NN1 ./PUN",
K/KB/KBF.xml,KBFRE01D,015402,74,,B,44,2,"And it was telling you  you know say they were, for argument's sake they was buying this house that was sort of up north and that.","and/CJC it/PNP be/VBD tell/VVG you/PNP you/PNP know/VVB say/VVB they/PNP be/VBD ,/PUN for/PRP argument/NN1 's/POS sake/NN1 they/PNP be/VBD buy/VVG this/DT0 house/NN1 that/CJT-DT0 be/VBD [sort/NN1 of/PRF]/AV0 up/AVP-PRP north/NN1 and/CJC that/DT0 ./PUN",
K/KB/KBF.xml,KBFRE01D,015402,75,,B,44,3,"And they were buying this house and it was worth something like  I don't know, they were, they'd got a twenty five grand mortgage.","and/CJC they/PNP be/VBD buy/VVG this/DT0 house/NN1 and/CJC it/PNP be/VBD worth/PRP something/PNI like/PRP i/PNP do/VDB not/XX0 know/VVI ,/PUN they/PNP be/VBD ,/PUN they/PNP have/VHD get/VVN a/AT0 twenty/CRD five/CRD grand/AJ0 mortgage/NN1 ./PUN",
K/KB/KBF.xml,KBFRE01D,015402,76,,A,45,1,Mm.,mm/ITJ ./PUN,
K/KB/KBF.xml,KBFRE01D,015402,77,,B,46,1,"They hadn't got  it it wasn't, I mean  you know to us it was qu- , a cheap mortgage but sort of up there it was probably, you know sort of","they/PNP have/VHD not/XX0 get/VVN it/PNP it/PNP be/VBD not/XX0 ,/PUN i/PNP mean/VVB you/PNP know/VVB to/PRP we/PNP it/PNP be/VBD qu/UNC ,/PUN a/AT0 cheap/AJ0 mortgage/NN1 but/CJC [sort/NN1 of/PRF]/AV0 up/AVP there/AV0 it/PNP be/VBD probably/AV0 ,/PUN you/PNP know/VVB [sort/NN1 of/PRF]/AV0",
K/KB/KBF.xml,KBFRE01D,015402,78,,A,47,1,Mm.,mm/ITJ ./PUN,
K/KB/KBF.xml,KBFRE01D,015402,79,,A,47,2,Mm.,mm/ITJ ./PUN,
K/KB/KBF.xml,KBFRE01D,015402,80,,B,48,1,a lot of money to him cos there's not the work and that.,a/AT0 lot/NN1 of/PRF money/NN1 to/PRP he/PNP cos/CJS there/EX0 be/VBZ not/XX0 the/AT0 work/NN1 and/CJC that/DT0 ./PUN,
K/KB/KBF.xml,KBFRE01D,015402,81,,B,48,2,And they'd bought this mortgage and their repayment was something like about I dunno a hundred and eighty pound a month.,and/CJC they/PNP have/VHD buy/VVN this/DT0 mortgage/NN1 and/CJC they/DPS repayment/NN1 be/VBD something/PNI like/PRP about/PRP i/PNP do/VDB n/XX0 no/VVI a/AT0 hundred/CRD and/CJC eighty/CRD pound/NN1 a/AT0 month/NN1 ./PUN,
K/KB/KBF.xml,KBFRE01D,015402,82,,A,49,1,Mm.,mm/ITJ ./PUN,
K/KB/KBF.xml,KBFRE01D,015402,83,,B,50,1,"And they said you know, and then all of a sudden it had sort of gone up six percent.","and/CJC they/PNP say/VVD you/PNP know/VVB ,/PUN and/CJC then/AV0 [all/DT0 of/PRF a/AT0 sudden/NN1]/AV0 it/PNP have/VHD [sort/NN1 of/PRF]/AV0 go/VVN up/AVP-PRP six/CRD percent/NN0 ./PUN",
K/KB/KBF.xml,KBFRE01D,015402,84,,A,51,1,Yes.,yes/ITJ ./PUN,
K/KB/KBF.xml,KBFRE01D,015402,85,,A,51,2,That's right.,that/DT0 be/VBZ right/AJ0 ./PUN,
K/KB/KBF.xml,KBFRE01D,015402,86,,B,52,1,And it was five hundred quid.,and/CJC it/PNP be/VBD five/CRD hundred/CRD quid/NN0 ./PUN,
K/KB/KBF.xml,KBFRE01D,015402,87,,A,53,1,Mm.,mm/ITJ ./PUN,
K/KB/KBF.xml,KBFRE01D,015402,88,,B,54,1,"And there was no way, you know at a hundred and eighty they'd struggled.","and/CJC there/EX0 be/VBD no/AT0 way/NN1 ,/PUN you/PNP know/VVB at/PRP a/AT0 hundred/CRD and/CJC eighty/CRD they/PNP have/VHD struggle/VVN ./PUN",
K/KB/KBF.xml,KBFRE01D,015402,89,,A,55,1,Mm.,mm/ITJ ./PUN,
K/KB/KBF.xml,KBFRE01D,015402,90,,A,55,2,Mm.,mm/ITJ ./PUN,
K/KB/KBF.xml,KBFRE01D,015402,91,,B,56,1,"And they thought, because  most people were, were sort of us.","and/CJC they/PNP think/VVD ,/PUN because/CJS most/DT0 people/NN0 be/VBD ,/PUN be/VBD sort/NN1 of/PRF we/PNP ./PUN",
K/KB/KBF.xml,KBFRE01D,015402,92,,B,56,2,We thought oh we'll go for it.,we/PNP think/VVD oh/ITJ we/PNP will/VM0 go/VVI for/PRP it/PNP ./PUN,
K/KB/KBF.xml,KBFRE01D,015402,93,,A,57,1,Yes.,yes/ITJ ./PUN,
K/KB/KBF.xml,KBFRE01D,015402,94,,A,57,2,Yes.,yes/ITJ ./PUN,
K/KB/KBF.xml,KBFRE01D,015402,95,,B,58,1,It's gonna be a struggle for a year.,it/PNP be/VBZ gon/VVG na/TO0 be/VBI a/AT0 struggle/NN1 for/PRP a/AT0 year/NN1 ./PUN,
K/KB/KBF.xml,KBFRE01D,015402,96,,B,58,2,But you go for it.,but/CJC you/PNP go/VVB for/PRP it/PNP ./PUN,
K/KB/KBF.xml,KBFRE01D,015402,97,,A,59,1,Yeah of course.,yeah/ITJ [of/PRF course/NN1]/AV0 ./PUN,
K/KB/KBF.xml,KBFRE01D,015402,98,,B,60,1,And you don't dream of it,and/CJC you/PNP do/VDB not/XX0 dream/VVI of/PRF it/PNP,
K/KB/KBF.xml,KBFRE01D,015402,99,,A,61,1,No.,no/ITJ ./PUN,
K/KB/KBF.xml,KBFRE01D,015402,100,,A,61,2,Nobody ever dreamed,nobody/PNI ever/AV0 dream/VVN-VVD,
K/KB/KBF.xml,KBFRE01D,015402,101,,B,62,1,going up.,go/VVG up/AVP ./PUN,
K/KB/KBF.xml,KBFRE01D,015402,102,,A,63,1,Nobody ever dreamed of this.,nobody/PNI ever/AV0 dream/VVN of/PRF this/DT0 ./PUN,
K/KB/KBF.xml,KBFRE01D,015402,103,,B,64,1,I mean they reckon it's gonna go back up now don't they?,i/PNP mean/VVB they/PNP reckon/VVB it/PNP be/VBZ gon/VVG na/TO0 go/VVI back/AVP up/AVP now/AV0 do/VDB not/XX0 they/PNP ?/PUN,
K/KB/KBF.xml,KBFRE01D,015402,104,,A,65,1,Yeah.,yeah/ITJ ./PUN,
K/KB/KBF.xml,KBFRE01D,015402,105,,A,65,2,Probably will.,probably/AV0 will/VM0 ./PUN,
K/KB/KBF.xml,KBFRE01D,015402,106,,A,65,3,"I, you see I think that instead of, instead of Lawson putting interest rates up to squeeze inflation out of the economy  he should have stopped all credit.","i/PNP ,/PUN you/PNP see/VVB i/PNP think/VVB that/CJT-DT0 [instead/AV0 of/PRF]/PRP ,/PUN [instead/AV0 of/PRF]/PRP lawson/NP0 put/VVG interest/NN1 rate/NN2 up/AVP to/TO0 squeeze/VVI inflation/NN1 [out/AVP of/PRF]/PRP the/AT0 economy/NN1 he/PNP should/VM0 have/VHI stop/VVN all/DT0 credit/NN1-VVB ./PUN",
K/KB/KBF.xml,KBFRE01D,015402,107,,A,65,4,When Jerry and I  were young  if at the end of the month there was no money in the account  the bank used to write you a filthy letter if you were two pounds overdrawn.,when/CJS jerry/NP0 and/CJC i/PNP be/VBD young/AJ0 if/CJS at/PRP the/AT0 end/NN1 of/PRF the/AT0 month/NN1 there/EX0 be/VBD no/AT0 money/NN1 in/PRP the/AT0 account/NN1-VVB the/AT0 bank/NN1 used/VM0 to/TO0 write/VVI you/PNP a/AT0 filthy/AJ0 letter/NN1 if/CJS you/PNP be/VBD two/CRD pound/NN2 overdrawn/AJ0 ./PUN,
K/KB/KBF.xml,KBFRE01D,015402,108,,A,65,5,And you had  if  it was no good you wanting something  and waving a bit of plastic at it.,and/CJC you/PNP have/VHD if/CJS it/PNP be/VBD no/AT0 good/NN1 you/PNP want/VVG-AJ0 something/PNI and/CJC wave/VVG a/AT0 bit/NN1 of/PRF plastic/NN1 at/PRP it/PNP ./PUN,
K/KB/KBF.xml,KBFRE01D,015402,109,,A,65,6,There was no bit of plastic to wave then.,there/EX0 be/VBD no/AT0 bit/NN1 of/PRF plastic/NN1 to/TO0 wave/VVI then/AV0 ./PUN,
K/KB/KBF.xml,KBFRE01D,015402,110,,B,66,1,There wasn't?,there/EX0 be/VBD not/XX0 ?/PUN,
K/KB/KBF.xml,KBFRE01D,015402,111,,A,67,1,Not a thing.,not/XX0 a/AT0 thing/NN1 ./PUN,
K/KB/KBF.xml,KBFRE01D,015402,112,,A,67,2,"If you wanted to borrow money from the bank to, to buy anything there were two ways of getting money.","if/CJS you/PNP want/VVD to/TO0 borrow/VVI money/NN1 from/PRP the/AT0 bank/NN1 to/TO0 ,/PUN to/TO0 buy/VVI anything/PNI there/EX0 be/VBD two/CRD way/NN2 of/PRF get/VVG money/NN1 ./PUN",
K/KB/KBF.xml,KBFRE01D,015402,113,,A,67,3,You could go to the bank and ask for a loan.,you/PNP could/VM0 go/VVI to/PRP the/AT0 bank/NN1 and/CJC ask/VVB for/PRP a/AT0 loan/NN1 ./PUN,
K/KB/KBF.xml,KBFRE01D,015402,114,,A,67,4,"And mostly you got a dusty answer because if you hadn't got shares to put down as collateral, you didn't get your loan.","and/CJC mostly/AV0 you/PNP get/VVD-VVN a/AT0 dusty/AJ0 answer/NN1 because/CJS if/CJS you/PNP have/VHD not/XX0 get/VVN share/NN2 to/TO0 put/VVI down/AVP as/PRP collateral/NN1 ,/PUN you/PNP do/VDD not/XX0 get/VVI you/DPS loan/NN1 ./PUN",
K/KB/KBF.xml,KBFRE01D,015402,115,,A,67,5,And the other way of doing it was to go on hire purchase.,and/CJC the/AT0 other/AJ0 way/NN1 of/PRF do/VDG it/PNP be/VBD to/TO0 go/VVI on/PRP hire/NN1 purchase/NN1 ./PUN,
K/KB/KBF.xml,KBFRE01D,015402,116,,A,67,6,"And when you wanted to buy something like a three piece suite, you went to somewhere like Bentalls  and they took you into a little room, soon as you said to the man well I want to buy this on hire purchase and you went in to a little room  and the man sat down and you filled in a long form.","and/CJC when/CJS you/PNP want/VVD to/TO0 buy/VVI something/PNI like/PRP a/AT0 three/CRD piece/NN1 suite/NN1 ,/PUN you/PNP go/VVD to/PRP somewhere/AV0 like/PRP bentalls/NP0 and/CJC they/PNP take/VVD you/PNP into/PRP a/AT0 little/AJ0 room/NN1 ,/PUN soon/AV0 as/CJS you/PNP say/VVD to/PRP the/AT0 man/NN1 well/AV0 i/PNP want/VVB to/TO0 buy/VVI this/DT0 on/PRP hire/NN1 purchase/NN1 and/CJC you/PNP go/VVD in/AVP-PRP to/PRP a/AT0 little/AJ0 room/NN1 and/CJC the/AT0 man/NN1 sit/VVD down/AVP and/CJC you/PNP fill/VVD-VVN in/AVP a/AT0 long/AJ0 form/NN1 ./PUN",
K/KB/KBF.xml,KBFRE01D,015402,117,,A,67,7,You told him what your husband earned.,you/PNP tell/VVD he/PNP what/DTQ you/DPS husband/NN1 earn/VVN-VVD ./PUN,
K/KB/KBF.xml,KBFRE01D,015402,118,,A,67,8,"Erm  what you, er what you  could manage in the way of repayments what, er er you had to put one third of the full price down.","erm/UNC what/DTQ you/PNP ,/PUN er/UNC what/DTQ you/PNP could/VM0 manage/VVI in/PRP the/AT0 way/NN1 of/PRF repayment/NN2 what/DTQ ,/PUN er/UNC er/UNC you/PNP have/VHD to/TO0 put/VVI one/CRD third/ORD of/PRF the/AT0 full/AJ0 price/NN1 down/AVP ./PUN",
K/KB/KBF.xml,KBFRE01D,015402,119,,B,68,1,Is that when you and Jerry were first married or,be/VBZ that/DT0 when/CJS you/PNP and/CJC jerry/NP0 be/VBD first/ORD married/AJ0 or/CJC,
K/KB/KBF.xml,KBFRE01D,015402,120,,A,69,1,Yes.,yes/ITJ ./PUN,
K/KB/KBF.xml,KBFRE01D,015402,121,,A,69,2,Yeah you had to put one third of the full price.,yeah/ITJ you/PNP have/VHD to/TO0 put/VVI one/CRD third/ORD of/PRF the/AT0 full/AJ0 price/NN1 ./PUN,
K/KB/KBF.xml,KBFRE01D,015402,122,,A,69,3,"So if a three piece suite cost say a hundred and fifty pounds, you had to put fifty pounds down.","so/AV0 if/CJS a/AT0 three/CRD piece/NN1 suite/NN1 cost/NN1-VVB say/VVB a/AT0 hundred/CRD and/CJC fifty/CRD pound/NN2 ,/PUN you/PNP have/VHD to/TO0 put/VVI fifty/CRD pound/NN2 down/AVP ./PUN",
K/KB/KBF.xml,KBFRE01D,015402,123,,A,69,4,"And the, the hundred over over two years on, on interest.","and/CJC the/AT0 ,/PUN the/AT0 hundred/CRD over/AV0 over/AV0 two/CRD year/NN2 on/PRP ,/PUN on/PRP interest/NN1 ./PUN",
K/KB/KBF.xml,KBFRE01D,015402,124,,B,70,1,So people couldn't get in that state could they?,so/AV0 people/NN0 could/VM0 not/XX0 get/VVI in/PRP that/DT0 state/NN1 could/VM0 they/PNP ?/PUN,
K/KB/KBF.xml,KBFRE01D,015402,125,,B,70,2,You,you/PNP,
K/KB/KBF.xml,KBFRE01D,015402,126,,A,71,1,"You, you could not get into debt Brenda.","you/PNP ,/PUN you/PNP could/VM0 not/XX0 get/VVI into/PRP debt/NN1 brenda/NP0 ./PUN",
K/KB/KBF.xml,KBFRE01D,015402,127,,A,71,2,You were not allowed to.,you/PNP be/VBD not/XX0 allow/VVN to/TO0 ./PUN,
K/KB/KBF.xml,KBFRE01D,015402,128,,B,72,1,What you could afford  you had.,what/DTQ you/PNP could/VM0 afford/VVI you/PNP have/VHD ./PUN,
K/KB/KBF.xml,KBFRE01D,015402,129,,A,73,1,Exactly.,exactly/AV0 ./PUN,
K/KB/KBF.xml,KBFRE01D,015402,130,,A,73,2,Exactly.,exactly/AV0 ./PUN,
K/KB/KBF.xml,KBFRE01D,015402,131,,B,74,1,"Now when did the  I suppose the credit card they brought  but as to what you say I mean  the, these, these repossessions it's not the fact  they can't afford the mortgage.","now/AV0 when/AVQ do/VDD the/AT0 i/PNP suppose/VVB the/AT0 credit/NN1 card/NN1 they/PNP bring/VVD but/CJC [as/CJS to/PRP]/PRP what/DTQ you/PNP say/VVB i/PNP mean/VVB the/AT0 ,/PUN these/DT0 ,/PUN these/DT0 repossession/NN2 it/PNP be/VBZ not/XX0 the/AT0 fact/NN1 they/PNP can/VM0 not/XX0 afford/VVI the/AT0 mortgage/NN1 ./PUN",
K/KB/KBF.xml,KBFRE01D,015402,132,,B,74,2,"It's the fact they can't afford  all the  the, the lifestyle to go with it, that's what Dave says.","it/PNP be/VBZ the/AT0 fact/NN1 they/PNP can/VM0 not/XX0 afford/VVI all/DT0 the/AT0 the/AT0 ,/PUN the/AT0 lifestyle/NN1 to/TO0 go/VVI with/PRP it/PNP ,/PUN that/DT0 be/VBZ what/DTQ dave/NP0 say/VVZ ./PUN",
K/KB/KBF.xml,KBFRE01D,015402,133,,B,74,3,I mean the fact is  you know there's blokes at work.,i/PNP mean/VVB the/AT0 fact/NN1 be/VBZ you/PNP know/VVB there/EX0 be/VBZ bloke/NN2 at/PRP work/NN1 ./PUN,
K/KB/KBF.xml,KBFRE01D,015402,134,,B,74,4,Same mortgage as us and earning the same as Dave.,same/DT0 mortgage/NN1 as/CJS we/PNP and/CJC earn/VVG the/AT0 same/DT0 as/CJS dave/NP0 ./PUN,
K/KB/KBF.xml,KBFRE01D,015402,135,,B,74,5,"I mean, you know they're in a dreadful state.","i/PNP mean/VVB ,/PUN you/PNP know/VVB they/PNP be/VBB in/PRP a/AT0 dreadful/AJ0 state/NN1 ./PUN",
K/KB/KBF.xml,KBFRE01D,015402,136,,A,75,1,Mm.,mm/ITJ ./PUN,
K/KB/KBF.xml,KBFRE01D,015402,137,,B,76,1,I mean they spend their wages before,i/PNP mean/VVB they/PNP spend/VVB they/DPS wage/NN2 before/AV0,
K/KB/KBF.xml,KBFRE01D,015402,138,,A,77,1,Mm.,mm/ITJ ./PUN,
K/KB/KBF.xml,KBFRE01D,015402,139,,B,78,1,And I think it's because they go out drinking and  you know,and/CJC i/PNP think/VVB it/PNP be/VBZ because/CJS they/PNP go/VVB out/AVP drink/VVG-NN1 and/CJC you/PNP know/VVB,
K/KB/KBF.xml,KBFRE01D,015402,140,,A,79,1,Mm.,mm/ITJ ./PUN,
K/KB/KBF.xml,KBFRE01D,015402,141,,B,80,1,They're always buying things for the home.,they/PNP be/VBB always/AV0 buy/VVG thing/NN2 for/PRP the/AT0 home/NN1 ./PUN,
K/KB/KBF.xml,KBFRE01D,015402,142,,B,80,2,And the cars.,and/CJC the/AT0 car/NN2 ./PUN,
K/KB/KBF.xml,KBFRE01D,015402,143,,B,80,3,I mean  majority of blokes at Dave's firm have changed their cars three times.,i/PNP mean/VVB majority/NN1 of/PRF bloke/NN2 at/PRP dave/NP0 's/POS firm/NN1 have/VHB change/VVN they/DPS car/NN2 three/CRD time/NN2 ./PUN,
K/KB/KBF.xml,KBFRE01D,015402,144,,A,81,1,Yeah.,yeah/ITJ ./PUN,
K/KB/KBF.xml,KBFRE01D,015402,145,,A,81,2,Yeah.,yeah/ITJ ./PUN,
