swda_filename,ptb_basename,conversation_no,transcript_index,act_tag,caller,turn_index,subutterance_index,text,pos,trees
K/KB/KBF.xml,KBFRE01D,015402,436,,A,247,1,"And I  they were addressed to him and they were from the council and I simply said, er wrote on the outside  erm no longer here, address not known.","and/CJC i/PNP they/PNP be/VBD address/VVN to/PRP he/PNP and/CJC they/PNP be/VBD from/PRP the/AT0 council/NN1 and/CJC i/PNP simply/AV0 say/VVD ,/PUN er/UNC write/VVD on/PRP the/AT0 outside/AJ0-NN1 erm/UNC [no/AV0 longer/AV0]/AV0 here/AV0 ,/PUN address/NN1-VVB not/XX0 know/VVN ./PUN",
K/KB/KBF.xml,KBFRE01D,015402,437,,A,247,2,Which was true.,which/DTQ be/VBD true/AJ0 ./PUN,
K/KB/KBF.xml,KBFRE01D,015402,438,,A,247,3,"And then they sent me a questionnaire saying  they understood that he'd  he'd given my address, and was he res- , was he still resident?","and/CJC then/AV0 they/PNP send/VVD i/PNP a/AT0 questionnaire/NN1 say/VVG they/PNP understand/VVD that/CJT he/PNP have/VHD he/PNP have/VHD give/VVN i/DPS address/NN1 ,/PUN and/CJC be/VBD he/PNP res/UNC ,/PUN be/VBD he/PNP still/AV0 resident/AJ0-NN1 ?/PUN",
K/KB/KBF.xml,KBFRE01D,015402,439,,A,247,4,And I said no.,and/CJC i/PNP say/VVD no/ITJ ./PUN,
K/KB/KBF.xml,KBFRE01D,015402,440,,A,247,5,Did I know his address?,do/VDD i/PNP know/VVI he/DPS address/NN1 ?/PUN,
K/KB/KBF.xml,KBFRE01D,015402,441,,A,247,6,I said no.,i/PNP say/VVD no/ITJ ./PUN,
K/KB/KBF.xml,KBFRE01D,015402,442,,A,247,7,"Eventually an expensive chap, you're talking fifteen thousand a year, an expensive chap comes to interview me.","eventually/AV0 an/AT0 expensive/AJ0 chap/NN1 ,/PUN you/PNP be/VBB talk/VVG fifteen/CRD thousand/CRD a/AT0 year/NN1 ,/PUN an/AT0 expensive/AJ0 chap/NN1 come/VVZ to/TO0 interview/VVI i/PNP ./PUN",
