swda_filename,ptb_basename,conversation_no,transcript_index,act_tag,caller,turn_index,subutterance_index,text,pos,trees
K/KD/KDK.xml,KDKRE00E,016801,0,,A,1,1,Oh Daddy  --,oh/ITJ daddy/NN1 ,
K/KD/KDK.xml,KDKRE00E,016801,1,,A,1,2,--I went into the upstairs bathroom  --,i/PNP go/VVD into/PRP the/AT0 upstairs/NN1 bathroom/NN1 ,
K/KD/KDK.xml,KDKRE00E,016801,2,,A,1,3,"--and turned on the light, it went on and it went ping  --","and/CJC turn/VVD on/PRP the/AT0 light/NN1-AJ0 ,/PUN it/PNP go/VVD on/AVP and/CJC it/PNP go/VVD ping/NN1 ",
K/KD/KDK.xml,KDKRE00E,016801,3,,A,1,4,--and then turned off again.,and/CJC then/AV0 turn/VVD-VVN off/AVP again/AV0 ./PUN ,
K/KD/KDK.xml,KDKRE00E,016801,4,,B,2,1,(()) ,,
