swda_filename,ptb_basename,conversation_no,transcript_index,act_tag,caller,turn_index,subutterance_index,text,pos,trees
K/KD/KD0.xml,KD0RE00L,017101,0,,A,1,1,Right.,right/AV0 ./PUN,
K/KD/KD0.xml,KD0RE00L,017101,1,,A,1,2,"Who shall we, who shall we get","who/PNQ shall/VM0 we/PNP ,/PUN who/PNQ shall/VM0 we/PNP get/VVI",
K/KD/KD0.xml,KD0RE00L,017101,2,,B,2,1,What?,what/DTQ ?/PUN,
K/KD/KD0.xml,KD0RE00L,017101,3,,A,3,1,as a replacement for somebody.,as/PRP-CJS a/AT0 replacement/NN1 for/PRP somebody/PNI ./PUN,
K/KD/KD0.xml,KD0RE00L,017101,4,,A,3,2,Who is there?,who/PNQ be/VBZ there/EX0 ?/PUN,
K/KD/KD0.xml,KD0RE00L,017101,5,,A,3,3,Who would you like?,who/PNQ would/VM0 you/PNP like/VVI ?/PUN,
K/KD/KD0.xml,KD0RE00L,017101,6,,A,3,4,If we had all the money.,if/CJS we/PNP have/VHD all/DT0 the/AT0 money/NN1 ./PUN,
K/KD/KD0.xml,KD0RE00L,017101,7,,A,3,5,Buy Ian Wright back I suppose.,buy/VVB ian/NP0 wright/NP0 back/AVP i/PNP suppose/VVB ./PUN,
K/KD/KD0.xml,KD0RE00L,017101,8,,B,4,1,No.,no/ITJ ./PUN,
K/KD/KD0.xml,KD0RE00L,017101,9,,B,4,2,I'd sell Bright.,i/PNP would/VM0 sell/VVI bright/AJ0 ./PUN,
K/KD/KD0.xml,KD0RE00L,017101,10,,B,4,3,No I wouldn't sell Bright.,no/ITJ i/PNP would/VM0 not/XX0 sell/VVI bright/AJ0 ./PUN,
K/KD/KD0.xml,KD0RE00L,017101,11,,B,4,4,I'd buy someone first.,i/PNP would/VM0 buy/VVI someone/PNI first/ORD ./PUN,
K/KD/KD0.xml,KD0RE00L,017101,12,,B,4,5,Make sure someone was interested in  (()) .,make/VVB sure/AJ0 someone/PNI be/VBD interested/AJ0 in/PRP ./PUN,
K/KD/KD0.xml,KD0RE00L,017101,13,,B,4,6,I'd buy Deane  and swap Bright in exchange for Deane.,i/PNP would/VM0 buy/VVI deane/NP0 and/CJC swap/VVB bright/AJ0 in/PRP exchange/NN1 for/PRP deane/NP0 ./PUN,
K/KD/KD0.xml,KD0RE00L,017101,14,,B,4,7,No matter how bad he doesn't like it  he's well and truly gutted.,[no/ITJ matter/NN1 how/AVQ]/AVQ bad/AJ0 he/PNP do/VDZ not/XX0 like/VVI it/PNP he/PNP be/VBZ well/AV0 and/CJC truly/AV0 gut/VVN-AJ0 ./PUN,
K/KD/KD0.xml,KD0RE00L,017101,15,,B,4,8,Er so him for Deane and,er/UNC so/AV0 he/PNP for/PRP deane/NP0 and/CJC,
K/KD/KD0.xml,KD0RE00L,017101,16,,A,5,1,Yeah but Deane won't be available till the end of the season.,yeah/ITJ but/CJC deane/NP0 will/VM0 not/XX0 be/VBI available/AJ0 till/PRP the/AT0 end/NN1 of/PRF the/AT0 season/NN1 ./PUN,
K/KD/KD0.xml,KD0RE00L,017101,17,,A,5,2,There's no way Sheffield United  (()),there/EX0 be/VBZ no/AT0 way/NN1 sheffield/NP0 united/AJ0,
K/KD/KD0.xml,KD0RE00L,017101,18,,B,6,1,Er I dunno.,er/UNC i/PNP do/VDB n/XX0 no/VVI ./PUN,
K/KD/KD0.xml,KD0RE00L,017101,19,,A,7,1,just stoking the price up I think.,just/AV0 stoke/VVG the/AT0 price/NN1 up/AVP i/PNP think/VVB ./PUN,
K/KD/KD0.xml,KD0RE00L,017101,20,,A,7,2,"Cos it's not old Bassett now, this is what it's all about.","cos/CJS it/PNP be/VBZ not/XX0 old/AJ0 bassett/NP0 now/AV0 ,/PUN this/DT0 be/VBZ what/DTQ it/PNP be/VBZ all/DT0 about/AVP-PRP ./PUN",
K/KD/KD0.xml,KD0RE00L,017101,21,,A,7,3,(()) to get the odd draw you need the odd goal and er it's not gonna come from any other people than er,to/TO0 get/VVI the/AT0 odd/AJ0 draw/VVB-NN1 you/PNP need/VVB the/AT0 odd/AJ0 goal/NN1 and/CJC er/UNC it/PNP be/VBZ not/XX0 gon/VVG na/TO0 come/VVI from/PRP any/DT0 other/AJ0 people/NN0 than/CJS er/UNC,
K/KD/KD0.xml,KD0RE00L,017101,22,,B,8,1,"Oh yeah, Deane.","oh/ITJ yeah/ITJ ,/PUN deane/NP0 ./PUN",
K/KD/KD0.xml,KD0RE00L,017101,23,,A,9,1,Deane.,deane/NP0 ./PUN,
K/KD/KD0.xml,KD0RE00L,017101,24,,A,9,2,But Deane didn't score today.,but/CJC deane/NP0 do/VDD not/XX0 score/VVI today/AV0 ./PUN,
K/KD/KD0.xml,KD0RE00L,017101,25,,A,9,3,It was Beazley apparently.,it/PNP be/VBD beazley/NP0 apparently/AV0 ./PUN,
K/KD/KD0.xml,KD0RE00L,017101,26,,A,9,4,Beazley.,beazley/NN1-NP0 ./PUN,
K/KD/KD0.xml,KD0RE00L,017101,27,,B,10,1,Beazley.,beazley/NN1-NP0 ./PUN,
K/KD/KD0.xml,KD0RE00L,017101,28,,B,10,2,Er I might see if I could pick up that  Sheffield United guy Jamie Hoyland.,er/UNC i/PNP might/VM0 see/VVI if/CJS i/PNP could/VM0 pick/VVI up/AVP that/DT0 sheffield/NP0 united/AJ0 guy/NN1 jamie/NP0 hoyland/NP0 ./PUN,
K/KD/KD0.xml,KD0RE00L,017101,29,,B,10,3,He's quite good.,he/PNP be/VBZ quite/AV0 good/AJ0 ./PUN,
K/KD/KD0.xml,KD0RE00L,017101,30,,A,11,1,"As you say the main problem is, as you say is are you going to change your whole  team, game (())","as/CJS you/PNP say/VVB the/AT0 main/AJ0 problem/NN1 be/VBZ ,/PUN as/CJS you/PNP say/VVB be/VBZ be/VBB you/PNP go/VVG to/TO0 change/VVI you/DPS whole/AJ0 team/NN1 ,/PUN game/NN1",
K/KD/KD0.xml,KD0RE00L,017101,31,,B,12,1,Yeah.,yeah/ITJ ./PUN,
K/KD/KD0.xml,KD0RE00L,017101,32,,B,12,2,I don't know.,i/PNP do/VDB not/XX0 know/VVI ./PUN,
K/KD/KD0.xml,KD0RE00L,017101,33,,B,12,3,I think they'll do it slowly but  not this slowly.,i/PNP think/VVB they/PNP will/VM0 do/VDI it/PNP slowly/AV0 but/CJC not/XX0 this/AV0 slowly/AV0 ./PUN,
K/KD/KD0.xml,KD0RE00L,017101,34,,B,12,4,I mean I th- I think we should have bought someone along with er Gabbiadini to play with him.,i/PNP mean/VVB i/PNP th/UNC i/PNP think/VVB we/PNP should/VM0 have/VHI buy/VVN someone/PNI [along/AVP with/PRP]/PRP er/UNC gabbiadini/NP0 to/TO0 play/VVI with/PRP he/PNP ./PUN,
K/KD/KD0.xml,KD0RE00L,017101,35,,B,12,5,(()) could just bring him and expect  (()) stuff.,could/VM0 just/AV0 bring/VVI he/PNP and/CJC expect/VVB stuff/NN1 ./PUN,
K/KD/KD0.xml,KD0RE00L,017101,36,,B,12,6,Mm could you get,mm/ITJ could/VM0 you/PNP get/VVI,
K/KD/KD0.xml,KD0RE00L,017101,37,,A,13,1,"I think he's gonna have to raid the bottom divisions again, you know.","i/PNP think/VVB he/PNP be/VBZ gon/VVG na/TO0 have/VHI to/TO0 raid/VVI the/AT0 bottom/AJ0-NN1 division/NN2 again/AV0 ,/PUN you/PNP know/VVB ./PUN",
K/KD/KD0.xml,KD0RE00L,017101,38,,B,14,1,What sort of bottom divisions?,what/DTQ sort/NN1 of/PRF bottom/AJ0-NN1 division/NN2 ?/PUN,
K/KD/KD0.xml,KD0RE00L,017101,39,,A,15,1,(()) he's probably got his eye on (()) .,he/PNP have/VHZ probably/AV0 get/VVN he/DPS eye/NN1 on/AVP-PRP ./PUN,
K/KD/KD0.xml,KD0RE00L,017101,40,,A,15,2,I mean that Coleman was a very good buy wasn't he?,i/PNP mean/VVB that/CJT-DT0 coleman/NP0 be/VBD a/AT0 very/AV0 good/AJ0 buy/NN1-VVB be/VBD not/XX0 he/PNP ?/PUN,
K/KD/KD0.xml,KD0RE00L,017101,41,,A,15,3,Yeah?(()),yeah/ITJ ?/PUN,
K/KD/KD0.xml,KD0RE00L,017101,42,,B,16,1,Yeah.,yeah/ITJ ./PUN,
K/KD/KD0.xml,KD0RE00L,017101,43,,A,17,1,How much did he cost?(()),how/AVQ much/DT0 do/VDD he/PNP cost/VVI ?/PUN,
K/KD/KD0.xml,KD0RE00L,017101,44,,B,18,1,Three hundred and fifty.,three/CRD hundred/CRD and/CJC fifty/CRD ./PUN,
K/KD/KD0.xml,KD0RE00L,017101,45,,A,19,1,Three hundred and fifty.,three/CRD hundred/CRD and/CJC fifty/CRD ./PUN,
K/KD/KD0.xml,KD0RE00L,017101,46,,A,19,2,"No it wasn't, it was three hundred.","no/ITJ it/PNP be/VBD not/XX0 ,/PUN it/PNP be/VBD three/CRD hundred/CRD ./PUN",
K/KD/KD0.xml,KD0RE00L,017101,47,,A,19,3,It was two,it/PNP be/VBD two/CRD,
K/KD/KD0.xml,KD0RE00L,017101,48,,B,20,1,Yes it was.,yes/ITJ it/PNP be/VBD ./PUN,
K/KD/KD0.xml,KD0RE00L,017101,49,,B,20,2,Three hundred and fifty.,three/CRD hundred/CRD and/CJC fifty/CRD ./PUN,
K/KD/KD0.xml,KD0RE00L,017101,50,,A,21,1,"Oh anyway, it was still pretty good wasn't it?","oh/ITJ anyway/AV0 ,/PUN it/PNP be/VBD still/AV0 pretty/AV0 good/AJ0 be/VBD not/XX0 it/PNP ?/PUN",
K/KD/KD0.xml,KD0RE00L,017101,51,,B,22,1,"Wasn't cheap, I mean","be/VBD not/XX0 cheap/AJ0 ,/PUN i/PNP mean/VVB",
K/KD/KD0.xml,KD0RE00L,017101,52,,A,23,1,"No, but I mean you could see   (()) play really well (()) .","no/ITJ ,/PUN but/CJC i/PNP mean/VVB you/PNP could/VM0 see/VVI play/NN1-VVB really/AV0 well/AV0-AJ0 ./PUN",
K/KD/KD0.xml,KD0RE00L,017101,53,,A,23,2,"I mean Southgate's all the more pleasing when you think he's somebody that's worked his way up, right?","i/PNP mean/VVB southgate/NP0 be/VBZ all/AV0 the/AT0 more/AV0 pleasing/AJ0 when/CJS you/PNP think/VVB he/PNP be/VBZ somebody/PNI that/CJT have/VHZ work/VVN he/DPS way/NN1 up/AVP ,/PUN right/AV0 ?/PUN",
K/KD/KD0.xml,KD0RE00L,017101,54,,B,24,1,Yeah.,yeah/ITJ ./PUN,
K/KD/KD0.xml,KD0RE00L,017101,55,,A,25,1,That's really nice to see.,that/DT0 be/VBZ really/AV0 nice/AJ0 to/TO0 see/VVI ./PUN,
K/KD/KD0.xml,KD0RE00L,017101,56,,A,25,2,And he played really well.,and/CJC he/PNP play/VVD really/AV0 well/AV0-AJ0 ./PUN,
K/KD/KD0.xml,KD0RE00L,017101,57,,B,26,1,Southgate is a harder person to mark isn't he?,southgate/NP0 be/VBZ a/AT0 hard/AJC person/NN1 to/TO0 mark/VVI be/VBZ not/XX0 he/PNP ?/PUN,
K/KD/KD0.xml,KD0RE00L,017101,58,,A,27,1,Yeah.,yeah/ITJ ./PUN,
K/KD/KD0.xml,KD0RE00L,017101,59,,A,27,2,"I think I'd drop Mortimer  oh look, Palace.","i/PNP think/VVB i/PNP would/VM0 drop/VVI mortimer/NP0 oh/ITJ look/VVB ,/PUN palace/NN1 ./PUN",
K/KD/KD0.xml,KD0RE00L,017101,60,,A,27,3,Red car  <laugh> it's like ours isn't it?,red/AJ0 car/NN1 it/PNP be/VBZ like/PRP ours/PNP be/VBZ not/XX0 it/PNP ?/PUN,
K/KD/KD0.xml,KD0RE00L,017101,61,,B,28,1,Yeah.,yeah/ITJ ./PUN,
K/KD/KD0.xml,KD0RE00L,017101,62,,A,29,1,"I'd drop, I'd drop Paul Mortimer","i/PNP would/VM0 drop/VVI ,/PUN i/PNP would/VM0 drop/VVI paul/NP0 mortimer/NP0",
K/KD/KD0.xml,KD0RE00L,017101,63,,B,30,1,Yeah.,yeah/ITJ ./PUN,
K/KD/KD0.xml,KD0RE00L,017101,64,,A,31,1,and have Collymore in right?,and/CJC have/VHB collymore/NP0 in/PRP-AVP right/AJ0-AV0 ?/PUN,
K/KD/KD0.xml,KD0RE00L,017101,65,,A,31,2,"And encourage  that's the trouble, you drop Mortimer you drop somebody who can er flip the ball in but  I think you definitely want to take the heat off Wright.","and/CJC encourage/VVB that/DT0-CJT be/VBZ the/AT0 trouble/NN1 ,/PUN you/PNP drop/VVB mortimer/NP0 you/PNP drop/VVB somebody/PNI who/PNQ can/VM0 er/UNC flip/VVI the/AT0 ball/NN1 in/AVP-PRP but/CJC i/PNP think/VVB you/PNP definitely/AV0 want/VVB to/TO0 take/VVI the/AT0 heat/NN1 off/PRP wright/NP0 ./PUN",
K/KD/KD0.xml,KD0RE00L,017101,66,,A,31,3,Now if if all Collymore does is distract   (()) but Mortimer was not playing enough of the game.,now/AV0 if/CJS if/CJS all/DT0 collymore/NP0 do/VDZ be/VBZ distract/VVI but/CJC mortimer/NP0 be/VBD not/XX0 play/VVG enough/DT0 of/PRF the/AT0 game/NN1 ./PUN,
K/KD/KD0.xml,KD0RE00L,017101,67,,A,31,4,"We can't afford  people like Mortimer to, I mean he scored a goal  (()) but I mean","we/PNP can/VM0 not/XX0 afford/VVI people/NN0 like/PRP mortimer/NP0 to/PRP ,/PUN i/PNP mean/VVB he/PNP score/VVD a/AT0 goal/NN1 but/CJC i/PNP mean/VVB",
K/KD/KD0.xml,KD0RE00L,017101,68,,B,32,1,Yeah.,yeah/ITJ ./PUN,
K/KD/KD0.xml,KD0RE00L,017101,69,,A,33,1,(()) Eddie  <<REDACTED (name)>> I think is worth  (()) sheer sort of  (()) opening teams up.,eddie/NP0 i/PNP think/VVB be/VBZ worth/PRP sheer/AJ0 sort/NN1 of/PRF opening/NN1-VVG team/NN2 up/AVP ./PUN,
K/KD/KD0.xml,KD0RE00L,017101,70,,A,33,2,"Well he does open, there's no  not many players can play a team better like  (()) than opening up (())","well/AV0 he/PNP do/VDZ open/VVI ,/PUN there/EX0 be/VBZ no/ITJ not/XX0 many/DT0 player/NN2 can/VM0 play/VVI a/AT0 team/NN1 well/AV0 like/AV0-AJ0 than/CJS open/VVG up/AVP",
K/KD/KD0.xml,KD0RE00L,017101,71,,B,34,1,"So what'd you do, say you had  (()) back next week so our next game against Birmingham.","so/AV0 what/DTQ would/VM0 you/PNP do/VDI ,/PUN say/VVB you/PNP have/VHD back/AVP next/ORD week/NN1 so/AV0 we/DPS next/ORD game/NN1 against/PRP birmingham/NP0 ./PUN",
K/KD/KD0.xml,KD0RE00L,017101,72,,B,34,2,What would you do then?,what/DTQ would/VM0 you/PNP do/VDI then/AV0 ?/PUN,
K/KD/KD0.xml,KD0RE00L,017101,73,,A,35,1,"Well I mean they've got, they've got, he's gotta do something because you're gonna lose that Birmingham game.","well/AV0 i/PNP mean/VVB they/PNP have/VHB get/VVN ,/PUN they/PNP have/VHB get/VVN ,/PUN he/PNP have/VHZ get/VVN ta/TO0 do/VDI something/PNI because/CJS you/PNP be/VBB gon/VVG na/TO0 lose/VVI that/DT0 birmingham/NP0 game/NN1 ./PUN",
K/KD/KD0.xml,KD0RE00L,017101,74,,A,35,2,(()) can see that coming now.,can/VM0 see/VVI that/DT0 come/VVG-NN1 now/AV0 ./PUN,
K/KD/KD0.xml,KD0RE00L,017101,75,,A,35,3,But Birmingham must have won today cos they had equal top  must have won I would have thought.,but/CJC birmingham/NP0 must/VM0 have/VHI win/VVN today/AV0 cos/CJS they/PNP have/VHD equal/AJ0 top/NN1 must/VM0 have/VHI win/VVN i/PNP would/VM0 have/VHI think/VVN ./PUN,
K/KD/KD0.xml,KD0RE00L,017101,76,,B,36,1,That's good.,that/DT0 be/VBZ good/AJ0 ./PUN,
K/KD/KD0.xml,KD0RE00L,017101,77,,A,37,1,Chelsea won one nil.,chelsea/NP0 win/VVD one/PNI-CRD nil/PNI ./PUN,
K/KD/KD0.xml,KD0RE00L,017101,78,,B,38,1,How do you know?,how/AVQ do/VDB you/PNP know/VVI ?/PUN,
K/KD/KD0.xml,KD0RE00L,017101,79,,A,39,1,(()) You'd have thought Forest would have beaten Chelsea wouldn't you?(()) really annoyed after being (()),you/PNP would/VM0 have/VHI think/VVN forest/NN1 would/VM0 have/VHI beat/VVN chelsea/NP0 would/VM0 not/XX0 you/PNP ?/PUN really/AV0 annoyed/AJ0-VVN after/PRP be/VBG,
K/KD/KD0.xml,KD0RE00L,017101,80,,B,40,1,Yeah.,yeah/ITJ ./PUN,
K/KD/KD0.xml,KD0RE00L,017101,81,,B,40,2,I suppose so.,i/PNP suppose/VVB so/AV0 ./PUN,
K/KD/KD0.xml,KD0RE00L,017101,82,,B,40,3,What are you gonna buy mum?,what/DTQ be/VBB you/PNP gon/VVG na/TO0 buy/VVI mum/NN1 ?/PUN,
K/KD/KD0.xml,KD0RE00L,017101,83,,A,41,1,He's gone the whole hog that guy  (()) hanging down to his,he/PNP have/VHZ go/VVN the/AT0 whole/AJ0 hog/NN1-VVB that/DT0-CJT guy/NN1 hang/VVG-NN1 down/AVP to/PRP he/DPS,
K/KD/KD0.xml,KD0RE00L,017101,84,,B,42,1,Oh.,oh/ITJ ./PUN,
K/KD/KD0.xml,KD0RE00L,017101,85,,B,42,2,So what are you gonna buy her?,so/AV0 what/DTQ be/VBB you/PNP gon/VVG na/TO0 buy/VVI she/PNP ?/PUN,
K/KD/KD0.xml,KD0RE00L,017101,86,,B,42,3,Newbury Fruits?,newbury/NP0 fruit/NN2 ?/PUN,
K/KD/KD0.xml,KD0RE00L,017101,87,,B,42,4,"Or something like that, er","or/CJC something/PNI like/PRP that/DT0 ,/PUN er/UNC",
K/KD/KD0.xml,KD0RE00L,017101,88,,A,43,1,They did very well with those little tulip hand out  (()) things didn't they?,they/PNP do/VDD very/AV0 well/AV0-AJ0 with/PRP those/DT0 little/AJ0 tulip/NN1 hand/NN1 out/AVP-PRP thing/NN2 do/VDD not/XX0 they/PNP ?/PUN,
K/KD/KD0.xml,KD0RE00L,017101,89,,A,43,2,"There's a lot of people who er don't, who would not have gone to the bother of going into the shop and buying a one pound or two pound or four pound  (())","there/EX0 be/VBZ a/AT0 lot/NN1 of/PRF people/NN0 who/PNQ er/UNC do/VDB not/XX0 ,/PUN who/PNQ would/VM0 not/XX0 have/VHI go/VVN to/PRP the/AT0 bother/NN1 of/PRF go/VVG into/PRP the/AT0 shop/NN1 and/CJC buy/VVG a/AT0 one/CRD pound/NN1 or/CJC two/CRD pound/NN1 or/CJC four/CRD pound/NN1",
K/KD/KD0.xml,KD0RE00L,017101,90,,B,44,1,But why did they do well out of them if they were free?,but/CJC why/AVQ do/VDD they/PNP do/VDI well/AV0 [out/AVP of/PRF]/PRP they/PNP if/CJS they/PNP be/VBD free/AJ0 ?/PUN,
K/KD/KD0.xml,KD0RE00L,017101,91,,A,45,1,Well yeah they're free but they've got their advert on it haven't they?(()),well/AV0 yeah/ITJ they/PNP be/VBB free/AJ0 but/CJC they/PNP have/VHB get/VVN they/DPS advert/NN1 on/PRP it/PNP have/VHB not/XX0 they/PNP ?/PUN,
K/KD/KD0.xml,KD0RE00L,017101,92,,B,46,1,Tulip,tulip/NP0,
K/KD/KD0.xml,KD0RE00L,017101,93,,A,47,1,"tulip tulip, I mean  you're like a roving little advert aren't you?","tulip/VVB-NN1 tulip/VVB-NN1 ,/PUN i/PNP mean/VVB you/PNP be/VBB like/PRP a/AT0 roving/AJ0 little/AJ0 advert/NN1 be/VBB not/XX0 you/PNP ?/PUN",
K/KD/KD0.xml,KD0RE00L,017101,94,,A,47,2,"I mean it, it draws your eye those little pictures doesn't it?","i/PNP mean/VVB it/PNP ,/PUN it/PNP draw/VVZ you/DPS eye/NN1 those/DT0 little/AJ0 picture/NN2 do/VDZ not/XX0 it/PNP ?/PUN",
K/KD/KD0.xml,KD0RE00L,017101,95,,A,47,3,You  (()),you/PNP,
K/KD/KD0.xml,KD0RE00L,017101,96,,B,48,1,"Oh he's got, he's got the hanging one at the front hasn't he?","oh/ITJ he/PNP have/VHZ get/VVN ,/PUN he/PNP have/VHZ get/VVN the/AT0 hanging/AJ0 one/PNI at/PRP the/AT0 front/NN1 have/VHZ not/XX0 he/PNP ?/PUN",
K/KD/KD0.xml,KD0RE00L,017101,97,,A,49,1,And he's got a badge on the right hand side as well.,and/CJC he/PNP have/VHZ get/VVN a/AT0 badge/NN1 on/PRP the/AT0 right/AJ0 hand/NN1 side/NN1 [as/CJS well/AV0]/AV0 ./PUN,
K/KD/KD0.xml,KD0RE00L,017101,98,,B,50,1,Yeah.,yeah/ITJ ./PUN,
K/KD/KD0.xml,KD0RE00L,017101,99,,A,51,1,So he really is  (()),so/AV0 he/PNP really/AV0 be/VBZ,
K/KD/KD0.xml,KD0RE00L,017101,100,,B,52,1,You see that guy next to us?,you/PNP see/VVB that/DT0 guy/NN1 [next/ORD to/PRP]/PRP we/PNP ?/PUN,
K/KD/KD0.xml,KD0RE00L,017101,101,,B,52,2,He's got a Palace earring hasn't he?(()) on one of his ears.,he/PNP have/VHZ get/VVN a/AT0 palace/NN1 earring/NN1 have/VHZ not/XX0 he/PNP ?/PUN on/PRP one/CRD of/PRF he/DPS ear/NN2 ./PUN,
K/KD/KD0.xml,KD0RE00L,017101,102,,A,53,1,Oh my goodness.,oh/ITJ i/DPS goodness/NN1 ./PUN,
K/KD/KD0.xml,KD0RE00L,017101,103,,B,54,1,On his left ear.,on/PRP he/DPS left/AJ0-NN1 ear/NN1 ./PUN,
K/KD/KD0.xml,KD0RE00L,017101,104,,A,55,1,"He's nice though isn't he, wasn't he, he did say something","he/PNP be/VBZ nice/AJ0 though/AV0 be/VBZ not/XX0 he/PNP ,/PUN be/VBD not/XX0 he/PNP ,/PUN he/PNP do/VDD say/VVI something/PNI",
K/KD/KD0.xml,KD0RE00L,017101,105,,B,56,1,Yeah.,yeah/ITJ ./PUN,
K/KD/KD0.xml,KD0RE00L,017101,106,,A,57,1,I didn't have to say anything.,i/PNP do/VDD not/XX0 have/VHI to/TO0 say/VVI anything/PNI ./PUN,
K/KD/KD0.xml,KD0RE00L,017101,107,,A,57,2,"I said to him  (()) I don't know, he said  did you enjoy yourself Tuesday?","i/PNP say/VVD to/PRP he/PNP i/PNP do/VDB not/XX0 know/VVI ,/PUN he/PNP say/VVD do/VDD you/PNP enjoy/VVI yourself/PNX tuesday/NP0 ?/PUN",
K/KD/KD0.xml,KD0RE00L,017101,108,,A,57,3,"Oh I said, did you see us?","oh/ITJ i/PNP say/VVD ,/PUN do/VDD you/PNP see/VVI we/PNP ?/PUN",
K/KD/KD0.xml,KD0RE00L,017101,109,,A,57,4,Oh yeah we saw you.,oh/ITJ yeah/ITJ we/PNP see/VVD you/PNP ./PUN,
K/KD/KD0.xml,KD0RE00L,017101,110,,A,57,5,And his dad's nice.,and/CJC he/DPS dad/NN1 be/VBZ nice/AJ0 ./PUN,
K/KD/KD0.xml,KD0RE00L,017101,111,,B,58,1,Yeah.,yeah/ITJ ./PUN,
K/KD/KD0.xml,KD0RE00L,017101,112,,B,58,2,But that other bloke was there but he wasn't in his normal place.,but/CJC that/DT0 other/AJ0 bloke/NN1 be/VBD there/AV0 but/CJC he/PNP be/VBD not/XX0 in/PRP he/DPS normal/AJ0 place/NN1 ./PUN,
K/KD/KD0.xml,KD0RE00L,017101,113,,A,59,1,Yes  (()),yes/ITJ,
K/KD/KD0.xml,KD0RE00L,017101,114,,B,60,1,Why wasn't he in his normal place?,why/AVQ be/VBD not/XX0 he/PNP in/PRP he/DPS normal/AJ0 place/NN1 ?/PUN,
K/KD/KD0.xml,KD0RE00L,017101,115,,A,61,1,Palace played really well.,palace/NN1 play/VVD-VVN really/AV0 well/AV0-AJ0 ./PUN,
K/KD/KD0.xml,KD0RE00L,017101,116,,A,61,2,"The first twenty five minutes, when you think we were one nil up right I thought gosh  if we could get that second goal it would have made all the difference and United would have been really would have been in trouble.","the/AT0 first/ORD twenty/CRD five/CRD minute/NN2 ,/PUN when/AVQ you/PNP think/VVB we/PNP be/VBD one/CRD-PNI nil/PNI up/AVP right/AV0 i/PNP think/VVD gosh/ITJ if/CJS we/PNP could/VM0 get/VVI that/DT0 second/NN1 goal/NN1 it/PNP would/VM0 have/VHI make/VVN all/DT0 the/AT0 difference/NN1 and/CJC unite/VVD would/VM0 have/VHI be/VBN really/AV0 would/VM0 have/VHI be/VBN in/PRP trouble/NN1 ./PUN",
