swda_filename,ptb_basename,conversation_no,transcript_index,act_tag,caller,turn_index,subutterance_index,text,pos,trees
K/KC/KCN.xml,KCNRE019,027409,0,,A,1,1,And if they've got the fire on.,and/CJC if/CJS they/PNP have/VHB get/VVN the/AT0 fire/NN1 on/AVP-PRP ./PUN ,
K/KC/KCN.xml,KCNRE019,027409,1,,B,2,1,And when it's cold it's bloody cold in there.,and/CJC when/CJS it/PNP be/VBZ cold/AJ0 it/PNP be/VBZ bloody/AJ0 cold/NN1-AJ0 in/PRP there/AV0 ./PUN ,
K/KC/KCN.xml,KCNRE019,027409,2,,A,3,1,Oh well that's only in the night isn't it?,oh/ITJ well/AV0 that/DT0 be/VBZ only/AV0 in/PRP the/AT0 night/NN1 be/VBZ not/XX0 it/PNP ?/PUN ,
K/KC/KCN.xml,KCNRE019,027409,3,,B,4,1,Well that's when you want to put it on isn't it?,well/AV0 that/DT0 be/VBZ when/AVQ you/PNP want/VVB to/TO0 put/VVI it/PNP on/AVP-PRP be/VBZ not/XX0 it/PNP ?/PUN ,
K/KC/KCN.xml,KCNRE019,027409,4,,A,5,1,I mean er it isn't cold.,i/PNP mean/VVB er/UNC it/PNP be/VBZ not/XX0 cold/AJ0 ./PUN ,
K/KC/KCN.xml,KCNRE019,027409,5,,A,5,2,It isn't cold here at night  --,it/PNP be/VBZ not/XX0 cold/AJ0 here/AV0 at/PRP night/NN1 ,
K/KC/KCN.xml,KCNRE019,027409,6,,A,5,3,--in my room and my room is cold.,in/PRP i/DPS room/NN1 and/CJC i/DPS room/NN1 be/VBZ cold/AJ0 ./PUN ,
K/KC/KCN.xml,KCNRE019,027409,7,,B,6,1,Well it shouldn't be.,well/AV0 it/PNP should/VM0 not/XX0 be/VBI ./PUN ,
K/KC/KCN.xml,KCNRE019,027409,8,,A,7,1,Well it is Jo.,well/AV0 it/PNP be/VBZ jo/NP0 ./PUN ,
K/KC/KCN.xml,KCNRE019,027409,9,,A,7,2,"It's colder than, than you're room up there.","it/PNP be/VBZ cold/AJC than/CJS ,/PUN than/CJS you/PNP be/VBB room/NN1 up/AVP there/AV0 ./PUN ",
K/KC/KCN.xml,KCNRE019,027409,10,,B,8,1,Cos it's got thermal bricks on.,cos/CJS it/PNP have/VHZ get/VVN thermal/AJ0 brick/NN2 on/AVP-PRP ./PUN ,
K/KC/KCN.xml,KCNRE019,027409,11,,A,9,1,Oh well.,oh/ITJ well/AV0 ./PUN ,
K/KC/KCN.xml,KCNRE019,027409,12,,B,10,1,And polystyrene lined.,and/CJC polystyrene/NN1 line/VVN-AJ0 ./PUN ,
K/KC/KCN.xml,KCNRE019,027409,13,,A,11,1,Most places  (()) ,most/DT0 place/NN2 ,
K/KC/KCN.xml,KCNRE019,027409,14,,B,12,1,There is a grey blanket missing.,there/EX0 be/VBZ a/AT0 grey/AJ0 blanket/NN1 miss/VVG-AJ0 ./PUN ,
K/KC/KCN.xml,KCNRE019,027409,15,,A,13,1,Oh well you won't have them to wash will you?,oh/ITJ well/AV0 you/PNP will/VM0 not/XX0 have/VHI they/PNP to/TO0 wash/VVI will/VM0 you/PNP ?/PUN ,
K/KC/KCN.xml,KCNRE019,027409,16,,B,14,1,Mm?,mm/ITJ ?/PUN ,
K/KC/KCN.xml,KCNRE019,027409,17,,A,15,1,You won't have them to wash will you?,you/PNP will/VM0 not/XX0 have/VHI they/PNP to/TO0 wash/VVI will/VM0 you/PNP ?/PUN ,
K/KC/KCN.xml,KCNRE019,027409,18,,B,16,1,No.,no/ITJ ./PUN ,
K/KC/KCN.xml,KCNRE019,027409,19,,B,16,2,--,,
K/KC/KCN.xml,KCNRE019,027409,20,,B,16,3,--<yawning> They've took the grey one </yawning> .,they/PNP have/VHB take/VVN the/AT0 grey/AJ0 one/PNI ./PUN ,
K/KC/KCN.xml,KCNRE019,027409,21,,A,17,1,Anything I can do?,anything/PNI i/PNP can/VM0 do/VDI ?/PUN ,
K/KC/KCN.xml,KCNRE019,027409,22,,B,18,1,Not really.,not/XX0 really/AV0 ./PUN ,
K/KC/KCN.xml,KCNRE019,027409,23,,B,18,2,--,,
K/KC/KCN.xml,KCNRE019,027409,24,,B,18,3,--And they didn't even  (()) paper and pencil.,and/CJC they/PNP do/VDD not/XX0 even/AV0-AJ0 paper/NN1 and/CJC pencil/NN1 ./PUN ,
K/KC/KCN.xml,KCNRE019,027409,25,,B,18,4,--,,
K/KC/KCN.xml,KCNRE019,027409,26,,B,18,5,--Oh well.,oh/ITJ well/AV0 ./PUN ,
K/KC/KCN.xml,KCNRE019,027409,27,,B,18,6,--,,
K/KC/KCN.xml,KCNRE019,027409,28,,B,18,7,--More for the next time.,more/DT0 for/PRP the/AT0 next/ORD time/NN1 ./PUN ,
