swda_filename,ptb_basename,conversation_no,transcript_index,act_tag,caller,turn_index,subutterance_index,text,pos,trees
K/KD/KDM.xml,KDMRE02T,030724,0,,A,1,1,It's my last weekend  but it was such a scramble!,it/PNP be/VBZ i/DPS last/ORD weekend/NN1 but/CJC it/PNP be/VBD such/DT0 a/AT0 scramble/NN1 !/PUN,
K/KD/KDM.xml,KDMRE02T,030724,1,,A,1,2,"I was, wanting to get home  I, I couldn't","i/PNP be/VBD ,/PUN want/VVG-AJ0 to/TO0 get/VVI home/AV0 i/PNP ,/PUN i/PNP could/VM0 not/XX0",
K/KD/KDM.xml,KDMRE02T,030724,2,,B,2,1,Mm.,mm/ITJ ./PUN,
K/KD/KDM.xml,KDMRE02T,030724,3,,A,3,1,be bothered but erm,be/VBB bothered/AJ0 but/CJC erm/UNC,
K/KD/KDM.xml,KDMRE02T,030724,4,,B,4,1,Yeah.,yeah/ITJ ./PUN,
K/KD/KDM.xml,KDMRE02T,030724,5,,B,4,2,Well you know the erm  Handbridge (()) ?,well/AV0 you/PNP know/VVB the/AT0 erm/UNC handbridge/NP0-NN1 ?/PUN,
K/KD/KDM.xml,KDMRE02T,030724,6,,A,5,1,Yes.,yes/ITJ ./PUN,
K/KD/KDM.xml,KDMRE02T,030724,7,,A,5,2,Yes,yes/ITJ,
K/KD/KDM.xml,KDMRE02T,030724,8,,B,6,1,Well you,well/AV0 you/PNP,
K/KD/KDM.xml,KDMRE02T,030724,9,,A,7,1,Yes.,yes/ITJ ./PUN,
K/KD/KDM.xml,KDMRE02T,030724,10,,B,8,1,"but I think there's only one  shop there, The Pearl Antiques  just over the bridge on the right hand side","but/CJC i/PNP think/VVB there/EX0 be/VBZ only/AV0 one/CRD shop/NN1 there/AV0 ,/PUN the/AT0 pearl/NN1 antique/NN2 just/AV0 over/PRP the/AT0 bridge/NN1 on/PRP the/AT0 right/AJ0 hand/NN1 side/NN1",
K/KD/KDM.xml,KDMRE02T,030724,11,,A,9,1,"Over the bri- , oh I know yes!","over/PRP the/AT0 bri/UNC ,/PUN oh/ITJ i/PNP know/VVB yes/ITJ !/PUN",
K/KD/KDM.xml,KDMRE02T,030724,12,,A,9,2,A-,a/UNC,
K/KD/KDM.xml,KDMRE02T,030724,13,,B,10,1,anyway,anyway/AV0,
K/KD/KDM.xml,KDMRE02T,030724,14,,A,11,1,that they call Vineholts Vineholts is a cake shop right opposite there.,that/CJT they/PNP call/VVB vineholts/NP0 vineholts/NP0 be/VBZ a/AT0 cake/NN1 shop/NN1 right/AV0-AJ0 opposite/AJ0-NN1 there/AV0 ./PUN,
K/KD/KDM.xml,KDMRE02T,030724,15,,B,12,1,"Oh yes , that's right yes.","oh/ITJ yes/ITJ ,/PUN that/DT0 be/VBZ right/AJ0 yes/ITJ ./PUN",
K/KD/KDM.xml,KDMRE02T,030724,16,,A,13,1,Well I hadn't been there for ages!,well/AV0 i/PNP have/VHD not/XX0 be/VBN there/AV0 for/PRP age/NN2 !/PUN,
K/KD/KDM.xml,KDMRE02T,030724,17,,B,14,1,Have you got a a row of shops on your left  by the pub,have/VHB you/PNP get/VVN a/AT0 a/AT0 row/NN1 of/PRF shop/NN2 on/PRP you/DPS left/NN1 by/PRP the/AT0 pub/NN1,
K/KD/KDM.xml,KDMRE02T,030724,18,,A,15,1,"Yes, and then on the right","yes/ITJ ,/PUN and/CJC then/AV0 on/PRP the/AT0 right/AJ0",
K/KD/KDM.xml,KDMRE02T,030724,19,,B,16,1,then er er a park on your right and,then/AV0 er/UNC er/UNC a/AT0 park/NN1 on/PRP you/DPS right/AJ0-NN1 and/CJC,
K/KD/KDM.xml,KDMRE02T,030724,20,,A,17,1,right.,right/AV0 ./PUN,
K/KD/KDM.xml,KDMRE02T,030724,21,,B,18,1,"then a couple of the shops, and she's about on the corner this","then/AV0 a/AT0 couple/NN1 of/PRF the/AT0 shop/NN2 ,/PUN and/CJC she/PNP be/VBZ about/AVP-PRP on/PRP the/AT0 corner/NN1 this/DT0",
K/KD/KDM.xml,KDMRE02T,030724,22,,A,19,1,"Oh, well I haven't been that way yet.","oh/ITJ ,/PUN well/AV0 i/PNP have/VHB not/XX0 be/VBN that/DT0 way/NN1 yet/AV0 ./PUN",
K/KD/KDM.xml,KDMRE02T,030724,23,,B,20,1,"Just a couple of ladies erm  well it's one lady, I think er  the lady just helps her.","just/AV0 a/AT0 couple/NN1 of/PRF lady/NN2 erm/UNC well/AV0 it/PNP be/VBZ one/CRD lady/NN1 ,/PUN i/PNP think/VVB er/UNC the/AT0 lady/NN1 just/AV0 help/VVZ she/PNP ./PUN",
K/KD/KDM.xml,KDMRE02T,030724,24,,B,20,2,"We've been in a couple of times and I said that I wanted a chaise you see  ooh I got this  erm  one for   (()) Victorian one  it's very nice, and lovely warm  you know, the legs  anyway it was one  one thousand three hundred you see, so I thought, oh  I said well  I didn't wanna","we/PNP have/VHB be/VBN in/PRP a/AT0 couple/NN1 of/PRF time/NN2 and/CJC i/PNP say/VVD that/CJT i/PNP want/VVD a/AT0 chaise/NN1 you/PNP see/VVB ooh/ITJ i/PNP get/VVD this/DT0 erm/UNC one/PNI for/PRP victorian/AJ0 one/PNI it/PNP be/VBZ very/AV0 nice/AJ0 ,/PUN and/CJC lovely/AJ0 warm/AJ0 you/PNP know/VVB ,/PUN the/AT0 leg/NN2 anyway/AV0 it/PNP be/VBD one/CRD one/CRD thousand/CRD three/CRD hundred/CRD you/PNP see/VVB ,/PUN so/AV0 i/PNP think/VVD ,/PUN oh/ITJ i/PNP say/VVD well/AV0 i/PNP do/VDD not/XX0 wan/VVI na/AT0",
K/KD/KDM.xml,KDMRE02T,030724,25,,A,21,1,I beg your pardon?,i/PNP beg/VVB you/DPS pardon/NN1 ?/PUN,
K/KD/KDM.xml,KDMRE02T,030724,26,,B,22,1,Well that's what you can spend now for a good one.,well/AV0 that/DT0 be/VBZ what/DTQ you/PNP can/VM0 spend/VVI now/AV0 for/PRP a/AT0 good/AJ0 one/PNI ./PUN,
K/KD/KDM.xml,KDMRE02T,030724,27,,B,22,2,"But this is ready to take home  but  I said oh, can I have it out?","but/CJC this/DT0 be/VBZ ready/AJ0 to/TO0 take/VVI home/AV0 but/CJC i/PNP say/VVD oh/ITJ ,/PUN can/VM0 i/PNP have/VHI it/PNP out/AVP ?/PUN",
K/KD/KDM.xml,KDMRE02T,030724,28,,B,22,3,"She said, yes.","she/PNP say/VVD ,/PUN yes/ITJ ./PUN",
K/KD/KDM.xml,KDMRE02T,030724,29,,A,23,1,That's finished is it then?,that/DT0 be/VBZ finish/VVN-AJ0 be/VBZ it/PNP then/AV0 ?/PUN,
K/KD/KDM.xml,KDMRE02T,030724,30,,B,24,1,"Oh yes, yes!","oh/ITJ yes/ITJ ,/PUN yes/ITJ !/PUN",
K/KD/KDM.xml,KDMRE02T,030724,31,,A,25,1,Had to be.,have/VHD to/TO0 be/VBI ./PUN,
K/KD/KDM.xml,KDMRE02T,030724,32,,B,26,1,"Oh, yes, yes, yes!","oh/ITJ ,/PUN yes/ITJ ,/PUN yes/ITJ ,/PUN yes/ITJ !/PUN",
K/KD/KDM.xml,KDMRE02T,030724,33,,A,27,1,Only one seat then?,only/AV0 one/CRD seat/NN1 then/AV0 ?/PUN,
K/KD/KDM.xml,KDMRE02T,030724,34,,B,28,1,Oh yes yeah.,oh/ITJ yes/ITJ yeah/ITJ ./PUN,
K/KD/KDM.xml,KDMRE02T,030724,35,,B,28,2,I said to her have you got one that's in bits?,i/PNP say/VVD to/PRP she/PNP have/VHB you/PNP get/VVN one/PNI that/CJT-DT0 be/VBZ in/PRP bit/NN2 ?/PUN,
K/KD/KDM.xml,KDMRE02T,030724,36,,B,28,3,"<laughing> But er  for three hundred, you know   </laughing> er  but  er er","but/CJC er/UNC for/PRP three/CRD hundred/CRD ,/PUN you/PNP know/VVB er/UNC but/CJC er/UNC er/UNC",
K/KD/KDM.xml,KDMRE02T,030724,37,,A,29,1,But,but/CJC,
K/KD/KDM.xml,KDMRE02T,030724,38,,B,30,1,the back was loose!,the/AT0 back/NN1 be/VBD loose/AJ0 !/PUN,
K/KD/KDM.xml,KDMRE02T,030724,39,,B,30,2,"And I said, and she said oh well  she said you know well it's  that's how you've gotta take it stripped, for me to take that to get that  done up by a restorer  you'd have to take all the upholstery off, or quite a bit off","and/CJC i/PNP say/VVD ,/PUN and/CJC she/PNP say/VVD oh/ITJ well/AV0 she/PNP say/VVD you/PNP know/VVB well/AV0 it/PNP be/VBZ that/DT0 be/VBZ how/AVQ you/PNP have/VHB get/VVN ta/TO0 take/VVI it/PNP strip/VVD ,/PUN for/PRP i/PNP to/TO0 take/VVI that/DT0 to/TO0 get/VVI that/DT0 do/VDN up/AVP by/PRP a/AT0 restorer/NN1 you/PNP would/VM0 have/VHI to/TO0 take/VVI all/DT0 the/AT0 upholstery/NN1 off/AVP-PRP ,/PUN or/CJC quite/AV0 [a/AT0 bit/NN1]/AV0 off/AVP-PRP",
K/KD/KDM.xml,KDMRE02T,030724,40,,A,31,1,Well I was gonna say,well/AV0 i/PNP be/VBD gon/VVG na/TO0 say/VVI,
K/KD/KDM.xml,KDMRE02T,030724,41,,B,32,1,"and then if it'd go up to about one seven she said, and I couldn't sell it here she said, I'm not Chester prices  I'm just that bit cheaper.","and/CJC then/AV0 if/CJS it/PNP would/VM0 go/VVI [up/AVP to/PRP]/PRP about/PRP one/CRD seven/CRD she/PNP say/VVD ,/PUN and/CJC i/PNP could/VM0 not/XX0 sell/VVI it/PNP here/AV0 she/PNP say/VVD ,/PUN i/PNP be/VBB not/XX0 chester/NP0 price/NN2 i/PNP be/VBB just/AV0 that/DT0 bit/NN1 cheap/AJC ./PUN",
K/KD/KDM.xml,KDMRE02T,030724,42,,B,32,2,"Which, a lovely lady!","which/DTQ ,/PUN a/AT0 lovely/AJ0 lady/NN1 !/PUN",
K/KD/KDM.xml,KDMRE02T,030724,43,,B,32,3,But,but/CJC,
K/KD/KDM.xml,KDMRE02T,030724,44,,A,33,1,But,but/CJC,
K/KD/KDM.xml,KDMRE02T,030724,45,,B,34,1,"I thought, I was surprised to see it was loose, you know.","i/PNP think/VVD ,/PUN i/PNP be/VBD surprised/AJ0 to/TO0 see/VVI it/PNP be/VBD loose/AJ0 ,/PUN you/PNP know/VVB ./PUN",
K/KD/KDM.xml,KDMRE02T,030724,46,,A,35,1,"Well that's it, I mean the joints","well/AV0 that/DT0 be/VBZ it/PNP ,/PUN i/PNP mean/VVB the/AT0 joint/NN2",
K/KD/KDM.xml,KDMRE02T,030724,47,,B,36,1,You've gotta take it home like that.,you/PNP have/VHB get/VVN ta/TO0 take/VVI it/PNP home/AV0 like/PRP that/DT0 ./PUN,
K/KD/KDM.xml,KDMRE02T,030724,48,,A,37,1,the joints have got to be done haven't they?,the/AT0 joint/NN2 have/VHB get/VVN to/TO0 be/VBI do/VDN have/VHB not/XX0 they/PNP ?/PUN,
K/KD/KDM.xml,KDMRE02T,030724,49,,B,38,1,"The joints have gone and this wanted doing but  it would of been extortionate she said, you know, to get it done","the/AT0 joint/NN2 have/VHB go/VVN and/CJC this/DT0 want/VVD do/VDG but/CJC it/PNP would/VM0 have/VHI be/VBN extortionate/AJ0 she/PNP say/VVD ,/PUN you/PNP know/VVB ,/PUN to/TO0 get/VVI it/PNP do/VDN",
K/KD/KDM.xml,KDMRE02T,030724,50,,A,39,1,Yeah.,yeah/ITJ ./PUN,
K/KD/KDM.xml,KDMRE02T,030724,51,,B,40,1,"and then try and sell it  you know, take","and/CJC then/AV0 try/VVB and/CJC sell/VVB it/PNP you/PNP know/VVB ,/PUN take/VVB",
K/KD/KDM.xml,KDMRE02T,030724,52,,A,41,1,Well that's alright.,well/AV0 that/DT0 be/VBZ alright/AJ0 ./PUN,
K/KD/KDM.xml,KDMRE02T,030724,53,,B,42,1,all that into account.,all/DT0 that/DT0-CJT into/PRP account/NN1 ./PUN,
K/KD/KDM.xml,KDMRE02T,030724,54,,A,43,1,I think it's terrible really!,i/PNP think/VVB it/PNP be/VBZ terrible/AJ0 really/AV0 !/PUN,
K/KD/KDM.xml,KDMRE02T,030724,55,,A,43,2,That's bad!,that/DT0 be/VBZ bad/AJ0 !/PUN,
K/KD/KDM.xml,KDMRE02T,030724,56,,B,44,1,"And I've seen chairs like that, I've seen  I don't know whether it's there but  a couple of places, bedroom chairs, gorgeous things, you know!","and/CJC i/PNP have/VHB see/VVN chair/NN2 like/PRP that/DT0 ,/PUN i/PNP have/VHB see/VVN i/PNP do/VDI not/XX0 know/VVI whether/CJS it/PNP be/VBZ there/AV0 but/CJC a/AT0 couple/NN1 of/PRF place/NN2 ,/PUN bedroom/NN1 chair/NN2 ,/PUN gorgeous/AJ0 thing/NN2 ,/PUN you/PNP know/VVB !/PUN",
K/KD/KDM.xml,KDMRE02T,030724,57,,A,45,1,(()) ,,
K/KD/KDM.xml,KDMRE02T,030724,58,,B,46,1,And   (()) the backs!,and/CJC the/AT0 back/NN2 !/PUN,
K/KD/KDM.xml,KDMRE02T,030724,59,,B,46,2,"You know, you can do this with the back!","you/PNP know/VVB ,/PUN you/PNP can/VM0 do/VDI this/DT0 with/PRP the/AT0 back/NN1 !/PUN",
K/KD/KDM.xml,KDMRE02T,030724,60,,B,46,3,"I mean, you don't like saying to the people","i/PNP mean/VVB ,/PUN you/PNP do/VDB not/XX0 like/VVI say/VVG to/PRP the/AT0 people/NN0",
K/KD/KDM.xml,KDMRE02T,030724,61,,A,47,1,No.,no/ITJ ./PUN,
K/KD/KDM.xml,KDMRE02T,030724,62,,B,48,1,"you know, because","you/PNP know/VVB ,/PUN because/CJS",
K/KD/KDM.xml,KDMRE02T,030724,63,,A,49,1,No.,no/ITJ ./PUN,
K/KD/KDM.xml,KDMRE02T,030724,64,,B,50,1,their faces drop when  <laughing> you,they/DPS face/NN2 drop/VVB-NN1 when/CJS you/PNP,
K/KD/KDM.xml,KDMRE02T,030724,65,,A,51,1,They do.<laugh>,they/PNP do/VDB ./PUN,
K/KD/KDM.xml,KDMRE02T,030724,66,,B,52,1,you're not supposed to say,you/PNP be/VBB not/XX0 supposed/AJ0 to/TO0 say/VVI,
K/KD/KDM.xml,KDMRE02T,030724,67,,A,53,1,You'll be marked man when you get in there.,you/PNP will/VM0 be/VBI marked/AJ0 man/NN1 when/CJS you/PNP get/VVB in/PRP there/AV0 ./PUN,
K/KD/KDM.xml,KDMRE02T,030724,68,,B,54,1,"You're supposed be glad that it's old and   <laughing> don't sit in there, you know th- </laughing> but er  it's bad, but though isn't it?","you/PNP be/VBB supposed/AJ0-VVN be/VBI glad/AJ0 that/CJT it/PNP be/VBZ old/AJ0 and/CJC do/VDB not/XX0 sit/VVI in/PRP there/AV0 ,/PUN you/PNP know/VVB th/UNC but/CJC er/UNC it/PNP be/VBZ bad/AJ0 ,/PUN but/CJC though/AV0 be/VBZ not/XX0 it/PNP ?/PUN",
K/KD/KDM.xml,KDMRE02T,030724,69,,A,55,1,It is.,it/PNP be/VBZ ./PUN,
K/KD/KDM.xml,KDMRE02T,030724,70,,B,56,1,"Well you know, you turn things out here and you go in  you might see that little  (())","well/AV0 you/PNP know/VVB ,/PUN you/PNP turn/VVB thing/NN2 out/AVP here/AV0 and/CJC you/PNP go/VVB in/PRP-AVP you/PNP might/VM0 see/VVI that/DT0-CJT little/AJ0",
K/KD/KDM.xml,KDMRE02T,030724,71,,A,57,1,"Yeah, put it in  (())","yeah/ITJ ,/PUN put/VVB it/PNP in/AVP-PRP",
K/KD/KDM.xml,KDMRE02T,030724,72,,B,58,1,and magnified in your mind aren't they?,and/CJC magnify/VVN in/PRP you/DPS mind/NN1 be/VBB not/XX0 they/PNP ?/PUN,
K/KD/KDM.xml,KDMRE02T,030724,73,,A,59,1,"That's right, like my  my (()) .<laugh>","that/DT0 be/VBZ right/AJ0 ,/PUN like/PRP i/DPS i/DPS ./PUN",
K/KD/KDM.xml,KDMRE02T,030724,74,,B,60,1,That's alright.,that/DT0 be/VBZ alright/AJ0 ./PUN,
K/KD/KDM.xml,KDMRE02T,030724,75,,B,60,2,I like it.,i/PNP like/VVB it/PNP ./PUN,
K/KD/KDM.xml,KDMRE02T,030724,76,,B,60,3,Top of the class Gwyneth!,top/NN1 of/PRF the/AT0 class/NN1 gwyneth/NP0 !/PUN,
