swda_filename,ptb_basename,conversation_no,transcript_index,act_tag,caller,turn_index,subutterance_index,text,pos,trees
K/KD/KD5.xml,KD5RE00R,033903,0,,A,1,1,But last time  do you remember this time last year it got so that his foot was really puffy?,but/CJC last/ORD time/NN1 do/VDB you/PNP remember/VVI this/DT0 time/NN1 last/ORD year/NN1 it/PNP get/VVD [so/AV0 that/CJT]/CJS he/DPS foot/NN1 be/VBD really/AV0 puffy/AJ0 ?/PUN,
K/KD/KD5.xml,KD5RE00R,033903,1,,B,2,1,Yeah.,yeah/ITJ ./PUN,
K/KD/KD5.xml,KD5RE00R,033903,2,,A,3,1,And erm  we had him on  two lots of antibiotics  before he even had an anaesthetic to get the inflammation down and I don't want it to get worse!,and/CJC erm/UNC we/PNP have/VHD he/PNP on/PRP two/CRD lots/PNI of/PRF antibiotic/NN2 before/CJS he/PNP even/AV0 have/VHD an/AT0 anaesthetic/NN1 to/TO0 get/VVI the/AT0 inflammation/NN1 down/AVP and/CJC i/PNP do/VDB not/XX0 want/VVI it/PNP to/TO0 get/VVI bad/AJC !/PUN,
K/KD/KD5.xml,KD5RE00R,033903,3,,B,4,1,And he couldn't drink while he was on those could he?,and/CJC he/PNP could/VM0 not/XX0 drink/VVI while/CJS he/PNP be/VBD on/PRP those/DT0 could/VM0 he/PNP ?/PUN,
K/KD/KD5.xml,KD5RE00R,033903,4,,A,5,1,He couldn't drink!,he/PNP could/VM0 not/XX0 drink/VVI !/PUN,
K/KD/KD5.xml,KD5RE00R,033903,5,,B,6,1,<laugh> ,,
K/KD/KD5.xml,KD5RE00R,033903,6,,A,7,1,"But erm  no, I mean","but/CJC erm/UNC no/ITJ ,/PUN i/PNP mean/VVB",
K/KD/KD5.xml,KD5RE00R,033903,7,,B,8,1,"No drink, no sex Charles!","no/AT0 drink/NN1-VVB ,/PUN no/AT0 sex/NN1 charles/NP0 !/PUN",
K/KD/KD5.xml,KD5RE00R,033903,8,,A,9,1,"He said look you can have these expensive antibiotics, they were intensive ones, said look you know I don't want him to lose his bloody foot just give me some antibiotic!","he/PNP say/VVD look/VVB you/PNP can/VM0 have/VHI these/DT0 expensive/AJ0 antibiotic/NN2 ,/PUN they/PNP be/VBD intensive/AJ0 one/NN2 ,/PUN say/VVD look/VVB you/PNP know/VVB i/PNP do/VDB not/XX0 want/VVI he/PNP to/TO0 lose/VVI he/DPS bloody/AJ0 foot/NN1 just/AV0 give/VVB i/PNP some/DT0 antibiotic/NN1 !/PUN",
K/KD/KD5.xml,KD5RE00R,033903,9,,A,9,2,"And he co- , and how much did he cost me, Charles?","and/CJC he/PNP co/UNC ,/PUN and/CJC how/AVQ much/DT0 do/VDD he/PNP cost/VVI i/PNP ,/PUN charles/NP0 ?/PUN",
K/KD/KD5.xml,KD5RE00R,033903,10,,A,9,3,Forty five pounds for that foot last year!,forty/CRD five/CRD pound/NN2 for/PRP that/DT0 foot/NN1 last/ORD year/NN1 !/PUN,
K/KD/KD5.xml,KD5RE00R,033903,11,,B,10,1,Well I think you should put him out to work!,well/AV0 i/PNP think/VVB you/PNP should/VM0 put/VVI he/PNP out/AVP to/PRP work/NN1 !/PUN,
K/KD/KD5.xml,KD5RE00R,033903,12,,B,10,2,Get some cash in!,get/VVB some/DT0 cash/NN1 in/AVP-PRP !/PUN,
K/KD/KD5.xml,KD5RE00R,033903,13,,B,10,3,Well  that's pretty incidental in the morning.,well/AV0 that/DT0 be/VBZ pretty/AV0 incidental/AJ0 in/PRP the/AT0 morning/NN1 ./PUN,
K/KD/KD5.xml,KD5RE00R,033903,14,,A,11,1,Mm.,mm/ITJ ./PUN,
K/KD/KD5.xml,KD5RE00R,033903,15,,B,12,1,"Cos he's bound, I mean with all that mud and everything, I mean there's lots of  sheep droppings and god knows what up there isn't there?","cos/CJS he/PNP have/VHZ bind/VVN ,/PUN i/PNP mean/VVB with/PRP all/DT0 that/DT0 mud/NN1 and/CJC everything/PNI ,/PUN i/PNP mean/VVB there/EX0 be/VBZ lots/PNI of/PRF sheep/NN0 dropping/NN2 and/CJC god/NN1 know/VVZ what/DTQ up/PRP-AVP there/AV0 be/VBZ not/XX0 there/EX0 ?/PUN",
K/KD/KD5.xml,KD5RE00R,033903,16,,A,13,1,"Yeah I know, it needs treatment though darling.","yeah/ITJ i/PNP know/VVB ,/PUN it/PNP need/VVZ treatment/NN1 though/AV0 darling/NN1 ./PUN",
K/KD/KD5.xml,KD5RE00R,033903,17,,B,14,1,"Yeah, I know it still needs treatment but I mean it'll  try and get the swelling down a bit.","yeah/ITJ ,/PUN i/PNP know/VVB it/PNP still/AV0 need/VVZ treatment/NN1 but/CJC i/PNP mean/VVB it/PNP will/VM0 try/VVI and/CJC get/VVI the/AT0 swelling/NN1 down/AVP-PRP [a/AT0 bit/NN1]/AV0 ./PUN",
K/KD/KD5.xml,KD5RE00R,033903,18,,A,15,1,Yeah.,yeah/ITJ ./PUN,
K/KD/KD5.xml,KD5RE00R,033903,19,,A,15,2,Well I don't think that it's swollen.,well/AV0 i/PNP do/VDB not/XX0 think/VVI that/CJT it/PNP be/VBZ swollen/AJ0-VVN ./PUN,
K/KD/KD5.xml,KD5RE00R,033903,20,,B,16,1,Well it's hot on (()) .,well/AV0 it/PNP be/VBZ hot/AJ0 on/PRP-AVP ./PUN,
K/KD/KD5.xml,KD5RE00R,033903,21,,A,17,1,"Well it is, it is, yeah, it's a, there's a little of  (()) flesh but nothing like  you know  it was when his foot got like that  do you see what I mean?","well/AV0 it/PNP be/VBZ ,/PUN it/PNP be/VBZ ,/PUN yeah/ITJ ,/PUN it/PNP be/VBZ a/AT0 ,/PUN there/EX0 be/VBZ a/AT0 little/DT0 of/PRF flesh/NN1 but/CJC nothing/PNI like/PRP you/PNP know/VVB it/PNP be/VBD when/CJS-AVQ he/DPS foot/NN1 get/VVD-VVN like/PRP that/DT0 do/VDB you/PNP see/VVI what/DTQ i/PNP mean/VVB ?/PUN",
K/KD/KD5.xml,KD5RE00R,033903,22,,B,18,1,Mm mm.,mm/ITJ mm/ITJ ./PUN,
K/KD/KD5.xml,KD5RE00R,033903,23,,A,19,1,Cold water.,cold/AJ0 water/NN1 ./PUN,
K/KD/KD5.xml,KD5RE00R,033903,24,,A,19,2,But the problem is he's so,but/CJC the/AT0 problem/NN1 be/VBZ he/PNP be/VBZ so/AV0,
K/KD/KD5.xml,KD5RE00R,033903,25,,B,20,1,<whispering> Oh shit </whispering> !,oh/ITJ shit/NN1 !/PUN,
K/KD/KD5.xml,KD5RE00R,033903,26,,A,21,1,it seems to have got sort of so much more deformed.,it/PNP seem/VVZ to/TO0 have/VHI get/VVN [sort/NN1 of/PRF]/AV0 so/AV0 much/AV0 more/AV0 deformed/AJ0 ./PUN,
K/KD/KD5.xml,KD5RE00R,033903,27,,A,21,2,Julie's bloody claws!,julie/NP0 's/POS bloody/AJ0 claw/NN2 !/PUN,
K/KD/KD5.xml,KD5RE00R,033903,28,,B,22,1,I saw  (()) today.,i/PNP see/VVD today/AV0 ./PUN,
K/KD/KD5.xml,KD5RE00R,033903,29,,A,23,1,Talk of being put,talk/NN1-VVB of/PRF be/VBG put/VVN,
K/KD/KD5.xml,KD5RE00R,033903,30,,B,24,1,And he's running the stocks suddenly.,and/CJC he/PNP be/VBZ run/VVG the/AT0 stock/NN2 suddenly/AV0 ./PUN,
K/KD/KD5.xml,KD5RE00R,033903,31,,A,25,1,"I mean I'm sure it's the same claw cos it's never grown back  you see, when he's had it cut off but  what the vet was hoping was that the claw would grow back and the the top of  of the tissue, see what I mean?","i/PNP mean/VVB i/PNP be/VBB sure/AJ0 it/PNP be/VBZ the/AT0 same/DT0 claw/NN1 cos/CJS it/PNP be/VBZ never/AV0 grow/VVN back/AVP you/PNP see/VVB ,/PUN when/CJS he/PNP have/VHZ have/VHN it/PNP cut/VVN-VVD off/AVP but/CJC what/DTQ the/AT0 vet/NN1 be/VBD hope/VVG be/VBD that/CJT the/AT0 claw/NN1 would/VM0 grow/VVI back/AVP and/CJC the/AT0 the/AT0 top/NN1 of/PRF of/PRF the/AT0 tissue/NN1 ,/PUN see/VVB what/DTQ i/PNP mean/VVB ?/PUN",
K/KD/KD5.xml,KD5RE00R,033903,32,,B,26,1,Mhm.,mhm/ITJ ./PUN,
K/KD/KD5.xml,KD5RE00R,033903,33,,A,27,1,And what's happened is the tissue has grown and not the bloody nail!,and/CJC what/DTQ have/VHZ happen/VVN be/VBZ the/AT0 tissue/NN1 have/VHZ grow/VVN and/CJC not/XX0 the/AT0 bloody/AJ0 nail/NN1 !/PUN,
K/KD/KD5.xml,KD5RE00R,033903,34,,B,28,1,Oh I see.,oh/ITJ i/PNP see/VVB ./PUN,
K/KD/KD5.xml,KD5RE00R,033903,35,,A,29,1,And and what,and/CJC and/CJC what/DTQ,
K/KD/KD5.xml,KD5RE00R,033903,36,,B,30,1,Mhm.,mhm/ITJ ./PUN,
K/KD/KD5.xml,KD5RE00R,033903,37,,A,31,1,it has done has just become distorted and it's splitting more away from the nail.,it/PNP have/VHZ do/VDN have/VHZ just/AV0 become/VVB distorted/AJ0-VVN and/CJC it/PNP be/VBZ split/VVG more/DT0 [away/AV0 from/PRP]/PRP the/AT0 nail/NN1 ./PUN,
K/KD/KD5.xml,KD5RE00R,033903,38,,B,32,1,That'll be a problem tomorrow (()) .,that/DT0 will/VM0 be/VBI a/AT0 problem/NN1 tomorrow/AV0 ./PUN,
K/KD/KD5.xml,KD5RE00R,033903,39,,A,33,1,"And when they get a bit long too, yeah.","and/CJC when/CJS they/PNP get/VVB [a/AT0 bit/NN1]/AV0 long/AV0-AJ0 too/AV0 ,/PUN yeah/ITJ ./PUN",
K/KD/KD5.xml,KD5RE00R,033903,40,,A,33,2,"I haven't, I'm just going to go to wee and then I'll have do those  it'll have to grow basically.","i/PNP have/VHB not/XX0 ,/PUN i/PNP be/VBB just/AV0 go/VVG to/TO0 go/VVI to/TO0 wee/VVI and/CJC then/AV0 i/PNP will/VM0 have/VHI do/VDB those/DT0 it/PNP will/VM0 have/VHI to/TO0 grow/VVI basically/AV0 ./PUN",
K/KD/KD5.xml,KD5RE00R,033903,41,,A,33,3,And unless we can (()) .,and/CJC unless/CJS we/PNP can/VM0 ./PUN,
