swda_filename,ptb_basename,conversation_no,transcript_index,act_tag,caller,turn_index,subutterance_index,text,pos,trees
K/KD/KD5.xml,KD5RE01M,034407,0,,A,1,1,Then the driver innit?,then/AV0 the/AT0 driver/NN1 in/VBZ n/XX0 it/PNP ?/PUN ,
K/KD/KD5.xml,KD5RE01M,034407,1,,B,2,1,"Well if it can't, it can't.","well/AV0 if/CJS it/PNP can/VM0 not/XX0 ,/PUN it/PNP can/VM0 not/XX0 ./PUN ",
K/KD/KD5.xml,KD5RE01M,034407,2,,B,2,2,Yeah well there's a problem with that because they might be on different project number mighten they?,yeah/ITJ well/AV0 there/EX0 be/VBZ a/AT0 problem/NN1 with/PRP that/DT0 because/CJS they/PNP might/VM0 be/VBI on/PRP different/AJ0 project/NN1 number/NN1 mighten/VVB they/PNP ?/PUN ,
K/KD/KD5.xml,KD5RE01M,034407,3,,A,3,1,Yeah but doesn't matter!,yeah/ITJ but/CJC do/VDZ not/XX0 matter/VVI !/PUN ,
K/KD/KD5.xml,KD5RE01M,034407,4,,A,3,2,"In this group, doesn't matter.","in/PRP this/DT0 group/NN1 ,/PUN do/VDZ not/XX0 matter/VVI ./PUN ",
K/KD/KD5.xml,KD5RE01M,034407,5,,A,3,3,"In other group, maybe.","in/PRP other/AJ0 group/NN1 ,/PUN maybe/AV0 ./PUN ",
K/KD/KD5.xml,KD5RE01M,034407,6,,B,4,1,Mm.,mm/ITJ ./PUN ,
K/KD/KD5.xml,KD5RE01M,034407,7,,A,5,1,"In this group (()) ,(()) .","in/PRP this/DT0 group/NN1 ,/PUN ./PUN ",
K/KD/KD5.xml,KD5RE01M,034407,8,,A,5,2,So if you want a se- --,so/AV0 if/CJS you/PNP want/VVB a/AT0 se/UNC ,
K/KD/KD5.xml,KD5RE01M,034407,9,,A,5,3,--see er er a normal reception you want some  --,see/VVB er/UNC er/UNC a/AT0 normal/AJ0 reception/NN1 you/PNP want/VVB some/DT0 ,
K/KD/KD5.xml,KD5RE01M,034407,10,,A,5,4,--some level if you want what?,some/DT0 level/NN1-AJ0 if/CJS you/PNP want/VVB what/DTQ ?/PUN ,
K/KD/KD5.xml,KD5RE01M,034407,11,,A,5,5,One.,one/CRD ./PUN ,
K/KD/KD5.xml,KD5RE01M,034407,12,,A,5,6,If you wanna thick one   --,if/CJS you/PNP wan/VVB na/AT0 thick/AJ0-AV0 one/PNI-CRD ,
K/KD/KD5.xml,KD5RE01M,034407,13,,A,5,7,"--(()) want a monitor  (()) this way,(()) , but not a lot.","want/VVB a/AT0 monitor/NN1-VVB this/DT0 way/NN1 ,/PUN ,/PUN but/CJC not/XX0 a/AT0 lot/NN1 ./PUN ",
K/KD/KD5.xml,KD5RE01M,034407,14,,A,5,8,So you don't wanna put all that in.,so/AV0 you/PNP do/VDB not/XX0 wan/VVI na/TO0 put/VVI all/DT0 that/DT0 in/AVP-PRP ./PUN ,
K/KD/KD5.xml,KD5RE01M,034407,15,,A,5,9,But it does  (()) or some order.,but/CJC it/PNP do/VDZ or/CJC some/DT0 order/NN1 ./PUN ,
K/KD/KD5.xml,KD5RE01M,034407,16,,A,5,10,But whereas anyone order from this company say well    --,but/CJC whereas/CJS anyone/PNI order/NN1-VVB from/PRP this/DT0 company/NN1 say/VVB-NN1 well/AV0 ,
K/KD/KD5.xml,KD5RE01M,034407,17,,A,5,11,--(()) --,,
K/KD/KD5.xml,KD5RE01M,034407,18,,A,5,12,--what do you want?,what/DTQ do/VDB you/PNP want/VVI ?/PUN ,
K/KD/KD5.xml,KD5RE01M,034407,19,,A,5,13,Do you want a big one or a small one?,do/VDB you/PNP want/VVI a/AT0 big/AJ0 one/PNI or/CJC a/AT0 small/AJ0 one/PNI ?/PUN ,
K/KD/KD5.xml,KD5RE01M,034407,20,,A,5,14,If you want a huge order  --,if/CJS you/PNP want/VVB a/AT0 huge/AJ0 order/NN1 ,
K/KD/KD5.xml,KD5RE01M,034407,21,,A,5,15,--oh you can look for your own.,oh/ITJ you/PNP can/VM0 look/VVI for/PRP you/DPS own/DT0 ./PUN ,
K/KD/KD5.xml,KD5RE01M,034407,22,,A,5,16,When Len  --,when/CJS len/NP0 ,
K/KD/KD5.xml,KD5RE01M,034407,23,,A,5,17,"--sent them a five pound order, or ten pound","send/VVD they/PNP a/AT0 five/CRD pound/NN1 order/NN1 ,/PUN or/CJC ten/CRD pound/NN1 ",
K/KD/KD5.xml,KD5RE01M,034407,24,,B,6,1,Mm.,mm/ITJ ./PUN ,
K/KD/KD5.xml,KD5RE01M,034407,25,,A,7,1,you can leave that (()) .,you/PNP can/VM0 leave/VVI that/DT0 ./PUN ,
K/KD/KD5.xml,KD5RE01M,034407,26,,A,7,2,Th- there is a  --,th/UNC there/EX0 be/VBZ a/AT0 ,
K/KD/KD5.xml,KD5RE01M,034407,27,,A,7,3,"--if there is work in our group, no problem!","if/CJS there/EX0 be/VBZ work/NN1-VVB in/PRP we/DPS group/NN1 ,/PUN no/AT0 problem/NN1 !/PUN ",
K/KD/KD5.xml,KD5RE01M,034407,28,,A,7,4,"As soon as we've been (()) , all been  (()) ","[as/CJS soon/AV0 as/CJS]/CJS we/PNP have/VHB be/VBN ,/PUN all/DT0 be/VBN ",
K/KD/KD5.xml,KD5RE01M,034407,29,,B,8,1,We'll have to  --,we/PNP will/VM0 have/VHI to/TO0 ,
K/KD/KD5.xml,KD5RE01M,034407,30,,B,8,2,--write that one with a  --,write/VVI that/DT0 one/PNI with/PRP a/AT0 ,
K/KD/KD5.xml,KD5RE01M,034407,31,,B,8,3,--indelible pen.,indelible/AJ0 pen/NN1 ./PUN ,
K/KD/KD5.xml,KD5RE01M,034407,32,,A,9,1,Yes.,yes/ITJ ./PUN ,
K/KD/KD5.xml,KD5RE01M,034407,33,,B,10,1,You only get on go at it as well.,you/PNP only/AV0 get/VVB on/AVP-PRP go/VVB-NN1 at/PRP it/PNP [as/CJS well/AV0]/AV0 ./PUN ,
K/KD/KD5.xml,KD5RE01M,034407,34,,A,11,1,So that is,so/AV0 that/DT0 be/VBZ ,
K/KD/KD5.xml,KD5RE01M,034407,35,,B,12,1,"I dunno, you get it off with spirit I suppose.","i/PNP do/VDB n/XX0 no/VVI ,/PUN you/PNP get/VVB it/PNP off/AVP with/PRP spirit/NN1 i/PNP suppose/VVB ./PUN ",
K/KD/KD5.xml,KD5RE01M,034407,36,,A,13,1,"Maybe, I think you can get erm  --","maybe/AV0 ,/PUN i/PNP think/VVB you/PNP can/VM0 get/VVI erm/UNC ",
K/KD/KD5.xml,KD5RE01M,034407,37,,A,13,2,--erm  --,erm/UNC ,
K/KD/KD5.xml,KD5RE01M,034407,38,,A,13,3,"--in, what they done on Norman's   (()) --","in/AVP-PRP ,/PUN what/DTQ they/PNP do/VDN on/PRP norman/NP0 's/POS ",
K/KD/KD5.xml,KD5RE01M,034407,39,,A,13,4,--they're using a tape.,they/PNP be/VBB use/VVG a/AT0 tape/NN1 ./PUN ,
K/KD/KD5.xml,KD5RE01M,034407,40,,B,14,1,A tape?,a/AT0 tape/NN1 ?/PUN ,
K/KD/KD5.xml,KD5RE01M,034407,41,,B,14,2,Oh that's messy!,oh/ITJ that/DT0 be/VBZ messy/AJ0 !/PUN ,
K/KD/KD5.xml,KD5RE01M,034407,42,,A,15,1,Er well  --,er/UNC well/AV0 ,
K/KD/KD5.xml,KD5RE01M,034407,43,,A,15,2,--if you're gonna draw the line I mean  --,if/CJS you/PNP be/VBB gon/VVG na/TO0 draw/VVI the/AT0 line/NN1 i/PNP mean/VVB ,
K/KD/KD5.xml,KD5RE01M,034407,44,,A,15,3,--I mean it's bloody  (()) we know what  --,i/PNP mean/VVB it/PNP be/VBZ bloody/AV0-AJ0 we/PNP know/VVB what/DTQ ,
K/KD/KD5.xml,KD5RE01M,034407,45,,A,15,4,"--who's in, who's out.","who/PNQ be/VBZ in/PRP-AVP ,/PUN who/PNQ be/VBZ out/AVP ./PUN ",
K/KD/KD5.xml,KD5RE01M,034407,46,,B,16,1,Yeah.<sigh> ,yeah/ITJ ./PUN ,
K/KD/KD5.xml,KD5RE01M,034407,47,,A,17,1,"Yeah, have a chat with Norman.","yeah/ITJ ,/PUN have/VHB a/AT0 chat/NN1 with/PRP norman/NP0 ./PUN ",
K/KD/KD5.xml,KD5RE01M,034407,48,,B,18,1,Okay.,okay/AV0 ./PUN ,
