swda_filename,ptb_basename,conversation_no,transcript_index,act_tag,caller,turn_index,subutterance_index,text,pos,trees
K/KE/KE5.xml,KE5RE001,035202,0,,A,1,1,We are watching the brides of Christ probably never ever to be seen again in the year two thousand and fifty six.,we/PNP be/VBB watch/VVG the/AT0 bride/NN2 of/PRF christ/NP0 probably/AV0 never/AV0 ever/AV0 to/TO0 be/VBI see/VVN again/AV0 in/PRP the/AT0 year/NN1 two/CRD thousand/CRD and/CJC fifty/CRD six/CRD ./PUN,
K/KE/KE5.xml,KE5RE001,035202,1,,A,1,2,Janice is writing away on her pad.,janice/NP0 be/VBZ write/VVG away/AV0 on/PRP she/DPS pad/NN1 ./PUN,
K/KE/KE5.xml,KE5RE001,035202,2,,B,2,1,Shaun's sitting cross legged,shaun/NP0 be/VBZ sit/VVG-AJ0 cross/NN1-AJ0 legged/AJ0,
K/KE/KE5.xml,KE5RE001,035202,3,,A,3,1,"<laugh> And Darren looks like an oversized leprechaun, all dressed in green and ready to go, meanwhile I'm reporting this excellent news to you guys  <laugh> if you are listening out there from the national library association, er, er, er, er","and/CJC darren/NP0 look/VVZ like/PRP an/AT0 oversized/AJ0 leprechaun/NN1 ,/PUN all/DT0 dress/VVN in/PRP green/NN1-AJ0 and/CJC ready/AJ0 to/TO0 go/VVI ,/PUN meanwhile/AV0 i/PNP be/VBB report/VVG this/DT0 excellent/AJ0 news/NN1 to/PRP you/PNP guy/NN2 if/CJS you/PNP be/VBB listen/VVG out/AVP there/AV0 from/PRP the/AT0 national/AJ0 library/NN1 association/NN1 ,/PUN er/UNC ,/PUN er/UNC ,/PUN er/UNC ,/PUN er/UNC",
K/KE/KE5.xml,KE5RE001,035202,4,,B,4,1,<laugh> ,,
K/KE/KE5.xml,KE5RE001,035202,5,,A,5,1,"we, ee, ee, ee, ee, ee","we/PNP ,/PUN ee/ITJ ,/PUN ee/ITJ ,/PUN ee/ITJ ,/PUN ee/ITJ ,/PUN ee/ITJ",
K/KE/KE5.xml,KE5RE001,035202,6,,B,6,1,<laugh> ,,
K/KE/KE5.xml,KE5RE001,035202,7,,A,7,1,"hello, hello","hello/ITJ ,/PUN hello/ITJ",
K/KE/KE5.xml,KE5RE001,035202,8,,B,8,1,What does,what/DTQ do/VDZ,
K/KE/KE5.xml,KE5RE001,035202,9,,B,8,2,(()) ,,
K/KE/KE5.xml,KE5RE001,035202,10,,B,8,3,"that word mean in the year twenty five, twenty thousand?","that/DT0 word/NN1 mean/VVB-NN1 in/PRP the/AT0 year/NN1 twenty/CRD five/CRD ,/PUN twenty/CRD thousand/CRD ?/PUN",
K/KE/KE5.xml,KE5RE001,035202,11,,B,8,4,Oh I've got to phone my ma,oh/ITJ i/PNP have/VHB get/VVN to/TO0 phone/VVI i/DPS ma/NN1,
K/KE/KE5.xml,KE5RE001,035202,12,,A,9,1,Blik blik slogger logger a,blik/NN1-NP0 blik/NN1-NP0 slogger/NN1 logger/NN1 a/AT0,
K/KE/KE5.xml,KE5RE001,035202,13,,B,10,1,Masturbate explain masturbate,masturbate/VVB explain/VVB masturbate/AJ0-NN1,
K/KE/KE5.xml,KE5RE001,035202,14,,A,11,1,by the way,by/PRP the/AT0 way/NN1,
K/KE/KE5.xml,KE5RE001,035202,15,,B,12,1,Well if you take a,well/AV0 if/CJS you/PNP take/VVB a/AT0,
K/KE/KE5.xml,KE5RE001,035202,16,,B,12,2,(()) ,,
K/KE/KE5.xml,KE5RE001,035202,17,,B,12,3,and cross it with a fuel injection between her and nitro oxide,and/CJC cross/VVB it/PNP with/PRP a/AT0 fuel/NN1 injection/NN1 between/PRP she/PNP and/CJC nitro/NN1 oxide/NN1,
K/KE/KE5.xml,KE5RE001,035202,18,,A,13,1,And take with crystals from the,and/CJC take/VVB with/PRP crystal/NN2 from/PRP the/AT0,
K/KE/KE5.xml,KE5RE001,035202,19,,B,14,1,"you'll put it with a box of speed with about seven hundred leggings, twelve per hour.","you/PNP will/VM0 put/VVI it/PNP with/PRP a/AT0 box/NN1 of/PRF speed/NN1 with/PRP about/AV0 seven/CRD hundred/CRD legging/NN2 ,/PUN twelve/CRD per/PRP hour/NN1 ./PUN",
K/KE/KE5.xml,KE5RE001,035202,20,,A,15,1,"I'd like you to ring us back up in the past and ask us, tell us if there's a war and how often you have sex in them days.","i/PNP would/VM0 like/VVI you/PNP to/TO0 ring/VVI we/PNP back/AVP up/AVP in/PRP the/AT0 past/NN1 and/CJC ask/VVB we/PNP ,/PUN tell/VVB we/PNP if/CJS there/EX0 be/VBZ a/AT0 war/NN1 and/CJC how/AVQ often/AV0 you/PNP have/VHB sex/NN1 in/PRP they/PNP day/NN2 ./PUN",
K/KE/KE5.xml,KE5RE001,035202,21,,B,16,1,"We do it seven days a, seven, seven times a day, seven times a week, in the year nineteen ninety two","we/PNP do/VDB it/PNP seven/CRD day/NN2 a/AT0 ,/PUN seven/CRD ,/PUN seven/CRD time/NN2 a/AT0 day/NN1 ,/PUN seven/CRD time/NN2 a/AT0 week/NN1 ,/PUN in/PRP the/AT0 year/NN1 nineteen/CRD ninety/CRD two/CRD",
K/KE/KE5.xml,KE5RE001,035202,22,,A,17,1,Excluding bank holiday Mondays,excluding/PRP bank/NN1 holiday/NN1 monday/NN2,
K/KE/KE5.xml,KE5RE001,035202,23,,B,18,1,fifty two weeks a year,fifty/CRD two/CRD week/NN2 a/AT0 year/NN1,
K/KE/KE5.xml,KE5RE001,035202,24,,A,19,1,excluding bank holiday Mondays,excluding/PRP bank/NN1 holiday/NN1 monday/NN2,
K/KE/KE5.xml,KE5RE001,035202,25,,B,20,1,and Christmas Day,and/CJC christmas/NN1 day/NN1,
K/KE/KE5.xml,KE5RE001,035202,26,,A,21,1,excluding bank holiday Mondays and Christmas Day,excluding/PRP bank/NN1 holiday/NN1 monday/NN2 and/CJC christmas/NN1 day/NN1,
K/KE/KE5.xml,KE5RE001,035202,27,,B,22,1,all too pissed,all/AV0 too/AV0 pissed/AJ0,
K/KE/KE5.xml,KE5RE001,035202,28,,A,23,1,Thank you very much for listening and,thank/VVB you/PNP very/AV0 much/AV0 for/PRP listening/NN1-VVG and/CJC,
K/KE/KE5.xml,KE5RE001,035202,29,,B,24,1,"this is er, er","this/DT0 be/VBZ er/UNC ,/PUN er/UNC",
K/KE/KE5.xml,KE5RE001,035202,30,,A,25,1,I should work for the B B C shouldn't I as a news reporter,i/PNP should/VM0 work/VVI for/PRP the/AT0 b/ZZ0 b/ZZ0 c/ZZ0 should/VM0 not/XX0 i/PNP as/PRP-CJS a/AT0 news/NN1 reporter/NN1,
K/KE/KE5.xml,KE5RE001,035202,31,,B,26,1,this is Nigel  <<REDACTED (name)>>,this/DT0 be/VBZ nigel/NP0,
K/KE/KE5.xml,KE5RE001,035202,32,,B,26,2,<belch> That's a burp you may not experience that word from where you come from,that/DT0 be/VBZ a/AT0 burp/NN1 you/PNP may/VM0 not/XX0 experience/VVI that/DT0 word/NN1 from/PRP where/AVQ you/PNP come/VVB from/PRP,
K/KE/KE5.xml,KE5RE001,035202,33,,A,27,1,"Yes by the year two thousand and fifty six comes, burps may be anonymous","yes/ITJ by/PRP the/AT0 year/NN1 two/CRD thousand/CRD and/CJC fifty/CRD six/CRD come/VVZ ,/PUN burp/NN2 may/VM0 be/VBI anonymous/AJ0",
