swda_filename,ptb_basename,conversation_no,transcript_index,act_tag,caller,turn_index,subutterance_index,text,pos,trees
K/KE/KE2.xml,KE2RE012,038501,0,,A,1,1,"Oh thanks very much, right I'll just go and get the paper ","oh/ITJ thanks/NN2 very/AV0 much/AV0 ,/PUN right/AV0 i/PNP will/VM0 just/AV0 go/VVI and/CJC get/VVI the/AT0 paper/NN1 ",
K/KE/KE2.xml,KE2RE012,038501,1,,B,2,1,Go and get the paper then okay ,go/VVB and/CJC get/VVB the/AT0 paper/NN1 then/AV0 okay/AV0 ,
K/KE/KE2.xml,KE2RE012,038501,2,,A,3,1,Yep ,yep/ITJ ,
K/KE/KE2.xml,KE2RE012,038501,3,,B,4,1,okay ,okay/AV0 ,
K/KE/KE2.xml,KE2RE012,038501,4,,A,5,1,"I don't know where, I thought I left my case here, I don't know what I've done with my case that's all, it's probably downstairs  --","i/PNP do/VDB not/XX0 know/VVI where/AVQ ,/PUN i/PNP think/VVD i/PNP leave/VVD i/DPS case/NN1 here/AV0 ,/PUN i/PNP do/VDB not/XX0 know/VVI what/DTQ i/PNP have/VHB do/VDN with/PRP i/DPS case/NN1 that/DT0 be/VBZ all/DT0 ,/PUN it/PNP be/VBZ probably/AV0 downstairs/AV0 ",
K/KE/KE2.xml,KE2RE012,038501,5,,A,5,2,--oh  --,oh/ITJ ,
K/KE/KE2.xml,KE2RE012,038501,6,,A,5,3,"--oh I don't know, mm  --","oh/ITJ i/PNP do/VDB not/XX0 know/VVI ,/PUN mm/ITJ ",
K/KE/KE2.xml,KE2RE012,038501,7,,A,5,4,--still not able to find it  --,still/AV0 not/XX0 able/AJ0 to/TO0 find/VVI it/PNP ,
K/KE/KE2.xml,KE2RE012,038501,8,,A,5,5,--I think I'd better put these plants out  --,i/PNP think/VVB i/PNP have/VHD well/AV0 put/VVN these/DT0 plant/NN2 out/AVP ,
K/KE/KE2.xml,KE2RE012,038501,9,,A,5,6,"--mm that's right, oh, mm  --","mm/ITJ that/DT0 be/VBZ right/AJ0 ,/PUN oh/ITJ ,/PUN mm/ITJ ",
K/KE/KE2.xml,KE2RE012,038501,10,,A,5,7,--that's not there  --,that/DT0 be/VBZ not/XX0 there/AV0 ,
K/KE/KE2.xml,KE2RE012,038501,11,,A,5,8,"--right, I'd better switch this, the tape off cos there's not much, be much conversation now for a while","right/AV0 ,/PUN i/PNP have/VHD well/AV0 switch/VVI this/DT0 ,/PUN the/AT0 tape/NN1 off/AVP cos/CJS there/EX0 be/VBZ not/XX0 much/DT0 ,/PUN be/VBI much/DT0 conversation/NN1 now/AV0 for/PRP a/AT0 while/NN1 ",
