swda_filename,ptb_basename,conversation_no,transcript_index,act_tag,caller,turn_index,subutterance_index,text,pos,trees
K/KE/KE2.xml,KE2RE01U,038901,0,,A,1,1,She'd have to put that in the compost.,she/PNP would/VM0 have/VHI to/TO0 put/VVI that/DT0 in/PRP the/AT0 compost/NN1 ./PUN,
K/KE/KE2.xml,KE2RE01U,038901,1,,B,2,1,What's that?,what/DTQ be/VBZ that/DT0 ?/PUN,
K/KE/KE2.xml,KE2RE01U,038901,2,,A,3,1,Well it's the fat.,well/AV0 it/PNP be/VBZ the/AT0 fat/NN1-AJ0 ./PUN,
K/KE/KE2.xml,KE2RE01U,038901,3,,B,4,1,Oh put it down here I'll cut it up and give it to the birds.,oh/ITJ put/VVB it/PNP down/AVP here/AV0 i/PNP will/VM0 cut/VVI it/PNP up/AVP and/CJC give/VVB it/PNP to/PRP the/AT0 bird/NN2 ./PUN,
K/KE/KE2.xml,KE2RE01U,038901,4,,A,5,1,Okay.,okay/AV0 ./PUN,
K/KE/KE2.xml,KE2RE01U,038901,5,,A,5,2,Well I always feed the birds.,well/AV0 i/PNP always/AV0 feed/VVB the/AT0 bird/NN2 ./PUN,
K/KE/KE2.xml,KE2RE01U,038901,6,,B,6,1,Yeah.,yeah/ITJ ./PUN,
K/KE/KE2.xml,KE2RE01U,038901,7,,A,7,1,Gave them a bit of chicken.,give/VVD they/PNP a/AT0 bit/NN1 of/PRF chicken/NN1 ./PUN,
K/KE/KE2.xml,KE2RE01U,038901,8,,A,7,2,Not cooked or anything.,not/XX0 cook/VVN-AJ0 or/CJC anything/PNI ./PUN,
K/KE/KE2.xml,KE2RE01U,038901,9,,B,8,1,That won't matter.,that/DT0 will/VM0 not/XX0 matter/VVI ./PUN,
K/KE/KE2.xml,KE2RE01U,038901,10,,B,8,2,I'll only cut it up smaller that's how they like it.,i/PNP will/VM0 only/AV0 cut/VVI it/PNP up/AVP-PRP small/AJC that/DT0 be/VBZ how/AVQ they/PNP like/VVB it/PNP ./PUN,
K/KE/KE2.xml,KE2RE01U,038901,11,,B,8,3,Anything with fat they eat.,anything/PNI with/PRP fat/NN1-AJ0 they/PNP eat/VVB ./PUN,
K/KE/KE2.xml,KE2RE01U,038901,12,,A,9,1,Oh!,oh/ITJ !/PUN,
K/KE/KE2.xml,KE2RE01U,038901,13,,A,9,2,I'll be glad to sit down again!,i/PNP will/VM0 be/VBI glad/AJ0 to/TO0 sit/VVI down/AVP again/AV0 !/PUN,
K/KE/KE2.xml,KE2RE01U,038901,14,,A,9,3,You've got the  (()) to do it and th- I'll have to be ever so careful I'm we- <laughing> wearing  </laughing> a (()) .,you/PNP have/VHB get/VVN the/AT0 to/TO0 do/VDI it/PNP and/CJC th/UNC i/PNP will/VM0 have/VHI to/TO0 be/VBI [ever/AV0 so/AV0]/AV0 careful/AJ0 i/PNP be/VBB we/UNC wear/VVG a/AT0 ./PUN,
K/KE/KE2.xml,KE2RE01U,038901,15,,A,9,4,<laughing> And so  kept on finding   </laughing> bits of the erm  Angora wool  sort of in the (()) .,and/CJC so/AV0 keep/VVN-VVD on/AVP find/VVG bit/NN2 of/PRF the/AT0 erm/UNC angora/NN1 wool/NN1 [sort/NN1 of/PRF]/AV0 in/PRP the/AT0 ./PUN,
K/KE/KE2.xml,KE2RE01U,038901,16,,B,10,1,Oh dear!,oh/ITJ dear/ITJ !/PUN,
K/KE/KE2.xml,KE2RE01U,038901,17,,B,10,2,Did you?<laugh>,do/VDD you/PNP ?/PUN,
K/KE/KE2.xml,KE2RE01U,038901,18,,A,11,1,I think there's only another one of these down there.,i/PNP think/VVB there/EX0 be/VBZ only/AV0 another/DT0 one/CRD of/PRF these/DT0 down/AVP there/AV0 ./PUN,
K/KE/KE2.xml,KE2RE01U,038901,19,,B,12,1,Where's that?,where/AVQ be/VBZ that/DT0 ?/PUN,
K/KE/KE2.xml,KE2RE01U,038901,20,,A,13,1,"I shi- , think I used it up.","i/PNP shi/UNC ,/PUN think/VVB i/PNP use/VVD it/PNP up/AVP ./PUN",
K/KE/KE2.xml,KE2RE01U,038901,21,,B,14,1,"Yeah , I think you have used the o- , one other.","yeah/ITJ ,/PUN i/PNP think/VVB you/PNP have/VHB use/VVN the/AT0 o/UNC ,/PUN one/CRD other/AJ0-NN1 ./PUN",
K/KE/KE2.xml,KE2RE01U,038901,22,,A,15,1,So if I see any more offers  can't seem to find any.,so/AV0 if/CJS i/PNP see/VVB any/DT0 more/DT0 offer/NN2 can/VM0 not/XX0 seem/VVI to/TO0 find/VVI any/DT0 ./PUN,
K/KE/KE2.xml,KE2RE01U,038901,23,,A,15,2,Found four erm  (()),find/VVN-VVD four/CRD erm/UNC,
K/KE/KE2.xml,KE2RE01U,038901,24,,B,16,1,Yep!,yep/ITJ !/PUN,
K/KE/KE2.xml,KE2RE01U,038901,25,,A,17,1,"Surprising to see  (()) children (()) , they're going back so soon.","surprising/AJ0 to/TO0 see/VVI child/NN2 ,/PUN they/PNP be/VBB go/VVG back/AVP so/AV0 soon/AV0 ./PUN",
K/KE/KE2.xml,KE2RE01U,038901,26,,B,18,1,Mm mm!,mm/ITJ mm/ITJ !/PUN,
K/KE/KE2.xml,KE2RE01U,038901,27,,A,19,1,Did you do the erm  this?,do/VDD you/PNP do/VDI the/AT0 erm/UNC this/DT0 ?/PUN,
K/KE/KE2.xml,KE2RE01U,038901,28,,B,20,1,Mm?,mm/ITJ ?/PUN,
K/KE/KE2.xml,KE2RE01U,038901,29,,B,20,2,Yes.,yes/ITJ ./PUN,
K/KE/KE2.xml,KE2RE01U,038901,30,,A,21,1,"Quite a saga, you know all of this.","quite/AV0 a/AT0 saga/NN1 ,/PUN you/PNP know/VVB all/DT0 of/PRF this/DT0 ./PUN",
K/KE/KE2.xml,KE2RE01U,038901,31,,A,21,2,So with my   (()) doo da it puts out sort of,so/AV0 with/PRP i/DPS doo/UNC da/UNC it/PNP put/VVZ out/AVP [sort/NN1 of/PRF]/AV0,
