swda_filename,ptb_basename,conversation_no,transcript_index,act_tag,caller,turn_index,subutterance_index,text,pos,trees
K/KE/KE2.xml,KE2RE022,038908,0,,A,1,1,Ooh ooh!,ooh/ITJ ooh/ITJ !/PUN,
K/KE/KE2.xml,KE2RE022,038908,1,,A,1,2,He could now lose it!,he/PNP could/VM0 now/AV0 lose/VVI it/PNP !/PUN,
K/KE/KE2.xml,KE2RE022,038908,2,,B,2,1,Hey?,hey/ITJ ?/PUN,
K/KE/KE2.xml,KE2RE022,038908,3,,A,3,1,<shouting> He could now lose it on the last ball </shouting> !,he/PNP could/VM0 now/AV0 lose/VVI it/PNP on/PRP-AVP the/AT0 last/ORD ball/NN1 !/PUN,
K/KE/KE2.xml,KE2RE022,038908,4,,B,4,1,Okay.(()) (()),okay/AV0 ./PUN,
K/KE/KE2.xml,KE2RE022,038908,5,,A,5,1,He's missed it!,he/PNP have/VHZ miss/VVN it/PNP !/PUN,
K/KE/KE2.xml,KE2RE022,038908,6,,A,5,2,He's only got two and he wanted three!,he/PNP have/VHZ only/AV0 get/VVN two/CRD and/CJC he/PNP want/VVD three/CRD !/PUN,
K/KE/KE2.xml,KE2RE022,038908,7,,A,5,3,Really!,really/AV0 !/PUN,
K/KE/KE2.xml,KE2RE022,038908,8,,A,5,4,"He, ha!","he/PNP ,/PUN ha/ITJ !/PUN",
K/KE/KE2.xml,KE2RE022,038908,9,,A,5,5,"So now it's, so he wants one and  Bryant one for two.","so/AV0 now/AV0 it/PNP be/VBZ ,/PUN so/CJS he/PNP want/VVZ one/CRD-PNI and/CJC bryant/NP0 one/PNI-CRD for/PRP two/CRD ./PUN",
K/KE/KE2.xml,KE2RE022,038908,10,,A,5,6,Ah!,ah/ITJ !/PUN,
K/KE/KE2.xml,KE2RE022,038908,11,,A,5,7,Gracious me!,gracious/AJ0 i/PNP !/PUN,
K/KE/KE2.xml,KE2RE022,038908,12,,A,5,8,Bryant thought he'd lost it then!,bryant/NP0 think/VVD he/PNP have/VHD lose/VVN it/PNP then/AV0 !/PUN,
K/KE/KE2.xml,KE2RE022,038908,13,,A,5,9,He should of done really it was,he/PNP should/VM0 have/VHI do/VDN really/AV0 it/PNP be/VBD,
K/KE/KE2.xml,KE2RE022,038908,14,,B,6,1,(()) are they both (()) ?,be/VBB they/PNP both/DT0 ?/PUN,
K/KE/KE2.xml,KE2RE022,038908,15,,A,7,1,"No, I think, oh I don't know he's an exiled Scot.","no/ITJ ,/PUN i/PNP think/VVB ,/PUN oh/ITJ i/PNP do/VDB not/XX0 know/VVI he/PNP be/VBZ an/AT0 exiled/AJ0 scot/NN1 ./PUN",
K/KE/KE2.xml,KE2RE022,038908,16,,B,8,1,"Did he have a little  (()) cos he's in er  oh no, of course he's wearing the blue of Scotland isn't he?","do/VDD he/PNP have/VHI a/AT0 little/AJ0 cos/CJS he/PNP be/VBZ in/PRP-AVP er/UNC oh/ITJ no/ITJ ,/PUN [of/PRF course/NN1]/AV0 he/PNP be/VBZ wear/VVG the/AT0 blue/NN1-AJ0 of/PRF scotland/NP0 be/VBZ not/XX0 he/PNP ?/PUN",
K/KE/KE2.xml,KE2RE022,038908,17,,A,9,1,Well of course they have to wear different colours anyway don't they?,well/AV0 [of/PRF course/NN1]/AV0 they/PNP have/VHB to/TO0 wear/VVI different/AJ0 colour/NN2 anyway/AV0 do/VDB not/XX0 they/PNP ?/PUN,
K/KE/KE2.xml,KE2RE022,038908,18,,B,10,1,Mm.,mm/ITJ ./PUN,
K/KE/KE2.xml,KE2RE022,038908,19,,B,10,2,Nice that  (()) isn't it?,nice/AJ0 that/CJT-DT0 be/VBZ not/XX0 it/PNP ?/PUN,
K/KE/KE2.xml,KE2RE022,038908,20,,A,11,1,Yeah.,yeah/ITJ ./PUN,
K/KE/KE2.xml,KE2RE022,038908,21,,A,11,2,Short innit?,short/NP0 in/VBZ n/XX0 it/PNP ?/PUN,
K/KE/KE2.xml,KE2RE022,038908,22,,B,12,1,"(()) , Andy Thompson innit?",",/PUN andy/NP0 thompson/NP0 in/VBZ n/XX0 it/PNP ?/PUN",
K/KE/KE2.xml,KE2RE022,038908,23,,A,13,1,Yeah.,yeah/ITJ ./PUN,
K/KE/KE2.xml,KE2RE022,038908,24,,A,13,2,"Oh, medium length.","oh/ITJ ,/PUN medium/AJ0-NN1 length/NN1 ./PUN",
K/KE/KE2.xml,KE2RE022,038908,25,,B,14,1,So,so/AV0,
K/KE/KE2.xml,KE2RE022,038908,26,,A,15,1,Well Thompson needs,well/AV0 thompson/NP0 need/VVZ-NN2,
K/KE/KE2.xml,KE2RE022,038908,27,,B,16,1,Bryant,bryant/NP0,
K/KE/KE2.xml,KE2RE022,038908,28,,A,17,1,Thompson needs one and Bryant needs two.,thompson/NP0 need/VVZ one/CRD-PNI and/CJC bryant/NP0 need/VVZ two/CRD ./PUN,
K/KE/KE2.xml,KE2RE022,038908,29,,A,17,2,And that's Thompson.,and/CJC that/DT0 be/VBZ thompson/NP0 ./PUN,
K/KE/KE2.xml,KE2RE022,038908,30,,B,18,1,I'm going with David this Saturday.,i/PNP be/VBB go/VVG with/PRP david/NP0 this/DT0 saturday/NP0 ./PUN,
K/KE/KE2.xml,KE2RE022,038908,31,,B,18,2,Worked hard hasn't he?,work/VVD-VVN hard/AV0 have/VHZ not/XX0 he/PNP ?/PUN,
K/KE/KE2.xml,KE2RE022,038908,32,,B,18,3,To get back there.,to/TO0 get/VVI back/AVP there/AV0 ./PUN,
K/KE/KE2.xml,KE2RE022,038908,33,,A,19,1,He has worked hard.,he/PNP have/VHZ work/VVN hard/AV0-AJ0 ./PUN,
K/KE/KE2.xml,KE2RE022,038908,34,,A,19,2,He only needed two at the last end.,he/PNP only/AV0 need/VVD two/CRD at/PRP the/AT0 last/ORD end/NN1 ./PUN,
K/KE/KE2.xml,KE2RE022,038908,35,,A,19,3,Thompson needed three.,thompson/NP0 need/VVD three/CRD ./PUN,
K/KE/KE2.xml,KE2RE022,038908,36,,A,19,4,Erm  but he just had sort of he wasn't so good.,erm/UNC but/CJC he/PNP just/AV0 have/VHD [sort/NN1 of/PRF]/AV0 he/PNP be/VBD not/XX0 so/AV0 good/AJ0 ./PUN,
K/KE/KE2.xml,KE2RE022,038908,37,,A,19,5,Well that's a better ball!,well/AV0 that/DT0 be/VBZ a/AT0 good/AJC ball/NN1 !/PUN,
K/KE/KE2.xml,KE2RE022,038908,38,,A,19,6,"If he'd done that in the last erm, he'd have won it.","if/CJS he/PNP have/VHD do/VDN that/DT0 in/PRP the/AT0 last/ORD erm/UNC ,/PUN he/PNP would/VM0 have/VHI win/VVN it/PNP ./PUN",
K/KE/KE2.xml,KE2RE022,038908,39,,B,20,1,And he's come back and sort of go round the back cos that other fellow sort of he came down,and/CJC he/PNP have/VHZ come/VVN back/AVP and/CJC [sort/NN1 of/PRF]/AV0 go/VVB-NN1 round/PRP the/AT0 back/NN1 cos/CJS that/DT0 other/AJ0 fellow/NN1 [sort/NN1 of/PRF]/AV0 he/PNP come/VVD down/AVP,
K/KE/KE2.xml,KE2RE022,038908,40,,A,21,1,Mm.,mm/ITJ ./PUN,
K/KE/KE2.xml,KE2RE022,038908,41,,B,22,1,and then he appeared up the top there.(()),and/CJC then/AV0 he/PNP appear/VVD up/AVP-PRP the/AT0 top/NN1 there/AV0 ./PUN,
K/KE/KE2.xml,KE2RE022,038908,42,,A,23,1,They come down to see  what the situation really is.,they/PNP come/VVB down/AVP to/TO0 see/VVI what/DTQ the/AT0 situation/NN1 really/AV0 be/VBZ ./PUN,
K/KE/KE2.xml,KE2RE022,038908,43,,B,24,1,Please!,please/AV0 !/PUN,
K/KE/KE2.xml,KE2RE022,038908,44,,B,24,2,Come on then!,come/VVB on/AVP then/AV0 !/PUN,
K/KE/KE2.xml,KE2RE022,038908,45,,B,24,3,Oh it's gone further though this,oh/ITJ it/PNP have/VHZ go/VVN further/far/AV0 though/AV0 this/DT0,
K/KE/KE2.xml,KE2RE022,038908,46,,A,25,1,Yeah.,yeah/ITJ ./PUN,
K/KE/KE2.xml,KE2RE022,038908,47,,B,26,1,"Well presumably they si- , they have to throw or they're supposed to throw, or have they not?","well/AV0 presumably/AV0 they/PNP si/UNC ,/PUN they/PNP have/VHB to/TO0 throw/VVI or/CJC they/PNP be/VBB supposed/AJ0 to/TO0 throw/VVI ,/PUN or/CJC have/VHB they/PNP not/XX0 ?/PUN",
K/KE/KE2.xml,KE2RE022,038908,48,,B,26,2,Cos he just said that should of been enough.,cos/CJS he/PNP just/AV0 say/VVD that/DT0 should/VM0 have/VHI be/VBN enough/AV0 ./PUN,
K/KE/KE2.xml,KE2RE022,038908,49,,A,27,1,"Oh, he's looking worried!","oh/ITJ ,/PUN he/PNP be/VBZ look/VVG worried/AJ0 !/PUN",
K/KE/KE2.xml,KE2RE022,038908,50,,A,27,2,Ooh ooh!,ooh/ITJ ooh/ITJ !/PUN,
K/KE/KE2.xml,KE2RE022,038908,51,,A,27,3,Ee ee!,ee/ITJ ee/ITJ !/PUN,
K/KE/KE2.xml,KE2RE022,038908,52,,B,28,1,Well that's much better than the other two isn't it?,well/AV0 that/DT0 be/VBZ much/AV0 good/AJC than/CJS the/AT0 other/AJ0-NN1 two/CRD be/VBZ not/XX0 it/PNP ?/PUN,
K/KE/KE2.xml,KE2RE022,038908,53,,A,29,1,"Yeah, I don't, yeah.","yeah/ITJ ,/PUN i/PNP do/VDB not/XX0 ,/PUN yeah/ITJ ./PUN",
K/KE/KE2.xml,KE2RE022,038908,54,,A,29,2,Could be two.,could/VM0 be/VBI two/CRD ./PUN,
K/KE/KE2.xml,KE2RE022,038908,55,,A,29,3,Yeah we've dropped two more.,yeah/ITJ we/PNP have/VHB drop/VVN two/CRD more/DT0 ./PUN,
K/KE/KE2.xml,KE2RE022,038908,56,,B,30,1,And he's got two more balls.,and/CJC he/PNP have/VHZ get/VVN two/CRD more/DT0 ball/NN2 ./PUN,
K/KE/KE2.xml,KE2RE022,038908,57,,A,31,1,Mm.,mm/ITJ ./PUN,
K/KE/KE2.xml,KE2RE022,038908,58,,B,32,1,"Well, is that a problem?","well/AV0 ,/PUN be/VBZ that/DT0 a/AT0 problem/NN1 ?/PUN",
K/KE/KE2.xml,KE2RE022,038908,59,,B,32,2,He's gonna try and knock,he/PNP be/VBZ gon/VVG na/TO0 try/VVI and/CJC knock/VVI,
K/KE/KE2.xml,KE2RE022,038908,60,,A,33,1,So he's gotta  (()) again.,so/AV0 he/PNP have/VHZ got/VVI ta/AT0 again/AV0 ./PUN,
K/KE/KE2.xml,KE2RE022,038908,61,,B,34,1,Yeah.,yeah/ITJ ./PUN,
K/KE/KE2.xml,KE2RE022,038908,62,,B,34,2,Oh it's going right through!,oh/ITJ it/PNP be/VBZ go/VVG right/AV0 through/AVP !/PUN,
K/KE/KE2.xml,KE2RE022,038908,63,,B,34,3,He's trying to knock David out of course isn't he?,he/PNP be/VBZ try/VVG to/TO0 knock/VVI david/NP0 out/AVP [of/PRF course/NN1]/AV0 be/VBZ not/XX0 he/PNP ?/PUN,
K/KE/KE2.xml,KE2RE022,038908,64,,A,35,1,Mm mm.,mm/ITJ mm/ITJ ./PUN,
K/KE/KE2.xml,KE2RE022,038908,65,,A,35,2,And drop himself in.,and/CJC drop/VVB-NN1 himself/PNX in/AVP-PRP ./PUN,
K/KE/KE2.xml,KE2RE022,038908,66,,B,36,1,Yeah.,yeah/ITJ ./PUN,
K/KE/KE2.xml,KE2RE022,038908,67,,A,37,1,Well I should think he's now got wo- one red I should think.,well/AV0 i/PNP should/VM0 think/VVI he/PNP have/VHZ now/AV0 get/VVN wo/UNC one/PNI-CRD red/AJ0-NN1 i/PNP should/VM0 think/VVI ./PUN,
K/KE/KE2.xml,KE2RE022,038908,68,,B,38,1,I suppose you could say David had it so often    <laugh> that it be nice for him to get it.,i/PNP suppose/VVB you/PNP could/VM0 say/VVI david/NP0 have/VHD it/PNP so/AV0 often/AV0 that/CJT it/PNP be/VBB nice/AJ0 for/PRP he/PNP to/TO0 get/VVI it/PNP ./PUN,
K/KE/KE2.xml,KE2RE022,038908,69,,A,39,1,I should think David will come out on the forehand and try and knock that  blue ball out.,i/PNP should/VM0 think/VVI david/NP0 will/VM0 come/VVI out/AVP on/PRP the/AT0 forehand/NN1 and/CJC try/VVB and/CJC knock/VVB that/DT0-CJT blue/AJ0 ball/NN1 out/AVP ./PUN,
K/KE/KE2.xml,KE2RE022,038908,70,,A,39,2,The one that's,the/AT0 one/PNI that/CJT be/VBZ,
K/KE/KE2.xml,KE2RE022,038908,71,,B,40,1,He's only got one there.,he/PNP have/VHZ only/AV0 get/VVN one/PNI there/AV0 ./PUN,
K/KE/KE2.xml,KE2RE022,038908,72,,A,41,1,Mm.,mm/ITJ ./PUN,
K/KE/KE2.xml,KE2RE022,038908,73,,A,41,2,Yes I,yes/ITJ i/PNP,
K/KE/KE2.xml,KE2RE022,038908,74,,B,42,1,The re-,the/AT0 re/UNC,
K/KE/KE2.xml,KE2RE022,038908,75,,A,43,1,thought he only got one.,think/VVD he/PNP only/AV0 get/VVD one/PNI-CRD ./PUN,
K/KE/KE2.xml,KE2RE022,038908,76,,A,43,2,Interesting to see which way he comes.,interesting/AJ0 to/TO0 see/VVI which/DTQ way/NN1 he/PNP come/VVZ ./PUN,
K/KE/KE2.xml,KE2RE022,038908,77,,A,43,3,I think he'll come round this way.,i/PNP think/VVB he/PNP will/VM0 come/VVI round/PRP-AVP this/DT0 way/NN1 ./PUN,
K/KE/KE2.xml,KE2RE022,038908,78,,A,43,4,Oh no he's not!,oh/ITJ no/ITJ he/PNP be/VBZ not/XX0 !/PUN,
K/KE/KE2.xml,KE2RE022,038908,79,,A,43,5,He's coming round the  back the other way.,he/PNP be/VBZ come/VVG round/PRP the/AT0 back/NN1 the/AT0 other/AJ0 way/NN1 ./PUN,
K/KE/KE2.xml,KE2RE022,038908,80,,A,43,6,Ooh ooh!,ooh/ITJ ooh/ITJ !/PUN,
K/KE/KE2.xml,KE2RE022,038908,81,,A,43,7,I th- probably only red still.,i/PNP th/UNC probably/AV0 only/AV0-AJ0 red/AJ0 still/AV0-AJ0 ./PUN,
K/KE/KE2.xml,KE2RE022,038908,82,,A,43,8,It's still his one.,it/PNP be/VBZ still/AV0 he/DPS one/PNI ./PUN,
K/KE/KE2.xml,KE2RE022,038908,83,,B,44,1,Still only got one.,still/AV0 only/AV0 get/VVD one/PNI-CRD ./PUN,
K/KE/KE2.xml,KE2RE022,038908,84,,B,44,2,Yes.,yes/ITJ ./PUN,
K/KE/KE2.xml,KE2RE022,038908,85,,B,44,3,Well he's got three  so this is the fourth one from this fellow isn't it?,well/AV0 he/PNP have/VHZ get/VVN three/CRD so/AV0 this/DT0 be/VBZ the/AT0 fourth/ORD one/PNI from/PRP this/DT0 fellow/NN1 be/VBZ not/XX0 it/PNP ?/PUN,
K/KE/KE2.xml,KE2RE022,038908,86,,A,45,1,That's right!,that/DT0 be/VBZ right/AJ0 !/PUN,
K/KE/KE2.xml,KE2RE022,038908,87,,B,46,1,And Bryant has the last one?,and/CJC bryant/NP0 have/VHZ the/AT0 last/ORD one/PNI ?/PUN,
K/KE/KE2.xml,KE2RE022,038908,88,,B,46,2,No.,no/ITJ ./PUN,
K/KE/KE2.xml,KE2RE022,038908,89,,A,47,1,A chalk.,a/AT0 chalk/NN1 ./PUN,
K/KE/KE2.xml,KE2RE022,038908,90,,B,48,1,<laugh> So it just needs  David to get through?,so/AV0 it/PNP just/AV0 need/VVZ david/NP0 to/TO0 get/VVI through/AVP-PRP ?/PUN,
K/KE/KE2.xml,KE2RE022,038908,91,,B,48,2,He can do what he likes,he/PNP can/VM0 do/VDI what/DTQ he/PNP like/VVZ,
K/KE/KE2.xml,KE2RE022,038908,92,,A,49,1,Yeah.,yeah/ITJ ./PUN,
K/KE/KE2.xml,KE2RE022,038908,93,,B,50,1,with this last ball really.,with/PRP this/DT0 last/ORD ball/NN1 really/AV0 ./PUN,
K/KE/KE2.xml,KE2RE022,038908,94,,A,51,1,"Well, yeah.","well/AV0 ,/PUN yeah/ITJ ./PUN",
K/KE/KE2.xml,KE2RE022,038908,95,,B,52,1,This red one.,this/DT0 red/AJ0 one/PNI ./PUN,
K/KE/KE2.xml,KE2RE022,038908,96,,A,53,1,If he gets another red he's won the match.,if/CJS he/PNP get/VVZ another/DT0 red/NN1 he/PNP have/VHZ win/VVN the/AT0 match/NN1 ./PUN,
K/KE/KE2.xml,KE2RE022,038908,97,,A,53,2,But if he  if he plays it and misses it he could give it to Thompson.,but/CJC if/CJS he/PNP if/CJS he/PNP play/VVZ it/PNP and/CJC miss/VVZ it/PNP he/PNP could/VM0 give/VVI it/PNP to/PRP thompson/NP0 ./PUN,
K/KE/KE2.xml,KE2RE022,038908,98,,A,53,3,And if he  if he doesn't play  it'll be a draw.,and/CJC if/CJS he/PNP if/CJS he/PNP do/VDZ not/XX0 play/VVI it/PNP will/VM0 be/VBI a/AT0 draw/NN1 ./PUN,
K/KE/KE2.xml,KE2RE022,038908,99,,B,54,1,"Oh not just , not just one ball he needs to play","oh/ITJ not/XX0 just/AV0 ,/PUN not/XX0 just/AV0 one/CRD ball/NN1 he/PNP need/VVZ to/TO0 play/VVI",
K/KE/KE2.xml,KE2RE022,038908,100,,A,55,1,Yes.,yes/ITJ ./PUN,
K/KE/KE2.xml,KE2RE022,038908,101,,B,56,1,but two.,but/CJC two/CRD ./PUN,
K/KE/KE2.xml,KE2RE022,038908,102,,A,57,1,He needs two.,he/PNP need/VVZ two/CRD ./PUN,
K/KE/KE2.xml,KE2RE022,038908,103,,A,57,2,Thompson didn't play his.,thompson/NP0 do/VDD not/XX0 play/VVI his/PNP ./PUN,
K/KE/KE2.xml,KE2RE022,038908,104,,A,57,3,It's all or nothing on this one!,it/PNP be/VBZ all/DT0 or/CJC nothing/PNI on/PRP this/DT0 one/PNI !/PUN,
K/KE/KE2.xml,KE2RE022,038908,105,,B,58,1,Oh dear!,oh/ITJ dear/ITJ !/PUN,
K/KE/KE2.xml,KE2RE022,038908,106,,B,58,2,So has that fellow won it?,so/AV0 have/VHZ that/DT0 fellow/NN1 win/VVN it/PNP ?/PUN,
K/KE/KE2.xml,KE2RE022,038908,107,,A,59,1,"No, it's one all.","no/ITJ ,/PUN it/PNP be/VBZ one/PNI all/AV0 ./PUN",
K/KE/KE2.xml,KE2RE022,038908,108,,A,59,2,"I- it it's one red, so they're now  six all.","i/UNC it/PNP it/PNP be/VBZ one/CRD-PNI red/AJ0-NN1 ,/PUN so/CJS they/PNP be/VBB now/AV0 six/CRD all/AV0 ./PUN",
K/KE/KE2.xml,KE2RE022,038908,109,,B,60,1,Oh gosh!,oh/ITJ gosh/ITJ !/PUN,
K/KE/KE2.xml,KE2RE022,038908,110,,B,60,2,It doesn't matter then.,it/PNP do/VDZ not/XX0 matter/VVI then/AV0 ./PUN,
