swda_filename,ptb_basename,conversation_no,transcript_index,act_tag,caller,turn_index,subutterance_index,text,pos,trees
K/KE/KE2.xml,KE2RE02S,039208,0,,A,1,1,Oh well I'm quite happy.,oh/ITJ well/AV0 i/PNP be/VBB quite/AV0 happy/AJ0 ./PUN ,
K/KE/KE2.xml,KE2RE02S,039208,1,,B,2,1,Sorry?,sorry/AJ0 ?/PUN ,
K/KE/KE2.xml,KE2RE02S,039208,2,,A,3,1,I said I must admit I'm quite happy here.,i/PNP say/VVD i/PNP must/VM0 admit/VVI i/PNP be/VBB quite/AV0 happy/AJ0 here/AV0 ./PUN ,
K/KE/KE2.xml,KE2RE02S,039208,3,,B,4,1,Oh well I,oh/ITJ well/AV0 i/PNP ,
K/KE/KE2.xml,KE2RE02S,039208,4,,A,5,1,Certainly  (()) Saint Gregory's I mean.,certainly/AV0 saint/NP0 gregory/NP0 's/POS i/PNP mean/VVB ./PUN ,
K/KE/KE2.xml,KE2RE02S,039208,5,,B,6,1,I think we can do without the erm  --,i/PNP think/VVB we/PNP can/VM0 do/VDI without/PRP the/AT0 erm/UNC ,
K/KE/KE2.xml,KE2RE02S,039208,6,,B,6,2,--the other things.,the/AT0 other/AJ0 thing/NN2 ./PUN ,
K/KE/KE2.xml,KE2RE02S,039208,7,,A,7,1,Yes.,yes/ITJ ./PUN ,
K/KE/KE2.xml,KE2RE02S,039208,8,,B,8,1,"You know, this fund raising, it's I mean we, we'll be giving them over a thousand pound, well a thousand pound anyway","you/PNP know/VVB ,/PUN this/DT0 fund/NN1 raising/NN1 ,/PUN it/PNP be/VBZ i/PNP mean/VVB we/PNP ,/PUN we/PNP will/VM0 be/VBI give/VVG they/PNP over/AV0 a/AT0 thousand/CRD pound/NN1 ,/PUN well/AV0 a/AT0 thousand/CRD pound/NN1 anyway/AV0 ",
K/KE/KE2.xml,KE2RE02S,039208,9,,A,9,1,Well may ,well/AV0 may/VM0 ,
K/KE/KE2.xml,KE2RE02S,039208,10,,B,10,1,well ,well/AV0 ,
K/KE/KE2.xml,KE2RE02S,039208,11,,A,11,1,may not be actually.,may/VM0 not/XX0 be/VBI actually/AV0 ./PUN ,
K/KE/KE2.xml,KE2RE02S,039208,12,,B,12,1,Yeah well it may well be,yeah/ITJ well/AV0 it/PNP may/VM0 well/AV0 be/VBI ,
K/KE/KE2.xml,KE2RE02S,039208,13,,A,13,1,"But I think this will be, I mean I'm  --","but/CJC i/PNP think/VVB this/DT0 will/VM0 be/VBI ,/PUN i/PNP mean/VVB i/PNP be/VBB ",
K/KE/KE2.xml,KE2RE02S,039208,14,,A,13,2,--more and more I'm thinking that erm,more/DT0 and/CJC more/AV0 i/PNP be/VBB think/VVG that/DT0 erm/UNC ,
K/KE/KE2.xml,KE2RE02S,039208,15,,B,14,1,And erm  --,and/CJC erm/UNC ,
K/KE/KE2.xml,KE2RE02S,039208,16,,B,14,2,--you know the other things that you do.,you/PNP know/VVB the/AT0 other/AJ0 thing/NN2 that/CJT you/PNP do/VDB ./PUN ,
K/KE/KE2.xml,KE2RE02S,039208,17,,B,14,3,--,,
K/KE/KE2.xml,KE2RE02S,039208,18,,B,14,4,--They have come on well haven't they?,they/PNP have/VHB come/VVN on/AVP-PRP well/AV0 have/VHB not/XX0 they/PNP ?/PUN ,
K/KE/KE2.xml,KE2RE02S,039208,19,,A,15,1,Yeah.,yeah/ITJ ./PUN ,
K/KE/KE2.xml,KE2RE02S,039208,20,,A,15,2,"Yeah they have, I mean they're just","yeah/ITJ they/PNP have/VHB ,/PUN i/PNP mean/VVB they/PNP be/VBB just/AV0 ",
K/KE/KE2.xml,KE2RE02S,039208,21,,B,16,1,Yeah,yeah/ITJ ,
K/KE/KE2.xml,KE2RE02S,039208,22,,A,17,1,they're just sort of shooting ,they/PNP be/VBB just/AV0 [sort/NN1 of/PRF]/AV0 shoot/VVG-NN1 ,
K/KE/KE2.xml,KE2RE02S,039208,23,,B,18,1,(()) able to plant them out then  (()) ,able/AJ0 to/TO0 plant/VVI they/PNP out/AVP then/AV0 ,
K/KE/KE2.xml,KE2RE02S,039208,24,,A,19,1,shooting up you see aren't they?,shoot/VVG up/AVP you/PNP see/VVB be/VBB not/XX0 they/PNP ?/PUN ,
K/KE/KE2.xml,KE2RE02S,039208,25,,B,20,1,We could bring that other erm (()) ,we/PNP could/VM0 bring/VVI that/DT0 other/AJ0-NN1 erm/UNC ,
K/KE/KE2.xml,KE2RE02S,039208,26,,A,21,1,"Yes I meant to do that, I'll do it when I come back down now.","yes/ITJ i/PNP mean/VVD to/TO0 do/VDI that/DT0 ,/PUN i/PNP will/VM0 do/VDI it/PNP when/CJS i/PNP come/VVB back/AVP down/AVP now/AV0 ./PUN ",
K/KE/KE2.xml,KE2RE02S,039208,27,,B,22,1,There's erm  --,there/EX0 's/POS erm/UNC ,
K/KE/KE2.xml,KE2RE02S,039208,28,,B,22,2,"--And I mean looking after the parish hall as well, why should we bother with that?","and/CJC i/PNP mean/VVB look/VVG after/PRP the/AT0 parish/NN1 hall/NN1 [as/CJS well/AV0]/AV0 ,/PUN why/AVQ should/VM0 we/PNP bother/VVI with/PRP that/DT0 ?/PUN ",
K/KE/KE2.xml,KE2RE02S,039208,29,,A,23,1,Yeah that's right.,yeah/ITJ that/DT0 be/VBZ right/AJ0 ./PUN ,
K/KE/KE2.xml,KE2RE02S,039208,30,,B,24,1,I mean we   --,i/PNP mean/VVB we/PNP ,
K/KE/KE2.xml,KE2RE02S,039208,31,,B,24,2,--<laugh> we have more than done  --,we/PNP have/VHB more/DT0 than/CJS do/VDN ,
K/KE/KE2.xml,KE2RE02S,039208,32,,B,24,3,--what was supposed to be to start with  --,what/DTQ be/VBD supposed/AJ0 to/TO0 be/VBI to/TO0 start/VVI with/PRP ,
K/KE/KE2.xml,KE2RE02S,039208,33,,B,24,4,--to see that it wasn't a drain on the parish.,to/TO0 see/VVI that/CJT it/PNP be/VBD not/XX0 a/AT0 drain/NN1 on/PRP the/AT0 parish/NN1 ./PUN ,
K/KE/KE2.xml,KE2RE02S,039208,34,,A,25,1,Yeah.,yeah/ITJ ./PUN ,
K/KE/KE2.xml,KE2RE02S,039208,35,,B,26,1,(()) --,,
K/KE/KE2.xml,KE2RE02S,039208,36,,B,26,2,--must get bored silly  --,must/VM0 get/VVI bored/AJ0 silly/AJ0 ,
K/KE/KE2.xml,KE2RE02S,039208,37,,B,26,3,--not being able to get out,not/XX0 be/VBG able/AJ0 to/TO0 get/VVI out/AVP ,
K/KE/KE2.xml,KE2RE02S,039208,38,,A,27,1,Yeah.,yeah/ITJ ./PUN ,
K/KE/KE2.xml,KE2RE02S,039208,39,,B,28,1,(()) ,,
K/KE/KE2.xml,KE2RE02S,039208,40,,A,29,1,"No I, the other thing is if we're out here, I don't know what to do about this lamp for the bedside, I mean I don't know that I need it and it's another ten pounds isn't it?","no/ITJ i/PNP ,/PUN the/AT0 other/AJ0 thing/NN1 be/VBZ if/CJS we/PNP be/VBB out/AVP here/AV0 ,/PUN i/PNP do/VDB not/XX0 know/VVI what/DTQ to/TO0 do/VDI about/PRP this/DT0 lamp/NN1 for/PRP the/AT0 bedside/NN1 ,/PUN i/PNP mean/VVB i/PNP do/VDB not/XX0 know/VVI that/CJT i/PNP need/VVB it/PNP and/CJC it/PNP be/VBZ another/DT0 ten/CRD pound/NN2 be/VBZ not/XX0 it/PNP ?/PUN ",
K/KE/KE2.xml,KE2RE02S,039208,41,,A,29,2,--,,
K/KE/KE2.xml,KE2RE02S,039208,42,,A,29,3,--What do you think?,what/DTQ do/VDB you/PNP think/VVI ?/PUN ,
K/KE/KE2.xml,KE2RE02S,039208,43,,B,30,1,I mean you're gonna get twenty five pounds in vouchers or something aren't you?,i/PNP mean/VVB you/PNP be/VBB gon/VVG na/TO0 get/VVI twenty/CRD five/CRD pound/NN2 in/PRP voucher/NN2 or/CJC something/PNI be/VBB not/XX0 you/PNP ?/PUN ,
K/KE/KE2.xml,KE2RE02S,039208,44,,B,30,2,--,,
K/KE/KE2.xml,KE2RE02S,039208,45,,B,30,3,--I don't know what  --,i/PNP do/VDB not/XX0 know/VVI what/DTQ ,
K/KE/KE2.xml,KE2RE02S,039208,46,,B,30,4,--kind of vou- did she say what?,kind/NN1 of/PRF vou/UNC do/VDD she/PNP say/VVI what/DTQ ?/PUN ,
K/KE/KE2.xml,KE2RE02S,039208,47,,A,31,1,"Oh I see, you mean not get it till then?","oh/ITJ i/PNP see/VVB ,/PUN you/PNP mean/VVB not/XX0 get/VVB it/PNP till/PRP then/AV0 ?/PUN ",
K/KE/KE2.xml,KE2RE02S,039208,48,,B,32,1,"Well it's only Friday, I mean we can ","well/AV0 it/PNP be/VBZ only/AV0 friday/NP0 ,/PUN i/PNP mean/VVB we/PNP can/VM0 ",
K/KE/KE2.xml,KE2RE02S,039208,49,,A,33,1,Yes.,yes/ITJ ./PUN ,
K/KE/KE2.xml,KE2RE02S,039208,50,,B,34,1,pay for it now.,pay/VVB-NN1 for/PRP it/PNP now/AV0 ./PUN ,
K/KE/KE2.xml,KE2RE02S,039208,51,,B,34,2,I mean what are the vouchers  (()) gonna be for?,i/PNP mean/VVB what/DTQ be/VBB the/AT0 voucher/NN2 gon/VVG na/TO0 be/VBI for/PRP ?/PUN ,
K/KE/KE2.xml,KE2RE02S,039208,52,,A,35,1,I've got no i- I've no idea.,i/PNP have/VHB get/VVN no/ITJ i/UNC i/PNP have/VHB no/AT0 idea/NN1 ./PUN ,
K/KE/KE2.xml,KE2RE02S,039208,53,,B,36,1,Probably be Smith's.<laughing> (()) </laughing> ,probably/AV0 be/VBB smith/NN1 's/POS ./PUN ,
K/KE/KE2.xml,KE2RE02S,039208,54,,A,37,1,<laugh> ,,
K/KE/KE2.xml,KE2RE02S,039208,55,,B,38,1,(()) taking off across the road like that in front of a car.,take/VVG off/AVP across/PRP the/AT0 road/NN1 like/PRP that/DT0 [in/PRP front/NN1 of/PRF]/PRP a/AT0 car/NN1 ./PUN ,
K/KE/KE2.xml,KE2RE02S,039208,56,,B,38,2,--,,
K/KE/KE2.xml,KE2RE02S,039208,57,,B,38,3,--You'd think they want to commit suicide wouldn't you?,you/PNP would/VM0 think/VVI they/PNP want/VVB to/TO0 commit/VVI suicide/NN1 would/VM0 not/XX0 you/PNP ?/PUN ,
K/KE/KE2.xml,KE2RE02S,039208,58,,A,39,1,You would wouldn't you?,you/PNP would/VM0 would/VM0 not/XX0 you/PNP ?/PUN ,
K/KE/KE2.xml,KE2RE02S,039208,59,,B,40,1,"There's ever so many more people about, it's a nice day of course ","there/EX0 be/VBZ [ever/AV0 so/AV0]/AV0 many/DT0 more/DT0 people/NN0 about/PRP-AVP ,/PUN it/PNP be/VBZ a/AT0 nice/AJ0 day/NN1 [of/PRF course/NN1]/AV0 ",
K/KE/KE2.xml,KE2RE02S,039208,60,,A,41,1,Yeah.,yeah/ITJ ./PUN ,
K/KE/KE2.xml,KE2RE02S,039208,61,,B,42,1,but as well as that of course there are all the school children around.,but/CJC [as/CJS well/AV0 as/CJS]/PRP that/DT0 [of/PRF course/NN1]/AV0 there/EX0 be/VBB all/DT0 the/AT0 school/NN1 child/NN2 around/AVP ./PUN ,
K/KE/KE2.xml,KE2RE02S,039208,62,,A,43,1,Mm.,mm/ITJ ./PUN ,
K/KE/KE2.xml,KE2RE02S,039208,63,,B,44,1,(()) ,,
K/KE/KE2.xml,KE2RE02S,039208,64,,A,45,1,Now where's he going?,now/AV0 where/AVQ be/VBZ he/PNP go/VVG ?/PUN ,
K/KE/KE2.xml,KE2RE02S,039208,65,,B,46,1,"No the fellow's stopped there, taking the cart off to go in there.","no/ITJ the/AT0 fellow/NN1 have/VHZ stop/VVN there/AV0 ,/PUN take/VVG the/AT0 cart/NN1 off/AVP to/TO0 go/VVI in/PRP there/AV0 ./PUN ",
K/KE/KE2.xml,KE2RE02S,039208,66,,A,47,1,"No indication, just --","no/AT0 indication/NN1 ,/PUN just/AV0 ",
K/KE/KE2.xml,KE2RE02S,039208,67,,A,47,2,--!,!/PUN ,
K/KE/KE2.xml,KE2RE02S,039208,68,,B,48,1,Yeah.,yeah/ITJ ./PUN ,
K/KE/KE2.xml,KE2RE02S,039208,69,,B,48,2,--,,
K/KE/KE2.xml,KE2RE02S,039208,70,,B,48,3,--He's shaking his head like mad.,he/PNP be/VBZ shake/VVG he/DPS head/NN1 like/PRP mad/AJ0 ./PUN ,
K/KE/KE2.xml,KE2RE02S,039208,71,,A,49,1,Yeah he didn't indicate.,yeah/ITJ he/PNP do/VDD not/XX0 indicate/VVI ./PUN ,
K/KE/KE2.xml,KE2RE02S,039208,72,,B,50,1,What was he supposed to be shaking his head for?,what/DTQ be/VBD he/PNP supposed/AJ0 to/TO0 be/VBI shake/VVG he/DPS head/NN1 for/PRP ?/PUN ,
K/KE/KE2.xml,KE2RE02S,039208,73,,A,51,1,Goodness only knows.,goodness/NN1 only/AV0 know/VVZ ./PUN ,
K/KE/KE2.xml,KE2RE02S,039208,74,,B,52,1,Cos I was shaking mine at him  <laugh> ,cos/CJS i/PNP be/VBD shake/VVG mine/PNP at/PRP he/PNP ,
K/KE/KE2.xml,KE2RE02S,039208,75,,A,53,1,"Oh, I see.","oh/ITJ ,/PUN i/PNP see/VVB ./PUN ",
K/KE/KE2.xml,KE2RE02S,039208,76,,B,54,1,perhaps,perhaps/AV0 ,
K/KE/KE2.xml,KE2RE02S,039208,77,,A,55,1,Well it was ridiculous!,well/AV0 it/PNP be/VBD ridiculous/AJ0 !/PUN ,
K/KE/KE2.xml,KE2RE02S,039208,78,,B,56,1,"It was, he didn't put on  (()) ","it/PNP be/VBD ,/PUN he/PNP do/VDD not/XX0 put/VVI on/AVP-PRP ",
K/KE/KE2.xml,KE2RE02S,039208,79,,A,57,1,There was no indication or anything.,there/EX0 be/VBD no/AT0 indication/NN1 or/CJC anything/PNI ./PUN ,
K/KE/KE2.xml,KE2RE02S,039208,80,,B,58,1,suddenly swept in there.,suddenly/AV0 sweep/VVN-VVD in/PRP there/AV0 ./PUN ,
K/KE/KE2.xml,KE2RE02S,039208,81,,B,58,2,--,,
K/KE/KE2.xml,KE2RE02S,039208,82,,B,58,3,"--(()) another bank there, talking about a clothes bank  (()) ","another/DT0 bank/NN1 there/AV0 ,/PUN talk/VVG about/PRP a/AT0 clothes/NN2 bank/NN1-VVB ",
K/KE/KE2.xml,KE2RE02S,039208,83,,A,59,1,"Oh that's right they've got, at the Cricketfield Lane erm car park there's a  --","oh/ITJ that/DT0 be/VBZ right/AJ0 they/PNP have/VHB get/VVN ,/PUN at/PRP the/AT0 cricketfield/NP0 lane/NP0 erm/UNC car/NN1 park/NN1 there/EX0 be/VBZ a/AT0 ",
K/KE/KE2.xml,KE2RE02S,039208,84,,A,59,2,"--where, you know where the bottle bank is on the ","where/AVQ ,/PUN you/PNP know/VVB where/AVQ the/AT0 bottle/NN1 bank/NN1 be/VBZ on/PRP the/AT0 ",
K/KE/KE2.xml,KE2RE02S,039208,85,,B,60,1,Yeah?,yeah/ITJ ?/PUN ,
K/KE/KE2.xml,KE2RE02S,039208,86,,A,61,1,they've got this clothing bank.,they/PNP have/VHB get/VVN this/DT0 clothing/NN1 bank/NN1 ./PUN ,
K/KE/KE2.xml,KE2RE02S,039208,87,,B,62,1,Oh.,oh/ITJ ./PUN ,
K/KE/KE2.xml,KE2RE02S,039208,88,,B,62,2,It did say something in that little magazine that came yesterday.,it/PNP do/VDD say/VVI something/PNI in/PRP that/DT0 little/AJ0 magazine/NN1 that/CJT come/VVD yesterday/AV0 ./PUN ,
K/KE/KE2.xml,KE2RE02S,039208,89,,A,63,1,Did it?,do/VDD it/PNP ?/PUN ,
K/KE/KE2.xml,KE2RE02S,039208,90,,A,63,2,Mm.,mm/ITJ ./PUN ,
K/KE/KE2.xml,KE2RE02S,039208,91,,B,64,1,Yes it did come to think of it.,yes/ITJ it/PNP do/VDD come/VVI to/TO0 think/VVI of/PRF it/PNP ./PUN ,
K/KE/KE2.xml,KE2RE02S,039208,92,,B,64,2,--,,
K/KE/KE2.xml,KE2RE02S,039208,93,,B,64,3,--So they're actually doing something about this   (()) --,so/AV0 they/PNP be/VBB actually/AV0 do/VDG something/PNI about/PRP this/DT0 ,
K/KE/KE2.xml,KE2RE02S,039208,94,,B,64,4,--looks almost as if they're putting steps in there.,look/VVZ almost/AV0 [as/PRP if/CJS]/CJS they/PNP be/VBB put/VVG step/NN2 in/PRP there/AV0 ./PUN ,
K/KE/KE2.xml,KE2RE02S,039208,95,,A,65,1,Did it?,do/VDD it/PNP ?/PUN ,
K/KE/KE2.xml,KE2RE02S,039208,96,,A,65,2,I didn't notice at all.,i/PNP do/VDD not/XX0 notice/VVI [at/PRP all/DT0]/AV0 ./PUN ,
K/KE/KE2.xml,KE2RE02S,039208,97,,B,66,1,See where that erm thing is there  --,see/VVB where/AVQ that/DT0 erm/UNC thing/NN1 be/VBZ there/EX0 ,
K/KE/KE2.xml,KE2RE02S,039208,98,,B,66,2,--oh there's a place there by the  (()) ,oh/ITJ there/EX0 be/VBZ a/AT0 place/NN1 there/AV0 by/PRP the/AT0 ,
K/KE/KE2.xml,KE2RE02S,039208,99,,A,67,1,Oh someone's going out here.,oh/ITJ someone/PNI be/VBZ go/VVG out/AVP here/AV0 ./PUN ,
K/KE/KE2.xml,KE2RE02S,039208,100,,B,68,1,Oh someone here look see.,oh/ITJ someone/PNI here/AV0 look/VVB see/VVB ./PUN ,
K/KE/KE2.xml,KE2RE02S,039208,101,,A,69,1,Oh is he going in there?,oh/ITJ be/VBZ he/PNP go/VVG in/PRP there/AV0 ?/PUN ,
K/KE/KE2.xml,KE2RE02S,039208,102,,A,69,2,Oh he's going in there.,oh/ITJ he/PNP be/VBZ go/VVG in/PRP there/AV0 ./PUN ,
K/KE/KE2.xml,KE2RE02S,039208,103,,B,70,1,It wasn't a big enough room there.,it/PNP be/VBD not/XX0 a/AT0 big/AJ0 enough/AV0 room/NN1 there/AV0 ./PUN ,
K/KE/KE2.xml,KE2RE02S,039208,104,,B,70,2,--,,
K/KE/KE2.xml,KE2RE02S,039208,105,,B,70,3,--Oh I see they're painting up there.,oh/ITJ i/PNP see/VVB they/PNP be/VBB paint/VVG up/AVP there/AV0 ./PUN ,
K/KE/KE2.xml,KE2RE02S,039208,106,,A,71,1,"You get out, I'll straighten up and come in.","you/PNP get/VVB out/AVP ,/PUN i/PNP will/VM0 straighten/VVI up/AVP and/CJC come/VVI in/AVP ./PUN ",
