swda_filename,ptb_basename,conversation_no,transcript_index,act_tag,caller,turn_index,subutterance_index,text,pos,trees
K/KE/KE2.xml,KE2RE02V,039302,0,,A,1,1,Yes the erm  --,yes/ITJ the/AT0 erm/UNC ,
K/KE/KE2.xml,KE2RE02V,039302,1,,A,1,2,--coffee is two lots of one eighty nine so that's three seventy  --,coffee/NN1 be/VBZ two/CRD lots/PNI of/PRF one/CRD eighty/CRD nine/CRD so/AV0 that/DT0 be/VBZ three/CRD seventy/CRD ,
K/KE/KE2.xml,KE2RE02V,039302,2,,A,1,3,--eight isn't it?,eight/CRD be/VBZ not/XX0 it/PNP ?/PUN ,
K/KE/KE2.xml,KE2RE02V,039302,3,,B,2,1,Mm.,mm/ITJ ./PUN ,
K/KE/KE2.xml,KE2RE02V,039302,4,,A,3,1,"Oh that's lovely,<reading> three years ago my sister died leaving a household of two men, my brother-in-law aged eighty and myself approaching retirement age to cope with ourselves, to cope for ourselves.","oh/ITJ that/DT0 be/VBZ lovely/AJ0 ,/PUN three/CRD year/NN2 ago/AV0 i/DPS sister/NN1 die/VVD leave/VVG a/AT0 household/NN1 of/PRF two/CRD man/NN2 ,/PUN i/DPS brother-in-law/NN1 aged/PRP eighty/CRD and/CJC myself/PNX approach/VVG-AJ0 retirement/NN1 age/NN1 to/TO0 cope/VVI with/PRP ourselves/PNX ,/PUN to/TO0 cope/VVI for/PRP ourselves/PNX ./PUN ",
K/KE/KE2.xml,KE2RE02V,039302,5,,A,3,2,--,,
K/KE/KE2.xml,KE2RE02V,039302,6,,A,3,3,--Er because neither of us could really manage in the kitchen it was not long before we became very tired of having to eat convenience food  --,er/UNC because/CJS neither/DT0 of/PRF we/PNP could/VM0 really/AV0 manage/VVI in/PRP the/AT0 kitchen/NN1 it/PNP be/VBD not/XX0 long/AV0 before/CJS we/PNP become/VVD very/AV0 tired/AJ0 of/PRF have/VHG to/TO0 eat/VVI convenience/NN1 food/NN1 ,
K/KE/KE2.xml,KE2RE02V,039302,7,,A,3,4,"--sad looking old meat pies, dried out chips and heated up frozen vegetables soon palled.","sad/AJ0 look/VVG old/AJ0 meat/NN1 pie/NN2 ,/PUN dry/VVD-VVN out/AVP chip/NN2 and/CJC heat/VVN up/AVP-PRP frozen/AJ0 vegetable/NN2 soon/AV0 pall/VVD-VVN ./PUN ",
K/KE/KE2.xml,KE2RE02V,039302,8,,A,3,5,I began to despair  --,i/PNP begin/VVD to/TO0 despair/VVI ,
K/KE/KE2.xml,KE2RE02V,039302,9,,A,3,6,"--in the local press I noticed an advert for an evening class, cookery for men  --","in/PRP the/AT0 local/AJ0 press/NN1-VVB i/PNP notice/VVD an/AT0 advert/NN1 for/PRP an/AT0 evening/NN1 class/NN1 ,/PUN cookery/NN1 for/PRP man/NN2 ",
K/KE/KE2.xml,KE2RE02V,039302,10,,A,3,7,"--being the young one in the family I plucked up courage and enrolled but it was great, with great apprehension that I went to the first class.","be/VBG the/AT0 young/AJ0 one/PNI in/PRP the/AT0 family/NN1 i/PNP pluck/VVD up/AVP-PRP courage/NN1 and/CJC enrol/VVD-VVN but/CJC it/PNP be/VBD great/AJ0 ,/PUN with/PRP great/AJ0 apprehension/NN1 that/CJT i/PNP go/VVD to/PRP the/AT0 first/ORD class/NN1 ./PUN ",
K/KE/KE2.xml,KE2RE02V,039302,11,,A,3,8,I needn't have worried.,i/PNP need/VM0 not/XX0 have/VHI worried/AJ0 ./PUN ,
K/KE/KE2.xml,KE2RE02V,039302,12,,A,3,9,"There were twenty of us, other chaps in much the same boat as me, Nancy our tutor was cheerful, down to earth and did not expect us to be cordon bleu cooks.","there/EX0 be/VBD twenty/CRD of/PRF we/PNP ,/PUN other/AJ0 chap/NN2 in/PRP-AVP much/AV0 the/AT0 same/DT0 boat/NN1 as/CJS i/PNP ,/PUN nancy/NP0 we/DPS tutor/NN1 be/VBD cheerful/AJ0 ,/PUN down/AVP to/PRP earth/NN1 and/CJC do/VDD not/XX0 expect/VVI we/PNP to/TO0 be/VBI [cordon/UNC bleu/UNC]/NN1 cook/NN2-VVZ ./PUN ",
K/KE/KE2.xml,KE2RE02V,039302,13,,A,3,10,That course changed my life.,that/DT0 course/NN1 change/VVD-VVN i/DPS life/NN1 ./PUN ,
K/KE/KE2.xml,KE2RE02V,039302,14,,A,3,11,"With a mixture of demonstrations, simple methods and constant humour, Nancy taught us to fend for ourselves.","with/PRP a/AT0 mixture/NN1 of/PRF demonstration/NN2 ,/PUN simple/AJ0 method/NN2 and/CJC constant/AJ0 humour/NN1 ,/PUN nancy/NP0 teach/VVD we/PNP to/TO0 fend/VVI for/PRP ourselves/PNX ./PUN ",
K/KE/KE2.xml,KE2RE02V,039302,15,,A,3,12,"I now have the confidence to tackle almost anything in the kitchen, pies, pastas, cakes, soups, meat dishes, vegetables and bread.","i/PNP now/AV0 have/VHB the/AT0 confidence/NN1 to/TO0 tackle/VVI almost/AV0 anything/PNI in/PRP the/AT0 kitchen/NN1 ,/PUN pie/NN2 ,/PUN pasta/NN2 ,/PUN cake/NN2 ,/PUN soup/NN2 ,/PUN meat/NN1 dish/NN2 ,/PUN vegetable/NN2 and/CJC bread/NN1 ./PUN ",
K/KE/KE2.xml,KE2RE02V,039302,16,,A,3,13,"There have been many disasters along the road, Yorkshire puddings you could sole your shoes with, burnt offerings of several varieties, a pat that even my dog wouldn't eat and last Christmas a chocolate log that disintegrated, the proud little Santa on top sinking without  <reading+laughing> trace in a sea of chocolate gunge.","there/EX0 have/VHB be/VBN many/DT0 disaster/NN2 along/PRP the/AT0 road/NN1 ,/PUN yorkshire/NP0 pudding/NN2 you/PNP could/VM0 sole/VVI you/DPS shoe/NN2 with/PRP ,/PUN burnt/AJ0-VVN offering/NN2 of/PRF several/DT0 variety/NN2 ,/PUN a/AT0 pat/NN1 that/CJT even/AV0 i/DPS dog/NN1 would/VM0 not/XX0 eat/VVI and/CJC last/VVI christmas/NN1 a/AT0 chocolate/NN1 log/NN1 that/CJT disintegrate/VVD ,/PUN the/AT0 proud/AJ0 little/AJ0 santa/NP0 on/PRP top/NN1 sink/VVG without/PRP trace/NN1 in/PRP a/AT0 sea/NN1 of/PRF chocolate/NN1 gunge/NN1 ./PUN ",
K/KE/KE2.xml,KE2RE02V,039302,17,,A,3,14,These setbacks however  <reading> were more than compensated for by the successes.,these/DT0 setback/NN2 however/AV0 be/VBD more/AV0 than/CJS compensate/VVN for/PRP by/PRP the/AT0 success/NN2 ./PUN ,
K/KE/KE2.xml,KE2RE02V,039302,18,,A,3,15,We still keep meat pies and vegetables in the freezer but only for emergencies and I'm in the third year of  <reading+laughing> the course now </reading+laughing> .,we/PNP still/AV0 keep/VVB meat/NN1 pie/NN2 and/CJC vegetable/NN2 in/PRP the/AT0 freezer/NN1 but/CJC only/AV0 for/PRP emergency/NN2 and/CJC i/PNP be/VBB in/PRP the/AT0 third/ORD year/NN1 of/PRF the/AT0 course/NN1 now/AV0 ./PUN ,
K/KE/KE2.xml,KE2RE02V,039302,19,,A,3,16,Oh that's lovely.,oh/ITJ that/DT0 be/VBZ lovely/AJ0 ./PUN ,
K/KE/KE2.xml,KE2RE02V,039302,20,,A,3,17,He got fifty pounds for writing that in as well.,he/PNP get/VVD fifty/CRD pound/NN2 for/PRP write/VVG that/DT0-CJT in/AVP-PRP [as/CJS well/AV0]/AV0 ./PUN ,
K/KE/KE2.xml,KE2RE02V,039302,21,,B,4,1,Did he really?,do/VDD he/PNP really/AV0 ?/PUN ,
K/KE/KE2.xml,KE2RE02V,039302,22,,B,4,2,<laughing> Yeah mm </laughing> ,yeah/ITJ mm/ITJ ,
