swda_filename,ptb_basename,conversation_no,transcript_index,act_tag,caller,turn_index,subutterance_index,text,pos,trees
K/KD/KDN.xml,KDNRE003,045504,0,,A,1,1,Have you tried under the bed Jean?,have/VHB you/PNP try/VVN under/PRP the/AT0 bed/NN1 jean/NP0 ?/PUN,
K/KD/KDN.xml,KDNRE003,045504,1,,B,2,1,What?,what/DTQ ?/PUN,
K/KD/KDN.xml,KDNRE003,045504,2,,A,3,1,But  Is it under the bed?,but/CJC be/VBZ it/PNP under/PRP the/AT0 bed/NN1 ?/PUN,
K/KD/KDN.xml,KDNRE003,045504,3,,B,4,1,No it's not.,no/ITJ it/PNP be/VBZ not/XX0 ./PUN,
K/KD/KDN.xml,KDNRE003,045504,4,,A,5,1,Well have you looked?,well/AV0 have/VHB you/PNP look/VVN-VVD ?/PUN,
K/KD/KDN.xml,KDNRE003,045504,5,,A,5,2,Where did you get that one?,where/AVQ do/VDD you/PNP get/VVI that/DT0 one/PNI ?/PUN,
K/KD/KDN.xml,KDNRE003,045504,6,,B,6,1,Beside the bed.,beside/PRP the/AT0 bed/NN1 ./PUN,
K/KD/KDN.xml,KDNRE003,045504,7,,A,7,1,<sigh> Well I put one on top of the bed!,well/AV0 i/PNP put/VVB one/PNI-CRD [on/PRP top/NN1 of/PRF]/PRP the/AT0 bed/NN1 !/PUN,
K/KD/KDN.xml,KDNRE003,045504,8,,A,7,2,But I don't know what I did with it.,but/CJC i/PNP do/VDB not/XX0 know/VVI what/DTQ i/PNP do/VDD with/PRP it/PNP ./PUN,
K/KD/KDN.xml,KDNRE003,045504,9,,A,7,3,Jean.,jean/NP0 ./PUN,
K/KD/KDN.xml,KDNRE003,045504,10,,B,8,1,What?,what/DTQ ?/PUN,
K/KD/KDN.xml,KDNRE003,045504,11,,A,9,1,I was talking about Paul there.,i/PNP be/VBD talk/VVG about/PRP paul/NP0 there/AV0 ./PUN,
K/KD/KDN.xml,KDNRE003,045504,12,,B,10,1,Why?,why/AVQ ?/PUN,
K/KD/KDN.xml,KDNRE003,045504,13,,A,11,1,He says  (()) last night and never took  (()) or anything.,he/PNP say/VVZ last/ORD night/NN1 and/CJC never/AV0 take/VVD or/CJC anything/PNI ./PUN,
K/KD/KDN.xml,KDNRE003,045504,14,,A,11,2,"<laugh> Well that's what I thought, but anyway!","well/AV0 that/DT0 be/VBZ what/DTQ i/PNP think/VVD ,/PUN but/CJC anyway/AV0 !/PUN",
K/KD/KDN.xml,KDNRE003,045504,15,,A,11,3,They're putting shorts on him!,they/PNP be/VBB put/VVG shorts/NN2 on/PRP he/PNP !/PUN,
K/KD/KDN.xml,KDNRE003,045504,16,,A,11,4,There's your slipper there for fu- <sigh> You finished in the bathroom?,there/EX0 be/VBZ you/DPS slipper/NN1 there/AV0 for/PRP fu/UNC you/PNP finish/VVD-VVN in/PRP the/AT0 bathroom/NN1 ?/PUN,
K/KD/KDN.xml,KDNRE003,045504,17,,A,11,5,I need a  dump.,i/PNP need/VVB a/AT0 dump/NN1 ./PUN,
K/KD/KDN.xml,KDNRE003,045504,18,,B,12,1,"Well  (()) won't no more, so no problem.","well/AV0 will/VM0 not/XX0 no/AT0 more/DT0 ,/PUN so/AV0 no/AT0 problem/NN1 ./PUN",
K/KD/KDN.xml,KDNRE003,045504,19,,A,13,1,Ha!,ha/ITJ !/PUN,
K/KD/KDN.xml,KDNRE003,045504,20,,A,13,2,That's one thing running at your own speed!,that/DT0 be/VBZ one/CRD thing/NN1 run/VVG-NN1 at/PRP you/DPS own/DT0 speed/NN1 !/PUN,
K/KD/KDN.xml,KDNRE003,045504,21,,A,13,3,Ah Jean!,ah/ITJ jean/NP0 !/PUN,
K/KD/KDN.xml,KDNRE003,045504,22,,A,13,4,"I was reading in a book the other day that if you get a  bicarbonate of sodas, that's baking soda.","i/PNP be/VBD read/VVG in/PRP a/AT0 book/NN1 the/AT0 other/AJ0 day/NN1 that/CJT if/CJS you/PNP get/VVB a/AT0 bicarbonate/NN1 of/PRF soda/NN2 ,/PUN that/DT0 be/VBZ bake/VVG-AJ0 soda/NN1 ./PUN",
K/KD/KDN.xml,KDNRE003,045504,23,,B,14,1,Thanks.,thanks/NN2 ./PUN,
K/KD/KDN.xml,KDNRE003,045504,24,,A,15,1,"And it takes the stains out of no, can it not get paint stains?","and/CJC it/PNP take/VVZ the/AT0 stain/NN2 [out/AVP of/PRF]/PRP no/ITJ ,/PUN can/VM0 it/PNP not/XX0 get/VVI paint/NN1-VVB stain/NN2 ?/PUN",
K/KD/KDN.xml,KDNRE003,045504,25,,A,15,2,"Right, where's this morning's paper and I go to the bogs?","right/AV0 ,/PUN where/AVQ be/VBZ this/DT0 morning/NN1 's/POS paper/NN1 and/CJC i/PNP go/VVB to/PRP the/AT0 bog/NN2 ?/PUN",
K/KD/KDN.xml,KDNRE003,045504,26,,A,15,3,I shouldn't be here  I should be away on the bus.,i/PNP should/VM0 not/XX0 be/VBI here/AV0 i/PNP should/VM0 be/VBI away/AV0 on/PRP the/AT0 bus/NN1 ./PUN,
K/KD/KDN.xml,KDNRE003,045504,27,,A,15,4,Oh God!,oh/ITJ god/NP0 !/PUN,
K/KD/KDN.xml,KDNRE003,045504,28,,A,15,5,Oh!,oh/ITJ !/PUN,
K/KD/KDN.xml,KDNRE003,045504,29,,B,16,1,(()) then?,then/AV0 ?/PUN,
K/KD/KDN.xml,KDNRE003,045504,30,,A,17,1,Ah  no Heather  I'll throw them down there  you'll have to get lighted the fire   (()) try   (()) and some  right  (()) .,ah/ITJ no/ITJ heather/NP0 i/PNP will/VM0 throw/VVI they/PNP down/AVP there/AV0 you/PNP will/VM0 have/VHI to/TO0 get/VVI light/VVN the/AT0 fire/NN1 try/NN1-VVB and/CJC some/DT0 right/AJ0 ./PUN,
