swda_filename,ptb_basename,conversation_no,transcript_index,act_tag,caller,turn_index,subutterance_index,text,pos,trees
K/KD/KDN.xml,KDNRE02E,046204,0,,A,1,1,Now Raymond come on to bed son.,now/AV0 raymond/NP0 come/VVB [on/AVP to/PRP]/PRP bed/NN1 son/NN1 ./PUN,
K/KD/KDN.xml,KDNRE02E,046204,1,,B,2,1,What's wrong Jean?,what/DTQ be/VBZ wrong/AJ0 jean/NP0 ?/PUN,
K/KD/KDN.xml,KDNRE02E,046204,2,,A,3,1,(()) ,,
K/KD/KDN.xml,KDNRE02E,046204,3,,A,3,2,,,
K/KD/KDN.xml,KDNRE02E,046204,4,,B,4,1,Right we'll go to bed.,right/AV0 we/PNP will/VM0 go/VVI to/PRP bed/NN1 ./PUN,
