swda_filename,ptb_basename,conversation_no,transcript_index,act_tag,caller,turn_index,subutterance_index,text,pos,trees
K/KB/KBB.xml,KBBRE00C,049205,0,,A,1,1,That's going.,that/DT0 be/VBZ go/VVG ./PUN,
K/KB/KBB.xml,KBBRE00C,049205,1,,B,2,1,Oh mhm.,oh/ITJ mhm/ITJ ./PUN,
K/KB/KBB.xml,KBBRE00C,049205,2,,A,3,1,We seem to have er,we/PNP seem/VVB to/TO0 have/VHI er/UNC,
K/KB/KBB.xml,KBBRE00C,049205,3,,B,4,1,Seems to have (()),seem/VVZ to/TO0 have/VHI,
K/KB/KBB.xml,KBBRE00C,049205,4,,A,5,1,That bit.,that/DT0 bit/NN1 ./PUN,
K/KB/KBB.xml,KBBRE00C,049205,5,,B,6,1,What will you be doing today then?,what/DTQ will/VM0 you/PNP be/VBI do/VDG today/AV0 then/AV0 ?/PUN,
K/KB/KBB.xml,KBBRE00C,049205,6,,A,7,1,Well as it's foggy I don't think we can go out.,well/AV0 as/CJS it/PNP be/VBZ foggy/AJ0 i/PNP do/VDB not/XX0 think/VVI we/PNP can/VM0 go/VVI out/AVP ./PUN,
K/KB/KBB.xml,KBBRE00C,049205,7,,B,8,1,No.,no/ITJ ./PUN,
K/KB/KBB.xml,KBBRE00C,049205,8,,A,9,1,It's a pity we didn't go yesterday  (()),it/PNP be/VBZ a/AT0 pity/NN1 we/PNP do/VDD not/XX0 go/VVI yesterday/AV0,
K/KB/KBB.xml,KBBRE00C,049205,9,,B,10,1,"Course we was gonna show Tom and Madge the, that er  aerial view of the house.","course/AV0 we/PNP be/VBD gon/VVG na/TO0 show/VVI tom/NP0 and/CJC madge/NP0 the/AT0 ,/PUN that/DT0 er/UNC aerial/AJ0 view/NN1 of/PRF the/AT0 house/NN1 ./PUN",
K/KB/KBB.xml,KBBRE00C,049205,10,,A,11,1,Oh well we've got plenty of time for that.,oh/ITJ well/AV0 we/PNP have/VHB get/VVN plenty/PNI of/PRF time/NN1 for/PRP that/DT0 ./PUN,
K/KB/KBB.xml,KBBRE00C,049205,11,,B,12,1,"Time for that, mm, besides it, there might be a lot of salt about.","time/NN1 for/PRP that/DT0 ,/PUN mm/ITJ ,/PUN besides/AV0 it/PNP ,/PUN there/EX0 might/VM0 be/VBI a/AT0 lot/NN1 of/PRF salt/NN1 about/PRP-AVP ./PUN",
K/KB/KBB.xml,KBBRE00C,049205,12,,A,13,1,Ooh you get obsessed with salt you do.,ooh/ITJ you/PNP get/VVB obsessed/AJ0 with/PRP salt/NN1 you/PNP do/VDB ./PUN,
K/KB/KBB.xml,KBBRE00C,049205,13,,B,14,1,"Well it's not that,i- it's so they  they like to get rid of it for the summer and i- if there's a  sign of a bit of frost out they all come, shoving it onto the road and rotting everybody's cars.","well/AV0 it/PNP be/VBZ not/XX0 that/DT0-CJT ,/PUN i/UNC it/PNP be/VBZ so/AV0 they/PNP they/PNP like/VVB to/TO0 get/VVI rid/VVN of/PRF it/PNP for/PRP the/AT0 summer/NN1 and/CJC i/UNC if/CJS there/EX0 be/VBZ a/AT0 sign/NN1 of/PRF a/AT0 bit/NN1 of/PRF frost/NN1 out/AVP they/PNP all/DT0 come/VVB ,/PUN shove/VVG it/PNP onto/PRP the/AT0 road/NN1 and/CJC rotting/AJ0-VVG everybody/PNI 's/POS car/NN2 ./PUN",
K/KB/KBB.xml,KBBRE00C,049205,14,,A,15,1,Has it froze the water to- last night?,have/VHZ it/PNP freeze/VVD the/AT0 water/NN1 to/UNC last/ORD night/NN1 ?/PUN,
K/KB/KBB.xml,KBBRE00C,049205,15,,B,16,1,No it's s- spitting with rain.,no/ITJ it/PNP be/VBZ s/UNC spit/VVG with/PRP rain/NN1 ./PUN,
K/KB/KBB.xml,KBBRE00C,049205,16,,A,17,1,Is it?,be/VBZ it/PNP ?/PUN,
K/KB/KBB.xml,KBBRE00C,049205,17,,A,17,2,Mm.,mm/ITJ ./PUN,
K/KB/KBB.xml,KBBRE00C,049205,18,,B,18,1,"Just like, well more like fog really.","just/AV0 like/AV0 ,/PUN well/AV0 more/AV0 like/PRP fog/NN1 really/AV0 ./PUN",
K/KB/KBB.xml,KBBRE00C,049205,19,,A,19,1,"Well do you know what, I forgot to take the chicken out of the fridge last night so  we can't have dinner so","well/AV0 do/VDB you/PNP know/VVI what/DTQ ,/PUN i/PNP forget/VVD to/TO0 take/VVI the/AT0 chicken/NN1 [out/AVP of/PRF]/PRP the/AT0 fridge/NN1 last/ORD night/NN1 so/CJS we/PNP can/VM0 not/XX0 have/VHI dinner/NN1 so/AV0",
K/KB/KBB.xml,KBBRE00C,049205,20,,B,20,1,Oh dear.,oh/ITJ dear/ITJ ./PUN,
K/KB/KBB.xml,KBBRE00C,049205,21,,A,21,1,too early.,too/AV0 early/AJ0-AV0 ./PUN,
K/KB/KBB.xml,KBBRE00C,049205,22,,B,22,1,"Put it in the stove, that'll thaw it.","put/VVB it/PNP in/PRP the/AT0 stove/NN1 ,/PUN that/DT0 will/VM0 thaw/VVI it/PNP ./PUN",
K/KB/KBB.xml,KBBRE00C,049205,23,,A,23,1,"<laughing> Don't be silly  </laughing> it is thaw- nearly thawed anyway, it won't, I'll do it right away I've just remembered.","do/VDB not/XX0 be/VBI silly/AJ0 it/PNP be/VBZ thaw/UNC nearly/AV0 thaw/VVN anyway/AV0 ,/PUN it/PNP will/VM0 not/XX0 ,/PUN i/PNP will/VM0 do/VDI it/PNP right/AV0-AJ0 away/AV0 i/PNP have/VHB just/AV0 remember/VVN ./PUN",
K/KB/KBB.xml,KBBRE00C,049205,24,,B,24,1,Well must we have chicken?,well/AV0 must/VM0 we/PNP have/VHI chicken/NN1 ?/PUN,
K/KB/KBB.xml,KBBRE00C,049205,25,,A,25,1,"Yes I haven't got anything else except t- tins, and you don't want tins on a Sunday do you?","yes/ITJ i/PNP have/VHB not/XX0 get/VVN anything/PNI else/AV0 except/PRP-CJS t/UNC tin/NN2 ,/PUN and/CJC you/PNP do/VDB not/XX0 want/VVI tin/NN2 on/PRP a/AT0 sunday/NP0 do/VDB you/PNP ?/PUN",
K/KB/KBB.xml,KBBRE00C,049205,26,,B,26,1,Best bread and dripping.,good/AJS bread/NN1 and/CJC drip/VVG ./PUN,
K/KB/KBB.xml,KBBRE00C,049205,27,,A,27,1,<laughing> Ooh ooh where's  </laughing> the dripping coming from?,ooh/ITJ ooh/ITJ where/AVQ be/VBZ the/AT0 dripping/NN1-AJ0 come/VVG from/PRP ?/PUN,
K/KB/KBB.xml,KBBRE00C,049205,28,,B,28,1,The butchers.,the/AT0 butchers/NN0 ./PUN,
K/KB/KBB.xml,KBBRE00C,049205,29,,B,28,2,Yeah I used to like their pork er dripping.,yeah/ITJ i/PNP used/VM0 to/TO0 like/AV0 they/DPS pork/NN1 er/UNC drip/VVG-NN1 ./PUN,
K/KB/KBB.xml,KBBRE00C,049205,30,,B,28,3,I used to like Cocklin's pork dripping  (()),i/PNP used/VM0 to/TO0 like/AV0 cocklin/NP0 's/POS pork/NN1 drip/VVG-NN1,
K/KB/KBB.xml,KBBRE00C,049205,31,,A,29,1,N- not for breakfast.,n/UNC not/XX0 for/PRP breakfast/NN1 ./PUN,
K/KB/KBB.xml,KBBRE00C,049205,32,,A,29,2,Anyway what are you going to have?,anyway/AV0 what/DTQ be/VBB you/PNP go/VVG to/TO0 have/VHI ?/PUN,
K/KB/KBB.xml,KBBRE00C,049205,33,,B,30,1,Burnt chicken,burnt/AJ0-VVN chicken/NN1,
K/KB/KBB.xml,KBBRE00C,049205,34,,A,31,1,(()) no I'm talking now,no/ITJ i/PNP be/VBB talk/VVG now/AV0,
K/KB/KBB.xml,KBBRE00C,049205,35,,B,32,1,chicken fricassee,chicken/NN1-VVB fricassee/NN1,
K/KB/KBB.xml,KBBRE00C,049205,36,,A,33,1,"I'm not talking, that's silly.","i/PNP be/VBB not/XX0 talk/VVG ,/PUN that/DT0 be/VBZ silly/AJ0 ./PUN",
K/KB/KBB.xml,KBBRE00C,049205,37,,B,34,1,er lightly done kippers on one side.,er/UNC lightly/AV0 do/VDN kipper/NN2 on/PRP one/CRD side/NN1 ./PUN,
K/KB/KBB.xml,KBBRE00C,049205,38,,A,35,1,Ooh.,ooh/ITJ ./PUN,
K/KB/KBB.xml,KBBRE00C,049205,39,,A,35,2,"Now, boiled or poached or (()) ?","now/AV0 ,/PUN boiled/AJ0-VVN or/CJC poach/VVD-VVN or/CJC ?/PUN",
K/KB/KBB.xml,KBBRE00C,049205,40,,B,36,1,Boiled will do.,boiled/AJ0-VVN will/VM0 do/VDI ./PUN,
K/KB/KBB.xml,KBBRE00C,049205,41,,A,37,1,I think er Tom and Jackie were alright last night weren't they?,i/PNP think/VVB er/UNC tom/NP0 and/CJC jackie/NP0 be/VBD alright/AJ0 last/ORD night/NN1 be/VBD not/XX0 they/PNP ?/PUN,
K/KB/KBB.xml,KBBRE00C,049205,42,,B,38,1,"What, do you mean (()) ?","what/DTQ ,/PUN do/VDB you/PNP mean/VVI ?/PUN",
K/KB/KBB.xml,KBBRE00C,049205,43,,A,39,1,"Yes, I think so.","yes/ITJ ,/PUN i/PNP think/VVB so/AV0 ./PUN",
K/KB/KBB.xml,KBBRE00C,049205,44,,A,39,2,They didn't seem to object.,they/PNP do/VDD not/XX0 seem/VVI to/TO0 object/VVI ./PUN,
K/KB/KBB.xml,KBBRE00C,049205,45,,B,40,1,No.,no/ITJ ./PUN,
K/KB/KBB.xml,KBBRE00C,049205,46,,A,41,1,<cough> Did you (()) ?,do/VDD you/PNP ?/PUN,
K/KB/KBB.xml,KBBRE00C,049205,47,,B,42,1,We could have a banana souffle (()),we/PNP could/VM0 have/VHI a/AT0 banana/NN1 souffle/NN1,
K/KB/KBB.xml,KBBRE00C,049205,48,,A,43,1,"Well we, we couldn't, don't be silly.","well/AV0 we/PNP ,/PUN we/PNP could/VM0 not/XX0 ,/PUN do/VDB not/XX0 be/VBI silly/AJ0 ./PUN",
K/KB/KBB.xml,KBBRE00C,049205,49,,A,43,2,No I said what are you going to do t- this morning?,no/ITJ i/PNP say/VVD what/DTQ be/VBB you/PNP go/VVG to/TO0 do/VDI t/UNC this/DT0 morning/NN1 ?/PUN,
K/KB/KBB.xml,KBBRE00C,049205,50,,B,44,1,(()) ,,
K/KB/KBB.xml,KBBRE00C,049205,51,,A,45,1,Are you going to do some more t- put some more snaps in the album?,be/VBB you/PNP go/VVG to/TO0 do/VDI some/DT0 more/DT0 t/UNC put/VVB some/DT0 more/DT0 snap/NN2 in/PRP the/AT0 album/NN1 ?/PUN,
K/KB/KBB.xml,KBBRE00C,049205,52,,B,46,1,"Well it depends on you, if you're not going out it's","well/AV0 it/PNP depend/VVZ on/PRP you/PNP ,/PUN if/CJS you/PNP be/VBB not/XX0 go/VVG out/AVP-PRP it/PNP be/VBZ",
K/KB/KBB.xml,KBBRE00C,049205,53,,A,47,1,"We ca- we can't go out in this weather, this frost.","we/PNP ca/UNC we/PNP can/VM0 not/XX0 go/VVI out/AVP in/PRP this/DT0 weather/NN1 ,/PUN this/DT0 frost/NN1 ./PUN",
K/KB/KBB.xml,KBBRE00C,049205,54,,A,47,2,Fog I mean.,fog/NN1-VVB i/PNP mean/VVB ./PUN,
K/KB/KBB.xml,KBBRE00C,049205,55,,B,48,1,There's er one of the pigeons  (()) I shall have to go and put some seed down.,there/EX0 be/VBZ er/UNC one/CRD of/PRF the/AT0 pigeon/NN2 i/PNP shall/VM0 have/VHI to/TO0 go/VVI and/CJC put/VVI some/DT0 seed/NN1 down/AVP ./PUN,
K/KB/KBB.xml,KBBRE00C,049205,56,,A,49,1,Well you'd better go and feed them then.,well/AV0 you/PNP have/VHD well/AV0 go/VVI and/CJC feed/VVI they/PNP then/AV0 ./PUN,
