swda_filename,ptb_basename,conversation_no,transcript_index,act_tag,caller,turn_index,subutterance_index,text,pos,trees
K/KB/KBX.xml,KBXRE007,058703,0,,A,1,1,There could be no doubt in the mind of John that Jesus had been sent by God.,there/EX0 could/VM0 be/VBI no/AT0 doubt/NN1 in/PRP the/AT0 mind/NN1 of/PRF john/NP0 that/CJT jesus/NP0 have/VHD be/VBN send/VVN by/PRP god/NP0 ./PUN,
K/KB/KBX.xml,KBXRE007,058703,1,,A,1,2,So what happened when Jesus was thirty years old?,so/AV0 what/DTQ happen/VVD when/CJS jesus/NP0 be/VBD thirty/CRD year/NN2 old/AJ0 ?/PUN,
K/KB/KBX.xml,KBXRE007,058703,2,,A,1,3,"Erm  he erm, he ha- he went to John the Baptist to baptize, to ask him to be baptized","erm/UNC he/PNP erm/UNC ,/PUN he/PNP ha/UNC he/PNP go/VVD to/PRP john/NP0 the/AT0 baptist/NN1 to/TO0 baptize/VVI ,/PUN to/TO0 ask/VVI he/PNP to/TO0 be/VBI baptize/VVN-AJ0",
K/KB/KBX.xml,KBXRE007,058703,3,,A,1,4,"Yeah that's right, very good, so nine,<reading> by pouring out this holy spirit and Jesus, Jehovah was er knighting him or appointing him to be the king of this coming kingdom, thing thus have anointed with the spirit, Jesus became the Messiah </reading> , which words in the Hebrew and Greek languages mean appoint, a anointed, therefore he became in fact Jesus Christ or Jesus the United, so, so it was Apostle Peter spoke of Jesus who was from Nazareth, Nazareth, how about anointed them, but all the spirit and power, also by his baptism and water, Jesus was presenting himself to God, to carry out the work that God had sent him to earth to do, what was that important work?","yeah/ITJ that/DT0 be/VBZ right/AJ0 ,/PUN very/AV0 good/AJ0 ,/PUN so/AV0 nine/CRD ,/PUN by/PRP pour/VVG out/AVP this/DT0 holy/AJ0 spirit/NN1 and/CJC jesus/NP0 ,/PUN jehovah/NP0 be/VBD er/UNC knight/VVG he/PNP or/CJC appoint/VVG he/PNP to/TO0 be/VBI the/AT0 king/NN1 of/PRF this/DT0 coming/AJ0-NN1 kingdom/NN1 ,/PUN thing/NN1 thus/AV0 have/VHB anoint/VVN with/PRP the/AT0 spirit/NN1 ,/PUN jesus/NP0 become/VVD the/AT0 messiah/NN1 ,/PUN which/DTQ word/NN2 in/PRP the/AT0 hebrew/NN1 and/CJC greek/AJ0-NN1 language/NN2 mean/VVB appoint/VVB ,/PUN a/AT0 anointed/AJ0 ,/PUN therefore/AV0 he/PNP become/VVD in/PRP fact/NN1 jesus/NP0 christ/NP0 or/CJC jesus/NP0 the/AT0 united/AJ0 ,/PUN so/AV0 ,/PUN so/AV0 it/PNP be/VBD apostle/NN1 peter/NP0 speak/VVD of/PRF jesus/NP0 who/PNQ be/VBD from/PRP nazareth/NP0 ,/PUN nazareth/NP0 ,/PUN how/AVQ about/PRP-AVP anoint/VVD they/PNP ,/PUN but/CJC all/DT0 the/AT0 spirit/NN1 and/CJC power/NN1 ,/PUN also/AV0 by/PRP he/DPS baptism/NN1 and/CJC water/NN1 ,/PUN jesus/NP0 be/VBD present/VVG himself/PNX to/PRP god/NP0 ,/PUN to/TO0 carry/VVI out/AVP-PRP the/AT0 work/NN1 that/CJT god/NP0 have/VHD send/VVN he/PNP to/PRP earth/NN1 to/TO0 do/VDI ,/PUN what/DTQ be/VBD that/DT0 important/AJ0 work/NN1 ?/PUN",
K/KB/KBX.xml,KBXRE007,058703,4,,A,1,5,So mine asks when did Jesus in fact become Christ?,so/AV0 mine/PNP ask/VVZ when/AVQ do/VDD jesus/NP0 in/PRP fact/NN1 become/VVB christ/NP0 ?/PUN,
K/KB/KBX.xml,KBXRE007,058703,5,,A,1,6,And why then?,and/CJC why/AVQ then/AV0 ?/PUN,
K/KB/KBX.xml,KBXRE007,058703,6,,A,1,7,"Er, when he was baptized","er/UNC ,/PUN when/CJS he/PNP be/VBD baptize/VVN-AJ0",
K/KB/KBX.xml,KBXRE007,058703,7,,A,1,8,And Peter says by his baptism what was Jesus presented himself to do?,and/CJC peter/NP0 say/VVZ by/PRP he/DPS baptism/NN1 what/DTQ be/VBD jesus/NP0 present/VVD himself/PNX to/TO0 do/VDI ?/PUN,
K/KB/KBX.xml,KBXRE007,058703,8,,A,1,9,"To do er  God's will, erm","to/TO0 do/VDI er/UNC god/NP0 's/POS will/NN1 ,/PUN erm/UNC",
K/KB/KBX.xml,KBXRE007,058703,9,,A,1,10,Yeah,yeah/ITJ,
K/KB/KBX.xml,KBXRE007,058703,10,,A,1,11,"with read it here, hmm","with/PRP read/VVD it/PNP here/AV0 ,/PUN hmm/ITJ",
K/KB/KBX.xml,KBXRE007,058703,11,,A,1,12,That's right as you say,that/DT0 be/VBZ right/AJ0 as/CJS you/PNP say/VVB,
K/KB/KBX.xml,KBXRE007,058703,12,,A,1,13,Yeah,yeah/ITJ,
K/KB/KBX.xml,KBXRE007,058703,13,,A,1,14,"So  <clears throat> when a person gets baptized then, what, what, they're dedicating themselves to do God's will aren't they?","so/AV0 when/CJS a/AT0 person/NN1 get/VVZ baptized/AJ0-VVN then/AV0 ,/PUN what/DTQ ,/PUN what/DTQ ,/PUN they/PNP be/VBB dedicate/VVG themselves/PNX to/TO0 do/VDI god/NP0 's/POS will/NN1 be/VBB not/XX0 they/PNP ?/PUN",
K/KB/KBX.xml,KBXRE007,058703,14,,A,1,15,"Yes, to carry out God's work, yes","yes/ITJ ,/PUN to/TO0 carry/VVI out/AVP god/NP0 's/POS work/NN1 ,/PUN yes/ITJ",
K/KB/KBX.xml,KBXRE007,058703,15,,A,1,16,"Were you, have, have you been baptized?","be/VBD you/PNP ,/PUN have/VHB ,/PUN have/VHB you/PNP be/VBN baptize/VVN-AJ0 ?/PUN",
K/KB/KBX.xml,KBXRE007,058703,16,,A,1,17,No,no/ITJ,
K/KB/KBX.xml,KBXRE007,058703,17,,A,1,18,When you was a baby?,when/CJS you/PNP be/VBD a/AT0 baby/NN1 ?/PUN,
K/KB/KBX.xml,KBXRE007,058703,18,,A,1,19,"Oh when I was a baby yes of course, yes","oh/ITJ when/CJS i/PNP be/VBD a/AT0 baby/NN1 yes/ITJ [of/PRF course/NN1]/AV0 ,/PUN yes/ITJ",
K/KB/KBX.xml,KBXRE007,058703,19,,A,1,20,So when you were a little baby  <clears throat> did you dedicate yourself to do God's will then?,so/AV0 when/CJS you/PNP be/VBD a/AT0 little/AJ0 baby/NN1 do/VDD you/PNP dedicate/VVI yourself/PNX to/TO0 do/VDI god/NP0 's/POS will/NN1 then/AV0 ?/PUN,
K/KB/KBX.xml,KBXRE007,058703,20,,A,1,21,No you're not capable are you?,no/ITJ you/PNP be/VBB not/XX0 capable/AJ0 be/VBB you/PNP ?/PUN,
K/KB/KBX.xml,KBXRE007,058703,21,,A,1,22,No,no/ITJ,
K/KB/KBX.xml,KBXRE007,058703,22,,A,1,23,Er,er/UNC,
K/KB/KBX.xml,KBXRE007,058703,23,,A,1,24,<clears throat> So just for us you don't even know what God's will is do you?,so/AV0 just/AV0 for/PRP we/PNP you/PNP do/VDB not/XX0 even/AV0 know/VVI what/DTQ god/NP0 's/POS will/NN1 be/VBZ do/VDB you/PNP ?/PUN,
K/KB/KBX.xml,KBXRE007,058703,24,,A,1,25,When,when/CJS-AVQ,
K/KB/KBX.xml,KBXRE007,058703,25,,A,1,26,No er,no/ITJ er/UNC,
K/KB/KBX.xml,KBXRE007,058703,26,,A,1,27,you're a baby,you/PNP be/VBB a/AT0 baby/NN1,
K/KB/KBX.xml,KBXRE007,058703,27,,A,1,28,That's right,that/DT0 be/VBZ right/AJ0,
K/KB/KBX.xml,KBXRE007,058703,28,,A,1,29,and er,and/CJC er/UNC,
K/KB/KBX.xml,KBXRE007,058703,29,,A,1,30,"There's something as well, er, er in baptism isn't there really?","there/EX0 be/VBZ something/PNI [as/CJS well/AV0]/AV0 ,/PUN er/UNC ,/PUN er/UNC in/PRP baptism/NN1 be/VBZ not/XX0 there/AV0 really/AV0 ?/PUN",
K/KB/KBX.xml,KBXRE007,058703,30,,A,1,31,"Godparents, these state that you should keep them on the straight and narrow","godparent/NN2 ,/PUN these/DT0 state/VVB that/CJT you/PNP should/VM0 keep/VVI they/PNP on/PRP-AVP the/AT0 straight/AJ0 and/CJC narrow/AJ0",
K/KB/KBX.xml,KBXRE007,058703,31,,A,1,32,<laugh> ,,
K/KB/KBX.xml,KBXRE007,058703,32,,A,1,33,I mean you can't guarantee that,i/PNP mean/VVB you/PNP can/VM0 not/XX0 guarantee/VVI that/DT0,
K/KB/KBX.xml,KBXRE007,058703,33,,A,1,34,No,no/ITJ,
K/KB/KBX.xml,KBXRE007,058703,34,,A,1,35,can they?,can/VM0 they/PNP ?/PUN,
K/KB/KBX.xml,KBXRE007,058703,35,,A,1,36,and then again  did Jesus have godparents?,and/CJC then/AV0 again/AV0 do/VDD jesus/NP0 have/VHI godparent/NN2 ?/PUN,
K/KB/KBX.xml,KBXRE007,058703,36,,A,1,37,No,no/ITJ,
K/KB/KBX.xml,KBXRE007,058703,37,,A,1,38,"No, I mean if the parents can't keep children under straight and narrow","no/ITJ ,/PUN i/PNP mean/VVB if/CJS the/AT0 parent/NN2 can/VM0 not/XX0 keep/VVI child/NN2 under/PRP straight/AJ0 and/CJC narrow/AJ0",
K/KB/KBX.xml,KBXRE007,058703,38,,A,1,39,"That's right, yeah","that/DT0 be/VBZ right/AJ0 ,/PUN yeah/ITJ",
K/KB/KBX.xml,KBXRE007,058703,39,,A,1,40,"and don't and particularly these days they don't go, seem to have all that much interest in doing so do they?","and/CJC do/VDB not/XX0 and/CJC particularly/AV0 these/DT0 day/NN2 they/PNP do/VDB not/XX0 go/VVI ,/PUN seem/VVB to/TO0 have/VHI all/DT0 that/AV0 much/DT0 interest/NN1 in/PRP do/VDG so/AV0 do/VDB they/PNP ?/PUN",
K/KB/KBX.xml,KBXRE007,058703,40,,A,1,41,"No no, not at all","no/ITJ no/ITJ ,/PUN not/XX0 [at/PRP all/DT0]/AV0",
K/KB/KBX.xml,KBXRE007,058703,41,,A,1,42,"So grandparents are probably even less interested, you know","so/AV0 grandparent/NN2 be/VBB probably/AV0 even/AV0 less/AV0 interested/AJ0 ,/PUN you/PNP know/VVB",
K/KB/KBX.xml,KBXRE007,058703,42,,A,1,43,Yeah,yeah/ITJ,
K/KB/KBX.xml,KBXRE007,058703,43,,A,1,44,so,so/AV0,
K/KB/KBX.xml,KBXRE007,058703,44,,A,1,45,"All the same as in my case, I mean  <laugh> I erm, er my aunt, my aunt travelled to, to","all/DT0 the/AT0 same/DT0 as/CJS in/PRP i/DPS case/NN1 ,/PUN i/PNP mean/VVB i/PNP erm/UNC ,/PUN er/UNC i/DPS aunt/NN1 ,/PUN i/DPS aunt/NN1 travel/VVD-VVN to/PRP ,/PUN to/PRP",
K/KB/KBX.xml,KBXRE007,058703,45,,B,2,1,(()) ,,
K/KB/KBX.xml,KBXRE007,058703,46,,A,3,1,"like to look after my mother, er she was one, and she died now erm she died two years ago, I think she was one of the first to go and er, the other one they fetched him out of the street the chap  then they corresponded with him up to the war  <laugh> but, but after that, they, I don't know whether they stopped writing because of the war, I don't know, but they never, never got in touch with them never again so","like/AV0 to/TO0 look/VVI after/PRP i/DPS mother/NN1 ,/PUN er/UNC she/PNP be/VBD one/CRD-PNI ,/PUN and/CJC she/PNP die/VVD now/AV0 erm/UNC she/PNP die/VVD two/CRD year/NN2 ago/AV0 ,/PUN i/PNP think/VVB she/PNP be/VBD one/CRD of/PRF the/AT0 first/ORD to/TO0 go/VVI and/CJC er/UNC ,/PUN the/AT0 other/AJ0 one/PNI they/PNP fetch/VVD he/PNP [out/AVP of/PRF]/PRP the/AT0 street/NN1 the/AT0 chap/NN1 then/AV0 they/PNP correspond/VVD with/PRP he/PNP [up/AVP to/PRP]/PRP the/AT0 war/NN1 but/CJC ,/PUN but/CJC after/PRP that/DT0 ,/PUN they/PNP ,/PUN i/PNP do/VDB not/XX0 know/VVI whether/CJS they/PNP stop/VVD write/VVG [because/CJS of/PRF]/PRP the/AT0 war/NN1 ,/PUN i/PNP do/VDB not/XX0 know/VVI ,/PUN but/CJC they/PNP never/AV0 ,/PUN never/AV0 get/VVD [in/PRP touch/NN1 with/PRP]/PRP they/PNP never/AV0 again/AV0 so/AV0",
K/KB/KBX.xml,KBXRE007,058703,47,,A,3,2,So that's when you were born?,so/AV0 that/DT0 be/VBZ when/AVQ-CJS you/PNP be/VBD bear/VVN ?/PUN,
K/KB/KBX.xml,KBXRE007,058703,48,,A,3,3,"Yes when, when I was baptized","yes/ITJ when/CJS ,/PUN when/CJS i/PNP be/VBD baptize/VVN-AJ0",
K/KB/KBX.xml,KBXRE007,058703,49,,A,3,4,How old where you when you were baptized?,how/AVQ old/AJ0 where/CJS you/PNP when/CJS you/PNP be/VBD baptize/VVN-AJ0 ?/PUN,
K/KB/KBX.xml,KBXRE007,058703,50,,A,3,5,"yeah, when I was baptized , she probably stayed there till I was baptized, cos she would of been Yorkie","yeah/ITJ ,/PUN when/CJS i/PNP be/VBD baptize/VVN-AJ0 ,/PUN she/PNP probably/AV0 stay/VVD-VVN there/AV0 till/CJS i/PNP be/VBD baptize/VVN-AJ0 ,/PUN cos/CJS she/PNP would/VM0 have/VHI be/VBN yorkie/NN1",
K/KB/KBX.xml,KBXRE007,058703,51,,A,3,6,Somebody they just fetched out of the street?,somebody/PNI they/PNP just/AV0 fetch/VVD [out/AVP of/PRF]/PRP the/AT0 street/NN1 ?/PUN,
K/KB/KBX.xml,KBXRE007,058703,52,,A,3,7,"and they fetched somebody out of the street, this was, this was in er Worcester this was","and/CJC they/PNP fetch/VVD somebody/PNI [out/AVP of/PRF]/PRP the/AT0 street/NN1 ,/PUN this/DT0 be/VBD ,/PUN this/DT0 be/VBD in/PRP er/UNC worcester/NP0 this/DT0 be/VBD",
K/KB/KBX.xml,KBXRE007,058703,53,,A,3,8,"To be er, godparents?","to/TO0 be/VBI er/UNC ,/PUN godparent/NN2 ?/PUN",
K/KB/KBX.xml,KBXRE007,058703,54,,A,3,9,"To be er to, yeah to be me godparents, checking","to/TO0 be/VBI er/UNC to/PRP ,/PUN yeah/ITJ to/TO0 be/VBI i/DPS godparent/NN2 ,/PUN check/VVG",
K/KB/KBX.xml,KBXRE007,058703,55,,B,4,1,(()) ,,
K/KB/KBX.xml,KBXRE007,058703,56,,A,5,1,"how, how serious do you think this chap would take that duty, you know","how/AVQ ,/PUN how/AVQ serious/AJ0 do/VDB you/PNP think/VVI this/DT0 chap/NN1 would/VM0 take/VVI that/DT0 duty/NN1 ,/PUN you/PNP know/VVB",
K/KB/KBX.xml,KBXRE007,058703,57,,A,5,2,Well,well/AV0,
K/KB/KBX.xml,KBXRE007,058703,58,,A,5,3,just just grabbed out of the street,just/AV0 just/AV0 grab/VVN-VVD [out/AVP of/PRF]/PRP the/AT0 street/NN1,
K/KB/KBX.xml,KBXRE007,058703,59,,A,5,4,"I think when they lived there they used to meet regularly, cos erm, I suppose Worcester, Worcester in November","i/PNP think/VVB when/CJS they/PNP live/VVD there/AV0 they/PNP used/VM0 to/TO0 meet/VVI regularly/AV0 ,/PUN cos/CJS erm/UNC ,/PUN i/PNP suppose/VVB worcester/NP0 ,/PUN worcester/NP0 in/PRP november/NP0",
K/KB/KBX.xml,KBXRE007,058703,60,,B,6,1,,,
K/KB/KBX.xml,KBXRE007,058703,61,,B,6,2,(()) ,,
K/KB/KBX.xml,KBXRE007,058703,62,,B,6,3,,,
K/KB/KBX.xml,KBXRE007,058703,63,,A,7,1,"Aye, people were more serious in them days than they are now aren't they?","aye/ITJ ,/PUN people/NN0 be/VBD more/AV0 serious/AJ0 in/PRP they/PNP day/NN2 than/CJS they/PNP be/VBB now/AV0 be/VBB not/XX0 they/PNP ?/PUN",
K/KB/KBX.xml,KBXRE007,058703,64,,A,7,2,Take things more serious,take/VVB thing/NN2 more/AV0 serious/AJ0,
K/KB/KBX.xml,KBXRE007,058703,65,,A,7,3,"Er, yes, yes this was like nineteen twenty eight years old","er/UNC ,/PUN yes/ITJ ,/PUN yes/ITJ this/DT0 be/VBD like/PRP nineteen/CRD twenty/CRD eight/CRD year/NN2 old/AJ0",
K/KB/KBX.xml,KBXRE007,058703,66,,A,7,4,Yes,yes/ITJ,
K/KB/KBX.xml,KBXRE007,058703,67,,A,7,5,"Yeah, they would be er erm, I think they would, would be more like er, see of course when we came back here to Stoke  <laugh> er I mean that severed relations with them so to speak apart from like say letters, they did use, used to write I remember getting letters and we'd send letters, perhaps only twice a year, but I can remember them mentioning.","yeah/ITJ ,/PUN they/PNP would/VM0 be/VBI er/UNC erm/UNC ,/PUN i/PNP think/VVB they/PNP would/VM0 ,/PUN would/VM0 be/VBI more/AV0 like/AV0-AJ0 er/UNC ,/PUN see/VVB [of/PRF course/NN1]/AV0 when/CJS we/PNP come/VVD back/AVP here/AV0 to/PRP stoke/NP0 er/UNC i/PNP mean/VVB that/DT0-CJT severed/AJ0 relation/NN2 with/PRP they/PNP so/AV0 to/TO0 speak/VVI [apart/AV0 from/PRP]/PRP like/AV0 say/VVB-NN1 letter/NN2 ,/PUN they/PNP do/VDD use/VVI ,/PUN used/VM0 to/TO0 write/VVI i/PNP remember/VVB get/VVG letter/NN2 and/CJC we/PNP would/VM0 send/VVI letter/NN2 ,/PUN perhaps/AV0 only/AV0-AJ0 twice/AV0 a/AT0 year/NN1 ,/PUN but/CJC i/PNP can/VM0 remember/VVI they/PNP mention/VVG ./PUN",
K/KB/KBX.xml,KBXRE007,058703,68,,A,7,6,"So regards to your upbringing they wouldn't, they discuss  (())","so/AV0 regard/VVZ to/PRP you/DPS upbringing/NN1 they/PNP would/VM0 not/XX0 ,/PUN they/PNP discuss/VVB",
K/KB/KBX.xml,KBXRE007,058703,69,,A,7,7,"No, my, my aunt was in York, we used to see her once a year, Christmas, she used to come","no/ITJ ,/PUN i/DPS ,/PUN i/DPS aunt/NN1 be/VBD in/PRP york/NP0 ,/PUN we/PNP used/VM0 to/TO0 see/VVI she/PNP once/AV0 a/AT0 year/NN1 ,/PUN christmas/NN1 ,/PUN she/PNP used/VM0 to/TO0 come/VVI",
K/KB/KBX.xml,KBXRE007,058703,70,,A,7,8,"Very good that, so, the next","very/AV0 good/AJ0 that/CJT-DT0 ,/PUN so/AV0 ,/PUN the/AT0 next/ORD",
K/KB/KBX.xml,KBXRE007,058703,71,,B,8,1,(()) ,,
K/KB/KBX.xml,KBXRE007,058703,72,,A,9,1,why he came to earth?,why/AVQ he/PNP come/VVD to/PRP earth/NN1 ?/PUN,
K/KB/KBX.xml,KBXRE007,058703,73,,A,9,2,"Er before we go into er, this next summary, have you any ideas yourself why Jesus came to the earth?","er/UNC before/CJS we/PNP go/VVB into/PRP er/UNC ,/PUN this/DT0 next/ORD summary/NN1 ,/PUN have/VHB you/PNP any/DT0 idea/NN2 yourself/PNX why/AVQ jesus/NP0 come/VVD to/PRP the/AT0 earth/NN1 ?/PUN",
K/KB/KBX.xml,KBXRE007,058703,74,,A,9,3,"Well I think probably it was such a bad place, putting, come to try and show a little light, proper way to live and","well/AV0 i/PNP think/VVB probably/AV0 it/PNP be/VBD such/DT0 a/AT0 bad/AJ0 place/NN1 ,/PUN put/VVG ,/PUN come/VVB to/TO0 try/VVI and/CJC show/VVI a/AT0 little/AJ0 light/NN1 ,/PUN proper/AJ0 way/NN1 to/TO0 live/VVI and/CJC",
K/KB/KBX.xml,KBXRE007,058703,75,,A,9,4,"Well you know er, I suppose that would be included, you know included","well/AV0 you/PNP know/VVB er/UNC ,/PUN i/PNP suppose/VVB that/DT0 would/VM0 be/VBI include/VVN ,/PUN you/PNP know/VVB include/VVN",
K/KB/KBX.xml,KBXRE007,058703,76,,A,9,5,Yes,yes/ITJ,
K/KB/KBX.xml,KBXRE007,058703,77,,B,10,1,(()) ,,
K/KB/KBX.xml,KBXRE007,058703,78,,B,10,2,<dog barking> ,,
K/KB/KBX.xml,KBXRE007,058703,79,,A,11,1,"Eh, eh give over","eh/ITJ ,/PUN eh/ITJ give/VVB over/AVP-PRP",
K/KB/KBX.xml,KBXRE007,058703,80,,A,11,2,"These other, these other things erm, hello little girl","these/DT0 other/AJ0 ,/PUN these/DT0 other/AJ0 thing/NN2 erm/UNC ,/PUN hello/ITJ little/AJ0 girl/NN1",
K/KB/KBX.xml,KBXRE007,058703,81,,B,12,1,Hello,hello/ITJ,
K/KB/KBX.xml,KBXRE007,058703,82,,A,13,1,"there, what's your name?","there/AV0 ,/PUN what/DTQ be/VBZ you/DPS name/NN1 ?/PUN",
K/KB/KBX.xml,KBXRE007,058703,83,,B,14,1,Clare,clare/NP0,
K/KB/KBX.xml,KBXRE007,058703,84,,A,15,1,Clare?,clare/NP0 ?/PUN,
K/KB/KBX.xml,KBXRE007,058703,85,,B,16,1,Yeah,yeah/ITJ,
K/KB/KBX.xml,KBXRE007,058703,86,,A,17,1,"Oh, how old are you Clare?","oh/ITJ ,/PUN how/AVQ old/AJ0 be/VBB you/PNP clare/NP0 ?/PUN",
K/KB/KBX.xml,KBXRE007,058703,87,,B,18,1,Three,three/CRD,
K/KB/KBX.xml,KBXRE007,058703,88,,A,19,1,"Three, oh I don't know, three already  <laugh> and you like going to see granddad?","three/CRD ,/PUN oh/ITJ i/PNP do/VDB not/XX0 know/VVI ,/PUN three/CRD already/AV0 and/CJC you/PNP like/VVB go/VVG to/TO0 see/VVI granddad/NN1 ?/PUN",
K/KB/KBX.xml,KBXRE007,058703,89,,B,20,1,Yeah,yeah/ITJ,
K/KB/KBX.xml,KBXRE007,058703,90,,A,21,1,"Yes  there, we're just reading this book for a minute or two, if you want to sit, sit and listen you can, you're alright lovey, you're gonna sit down there, sit on that chair if you like","yes/ITJ there/AV0 ,/PUN we/PNP be/VBB just/AV0 read/VVG this/DT0 book/NN1 for/PRP a/AT0 minute/NN1 or/CJC two/CRD ,/PUN if/CJS you/PNP want/VVB to/TO0 sit/VVI ,/PUN sit/VVI and/CJC listen/VVI you/PNP can/VM0 ,/PUN you/PNP be/VBB alright/AJ0 lovey/NN1 ,/PUN you/PNP be/VBB gon/VVG na/TO0 sit/VVI down/AVP there/AV0 ,/PUN sit/VVB on/PRP-AVP that/DT0 chair/NN1 if/CJS you/PNP like/VVB",
K/KB/KBX.xml,KBXRE007,058703,91,,A,21,2,Er,er/UNC,
K/KB/KBX.xml,KBXRE007,058703,92,,A,21,3,"sit up, bring that chair up there look","sit/VVB up/AVP ,/PUN bring/VVB that/DT0 chair/NN1 up/AVP there/AV0 look/VVB",
K/KB/KBX.xml,KBXRE007,058703,93,,A,21,4,"get the towel off there in case you lean back, put that up there then","get/VVB the/AT0 towel/NN1 off/AVP-PRP there/AV0 [in/PRP case/NN1]/CJS you/PNP lean/VVB back/AVP ,/PUN put/VVB that/DT0 up/AVP there/AV0 then/AV0",
K/KB/KBX.xml,KBXRE007,058703,94,,A,21,5,"Very good that, use, you can erm sit, sit and listen are you?","very/AV0 good/AJ0 that/CJT-DT0 ,/PUN use/VVB-NN1 ,/PUN you/PNP can/VM0 erm/UNC sit/VVI ,/PUN sit/VVI and/CJC listen/VVI be/VBB you/PNP ?/PUN",
K/KB/KBX.xml,KBXRE007,058703,95,,B,22,1,Yeah,yeah/ITJ,
K/KB/KBX.xml,KBXRE007,058703,96,,A,23,1,That's a good girl,that/DT0 be/VBZ a/AT0 good/AJ0 girl/NN1,
K/KB/KBX.xml,KBXRE007,058703,97,,B,24,1,but my mum's here,but/CJC i/DPS mum/NN1 be/VBZ here/AV0,
K/KB/KBX.xml,KBXRE007,058703,98,,A,25,1,Your mum's here,you/DPS mum/NN1 be/VBZ here/AV0,
K/KB/KBX.xml,KBXRE007,058703,99,,A,25,2,Mum's in now is she?,mum/NN1 's/POS in/AVP-PRP now/AV0 be/VBZ she/PNP ?/PUN,
K/KB/KBX.xml,KBXRE007,058703,100,,A,25,3,alright then,alright/AV0 then/AV0,
K/KB/KBX.xml,KBXRE007,058703,101,,A,25,4,<laugh> ,,
K/KB/KBX.xml,KBXRE007,058703,102,,A,25,5,"Well if, after sitting a bit if you want to go into your mum you can can't you?","well/AV0 if/CJS ,/PUN after/PRP sit/VVG [a/AT0 bit/NN1]/AV0 if/CJS you/PNP want/VVB to/TO0 go/VVI into/PRP you/DPS mum/NN1 you/PNP can/VM0 can/VM0 not/XX0 you/PNP ?/PUN",
K/KB/KBX.xml,KBXRE007,058703,103,,A,25,6,"Very good then, so why he came to earth","very/AV0 good/AJ0 then/AV0 ,/PUN so/AV0 why/AVQ he/PNP come/VVD to/PRP earth/NN1",
K/KB/KBX.xml,KBXRE007,058703,104,,B,26,1,(()) ,,
K/KB/KBX.xml,KBXRE007,058703,105,,A,27,1,"says  <reading> explaining why he had come to earth Jesus told the Roman governor Pontius Pilate, will thus I've been born and for this purpose I have come out of the world that I should bear witness to the truth, but what particular truth was Jesus sent to earth to make no man, first just about his heavenly father, he taught his followers to pray that his father name be hallowed or hell holy and he prayed, I have made your name manifest to the man you gave me </reading> , also he said  <reading> I must declare the good news with the kingdom of God, because for this I was sent forth </reading> , so what truths did Jesus come to er, to tell?","say/VVZ explain/VVG why/AVQ he/PNP have/VHD come/VVN to/PRP earth/NN1 jesus/NP0 tell/VVD the/AT0 roman/AJ0-NN1 governor/NN1 pontius/NP0-NN1 pilate/NP0-NN1 ,/PUN will/VM0 thus/AV0 i/PNP have/VHB be/VBN bear/VVN and/CJC for/PRP this/DT0 purpose/NN1 i/PNP have/VHB come/VVN [out/AVP of/PRF]/PRP the/AT0 world/NN1 that/CJT i/PNP should/VM0 bear/VVI witness/NN1-VVB to/PRP the/AT0 truth/NN1 ,/PUN but/CJC what/DTQ particular/AJ0 truth/NN1 be/VBD jesus/NP0 send/VVD to/PRP earth/NN1 to/TO0 make/VVI no/AT0 man/NN1 ,/PUN first/ORD [just/AV0 about/AV0]/AV0 he/DPS heavenly/AJ0 father/NN1 ,/PUN he/PNP teach/VVD he/DPS follower/NN2 to/TO0 pray/VVI that/CJT he/DPS father/NN1 name/NN1 be/VBB hallowed/AJ0 or/CJC hell/NN1 holy/AJ0 and/CJC he/PNP pray/VVD ,/PUN i/PNP have/VHB make/VVN you/DPS name/NN1 manifest/VVI to/PRP the/AT0 man/NN1 you/PNP give/VVD i/PNP ,/PUN also/AV0 he/PNP say/VVD i/PNP must/VM0 declare/VVI the/AT0 good/AJ0 news/NN1 with/PRP the/AT0 kingdom/NN1 of/PRF god/NP0 ,/PUN because/CJS for/PRP this/DT0 i/PNP be/VBD send/VVN forth/AV0 ,/PUN so/AV0 what/DTQ truth/NN2 do/VDD jesus/NP0 come/VVI to/TO0 er/UNC ,/PUN to/TO0 tell/VVI ?/PUN",
K/KB/KBX.xml,KBXRE007,058703,106,,A,27,2,"Er, truth about his heavenly father, erm  taught his followers to, his father's name be heard how holy","er/UNC ,/PUN truth/NN1 about/PRP he/DPS heavenly/AJ0 father/NN1 ,/PUN erm/UNC teach/VVD-VVN he/DPS follower/NN2 to/PRP ,/PUN he/DPS father/NN1 's/POS name/NN1 be/VBI hear/VVN how/AVQ holy/AJ0",
K/KB/KBX.xml,KBXRE007,058703,107,,A,27,3,What did he  (()) <dog barking>,what/DTQ do/VDD he/PNP,
