swda_filename,ptb_basename,conversation_no,transcript_index,act_tag,caller,turn_index,subutterance_index,text,pos,trees
K/KB/KB9.xml,KB9RE000,061901,0,,A,1,1,I got a thing from  (()) this morning,i/PNP get/VVD a/AT0 thing/NN1 from/PRP this/DT0 morning/NN1,
K/KB/KB9.xml,KB9RE000,061901,1,,B,2,1,From where?,from/PRP where/AVQ ?/PUN,
K/KB/KB9.xml,KB9RE000,061901,2,,A,3,1,(()) ,,
K/KB/KB9.xml,KB9RE000,061901,3,,B,4,1,where's that at?,where/AVQ be/VBZ that/DT0 at/PRP ?/PUN,
K/KB/KB9.xml,KB9RE000,061901,4,,A,5,1,it's the,it/PNP be/VBZ the/AT0,
K/KB/KB9.xml,KB9RE000,061901,5,,B,6,1,er college,er/UNC college/NN1,
K/KB/KB9.xml,KB9RE000,061901,6,,A,7,1,technical college,technical/AJ0 college/NN1,
K/KB/KB9.xml,KB9RE000,061901,7,,B,8,1,"oh right, what saying?, you're not brainy enough to go to college","oh/ITJ right/AV0 ,/PUN what/DTQ saying/NN1 ?/PUN ,/PUN you/PNP be/VBB not/XX0 brainy/AJ0 enough/AV0 to/TO0 go/VVI to/PRP college/NN1",
K/KB/KB9.xml,KB9RE000,061901,8,,A,9,1,"no, no I don't no, is (())","no/ITJ ,/PUN no/ITJ i/PNP do/VDB not/XX0 no/ITJ ,/PUN be/VBZ",
K/KB/KB9.xml,KB9RE000,061901,9,,B,10,1,oh can I have your fork?,oh/ITJ can/VM0 i/PNP have/VHI you/DPS fork/NN1 ?/PUN,
K/KB/KB9.xml,KB9RE000,061901,10,,A,11,1,<screaming> ah ya  </screaming> you've got more than me,ah/ITJ ya/ITJ you/PNP have/VHB get/VVN more/DT0 than/CJS i/PNP,
K/KB/KB9.xml,KB9RE000,061901,11,,B,12,1,I like these feet,i/PNP like/VVB these/DT0 foot/NN2,
K/KB/KB9.xml,KB9RE000,061901,12,,A,13,1,"I do, I like the yellow ones, it, it just said","i/PNP do/VDB ,/PUN i/PNP like/VVB the/AT0 yellow/AJ0 one/NN2 ,/PUN it/PNP ,/PUN it/PNP just/AV0 say/VVD",
K/KB/KB9.xml,KB9RE000,061901,13,,B,14,1,what did it say?,what/DTQ do/VDD it/PNP say/VVI ?/PUN,
K/KB/KB9.xml,KB9RE000,061901,14,,A,15,1,"I thought it was a refresher course,(()) it's not that","i/PNP think/VVD it/PNP be/VBD a/AT0 refresher/NN1 course/NN1 ,/PUN it/PNP be/VBZ not/XX0 that/DT0",
K/KB/KB9.xml,KB9RE000,061901,15,,B,16,1,"what is this?, this yours?","what/DTQ be/VBZ this/DT0 ?/PUN ,/PUN this/DT0 yours/PNP ?/PUN",
K/KB/KB9.xml,KB9RE000,061901,16,,B,16,2,"Jane don't be nosy, you shouldn't read other people's things  what did she say  (()) it?","jane/NP0 do/VDB not/XX0 be/VBI nosy/AJ0 ,/PUN you/PNP should/VM0 not/XX0 read/VVI other/AJ0 people/NN0 's/POS thing/NN2 what/DTQ do/VDD she/PNP say/VVI it/PNP ?/PUN",
K/KB/KB9.xml,KB9RE000,061901,17,,A,17,1,(()) ,,
K/KB/KB9.xml,KB9RE000,061901,18,,A,17,2,Go and ask when she's finished or when she's about finished reading that (()),go/VVB and/CJC ask/VVB when/CJS she/PNP have/VHZ finish/VVN or/CJC when/CJS she/PNP be/VBZ about/AV0 finished/AJ0 reading/NN1-VVG that/DT0,
K/KB/KB9.xml,KB9RE000,061901,19,,B,18,1,she's nearly finished actually,she/PNP be/VBZ nearly/AV0 finish/VVN-VVD actually/AV0,
K/KB/KB9.xml,KB9RE000,061901,20,,A,19,1,"why, what she gonna do?","why/AVQ ,/PUN what/DTQ she/PNP gon/VVG na/TO0 do/VDI ?/PUN",
