swda_filename,ptb_basename,conversation_no,transcript_index,act_tag,caller,turn_index,subutterance_index,text,pos,trees
K/KD/KDC.xml,KDCRE004,063305,0,,A,1,1,"Question six, pate de foie gras is made form the liver of, okay literary of a fat goose, but we accepted goose alright, so pate de foie gras from a goose liver.","question/NN1 six/CRD ,/PUN [pate/UNC de/UNC foie/UNC gras/UNC]/NN1 be/VBZ make/VVN form/VVI the/AT0 liver/NN1 of/PRF ,/PUN okay/AV0 literary/AJ0 of/PRF a/AT0 fat/AJ0-NN1 goose/NN1 ,/PUN but/CJC we/PNP accept/VVD goose/NN1 alright/AV0 ,/PUN so/AV0 [pate/UNC de/UNC foie/UNC gras/UNC]/NN1 from/PRP a/AT0 goose/NN1 liver/NN1 ./PUN",
K/KD/KDC.xml,KDCRE004,063305,1,,A,1,2,"Question seven, which substance used to be known as Brimstone?","question/NN1 seven/CRD ,/PUN which/DTQ substance/NN1 used/VM0 to/TO0 be/VBI know/VVN as/PRP brimstone/NN1 ?/PUN",
K/KD/KDC.xml,KDCRE004,063305,2,,A,1,3,That's sulphur,that/DT0 be/VBZ sulphur/NN1,
K/KD/KDC.xml,KDCRE004,063305,3,,B,2,1,I'd erm cod liver oil.,i/PNP have/VHD erm/UNC cod/NN0 liver/NN1 oil/NN1 ./PUN,
K/KD/KDC.xml,KDCRE004,063305,4,,A,3,1,"question eight, in Britain we play the game draughts, in America the same game is called checkers  er, number nine, one or two of you got it right, most of you caught out with M G sports cars, the M G actually stands for Morris Garages","question/NN1-VVB eight/CRD ,/PUN in/PRP britain/NP0 we/PNP play/VVB the/AT0 game/NN1 draught/NN2 ,/PUN in/PRP america/NP0 the/AT0 same/DT0 game/NN1 be/VBZ call/VVN-AJ0 checker/NN2 er/UNC ,/PUN number/NN1 nine/CRD ,/PUN one/CRD or/CJC two/CRD of/PRF you/PNP get/VVD it/PNP right/AJ0 ,/PUN most/DT0 of/PRF you/PNP catch/VVD out/AVP with/PRP m/ZZ0 g/ZZ0 sport/NN2 car/NN2 ,/PUN the/AT0 m/ZZ0 g/ZZ0 actually/AV0 stand/VVZ for/PRP morris/NP0 garage/NN2",
K/KD/KDC.xml,KDCRE004,063305,5,,B,4,1,Ah got that one,ah/ITJ get/VVD-VVN that/DT0 one/PNI,
K/KD/KDC.xml,KDCRE004,063305,6,,A,5,1,(()) ,,
K/KD/KDC.xml,KDCRE004,063305,7,,B,6,1,oh shit,oh/ITJ shit/NN1,
K/KD/KDC.xml,KDCRE004,063305,8,,A,7,1,"Okay, you got half, you got Morris, question ten, tetanus is better known by what name to you and me it's lock jaw, at least if you've ever had it, it is, question eleven","okay/AV0 ,/PUN you/PNP get/VVD half/DT0 ,/PUN you/PNP get/VVD morris/NP0 ,/PUN question/NN1-VVB ten/CRD ,/PUN tetanus/NN1 be/VBZ well/AV0 know/VVN by/PRP what/DTQ name/NN1-VVB to/PRP you/PNP and/CJC i/PNP it/PNP be/VBZ lock/NN1 jaw/NN1 ,/PUN [at/PRP least/AV0]/AV0 if/CJS you/PNP have/VHB ever/AV0 have/VHN it/PNP ,/PUN it/PNP be/VBZ ,/PUN question/NN1-VVB eleven/CRD",
K/KD/KDC.xml,KDCRE004,063305,9,,A,7,2,(()) ,,
K/KD/KDC.xml,KDCRE004,063305,10,,A,7,3,what is the length of time of an  <laugh> of an F A football match?,what/DTQ be/VBZ the/AT0 length/NN1 of/PRF time/NN1 of/PRF an/AT0 of/PRF an/AT0 f/ZZ0 a/ZZ0 football/NN1 match/NN1-VVB ?/PUN,
K/KD/KDC.xml,KDCRE004,063305,11,,A,7,4,"Ninety minutes, excluding injury time and all that stuff, ninety minutes, question twelve, who hosts the T V quiz The Krypton Factor?, that's Gordon Burns  question thirteen, who painted the Mona Lisa?","ninety/CRD minute/NN2 ,/PUN excluding/PRP injury/NN1 time/NN1 and/CJC all/DT0 that/DT0 stuff/NN1 ,/PUN ninety/CRD minute/NN2 ,/PUN question/NN1-VVB twelve/CRD ,/PUN who/PNQ host/VVZ the/AT0 t/ZZ0 v/ZZ0 quiz/NN1-VVB the/AT0 krypton/NP0-NN1 factor/NN1 ?/PUN ,/PUN that/DT0 be/VBZ gordon/NP0 burns/NP0 question/NN1 thirteen/CRD ,/PUN who/PNQ paint/VVD the/AT0 mona/NP0 lisa/NP0 ?/PUN",
K/KD/KDC.xml,KDCRE004,063305,12,,A,7,5,"Leonardo de Vinci  fourteen, Middlesex Street in London has a very famous market lends its name to the street it's Petticoat Lane  question fifteen, which of them is not a bone, okay, we, we asked you which of these is not a bone, a femur, a patella, radius, cornea or temporal, the one is cornea, that's part, that's part of the eye  question sixteen, which country is the world's leading coffee producer?","leonardo/NP0 de/NP0 vinci/NP0-NN1 fourteen/CRD ,/PUN middlesex/NP0 street/NP0 in/PRP london/NP0 have/VHZ a/AT0 very/AV0 famous/AJ0 market/NN1 lend/VVZ it/DPS name/NN1 to/PRP the/AT0 street/NN1 it/PNP be/VBZ petticoat/NP0 lane/NP0 question/NN1 fifteen/CRD ,/PUN which/DTQ of/PRF they/PNP be/VBZ not/XX0 a/AT0 bone/NN1 ,/PUN okay/AV0 ,/PUN we/PNP ,/PUN we/PNP ask/VVD you/PNP which/DTQ of/PRF these/DT0 be/VBZ not/XX0 a/AT0 bone/NN1 ,/PUN a/AT0 femur/NN1 ,/PUN a/AT0 patella/NN1 ,/PUN radius/NN1 ,/PUN cornea/NN1 or/CJC temporal/AJ0 ,/PUN the/AT0 one/PNI-CRD be/VBZ cornea/NN1 ,/PUN that/DT0 be/VBZ part/NN1 ,/PUN that/DT0 be/VBZ part/NN1 of/PRF the/AT0 eye/NN1 question/NN1 sixteen/CRD ,/PUN which/DTQ country/NN1 be/VBZ the/AT0 world/NN1 's/POS leading/AJ0 coffee/NN1 producer/NN1 ?/PUN",
K/KD/KDC.xml,KDCRE004,063305,13,,A,7,6,"I said go for the obvious one Brazil  question seventeen, the Pyrenees mountain range lies between which two countries?","i/PNP say/VVD go/VVB-NN1 for/PRP the/AT0 obvious/AJ0 one/PNI brazil/NP0 question/NN1 seventeen/CRD ,/PUN the/AT0 pyrenees/NP0 mountain/NN1 range/NN1 lie/VVZ-NN2 between/PRP which/DTQ two/CRD country/NN2 ?/PUN",
K/KD/KDC.xml,KDCRE004,063305,14,,A,7,7,"France and Spain, okay, if you only got one of those countries right we couldn't give you the point, it has to be both, question eighteen, in which book would you find the character Long John Silver?","france/NP0 and/CJC spain/NP0 ,/PUN okay/AV0 ,/PUN if/CJS you/PNP only/AV0 get/VVD one/CRD of/PRF those/DT0 country/NN2 right/AV0 we/PNP could/VM0 not/XX0 give/VVI you/PNP the/AT0 point/NN1 ,/PUN it/PNP have/VHZ to/TO0 be/VBI both/AV0 ,/PUN question/NN1-VVB eighteen/CRD ,/PUN in/PRP which/DTQ book/NN1 would/VM0 you/PNP find/VVI the/AT0 character/NN1 long/AV0-AJ0 john/NP0 silver/NP0 ?/PUN",
K/KD/KDC.xml,KDCRE004,063305,15,,A,7,8,Treasure Island,treasure/NP0 island/NP0,
