swda_filename,ptb_basename,conversation_no,transcript_index,act_tag,caller,turn_index,subutterance_index,text,pos,trees
K/KB/KB8.xml,KB8RE00C,069502,0,,A,1,1,"Hey, you know, talking about the ducks on the river, you know that  --","hey/ITJ ,/PUN you/PNP know/VVB ,/PUN talk/VVG about/PRP the/AT0 duck/NN2 on/PRP the/AT0 river/NN1 ,/PUN you/PNP know/VVB that/DT0-CJT ",
K/KB/KB8.xml,KB8RE00C,069502,1,,A,1,2,"--elderly, ever so refined lady","elderly/AJ0 ,/PUN [ever/AV0 so/AV0]/AV0 refined/AJ0 lady/NN1 ",
K/KB/KB8.xml,KB8RE00C,069502,2,,B,2,1,Who brought bread to feed ,who/PNQ bring/VVD bread/NN1 to/TO0 feed/VVI ,
K/KB/KB8.xml,KB8RE00C,069502,3,,A,3,1,Yes.,yes/ITJ ./PUN ,
K/KB/KB8.xml,KB8RE00C,069502,4,,B,4,1,the ducks?,the/AT0 duck/NN2 ?/PUN ,
K/KB/KB8.xml,KB8RE00C,069502,5,,B,4,2,Yes.,yes/ITJ ./PUN ,
K/KB/KB8.xml,KB8RE00C,069502,6,,B,4,3,"Yes well, that's right.","yes/ITJ well/AV0 ,/PUN that/DT0 be/VBZ right/AJ0 ./PUN ",
K/KB/KB8.xml,KB8RE00C,069502,7,,A,5,1,I think she must have been  --,i/PNP think/VVB she/PNP must/VM0 have/VHI be/VBN ,
K/KB/KB8.xml,KB8RE00C,069502,8,,A,5,2,"--quite well off some time, had fallen on  --","quite/AV0 [well/AV0 off/AVP]/AJ0 some/DT0 time/NN1 ,/PUN have/VHD fall/VVN on/AVP-PRP ",
K/KB/KB8.xml,KB8RE00C,069502,9,,A,5,3,--really hard times.,really/AV0 hard/AJ0 time/NN2 ./PUN ,
K/KB/KB8.xml,KB8RE00C,069502,10,,A,5,4,"I mean, she told me  --","i/PNP mean/VVB ,/PUN she/PNP tell/VVD i/PNP ",
K/KB/KB8.xml,KB8RE00C,069502,11,,A,5,5,"--oh, a couple of years ago that she was eighty.","oh/ITJ ,/PUN a/AT0 couple/NN1 of/PRF year/NN2 ago/AV0 that/CJT she/PNP be/VBD eighty/CRD ./PUN ",
K/KB/KB8.xml,KB8RE00C,069502,12,,A,5,6,"And, I better get this dinner out.","and/CJC ,/PUN i/PNP well/AV0 get/VVI this/DT0 dinner/NN1 out/AVP ./PUN ",
K/KB/KB8.xml,KB8RE00C,069502,13,,A,5,7,And erm  --,and/CJC erm/UNC ,
K/KB/KB8.xml,KB8RE00C,069502,14,,A,5,8,--she always thought of her husband as daddy.,she/PNP always/AV0 think/VVD of/PRF she/DPS husband/NN1 as/PRP daddy/NN1 ./PUN ,
K/KB/KB8.xml,KB8RE00C,069502,15,,B,6,1,Mhm.,mhm/ITJ ./PUN ,
K/KB/KB8.xml,KB8RE00C,069502,16,,A,7,1,And her daughter  --,and/CJC she/DPS daughter/NN1 ,
K/KB/KB8.xml,KB8RE00C,069502,17,,A,7,2,--I think she must have been getting on because  --,i/PNP think/VVB she/PNP must/VM0 have/VHI be/VBN get/VVG on/AVP because/CJS ,
K/KB/KB8.xml,KB8RE00C,069502,18,,A,7,3,"--around the time she told me that she was eighty, she happened to mention that her daughter was forty.","around/PRP the/AT0 time/NN1 she/PNP tell/VVD i/PNP that/CJT she/PNP be/VBD eighty/CRD ,/PUN she/PNP happen/VVD to/TO0 mention/VVI that/CJT she/DPS daughter/NN1 be/VBD forty/CRD ./PUN ",
K/KB/KB8.xml,KB8RE00C,069502,19,,B,8,1,She had no grandchildren  (()) ,she/PNP have/VHD no/AT0 grandchildren/NN2 ,
K/KB/KB8.xml,KB8RE00C,069502,20,,A,9,1,"I know, her daughter, er her daughter's not married.","i/PNP know/VVB ,/PUN she/DPS daughter/NN1 ,/PUN er/UNC she/DPS daughter/NN1 be/VBZ not/XX0 married/AJ0 ./PUN ",
K/KB/KB8.xml,KB8RE00C,069502,21,,A,9,2,Well I haven't seen her feeding the ducks  --,well/AV0 i/PNP have/VHB not/XX0 see/VVN she/PNP feed/VVG the/AT0 duck/NN2 ,
K/KB/KB8.xml,KB8RE00C,069502,22,,A,9,3,--for about three or four months.,for/PRP about/AV0 three/CRD or/CJC four/CRD month/NN2 ./PUN ,
K/KB/KB8.xml,KB8RE00C,069502,23,,A,9,4,I wonder if she's died or she's ill?,i/PNP wonder/VVB if/CJS she/PNP have/VHZ die/VVN or/CJC she/PNP be/VBZ ill/AJ0 ?/PUN ,
K/KB/KB8.xml,KB8RE00C,069502,24,,B,10,1,She's always going to jumble sales.,she/PNP be/VBZ always/AV0 go/VVG to/TO0 jumble/VVI sales/NN0 ./PUN ,
K/KB/KB8.xml,KB8RE00C,069502,25,,A,11,1,I know.,i/PNP know/VVB ./PUN ,
K/KB/KB8.xml,KB8RE00C,069502,26,,A,11,2,"All, all her clothes came from jumble sales.","all/DT0 ,/PUN all/DT0 she/DPS clothes/NN2 come/VVD from/PRP jumble/NN1-VVB sales/NN0 ./PUN ",
K/KB/KB8.xml,KB8RE00C,069502,27,,A,11,3,Everything.,everything/PNI ./PUN ,
K/KB/KB8.xml,KB8RE00C,069502,28,,A,11,4,"She wa- she was buying, long after nylon shirts went out of fashion, there we- there was a pile of nylon shirts, and she said I'm, I'm just looking to see if this  --","she/PNP wa/UNC she/PNP be/VBD buy/VVG ,/PUN long/AV0 after/CJS nylon/NN1 shirt/NN2 go/VVD [out/AVP of/PRF]/PRP fashion/NN1 ,/PUN there/EX0 we/UNC there/EX0 be/VBD a/AT0 pile/NN1 of/PRF nylon/NN1 shirt/NN2 ,/PUN and/CJC she/PNP say/VVD i/PNP be/VBB ,/PUN i/PNP be/VBB just/AV0 look/VVG to/TO0 see/VVI if/CJS this/DT0 ",
K/KB/KB8.xml,KB8RE00C,069502,29,,A,11,5,--if these will be suitable for daddy.,if/CJS these/DT0 will/VM0 be/VBI suitable/AJ0 for/PRP daddy/NN1 ./PUN ,
K/KB/KB8.xml,KB8RE00C,069502,30,,A,11,6,I can't remember  --,i/PNP can/VM0 not/XX0 remember/VVI ,
K/KB/KB8.xml,KB8RE00C,069502,31,,A,11,7,"--er, she gave me the reason why she wanted these for  --","er/UNC ,/PUN she/PNP give/VVD i/PNP the/AT0 reason/NN1 why/AVQ she/PNP want/VVD these/DT0 for/PRP ",
K/KB/KB8.xml,KB8RE00C,069502,32,,A,11,8,"--oh, he, he, he always wears his cuffs out or something.","oh/ITJ ,/PUN he/PNP ,/PUN he/PNP ,/PUN he/PNP always/AV0 wear/VVZ he/DPS cuff/NN2 out/AVP or/CJC something/PNI ./PUN ",
K/KB/KB8.xml,KB8RE00C,069502,33,,A,11,9,"She was quite pleasant to talk to, I liked listening to her.","she/PNP be/VBD quite/AV0 pleasant/AJ0 to/TO0 talk/VVI to/PRP ,/PUN i/PNP like/VVD listen/VVG to/PRP she/PNP ./PUN ",
K/KB/KB8.xml,KB8RE00C,069502,34,,A,11,10,I don't think I know her name.,i/PNP do/VDB not/XX0 think/VVI i/PNP know/VVB she/DPS name/NN1 ./PUN ,
K/KB/KB8.xml,KB8RE00C,069502,35,,A,11,11,"So, I couldn't even ask anyone.","so/AV0 ,/PUN i/PNP could/VM0 not/XX0 even/AV0 ask/VVI anyone/PNI ./PUN ",
