swda_filename,ptb_basename,conversation_no,transcript_index,act_tag,caller,turn_index,subutterance_index,text,pos,trees
K/KD/KD0.xml,KD0RE00F,17004,0,,A,1,1,How do they make that building curved?,"[How/WRB, do/VBP, they/PRP, make/VB, that/DT, building/NN, curved/VBD, ?/.]",(ROOT (SBARQ (WHADVP (WRB How)) (SQ (VBP do) (NP (PRP they)) (VP (VB make) (SBAR (S (NP (DT that) (NN building)) (VP (VBD curved)))))) (. ?)))
K/KD/KD0.xml,KD0RE00F,17004,1,,B,2,1,(()) architecture.,"[architecture/NN, ./.]",(ROOT (NP (NN architecture) (. .)))
K/KD/KD0.xml,KD0RE00F,17004,2,,B,2,2,They're quite nice actually aren't they?,"[They/PRP, 're/VBP, quite/RB, nice/JJ, actually/RB, aren/NNP, 't/PRP, they/PRP, ?/.]",(ROOT (S (NP (PRP They)) (VP (VBP 're) (ADJP (RB quite) (JJ nice)) (ADVP (RB actually)) (PP (NP (NNP aren)) (NP (NP (PRP 't)) (NP (PRP they))))) (. ?)))
K/KD/KD0.xml,KD0RE00F,17004,3,,B,2,3,"They, they're a bit run down.","[They/PRP, ,/,, they/PRP, 're/VBP, a/DT, bit/NN, run/VB, down/RB, ./.]","(ROOT (S (NP (PRP They)) (, ,) (NP (PRP they)) (VP (VBP 're) (NP (DT a) (NN bit) (S (VP (VB run) (ADVP (RB down)))))) (. .)))"
K/KD/KD0.xml,KD0RE00F,17004,4,,B,2,4,They could have a bit more money spent on them.,"[They/PRP, could/MD, have/VB, a/DT, bit/NN, more/JJR, money/NN, spent/VBN, on/IN, them/PRP, ./.]",(ROOT (S (NP (PRP They)) (VP (MD could) (VP (VB have) (NP (ADJP (NP (DT a) (NN bit)) (JJR more)) (NN money)) (VP (VBN spent) (PP (IN on) (NP (PRP them)))))) (. .)))
K/KD/KD0.xml,KD0RE00F,17004,5,,B,2,5,Had a new roof I note but,"[Had/VBD, a/DT, new/JJ, roof/NN, I/PRP, note/VBP, but/CC]",(ROOT (SINV (VBD Had) (NP (NP (DT a) (JJ new) (NN roof)) (ADVP (PRP I))) (VP (VBP note) (ADVP (CC but)))))
K/KD/KD0.xml,KD0RE00F,17004,6,,A,3,1,Yeah.,"[Yeah/UH, ./.]",(ROOT (INTJ (UH Yeah) (. .)))
K/KD/KD0.xml,KD0RE00F,17004,7,,B,4,1,They're always for sale.,"[They/PRP, 're/VBP, always/RB, for/IN, sale/NN, ./.]",(ROOT (S (NP (PRP They)) (VP (VBP 're) (ADVP (RB always)) (PP (IN for) (NP (NN sale)))) (. .)))
K/KD/KD0.xml,KD0RE00F,17004,8,,B,4,2,There's always a for sale sign out- outside one of those or one of those.,"[There/EX, 's/VBZ, always/RB, a/DT, for/IN, sale/NN, sign/NN, out-/NN, outside/IN, one/CD, of/IN, those/DT, or/CC, one/CD, of/IN, those/DT, ./.]",(ROOT (S (NP (EX There)) (VP (VBZ 's) (NP (NP (RB always) (DT a)) (PP (IN for) (NP (NP (NP (NN sale) (NN sign) (NN out-)) (PP (IN outside) (NP (CD one))) (PP (IN of) (NP (DT those)))) (CC or) (NP (NP (CD one)) (PP (IN of) (NP (DT those)))))))) (. .)))
K/KD/KD0.xml,KD0RE00F,17004,9,,B,4,3,"I reckon it's one of those flats, you can always get a flat there.","[I/PRP, reckon/VBP, it/PRP, 's/VBZ, one/CD, of/IN, those/DT, flats/NNS, ,/,, you/PRP, can/MD, always/RB, get/VB, a/DT, flat/JJ, there/RB, ./.]","(ROOT (S (S (NP (PRP I)) (VP (VBP reckon) (SBAR (S (NP (PRP it)) (VP (VBZ 's) (NP (NP (CD one)) (PP (IN of) (NP (DT those) (NNS flats))))))))) (, ,) (NP (PRP you)) (VP (MD can) (ADVP (RB always)) (VP (VB get) (NP (DT a) (JJ flat)) (ADVP (RB there)))) (. .)))"
K/KD/KD0.xml,KD0RE00F,17004,10,,A,5,1,Are they flats?,"[Are/VBP, they/PRP, flats/NNS, ?/.]",(ROOT (S (VP (VBP Are) (NP (NP (PRP they)) (NP (NNS flats)))) (. ?)))
K/KD/KD0.xml,KD0RE00F,17004,11,,B,6,1,"So many that, er yeah, so many of them that  --","[So/RB, many/JJ, that/IN, ,/,, er/NN, yeah/UH, ,/,, so/RB, many/JJ, of/IN, them/PRP, that/IN, soon/RB, as/IN, one/CD, 's/POS, sold/VBN, somebody/NN, else/RB, sells/VBZ, another/DT, one/CD, ./.]","(ROOT (S (ADVP (ADVP (RB So) (JJ many)) (SBAR (IN that) (, ,) (S (NP (NN er)) (VP (S (NP (NP (FRAG (INTJ (UH yeah)) (, ,) (NP (RB so) (JJ many)))) (PP (IN of) (NP (NP (PRP them)) (SBAR (WHNP (IN that)) (S (VP (ADVP (RB soon) (PP (IN as) (NP (CD one) (POS 's)))) (VBN sold)))))))))))) (NP (NN somebody) (RB else)) (VP (VBZ sells) (NP (DT another) (CD one))) (. .)))"
K/KD/KD0.xml,KD0RE00F,17004,12,,B,6,2,--soon as one's sold somebody else sells another one.,"[So/RB, many/JJ, that/IN, ,/,, er/NN, yeah/UH, ,/,, so/RB, many/JJ, of/IN, them/PRP, that/IN, soon/RB, as/IN, one/CD, 's/POS, sold/VBN, somebody/NN, else/RB, sells/VBZ, another/DT, one/CD, ./.]","(ROOT (S (ADVP (ADVP (RB So) (JJ many)) (SBAR (IN that) (, ,) (S (NP (NN er)) (VP (S (NP (NP (FRAG (INTJ (UH yeah)) (, ,) (NP (RB so) (JJ many)))) (PP (IN of) (NP (NP (PRP them)) (SBAR (WHNP (IN that)) (S (VP (ADVP (RB soon) (PP (IN as) (NP (CD one) (POS 's)))) (VBN sold)))))))))))) (NP (NN somebody) (RB else)) (VP (VBZ sells) (NP (DT another) (CD one))) (. .)))"
K/KD/KD0.xml,KD0RE00F,17004,13,,A,7,1,Yeah.,"[Yeah/UH, ./.]",(ROOT (INTJ (UH Yeah) (. .)))
K/KD/KD0.xml,KD0RE00F,17004,14,,A,7,2,Well how many are there?,"[Well/RB, how/WRB, many/JJ, are/VBP, there/EX, ?/.]",(ROOT (SBARQ (WHADJP (RB Well) (WRB how) (JJ many)) (SQ (VBP are) (NP (EX there))) (. ?)))
K/KD/KD0.xml,KD0RE00F,17004,15,,A,7,3,Seventeen to twenty,"[Seventeen/CD, to/TO, twenty/CD]",(ROOT (NP (NP (CD Seventeen)) (PP (TO to) (NP (CD twenty)))))
K/KD/KD0.xml,KD0RE00F,17004,16,,B,8,1,Oh (()) ,[Oh/UH],(ROOT (INTJ (UH Oh)))
K/KD/KD0.xml,KD0RE00F,17004,17,,A,9,1,twenty one to twenty six.,"[twenty/CD, one/CD, to/TO, twenty/CD, six/CD, ./.]",(ROOT (NP (NP (CD twenty) (CD one)) (PP (TO to) (NP (CD twenty) (CD six))) (. .)))
K/KD/KD0.xml,KD0RE00F,17004,18,,B,10,1,It's a lot isn't it?,"[It/PRP, 's/VBZ, a/DT, lot/NN, isn/NN, 't/PRP, it/PRP, ?/.]",(ROOT (S (NP (PRP It)) (VP (VBZ 's) (NP (NP (DT a) (NN lot) (NN isn)) (NP (NP (PRP 't)) (NP (PRP it))))) (. ?)))
K/KD/KD0.xml,KD0RE00F,17004,19,,A,11,1,Yeah.,"[Yeah/UH, ./.]",(ROOT (INTJ (UH Yeah) (. .)))
K/KD/KD0.xml,KD0RE00F,17004,20,,A,11,2,Specially both sides.,"[Specially/RB, both/DT, sides/NNS, ./.]",(ROOT (FRAG (ADVP (RB Specially)) (NP (DT both) (NNS sides)) (. .)))
K/KD/KD0.xml,KD0RE00F,17004,21,,A,11,3,Yellow flag coming out of his aerial.,"[Yellow/JJ, flag/NN, coming/VBG, out/IN, of/IN, his/PRP$, aerial/JJ, ./.]",(ROOT (NP (NP (JJ Yellow) (NN flag)) (VP (VBG coming) (PRT (IN out)) (PP (IN of) (NP (PRP$ his) (JJ aerial)))) (. .)))
K/KD/KD0.xml,KD0RE00F,17004,22,,A,11,4,Oh where would you prefer your ae- aerial?,"[Oh/UH, where/WRB, would/MD, you/PRP, prefer/VB, your/PRP$, ae-/NN, aerial/JJ, ?/.]",(ROOT (SBARQ (UH Oh) (WHADVP (WRB where)) (SQ (MD would) (NP (PRP you)) (VP (VB prefer) (S (NP (PRP$ your) (NN ae-)) (ADJP (JJ aerial))))) (. ?)))
K/KD/KD0.xml,KD0RE00F,17004,23,,A,11,5,Would you like it there  --,"[Would/MD, you/PRP, like/VB, it/PRP, there/EX, up/IN, there/EX, or/CC, at/IN, the/DT, back/NN, ?/.]",(ROOT (SQ (MD Would) (NP (PRP you)) (VP (VB like) (S (NP (PRP it)) (NP (EX there))) (PP (PP (IN up) (NP (EX there))) (CC or) (PP (IN at) (NP (DT the) (NN back))))) (. ?)))
K/KD/KD0.xml,KD0RE00F,17004,24,,A,11,6,--up there or at the back?,"[Would/MD, you/PRP, like/VB, it/PRP, there/EX, up/IN, there/EX, or/CC, at/IN, the/DT, back/NN, ?/.]",(ROOT (SQ (MD Would) (NP (PRP you)) (VP (VB like) (S (NP (PRP it)) (NP (EX there))) (PP (PP (IN up) (NP (EX there))) (CC or) (PP (IN at) (NP (DT the) (NN back))))) (. ?)))
K/KD/KD0.xml,KD0RE00F,17004,25,,B,12,1,Up there's alright.,"[Up/IN, there/EX, 's/VBZ, alright/JJ, ./.]",(ROOT (S (PP (IN Up)) (NP (EX there)) (VP (VBZ 's) (ADJP (JJ alright))) (. .)))
K/KD/KD0.xml,KD0RE00F,17004,26,,B,12,2,I like it the way the ones that you can  --,"[I/PRP, like/VBP, it/PRP, the/DT, way/NN, the/DT, ones/NNS, that/IN, you/PRP, can/MD, close/VB, each/DT, time/NN, ,/,, now/RB, I/PRP, 'm/VBP, sure/JJ, my/PRP$, aerial/JJ, will/MD, last/RB, longer/RB, ./.]","(ROOT (S (S (NP (PRP I)) (VP (VBP like) (S (NP (PRP it)) (NP (NP (DT the) (NN way)) (NP (DT the) (NNS ones)))) (SBAR (IN that) (S (NP (PRP you)) (VP (MD can) (VP (VB close) (NP (DT each) (NN time)))))))) (, ,) (ADVP (RB now)) (S (NP (PRP I)) (VP (VBP 'm) (ADJP (JJ sure) (SBAR (S (NP (PRP$ my) (JJ aerial)) (VP (MD will) (ADVP (RB last) (RB longer)))))))) (. .)))"
K/KD/KD0.xml,KD0RE00F,17004,27,,B,12,3,"--close each time, now I'm sure my aerial will last longer.","[I/PRP, like/VBP, it/PRP, the/DT, way/NN, the/DT, ones/NNS, that/IN, you/PRP, can/MD, close/VB, each/DT, time/NN, ,/,, now/RB, I/PRP, 'm/VBP, sure/JJ, my/PRP$, aerial/JJ, will/MD, last/RB, longer/RB, ./.]","(ROOT (S (S (NP (PRP I)) (VP (VBP like) (S (NP (PRP it)) (NP (NP (DT the) (NN way)) (NP (DT the) (NNS ones)))) (SBAR (IN that) (S (NP (PRP you)) (VP (MD can) (VP (VB close) (NP (DT each) (NN time)))))))) (, ,) (ADVP (RB now)) (S (NP (PRP I)) (VP (VBP 'm) (ADJP (JJ sure) (SBAR (S (NP (PRP$ my) (JJ aerial)) (VP (MD will) (ADVP (RB last) (RB longer)))))))) (. .)))"
K/KD/KD0.xml,KD0RE00F,17004,28,,B,12,4,Cos you can ,"[Cos/NNP, you/PRP, can/MD]",(ROOT (FRAG (NP (NP (NNP Cos)) (SBAR (S (NP (PRP you)) (VP (MD can)))))))
K/KD/KD0.xml,KD0RE00F,17004,29,,A,13,1,What do you mean close.,"[What/WP, do/VBP, you/PRP, mean/VB, close/RB, ./.]",(ROOT (SBARQ (WHNP (WP What)) (SQ (VBP do) (NP (PRP you)) (VP (VB mean) (ADVP (RB close)))) (. .)))
K/KD/KD0.xml,KD0RE00F,17004,30,,B,14,1,Well it compacts.,"[Well/RB, it/PRP, compacts/VBZ, ./.]",(ROOT (S (ADVP (RB Well)) (NP (PRP it)) (VP (VBZ compacts)) (. .)))
K/KD/KD0.xml,KD0RE00F,17004,31,,A,15,1,Oh yeah.,"[Oh/UH, yeah/UH, ./.]",(ROOT (S (INTJ (UH Oh)) (VP (UH yeah)) (. .)))
K/KD/KD0.xml,KD0RE00F,17004,32,,B,16,1,"The ones that stick out all the time, they  --","[The/DT, ones/NNS, that/WDT, stick/VBP, out/RP, all/PDT, the/DT, time/NN, ,/,, they/PRP, I/PRP, suppose/VBP, that/DT, is/VBZ, good/JJ, ./.]","(ROOT (S (NP (NP (DT The) (NNS ones)) (SBAR (WHNP (WDT that)) (S (VP (VBP stick) (PRT (RP out)) (NP (PDT all) (DT the) (NN time)) (, ,) (S (NP (PRP they))))))) (NP (PRP I)) (VP (VBP suppose) (SBAR (S (NP (DT that)) (VP (VBZ is) (ADJP (JJ good)))))) (. .)))"
K/KD/KD0.xml,KD0RE00F,17004,33,,B,16,2,--I suppose that is good.,"[The/DT, ones/NNS, that/WDT, stick/VBP, out/RP, all/PDT, the/DT, time/NN, ,/,, they/PRP, I/PRP, suppose/VBP, that/DT, is/VBZ, good/JJ, ./.]","(ROOT (S (NP (NP (DT The) (NNS ones)) (SBAR (WHNP (WDT that)) (S (VP (VBP stick) (PRT (RP out)) (NP (PDT all) (DT the) (NN time)) (, ,) (S (NP (PRP they))))))) (NP (PRP I)) (VP (VBP suppose) (SBAR (S (NP (DT that)) (VP (VBZ is) (ADJP (JJ good)))))) (. .)))"
K/KD/KD0.xml,KD0RE00F,17004,34,,B,16,3,"If you have one that doesn't compact, you you're best to have one in the middle cos it's less likely to get pranged there isn't it?","[If/IN, you/PRP, have/VBP, one/CD, that/WDT, doesn/VBP, 't/PRP, compact/JJ, ,/,, you/PRP, you/PRP, 're/VBP, best/JJS, to/TO, have/VB, one/CD, in/IN, the/DT, middle/JJ, cos/NN, it/PRP, 's/VBZ, less/RBR, likely/JJ, to/TO, get/VB, pranged/VBN, there/EX, isn/SYM, 't/PRP, it/PRP, ?/.]","(ROOT (S (SBAR (IN If) (S (NP (PRP you)) (VP (VBP have) (NP (NP (CD one)) (SBAR (WHNP (WDT that)) (S (VP (VBP doesn) (NP (PRP 't) (JJ compact))))))))) (, ,) (NP (PRP you)) (PRN (S (NP (PRP you)) (VP (VBP 're) (ADJP (ADJP (JJS best)) (S (VP (TO to) (VP (VB have) (NP (NP (CD one)) (PP (IN in) (NP (DT the) (JJ middle) (NN cos))))))))))) (NP (PRP it)) (VP (VBZ 's) (ADJP (RBR less) (JJ likely) (S (VP (TO to) (VP (VP (VB get) (VP (VBN pranged) (S (NP (EX there)) (VP (SYM isn) (NP (PRP 't)))))) (NP (PRP it))))))) (. ?)))"
K/KD/KD0.xml,KD0RE00F,17004,35,,A,17,1,Yeah.,"[Yeah/UH, ./.]",(ROOT (INTJ (UH Yeah) (. .)))
K/KD/KD0.xml,KD0RE00F,17004,36,,B,18,1,Here like walkers by can bend it and  --,"[Here/RB, like/IN, walkers/NNS, by/IN, can/MD, bend/VB, it/PRP, and/CC, Oh/UH, look/VB, ./.]",(ROOT (S (ADVP (RB Here)) (PP (IN like) (NP (NNS walkers))) (VP (VP (PP (IN by)) (MD can) (VP (VB bend) (NP (PRP it)))) (CC and) (VP (FRAG (INTJ (UH Oh))))) (VP (VB look)) (. .)))
K/KD/KD0.xml,KD0RE00F,17004,37,,B,18,2,--Oh look.,"[Here/RB, like/IN, walkers/NNS, by/IN, can/MD, bend/VB, it/PRP, and/CC, Oh/UH, look/VB, ./.]",(ROOT (S (ADVP (RB Here)) (PP (IN like) (NP (NNS walkers))) (VP (VP (PP (IN by)) (MD can) (VP (VB bend) (NP (PRP it)))) (CC and) (VP (FRAG (INTJ (UH Oh))))) (VP (VB look)) (. .)))
K/KD/KD0.xml,KD0RE00F,17004,38,,B,18,3,Here's my next one.,"[Here/RB, 's/POS, my/PRP$, next/JJ, one/CD, ./.]",(ROOT (NP (NP (NP (RB Here)) (VP (S (NP (POS 's))) (PP (NP (PRP$ my)) (JJ next) (NP (CD one))))) (. .)))
K/KD/KD0.xml,KD0RE00F,17004,39,,B,18,4,Six.,"[Six/CD, ./.]",(ROOT (FRAG (NP (CD Six)) (. .)))
K/KD/KD0.xml,KD0RE00F,17004,40,,B,18,5,I've let six go now.,"[I/PRP, 've/VBP, let/VB, six/CD, go/VB, now/RB, ./.]",(ROOT (S (NP (PRP I)) (VP (VBP 've) (S (VP (VB let) (NP (CD six)) (VP (VB go) (ADVP (RB now)))))) (. .)))
K/KD/KD0.xml,KD0RE00F,17004,41,,A,19,1,You must have let someone go before now.,"[You/PRP, must/MD, have/VB, let/VB, someone/NN, go/VB, before/RB, now/RB, ./.]",(ROOT (S (NP (PRP You)) (VP (MD must) (VP (VB have) (S (VP (VB let) (S (NP (NN someone)) (VP (VB go) (ADVP (RB before) (RB now)))))))) (. .)))
K/KD/KD0.xml,KD0RE00F,17004,42,,B,20,1,"I didn't, no I haven't.","[I/PRP, didn/VBP, 't/PRP, ,/,, no/DT, I/PRP, haven/NN, 't/PRP, ./.]","(ROOT (S (NP (PRP I)) (VP (VBP didn) (S (NP (NP (PRP 't)) (, ,) (NP (DT no) (NP (PRP I)) (NN haven))) (NP (PRP 't)))) (. .)))"
K/KD/KD0.xml,KD0RE00F,17004,43,,B,20,2,No.,"[No/DT, ./.]",(ROOT (FRAG (NP (DT No)) (. .)))
K/KD/KD0.xml,KD0RE00F,17004,44,,B,20,3,Haven't had the opportunity to.,"[Haven/NNP, 't/PRP, had/VBD, the/DT, opportunity/NN, to/TO, ./.]",(ROOT (S (NP (NNP Haven) (PRP 't)) (VP (VBD had) (NP (DT the) (NN opportunity) (S (VP (TO to))))) (. .)))
K/KD/KD0.xml,KD0RE00F,17004,45,,B,20,4,What is this lady dressed up like?,"[What/WP, is/VBZ, this/DT, lady/NN, dressed/VBN, up/RP, like/IN, ?/.]",(ROOT (SBARQ (WHNP (WP What)) (SQ (VBZ is) (NP (DT this) (NN lady)) (VP (VBN dressed) (PRT (RP up)) (PP (IN like)))) (. ?)))
K/KD/KD0.xml,KD0RE00F,17004,46,,A,21,1,<laugh> ,[],
K/KD/KD0.xml,KD0RE00F,17004,47,,B,22,1,<laughing> What has she got on  (()) </laughing> ?,"[What/WDT, has/VBZ, she/PRP, got/VBD, on/IN, ?/.]",(ROOT (SBARQ (WHNP (WDT What)) (SQ (VBZ has) (NP (PRP she)) (VP (VBD got) (PP (IN on)))) (. ?)))
K/KD/KD0.xml,KD0RE00F,17004,48,,A,23,1,What has she got on her hair?,"[What/WDT, has/VBZ, she/PRP, got/VBD, on/IN, her/PRP$, hair/NN, ?/.]",(ROOT (SBARQ (WHNP (WDT What)) (SQ (VBZ has) (NP (PRP she)) (VP (VBD got) (PP (IN on) (NP (PRP$ her) (NN hair))))) (. ?)))
K/KD/KD0.xml,KD0RE00F,17004,49,,A,23,2,Weird.,"[Weird/JJ, ./.]",(ROOT (FRAG (ADJP (JJ Weird)) (. .)))
K/KD/KD0.xml,KD0RE00F,17004,50,,B,24,1,<laughing> Bunch of wool </laughing> .,"[Bunch/NN, of/IN, wool/NN, ./.]",(ROOT (NP (NP (NN Bunch)) (PP (IN of) (NP (NN wool))) (. .)))
K/KD/KD0.xml,KD0RE00F,17004,51,,A,25,1,<laugh> She'll be thinking where's that wool?,"[She/PRP, 'll/MD, be/VB, thinking/VBG, where/WRB, 's/POS, that/WDT, wool/NN, ?/.]",(ROOT (S (NP (PRP She)) (VP (MD 'll) (VP (VB be) (VP (VBG thinking) (SBAR (WHADVP (WRB where)) (FRAG (WHPP (POS 's) (WHNP (WDT that) (NN wool)))))))) (. ?)))
K/KD/KD0.xml,KD0RE00F,17004,52,,A,25,2,Oh it's on my head.,"[Oh/UH, it/PRP, 's/VBZ, on/IN, my/PRP$, head/NN, ./.]",(ROOT (S (S (INTJ (UH Oh)) (NP (PRP it)) (VP (VBZ 's) (PP (IN on) (NP (PRP$ my) (NN head))))) (. .)))
K/KD/KD0.xml,KD0RE00F,17004,53,,A,25,3,Look at those tiny rugby posts.,"[Look/VB, at/IN, those/DT, tiny/JJ, rugby/JJ, posts/NNS, ./.]",(ROOT (S (VP (VB Look) (PP (IN at) (NP (DT those) (JJ tiny) (JJ rugby) (NNS posts)))) (. .)))
K/KD/KD0.xml,KD0RE00F,17004,54,,B,26,1,"Yeah, I don't know why they do that, I was gonna ask that, why they chop those off, look like they've been vandalized don't they?","[Yeah/UH, ,/,, I/PRP, don/VBP, 't/PRP, know/VB, why/WRB, they/PRP, do/VBP, that/DT, ,/,, I/PRP, was/VBD, gonna/NNP, ask/VB, that/IN, ,/,, why/WRB, they/PRP, chop/VBP, those/DT, off/RP, ,/,, look/VB, like/IN, they/PRP, 've/VBP, been/VBN, vandalized/VBN, don/NNP, 't/PRP, they/PRP, ?/.]","(ROOT (S (S (INTJ (UH Yeah)) (, ,) (NP (PRP I)) (VP (VBP don) (S (NP (PRP 't)) (VP (VB know) (SBAR (WHADVP (WRB why)) (S (NP (PRP they)) (VP (VBP do) (NP (DT that))))))))) (, ,) (NP (PRP I)) (VP (VBD was) (S (NP (NNP gonna)) (VP (VB ask) (SBAR (IN that) (, ,) (S (SBAR (WHADVP (WRB why)) (S (NP (PRP they)) (VP (VBP chop) (NP (DT those)) (PRT (RP off))))) (, ,) (VP (VB look) (SBAR (IN like) (S (NP (PRP they)) (VP (VBP 've) (VP (VBN been) (VP (VBN vandalized) (S (VP (NNP don) (S (NP (PRP 't)) (NP (PRP they)))))))))))))))) (. ?)))"
K/KD/KD0.xml,KD0RE00F,17004,55,,A,27,1,Yeah.,"[Yeah/UH, ./.]",(ROOT (INTJ (UH Yeah) (. .)))
K/KD/KD0.xml,KD0RE00F,17004,56,,A,27,2,It's only for junior rugby though.,"[It/PRP, 's/VBZ, only/RB, for/IN, junior/JJ, rugby/JJ, though/IN, ./.]",(ROOT (S (NP (PRP It)) (VP (VBZ 's) (ADVP (RB only)) (PP (IN for) (NP (JJ junior) (JJ rugby))) (ADVP (IN though))) (. .)))
K/KD/KD0.xml,KD0RE00F,17004,57,,B,28,1,They haven't replaced that garage have they?,"[They/PRP, haven/NN, 't/PRP, replaced/VBD, that/IN, garage/NN, have/VBP, they/PRP, ?/.]",(ROOT (S (NP (PRP They)) (VP (NN haven) (SBAR (S (NP (PRP 't)) (VP (VBD replaced) (SBAR (IN that) (S (NP (NN garage)) (VP (VBP have) (NP (PRP they))))))))) (. ?)))
K/KD/KD0.xml,KD0RE00F,17004,58,,B,28,2,It's Volvo's in there.,"[It/PRP, 's/VBZ, Volvo/NNP, 's/POS, in/IN, there/EX, ./.]",(ROOT (S (NP (PRP It)) (VP (VBZ 's) (NP (NP (NNP Volvo) (POS 's)) (PP (IN in) (NP (EX there))))) (. .)))
K/KD/KD0.xml,KD0RE00F,17004,59,,B,28,3,"They've got no-one, no-one's ","[They/PRP, 've/VBP, got/VBN, no-one/NN, ,/,, no-one/NN, 's/POS]","(ROOT (S (NP (PRP They)) (VP (VBP 've) (VP (VBN got) (S (NP (NP (NN no-one)) (, ,) (NP (NP (NN no-one)) (POS 's))))))))"
K/KD/KD0.xml,KD0RE00F,17004,60,,A,29,1,Yeah.,"[Yeah/UH, ./.]",(ROOT (INTJ (UH Yeah) (. .)))
K/KD/KD0.xml,KD0RE00F,17004,61,,B,30,1,Put a new garage in there already.,"[Put/VB, a/DT, new/JJ, garage/NN, in/IN, there/EX, already/RB, ./.]",(ROOT (S (VP (VB Put) (NP (DT a) (JJ new) (NN garage)) (PP (IN in) (NP (EX there)) (ADVP (RB already)))) (. .)))
K/KD/KD0.xml,KD0RE00F,17004,62,,A,31,1,There's loads of new garages going in all over the place.,"[There/EX, 's/VBZ, loads/NNS, of/IN, new/JJ, garages/NNS, going/VBG, in/IN, all/DT, over/IN, the/DT, place/NN, ./.]",(ROOT (S (NP (EX There)) (VP (VBZ 's) (NP (NP (NNS loads)) (PP (IN of) (NP (NP (JJ new) (NNS garages)) (VP (VBG going) (PP (IN in) (NP (NP (DT all)) (PP (IN over) (NP (DT the) (NN place)))))))))) (. .)))
K/KD/KD0.xml,KD0RE00F,17004,63,,A,31,2,Volvo ,[Volvo/NNP],(ROOT (NP (NNP Volvo)))
K/KD/KD0.xml,KD0RE00F,17004,64,,B,32,1,Could have let that one go but I was too late.,"[Could/MD, have/VB, let/VB, that/DT, one/CD, go/NN, but/CC, I/PRP, was/VBD, too/RB, late/JJ, ./.]",(ROOT (S (VP (MD Could) (VP (VB have) (S (VP (VB let) (NP (DT that) (CD one) (NN go)) (SBAR (CC but) (S (NP (PRP I)) (VP (VBD was) (ADJP (RB too) (JJ late))))))))) (. .)))
K/KD/KD0.xml,KD0RE00F,17004,65,,A,33,1,Yeah.,"[Yeah/UH, ./.]",(ROOT (INTJ (UH Yeah) (. .)))
K/KD/KD0.xml,KD0RE00F,17004,66,,A,33,2,Volvo seem to be  --,"[Volvo/NNP, seem/VBP, to/TO, be/VB, moving/VBG, out/IN, all/DT, over/IN, the/DT, place/NN, ./.]",(ROOT (S (NP (NNP Volvo)) (VP (VBP seem) (S (VP (TO to) (VP (VB be) (VP (VBG moving) (ADVP (IN out) (DT all)) (PP (IN over) (NP (DT the) (NN place)))))))) (. .)))
K/KD/KD0.xml,KD0RE00F,17004,67,,A,33,3,--moving out all over the place.,"[Volvo/NNP, seem/VBP, to/TO, be/VB, moving/VBG, out/IN, all/DT, over/IN, the/DT, place/NN, ./.]",(ROOT (S (NP (NNP Volvo)) (VP (VBP seem) (S (VP (TO to) (VP (VB be) (VP (VBG moving) (ADVP (IN out) (DT all)) (PP (IN over) (NP (DT the) (NN place)))))))) (. .)))
K/KD/KD0.xml,KD0RE00F,17004,68,,A,33,4,I think they're trying to set up  --,"[I/PRP, think/VBP, they/PRP, 're/VBP, trying/VBG, to/TO, set/VB, up/RP, er/NN, nought/NN, ,/,, their/PRP$, own/JJ, things/NNS, rather/RB, than/IN, just/RB, joining/VBG, petrol/NNP, stations/NNS, ./.]","(ROOT (S (NP (PRP I)) (VP (VBP think) (SBAR (S (NP (PRP they)) (VP (VBP 're) (VP (VBG trying) (S (VP (TO to) (VP (VP (VB set) (PRT (RP up)) (NP (NP (NN er) (NN nought)) (, ,) (NP (PRP$ their) (JJ own) (NNS things)))) (CONJP (RB rather) (IN than)) (VP (ADVP (RB just)) (VBG joining) (NP (NNP petrol) (NNS stations))))))))))) (. .)))"
K/KD/KD0.xml,KD0RE00F,17004,69,,A,33,5,"--er nought, their own things rather than just joining petrol stations.","[I/PRP, think/VBP, they/PRP, 're/VBP, trying/VBG, to/TO, set/VB, up/RP, er/NN, nought/NN, ,/,, their/PRP$, own/JJ, things/NNS, rather/RB, than/IN, just/RB, joining/VBG, petrol/NNP, stations/NNS, ./.]","(ROOT (S (NP (PRP I)) (VP (VBP think) (SBAR (S (NP (PRP they)) (VP (VBP 're) (VP (VBG trying) (S (VP (TO to) (VP (VP (VB set) (PRT (RP up)) (NP (NP (NN er) (NN nought)) (, ,) (NP (PRP$ their) (JJ own) (NNS things)))) (CONJP (RB rather) (IN than)) (VP (ADVP (RB just)) (VBG joining) (NP (NNP petrol) (NNS stations))))))))))) (. .)))"
K/KD/KD0.xml,KD0RE00F,17004,70,,A,33,6,<yawn> --,"[Where/WRB, 's/VBZ, the/DT, Secombe/NNP, centre/NNP]",(ROOT (SBARQ (WHADVP (WRB Where)) (SQ (VBZ 's) (NP (DT the) (NNP Secombe) (NNP centre)))))
K/KD/KD0.xml,KD0RE00F,17004,71,,A,33,7,--Where's the Secombe centre ,"[Where/WRB, 's/VBZ, the/DT, Secombe/NNP, centre/NNP]",(ROOT (SBARQ (WHADVP (WRB Where)) (SQ (VBZ 's) (NP (DT the) (NNP Secombe) (NNP centre)))))
K/KD/KD0.xml,KD0RE00F,17004,72,,B,34,1,Back there.,"[Back/RB, there/RB, ./.]",(ROOT (FRAG (ADVP (RB Back) (RB there)) (. .)))
K/KD/KD0.xml,KD0RE00F,17004,73,,A,35,1,"Have you been to that place, Holiday Inn?","[Have/VB, you/PRP, been/VBN, to/TO, that/DT, place/NN, ,/,, Holiday/NNP, Inn/NNP, ?/.]","(ROOT (SQ (VP (VB Have) (NP (PRP you)) (VP (VBN been) (PP (TO to) (NP (NP (DT that) (NN place)) (, ,) (NP (NNP Holiday) (NNP Inn)))))) (. ?)))"
