swda_filename,ptb_basename,conversation_no,transcript_index,act_tag,caller,turn_index,subutterance_index,text,pos,trees
K/KP/KP6.xml,KP6RE005,142606,0,,A,1,1,"If you have to translate any of these, when  --","[If/IN, you/PRP, have/VBP, to/TO, translate/VB, any/DT, of/IN, these/DT, ,/,, when/WRB, as/RB, soon/RB, as/IN, after/IN]","(ROOT (SBAR (IN If) (S (NP (PRP you)) (VP (VBP have) (S (VP (TO to) (VP (VP (VB translate) (NP (NP (DT any)) (PP (IN of) (NP (DT these))))) (, ,) (FRAG (WHADVP (WRB when)) (PP (RB as) (RB soon) (IN as) (ADVP (IN after)))))))))))"
K/KP/KP6.xml,KP6RE005,142606,1,,A,1,2,--as soon as after,"[If/IN, you/PRP, have/VBP, to/TO, translate/VB, any/DT, of/IN, these/DT, ,/,, when/WRB, as/RB, soon/RB, as/IN, after/IN]","(ROOT (SBAR (IN If) (S (NP (PRP you)) (VP (VBP have) (S (VP (TO to) (VP (VP (VB translate) (NP (NP (DT any)) (PP (IN of) (NP (DT these))))) (, ,) (FRAG (WHADVP (WRB when)) (PP (RB as) (RB soon) (IN as) (ADVP (IN after)))))))))))"
K/KP/KP6.xml,KP6RE005,142606,2,,A,1,3,Loopy.,"[Loopy/JJ, ./.]",(ROOT (FRAG (ADJP (JJ Loopy)) (. .)))
K/KP/KP6.xml,KP6RE005,142606,3,,A,1,4,or     <laughing> (()) </laughing> --,"[or/CC, then/RB, you/PRP, need/VBP, to/TO, take/VB, especial/NNP, care/NNP, ,/,, alright/NNP, ?/.]","(ROOT (S (CC or) (ADVP (RB then)) (NP (PRP you)) (VP (VBP need) (S (VP (TO to) (VP (VB take) (NP (NP (NNP especial) (NNP care)) (, ,) (NP (NNP alright))))))) (. ?)))"
K/KP/KP6.xml,KP6RE005,142606,4,,A,1,5,"--then you need to take especial care, alright?","[or/CC, then/RB, you/PRP, need/VBP, to/TO, take/VB, especial/NNP, care/NNP, ,/,, alright/NNP, ?/.]","(ROOT (S (CC or) (ADVP (RB then)) (NP (PRP you)) (VP (VBP need) (S (VP (TO to) (VP (VB take) (NP (NP (NNP especial) (NNP care)) (, ,) (NP (NNP alright))))))) (. ?)))"
K/KP/KP6.xml,KP6RE005,142606,5,,A,1,6,Time  --,"[Time/NN, time/NN, time/NN, time/NN, time/NN, time/NN, time/NN]",(ROOT (NP (NP (NN Time) (NN time)) (NP (NN time) (NN time)) (NP (NN time) (NN time) (NN time))))
K/KP/KP6.xml,KP6RE005,142606,6,,A,1,7,--time  --,"[Time/NN, time/NN, time/NN, time/NN, time/NN, time/NN, time/NN]",(ROOT (NP (NP (NN Time) (NN time)) (NP (NN time) (NN time)) (NP (NN time) (NN time) (NN time))))
K/KP/KP6.xml,KP6RE005,142606,7,,A,1,8,--time  --,"[Time/NN, time/NN, time/NN, time/NN, time/NN, time/NN, time/NN]",(ROOT (NP (NP (NN Time) (NN time)) (NP (NN time) (NN time)) (NP (NN time) (NN time) (NN time))))
K/KP/KP6.xml,KP6RE005,142606,8,,A,1,9,--time  --,"[Time/NN, time/NN, time/NN, time/NN, time/NN, time/NN, time/NN]",(ROOT (NP (NP (NN Time) (NN time)) (NP (NN time) (NN time)) (NP (NN time) (NN time) (NN time))))
K/KP/KP6.xml,KP6RE005,142606,9,,A,1,10,--time  --,"[Time/NN, time/NN, time/NN, time/NN, time/NN, time/NN, time/NN]",(ROOT (NP (NP (NN Time) (NN time)) (NP (NN time) (NN time)) (NP (NN time) (NN time) (NN time))))
K/KP/KP6.xml,KP6RE005,142606,10,,A,1,11,--time  --,"[Time/NN, time/NN, time/NN, time/NN, time/NN, time/NN, time/NN]",(ROOT (NP (NP (NN Time) (NN time)) (NP (NN time) (NN time)) (NP (NN time) (NN time) (NN time))))
K/KP/KP6.xml,KP6RE005,142606,11,,A,1,12,--time ,"[Time/NN, time/NN, time/NN, time/NN, time/NN, time/NN, time/NN]",(ROOT (NP (NP (NN Time) (NN time)) (NP (NN time) (NN time)) (NP (NN time) (NN time) (NN time))))
K/KP/KP6.xml,KP6RE005,142606,12,,A,1,13,<cough> ,[],X
K/KP/KP6.xml,KP6RE005,142606,13,,A,1,14,"time is like a Christmas card (()) , time, alright?","[time/NN, is/VBZ, like/IN, a/DT, Christmas/NNP, card/NN, ,/,, time/NN, ,/,, alright/NNP, ?/.]","(ROOT (S (NP (NN time)) (VP (VBZ is) (PP (IN like) (NP (NP (DT a) (NNP Christmas) (NN card)) (, ,) (NP (NP (NN time)) (, ,) (NP (NNP alright)))))) (. ?)))"
K/KP/KP6.xml,KP6RE005,142606,14,,A,1,15,"Any time you've got a time clause  <shouting> clause, what's clause </shouting> ?","[Any/DT, time/NN, you/PRP, 've/VBP, got/VBD, a/DT, time/NN, clause/NN, clause/NN, ,/,, what/WP, 's/VBZ, clause/NN, ?/.]","(ROOT (S (NP (DT Any) (NN time)) (NP (PRP you)) (VP (VBP 've) (VP (VBD got) (NP (NP (DT a) (NN time) (NN clause) (NN clause)) (, ,) (SBAR (WHNP (WP what)) (S (VP (VBZ 's) (NP (NN clause)))))))) (. ?)))"
K/KP/KP6.xml,KP6RE005,142606,15,,A,1,16,End of a cat's leg  (()) ,"[End/NN, of/IN, a/DT, cat/NN, 's/POS, leg/NN]",(ROOT (NP (NP (NN End)) (PP (IN of) (NP (NP (DT a) (NN cat) (POS 's)) (NN leg)))))
K/KP/KP6.xml,KP6RE005,142606,16,,B,2,1,Part of a statement ,"[Part/NN, of/IN, a/DT, statement/NN]",(ROOT (NP (NP (NN Part)) (PP (IN of) (NP (DT a) (NN statement)))))
K/KP/KP6.xml,KP6RE005,142606,17,,A,3,1,(()) ,[],X
K/KP/KP6.xml,KP6RE005,142606,18,,A,3,2,<laugh> ,[],X
K/KP/KP6.xml,KP6RE005,142606,19,,A,3,3,It's what's gonna happen in  (()) it's gonna come down the chimney.,"[It/PRP, 's/VBZ, what/WP, 's/VBZ, gonna/NNP, happen/VB, in/IN, it/PRP, 's/VBZ, gonna/NNP, come/VB, down/RP, the/DT, chimney/NN, ./.]",(ROOT (S (NP (PRP It)) (VP (VBZ 's) (SBAR (WHNP (WP what)) (S (VP (VBZ 's) (S (NP (NNP gonna)) (VP (VB happen) (SBAR (IN in) (S (NP (PRP it)) (VP (VBZ 's) (S (NP (NNP gonna)) (VP (VB come) (PRT (RP down)) (NP (DT the) (NN chimney))))))))))))) (. .)))
K/KP/KP6.xml,KP6RE005,142606,20,,A,3,4,Right every time you've got a floppy black time thing with a tail ,"[Right/JJ, every/DT, time/NN, you/PRP, 've/VBP, got/VBD, a/DT, floppy/JJ, black/JJ, time/NN, thing/NN, with/IN, a/DT, tail/NN]",(ROOT (FRAG (ADVP (JJ Right)) (NP (DT every) (NN time) (SBAR (S (NP (PRP you)) (VP (VBP 've) (VP (VBD got) (NP (DT a) (JJ floppy) (JJ black) (NN time) (NN thing)) (PP (IN with) (NP (DT a) (NN tail))))))))))
K/KP/KP6.xml,KP6RE005,142606,21,,A,3,5,<laugh> ,[],X
K/KP/KP6.xml,KP6RE005,142606,22,,A,3,6,that's the back of a cat.,"[that/DT, 's/VBZ, the/DT, back/NN, of/IN, a/DT, cat/NN, ./.]",(ROOT (S (NP (DT that)) (VP (VBZ 's) (NP (NP (DT the) (NN back)) (PP (IN of) (NP (DT a) (NN cat))))) (. .)))
K/KP/KP6.xml,KP6RE005,142606,23,,A,3,7,Every time ,"[Every/DT, time/NN]",(ROOT (FRAG (NP (DT Every) (NN time))))
K/KP/KP6.xml,KP6RE005,142606,24,,A,3,8,What's its name?,"[What/WP, 's/VBZ, its/PRP$, name/NN, ?/.]",(ROOT (SBARQ (WHNP (WP What)) (SQ (VBZ 's) (NP (PRP$ its) (NN name))) (. ?)))
K/KP/KP6.xml,KP6RE005,142606,25,,A,3,9,every time then ,"[every/DT, time/NN, then/RB]",(ROOT (FRAG (ADVP (DT every) (NN time)) (RB then)))
K/KP/KP6.xml,KP6RE005,142606,26,,A,3,10,"I still don't see what the relevance of that, that  (()) ","[I/PRP, still/RB, don/VBP, 't/PRP, see/VB, what/WP, the/DT, relevance/NN, of/IN, that/DT, ,/,, that/IN]","(ROOT (FRAG (S (NP (PRP I)) (ADVP (RB still)) (VP (VBP don) (SBAR (S (NP (PRP 't)) (VP (VB see) (S (NP (WP what)) (NP (NP (DT the) (NN relevance)) (PP (IN of) (NP (DT that)))))))) (, ,) (ADVP (IN that))))))"
K/KP/KP6.xml,KP6RE005,142606,27,,A,3,11,There's another one squashed behind my blackboard.,"[There/EX, 's/VBZ, another/DT, one/CD, squashed/JJ, behind/IN, my/PRP$, blackboard/NN, ./.]",(ROOT (S (NP (EX There)) (VP (VBZ 's) (NP (NP (DT another) (CD one)) (ADJP (JJ squashed) (PP (IN behind) (NP (PRP$ my) (NN blackboard)))))) (. .)))
K/KP/KP6.xml,KP6RE005,142606,28,,A,3,12,<laugh> ,[],X
K/KP/KP6.xml,KP6RE005,142606,29,,A,3,13,Erm every time you've got those words there in  (()) what I want you to do is pause   --,"[Erm/NN, every/DT, time/NN, you/PRP, 've/VBP, got/VBD, those/DT, words/NNS, there/RB, in/IN, what/WP, I/PRP, want/VBP, you/PRP, to/TO, do/VB, is/VBZ, pause/VB, into/IN, the/DT, time/NN, clause/NN]",(ROOT (S (NP (NP (NN Erm)) (SBAR (S (NP (DT every) (NN time)) (NP (PRP you)) (VP (VBP 've) (VP (VBD got) (NP (DT those) (NNS words)) (ADVP (RB there)) (PP (IN in) (SBAR (WHNP (WP what)) (S (NP (PRP I)) (VP (VBP want) (S (NP (PRP you)) (VP (TO to) (VP (VB do))))))))))))) (VP (VBZ is) (VP (VB pause) (PP (IN into) (NP (DT the) (NN time) (NN clause)))))))
K/KP/KP6.xml,KP6RE005,142606,30,,A,3,14,--(()) into the time clause ,"[Erm/NN, every/DT, time/NN, you/PRP, 've/VBP, got/VBD, those/DT, words/NNS, there/RB, in/IN, what/WP, I/PRP, want/VBP, you/PRP, to/TO, do/VB, is/VBZ, pause/VB, into/IN, the/DT, time/NN, clause/NN]",(ROOT (S (NP (NP (NN Erm)) (SBAR (S (NP (DT every) (NN time)) (NP (PRP you)) (VP (VBP 've) (VP (VBD got) (NP (DT those) (NNS words)) (ADVP (RB there)) (PP (IN in) (SBAR (WHNP (WP what)) (S (NP (PRP I)) (VP (VBP want) (S (NP (PRP you)) (VP (TO to) (VP (VB do))))))))))))) (VP (VBZ is) (VP (VB pause) (PP (IN into) (NP (DT the) (NN time) (NN clause)))))))
K/KP/KP6.xml,KP6RE005,142606,31,,B,4,1,<laugh> ,[],X
K/KP/KP6.xml,KP6RE005,142606,32,,A,5,1,<laughing> Oh dear </laughing> .,"[Oh/UH, dear/RB, ./.]",(ROOT (S (VP (NP (INTJ (UH Oh)) (NP (RB dear)))) (. .)))
K/KP/KP6.xml,KP6RE005,142606,33,,A,5,2,"and it is, it's gonna cost you marks, alright?","[and/CC, it/PRP, is/VBZ, ,/,, it/PRP, 's/VBZ, gonna/NNP, cost/VB, you/PRP, marks/NNS, ,/,, alright/NNP, ?/.]","(ROOT (S (S (CC and) (NP (PRP it)) (VP (VBZ is))) (, ,) (NP (PRP it)) (VP (VBZ 's) (S (NP (NNP gonna)) (VP (VB cost) (NP (PRP you)) (NP (NP (NNS marks)) (, ,) (NP (NNP alright)))))) (. ?)))"
K/KP/KP6.xml,KP6RE005,142606,34,,A,5,3,For example then all of you do the inimitable NMTs  --,"[For/IN, example/NN, then/RB, all/DT, of/IN, you/PRP, do/VBP, the/DT, inimitable/JJ, NMTs/NNS, and/CC, would/MD, 've/VB, lost/VBN, a/DT, mark/NN, ,/,, the/DT, real/JJ, thing/NN, is/VBZ, when/WRB, you/PRP, 've/VBP, got/VBD, a/DT, time/NN, clause/NN, stop/NN, ,/,, think/VB, and/CC, really/RB, focus/VB, on/IN, this/DT, meaning/NN, of/IN, the/DT, verb/VB, in/IN, the/DT, time/NN, clause/NN, ,/,, right/NN, ?/.]","(ROOT (S (PP (IN For) (NP (NN example))) (NP (RB then)) (NP (NP (DT all)) (PP (IN of) (NP (PRP you)))) (VP (VP (VBP do) (NP (DT the) (JJ inimitable) (NNS NMTs))) (CC and) (VP (MD would) (VP (VP (VB 've) (VP (VBN lost) (NP (NP (DT a) (NN mark)) (, ,) (NP (NP (DT the) (JJ real) (NN thing)) (SBAR (S (VP (VBZ is) (SBAR (WHADVP (WRB when)) (S (NP (PRP you)) (VP (VBP 've) (VP (VBD got) (NP (DT a) (NN time) (NN clause) (NN stop))))))))))))) (, ,) (VP (VB think)) (CC and) (ADVP (RB really)) (VP (VB focus) (PP (IN on) (NP (NP (DT this) (NN meaning)) (PP (IN of) (NP (DT the)))))))) (VP (VB verb) (PP (IN in) (NP (DT the) (NN time) (NN clause)))) (, ,) (NP (NN right))) (. ?)))"
K/KP/KP6.xml,KP6RE005,142606,35,,A,5,4,"--and would've lost a mark,(()) the real thing is when you've got a time clause stop, think and really focus on this meaning of the verb in the time clause, right?","[For/IN, example/NN, then/RB, all/DT, of/IN, you/PRP, do/VBP, the/DT, inimitable/JJ, NMTs/NNS, and/CC, would/MD, 've/VB, lost/VBN, a/DT, mark/NN, ,/,, the/DT, real/JJ, thing/NN, is/VBZ, when/WRB, you/PRP, 've/VBP, got/VBD, a/DT, time/NN, clause/NN, stop/NN, ,/,, think/VB, and/CC, really/RB, focus/VB, on/IN, this/DT, meaning/NN, of/IN, the/DT, verb/VB, in/IN, the/DT, time/NN, clause/NN, ,/,, right/NN, ?/.]","(ROOT (S (PP (IN For) (NP (NN example))) (NP (RB then)) (NP (NP (DT all)) (PP (IN of) (NP (PRP you)))) (VP (VP (VBP do) (NP (DT the) (JJ inimitable) (NNS NMTs))) (CC and) (VP (MD would) (VP (VP (VB 've) (VP (VBN lost) (NP (NP (DT a) (NN mark)) (, ,) (NP (NP (DT the) (JJ real) (NN thing)) (SBAR (S (VP (VBZ is) (SBAR (WHADVP (WRB when)) (S (NP (PRP you)) (VP (VBP 've) (VP (VBD got) (NP (DT a) (NN time) (NN clause) (NN stop))))))))))))) (, ,) (VP (VB think)) (CC and) (ADVP (RB really)) (VP (VB focus) (PP (IN on) (NP (NP (DT this) (NN meaning)) (PP (IN of) (NP (DT the)))))))) (VP (VB verb) (PP (IN in) (NP (DT the) (NN time) (NN clause)))) (, ,) (NP (NN right))) (. ?)))"
K/KP/KP6.xml,KP6RE005,142606,36,,A,5,5,"There are little tricks, for example, if it's a time clause, when you think to yourself oh God it's one of those lists, you sit down and calm yourself, take a Valium or whatever it is and just apply yourselves to that, right, what the next point is so the first thing I want you to do is stop at this time clause, when you realize it's a time clause I want you to go trot trot trot trot trot trot trot trot trot trot trot trot trot trot to the main verb, alright?","[There/EX, are/VBP, little/JJ, tricks/NNS, ,/,, for/IN, example/NN, ,/,, if/IN, it/PRP, 's/VBZ, a/DT, time/NN, clause/NN, ,/,, when/WRB, you/PRP, think/VBP, to/TO, yourself/PRP, oh/UH, God/NNP, it/PRP, 's/VBZ, one/CD, of/IN, those/DT, lists/NNS, ,/,, you/PRP, sit/VBP, down/RB, and/CC, calm/VB, yourself/PRP, ,/,, take/VB, a/DT, Valium/NN, or/CC, whatever/WDT, it/PRP, is/VBZ, and/CC, just/RB, apply/VB, yourselves/NNS, to/TO, that/DT, ,/,, right/RB, ,/,, what/WP, the/DT, next/JJ, point/NN, is/VBZ, so/IN, the/DT, first/JJ, thing/NN, I/PRP, want/VBP, you/PRP, to/TO, do/VB, is/VBZ, stop/VB, at/IN, this/DT, time/NN, clause/NN, ,/,, when/WRB, you/PRP, realize/VBP, it/PRP, 's/VBZ, a/DT, time/NN, clause/NN, I/PRP, want/VBP, you/PRP, to/TO, go/VB, trot/NNP, trot/NNP, trot/NNP, trot/NNP, trot/NNP, trot/NNP, trot/NNP, trot/NNP, trot/NNP, trot/NNP, trot/NNP, trot/NNP, trot/NNP, trot/NNP, to/TO, the/DT, main/JJ, verb/VB, ,/,, alright/VB, ?/.]","(ROOT (S (S (NP (EX There)) (VP (VBP are) (NP (JJ little) (NNS tricks)))) (, ,) (S (PP (IN for) (NP (NN example))) (, ,) (SBAR (IN if) (S (NP (PRP it)) (VP (VBZ 's) (NP (NP (DT a) (NN time) (NN clause)) (, ,) (SBAR (WHADVP (WRB when)) (S (NP (PRP you)) (VP (VBP think) (PP (TO to) (NP (PRP yourself))) (NP (INTJ (UH oh)) (NP (NNP God)))))))))) (NP (PRP it)) (VP (VBZ 's) (NP (NP (CD one)) (PP (IN of) (NP (DT those) (NNS lists)))))) (, ,) (S (NP (PRP you)) (VP (VP (VBP sit) (ADVP (RB down))) (CC and) (VP (VP (VB calm) (NP (PRP yourself))) (, ,) (VP (VB take) (NP (NP (DT a) (NN Valium)) (CC or) (SBAR (WHNP (WDT whatever)) (S (NP (PRP it)) (VP (VBZ is)))))) (CC and) (ADVP (RB just)) (VP (VB apply) (NP (NNS yourselves)) (PP (TO to) (NP (DT that))) (, ,) (ADVP (RB right)) (, ,) (SBAR (WHNP (WP what)) (S (NP (DT the) (JJ next) (NN point)) (VP (VBZ is) (SBAR (IN so) (S (NP (NP (DT the) (JJ first) (NN thing)) (SBAR (S (NP (PRP I)) (VP (VBP want) (S (NP (PRP you)) (VP (TO to) (VP (VB do)))))))) (VP (VBZ is) (ADJP (VB stop) (PP (IN at) (NP (NP (DT this) (NN time) (NN clause)) (, ,) (SBAR (WHADVP (WRB when)) (S (NP (PRP you)) (VP (VBP realize) (SBAR (S (NP (PRP it)) (VP (VBZ 's) (NP (NP (DT a) (NN time) (NN clause)) (SBAR (S (NP (PRP I)) (VP (VBP want) (S (NP (PRP you)) (VP (TO to) (VP (VB go) (S (NP (NP (NNP trot) (NNP trot) (NNP trot) (NNP trot) (NNP trot) (NNP trot) (NNP trot) (NNP trot) (NNP trot) (NNP trot) (NNP trot) (NNP trot) (NNP trot) (NNP trot)) (PP (TO to) (NP (DT the) (JJ main)))) (VP (VB verb))))))))))))))))))))))))))) (, ,) (VP (VB alright)))) (. ?)))"
K/KP/KP6.xml,KP6RE005,142606,37,,A,5,6,"Now the tense of the main verb, in other words not the bit in the when clause or the as soon as clause or whatever, normally  --","[Now/RB, the/DT, tense/JJ, of/IN, the/DT, main/JJ, verb/VB, ,/,, in/IN, other/JJ, words/NNS, not/RB, the/DT, bit/NN, in/IN, the/DT, when/WRB, clause/NN, or/CC, the/DT, as/RB, soon/RB, as/IN, clause/NN, or/CC, whatever/WDT, ,/,, normally/RB, virtually/RB, it/PRP, gives/VBZ, it/PRP, away/RB, because/IN, if/IN, it/PRP, 's/VBZ, future/JJ, in/IN, the/DT, main/JJ, the/DT, chances/NNS, are/VBP, extremely/RB, high/JJ, that/IN, it/PRP, 's/VBZ, going/VBG, to/TO, be/VB, future/JJ, in/IN, French/JJ, at/IN, least/JJS, in/IN, the/DT, time/NN, clause/NN, ./.]","(ROOT (S (ADVP (RB Now)) (S (NP (NP (DT the) (JJ tense)) (PP (IN of) (NP (DT the) (JJ main)))) (VP (VB verb) (, ,) (PP (IN in) (NP (JJ other) (NNS words))) (PP (NP (RB not) (DT the) (NN bit)) (IN in) (NP (DT the) (UCP (WHADVP (WRB when) (NP (NN clause))) (CC or) (PP (ADVP (NP (DT the) (RB as)) (RB soon)) (IN as))) (NN clause))))) (CC or) (S (NP (WDT whatever)) (, ,) (ADVP (RB normally)) (NP (RB virtually) (PRP it)) (VP (VBZ gives) (NP (PRP it)) (ADVP (RB away)) (SBAR (IN because) (S (SBAR (IN if) (S (NP (PRP it)) (VP (VBZ 's) (NP (NP (JJ future)) (PP (IN in) (NP (DT the) (JJ main))))))) (NP (DT the) (NNS chances)) (VP (VBP are) (ADJP (RB extremely) (JJ high) (SBAR (IN that) (S (NP (PRP it)) (VP (VBZ 's) (VP (VBG going) (S (VP (TO to) (VP (VB be) (NP (NP (JJ future)) (PP (IN in) (NP (NP (JJ French)) (ADVP (IN at) (JJS least)))) (PP (IN in) (NP (DT the) (NN time) (NN clause))))))))))))))))) (. .)))"
K/KP/KP6.xml,KP6RE005,142606,38,,A,5,7,--virtually it gives it away because if it's future in the main  --,"[Now/RB, the/DT, tense/JJ, of/IN, the/DT, main/JJ, verb/VB, ,/,, in/IN, other/JJ, words/NNS, not/RB, the/DT, bit/NN, in/IN, the/DT, when/WRB, clause/NN, or/CC, the/DT, as/RB, soon/RB, as/IN, clause/NN, or/CC, whatever/WDT, ,/,, normally/RB, virtually/RB, it/PRP, gives/VBZ, it/PRP, away/RB, because/IN, if/IN, it/PRP, 's/VBZ, future/JJ, in/IN, the/DT, main/JJ, the/DT, chances/NNS, are/VBP, extremely/RB, high/JJ, that/IN, it/PRP, 's/VBZ, going/VBG, to/TO, be/VB, future/JJ, in/IN, French/JJ, at/IN, least/JJS, in/IN, the/DT, time/NN, clause/NN, ./.]","(ROOT (S (ADVP (RB Now)) (S (NP (NP (DT the) (JJ tense)) (PP (IN of) (NP (DT the) (JJ main)))) (VP (VB verb) (, ,) (PP (IN in) (NP (JJ other) (NNS words))) (PP (NP (RB not) (DT the) (NN bit)) (IN in) (NP (DT the) (UCP (WHADVP (WRB when) (NP (NN clause))) (CC or) (PP (ADVP (NP (DT the) (RB as)) (RB soon)) (IN as))) (NN clause))))) (CC or) (S (NP (WDT whatever)) (, ,) (ADVP (RB normally)) (NP (RB virtually) (PRP it)) (VP (VBZ gives) (NP (PRP it)) (ADVP (RB away)) (SBAR (IN because) (S (SBAR (IN if) (S (NP (PRP it)) (VP (VBZ 's) (NP (NP (JJ future)) (PP (IN in) (NP (DT the) (JJ main))))))) (NP (DT the) (NNS chances)) (VP (VBP are) (ADJP (RB extremely) (JJ high) (SBAR (IN that) (S (NP (PRP it)) (VP (VBZ 's) (VP (VBG going) (S (VP (TO to) (VP (VB be) (NP (NP (JJ future)) (PP (IN in) (NP (NP (JJ French)) (ADVP (IN at) (JJS least)))) (PP (IN in) (NP (DT the) (NN time) (NN clause))))))))))))))))) (. .)))"
K/KP/KP6.xml,KP6RE005,142606,39,,A,5,8,--the chances are extremely high that it's going to be future in French at least in the time clause.,"[Now/RB, the/DT, tense/JJ, of/IN, the/DT, main/JJ, verb/VB, ,/,, in/IN, other/JJ, words/NNS, not/RB, the/DT, bit/NN, in/IN, the/DT, when/WRB, clause/NN, or/CC, the/DT, as/RB, soon/RB, as/IN, clause/NN, or/CC, whatever/WDT, ,/,, normally/RB, virtually/RB, it/PRP, gives/VBZ, it/PRP, away/RB, because/IN, if/IN, it/PRP, 's/VBZ, future/JJ, in/IN, the/DT, main/JJ, the/DT, chances/NNS, are/VBP, extremely/RB, high/JJ, that/IN, it/PRP, 's/VBZ, going/VBG, to/TO, be/VB, future/JJ, in/IN, French/JJ, at/IN, least/JJS, in/IN, the/DT, time/NN, clause/NN, ./.]","(ROOT (S (ADVP (RB Now)) (S (NP (NP (DT the) (JJ tense)) (PP (IN of) (NP (DT the) (JJ main)))) (VP (VB verb) (, ,) (PP (IN in) (NP (JJ other) (NNS words))) (PP (NP (RB not) (DT the) (NN bit)) (IN in) (NP (DT the) (UCP (WHADVP (WRB when) (NP (NN clause))) (CC or) (PP (ADVP (NP (DT the) (RB as)) (RB soon)) (IN as))) (NN clause))))) (CC or) (S (NP (WDT whatever)) (, ,) (ADVP (RB normally)) (NP (RB virtually) (PRP it)) (VP (VBZ gives) (NP (PRP it)) (ADVP (RB away)) (SBAR (IN because) (S (SBAR (IN if) (S (NP (PRP it)) (VP (VBZ 's) (NP (NP (JJ future)) (PP (IN in) (NP (DT the) (JJ main))))))) (NP (DT the) (NNS chances)) (VP (VBP are) (ADJP (RB extremely) (JJ high) (SBAR (IN that) (S (NP (PRP it)) (VP (VBZ 's) (VP (VBG going) (S (VP (TO to) (VP (VB be) (NP (NP (JJ future)) (PP (IN in) (NP (NP (JJ French)) (ADVP (IN at) (JJS least)))) (PP (IN in) (NP (DT the) (NN time) (NN clause))))))))))))))))) (. .)))"
K/KP/KP6.xml,KP6RE005,142606,40,,A,5,9,Okay?,"[Okay/UH, ?/.]",(ROOT (INTJ (UH Okay) (. ?)))
K/KP/KP6.xml,KP6RE005,142606,41,,A,5,10,Shall we do another one of those and pick up something Neil said earlier,"[Shall/MD, we/PRP, do/VB, another/DT, one/CD, of/IN, those/DT, and/CC, pick/VB, up/RP, something/NN, Neil/NNP, said/VBD, earlier/JJR]",(ROOT (SINV (MD Shall) (NP (PRP we)) (VP (VP (VB do) (NP (NP (DT another) (CD one)) (PP (IN of) (NP (DT those))))) (CC and) (VP (VB pick) (PRT (RP up)) (NP (NP (NN something)) (SBAR (S (NP (NNP Neil)) (VP (VBD said) (NP (JJR earlier))))))))))
K/KP/KP6.xml,KP6RE005,142606,42,,A,5,11,Yeah but I still don't understand what the boot's gotta do with it.,"[Yeah/UH, but/CC, I/PRP, still/RB, don/VBP, 't/PRP, understand/VB, what/WP, the/DT, boot/NN, 's/POS, gotta/NNP, do/VBP, with/IN, it/PRP, ./.]",(ROOT (SINV (S (INTJ (UH Yeah)) (NP (CC but)) (ADVP (PRP I)) (VP (ADVP (RB still)) (VBP don) (SBAR (S (NP (PRP 't)) (VP (VB understand) (S (NP (WP what)) (NP (NP (DT the) (NN boot) (POS 's)) (NNP gotta)))))))) (VP (VBP do) (PP (IN with))) (NP (PRP it)) (. .)))
K/KP/KP6.xml,KP6RE005,142606,43,,A,5,12,What what?,"[What/WDT, what/WP, ?/.]",(ROOT (FRAG (SBAR (WHNP (WDT What)) (FRAG (SBARQ (WHNP (WP what)) (. ?))))))
K/KP/KP6.xml,KP6RE005,142606,44,,A,5,13,What that skating bit's to do with it.,"[What/WDT, that/WDT, skating/VBG, bit/NN, 's/POS, to/TO, do/VB, with/IN, it/PRP, ./.]",(ROOT (FRAG (WHNP (WDT What)) (SBAR (WHNP (WDT that)) (S (VP (VBG skating) (NP (NP (NN bit)) (SBAR (S (NP (POS 's)) (VP (TO to) (VP (VB do) (PP (IN with) (NP (PRP it))))))))))) (. .)))
K/KP/KP6.xml,KP6RE005,142606,45,,A,5,14,What what?,"[What/WDT, what/WP, ?/.]",(ROOT (FRAG (SBAR (WHNP (WDT What)) (FRAG (SBARQ (WHNP (WP what)) (. ?))))))
K/KP/KP6.xml,KP6RE005,142606,46,,A,5,15,That skating bit got's to do  (()) ,"[That/DT, skating/VBG, bit/NN, got/VBD, 's/POS, to/TO, do/VB]",(ROOT (S (NP (DT That) (VBG skating) (NN bit)) (VP (VBD got) (SBAR (S (NP (POS 's)) (VP (TO to) (VP (VB do))))))))
K/KP/KP6.xml,KP6RE005,142606,47,,A,5,16,It's a it's a bell so it's an alarm bell.,"[It/PRP, 's/VBZ, a/DT, it/PRP, 's/VBZ, a/DT, bell/NN, so/IN, it/PRP, 's/VBZ, an/DT, alarm/NN, bell/NN, ./.]",(ROOT (S (NP (PRP It)) (VP (VBZ 's) (NP (DT a) (S (NP (PRP it)) (VP (VBZ 's) (NP (DT a) (NN bell)) (SBAR (IN so) (S (NP (PRP it)) (VP (VBZ 's) (NP (DT an) (NN alarm) (NN bell))))))))) (. .)))
K/KP/KP6.xml,KP6RE005,142606,48,,A,5,17,(()) ,[],X
K/KP/KP6.xml,KP6RE005,142606,49,,A,5,18,Oh I see!,"[Oh/UH, I/PRP, see/VBP, !/.]",(ROOT (S (S (INTJ (UH Oh)) (NP (PRP I)) (VP (VBP see))) (. !)))
K/KP/KP6.xml,KP6RE005,142606,50,,A,5,19,"And whenever, whenever you see a time clause press alarm  (()) ","[And/CC, whenever/WRB, ,/,, whenever/WRB, you/PRP, see/VBP, a/DT, time/NN, clause/NN, press/NN, alarm/NN]","(ROOT (FRAG (CC And) (S (VP (WRB whenever) (, ,) (SBAR (WHADVP (WRB whenever)) (S (NP (PRP you)) (VP (VBP see) (NP (DT a) (NN time) (NN clause) (NN press) (NN alarm)))))))))"
K/KP/KP6.xml,KP6RE005,142606,51,,A,5,20,<cough> ,[],X
K/KP/KP6.xml,KP6RE005,142606,52,,A,5,21,Anyway but what's the significance  (()) ,"[Anyway/RB, but/CC, what/WP, 's/VBZ, the/DT, significance/NN]",(ROOT (UCP (FRAG (ADVP (RB Anyway))) (CC but) (SBAR (WHNP (WP what)) (S (VP (VBZ 's) (NP (DT the) (NN significance)))))))
K/KP/KP6.xml,KP6RE005,142606,53,,A,5,22,(()) ,[],X
K/KP/KP6.xml,KP6RE005,142606,54,,A,5,23,(()) ,[],X
K/KP/KP6.xml,KP6RE005,142606,55,,A,5,24,(()) ,[],X
K/KP/KP6.xml,KP6RE005,142606,56,,B,6,1,<clears throat> ,[],X
K/KP/KP6.xml,KP6RE005,142606,57,,A,7,1,Time  --,"[Time/NNP, right/NNP, ,/,]","(ROOT (S (NP (NNP Time)) (VP (NNP right)) (, ,)))"
K/KP/KP6.xml,KP6RE005,142606,58,,A,7,2,"--right,(()) --","[Time/NNP, right/NNP, ,/,]","(ROOT (S (NP (NNP Time)) (VP (NNP right)) (, ,)))"
K/KP/KP6.xml,KP6RE005,142606,59,,A,7,3,--(()) ,"[Time/NNP, right/NNP, ,/,]","(ROOT (S (NP (NNP Time)) (VP (NNP right)) (, ,)))"
K/KP/KP6.xml,KP6RE005,142606,60,,A,7,4,(()) ,[],X
K/KP/KP6.xml,KP6RE005,142606,61,,A,7,5,"so it looks like you've got future there, then you go trot trot trot trot trot trot trot trot back  --","[so/IN, it/PRP, looks/VBZ, like/IN, you/PRP, 've/VBP, got/VBN, future/JJ, there/RB, ,/,, then/RB, you/PRP, go/VBP, trot/NNP, trot/NNP, trot/NNP, trot/NNP, trot/NNP, trot/NNP, trot/NNP, trot/NNP, back/RB, now/RB, you/PRP, 've/VBP, got/VBD, something/NN, slightly/RB, different/JJ, there/RB, here/RB, you/PRP, had/VBD, der/NNP, der/NNP, der/NNP, der/NNP, der/NNP, you/PRP, said/VBD, okay/JJ, ,/,, future/JJ, ,/,, then/RB, you/PRP, went/VBD, back/RB, there/RB, and/CC, you/PRP, found/VBD, that/IN, it/PRP, was/VBD, a/DT, present/JJ, tense/JJ, in/IN, English/NNP, ,/,, right/RB, ,/,, but/CC, you/PRP, needed/VBD, a/DT, future/NN, in/IN, French/JJ, because/IN, the/DT, whole/JJ, thing/NN, is/VBZ, future/JJ, ./.]","(ROOT (S (S (IN so) (NP (PRP it)) (VP (VBZ looks) (SBAR (IN like) (S (NP (PRP you)) (VP (VBP 've) (VP (VBN got) (NP (JJ future)) (ADVP (RB there)))))))) (, ,) (S (ADVP (RB then)) (NP (PRP you)) (VP (VBP go) (NP (NNP trot) (NNP trot) (NNP trot) (NNP trot) (NNP trot) (NNP trot) (NNP trot) (NNP trot)) (ADVP (RB back) (RB now)) (SBAR (S (NP (PRP you)) (VP (VBP 've) (VP (VBD got) (NP (NP (NN something)) (ADJP (RB slightly) (JJ different))) (ADVP (RB there) (RB here) (SBAR (S (NP (PRP you)) (VP (VBD had) (NP (NP (NNP der) (NNP der) (NNP der) (NNP der) (NNP der)) (SBAR (S (NP (PRP you)) (VP (VBD said) (ADJP (JJ okay)))))))))))))))) (, ,) (S (NP (JJ future)) (, ,) (ADVP (RB then)) (NP (PRP you)) (VP (VBD went) (ADVP (RB back) (RB there)))) (CC and) (S (S (NP (PRP you)) (VP (VBD found) (SBAR (IN that) (S (NP (PRP it)) (VP (VBD was) (NP (NP (DT a) (JJ present) (JJ tense)) (PP (IN in) (NP (NNP English)))) (, ,) (ADVP (RB right))))))) (, ,) (CC but) (S (NP (PRP you)) (VP (VBD needed) (NP (DT a) (NN future)) (PP (IN in) (NP (JJ French))) (SBAR (IN because) (S (NP (DT the) (JJ whole) (NN thing)) (VP (VBZ is) (NP (JJ future)))))))) (. .)))"
