swda_filename,ptb_basename,conversation_no,transcript_index,act_tag,caller,turn_index,subutterance_index,text,pos,trees
K/KB/KB7.xml,KB7RE01H,19202,140,,B,102,3,"--wanted to as a  (()) without being asked to do it, I would of gone and seen personnel and asked, I would not of dreamed of doing it in a work's situation unless I was asked, say anything personal I'd turned it off  --","[it/PRP, 's/VBZ, completely/RB, anonymous/JJ, number/NN, you/PRP, know/VBP, it/PRP, 's/VBZ, only/RB, to/TO, be/VB, on/IN, that/DT, ,/,, said/VBD, I/PRP, 'll/MD, wipe/VB, it/PRP, off/RP, then/RB, ,/,, you/PRP, bloody/JJ, well/RB, won/VBN, 't/PRP, ,/,, I/PRP, think/VBP, he/PRP, wants/VBZ, to/TO, tell/VB, people/NNS, before/IN, he/PRP, can/MD, say/VB, very/RB, wrong/JJ, ,/,, could/MD, say/VB, something/NN, personal/JJ, ,/,, if/IN, it/PRP, was/VBD, personal/JJ, ,/,, no/RB, longer/RB, it/PRP, ,/,, no/DT, you/PRP, weren/VBP, 't/PRP, personal/JJ, to/TO, you/PRP, ,/,, but/CC, I/PRP, 'm/VBP, quite/RB, happy/JJ, to/TO, arrange/VB, it/PRP, if/IN, you/PRP, wish/VBP, ,/,, no/DT, ,/,, no/DT, ,/,, no/DT, ,/,, no/DT, ,/,, no/DT, ,/,, ,/,, I/PRP, shouldn/VBP, 't/PRP, have/VB, to/TO, tell/VB, you/PRP, not/RB, to/TO, take/VB, my/PRP$, points/NNS, in/IN, full/JJ, ,/,, there/EX, we/PRP, go/VBP, it/PRP, 's/VBZ, driving/VBG, me/PRP, doing/VBG, that/IN, in/IN, the/DT, factory/NN, having/VBG, without/IN, people/NNS, 's/POS, permission/NN, ,/,, I/PRP, want/VBP, to/TO, know/VB, ,/,, I/PRP, ask/VBP, permission/NN, if/IN, I/PRP, 'd/MD, er/NN, wanted/VBD, to/TO, as/IN, a/DT, without/IN, being/VBG, asked/VBN, to/TO, do/VB, it/PRP, ,/,, I/PRP, would/MD, of/IN, gone/VBN, and/CC, seen/VBN, personnel/NNS, and/CC, asked/VBD, ,/,, I/PRP, would/MD, not/RB, of/IN, dreamed/VBN, of/IN, doing/VBG, it/PRP, in/IN, a/DT, work/NN, 's/POS, situation/NN, unless/IN, I/PRP, was/VBD, asked/VBN, ,/,, say/VB, anything/NN, personal/JJ, I/PRP, 'd/MD, turned/VBD, it/PRP, off/RP, not/RB, that/IN, it/PRP, ,/,, apart/RB, from/IN, me/PRP, and/CC, Stuart/NNP]","(X (PRP it) (VBZ 's) (RB completely) (JJ anonymous) (NN number) (PRP you) (VBP know) (PRP it) (VBZ 's) (RB only) (TO to) (VB be) (IN on) (DT that) (, ,) (VBD said) (PRP I) (MD 'll) (VB wipe) (PRP it) (RP off) (RB then) (, ,) (PRP you) (JJ bloody) (RB well) (VBN won) (PRP 't) (, ,) (PRP I) (VBP think) (PRP he) (VBZ wants) (TO to) (VB tell) (NNS people) (IN before) (PRP he) (MD can) (VB say) (RB very) (JJ wrong) (, ,) (MD could) (VB say) (NN something) (JJ personal) (, ,) (IN if) (PRP it) (VBD was) (JJ personal) (, ,) (RB no) (RB longer) (PRP it) (, ,) (DT no) (PRP you) (VBP weren) (PRP 't) (JJ personal) (TO to) (PRP you) (, ,) (CC but) (PRP I) (VBP 'm) (RB quite) (JJ happy) (TO to) (VB arrange) (PRP it) (IN if) (PRP you) (VBP wish) (, ,) (DT no) (, ,) (DT no) (, ,) (DT no) (, ,) (DT no) (, ,) (DT no) (, ,) (, ,) (PRP I) (VBP shouldn) (PRP 't) (VB have) (TO to) (VB tell) (PRP you) (RB not) (TO to) (VB take) (PRP$ my) (NNS points) (IN in) (JJ full) (, ,) (EX there) (PRP we) (VBP go) (PRP it) (VBZ 's) (VBG driving) (PRP me) (VBG doing) (IN that) (IN in) (DT the) (NN factory) (VBG having) (IN without) (NNS people) (POS 's) (NN permission) (, ,) (PRP I) (VBP want) (TO to) (VB know) (, ,) (PRP I) (VBP ask) (NN permission) (IN if) (PRP I) (MD 'd) (NN er) (VBD wanted) (TO to) (IN as) (DT a) (IN without) (VBG being) (VBN asked) (TO to) (VB do) (PRP it) (, ,) (PRP I) (MD would) (IN of) (VBN gone) (CC and) (VBN seen) (NNS personnel) (CC and) (VBD asked) (, ,) (PRP I) (MD would) (RB not) (IN of) (VBN dreamed) (IN of) (VBG doing) (PRP it) (IN in) (DT a) (NN work) (POS 's) (NN situation) (IN unless) (PRP I) (VBD was) (VBN asked) (, ,) (VB say) (NN anything) (JJ personal) (PRP I) (MD 'd) (VBD turned) (PRP it) (RP off) (RB not) (IN that) (PRP it) (, ,) (RB apart) (IN from) (PRP me) (CC and) (NNP Stuart))"
K/KB/KB7.xml,KB7RE01H,19202,141,,B,102,4,"--not that it, apart from me and Stuart","[it/PRP, 's/VBZ, completely/RB, anonymous/JJ, number/NN, you/PRP, know/VBP, it/PRP, 's/VBZ, only/RB, to/TO, be/VB, on/IN, that/DT, ,/,, said/VBD, I/PRP, 'll/MD, wipe/VB, it/PRP, off/RP, then/RB, ,/,, you/PRP, bloody/JJ, well/RB, won/VBN, 't/PRP, ,/,, I/PRP, think/VBP, he/PRP, wants/VBZ, to/TO, tell/VB, people/NNS, before/IN, he/PRP, can/MD, say/VB, very/RB, wrong/JJ, ,/,, could/MD, say/VB, something/NN, personal/JJ, ,/,, if/IN, it/PRP, was/VBD, personal/JJ, ,/,, no/RB, longer/RB, it/PRP, ,/,, no/DT, you/PRP, weren/VBP, 't/PRP, personal/JJ, to/TO, you/PRP, ,/,, but/CC, I/PRP, 'm/VBP, quite/RB, happy/JJ, to/TO, arrange/VB, it/PRP, if/IN, you/PRP, wish/VBP, ,/,, no/DT, ,/,, no/DT, ,/,, no/DT, ,/,, no/DT, ,/,, no/DT, ,/,, ,/,, I/PRP, shouldn/VBP, 't/PRP, have/VB, to/TO, tell/VB, you/PRP, not/RB, to/TO, take/VB, my/PRP$, points/NNS, in/IN, full/JJ, ,/,, there/EX, we/PRP, go/VBP, it/PRP, 's/VBZ, driving/VBG, me/PRP, doing/VBG, that/IN, in/IN, the/DT, factory/NN, having/VBG, without/IN, people/NNS, 's/POS, permission/NN, ,/,, I/PRP, want/VBP, to/TO, know/VB, ,/,, I/PRP, ask/VBP, permission/NN, if/IN, I/PRP, 'd/MD, er/NN, wanted/VBD, to/TO, as/IN, a/DT, without/IN, being/VBG, asked/VBN, to/TO, do/VB, it/PRP, ,/,, I/PRP, would/MD, of/IN, gone/VBN, and/CC, seen/VBN, personnel/NNS, and/CC, asked/VBD, ,/,, I/PRP, would/MD, not/RB, of/IN, dreamed/VBN, of/IN, doing/VBG, it/PRP, in/IN, a/DT, work/NN, 's/POS, situation/NN, unless/IN, I/PRP, was/VBD, asked/VBN, ,/,, say/VB, anything/NN, personal/JJ, I/PRP, 'd/MD, turned/VBD, it/PRP, off/RP, not/RB, that/IN, it/PRP, ,/,, apart/RB, from/IN, me/PRP, and/CC, Stuart/NNP]","(X (PRP it) (VBZ 's) (RB completely) (JJ anonymous) (NN number) (PRP you) (VBP know) (PRP it) (VBZ 's) (RB only) (TO to) (VB be) (IN on) (DT that) (, ,) (VBD said) (PRP I) (MD 'll) (VB wipe) (PRP it) (RP off) (RB then) (, ,) (PRP you) (JJ bloody) (RB well) (VBN won) (PRP 't) (, ,) (PRP I) (VBP think) (PRP he) (VBZ wants) (TO to) (VB tell) (NNS people) (IN before) (PRP he) (MD can) (VB say) (RB very) (JJ wrong) (, ,) (MD could) (VB say) (NN something) (JJ personal) (, ,) (IN if) (PRP it) (VBD was) (JJ personal) (, ,) (RB no) (RB longer) (PRP it) (, ,) (DT no) (PRP you) (VBP weren) (PRP 't) (JJ personal) (TO to) (PRP you) (, ,) (CC but) (PRP I) (VBP 'm) (RB quite) (JJ happy) (TO to) (VB arrange) (PRP it) (IN if) (PRP you) (VBP wish) (, ,) (DT no) (, ,) (DT no) (, ,) (DT no) (, ,) (DT no) (, ,) (DT no) (, ,) (, ,) (PRP I) (VBP shouldn) (PRP 't) (VB have) (TO to) (VB tell) (PRP you) (RB not) (TO to) (VB take) (PRP$ my) (NNS points) (IN in) (JJ full) (, ,) (EX there) (PRP we) (VBP go) (PRP it) (VBZ 's) (VBG driving) (PRP me) (VBG doing) (IN that) (IN in) (DT the) (NN factory) (VBG having) (IN without) (NNS people) (POS 's) (NN permission) (, ,) (PRP I) (VBP want) (TO to) (VB know) (, ,) (PRP I) (VBP ask) (NN permission) (IN if) (PRP I) (MD 'd) (NN er) (VBD wanted) (TO to) (IN as) (DT a) (IN without) (VBG being) (VBN asked) (TO to) (VB do) (PRP it) (, ,) (PRP I) (MD would) (IN of) (VBN gone) (CC and) (VBN seen) (NNS personnel) (CC and) (VBD asked) (, ,) (PRP I) (MD would) (RB not) (IN of) (VBN dreamed) (IN of) (VBG doing) (PRP it) (IN in) (DT a) (NN work) (POS 's) (NN situation) (IN unless) (PRP I) (VBD was) (VBN asked) (, ,) (VB say) (NN anything) (JJ personal) (PRP I) (MD 'd) (VBD turned) (PRP it) (RP off) (RB not) (IN that) (PRP it) (, ,) (RB apart) (IN from) (PRP me) (CC and) (NNP Stuart))"
K/KB/KB7.xml,KB7RE01H,19202,142,,A,103,1,Go on.,"[Go/VB, on/IN, ./.]",(ROOT (S (VP (VB Go) (PP (IN on))) (. .)))
K/KB/KB7.xml,KB7RE01H,19202,143,,B,104,1,"apart from me and Stuart there's nothing personal on it really, we went me and er telling me about her problems I only put that on a tape do you?","[apart/RB, from/IN, me/PRP, and/CC, Stuart/NNP, there/EX, 's/VBZ, nothing/NN, personal/JJ, on/IN, it/PRP, really/RB, ,/,, we/PRP, went/VBD, me/PRP, and/CC, er/NN, telling/VBG, me/PRP, about/IN, her/PRP$, problems/NNS, I/PRP, only/RB, put/VBD, that/DT, on/IN, a/DT, tape/NN, do/VBP, you/PRP, ?/.]","(ROOT (S (S (ADVP (RB apart) (PP (IN from) (NP (NP (PRP me)) (CC and) (NP (NNP Stuart))))) (NP (EX there)) (VP (VBZ 's) (ADJP (NN nothing) (JJ personal) (PP (IN on) (NP (PRP it)))) (ADVP (RB really)))) (, ,) (S (NP (PRP we)) (VP (VBD went) (NP (PRP me)))) (CC and) (S (NP (NP (NN er)) (VP (VBG telling) (NP (PRP me)) (PP (IN about) (NP (PRP$ her) (NNS problems))) (SBAR (S (NP (PRP I)) (ADVP (RB only)) (VP (VBD put) (NP (DT that)) (PP (IN on) (NP (DT a) (NN tape)))))))) (VP (VBP do) (NP (PRP you)))) (. ?)))"
K/KB/KB7.xml,KB7RE01H,19202,144,,A,105,1,"<laugh> , its not er","[,/,, its/PRP$, not/RB, er/NN]","(ROOT (FRAG (, ,) (NP (PRP$ its) (RB not) (NN er))))"
K/KB/KB7.xml,KB7RE01H,19202,145,,B,106,1,"you know, anything personal like that you turn it off don't you?--","[you/PRP, know/VBP, ,/,, anything/NN, personal/JJ, like/IN, that/IN, you/PRP, turn/VBP, it/PRP, off/RP, don/NNP, 't/PRP, you/PRP, ?not/VBP, that/IN, they/PRP, know/VBP, or/CC, care/VBP, whi-/JJ, anyone/NN, 's/POS, personal/JJ, problems/NNS, anyway/RB, ,/,, they/PRP, don/VBP, 't/PRP, know/VB, who/WP, we/PRP, are/VBP]","(ROOT (S (NP (PRP you)) (VP (VBP know) (SBAR (S (, ,) (S (NP (NP (NN anything)) (SBAR (WHNP (NP (JJ personal)) (PP (IN like) (SBAR (IN that) (S (NP (PRP you)) (VP (VBP turn) (NP (PRP it)) (PRT (RP off))))))) (S (VP (NNP don) (S (NP (PRP 't)) (NP (PRP you))))))) (VP (VBP ?not) (SBAR (IN that) (S (NP (PRP they)) (VP (VBP know) (CC or) (VBP care) (NP (NP (JJ whi-) (NN anyone) (POS 's)) (NX (JJ personal) (NNS problems))) (ADVP (RB anyway))))))) (, ,) (NP (PRP they)) (VP (VBP don) (S (NP (PRP 't)) (VP (VB know) (SBAR (WHNP (WP who)) (S (NP (PRP we)) (VP (VBP are))))))))))))"
K/KB/KB7.xml,KB7RE01H,19202,146,,B,106,2,"--not that they know or care whi- anyone's personal problems anyway, they don't know who we are ","[you/PRP, know/VBP, ,/,, anything/NN, personal/JJ, like/IN, that/IN, you/PRP, turn/VBP, it/PRP, off/RP, don/NNP, 't/PRP, you/PRP, ?not/VBP, that/IN, they/PRP, know/VBP, or/CC, care/VBP, whi-/JJ, anyone/NN, 's/POS, personal/JJ, problems/NNS, anyway/RB, ,/,, they/PRP, don/VBP, 't/PRP, know/VB, who/WP, we/PRP, are/VBP]","(ROOT (S (NP (PRP you)) (VP (VBP know) (SBAR (S (, ,) (S (NP (NP (NN anything)) (SBAR (WHNP (NP (JJ personal)) (PP (IN like) (SBAR (IN that) (S (NP (PRP you)) (VP (VBP turn) (NP (PRP it)) (PRT (RP off))))))) (S (VP (NNP don) (S (NP (PRP 't)) (NP (PRP you))))))) (VP (VBP ?not) (SBAR (IN that) (S (NP (PRP they)) (VP (VBP know) (CC or) (VBP care) (NP (NP (JJ whi-) (NN anyone) (POS 's)) (NX (JJ personal) (NNS problems))) (ADVP (RB anyway))))))) (, ,) (NP (PRP they)) (VP (VBP don) (S (NP (PRP 't)) (VP (VB know) (SBAR (WHNP (WP who)) (S (NP (PRP we)) (VP (VBP are))))))))))))"
K/KB/KB7.xml,KB7RE01H,19202,147,,A,107,1,Cos a conversation like that very well be  --,"[Cos/NNP, a/DT, conversation/NN, like/IN, that/DT, very/RB, well/RB, be/VB, a/DT, private/JJ, person/NN, will/MD, not/RB, be/VB, a/DT]",(ROOT (S (NP (NP (NNP Cos)) (SBAR (S (NP (NP (DT a) (NN conversation)) (PP (IN like) (NP (DT that)))) (ADVP (RB very) (RB well)) (VP (VB be) (NP (DT a) (JJ private) (NN person)))))) (VP (MD will) (RB not) (VP (VB be) (NP (DT a))))))
K/KB/KB7.xml,KB7RE01H,19202,148,,A,107,2,--a private person will not be a ,"[Cos/NNP, a/DT, conversation/NN, like/IN, that/DT, very/RB, well/RB, be/VB, a/DT, private/JJ, person/NN, will/MD, not/RB, be/VB, a/DT]",(ROOT (S (NP (NP (NNP Cos)) (SBAR (S (NP (NP (DT a) (NN conversation)) (PP (IN like) (NP (DT that)))) (ADVP (RB very) (RB well)) (VP (VB be) (NP (DT a) (JJ private) (NN person)))))) (VP (MD will) (RB not) (VP (VB be) (NP (DT a))))))
K/KB/KB7.xml,KB7RE01H,19202,149,,B,108,1,(()) ,[],X
K/KB/KB7.xml,KB7RE01H,19202,150,,A,109,1,"but then again you, you might, you might come up and say, say something that  --","[but/CC, then/RB, again/RB, you/PRP, ,/,, you/PRP, might/MD, ,/,, you/PRP, might/MD, come/VB, up/RB, and/CC, say/VB, ,/,, say/VB, something/NN, that/IN, that/IN, they/PRP, wanna/NNP, hear/VB, ,/,, you/PRP, wanna/NNP, hear/VB, ?/.]","(ROOT (S (CC but) (ADVP (RB then)) (ADVP (RB again)) (NP (PRP you)) (, ,) (NP (PRP you)) (VP (MD might) (PRN (, ,) (S (NP (PRP you)) (VP (MD might) (VP (VP (VB come) (ADVP (RB up))) (CC and) (VP (VB say))))) (, ,)) (VP (VB say) (NP (NN something)) (SBAR (IN that) (IN that) (S (NP (NP (PRP they)) (NP (NNP wanna))) (VP (VB hear) (, ,) (S (NP (PRP you)) (NP (NNP wanna)) (S (VP (VB hear))))))))) (. ?)))"
K/KB/KB7.xml,KB7RE01H,19202,151,,A,109,2,"--that they wanna hear, you wanna hear?","[but/CC, then/RB, again/RB, you/PRP, ,/,, you/PRP, might/MD, ,/,, you/PRP, might/MD, come/VB, up/RB, and/CC, say/VB, ,/,, say/VB, something/NN, that/IN, that/IN, they/PRP, wanna/NNP, hear/VB, ,/,, you/PRP, wanna/NNP, hear/VB, ?/.]","(ROOT (S (CC but) (ADVP (RB then)) (ADVP (RB again)) (NP (PRP you)) (, ,) (NP (PRP you)) (VP (MD might) (PRN (, ,) (S (NP (PRP you)) (VP (MD might) (VP (VP (VB come) (ADVP (RB up))) (CC and) (VP (VB say))))) (, ,)) (VP (VB say) (NP (NN something)) (SBAR (IN that) (IN that) (S (NP (NP (PRP they)) (NP (NNP wanna))) (VP (VB hear) (, ,) (S (NP (PRP you)) (NP (NNP wanna)) (S (VP (VB hear))))))))) (. ?)))"
K/KB/KB7.xml,KB7RE01H,19202,152,,B,110,1,"Yeah, but","[Yeah/UH, ,/,, but/CC]","(ROOT (FRAG (INTJ (UH Yeah)) (, ,) (ADVP (CC but))))"
K/KB/KB7.xml,KB7RE01H,19202,153,,A,111,1,"No, but you said you","[No/DT, ,/,, but/CC, you/PRP, said/VBD, you/PRP]","(ROOT (S (NP (NP (DT No)) (, ,) (PP (CC but) (NP (PRP you)))) (VP (VBD said) (NP (PRP you)))))"
K/KB/KB7.xml,KB7RE01H,19202,154,,B,112,1,yeah,[yeah/UH],(ROOT (INTJ (UH yeah)))
K/KB/KB7.xml,KB7RE01H,19202,155,,A,113,1,that's what I mean,"[that/DT, 's/VBZ, what/WP, I/PRP, mean/VBP]",(ROOT (S (NP (DT that)) (VP (VBZ 's) (SBAR (WHNP (WP what)) (S (NP (PRP I)) (VP (VBP mean)))))))
K/KB/KB7.xml,KB7RE01H,19202,156,,B,114,1,"the person have a private conversation and let someone say it to me and it, what they, problems it's not something that you wanna be on somebody else's to listen to is it?","[the/DT, person/NN, have/VBP, a/DT, private/JJ, conversation/NN, and/CC, let/VB, someone/NN, say/VBP, it/PRP, to/TO, me/PRP, and/CC, it/PRP, ,/,, what/WP, they/PRP, ,/,, problems/NNS, it/PRP, 's/VBZ, not/RB, something/NN, that/IN, you/PRP, wanna/NNP, be/VB, on/IN, somebody/NN, else/RB, 's/VBZ, to/TO, listen/VB, to/TO, is/VBZ, it/PRP, ?/.]","(ROOT (S (NP (DT the) (NN person)) (VP (VP (VBP have) (NP (DT a) (JJ private) (NN conversation))) (CC and) (VP (VB let) (SBAR (S (NP (NN someone)) (VP (VBP say) (NP (PRP it)) (PP (TO to) (NP (NP (PRP me)) (CC and) (NP (PRP it)))) (, ,) (SBAR (WHNP (WP what)) (S (NP (PRP they)) (, ,) (NP (NP (NNS problems)) (SBAR (S (NP (PRP it)) (VP (VBZ 's) (RB not) (NP (NN something)) (SBAR (IN that) (S (NP (NP (PRP you)) (SBAR (S (NP (NNP wanna)) (VP (VB be) (PP (IN on) (NP (NN somebody) (RB else))))))) (VP (VBZ 's) (S (VP (TO to) (VP (VB listen) (PP (TO to)))))))))))) (VP (VBZ is) (NP (PRP it)))))))))) (. ?)))"
K/KB/KB7.xml,KB7RE01H,19202,157,,B,114,2,"You just don't do it, you know its anonymous.","[You/PRP, just/RB, don/VBP, 't/PRP, do/VB, it/PRP, ,/,, you/PRP, know/VBP, its/PRP$, anonymous/JJ, ./.]","(ROOT (S (S (NP (PRP You)) (ADVP (RB just)) (VP (VBP don) (S (NP (PRP 't)) (VP (VB do) (NP (PRP it)))))) (, ,) (NP (PRP you)) (VP (VBP know) (NP (PRP$ its) (JJ anonymous))) (. .)))"
K/KB/KB7.xml,KB7RE01H,19202,158,,A,115,1,(()) ,[],X
K/KB/KB7.xml,KB7RE01H,19202,159,,B,116,1,Deirdre's the only person that's erm  --,"[Deirdre/NNP, 's/POS, the/DT, only/JJ, person/NN, that/WDT, 's/VBZ, erm/NN, got/VBD, one/CD, I/PRP, on/IN, there/EX]",(ROOT (S (NP (NP (NP (NNP Deirdre) (POS 's)) (NP (DT the) (JJ only) (NN person))) (SBAR (WHNP (WDT that)) (S (VP (VBZ 's) (NP (NN erm)))))) (VP (VBD got) (NP (CD one)) (PP (NP (PRP I)) (IN on) (NP (EX there))))))
K/KB/KB7.xml,KB7RE01H,19202,160,,B,116,2,--got one  --,"[Deirdre/NNP, 's/POS, the/DT, only/JJ, person/NN, that/WDT, 's/VBZ, erm/NN, got/VBD, one/CD, I/PRP, on/IN, there/EX]",(ROOT (S (NP (NP (NP (NNP Deirdre) (POS 's)) (NP (DT the) (JJ only) (NN person))) (SBAR (WHNP (WDT that)) (S (VP (VBZ 's) (NP (NN erm)))))) (VP (VBD got) (NP (CD one)) (PP (NP (PRP I)) (IN on) (NP (EX there))))))
K/KB/KB7.xml,KB7RE01H,19202,161,,B,116,3,--I  (()) on there ,"[Deirdre/NNP, 's/POS, the/DT, only/JJ, person/NN, that/WDT, 's/VBZ, erm/NN, got/VBD, one/CD, I/PRP, on/IN, there/EX]",(ROOT (S (NP (NP (NP (NNP Deirdre) (POS 's)) (NP (DT the) (JJ only) (NN person))) (SBAR (WHNP (WDT that)) (S (VP (VBZ 's) (NP (NN erm)))))) (VP (VBD got) (NP (CD one)) (PP (NP (PRP I)) (IN on) (NP (EX there))))))
K/KB/KB7.xml,KB7RE01H,19202,162,,A,117,1,Saw her car,"[Saw/VBD, her/PRP, car/NN]",(ROOT (SINV (VP (VBD Saw) (NP (PRP her))) (NP (NN car))))
K/KB/KB7.xml,KB7RE01H,19202,163,,B,118,1,Well (()) ,[Well/RB],(ROOT (INTJ (RB Well)))
K/KB/KB7.xml,KB7RE01H,19202,164,,A,119,1,I thought I was gonna hit a tree  (()) ,"[I/PRP, thought/VBD, I/PRP, was/VBD, gonna/NNP, hit/VBD, a/DT, tree/NN]",(ROOT (S (NP (PRP I)) (VP (VBD thought) (SBAR (S (NP (PRP I)) (VP (VBD was) (NP (NP (NNP gonna)) (SBAR (S (VP (VBD hit) (NP (DT a) (NN tree))))))))))))
K/KB/KB7.xml,KB7RE01H,19202,165,,B,120,1,I suppose I had better make a move to get some clothes on you think?,"[I/PRP, suppose/VBP, I/PRP, had/VBD, better/RBR, make/VB, a/DT, move/NN, to/TO, get/VB, some/DT, clothes/NNS, on/IN, you/PRP, think/VB, ?/.]",(ROOT (S (NP (PRP I)) (VP (VBP suppose) (SBAR (S (NP (PRP I)) (VP (VBD had) (ADVP (RBR better)) (VP (VB make) (NP (DT a) (NN move) (S (VP (TO to) (VP (VB get) (S (NP (NP (DT some) (NNS clothes)) (PP (IN on) (NP (PRP you)))) (VP (VB think)))))))))))) (. ?)))
K/KB/KB7.xml,KB7RE01H,19202,166,,A,121,1,Well you needn't bother.,"[Well/RB, you/PRP, needn/VBP, 't/PRP, bother/VB, ./.]",(ROOT (S (ADVP (RB Well)) (NP (PRP you)) (VP (VBP needn) (S (NP (PRP 't)) (VP (VB bother)))) (. .)))
K/KB/KB7.xml,KB7RE01H,19202,167,,B,122,1,No  --,"[No/DT, won/VBD, 't/PRP, go/VB, nowhere/RB, that/IN, I/PRP, do/VBP]",(ROOT (S (NP (DT No)) (VP (VBD won) (S (NP (PRP 't)) (VP (VB go) (NP (RB nowhere)) (SBAR (IN that) (S (NP (PRP I)) (VP (VBP do)))))))))
K/KB/KB7.xml,KB7RE01H,19202,168,,B,122,2,--won't go nowhere  --,"[No/DT, won/VBD, 't/PRP, go/VB, nowhere/RB, that/IN, I/PRP, do/VBP]",(ROOT (S (NP (DT No)) (VP (VBD won) (S (NP (PRP 't)) (VP (VB go) (NP (RB nowhere)) (SBAR (IN that) (S (NP (PRP I)) (VP (VBP do)))))))))
K/KB/KB7.xml,KB7RE01H,19202,169,,B,122,3,--that I do (()) ,"[No/DT, won/VBD, 't/PRP, go/VB, nowhere/RB, that/IN, I/PRP, do/VBP]",(ROOT (S (NP (DT No)) (VP (VBD won) (S (NP (PRP 't)) (VP (VB go) (NP (RB nowhere)) (SBAR (IN that) (S (NP (PRP I)) (VP (VBP do)))))))))
