swda_filename,ptb_basename,conversation_no,transcript_index,act_tag,caller,turn_index,subutterance_index,text,pos,trees
K/KP/KP6.xml,KP6RE005,142606,62,,A,7,6,--now you've got something slightly different there  --,"[so/IN, it/PRP, looks/VBZ, like/IN, you/PRP, 've/VBP, got/VBN, future/JJ, there/RB, ,/,, then/RB, you/PRP, go/VBP, trot/NNP, trot/NNP, trot/NNP, trot/NNP, trot/NNP, trot/NNP, trot/NNP, trot/NNP, back/RB, now/RB, you/PRP, 've/VBP, got/VBD, something/NN, slightly/RB, different/JJ, there/RB, here/RB, you/PRP, had/VBD, der/NNP, der/NNP, der/NNP, der/NNP, der/NNP, you/PRP, said/VBD, okay/JJ, ,/,, future/JJ, ,/,, then/RB, you/PRP, went/VBD, back/RB, there/RB, and/CC, you/PRP, found/VBD, that/IN, it/PRP, was/VBD, a/DT, present/JJ, tense/JJ, in/IN, English/NNP, ,/,, right/RB, ,/,, but/CC, you/PRP, needed/VBD, a/DT, future/NN, in/IN, French/JJ, because/IN, the/DT, whole/JJ, thing/NN, is/VBZ, future/JJ, ./.]","(ROOT (S (S (IN so) (NP (PRP it)) (VP (VBZ looks) (SBAR (IN like) (S (NP (PRP you)) (VP (VBP 've) (VP (VBN got) (NP (JJ future)) (ADVP (RB there)))))))) (, ,) (S (ADVP (RB then)) (NP (PRP you)) (VP (VBP go) (NP (NNP trot) (NNP trot) (NNP trot) (NNP trot) (NNP trot) (NNP trot) (NNP trot) (NNP trot)) (ADVP (RB back) (RB now)) (SBAR (S (NP (PRP you)) (VP (VBP 've) (VP (VBD got) (NP (NP (NN something)) (ADJP (RB slightly) (JJ different))) (ADVP (RB there) (RB here) (SBAR (S (NP (PRP you)) (VP (VBD had) (NP (NP (NNP der) (NNP der) (NNP der) (NNP der) (NNP der)) (SBAR (S (NP (PRP you)) (VP (VBD said) (ADJP (JJ okay)))))))))))))))) (, ,) (S (NP (JJ future)) (, ,) (ADVP (RB then)) (NP (PRP you)) (VP (VBD went) (ADVP (RB back) (RB there)))) (CC and) (S (S (NP (PRP you)) (VP (VBD found) (SBAR (IN that) (S (NP (PRP it)) (VP (VBD was) (NP (NP (DT a) (JJ present) (JJ tense)) (PP (IN in) (NP (NNP English)))) (, ,) (ADVP (RB right))))))) (, ,) (CC but) (S (NP (PRP you)) (VP (VBD needed) (NP (DT a) (NN future)) (PP (IN in) (NP (JJ French))) (SBAR (IN because) (S (NP (DT the) (JJ whole) (NN thing)) (VP (VBZ is) (NP (JJ future)))))))) (. .)))"
K/KP/KP6.xml,KP6RE005,142606,63,,A,7,7,--here  --,"[so/IN, it/PRP, looks/VBZ, like/IN, you/PRP, 've/VBP, got/VBN, future/JJ, there/RB, ,/,, then/RB, you/PRP, go/VBP, trot/NNP, trot/NNP, trot/NNP, trot/NNP, trot/NNP, trot/NNP, trot/NNP, trot/NNP, back/RB, now/RB, you/PRP, 've/VBP, got/VBD, something/NN, slightly/RB, different/JJ, there/RB, here/RB, you/PRP, had/VBD, der/NNP, der/NNP, der/NNP, der/NNP, der/NNP, you/PRP, said/VBD, okay/JJ, ,/,, future/JJ, ,/,, then/RB, you/PRP, went/VBD, back/RB, there/RB, and/CC, you/PRP, found/VBD, that/IN, it/PRP, was/VBD, a/DT, present/JJ, tense/JJ, in/IN, English/NNP, ,/,, right/RB, ,/,, but/CC, you/PRP, needed/VBD, a/DT, future/NN, in/IN, French/JJ, because/IN, the/DT, whole/JJ, thing/NN, is/VBZ, future/JJ, ./.]","(ROOT (S (S (IN so) (NP (PRP it)) (VP (VBZ looks) (SBAR (IN like) (S (NP (PRP you)) (VP (VBP 've) (VP (VBN got) (NP (JJ future)) (ADVP (RB there)))))))) (, ,) (S (ADVP (RB then)) (NP (PRP you)) (VP (VBP go) (NP (NNP trot) (NNP trot) (NNP trot) (NNP trot) (NNP trot) (NNP trot) (NNP trot) (NNP trot)) (ADVP (RB back) (RB now)) (SBAR (S (NP (PRP you)) (VP (VBP 've) (VP (VBD got) (NP (NP (NN something)) (ADJP (RB slightly) (JJ different))) (ADVP (RB there) (RB here) (SBAR (S (NP (PRP you)) (VP (VBD had) (NP (NP (NNP der) (NNP der) (NNP der) (NNP der) (NNP der)) (SBAR (S (NP (PRP you)) (VP (VBD said) (ADJP (JJ okay)))))))))))))))) (, ,) (S (NP (JJ future)) (, ,) (ADVP (RB then)) (NP (PRP you)) (VP (VBD went) (ADVP (RB back) (RB there)))) (CC and) (S (S (NP (PRP you)) (VP (VBD found) (SBAR (IN that) (S (NP (PRP it)) (VP (VBD was) (NP (NP (DT a) (JJ present) (JJ tense)) (PP (IN in) (NP (NNP English)))) (, ,) (ADVP (RB right))))))) (, ,) (CC but) (S (NP (PRP you)) (VP (VBD needed) (NP (DT a) (NN future)) (PP (IN in) (NP (JJ French))) (SBAR (IN because) (S (NP (DT the) (JJ whole) (NN thing)) (VP (VBZ is) (NP (JJ future)))))))) (. .)))"
K/KP/KP6.xml,KP6RE005,142606,64,,A,7,8,"--you had der der der der der you said okay, future, then you went back there and you found that it was a present tense in English, right, but you needed a future in French because the whole thing is future.","[so/IN, it/PRP, looks/VBZ, like/IN, you/PRP, 've/VBP, got/VBN, future/JJ, there/RB, ,/,, then/RB, you/PRP, go/VBP, trot/NNP, trot/NNP, trot/NNP, trot/NNP, trot/NNP, trot/NNP, trot/NNP, trot/NNP, back/RB, now/RB, you/PRP, 've/VBP, got/VBD, something/NN, slightly/RB, different/JJ, there/RB, here/RB, you/PRP, had/VBD, der/NNP, der/NNP, der/NNP, der/NNP, der/NNP, you/PRP, said/VBD, okay/JJ, ,/,, future/JJ, ,/,, then/RB, you/PRP, went/VBD, back/RB, there/RB, and/CC, you/PRP, found/VBD, that/IN, it/PRP, was/VBD, a/DT, present/JJ, tense/JJ, in/IN, English/NNP, ,/,, right/RB, ,/,, but/CC, you/PRP, needed/VBD, a/DT, future/NN, in/IN, French/JJ, because/IN, the/DT, whole/JJ, thing/NN, is/VBZ, future/JJ, ./.]","(ROOT (S (S (IN so) (NP (PRP it)) (VP (VBZ looks) (SBAR (IN like) (S (NP (PRP you)) (VP (VBP 've) (VP (VBN got) (NP (JJ future)) (ADVP (RB there)))))))) (, ,) (S (ADVP (RB then)) (NP (PRP you)) (VP (VBP go) (NP (NNP trot) (NNP trot) (NNP trot) (NNP trot) (NNP trot) (NNP trot) (NNP trot) (NNP trot)) (ADVP (RB back) (RB now)) (SBAR (S (NP (PRP you)) (VP (VBP 've) (VP (VBD got) (NP (NP (NN something)) (ADJP (RB slightly) (JJ different))) (ADVP (RB there) (RB here) (SBAR (S (NP (PRP you)) (VP (VBD had) (NP (NP (NNP der) (NNP der) (NNP der) (NNP der) (NNP der)) (SBAR (S (NP (PRP you)) (VP (VBD said) (ADJP (JJ okay)))))))))))))))) (, ,) (S (NP (JJ future)) (, ,) (ADVP (RB then)) (NP (PRP you)) (VP (VBD went) (ADVP (RB back) (RB there)))) (CC and) (S (S (NP (PRP you)) (VP (VBD found) (SBAR (IN that) (S (NP (PRP it)) (VP (VBD was) (NP (NP (DT a) (JJ present) (JJ tense)) (PP (IN in) (NP (NNP English)))) (, ,) (ADVP (RB right))))))) (, ,) (CC but) (S (NP (PRP you)) (VP (VBD needed) (NP (DT a) (NN future)) (PP (IN in) (NP (JJ French))) (SBAR (IN because) (S (NP (DT the) (JJ whole) (NN thing)) (VP (VBZ is) (NP (JJ future)))))))) (. .)))"
K/KP/KP6.xml,KP6RE005,142606,65,,A,7,9,"Well that's future, but it's a different tense again.","[Well/RB, that/DT, 's/VBZ, future/JJ, ,/,, but/CC, it/PRP, 's/VBZ, a/DT, different/JJ, tense/JJ, again/RB, ./.]","(ROOT (S (S (INTJ (RB Well)) (NP (DT that)) (VP (VBZ 's) (NP (JJ future)))) (, ,) (CC but) (S (NP (PRP it)) (VP (VBZ 's) (NP (DT a) (JJ different) (JJ tense)) (ADVP (RB again)))) (. .)))"
K/KP/KP6.xml,KP6RE005,142606,66,,A,7,10,Okay technically it's a future of the auxiliary of the past participle  --,"[Okay/JJ, technically/RB, it/PRP, 's/VBZ, a/DT, future/NN, of/IN, the/DT, auxiliary/NN, of/IN, the/DT, past/JJ, participle/NN, future/NN, of/IN, the/DT, auxiliary/NN, of/IN, the/DT, past/JJ, participle/NN, don/NNP, 't/PRP, know/VBP, why/WRB, I/PRP, bother/VBP, ./.]",(ROOT (FRAG (ADJP (JJ Okay) (RB technically)) (S (NP (PRP it)) (VP (VBZ 's) (NP (NP (DT a) (NN future)) (PP (IN of) (NP (NP (DT the) (NN auxiliary)) (PP (IN of) (NP (NP (DT the) (JJ past) (NN participle) (NN future)) (PP (IN of) (NP (NP (DT the) (NN auxiliary)) (PP (IN of) (NP (DT the) (JJ past) (NN participle) (NNP don))))))))) (SBAR (S (NP (PRP 't)) (VP (VBP know) (SBAR (WHADVP (WRB why)) (S (NP (PRP I)) (VP (VBP bother)))))))))) (. .)))
K/KP/KP6.xml,KP6RE005,142606,67,,A,7,11,--future of the auxiliary of the past participle  (()) don't know why I bother.,"[Okay/JJ, technically/RB, it/PRP, 's/VBZ, a/DT, future/NN, of/IN, the/DT, auxiliary/NN, of/IN, the/DT, past/JJ, participle/NN, future/NN, of/IN, the/DT, auxiliary/NN, of/IN, the/DT, past/JJ, participle/NN, don/NNP, 't/PRP, know/VBP, why/WRB, I/PRP, bother/VBP, ./.]",(ROOT (FRAG (ADJP (JJ Okay) (RB technically)) (S (NP (PRP it)) (VP (VBZ 's) (NP (NP (DT a) (NN future)) (PP (IN of) (NP (NP (DT the) (NN auxiliary)) (PP (IN of) (NP (NP (DT the) (JJ past) (NN participle) (NN future)) (PP (IN of) (NP (NP (DT the) (NN auxiliary)) (PP (IN of) (NP (DT the) (JJ past) (NN participle) (NNP don))))))))) (SBAR (S (NP (PRP 't)) (VP (VBP know) (SBAR (WHADVP (WRB why)) (S (NP (PRP I)) (VP (VBP bother)))))))))) (. .)))
K/KP/KP6.xml,KP6RE005,142606,68,,A,7,12,So is it is the same? the answer is yes and no.,"[So/RB, is/VBZ, it/PRP, is/VBZ, the/DT, same/JJ, ?/., the/DT, answer/NN, is/VBZ, yes/RB, and/CC, no/DT, ./.]",(ROOT (S (SBARQ (WHADVP (RB So)) (SQ (VBZ is) (NP (NP (PRP it)) (SBAR (S (VP (VBZ is) (NP (DT the) (JJ same))))))) (. ?)) (NP (DT the) (NN answer)) (VP (VBZ is) (NP (NP (RB yes)) (CC and) (NP (DT no)))) (. .)))
K/KP/KP6.xml,KP6RE005,142606,69,,A,7,13,Ooh!,"[Ooh/NNP, !/.]",(ROOT (FRAG (NP (NNP Ooh)) (. !)))
