swda_filename,ptb_basename,conversation_no,transcript_index,act_tag,caller,turn_index,subutterance_index,text,pos,trees
K/KD/KDK.xml,KDKRE00G,16803,51,,A,31,4,--but I was only like two minutes behind.,"[I/PRP, mean/VBP, okay/JJ, so/IN, I/PRP, thought/VBD, ah/NN, I/PRP, don/VBP, 't/PRP, give/VB, a/DT, shit/NN, you/PRP, know/VBP, ,/,, I/PRP, mean/VBP, but/CC, I/PRP, was/VBD, only/RB, like/IN, two/CD, minutes/NNS, behind/IN, ./.]","(ROOT (S (S (NP (PRP I)) (VP (VBP mean) (ADJP (JJ okay) (SBAR (IN so) (S (NP (PRP I)) (VP (VBD thought) (SBAR (S (NP (NP (NN ah)) (SBAR (S (NP (PRP I)) (VP (VBP don) (S (NP (PRP 't)) (VP (VB give) (NP (DT a) (NN shit)) (NP (PRP you)))))))) (VP (VBP know)))))))))) (, ,) (NP (PRP I)) (VP (VBP mean) (SBAR (CC but) (S (NP (PRP I)) (VP (VBD was) (ADVP (RB only)) (PP (IN like) (ADVP (NP (CD two) (NNS minutes)) (IN behind))))))) (. .)))"
K/KD/KDK.xml,KDKRE00G,16803,52,,B,32,1,I know  --,"[I/PRP, know/VBP, I/PRP, know/VB, ./.]",(ROOT (S (NP (PRP I)) (VP (VBP know) (S (NP (PRP I)) (VP (VB know)))) (. .)))
K/KD/KDK.xml,KDKRE00G,16803,53,,B,32,2,--I know.,"[I/PRP, know/VBP, I/PRP, know/VB, ./.]",(ROOT (S (NP (PRP I)) (VP (VBP know) (S (NP (PRP I)) (VP (VB know)))) (. .)))
K/KD/KDK.xml,KDKRE00G,16803,54,,A,33,1,and then Steve says  --,"[and/CC, then/RB, Steve/NNP, says/VBZ, well/RB, I/PRP, 'll/MD, just/RB, make/VB, last/JJ, orders/NNS, ,/,, see/VBP, you/PRP, later/RB, Paul/NNP, ./.]","(ROOT (SINV (S (CC and) (RB then) (NP (NNP Steve)) (VP (VBZ says) (S (ADVP (RB well)) (NP (PRP I)) (VP (MD 'll) (ADVP (RB just)) (VP (VB make) (NP (JJ last) (NNS orders))))))) (, ,) (VP (VBP see) (NP (PRP you)) (ADVP (RB later))) (NP (NNP Paul)) (. .)))"
K/KD/KDK.xml,KDKRE00G,16803,55,,A,33,2,"--well I'll just make last orders, see you later Paul.","[and/CC, then/RB, Steve/NNP, says/VBZ, well/RB, I/PRP, 'll/MD, just/RB, make/VB, last/JJ, orders/NNS, ,/,, see/VBP, you/PRP, later/RB, Paul/NNP, ./.]","(ROOT (SINV (S (CC and) (RB then) (NP (NNP Steve)) (VP (VBZ says) (S (ADVP (RB well)) (NP (PRP I)) (VP (MD 'll) (ADVP (RB just)) (VP (VB make) (NP (JJ last) (NNS orders))))))) (, ,) (VP (VBP see) (NP (PRP you)) (ADVP (RB later))) (NP (NNP Paul)) (. .)))"
K/KD/KDK.xml,KDKRE00G,16803,56,,B,34,1,(()) ,[],
K/KD/KDK.xml,KDKRE00G,16803,57,,A,35,1,And then  (()) says you've got a key haven't you?,"[And/CC, then/RB, says/VBZ, you/PRP, 've/VBP, got/VBD, a/DT, key/JJ, haven/NN, 't/PRP, you/PRP, ?/.]",(ROOT (SINV (CC And) (ADVP (RB then)) (VP (VBZ says) (SBAR (S (NP (PRP you)) (VP (VBP 've) (VP (VBD got) (S (NP (DT a) (JJ key) (NN haven)) (NP (PRP 't)))))))) (NP (PRP you)) (. ?)))
K/KD/KDK.xml,KDKRE00G,16803,58,,B,36,1,Want fifty  (()) ,"[Want/VB, fifty/CD]",(ROOT (S (VP (VB Want) (NP (CD fifty)))))
K/KD/KDK.xml,KDKRE00G,16803,59,,A,37,1,I says no!--,"[I/PRP, says/VBZ, no/DT, !said/NN, oh/NN, alright/NN]",(ROOT (S (NP (PRP I)) (VP (VBZ says) (NP (DT no) (NN !said) (NN oh) (NN alright)))))
K/KD/KDK.xml,KDKRE00G,16803,60,,A,37,2,--said oh alright ,"[I/PRP, says/VBZ, no/DT, !said/NN, oh/NN, alright/NN]",(ROOT (S (NP (PRP I)) (VP (VBZ says) (NP (DT no) (NN !said) (NN oh) (NN alright)))))
K/KD/KDK.xml,KDKRE00G,16803,61,,B,38,1,(()) ,[],
K/KD/KDK.xml,KDKRE00G,16803,62,,A,39,1,(()) ,[],
K/KD/KDK.xml,KDKRE00G,16803,63,,B,40,1,I've had before  (()) where I have been told   (()) --,"[I/PRP, 've/VBP, had/VBN, before/IN, where/WRB, I/PRP, have/VBP, been/VBN, told/VBN, waited/VBD, and/CC, helped/VBD, people/NNS, finish/VB, their/PRP$]",(ROOT (S (NP (PRP I)) (VP (VBP 've) (VP (VBN had) (SBAR (IN before) (S (SBAR (WHADVP (WRB where)) (S (NP (PRP I)) (VP (VBP have) (VP (VBN been) (VP (VBN told)))))) (VP (VP (VBD waited)) (CC and) (VP (VBD helped) (S (NP (NNS people)) (VP (VB finish) (NP (PRP$ their))))))))))))
K/KD/KDK.xml,KDKRE00G,16803,64,,B,40,2,--waited and helped people finish their  (()) ,"[I/PRP, 've/VBP, had/VBN, before/IN, where/WRB, I/PRP, have/VBP, been/VBN, told/VBN, waited/VBD, and/CC, helped/VBD, people/NNS, finish/VB, their/PRP$]",(ROOT (S (NP (PRP I)) (VP (VBP 've) (VP (VBN had) (SBAR (IN before) (S (SBAR (WHADVP (WRB where)) (S (NP (PRP I)) (VP (VBP have) (VP (VBN been) (VP (VBN told)))))) (VP (VP (VBD waited)) (CC and) (VP (VBD helped) (S (NP (NNS people)) (VP (VB finish) (NP (PRP$ their))))))))))))
K/KD/KDK.xml,KDKRE00G,16803,65,,A,41,1,Yeah  --,"[Yeah/UH, yeah/UH, I/PRP, done/VBD, that/IN, ./.]",(ROOT (S (S (INTJ (UH Yeah) (UH yeah)) (NP (PRP I)) (VP (VBD done) (ADVP (IN that)))) (. .)))
K/KD/KDK.xml,KDKRE00G,16803,66,,A,41,2,--yeah I done that.,"[Yeah/UH, yeah/UH, I/PRP, done/VBD, that/IN, ./.]",(ROOT (S (S (INTJ (UH Yeah) (UH yeah)) (NP (PRP I)) (VP (VBD done) (ADVP (IN that)))) (. .)))
K/KD/KDK.xml,KDKRE00G,16803,67,,B,42,1,And those have gone home  --,"[And/CC, those/DT, have/VBP, gone/VBN, home/NN, while/IN, I/PRP, 've/VBP, been/VBN, doing/VBG, something/NN, else/RB, for/IN, them/PRP, ,/,, they/PRP, 've/VBP, gone/VBN, ,/,, and/CC, left/VBD, me/PRP, !/.]","(ROOT (S (S (CC And) (NP (DT those)) (VP (VBP have) (VP (VBN gone) (ADVP (NN home)) (SBAR (IN while) (S (NP (PRP I)) (VP (VBP 've) (VP (VBN been) (VP (VBG doing) (NP (NP (NN something) (RB else)) (PP (IN for) (NP (PRP them)))))))))))) (, ,) (NP (PRP they)) (VP (VP (VBP 've) (VP (VBN gone))) (, ,) (CC and) (VP (VBD left) (NP (PRP me)))) (. !)))"
K/KD/KDK.xml,KDKRE00G,16803,68,,B,42,2,"--while I've been doing something else for them, they've gone, and left me!","[And/CC, those/DT, have/VBP, gone/VBN, home/NN, while/IN, I/PRP, 've/VBP, been/VBN, doing/VBG, something/NN, else/RB, for/IN, them/PRP, ,/,, they/PRP, 've/VBP, gone/VBN, ,/,, and/CC, left/VBD, me/PRP, !/.]","(ROOT (S (S (CC And) (NP (DT those)) (VP (VBP have) (VP (VBN gone) (ADVP (NN home)) (SBAR (IN while) (S (NP (PRP I)) (VP (VBP 've) (VP (VBN been) (VP (VBG doing) (NP (NP (NN something) (RB else)) (PP (IN for) (NP (PRP them)))))))))))) (, ,) (NP (PRP they)) (VP (VP (VBP 've) (VP (VBN gone))) (, ,) (CC and) (VP (VBD left) (NP (PRP me)))) (. !)))"
K/KD/KDK.xml,KDKRE00G,16803,69,,A,43,1,I can't believe it!,"[I/PRP, can/MD, 't/PRP, believe/VB, it/PRP, !/.]",(ROOT (S (NP (PRP I)) (VP (MD can) (NP (PRP 't)) (S (VP (VB believe) (NP (PRP it))))) (. !)))
K/KD/KDK.xml,KDKRE00G,16803,70,,B,44,1,And I could of gone with them!,"[And/CC, I/PRP, could/MD, of/IN, gone/VBN, with/IN, them/PRP, !/.]",(ROOT (S (CC And) (NP (PRP I)) (VP (MD could) (PP (IN of)) (VP (VBN gone) (PP (IN with) (NP (PRP them))))) (. !)))
K/KD/KDK.xml,KDKRE00G,16803,71,,A,45,1,Yeah I mean I  --,"[Yeah/UH, I/PRP, mean/VBP, I/PRP, I/PRP, mean/VBP, sometimes/RB, when/WRB, you/PRP, get/VBP, day/NN, you/PRP, think/VBP, oh/UH, yes/UH, they/PRP, could/MD, ,/,, you/PRP, know/VBP, ,/,, so/CC, you/PRP, like/IN, start/VB, a/DT, round/JJ, don/NNP, 't/PRP, you/PRP, if/IN, you/PRP]","(ROOT (S (S (INTJ (UH Yeah)) (NP (PRP I)) (VP (VBP mean) (NP (PRP I)) (SBAR (S (NP (PRP I)) (VP (VBP mean) (SBAR (S (SBAR (ADVP (RB sometimes)) (WHADVP (WRB when)) (S (NP (PRP you)) (VP (VBP get) (SBAR (S (NP (NN day)) (NP (PRP you)) (VP (VBP think) (SBAR (S (INTJ (UH oh) (UH yes)) (NP (PRP they)) (VP (MD could)))))))))) (, ,) (NP (PRP you)) (VP (VBP know))))))))) (, ,) (CC so) (SQ (NP (PRP you)) (VP (ADVP (IN like)) (VB start) (NP (DT a) (JJ round)) (S (VP (NNP don) (S (NP (PRP 't)) (NP (PRP you))))) (PP (IN if) (NP (PRP you)))))))"
K/KD/KDK.xml,KDKRE00G,16803,72,,A,45,2,"--I mean sometimes when you get  (()) day you think oh yes they could, you know, so you like start a round don't you if you ","[Yeah/UH, I/PRP, mean/VBP, I/PRP, I/PRP, mean/VBP, sometimes/RB, when/WRB, you/PRP, get/VBP, day/NN, you/PRP, think/VBP, oh/UH, yes/UH, they/PRP, could/MD, ,/,, you/PRP, know/VBP, ,/,, so/CC, you/PRP, like/IN, start/VB, a/DT, round/JJ, don/NNP, 't/PRP, you/PRP, if/IN, you/PRP]","(ROOT (S (S (INTJ (UH Yeah)) (NP (PRP I)) (VP (VBP mean) (NP (PRP I)) (SBAR (S (NP (PRP I)) (VP (VBP mean) (SBAR (S (SBAR (ADVP (RB sometimes)) (WHADVP (WRB when)) (S (NP (PRP you)) (VP (VBP get) (SBAR (S (NP (NN day)) (NP (PRP you)) (VP (VBP think) (SBAR (S (INTJ (UH oh) (UH yes)) (NP (PRP they)) (VP (MD could)))))))))) (, ,) (NP (PRP you)) (VP (VBP know))))))))) (, ,) (CC so) (SQ (NP (PRP you)) (VP (ADVP (IN like)) (VB start) (NP (DT a) (JJ round)) (S (VP (NNP don) (S (NP (PRP 't)) (NP (PRP you))))) (PP (IN if) (NP (PRP you)))))))"
K/KD/KDK.xml,KDKRE00G,16803,73,,B,46,1,And you wait for other people an- that and  --,"[And/CC, you/PRP, wait/VB, for/IN, other/JJ, people/NNS, an-/NN, that/WDT, and/CC, and/CC, you/PRP, don/VBP, 't/PRP, leave/VB, that/DT, 's/VBZ, all/DT, I/PRP, won/VBD, 't/PRP, do/VB, that/DT, again/RB, ,/,, ./.]","(ROOT (S (CC And) (NP (PRP you)) (VP (VB wait) (PP (IN for) (NP (NP (JJ other) (NNS people) (NN an-)) (SBAR (WHNP (WDT that)) (PRN (CC and) (S (CC and) (NP (PRP you)) (VP (VBP don) (S (NP (PRP 't)) (VP (VB leave) (NP (DT that))))))) (S (VP (VBZ 's) (NP (NP (DT all)) (SBAR (S (NP (PRP I)) (VP (VBD won) (S (NP (PRP 't)) (VP (VB do) (NP (DT that)) (ADVP (RB again))) (, ,)))))))))))) (. .)))"
K/KD/KDK.xml,KDKRE00G,16803,74,,B,46,2,--and you don't leave that's all  --,"[And/CC, you/PRP, wait/VB, for/IN, other/JJ, people/NNS, an-/NN, that/WDT, and/CC, and/CC, you/PRP, don/VBP, 't/PRP, leave/VB, that/DT, 's/VBZ, all/DT, I/PRP, won/VBD, 't/PRP, do/VB, that/DT, again/RB, ,/,, ./.]","(ROOT (S (CC And) (NP (PRP you)) (VP (VB wait) (PP (IN for) (NP (NP (JJ other) (NNS people) (NN an-)) (SBAR (WHNP (WDT that)) (PRN (CC and) (S (CC and) (NP (PRP you)) (VP (VBP don) (S (NP (PRP 't)) (VP (VB leave) (NP (DT that))))))) (S (VP (VBZ 's) (NP (NP (DT all)) (SBAR (S (NP (PRP I)) (VP (VBD won) (S (NP (PRP 't)) (VP (VB do) (NP (DT that)) (ADVP (RB again))) (, ,)))))))))))) (. .)))"
K/KD/KDK.xml,KDKRE00G,16803,75,,B,46,3,"--I won't do that again,(()) .","[And/CC, you/PRP, wait/VB, for/IN, other/JJ, people/NNS, an-/NN, that/WDT, and/CC, and/CC, you/PRP, don/VBP, 't/PRP, leave/VB, that/DT, 's/VBZ, all/DT, I/PRP, won/VBD, 't/PRP, do/VB, that/DT, again/RB, ,/,, ./.]","(ROOT (S (CC And) (NP (PRP you)) (VP (VB wait) (PP (IN for) (NP (NP (JJ other) (NNS people) (NN an-)) (SBAR (WHNP (WDT that)) (PRN (CC and) (S (CC and) (NP (PRP you)) (VP (VBP don) (S (NP (PRP 't)) (VP (VB leave) (NP (DT that))))))) (S (VP (VBZ 's) (NP (NP (DT all)) (SBAR (S (NP (PRP I)) (VP (VBD won) (S (NP (PRP 't)) (VP (VB do) (NP (DT that)) (ADVP (RB again))) (, ,)))))))))))) (. .)))"
K/KD/KDK.xml,KDKRE00G,16803,76,,A,47,1,I say I do- --,"[I/PRP, say/VBP, I/PRP, do-/JJ, I/PRP, don/VBP, 't/PRP, mind/VB, I/PRP, just/RB, think/VBP, what/WP, the/DT, bloody/JJ, hell/NN, ,/,, you/PRP, know/VBP, we/PRP, 're/VBP, only/RB, just/RB, like/IN, two/CD, minutes/NNS, apart/RB, !/.]","(ROOT (S (NP (PRP I)) (VP (VBP say) (S (NP (PRP I)) (ADJP (JJ do-)) (SBAR (S (NP (PRP I)) (VP (VBP don) (S (NP (PRP 't)) (VP (VB mind) (SBAR (S (NP (PRP I)) (ADVP (RB just)) (VP (VBP think) (SBAR (S (SBAR (WHNP (WP what)) (FRAG (NP (DT the) (JJ bloody) (NN hell)))) (, ,) (NP (PRP you)) (VP (VBP know) (SBAR (S (NP (PRP we)) (VP (VBP 're) (NP (NP (RB only) (RB just)) (PP (IN like) (NP (CD two) (NNS minutes)))) (ADVP (RB apart)))))))))))))))))) (. !)))"
K/KD/KDK.xml,KDKRE00G,16803,77,,A,47,2,"--I don't mind I just think what the bloody hell, you know we're only  --","[I/PRP, say/VBP, I/PRP, do-/JJ, I/PRP, don/VBP, 't/PRP, mind/VB, I/PRP, just/RB, think/VBP, what/WP, the/DT, bloody/JJ, hell/NN, ,/,, you/PRP, know/VBP, we/PRP, 're/VBP, only/RB, just/RB, like/IN, two/CD, minutes/NNS, apart/RB, !/.]","(ROOT (S (NP (PRP I)) (VP (VBP say) (S (NP (PRP I)) (ADJP (JJ do-)) (SBAR (S (NP (PRP I)) (VP (VBP don) (S (NP (PRP 't)) (VP (VB mind) (SBAR (S (NP (PRP I)) (ADVP (RB just)) (VP (VBP think) (SBAR (S (SBAR (WHNP (WP what)) (FRAG (NP (DT the) (JJ bloody) (NN hell)))) (, ,) (NP (PRP you)) (VP (VBP know) (SBAR (S (NP (PRP we)) (VP (VBP 're) (NP (NP (RB only) (RB just)) (PP (IN like) (NP (CD two) (NNS minutes)))) (ADVP (RB apart)))))))))))))))))) (. !)))"
K/KD/KDK.xml,KDKRE00G,16803,78,,A,47,3,--just like two minutes apart!,"[I/PRP, say/VBP, I/PRP, do-/JJ, I/PRP, don/VBP, 't/PRP, mind/VB, I/PRP, just/RB, think/VBP, what/WP, the/DT, bloody/JJ, hell/NN, ,/,, you/PRP, know/VBP, we/PRP, 're/VBP, only/RB, just/RB, like/IN, two/CD, minutes/NNS, apart/RB, !/.]","(ROOT (S (NP (PRP I)) (VP (VBP say) (S (NP (PRP I)) (ADJP (JJ do-)) (SBAR (S (NP (PRP I)) (VP (VBP don) (S (NP (PRP 't)) (VP (VB mind) (SBAR (S (NP (PRP I)) (ADVP (RB just)) (VP (VBP think) (SBAR (S (SBAR (WHNP (WP what)) (FRAG (NP (DT the) (JJ bloody) (NN hell)))) (, ,) (NP (PRP you)) (VP (VBP know) (SBAR (S (NP (PRP we)) (VP (VBP 're) (NP (NP (RB only) (RB just)) (PP (IN like) (NP (CD two) (NNS minutes)))) (ADVP (RB apart)))))))))))))))))) (. !)))"
K/KD/KDK.xml,KDKRE00G,16803,79,,B,48,1,I know  --,"[I/PRP, know/VBP, yeah/UH, ./.]",(ROOT (S (NP (PRP I)) (VP (VBP know) (NP (UH yeah))) (. .)))
K/KD/KDK.xml,KDKRE00G,16803,80,,B,48,2,--yeah.,"[I/PRP, know/VBP, yeah/UH, ./.]",(ROOT (S (NP (PRP I)) (VP (VBP know) (NP (UH yeah))) (. .)))
K/KD/KDK.xml,KDKRE00G,16803,81,,A,49,1,"It was like  (()) today, well right, we're off  --","[It/PRP, was/VBD, like/IN, today/NN, ,/,, well/RB, right/RB, ,/,, we/PRP, 're/VBP, off/RP, see/VB, you/PRP, ./.]","(ROOT (S (S (NP (PRP It)) (VP (VBD was) (PP (IN like) (NP (NN today))) (, ,) (ADVP (RB well) (RB right)))) (, ,) (NP (PRP we)) (VP (VBP 're) (ADVP (RP off)) (S (VP (VB see) (NP (PRP you))))) (. .)))"
K/KD/KDK.xml,KDKRE00G,16803,82,,A,49,2,--see you.,"[It/PRP, was/VBD, like/IN, today/NN, ,/,, well/RB, right/RB, ,/,, we/PRP, 're/VBP, off/RP, see/VB, you/PRP, ./.]","(ROOT (S (S (NP (PRP It)) (VP (VBD was) (PP (IN like) (NP (NN today))) (, ,) (ADVP (RB well) (RB right)))) (, ,) (NP (PRP we)) (VP (VBP 're) (ADVP (RP off)) (S (VP (VB see) (NP (PRP you))))) (. .)))"
