swda_filename,ptb_basename,conversation_no,transcript_index,act_tag,caller,turn_index,subutterance_index,text,pos,trees
K/KD/KDA.xml,KDARE00E,11606,28,,A,17,4,You can see why I was in such a bad mood Saturday cos if I'd drunk that much Friday night you can imagine what sort of a hang over I had.,"[You/PRP, can/MD, see/VB, why/WRB, I/PRP, was/VBD, in/IN, such/JJ, a/DT, bad/JJ, mood/NN, Saturday/NNP, cos/NNP, if/IN, I/PRP, 'd/MD, drunk/JJ, that/IN, much/JJ, Friday/NNP, night/NN, you/PRP, can/MD, imagine/VB, what/WP, sort/NN, of/IN, a/DT, hang/NNP, over/IN, I/PRP, had/VBD, ./.]",(ROOT (S (NP (PRP You)) (VP (MD can) (VP (VB see) (SBAR (WHADVP (WRB why)) (S (NP (PRP I)) (VP (VBD was) (PP (IN in) (NP (NP (JJ such) (DT a) (JJ bad) (NN mood)) (NP (NNP Saturday) (NNP cos)))) (SBAR (IN if) (S (NP (PRP I)) (VP (MD 'd) (VP (ADJP (JJ drunk)) (SBAR (IN that) (S (NP (JJ much) (NNP Friday) (NN night)) (NP (PRP you)) (VP (MD can) (VP (VB imagine) (SBAR (WHNP (WP what)) (S (NP (NP (NN sort)) (PP (IN of) (NP (NP (DT a) (NNP hang)) (PP (IN over) (NP (PRP I)))))) (VP (VBD had))))))))))))))))) (. .)))
K/KD/KDA.xml,KDARE00E,11606,29,,A,17,5,I mean we got up about nine o'clock as well.,"[I/PRP, mean/VBP, we/PRP, got/VBD, up/RP, about/IN, nine/CD, o/NN, 'clock/NN, as/RB, well/RB, ./.]",(ROOT (S (NP (PRP I)) (VP (VBP mean) (SBAR (S (NP (PRP we)) (VP (VBD got) (PRT (RP up)) (PP (IN about) (NP (NP (CD nine) (NN o) (NN 'clock)) (ADVP (RB as) (RB well)))))))) (. .)))
K/KD/KDA.xml,KDARE00E,11606,30,,A,17,6,"(()) but er I'd meet up in town and  (()) our house like twenty past nine, half past (()) , get, get, get the bit of shopping done before the fucking  (()) crowds I might off wasted me time, we got in there about ten o'clock,(()) right old day.","[but/CC, er/NN, I/PRP, 'd/MD, meet/VB, up/RP, in/IN, town/NN, and/CC, our/PRP$, house/NNP, like/IN, twenty/CD, past/JJ, nine/CD, ,/,, half/DT, past/JJ, ,/,, get/VB, ,/,, get/VB, ,/,, get/VB, the/DT, bit/NN, of/IN, shopping/NN, done/VBN, before/IN, the/DT, fucking/JJ, crowds/NNS, I/PRP, might/MD, off/RB, wasted/VBN, me/PRP, time/NN, ,/,, we/PRP, got/VBD, in/IN, there/EX, about/IN, ten/CD, o/NN, 'clock/NN, ,/,, right/JJ, old/JJ, day/NN, ./.]","(ROOT (S (CC but) (NP (NP (NN er)) (SBAR (S (NP (PRP I)) (VP (MD 'd) (VP (VB meet) (PRT (RP up)) (PP (IN in) (NP (NP (NN town)) (CC and) (NP (NP (PRP$ our) (NX (NNP house))) (PP (IN like) (NP (CD twenty))) (ADJP (JJ past) (NP (CD nine))) (, ,) (NP (DT half) (JJ past) (PRN (, ,) (S (VP (VP (VB get)) (, ,) (VP (VB get)) (, ,) (VP (VB get) (NP (NP (DT the) (NN bit)) (PP (IN of) (NP (NP (NN shopping)) (VP (VBN done) (PP (IN before) (NP (NP (DT the) (JJ fucking) (NNS crowds)) (SBAR (S (NP (PRP I)) (VP (MD might) (VP (ADVP (RB off)) (VBN wasted) (S (NP (PRP me))))))))))))))))) (NN time)))))))))) (, ,) (NP (PRP we)) (VP (VBD got) (PP (IN in) (NP (EX there))) (PP (IN about) (NP (NP (CD ten) (NN o) (NN 'clock)) (, ,) (NP (JJ right) (JJ old) (NN day))))) (. .)))"
K/KD/KDA.xml,KDARE00E,11606,31,,B,18,1,Yeah.,"[Yeah/UH, ./.]",(ROOT (INTJ (UH Yeah) (. .)))
K/KD/KDA.xml,KDARE00E,11606,32,,A,19,1,"By fucking half past ten it's, it's well busy, it's so packed.<sawing> (()) ","[By/IN, fucking/VBG, half/JJ, past/JJ, ten/CD, it/PRP, 's/VBZ, ,/,, it/PRP, 's/VBZ, well/RB, busy/JJ, ,/,, it/PRP, 's/VBZ, so/RB, packed/JJ, ./.]","(ROOT (S (PP (IN By) (S (VP (VBG fucking) (NP (NP (JJ half) (QP (JJ past) (CD ten))) (SBAR (S (NP (PRP it)) (VP (VBZ 's) (, ,) (SBAR (S (NP (PRP it)) (VP (VBZ 's) (ADJP (RB well) (JJ busy)))))))))))) (, ,) (NP (PRP it)) (VP (VBZ 's) (ADJP (RB so) (JJ packed))) (. .)))"
K/KD/KDA.xml,KDARE00E,11606,33,,B,20,1,Barry's not there.(()) ,"[Barry/NNP, 's/POS, not/RB, there/RB, ./.]",(ROOT (NP (NP (NP (NNP Barry) (POS 's)) (NP (RB not) (RB there))) (. .)))
K/KD/KDA.xml,KDARE00E,11606,34,,A,21,1,I bet you hate it when the glue goes hard (()) .,"[I/PRP, bet/VBP, you/PRP, hate/VB, it/PRP, when/WRB, the/DT, glue/NN, goes/VBZ, hard/RB, ./.]",(ROOT (S (NP (PRP I)) (VP (VBP bet) (S (NP (PRP you)) (VP (VB hate) (NP (PRP it)) (SBAR (WHADVP (WRB when)) (S (NP (DT the) (NN glue)) (VP (VBZ goes) (ADVP (RB hard)))))))) (. .)))
K/KD/KDA.xml,KDARE00E,11606,35,,B,22,1,Yeah.,"[Yeah/UH, ./.]",(ROOT (INTJ (UH Yeah) (. .)))
K/KD/KDA.xml,KDARE00E,11606,36,,A,23,1,That's the only thing with bonding (()) .,"[That/DT, 's/VBZ, the/DT, only/JJ, thing/NN, with/IN, bonding/NN, ./.]",(ROOT (S (NP (DT That)) (VP (VBZ 's) (NP (NP (DT the) (JJ only) (NN thing)) (PP (IN with) (NP (NN bonding))))) (. .)))
