swda_filename,ptb_basename,conversation_no,transcript_index,act_tag,caller,turn_index,subutterance_index,text,pos,trees
K/KB/KB7.xml,KB7RE01H,19202,0,,A,1,1,Hello dearest ,"[Hello/UH, dearest/JJS]",(ROOT (INTJ (UH Hello) (JJS dearest)))
K/KB/KB7.xml,KB7RE01H,19202,1,,B,2,1,Hello my darling,"[Hello/UH, my/PRP$, darling/NN]",(ROOT (INTJ (UH Hello) (PRP$ my) (NN darling)))
K/KB/KB7.xml,KB7RE01H,19202,2,,A,3,1,All right then?,"[All/DT, right/JJ, then/RB, ?/.]",(ROOT (FRAG (NP (DT All)) (ADJP (JJ right)) (ADVP (RB then)) (. ?)))
K/KB/KB7.xml,KB7RE01H,19202,3,,B,4,1,Yep ,[Yep/NN],(ROOT (NP (NN Yep)))
K/KB/KB7.xml,KB7RE01H,19202,4,,A,5,1,You (()) ,[You/PRP],(ROOT (FRAG (NP (PRP You))))
K/KB/KB7.xml,KB7RE01H,19202,5,,B,6,1,Yep  --,"[Yep/NN, and/CC, what/WP, 's/VBZ, the/DT, plan/NN, of/IN, attack/NN, today/NN, ?/.]",(ROOT (UCP (NP (NN Yep)) (CC and) (SBAR (WHNP (WP what)) (S (VP (VBZ 's) (NP (NP (DT the) (NN plan)) (PP (IN of) (NP (NN attack) (NN today)))))) (. ?))))
K/KB/KB7.xml,KB7RE01H,19202,6,,B,6,2,--and what's the plan of attack today?,"[Yep/NN, and/CC, what/WP, 's/VBZ, the/DT, plan/NN, of/IN, attack/NN, today/NN, ?/.]",(ROOT (UCP (NP (NN Yep)) (CC and) (SBAR (WHNP (WP what)) (S (VP (VBZ 's) (NP (NP (DT the) (NN plan)) (PP (IN of) (NP (NN attack) (NN today)))))) (. ?))))
K/KB/KB7.xml,KB7RE01H,19202,7,,A,7,1,Oh plan of attack  --,"[Oh/UH, plan/NN, of/IN, attack/NN, erm/NN, down/RB, ./.]",(ROOT (S (VP (PP (NP (UH Oh)) (NP (NP (NN plan)) (PP (IN of) (NP (NP (NN attack) (NN erm)) (ADVP (RB down))))))) (. .)))
K/KB/KB7.xml,KB7RE01H,19202,8,,A,7,2,--erm  (()) down.,"[Oh/UH, plan/NN, of/IN, attack/NN, erm/NN, down/RB, ./.]",(ROOT (S (VP (PP (NP (UH Oh)) (NP (NP (NN plan)) (PP (IN of) (NP (NP (NN attack) (NN erm)) (ADVP (RB down))))))) (. .)))
K/KB/KB7.xml,KB7RE01H,19202,9,,B,8,1,I'll go and tell the estate agent you'll be a little bit late.,"[I/PRP, 'll/MD, go/VB, and/CC, tell/VB, the/DT, estate/NN, agent/NN, you/PRP, 'll/MD, be/VB, a/DT, little/JJ, bit/NN, late/JJ, ./.]",(ROOT (S (NP (PRP I)) (VP (MD 'll) (VP (VB go) (CC and) (VB tell) (NP (NP (DT the) (NN estate) (NN agent)) (SBAR (S (NP (PRP you)) (VP (MD 'll) (VP (VB be) (ADJP (NP (DT a) (JJ little) (NN bit)) (JJ late))))))))) (. .)))
K/KB/KB7.xml,KB7RE01H,19202,10,,A,9,1,Yeah.,"[Yeah/UH, ./.]",(ROOT (INTJ (UH Yeah) (. .)))
K/KB/KB7.xml,KB7RE01H,19202,11,,B,10,1,You go to the solicitor and then I'll see you  --,"[You/PRP, go/VBP, to/TO, the/DT, solicitor/NN, and/CC, then/RB, I/PRP, 'll/MD, see/VB, you/PRP, on/IN, the/DT, wa-/NN, ,/,, on/IN, that/DT, part/NN, of/IN, the/DT, shop/NN]","(ROOT (NP (S (S (NP (PRP You)) (VP (VBP go) (PP (TO to) (NP (DT the) (NN solicitor))))) (CC and) (S (ADVP (RB then)) (NP (PRP I)) (VP (MD 'll) (VP (VB see) (NP (PRP you)) (PP (IN on) (NP (DT the) (NN wa-))) (, ,) (PP (IN on) (NP (NP (DT that) (NN part)) (PP (IN of) (NP (DT the) (NN shop)))))))))))"
K/KB/KB7.xml,KB7RE01H,19202,12,,B,10,2,"--on the wa- , on that part of the shop ","[You/PRP, go/VBP, to/TO, the/DT, solicitor/NN, and/CC, then/RB, I/PRP, 'll/MD, see/VB, you/PRP, on/IN, the/DT, wa-/NN, ,/,, on/IN, that/DT, part/NN, of/IN, the/DT, shop/NN]","(ROOT (NP (S (S (NP (PRP You)) (VP (VBP go) (PP (TO to) (NP (DT the) (NN solicitor))))) (CC and) (S (ADVP (RB then)) (NP (PRP I)) (VP (MD 'll) (VP (VB see) (NP (PRP you)) (PP (IN on) (NP (DT the) (NN wa-))) (, ,) (PP (IN on) (NP (NP (DT that) (NN part)) (PP (IN of) (NP (DT the) (NN shop)))))))))))"
K/KB/KB7.xml,KB7RE01H,19202,13,,A,11,1,"It is a problem  (()) estate agents' name, look as though it  (()) ","[It/PRP, is/VBZ, a/DT, problem/NN, estate/NN, agents/NNS, '/POS, name/NN, ,/,, look/VBP, as/IN, though/IN, it/PRP]","(ROOT (SINV (S (NP (PRP It)) (VP (VBZ is) (NP (NP (DT a) (NN problem) (NN estate) (NNS agents) (POS ')) (NN name)))) (, ,) (VP (VBP look) (PP (IN as) (NP (IN though)))) (NP (PRP it))))"
K/KB/KB7.xml,KB7RE01H,19202,14,,B,12,1,"Yeah, on the appointment you could get from the solicitor was (()) ","[Yeah/UH, ,/,, on/IN, the/DT, appointment/NN, you/PRP, could/MD, get/VB, from/IN, the/DT, solicitor/NN, was/VBD]","(ROOT (S (INTJ (UH Yeah)) (, ,) (NP (IN on) (DT the) (NN appointment)) (ADVP (PRP you)) (VP (MD could) (VP (VB get) (PP (IN from) (NP (NP (DT the) (NN solicitor)) (VP (VBD was))))))))"
K/KB/KB7.xml,KB7RE01H,19202,15,,A,13,1,(()) ,[],X
K/KB/KB7.xml,KB7RE01H,19202,16,,A,13,2,(()) ,[],X
K/KB/KB7.xml,KB7RE01H,19202,17,,B,14,1,"Get those soon as poss, and I'll go and look in the carpet shop","[Get/VB, those/DT, soon/RB, as/IN, poss/NNP, ,/,, and/CC, I/PRP, 'll/MD, go/VB, and/CC, look/VB, in/IN, the/DT, carpet/NN, shop/NN]","(ROOT (S (VP (VP (VB Get) (NP (DT those)) (ADVP (RB soon)) (PP (IN as) (NP (NNP poss))) (, ,) (PRN (CC and) (S (NP (PRP I)) (VP (MD 'll) (VP (VB go)))))) (CC and) (VP (VB look) (PP (IN in) (NP (DT the) (NN carpet) (NN shop)))))))"
K/KB/KB7.xml,KB7RE01H,19202,18,,A,15,1,Yes,[Yes/UH],(ROOT (INTJ (UH Yes)))
K/KB/KB7.xml,KB7RE01H,19202,19,,B,16,1,find out a few  --,"[find/VB, out/RP, a/DT, few/JJ, details/NNS, and/CC, I/PRP, 'll/MD, meet/VB, you/PRP, back/RB, at/IN, the/DT, estate/NN, agents/NNS]",(ROOT (NP (S (S (VP (VB find) (PRT (RP out)) (NP (DT a) (JJ few) (NNS details)))) (CC and) (S (NP (PRP I)) (VP (MD 'll) (VP (VB meet) (NP (PRP you)) (ADVP (RB back)) (PP (IN at) (NP (DT the) (NN estate) (NNS agents)))))))))
K/KB/KB7.xml,KB7RE01H,19202,20,,B,16,2,--details and I'll meet you back at the estate agents,"[find/VB, out/RP, a/DT, few/JJ, details/NNS, and/CC, I/PRP, 'll/MD, meet/VB, you/PRP, back/RB, at/IN, the/DT, estate/NN, agents/NNS]",(ROOT (NP (S (S (VP (VB find) (PRT (RP out)) (NP (DT a) (JJ few) (NNS details)))) (CC and) (S (NP (PRP I)) (VP (MD 'll) (VP (VB meet) (NP (PRP you)) (ADVP (RB back)) (PP (IN at) (NP (DT the) (NN estate) (NNS agents)))))))))
K/KB/KB7.xml,KB7RE01H,19202,21,,A,17,1,Oh  (()) ,[Oh/UH],(ROOT (INTJ (UH Oh)))
K/KB/KB7.xml,KB7RE01H,19202,22,,B,18,1,"or if you're out early, well  (()) forms sign, so you might be a little while  --","[or/CC, if/IN, you/PRP, 're/VBP, out/RB, early/RB, ,/,, well/RB, forms/VBZ, sign/NN, ,/,, so/RB, you/PRP, might/MD, be/VB, a/DT, little/JJ, while/NN, and/CC, if/IN, you/PRP, 've/VBP, got/VBN, ,/,, oh/UH, we/PRP, 're/VBP, going/VBG, to/TO, mum/NN, 's/POS, then/RB, aren/NNP, 't/PRP, we/PRP, ?/.]","(ROOT (SINV (CC or) (SBAR (IN if) (S (NP (PRP you)) (VP (VBP 're) (ADVP (RB out) (RB early))))) (, ,) (ADVP (RB well)) (VP (VBZ forms) (NP (NP (NN sign)) (, ,) (SBAR (SBAR (RB so) (S (NP (PRP you)) (VP (MD might) (VP (VB be) (NP (DT a) (JJ little) (NN while)))))) (CC and) (SBAR (IN if) (S (S (NP (PRP you)) (VP (VBP 've) (VP (VBN got)))) (, ,) (S (INTJ (UH oh)) (NP (PRP we)) (VP (VBP 're) (VP (VBG going) (PP (TO to) (NP (NP (NN mum) (POS 's)) (NP (FRAG (X (ADVP (RB then)) (NP (NNP aren))) (NP (PRP 't)))))))))))))) (NP (PRP we)) (. ?)))"
K/KB/KB7.xml,KB7RE01H,19202,23,,B,18,2,"--and if you've got, oh we're going to mum's then aren't we?","[or/CC, if/IN, you/PRP, 're/VBP, out/RB, early/RB, ,/,, well/RB, forms/VBZ, sign/NN, ,/,, so/RB, you/PRP, might/MD, be/VB, a/DT, little/JJ, while/NN, and/CC, if/IN, you/PRP, 've/VBP, got/VBN, ,/,, oh/UH, we/PRP, 're/VBP, going/VBG, to/TO, mum/NN, 's/POS, then/RB, aren/NNP, 't/PRP, we/PRP, ?/.]","(ROOT (SINV (CC or) (SBAR (IN if) (S (NP (PRP you)) (VP (VBP 're) (ADVP (RB out) (RB early))))) (, ,) (ADVP (RB well)) (VP (VBZ forms) (NP (NP (NN sign)) (, ,) (SBAR (SBAR (RB so) (S (NP (PRP you)) (VP (MD might) (VP (VB be) (NP (DT a) (JJ little) (NN while)))))) (CC and) (SBAR (IN if) (S (S (NP (PRP you)) (VP (VBP 've) (VP (VBN got)))) (, ,) (S (INTJ (UH oh)) (NP (PRP we)) (VP (VBP 're) (VP (VBG going) (PP (TO to) (NP (NP (NN mum) (POS 's)) (NP (FRAG (X (ADVP (RB then)) (NP (NNP aren))) (NP (PRP 't)))))))))))))) (NP (PRP we)) (. ?)))"
K/KB/KB7.xml,KB7RE01H,19202,24,,B,18,3,"Said it's still very early, we could pop to Leveringham, oh we don't know where it is  --","[Said/VBD, it/PRP, 's/VBZ, still/RB, very/RB, early/RB, ,/,, we/PRP, could/MD, pop/VB, to/TO, Leveringham/NN, ,/,, oh/UH, we/PRP, don/VBP, 't/PRP, know/VB, where/WRB, it/PRP, is/VBZ, we/PRP, might/MD, have/VB, some/DT, details/NNS, in/IN, this/DT, ,/,, what/WP, we/PRP, gotta/NNP, do/VBP, with/IN, my/PRP$, money/NN, ./.]","(ROOT (S (S (S (VP (VBD Said) (SBAR (S (NP (PRP it)) (VP (VBZ 's) (ADVP (RB still)) (ADVP (RB very) (RB early))))))) (, ,) (NP (PRP we)) (VP (MD could) (VP (VB pop) (PP (TO to) (NP (NN Leveringham)))))) (, ,) (S (INTJ (UH oh)) (NP (PRP we)) (VP (VBP don) (S (NP (PRP 't)) (VP (VB know) (SBAR (WHADVP (WRB where)) (S (NP (PRP it)) (VP (VBZ is) (SBAR (S (NP (PRP we)) (VP (MD might) (VP (VB have) (NP (NP (DT some) (NNS details)) (PP (IN in) (NP (NP (DT this)) (, ,) (SBAR (WHNP (WP what)) (S (NP (NP (PRP we)) (NP (NNP gotta))) (VP (VBP do) (PP (IN with) (NP (PRP$ my) (NN money)))))))))))))))))))) (. .)))"
K/KB/KB7.xml,KB7RE01H,19202,25,,B,18,4,"--we might have some details in this, what we gotta do with my money.","[Said/VBD, it/PRP, 's/VBZ, still/RB, very/RB, early/RB, ,/,, we/PRP, could/MD, pop/VB, to/TO, Leveringham/NN, ,/,, oh/UH, we/PRP, don/VBP, 't/PRP, know/VB, where/WRB, it/PRP, is/VBZ, we/PRP, might/MD, have/VB, some/DT, details/NNS, in/IN, this/DT, ,/,, what/WP, we/PRP, gotta/NNP, do/VBP, with/IN, my/PRP$, money/NN, ./.]","(ROOT (S (S (S (VP (VBD Said) (SBAR (S (NP (PRP it)) (VP (VBZ 's) (ADVP (RB still)) (ADVP (RB very) (RB early))))))) (, ,) (NP (PRP we)) (VP (MD could) (VP (VB pop) (PP (TO to) (NP (NN Leveringham)))))) (, ,) (S (INTJ (UH oh)) (NP (PRP we)) (VP (VBP don) (S (NP (PRP 't)) (VP (VB know) (SBAR (WHADVP (WRB where)) (S (NP (PRP it)) (VP (VBZ is) (SBAR (S (NP (PRP we)) (VP (MD might) (VP (VB have) (NP (NP (DT some) (NNS details)) (PP (IN in) (NP (NP (DT this)) (, ,) (SBAR (WHNP (WP what)) (S (NP (NP (PRP we)) (NP (NNP gotta))) (VP (VBP do) (PP (IN with) (NP (PRP$ my) (NN money)))))))))))))))))))) (. .)))"
K/KB/KB7.xml,KB7RE01H,19202,26,,A,19,1,"My house, my house, my (()) ","[My/PRP$, house/NN, ,/,, my/PRP$, house/NN, ,/,, my/PRP$]","(ROOT (FRAG (NP (NP (PRP$ My) (NN house)) (, ,) (NP (PRP$ my) (NN house)) (, ,) (NP (PRP$ my)))))"
K/KB/KB7.xml,KB7RE01H,19202,27,,B,20,1,I shouldn't think until you at least gone to the mortgage he's gonna give us authorization to spend his money.,"[I/PRP, shouldn/VBP, 't/PRP, think/VB, until/IN, you/PRP, at/IN, least/JJS, gone/VBN, to/TO, the/DT, mortgage/NN, he/PRP, 's/VBZ, gonna/NNP, give/VB, us/PRP, authorization/NN, to/TO, spend/VB, his/PRP$, money/NN, ./.]",(ROOT (S (NP (PRP I)) (VP (VBP shouldn) (S (NP (PRP 't)) (VP (VB think) (SBAR (IN until) (S (NP (PRP you)) (ADVP (IN at) (JJS least)) (VP (VBN gone) (PP (TO to) (NP (NP (DT the) (NN mortgage)) (SBAR (S (NP (PRP he)) (VP (VBZ 's) (S (NP (NNP gonna)) (VP (VB give) (NP (PRP us)) (NP (NN authorization))))))) (S (VP (TO to) (VP (VB spend) (NP (PRP$ his) (NN money))))))))))))) (. .)))
K/KB/KB7.xml,KB7RE01H,19202,28,,A,21,1,(()) ,[],X
K/KB/KB7.xml,KB7RE01H,19202,29,,B,22,1,"I'm not gonna use authori- to go and spend one thousand, five hundred pounds and it all falls through <laugh> ","[I/PRP, 'm/VBP, not/RB, gonna/VBN, use/NN, authori-/NN, to/TO, go/VB, and/CC, spend/VB, one/CD, thousand/CD, ,/,, five/CD, hundred/CD, pounds/NNS, and/CC, it/PRP, all/DT, falls/VBZ, through/IN]","(ROOT (NP (S (S (NP (PRP I)) (VP (VBP 'm) (RB not) (VP (VBN gonna) (NP (NN use) (NN authori-)) (S (VP (TO to) (VP (VB go) (CC and) (VB spend) (NP (NP (QP (CD one) (CD thousand))) (, ,) (NP (QP (CD five) (CD hundred)) (NNS pounds))))))))) (CC and) (S (NP (PRP it)) (ADVP (DT all)) (VP (VBZ falls) (PP (IN through)))))))"
K/KB/KB7.xml,KB7RE01H,19202,30,,A,23,1,"That's true, that's true, that's true,","[That/DT, 's/VBZ, true/JJ, ,/,, that/DT, 's/VBZ, true/JJ, ,/,, that/DT, 's/VBZ, true/JJ, ,/,]","(ROOT (S (NP (DT That)) (VP (VBZ 's) (ADJP (JJ true)) (PRN (, ,) (S (NP (DT that)) (VP (VBZ 's) (ADJP (JJ true)))) (, ,)) (SBAR (WHNP (DT that)) (S (VP (VBZ 's) (ADJP (JJ true)))))) (, ,)))"
K/KB/KB7.xml,KB7RE01H,19202,31,,B,24,1,after we've spent it ,"[after/IN, we/PRP, 've/VBP, spent/VBN, it/PRP]",(ROOT (SBAR (IN after) (S (NP (PRP we)) (VP (VBP 've) (VP (VBN spent) (NP (PRP it)))))))
K/KB/KB7.xml,KB7RE01H,19202,32,,A,25,1,"very true, very true ","[very/RB, true/JJ, ,/,, very/RB, true/JJ]","(ROOT (FRAG (S (ADJP (ADJP (RB very) (JJ true)) (, ,) (ADJP (RB very) (JJ true))))))"
K/KB/KB7.xml,KB7RE01H,19202,33,,B,26,1,And what we having for lunch?,"[And/CC, what/WP, we/PRP, having/VBG, for/IN, lunch/NN, ?/.]",(ROOT (FRAG (CC And) (SBAR (WHNP (WP what)) (S (NP (PRP we)) (VP (VBG having) (NP (NP (IN for)) (ADJP (NN lunch)))))) (. ?)))
K/KB/KB7.xml,KB7RE01H,19202,34,,A,27,1,"Don't know, I don't know what we're having ","[Don/NNP, 't/PRP, know/VBP, ,/,, I/PRP, don/VBP, 't/PRP, know/VB, what/WP, we/PRP, 're/VBP, having/VBG]","(ROOT (FRAG (NP (NP (NNP Don)) (SBAR (S (NP (PRP 't)) (VP (VBP know) (, ,) (SBAR (S (NP (PRP I)) (VP (VBP don) (S (NP (PRP 't)) (VP (VB know) (SBAR (WHNP (WP what)) (S (NP (PRP we)) (VP (VBP 're) (VP (VBG having))))))))))))))))"
K/KB/KB7.xml,KB7RE01H,19202,35,,B,28,1,Taking fish to mum's or find something when we get there?,"[Taking/VBG, fish/NN, to/TO, mum/NN, 's/POS, or/CC, find/VB, something/NN, when/WRB, we/PRP, get/VBP, there/EX, ?/.]",(ROOT (S (S (VP (VBG Taking) (NP (NN fish)) (PP (TO to) (NP (NN mum) (POS 's))))) (CC or) (S (VP (VB find) (NP (NN something)) (SBAR (WHADVP (WRB when)) (S (NP (PRP we)) (VP (VBP get) (S (NP (EX there)))))))) (. ?)))
K/KB/KB7.xml,KB7RE01H,19202,36,,A,29,1,"You taking  (()) depends how old it will be don't it, don't know how old it will be.","[You/PRP, taking/VBG, depends/VBZ, how/WRB, old/JJ, it/PRP, will/MD, be/VB, don/NNP, 't/PRP, it/PRP, ,/,, don/NNP, 't/PRP, know/VB, how/WRB, old/JJ, it/PRP, will/MD, be/VB, ./.]","(ROOT (SINV (S (NP (PRP You)) (VP (VBG taking))) (VP (VBZ depends) (SBAR (WHADJP (WRB how) (JJ old)) (S (NP (PRP it)) (VP (MD will) (VP (VB be) (VP (NNP don) (NP (PRP 't)))))))) (NP (NP (PRP it)) (, ,) (NP (NP (NNP don)) (SBAR (S (NP (PRP 't)) (VP (VB know) (SBAR (WHADJP (WRB how) (JJ old)) (S (NP (PRP it)) (VP (MD will) (VP (VB be)))))))))) (. .)))"
K/KB/KB7.xml,KB7RE01H,19202,37,,B,30,1,No ,[No/DT],(ROOT (FRAG (NP (DT No))))
K/KB/KB7.xml,KB7RE01H,19202,38,,A,31,1,No point in buying  --,"[No/DT, point/NN, in/IN, buying/VBG, fish/NN, extra/JJ, if/IN, we/PRP, know/VBP, we/PRP, 're/VBP, gonna/NNP, be/VB, ,/,, have/VB, to/TO, wait/VB, or/CC, something/NN]","(ROOT (FRAG (NP (DT No) (NN point)) (PP (IN in) (NP (S (VP (VBG buying) (NP (NN fish) (JJ extra)) (SBAR (IN if) (S (NP (PRP we)) (VP (VBP know) (SBAR (S (NP (PRP we)) (VP (VBP 're) (S (NP (NNP gonna)) (VP (VP (VB be)) (, ,) (VP (VB have) (S (VP (TO to) (VP (VB wait))))))))))))))) (CC or) (NP (NN something))))))"
K/KB/KB7.xml,KB7RE01H,19202,39,,A,31,2,"--fish extra if we know we're gonna be, have to wait or something ","[No/DT, point/NN, in/IN, buying/VBG, fish/NN, extra/JJ, if/IN, we/PRP, know/VBP, we/PRP, 're/VBP, gonna/NNP, be/VB, ,/,, have/VB, to/TO, wait/VB, or/CC, something/NN]","(ROOT (FRAG (NP (DT No) (NN point)) (PP (IN in) (NP (S (VP (VBG buying) (NP (NN fish) (JJ extra)) (SBAR (IN if) (S (NP (PRP we)) (VP (VBP know) (SBAR (S (NP (PRP we)) (VP (VBP 're) (S (NP (NNP gonna)) (VP (VP (VB be)) (, ,) (VP (VB have) (S (VP (TO to) (VP (VB wait))))))))))))))) (CC or) (NP (NN something))))))"
K/KB/KB7.xml,KB7RE01H,19202,40,,B,32,1,"If we're gonna be late, we'll have to buy the fish, cos we won't have time to cook anything.","[If/IN, we/PRP, 're/VBP, gonna/NNP, be/VB, late/RB, ,/,, we/PRP, 'll/MD, have/VB, to/TO, buy/VB, the/DT, fish/NN, ,/,, cos/NN, we/PRP, won/VBD, 't/PRP, have/VB, time/NN, to/TO, cook/VB, anything/NN, ./.]","(ROOT (S (SBAR (IN If) (S (NP (PRP we)) (VP (VBP 're) (S (NP (NNP gonna)) (VP (VB be) (ADVP (RB late))))))) (, ,) (NP (PRP we)) (VP (MD 'll) (VP (VB have) (S (VP (TO to) (VP (VB buy) (NP (NP (DT the) (NN fish)) (, ,) (NP (NP (NN cos)) (SBAR (S (NP (PRP we)) (VP (VBD won) (S (NP (PRP 't)) (VP (VB have) (NP (NN time)))))))))))) (S (VP (TO to) (VP (VB cook) (NP (NN anything))))))) (. .)))"
K/KB/KB7.xml,KB7RE01H,19202,41,,A,33,1,"Oh fish and chips you mean, from the chippie?","[Oh/UH, fish/NN, and/CC, chips/NNS, you/PRP, mean/VBP, ,/,, from/IN, the/DT, chippie/NNP, ?/.]","(ROOT (S (S (INTJ (UH Oh)) (NP (NN fish) (CC and) (NNS chips)) (VP (ADVP (PRP you)) (VBP mean))) (, ,) (FRAG (PP (IN from) (NP (DT the) (NNP chippie)))) (. ?)))"
K/KB/KB7.xml,KB7RE01H,19202,42,,B,34,1,"Yeah, yes I'll just have a piece of fish and you can have  --","[Yeah/UH, ,/,, yes/UH, I/PRP, 'll/MD, just/RB, have/VB, a/DT, piece/NN, of/IN, fish/NN, and/CC, you/PRP, can/MD, have/VB, fish/NN, and/CC, chips/NNS, ,/,, we/PRP, won/VBD, 't/PRP, have/VB, time/NN, to/TO, cook/VB, anything/NN, will/MD, we/PRP, ?/.]","(ROOT (SINV (S (S (INTJ (UH Yeah) (, ,) (UH yes)) (NP (PRP I)) (VP (MD 'll) (ADVP (RB just)) (VP (VB have) (NP (NP (DT a) (NN piece)) (PP (IN of) (NP (NN fish))))))) (CC and) (S (S (NP (PRP you)) (VP (MD can) (VP (VB have) (NP (NN fish) (CC and) (NNS chips))))) (, ,) (NP (PRP we)) (VP (VBD won) (S (NP (PRP 't)) (VP (VB have) (S (NP (NN time)) (VP (TO to) (VP (VB cook) (NP (NN anything)))))))))) (VP (MD will)) (NP (PRP we)) (. ?)))"
K/KB/KB7.xml,KB7RE01H,19202,43,,B,34,2,"--fish and chips, we won't have time to cook anything will we?","[Yeah/UH, ,/,, yes/UH, I/PRP, 'll/MD, just/RB, have/VB, a/DT, piece/NN, of/IN, fish/NN, and/CC, you/PRP, can/MD, have/VB, fish/NN, and/CC, chips/NNS, ,/,, we/PRP, won/VBD, 't/PRP, have/VB, time/NN, to/TO, cook/VB, anything/NN, will/MD, we/PRP, ?/.]","(ROOT (SINV (S (S (INTJ (UH Yeah) (, ,) (UH yes)) (NP (PRP I)) (VP (MD 'll) (ADVP (RB just)) (VP (VB have) (NP (NP (DT a) (NN piece)) (PP (IN of) (NP (NN fish))))))) (CC and) (S (S (NP (PRP you)) (VP (MD can) (VP (VB have) (NP (NN fish) (CC and) (NNS chips))))) (, ,) (NP (PRP we)) (VP (VBD won) (S (NP (PRP 't)) (VP (VB have) (S (NP (NN time)) (VP (TO to) (VP (VB cook) (NP (NN anything)))))))))) (VP (MD will)) (NP (PRP we)) (. ?)))"
K/KB/KB7.xml,KB7RE01H,19202,44,,A,35,1,That's what I mean,"[That/DT, 's/VBZ, what/WP, I/PRP, mean/VBP]",(ROOT (S (NP (DT That)) (VP (VBZ 's) (SBAR (WHNP (WP what)) (S (NP (PRP I)) (VP (VBP mean)))))))
K/KB/KB7.xml,KB7RE01H,19202,45,,B,36,1,Depending on the time.,"[Depending/VBG, on/IN, the/DT, time/NN, ./.]",(ROOT (FRAG (PP (VBG Depending) (PP (IN on) (NP (DT the) (NN time)))) (. .)))
K/KB/KB7.xml,KB7RE01H,19202,46,,A,37,1,or I say  (()) chicken alright?,"[or/CC, I/PRP, say/VBP, chicken/NN, alright/NN, ?/.]",(ROOT (S (CC or) (NP (PRP I)) (VP (VBP say) (NP (NN chicken) (NN alright))) (. ?)))
K/KB/KB7.xml,KB7RE01H,19202,47,,B,38,1,"Depending on how long we're gonna have to cook it, well I mean,(()) , oh well  (()) what I can  --","[Depending/VBG, on/IN, how/WRB, long/RB, we/PRP, 're/VBP, gonna/NNS, have/VBP, to/TO, cook/VB, it/PRP, ,/,, well/RB, I/PRP, mean/VBP, ,/,, ,/,, oh/UH, well/RB, what/WP, I/PRP, can/MD, still/RB, you/PRP, 'll/MD, have/VB, to/TO, fish/NN, and/CC, chips/NNS]","(ROOT (PP (VBG Depending) (PP (IN on) (SBAR (WHADVP (WRB how) (RB long)) (S (NP (PRP we)) (VP (VBP 're) (NP (NP (NNS gonna)) (VP (VP (VBP have) (S (VP (TO to) (VP (VB cook) (NP (PRP it)) (PRN (, ,) (S (ADVP (RB well)) (NP (PRP I)) (VP (VBP mean))) (, ,)))))) (, ,) (VP (NP (UH oh)) (ADVP (RB well))) (SBAR (WHNP (WP what)) (S (NP (PRP I)) (VP (MD can) (ADVP (RB still)))))) (SBAR (S (NP (PRP you)) (VP (MD 'll) (VP (VB have) (PP (TO to) (NP (NN fish) (CC and) (NNS chips))))))))))))))"
K/KB/KB7.xml,KB7RE01H,19202,48,,B,38,2,--still you'll have to  (()) fish and chips ,"[Depending/VBG, on/IN, how/WRB, long/RB, we/PRP, 're/VBP, gonna/NNS, have/VBP, to/TO, cook/VB, it/PRP, ,/,, well/RB, I/PRP, mean/VBP, ,/,, ,/,, oh/UH, well/RB, what/WP, I/PRP, can/MD, still/RB, you/PRP, 'll/MD, have/VB, to/TO, fish/NN, and/CC, chips/NNS]","(ROOT (PP (VBG Depending) (PP (IN on) (SBAR (WHADVP (WRB how) (RB long)) (S (NP (PRP we)) (VP (VBP 're) (NP (NP (NNS gonna)) (VP (VP (VBP have) (S (VP (TO to) (VP (VB cook) (NP (PRP it)) (PRN (, ,) (S (ADVP (RB well)) (NP (PRP I)) (VP (VBP mean))) (, ,)))))) (, ,) (VP (NP (UH oh)) (ADVP (RB well))) (SBAR (WHNP (WP what)) (S (NP (PRP I)) (VP (MD can) (ADVP (RB still)))))) (SBAR (S (NP (PRP you)) (VP (MD 'll) (VP (VB have) (PP (TO to) (NP (NN fish) (CC and) (NNS chips))))))))))))))"
K/KB/KB7.xml,KB7RE01H,19202,49,,A,39,1,(()) ,[],X
K/KB/KB7.xml,KB7RE01H,19202,50,,B,40,1,still you perhaps have to buy fish and chips,"[still/RB, you/PRP, perhaps/RB, have/VBP, to/TO, buy/VB, fish/NN, and/CC, chips/NNS]",(ROOT (ADJP (RB still) (SBAR (S (NP (PRP you)) (ADVP (RB perhaps)) (VP (VBP have) (S (VP (TO to) (VP (VB buy) (NP (NN fish) (CC and) (NNS chips))))))))))
K/KB/KB7.xml,KB7RE01H,19202,51,,A,41,1,Why?,"[Why/WRB, ?/.]",(ROOT (FRAG (WRB Why) (. ?)))
K/KB/KB7.xml,KB7RE01H,19202,52,,B,42,1,cos Ann hasn't got a lot of pennies anyway,"[cos/NNP, Ann/NNP, hasn/NNP, 't/PRP, got/VBD, a/DT, lot/NN, of/IN, pennies/NNS, anyway/RB]",(ROOT (FRAG (NP (NP (NNP cos) (NNP Ann) (NNP hasn)) (SBAR (S (NP (PRP 't)) (VP (VBD got) (NP (NP (DT a) (NN lot)) (PP (IN of) (NP (NNS pennies)))) (ADVP (RB anyway))))))))
K/KB/KB7.xml,KB7RE01H,19202,53,,A,43,1,Nor has Stuey.,"[Nor/CC, has/VBZ, Stuey/NNP, ./.]",(ROOT (S (CC Nor) (VP (VBZ has) (NP (NNP Stuey))) (. .)))
K/KB/KB7.xml,KB7RE01H,19202,54,,B,44,1,hasn't he?,"[hasn/NNP, 't/PRP, he/PRP, ?/.]",(ROOT (NP (NP (NNP hasn)) (NP (NP (PRP 't)) (NP (PRP he))) (. ?)))
K/KB/KB7.xml,KB7RE01H,19202,55,,B,44,2,"Oh bloody hell, we're poor streaks then dear.","[Oh/UH, bloody/JJ, hell/NN, ,/,, we/PRP, 're/VBP, poor/JJ, streaks/NNS, then/RB, dear/RB, ./.]","(ROOT (S (INTJ (UH Oh)) (INTJ (JJ bloody) (NN hell)) (, ,) (NP (PRP we)) (VP (VBP 're) (ADVP (NP (JJ poor) (NNS streaks)) (RB then)) (ADJP (RB dear))) (. .)))"
K/KB/KB7.xml,KB7RE01H,19202,56,,A,45,1,That's wise you know.,"[That/DT, 's/VBZ, wise/JJ, you/PRP, know/VBP, ./.]",(ROOT (S (NP (DT That)) (VP (VBZ 's) (ADJP (JJ wise) (SBAR (S (NP (PRP you)) (VP (VBP know)))))) (. .)))
K/KB/KB7.xml,KB7RE01H,19202,57,,B,46,1,"Bloody hell,(()) then, it's chicken <laugh> ","[Bloody/JJ, hell/NN, ,/,, then/RB, ,/,, it/PRP, 's/VBZ, chicken/NN]","(ROOT (S (NP (JJ Bloody) (NN hell)) (, ,) (ADVP (RB then)) (, ,) (NP (PRP it)) (VP (VBZ 's) (NP (NN chicken)))))"
K/KB/KB7.xml,KB7RE01H,19202,58,,A,47,1,Right oh ,"[Right/JJ, oh/NN]",(ROOT (NP (JJ Right) (NN oh)))
K/KB/KB7.xml,KB7RE01H,19202,59,,B,48,1,<laugh> ,[],X
K/KB/KB7.xml,KB7RE01H,19202,60,,A,49,1,"yeah well, we've got some erm cordon bleu or some whatever, you know,(()) ","[yeah/UH, well/UH, ,/,, we/PRP, 've/VBP, got/VBD, some/DT, erm/NN, cordon/NN, bleu/NN, or/CC, some/DT, whatever/WDT, ,/,, you/PRP, know/VBP, ,/,]","(ROOT (NP (S (S (INTJ (UH yeah) (UH well)) (, ,) (NP (PRP we)) (VP (VBP 've) (VP (VBD got) (NP (DT some) (NN erm) (NN cordon) (NN bleu))))) (CC or) (S (SBAR (WHNP (DT some)) (FRAG (WHNP (WDT whatever)))) (, ,) (NP (PRP you)) (VP (VBP know)) (, ,)))))"
K/KB/KB7.xml,KB7RE01H,19202,61,,B,50,1,It can go in microwave.,"[It/PRP, can/MD, go/VB, in/IN, microwave/NN, ./.]",(ROOT (S (NP (PRP It)) (VP (MD can) (VP (VB go) (PP (IN in) (NP (NN microwave))))) (. .)))
K/KB/KB7.xml,KB7RE01H,19202,62,,A,51,1,(()) or whatever's,"[or/CC, whatever/WDT, 's/POS]",(ROOT (PRN (CC or) (S (NP (WDT whatever)) (VP (POS 's)))))
K/KB/KB7.xml,KB7RE01H,19202,63,,B,52,1,"Go in the microwave that's all, I ain't got much money at all, I didn't have that much left, I bought mum's cigs and that bit of shopping the other day and that was the end of that    --","[Go/VB, in/IN, the/DT, microwave/NN, that/WDT, 's/VBZ, all/DT, ,/,, I/PRP, ain/VBP, 't/PRP, got/VBD, much/JJ, money/NN, at/IN, all/DT, ,/,, I/PRP, didn/VBP, 't/PRP, have/VB, that/DT, much/JJ, left/NN, ,/,, I/PRP, bought/VBD, mum/NN, 's/POS, cigs/NNS, and/CC, that/IN, bit/NN, of/IN, shopping/VBG, the/DT, other/JJ, day/NN, and/CC, that/DT, was/VBD, the/DT, end/NN, of/IN, that/IN, we/PRP, will/MD, survive/VB, ./.]","(ROOT (S (S (S (VP (VB Go) (PP (IN in) (NP (NP (DT the) (NN microwave)) (SBAR (WHNP (WDT that)) (S (VP (VBZ 's) (NP (DT all))))))))) (, ,) (NP (PRP I)) (VP (VBP ain) (SBAR (S (NP (PRP 't)) (VP (VBD got) (NP (JJ much) (NN money)) (ADVP (IN at) (DT all))))))) (, ,) (NP (PRP I)) (VP (VBP didn) (S (NP (PRP 't)) (VP (VB have) (NP (DT that) (JJ much) (NN left)))) (, ,) (SBAR (SBAR (S (NP (PRP I)) (VP (VBD bought) (NP (NP (NN mum) (POS 's)) (NNS cigs))))) (CC and) (SBAR (IN that) (S (NP (NP (NN bit)) (PP (IN of) (S (VP (VBG shopping) (NP (NP (DT the) (JJ other) (NN day)) (CC and) (NP (DT that))))))) (VP (VBD was) (NP (NP (DT the) (NN end)) (PP (IN of) (SBAR (IN that) (S (NP (PRP we)) (VP (MD will) (VP (VB survive)))))))))))) (. .)))"
K/KB/KB7.xml,KB7RE01H,19202,64,,B,52,2,--<sigh> --,"[Go/VB, in/IN, the/DT, microwave/NN, that/WDT, 's/VBZ, all/DT, ,/,, I/PRP, ain/VBP, 't/PRP, got/VBD, much/JJ, money/NN, at/IN, all/DT, ,/,, I/PRP, didn/VBP, 't/PRP, have/VB, that/DT, much/JJ, left/NN, ,/,, I/PRP, bought/VBD, mum/NN, 's/POS, cigs/NNS, and/CC, that/IN, bit/NN, of/IN, shopping/VBG, the/DT, other/JJ, day/NN, and/CC, that/DT, was/VBD, the/DT, end/NN, of/IN, that/IN, we/PRP, will/MD, survive/VB, ./.]","(ROOT (S (S (S (VP (VB Go) (PP (IN in) (NP (NP (DT the) (NN microwave)) (SBAR (WHNP (WDT that)) (S (VP (VBZ 's) (NP (DT all))))))))) (, ,) (NP (PRP I)) (VP (VBP ain) (SBAR (S (NP (PRP 't)) (VP (VBD got) (NP (JJ much) (NN money)) (ADVP (IN at) (DT all))))))) (, ,) (NP (PRP I)) (VP (VBP didn) (S (NP (PRP 't)) (VP (VB have) (NP (DT that) (JJ much) (NN left)))) (, ,) (SBAR (SBAR (S (NP (PRP I)) (VP (VBD bought) (NP (NP (NN mum) (POS 's)) (NNS cigs))))) (CC and) (SBAR (IN that) (S (NP (NP (NN bit)) (PP (IN of) (S (VP (VBG shopping) (NP (NP (DT the) (JJ other) (NN day)) (CC and) (NP (DT that))))))) (VP (VBD was) (NP (NP (DT the) (NN end)) (PP (IN of) (SBAR (IN that) (S (NP (PRP we)) (VP (MD will) (VP (VB survive)))))))))))) (. .)))"
