swda_filename,ptb_basename,conversation_no,transcript_index,act_tag,caller,turn_index,subutterance_index,text,pos,trees
K/KD/KDA.xml,KDARE00E,11606,0,,A,1,1,"You see I can't remember if they're if they're pulling my plonker or not, but that is the sort of thing I do, but I can't remember anything about it.","[You/PRP, see/VBP, I/PRP, can/MD, 't/PRP, remember/VB, if/IN, they/PRP, 're/VBP, if/IN, they/PRP, 're/VBP, pulling/VBG, my/PRP$, plonker/NN, or/CC, not/RB, ,/,, but/CC, that/DT, is/VBZ, the/DT, sort/NN, of/IN, thing/NN, I/PRP, do/VBP, ,/,, but/CC, I/PRP, can/MD, 't/PRP, remember/VB, anything/NN, about/IN, it/PRP, ./.]","(ROOT (S (S (NP (PRP You)) (VP (VBP see) (SBAR (S (NP (PRP I)) (VP (MD can) (NP (PRP 't)) (S (VP (VB remember) (SBAR (IN if) (S (NP (PRP they)) (VP (VBP 're) (SBAR (IN if) (S (NP (PRP they)) (VP (VBP 're) (VP (VBG pulling) (NP (PRP$ my) (NN plonker))))) (CC or) (RB not)))))))))))) (, ,) (CC but) (S (S (NP (DT that)) (VP (VBZ is) (NP (NP (DT the) (NN sort)) (PP (IN of) (NP (NN thing))) (SBAR (S (NP (PRP I)) (VP (VBP do))))))) (, ,) (CC but) (S (NP (PRP I)) (VP (MD can) (NP (PRP 't)) (S (VP (VB remember) (NP (NN anything)) (PP (IN about) (NP (PRP it)))))))) (. .)))"
K/KD/KDA.xml,KDARE00E,11606,1,,A,1,2,"The only trouble is I did have quite, well it's easy though that's the thing  --","[The/DT, only/JJ, trouble/NN, is/VBZ, I/PRP, did/VBD, have/VB, quite/RB, ,/,, well/RB, it/PRP, 's/VBZ, easy/JJ, though/IN, that/DT, 's/VBZ, the/DT, thing/NN, it/PRP, 's/VBZ, just/RB, like/IN, a/DT, ,/,, it/PRP, 's/VBZ, just/RB, a/DT, multi/NNP, storey/NNP, car/NNP, park/NNP, ,/,, so/IN, it/PRP, 's/VBZ, quite/RB, easy/JJ, ,/,, and/CC, you/PRP, ,/,, you/PRP, know/VBP, you/PRP, can/MD, get/VB, strong/JJ, when/WRB, you/PRP, 're/VBP, pissed/VBN, don/NNP, 't/PRP, you/PRP, ,/,, like/IN]","(ROOT (S (S (NP (DT The) (JJ only) (NN trouble)) (VP (VBZ is) (SBAR (S (NP (PRP I)) (VP (VBD did) (VP (VB have) (S (ADVP (RB quite)) (, ,) (ADVP (RB well)) (NP (PRP it)) (VP (VBZ 's) (ADJP (JJ easy)) (SBAR (IN though) (S (NP (DT that)) (VP (VBZ 's) (NP (NP (DT the) (NN thing)) (SBAR (S (NP (PRP it)) (VP (VBZ 's) (NP (QP (RB just) (IN like) (DT a)))))))))))))))))) (PRN (, ,) (S (NP (PRP it)) (VP (VBZ 's) (ADVP (RB just)) (NP (DT a) (NNP multi) (NNP storey) (NNP car) (NNP park)))) (, ,)) (IN so) (S (NP (PRP it)) (VP (VBZ 's) (ADJP (RB quite) (JJ easy)))) (, ,) (CC and) (S (NP (PRP you)) (, ,) (NP (PRP you)) (VP (VBP know) (SBAR (S (NP (PRP you)) (VP (MD can) (VP (VB get) (ADJP (JJ strong)) (SBAR (WHADVP (WRB when)) (S (NP (PRP you)) (VP (VBP 're) (VP (VBN pissed) (S (VP (NNP don) (S (NP (PRP 't)) (NP (PRP you))))))))))))) (, ,) (PP (IN like))))))"
K/KD/KDA.xml,KDARE00E,11606,2,,A,1,3,"--it's just like a, it's just a multi storey car park, so it's quite easy, and you, you know you can get strong when you're pissed don't you, like","[The/DT, only/JJ, trouble/NN, is/VBZ, I/PRP, did/VBD, have/VB, quite/RB, ,/,, well/RB, it/PRP, 's/VBZ, easy/JJ, though/IN, that/DT, 's/VBZ, the/DT, thing/NN, it/PRP, 's/VBZ, just/RB, like/IN, a/DT, ,/,, it/PRP, 's/VBZ, just/RB, a/DT, multi/NNP, storey/NNP, car/NNP, park/NNP, ,/,, so/IN, it/PRP, 's/VBZ, quite/RB, easy/JJ, ,/,, and/CC, you/PRP, ,/,, you/PRP, know/VBP, you/PRP, can/MD, get/VB, strong/JJ, when/WRB, you/PRP, 're/VBP, pissed/VBN, don/NNP, 't/PRP, you/PRP, ,/,, like/IN]","(ROOT (S (S (NP (DT The) (JJ only) (NN trouble)) (VP (VBZ is) (SBAR (S (NP (PRP I)) (VP (VBD did) (VP (VB have) (S (ADVP (RB quite)) (, ,) (ADVP (RB well)) (NP (PRP it)) (VP (VBZ 's) (ADJP (JJ easy)) (SBAR (IN though) (S (NP (DT that)) (VP (VBZ 's) (NP (NP (DT the) (NN thing)) (SBAR (S (NP (PRP it)) (VP (VBZ 's) (NP (QP (RB just) (IN like) (DT a)))))))))))))))))) (PRN (, ,) (S (NP (PRP it)) (VP (VBZ 's) (ADVP (RB just)) (NP (DT a) (NNP multi) (NNP storey) (NNP car) (NNP park)))) (, ,)) (IN so) (S (NP (PRP it)) (VP (VBZ 's) (ADJP (RB quite) (JJ easy)))) (, ,) (CC and) (S (NP (PRP you)) (, ,) (NP (PRP you)) (VP (VBP know) (SBAR (S (NP (PRP you)) (VP (MD can) (VP (VB get) (ADJP (JJ strong)) (SBAR (WHADVP (WRB when)) (S (NP (PRP you)) (VP (VBP 're) (VP (VBN pissed) (S (VP (NNP don) (S (NP (PRP 't)) (NP (PRP you))))))))))))) (, ,) (PP (IN like))))))"
K/KD/KDA.xml,KDARE00E,11606,3,,B,2,1,What  (()) fucking  (()) .,"[What/WDT, fucking/NN, ./.]",(ROOT (FRAG (WHNP (WDT What) (NP (NN fucking))) (. .)))
K/KD/KDA.xml,KDARE00E,11606,4,,B,2,2,Well either you have to think it's wrong.,"[Well/RB, either/CC, you/PRP, have/VBP, to/TO, think/VB, it/PRP, 's/VBZ, wrong/JJ, ./.]",(ROOT (S (S (ADVP (RB Well)) (ADVP (CC either)) (NP (PRP you)) (VP (VBP have) (S (VP (TO to) (VP (VB think)))))) (NP (PRP it)) (VP (VBZ 's) (ADJP (JJ wrong))) (. .)))
K/KD/KDA.xml,KDARE00E,11606,5,,A,3,1,"yeah but I mean, I  (()) it, I  (()) when I'm fucking pissed, I can't  (()) sober, that's why I probably think they're, they're not pulling a plonker cos I've done that sort of thing in the past  --","[yeah/UH, but/CC, I/PRP, mean/VBP, ,/,, I/PRP, it/PRP, ,/,, I/PRP, when/WRB, I/PRP, 'm/VBP, fucking/VBG, pissed/VBN, ,/,, I/PRP, can/MD, 't/PRP, sober/JJ, ,/,, that/DT, 's/VBZ, why/WRB, I/PRP, probably/RB, think/VBP, they/PRP, 're/VBP, ,/,, they/PRP, 're/VBP, not/RB, pulling/VBG, a/DT, plonker/NN, cos/NN, I/PRP, 've/VBP, done/VBN, that/IN, sort/NN, of/IN, thing/NN, in/IN, the/DT, past/NN, had/VBD, me/PRP, fucking/JJ, climbing/VBG, on/IN, bikes/NNS, ,/,, swinging/VBG, off/RP, the/DT, side/NN, of/IN, the/DT, building/NN, ./.]","(ROOT (S (S (INTJ (UH yeah)) (NP (CC but)) (VP (ADVP (PRP I)) (VBP mean))) (, ,) (S (NP (PRP I)) (NP (PRP it))) (, ,) (S (S (NP (PRP I)) (SBAR (WHADVP (WRB when)) (S (NP (PRP I)) (VP (VBP 'm) (VP (VBG fucking) (S (VP (VBN pissed)))))))) (, ,) (NP (PRP I)) (VP (MD can) (VP (FRAG (ADJP (NP (PRP 't)) (JJ sober)))))) (, ,) (S (NP (DT that)) (VP (VBZ 's) (SBAR (WHADVP (WRB why)) (S (NP (PRP I)) (ADVP (RB probably)) (VP (VBP think) (SBAR (S (NP (PRP they)) (VP (VBP 're))))))))) (, ,) (S (NP (PRP they)) (VP (VBP 're) (RB not) (VP (VBG pulling) (NP (NP (DT a) (NN plonker) (NN cos)) (SBAR (S (NP (PRP I)) (VP (VBP 've) (VP (VBN done) (SBAR (IN that) (S (NP (NP (NN sort)) (PP (IN of) (NP (NP (NN thing)) (PP (IN in) (NP (DT the) (NN past)))))) (VP (VBD had) (S (NP (PRP me)) (ADJP (JJ fucking)) (S (VP (VBG climbing) (PP (IN on) (NP (NNS bikes))))))))))))))))) (, ,) (S (VP (VBG swinging) (PRT (RP off)) (NP (NP (DT the) (NN side)) (PP (IN of) (NP (DT the) (NN building)))))) (. .)))"
K/KD/KDA.xml,KDARE00E,11606,6,,A,3,2,"--had me fucking climbing on bikes, swinging off the side of the building (()) .","[yeah/UH, but/CC, I/PRP, mean/VBP, ,/,, I/PRP, it/PRP, ,/,, I/PRP, when/WRB, I/PRP, 'm/VBP, fucking/VBG, pissed/VBN, ,/,, I/PRP, can/MD, 't/PRP, sober/JJ, ,/,, that/DT, 's/VBZ, why/WRB, I/PRP, probably/RB, think/VBP, they/PRP, 're/VBP, ,/,, they/PRP, 're/VBP, not/RB, pulling/VBG, a/DT, plonker/NN, cos/NN, I/PRP, 've/VBP, done/VBN, that/IN, sort/NN, of/IN, thing/NN, in/IN, the/DT, past/NN, had/VBD, me/PRP, fucking/JJ, climbing/VBG, on/IN, bikes/NNS, ,/,, swinging/VBG, off/RP, the/DT, side/NN, of/IN, the/DT, building/NN, ./.]","(ROOT (S (S (INTJ (UH yeah)) (NP (CC but)) (VP (ADVP (PRP I)) (VBP mean))) (, ,) (S (NP (PRP I)) (NP (PRP it))) (, ,) (S (S (NP (PRP I)) (SBAR (WHADVP (WRB when)) (S (NP (PRP I)) (VP (VBP 'm) (VP (VBG fucking) (S (VP (VBN pissed)))))))) (, ,) (NP (PRP I)) (VP (MD can) (VP (FRAG (ADJP (NP (PRP 't)) (JJ sober)))))) (, ,) (S (NP (DT that)) (VP (VBZ 's) (SBAR (WHADVP (WRB why)) (S (NP (PRP I)) (ADVP (RB probably)) (VP (VBP think) (SBAR (S (NP (PRP they)) (VP (VBP 're))))))))) (, ,) (S (NP (PRP they)) (VP (VBP 're) (RB not) (VP (VBG pulling) (NP (NP (DT a) (NN plonker) (NN cos)) (SBAR (S (NP (PRP I)) (VP (VBP 've) (VP (VBN done) (SBAR (IN that) (S (NP (NP (NN sort)) (PP (IN of) (NP (NP (NN thing)) (PP (IN in) (NP (DT the) (NN past)))))) (VP (VBD had) (S (NP (PRP me)) (ADJP (JJ fucking)) (S (VP (VBG climbing) (PP (IN on) (NP (NNS bikes))))))))))))))))) (, ,) (S (VP (VBG swinging) (PRT (RP off)) (NP (NP (DT the) (NN side)) (PP (IN of) (NP (DT the) (NN building)))))) (. .)))"
K/KD/KDA.xml,KDARE00E,11606,7,,B,4,1,Oh I.,"[Oh/UH, I/PRP, ./.]",(ROOT (S (VP (NP (INTJ (UH Oh)) (NP (PRP I)))) (. .)))
K/KD/KDA.xml,KDARE00E,11606,8,,A,5,1,"See I never know whether they're pulling, pulling a plonker or not you know, that's the real (()) , like I said I can't remember doing it, but, I wouldn't put it pass myself and I fucking get stupid, I don't get aggressive or anything I just get stupid, you know, I do shit like that.","[See/VB, I/PRP, never/RB, know/VBP, whether/IN, they/PRP, 're/VBP, pulling/VBG, ,/,, pulling/VBG, a/DT, plonker/NN, or/CC, not/RB, you/PRP, know/VBP, ,/,, that/DT, 's/VBZ, the/DT, real/JJ, ,/,, like/IN, I/PRP, said/VBD, I/PRP, can/MD, 't/PRP, remember/VB, doing/VBG, it/PRP, ,/,, but/CC, ,/,, I/PRP, wouldn/VBP, 't/PRP, put/VB, it/PRP, pass/VB, myself/PRP, and/CC, I/PRP, fucking/VBG, get/VB, stupid/JJ, ,/,, I/PRP, don/VBP, 't/PRP, get/VB, aggressive/JJ, or/CC, anything/NN, I/PRP, just/RB, get/VB, stupid/JJ, ,/,, you/PRP, know/VBP, ,/,, I/PRP, do/VBP, shit/VB, like/IN, that/DT, ./.]","(ROOT (S (S (S (VP (VB See) (SBAR (S (NP (PRP I)) (ADVP (RB never)) (VP (VBP know) (SBAR (IN whether) (S (NP (PRP they)) (VP (VBP 're) (VP (VBG pulling) (, ,) (S (VP (VBG pulling) (NP (DT a) (NN plonker))))))) (CC or) (RB not))))))) (NP (PRP you)) (VP (VBP know) (PRN (, ,) (S (NP (DT that)) (VP (VBZ 's) (NP (DT the) (JJ real)))) (, ,)) (SBAR (IN like) (S (NP (PRP I)) (VP (VBD said) (SBAR (S (NP (PRP I)) (VP (MD can) (NP (PRP 't)) (S (VP (VB remember) (S (VP (VBG doing) (NP (PRP it)))))))))))))) (, ,) (CC but) (, ,) (S (NP (PRP I)) (VP (VBP wouldn) (S (NP (PRP 't)) (VP (VB put) (S (NP (PRP it)) (VP (VB pass) (S (NP (PRP myself) (CC and) (PRP I)) (VP (VBG fucking) (S (VP (VB get) (ADJP (JJ stupid)))))))))))) (, ,) (S (NP (PRP I)) (VP (VBP don) (S (NP (PRP 't)) (VP (VB get) (UCP (ADJP (JJ aggressive)) (CC or) (NP (NP (NN anything)) (SBAR (S (NP (PRP I)) (ADVP (RB just)) (VP (VB get) (ADJP (JJ stupid))))))))))) (, ,) (S (NP (PRP you)) (VP (VBP know))) (, ,) (S (NP (PRP I)) (VP (VBP do) (VP (VB shit) (PP (IN like) (NP (DT that)))))) (. .)))"
K/KD/KDA.xml,KDARE00E,11606,9,,A,5,2,"I've nicked bus stop signs, fucking road signs and stuff, I just get stupid, that's if I get that pissed, I mean I probably talking of, talking of fucking all most not knowing you're right name sort of pissed.","[I/PRP, 've/VBP, nicked/VBN, bus/NN, stop/NN, signs/NNS, ,/,, fucking/VBG, road/NN, signs/NNS, and/CC, stuff/NN, ,/,, I/PRP, just/RB, get/VB, stupid/JJ, ,/,, that/DT, 's/VBZ, if/IN, I/PRP, get/VBP, that/IN, pissed/VBN, ,/,, I/PRP, mean/VBP, I/PRP, probably/RB, talking/VBG, of/IN, ,/,, talking/VBG, of/IN, fucking/VBG, all/DT, most/JJS, not/RB, knowing/VBG, you/PRP, 're/VBP, right/JJ, name/NN, sort/NN, of/IN, pissed/VBN, ./.]","(ROOT (S (S (NP (PRP I)) (VP (VBP 've) (VP (VBN nicked) (NP (NN bus) (NN stop) (NNS signs)) (, ,) (S (VP (VBG fucking) (S (NP (NN road) (NNS signs) (CC and) (NN stuff)) (, ,) (NP (PRP I)) (ADVP (RB just)) (VP (VB get) (ADJP (JJ stupid))))))))) (, ,) (NP (DT that)) (VP (VBZ 's) (SBAR (IN if) (S (NP (PRP I)) (VP (VBP get) (SBAR (IN that) (S (S (VP (VBN pissed))) (, ,) (NP (PRP I)) (VP (VBP mean) (S (NP (PRP I)) (VP (VP (ADVP (RB probably)) (VBG talking) (PP (IN of))) (, ,) (VP (VBG talking) (PP (IN of) (S (VP (VBG fucking) (NP (NP (DT all)) (SBAR (WHNP (WHNP (JJS most)) (S (RB not) (VP (VBG knowing) (NP (PRP you))))) (S (VP (VBP 're) (NP (NP (JJ right) (NN name) (NN sort)) (PP (IN of) (S (VP (VBN pissed)))))))))))))))))))))) (. .)))"
K/KD/KDA.xml,KDARE00E,11606,10,,B,6,1,(()) .,[./.],(ROOT (NP (. .)))
K/KD/KDA.xml,KDARE00E,11606,11,,A,7,1,"That's the thing,apparent- apparently I couldn't even walk straight, and yet there's me fucking climbing up the outside of a building, which to me sounds about right.","[That/DT, 's/VBZ, the/DT, thing/NN, ,apparent-/JJ, apparently/RB, I/PRP, couldn/VBP, 't/PRP, even/RB, walk/VBP, straight/RB, ,/,, and/CC, yet/RB, there/EX, 's/VBZ, me/PRP, fucking/JJ, climbing/VBG, up/RP, the/DT, outside/NN, of/IN, a/DT, building/NN, ,/,, which/WDT, to/TO, me/PRP, sounds/VBZ, about/RB, right/RB, ./.]","(ROOT (S (S (NP (DT That)) (VP (VBZ 's) (ADJP (NP (DT the) (NN thing)) (JJ ,apparent-)) (ADVP (RB apparently)))) (PRN (S (NP (PRP I)) (VP (VBP couldn) (SBAR (S (NP (PRP 't)) (ADVP (RB even)) (VP (VBP walk) (ADVP (RB straight))))))) (, ,)) (CC and) (ADVP (RB yet)) (S (NP (EX there)) (VP (VBZ 's) (S (NP (PRP me)) (ADJP (JJ fucking)) (S (VP (VBG climbing) (PRT (RP up)) (NP (NP (DT the) (NN outside)) (PP (IN of) (NP (NP (DT a) (NN building)) (, ,) (SBAR (WHNP (WDT which)) (S (PP (TO to) (NP (PRP me))) (VP (VBZ sounds) (ADVP (RB about) (RB right))))))))))))) (. .)))"
K/KD/KDA.xml,KDARE00E,11606,12,,A,7,2,"God knows how I didn't kill myself and the sheer of the whole thing was, it wasn't even on the second floor, it was on the ground floor, they were just pulling a (()) .","[God/NNP, knows/VBZ, how/WRB, I/PRP, didn/VBP, 't/PRP, kill/VB, myself/PRP, and/CC, the/DT, sheer/NN, of/IN, the/DT, whole/JJ, thing/NN, was/VBD, ,/,, it/PRP, wasn/VBD, 't/PRP, even/RB, on/IN, the/DT, second/JJ, floor/NN, ,/,, it/PRP, was/VBD, on/IN, the/DT, ground/NN, floor/NN, ,/,, they/PRP, were/VBD, just/RB, pulling/VBG, a/DT, ./.]","(ROOT (S (S (NP (NNP God)) (VP (VBZ knows) (SBAR (WHADVP (WRB how)) (S (NP (PRP I)) (VP (VBP didn) (S (NP (PRP 't)) (VP (VB kill) (NP (PRP myself))))))))) (CC and) (S (NP (NP (DT the) (NN sheer)) (PP (IN of) (NP (DT the) (JJ whole) (NN thing)))) (VP (VBD was))) (, ,) (S (NP (PRP it)) (VP (VBD wasn) (NP (PRP 't)) (ADVP (RB even)) (PP (IN on) (NP (DT the) (JJ second) (NN floor))))) (, ,) (S (NP (PRP it)) (VP (VBD was) (PP (IN on) (NP (DT the) (NN ground) (NN floor))))) (, ,) (S (NP (PRP they)) (VP (VBD were) (ADVP (RB just)) (VP (VBG pulling) (NP (DT a))))) (. .)))"
K/KD/KDA.xml,KDARE00E,11606,13,,A,7,3,Cos I count.,"[Cos/NNP, I/PRP, count/VBP, ./.]",(ROOT (S (NP (NNP Cos) (PRP I)) (VP (VBP count)) (. .)))
K/KD/KDA.xml,KDARE00E,11606,14,,B,8,1,"I, I use to go up the (()) .","[I/PRP, ,/,, I/PRP, use/VBP, to/TO, go/VB, up/RP, the/DT, ./.]","(ROOT (S (NP (PRP I)) (, ,) (NP (PRP I)) (VP (VBP use) (S (VP (TO to) (VP (VB go) (PRT (RP up)) (NP (DT the)))))) (. .)))"
K/KD/KDA.xml,KDARE00E,11606,15,,A,9,1,But norm- nine times out of ten you went the inside of it.,"[But/CC, norm-/JJ, nine/CD, times/NNS, out/IN, of/IN, ten/CD, you/PRP, went/VBD, the/DT, inside/NN, of/IN, it/PRP, ./.]",(ROOT (S (CC But) (NP (NP (JJ norm-)) (PP (ADVP (NP (CD nine) (NNS times)) (IN out)) (IN of) (NP (CD ten)))) (NP (PRP you)) (VP (VBD went) (NP (NP (DT the) (NN inside)) (PP (IN of) (NP (PRP it))))) (. .)))
K/KD/KDA.xml,KDARE00E,11606,16,,B,10,1,"Oh yeah, just sat there in the outside, down a (()) .","[Oh/UH, yeah/UH, ,/,, just/RB, sat/VBD, there/EX, in/IN, the/DT, outside/JJ, ,/,, down/IN, a/DT, ./.]","(ROOT (S (INTJ (UH Oh) (UH yeah)) (, ,) (ADVP (RB just)) (VP (VBD sat) (NP (EX there)) (PP (IN in) (NP (DT the) (JJ outside))) (, ,) (ADVP (IN down) (DT a))) (. .)))"
K/KD/KDA.xml,KDARE00E,11606,17,,A,11,1,"Well I, see, if, my memory","[Well/RB, I/PRP, ,/,, see/VB, ,/,, if/IN, ,/,, my/PRP$, memory/NN]","(ROOT (FRAG (ADVP (RB Well)) (NP (NP (PRP I)) (, ,) (NP (NP (NP (VB see)) (PRN (, ,) (PP (IN if)))) (, ,) (NP (PRP$ my) (NN memory))))))"
K/KD/KDA.xml,KDARE00E,11606,18,,B,12,1,"Fucking people use to come out and fucking say to me, fucking wanker up there, I wonder if he's gonna jump,(()) the old bill (()) .","[Fucking/JJ, people/NNS, use/VBP, to/TO, come/VB, out/RP, and/CC, fucking/VBG, say/VB, to/IN, me/PRP, ,/,, fucking/VBG, wanker/NN, up/IN, there/RB, ,/,, I/PRP, wonder/VBP, if/IN, he/PRP, 's/VBZ, gonna/NNP, jump/VB, ,/,, the/DT, old/JJ, bill/NN, ./.]","(ROOT (S (S (NP (JJ Fucking) (NNS people)) (VP (VBP use) (S (VP (TO to) (VP (VB come) (PRT (RP out))))))) (CC and) (S (S (VP (VP (VBG fucking) (S (VP (VB say) (PP (IN to) (NP (PRP me)))))) (, ,) (VP (VBG fucking) (NP (NN wanker)) (ADVP (IN up) (RB there))))) (, ,) (NP (PRP I)) (VP (VBP wonder) (SBAR (IN if) (S (NP (PRP he)) (VP (VBZ 's) (S (NP (NNP gonna)) (VP (VP (VB jump)) (, ,) (NP (DT the) (ADJP (JJ old)) (NN bill))))))))) (. .)))"
K/KD/KDA.xml,KDARE00E,11606,19,,A,13,1,"Well, my, my memory right, you go down into, into like a, the ground floor and the top of the, like the bottom of the next floor is about that sort of height, but there is a wall up there sort of thing, which erm, I, I must, which you could probably get on.","[Well/RB, ,/,, my/PRP$, ,/,, my/PRP$, memory/NN, right/NN, ,/,, you/PRP, go/VBP, down/RB, into/IN, ,/,, into/IN, like/IN, a/DT, ,/,, the/DT, ground/NN, floor/NN, and/CC, the/DT, top/NN, of/IN, the/DT, ,/,, like/IN, the/DT, bottom/NN, of/IN, the/DT, next/JJ, floor/NN, is/VBZ, about/IN, that/DT, sort/NN, of/IN, height/NN, ,/,, but/CC, there/EX, is/VBZ, a/DT, wall/NN, up/IN, there/EX, sort/NN, of/IN, thing/NN, ,/,, which/WDT, erm/NNP, ,/,, I/PRP, ,/,, I/PRP, must/MD, ,/,, which/WDT, you/PRP, could/MD, probably/RB, get/VB, on/IN, ./.]","(ROOT (S (S (INTJ (RB Well)) (, ,) (NP (PRP$ my)) (, ,) (PRN (S (NP (PRP$ my) (NN memory) (NN right)) (, ,) (NP (PRP you)) (VP (VBP go) (ADVP (RB down)) (PP (IN into) (PRN (, ,) (PP (IN into) (PP (IN like) (NP (NP (DT a)) (, ,) (NP (DT the) (NN ground) (NN floor)) (CC and) (NP (NP (DT the) (NN top)) (PP (IN of) (NP (DT the))))))) (, ,))) (PP (IN like) (NP (NP (DT the) (NN bottom)) (PP (IN of) (NP (DT the) (JJ next) (NN floor)))))))) (VP (VBZ is) (PP (IN about) (NP (NP (DT that) (NN sort)) (PP (IN of) (NP (NN height))))))) (, ,) (CC but) (S (NP (EX there)) (VP (VBZ is) (NP (NP (DT a) (NAC (NN wall) (PP (IN up) (NP (EX there)))) (NN sort)) (PP (IN of) (NP (NP (NN thing)) (, ,) (SBAR (WHNP (WDT which)) (S (NP (NNP erm)))))))) (PRN (, ,) (S (NP (PRP I)) (, ,) (NP (PRP I)) (VP (MD must))) (, ,)) (SBAR (WHNP (WDT which)) (S (NP (PRP you)) (VP (MD could) (ADVP (RB probably)) (VP (VB get) (PP (IN on))))))) (. .)))"
K/KD/KDA.xml,KDARE00E,11606,20,,A,13,2,"So what they says is that I, I got on at this wall, jumped across onto this other wall, shinned up the outside of this other wall, stood on top of this the first floor wall and jumped up and caught hold of the top of the second floor wall and he reckon in the la- about fucking twenty odd seconds, I was up and over and in, they, they, they  (()) fucking kill yourself, get down, I can't remember none of it.","[So/RB, what/WP, they/PRP, says/VBZ, is/VBZ, that/IN, I/PRP, ,/,, I/PRP, got/VBD, on/IN, at/IN, this/DT, wall/NN, ,/,, jumped/VBD, across/IN, onto/IN, this/DT, other/JJ, wall/NN, ,/,, shinned/VBD, up/RP, the/DT, outside/NN, of/IN, this/DT, other/JJ, wall/NN, ,/,, stood/VBD, on/IN, top/NN, of/IN, this/DT, the/DT, first/JJ, floor/NN, wall/NN, and/CC, jumped/VBD, up/RP, and/CC, caught/VBD, hold/NN, of/IN, the/DT, top/NN, of/IN, the/DT, second/JJ, floor/NN, wall/NN, and/CC, he/PRP, reckon/VB, in/IN, the/DT, la-/NN, about/IN, fucking/VBG, twenty/CD, odd/JJ, seconds/NNS, ,/,, I/PRP, was/VBD, up/RB, and/CC, over/RB, and/CC, in/IN, ,/,, they/PRP, ,/,, they/PRP, ,/,, they/PRP, fucking/VBG, kill/NN, yourself/PRP, ,/,, get/VB, down/RB, ,/,, I/PRP, can/MD, 't/PRP, remember/VB, none/NN, of/IN, it/PRP, ./.]","(ROOT (S (S (RB So) (SBAR (WHNP (WP what)) (S (NP (PRP they)) (VP (VBZ says) (SBAR (S (VP (VBZ is) (SBAR (IN that) (S (S (NP (PRP I)) (PRN (, ,) (S (NP (PRP I)) (VP (VBD got) (PP (IN on) (PP (IN at) (NP (DT this) (NN wall)))))) (, ,)) (VP (VP (VBD jumped) (ADVP (IN across)) (PP (IN onto) (NP (DT this) (JJ other) (NN wall)))) (, ,) (VP (VBD shinned) (PRT (RP up)) (NP (NP (DT the) (NN outside)) (PP (IN of) (NP (DT this) (JJ other) (NN wall))))) (, ,) (VP (VBD stood) (PP (IN on) (NP (NP (NN top)) (PP (IN of) (NP (DT this) (NP (DT the) (JJ first) (NN floor)) (NN wall)))))) (CC and) (VP (VP (VBD jumped) (PRT (RP up))) (CC and) (VP (VBD caught) (NP (NP (NN hold)) (PP (IN of) (NP (NP (DT the) (NN top)) (PP (IN of) (NP (DT the) (JJ second) (NN floor) (NN wall)))))))))) (CC and) (S (NP (PRP he)) (VP (VB reckon) (PP (IN in) (NP (DT the) (NN la-))) (PP (IN about) (S (VP (VBG fucking) (NP (CD twenty) (JJ odd) (NNS seconds))))))))))))))) (, ,) (NP (PRP I)) (VP (VBD was) (UCP (ADVP (RB up) (CC and) (RB over)) (CC and) (PP (IN in))))) (, ,) (S (NP (PRP they)) (, ,) (NP (PRP they))) (, ,) (S (NP (PRP they)) (VP (VBG fucking) (S (NP (NN kill)) (NP (PRP yourself))))) (, ,) (S (S (VP (VB get) (ADVP (RB down)))) (, ,) (NP (PRP I)) (VP (MD can) (NP (PRP 't)) (S (VP (VB remember) (NP (NP (NN none)) (PP (IN of) (NP (PRP it)))))))) (. .)))"
K/KD/KDA.xml,KDARE00E,11606,21,,A,13,3,The on- the only thing I can remember is running after the car.,"[The/DT, on-/JJ, the/DT, only/JJ, thing/NN, I/PRP, can/MD, remember/VB, is/VBZ, running/VBG, after/IN, the/DT, car/NN, ./.]",(ROOT (S (NP (NP (DT The) (JJ on-) (DT the) (JJ only) (NN thing)) (SBAR (S (NP (PRP I)) (VP (MD can) (VP (VB remember)))))) (VP (VBZ is) (VP (VBG running) (PP (IN after) (NP (DT the) (NN car))))) (. .)))
K/KD/KDA.xml,KDARE00E,11606,22,,B,14,1,Why they all just piled in did they?,"[Why/WRB, they/PRP, all/DT, just/RB, piled/VBN, in/IN, did/VBD, they/PRP, ?/.]",(ROOT (SBARQ (WHADVP (WRB Why)) (S (NP (PRP they)) (VP (ADVP (DT all) (RB just)) (VBN piled) (SBAR (IN in) (SINV (VBD did) (NP (PRP they)))))) (. ?)))
K/KD/KDA.xml,KDARE00E,11606,23,,A,15,1,Well I don't know.,"[Well/RB, I/PRP, don/VBP, 't/PRP, know/VB, ./.]",(ROOT (S (ADVP (RB Well)) (NP (PRP I)) (VP (VBP don) (S (NP (PRP 't)) (VP (VB know)))) (. .)))
K/KD/KDA.xml,KDARE00E,11606,24,,B,16,1,(()) to fuck off?,"[to/TO, fuck/VB, off/RP, ?/.]",(ROOT (S (VP (TO to) (VP (VB fuck) (PRT (RP off)))) (. ?)))
K/KD/KDA.xml,KDARE00E,11606,25,,A,17,1,"Yeah, probably, me and this other mate he'd a, did a, I can, I can remember him saying something about I'll race yeah, it, like I remember just remember him, me and him run- running down ramps and stuff trying to get back down to the ground floor, so   --","[Yeah/UH, ,/,, probably/RB, ,/,, me/PRP, and/CC, this/DT, other/JJ, mate/NN, he/PRP, 'd/VBD, a/DT, ,/,, did/VBD, a/DT, ,/,, I/PRP, can/MD, ,/,, I/PRP, can/MD, remember/VB, him/PRP, saying/VBG, something/NN, about/IN, I/PRP, 'll/MD, race/NN, yeah/UH, ,/,, it/PRP, ,/,, like/IN, I/PRP, remember/VBP, just/RB, remember/VB, him/PRP, ,/,, me/PRP, and/CC, him/PRP, run-/NN, running/VBG, down/RP, ramps/NNS, and/CC, stuff/NN, trying/VBG, to/TO, get/VB, back/RB, down/RB, to/TO, the/DT, ground/NN, floor/NN, ,/,, so/RB, ./.]","(ROOT (S (INTJ (UH Yeah)) (, ,) (ADVP (RB probably)) (, ,) (NP (NP (PRP me)) (CC and) (NP (DT this) (JJ other) (NN mate))) (PRN (S (NP (PRP he)) (VP (VBD 'd) (NP (DT a)))) (, ,)) (VP (VBD did) (SBAR (S (NP (DT a)) (PRN (, ,) (S (NP (PRP I)) (VP (MD can))) (, ,)) (NP (PRP I)) (VP (MD can) (VP (VB remember) (S (NP (PRP him)) (VP (VBG saying) (NP (NN something)) (SBAR (IN about) (S (NP (PRP I)) (VP (MD 'll) (S (NP (NP (NN race)) (SBAR (S (FRAG (INTJ (UH yeah)) (, ,) (NP (PRP it))) (, ,) (PP (IN like) (NP (PRP I))) (VP (VBP remember) (ADVP (RB just)) (VP (VB remember) (S (S (NP (PRP him)) (, ,) (NP (PRP me))) (CC and) (S (NP (PRP him)) (NP (NN run-)))))))) (VP (VBG running) (PRT (RP down)) (NP (NP (NNS ramps) (CC and) (NN stuff)) (VP (VBG trying) (S (VP (TO to) (VP (VB get) (ADVP (RB back) (RB down)) (PP (TO to) (NP (DT the) (NN ground) (NN floor))) (, ,) (ADVP (RB so)))))))))))))))))))) (. .)))"
K/KD/KDA.xml,KDARE00E,11606,26,,A,17,2,--(()) <sawing> .,"[Yeah/UH, ,/,, probably/RB, ,/,, me/PRP, and/CC, this/DT, other/JJ, mate/NN, he/PRP, 'd/VBD, a/DT, ,/,, did/VBD, a/DT, ,/,, I/PRP, can/MD, ,/,, I/PRP, can/MD, remember/VB, him/PRP, saying/VBG, something/NN, about/IN, I/PRP, 'll/MD, race/NN, yeah/UH, ,/,, it/PRP, ,/,, like/IN, I/PRP, remember/VBP, just/RB, remember/VB, him/PRP, ,/,, me/PRP, and/CC, him/PRP, run-/NN, running/VBG, down/RP, ramps/NNS, and/CC, stuff/NN, trying/VBG, to/TO, get/VB, back/RB, down/RB, to/TO, the/DT, ground/NN, floor/NN, ,/,, so/RB, ./.]","(ROOT (S (INTJ (UH Yeah)) (, ,) (ADVP (RB probably)) (, ,) (NP (NP (PRP me)) (CC and) (NP (DT this) (JJ other) (NN mate))) (PRN (S (NP (PRP he)) (VP (VBD 'd) (NP (DT a)))) (, ,)) (VP (VBD did) (SBAR (S (NP (DT a)) (PRN (, ,) (S (NP (PRP I)) (VP (MD can))) (, ,)) (NP (PRP I)) (VP (MD can) (VP (VB remember) (S (NP (PRP him)) (VP (VBG saying) (NP (NN something)) (SBAR (IN about) (S (NP (PRP I)) (VP (MD 'll) (S (NP (NP (NN race)) (SBAR (S (FRAG (INTJ (UH yeah)) (, ,) (NP (PRP it))) (, ,) (PP (IN like) (NP (PRP I))) (VP (VBP remember) (ADVP (RB just)) (VP (VB remember) (S (S (NP (PRP him)) (, ,) (NP (PRP me))) (CC and) (S (NP (PRP him)) (NP (NN run-)))))))) (VP (VBG running) (PRT (RP down)) (NP (NP (NNS ramps) (CC and) (NN stuff)) (VP (VBG trying) (S (VP (TO to) (VP (VB get) (ADVP (RB back) (RB down)) (PP (TO to) (NP (DT the) (NN ground) (NN floor))) (, ,) (ADVP (RB so)))))))))))))))))))) (. .)))"
K/KD/KDA.xml,KDARE00E,11606,27,,A,17,3,Actually sometimes I'm pretty glad I don't remember things like that.,"[Actually/RB, sometimes/RB, I/PRP, 'm/VBP, pretty/RB, glad/JJ, I/PRP, don/VBP, 't/PRP, remember/VB, things/NNS, like/IN, that/DT, ./.]",(ROOT (S (S (ADVP (RB Actually)) (ADVP (RB sometimes)) (NP (PRP I)) (VP (VBP 'm) (ADJP (RB pretty) (JJ glad)))) (NP (PRP I)) (VP (VBP don) (S (NP (PRP 't)) (VP (VB remember) (NP (NNS things)) (PP (IN like) (NP (DT that)))))) (. .)))
