swda_filename,ptb_basename,conversation_no,transcript_index,act_tag,caller,turn_index,subutterance_index,text,pos,trees
K/KD/KD0.xml,KD0RE025,17903,0,,A,1,1,Got the  (()) car things going through.,"[Got/VBD, the/DT, car/NN, things/NNS, going/VBG, through/IN, ./.]",(ROOT (S (VP (VBD Got) (NP (NP (DT the) (NN car) (NNS things)) (VP (VBG going) (PP (IN through))))) (. .)))
K/KD/KD0.xml,KD0RE025,17903,1,,B,2,1,(()) ,[],
K/KD/KD0.xml,KD0RE025,17903,2,,A,3,1,"Mm,(()) got them, on Monks Lane the (()) ","[Mm/NN, ,/,, got/VBD, them/PRP, ,/,, on/IN, Monks/NNP, Lane/NNP, the/DT]","(ROOT (NP (NP (NP (NN Mm)) (PRN (, ,) (SINV (VP (VBD got)) (NP (PRP them))) (, ,))) (PP (IN on) (NP (NNP Monks) (NNP Lane)) (X (DT the)))))"
K/KD/KD0.xml,KD0RE025,17903,3,,B,4,1,But he's injured.,"[But/CC, he/PRP, 's/VBZ, injured/VBN, ./.]",(ROOT (S (CC But) (NP (PRP he)) (VP (VBZ 's) (VP (VBN injured))) (. .)))
K/KD/KD0.xml,KD0RE025,17903,4,,A,5,1,"Yes, and its not through yet, presumably they'll have another look at it at the end of the month.","[Yes/UH, ,/,, and/CC, its/PRP$, not/RB, through/IN, yet/RB, ,/,, presumably/RB, they/PRP, 'll/MD, have/VB, another/DT, look/NN, at/IN, it/PRP, at/IN, the/DT, end/NN, of/IN, the/DT, month/NN, ./.]","(ROOT (S (INTJ (UH Yes)) (, ,) (NP (CC and) (NP (NP (PRP$ its)) (ADVP (RB not) (PP (IN through) (ADVP (RB yet)))))) (, ,) (ADVP (RB presumably)) (NP (PRP they)) (VP (MD 'll) (VP (VB have) (NP (NP (DT another) (NN look)) (PP (IN at) (NP (PRP it)))) (PP (IN at) (NP (NP (DT the) (NN end)) (PP (IN of) (NP (DT the) (NN month))))))) (. .)))"
