swda_filename,ptb_basename,conversation_no,transcript_index,act_tag,caller,turn_index,subutterance_index,text,pos,trees
K/KB/KB7.xml,KB7RE01H,19202,65,,B,52,3,--we will survive.,"[Go/VB, in/IN, the/DT, microwave/NN, that/WDT, 's/VBZ, all/DT, ,/,, I/PRP, ain/VBP, 't/PRP, got/VBD, much/JJ, money/NN, at/IN, all/DT, ,/,, I/PRP, didn/VBP, 't/PRP, have/VB, that/DT, much/JJ, left/NN, ,/,, I/PRP, bought/VBD, mum/NN, 's/POS, cigs/NNS, and/CC, that/IN, bit/NN, of/IN, shopping/VBG, the/DT, other/JJ, day/NN, and/CC, that/DT, was/VBD, the/DT, end/NN, of/IN, that/IN, we/PRP, will/MD, survive/VB, ./.]","(ROOT (S (S (S (VP (VB Go) (PP (IN in) (NP (NP (DT the) (NN microwave)) (SBAR (WHNP (WDT that)) (S (VP (VBZ 's) (NP (DT all))))))))) (, ,) (NP (PRP I)) (VP (VBP ain) (SBAR (S (NP (PRP 't)) (VP (VBD got) (NP (JJ much) (NN money)) (ADVP (IN at) (DT all))))))) (, ,) (NP (PRP I)) (VP (VBP didn) (S (NP (PRP 't)) (VP (VB have) (NP (DT that) (JJ much) (NN left)))) (, ,) (SBAR (SBAR (S (NP (PRP I)) (VP (VBD bought) (NP (NP (NN mum) (POS 's)) (NNS cigs))))) (CC and) (SBAR (IN that) (S (NP (NP (NN bit)) (PP (IN of) (S (VP (VBG shopping) (NP (NP (DT the) (JJ other) (NN day)) (CC and) (NP (DT that))))))) (VP (VBD was) (NP (NP (DT the) (NN end)) (PP (IN of) (SBAR (IN that) (S (NP (PRP we)) (VP (MD will) (VP (VB survive)))))))))))) (. .)))"
K/KB/KB7.xml,KB7RE01H,19202,66,,A,53,1,Pay day late again?,"[Pay/VB, day/NN, late/RB, again/RB, ?/.]",(ROOT (SQ (VP (VB Pay) (NP (NN day)) (ADVP (RB late) (RB again))) (. ?)))
K/KB/KB7.xml,KB7RE01H,19202,67,,B,54,1,"Even if we only have a tin of soup, that will do me.","[Even/RB, if/IN, we/PRP, only/RB, have/VBP, a/DT, tin/NN, of/IN, soup/NN, ,/,, that/WDT, will/MD, do/VB, me/PRP, ./.]","(ROOT (S (SBAR (RB Even) (IN if) (S (NP (PRP we)) (ADVP (RB only)) (VP (VBP have) (NP (NP (DT a) (NN tin)) (PP (IN of) (NP (NN soup))))))) (, ,) (NP (WDT that)) (VP (MD will) (VP (VB do) (NP (PRP me)))) (. .)))"
K/KB/KB7.xml,KB7RE01H,19202,68,,A,55,1,"Yeah, I don't mind   (()) --","[Yeah/UH, ,/,, I/PRP, don/VBP, 't/PRP, mind/VB, so/IN, it/PRP, 's/VBZ, pay/NN, day/NN, today/NN]","(ROOT (S (INTJ (UH Yeah)) (, ,) (NP (PRP I)) (VP (VBP don) (S (NP (PRP 't)) (VP (VB mind) (SBAR (IN so) (S (NP (PRP it)) (VP (VBZ 's) (NP (NN pay) (NN day)))))))) (NN today)))"
K/KB/KB7.xml,KB7RE01H,19202,69,,A,55,2,--so it's pay day today,"[Yeah/UH, ,/,, I/PRP, don/VBP, 't/PRP, mind/VB, so/IN, it/PRP, 's/VBZ, pay/NN, day/NN, today/NN]","(ROOT (S (INTJ (UH Yeah)) (, ,) (NP (PRP I)) (VP (VBP don) (S (NP (PRP 't)) (VP (VB mind) (SBAR (IN so) (S (NP (PRP it)) (VP (VBZ 's) (NP (NN pay) (NN day)))))))) (NN today)))"
K/KB/KB7.xml,KB7RE01H,19202,70,,B,56,1,Yeah  --,"[Yeah/UH, but/CC, you/PRP, can/MD, 't/PRP, get/VB, it/PRP, till/IN, tomorrow/NN, there/EX, is/VBZ, a/DT, little/JJ, bit/NN, in/IN, the/DT, bank/NN, ,/,, but/CC, not/RB, a/DT, lot/NN, ,/,, go/VB, wait/VB, till/IN, tomorrow/NN, and/CC, we/PRP, must/MD, get/VB, to/TO, Chester/NNP, Hill/NNP, today/NN, ./.]","(ROOT (S (INTJ (UH Yeah)) (VP (VP (SBAR (CC but) (S (NP (PRP you)) (VP (MD can) (NP (PRP 't)) (S (VP (VB get) (NP (PRP it)) (SBAR (IN till) (S (NP (NN tomorrow)) (NP (EX there)) (VP (VBZ is) (NP (NP (DT a) (JJ little) (NN bit)) (PP (IN in) (NP (NP (DT the) (NN bank)) (, ,) (CONJP (CC but) (RB not)) (NP (DT a) (NN lot))))))))))))) (, ,) (VP (VB go) (VP (VB wait) (PP (IN till) (NP (NN tomorrow)))))) (CC and) (VP (ADVP (PRP we)) (MD must) (VP (VB get) (PP (TO to) (NP (NNP Chester) (NNP Hill))) (NP (NN today))))) (. .)))"
K/KB/KB7.xml,KB7RE01H,19202,71,,B,56,2,--but you can't get it till tomorrow  --,"[Yeah/UH, but/CC, you/PRP, can/MD, 't/PRP, get/VB, it/PRP, till/IN, tomorrow/NN, there/EX, is/VBZ, a/DT, little/JJ, bit/NN, in/IN, the/DT, bank/NN, ,/,, but/CC, not/RB, a/DT, lot/NN, ,/,, go/VB, wait/VB, till/IN, tomorrow/NN, and/CC, we/PRP, must/MD, get/VB, to/TO, Chester/NNP, Hill/NNP, today/NN, ./.]","(ROOT (S (INTJ (UH Yeah)) (VP (VP (SBAR (CC but) (S (NP (PRP you)) (VP (MD can) (NP (PRP 't)) (S (VP (VB get) (NP (PRP it)) (SBAR (IN till) (S (NP (NN tomorrow)) (NP (EX there)) (VP (VBZ is) (NP (NP (DT a) (JJ little) (NN bit)) (PP (IN in) (NP (NP (DT the) (NN bank)) (, ,) (CONJP (CC but) (RB not)) (NP (DT a) (NN lot))))))))))))) (, ,) (VP (VB go) (VP (VB wait) (PP (IN till) (NP (NN tomorrow)))))) (CC and) (VP (ADVP (PRP we)) (MD must) (VP (VB get) (PP (TO to) (NP (NNP Chester) (NNP Hill))) (NP (NN today))))) (. .)))"
K/KB/KB7.xml,KB7RE01H,19202,72,,B,56,3,"--there is a little bit in the bank, but not a lot, go  (()) wait till tomorrow  --","[Yeah/UH, but/CC, you/PRP, can/MD, 't/PRP, get/VB, it/PRP, till/IN, tomorrow/NN, there/EX, is/VBZ, a/DT, little/JJ, bit/NN, in/IN, the/DT, bank/NN, ,/,, but/CC, not/RB, a/DT, lot/NN, ,/,, go/VB, wait/VB, till/IN, tomorrow/NN, and/CC, we/PRP, must/MD, get/VB, to/TO, Chester/NNP, Hill/NNP, today/NN, ./.]","(ROOT (S (INTJ (UH Yeah)) (VP (VP (SBAR (CC but) (S (NP (PRP you)) (VP (MD can) (NP (PRP 't)) (S (VP (VB get) (NP (PRP it)) (SBAR (IN till) (S (NP (NN tomorrow)) (NP (EX there)) (VP (VBZ is) (NP (NP (DT a) (JJ little) (NN bit)) (PP (IN in) (NP (NP (DT the) (NN bank)) (, ,) (CONJP (CC but) (RB not)) (NP (DT a) (NN lot))))))))))))) (, ,) (VP (VB go) (VP (VB wait) (PP (IN till) (NP (NN tomorrow)))))) (CC and) (VP (ADVP (PRP we)) (MD must) (VP (VB get) (PP (TO to) (NP (NNP Chester) (NNP Hill))) (NP (NN today))))) (. .)))"
K/KB/KB7.xml,KB7RE01H,19202,73,,B,56,4,--and we must get to Chester Hill today --,"[Yeah/UH, but/CC, you/PRP, can/MD, 't/PRP, get/VB, it/PRP, till/IN, tomorrow/NN, there/EX, is/VBZ, a/DT, little/JJ, bit/NN, in/IN, the/DT, bank/NN, ,/,, but/CC, not/RB, a/DT, lot/NN, ,/,, go/VB, wait/VB, till/IN, tomorrow/NN, and/CC, we/PRP, must/MD, get/VB, to/TO, Chester/NNP, Hill/NNP, today/NN, ./.]","(ROOT (S (INTJ (UH Yeah)) (VP (VP (SBAR (CC but) (S (NP (PRP you)) (VP (MD can) (NP (PRP 't)) (S (VP (VB get) (NP (PRP it)) (SBAR (IN till) (S (NP (NN tomorrow)) (NP (EX there)) (VP (VBZ is) (NP (NP (DT a) (JJ little) (NN bit)) (PP (IN in) (NP (NP (DT the) (NN bank)) (, ,) (CONJP (CC but) (RB not)) (NP (DT a) (NN lot))))))))))))) (, ,) (VP (VB go) (VP (VB wait) (PP (IN till) (NP (NN tomorrow)))))) (CC and) (VP (ADVP (PRP we)) (MD must) (VP (VB get) (PP (TO to) (NP (NNP Chester) (NNP Hill))) (NP (NN today))))) (. .)))"
K/KB/KB7.xml,KB7RE01H,19202,74,,B,56,5,--.,"[Yeah/UH, but/CC, you/PRP, can/MD, 't/PRP, get/VB, it/PRP, till/IN, tomorrow/NN, there/EX, is/VBZ, a/DT, little/JJ, bit/NN, in/IN, the/DT, bank/NN, ,/,, but/CC, not/RB, a/DT, lot/NN, ,/,, go/VB, wait/VB, till/IN, tomorrow/NN, and/CC, we/PRP, must/MD, get/VB, to/TO, Chester/NNP, Hill/NNP, today/NN, ./.]","(ROOT (S (INTJ (UH Yeah)) (VP (VP (SBAR (CC but) (S (NP (PRP you)) (VP (MD can) (NP (PRP 't)) (S (VP (VB get) (NP (PRP it)) (SBAR (IN till) (S (NP (NN tomorrow)) (NP (EX there)) (VP (VBZ is) (NP (NP (DT a) (JJ little) (NN bit)) (PP (IN in) (NP (NP (DT the) (NN bank)) (, ,) (CONJP (CC but) (RB not)) (NP (DT a) (NN lot))))))))))))) (, ,) (VP (VB go) (VP (VB wait) (PP (IN till) (NP (NN tomorrow)))))) (CC and) (VP (ADVP (PRP we)) (MD must) (VP (VB get) (PP (TO to) (NP (NNP Chester) (NNP Hill))) (NP (NN today))))) (. .)))"
K/KB/KB7.xml,KB7RE01H,19202,75,,B,56,6,"I like that, I don't like Jason Donovan but I quite like that, do you?","[I/PRP, like/VBP, that/IN, ,/,, I/PRP, don/VBP, 't/PRP, like/IN, Jason/NNP, Donovan/NNP, but/CC, I/PRP, quite/RB, like/IN, that/DT, ,/,, do/VBP, you/PRP, ?/.]","(ROOT (S (NP (PRP I)) (VP (VBP like) (SBAR (IN that) (, ,) (S (NP (PRP I)) (VP (VBP don) (NP (PRP 't)) (PP (IN like) (NP (NP (NNP Jason) (NNP Donovan)) (PP (CC but) (NP (PRP I))))) (ADVP (RB quite) (PP (IN like) (NP (NP (DT that)) (, ,) (VP (VBP do) (NP (PRP you)))))))))) (. ?)))"
K/KB/KB7.xml,KB7RE01H,19202,76,,A,57,1,Not bad ,"[Not/RB, bad/JJ]",(ROOT (FRAG (RB Not) (ADJP (JJ bad))))
K/KB/KB7.xml,KB7RE01H,19202,77,,B,58,1,"I don't like him, I never have but I, try not,(()) quite pleasant isn't it?","[I/PRP, don/VBP, 't/PRP, like/IN, him/PRP, ,/,, I/PRP, never/RB, have/VBP, but/CC, I/PRP, ,/,, try/VB, not/RB, ,/,, quite/RB, pleasant/JJ, isn/NN, 't/PRP, it/PRP, ?/.]","(ROOT (S (S (NP (PRP I)) (VP (VBP don) (NP (PRP 't)) (PP (IN like) (NP (PRP him))))) (, ,) (S (NP (PRP I)) (ADVP (RB never)) (VP (VBP have) (NP (CC but) (NP (PRP I)) (, ,) (SBAR (S (VP (VB try) (RB not))))))) (, ,) (S (NP (NP (RB quite) (JJ pleasant) (NN isn)) (NP (PRP 't))) (NP (PRP it))) (. ?)))"
K/KB/KB7.xml,KB7RE01H,19202,78,,A,59,1,"Oh yes pleasant, oh yes pleasant.","[Oh/UH, yes/UH, pleasant/JJ, ,/,, oh/UH, yes/UH, pleasant/JJ, ./.]","(ROOT (S (INTJ (UH Oh)) (VP (UH yes) (NP (JJ pleasant)) (, ,) (NP (INTJ (UH oh) (UH yes)) (NP (JJ pleasant)))) (. .)))"
K/KB/KB7.xml,KB7RE01H,19202,79,,B,60,1,"I've never liked anything else he's had,(()) particularly have you?","[I/PRP, 've/VBP, never/RB, liked/VBN, anything/NN, else/RB, he/PRP, 's/VBZ, had/VBN, ,/,, particularly/RB, have/VBP, you/PRP, ?/.]","(ROOT (S (NP (PRP I)) (VP (VBP 've) (ADVP (RB never)) (VP (VBN liked) (NP (NN anything)) (S (ADJP (RB else)) (SBAR (S (NP (PRP he)) (VP (VP (VBZ 's) (VP (VBN had))) (, ,) (ADVP (RB particularly)) (VP (VBP have) (NP (PRP you))))))))) (. ?)))"
K/KB/KB7.xml,KB7RE01H,19202,80,,B,60,2,But I just find that  --,"[But/CC, I/PRP, just/RB, find/VBP, that/IN, pleasant/JJ, listening/NN, ./.]",(ROOT (S (CC But) (NP (PRP I)) (ADVP (RB just)) (VP (VBP find) (PP (IN that) (NP (JJ pleasant) (NN listening)))) (. .)))
K/KB/KB7.xml,KB7RE01H,19202,81,,B,60,3,--pleasant listening.,"[But/CC, I/PRP, just/RB, find/VBP, that/IN, pleasant/JJ, listening/NN, ./.]",(ROOT (S (CC But) (NP (PRP I)) (ADVP (RB just)) (VP (VBP find) (PP (IN that) (NP (JJ pleasant) (NN listening)))) (. .)))
K/KB/KB7.xml,KB7RE01H,19202,82,,A,61,1,Oh it's a pleasant sound.,"[Oh/UH, it/PRP, 's/VBZ, a/DT, pleasant/JJ, sound/NN, ./.]",(ROOT (S (S (INTJ (UH Oh)) (NP (PRP it)) (VP (VBZ 's) (NP (DT a) (JJ pleasant) (NN sound)))) (. .)))
K/KB/KB7.xml,KB7RE01H,19202,83,,B,62,1,"Pleasant and nice songs I suppose I don't know it's just, quite like it, it's now big, it's about the most thing he's ever recorded that I have liked,","[Pleasant/JJ, and/CC, nice/JJ, songs/NNS, I/PRP, suppose/VBP, I/PRP, don/VB, 't/PRP, know/VB, it/PRP, 's/VBZ, just/RB, ,/,, quite/RB, like/IN, it/PRP, ,/,, it/PRP, 's/VBZ, now/RB, big/JJ, ,/,, it/PRP, 's/VBZ, about/IN, the/DT, most/RBS, thing/NN, he/PRP, 's/VBZ, ever/RB, recorded/VBN, that/IN, I/PRP, have/VBP, liked/VBN, ,/,]","(ROOT (S (NP (NP (ADJP (JJ Pleasant) (CC and) (JJ nice)) (NNS songs)) (SBAR (S (NP (PRP I)) (VP (VBP suppose) (S (NP (PRP I)) (VP (VB don) (S (NP (PRP 't)) (VP (VB know) (SBAR (S (NP (PRP it)) (VP (VBZ 's) (ADVP (RB just))))))))))))) (, ,) (ADVP (RB quite) (PP (IN like) (NP (PRP it)))) (, ,) (NP (PRP it)) (VP (VBZ 's) (ADVP (ADVP (RB now) (JJ big)) (PRN (, ,) (S (NP (PRP it)) (VP (VBZ 's) (PP (IN about) (NP (NP (DT the) (NP (RBS most)) (NN thing)) (SBAR (S (NP (PRP he)) (VP (VBZ 's) (ADVP (RB ever)) (VP (VBN recorded) (SBAR (IN that) (S (NP (PRP I)) (VP (VBP have) (VP (VBN liked))))))))))))) (, ,))))))"
K/KB/KB7.xml,KB7RE01H,19202,84,,A,63,1,Mm.,"[Mm/NN, ./.]",(ROOT (NP (NN Mm) (. .)))
K/KB/KB7.xml,KB7RE01H,19202,85,,B,64,1,I've absolutely never been a Jason Donovan fan before  --,"[I/PRP, 've/VBP, absolutely/RB, never/RB, been/VBN, a/DT, Jason/NNP, Donovan/NNP, fan/NN, before/IN, Christmas/NNP, number/NN, one/CD, 's/POS, going/VBG, to/TO, be/VB, Bohemian/JJ, Rhapsody/NN, which/WDT, I/PRP, do/VBP, like/IN, you/PRP, know/VBP]",(ROOT (S (NP (PRP I)) (VP (VBP 've) (ADVP (RB absolutely)) (ADVP (RB never)) (VP (VBN been) (NP (NP (DT a) (NNP Jason) (NNP Donovan) (NN fan)) (PP (IN before) (NP (NP (NNP Christmas) (NN number)) (NP (CD one) (POS 's)))) (VP (VBG going) (S (VP (TO to) (VP (VB be) (NP (NP (JJ Bohemian) (NN Rhapsody)) (SBAR (WHNP (WDT which)) (S (NP (PRP I)) (VP (VBP do) (SBAR (IN like) (S (NP (PRP you)) (VP (VBP know)))))))))))))))))
K/KB/KB7.xml,KB7RE01H,19202,86,,B,64,2,--Christmas number one's going to be Bohemian Rhapsody which I do like you know (()) ,"[I/PRP, 've/VBP, absolutely/RB, never/RB, been/VBN, a/DT, Jason/NNP, Donovan/NNP, fan/NN, before/IN, Christmas/NNP, number/NN, one/CD, 's/POS, going/VBG, to/TO, be/VB, Bohemian/JJ, Rhapsody/NN, which/WDT, I/PRP, do/VBP, like/IN, you/PRP, know/VBP]",(ROOT (S (NP (PRP I)) (VP (VBP 've) (ADVP (RB absolutely)) (ADVP (RB never)) (VP (VBN been) (NP (NP (DT a) (NNP Jason) (NNP Donovan) (NN fan)) (PP (IN before) (NP (NP (NNP Christmas) (NN number)) (NP (CD one) (POS 's)))) (VP (VBG going) (S (VP (TO to) (VP (VB be) (NP (NP (JJ Bohemian) (NN Rhapsody)) (SBAR (WHNP (WDT which)) (S (NP (PRP I)) (VP (VBP do) (SBAR (IN like) (S (NP (PRP you)) (VP (VBP know)))))))))))))))))
K/KB/KB7.xml,KB7RE01H,19202,87,,A,65,1,"I know, will do.","[I/PRP, know/VBP, ,/,, will/MD, do/VB, ./.]","(ROOT (S (NP (PRP I)) (VP (VP (VBP know)) (, ,) (VP (MD will) (VP (VB do)))) (. .)))"
K/KB/KB7.xml,KB7RE01H,19202,88,,B,66,1,"yes, it's already going to the top of the charts  --","[yes/UH, ,/,, it/PRP, 's/VBZ, already/RB, going/VBG, to/TO, the/DT, top/NN, of/IN, the/DT, charts/NNS, to/TO, be/VB, number/NN, one/CD, for/IN, Christmas/NNP, all/PDT, the/DT, other/JJ, Christmas/NNP, songs/NNS, are/VBP]","(ROOT (S (ADVP (UH yes)) (, ,) (NP (PRP it)) (VP (VBZ 's) (ADVP (RB already)) (VP (VBG going) (PP (TO to) (NP (NP (DT the) (NN top)) (PP (IN of) (NP (DT the) (NNS charts))))) (S (VP (TO to) (VP (VB be) (NP (NP (NN number) (CD one)) (PP (IN for) (NP (NNP Christmas))) (SBAR (S (NP (PDT all) (DT the) (JJ other) (NNP Christmas) (NNS songs)) (VP (VBP are))))))))))))"
K/KB/KB7.xml,KB7RE01H,19202,89,,B,66,2,--to be number one for Christmas  --,"[yes/UH, ,/,, it/PRP, 's/VBZ, already/RB, going/VBG, to/TO, the/DT, top/NN, of/IN, the/DT, charts/NNS, to/TO, be/VB, number/NN, one/CD, for/IN, Christmas/NNP, all/PDT, the/DT, other/JJ, Christmas/NNP, songs/NNS, are/VBP]","(ROOT (S (ADVP (UH yes)) (, ,) (NP (PRP it)) (VP (VBZ 's) (ADVP (RB already)) (VP (VBG going) (PP (TO to) (NP (NP (DT the) (NN top)) (PP (IN of) (NP (DT the) (NNS charts))))) (S (VP (TO to) (VP (VB be) (NP (NP (NN number) (CD one)) (PP (IN for) (NP (NNP Christmas))) (SBAR (S (NP (PDT all) (DT the) (JJ other) (NNP Christmas) (NNS songs)) (VP (VBP are))))))))))))"
K/KB/KB7.xml,KB7RE01H,19202,90,,B,66,3,--all the other Christmas songs are ,"[yes/UH, ,/,, it/PRP, 's/VBZ, already/RB, going/VBG, to/TO, the/DT, top/NN, of/IN, the/DT, charts/NNS, to/TO, be/VB, number/NN, one/CD, for/IN, Christmas/NNP, all/PDT, the/DT, other/JJ, Christmas/NNP, songs/NNS, are/VBP]","(ROOT (S (ADVP (UH yes)) (, ,) (NP (PRP it)) (VP (VBZ 's) (ADVP (RB already)) (VP (VBG going) (PP (TO to) (NP (NP (DT the) (NN top)) (PP (IN of) (NP (DT the) (NNS charts))))) (S (VP (TO to) (VP (VB be) (NP (NP (NN number) (CD one)) (PP (IN for) (NP (NNP Christmas))) (SBAR (S (NP (PDT all) (DT the) (JJ other) (NNP Christmas) (NNS songs)) (VP (VBP are))))))))))))"
K/KB/KB7.xml,KB7RE01H,19202,91,,A,67,1,They're all coming down and that one's er,"[They/PRP, 're/VBP, all/DT, coming/VBG, down/RB, and/CC, that/DT, one/NN, 's/POS, er/NN]",(ROOT (S (NP (PRP They)) (VP (VBP 're) (NP (NP (NP (DT all)) (VP (VBG coming) (ADVP (RB down)))) (CC and) (NP (NP (DT that) (NN one) (POS 's)) (NN er))))))
K/KB/KB7.xml,KB7RE01H,19202,92,,B,68,1,yep,[yep/NN],(ROOT (NP (NN yep)))
K/KB/KB7.xml,KB7RE01H,19202,93,,A,69,1,going up ,"[going/VBG, up/RP]",(ROOT (S (VP (VBG going) (PRT (RP up)))))
K/KB/KB7.xml,KB7RE01H,19202,94,,B,70,1,that will do.,"[that/DT, will/MD, do/VB, ./.]",(ROOT (S (NP (DT that)) (VP (MD will) (VP (VB do))) (. .)))
K/KB/KB7.xml,KB7RE01H,19202,95,,A,71,1,They always  (()) prices keep falling.,"[They/PRP, always/RB, prices/NNS, keep/VBP, falling/VBG, ./.]",(ROOT (S (NP (PRP They)) (VP (ADVP (RB always) (NP (NNS prices))) (VBP keep) (S (VP (VBG falling)))) (. .)))
K/KB/KB7.xml,KB7RE01H,19202,96,,B,72,1,(()) --,"[Well/RB, ,/,, I/PRP, understand/VBP, its/PRP$, reasoning/NN, ,/,, but/CC, ,/,, I/PRP, think/VBP, if/IN, you/PRP, 've/VBP, been/VBN, very/RB, hard/JJ, pushed/VBN, list/NN, ,/,, with/IN, this/DT, money/NN, ,/,, don/NNP, 't/PRP, you/PRP, ?/.]","(ROOT (S (INTJ (RB Well)) (, ,) (NP (PRP I)) (VP (VBP understand) (NP (NP (PRP$ its) (NN reasoning)) (, ,) (CC but) (PRN (, ,) (S (NP (PRP I)) (VP (VBP think) (SBAR (IN if) (S (NP (PRP you)) (VP (VBP 've) (VP (VBN been) (VP (ADVP (RB very) (JJ hard)) (VBN pushed) (NP (NN list))))))))) (, ,)) (PP (IN with) (NP (DT this) (NN money)))) (, ,) (S (VP (NNP don) (S (NP (PRP 't)) (NP (PRP you)))))) (. ?)))"
K/KB/KB7.xml,KB7RE01H,19202,97,,B,72,2,"--Well, I understand its  --","[Well/RB, ,/,, I/PRP, understand/VBP, its/PRP$, reasoning/NN, ,/,, but/CC, ,/,, I/PRP, think/VBP, if/IN, you/PRP, 've/VBP, been/VBN, very/RB, hard/JJ, pushed/VBN, list/NN, ,/,, with/IN, this/DT, money/NN, ,/,, don/NNP, 't/PRP, you/PRP, ?/.]","(ROOT (S (INTJ (RB Well)) (, ,) (NP (PRP I)) (VP (VBP understand) (NP (NP (PRP$ its) (NN reasoning)) (, ,) (CC but) (PRN (, ,) (S (NP (PRP I)) (VP (VBP think) (SBAR (IN if) (S (NP (PRP you)) (VP (VBP 've) (VP (VBN been) (VP (ADVP (RB very) (JJ hard)) (VBN pushed) (NP (NN list))))))))) (, ,)) (PP (IN with) (NP (DT this) (NN money)))) (, ,) (S (VP (NNP don) (S (NP (PRP 't)) (NP (PRP you)))))) (. ?)))"
K/KB/KB7.xml,KB7RE01H,19202,98,,B,72,3,"--reasoning (()) , but, I think if you've been very hard pushed  (()) list, with this money, don't you?","[Well/RB, ,/,, I/PRP, understand/VBP, its/PRP$, reasoning/NN, ,/,, but/CC, ,/,, I/PRP, think/VBP, if/IN, you/PRP, 've/VBP, been/VBN, very/RB, hard/JJ, pushed/VBN, list/NN, ,/,, with/IN, this/DT, money/NN, ,/,, don/NNP, 't/PRP, you/PRP, ?/.]","(ROOT (S (INTJ (RB Well)) (, ,) (NP (PRP I)) (VP (VBP understand) (NP (NP (PRP$ its) (NN reasoning)) (, ,) (CC but) (PRN (, ,) (S (NP (PRP I)) (VP (VBP think) (SBAR (IN if) (S (NP (PRP you)) (VP (VBP 've) (VP (VBN been) (VP (ADVP (RB very) (JJ hard)) (VBN pushed) (NP (NN list))))))))) (, ,)) (PP (IN with) (NP (DT this) (NN money)))) (, ,) (S (VP (NNP don) (S (NP (PRP 't)) (NP (PRP you)))))) (. ?)))"
K/KB/KB7.xml,KB7RE01H,19202,99,,A,73,1,"Mm, mm.","[Mm/NN, ,/,, mm/NN, ./.]","(ROOT (NP (NP (NN Mm)) (, ,) (NP (NN mm)) (. .)))"
K/KB/KB7.xml,KB7RE01H,19202,100,,B,74,1,Considering I'm not supposed to have that  --,"[Considering/VBG, I/PRP, 'm/VBP, not/RB, supposed/VBN, to/TO, have/VB, that/DT, cos/NN, I/PRP, had/VBD, it/PRP, when/WRB, Ann/NNP, and/CC, bought/VBD, it/PRP, not/RB, sure/RB, if/IN, it/PRP, 's/VBZ, now/RB, are/VBP, you/PRP, ?/.]",(ROOT (SINV (PP (VBG Considering) (NP (PRP I))) (VP (VBP 'm) (RB not) (VP (VBN supposed) (S (VP (TO to) (VP (VB have) (NP (NP (DT that) (NN cos)) (SBAR (S (NP (PRP I)) (VP (VBD had) (NP (PRP it))))))))))) (SBAR (WHADVP (WRB when)) (S (S (UCP (NP (NNP Ann)) (CC and) (S (VP (VBD bought) (NP (PRP it)) (ADVP (ADVP (RB not) (RB sure)) (SBAR (IN if) (S (NP (PRP it)) (VP (VBZ 's) (ADVP (RB now)))))))))) (VP (VBP are) (NP (PRP you))))) (. ?)))
K/KB/KB7.xml,KB7RE01H,19202,101,,B,74,2,--cos I had it when Ann and  (()) bought it  (()) not sure if it's now  --,"[Considering/VBG, I/PRP, 'm/VBP, not/RB, supposed/VBN, to/TO, have/VB, that/DT, cos/NN, I/PRP, had/VBD, it/PRP, when/WRB, Ann/NNP, and/CC, bought/VBD, it/PRP, not/RB, sure/RB, if/IN, it/PRP, 's/VBZ, now/RB, are/VBP, you/PRP, ?/.]",(ROOT (SINV (PP (VBG Considering) (NP (PRP I))) (VP (VBP 'm) (RB not) (VP (VBN supposed) (S (VP (TO to) (VP (VB have) (NP (NP (DT that) (NN cos)) (SBAR (S (NP (PRP I)) (VP (VBD had) (NP (PRP it))))))))))) (SBAR (WHADVP (WRB when)) (S (S (UCP (NP (NNP Ann)) (CC and) (S (VP (VBD bought) (NP (PRP it)) (ADVP (ADVP (RB not) (RB sure)) (SBAR (IN if) (S (NP (PRP it)) (VP (VBZ 's) (ADVP (RB now)))))))))) (VP (VBP are) (NP (PRP you))))) (. ?)))
K/KB/KB7.xml,KB7RE01H,19202,102,,B,74,3,--are you?,"[Considering/VBG, I/PRP, 'm/VBP, not/RB, supposed/VBN, to/TO, have/VB, that/DT, cos/NN, I/PRP, had/VBD, it/PRP, when/WRB, Ann/NNP, and/CC, bought/VBD, it/PRP, not/RB, sure/RB, if/IN, it/PRP, 's/VBZ, now/RB, are/VBP, you/PRP, ?/.]",(ROOT (SINV (PP (VBG Considering) (NP (PRP I))) (VP (VBP 'm) (RB not) (VP (VBN supposed) (S (VP (TO to) (VP (VB have) (NP (NP (DT that) (NN cos)) (SBAR (S (NP (PRP I)) (VP (VBD had) (NP (PRP it))))))))))) (SBAR (WHADVP (WRB when)) (S (S (UCP (NP (NNP Ann)) (CC and) (S (VP (VBD bought) (NP (PRP it)) (ADVP (ADVP (RB not) (RB sure)) (SBAR (IN if) (S (NP (PRP it)) (VP (VBZ 's) (ADVP (RB now)))))))))) (VP (VBP are) (NP (PRP you))))) (. ?)))
K/KB/KB7.xml,KB7RE01H,19202,103,,A,75,1,"Not really, was, though I thought we were offering a reasonable price taking everything into consideration","[Not/RB, really/RB, ,/,, was/VBD, ,/,, though/IN, I/PRP, thought/VBD, we/PRP, were/VBD, offering/VBG, a/DT, reasonable/JJ, price/NN, taking/VBG, everything/NN, into/IN, consideration/NN]","(ROOT (SINV (RB Not) (ADVP (RB really)) (, ,) (VP (VBD was) (VP (, ,) (SBAR (IN though) (S (NP (PRP I)) (VP (VBD thought) (SBAR (S (NP (PRP we)) (VP (VBD were) (VP (VBG offering) (NP (NP (DT a) (JJ reasonable) (NN price)) (VP (VBG taking)))))))))))) (NP (NP (NN everything)) (PP (IN into) (NP (NN consideration))))))"
K/KB/KB7.xml,KB7RE01H,19202,104,,B,76,1,(()) upstairs and,"[upstairs/NN, and/CC]",(ROOT (FRAG (NP (NP (NN upstairs)) (ADVP (CC and)))))
K/KB/KB7.xml,KB7RE01H,19202,105,,A,77,1,(()) price market ,"[price/NN, market/NN]",(ROOT (NP (NN price) (NN market)))
K/KB/KB7.xml,KB7RE01H,19202,106,,B,78,1,market ,[market/NN],(ROOT (NP (NN market)))
K/KB/KB7.xml,KB7RE01H,19202,107,,A,79,1,"erm, how long we've been here sitting tenants er","[erm/NN, ,/,, how/WRB, long/RB, we/PRP, 've/VBP, been/VBN, here/RB, sitting/VBG, tenants/NNS, er/NN]","(ROOT (FRAG (NP (NP (NN erm)) (, ,) (SBAR (WHADVP (WRB how) (RB long)) (S (NP (PRP we)) (VP (VBP 've) (VP (VBN been) (VP (ADVP (RB here)) (VBG sitting) (NP (NNS tenants) (NN er))))))))))"
K/KB/KB7.xml,KB7RE01H,19202,108,,B,80,1,I'm not thinking it object the sitting tenants ,"[I/PRP, 'm/VBP, not/RB, thinking/VBG, it/PRP, object/VB, the/DT, sitting/VBG, tenants/NNS]",(ROOT (S (NP (PRP I)) (VP (VBP 'm) (RB not) (VP (VBG thinking) (S (NP (PRP it)) (VP (VB object) (NP (DT the) (VBG sitting) (NNS tenants))))))))
K/KB/KB7.xml,KB7RE01H,19202,109,,A,81,1,"the  (()) , I thought that was fair- ","[the/DT, ,/,, I/PRP, thought/VBD, that/DT, was/VBD, fair-/JJ]","(ROOT (S (ADVP (DT the)) (, ,) (NP (PRP I)) (VP (VBD thought) (SBAR (S (NP (DT that)) (VP (VBD was) (ADJP (JJ fair-))))))))"
K/KB/KB7.xml,KB7RE01H,19202,110,,B,82,1,as it stands at the moment.,"[as/IN, it/PRP, stands/VBZ, at/IN, the/DT, moment/NN, ./.]",(ROOT (FRAG (SBAR (IN as) (S (NP (PRP it)) (VP (VBZ stands) (PP (IN at) (NP (DT the) (NN moment)))))) (. .)))
K/KB/KB7.xml,KB7RE01H,19202,111,,A,83,1,fairly good deal.,"[fairly/RB, good/JJ, deal/NN, ./.]",(ROOT (FRAG (ADVP (RB fairly)) (NP (JJ good) (NN deal)) (. .)))
K/KB/KB7.xml,KB7RE01H,19202,112,,B,84,1,Mm.,"[Mm/NN, ./.]",(ROOT (NP (NN Mm) (. .)))
K/KB/KB7.xml,KB7RE01H,19202,113,,B,84,2,"See here, they're gonna get thirty six for it as it stands  --","[See/VB, here/RB, ,/,, they/PRP, 're/VBP, gonna/NNP, get/VB, thirty/CD, six/CD, for/IN, it/PRP, as/IN, it/PRP, stands/VBZ, put/VB, it/PRP, on/IN, the/DT, market/NN, as/IN]","(ROOT (S (VP (VB See) (S (ADVP (RB here)) (, ,) (NP (PRP they)) (VP (VBP 're) (S (NP (NNP gonna)) (VP (VB get) (NP (CD thirty) (CD six)) (PP (IN for) (NP (PRP it))) (SBAR (IN as) (S (NP (PRP it)) (VP (VBZ stands) (VP (VB put) (NP (PRP it)) (PP (IN on) (NP (DT the) (NN market) (IN as))))))))))))))"
K/KB/KB7.xml,KB7RE01H,19202,114,,B,84,3,--put it on the market as  (()) ,"[See/VB, here/RB, ,/,, they/PRP, 're/VBP, gonna/NNP, get/VB, thirty/CD, six/CD, for/IN, it/PRP, as/IN, it/PRP, stands/VBZ, put/VB, it/PRP, on/IN, the/DT, market/NN, as/IN]","(ROOT (S (VP (VB See) (S (ADVP (RB here)) (, ,) (NP (PRP they)) (VP (VBP 're) (S (NP (NNP gonna)) (VP (VB get) (NP (CD thirty) (CD six)) (PP (IN for) (NP (PRP it))) (SBAR (IN as) (S (NP (PRP it)) (VP (VBZ stands) (VP (VB put) (NP (PRP it)) (PP (IN on) (NP (DT the) (NN market) (IN as))))))))))))))"
K/KB/KB7.xml,KB7RE01H,19202,115,,A,85,1,"Might do, yeah.","[Might/MD, do/VB, ,/,, yeah/UH, ./.]","(ROOT (S (S (NP (MD Might)) (VP (VB do))) (, ,) (FRAG (INTJ (UH yeah))) (. .)))"
K/KB/KB7.xml,KB7RE01H,19202,116,,B,86,1,Might even  (()) two years (()) .,"[Might/MD, even/RB, two/CD, years/NNS, ./.]",(ROOT (S (VP (MD Might) (ADVP (RB even) (NP (CD two) (NNS years)))) (. .)))
K/KB/KB7.xml,KB7RE01H,19202,117,,A,87,1,"When you look at, look at the old houses on the market, erm, yeah, I think he might just, he might wait a while, there aren't that many buyers,","[When/WRB, you/PRP, look/VBP, at/IN, ,/,, look/VB, at/IN, the/DT, old/JJ, houses/NNS, on/IN, the/DT, market/NN, ,/,, erm/NN, ,/,, yeah/UH, ,/,, I/PRP, think/VBP, he/PRP, might/MD, just/RB, ,/,, he/PRP, might/MD, wait/VB, a/DT, while/NN, ,/,, there/EX, aren/NNP, 't/PRP, that/IN, many/JJ, buyers/NNS, ,/,]","(ROOT (SBAR (WHADVP (WRB When)) (S (S (NP (PRP you)) (VP (VBP look) (PP (IN at) (PRN (, ,) (S (VP (VB look) (PP (IN at) (NP (NP (DT the) (JJ old) (NNS houses)) (PP (IN on) (NP (DT the) (NN market))))))) (, ,)) (NP (NN erm))))) (, ,) (S (INTJ (UH yeah)) (, ,) (S (NP (PRP I)) (VP (VBP think) (SBAR (S (NP (PRP he)) (VP (MD might) (ADVP (RB just))))))) (, ,) (S (S (NP (PRP he)) (VP (MD might) (VP (VB wait) (NP (DT a) (NN while))))) (, ,) (S (NP (EX there)) (NP (NP (NNP aren)) (VP (NP (PRP 't)) (PP (IN that) (NP (JJ many) (NNS buyers))))))) (, ,)))))"
