swda_filename,ptb_basename,conversation_no,transcript_index,act_tag,caller,turn_index,subutterance_index,text,pos,trees
K/KD/KDK.xml,KDKRE00G,16803,0,,A,1,1,You been waiting long?,"[You/PRP, been/VBN, waiting/VBG, long/RB, ?/.]",(ROOT (S (NP (PRP You)) (VP (VBN been) (VP (VBG waiting) (ADVP (RB long)))) (. ?)))
K/KD/KDK.xml,KDKRE00G,16803,1,,B,2,1,I went up there and   (()) --,"[I/PRP, went/VBD, up/RB, there/RB, and/CC, oh/UH, look/VB, oh/UH, they/PRP, 've/VBP, gone/VBN, !/.]",(ROOT (S (NP (PRP I)) (VP (VP (VBD went) (ADVP (RB up) (RB there))) (CC and) (VP (FRAG (INTJ (UH oh))))) (VP (VB look) (SBAR (S (INTJ (UH oh)) (NP (PRP they)) (VP (VBP 've) (VP (VBN gone)))))) (. !)))
K/KD/KDK.xml,KDKRE00G,16803,2,,B,2,2,--oh look  --,"[I/PRP, went/VBD, up/RB, there/RB, and/CC, oh/UH, look/VB, oh/UH, they/PRP, 've/VBP, gone/VBN, !/.]",(ROOT (S (NP (PRP I)) (VP (VP (VBD went) (ADVP (RB up) (RB there))) (CC and) (VP (FRAG (INTJ (UH oh))))) (VP (VB look) (SBAR (S (INTJ (UH oh)) (NP (PRP they)) (VP (VBP 've) (VP (VBN gone)))))) (. !)))
K/KD/KDK.xml,KDKRE00G,16803,3,,B,2,3,--oh they've gone!,"[I/PRP, went/VBD, up/RB, there/RB, and/CC, oh/UH, look/VB, oh/UH, they/PRP, 've/VBP, gone/VBN, !/.]",(ROOT (S (NP (PRP I)) (VP (VP (VBD went) (ADVP (RB up) (RB there))) (CC and) (VP (FRAG (INTJ (UH oh))))) (VP (VB look) (SBAR (S (INTJ (UH oh)) (NP (PRP they)) (VP (VBP 've) (VP (VBN gone)))))) (. !)))
K/KD/KDK.xml,KDKRE00G,16803,4,,A,3,1,Oh.,"[Oh/UH, ./.]",(ROOT (INTJ (UH Oh) (. .)))
K/KD/KDK.xml,KDKRE00G,16803,5,,B,4,1,Where did you go?,"[Where/WRB, did/VBD, you/PRP, go/VB, ?/.]",(ROOT (SBARQ (WHADVP (WRB Where)) (SQ (VBD did) (NP (PRP you)) (VP (VB go))) (. ?)))
K/KD/KDK.xml,KDKRE00G,16803,6,,A,5,1,We must have parked  --,"[We/PRP, must/MD, have/VB, parked/VBN, we/PRP, could/MD, have/VB, parked/VBN, ./.]",(ROOT (S (NP (PRP We)) (VP (MD must) (VP (VB have) (VP (VBN parked) (SBAR (S (NP (PRP we)) (VP (MD could) (VP (VB have) (VP (VBN parked))))))))) (. .)))
K/KD/KDK.xml,KDKRE00G,16803,7,,A,5,2,--we could have parked.,"[We/PRP, must/MD, have/VB, parked/VBN, we/PRP, could/MD, have/VB, parked/VBN, ./.]",(ROOT (S (NP (PRP We)) (VP (MD must) (VP (VB have) (VP (VBN parked) (SBAR (S (NP (PRP we)) (VP (MD could) (VP (VB have) (VP (VBN parked))))))))) (. .)))
K/KD/KDK.xml,KDKRE00G,16803,8,,B,6,1,We can   --,"[We/PRP, can/MD, that/WDT, though/RB, ./.]",(ROOT (S (NP (PRP We)) (VP (MD can) (VP (FRAG (SBAR (WHNP (WDT that)) (FRAG (ADVP (RB though))))))) (. .)))
K/KD/KDK.xml,KDKRE00G,16803,9,,B,6,2,--(()) that though.,"[We/PRP, can/MD, that/WDT, though/RB, ./.]",(ROOT (S (NP (PRP We)) (VP (MD can) (VP (FRAG (SBAR (WHNP (WDT that)) (FRAG (ADVP (RB though))))))) (. .)))
K/KD/KDK.xml,KDKRE00G,16803,10,,A,7,1,Yeah.,"[Yeah/UH, ./.]",(ROOT (INTJ (UH Yeah) (. .)))
K/KD/KDK.xml,KDKRE00G,16803,11,,B,8,1,What's up there (()) ,"[What/WP, 's/VBZ, up/RB, there/RB]",(ROOT (SBARQ (WHNP (WP What)) (SQ (VBZ 's) (ADVP (RB up) (RB there)))))
K/KD/KDK.xml,KDKRE00G,16803,12,,A,9,1,Just there?,"[Just/RB, there/EX, ?/.]",(ROOT (S (VP (PP (RB Just) (NP (EX there)))) (. ?)))
K/KD/KDK.xml,KDKRE00G,16803,13,,B,10,1,Yeah.,"[Yeah/UH, ./.]",(ROOT (INTJ (UH Yeah) (. .)))
K/KD/KDK.xml,KDKRE00G,16803,14,,A,11,1,I just came down  --,"[I/PRP, just/RB, came/VBD, down/RB, and/CC, I/PRP, walked/VBD, all/DT, through/IN, that/DT, Kenyan/JJ]",(ROOT (NP (S (S (NP (PRP I)) (ADVP (RB just)) (VP (VBD came) (ADVP (RB down)))) (CC and) (S (NP (PRP I)) (VP (VBD walked) (NP (DT all)) (PP (IN through) (NP (DT that) (JJ Kenyan))))))))
K/KD/KDK.xml,KDKRE00G,16803,15,,A,11,2,--and I walked all through that Kenyan ,"[I/PRP, just/RB, came/VBD, down/RB, and/CC, I/PRP, walked/VBD, all/DT, through/IN, that/DT, Kenyan/JJ]",(ROOT (NP (S (S (NP (PRP I)) (ADVP (RB just)) (VP (VBD came) (ADVP (RB down)))) (CC and) (S (NP (PRP I)) (VP (VBD walked) (NP (DT all)) (PP (IN through) (NP (DT that) (JJ Kenyan))))))))
K/KD/KDK.xml,KDKRE00G,16803,16,,B,12,1,(()) ,[],
K/KD/KDK.xml,KDKRE00G,16803,17,,A,13,1,I w- I walked all through that Nigerian mob  --,"[I/PRP, w-/VBP, I/PRP, walked/VBD, all/DT, through/IN, that/DT, Nigerian/JJ, mob/NN, and/CC, I/PRP, thought/VBD, oh/UH, we-/NN, I/PRP, 'll/MD, walk/VB, down/IN, the/DT, ticket/NN, desk/NN, ,/,, see/VB, if/IN, this/DT, is/VBZ, all/DT, shut/VBN]","(ROOT (S (NP (PRP I)) (VP (VBP w-) (S (S (NP (PRP I)) (VP (VBD walked) (NP (DT all)) (PP (IN through) (NP (DT that) (JJ Nigerian) (NN mob))))) (CC and) (S (NP (PRP I)) (VP (VBD thought) (NP (INTJ (UH oh)) (NP (NN we-))))) (S (NP (PRP I)) (VP (MD 'll) (VP (VB walk) (PRT (IN down)) (NP (DT the) (NN ticket) (NN desk))) (, ,) (VP (VB see) (SBAR (IN if) (S (NP (DT this)) (VP (VBZ is) (NP (NP (DT all)) (VP (VBN shut)))))))))))))"
K/KD/KDK.xml,KDKRE00G,16803,18,,A,13,2,"--and I thought oh we- I'll walk down the ticket desk, see if this is all shut","[I/PRP, w-/VBP, I/PRP, walked/VBD, all/DT, through/IN, that/DT, Nigerian/JJ, mob/NN, and/CC, I/PRP, thought/VBD, oh/UH, we-/NN, I/PRP, 'll/MD, walk/VB, down/IN, the/DT, ticket/NN, desk/NN, ,/,, see/VB, if/IN, this/DT, is/VBZ, all/DT, shut/VBN]","(ROOT (S (NP (PRP I)) (VP (VBP w-) (S (S (NP (PRP I)) (VP (VBD walked) (NP (DT all)) (PP (IN through) (NP (DT that) (JJ Nigerian) (NN mob))))) (CC and) (S (NP (PRP I)) (VP (VBD thought) (NP (INTJ (UH oh)) (NP (NN we-))))) (S (NP (PRP I)) (VP (MD 'll) (VP (VB walk) (PRT (IN down)) (NP (DT the) (NN ticket) (NN desk))) (, ,) (VP (VB see) (SBAR (IN if) (S (NP (DT this)) (VP (VBZ is) (NP (NP (DT all)) (VP (VBN shut)))))))))))))"
K/KD/KDK.xml,KDKRE00G,16803,19,,B,14,1,(()) ,[],
K/KD/KDK.xml,KDKRE00G,16803,20,,A,15,1,(()) ,[],
K/KD/KDK.xml,KDKRE00G,16803,21,,B,16,1,Someone walked down there.,"[Someone/NN, walked/VBD, down/RB, there/RB, ./.]",(ROOT (S (NP (NN Someone)) (VP (VBD walked) (ADVP (RB down) (RB there))) (. .)))
K/KD/KDK.xml,KDKRE00G,16803,22,,A,17,1,Wonder how much  --,"[Wonder/VB, how/WRB, much/JJ, oh/NN, mush/NN, How/WRB, are/VBP, you/PRP, lately/RB, ,/,, haven/NN, 't/PRP, seen/VBN, you/PRP, for/IN, ages/NNS, ,/,, give/VB, us/PRP, a/DT, ring/NN, still/RB, out/IN, buying/VBG, the/DT, old/JJ, place/NN, I/PRP, married/VBD, her/PRP, ,/,, yeah/UH, ./.]","(ROOT (S (S (S (VP (VB Wonder) (SBAR (WHADJP (WRB how) (JJ much)) (S (NP (NP (NP (NN oh) (NN mush)) (SBAR (WHADVP (WRB How)) (S (VP (VBP are) (NP (PRP you)) (ADVP (RB lately)))))) (, ,) (NP (NP (NN haven)) (SBAR (S (NP (PRP 't)) (VP (VBN seen) (NP (PRP you)) (PP (IN for) (NP (NNS ages))))))) (, ,)) (VP (VB give) (NP (PRP us)) (NP (DT a) (NN ring)) (PP (ADVP (RB still)) (IN out) (S (VP (VBG buying) (NP (DT the) (JJ old) (NN place)))))))))) (NP (PRP I)) (VP (VBD married) (NP (PRP her)))) (, ,) (FRAG (INTJ (UH yeah))) (. .)))"
K/KD/KDK.xml,KDKRE00G,16803,23,,A,17,2,--oh mush  --,"[Wonder/VB, how/WRB, much/JJ, oh/NN, mush/NN, How/WRB, are/VBP, you/PRP, lately/RB, ,/,, haven/NN, 't/PRP, seen/VBN, you/PRP, for/IN, ages/NNS, ,/,, give/VB, us/PRP, a/DT, ring/NN, still/RB, out/IN, buying/VBG, the/DT, old/JJ, place/NN, I/PRP, married/VBD, her/PRP, ,/,, yeah/UH, ./.]","(ROOT (S (S (S (VP (VB Wonder) (SBAR (WHADJP (WRB how) (JJ much)) (S (NP (NP (NP (NN oh) (NN mush)) (SBAR (WHADVP (WRB How)) (S (VP (VBP are) (NP (PRP you)) (ADVP (RB lately)))))) (, ,) (NP (NP (NN haven)) (SBAR (S (NP (PRP 't)) (VP (VBN seen) (NP (PRP you)) (PP (IN for) (NP (NNS ages))))))) (, ,)) (VP (VB give) (NP (PRP us)) (NP (DT a) (NN ring)) (PP (ADVP (RB still)) (IN out) (S (VP (VBG buying) (NP (DT the) (JJ old) (NN place)))))))))) (NP (PRP I)) (VP (VBD married) (NP (PRP her)))) (, ,) (FRAG (INTJ (UH yeah))) (. .)))"
K/KD/KDK.xml,KDKRE00G,16803,24,,A,17,3,"--How are you lately, haven't seen you for ages, give us a ring  (()) still out buying the old place  --","[Wonder/VB, how/WRB, much/JJ, oh/NN, mush/NN, How/WRB, are/VBP, you/PRP, lately/RB, ,/,, haven/NN, 't/PRP, seen/VBN, you/PRP, for/IN, ages/NNS, ,/,, give/VB, us/PRP, a/DT, ring/NN, still/RB, out/IN, buying/VBG, the/DT, old/JJ, place/NN, I/PRP, married/VBD, her/PRP, ,/,, yeah/UH, ./.]","(ROOT (S (S (S (VP (VB Wonder) (SBAR (WHADJP (WRB how) (JJ much)) (S (NP (NP (NP (NN oh) (NN mush)) (SBAR (WHADVP (WRB How)) (S (VP (VBP are) (NP (PRP you)) (ADVP (RB lately)))))) (, ,) (NP (NP (NN haven)) (SBAR (S (NP (PRP 't)) (VP (VBN seen) (NP (PRP you)) (PP (IN for) (NP (NNS ages))))))) (, ,)) (VP (VB give) (NP (PRP us)) (NP (DT a) (NN ring)) (PP (ADVP (RB still)) (IN out) (S (VP (VBG buying) (NP (DT the) (JJ old) (NN place)))))))))) (NP (PRP I)) (VP (VBD married) (NP (PRP her)))) (, ,) (FRAG (INTJ (UH yeah))) (. .)))"
K/KD/KDK.xml,KDKRE00G,16803,25,,A,17,4,"--I married her, yeah.","[Wonder/VB, how/WRB, much/JJ, oh/NN, mush/NN, How/WRB, are/VBP, you/PRP, lately/RB, ,/,, haven/NN, 't/PRP, seen/VBN, you/PRP, for/IN, ages/NNS, ,/,, give/VB, us/PRP, a/DT, ring/NN, still/RB, out/IN, buying/VBG, the/DT, old/JJ, place/NN, I/PRP, married/VBD, her/PRP, ,/,, yeah/UH, ./.]","(ROOT (S (S (S (VP (VB Wonder) (SBAR (WHADJP (WRB how) (JJ much)) (S (NP (NP (NP (NN oh) (NN mush)) (SBAR (WHADVP (WRB How)) (S (VP (VBP are) (NP (PRP you)) (ADVP (RB lately)))))) (, ,) (NP (NP (NN haven)) (SBAR (S (NP (PRP 't)) (VP (VBN seen) (NP (PRP you)) (PP (IN for) (NP (NNS ages))))))) (, ,)) (VP (VB give) (NP (PRP us)) (NP (DT a) (NN ring)) (PP (ADVP (RB still)) (IN out) (S (VP (VBG buying) (NP (DT the) (JJ old) (NN place)))))))))) (NP (PRP I)) (VP (VBD married) (NP (PRP her)))) (, ,) (FRAG (INTJ (UH yeah))) (. .)))"
K/KD/KDK.xml,KDKRE00G,16803,26,,B,18,1,Yeah.,"[Yeah/UH, ./.]",(ROOT (INTJ (UH Yeah) (. .)))
K/KD/KDK.xml,KDKRE00G,16803,27,,A,19,1,What's up with Robert?,"[What/WP, 's/VBZ, up/RP, with/IN, Robert/NNP, ?/.]",(ROOT (SBARQ (WHNP (WP What)) (SQ (VP (VBZ 's) (ADVP (RP up)) (PP (IN with) (NP (NNP Robert))))) (. ?)))
K/KD/KDK.xml,KDKRE00G,16803,28,,B,20,1,Did Clare give you the message?,"[Did/VBD, Clare/NNP, give/VB, you/PRP, the/DT, message/NN, ?/.]",(ROOT (SQ (VBD Did) (NP (NNP Clare)) (VP (VB give) (NP (PRP you)) (NP (DT the) (NN message))) (. ?)))
K/KD/KDK.xml,KDKRE00G,16803,29,,A,21,1,I said erm ,"[I/PRP, said/VBD, erm/NN]",(ROOT (S (NP (PRP I)) (VP (VBD said) (NP (NN erm)))))
K/KD/KDK.xml,KDKRE00G,16803,30,,B,22,1,He told me  --,"[He/PRP, told/VBD, me/PRP, he/PRP, said/VBD, Natalie/NNP]",(ROOT (S (NP (PRP He)) (VP (VBD told) (NP (PRP me)) (SBAR (S (NP (PRP he)) (VP (VBD said) (NP (NNP Natalie))))))))
K/KD/KDK.xml,KDKRE00G,16803,31,,B,22,2,--he said Natalie,"[He/PRP, told/VBD, me/PRP, he/PRP, said/VBD, Natalie/NNP]",(ROOT (S (NP (PRP He)) (VP (VBD told) (NP (PRP me)) (SBAR (S (NP (PRP he)) (VP (VBD said) (NP (NNP Natalie))))))))
K/KD/KDK.xml,KDKRE00G,16803,32,,A,23,1,he said erm,"[he/PRP, said/VBD, erm/NN]",(ROOT (S (NP (PRP he)) (VP (VBD said) (NP (NN erm)))))
K/KD/KDK.xml,KDKRE00G,16803,33,,B,24,1,I nearly forgot.,"[I/PRP, nearly/RB, forgot/VBD, ./.]",(ROOT (S (NP (PRP I)) (ADVP (RB nearly)) (VP (VBD forgot)) (. .)))
K/KD/KDK.xml,KDKRE00G,16803,34,,A,25,1,erm  --,"[erm/NN, she/PRP, said/VBD, send/VB, her/PRP$, send/VB, her/PRP, a/DT, mail/NN, something/NN, like/IN, that/DT, yeah/UH, so/IN, I/PRP, went/VBD, to/TO, the/DT, ticket/NN, desk/NN, ,/,, it/PRP, was/VBD, locked/VBN, up/RB, and/CC, they/PRP, 'd/MD, just/RB, come/VB, walking/VBG, back/RB, and/CC, I/PRP, thought/VBD, ah/NN, I/PRP, hope/VBP, she/PRP, 's/VBZ, not/RB, been/VBN, waiting/VBG, around/RB, ./.]","(ROOT (S (NP (NP (NN erm)) (SBAR (S (NP (PRP she)) (VP (VBD said) (VP (VB send) (S (NP (PRP$ her)) (VP (VB send) (S (NP (PRP her)) (NP (NP (DT a) (NN mail) (NN something)) (PP (IN like) (NP (NP (DT that)) (FRAG (INTJ (UH yeah))))))) (SBAR (IN so) (S (NP (PRP I)) (VP (VBD went) (PP (TO to) (NP (DT the) (NN ticket) (NN desk))))))))))))) (, ,) (S (NP (PRP it)) (VP (VBD was) (VP (VBN locked) (ADVP (RB up))))) (CC and) (S (S (NP (PRP they)) (VP (MD 'd) (ADVP (RB just)) (VP (VB come) (S (VP (VBG walking) (ADVP (RB back))))))) (CC and) (S (NP (PRP I)) (VP (VBD thought) (NP (NP (NN ah)) (SBAR (S (NP (PRP I)) (VP (VBP hope) (SBAR (S (NP (PRP she)) (VP (VBZ 's) (RB not) (VP (VBN been) (VP (VBG waiting) (ADVP (RB around)))))))))))))) (. .)))"
K/KD/KDK.xml,KDKRE00G,16803,35,,A,25,2,--she said send her send her a mail  (()) something like that  --,"[erm/NN, she/PRP, said/VBD, send/VB, her/PRP$, send/VB, her/PRP, a/DT, mail/NN, something/NN, like/IN, that/DT, yeah/UH, so/IN, I/PRP, went/VBD, to/TO, the/DT, ticket/NN, desk/NN, ,/,, it/PRP, was/VBD, locked/VBN, up/RB, and/CC, they/PRP, 'd/MD, just/RB, come/VB, walking/VBG, back/RB, and/CC, I/PRP, thought/VBD, ah/NN, I/PRP, hope/VBP, she/PRP, 's/VBZ, not/RB, been/VBN, waiting/VBG, around/RB, ./.]","(ROOT (S (NP (NP (NN erm)) (SBAR (S (NP (PRP she)) (VP (VBD said) (VP (VB send) (S (NP (PRP$ her)) (VP (VB send) (S (NP (PRP her)) (NP (NP (DT a) (NN mail) (NN something)) (PP (IN like) (NP (NP (DT that)) (FRAG (INTJ (UH yeah))))))) (SBAR (IN so) (S (NP (PRP I)) (VP (VBD went) (PP (TO to) (NP (DT the) (NN ticket) (NN desk))))))))))))) (, ,) (S (NP (PRP it)) (VP (VBD was) (VP (VBN locked) (ADVP (RB up))))) (CC and) (S (S (NP (PRP they)) (VP (MD 'd) (ADVP (RB just)) (VP (VB come) (S (VP (VBG walking) (ADVP (RB back))))))) (CC and) (S (NP (PRP I)) (VP (VBD thought) (NP (NP (NN ah)) (SBAR (S (NP (PRP I)) (VP (VBP hope) (SBAR (S (NP (PRP she)) (VP (VBZ 's) (RB not) (VP (VBN been) (VP (VBG waiting) (ADVP (RB around)))))))))))))) (. .)))"
K/KD/KDK.xml,KDKRE00G,16803,36,,A,25,3,"--yeah so I went to the ticket desk, it was locked up and they'd just come walking back and I thought  --","[erm/NN, she/PRP, said/VBD, send/VB, her/PRP$, send/VB, her/PRP, a/DT, mail/NN, something/NN, like/IN, that/DT, yeah/UH, so/IN, I/PRP, went/VBD, to/TO, the/DT, ticket/NN, desk/NN, ,/,, it/PRP, was/VBD, locked/VBN, up/RB, and/CC, they/PRP, 'd/MD, just/RB, come/VB, walking/VBG, back/RB, and/CC, I/PRP, thought/VBD, ah/NN, I/PRP, hope/VBP, she/PRP, 's/VBZ, not/RB, been/VBN, waiting/VBG, around/RB, ./.]","(ROOT (S (NP (NP (NN erm)) (SBAR (S (NP (PRP she)) (VP (VBD said) (VP (VB send) (S (NP (PRP$ her)) (VP (VB send) (S (NP (PRP her)) (NP (NP (DT a) (NN mail) (NN something)) (PP (IN like) (NP (NP (DT that)) (FRAG (INTJ (UH yeah))))))) (SBAR (IN so) (S (NP (PRP I)) (VP (VBD went) (PP (TO to) (NP (DT the) (NN ticket) (NN desk))))))))))))) (, ,) (S (NP (PRP it)) (VP (VBD was) (VP (VBN locked) (ADVP (RB up))))) (CC and) (S (S (NP (PRP they)) (VP (MD 'd) (ADVP (RB just)) (VP (VB come) (S (VP (VBG walking) (ADVP (RB back))))))) (CC and) (S (NP (PRP I)) (VP (VBD thought) (NP (NP (NN ah)) (SBAR (S (NP (PRP I)) (VP (VBP hope) (SBAR (S (NP (PRP she)) (VP (VBZ 's) (RB not) (VP (VBN been) (VP (VBG waiting) (ADVP (RB around)))))))))))))) (. .)))"
K/KD/KDK.xml,KDKRE00G,16803,37,,A,25,4,--ah I hope she's not been waiting around.,"[erm/NN, she/PRP, said/VBD, send/VB, her/PRP$, send/VB, her/PRP, a/DT, mail/NN, something/NN, like/IN, that/DT, yeah/UH, so/IN, I/PRP, went/VBD, to/TO, the/DT, ticket/NN, desk/NN, ,/,, it/PRP, was/VBD, locked/VBN, up/RB, and/CC, they/PRP, 'd/MD, just/RB, come/VB, walking/VBG, back/RB, and/CC, I/PRP, thought/VBD, ah/NN, I/PRP, hope/VBP, she/PRP, 's/VBZ, not/RB, been/VBN, waiting/VBG, around/RB, ./.]","(ROOT (S (NP (NP (NN erm)) (SBAR (S (NP (PRP she)) (VP (VBD said) (VP (VB send) (S (NP (PRP$ her)) (VP (VB send) (S (NP (PRP her)) (NP (NP (DT a) (NN mail) (NN something)) (PP (IN like) (NP (NP (DT that)) (FRAG (INTJ (UH yeah))))))) (SBAR (IN so) (S (NP (PRP I)) (VP (VBD went) (PP (TO to) (NP (DT the) (NN ticket) (NN desk))))))))))))) (, ,) (S (NP (PRP it)) (VP (VBD was) (VP (VBN locked) (ADVP (RB up))))) (CC and) (S (S (NP (PRP they)) (VP (MD 'd) (ADVP (RB just)) (VP (VB come) (S (VP (VBG walking) (ADVP (RB back))))))) (CC and) (S (NP (PRP I)) (VP (VBD thought) (NP (NP (NN ah)) (SBAR (S (NP (PRP I)) (VP (VBP hope) (SBAR (S (NP (PRP she)) (VP (VBZ 's) (RB not) (VP (VBN been) (VP (VBG waiting) (ADVP (RB around)))))))))))))) (. .)))"
K/KD/KDK.xml,KDKRE00G,16803,38,,B,26,1,<laugh> ,[],
K/KD/KDK.xml,KDKRE00G,16803,39,,A,27,1,I can't do that   (()) --,"[I/PRP, can/MD, 't/PRP, do/VB, that/DT, I/PRP, tell/VBP, you/PRP, ,/,, I/PRP, mean/VBP, I/PRP, don/VB, 't/PRP, mind/VB, ,/,, don/NNP, 't/PRP, get/VB, me/PRP, wrong/JJ, it/PRP, 's/VBZ, just/RB, that/IN, I/PRP, was/VBD, the/DT, last/JJ, one/CD, back/RB, up/RB, and/CC, I/PRP, got/VBD, up/RB, there/RB, ,/,, still/RB, got/VBD, a/DT, little/JJ, bit/NN, of/IN, to/TO, do/VB, and/CC, they/PRP, got/VBD, more/JJR, than/IN, they/PRP, did/VBD]","(ROOT (S (S (NP (PRP I)) (VP (MD can) (NP (PRP 't)) (S (VP (VB do) (SBAR (WHNP (DT that)) (S (NP (PRP I)) (VP (VBP tell) (NP (PRP you))))))))) (, ,) (S (NP (PRP I)) (VP (VBP mean) (S (NP (PRP I)) (VP (VB don) (S (NP (PRP 't)) (VP (VB mind) (, ,) (S (NP (NNP don) (PRP 't)) (VP (VB get) (S (NP (PRP me)) (ADJP (JJ wrong)) (SBAR (S (NP (PRP it)) (VP (VBZ 's) (ADVP (RB just)) (SBAR (SBAR (IN that) (S (NP (PRP I)) (VP (VBD was) (NP (DT the) (JJ last) (CD one)) (ADVP (RB back) (RB up))))) (CC and) (SBAR (S (NP (PRP I)) (VP (VBD got) (ADVP (RB up) (RB there))))) (, ,) (S (ADVP (RB still)) (VP (VBD got) (NP (NP (DT a) (JJ little) (NN bit)) (PP (IN of) (NP (S (VP (TO to) (VP (VB do)))))))))))))))))))))) (CC and) (S (NP (PRP they)) (VP (VBD got) (NP (JJR more)) (SBAR (IN than) (S (NP (PRP they)) (VP (VBD did))))))))"
K/KD/KDK.xml,KDKRE00G,16803,40,,A,27,2,"--I tell you, I mean I don't mind, don't get me wrong it's just that  --","[I/PRP, can/MD, 't/PRP, do/VB, that/DT, I/PRP, tell/VBP, you/PRP, ,/,, I/PRP, mean/VBP, I/PRP, don/VB, 't/PRP, mind/VB, ,/,, don/NNP, 't/PRP, get/VB, me/PRP, wrong/JJ, it/PRP, 's/VBZ, just/RB, that/IN, I/PRP, was/VBD, the/DT, last/JJ, one/CD, back/RB, up/RB, and/CC, I/PRP, got/VBD, up/RB, there/RB, ,/,, still/RB, got/VBD, a/DT, little/JJ, bit/NN, of/IN, to/TO, do/VB, and/CC, they/PRP, got/VBD, more/JJR, than/IN, they/PRP, did/VBD]","(ROOT (S (S (NP (PRP I)) (VP (MD can) (NP (PRP 't)) (S (VP (VB do) (SBAR (WHNP (DT that)) (S (NP (PRP I)) (VP (VBP tell) (NP (PRP you))))))))) (, ,) (S (NP (PRP I)) (VP (VBP mean) (S (NP (PRP I)) (VP (VB don) (S (NP (PRP 't)) (VP (VB mind) (, ,) (S (NP (NNP don) (PRP 't)) (VP (VB get) (S (NP (PRP me)) (ADJP (JJ wrong)) (SBAR (S (NP (PRP it)) (VP (VBZ 's) (ADVP (RB just)) (SBAR (SBAR (IN that) (S (NP (PRP I)) (VP (VBD was) (NP (DT the) (JJ last) (CD one)) (ADVP (RB back) (RB up))))) (CC and) (SBAR (S (NP (PRP I)) (VP (VBD got) (ADVP (RB up) (RB there))))) (, ,) (S (ADVP (RB still)) (VP (VBD got) (NP (NP (DT a) (JJ little) (NN bit)) (PP (IN of) (NP (S (VP (TO to) (VP (VB do)))))))))))))))))))))) (CC and) (S (NP (PRP they)) (VP (VBD got) (NP (JJR more)) (SBAR (IN than) (S (NP (PRP they)) (VP (VBD did))))))))"
K/KD/KDK.xml,KDKRE00G,16803,41,,A,27,3,--I was the last one back up  --,"[I/PRP, can/MD, 't/PRP, do/VB, that/DT, I/PRP, tell/VBP, you/PRP, ,/,, I/PRP, mean/VBP, I/PRP, don/VB, 't/PRP, mind/VB, ,/,, don/NNP, 't/PRP, get/VB, me/PRP, wrong/JJ, it/PRP, 's/VBZ, just/RB, that/IN, I/PRP, was/VBD, the/DT, last/JJ, one/CD, back/RB, up/RB, and/CC, I/PRP, got/VBD, up/RB, there/RB, ,/,, still/RB, got/VBD, a/DT, little/JJ, bit/NN, of/IN, to/TO, do/VB, and/CC, they/PRP, got/VBD, more/JJR, than/IN, they/PRP, did/VBD]","(ROOT (S (S (NP (PRP I)) (VP (MD can) (NP (PRP 't)) (S (VP (VB do) (SBAR (WHNP (DT that)) (S (NP (PRP I)) (VP (VBP tell) (NP (PRP you))))))))) (, ,) (S (NP (PRP I)) (VP (VBP mean) (S (NP (PRP I)) (VP (VB don) (S (NP (PRP 't)) (VP (VB mind) (, ,) (S (NP (NNP don) (PRP 't)) (VP (VB get) (S (NP (PRP me)) (ADJP (JJ wrong)) (SBAR (S (NP (PRP it)) (VP (VBZ 's) (ADVP (RB just)) (SBAR (SBAR (IN that) (S (NP (PRP I)) (VP (VBD was) (NP (DT the) (JJ last) (CD one)) (ADVP (RB back) (RB up))))) (CC and) (SBAR (S (NP (PRP I)) (VP (VBD got) (ADVP (RB up) (RB there))))) (, ,) (S (ADVP (RB still)) (VP (VBD got) (NP (NP (DT a) (JJ little) (NN bit)) (PP (IN of) (NP (S (VP (TO to) (VP (VB do)))))))))))))))))))))) (CC and) (S (NP (PRP they)) (VP (VBD got) (NP (JJR more)) (SBAR (IN than) (S (NP (PRP they)) (VP (VBD did))))))))"
K/KD/KDK.xml,KDKRE00G,16803,42,,A,27,4,"--and I got up there, still got a little bit of  (()) to do  --","[I/PRP, can/MD, 't/PRP, do/VB, that/DT, I/PRP, tell/VBP, you/PRP, ,/,, I/PRP, mean/VBP, I/PRP, don/VB, 't/PRP, mind/VB, ,/,, don/NNP, 't/PRP, get/VB, me/PRP, wrong/JJ, it/PRP, 's/VBZ, just/RB, that/IN, I/PRP, was/VBD, the/DT, last/JJ, one/CD, back/RB, up/RB, and/CC, I/PRP, got/VBD, up/RB, there/RB, ,/,, still/RB, got/VBD, a/DT, little/JJ, bit/NN, of/IN, to/TO, do/VB, and/CC, they/PRP, got/VBD, more/JJR, than/IN, they/PRP, did/VBD]","(ROOT (S (S (NP (PRP I)) (VP (MD can) (NP (PRP 't)) (S (VP (VB do) (SBAR (WHNP (DT that)) (S (NP (PRP I)) (VP (VBP tell) (NP (PRP you))))))))) (, ,) (S (NP (PRP I)) (VP (VBP mean) (S (NP (PRP I)) (VP (VB don) (S (NP (PRP 't)) (VP (VB mind) (, ,) (S (NP (NNP don) (PRP 't)) (VP (VB get) (S (NP (PRP me)) (ADJP (JJ wrong)) (SBAR (S (NP (PRP it)) (VP (VBZ 's) (ADVP (RB just)) (SBAR (SBAR (IN that) (S (NP (PRP I)) (VP (VBD was) (NP (DT the) (JJ last) (CD one)) (ADVP (RB back) (RB up))))) (CC and) (SBAR (S (NP (PRP I)) (VP (VBD got) (ADVP (RB up) (RB there))))) (, ,) (S (ADVP (RB still)) (VP (VBD got) (NP (NP (DT a) (JJ little) (NN bit)) (PP (IN of) (NP (S (VP (TO to) (VP (VB do)))))))))))))))))))))) (CC and) (S (NP (PRP they)) (VP (VBD got) (NP (JJR more)) (SBAR (IN than) (S (NP (PRP they)) (VP (VBD did))))))))"
K/KD/KDK.xml,KDKRE00G,16803,43,,A,27,5,--and they got more  (()) than they did ,"[I/PRP, can/MD, 't/PRP, do/VB, that/DT, I/PRP, tell/VBP, you/PRP, ,/,, I/PRP, mean/VBP, I/PRP, don/VB, 't/PRP, mind/VB, ,/,, don/NNP, 't/PRP, get/VB, me/PRP, wrong/JJ, it/PRP, 's/VBZ, just/RB, that/IN, I/PRP, was/VBD, the/DT, last/JJ, one/CD, back/RB, up/RB, and/CC, I/PRP, got/VBD, up/RB, there/RB, ,/,, still/RB, got/VBD, a/DT, little/JJ, bit/NN, of/IN, to/TO, do/VB, and/CC, they/PRP, got/VBD, more/JJR, than/IN, they/PRP, did/VBD]","(ROOT (S (S (NP (PRP I)) (VP (MD can) (NP (PRP 't)) (S (VP (VB do) (SBAR (WHNP (DT that)) (S (NP (PRP I)) (VP (VBP tell) (NP (PRP you))))))))) (, ,) (S (NP (PRP I)) (VP (VBP mean) (S (NP (PRP I)) (VP (VB don) (S (NP (PRP 't)) (VP (VB mind) (, ,) (S (NP (NNP don) (PRP 't)) (VP (VB get) (S (NP (PRP me)) (ADJP (JJ wrong)) (SBAR (S (NP (PRP it)) (VP (VBZ 's) (ADVP (RB just)) (SBAR (SBAR (IN that) (S (NP (PRP I)) (VP (VBD was) (NP (DT the) (JJ last) (CD one)) (ADVP (RB back) (RB up))))) (CC and) (SBAR (S (NP (PRP I)) (VP (VBD got) (ADVP (RB up) (RB there))))) (, ,) (S (ADVP (RB still)) (VP (VBD got) (NP (NP (DT a) (JJ little) (NN bit)) (PP (IN of) (NP (S (VP (TO to) (VP (VB do)))))))))))))))))))))) (CC and) (S (NP (PRP they)) (VP (VBD got) (NP (JJR more)) (SBAR (IN than) (S (NP (PRP they)) (VP (VBD did))))))))"
K/KD/KDK.xml,KDKRE00G,16803,44,,B,28,1,Oh yeah.,"[Oh/UH, yeah/UH, ./.]",(ROOT (S (INTJ (UH Oh)) (VP (UH yeah)) (. .)))
K/KD/KDK.xml,KDKRE00G,16803,45,,A,29,1,"(()) right, see you  --","[right/NN, ,/,, see/VBP, you/PRP]","(ROOT (FRAG (NP (NP (NN right)) (SBAR (S (, ,) (VP (VBP see) (NP (PRP you))))))))"
K/KD/KDK.xml,KDKRE00G,16803,46,,A,29,2,--(()) ,"[right/NN, ,/,, see/VBP, you/PRP]","(ROOT (FRAG (NP (NP (NN right)) (SBAR (S (, ,) (VP (VBP see) (NP (PRP you))))))))"
K/KD/KDK.xml,KDKRE00G,16803,47,,B,30,1,"Yeah, oh yeah, I know.","[Yeah/UH, ,/,, oh/UH, yeah/UH, ,/,, I/PRP, know/VBP, ./.]","(ROOT (S (INTJ (UH Yeah) (, ,) (UH oh)) (INTJ (UH yeah)) (, ,) (NP (PRP I)) (VP (VBP know)) (. .)))"
K/KD/KDK.xml,KDKRE00G,16803,48,,A,31,1,I mean  --,"[I/PRP, mean/VBP, okay/JJ, so/IN, I/PRP, thought/VBD, ah/NN, I/PRP, don/VBP, 't/PRP, give/VB, a/DT, shit/NN, you/PRP, know/VBP, ,/,, I/PRP, mean/VBP, but/CC, I/PRP, was/VBD, only/RB, like/IN, two/CD, minutes/NNS, behind/IN, ./.]","(ROOT (S (S (NP (PRP I)) (VP (VBP mean) (ADJP (JJ okay) (SBAR (IN so) (S (NP (PRP I)) (VP (VBD thought) (SBAR (S (NP (NP (NN ah)) (SBAR (S (NP (PRP I)) (VP (VBP don) (S (NP (PRP 't)) (VP (VB give) (NP (DT a) (NN shit)) (NP (PRP you)))))))) (VP (VBP know)))))))))) (, ,) (NP (PRP I)) (VP (VBP mean) (SBAR (CC but) (S (NP (PRP I)) (VP (VBD was) (ADVP (RB only)) (PP (IN like) (ADVP (NP (CD two) (NNS minutes)) (IN behind))))))) (. .)))"
K/KD/KDK.xml,KDKRE00G,16803,49,,A,31,2,--okay so I thought ah  --,"[I/PRP, mean/VBP, okay/JJ, so/IN, I/PRP, thought/VBD, ah/NN, I/PRP, don/VBP, 't/PRP, give/VB, a/DT, shit/NN, you/PRP, know/VBP, ,/,, I/PRP, mean/VBP, but/CC, I/PRP, was/VBD, only/RB, like/IN, two/CD, minutes/NNS, behind/IN, ./.]","(ROOT (S (S (NP (PRP I)) (VP (VBP mean) (ADJP (JJ okay) (SBAR (IN so) (S (NP (PRP I)) (VP (VBD thought) (SBAR (S (NP (NP (NN ah)) (SBAR (S (NP (PRP I)) (VP (VBP don) (S (NP (PRP 't)) (VP (VB give) (NP (DT a) (NN shit)) (NP (PRP you)))))))) (VP (VBP know)))))))))) (, ,) (NP (PRP I)) (VP (VBP mean) (SBAR (CC but) (S (NP (PRP I)) (VP (VBD was) (ADVP (RB only)) (PP (IN like) (ADVP (NP (CD two) (NNS minutes)) (IN behind))))))) (. .)))"
K/KD/KDK.xml,KDKRE00G,16803,50,,A,31,3,"--I don't give a shit you know, I mean  --","[I/PRP, mean/VBP, okay/JJ, so/IN, I/PRP, thought/VBD, ah/NN, I/PRP, don/VBP, 't/PRP, give/VB, a/DT, shit/NN, you/PRP, know/VBP, ,/,, I/PRP, mean/VBP, but/CC, I/PRP, was/VBD, only/RB, like/IN, two/CD, minutes/NNS, behind/IN, ./.]","(ROOT (S (S (NP (PRP I)) (VP (VBP mean) (ADJP (JJ okay) (SBAR (IN so) (S (NP (PRP I)) (VP (VBD thought) (SBAR (S (NP (NP (NN ah)) (SBAR (S (NP (PRP I)) (VP (VBP don) (S (NP (PRP 't)) (VP (VB give) (NP (DT a) (NN shit)) (NP (PRP you)))))))) (VP (VBP know)))))))))) (, ,) (NP (PRP I)) (VP (VBP mean) (SBAR (CC but) (S (NP (PRP I)) (VP (VBD was) (ADVP (RB only)) (PP (IN like) (ADVP (NP (CD two) (NNS minutes)) (IN behind))))))) (. .)))"
