swda_filename,ptb_basename,conversation_no,transcript_index,act_tag,caller,turn_index,subutterance_index,text,pos,trees
K/KB/KB7.xml,KB7RE01H,19202,118,,B,88,1,"Oh that's it, that's why they're coming down, that's why  (()) are quite pleased to see us dear, especially at this time of the year, not many people will buy Christmas time, think oh we'll wait and go and get Christmas over and the spring and ","[Oh/UH, that/DT, 's/VBZ, it/PRP, ,/,, that/DT, 's/VBZ, why/WRB, they/PRP, 're/VBP, coming/VBG, down/RB, ,/,, that/DT, 's/VBZ, why/WRB, are/VBP, quite/RB, pleased/JJ, to/TO, see/VB, us/PRP, dear/RB, ,/,, especially/RB, at/IN, this/DT, time/NN, of/IN, the/DT, year/NN, ,/,, not/RB, many/JJ, people/NNS, will/MD, buy/VB, Christmas/NNP, time/NNP, ,/,, think/VBP, oh/UH, we/PRP, 'll/MD, wait/VB, and/CC, go/VB, and/CC, get/VB, Christmas/NNP, over/IN, and/CC, the/DT, spring/NN, and/CC]","(ROOT (S (S (INTJ (UH Oh)) (NP (DT that)) (VP (VBZ 's) (NP (PRP it)))) (, ,) (S (NP (DT that)) (VP (VBZ 's) (SBAR (WHADVP (WRB why)) (S (NP (PRP they)) (VP (VBP 're) (VP (VBG coming) (ADVP (RB down)))))))) (, ,) (S (NP (DT that)) (VP (VBZ 's) (SBAR (WHADVP (WRB why)) (S (VP (VBP are) (ADJP (RB quite) (JJ pleased) (S (VP (TO to) (VP (VB see) (S (NP (PRP us)) (ADJP (RB dear)))))))))))) (, ,) (S (PP (RB especially) (PP (IN at) (NP (NP (DT this) (NN time)) (PP (IN of) (NP (DT the) (NN year)))))) (, ,) (SBAR (RB not) (S (NP (JJ many) (NNS people)) (VP (MD will) (VP (VB buy) (NP (NNP Christmas) (NNP time)))))) (, ,) (VP (VBP think) (SBAR (S (INTJ (UH oh)) (NP (PRP we)) (VP (MD 'll) (VP (VB wait))))))) (CC and) (S (S (VP (VB go))) (CC and) (S (VP (VB get) (S (S (NP (NNP Christmas)) (ADJP (IN over))) (CC and) (S (NP (DT the) (NN spring)) (NP (CC and)))))))))"
K/KB/KB7.xml,KB7RE01H,19202,119,,A,89,1,"I think looking at the market you can, you can get a, erm detached, semi-detached sort of one you know one bedroom I suppose,","[I/PRP, think/VBP, looking/VBG, at/IN, the/DT, market/NN, you/PRP, can/MD, ,/,, you/PRP, can/MD, get/VB, a/DT, ,/,, erm/NN, detached/VBD, ,/,, semi-detached/JJ, sort/NN, of/IN, one/CD, you/PRP, know/VBP, one/CD, bedroom/NN, I/PRP, suppose/VBP, ,/,]","(ROOT (S (NP (PRP I)) (VP (VBP think) (S (VP (VBG looking) (PP (IN at) (NP (NP (DT the) (NN market)) (SBAR (S (S (NP (PRP you)) (VP (MD can))) (, ,) (S (NP (PRP you)) (VP (MD can) (VP (VB get) (NP (DT a))))) (, ,) (S (NP (NN erm)) (VP (VBD detached))) (, ,) (S (NP (NP (JJ semi-detached) (NN sort)) (PP (IN of) (NP (CD one)))) (NP (PRP you)) (VP (VBP know) (NP (NP (CD one) (NN bedroom)) (SBAR (S (NP (PRP I)) (VP (VBP suppose)))))))))))))) (, ,)))"
K/KB/KB7.xml,KB7RE01H,19202,120,,B,90,1,You can get two bedroom,"[You/PRP, can/MD, get/VB, two/CD, bedroom/NN]",(ROOT (S (NP (PRP You)) (VP (MD can) (VP (VB get) (NP (CD two) (NN bedroom))))))
K/KB/KB7.xml,KB7RE01H,19202,121,,A,91,1,"two bedroom at a push for about thirty four, thirty five, thirty six, thirty seven,","[two/CD, bedroom/NN, at/IN, a/DT, push/NN, for/IN, about/IN, thirty/CD, four/CD, ,/,, thirty/CD, five/CD, ,/,, thirty/CD, six/CD, ,/,, thirty/CD, seven/CD, ,/,]","(ROOT (FRAG (ADJP (ADJP (CD two) (NN bedroom)) (PP (IN at) (NP (DT a) (NN push))) (PP (IN for) (PP (IN about) (NP (CD thirty) (CD four))))) (, ,) (NP (NP (CD thirty) (CD five)) (, ,) (NP (CD thirty) (CD six)) (, ,) (NP (NP (CD thirty)) (NP (CD seven))) (, ,))))"
K/KB/KB7.xml,KB7RE01H,19202,122,,B,92,1,(()) ,[],X
K/KB/KB7.xml,KB7RE01H,19202,123,,A,93,1,"oh I don't know, I don't know, I think it will be a while getting rid of it yes, but I think he might get his price eventually, but it will take a long while to get it (()) , it's up to him if he wants a quick sale,(()) --","[oh/UH, I/PRP, don/VBP, 't/PRP, know/VB, ,/,, I/PRP, don/VBP, 't/PRP, know/VB, ,/,, I/PRP, think/VBP, it/PRP, will/MD, be/VB, a/DT, while/NN, getting/VBG, rid/JJ, of/IN, it/PRP, yes/RB, ,/,, but/CC, I/PRP, think/VBP, he/PRP, might/MD, get/VB, his/PRP$, price/NN, eventually/RB, ,/,, but/CC, it/PRP, will/MD, take/VB, a/DT, long/JJ, while/IN, to/TO, get/VB, it/PRP, ,/,, it/PRP, 's/VBZ, up/RB, to/TO, him/PRP, if/IN, he/PRP, wants/VBZ, a/DT, quick/JJ, sale/NN, ,/,, you/PRP, know/VBP, ,/,, thirty/CD, five/CD, yeah/UH, I/PRP, ,/,, thirty/CD, five/CD, thousand/CD, I/PRP, think/VBP, ,/,, as/IN, I/PRP, say/VBP, taking/VBG, everything/NN, into/IN, consideration/NN, ,/,, I/PRP, mean/VBP, ,/,, failing/VBG, three/CD, okay/JJ, I/PRP, know/VBP, I/PRP, did/VBD, the/DT, thirty/CD, three/CD, so/IN, take/VB, thirty/CD, five/CD, ,/,, thirty/CD, three/CD, and/CC, a/DT, half/NN, ,/,, oh/UH, he/PRP, ain/FW, 't/PRP, got/VBD, much/RB, to/TO, worry/VB, about/IN]","(ROOT (S (S (INTJ (UH oh)) (NP (PRP I)) (VP (VBP don) (S (NP (PRP 't)) (VP (VB know))))) (, ,) (S (NP (PRP I)) (VP (VBP don) (S (NP (PRP 't)) (VP (VB know))))) (, ,) (S (NP (PRP I)) (VP (VBP think) (SBAR (S (NP (PRP it)) (VP (MD will) (VP (VB be) (NP (DT a) (NN while) (S (VP (VBG getting) (ADJP (JJ rid) (PP (IN of) (NP (PRP it)))) (NP (RB yes))))))))))) (, ,) (CC but) (S (NP (PRP I)) (VP (VBP think) (S (S (S (NP (PRP he)) (VP (MD might) (VP (VB get) (NP (PRP$ his) (NN price)) (ADVP (RB eventually))))) (, ,) (CC but) (S (NP (PRP it)) (VP (MD will) (VP (VB take) (NP (DT a) (JJ long)))))) (S (SBAR (IN while) (S (VP (TO to) (VP (VB get) (NP (PRP it)))))) (, ,) (NP (PRP it)) (VP (VBZ 's) (ADVP (RB up) (PP (TO to) (NP (PRP him)))))) (S (SBAR (IN if) (S (NP (PRP he)) (VP (VBZ wants) (NP (DT a) (JJ quick) (NN sale))))) (, ,) (NP (PRP you)) (VP (VBP know) (, ,) (NP (CD thirty) (CD five)) (PP (NP (UH yeah)) (NP (NP (PRP I)) (, ,) (NP (NP (CD thirty)) (NP (QP (CD five) (CD thousand)))))))) (S (NP (PRP I)) (VP (VBP think)))) (, ,) (SBAR (IN as) (S (NP (PRP I)) (VP (VBP say) (S (VP (VP (VBG taking) (NP (NN everything)) (PP (IN into) (NP (NN consideration))) (, ,) (S (NP (PRP I)) (VP (VBP mean)))) (, ,) (VP (VBG failing) (NP (CD three)) (S (ADJP (JJ okay)) (SBAR (S (NP (PRP I)) (VP (VBP know) (SBAR (S (NP (PRP I)) (VP (VBD did) (SBAR (S (NP (DT the) (CD thirty)) (ADVP (NP (CD three)) (IN so)) (VP (VB take) (NP (NP (CD thirty) (CD five)) (, ,) (NP (CD thirty) (CD three)) (CC and) (NP (DT a) (NN half)))))))))))))) (, ,) (NP (INTJ (UH oh)) (NP (PRP he))))) (NP (NP (FW ain)) (SBAR (S (NP (PRP 't)) (VP (VBD got) (NP (RB much)) (S (VP (TO to) (VP (VB worry) (PP (IN about))))))))))))))))"
K/KB/KB7.xml,KB7RE01H,19202,124,,A,93,2,"--you know, thirty five yeah I, thirty five thousand I think (()) , as I say taking everything into consideration, I mean, failing three okay I know I did the  (()) thirty three  --","[oh/UH, I/PRP, don/VBP, 't/PRP, know/VB, ,/,, I/PRP, don/VBP, 't/PRP, know/VB, ,/,, I/PRP, think/VBP, it/PRP, will/MD, be/VB, a/DT, while/NN, getting/VBG, rid/JJ, of/IN, it/PRP, yes/RB, ,/,, but/CC, I/PRP, think/VBP, he/PRP, might/MD, get/VB, his/PRP$, price/NN, eventually/RB, ,/,, but/CC, it/PRP, will/MD, take/VB, a/DT, long/JJ, while/IN, to/TO, get/VB, it/PRP, ,/,, it/PRP, 's/VBZ, up/RB, to/TO, him/PRP, if/IN, he/PRP, wants/VBZ, a/DT, quick/JJ, sale/NN, ,/,, you/PRP, know/VBP, ,/,, thirty/CD, five/CD, yeah/UH, I/PRP, ,/,, thirty/CD, five/CD, thousand/CD, I/PRP, think/VBP, ,/,, as/IN, I/PRP, say/VBP, taking/VBG, everything/NN, into/IN, consideration/NN, ,/,, I/PRP, mean/VBP, ,/,, failing/VBG, three/CD, okay/JJ, I/PRP, know/VBP, I/PRP, did/VBD, the/DT, thirty/CD, three/CD, so/IN, take/VB, thirty/CD, five/CD, ,/,, thirty/CD, three/CD, and/CC, a/DT, half/NN, ,/,, oh/UH, he/PRP, ain/FW, 't/PRP, got/VBD, much/RB, to/TO, worry/VB, about/IN]","(ROOT (S (S (INTJ (UH oh)) (NP (PRP I)) (VP (VBP don) (S (NP (PRP 't)) (VP (VB know))))) (, ,) (S (NP (PRP I)) (VP (VBP don) (S (NP (PRP 't)) (VP (VB know))))) (, ,) (S (NP (PRP I)) (VP (VBP think) (SBAR (S (NP (PRP it)) (VP (MD will) (VP (VB be) (NP (DT a) (NN while) (S (VP (VBG getting) (ADJP (JJ rid) (PP (IN of) (NP (PRP it)))) (NP (RB yes))))))))))) (, ,) (CC but) (S (NP (PRP I)) (VP (VBP think) (S (S (S (NP (PRP he)) (VP (MD might) (VP (VB get) (NP (PRP$ his) (NN price)) (ADVP (RB eventually))))) (, ,) (CC but) (S (NP (PRP it)) (VP (MD will) (VP (VB take) (NP (DT a) (JJ long)))))) (S (SBAR (IN while) (S (VP (TO to) (VP (VB get) (NP (PRP it)))))) (, ,) (NP (PRP it)) (VP (VBZ 's) (ADVP (RB up) (PP (TO to) (NP (PRP him)))))) (S (SBAR (IN if) (S (NP (PRP he)) (VP (VBZ wants) (NP (DT a) (JJ quick) (NN sale))))) (, ,) (NP (PRP you)) (VP (VBP know) (, ,) (NP (CD thirty) (CD five)) (PP (NP (UH yeah)) (NP (NP (PRP I)) (, ,) (NP (NP (CD thirty)) (NP (QP (CD five) (CD thousand)))))))) (S (NP (PRP I)) (VP (VBP think)))) (, ,) (SBAR (IN as) (S (NP (PRP I)) (VP (VBP say) (S (VP (VP (VBG taking) (NP (NN everything)) (PP (IN into) (NP (NN consideration))) (, ,) (S (NP (PRP I)) (VP (VBP mean)))) (, ,) (VP (VBG failing) (NP (CD three)) (S (ADJP (JJ okay)) (SBAR (S (NP (PRP I)) (VP (VBP know) (SBAR (S (NP (PRP I)) (VP (VBD did) (SBAR (S (NP (DT the) (CD thirty)) (ADVP (NP (CD three)) (IN so)) (VP (VB take) (NP (NP (CD thirty) (CD five)) (, ,) (NP (CD thirty) (CD three)) (CC and) (NP (DT a) (NN half)))))))))))))) (, ,) (NP (INTJ (UH oh)) (NP (PRP he))))) (NP (NP (FW ain)) (SBAR (S (NP (PRP 't)) (VP (VBD got) (NP (RB much)) (S (VP (TO to) (VP (VB worry) (PP (IN about))))))))))))))))"
K/KB/KB7.xml,KB7RE01H,19202,125,,A,93,3,"--so take thirty five, thirty three and a half, oh  (()) he ain't got much to worry about ","[oh/UH, I/PRP, don/VBP, 't/PRP, know/VB, ,/,, I/PRP, don/VBP, 't/PRP, know/VB, ,/,, I/PRP, think/VBP, it/PRP, will/MD, be/VB, a/DT, while/NN, getting/VBG, rid/JJ, of/IN, it/PRP, yes/RB, ,/,, but/CC, I/PRP, think/VBP, he/PRP, might/MD, get/VB, his/PRP$, price/NN, eventually/RB, ,/,, but/CC, it/PRP, will/MD, take/VB, a/DT, long/JJ, while/IN, to/TO, get/VB, it/PRP, ,/,, it/PRP, 's/VBZ, up/RB, to/TO, him/PRP, if/IN, he/PRP, wants/VBZ, a/DT, quick/JJ, sale/NN, ,/,, you/PRP, know/VBP, ,/,, thirty/CD, five/CD, yeah/UH, I/PRP, ,/,, thirty/CD, five/CD, thousand/CD, I/PRP, think/VBP, ,/,, as/IN, I/PRP, say/VBP, taking/VBG, everything/NN, into/IN, consideration/NN, ,/,, I/PRP, mean/VBP, ,/,, failing/VBG, three/CD, okay/JJ, I/PRP, know/VBP, I/PRP, did/VBD, the/DT, thirty/CD, three/CD, so/IN, take/VB, thirty/CD, five/CD, ,/,, thirty/CD, three/CD, and/CC, a/DT, half/NN, ,/,, oh/UH, he/PRP, ain/FW, 't/PRP, got/VBD, much/RB, to/TO, worry/VB, about/IN]","(ROOT (S (S (INTJ (UH oh)) (NP (PRP I)) (VP (VBP don) (S (NP (PRP 't)) (VP (VB know))))) (, ,) (S (NP (PRP I)) (VP (VBP don) (S (NP (PRP 't)) (VP (VB know))))) (, ,) (S (NP (PRP I)) (VP (VBP think) (SBAR (S (NP (PRP it)) (VP (MD will) (VP (VB be) (NP (DT a) (NN while) (S (VP (VBG getting) (ADJP (JJ rid) (PP (IN of) (NP (PRP it)))) (NP (RB yes))))))))))) (, ,) (CC but) (S (NP (PRP I)) (VP (VBP think) (S (S (S (NP (PRP he)) (VP (MD might) (VP (VB get) (NP (PRP$ his) (NN price)) (ADVP (RB eventually))))) (, ,) (CC but) (S (NP (PRP it)) (VP (MD will) (VP (VB take) (NP (DT a) (JJ long)))))) (S (SBAR (IN while) (S (VP (TO to) (VP (VB get) (NP (PRP it)))))) (, ,) (NP (PRP it)) (VP (VBZ 's) (ADVP (RB up) (PP (TO to) (NP (PRP him)))))) (S (SBAR (IN if) (S (NP (PRP he)) (VP (VBZ wants) (NP (DT a) (JJ quick) (NN sale))))) (, ,) (NP (PRP you)) (VP (VBP know) (, ,) (NP (CD thirty) (CD five)) (PP (NP (UH yeah)) (NP (NP (PRP I)) (, ,) (NP (NP (CD thirty)) (NP (QP (CD five) (CD thousand)))))))) (S (NP (PRP I)) (VP (VBP think)))) (, ,) (SBAR (IN as) (S (NP (PRP I)) (VP (VBP say) (S (VP (VP (VBG taking) (NP (NN everything)) (PP (IN into) (NP (NN consideration))) (, ,) (S (NP (PRP I)) (VP (VBP mean)))) (, ,) (VP (VBG failing) (NP (CD three)) (S (ADJP (JJ okay)) (SBAR (S (NP (PRP I)) (VP (VBP know) (SBAR (S (NP (PRP I)) (VP (VBD did) (SBAR (S (NP (DT the) (CD thirty)) (ADVP (NP (CD three)) (IN so)) (VP (VB take) (NP (NP (CD thirty) (CD five)) (, ,) (NP (CD thirty) (CD three)) (CC and) (NP (DT a) (NN half)))))))))))))) (, ,) (NP (INTJ (UH oh)) (NP (PRP he))))) (NP (NP (FW ain)) (SBAR (S (NP (PRP 't)) (VP (VBD got) (NP (RB much)) (S (VP (TO to) (VP (VB worry) (PP (IN about))))))))))))))))"
K/KB/KB7.xml,KB7RE01H,19202,126,,B,94,1,Well,[Well/RB],(ROOT (INTJ (RB Well)))
K/KB/KB7.xml,KB7RE01H,19202,127,,A,95,1,(()) ,[],X
K/KB/KB7.xml,KB7RE01H,19202,128,,B,96,1,I'd better get some clothies on  --,"[I/PRP, 'd/MD, better/RB, get/VB, some/DT, clothies/NNS, on/IN, cause/NN, a/DT, bit/NN, of/IN, a/DT, stir/VB, round/NN, the/DT, estate/NN, agents/NNS, ,/,, naked/JJ, from/IN, the/DT, waist/NN, down/RB, ,/,, darling/NN]","(ROOT (S (NP (PRP I)) (VP (MD 'd) (ADVP (RB better)) (VP (VB get) (NP (NP (DT some) (NNS clothies)) (PP (IN on) (NP (NP (NN cause)) (NP (DT a) (NN bit)))) (PP (IN of) (NP (DT a) (S (VP (VB stir) (S (NP (NN round)) (NP (NP (DT the) (NN estate) (NNS agents)) (, ,) (ADJP (JJ naked) (PP (IN from) (ADVP (NP (DT the) (NN waist)) (RB down)))) (, ,))))) (NN darling))))))))"
K/KB/KB7.xml,KB7RE01H,19202,129,,B,96,2,"--cause a bit of a stir round the estate agents (()) , naked from the waist down,(()) darling","[I/PRP, 'd/MD, better/RB, get/VB, some/DT, clothies/NNS, on/IN, cause/NN, a/DT, bit/NN, of/IN, a/DT, stir/VB, round/NN, the/DT, estate/NN, agents/NNS, ,/,, naked/JJ, from/IN, the/DT, waist/NN, down/RB, ,/,, darling/NN]","(ROOT (S (NP (PRP I)) (VP (MD 'd) (ADVP (RB better)) (VP (VB get) (NP (NP (DT some) (NNS clothies)) (PP (IN on) (NP (NP (NN cause)) (NP (DT a) (NN bit)))) (PP (IN of) (NP (DT a) (S (VP (VB stir) (S (NP (NN round)) (NP (NP (DT the) (NN estate) (NNS agents)) (, ,) (ADJP (JJ naked) (PP (IN from) (ADVP (NP (DT the) (NN waist)) (RB down)))) (, ,))))) (NN darling))))))))"
K/KB/KB7.xml,KB7RE01H,19202,130,,A,97,1,(()) ,[],X
K/KB/KB7.xml,KB7RE01H,19202,131,,B,98,1,What  (()) that's ten minutes slow   (()) --,"[What/WDT, that/DT, 's/VBZ, ten/CD, minutes/NNS, slow/JJ, Just/RB, a-f-bout/JJ, done/VBN, all/DT, your/PRP$, paper/NN, work/NN, on/IN, them/PRP, teams/NNS]",(ROOT (SBAR (WHNP (WDT What)) (S (NP (DT that)) (VP (VBZ 's) (ADJP (NP (CD ten) (NNS minutes)) (JJ slow)) (NP (NP (RB Just) (JJ a-f-bout)) (VP (VBN done) (S (NP (DT all)) (NP (NP (PRP$ your) (NN paper) (NN work)) (PP (IN on) (NP (PRP them) (NNS teams)))))))))))
K/KB/KB7.xml,KB7RE01H,19202,132,,B,98,2,--Just a-f-bout done all your paper work on them teams,"[What/WDT, that/DT, 's/VBZ, ten/CD, minutes/NNS, slow/JJ, Just/RB, a-f-bout/JJ, done/VBN, all/DT, your/PRP$, paper/NN, work/NN, on/IN, them/PRP, teams/NNS]",(ROOT (SBAR (WHNP (WDT What)) (S (NP (DT that)) (VP (VBZ 's) (ADJP (NP (CD ten) (NNS minutes)) (JJ slow)) (NP (NP (RB Just) (JJ a-f-bout)) (VP (VBN done) (S (NP (DT all)) (NP (NP (PRP$ your) (NN paper) (NN work)) (PP (IN on) (NP (PRP them) (NNS teams)))))))))))
K/KB/KB7.xml,KB7RE01H,19202,133,,A,99,1,I know.,"[I/PRP, know/VBP, ./.]",(ROOT (S (NP (PRP I)) (VP (VBP know)) (. .)))
K/KB/KB7.xml,KB7RE01H,19202,134,,B,100,1,got a  (()) he's coming tomorrow  --,"[got/VBD, a/DT, he/PRP, 's/VBZ, coming/VBG, tomorrow/NN, you/PRP, know/VBP, ,/,, got/VBD, the/DT, bird/NN, as/RB, well/RB, ain/IN, 't/PRP, we/PRP, ,/,, that/DT, 's/VBZ, why/WRB, I/PRP, got/VBD, up/RB, early/JJ, to/TO, I/PRP, ,/,, go/VB, through/IN, deeply/RB, objective/JJ, ./.]","(ROOT (SINV (S (S (VP (VBD got) (SBAR (S (NP (DT a) (PRP he)) (VP (VBZ 's) (VP (VBG coming) (NP (NN tomorrow)))))))) (NP (PRP you)) (VP (VBP know))) (, ,) (VP (VBD got) (NP (DT the) (NN bird)) (ADVP (ADVP (RB as) (RB well)) (PP (IN ain) (NP (PRP 't))))) (NP (NP (PRP we)) (, ,) (SBAR (WHNP (DT that)) (S (VP (VBZ 's) (SBAR (WHADVP (WRB why)) (S (NP (PRP I)) (VP (VBD got) (ADVP (RB up) (JJ early) (PP (TO to) (NP (PRP I)))) (, ,) (S (VP (VB go) (PRT (IN through)) (NP (RB deeply) (JJ objective))))))))))) (. .)))"
K/KB/KB7.xml,KB7RE01H,19202,135,,B,100,2,"--you know, got the bird  (()) as well ain't we, that's why I got up early to I, go through  --","[got/VBD, a/DT, he/PRP, 's/VBZ, coming/VBG, tomorrow/NN, you/PRP, know/VBP, ,/,, got/VBD, the/DT, bird/NN, as/RB, well/RB, ain/IN, 't/PRP, we/PRP, ,/,, that/DT, 's/VBZ, why/WRB, I/PRP, got/VBD, up/RB, early/JJ, to/TO, I/PRP, ,/,, go/VB, through/IN, deeply/RB, objective/JJ, ./.]","(ROOT (SINV (S (S (VP (VBD got) (SBAR (S (NP (DT a) (PRP he)) (VP (VBZ 's) (VP (VBG coming) (NP (NN tomorrow)))))))) (NP (PRP you)) (VP (VBP know))) (, ,) (VP (VBD got) (NP (DT the) (NN bird)) (ADVP (ADVP (RB as) (RB well)) (PP (IN ain) (NP (PRP 't))))) (NP (NP (PRP we)) (, ,) (SBAR (WHNP (DT that)) (S (VP (VBZ 's) (SBAR (WHADVP (WRB why)) (S (NP (PRP I)) (VP (VBD got) (ADVP (RB up) (JJ early) (PP (TO to) (NP (PRP I)))) (, ,) (S (VP (VB go) (PRT (IN through)) (NP (RB deeply) (JJ objective))))))))))) (. .)))"
K/KB/KB7.xml,KB7RE01H,19202,136,,B,100,3,--deeply objective.,"[got/VBD, a/DT, he/PRP, 's/VBZ, coming/VBG, tomorrow/NN, you/PRP, know/VBP, ,/,, got/VBD, the/DT, bird/NN, as/RB, well/RB, ain/IN, 't/PRP, we/PRP, ,/,, that/DT, 's/VBZ, why/WRB, I/PRP, got/VBD, up/RB, early/JJ, to/TO, I/PRP, ,/,, go/VB, through/IN, deeply/RB, objective/JJ, ./.]","(ROOT (SINV (S (S (VP (VBD got) (SBAR (S (NP (DT a) (PRP he)) (VP (VBZ 's) (VP (VBG coming) (NP (NN tomorrow)))))))) (NP (PRP you)) (VP (VBP know))) (, ,) (VP (VBD got) (NP (DT the) (NN bird)) (ADVP (ADVP (RB as) (RB well)) (PP (IN ain) (NP (PRP 't))))) (NP (NP (PRP we)) (, ,) (SBAR (WHNP (DT that)) (S (VP (VBZ 's) (SBAR (WHADVP (WRB why)) (S (NP (PRP I)) (VP (VBD got) (ADVP (RB up) (JJ early) (PP (TO to) (NP (PRP I)))) (, ,) (S (VP (VB go) (PRT (IN through)) (NP (RB deeply) (JJ objective))))))))))) (. .)))"
K/KB/KB7.xml,KB7RE01H,19202,137,,A,101,1,"Why, what's been (()) ","[Why/WRB, ,/,, what/WP, 's/VBZ, been/VBN]","(ROOT (SBARQ (WHADVP (WRB Why)) (, ,) (WHNP (WP what)) (SQ (VBZ 's) (VP (VBN been)))))"
K/KB/KB7.xml,KB7RE01H,19202,138,,B,102,1,"(()) it's completely anonymous number you know it's only  (()) to be on that, said I'll wipe it off then, you bloody well won't, I think he wants to tell people before he can say  (()) very wrong, could say something personal,(()) if it was personal, no longer it, no you weren't  (()) personal to you, but I'm quite happy to arrange it if you wish, no, no, no, no, no,(()) , I shouldn't have to tell you not to take my points in full, there we go   <laugh> --","[it/PRP, 's/VBZ, completely/RB, anonymous/JJ, number/NN, you/PRP, know/VBP, it/PRP, 's/VBZ, only/RB, to/TO, be/VB, on/IN, that/DT, ,/,, said/VBD, I/PRP, 'll/MD, wipe/VB, it/PRP, off/RP, then/RB, ,/,, you/PRP, bloody/JJ, well/RB, won/VBN, 't/PRP, ,/,, I/PRP, think/VBP, he/PRP, wants/VBZ, to/TO, tell/VB, people/NNS, before/IN, he/PRP, can/MD, say/VB, very/RB, wrong/JJ, ,/,, could/MD, say/VB, something/NN, personal/JJ, ,/,, if/IN, it/PRP, was/VBD, personal/JJ, ,/,, no/RB, longer/RB, it/PRP, ,/,, no/DT, you/PRP, weren/VBP, 't/PRP, personal/JJ, to/TO, you/PRP, ,/,, but/CC, I/PRP, 'm/VBP, quite/RB, happy/JJ, to/TO, arrange/VB, it/PRP, if/IN, you/PRP, wish/VBP, ,/,, no/DT, ,/,, no/DT, ,/,, no/DT, ,/,, no/DT, ,/,, no/DT, ,/,, ,/,, I/PRP, shouldn/VBP, 't/PRP, have/VB, to/TO, tell/VB, you/PRP, not/RB, to/TO, take/VB, my/PRP$, points/NNS, in/IN, full/JJ, ,/,, there/EX, we/PRP, go/VBP, it/PRP, 's/VBZ, driving/VBG, me/PRP, doing/VBG, that/IN, in/IN, the/DT, factory/NN, having/VBG, without/IN, people/NNS, 's/POS, permission/NN, ,/,, I/PRP, want/VBP, to/TO, know/VB, ,/,, I/PRP, ask/VBP, permission/NN, if/IN, I/PRP, 'd/MD, er/NN, wanted/VBD, to/TO, as/IN, a/DT, without/IN, being/VBG, asked/VBN, to/TO, do/VB, it/PRP, ,/,, I/PRP, would/MD, of/IN, gone/VBN, and/CC, seen/VBN, personnel/NNS, and/CC, asked/VBD, ,/,, I/PRP, would/MD, not/RB, of/IN, dreamed/VBN, of/IN, doing/VBG, it/PRP, in/IN, a/DT, work/NN, 's/POS, situation/NN, unless/IN, I/PRP, was/VBD, asked/VBN, ,/,, say/VB, anything/NN, personal/JJ, I/PRP, 'd/MD, turned/VBD, it/PRP, off/RP, not/RB, that/IN, it/PRP, ,/,, apart/RB, from/IN, me/PRP, and/CC, Stuart/NNP]","(X (PRP it) (VBZ 's) (RB completely) (JJ anonymous) (NN number) (PRP you) (VBP know) (PRP it) (VBZ 's) (RB only) (TO to) (VB be) (IN on) (DT that) (, ,) (VBD said) (PRP I) (MD 'll) (VB wipe) (PRP it) (RP off) (RB then) (, ,) (PRP you) (JJ bloody) (RB well) (VBN won) (PRP 't) (, ,) (PRP I) (VBP think) (PRP he) (VBZ wants) (TO to) (VB tell) (NNS people) (IN before) (PRP he) (MD can) (VB say) (RB very) (JJ wrong) (, ,) (MD could) (VB say) (NN something) (JJ personal) (, ,) (IN if) (PRP it) (VBD was) (JJ personal) (, ,) (RB no) (RB longer) (PRP it) (, ,) (DT no) (PRP you) (VBP weren) (PRP 't) (JJ personal) (TO to) (PRP you) (, ,) (CC but) (PRP I) (VBP 'm) (RB quite) (JJ happy) (TO to) (VB arrange) (PRP it) (IN if) (PRP you) (VBP wish) (, ,) (DT no) (, ,) (DT no) (, ,) (DT no) (, ,) (DT no) (, ,) (DT no) (, ,) (, ,) (PRP I) (VBP shouldn) (PRP 't) (VB have) (TO to) (VB tell) (PRP you) (RB not) (TO to) (VB take) (PRP$ my) (NNS points) (IN in) (JJ full) (, ,) (EX there) (PRP we) (VBP go) (PRP it) (VBZ 's) (VBG driving) (PRP me) (VBG doing) (IN that) (IN in) (DT the) (NN factory) (VBG having) (IN without) (NNS people) (POS 's) (NN permission) (, ,) (PRP I) (VBP want) (TO to) (VB know) (, ,) (PRP I) (VBP ask) (NN permission) (IN if) (PRP I) (MD 'd) (NN er) (VBD wanted) (TO to) (IN as) (DT a) (IN without) (VBG being) (VBN asked) (TO to) (VB do) (PRP it) (, ,) (PRP I) (MD would) (IN of) (VBN gone) (CC and) (VBN seen) (NNS personnel) (CC and) (VBD asked) (, ,) (PRP I) (MD would) (RB not) (IN of) (VBN dreamed) (IN of) (VBG doing) (PRP it) (IN in) (DT a) (NN work) (POS 's) (NN situation) (IN unless) (PRP I) (VBD was) (VBN asked) (, ,) (VB say) (NN anything) (JJ personal) (PRP I) (MD 'd) (VBD turned) (PRP it) (RP off) (RB not) (IN that) (PRP it) (, ,) (RB apart) (IN from) (PRP me) (CC and) (NNP Stuart))"
K/KB/KB7.xml,KB7RE01H,19202,139,,B,102,2,"--it's driving me doing that in the factory having without people's permission, I want to know, I  (()) ask permission if I'd er  --","[it/PRP, 's/VBZ, completely/RB, anonymous/JJ, number/NN, you/PRP, know/VBP, it/PRP, 's/VBZ, only/RB, to/TO, be/VB, on/IN, that/DT, ,/,, said/VBD, I/PRP, 'll/MD, wipe/VB, it/PRP, off/RP, then/RB, ,/,, you/PRP, bloody/JJ, well/RB, won/VBN, 't/PRP, ,/,, I/PRP, think/VBP, he/PRP, wants/VBZ, to/TO, tell/VB, people/NNS, before/IN, he/PRP, can/MD, say/VB, very/RB, wrong/JJ, ,/,, could/MD, say/VB, something/NN, personal/JJ, ,/,, if/IN, it/PRP, was/VBD, personal/JJ, ,/,, no/RB, longer/RB, it/PRP, ,/,, no/DT, you/PRP, weren/VBP, 't/PRP, personal/JJ, to/TO, you/PRP, ,/,, but/CC, I/PRP, 'm/VBP, quite/RB, happy/JJ, to/TO, arrange/VB, it/PRP, if/IN, you/PRP, wish/VBP, ,/,, no/DT, ,/,, no/DT, ,/,, no/DT, ,/,, no/DT, ,/,, no/DT, ,/,, ,/,, I/PRP, shouldn/VBP, 't/PRP, have/VB, to/TO, tell/VB, you/PRP, not/RB, to/TO, take/VB, my/PRP$, points/NNS, in/IN, full/JJ, ,/,, there/EX, we/PRP, go/VBP, it/PRP, 's/VBZ, driving/VBG, me/PRP, doing/VBG, that/IN, in/IN, the/DT, factory/NN, having/VBG, without/IN, people/NNS, 's/POS, permission/NN, ,/,, I/PRP, want/VBP, to/TO, know/VB, ,/,, I/PRP, ask/VBP, permission/NN, if/IN, I/PRP, 'd/MD, er/NN, wanted/VBD, to/TO, as/IN, a/DT, without/IN, being/VBG, asked/VBN, to/TO, do/VB, it/PRP, ,/,, I/PRP, would/MD, of/IN, gone/VBN, and/CC, seen/VBN, personnel/NNS, and/CC, asked/VBD, ,/,, I/PRP, would/MD, not/RB, of/IN, dreamed/VBN, of/IN, doing/VBG, it/PRP, in/IN, a/DT, work/NN, 's/POS, situation/NN, unless/IN, I/PRP, was/VBD, asked/VBN, ,/,, say/VB, anything/NN, personal/JJ, I/PRP, 'd/MD, turned/VBD, it/PRP, off/RP, not/RB, that/IN, it/PRP, ,/,, apart/RB, from/IN, me/PRP, and/CC, Stuart/NNP]","(X (PRP it) (VBZ 's) (RB completely) (JJ anonymous) (NN number) (PRP you) (VBP know) (PRP it) (VBZ 's) (RB only) (TO to) (VB be) (IN on) (DT that) (, ,) (VBD said) (PRP I) (MD 'll) (VB wipe) (PRP it) (RP off) (RB then) (, ,) (PRP you) (JJ bloody) (RB well) (VBN won) (PRP 't) (, ,) (PRP I) (VBP think) (PRP he) (VBZ wants) (TO to) (VB tell) (NNS people) (IN before) (PRP he) (MD can) (VB say) (RB very) (JJ wrong) (, ,) (MD could) (VB say) (NN something) (JJ personal) (, ,) (IN if) (PRP it) (VBD was) (JJ personal) (, ,) (RB no) (RB longer) (PRP it) (, ,) (DT no) (PRP you) (VBP weren) (PRP 't) (JJ personal) (TO to) (PRP you) (, ,) (CC but) (PRP I) (VBP 'm) (RB quite) (JJ happy) (TO to) (VB arrange) (PRP it) (IN if) (PRP you) (VBP wish) (, ,) (DT no) (, ,) (DT no) (, ,) (DT no) (, ,) (DT no) (, ,) (DT no) (, ,) (, ,) (PRP I) (VBP shouldn) (PRP 't) (VB have) (TO to) (VB tell) (PRP you) (RB not) (TO to) (VB take) (PRP$ my) (NNS points) (IN in) (JJ full) (, ,) (EX there) (PRP we) (VBP go) (PRP it) (VBZ 's) (VBG driving) (PRP me) (VBG doing) (IN that) (IN in) (DT the) (NN factory) (VBG having) (IN without) (NNS people) (POS 's) (NN permission) (, ,) (PRP I) (VBP want) (TO to) (VB know) (, ,) (PRP I) (VBP ask) (NN permission) (IN if) (PRP I) (MD 'd) (NN er) (VBD wanted) (TO to) (IN as) (DT a) (IN without) (VBG being) (VBN asked) (TO to) (VB do) (PRP it) (, ,) (PRP I) (MD would) (IN of) (VBN gone) (CC and) (VBN seen) (NNS personnel) (CC and) (VBD asked) (, ,) (PRP I) (MD would) (RB not) (IN of) (VBN dreamed) (IN of) (VBG doing) (PRP it) (IN in) (DT a) (NN work) (POS 's) (NN situation) (IN unless) (PRP I) (VBD was) (VBN asked) (, ,) (VB say) (NN anything) (JJ personal) (PRP I) (MD 'd) (VBD turned) (PRP it) (RP off) (RB not) (IN that) (PRP it) (, ,) (RB apart) (IN from) (PRP me) (CC and) (NNP Stuart))"
