swda_filename,ptb_basename,conversation_no,transcript_index,act_tag,caller,turn_index,subutterance_index,text,pos,trees
K/KB/KBF.xml,KBFRE005,15006,0,,A,1,1,At this work experience (()) .,"[At/IN, this/DT, work/NN, experience/NN, ./.]",(ROOT (FRAG (PP (IN At) (NP (DT this) (NN work) (NN experience))) (. .)))
K/KB/KBF.xml,KBFRE005,15006,1,,B,2,1,In (()) .,"[In/IN, ./.]",(ROOT (FRAG (PP (IN In)) (. .)))
K/KB/KBF.xml,KBFRE005,15006,2,,A,3,1,Do they?,"[Do/VB, they/PRP, ?/.]",(ROOT (SQ (VP (VB Do) (NP (PRP they))) (. ?)))
K/KB/KBF.xml,KBFRE005,15006,3,,B,4,1,I asked for some once.,"[I/PRP, asked/VBD, for/IN, some/DT, once/RB, ./.]",(ROOT (S (NP (PRP I)) (VP (VBD asked) (PP (IN for) (NP (DT some))) (ADVP (RB once))) (. .)))
K/KB/KBF.xml,KBFRE005,15006,4,,A,5,1,You did?,"[You/PRP, did/VBD, ?/.]",(ROOT (S (NP (PRP You)) (VP (VBD did)) (. ?)))
K/KB/KBF.xml,KBFRE005,15006,5,,B,6,1,"No, I never pick up the phone, they do that, pick up one phone and speak for a minute, while that ones ringing they say hold on a minute, and pick up the other one.","[No/DT, ,/,, I/PRP, never/RB, pick/VBP, up/RP, the/DT, phone/NN, ,/,, they/PRP, do/VBP, that/IN, ,/,, pick/VB, up/RP, one/CD, phone/NN, and/CC, speak/VB, for/IN, a/DT, minute/NN, ,/,, while/IN, that/DT, ones/NNS, ringing/VBG, they/PRP, say/VBP, hold/VB, on/IN, a/DT, minute/NN, ,/,, and/CC, pick/VB, up/RP, the/DT, other/JJ, one/CD, ./.]","(ROOT (S (S (NP (DT No)) (, ,) (NP (PRP I)) (ADVP (RB never)) (VP (VBP pick) (PRT (RP up)) (NP (DT the) (NN phone)))) (, ,) (NP (PRP they)) (VP (VBP do) (SBAR (IN that) (, ,) (S (S (VP (VP (VB pick) (PRT (RP up)) (NP (CD one) (NN phone))) (CC and) (VP (VB speak) (PP (IN for) (NP (DT a) (NN minute))) (, ,) (SBAR (IN while) (S (NP (NP (DT that) (NNS ones)) (VP (VBG ringing) (NP (PRP they)))) (VP (VBP say) (VP (VB hold) (PP (IN on) (NP (DT a) (NN minute)))))))))) (, ,) (CC and) (S (VP (VB pick) (PRT (RP up)) (NP (DT the) (JJ other) (CD one))))))) (. .)))"
K/KB/KBF.xml,KBFRE005,15006,6,,A,7,1,What's it about then?,"[What/WP, 's/VBZ, it/PRP, about/IN, then/RB, ?/.]",(ROOT (SBARQ (WHNP (WP What)) (SQ (VBZ 's) (NP (PRP it)) (ADJP (IN about) (ADVP (RB then)))) (. ?)))
K/KB/KBF.xml,KBFRE005,15006,7,,B,8,1,"<cough> , it's only about this erm, I have to do the practice.","[,/,, it/PRP, 's/VBZ, only/RB, about/RB, this/DT, erm/NN, ,/,, I/PRP, have/VBP, to/TO, do/VB, the/DT, practice/NN, ./.]","(ROOT (PRN (, ,) (S (NP (PRP it)) (VP (VBZ 's) (NP (NP (RB only) (RB about)) (S (NP (DT this) (NN erm)) (, ,) (NP (PRP I)) (VP (VBP have) (S (VP (TO to) (VP (VB do) (NP (DT the) (NN practice)))))) (. .)))))))"
K/KB/KBF.xml,KBFRE005,15006,8,,A,9,1,Huh?,"[Huh/NNP, ?/.]",(ROOT (FRAG (NP (NNP Huh)) (. ?)))
K/KB/KBF.xml,KBFRE005,15006,9,,B,10,1,Have to do the practice.,"[Have/VB, to/TO, do/VB, the/DT, practice/NN, ./.]",(ROOT (S (VP (VB Have) (S (VP (TO to) (VP (VB do) (NP (DT the) (NN practice)))))) (. .)))
K/KB/KBF.xml,KBFRE005,15006,10,,A,11,1,Know how to do them now?,"[Know/VB, how/WRB, to/TO, do/VB, them/PRP, now/RB, ?/.]",(ROOT (SQ (VP (VB Know) (SBAR (WHADVP (WRB how)) (S (VP (TO to) (VP (VB do) (NP (PRP them)) (ADVP (RB now))))))) (. ?)))
K/KB/KBF.xml,KBFRE005,15006,11,,A,11,2,You should  (()) at Peter's.,"[You/PRP, should/MD, at/IN, Peter/NNP, 's/POS, ./.]",(ROOT (S (NP (PRP You)) (VP (MD should) (PP (IN at) (NP (NNP Peter) (POS 's)))) (. .)))
K/KB/KBF.xml,KBFRE005,15006,12,,B,12,1,I don't know Peter's (()) .,"[I/PRP, don/VBP, 't/PRP, know/VB, Peter/NNP, 's/POS, ./.]",(ROOT (S (NP (PRP I)) (VP (VBP don) (S (NP (PRP 't)) (VP (VB know) (S (NP (NNP Peter) (POS 's)))))) (. .)))
K/KB/KBF.xml,KBFRE005,15006,13,,A,13,1,"No, I don't actually.","[No/DT, ,/,, I/PRP, don/VBP, 't/PRP, actually/RB, ./.]","(ROOT (S (NP (DT No)) (, ,) (NP (PRP I)) (VP (VBP don) (NP (PRP 't)) (ADVP (RB actually))) (. .)))"
K/KB/KBF.xml,KBFRE005,15006,14,,B,14,1,Cos I don't know his  (()) can't do it.,"[Cos/NNP, I/NNP, don/NNP, 't/PRP, know/VB, his/PRP$, can/MD, 't/PRP, do/VB, it/PRP, ./.]",(ROOT (S (NP (NP (NNP Cos) (NNP I) (NNP don)) (SBAR (S (NP (PRP 't)) (VP (VB know) (NP (PRP$ his)))))) (VP (MD can) (NP (PRP 't)) (S (VP (VB do) (NP (PRP it))))) (. .)))
K/KB/KBF.xml,KBFRE005,15006,15,,A,15,1,Quit easy though isn't it?,"[Quit/VB, easy/NNP, though/NNP, isn/NNP, 't/PRP, it/PRP, ?/.]",(ROOT (SQ (VP (VB Quit) (S (NP (NP (NNP easy) (NNP though) (NNP isn)) (NP (PRP 't))) (NP (PRP it)))) (. ?)))
K/KB/KBF.xml,KBFRE005,15006,16,,B,16,1,"All you do is, stick it through, phone your number, push the button, it's gone through.","[All/DT, you/PRP, do/VBP, is/VBZ, ,/,, stick/VB, it/PRP, through/IN, ,/,, phone/NN, your/PRP$, number/NN, ,/,, push/VBP, the/DT, button/NN, ,/,, it/PRP, 's/VBZ, gone/VBN, through/IN, ./.]","(ROOT (S (S (NP (NP (DT All)) (SBAR (S (NP (PRP you)) (VP (VBP do))))) (VP (VP (VBZ is)) (, ,) (VP (VB stick) (NP (PRP it)) (PP (IN through))) (, ,) (VP (NN phone) (NP (PRP$ your) (NN number))) (, ,) (VP (VBP push) (NP (DT the) (NN button))))) (, ,) (NP (PRP it)) (VP (VBZ 's) (VP (VBN gone) (PP (IN through)))) (. .)))"
K/KB/KBF.xml,KBFRE005,15006,17,,B,16,2,I get fed up doing the (()) .,"[I/PRP, get/VBP, fed/VBN, up/RP, doing/VBG, the/DT, ./.]",(ROOT (S (NP (PRP I)) (VP (VBP get) (VP (VBN fed) (PRT (RP up)) (S (VP (VBG doing) (NP (DT the)))))) (. .)))
K/KB/KBF.xml,KBFRE005,15006,18,,A,17,1,"Yeah, but, even when you leave school that's what happens don't it?","[Yeah/UH, ,/,, but/CC, ,/,, even/RB, when/WRB, you/PRP, leave/VBP, school/NN, that/WDT, 's/VBZ, what/WP, happens/VBZ, don/NNP, 't/PRP, it/PRP, ?/.]","(ROOT (S (INTJ (UH Yeah)) (, ,) (ADVP (CC but)) (, ,) (SBAR (RB even) (WHADVP (WRB when)) (S (NP (PRP you)) (VP (VBP leave) (NP (NN school))))) (NP (WDT that)) (VP (VBZ 's) (SBAR (WHNP (WP what)) (S (VP (VBZ happens) (S (VP (NNP don) (S (NP (PRP 't)) (NP (PRP it))))))))) (. ?)))"
K/KB/KBF.xml,KBFRE005,15006,19,,A,17,2,"I, I mean you usually start off with the boy  (()) everybody has to start at the bottom,(()) .","[I/PRP, ,/,, I/PRP, mean/VBP, you/PRP, usually/RB, start/VBP, off/RP, with/IN, the/DT, boy/NN, everybody/NN, has/VBZ, to/TO, start/VB, at/IN, the/DT, bottom/NN, ,/,, ./.]","(ROOT (S (NP (PRP I)) (PRN (, ,) (S (NP (PRP I)) (VP (VBP mean) (SBAR (S (NP (PRP you)) (ADVP (RB usually)) (VP (VBP start) (PRT (RP off)) (PP (IN with) (NP (DT the) (NN boy) (NN everybody))))))))) (VP (VBZ has) (S (VP (TO to) (VP (VB start) (PP (IN at) (NP (DT the) (NN bottom)) (, ,)))))) (. .)))"
K/KB/KBF.xml,KBFRE005,15006,20,,B,18,1,(()) .,[./.],(ROOT (NP (. .)))
K/KB/KBF.xml,KBFRE005,15006,21,,A,19,1,"Mm, I'm sure.","[Mm/NN, ,/,, I/PRP, 'm/VBP, sure/JJ, ./.]","(ROOT (S (NP (NN Mm)) (, ,) (NP (PRP I)) (VP (VBP 'm) (ADJP (JJ sure))) (. .)))"
K/KB/KBF.xml,KBFRE005,15006,22,,B,20,1,<cough> ,[],
K/KB/KBF.xml,KBFRE005,15006,23,,A,21,1,You make yourself cough more by lying down there.,"[You/PRP, make/VBP, yourself/PRP, cough/VB, more/RBR, by/IN, lying/VBG, down/IN, there/RB, ./.]",(ROOT (S (NP (PRP You)) (VP (VBP make) (S (NP (PRP yourself)) (VP (VB cough) (ADVP (RBR more)) (PP (IN by) (S (VP (VBG lying) (ADVP (IN down) (RB there)))))))) (. .)))
