swda_filename,ptb_basename,conversation_no,transcript_index,act_tag,caller,turn_index,subutterance_index,text,pos,trees
K/KP/KPT.xml,KPTRE005,132406,0,,A,1,1,Fuck  --,"[Fuck/NN, would/MD, be/VB, good/JJ, one/CD, ./.]",(ROOT (S (NP (NN Fuck)) (VP (MD would) (VP (VB be) (ADJP (JJ good) (NP (CD one))))) (. .)))
K/KP/KPT.xml,KPTRE005,132406,1,,A,1,2,--would be good one.,"[Fuck/NN, would/MD, be/VB, good/JJ, one/CD, ./.]",(ROOT (S (NP (NN Fuck)) (VP (MD would) (VP (VB be) (ADJP (JJ good) (NP (CD one))))) (. .)))
K/KP/KPT.xml,KPTRE005,132406,2,,A,1,3,Everything's come out my bag.,"[Everything/NN, 's/POS, come/VBN, out/RP, my/PRP$, bag/NN, ./.]",(ROOT (NP (NP (NN Everything)) (SBAR (S (NP (POS 's)) (VP (VBN come) (PRT (RP out)) (NP (PRP$ my) (NN bag))))) (. .)))
K/KP/KPT.xml,KPTRE005,132406,3,,A,1,4,Bloody way!,"[Bloody/JJ, way/NN, !/.]",(ROOT (NP (JJ Bloody) (NN way) (. !)))
K/KP/KPT.xml,KPTRE005,132406,4,,A,1,5,Aargh!,"[Aargh/RB, !/.]",(ROOT (FRAG (ADVP (RB Aargh)) (. !)))
K/KP/KPT.xml,KPTRE005,132406,5,,B,2,1,Come on Peter  (()) get  --,"[Come/VB, on/IN, Peter/NNP, get/VB, on/IN, the/DT, bus/NN, ./.]",(ROOT (S (VP (VB Come) (PP (IN on) (NP (NNP Peter))) (S (VP (VB get) (PP (IN on) (NP (DT the) (NN bus)))))) (. .)))
K/KP/KPT.xml,KPTRE005,132406,6,,B,2,2,--on the bus.,"[Come/VB, on/IN, Peter/NNP, get/VB, on/IN, the/DT, bus/NN, ./.]",(ROOT (S (VP (VB Come) (PP (IN on) (NP (NNP Peter))) (S (VP (VB get) (PP (IN on) (NP (DT the) (NN bus)))))) (. .)))
K/KP/KPT.xml,KPTRE005,132406,7,,A,3,1,Ah shit!,"[Ah/NN, shit/NN, !/.]",(ROOT (FRAG (NP (NN Ah) (NN shit)) (. !)))
