swda_filename,ptb_basename,conversation_no,transcript_index,act_tag,caller,turn_index,subutterance_index,text,pos,trees
K/KE/KE3.xml,KE3RE027,10607,0,,A,1,1,I'm interested to see what it's gonna do for a hot wax if you see what I mean?,"[I/PRP, 'm/VBP, interested/JJ, to/TO, see/VB, what/WP, it/PRP, 's/VBZ, gonna/NN, do/VB, for/IN, a/DT, hot/JJ, wax/NN, if/IN, you/PRP, see/VBP, what/WP, I/PRP, mean/VB, ?/.]",(ROOT (S (NP (PRP I)) (VP (VBP 'm) (ADJP (JJ interested) (S (VP (TO to) (VP (VB see) (SBAR (WHNP (WP what)) (S (NP (PRP it)) (VP (VBZ 's) (S (NP (NN gonna)) (VP (VB do) (PP (IN for) (NP (DT a) (JJ hot) (NN wax))) (SBAR (IN if) (S (NP (PRP you)) (VP (VBP see) (SBAR (WHNP (WP what)) (S (NP (PRP I)) (VP (VB mean))))))))))))))))) (. ?)))
K/KE/KE3.xml,KE3RE027,10607,1,,B,2,1,Yeah ,[Yeah/UH],(ROOT (INTJ (UH Yeah)))
K/KE/KE3.xml,KE3RE027,10607,2,,A,3,1,"Or at least, wow.","[Or/CC, at/IN, least/JJS, ,/,, wow/UH, ./.]","(ROOT (S (NP (CC Or)) (VP (PP (PP (IN at) (NP (NP (JJS least)) (, ,))) (NP (UH wow)))) (. .)))"
K/KE/KE3.xml,KE3RE027,10607,3,,B,4,1,What?,"[What/WDT, ?/.]",(ROOT (FRAG (WHNP (WDT What)) (. ?)))
K/KE/KE3.xml,KE3RE027,10607,4,,A,5,1,I've got a little pool down here.,"[I/PRP, 've/VBP, got/VBD, a/DT, little/JJ, pool/NN, down/IN, here/RB, ./.]",(ROOT (S (NP (PRP I)) (VP (VBP 've) (VP (VBD got) (NP (DT a) (JJ little) (NN pool)) (ADVP (IN down) (RB here)))) (. .)))
K/KE/KE3.xml,KE3RE027,10607,5,,A,5,2,"(()) down there, on the inside, yes.","[down/IN, there/RB, ,/,, on/IN, the/DT, inside/NN, ,/,, yes/UH, ./.]","(ROOT (FRAG (PP (IN down) (NP (NP (RB there)) (, ,) (PP (IN on) (NP (DT the) (NN inside))))) (, ,) (INTJ (UH yes)) (. .)))"
K/KE/KE3.xml,KE3RE027,10607,6,,B,6,1,Yes.,"[Yes/UH, ./.]",(ROOT (INTJ (UH Yes) (. .)))
K/KE/KE3.xml,KE3RE027,10607,7,,A,7,1,Well it is a bit excessive isn't it?,"[Well/RB, it/PRP, is/VBZ, a/DT, bit/NN, excessive/JJ, isn/NN, 't/PRP, it/PRP, ?/.]",(ROOT (S (ADVP (RB Well)) (NP (PRP it)) (VP (VBZ is) (NP (NP (DT a) (ADJP (NN bit) (JJ excessive)) (NN isn)) (NP (NP (PRP 't)) (NP (PRP it))))) (. ?)))
K/KE/KE3.xml,KE3RE027,10607,8,,B,8,1,Yeah .,"[Yeah/UH, ./.]",(ROOT (INTJ (UH Yeah) (. .)))
K/KE/KE3.xml,KE3RE027,10607,9,,A,9,1,It's not erm  --,"[It/PRP, 's/VBZ, not/RB, erm/VB, well/RB, where/WRB, was/VBD, the/DT, hot/JJ, wax/NN, ?we/NN, just/RB, had/VBD, an/DT, ordinary/JJ, wash/NN, go/VB, and/CC, ask/VB, her/PRP, ,/,, say/VBP, you/PRP, asked/VBN, for/IN, how/WRB, much/JJ, did/VBD, you/PRP, pay/VB, ?/.]","(ROOT (S (NP (PRP It)) (VP (VBZ 's) (RB not) (S (VP (VB erm) (ADVP (RB well)))) (SBAR (WHADVP (WRB where)) (S (VP (VBD was) (NP (NP (DT the) (JJ hot) (NN wax)) (SBAR (S (NP (NN ?we)) (ADVP (RB just)) (VP (VBD had) (S (NP (DT an) (JJ ordinary) (NN wash)) (VP (VB go) (CC and) (VB ask) (NP (PRP her))))))) (, ,) (SBAR (S (VP (VBP say) (S (NP (PRP you)) (VP (VBN asked) (PP (IN for) (SBARQ (WHADJP (WRB how) (JJ much)) (SQ (VBD did) (NP (PRP you)) (VP (VB pay))) (. ?)))))))))))))))"
K/KE/KE3.xml,KE3RE027,10607,10,,A,9,2,--well where was the hot wax?--,"[It/PRP, 's/VBZ, not/RB, erm/VB, well/RB, where/WRB, was/VBD, the/DT, hot/JJ, wax/NN, ?we/NN, just/RB, had/VBD, an/DT, ordinary/JJ, wash/NN, go/VB, and/CC, ask/VB, her/PRP, ,/,, say/VBP, you/PRP, asked/VBN, for/IN, how/WRB, much/JJ, did/VBD, you/PRP, pay/VB, ?/.]","(ROOT (S (NP (PRP It)) (VP (VBZ 's) (RB not) (S (VP (VB erm) (ADVP (RB well)))) (SBAR (WHADVP (WRB where)) (S (VP (VBD was) (NP (NP (DT the) (JJ hot) (NN wax)) (SBAR (S (NP (NN ?we)) (ADVP (RB just)) (VP (VBD had) (S (NP (DT an) (JJ ordinary) (NN wash)) (VP (VB go) (CC and) (VB ask) (NP (PRP her))))))) (, ,) (SBAR (S (VP (VBP say) (S (NP (PRP you)) (VP (VBN asked) (PP (IN for) (SBARQ (WHADJP (WRB how) (JJ much)) (SQ (VBD did) (NP (PRP you)) (VP (VB pay))) (. ?)))))))))))))))"
K/KE/KE3.xml,KE3RE027,10607,11,,A,9,3,--we just had an ordinary wash  --,"[It/PRP, 's/VBZ, not/RB, erm/VB, well/RB, where/WRB, was/VBD, the/DT, hot/JJ, wax/NN, ?we/NN, just/RB, had/VBD, an/DT, ordinary/JJ, wash/NN, go/VB, and/CC, ask/VB, her/PRP, ,/,, say/VBP, you/PRP, asked/VBN, for/IN, how/WRB, much/JJ, did/VBD, you/PRP, pay/VB, ?/.]","(ROOT (S (NP (PRP It)) (VP (VBZ 's) (RB not) (S (VP (VB erm) (ADVP (RB well)))) (SBAR (WHADVP (WRB where)) (S (VP (VBD was) (NP (NP (DT the) (JJ hot) (NN wax)) (SBAR (S (NP (NN ?we)) (ADVP (RB just)) (VP (VBD had) (S (NP (DT an) (JJ ordinary) (NN wash)) (VP (VB go) (CC and) (VB ask) (NP (PRP her))))))) (, ,) (SBAR (S (VP (VBP say) (S (NP (PRP you)) (VP (VBN asked) (PP (IN for) (SBARQ (WHADJP (WRB how) (JJ much)) (SQ (VBD did) (NP (PRP you)) (VP (VB pay))) (. ?)))))))))))))))"
K/KE/KE3.xml,KE3RE027,10607,12,,A,9,4,"--go and ask her, say you asked for  --","[It/PRP, 's/VBZ, not/RB, erm/VB, well/RB, where/WRB, was/VBD, the/DT, hot/JJ, wax/NN, ?we/NN, just/RB, had/VBD, an/DT, ordinary/JJ, wash/NN, go/VB, and/CC, ask/VB, her/PRP, ,/,, say/VBP, you/PRP, asked/VBN, for/IN, how/WRB, much/JJ, did/VBD, you/PRP, pay/VB, ?/.]","(ROOT (S (NP (PRP It)) (VP (VBZ 's) (RB not) (S (VP (VB erm) (ADVP (RB well)))) (SBAR (WHADVP (WRB where)) (S (VP (VBD was) (NP (NP (DT the) (JJ hot) (NN wax)) (SBAR (S (NP (NN ?we)) (ADVP (RB just)) (VP (VBD had) (S (NP (DT an) (JJ ordinary) (NN wash)) (VP (VB go) (CC and) (VB ask) (NP (PRP her))))))) (, ,) (SBAR (S (VP (VBP say) (S (NP (PRP you)) (VP (VBN asked) (PP (IN for) (SBARQ (WHADJP (WRB how) (JJ much)) (SQ (VBD did) (NP (PRP you)) (VP (VB pay))) (. ?)))))))))))))))"
K/KE/KE3.xml,KE3RE027,10607,13,,A,9,5,--how much did you pay?,"[It/PRP, 's/VBZ, not/RB, erm/VB, well/RB, where/WRB, was/VBD, the/DT, hot/JJ, wax/NN, ?we/NN, just/RB, had/VBD, an/DT, ordinary/JJ, wash/NN, go/VB, and/CC, ask/VB, her/PRP, ,/,, say/VBP, you/PRP, asked/VBN, for/IN, how/WRB, much/JJ, did/VBD, you/PRP, pay/VB, ?/.]","(ROOT (S (NP (PRP It)) (VP (VBZ 's) (RB not) (S (VP (VB erm) (ADVP (RB well)))) (SBAR (WHADVP (WRB where)) (S (VP (VBD was) (NP (NP (DT the) (JJ hot) (NN wax)) (SBAR (S (NP (NN ?we)) (ADVP (RB just)) (VP (VBD had) (S (NP (DT an) (JJ ordinary) (NN wash)) (VP (VB go) (CC and) (VB ask) (NP (PRP her))))))) (, ,) (SBAR (S (VP (VBP say) (S (NP (PRP you)) (VP (VBN asked) (PP (IN for) (SBARQ (WHADJP (WRB how) (JJ much)) (SQ (VBD did) (NP (PRP you)) (VP (VB pay))) (. ?)))))))))))))))"
K/KE/KE3.xml,KE3RE027,10607,14,,B,10,1,"I had the right card, it was the card number five which was for the hot wash as, hot wax as well.","[I/PRP, had/VBD, the/DT, right/JJ, card/NN, ,/,, it/PRP, was/VBD, the/DT, card/NN, number/NN, five/CD, which/WDT, was/VBD, for/IN, the/DT, hot/JJ, wash/NN, as/IN, ,/,, hot/JJ, wax/NN, as/RB, well/RB, ./.]","(ROOT (S (S (NP (PRP I)) (VP (VBD had) (NP (DT the) (JJ right) (NN card)))) (, ,) (NP (PRP it)) (VP (VBD was) (NP (NP (DT the) (NN card) (NN number)) (NP (CD five)) (SBAR (WHNP (WDT which)) (S (VP (VBD was) (PP (IN for) (NP (NP (DT the) (JJ hot) (NN wash)) (PP (IN as) (NP (NP (, ,) (JJ hot) (NN wax)) (ADVP (RB as) (RB well))))))))))) (. .)))"
K/KE/KE3.xml,KE3RE027,10607,15,,A,11,1,"Well it's, we've just had an ordinary wash  --","[Well/RB, it/PRP, 's/VBZ, ,/,, we/PRP, 've/VBP, just/RB, had/VBN, an/DT, ordinary/JJ, wash/NNP, haven/NNP, 't/PRP, we/PRP, ?/.]","(ROOT (S (ADVP (RB Well)) (NP (PRP it)) (VP (VBZ 's) (, ,) (SBAR (S (NP (PRP we)) (VP (VBP 've) (ADVP (RB just)) (VP (VBN had) (NP (NP (DT an) (JJ ordinary) (NNP wash)) (S (VP (NNP haven) (S (NP (PRP 't)) (NP (PRP we))))))))))) (. ?)))"
K/KE/KE3.xml,KE3RE027,10607,16,,A,11,2,--haven't we?,"[Well/RB, it/PRP, 's/VBZ, ,/,, we/PRP, 've/VBP, just/RB, had/VBN, an/DT, ordinary/JJ, wash/NNP, haven/NNP, 't/PRP, we/PRP, ?/.]","(ROOT (S (ADVP (RB Well)) (NP (PRP it)) (VP (VBZ 's) (, ,) (SBAR (S (NP (PRP we)) (VP (VBP 've) (ADVP (RB just)) (VP (VBN had) (NP (NP (DT an) (JJ ordinary) (NNP wash)) (S (VP (NNP haven) (S (NP (PRP 't)) (NP (PRP we))))))))))) (. ?)))"
K/KE/KE3.xml,KE3RE027,10607,17,,B,12,1,"I don't know, they might ","[I/PRP, don/VBP, 't/PRP, know/VB, ,/,, they/PRP, might/MD]","(ROOT (S (NP (PRP I)) (VP (VBP don) (S (NP (PRP 't)) (VP (VB know) (, ,) (S (NP (PRP they)) (VP (MD might))))))))"
K/KE/KE3.xml,KE3RE027,10607,18,,A,13,1,I don't exactly feel as if we'd had our monies worth there.,"[I/PRP, don/VBP, 't/PRP, exactly/RB, feel/VBP, as/IN, if/IN, we/PRP, 'd/MD, had/VBD, our/PRP$, monies/NNS, worth/IN, there/RB, ./.]",(ROOT (S (NP (PRP I)) (VP (VBP don) (SBAR (S (NP (PRP 't)) (ADVP (RB exactly)) (VP (VBP feel) (SBAR (IN as) (IN if) (S (NP (PRP we)) (VP (MD 'd) (VP (VBD had) (NP (PRP$ our) (NNS monies)) (PP (IN worth) (NP (RB there))))))))))) (. .)))
K/KE/KE3.xml,KE3RE027,10607,19,,B,14,1,"Oh, mm, I don't, I don't really know what the hot wax does.","[Oh/UH, ,/,, mm/NN, ,/,, I/PRP, don/VBP, 't/PRP, ,/,, I/PRP, don/VBP, 't/PRP, really/RB, know/VBP, what/WP, the/DT, hot/JJ, wax/NN, does/VBZ, ./.]","(ROOT (S (INTJ (UH Oh)) (, ,) (NP (NN mm)) (, ,) (PRN (S (NP (PRP I)) (VP (VBP don) (NP (PRP 't))))) (, ,) (NP (PRP I)) (VP (VBP don) (SBAR (S (NP (PRP 't)) (ADVP (RB really)) (VP (VBP know) (SBAR (WHNP (WP what)) (S (NP (DT the) (JJ hot) (NN wax)) (VP (VBZ does)))))))) (. .)))"
K/KE/KE3.xml,KE3RE027,10607,20,,A,15,1,"Oh no, it does feel.","[Oh/UH, no/DT, ,/,, it/PRP, does/VBZ, feel/VB, ./.]","(ROOT (S (ADVP (UH Oh) (DT no)) (, ,) (NP (PRP it)) (VP (VBZ does) (VP (VB feel))) (. .)))"
K/KE/KE3.xml,KE3RE027,10607,21,,B,16,1,It's probably different.,"[It/PRP, 's/VBZ, probably/RB, different/JJ, ./.]",(ROOT (S (NP (PRP It)) (VP (VBZ 's) (ADVP (RB probably)) (ADJP (JJ different))) (. .)))
K/KE/KE3.xml,KE3RE027,10607,22,,A,17,1,"It, it's, no, no .","[It/PRP, ,/,, it/PRP, 's/VBZ, ,/,, no/DT, ,/,, no/DT, ./.]","(ROOT (S (NP (PRP It)) (, ,) (NP (PRP it)) (VP (VBZ 's) (, ,) (ADVP (DT no)) (, ,) (NP (DT no))) (. .)))"
K/KE/KE3.xml,KE3RE027,10607,23,,B,18,1,Different stuff is put on it.,"[Different/JJ, stuff/NN, is/VBZ, put/VBN, on/IN, it/PRP, ./.]",(ROOT (S (NP (JJ Different) (NN stuff)) (VP (VBZ is) (VP (VBN put) (PP (IN on) (NP (PRP it))))) (. .)))
K/KE/KE3.xml,KE3RE027,10607,24,,A,19,1,"Yeah, there's something, it feels erm.","[Yeah/UH, ,/,, there/EX, 's/VBZ, something/NN, ,/,, it/PRP, feels/VBZ, erm/NN, ./.]","(ROOT (S (S (INTJ (UH Yeah)) (, ,) (NP (EX there)) (VP (VBZ 's) (NP (NN something)))) (, ,) (NP (PRP it)) (VP (VBZ feels) (NP (NN erm))) (. .)))"
K/KE/KE3.xml,KE3RE027,10607,25,,B,20,1,Feels waxy?,"[Feels/VBZ, waxy/NN, ?/.]",(ROOT (S (VP (VBZ Feels) (NP (NN waxy))) (. ?)))
K/KE/KE3.xml,KE3RE027,10607,26,,B,20,2,This one's cheaper than the er,"[This/DT, one/NN, 's/POS, cheaper/JJR, than/IN, the/DT, er/NN]",(ROOT (NP (NP (NP (DT This) (NN one) (POS 's)) (NP (JJR cheaper))) (PP (IN than) (NP (DT the) (NN er)))))
K/KE/KE3.xml,KE3RE027,10607,27,,A,21,1,Sorry.,"[Sorry/JJ, ./.]",(ROOT (FRAG (ADJP (JJ Sorry)) (. .)))
K/KE/KE3.xml,KE3RE027,10607,28,,B,22,1,This one is cheaper,"[This/DT, one/CD, is/VBZ, cheaper/JJR]",(ROOT (S (NP (DT This) (CD one)) (VP (VBZ is) (ADJP (JJR cheaper)))))
K/KE/KE3.xml,KE3RE027,10607,29,,A,23,1,What than the erm.,"[What/WDT, than/IN, the/DT, erm/NN, ./.]",(ROOT (FRAG (WHNP (WDT What)) (PP (IN than) (NP (DT the) (NN erm))) (. .)))
K/KE/KE3.xml,KE3RE027,10607,30,,B,24,1,than the one at the Longwell Green.,"[than/IN, the/DT, one/CD, at/IN, the/DT, Longwell/NNP, Green/NNP, ./.]",(ROOT (FRAG (PP (IN than) (NP (NP (DT the) (CD one)) (PP (IN at) (NP (DT the) (NNP Longwell) (NNP Green))))) (. .)))
K/KE/KE3.xml,KE3RE027,10607,31,,A,25,1,"Yeah, it's had something, look it wouldn't of.","[Yeah/UH, ,/,, it/PRP, 's/VBZ, had/VBD, something/NN, ,/,, look/VB, it/PRP, wouldn/VB, 't/PRP, of/IN, ./.]","(ROOT (S (INTJ (UH Yeah)) (, ,) (NP (PRP it)) (VP (VBZ 's) (VP (VBD had) (S (NP (NN something)) (, ,) (VP (VB look) (S (NP (PRP it)) (VP (VB wouldn) (NP (PRP 't)) (PP (IN of)))))))) (. .)))"
K/KE/KE3.xml,KE3RE027,10607,32,,B,26,1,Mm.,"[Mm/NN, ./.]",(ROOT (NP (NN Mm) (. .)))
K/KE/KE3.xml,KE3RE027,10607,33,,A,27,1,"Yes, it's had something, look at the paint work.","[Yes/UH, ,/,, it/PRP, 's/VBZ, had/VBD, something/NN, ,/,, look/VB, at/IN, the/DT, paint/NN, work/NN, ./.]","(ROOT (S (INTJ (UH Yes)) (, ,) (NP (PRP it)) (VP (VBZ 's) (VP (VBD had) (S (NP (NN something)) (, ,) (VP (VB look) (PP (IN at) (NP (DT the) (NN paint) (NN work))))))) (. .)))"
K/KE/KE3.xml,KE3RE027,10607,34,,B,28,1,"Yeah, it's good, in it?","[Yeah/UH, ,/,, it/PRP, 's/VBZ, good/JJ, ,/,, in/IN, it/PRP, ?/.]","(ROOT (S (INTJ (UH Yeah)) (, ,) (NP (PRP it)) (VP (VBZ 's) (ADJP (JJ good)) (, ,) (PP (IN in) (NP (PRP it)))) (. ?)))"
K/KE/KE3.xml,KE3RE027,10607,35,,A,29,1,It was probably erm the shampoo and what have you it's  (()) in ,"[It/PRP, was/VBD, probably/RB, erm/IN, the/DT, shampoo/NN, and/CC, what/WP, have/VBP, you/PRP, it/PRP, 's/VBZ, in/IN]",(ROOT (S (NP (PRP It)) (VP (VBD was) (UCP (PP (ADVP (RB probably)) (IN erm) (NP (DT the) (NN shampoo))) (CC and) (SBAR (WHNP (WP what)) (S (VP (VBP have) (NP (NP (PRP you)) (SBAR (S (NP (PRP it)) (VP (VBZ 's) (PP (IN in)))))))))))))
K/KE/KE3.xml,KE3RE027,10607,36,,B,30,1,Yeah .,"[Yeah/UH, ./.]",(ROOT (INTJ (UH Yeah) (. .)))
K/KE/KE3.xml,KE3RE027,10607,37,,A,31,1,together   (()) --,"[together/RB, I/PRP, 'm/VBP, sorry/JJ, ./.]",(ROOT (S (ADVP (RB together)) (NP (PRP I)) (VP (VBP 'm) (ADJP (JJ sorry))) (. .)))
K/KE/KE3.xml,KE3RE027,10607,38,,A,31,2,--I'm sorry.,"[together/RB, I/PRP, 'm/VBP, sorry/JJ, ./.]",(ROOT (S (ADVP (RB together)) (NP (PRP I)) (VP (VBP 'm) (ADJP (JJ sorry))) (. .)))
K/KE/KE3.xml,KE3RE027,10607,39,,B,32,1,It's alright.,"[It/PRP, 's/VBZ, alright/JJ, ./.]",(ROOT (S (NP (PRP It)) (VP (VBZ 's) (ADJP (JJ alright))) (. .)))
K/KE/KE3.xml,KE3RE027,10607,40,,A,33,1,Jumping off the clutch there.,"[Jumping/VBG, off/RP, the/DT, clutch/NN, there/RB, ./.]",(ROOT (S (VP (VBG Jumping) (PRT (RP off)) (NP (DT the) (NN clutch)) (ADVP (RB there))) (. .)))
K/KE/KE3.xml,KE3RE027,10607,41,,B,34,1,"<laugh> , I'm a past master at that  <laugh> ","[,/,, I/PRP, 'm/VBP, a/DT, past/JJ, master/NN, at/IN, that/DT]","(ROOT (PRN (, ,) (S (NP (PRP I)) (VP (VBP 'm) (NP (NP (DT a) (JJ past) (NN master)) (PP (IN at) (NP (DT that))))))))"
K/KE/KE3.xml,KE3RE027,10607,42,,A,35,1,Going a bit quickly.,"[Going/VBG, a/DT, bit/NN, quickly/RB, ./.]",(ROOT (S (VP (VBG Going) (NP (DT a) (NN bit)) (ADVP (RB quickly))) (. .)))
K/KE/KE3.xml,KE3RE027,10607,43,,B,36,1,What's going a bit quickly?,"[What/WP, 's/VBZ, going/VBG, a/DT, bit/NN, quickly/RB, ?/.]",(ROOT (SBARQ (WHNP (WP What)) (SQ (VP (VBZ 's) (VP (VBG going) (NP (DT a) (NN bit)) (ADVP (RB quickly))))) (. ?)))
K/KE/KE3.xml,KE3RE027,10607,44,,A,37,1,That police car.,"[That/DT, police/NN, car/NN, ./.]",(ROOT (NP (NP (DT That)) (NP (NN police) (NN car)) (. .)))
K/KE/KE3.xml,KE3RE027,10607,45,,B,38,1,Ah.,"[Ah/NN, ./.]",(ROOT (INTJ (NN Ah) (. .)))
K/KE/KE3.xml,KE3RE027,10607,46,,A,39,1,"Wasn't screaming, just that it's (()) , the eh, getting there.","[Wasn/NNP, 't/PRP, screaming/VBG, ,/,, just/RB, that/IN, it/PRP, 's/VBZ, ,/,, the/DT, eh/UH, ,/,, getting/VBG, there/RB, ./.]","(ROOT (S (NP (NNP Wasn) (PRP 't)) (VP (VP (VBG screaming) (, ,) (SBAR (RB just) (IN that) (S (NP (PRP it)) (VP (VBZ 's) (PRN (, ,) (SBAR (WHNP (DT the)) (FRAG (INTJ (UH eh)))) (, ,)))))) (VP (VBG getting) (ADVP (RB there)))) (. .)))"
K/KE/KE3.xml,KE3RE027,10607,47,,B,40,1,Mm.,"[Mm/NN, ./.]",(ROOT (NP (NN Mm) (. .)))
K/KE/KE3.xml,KE3RE027,10607,48,,A,41,1,Don't you start.,"[Don/NNP, 't/PRP, you/PRP, start/VBP, ./.]",(ROOT (S (NP (NNP Don) (PRP 't)) (NP (PRP you)) (VP (VBP start)) (. .)))
K/KE/KE3.xml,KE3RE027,10607,49,,B,42,1,<laugh> .,[./.],(ROOT (NP (. .)))
K/KE/KE3.xml,KE3RE027,10607,50,,A,43,1,"I know how easy it is to do that, coming up there.","[I/PRP, know/VBP, how/WRB, easy/JJ, it/PRP, is/VBZ, to/TO, do/VB, that/DT, ,/,, coming/VBG, up/RB, there/RB, ./.]","(ROOT (S (NP (PRP I)) (VP (VBP know) (SBAR (WHADVP (WRB how) (ADJP (JJ easy))) (S (NP (PRP it)) (VP (VBZ is) (S (VP (TO to) (VP (VB do) (NP (NP (DT that)) (, ,) (VP (VBG coming) (ADVP (RB up) (RB there))))))))))) (. .)))"
K/KE/KE3.xml,KE3RE027,10607,51,,B,44,1,"Coming up there, yes, quite er, quite tricky.","[Coming/VBG, up/RB, there/RB, ,/,, yes/UH, ,/,, quite/RB, er/NN, ,/,, quite/RB, tricky/JJ, ./.]","(ROOT (S (VP (VBG Coming) (ADVP (ADVP (RB up) (RB there)) (PRN (, ,) (INTJ (UH yes)) (, ,))) (NP (NP (RB quite) (NN er)) (, ,) (ADJP (RB quite) (JJ tricky)))) (. .)))"
K/KE/KE3.xml,KE3RE027,10607,52,,A,45,1,"Thanks for a paying to have it washed like that, cos it ","[Thanks/NNS, for/IN, a/DT, paying/VBG, to/TO, have/VB, it/PRP, washed/VBN, like/IN, that/DT, ,/,, cos/NN, it/PRP]","(ROOT (SBAR (NP (NNS Thanks)) (IN for) (S (NP (DT a) (VBG paying)) (VP (TO to) (VP (VB have) (S (NP (PRP it)) (VP (VBN washed) (PP (IN like) (NP (NP (DT that)) (, ,) (NP (NP (NN cos)) (NP (PRP it))))))))))))"
K/KE/KE3.xml,KE3RE027,10607,53,,B,46,1,That's alright .,"[That/DT, 's/VBZ, alright/JJ, ./.]",(ROOT (S (NP (DT That)) (VP (VBZ 's) (ADJP (JJ alright))) (. .)))
K/KE/KE3.xml,KE3RE027,10607,54,,A,47,1,saves an awful lot of time with us.,"[saves/VBZ, an/DT, awful/JJ, lot/NN, of/IN, time/NN, with/IN, us/PRP, ./.]",(ROOT (S (VP (VBZ saves) (NP (NP (DT an) (JJ awful) (NN lot)) (PP (IN of) (NP (NN time)))) (PP (IN with) (NP (PRP us)))) (. .)))
K/KE/KE3.xml,KE3RE027,10607,55,,B,48,1,"Saves a lot of work don't it, a lot of time ","[Saves/VBZ, a/DT, lot/NN, of/IN, work/NN, don/NNP, 't/PRP, it/PRP, ,/,, a/DT, lot/NN, of/IN, time/NN]","(ROOT (SINV (VP (VBZ Saves) (S (NP (NP (DT a) (NN lot)) (PP (IN of) (NP (NN work) (NNP don)))) (NP (PRP 't)))) (NP (NP (PRP it)) (, ,) (NP (NP (DT a) (NN lot)) (PP (IN of) (NP (NN time)))))))"
K/KE/KE3.xml,KE3RE027,10607,56,,A,49,1,I want to check the tyres and that as well.,"[I/PRP, want/VBP, to/TO, check/VB, the/DT, tyres/NNS, and/CC, that/IN, as/RB, well/RB, ./.]",(ROOT (S (NP (PRP I)) (VP (VBP want) (S (VP (TO to) (VP (VB check) (UCP (NP (DT the) (NNS tyres)) (CC and) (ADJP (IN that) (RB as) (RB well))))))) (. .)))
K/KE/KE3.xml,KE3RE027,10607,57,,B,50,1,"Mm, mm.","[Mm/NN, ,/,, mm/NN, ./.]","(ROOT (NP (NP (NN Mm)) (, ,) (NP (NN mm)) (. .)))"
K/KE/KE3.xml,KE3RE027,10607,58,,A,51,1,Cos we haven't had for any actual air in it for ages.,"[Cos/NN, we/PRP, haven/NN, 't/PRP, had/VBD, for/IN, any/DT, actual/JJ, air/NN, in/IN, it/PRP, for/IN, ages/NNS, ./.]",(ROOT (S (S (VP (NN Cos) (NP (PRP we) (NN haven)))) (NP (PRP 't)) (VP (VBD had) (PP (IN for) (NP (NP (DT any) (JJ actual) (NN air)) (PP (IN in) (NP (PRP it))) (PP (IN for) (NP (NNS ages)))))) (. .)))
K/KE/KE3.xml,KE3RE027,10607,59,,B,52,1,Mm.,"[Mm/NN, ./.]",(ROOT (NP (NN Mm) (. .)))
K/KE/KE3.xml,KE3RE027,10607,60,,A,53,1,I'm sure they must need er  --,"[I/PRP, 'm/VBP, sure/JJ, they/PRP, must/MD, need/VB, er/NN, a/DT, little/JJ, bit/NN, ./.]",(ROOT (S (NP (PRP I)) (VP (VBP 'm) (ADJP (JJ sure) (SBAR (S (NP (PRP they)) (VP (MD must) (VP (VB need) (NP (NP (NN er)) (NP (DT a) (JJ little) (NN bit))))))))) (. .)))
K/KE/KE3.xml,KE3RE027,10607,61,,A,53,2,--a little bit.,"[I/PRP, 'm/VBP, sure/JJ, they/PRP, must/MD, need/VB, er/NN, a/DT, little/JJ, bit/NN, ./.]",(ROOT (S (NP (PRP I)) (VP (VBP 'm) (ADJP (JJ sure) (SBAR (S (NP (PRP they)) (VP (MD must) (VP (VB need) (NP (NP (NN er)) (NP (DT a) (JJ little) (NN bit))))))))) (. .)))
K/KE/KE3.xml,KE3RE027,10607,62,,B,54,1,Yeah ,[Yeah/UH],(ROOT (INTJ (UH Yeah)))
K/KE/KE3.xml,KE3RE027,10607,63,,A,55,1,And we've got plenty of time now to erm do the hoovering and what have you.,"[And/CC, we/PRP, 've/VBP, got/VBN, plenty/NN, of/IN, time/NN, now/RB, to/TO, erm/NN, do/VBP, the/DT, hoovering/NN, and/CC, what/WP, have/VBP, you/PRP, ./.]",(ROOT (S (CC And) (NP (PRP we)) (VP (VBP 've) (VP (VBN got) (SBAR (SBAR (S (NP (NP (NN plenty)) (PP (IN of) (NP (NN time)))) (VP (ADVP (RB now) (PP (TO to) (NP (NN erm)))) (VBP do) (NP (DT the) (NN hoovering))))) (CC and) (SBAR (WHNP (WP what)) (S (VP (VBP have) (NP (PRP you)))))))) (. .)))
K/KE/KE3.xml,KE3RE027,10607,64,,B,56,1,Mm.,"[Mm/NN, ./.]",(ROOT (NP (NN Mm) (. .)))
