swda_filename,ptb_basename,conversation_no,transcript_index,act_tag,caller,turn_index,subutterance_index,text,pos,trees
K/KB/KBK.xml,KBKRE00A,2011,91,,B,56,2,And it's a bit silly to wear er a permanent arrangement.,"[And/CC, it/PRP, 's/VBZ, a/DT, bit/NN, silly/JJ, to/TO, wear/VB, er/NN, a/DT, permanent/JJ, arrangement/NN, ./.]",(ROOT (S (CC And) (NP (PRP it)) (VP (VBZ 's) (ADJP (NP (DT a) (NN bit)) (JJ silly)) (S (VP (TO to) (VP (VB wear) (NP (NN er)) (NP (DT a) (JJ permanent) (NN arrangement)))))) (. .)))
K/KB/KBK.xml,KBKRE00A,2011,92,,B,56,3,"But this shirt could be worn with the skirt, couldn't it?","[But/CC, this/DT, shirt/NN, could/MD, be/VB, worn/VBN, with/IN, the/DT, skirt/NN, ,/,, couldn/NN, 't/PRP, it/PRP, ?/.]","(ROOT (S (CC But) (NP (DT this) (NN shirt)) (VP (MD could) (VP (VB be) (VP (VBN worn) (PP (IN with) (NP (NP (DT the) (NN skirt)) (, ,) (NP (NP (NN couldn)) (NP (PRP 't))))) (NP (PRP it))))) (. ?)))"
K/KB/KBK.xml,KBKRE00A,2011,93,,A,57,1,Definitely.,"[Definitely/RB, ./.]",(ROOT (FRAG (ADVP (RB Definitely)) (. .)))
K/KB/KBK.xml,KBKRE00A,2011,94,,B,58,1,"I mean the colour's just as, it's not quite as strong.","[I/PRP, mean/VBP, the/DT, colour/NN, 's/POS, just/RB, as/RB, ,/,, it/PRP, 's/VBZ, not/RB, quite/RB, as/IN, strong/JJ, ./.]","(ROOT (S (S (NP (PRP I)) (VP (VBP mean) (NP (NP (DT the) (NN colour) (POS 's)) (NP (RB just) (RB as))))) (, ,) (NP (PRP it)) (VP (VBZ 's) (RB not) (ADJP (RB quite) (PP (IN as) (ADJP (JJ strong))))) (. .)))"
K/KB/KBK.xml,KBKRE00A,2011,95,,A,59,1,(()) the colour's pretty neutral isn't it?,"[the/DT, colour/NN, 's/POS, pretty/JJ, neutral/JJ, isn/NN, 't/PRP, it/PRP, ?/.]",(ROOT (NP (NP (NP (DT the) (NN colour) (POS 's)) (ADJP (JJ pretty) (JJ neutral)) (NN isn)) (NP (NP (PRP 't)) (NP (PRP it))) (. ?)))
K/KB/KBK.xml,KBKRE00A,2011,96,,B,60,1,But I mean it does pick up.,"[But/CC, I/PRP, mean/VBP, it/PRP, does/VBZ, pick/VB, up/RP, ./.]",(ROOT (S (CC But) (NP (PRP I)) (VP (VBP mean) (SBAR (S (NP (PRP it)) (VP (VBZ does) (VP (VB pick) (PRT (RP up))))))) (. .)))
K/KB/KBK.xml,KBKRE00A,2011,97,,A,61,1,Yes.,"[Yes/UH, ./.]",(ROOT (INTJ (UH Yes) (. .)))
K/KB/KBK.xml,KBKRE00A,2011,98,,A,61,2,Yes I think the skirt's gonna be very useful actually.,"[Yes/UH, I/PRP, think/VBP, the/DT, skirt/NN, 's/POS, gonna/NN, be/VB, very/RB, useful/JJ, actually/RB, ./.]",(ROOT (S (S (INTJ (UH Yes)) (NP (PRP I)) (VP (VBP think) (NP (NP (DT the) (NN skirt) (POS 's)) (NN gonna) (S (VP (VB be) (ADJP (RB very) (JJ useful))))) (ADVP (RB actually)))) (. .)))
K/KB/KBK.xml,KBKRE00A,2011,99,,B,62,1,Er  (()) good skirt whether (()) .,"[Er/NN, good/JJ, skirt/NN, whether/IN, ./.]",(ROOT (NP (NP (NN Er)) (NP (JJ good) (NN skirt) (IN whether)) (. .)))
K/KB/KBK.xml,KBKRE00A,2011,100,,A,63,1,Well I hope you will.,"[Well/RB, I/PRP, hope/VBP, you/PRP, will/MD, ./.]",(ROOT (S (ADVP (RB Well)) (NP (PRP I)) (VP (VBP hope) (SBAR (S (NP (PRP you)) (VP (MD will))))) (. .)))
K/KB/KBK.xml,KBKRE00A,2011,101,,A,63,2,I like it.,"[I/PRP, like/VBP, it/PRP, ./.]",(ROOT (S (NP (PRP I)) (VP (VBP like) (NP (PRP it))) (. .)))
K/KB/KBK.xml,KBKRE00A,2011,102,,B,64,1,(()) ,[],X
K/KB/KBK.xml,KBKRE00A,2011,103,,A,65,1,It's the wrong green I think.,"[It/PRP, 's/VBZ, the/DT, wrong/JJ, green/NN, I/PRP, think/VBP, ./.]",(ROOT (S (NP (PRP It)) (VP (VBZ 's) (NP (NP (DT the) (JJ wrong) (NN green)) (SBAR (S (NP (PRP I)) (VP (VBP think)))))) (. .)))
K/KB/KBK.xml,KBKRE00A,2011,104,,A,65,2,"The actual skirt, the skirt's a blueyer green.","[The/DT, actual/JJ, skirt/NN, ,/,, the/DT, skirt/NN, 's/VBZ, a/DT, blueyer/JJR, green/NN, ./.]","(ROOT (S (NP (NP (DT The) (JJ actual) (NN skirt)) (, ,) (NP (DT the) (NN skirt))) (VP (VBZ 's) (NP (DT a) (JJR blueyer) (NN green))) (. .)))"
K/KB/KBK.xml,KBKRE00A,2011,105,,A,65,3,"But you've got two blouses to wear with it, that's alright.","[But/CC, you/PRP, 've/VBP, got/VBD, two/CD, blouses/NNS, to/TO, wear/VB, with/IN, it/PRP, ,/,, that/DT, 's/VBZ, alright/JJ, ./.]","(ROOT (S (S (CC But) (NP (PRP you)) (VP (VBP 've) (VP (VBD got) (NP (CD two) (NNS blouses)) (S (VP (TO to) (VP (VB wear) (PP (IN with) (NP (PRP it))))))))) (, ,) (NP (DT that)) (VP (VBZ 's) (ADJP (JJ alright))) (. .)))"
K/KB/KBK.xml,KBKRE00A,2011,106,,A,65,4,You've got this other white one as well.,"[You/PRP, 've/VBP, got/VBN, this/DT, other/JJ, white/JJ, one/NN, as/RB, well/RB, ./.]",(ROOT (S (NP (PRP You)) (VP (VBP 've) (VP (VBN got) (NP (DT this) (JJ other) (JJ white) (NN one)) (ADVP (RB as) (RB well)))) (. .)))
K/KB/KBK.xml,KBKRE00A,2011,107,,B,66,1,(()) white one.,"[white/NNP, one/CD, ./.]",(ROOT (NP (NP (NNP white)) (NP (CD one)) (. .)))
K/KB/KBK.xml,KBKRE00A,2011,108,,B,66,2,"That's a short, that's your shirt.","[That/DT, 's/VBZ, a/DT, short/JJ, ,/,, that/DT, 's/VBZ, your/PRP$, shirt/NN, ./.]","(ROOT (S (S (NP (DT That)) (VP (VBZ 's) (NP (DT a) (JJ short)))) (, ,) (NP (DT that)) (VP (VBZ 's) (NP (PRP$ your) (NN shirt))) (. .)))"
K/KB/KBK.xml,KBKRE00A,2011,109,,A,67,1,That's mine is it?,"[That/DT, 's/VBZ, mine/NN, is/VBZ, it/PRP, ?/.]",(ROOT (S (NP (DT That)) (VP (VBZ 's) (NP (NP (NN mine)) (SBAR (S (VP (VBZ is) (NP (PRP it))))))) (. ?)))
K/KB/KBK.xml,KBKRE00A,2011,110,,A,67,2,Mm.,"[Mm/NN, ./.]",(ROOT (NP (NN Mm) (. .)))
K/KB/KBK.xml,KBKRE00A,2011,111,,B,68,1,"They're very good, that's the white one.","[They/PRP, 're/VBP, very/RB, good/JJ, ,/,, that/DT, 's/VBZ, the/DT, white/JJ, one/CD, ./.]","(ROOT (S (S (NP (PRP They)) (VP (VBP 're) (ADJP (RB very) (JJ good)))) (, ,) (NP (DT that)) (VP (VBZ 's) (NP (DT the) (JJ white) (CD one))) (. .)))"
K/KB/KBK.xml,KBKRE00A,2011,112,,A,69,1,Yes.,"[Yes/UH, ./.]",(ROOT (INTJ (UH Yes) (. .)))
K/KB/KBK.xml,KBKRE00A,2011,113,,A,69,2,I would have thought,"[I/PRP, would/MD, have/VB, thought/VBN]",(ROOT (S (NP (PRP I)) (VP (MD would) (VP (VB have) (VP (VBN thought))))))
K/KB/KBK.xml,KBKRE00A,2011,114,,B,70,1,This white one might  (()) the cream one.,"[This/DT, white/JJ, one/NN, might/MD, the/DT, cream/NN, one/CD, ./.]",(ROOT (S (NP (DT This) (JJ white) (NN one)) (VP (MD might) (VP (NP (DT the) (NN cream) (CD one)))) (. .)))
K/KB/KBK.xml,KBKRE00A,2011,115,,A,71,1,Well so you've got four blouses (()) .,"[Well/RB, so/IN, you/PRP, 've/VBP, got/VBN, four/CD, blouses/NNS, ./.]",(ROOT (FRAG (ADVP (RB Well)) (SBAR (IN so) (S (NP (PRP you)) (VP (VBP 've) (VP (VBN got) (NP (CD four) (NNS blouses)))))) (. .)))
K/KB/KBK.xml,KBKRE00A,2011,116,,B,72,1,Which is the fourth?,"[Which/WDT, is/VBZ, the/DT, fourth/JJ, ?/.]",(ROOT (SBARQ (WHNP (WDT Which)) (SQ (VBZ is) (NP (DT the) (JJ fourth))) (. ?)))
K/KB/KBK.xml,KBKRE00A,2011,117,,A,73,1,Well the one you just said is a bit old now.,"[Well/RB, the/DT, one/CD, you/PRP, just/RB, said/VBD, is/VBZ, a/DT, bit/NN, old/JJ, now/RB, ./.]",(ROOT (S (ADVP (RB Well)) (NP (NP (DT the) (CD one)) (SBAR (S (NP (PRP you)) (ADVP (RB just)) (VP (VBD said))))) (VP (VBZ is) (ADJP (NP (DT a) (NN bit)) (JJ old)) (ADVP (RB now))) (. .)))
K/KB/KBK.xml,KBKRE00A,2011,118,,B,74,1,Oh yeah but that's white again isn't it?,"[Oh/UH, yeah/UH, but/CC, that/DT, 's/VBZ, white/JJ, again/RB, isn/RB, 't/PRP, it/PRP, ?/.]",(ROOT (UCP (FRAG (INTJ (UH Oh) (UH yeah))) (CC but) (SBAR (WHNP (DT that)) (S (VP (VBZ 's) (ADJP (ADJP (JJ white)) (PRN (ADVP (RB again)) (ADVP (RB isn)))) (NP (NP (PRP 't)) (NP (PRP it))))) (. ?))))
K/KB/KBK.xml,KBKRE00A,2011,119,,A,75,1,Yes.,"[Yes/UH, ./.]",(ROOT (INTJ (UH Yes) (. .)))
K/KB/KBK.xml,KBKRE00A,2011,120,,A,75,2,No I think they're all worth  (()) and I think that's an attractive top as well.,"[No/DT, I/PRP, think/VBP, they/PRP, 're/VBP, all/DT, worth/JJ, and/CC, I/PRP, think/VBP, that/DT, 's/VBZ, an/DT, attractive/JJ, top/NN, as/RB, well/RB, ./.]",(ROOT (S (S (NP (DT No) (PRP I)) (VP (VBP think) (SBAR (S (NP (PRP they)) (VP (VBP 're) (ADJP (DT all) (JJ worth))))))) (CC and) (S (NP (PRP I)) (VP (VBP think) (SBAR (S (NP (DT that)) (VP (VBZ 's) (NP (DT an) (JJ attractive) (NN top)) (ADVP (RB as) (RB well))))))) (. .)))
K/KB/KBK.xml,KBKRE00A,2011,121,,A,75,3,I think you should have that.,"[I/PRP, think/VBP, you/PRP, should/MD, have/VB, that/DT, ./.]",(ROOT (S (NP (PRP I)) (VP (VBP think) (SBAR (S (NP (PRP you)) (VP (MD should) (VP (VB have) (NP (DT that))))))) (. .)))
K/KB/KBK.xml,KBKRE00A,2011,122,,B,76,1,Well erm.,"[Well/RB, erm/NN, ./.]",(ROOT (FRAG (ADVP (RB Well)) (NP (NN erm)) (. .)))
K/KB/KBK.xml,KBKRE00A,2011,123,,B,76,2,What else (()) .,"[What/WP, else/RB, ./.]",(ROOT (FRAG (WHNP (WP What) (RB else)) (. .)))
K/KB/KBK.xml,KBKRE00A,2011,124,,A,77,1,I don't know (()) .,"[I/PRP, don/VBP, 't/PRP, know/VB, ./.]",(ROOT (S (NP (PRP I)) (VP (VBP don) (S (NP (PRP 't)) (VP (VB know)))) (. .)))
K/KB/KBK.xml,KBKRE00A,2011,125,,A,77,2,It's it's it's a possible winter or cooler ,"[It/PRP, 's/VBZ, it/PRP, 's/VBZ, it/PRP, 's/VBZ, a/DT, possible/JJ, winter/NN, or/CC, cooler/JJR]",(ROOT (S (NP (PRP It)) (VP (VBZ 's) (SBAR (S (NP (PRP it)) (VP (VBZ 's) (SBAR (S (NP (PRP it)) (VP (VBZ 's) (NP (NP (DT a) (JJ possible) (NN winter)) (CC or) (NP (JJR cooler))))))))))))
K/KB/KBK.xml,KBKRE00A,2011,126,,B,78,1,No it's not.,"[No/DT, it/PRP, 's/VBZ, not/RB, ./.]",(ROOT (S (NP (DT No) (PRP it)) (VP (VBZ 's) (RB not)) (. .)))
K/KB/KBK.xml,KBKRE00A,2011,127,,A,79,1,weather skirt.,"[weather/NN, skirt/NN, ./.]",(ROOT (NP (NP (NN weather)) (NP (NN skirt)) (. .)))
K/KB/KBK.xml,KBKRE00A,2011,128,,A,79,2,With a jumper or cardigan.,"[With/IN, a/DT, jumper/NN, or/CC, cardigan/NN, ./.]",(ROOT (FRAG (PP (IN With) (NP (DT a) (NN jumper) (CC or) (NN cardigan))) (. .)))
K/KB/KBK.xml,KBKRE00A,2011,129,,B,80,1,No it's not.,"[No/DT, it/PRP, 's/VBZ, not/RB, ./.]",(ROOT (S (NP (DT No) (PRP it)) (VP (VBZ 's) (RB not)) (. .)))
K/KB/KBK.xml,KBKRE00A,2011,130,,B,80,2,"(()) cooler, warmer weather and it's got short sleeves you know.","[cooler/JJR, ,/,, warmer/JJR, weather/NN, and/CC, it/PRP, 's/VBZ, got/VBN, short/JJ, sleeves/NNS, you/PRP, know/VBP, ./.]","(ROOT (S (NP (NP (JJR cooler)) (, ,) (NP (JJR warmer) (NN weather)) (CC and) (NP (PRP it))) (VP (VBZ 's) (VP (VBN got) (NP (NP (JJ short) (NNS sleeves)) (SBAR (S (NP (PRP you)) (VP (VBP know))))))) (. .)))"
K/KB/KBK.xml,KBKRE00A,2011,131,,B,80,3,I don't really erm (()) .,"[I/PRP, don/VBP, 't/PRP, really/RB, erm/NN, ./.]",(ROOT (S (NP (PRP I)) (VP (VBP don) (S (NP (PRP 't)) (ADVP (RB really)) (NP (NN erm)))) (. .)))
K/KB/KBK.xml,KBKRE00A,2011,132,,A,81,1,<laugh> ,[],X
K/KB/KBK.xml,KBKRE00A,2011,133,,B,82,1,That's wrong for that.,"[That/DT, 's/VBZ, wrong/JJ, for/IN, that/DT, ./.]",(ROOT (S (NP (DT That)) (VP (VBZ 's) (ADJP (JJ wrong) (PP (IN for) (NP (DT that))))) (. .)))
K/KB/KBK.xml,KBKRE00A,2011,134,,B,82,2,This has got a stain on it.,"[This/DT, has/VBZ, got/VBN, a/DT, stain/VB, on/IN, it/PRP, ./.]",(ROOT (S (NP (DT This)) (VP (VBZ has) (VP (VBN got) (S (NP (DT a)) (VP (VB stain) (PP (IN on) (NP (PRP it))))))) (. .)))
K/KB/KBK.xml,KBKRE00A,2011,135,,A,83,1,That's a nuisance.,"[That/DT, 's/VBZ, a/DT, nuisance/NN, ./.]",(ROOT (S (NP (DT That)) (VP (VBZ 's) (NP (DT a) (NN nuisance))) (. .)))
K/KB/KBK.xml,KBKRE00A,2011,136,,A,83,2,It would be perfectly acceptable otherwise.,"[It/PRP, would/MD, be/VB, perfectly/RB, acceptable/JJ, otherwise/RB, ./.]",(ROOT (S (NP (PRP It)) (VP (MD would) (VP (VB be) (ADJP (RB perfectly) (JJ acceptable)) (ADVP (RB otherwise)))) (. .)))
K/KB/KBK.xml,KBKRE00A,2011,137,,B,84,1,Yes and we've got big crease marks on there.,"[Yes/RB, and/CC, we/PRP, 've/VBP, got/VBD, big/JJ, crease/NN, marks/NNS, on/IN, there/EX, ./.]",(ROOT (S (NP (NP (RB Yes)) (CC and) (NP (PRP we))) (VP (VBP 've) (VP (VBD got) (NP (JJ big) (NN crease) (NNS marks)) (PP (IN on) (NP (EX there))))) (. .)))
K/KB/KBK.xml,KBKRE00A,2011,138,,A,85,1,Let's have a look.,"[Let/VB, 's/PRP, have/VB, a/DT, look/NN, ./.]",(ROOT (S (VP (VB Let) (S (NP (PRP 's)) (VP (VB have) (NP (DT a) (NN look))))) (. .)))
K/KB/KBK.xml,KBKRE00A,2011,139,,B,86,1,There.,"[There/EX, ./.]",(ROOT (S (VP (EX There)) (. .)))
K/KB/KBK.xml,KBKRE00A,2011,140,,B,86,2,I know it's there.,"[I/PRP, know/VBP, it/PRP, 's/VBZ, there/RB, ./.]",(ROOT (S (NP (PRP I)) (VP (VBP know) (SBAR (S (NP (PRP it)) (VP (VBZ 's) (ADVP (RB there)))))) (. .)))
K/KB/KBK.xml,KBKRE00A,2011,141,,B,86,3,I know it was last year I was really annoyed.,"[I/PRP, know/VBP, it/PRP, was/VBD, last/JJ, year/NN, I/PRP, was/VBD, really/RB, annoyed/JJ, ./.]",(ROOT (S (NP (PRP I)) (VP (VBP know) (SBAR (S (NP (PRP it)) (VP (VBD was) (NP (NP (JJ last) (NN year)) (SBAR (S (NP (PRP I)) (VP (VBD was) (ADJP (RB really) (JJ annoyed)))))))))) (. .)))
K/KB/KBK.xml,KBKRE00A,2011,142,,A,87,1,Put the light on.,"[Put/VB, the/DT, light/NN, on/IN, ./.]",(ROOT (S (VP (VB Put) (NP (DT the) (NN light)) (PP (IN on))) (. .)))
K/KB/KBK.xml,KBKRE00A,2011,143,,A,87,2,". Well if we can't see it, it doesn't matter even if it is there.","[./., Well/RB, if/IN, we/PRP, can/MD, 't/PRP, see/VB, it/PRP, ,/,, it/PRP, doesn/VBD, 't/PRP, matter/VB, even/RB, if/IN, it/PRP, is/VBZ, there/RB, ./.]","(ROOT (S (. .) (SBAR (ADVP (RB Well)) (IN if) (S (NP (PRP we)) (VP (MD can) (NP (PRP 't)) (S (VP (VB see) (NP (PRP it))))))) (, ,) (NP (PRP it)) (VP (VBD doesn) (S (NP (PRP 't)) (VP (VB matter) (SBAR (RB even) (IN if) (S (NP (PRP it)) (VP (VBZ is) (ADVP (RB there)))))))) (. .)))"
K/KB/KBK.xml,KBKRE00A,2011,144,,A,87,3,N'est pas?,"[N/NNP, 'est/NNP, pas/NN, ?/.]",(ROOT (NP (NP (NNP N) (NNP 'est)) (NP (NN pas)) (. ?)))
K/KB/KBK.xml,KBKRE00A,2011,145,,B,88,1,Well you certainly can't see it.,"[Well/RB, you/PRP, certainly/RB, can/MD, 't/PRP, see/VB, it/PRP, ./.]",(ROOT (S (ADVP (RB Well)) (NP (PRP you)) (ADVP (RB certainly)) (VP (MD can) (NP (PRP 't)) (S (VP (VB see) (NP (PRP it))))) (. .)))
K/KB/KBK.xml,KBKRE00A,2011,146,,B,88,2,Which is  (()) cos there was this big round grease mark.,"[Which/WDT, is/VBZ, cos/NN, there/EX, was/VBD, this/DT, big/JJ, round/NN, grease/NN, mark/NN, ./.]",(ROOT (S (NP (WDT Which)) (VP (VBZ is) (NP (NP (NN cos)) (SBAR (S (NP (EX there)) (VP (VBD was) (NP (DT this) (JJ big) (NN round) (NN grease) (NN mark))))))) (. .)))
K/KB/KBK.xml,KBKRE00A,2011,147,,B,88,3,It was very  (()) but maybe I got it out.,"[It/PRP, was/VBD, very/RB, but/CC, maybe/RB, I/PRP, got/VBD, it/PRP, out/RP, ./.]",(ROOT (S (S (NP (PRP It)) (VP (VBD was) (ADVP (RB very) (CC but) (RB maybe)))) (NP (PRP I)) (VP (VBD got) (NP (PRP it)) (PRT (RP out))) (. .)))
K/KB/KBK.xml,KBKRE00A,2011,148,,B,88,4,But I suppose that  --,"[But/CC, I/PRP, suppose/VBP, that/IN, might/MD, erm/VB]",(ROOT (S (CC But) (NP (PRP I)) (VP (VBP suppose) (SBAR (IN that) (S (VP (MD might) (VP (VB erm))))))))
K/KB/KBK.xml,KBKRE00A,2011,149,,B,88,5,--might erm,"[But/CC, I/PRP, suppose/VBP, that/IN, might/MD, erm/VB]",(ROOT (S (CC But) (NP (PRP I)) (VP (VBP suppose) (SBAR (IN that) (S (VP (MD might) (VP (VB erm))))))))
K/KB/KBK.xml,KBKRE00A,2011,150,,A,89,1,Don't you think they go well together?,"[Don/NNP, 't/PRP, you/PRP, think/VBP, they/PRP, go/VB, well/RB, together/RB, ?/.]",(ROOT (S (NP (NNP Don) (PRP 't)) (NP (PRP you)) (VP (VBP think) (S (NP (PRP they)) (VP (VB go) (ADVP (RB well) (RB together))))) (. ?)))
K/KB/KBK.xml,KBKRE00A,2011,151,,B,90,1,work.,"[work/NN, ./.]",(ROOT (NP (NN work) (. .)))
K/KB/KBK.xml,KBKRE00A,2011,152,,B,90,2,Those colours are not too dark are they?,"[Those/DT, colours/NNS, are/VBP, not/RB, too/RB, dark/JJ, are/VBP, they/PRP, ?/.]",(ROOT (S (NP (DT Those) (NNS colours)) (VP (VBP are) (RB not) (ADJP (RB too) (JJ dark) (SBAR (S (VP (VBP are) (NP (PRP they))))))) (. ?)))
K/KB/KBK.xml,KBKRE00A,2011,153,,A,91,1,(()) ,[],X
K/KB/KBK.xml,KBKRE00A,2011,154,,B,92,1,They're not perfect but they would do (()) .,"[They/PRP, 're/VBP, not/RB, perfect/JJ, but/CC, they/PRP, would/MD, do/VB, ./.]",(ROOT (S (S (NP (PRP They)) (VP (VBP 're) (RB not) (ADJP (JJ perfect)))) (CC but) (S (NP (PRP they)) (VP (MD would) (VP (VB do)))) (. .)))
K/KB/KBK.xml,KBKRE00A,2011,155,,B,92,2,Oh what about this?,"[Oh/UH, what/WP, about/IN, this/DT, ?/.]",(ROOT (FRAG (PP (NP (UH Oh)) (PP (NP (WP what)) (IN about) (NP (DT this)))) (. ?)))
K/KB/KBK.xml,KBKRE00A,2011,156,,B,92,3,Mind you this skirt is only casual.,"[Mind/VB, you/PRP, this/DT, skirt/NN, is/VBZ, only/RB, casual/JJ, ./.]",(ROOT (S (VP (VB Mind) (NP (PRP you)) (SBAR (S (NP (DT this) (NN skirt)) (VP (VBZ is) (NP (RB only) (JJ casual)))))) (. .)))
K/KB/KBK.xml,KBKRE00A,2011,157,,B,92,4,And that's a rather sort of formal blouse.,"[And/CC, that/DT, 's/VBZ, a/DT, rather/RB, sort/NN, of/IN, formal/JJ, blouse/NN, ./.]",(ROOT (S (CC And) (NP (DT that)) (VP (VBZ 's) (NP (NP (DT a) (ADVP (RB rather)) (NN sort)) (PP (IN of) (NP (JJ formal) (NN blouse))))) (. .)))
K/KB/KBK.xml,KBKRE00A,2011,158,,B,92,5,No that's wrong.,"[No/DT, that/WDT, 's/VBZ, wrong/JJ, ./.]",(ROOT (S (VP (NP (DT No) (S (NP (WDT that)) (VP (VBZ 's) (ADJP (JJ wrong)))))) (. .)))
K/KB/KBK.xml,KBKRE00A,2011,159,,B,92,6,(()) wrong.,"[wrong/JJ, ./.]",(ROOT (FRAG (ADJP (JJ wrong)) (. .)))
K/KB/KBK.xml,KBKRE00A,2011,160,,A,93,1,Oddly enough I mean it's so far away from the yellow I would say it isn't wrong.,"[Oddly/RB, enough/RB, I/PRP, mean/VBP, it/PRP, 's/VBZ, so/RB, far/RB, away/RB, from/IN, the/DT, yellow/JJ, I/PRP, would/MD, say/VB, it/PRP, isn/JJ, 't/PRP, wrong/JJ, ./.]",(ROOT (S (ADVP (RB Oddly) (RB enough)) (NP (PRP I)) (VP (VBP mean) (SBAR (S (NP (PRP it)) (VP (VBZ 's) (ADVP (RB so) (RB far) (RB away)) (PP (IN from) (NP (NP (NP (DT the) (JJ yellow)) (SBAR (S (NP (PRP I)) (VP (MD would) (VP (VB say) (S (NP (PRP it)) (ADJP (JJ isn)))))))) (ADJP (NP (PRP 't)) (JJ wrong)))))))) (. .)))
K/KB/KBK.xml,KBKRE00A,2011,161,,B,94,1,Oh it is wrong.,"[Oh/UH, it/PRP, is/VBZ, wrong/JJ, ./.]",(ROOT (S (S (INTJ (UH Oh)) (NP (PRP it)) (VP (VBZ is) (ADJP (JJ wrong)))) (. .)))
K/KB/KBK.xml,KBKRE00A,2011,162,,B,94,2,"It's not, it's not the same as this at all.","[It/PRP, 's/VBZ, not/RB, ,/,, it/PRP, 's/VBZ, not/RB, the/DT, same/JJ, as/IN, this/DT, at/IN, all/DT, ./.]","(ROOT (S (S (NP (PRP It)) (VP (VBZ 's) (RB not))) (, ,) (NP (PRP it)) (VP (VBZ 's) (RB not) (NP (DT the) (JJ same)) (PP (IN as) (NP (NP (DT this)) (ADVP (IN at) (DT all))))) (. .)))"
K/KB/KBK.xml,KBKRE00A,2011,163,,B,94,3,That's sort of brilliant ,"[That/DT, 's/VBZ, sort/NN, of/IN, brilliant/JJ]",(ROOT (S (NP (DT That)) (VP (VBZ 's) (ADJP (ADVP (NN sort) (IN of)) (JJ brilliant)))))
K/KB/KBK.xml,KBKRE00A,2011,164,,A,95,1,"That, that's a hot pattern and colour isn't it?","[That/DT, ,/,, that/DT, 's/VBZ, a/DT, hot/JJ, pattern/NN, and/CC, colour/NN, isn/NN, 't/PRP, it/PRP, ?/.]","(ROOT (FRAG (NP (DT That)) (, ,) (SBAR (WHNP (DT that)) (S (VP (VBZ 's) (NP (NP (DT a) (JJ hot) (NN pattern) (CC and) (NN colour) (NN isn)) (NP (NP (PRP 't)) (NP (PRP it))))))) (. ?)))"
K/KB/KBK.xml,KBKRE00A,2011,165,,B,96,1,"That's a brilliant yellow, yes.","[That/DT, 's/VBZ, a/DT, brilliant/JJ, yellow/NN, ,/,, yes/UH, ./.]","(ROOT (S (S (NP (DT That)) (VP (VBZ 's) (NP (DT a) (JJ brilliant) (NN yellow)))) (, ,) (FRAG (INTJ (UH yes))) (. .)))"
K/KB/KBK.xml,KBKRE00A,2011,166,,B,96,2,And this one's erm a sort of golder.,"[And/CC, this/DT, one/NN, 's/POS, erm/NN, a/DT, sort/NN, of/IN, golder/NNP, ./.]",(ROOT (FRAG (CC And) (NP (NP (NP (NP (DT this) (NN one) (POS 's)) (NN erm)) (NP (DT a) (NN sort))) (PP (IN of) (NP (NNP golder)))) (. .)))
K/KB/KBK.xml,KBKRE00A,2011,167,,B,96,3,And that wouldn't do.,"[And/CC, that/DT, wouldn/NN, 't/PRP, do/VBP, ./.]",(ROOT (FRAG (CC And) (NP (DT that) (NN wouldn) (SBAR (S (NP (PRP 't)) (VP (VBP do))))) (. .)))
K/KB/KBK.xml,KBKRE00A,2011,168,,B,96,4,But that's colours go with that (()) .,"[But/CC, that/DT, 's/VBZ, colours/NNS, go/VB, with/IN, that/DT, ./.]",(ROOT (S (CC But) (NP (DT that)) (VP (VBZ 's) (S (NP (NNS colours)) (VP (VB go) (PP (IN with) (NP (DT that)))))) (. .)))
K/KB/KBK.xml,KBKRE00A,2011,169,,A,97,1,Mhm.,"[Mhm/NNP, ./.]",(ROOT (FRAG (NP (NNP Mhm)) (. .)))
K/KB/KBK.xml,KBKRE00A,2011,170,,B,98,1,Those are the only (()) .,"[Those/DT, are/VBP, the/DT, only/RB, ./.]",(ROOT (S (NP (DT Those)) (VP (VBP are) (NP (DT the) (RB only))) (. .)))
K/KB/KBK.xml,KBKRE00A,2011,171,,B,98,2,"And I'll keep this blue skirt  (()) stain, quite smart.","[And/CC, I/PRP, 'll/MD, keep/VB, this/DT, blue/JJ, skirt/NN, stain/VB, ,/,, quite/RB, smart/JJ, ./.]","(ROOT (S (CC And) (NP (PRP I)) (VP (MD 'll) (VP (VB keep) (S (NP (DT this) (JJ blue) (NN skirt)) (VP (VB stain))) (, ,) (ADJP (RB quite) (JJ smart)))) (. .)))"
K/KB/KBK.xml,KBKRE00A,2011,172,,A,99,1,Yes.,"[Yes/UH, ./.]",(ROOT (INTJ (UH Yes) (. .)))
K/KB/KBK.xml,KBKRE00A,2011,173,,B,100,1,(()) .,[./.],(ROOT (NP (. .)))
K/KB/KBK.xml,KBKRE00A,2011,174,,B,100,2,And I'll keep the dress.,"[And/CC, I/PRP, 'll/MD, keep/VB, the/DT, dress/NN, ./.]",(ROOT (S (CC And) (NP (PRP I)) (VP (MD 'll) (VP (VB keep) (NP (DT the) (NN dress)))) (. .)))
K/KB/KBK.xml,KBKRE00A,2011,175,,B,100,3,And I'll think about the shirt.,"[And/CC, I/PRP, 'll/MD, think/VB, about/IN, the/DT, shirt/NN, ./.]",(ROOT (S (CC And) (NP (PRP I)) (VP (MD 'll) (VP (VB think) (PP (IN about) (NP (DT the) (NN shirt))))) (. .)))
K/KB/KBK.xml,KBKRE00A,2011,176,,B,100,4,I like it with the skirt.,"[I/PRP, like/VBP, it/PRP, with/IN, the/DT, skirt/NN, ./.]",(ROOT (S (NP (PRP I)) (VP (VBP like) (NP (PRP it)) (PP (IN with) (NP (DT the) (NN skirt)))) (. .)))
K/KB/KBK.xml,KBKRE00A,2011,177,,B,100,5,What I might do is go back to Marks.,"[What/WP, I/PRP, might/MD, do/VB, is/VBZ, go/VB, back/RB, to/TO, Marks/NNS, ./.]",(ROOT (S (SBAR (WHNP (WP What)) (S (NP (PRP I)) (VP (MD might) (VP (VB do))))) (VP (VBZ is) (VP (VB go) (ADVP (RB back)) (PP (TO to) (NP (NNS Marks))))) (. .)))
K/KB/KBK.xml,KBKRE00A,2011,178,,B,100,6,If they have one thing in that colour they may have another one.,"[If/IN, they/PRP, have/VBP, one/CD, thing/NN, in/IN, that/DT, colour/NN, they/PRP, may/MD, have/VB, another/DT, one/CD, ./.]",(ROOT (S (SBAR (IN If) (S (NP (PRP they)) (VP (VBP have) (NP (NP (CD one) (NN thing)) (PP (IN in) (NP (DT that) (NN colour))))))) (NP (PRP they)) (VP (MD may) (VP (VB have) (NP (DT another) (CD one)))) (. .)))
K/KB/KBK.xml,KBKRE00A,2011,179,,A,101,1,In what colour?,"[In/IN, what/WDT, colour/NN, ?/.]",(ROOT (FRAG (PP (IN In) (WHNP (WDT what) (NN colour))) (. ?)))
K/KB/KBK.xml,KBKRE00A,2011,180,,A,101,2,We were chatting.,"[We/PRP, were/VBD, chatting/VBG, ./.]",(ROOT (S (NP (PRP We)) (VP (VBD were) (VP (VBG chatting))) (. .)))
K/KB/KBK.xml,KBKRE00A,2011,181,,B,102,1,The gold (()) ,"[The/DT, gold/NN]",(ROOT (FRAG (NP (DT The) (NN gold))))
K/KB/KBK.xml,KBKRE00A,2011,182,,A,103,1,"Are you, are you thinking of that because it's a bit too formal or something?","[Are/VBP, you/PRP, ,/,, are/VBP, you/PRP, thinking/VBG, of/IN, that/DT, because/IN, it/PRP, 's/VBZ, a/DT, bit/NN, too/RB, formal/JJ, or/CC, something/NN, ?/.]","(ROOT (SQ (VBP Are) (NP (PRP you)) (VP (, ,) (S (VP (VBP are) (NP (NP (NP (PRP you)) (VP (VBG thinking) (PP (IN of) (NP (DT that))) (SBAR (IN because) (S (NP (PRP it)) (VP (VBZ 's) (ADJP (NP (DT a) (NN bit)) (RB too) (JJ formal))))))) (CC or) (NP (NN something)))))) (. ?)))"
K/KB/KBK.xml,KBKRE00A,2011,183,,B,104,1,No just because it hasn't got the length for tucking in.,"[No/DT, just/RB, because/IN, it/PRP, hasn/VBD, 't/PRP, got/VBD, the/DT, length/NN, for/IN, tucking/VBG, in/IN, ./.]",(ROOT (S (NP (NP (DT No) (RB just)) (SBAR (IN because) (S (NP (PRP it)) (VP (VBD hasn) (NP (PRP 't)))))) (VP (VBD got) (NP (DT the) (NN length)) (PP (IN for) (S (VP (VBG tucking) (PP (IN in)))))) (. .)))
K/KB/KBK.xml,KBKRE00A,2011,184,,A,105,1,"Oh, yes.","[Oh/UH, ,/,, yes/UH, ./.]","(ROOT (INTJ (INTJ (UH Oh)) (, ,) (INTJ (UH yes) (. .))))"
K/KB/KBK.xml,KBKRE00A,2011,185,,B,106,1,And I don't like these that pull out when you (()) ,"[And/CC, I/PRP, don/VBP, 't/PRP, like/IN, these/DT, that/IN, pull/VB, out/RP, when/WRB, you/PRP]",(ROOT (S (CC And) (NP (PRP I)) (VP (VBP don) (NP (PRP 't)) (PP (IN like) (NP (DT these))) (SBAR (IN that) (SINV (VP (VB pull) (PRT (RP out)) (FRAG (WHADVP (WRB when)))) (NP (PRP you)))))))
K/KB/KBK.xml,KBKRE00A,2011,186,,A,107,1,Well at least if it pulls out it looks alright.,"[Well/RB, at/IN, least/JJS, if/IN, it/PRP, pulls/VBZ, out/IN, it/PRP, looks/VBZ, alright/JJ, ./.]",(ROOT (S (ADVP (ADVP (RB Well)) (SBAR (ADVP (IN at) (JJS least)) (IN if) (S (NP (PRP it)) (VP (VBZ pulls) (PRT (IN out)))))) (NP (PRP it)) (VP (VBZ looks) (ADJP (JJ alright))) (. .)))
K/KB/KBK.xml,KBKRE00A,2011,187,,A,107,2,It was interesting in the pub last night.,"[It/PRP, was/VBD, interesting/JJ, in/IN, the/DT, pub/NN, last/JJ, night/NN, ./.]",(ROOT (S (NP (PRP It)) (VP (VBD was) (ADJP (JJ interesting) (PP (IN in) (NP (DT the) (NN pub)))) (NP (JJ last) (NN night))) (. .)))
K/KB/KBK.xml,KBKRE00A,2011,188,,A,107,3,There were quite a lot of enthusiastic er  --,"[There/EX, were/VBD, quite/RB, a/DT, lot/NN, of/IN, enthusiastic/JJ, er/NN, audience/NN, but/CC, er/NN, they/PRP, were/VBD, mostly/RB, grey/JJ, beards/NNS, like/IN, me/PRP, ./.]",(ROOT (S (NP (EX There)) (VP (VBD were) (NP (NP (RB quite) (DT a) (NN lot)) (PP (IN of) (NP (NP (JJ enthusiastic) (NN er) (NN audience)) (PP (CC but) (NP (NN er))))) (SBAR (S (NP (PRP they)) (VP (VBD were) (ADVP (RB mostly)) (NP (NP (JJ grey) (NNS beards)) (PP (IN like) (NP (PRP me))))))))) (. .)))
K/KB/KBK.xml,KBKRE00A,2011,189,,A,107,4,--audience but er they were mostly grey beards like me.,"[There/EX, were/VBD, quite/RB, a/DT, lot/NN, of/IN, enthusiastic/JJ, er/NN, audience/NN, but/CC, er/NN, they/PRP, were/VBD, mostly/RB, grey/JJ, beards/NNS, like/IN, me/PRP, ./.]",(ROOT (S (NP (EX There)) (VP (VBD were) (NP (NP (RB quite) (DT a) (NN lot)) (PP (IN of) (NP (NP (JJ enthusiastic) (NN er) (NN audience)) (PP (CC but) (NP (NN er))))) (SBAR (S (NP (PRP they)) (VP (VBD were) (ADVP (RB mostly)) (NP (NP (JJ grey) (NNS beards)) (PP (IN like) (NP (PRP me))))))))) (. .)))
K/KB/KBK.xml,KBKRE00A,2011,190,,A,107,5,Yes.,"[Yes/UH, ./.]",(ROOT (INTJ (UH Yes) (. .)))
