swda_filename,ptb_basename,conversation_no,transcript_index,act_tag,caller,turn_index,subutterance_index,text,pos,trees
K/KB/KBK.xml,KBKRE01U,2227,0,,A,1,1,Bingo  --,"[Bingo/NNP, what/WDT, what/WP, ,/,, what/WP, ,/,, what/WP, ,/,, what/WP, ,/,, what/WP, ,/,, what/WDT, ./.]","(ROOT (NP (NP (NP (NNP Bingo)) (SBAR (WHNP (WDT what)))) (NP (NP (WP what)) (, ,) (UCP (NP (WP what)) (, ,) (NP (WP what)) (, ,) (NP (WP what)) (, ,) (NP (WP what)) (, ,) (PP (WDT what)))) (. .)))"
K/KB/KBK.xml,KBKRE01U,2227,1,,A,1,2,--what  --,"[Bingo/NNP, what/WDT, what/WP, ,/,, what/WP, ,/,, what/WP, ,/,, what/WP, ,/,, what/WP, ,/,, what/WDT, ./.]","(ROOT (NP (NP (NP (NNP Bingo)) (SBAR (WHNP (WDT what)))) (NP (NP (WP what)) (, ,) (UCP (NP (WP what)) (, ,) (NP (WP what)) (, ,) (NP (WP what)) (, ,) (NP (WP what)) (, ,) (PP (WDT what)))) (. .)))"
K/KB/KBK.xml,KBKRE01U,2227,2,,A,1,3,"--what, what, what, what, what, what.","[Bingo/NNP, what/WDT, what/WP, ,/,, what/WP, ,/,, what/WP, ,/,, what/WP, ,/,, what/WP, ,/,, what/WDT, ./.]","(ROOT (NP (NP (NP (NNP Bingo)) (SBAR (WHNP (WDT what)))) (NP (NP (WP what)) (, ,) (UCP (NP (WP what)) (, ,) (NP (WP what)) (, ,) (NP (WP what)) (, ,) (NP (WP what)) (, ,) (PP (WDT what)))) (. .)))"
K/KB/KBK.xml,KBKRE01U,2227,3,,B,2,1,Wasn't what you were expecting was it?,"[Wasn/NNP, 't/PRP, what/WP, you/PRP, were/VBD, expecting/VBG, was/VBD, it/PRP, ?/.]",(ROOT (S (NP (NNP Wasn) (PRP 't)) (SBAR (WHNP (WP what)) (S (NP (PRP you)) (VP (VBD were) (VP (VBG expecting))))) (VP (VBD was) (NP (PRP it))) (. ?)))
K/KB/KBK.xml,KBKRE01U,2227,4,,A,3,1,"No, I think that might be because it doesn't include the welding grants, but even so, let's have a look at, down here (()) ","[No/DT, ,/,, I/PRP, think/VBP, that/IN, might/MD, be/VB, because/IN, it/PRP, doesn/VBD, 't/PRP, include/VBP, the/DT, welding/NN, grants/NNS, ,/,, but/CC, even/RB, so/RB, ,/,, let/VB, 's/PRP, have/VB, a/DT, look/NN, at/IN, ,/,, down/RB, here/RB]","(ROOT (NP (S (NP (DT No)) (, ,) (NP (PRP I)) (VP (VBP think) (SBAR (IN that) (S (VP (MD might) (VP (VB be) (UCP (SBAR (IN because) (S (NP (PRP it)) (VP (VBD doesn) (SBAR (S (NP (PRP 't)) (VP (VBP include) (NP (DT the) (NN welding) (NNS grants)))))))) (, ,) (CC but) (ADVP (RB even) (RB so)))) (, ,) (VP (VB let) (S (NP (PRP 's)) (VP (VB have) (NP (DT a) (NN look)))) (PP (IN at)) (, ,) (ADVP (RB down) (RB here))))))))))"
