swda_filename,ptb_basename,conversation_no,transcript_index,act_tag,caller,turn_index,subutterance_index,text,pos,trees
K/KC/KCF.xml,KCFRE001,28002,42,,B,16,14,"--the weeds er the weeds haven't grown, but you get a wet summer  --","[And/CC, he/PRP, 's/VBZ, gotta/NNP, do/VB, it/PRP, a/DT, few/JJ, times/NNS, ,/,, so/RB, then/RB, the/DT, cost/NN, becomes/VBZ, and/CC, ,/,, and/CC, you/PRP, like/IN, let/VB, 's/POS, be/VB, fair/JJ, ,/,, we/PRP, 've/VBP, had/VBD, summers/NNS, where/WRB, it/PRP, 's/VBZ, the/DT, weeds/NNS, er/NN, the/DT, weeds/NNS, haven/NN, 't/PRP, grown/VBN, ,/,, but/CC, you/PRP, get/VBP, a/DT, wet/JJ, summer/NN, and/CC, the/DT, weather/NN, warms/NNS, and/CC, the/DT, wet/NNP, and/CC, the/DT, weeds/NNS, go/VBP, peooow/NN, up/RP, like/IN, that/DT, ./.]","(ROOT (S (CC And) (NP (PRP he)) (VP (VBZ 's) (S (S (S (NP (NNP gotta)) (VP (VB do) (S (NP (PRP it)) (NP (DT a) (JJ few) (NNS times))))) (, ,) (RB so) (S (ADVP (RB then)) (NP (DT the) (NN cost)) (VP (VBZ becomes)))) (CC and) (, ,) (CC and) (S (NP (PRP you)) (PP (IN like) (S (S (S (S (VP (VB let) (S (NP (POS 's)) (VP (VB be) (ADJP (JJ fair)))))) (, ,) (NP (PRP we)) (VP (VBP 've) (VP (VBD had) (NP (NP (NNS summers)) (SBAR (WHADVP (WRB where)) (S (NP (PRP it)) (VP (VBZ 's) (NP (NP (NP (DT the) (NNS weeds) (NN er)) (NP (DT the) (NNS weeds) (NN haven))) (SBAR (S (NP (PRP 't)) (VP (VBN grown)))))))))))) (, ,) (CC but) (S (NP (PRP you)) (VP (VBP get) (NP (NP (DT a) (JJ wet) (NN summer)) (CC and) (NP (NP (DT the) (NN weather) (NNS warms)) (CC and) (NP (DT the) (NNP wet))))))) (CC and) (S (NP (DT the) (NNS weeds)) (VP (VBP go) (NP (NN peooow)) (PRT (RP up)) (PP (IN like) (NP (DT that)))))))))) (. .)))"
K/KC/KCF.xml,KCFRE001,28002,43,,B,16,15,--and the weather warms and the wet and the weeds go peooow up like that.,"[And/CC, he/PRP, 's/VBZ, gotta/NNP, do/VB, it/PRP, a/DT, few/JJ, times/NNS, ,/,, so/RB, then/RB, the/DT, cost/NN, becomes/VBZ, and/CC, ,/,, and/CC, you/PRP, like/IN, let/VB, 's/POS, be/VB, fair/JJ, ,/,, we/PRP, 've/VBP, had/VBD, summers/NNS, where/WRB, it/PRP, 's/VBZ, the/DT, weeds/NNS, er/NN, the/DT, weeds/NNS, haven/NN, 't/PRP, grown/VBN, ,/,, but/CC, you/PRP, get/VBP, a/DT, wet/JJ, summer/NN, and/CC, the/DT, weather/NN, warms/NNS, and/CC, the/DT, wet/NNP, and/CC, the/DT, weeds/NNS, go/VBP, peooow/NN, up/RP, like/IN, that/DT, ./.]","(ROOT (S (CC And) (NP (PRP he)) (VP (VBZ 's) (S (S (S (NP (NNP gotta)) (VP (VB do) (S (NP (PRP it)) (NP (DT a) (JJ few) (NNS times))))) (, ,) (RB so) (S (ADVP (RB then)) (NP (DT the) (NN cost)) (VP (VBZ becomes)))) (CC and) (, ,) (CC and) (S (NP (PRP you)) (PP (IN like) (S (S (S (S (VP (VB let) (S (NP (POS 's)) (VP (VB be) (ADJP (JJ fair)))))) (, ,) (NP (PRP we)) (VP (VBP 've) (VP (VBD had) (NP (NP (NNS summers)) (SBAR (WHADVP (WRB where)) (S (NP (PRP it)) (VP (VBZ 's) (NP (NP (NP (DT the) (NNS weeds) (NN er)) (NP (DT the) (NNS weeds) (NN haven))) (SBAR (S (NP (PRP 't)) (VP (VBN grown)))))))))))) (, ,) (CC but) (S (NP (PRP you)) (VP (VBP get) (NP (NP (DT a) (JJ wet) (NN summer)) (CC and) (NP (NP (DT the) (NN weather) (NNS warms)) (CC and) (NP (DT the) (NNP wet))))))) (CC and) (S (NP (DT the) (NNS weeds)) (VP (VBP go) (NP (NN peooow)) (PRT (RP up)) (PP (IN like) (NP (DT that)))))))))) (. .)))"
K/KC/KCF.xml,KCFRE001,28002,44,,B,16,16,"So that's, and then it doesn't  --","[So/IN, that/DT, 's/VBZ, ,/,, and/CC, then/RB, it/PRP, doesn/VBD, 't/PRP, stops/VBZ]","(ROOT (S (S (IN So) (NP (DT that)) (VP (VBZ 's))) (, ,) (CC and) (S (ADVP (RB then)) (NP (PRP it)) (VP (VBD doesn) (SBAR (S (NP (PRP 't)) (VP (VBZ stops))))))))"
K/KC/KCF.xml,KCFRE001,28002,45,,B,16,17,--stops (()) ,"[So/IN, that/DT, 's/VBZ, ,/,, and/CC, then/RB, it/PRP, doesn/VBD, 't/PRP, stops/VBZ]","(ROOT (S (S (IN So) (NP (DT that)) (VP (VBZ 's))) (, ,) (CC and) (S (ADVP (RB then)) (NP (PRP it)) (VP (VBD doesn) (SBAR (S (NP (PRP 't)) (VP (VBZ stops))))))))"
K/KC/KCF.xml,KCFRE001,28002,46,,A,17,1,"Well alright then, why can't he put bark on it (()) ?","[Well/RB, alright/JJ, then/RB, ,/,, why/WRB, can/MD, 't/PRP, he/PRP, put/VBD, bark/NN, on/IN, it/PRP, ?/.]","(ROOT (SBARQ (PP (PP (ADVP (RB Well)) (ADJP (JJ alright))) (ADVP (RB then))) (, ,) (WHADVP (WRB why)) (SQ (VP (MD can)) (NP (PRP 't)) (NP (NP (PRP he)) (SBAR (S (VP (VBD put) (NP (NN bark)) (PP (IN on) (NP (PRP it)))))))) (. ?)))"
K/KC/KCF.xml,KCFRE001,28002,47,,B,18,1,"Well that, it costs.","[Well/RB, that/IN, ,/,, it/PRP, costs/VBZ, ./.]","(ROOT (FRAG (ADVP (RB Well)) (SBAR (IN that) (, ,) (S (NP (PRP it)) (VP (VBZ costs)))) (. .)))"
K/KC/KCF.xml,KCFRE001,28002,48,,A,19,1,(()) from everywhere.,"[from/IN, everywhere/RB, ./.]",(ROOT (FRAG (PP (IN from) (NP (RB everywhere))) (. .)))
K/KC/KCF.xml,KCFRE001,28002,49,,A,19,2,Do it that way.,"[Do/VB, it/PRP, that/DT, way/NN, ./.]",(ROOT (S (VP (VB Do) (S (NP (PRP it)) (NP (DT that) (NN way)))) (. .)))
K/KC/KCF.xml,KCFRE001,28002,50,,B,20,1,But it's still costs isn't it?,"[But/CC, it/PRP, 's/VBZ, still/RB, costs/VBZ, isn/NN, 't/PRP, it/PRP, ?/.]",(ROOT (SINV (S (CC But) (NP (PRP it)) (VP (VBZ 's) (ADVP (RB still)))) (VP (VBZ costs) (NP (NN isn)) (NP (PRP 't))) (NP (PRP it)) (. ?)))
K/KC/KCF.xml,KCFRE001,28002,51,,A,21,1,(()) ,[],
K/KC/KCF.xml,KCFRE001,28002,52,,B,22,1,Well then if you put a lot of bark on it  --,"[Well/RB, then/RB, if/IN, you/PRP, put/VBP, a/DT, lot/NN, of/IN, bark/NN, on/IN, it/PRP, and/CC, with/IN, vegetables/NNS, ,/,, so/IN, they/PRP, want/VBP, fertilizer/NN]","(ROOT (FRAG (ADVP (RB Well)) (SBAR (ADVP (RB then)) (IN if) (S (NP (PRP you)) (VP (VBP put) (NP (NP (DT a) (NN lot)) (PP (IN of) (NP (NN bark)))) (PP (PP (IN on) (NP (PRP it))) (CC and) (PP (IN with) (NP (NP (NNS vegetables)) (, ,) (SBAR (IN so) (S (NP (PRP they)) (VP (VBP want) (NP (NN fertilizer)))))))))))))"
K/KC/KCF.xml,KCFRE001,28002,53,,B,22,2,"--and with vegetables, so they want  <laughing> fertilizer </laughing> ","[Well/RB, then/RB, if/IN, you/PRP, put/VBP, a/DT, lot/NN, of/IN, bark/NN, on/IN, it/PRP, and/CC, with/IN, vegetables/NNS, ,/,, so/IN, they/PRP, want/VBP, fertilizer/NN]","(ROOT (FRAG (ADVP (RB Well)) (SBAR (ADVP (RB then)) (IN if) (S (NP (PRP you)) (VP (VBP put) (NP (NP (DT a) (NN lot)) (PP (IN of) (NP (NN bark)))) (PP (PP (IN on) (NP (PRP it))) (CC and) (PP (IN with) (NP (NP (NNS vegetables)) (, ,) (SBAR (IN so) (S (NP (PRP they)) (VP (VBP want) (NP (NN fertilizer)))))))))))))"
K/KC/KCF.xml,KCFRE001,28002,54,,A,23,1,Well  (()) ,[Well/RB],(ROOT (INTJ (RB Well)))
K/KC/KCF.xml,KCFRE001,28002,55,,B,24,1,(()) ,[],
