swda_filename,ptb_basename,conversation_no,transcript_index,act_tag,caller,turn_index,subutterance_index,text,pos,trees
K/KC/KCN.xml,KCNRE01K,27602,204,,B,68,8,--foreseeable future.,"[She/PRP, 'll/MD, get/VB, the/DT, house/NNP, if/IN, The/DT, Sunnin-/NN, Sunninghill/VBD, the/DT, five/CD, million/CD, house/NNP, ,/,, built/VBN, for/IN, the/DT, couple/NN, at/IN, the/DT, Queen/NN, 's/POS, expense/NN, will/MD, remain/VB, Fergie/NNP, 's/POS, home/NN, for/IN, the/DT, foreseeable/JJ, future/NN, ./.]","(ROOT (S (NP (PRP She)) (VP (MD 'll) (VP (VB get) (NP (DT the) (NNP house)) (SBAR (IN if) (S (NP (DT The) (NN Sunnin-)) (VP (VBD Sunninghill) (NP (NP (DT the) (ADJP (QP (CD five) (CD million))) (NNP house)) (, ,) (VP (VBN built) (SBAR (IN for) (S (NP (NP (DT the) (NN couple)) (PP (IN at) (NP (NP (DT the) (NN Queen) (POS 's)) (NN expense)))) (VP (MD will) (VP (VB remain) (NP (NP (NP (NNP Fergie) (POS 's)) (NN home)) (PP (IN for) (NP (DT the) (JJ foreseeable) (NN future))))))))))))))) (. .)))"
K/KC/KCN.xml,KCNRE01K,27602,205,,B,68,9,The Queen who gave it to Andy and Fergie as a wedding present  --,"[The/DT, Queen/NN, who/WP, gave/VBD, it/PRP, to/TO, Andy/NNP, and/CC, Fergie/NNP, as/IN, a/DT, wedding/NN, present/JJ, has/VBZ, made/VBN, it/PRP, clear/JJ, to/TO, her/PRP$, advisors/NNP, that/IN, the/DT, Duchess/NN, should/MD, not/RB, be/VB, forced/VBN, to/TO, leave/VB, ,/,, as/RB, long/RB, as/IN, the-/NN, she/PRP, adheres/VBZ, to/TO, her/PRP$, agreement/NN, not/RB, to/TO, talk/VB, about/IN, the/DT, marriage/NN, break/VB, up/RP, ./.]","(ROOT (S (NP (NP (DT The) (NN Queen)) (SBAR (WHNP (WP who)) (S (VP (VBD gave) (NP (PRP it)) (PP (TO to) (NP (NNP Andy) (CC and) (NNP Fergie))) (PP (IN as) (NP (DT a) (NN wedding) (JJ present))))))) (VP (VBZ has) (VP (VBN made) (S (NP (PRP it)) (ADJP (JJ clear) (PP (TO to) (NP (PRP$ her) (NNP advisors))))) (SBAR (IN that) (S (NP (DT the) (NN Duchess)) (VP (MD should) (VP (RB not) (VP (VB be) (VP (VBN forced) (S (VP (TO to) (VP (VB leave)))))) (, ,) (ADVP (RB as) (RB long) (PP (IN as) (NP (NP (NN the-)) (SBAR (S (NP (PRP she)) (VP (VBZ adheres) (PP (TO to) (NP (PRP$ her) (NN agreement) (S (VP (RB not) (TO to) (VP (VB talk) (PP (IN about) (NP (DT the) (NN marriage)))))))))))))) (VP (VB break) (PRT (RP up))))))))) (. .)))"
K/KC/KCN.xml,KCNRE01K,27602,206,,B,68,10,--has made it clear to her advisors  --,"[The/DT, Queen/NN, who/WP, gave/VBD, it/PRP, to/TO, Andy/NNP, and/CC, Fergie/NNP, as/IN, a/DT, wedding/NN, present/JJ, has/VBZ, made/VBN, it/PRP, clear/JJ, to/TO, her/PRP$, advisors/NNP, that/IN, the/DT, Duchess/NN, should/MD, not/RB, be/VB, forced/VBN, to/TO, leave/VB, ,/,, as/RB, long/RB, as/IN, the-/NN, she/PRP, adheres/VBZ, to/TO, her/PRP$, agreement/NN, not/RB, to/TO, talk/VB, about/IN, the/DT, marriage/NN, break/VB, up/RP, ./.]","(ROOT (S (NP (NP (DT The) (NN Queen)) (SBAR (WHNP (WP who)) (S (VP (VBD gave) (NP (PRP it)) (PP (TO to) (NP (NNP Andy) (CC and) (NNP Fergie))) (PP (IN as) (NP (DT a) (NN wedding) (JJ present))))))) (VP (VBZ has) (VP (VBN made) (S (NP (PRP it)) (ADJP (JJ clear) (PP (TO to) (NP (PRP$ her) (NNP advisors))))) (SBAR (IN that) (S (NP (DT the) (NN Duchess)) (VP (MD should) (VP (RB not) (VP (VB be) (VP (VBN forced) (S (VP (TO to) (VP (VB leave)))))) (, ,) (ADVP (RB as) (RB long) (PP (IN as) (NP (NP (NN the-)) (SBAR (S (NP (PRP she)) (VP (VBZ adheres) (PP (TO to) (NP (PRP$ her) (NN agreement) (S (VP (RB not) (TO to) (VP (VB talk) (PP (IN about) (NP (DT the) (NN marriage)))))))))))))) (VP (VB break) (PRT (RP up))))))))) (. .)))"
K/KC/KCN.xml,KCNRE01K,27602,207,,B,68,11,"--that the Duchess should not be forced to leave, as long as the- --","[The/DT, Queen/NN, who/WP, gave/VBD, it/PRP, to/TO, Andy/NNP, and/CC, Fergie/NNP, as/IN, a/DT, wedding/NN, present/JJ, has/VBZ, made/VBN, it/PRP, clear/JJ, to/TO, her/PRP$, advisors/NNP, that/IN, the/DT, Duchess/NN, should/MD, not/RB, be/VB, forced/VBN, to/TO, leave/VB, ,/,, as/RB, long/RB, as/IN, the-/NN, she/PRP, adheres/VBZ, to/TO, her/PRP$, agreement/NN, not/RB, to/TO, talk/VB, about/IN, the/DT, marriage/NN, break/VB, up/RP, ./.]","(ROOT (S (NP (NP (DT The) (NN Queen)) (SBAR (WHNP (WP who)) (S (VP (VBD gave) (NP (PRP it)) (PP (TO to) (NP (NNP Andy) (CC and) (NNP Fergie))) (PP (IN as) (NP (DT a) (NN wedding) (JJ present))))))) (VP (VBZ has) (VP (VBN made) (S (NP (PRP it)) (ADJP (JJ clear) (PP (TO to) (NP (PRP$ her) (NNP advisors))))) (SBAR (IN that) (S (NP (DT the) (NN Duchess)) (VP (MD should) (VP (RB not) (VP (VB be) (VP (VBN forced) (S (VP (TO to) (VP (VB leave)))))) (, ,) (ADVP (RB as) (RB long) (PP (IN as) (NP (NP (NN the-)) (SBAR (S (NP (PRP she)) (VP (VBZ adheres) (PP (TO to) (NP (PRP$ her) (NN agreement) (S (VP (RB not) (TO to) (VP (VB talk) (PP (IN about) (NP (DT the) (NN marriage)))))))))))))) (VP (VB break) (PRT (RP up))))))))) (. .)))"
K/KC/KCN.xml,KCNRE01K,27602,208,,B,68,12,--she adheres to her agreement  --,"[The/DT, Queen/NN, who/WP, gave/VBD, it/PRP, to/TO, Andy/NNP, and/CC, Fergie/NNP, as/IN, a/DT, wedding/NN, present/JJ, has/VBZ, made/VBN, it/PRP, clear/JJ, to/TO, her/PRP$, advisors/NNP, that/IN, the/DT, Duchess/NN, should/MD, not/RB, be/VB, forced/VBN, to/TO, leave/VB, ,/,, as/RB, long/RB, as/IN, the-/NN, she/PRP, adheres/VBZ, to/TO, her/PRP$, agreement/NN, not/RB, to/TO, talk/VB, about/IN, the/DT, marriage/NN, break/VB, up/RP, ./.]","(ROOT (S (NP (NP (DT The) (NN Queen)) (SBAR (WHNP (WP who)) (S (VP (VBD gave) (NP (PRP it)) (PP (TO to) (NP (NNP Andy) (CC and) (NNP Fergie))) (PP (IN as) (NP (DT a) (NN wedding) (JJ present))))))) (VP (VBZ has) (VP (VBN made) (S (NP (PRP it)) (ADJP (JJ clear) (PP (TO to) (NP (PRP$ her) (NNP advisors))))) (SBAR (IN that) (S (NP (DT the) (NN Duchess)) (VP (MD should) (VP (RB not) (VP (VB be) (VP (VBN forced) (S (VP (TO to) (VP (VB leave)))))) (, ,) (ADVP (RB as) (RB long) (PP (IN as) (NP (NP (NN the-)) (SBAR (S (NP (PRP she)) (VP (VBZ adheres) (PP (TO to) (NP (PRP$ her) (NN agreement) (S (VP (RB not) (TO to) (VP (VB talk) (PP (IN about) (NP (DT the) (NN marriage)))))))))))))) (VP (VB break) (PRT (RP up))))))))) (. .)))"
K/KC/KCN.xml,KCNRE01K,27602,209,,B,68,13,--not to talk about the marriage break up </reading> .,"[The/DT, Queen/NN, who/WP, gave/VBD, it/PRP, to/TO, Andy/NNP, and/CC, Fergie/NNP, as/IN, a/DT, wedding/NN, present/JJ, has/VBZ, made/VBN, it/PRP, clear/JJ, to/TO, her/PRP$, advisors/NNP, that/IN, the/DT, Duchess/NN, should/MD, not/RB, be/VB, forced/VBN, to/TO, leave/VB, ,/,, as/RB, long/RB, as/IN, the-/NN, she/PRP, adheres/VBZ, to/TO, her/PRP$, agreement/NN, not/RB, to/TO, talk/VB, about/IN, the/DT, marriage/NN, break/VB, up/RP, ./.]","(ROOT (S (NP (NP (DT The) (NN Queen)) (SBAR (WHNP (WP who)) (S (VP (VBD gave) (NP (PRP it)) (PP (TO to) (NP (NNP Andy) (CC and) (NNP Fergie))) (PP (IN as) (NP (DT a) (NN wedding) (JJ present))))))) (VP (VBZ has) (VP (VBN made) (S (NP (PRP it)) (ADJP (JJ clear) (PP (TO to) (NP (PRP$ her) (NNP advisors))))) (SBAR (IN that) (S (NP (DT the) (NN Duchess)) (VP (MD should) (VP (RB not) (VP (VB be) (VP (VBN forced) (S (VP (TO to) (VP (VB leave)))))) (, ,) (ADVP (RB as) (RB long) (PP (IN as) (NP (NP (NN the-)) (SBAR (S (NP (PRP she)) (VP (VBZ adheres) (PP (TO to) (NP (PRP$ her) (NN agreement) (S (VP (RB not) (TO to) (VP (VB talk) (PP (IN about) (NP (DT the) (NN marriage)))))))))))))) (VP (VB break) (PRT (RP up))))))))) (. .)))"
K/KC/KCN.xml,KCNRE01K,27602,210,,B,68,14,"But, a broke up's a broke up, innit?","[But/CC, ,/,, a/DT, broke/VBD, up/RP, 's/POS, a/DT, broke/VBD, up/RB, ,/,, innit/NN, ?/.]","(ROOT (S (CC But) (PRN (, ,) (S (NP (DT a)) (VP (VBD broke) (PRT (RP up)) (S (NP (POS 's)))))) (NP (DT a)) (VP (VBD broke) (ADVP (RB up)) (, ,) (S (NP (NN innit)))) (. ?)))"
K/KC/KCN.xml,KCNRE01K,27602,211,,A,69,1,Well she's been talking hasn't she?,"[Well/RB, she/PRP, 's/VBZ, been/VBN, talking/VBG, hasn/NN, 't/PRP, she/PRP, ?/.]",(ROOT (S (ADVP (RB Well)) (NP (PRP she)) (VP (VBZ 's) (VP (VBN been) (VP (VBG talking) (S (NP (NP (NN hasn)) (NP (PRP 't))) (NP (PRP she)))))) (. ?)))
K/KC/KCN.xml,KCNRE01K,27602,212,,B,70,1,<reading> The decision means the children will remain physically close to the queen  --,"[The/DT, decision/NN, means/VBZ, the/DT, children/NNS, will/MD, remain/VB, physically/RB, close/JJ, to/TO, the/DT, queen/NN, and/CC, Princess/NNP, Beatrice/NNP, will/MD, be/VB, able/JJ, to/TO, remain/VB, at/IN, the/DT, same/JJ, school/NN, ./.]",(ROOT (S (S (NP (DT The) (NN decision)) (VP (VBZ means) (SBAR (S (NP (DT the) (NNS children)) (VP (MD will) (VP (VB remain) (ADJP (RB physically) (JJ close) (PP (TO to) (NP (DT the) (NN queen)))))))))) (CC and) (S (NP (NNP Princess) (NNP Beatrice)) (VP (MD will) (VP (VB be) (ADJP (JJ able) (S (VP (TO to) (VP (VB remain) (PP (IN at) (NP (DT the) (JJ same) (NN school)))))))))) (. .)))
K/KC/KCN.xml,KCNRE01K,27602,213,,B,70,2,--and Princess Beatrice will be able to remain at the same school.,"[The/DT, decision/NN, means/VBZ, the/DT, children/NNS, will/MD, remain/VB, physically/RB, close/JJ, to/TO, the/DT, queen/NN, and/CC, Princess/NNP, Beatrice/NNP, will/MD, be/VB, able/JJ, to/TO, remain/VB, at/IN, the/DT, same/JJ, school/NN, ./.]",(ROOT (S (S (NP (DT The) (NN decision)) (VP (VBZ means) (SBAR (S (NP (DT the) (NNS children)) (VP (MD will) (VP (VB remain) (ADJP (RB physically) (JJ close) (PP (TO to) (NP (DT the) (NN queen)))))))))) (CC and) (S (NP (NNP Princess) (NNP Beatrice)) (VP (MD will) (VP (VB be) (ADJP (JJ able) (S (VP (TO to) (VP (VB remain) (PP (IN at) (NP (DT the) (JJ same) (NN school)))))))))) (. .)))
K/KC/KCN.xml,KCNRE01K,27602,214,,B,70,3,The house is not regarded as a ac- --,"[The/DT, house/NNP, is/VBZ, not/RB, regarded/VBN, as/IN, a/DT, ac-/JJ, architectural/JJ, masterpiece/NN, !/.]",(ROOT (S (NP (DT The) (NNP house)) (VP (VBZ is) (RB not) (VP (VBN regarded) (PP (IN as) (NP (DT a) (JJ ac-) (JJ architectural) (NN masterpiece))))) (. !)))
K/KC/KCN.xml,KCNRE01K,27602,215,,B,70,4,--architectural masterpiece!,"[The/DT, house/NNP, is/VBZ, not/RB, regarded/VBN, as/IN, a/DT, ac-/JJ, architectural/JJ, masterpiece/NN, !/.]",(ROOT (S (NP (DT The) (NNP house)) (VP (VBZ is) (RB not) (VP (VBN regarded) (PP (IN as) (NP (DT a) (JJ ac-) (JJ architectural) (NN masterpiece))))) (. !)))
K/KC/KCN.xml,KCNRE01K,27602,216,,B,70,5,It is nicknamed Southyork  --,"[It/PRP, is/VBZ, nicknamed/VBN, Southyork/NN, because/IN, of/IN, it/PRP, 's/VBZ, resemblance/NN, to/TO, R/NN, J/NN, Ewing/NNP, 's/POS, ranch/NN, ,/,, Southfork/NNP, from/IN, the/DT, soap/NN, opera/NN, ,/,, Dallas/NNP, !/.]","(ROOT (S (NP (PRP It)) (VP (VBZ is) (VP (VBN nicknamed) (NP (NN Southyork)) (SBAR (IN because) (IN of) (S (NP (PRP it)) (VP (VBZ 's) (NP (NP (NN resemblance)) (PP (TO to) (NP (NP (NP (NN R) (NN J)) (NP (NP (NNP Ewing) (POS 's)) (NN ranch))) (, ,) (NP (NP (NNP Southfork)) (PP (IN from) (NP (NP (DT the) (NN soap) (NN opera)) (, ,) (NP (NNP Dallas))))))))))))) (. !)))"
K/KC/KCN.xml,KCNRE01K,27602,217,,B,70,6,"--because of it's resemblance to R J Ewing's ranch, Southfork  --","[It/PRP, is/VBZ, nicknamed/VBN, Southyork/NN, because/IN, of/IN, it/PRP, 's/VBZ, resemblance/NN, to/TO, R/NN, J/NN, Ewing/NNP, 's/POS, ranch/NN, ,/,, Southfork/NNP, from/IN, the/DT, soap/NN, opera/NN, ,/,, Dallas/NNP, !/.]","(ROOT (S (NP (PRP It)) (VP (VBZ is) (VP (VBN nicknamed) (NP (NN Southyork)) (SBAR (IN because) (IN of) (S (NP (PRP it)) (VP (VBZ 's) (NP (NP (NN resemblance)) (PP (TO to) (NP (NP (NP (NN R) (NN J)) (NP (NP (NNP Ewing) (POS 's)) (NN ranch))) (, ,) (NP (NP (NNP Southfork)) (PP (IN from) (NP (NP (DT the) (NN soap) (NN opera)) (, ,) (NP (NNP Dallas))))))))))))) (. !)))"
K/KC/KCN.xml,KCNRE01K,27602,218,,B,70,7,"--from the soap opera, Dallas!","[It/PRP, is/VBZ, nicknamed/VBN, Southyork/NN, because/IN, of/IN, it/PRP, 's/VBZ, resemblance/NN, to/TO, R/NN, J/NN, Ewing/NNP, 's/POS, ranch/NN, ,/,, Southfork/NNP, from/IN, the/DT, soap/NN, opera/NN, ,/,, Dallas/NNP, !/.]","(ROOT (S (NP (PRP It)) (VP (VBZ is) (VP (VBN nicknamed) (NP (NN Southyork)) (SBAR (IN because) (IN of) (S (NP (PRP it)) (VP (VBZ 's) (NP (NP (NN resemblance)) (PP (TO to) (NP (NP (NP (NN R) (NN J)) (NP (NP (NNP Ewing) (POS 's)) (NN ranch))) (, ,) (NP (NP (NNP Southfork)) (PP (IN from) (NP (NP (DT the) (NN soap) (NN opera)) (, ,) (NP (NNP Dallas))))))))))))) (. !)))"
K/KC/KCN.xml,KCNRE01K,27602,219,,B,70,8,The house is like a fortress behind eight  --,"[The/DT, house/NNP, is/VBZ, like/IN, a/DT, fortress/NN, behind/IN, eight/CD, foot/NN, walls/NNS, and/CC, set/VBN, in/IN, four/CD, acre/NN, grounds/NNS, ./.]",(ROOT (S (NP (DT The) (NNP house)) (VP (VBZ is) (UCP (PP (IN like) (NP (NP (DT a) (NN fortress)) (PP (IN behind) (NP (CD eight) (NN foot) (NNS walls))))) (CC and) (VP (VBN set) (PP (IN in) (NP (CD four) (NN acre) (NNS grounds)))))) (. .)))
K/KC/KCN.xml,KCNRE01K,27602,220,,B,70,9,--foot walls  --,"[The/DT, house/NNP, is/VBZ, like/IN, a/DT, fortress/NN, behind/IN, eight/CD, foot/NN, walls/NNS, and/CC, set/VBN, in/IN, four/CD, acre/NN, grounds/NNS, ./.]",(ROOT (S (NP (DT The) (NNP house)) (VP (VBZ is) (UCP (PP (IN like) (NP (NP (DT a) (NN fortress)) (PP (IN behind) (NP (CD eight) (NN foot) (NNS walls))))) (CC and) (VP (VBN set) (PP (IN in) (NP (CD four) (NN acre) (NNS grounds)))))) (. .)))
K/KC/KCN.xml,KCNRE01K,27602,221,,B,70,10,--and set in four acre grounds.,"[The/DT, house/NNP, is/VBZ, like/IN, a/DT, fortress/NN, behind/IN, eight/CD, foot/NN, walls/NNS, and/CC, set/VBN, in/IN, four/CD, acre/NN, grounds/NNS, ./.]",(ROOT (S (NP (DT The) (NNP house)) (VP (VBZ is) (UCP (PP (IN like) (NP (NP (DT a) (NN fortress)) (PP (IN behind) (NP (CD eight) (NN foot) (NNS walls))))) (CC and) (VP (VBN set) (PP (IN in) (NP (CD four) (NN acre) (NNS grounds)))))) (. .)))
K/KC/KCN.xml,KCNRE01K,27602,222,,B,70,11,Various critics  --,"[Various/JJ, critics/NNS, have/VBP, likened/VBN, it/PRP, to/TO, a/DT, Tesco/NNP, 's/POS, superstores/NNS, !/.]",(ROOT (S (NP (JJ Various) (NNS critics)) (VP (VBP have) (VP (VBN likened) (NP (PRP it)) (PP (TO to) (NP (NP (DT a) (NNP Tesco) (POS 's)) (NNS superstores))))) (. !)))
K/KC/KCN.xml,KCNRE01K,27602,223,,B,70,12,--have likened it to a Tesco's superstores!,"[Various/JJ, critics/NNS, have/VBP, likened/VBN, it/PRP, to/TO, a/DT, Tesco/NNP, 's/POS, superstores/NNS, !/.]",(ROOT (S (NP (JJ Various) (NNS critics)) (VP (VBP have) (VP (VBN likened) (NP (PRP it)) (PP (TO to) (NP (NP (DT a) (NNP Tesco) (POS 's)) (NNS superstores))))) (. !)))
K/KC/KCN.xml,KCNRE01K,27602,224,,B,70,13,The little chef  --,"[The/DT, little/JJ, chef/NN, and/CC, a/DT, glorified/JJ, council/NNP, house/NNP, !/.]",(ROOT (NP (NP (NP (DT The) (JJ little) (NN chef)) (CC and) (NP (DT a) (JJ glorified) (NNP council) (NNP house))) (. !)))
K/KC/KCN.xml,KCNRE01K,27602,225,,B,70,14,--and a glorified council house!,"[The/DT, little/JJ, chef/NN, and/CC, a/DT, glorified/JJ, council/NNP, house/NNP, !/.]",(ROOT (NP (NP (NP (DT The) (JJ little) (NN chef)) (CC and) (NP (DT a) (JJ glorified) (NNP council) (NNP house))) (. !)))
K/KC/KCN.xml,KCNRE01K,27602,226,,B,70,15,It has  --,"[It/PRP, has/VBZ, pseudo-Tudor/JJ, beams/NNS, no/DT, expense/NN, spared/VBD, furnishings/NNS, ,/,, including/VBG, a/DT, dome/NN, glass/NN, roof/NN, in/IN, the/DT, entrance/NN, hall/NN, and/CC, vast/JJ, main/JJ, function/NN, room/NN, with/IN, a/DT, marble/NN, fireplace/NN, and/CC, a/DT, galleried/JJ, landing/NN, ./.]","(ROOT (S (NP (PRP It)) (VP (VBZ has) (NP (NP (JJ pseudo-Tudor) (NNS beams)) (SBAR (S (NP (DT no) (NN expense)) (VP (VBD spared) (NP (NP (NNS furnishings)) (, ,) (PP (VBG including) (NP (NP (NP (DT a) (NN dome) (NN glass) (NN roof)) (PP (IN in) (NP (DT the) (NN entrance) (NN hall)))) (CC and) (NP (NP (JJ vast) (JJ main) (NN function) (NN room)) (PP (IN with) (NP (NP (DT a) (NN marble) (NN fireplace)) (CC and) (NP (DT a) (JJ galleried) (NN landing))))))))))))) (. .)))"
K/KC/KCN.xml,KCNRE01K,27602,227,,B,70,16,--pseudo-Tudor beams  --,"[It/PRP, has/VBZ, pseudo-Tudor/JJ, beams/NNS, no/DT, expense/NN, spared/VBD, furnishings/NNS, ,/,, including/VBG, a/DT, dome/NN, glass/NN, roof/NN, in/IN, the/DT, entrance/NN, hall/NN, and/CC, vast/JJ, main/JJ, function/NN, room/NN, with/IN, a/DT, marble/NN, fireplace/NN, and/CC, a/DT, galleried/JJ, landing/NN, ./.]","(ROOT (S (NP (PRP It)) (VP (VBZ has) (NP (NP (JJ pseudo-Tudor) (NNS beams)) (SBAR (S (NP (DT no) (NN expense)) (VP (VBD spared) (NP (NP (NNS furnishings)) (, ,) (PP (VBG including) (NP (NP (NP (DT a) (NN dome) (NN glass) (NN roof)) (PP (IN in) (NP (DT the) (NN entrance) (NN hall)))) (CC and) (NP (NP (JJ vast) (JJ main) (NN function) (NN room)) (PP (IN with) (NP (NP (DT a) (NN marble) (NN fireplace)) (CC and) (NP (DT a) (JJ galleried) (NN landing))))))))))))) (. .)))"
K/KC/KCN.xml,KCNRE01K,27602,228,,B,70,17,"--no expense spared furnishings, including a dome glass roof  --","[It/PRP, has/VBZ, pseudo-Tudor/JJ, beams/NNS, no/DT, expense/NN, spared/VBD, furnishings/NNS, ,/,, including/VBG, a/DT, dome/NN, glass/NN, roof/NN, in/IN, the/DT, entrance/NN, hall/NN, and/CC, vast/JJ, main/JJ, function/NN, room/NN, with/IN, a/DT, marble/NN, fireplace/NN, and/CC, a/DT, galleried/JJ, landing/NN, ./.]","(ROOT (S (NP (PRP It)) (VP (VBZ has) (NP (NP (JJ pseudo-Tudor) (NNS beams)) (SBAR (S (NP (DT no) (NN expense)) (VP (VBD spared) (NP (NP (NNS furnishings)) (, ,) (PP (VBG including) (NP (NP (NP (DT a) (NN dome) (NN glass) (NN roof)) (PP (IN in) (NP (DT the) (NN entrance) (NN hall)))) (CC and) (NP (NP (JJ vast) (JJ main) (NN function) (NN room)) (PP (IN with) (NP (NP (DT a) (NN marble) (NN fireplace)) (CC and) (NP (DT a) (JJ galleried) (NN landing))))))))))))) (. .)))"
K/KC/KCN.xml,KCNRE01K,27602,229,,B,70,18,--in the entrance hall  --,"[It/PRP, has/VBZ, pseudo-Tudor/JJ, beams/NNS, no/DT, expense/NN, spared/VBD, furnishings/NNS, ,/,, including/VBG, a/DT, dome/NN, glass/NN, roof/NN, in/IN, the/DT, entrance/NN, hall/NN, and/CC, vast/JJ, main/JJ, function/NN, room/NN, with/IN, a/DT, marble/NN, fireplace/NN, and/CC, a/DT, galleried/JJ, landing/NN, ./.]","(ROOT (S (NP (PRP It)) (VP (VBZ has) (NP (NP (JJ pseudo-Tudor) (NNS beams)) (SBAR (S (NP (DT no) (NN expense)) (VP (VBD spared) (NP (NP (NNS furnishings)) (, ,) (PP (VBG including) (NP (NP (NP (DT a) (NN dome) (NN glass) (NN roof)) (PP (IN in) (NP (DT the) (NN entrance) (NN hall)))) (CC and) (NP (NP (JJ vast) (JJ main) (NN function) (NN room)) (PP (IN with) (NP (NP (DT a) (NN marble) (NN fireplace)) (CC and) (NP (DT a) (JJ galleried) (NN landing))))))))))))) (. .)))"
K/KC/KCN.xml,KCNRE01K,27602,230,,B,70,19,--and vast main function room with a marble fireplace  --,"[It/PRP, has/VBZ, pseudo-Tudor/JJ, beams/NNS, no/DT, expense/NN, spared/VBD, furnishings/NNS, ,/,, including/VBG, a/DT, dome/NN, glass/NN, roof/NN, in/IN, the/DT, entrance/NN, hall/NN, and/CC, vast/JJ, main/JJ, function/NN, room/NN, with/IN, a/DT, marble/NN, fireplace/NN, and/CC, a/DT, galleried/JJ, landing/NN, ./.]","(ROOT (S (NP (PRP It)) (VP (VBZ has) (NP (NP (JJ pseudo-Tudor) (NNS beams)) (SBAR (S (NP (DT no) (NN expense)) (VP (VBD spared) (NP (NP (NNS furnishings)) (, ,) (PP (VBG including) (NP (NP (NP (DT a) (NN dome) (NN glass) (NN roof)) (PP (IN in) (NP (DT the) (NN entrance) (NN hall)))) (CC and) (NP (NP (JJ vast) (JJ main) (NN function) (NN room)) (PP (IN with) (NP (NP (DT a) (NN marble) (NN fireplace)) (CC and) (NP (DT a) (JJ galleried) (NN landing))))))))))))) (. .)))"
K/KC/KCN.xml,KCNRE01K,27602,231,,B,70,20,--and a galleried landing </reading> .,"[It/PRP, has/VBZ, pseudo-Tudor/JJ, beams/NNS, no/DT, expense/NN, spared/VBD, furnishings/NNS, ,/,, including/VBG, a/DT, dome/NN, glass/NN, roof/NN, in/IN, the/DT, entrance/NN, hall/NN, and/CC, vast/JJ, main/JJ, function/NN, room/NN, with/IN, a/DT, marble/NN, fireplace/NN, and/CC, a/DT, galleried/JJ, landing/NN, ./.]","(ROOT (S (NP (PRP It)) (VP (VBZ has) (NP (NP (JJ pseudo-Tudor) (NNS beams)) (SBAR (S (NP (DT no) (NN expense)) (VP (VBD spared) (NP (NP (NNS furnishings)) (, ,) (PP (VBG including) (NP (NP (NP (DT a) (NN dome) (NN glass) (NN roof)) (PP (IN in) (NP (DT the) (NN entrance) (NN hall)))) (CC and) (NP (NP (JJ vast) (JJ main) (NN function) (NN room)) (PP (IN with) (NP (NP (DT a) (NN marble) (NN fireplace)) (CC and) (NP (DT a) (JJ galleried) (NN landing))))))))))))) (. .)))"
K/KC/KCN.xml,KCNRE01K,27602,232,,B,70,21,"Musicians gallery, innit?","[Musicians/NNS, gallery/NN, ,/,, innit/NN, ?/.]","(ROOT (NP (NP (NNS Musicians) (NN gallery)) (, ,) (NP (NN innit)) (. ?)))"
K/KC/KCN.xml,KCNRE01K,27602,233,,B,70,22,<reading> The house has twenty five rooms including  --,"[The/DT, house/NNP, has/VBZ, twenty/CD, five/CD, rooms/NNS, including/VBG, special/JJ, quarters/NNS, for/IN, the/DT, Queen/NN, and/CC, the/DT, Duke/NNP, of/IN, Edinburgh/NNP, and/CC, Charles/NNP, and/CC, Diana/NNP, ./.]",(ROOT (S (NP (DT The) (NNP house)) (VP (VBZ has) (NP (NP (CD twenty) (CD five) (NNS rooms)) (PP (VBG including) (NP (NP (NP (JJ special) (NNS quarters)) (PP (IN for) (NP (DT the) (NN Queen)))) (CC and) (NP (NP (DT the) (NNP Duke)) (PP (IN of) (NP (NP (NNP Edinburgh)) (CC and) (NP (NNP Charles) (CC and) (NNP Diana))))))))) (. .)))
K/KC/KCN.xml,KCNRE01K,27602,234,,B,70,23,--special quarters for the Queen  --,"[The/DT, house/NNP, has/VBZ, twenty/CD, five/CD, rooms/NNS, including/VBG, special/JJ, quarters/NNS, for/IN, the/DT, Queen/NN, and/CC, the/DT, Duke/NNP, of/IN, Edinburgh/NNP, and/CC, Charles/NNP, and/CC, Diana/NNP, ./.]",(ROOT (S (NP (DT The) (NNP house)) (VP (VBZ has) (NP (NP (CD twenty) (CD five) (NNS rooms)) (PP (VBG including) (NP (NP (NP (JJ special) (NNS quarters)) (PP (IN for) (NP (DT the) (NN Queen)))) (CC and) (NP (NP (DT the) (NNP Duke)) (PP (IN of) (NP (NP (NNP Edinburgh)) (CC and) (NP (NNP Charles) (CC and) (NNP Diana))))))))) (. .)))
K/KC/KCN.xml,KCNRE01K,27602,235,,B,70,24,--and the Duke of Edinburgh  --,"[The/DT, house/NNP, has/VBZ, twenty/CD, five/CD, rooms/NNS, including/VBG, special/JJ, quarters/NNS, for/IN, the/DT, Queen/NN, and/CC, the/DT, Duke/NNP, of/IN, Edinburgh/NNP, and/CC, Charles/NNP, and/CC, Diana/NNP, ./.]",(ROOT (S (NP (DT The) (NNP house)) (VP (VBZ has) (NP (NP (CD twenty) (CD five) (NNS rooms)) (PP (VBG including) (NP (NP (NP (JJ special) (NNS quarters)) (PP (IN for) (NP (DT the) (NN Queen)))) (CC and) (NP (NP (DT the) (NNP Duke)) (PP (IN of) (NP (NP (NNP Edinburgh)) (CC and) (NP (NNP Charles) (CC and) (NNP Diana))))))))) (. .)))
K/KC/KCN.xml,KCNRE01K,27602,236,,B,70,25,--and Charles and Diana.,"[The/DT, house/NNP, has/VBZ, twenty/CD, five/CD, rooms/NNS, including/VBG, special/JJ, quarters/NNS, for/IN, the/DT, Queen/NN, and/CC, the/DT, Duke/NNP, of/IN, Edinburgh/NNP, and/CC, Charles/NNP, and/CC, Diana/NNP, ./.]",(ROOT (S (NP (DT The) (NNP house)) (VP (VBZ has) (NP (NP (CD twenty) (CD five) (NNS rooms)) (PP (VBG including) (NP (NP (NP (JJ special) (NNS quarters)) (PP (IN for) (NP (DT the) (NN Queen)))) (CC and) (NP (NP (DT the) (NNP Duke)) (PP (IN of) (NP (NP (NNP Edinburgh)) (CC and) (NP (NNP Charles) (CC and) (NNP Diana))))))))) (. .)))
K/KC/KCN.xml,KCNRE01K,27602,237,,B,70,26,It is multa- --,"[It/PRP, is/VBZ, multa-/JJ, and/CC, it/PRP, is/VBZ, mortar/JJ, and/CC, bullet/NN, proof/NN, ./.]",(ROOT (S (S (NP (PRP It)) (VP (VBZ is) (ADJP (JJ multa-)))) (CC and) (S (NP (PRP it)) (VP (VBZ is) (NP (JJ mortar) (CC and) (NN bullet) (NN proof)))) (. .)))
K/KC/KCN.xml,KCNRE01K,27602,238,,B,70,27,--and  --,"[It/PRP, is/VBZ, multa-/JJ, and/CC, it/PRP, is/VBZ, mortar/JJ, and/CC, bullet/NN, proof/NN, ./.]",(ROOT (S (S (NP (PRP It)) (VP (VBZ is) (ADJP (JJ multa-)))) (CC and) (S (NP (PRP it)) (VP (VBZ is) (NP (JJ mortar) (CC and) (NN bullet) (NN proof)))) (. .)))
K/KC/KCN.xml,KCNRE01K,27602,239,,B,70,28,--it is mortar and bullet proof.,"[It/PRP, is/VBZ, multa-/JJ, and/CC, it/PRP, is/VBZ, mortar/JJ, and/CC, bullet/NN, proof/NN, ./.]",(ROOT (S (S (NP (PRP It)) (VP (VBZ is) (ADJP (JJ multa-)))) (CC and) (S (NP (PRP it)) (VP (VBZ is) (NP (JJ mortar) (CC and) (NN bullet) (NN proof)))) (. .)))
K/KC/KCN.xml,KCNRE01K,27602,240,,B,70,29,Outside is a twenty five foot  --,"[Outside/JJ, is/VBZ, a/DT, twenty/CD, five/CD, foot/NN, swimming/NN, pool/NN, and/CC, landscaped/JJ, gardens/NNS, ./.]",(ROOT (S (NP (JJ Outside)) (VP (VBZ is) (NP (NP (DT a) (ADJP (CD twenty) (CD five)) (NN foot) (NN swimming) (NN pool)) (CC and) (NP (JJ landscaped) (NNS gardens)))) (. .)))
K/KC/KCN.xml,KCNRE01K,27602,241,,B,70,30,--swimming pool and landscaped gardens </reading> .,"[Outside/JJ, is/VBZ, a/DT, twenty/CD, five/CD, foot/NN, swimming/NN, pool/NN, and/CC, landscaped/JJ, gardens/NNS, ./.]",(ROOT (S (NP (JJ Outside)) (VP (VBZ is) (NP (NP (DT a) (ADJP (CD twenty) (CD five)) (NN foot) (NN swimming) (NN pool)) (CC and) (NP (JJ landscaped) (NNS gardens)))) (. .)))
K/KC/KCN.xml,KCNRE01K,27602,242,,A,71,1,I don't think Fergie would want to stay there.,"[I/PRP, don/VBP, 't/PRP, think/VB, Fergie/NNP, would/MD, want/VB, to/TO, stay/VB, there/RB, ./.]",(ROOT (S (NP (PRP I)) (VP (VBP don) (S (NP (PRP 't)) (VP (VB think) (SBAR (S (NP (NNP Fergie)) (VP (MD would) (VP (VB want) (S (VP (TO to) (VP (VB stay) (ADVP (RB there)))))))))))) (. .)))
K/KC/KCN.xml,KCNRE01K,27602,243,,B,72,1,It is like er  --,"[It/PRP, is/VBZ, like/IN, er/NN, it/PRP, is/VBZ, like/IN]",(ROOT (S (NP (PRP It)) (VP (VBZ is) (PP (IN like) (NP (NP (NN er)) (SBAR (S (NP (PRP it)) (VP (VBZ is) (PP (IN like))))))))))
K/KC/KCN.xml,KCNRE01K,27602,244,,B,72,2,--it is like ,"[It/PRP, is/VBZ, like/IN, er/NN, it/PRP, is/VBZ, like/IN]",(ROOT (S (NP (PRP It)) (VP (VBZ is) (PP (IN like) (NP (NP (NN er)) (SBAR (S (NP (PRP it)) (VP (VBZ is) (PP (IN like))))))))))
K/KC/KCN.xml,KCNRE01K,27602,245,,A,73,1,She'll leave the country I think.,"[She/PRP, 'll/MD, leave/VB, the/DT, country/NN, I/PRP, think/VBP, ./.]",(ROOT (S (NP (PRP She)) (VP (MD 'll) (VP (VB leave) (NP (NP (DT the) (NN country)) (SBAR (S (NP (PRP I)) (VP (VBP think))))))) (. .)))
K/KC/KCN.xml,KCNRE01K,27602,246,,B,74,1,It is like Tesco's isn't it?,"[It/PRP, is/VBZ, like/IN, Tesco/NNP, 's/POS, isn/NNP, 't/PRP, it/PRP, ?/.]",(ROOT (S (NP (PRP It)) (VP (VBZ is) (PP (IN like) (NP (NP (NP (NNP Tesco) (POS 's)) (NNP isn)) (NP (NP (PRP 't)) (NP (PRP it)))))) (. ?)))
