swda_filename,ptb_basename,conversation_no,transcript_index,act_tag,caller,turn_index,subutterance_index,text,pos,trees
K/KB/KBK.xml,KBKRE02B,2310,0,,A,1,1,<laugh> ,[],
K/KB/KBK.xml,KBKRE02B,2310,1,,B,2,1,How odd that I should be nine cents adrift ,"[How/WRB, odd/JJ, that/IN, I/PRP, should/MD, be/VB, nine/CD, cents/NNS, adrift/VBP]",(ROOT (SBARQ (WHNP (WHNP (WRB How) (JJ odd)) (SBAR (IN that) (S (NP (PRP I)) (VP (MD should) (VP (VB be) (NP (CD nine) (NNS cents))))))) (SQ (VP (VBP adrift)))))
K/KB/KBK.xml,KBKRE02B,2310,2,,A,3,1,I know.,"[I/PRP, know/VBP, ./.]",(ROOT (S (NP (PRP I)) (VP (VBP know)) (. .)))
K/KB/KBK.xml,KBKRE02B,2310,3,,B,4,1,in that.,"[in/IN, that/DT, ./.]",(ROOT (FRAG (PP (IN in) (NP (DT that))) (. .)))
K/KB/KBK.xml,KBKRE02B,2310,4,,A,5,1,I know.,"[I/PRP, know/VBP, ./.]",(ROOT (S (NP (PRP I)) (VP (VBP know)) (. .)))
K/KB/KBK.xml,KBKRE02B,2310,5,,B,6,1,That is really odd isn't it?,"[That/DT, is/VBZ, really/RB, odd/JJ, isn/NN, 't/PRP, it/PRP, ?/.]",(ROOT (S (NP (DT That)) (VP (VBZ is) (ADVP (RB really)) (NP (NP (JJ odd) (NN isn)) (NP (NP (PRP 't)) (NP (PRP it))))) (. ?)))
K/KB/KBK.xml,KBKRE02B,2310,6,,B,6,2,I agree.,"[I/PRP, agree/VBP, ./.]",(ROOT (S (NP (PRP I)) (VP (VBP agree)) (. .)))
K/KB/KBK.xml,KBKRE02B,2310,7,,A,7,1,It's worse being nine thousand out (()) .,"[It/PRP, 's/VBZ, worse/JJR, being/VBG, nine/CD, thousand/CD, out/IN, ./.]",(ROOT (S (NP (PRP It)) (VP (VBZ 's) (ADJP (JJR worse)) (S (VP (VBG being) (ADVP (NP (CD nine) (CD thousand)) (IN out))))) (. .)))
K/KB/KBK.xml,KBKRE02B,2310,8,,B,8,1,"Oh absolutely, yes, yes, I been coun- --","[Oh/UH, absolutely/RB, ,/,, yes/UH, ,/,, yes/UH, ,/,, I/PRP, been/VBN, coun-/NN, can/MD, you/PRP, be/VB, nine/CD, cents/NNS, out/RB, ,/,, I/PRP, mean/VBP, ,tha-/JJ, tha-/NN, there/EX, 's/VBZ, nine/CD, of/IN, nothing/NN, there/RB, ./.]","(ROOT (S (INTJ (UH Oh)) (INTJ (INTJ (RB absolutely)) (, ,) (INTJ (UH yes) (, ,) (UH yes))) (, ,) (NP (PRP I)) (PP (VBN been) (NP (NN coun-))) (PRN (SINV (MD can) (NP (PRP you)) (VP (VB be) (ADVP (NP (CD nine) (NNS cents)) (RB out)))) (, ,)) (NP (PRP I)) (VP (VBP mean) (NP (NP (JJ ,tha-) (NN tha-)) (SBAR (S (NP (EX there)) (VP (VBZ 's) (NP (NP (CD nine)) (PP (IN of) (NP (NN nothing)))) (ADVP (RB there))))))) (. .)))"
K/KB/KBK.xml,KBKRE02B,2310,9,,B,8,2,"--can you be nine cents out, I mean,tha- --","[Oh/UH, absolutely/RB, ,/,, yes/UH, ,/,, yes/UH, ,/,, I/PRP, been/VBN, coun-/NN, can/MD, you/PRP, be/VB, nine/CD, cents/NNS, out/RB, ,/,, I/PRP, mean/VBP, ,tha-/JJ, tha-/NN, there/EX, 's/VBZ, nine/CD, of/IN, nothing/NN, there/RB, ./.]","(ROOT (S (INTJ (UH Oh)) (INTJ (INTJ (RB absolutely)) (, ,) (INTJ (UH yes) (, ,) (UH yes))) (, ,) (NP (PRP I)) (PP (VBN been) (NP (NN coun-))) (PRN (SINV (MD can) (NP (PRP you)) (VP (VB be) (ADVP (NP (CD nine) (NNS cents)) (RB out)))) (, ,)) (NP (PRP I)) (VP (VBP mean) (NP (NP (JJ ,tha-) (NN tha-)) (SBAR (S (NP (EX there)) (VP (VBZ 's) (NP (NP (CD nine)) (PP (IN of) (NP (NN nothing)))) (ADVP (RB there))))))) (. .)))"
K/KB/KBK.xml,KBKRE02B,2310,10,,B,8,3,--tha- --,"[Oh/UH, absolutely/RB, ,/,, yes/UH, ,/,, yes/UH, ,/,, I/PRP, been/VBN, coun-/NN, can/MD, you/PRP, be/VB, nine/CD, cents/NNS, out/RB, ,/,, I/PRP, mean/VBP, ,tha-/JJ, tha-/NN, there/EX, 's/VBZ, nine/CD, of/IN, nothing/NN, there/RB, ./.]","(ROOT (S (INTJ (UH Oh)) (INTJ (INTJ (RB absolutely)) (, ,) (INTJ (UH yes) (, ,) (UH yes))) (, ,) (NP (PRP I)) (PP (VBN been) (NP (NN coun-))) (PRN (SINV (MD can) (NP (PRP you)) (VP (VB be) (ADVP (NP (CD nine) (NNS cents)) (RB out)))) (, ,)) (NP (PRP I)) (VP (VBP mean) (NP (NP (JJ ,tha-) (NN tha-)) (SBAR (S (NP (EX there)) (VP (VBZ 's) (NP (NP (CD nine)) (PP (IN of) (NP (NN nothing)))) (ADVP (RB there))))))) (. .)))"
K/KB/KBK.xml,KBKRE02B,2310,11,,B,8,4,--there's nine of nothing there.<laugh> ,"[Oh/UH, absolutely/RB, ,/,, yes/UH, ,/,, yes/UH, ,/,, I/PRP, been/VBN, coun-/NN, can/MD, you/PRP, be/VB, nine/CD, cents/NNS, out/RB, ,/,, I/PRP, mean/VBP, ,tha-/JJ, tha-/NN, there/EX, 's/VBZ, nine/CD, of/IN, nothing/NN, there/RB, ./.]","(ROOT (S (INTJ (UH Oh)) (INTJ (INTJ (RB absolutely)) (, ,) (INTJ (UH yes) (, ,) (UH yes))) (, ,) (NP (PRP I)) (PP (VBN been) (NP (NN coun-))) (PRN (SINV (MD can) (NP (PRP you)) (VP (VB be) (ADVP (NP (CD nine) (NNS cents)) (RB out)))) (, ,)) (NP (PRP I)) (VP (VBP mean) (NP (NP (JJ ,tha-) (NN tha-)) (SBAR (S (NP (EX there)) (VP (VBZ 's) (NP (NP (CD nine)) (PP (IN of) (NP (NN nothing)))) (ADVP (RB there))))))) (. .)))"
K/KB/KBK.xml,KBKRE02B,2310,12,,A,9,1,(()) ,[],
K/KB/KBK.xml,KBKRE02B,2310,13,,B,10,1,Mm.,"[Mm/NN, ./.]",(ROOT (NP (NN Mm) (. .)))
K/KB/KBK.xml,KBKRE02B,2310,14,,A,11,1,(()) so I think it's being a good idea to put the  (()) don't you?,"[so/IN, I/PRP, think/VBP, it/PRP, 's/VBZ, being/VBG, a/DT, good/JJ, idea/NN, to/TO, put/VB, the/DT, don/NNP, 't/PRP, you/PRP, ?/.]",(ROOT (S (IN so) (NP (PRP I)) (VP (VBP think) (SBAR (S (NP (PRP it)) (VP (VBZ 's) (VP (VBG being) (NP (DT a) (JJ good) (NN idea) (S (VP (TO to) (VP (VB put) (S (NP (DT the) (NNP don)) (NP (PRP 't))))))) (NP (PRP you))))))) (. ?)))
K/KB/KBK.xml,KBKRE02B,2310,15,,B,12,1,"And, and I suggest total eh C I F C two of above is a (()) .","[And/CC, ,/,, and/CC, I/PRP, suggest/VBP, total/JJ, eh/UH, C/$, I/CD, F/NN, C/NN, two/CD, of/IN, above/JJ, is/VBZ, a/DT, ./.]","(ROOT (S (CC And) (PRN (, ,) (S (CC and) (NP (PRP I)) (VP (VBP suggest) (S (VP (JJ total) (NP (INTJ (UH eh)) (NP ($ C) (CD I) (NN F)))))))) (NP (NP (NN C) (CD two)) (PP (IN of) (ADJP (JJ above)))) (VP (VBZ is) (NP (DT a))) (. .)))"
K/KB/KBK.xml,KBKRE02B,2310,16,,A,13,1,Well if I put it und- --,"[Well/RB, if/IN, I/PRP, put/VBP, it/PRP, und-/JJ, at/IN, the/DT, end/NN, twenty/CD, five/CD, ,/,, four/CD, one/CD, end/NN, B/NN, item/NN, two/CD, four/CD, ,/,, you/PRP, know/VBP, ,/,, in/IN, other/JJ, words/NNS, just/RB, there/RB, ./.]","(ROOT (S (SBAR (ADVP (RB Well)) (IN if) (S (NP (PRP I)) (VP (VBP put) (S (NP (PRP it)) (ADJP (JJ und-) (PP (IN at) (NP (NP (NP (DT the) (NN end)) (NP (CD twenty) (CD five))) (, ,) (NP (NP (NP (QP (CD four) (CD one))) (NP (NN end) (NN B) (NN item))) (NP (CD two) (CD four)))))))))) (, ,) (NP (PRP you)) (VP (VBP know) (, ,) (PP (IN in) (NP (JJ other) (NNS words))) (ADVP (RB just)) (ADVP (RB there))) (. .)))"
K/KB/KBK.xml,KBKRE02B,2310,17,,A,13,2,"--at the end twenty five, four one end B item two four, you know, in other words  (()) just there.","[Well/RB, if/IN, I/PRP, put/VBP, it/PRP, und-/JJ, at/IN, the/DT, end/NN, twenty/CD, five/CD, ,/,, four/CD, one/CD, end/NN, B/NN, item/NN, two/CD, four/CD, ,/,, you/PRP, know/VBP, ,/,, in/IN, other/JJ, words/NNS, just/RB, there/RB, ./.]","(ROOT (S (SBAR (ADVP (RB Well)) (IN if) (S (NP (PRP I)) (VP (VBP put) (S (NP (PRP it)) (ADJP (JJ und-) (PP (IN at) (NP (NP (NP (DT the) (NN end)) (NP (CD twenty) (CD five))) (, ,) (NP (NP (NP (QP (CD four) (CD one))) (NP (NN end) (NN B) (NN item))) (NP (CD two) (CD four)))))))))) (, ,) (NP (PRP you)) (VP (VBP know) (, ,) (PP (IN in) (NP (JJ other) (NNS words))) (ADVP (RB just)) (ADVP (RB there))) (. .)))"
K/KB/KBK.xml,KBKRE02B,2310,18,,B,14,1,Yes.,"[Yes/UH, ./.]",(ROOT (INTJ (UH Yes) (. .)))
K/KB/KBK.xml,KBKRE02B,2310,19,,B,14,2,Fine.,"[Fine/NN, ./.]",(ROOT (INTJ (NN Fine) (. .)))
K/KB/KBK.xml,KBKRE02B,2310,20,,B,14,3,I  --,"[I/PRP, I/PRP, suggest/VBP, again/RB, you/PRP, say/VBP, ,/,, dollars/NNS, ,/,, C/NN, I/NN, F/NN, C/NN, two/CD]","(ROOT (FRAG (NP (NP (PRP I)) (SBAR (S (NP (PRP I)) (VP (VBP suggest) (S (ADVP (RB again)) (NP (PRP you)) (VP (VBP say) (, ,) (NP (NNS dollars)) (, ,) (S (NP (NP (NN C) (NN I) (NN F)) (PP (NN C) (NP (CD two)))))))))))))"
K/KB/KBK.xml,KBKRE02B,2310,21,,B,14,4,"--I suggest again you say, dollars, C I F C two  (()) ","[I/PRP, I/PRP, suggest/VBP, again/RB, you/PRP, say/VBP, ,/,, dollars/NNS, ,/,, C/NN, I/NN, F/NN, C/NN, two/CD]","(ROOT (FRAG (NP (NP (PRP I)) (SBAR (S (NP (PRP I)) (VP (VBP suggest) (S (ADVP (RB again)) (NP (PRP you)) (VP (VBP say) (, ,) (NP (NNS dollars)) (, ,) (S (NP (NP (NN C) (NN I) (NN F)) (PP (NN C) (NP (CD two)))))))))))))"
K/KB/KBK.xml,KBKRE02B,2310,22,,A,15,1,"Total, ah, oh yes I will do.","[Total/NN, ,/,, ah/NN, ,/,, oh/UH, yes/UH, I/PRP, will/MD, do/VB, ./.]","(ROOT (S (S (NP (NP (NN Total)) (, ,) (NP (NN ah)))) (, ,) (S (INTJ (UH oh) (UH yes)) (NP (PRP I)) (VP (MD will) (VP (VB do)))) (. .)))"
K/KB/KBK.xml,KBKRE02B,2310,23,,A,15,2,Total of above.,"[Total/NN, of/IN, above/JJ, ./.]",(ROOT (NP (NP (NN Total)) (PP (IN of) (ADJP (JJ above))) (. .)))
K/KB/KBK.xml,KBKRE02B,2310,24,,B,16,1,"Total of the above yes, yes that's great.","[Total/NN, of/IN, the/DT, above/JJ, yes/RB, ,/,, yes/UH, that/DT, 's/VBZ, great/JJ, ./.]","(ROOT (S (NP (NP (NN Total)) (PP (IN of) (NP (NP (DT the) (JJ above)) (VP (NP (RB yes)) (, ,) (NP (INTJ (UH yes)) (NP (DT that))))))) (VP (VBZ 's) (ADJP (JJ great))) (. .)))"
K/KB/KBK.xml,KBKRE02B,2310,25,,A,17,1,(()) twenty five items.,"[twenty/CD, five/CD, items/NNS, ./.]",(ROOT (NP (NP (CD twenty)) (NP (CD five) (NNS items)) (. .)))
K/KB/KBK.xml,KBKRE02B,2310,26,,B,18,1,"Yes the twenty five items above, yes, good idea.","[Yes/UH, the/DT, twenty/CD, five/CD, items/NNS, above/IN, ,/,, yes/UH, ,/,, good/JJ, idea/NN, ./.]","(ROOT (S (VP (PP (NP (UH Yes)) (NP (NP (DT the) (CD twenty) (CD five) (NNS items)) (PP (IN above) (PRN (, ,) (INTJ (UH yes)) (, ,)) (NP (JJ good) (NN idea)))))) (. .)))"
K/KB/KBK.xml,KBKRE02B,2310,27,,A,19,1,(()) ,[],
K/KB/KBK.xml,KBKRE02B,2310,28,,B,20,1,Yes.,"[Yes/UH, ./.]",(ROOT (INTJ (UH Yes) (. .)))
K/KB/KBK.xml,KBKRE02B,2310,29,,A,21,1,where I mucked the whole thing up trying to get the  <laugh> ,"[where/WRB, I/PRP, mucked/VBD, the/DT, whole/JJ, thing/NN, up/IN, trying/VBG, to/TO, get/VB, the/DT]",(ROOT (SBAR (WHADVP (WRB where)) (S (NP (PRP I)) (VP (VBD mucked) (NP (DT the) (JJ whole) (NN thing)) (PP (IN up) (S (VP (VBG trying) (S (VP (TO to) (VP (VB get) (NP (DT the))))))))))))
K/KB/KBK.xml,KBKRE02B,2310,30,,B,22,1,<laugh> And we thought that was a frightfully clever machine when it first arrived.,"[And/CC, we/PRP, thought/VBD, that/DT, was/VBD, a/DT, frightfully/RB, clever/JJ, machine/NN, when/WRB, it/PRP, first/RB, arrived/VBD, ./.]",(ROOT (S (CC And) (NP (PRP we)) (VP (VBD thought) (SBAR (S (NP (DT that)) (VP (VBD was) (NP (NP (DT a) (ADJP (RB frightfully) (JJ clever)) (NN machine)) (SBAR (WHADVP (WRB when)) (S (NP (PRP it)) (ADVP (RB first)) (VP (VBD arrived))))))))) (. .)))
K/KB/KBK.xml,KBKRE02B,2310,31,,A,23,1,Yeah.,"[Yeah/UH, ./.]",(ROOT (INTJ (UH Yeah) (. .)))
K/KB/KBK.xml,KBKRE02B,2310,32,,A,23,2,Who's got a posh H reg B M W?,"[Who/WP, 's/VBZ, got/VBD, a/DT, posh/JJ, H/NN, reg/NN, B/NN, M/NN, W/NN, ?/.]",(ROOT (SBARQ (WHNP (WP Who)) (SQ (VP (VBZ 's) (VP (VBD got) (NP (DT a) (JJ posh) (NN H) (NN reg) (NN B)) (PP (NN M) (NN W))))) (. ?)))
K/KB/KBK.xml,KBKRE02B,2310,33,,B,24,1,"Bill, next door, he's d- --","[Bill/NN, ,/,, next/JJ, door/NN, ,/,, he/PRP, 's/VBZ, d-/JJ, company/NN, d-/NN, boss/NN, of/IN, a/DT, plastics/NNS, company/NN, ./.]","(ROOT (S (NP (NN Bill)) (, ,) (ADVP (JJ next) (NN door)) (, ,) (NP (PRP he)) (VP (VBZ 's) (NP (NP (JJ d-) (NN company) (NN d-) (NN boss)) (PP (IN of) (NP (DT a) (NNS plastics) (NN company))))) (. .)))"
K/KB/KBK.xml,KBKRE02B,2310,34,,B,24,2,--company d- --,"[Bill/NN, ,/,, next/JJ, door/NN, ,/,, he/PRP, 's/VBZ, d-/JJ, company/NN, d-/NN, boss/NN, of/IN, a/DT, plastics/NNS, company/NN, ./.]","(ROOT (S (NP (NN Bill)) (, ,) (ADVP (JJ next) (NN door)) (, ,) (NP (PRP he)) (VP (VBZ 's) (NP (NP (JJ d-) (NN company) (NN d-) (NN boss)) (PP (IN of) (NP (DT a) (NNS plastics) (NN company))))) (. .)))"
K/KB/KBK.xml,KBKRE02B,2310,35,,B,24,3,--boss of a plastics company.,"[Bill/NN, ,/,, next/JJ, door/NN, ,/,, he/PRP, 's/VBZ, d-/JJ, company/NN, d-/NN, boss/NN, of/IN, a/DT, plastics/NNS, company/NN, ./.]","(ROOT (S (NP (NN Bill)) (, ,) (ADVP (JJ next) (NN door)) (, ,) (NP (PRP he)) (VP (VBZ 's) (NP (NP (JJ d-) (NN company) (NN d-) (NN boss)) (PP (IN of) (NP (DT a) (NNS plastics) (NN company))))) (. .)))"
K/KB/KBK.xml,KBKRE02B,2310,36,,B,24,4,Yes I agree.,"[Yes/UH, I/PRP, agree/VBP, ./.]",(ROOT (S (S (INTJ (UH Yes)) (NP (PRP I)) (VP (VBP agree))) (. .)))
K/KB/KBK.xml,KBKRE02B,2310,37,,B,24,5,"He had a perfectly good Audi when he moved here last year, so why in the heck does he need a monster B M W like that then?","[He/PRP, had/VBD, a/DT, perfectly/RB, good/JJ, Audi/NNP, when/WRB, he/PRP, moved/VBD, here/RB, last/JJ, year/NN, ,/,, so/RB, why/WRB, in/IN, the/DT, heck/NN, does/VBZ, he/PRP, need/VB, a/DT, monster/NN, B/NN, M/NN, W/NN, like/IN, that/DT, then/RB, ?/.]","(ROOT (S (NP (PRP He)) (VP (VBD had) (NP (NP (DT a) (ADJP (RB perfectly) (JJ good)) (NNP Audi)) (SBAR (WHADVP (WRB when)) (S (NP (PRP he)) (VP (VBD moved) (ADVP (RB here)) (NP (JJ last) (NN year)) (, ,) (SBAR (RB so) (WHADVP (WRB why) (PP (IN in) (NP (DT the) (NN heck)))) (S (VP (VBZ does) (S (NP (PRP he)) (VP (VB need) (NP (DT a) (NN monster) (NN B) (NN M) (NN W)) (PP (IN like) (NP (NP (DT that)) (ADVP (RB then)))))))))))))) (. ?)))"
K/KB/KBK.xml,KBKRE02B,2310,38,,A,25,1,"<laugh> Simon actually counting up the cars next door, on the drive, getting (()) , by that  (()) knowledge  (()) wanted to keep it.","[Simon/NNP, actually/RB, counting/VBG, up/RP, the/DT, cars/NNS, next/IN, door/NN, ,/,, on/IN, the/DT, drive/NN, ,/,, getting/VBG, ,/,, by/IN, that/DT, knowledge/NN, wanted/VBD, to/TO, keep/VB, it/PRP, ./.]","(ROOT (S (NP (NP (NNP Simon)) (VP (ADVP (RB actually)) (VP (VBG counting) (PRT (RP up)) (NP (NP (DT the) (NNS cars)) (PP (IN next) (NP (NN door)))) (, ,) (PP (IN on) (NP (DT the) (NN drive)))) (, ,) (VP (VBG getting) (, ,) (PP (IN by) (NP (DT that) (NN knowledge)))))) (VP (VBD wanted) (S (VP (TO to) (VP (VB keep) (NP (PRP it)))))) (. .)))"
K/KB/KBK.xml,KBKRE02B,2310,39,,B,26,1,<laugh> ,[],
K/KB/KBK.xml,KBKRE02B,2310,40,,A,27,1,"And eh, Simon got all the mud all  (()) and he said you know when I was young, we were ahead of the (()) , but now we're well behind  <laugh> ","[And/CC, eh/UH, ,/,, Simon/NNP, got/VBD, all/PDT, the/DT, mud/NN, all/RB, and/CC, he/PRP, said/VBD, you/PRP, know/VB, when/WRB, I/PRP, was/VBD, young/JJ, ,/,, we/PRP, were/VBD, ahead/RB, of/IN, the/DT, ,/,, but/CC, now/RB, we/PRP, 're/VBP, well/RB, behind/IN]","(ROOT (FRAG (S (S (CC And) (S (INTJ (UH eh)) (, ,) (NP (NNP Simon)) (VP (VBD got) (NP (PDT all) (DT the) (NN mud)) (ADVP (RB all)))) (CC and) (S (NP (PRP he)) (VP (VBD said) (S (NP (PRP you)) (VP (VB know) (S (SBAR (WHADVP (WRB when)) (S (NP (PRP I)) (VP (VBD was) (ADJP (JJ young))))) (, ,) (NP (PRP we)) (VP (VBD were) (ADVP (RB ahead) (IN of) (DT the))))))))) (, ,) (CC but) (S (ADVP (RB now)) (NP (PRP we)) (VP (VBP 're) (ADVP (RB well)) (ADVP (IN behind)))))))"
K/KB/KBK.xml,KBKRE02B,2310,41,,B,28,1,<laugh> It  --,"[It/PRP, it/PRP, 's/VBZ, up/RB, to/TO, you/PRP, son/NN, ./.]",(ROOT (S (NP (PRP It)) (NP (PRP it)) (VP (VBZ 's) (ADVP (RB up) (PP (TO to) (NP (PRP you)))) (NP (NN son))) (. .)))
K/KB/KBK.xml,KBKRE02B,2310,42,,B,28,2,--it's up to you son.,"[It/PRP, it/PRP, 's/VBZ, up/RB, to/TO, you/PRP, son/NN, ./.]",(ROOT (S (NP (PRP It)) (NP (PRP it)) (VP (VBZ 's) (ADVP (RB up) (PP (TO to) (NP (PRP you)))) (NP (NN son))) (. .)))
K/KB/KBK.xml,KBKRE02B,2310,43,,A,29,1,It's because of it that we bought (()) .,"[It/PRP, 's/VBZ, because/IN, of/IN, it/PRP, that/IN, we/PRP, bought/VBD, ./.]",(ROOT (S (NP (PRP It)) (VP (VBZ 's) (PP (IN because) (PP (IN of) (NP (PRP it)))) (SBAR (IN that) (S (NP (PRP we)) (VP (VBD bought))))) (. .)))
K/KB/KBK.xml,KBKRE02B,2310,44,,B,30,1,Yeah.,"[Yeah/UH, ./.]",(ROOT (INTJ (UH Yeah) (. .)))
K/KB/KBK.xml,KBKRE02B,2310,45,,B,30,2,Up to you sonny boy.,"[Up/IN, to/TO, you/PRP, sonny/NNP, boy/NNP, ./.]",(ROOT (FRAG (PP (IN Up) (PP (TO to) (NP (NP (PRP you)) (NP (NNP sonny) (NNP boy))))) (. .)))
K/KB/KBK.xml,KBKRE02B,2310,46,,B,30,3,I know two or three lads of the next generation beyond us who are doing in their twenties rather better than their fathers  <laugh> in their fifties.,"[I/PRP, know/VBP, two/CD, or/CC, three/CD, lads/NNS, of/IN, the/DT, next/JJ, generation/NN, beyond/IN, us/PRP, who/WP, are/VBP, doing/VBG, in/IN, their/PRP$, twenties/NNS, rather/RB, better/JJR, than/IN, their/PRP$, fathers/NNS, in/IN, their/PRP$, fifties/NNS, ./.]",(ROOT (S (NP (PRP I)) (VP (VBP know) (NP (NP (QP (CD two) (CC or) (CD three)) (NNS lads)) (PP (IN of) (NP (DT the) (JJ next) (NN generation)))) (PP (IN beyond) (NP (NP (PRP us)) (SBAR (WHNP (WP who)) (S (VP (VBP are) (VP (VBG doing) (PP (IN in) (NP (NP (PRP$ their) (NNS twenties)) (ADJP (RB rather) (JJR better)))) (PP (IN than) (NP (NP (PRP$ their) (NNS fathers)) (PP (IN in) (NP (PRP$ their) (NNS fifties)))))))))))) (. .)))
K/KB/KBK.xml,KBKRE02B,2310,47,,A,31,1,Yes.,"[Yes/UH, ./.]",(ROOT (INTJ (UH Yes) (. .)))
K/KB/KBK.xml,KBKRE02B,2310,48,,B,32,1,<laugh> ,[],
K/KB/KBK.xml,KBKRE02B,2310,49,,A,33,1,(()) it's where they put the energy don't they?,"[it/PRP, 's/VBZ, where/WRB, they/PRP, put/VBD, the/DT, energy/NNP, don/NNP, 't/PRP, they/PRP, ?/.]",(ROOT (S (NP (PRP it)) (VP (VBZ 's) (SBAR (WHADVP (WRB where)) (S (NP (PRP they)) (VP (VBD put) (S (NP (DT the) (NNP energy)) (VP (NNP don) (S (NP (PRP 't)) (NP (PRP they))))))))) (. ?)))
K/KB/KBK.xml,KBKRE02B,2310,50,,B,34,1,Most of them in banking or accountancy.,"[Most/JJS, of/IN, them/PRP, in/IN, banking/NN, or/CC, accountancy/NN, ./.]",(ROOT (NP (NP (JJS Most)) (PP (IN of) (NP (PRP them))) (PP (IN in) (NP (NN banking) (CC or) (NN accountancy))) (. .)))
K/KB/KBK.xml,KBKRE02B,2310,51,,B,34,2,"The thing that  (()) about Bill is, he does have an amazing amount of labour saving gear, like electric hedge shears trimmers, and erm","[The/DT, thing/NN, that/WDT, about/IN, Bill/NN, is/VBZ, ,/,, he/PRP, does/VBZ, have/VB, an/DT, amazing/JJ, amount/NN, of/IN, labour/NN, saving/NN, gear/NN, ,/,, like/IN, electric/JJ, hedge/NN, shears/NNS, trimmers/NNS, ,/,, and/CC, erm/NN]","(ROOT (FRAG (NP (DT The) (NN thing)) (SBAR (WHNP (WDT that)) (S (PP (IN about) (NP (NN Bill))) (VP (VBZ is) (, ,) (SBAR (S (NP (PRP he)) (VP (VBZ does) (VP (VB have) (NP (NP (DT an) (JJ amazing) (NN amount)) (PP (IN of) (NP (NP (NN labour) (NN saving) (NN gear)) (, ,) (PP (IN like) (NP (JJ electric) (NN hedge) (NNS shears) (NNS trimmers))) (, ,) (CC and) (NP (NN erm))))))))))))))"
K/KB/KBK.xml,KBKRE02B,2310,52,,A,35,1,Graham's got that.,"[Graham/NNP, 's/POS, got/VBD, that/DT, ./.]",(ROOT (S (NP (NNP Graham) (POS 's)) (VP (VBD got) (NP (DT that))) (. .)))
K/KB/KBK.xml,KBKRE02B,2310,53,,B,36,1,He  --,"[He/PRP, he/PRP, he/PRP, 's/VBZ, got/VBN, erm/NN, a/DT, pump/NN, for/IN, the/DT, erm/NN, ,/,, hosepipe/NN, ,/,, so/RB, that/IN, when/WRB, he/PRP, hoses/VBZ, the/DT, front/NN, or/CC, the/DT, car/NN, he/PRP, 's/VBZ, really/RB, got/VBD, a/DT, spurt/NN, ,/,, yes/UH, ,/,, yes/UH, ,/,, he/PRP, actually/RB, put/VBD, 's/POS, the/DT, hose/NN, in/IN, one/CD, side/NN, and/CC, goes/VBZ, sh-/NN, shoots/VBZ, it/PRP, out/RP, again/RB, ./.]","(ROOT (S (S (NP (PRP He)) (NP (PRP he))) (PRN (S (NP (PRP he)) (VP (VBZ 's) (VP (VBN got) (S (NP (NN erm)) (NP (NP (DT a) (NN pump)) (PP (IN for) (NP (DT the) (NN erm)))))))) (, ,)) (NP (NN hosepipe)) (, ,) (ADVP (RB so) (SBAR (IN that) (S (SBAR (WHADVP (WRB when)) (S (NP (PRP he)) (VP (VBZ hoses) (NP (NP (DT the) (NN front)) (CC or) (NP (DT the) (NN car)))))) (NP (PRP he)) (VP (VBZ 's) (ADVP (RB really)))))) (VP (VP (VBD got) (S (NP (DT a) (NN spurt)) (, ,) (INTJ (UH yes)) (, ,) (INTJ (UH yes)) (, ,) (NP (PRP he)) (ADVP (RB actually)) (VP (VBD put) (S (NP (POS 's))) (NP (DT the) (NN hose)) (PP (IN in) (NP (CD one) (NN side)))))) (CC and) (VP (VBZ goes) (NP (NP (NN sh-)) (VP (VBZ shoots) (NP (PRP it)) (PRT (RP out)) (ADVP (RB again)))))) (. .)))"
K/KB/KBK.xml,KBKRE02B,2310,54,,B,36,2,--he  --,"[He/PRP, he/PRP, he/PRP, 's/VBZ, got/VBN, erm/NN, a/DT, pump/NN, for/IN, the/DT, erm/NN, ,/,, hosepipe/NN, ,/,, so/RB, that/IN, when/WRB, he/PRP, hoses/VBZ, the/DT, front/NN, or/CC, the/DT, car/NN, he/PRP, 's/VBZ, really/RB, got/VBD, a/DT, spurt/NN, ,/,, yes/UH, ,/,, yes/UH, ,/,, he/PRP, actually/RB, put/VBD, 's/POS, the/DT, hose/NN, in/IN, one/CD, side/NN, and/CC, goes/VBZ, sh-/NN, shoots/VBZ, it/PRP, out/RP, again/RB, ./.]","(ROOT (S (S (NP (PRP He)) (NP (PRP he))) (PRN (S (NP (PRP he)) (VP (VBZ 's) (VP (VBN got) (S (NP (NN erm)) (NP (NP (DT a) (NN pump)) (PP (IN for) (NP (DT the) (NN erm)))))))) (, ,)) (NP (NN hosepipe)) (, ,) (ADVP (RB so) (SBAR (IN that) (S (SBAR (WHADVP (WRB when)) (S (NP (PRP he)) (VP (VBZ hoses) (NP (NP (DT the) (NN front)) (CC or) (NP (DT the) (NN car)))))) (NP (PRP he)) (VP (VBZ 's) (ADVP (RB really)))))) (VP (VP (VBD got) (S (NP (DT a) (NN spurt)) (, ,) (INTJ (UH yes)) (, ,) (INTJ (UH yes)) (, ,) (NP (PRP he)) (ADVP (RB actually)) (VP (VBD put) (S (NP (POS 's))) (NP (DT the) (NN hose)) (PP (IN in) (NP (CD one) (NN side)))))) (CC and) (VP (VBZ goes) (NP (NP (NN sh-)) (VP (VBZ shoots) (NP (PRP it)) (PRT (RP out)) (ADVP (RB again)))))) (. .)))"
K/KB/KBK.xml,KBKRE02B,2310,55,,B,36,3,"--he's got erm a pump for the erm, hosepipe, so that when he hoses the front or the car he's really got a spurt, yes, yes, he actually put's the hose in one side and goes sh- shoots it out again.","[He/PRP, he/PRP, he/PRP, 's/VBZ, got/VBN, erm/NN, a/DT, pump/NN, for/IN, the/DT, erm/NN, ,/,, hosepipe/NN, ,/,, so/RB, that/IN, when/WRB, he/PRP, hoses/VBZ, the/DT, front/NN, or/CC, the/DT, car/NN, he/PRP, 's/VBZ, really/RB, got/VBD, a/DT, spurt/NN, ,/,, yes/UH, ,/,, yes/UH, ,/,, he/PRP, actually/RB, put/VBD, 's/POS, the/DT, hose/NN, in/IN, one/CD, side/NN, and/CC, goes/VBZ, sh-/NN, shoots/VBZ, it/PRP, out/RP, again/RB, ./.]","(ROOT (S (S (NP (PRP He)) (NP (PRP he))) (PRN (S (NP (PRP he)) (VP (VBZ 's) (VP (VBN got) (S (NP (NN erm)) (NP (NP (DT a) (NN pump)) (PP (IN for) (NP (DT the) (NN erm)))))))) (, ,)) (NP (NN hosepipe)) (, ,) (ADVP (RB so) (SBAR (IN that) (S (SBAR (WHADVP (WRB when)) (S (NP (PRP he)) (VP (VBZ hoses) (NP (NP (DT the) (NN front)) (CC or) (NP (DT the) (NN car)))))) (NP (PRP he)) (VP (VBZ 's) (ADVP (RB really)))))) (VP (VP (VBD got) (S (NP (DT a) (NN spurt)) (, ,) (INTJ (UH yes)) (, ,) (INTJ (UH yes)) (, ,) (NP (PRP he)) (ADVP (RB actually)) (VP (VBD put) (S (NP (POS 's))) (NP (DT the) (NN hose)) (PP (IN in) (NP (CD one) (NN side)))))) (CC and) (VP (VBZ goes) (NP (NP (NN sh-)) (VP (VBZ shoots) (NP (PRP it)) (PRT (RP out)) (ADVP (RB again)))))) (. .)))"
K/KB/KBK.xml,KBKRE02B,2310,56,,A,37,1,(()) (()) long enough.,"[long/RB, enough/RB, ./.]",(ROOT (FRAG (ADVP (RB long) (RB enough)) (. .)))
K/KB/KBK.xml,KBKRE02B,2310,57,,B,38,1,Well if you're gonna get the bottom of the garden where you're downhill it's not too bad but when you're coming up here and doing as he was watering the new grass on the front he  --,"[Well/RB, if/IN, you/PRP, 're/VBP, gonna/NNP, get/VB, the/DT, bottom/NN, of/IN, the/DT, garden/NN, where/WRB, you/PRP, 're/VBP, downhill/RB, it/PRP, 's/VBZ, not/RB, too/RB, bad/JJ, but/CC, when/WRB, you/PRP, 're/VBP, coming/VBG, up/RB, here/RB, and/CC, doing/VBG, as/IN, he/PRP, was/VBD, watering/VBG, the/DT, new/JJ, grass/NN, on/IN, the/DT, front/NN, he/PRP, he/PRP, I/PRP, mean/VBP, yes/RB, he/PRP, is/VBZ, below/IN, it/PRP, it/PRP, 's/VBZ, the/DT, bottom/NN, of/IN, your/PRP$, storage/NN, tank/NN, in/IN, c-/NN, in/IN, the/DT, attic/NN, which/WDT, counts/VBZ, ./.]",(ROOT (S (SBAR (ADVP (RB Well)) (IN if) (S (NP (PRP you)) (VP (VBP 're) (S (NP (NNP gonna)) (VP (VB get) (NP (NP (DT the) (NN bottom)) (PP (IN of) (NP (NP (DT the) (NN garden)) (SBAR (WHADVP (WRB where)) (S (NP (PRP you)) (VP (VBP 're) (ADVP (RB downhill)) (SBAR (SBAR (S (NP (PRP it)) (VP (VBZ 's) (RB not) (ADJP (RB too) (JJ bad))))) (CC but) (SBAR (WHADVP (WRB when)) (S (NP (PRP you)) (VP (VBP 're) (VP (VP (VBG coming) (ADVP (RB up) (RB here))) (CC and) (VP (VBG doing) (SBAR (IN as) (S (NP (PRP he)) (VP (VBD was) (VP (VBG watering) (NP (DT the) (JJ new) (NN grass)) (PP (IN on) (NP (DT the) (NN front) (PRP he)))))))) (NP (NP (PRP he)) (SBAR (S (NP (PRP I)) (VP (VBP mean) (SBAR (S (NP (RB yes) (PRP he)) (VP (VBZ is) (PP (IN below) (NP (PRP it)))))))))))))))))))))))))) (NP (PRP it)) (VP (VBZ 's) (NP (NP (DT the) (NN bottom)) (PP (IN of) (NP (NP (PRP$ your) (NN storage) (NN tank)) (PP (IN in) (NP (NP (NN c-)) (PP (IN in) (NP (NP (DT the) (NN attic)) (SBAR (WHNP (WDT which)) (S (VP (VBZ counts)))))))))))) (. .)))
K/KB/KBK.xml,KBKRE02B,2310,58,,B,38,2,--he I mean yes he is below it it's the bottom of your storage tank in c- --,"[Well/RB, if/IN, you/PRP, 're/VBP, gonna/NNP, get/VB, the/DT, bottom/NN, of/IN, the/DT, garden/NN, where/WRB, you/PRP, 're/VBP, downhill/RB, it/PRP, 's/VBZ, not/RB, too/RB, bad/JJ, but/CC, when/WRB, you/PRP, 're/VBP, coming/VBG, up/RB, here/RB, and/CC, doing/VBG, as/IN, he/PRP, was/VBD, watering/VBG, the/DT, new/JJ, grass/NN, on/IN, the/DT, front/NN, he/PRP, he/PRP, I/PRP, mean/VBP, yes/RB, he/PRP, is/VBZ, below/IN, it/PRP, it/PRP, 's/VBZ, the/DT, bottom/NN, of/IN, your/PRP$, storage/NN, tank/NN, in/IN, c-/NN, in/IN, the/DT, attic/NN, which/WDT, counts/VBZ, ./.]",(ROOT (S (SBAR (ADVP (RB Well)) (IN if) (S (NP (PRP you)) (VP (VBP 're) (S (NP (NNP gonna)) (VP (VB get) (NP (NP (DT the) (NN bottom)) (PP (IN of) (NP (NP (DT the) (NN garden)) (SBAR (WHADVP (WRB where)) (S (NP (PRP you)) (VP (VBP 're) (ADVP (RB downhill)) (SBAR (SBAR (S (NP (PRP it)) (VP (VBZ 's) (RB not) (ADJP (RB too) (JJ bad))))) (CC but) (SBAR (WHADVP (WRB when)) (S (NP (PRP you)) (VP (VBP 're) (VP (VP (VBG coming) (ADVP (RB up) (RB here))) (CC and) (VP (VBG doing) (SBAR (IN as) (S (NP (PRP he)) (VP (VBD was) (VP (VBG watering) (NP (DT the) (JJ new) (NN grass)) (PP (IN on) (NP (DT the) (NN front) (PRP he)))))))) (NP (NP (PRP he)) (SBAR (S (NP (PRP I)) (VP (VBP mean) (SBAR (S (NP (RB yes) (PRP he)) (VP (VBZ is) (PP (IN below) (NP (PRP it)))))))))))))))))))))))))) (NP (PRP it)) (VP (VBZ 's) (NP (NP (DT the) (NN bottom)) (PP (IN of) (NP (NP (PRP$ your) (NN storage) (NN tank)) (PP (IN in) (NP (NP (NN c-)) (PP (IN in) (NP (NP (DT the) (NN attic)) (SBAR (WHNP (WDT which)) (S (VP (VBZ counts)))))))))))) (. .)))
