swda_filename,ptb_basename,conversation_no,transcript_index,act_tag,caller,turn_index,subutterance_index,text,pos,trees
K/KC/KCN.xml,KCNRE00U,27207,58,,A,23,2,You're looking for a job.,"[You/PRP, 're/VBP, looking/VBG, for/IN, a/DT, job/NN, ./.]",(ROOT (S (NP (PRP You)) (VP (VBP 're) (VP (VBG looking) (PP (IN for) (NP (DT a) (NN job))))) (. .)))
K/KC/KCN.xml,KCNRE00U,27207,59,,A,23,3,They don't call it unemployed.,"[They/PRP, don/VBP, 't/PRP, call/VB, it/PRP, unemployed/JJ, ./.]",(ROOT (S (NP (PRP They)) (VP (VBP don) (S (NP (PRP 't)) (VP (VB call) (S (NP (PRP it)) (ADJP (JJ unemployed)))))) (. .)))
K/KC/KCN.xml,KCNRE00U,27207,60,,B,24,1,Well you can't go on the list for six weeks anyway.,"[Well/RB, you/PRP, can/MD, 't/PRP, go/VB, on/IN, the/DT, list/NN, for/IN, six/CD, weeks/NNS, anyway/RB, ./.]",(ROOT (S (ADVP (RB Well)) (NP (PRP you)) (VP (MD can) (NP (PRP 't)) (S (VP (VB go) (PP (IN on) (NP (NP (DT the) (NN list)) (PP (IN for) (NP (CD six) (NNS weeks))))) (ADVP (RB anyway))))) (. .)))
K/KC/KCN.xml,KCNRE00U,27207,61,,A,25,1,Six months.(()) ,"[Six/CD, months/NNS, ./.]",(ROOT (NP (CD Six) (NNS months) (. .)))
K/KC/KCN.xml,KCNRE00U,27207,62,,B,26,1,"(()) six weeks, yeah.","[six/CD, weeks/NNS, ,/,, yeah/UH, ./.]","(ROOT (NP (NP (CD six) (NNS weeks)) (, ,) (NP (UH yeah)) (. .)))"
K/KC/KCN.xml,KCNRE00U,27207,63,,A,27,1,"Well if you haven't been working for six months you are looking for a job, you are not unemployed.","[Well/RB, if/IN, you/PRP, haven/NN, 't/PRP, been/VBN, working/VBG, for/IN, six/CD, months/NNS, you/PRP, are/VBP, looking/VBG, for/IN, a/DT, job/NN, ,/,, you/PRP, are/VBP, not/RB, unemployed/JJ, ./.]","(ROOT (S (SBAR (ADVP (RB Well)) (IN if) (S (NP (PRP you)) (VP (NN haven) (S (NP (PRP 't)) (VP (VBN been) (VP (VBG working) (PP (IN for) (NP (NP (CD six) (NNS months)) (SBAR (S (NP (PRP you)) (VP (VBP are) (VP (VBG looking) (PP (IN for) (NP (DT a) (NN job))))))))))))))) (, ,) (NP (PRP you)) (VP (VBP are) (RB not) (ADJP (JJ unemployed))) (. .)))"
K/KC/KCN.xml,KCNRE00U,27207,64,,A,27,2,They don't call that unemployment.,"[They/PRP, don/VBP, 't/PRP, call/VB, that/DT, unemployment/NN, ./.]",(ROOT (S (NP (PRP They)) (VP (VBP don) (S (NP (PRP 't)) (VP (VB call) (NP (DT that) (NN unemployment))))) (. .)))
K/KC/KCN.xml,KCNRE00U,27207,65,,A,27,3,Course this is all  --,"[Course/NN, this/DT, is/VBZ, all/DT, voting/VBG, propaganda/NN, again/RB, ./.]",(ROOT (S (NP (NP (NN Course)) (NP (DT this))) (VP (VBZ is) (NP (NP (DT all) (VBG voting) (NN propaganda)) (ADVP (RB again)))) (. .)))
K/KC/KCN.xml,KCNRE00U,27207,66,,A,27,4,--voting   (()) --,"[Course/NN, this/DT, is/VBZ, all/DT, voting/VBG, propaganda/NN, again/RB, ./.]",(ROOT (S (NP (NP (NN Course)) (NP (DT this))) (VP (VBZ is) (NP (NP (DT all) (VBG voting) (NN propaganda)) (ADVP (RB again)))) (. .)))
K/KC/KCN.xml,KCNRE00U,27207,67,,A,27,5,--propaganda again.,"[Course/NN, this/DT, is/VBZ, all/DT, voting/VBG, propaganda/NN, again/RB, ./.]",(ROOT (S (NP (NP (NN Course)) (NP (DT this))) (VP (VBZ is) (NP (NP (DT all) (VBG voting) (NN propaganda)) (ADVP (RB again)))) (. .)))
K/KC/KCN.xml,KCNRE00U,27207,68,,A,27,6,I mean when is it  --,"[I/PRP, mean/VBP, when/WRB, is/VBZ, it/PRP, it/PRP, 's/VBZ, a/DT, disgrace/NN, to/TO, the/DT, social/NNP, service/NNP, workers/NNS, isn/VBP, 't/PRP, it/PRP, ?/.]",(ROOT (SINV (S (NP (PRP I)) (VP (VBP mean) (SBAR (WHADVP (WRB when)) (S (VP (VBZ is) (NP (NP (PRP it)) (SBAR (S (NP (PRP it)) (VP (VBZ 's) (NP (NP (DT a) (NN disgrace)) (PP (TO to) (NP (DT the) (NNP social) (NNP service) (NNS workers))))))))))))) (VP (VBP isn) (NP (PRP 't))) (NP (PRP it)) (. ?)))
K/KC/KCN.xml,KCNRE00U,27207,69,,A,27,7,--it's a disgrace to the social service workers isn't it?,"[I/PRP, mean/VBP, when/WRB, is/VBZ, it/PRP, it/PRP, 's/VBZ, a/DT, disgrace/NN, to/TO, the/DT, social/NNP, service/NNP, workers/NNS, isn/VBP, 't/PRP, it/PRP, ?/.]",(ROOT (SINV (S (NP (PRP I)) (VP (VBP mean) (SBAR (WHADVP (WRB when)) (S (VP (VBZ is) (NP (NP (PRP it)) (SBAR (S (NP (PRP it)) (VP (VBZ 's) (NP (NP (DT a) (NN disgrace)) (PP (TO to) (NP (DT the) (NNP social) (NNP service) (NNS workers))))))))))))) (VP (VBP isn) (NP (PRP 't))) (NP (PRP it)) (. ?)))
K/KC/KCN.xml,KCNRE00U,27207,70,,A,27,8,To make them wear uniform.,"[To/TO, make/VB, them/PRP, wear/VB, uniform/NN, ./.]",(ROOT (S (VP (TO To) (VP (VB make) (S (NP (PRP them)) (VP (VB wear) (NP (NN uniform)))))) (. .)))
K/KC/KCN.xml,KCNRE00U,27207,71,,A,27,9,They're getting them like prison officers and policeman and ,"[They/PRP, 're/VBP, getting/VBG, them/PRP, like/IN, prison/NN, officers/NNS, and/CC, policeman/NN, and/CC]",(ROOT (S (NP (PRP They)) (VP (VBP 're) (VP (VBG getting) (NP (NP (PRP them)) (PP (IN like) (NP (NP (NN prison) (NNS officers)) (CC and) (NP (NN policeman))))) (CC and)))))
K/KC/KCN.xml,KCNRE00U,27207,72,,B,28,1,Well it's the same as anywhere else.,"[Well/RB, it/PRP, 's/VBZ, the/DT, same/JJ, as/RB, anywhere/RB, else/RB, ./.]",(ROOT (S (ADVP (RB Well)) (NP (PRP it)) (VP (VBZ 's) (NP (DT the) (JJ same)) (ADVP (RB as) (RB anywhere) (RB else))) (. .)))
K/KC/KCN.xml,KCNRE00U,27207,73,,B,28,2,If you work in Marks and Spencers you wear er their uniform.,"[If/IN, you/PRP, work/VBP, in/IN, Marks/NNS, and/CC, Spencers/NNS, you/PRP, wear/VBP, er/NN, their/PRP$, uniform/NN, ./.]",(ROOT (S (SBAR (IN If) (S (NP (PRP you)) (VP (VBP work) (PP (IN in) (NP (NNS Marks) (CC and) (NNS Spencers)))))) (NP (PRP you)) (VP (VBP wear) (S (NP (NN er)) (NP (PRP$ their) (NN uniform)))) (. .)))
K/KC/KCN.xml,KCNRE00U,27207,74,,B,28,3,If you work in the hospital you wear their uniform.,"[If/IN, you/PRP, work/VBP, in/IN, the/DT, hospital/NN, you/PRP, wear/VBP, their/PRP$, uniform/NN, ./.]",(ROOT (S (SBAR (IN If) (S (NP (PRP you)) (VP (VBP work) (PP (IN in) (NP (DT the) (NN hospital)))))) (NP (PRP you)) (VP (VBP wear) (NP (PRP$ their) (NN uniform))) (. .)))
K/KC/KCN.xml,KCNRE00U,27207,75,,A,29,1,Yeah.,"[Yeah/UH, ./.]",(ROOT (INTJ (UH Yeah) (. .)))
K/KC/KCN.xml,KCNRE00U,27207,76,,A,29,2,That's only to advertise the place though isn't it?,"[That/DT, 's/VBZ, only/RB, to/TO, advertise/VB, the/DT, place/NN, though/IN, isn/NN, 't/PRP, it/PRP, ?/.]",(ROOT (S (NP (DT That)) (VP (VBZ 's) (ADVP (RB only)) (S (VP (TO to) (VP (VB advertise) (S (NP (NP (DT the) (NN place) (IN though) (NN isn)) (NP (PRP 't))) (NP (PRP it))))))) (. ?)))
K/KC/KCN.xml,KCNRE00U,27207,77,,A,29,3,Marks and Spencers and ,"[Marks/NNS, and/CC, Spencers/NNS, and/CC]",(ROOT (FRAG (NP (NP (NNS Marks) (CC and) (NNS Spencers)) (ADVP (CC and)))))
K/KC/KCN.xml,KCNRE00U,27207,78,,B,30,1,It isn't.,"[It/PRP, isn/VBD, 't/PRP, ./.]",(ROOT (S (NP (PRP It)) (VP (VBD isn) (NP (PRP 't))) (. .)))
K/KC/KCN.xml,KCNRE00U,27207,79,,B,30,2,If you went into your Clarke's shoe shop they've all got the same clothes.,"[If/IN, you/PRP, went/VBD, into/IN, your/PRP$, Clarke/NNP, 's/POS, shoe/NN, shop/NN, they/PRP, 've/VBP, all/DT, got/VBD, the/DT, same/JJ, clothes/NNS, ./.]",(ROOT (S (SBAR (IN If) (S (NP (PRP you)) (VP (VBD went) (PP (IN into) (NP (PRP$ your) (NP (NNP Clarke) (POS 's)) (NN shoe) (NN shop)))))) (NP (PRP they)) (VP (VBP 've) (VP (ADVP (DT all)) (VBD got) (NP (DT the) (JJ same) (NNS clothes)))) (. .)))
K/KC/KCN.xml,KCNRE00U,27207,80,,B,30,3,It's it makes it so easy that  --,"[It/PRP, 's/VBZ, it/PRP, makes/VBZ, it/PRP, so/RB, easy/JJ, that/IN, the/DT, staff/NN, ,/,, one/CD, can/MD, 't/PRP, dress/VB, any/DT, better/JJR, than/IN, the/DT, other/JJ, ./.]","(ROOT (S (NP (PRP It)) (VP (VBZ 's) (SBAR (S (NP (PRP it)) (VP (VBZ makes) (S (NP (PRP it)) (ADJP (RB so) (JJ easy) (PP (IN that) (NP (NP (DT the) (NN staff)) (, ,) (NP (CD one))))) (SBAR (SINV (MD can) (NP (PRP 't)) (VP (VB dress) (NP (DT any) (JJR better)) (PP (IN than) (NP (DT the) (JJ other))))))))))) (. .)))"
K/KC/KCN.xml,KCNRE00U,27207,81,,B,30,4,"--the staff, one can't dress any better than the other.","[It/PRP, 's/VBZ, it/PRP, makes/VBZ, it/PRP, so/RB, easy/JJ, that/IN, the/DT, staff/NN, ,/,, one/CD, can/MD, 't/PRP, dress/VB, any/DT, better/JJR, than/IN, the/DT, other/JJ, ./.]","(ROOT (S (NP (PRP It)) (VP (VBZ 's) (SBAR (S (NP (PRP it)) (VP (VBZ makes) (S (NP (PRP it)) (ADJP (RB so) (JJ easy) (PP (IN that) (NP (NP (DT the) (NN staff)) (, ,) (NP (CD one))))) (SBAR (SINV (MD can) (NP (PRP 't)) (VP (VB dress) (NP (DT any) (JJR better)) (PP (IN than) (NP (DT the) (JJ other))))))))))) (. .)))"
K/KC/KCN.xml,KCNRE00U,27207,82,,B,30,5,They're all equal.,"[They/PRP, 're/VBP, all/DT, equal/JJ, ./.]",(ROOT (S (NP (PRP They)) (VP (VBP 're) (ADJP (DT all) (JJ equal))) (. .)))
K/KC/KCN.xml,KCNRE00U,27207,83,,A,31,1,When you go to places like  --,"[When/WRB, you/PRP, go/VBP, to/TO, places/NNS, like/IN, in/IN, the/DT, big/JJ, stores/NNS, the/DT, staff/NN, have/VBP, all/DT, got/VBD, the/DT, same/JJ, type/NN, of/IN, apron/NN, er/NN, overall/RB, ./.]",(ROOT (S (SBAR (WHADVP (WRB When)) (S (NP (PRP you)) (VP (VBP go) (PP (TO to) (NP (NNS places))) (PP (IN like) (PP (IN in) (NP (DT the) (JJ big) (NNS stores))))))) (NP (DT the) (NN staff)) (VP (VBP have) (NP (NP (DT all)) (SBAR (S (VP (VBD got) (NP (NP (DT the) (JJ same) (NN type)) (PP (IN of) (NP (NN apron) (NN er)))) (ADVP (RB overall))))))) (. .)))
K/KC/KCN.xml,KCNRE00U,27207,84,,A,31,2,--in the big stores  --,"[When/WRB, you/PRP, go/VBP, to/TO, places/NNS, like/IN, in/IN, the/DT, big/JJ, stores/NNS, the/DT, staff/NN, have/VBP, all/DT, got/VBD, the/DT, same/JJ, type/NN, of/IN, apron/NN, er/NN, overall/RB, ./.]",(ROOT (S (SBAR (WHADVP (WRB When)) (S (NP (PRP you)) (VP (VBP go) (PP (TO to) (NP (NNS places))) (PP (IN like) (PP (IN in) (NP (DT the) (JJ big) (NNS stores))))))) (NP (DT the) (NN staff)) (VP (VBP have) (NP (NP (DT all)) (SBAR (S (VP (VBD got) (NP (NP (DT the) (JJ same) (NN type)) (PP (IN of) (NP (NN apron) (NN er)))) (ADVP (RB overall))))))) (. .)))
K/KC/KCN.xml,KCNRE00U,27207,85,,A,31,3,--the staff have all got the same type of apron er overall.,"[When/WRB, you/PRP, go/VBP, to/TO, places/NNS, like/IN, in/IN, the/DT, big/JJ, stores/NNS, the/DT, staff/NN, have/VBP, all/DT, got/VBD, the/DT, same/JJ, type/NN, of/IN, apron/NN, er/NN, overall/RB, ./.]",(ROOT (S (SBAR (WHADVP (WRB When)) (S (NP (PRP you)) (VP (VBP go) (PP (TO to) (NP (NNS places))) (PP (IN like) (PP (IN in) (NP (DT the) (JJ big) (NNS stores))))))) (NP (DT the) (NN staff)) (VP (VBP have) (NP (NP (DT all)) (SBAR (S (VP (VBD got) (NP (NP (DT the) (JJ same) (NN type)) (PP (IN of) (NP (NN apron) (NN er)))) (ADVP (RB overall))))))) (. .)))
K/KC/KCN.xml,KCNRE00U,27207,86,,A,31,4,"And that's for the customer, if it needs help they know who is who to go for advice.","[And/CC, that/DT, 's/VBZ, for/IN, the/DT, customer/NN, ,/,, if/IN, it/PRP, needs/VBZ, help/NN, they/PRP, know/VBP, who/WP, is/VBZ, who/WP, to/TO, go/VB, for/IN, advice/NN, ./.]","(ROOT (S (CC And) (NP (DT that)) (VP (VBZ 's) (PP (IN for) (NP (DT the) (NN customer))) (, ,) (SBAR (IN if) (S (NP (PRP it)) (VP (VBZ needs) (NP (NP (NN help)) (SBAR (S (NP (PRP they)) (VP (VBP know) (SBAR (WHNP (WP who)) (S (VP (VBZ is) (SBAR (WHNP (WP who)) (S (VP (TO to) (VP (VB go) (PP (IN for) (NP (NN advice)))))))))))))))))) (. .)))"
K/KC/KCN.xml,KCNRE00U,27207,87,,B,32,1,Yeah.,"[Yeah/UH, ./.]",(ROOT (INTJ (UH Yeah) (. .)))
K/KC/KCN.xml,KCNRE00U,27207,88,,A,33,1,That's all it is.,"[That/DT, 's/VBZ, all/DT, it/PRP, is/VBZ, ./.]",(ROOT (S (NP (DT That)) (VP (VBZ 's) (NP (NP (DT all)) (SBAR (S (NP (PRP it)) (VP (VBZ is)))))) (. .)))
K/KC/KCN.xml,KCNRE00U,27207,89,,A,33,2,But when you've got people stood behind a desk and serving you and doing nothing but serving you as you come.,"[But/CC, when/WRB, you/PRP, 've/VBP, got/VBN, people/NNS, stood/VBD, behind/IN, a/DT, desk/NN, and/CC, serving/VBG, you/PRP, and/CC, doing/VBG, nothing/NN, but/CC, serving/VBG, you/PRP, as/IN, you/PRP, come/VBP, ./.]",(ROOT (S (CC But) (SBAR (WHADVP (WRB when)) (S (NP (PRP you)) (VP (VBP 've) (VP (VBN got))))) (S (NP (NNS people)) (VP (VBD stood) (PP (IN behind) (NP (DT a) (NN desk))))) (CC and) (S (S (VP (VBG serving) (NP (PRP you)))) (CC and) (S (VP (VP (VBG doing) (NP (NN nothing))) (CC but) (VP (VBG serving) (NP (PRP you)) (SBAR (IN as) (S (NP (PRP you)) (VP (VBP come)))))))) (. .)))
K/KC/KCN.xml,KCNRE00U,27207,90,,A,33,3,They'll be wanting bank clerks to have uniforms next.,"[They/PRP, 'll/MD, be/VB, wanting/VBG, bank/NN, clerks/NNS, to/TO, have/VB, uniforms/NNS, next/JJ, ./.]",(ROOT (S (NP (PRP They)) (VP (MD 'll) (VP (VB be) (VP (VBG wanting) (NP (NN bank) (NNS clerks)) (S (VP (TO to) (VP (VB have) (NP (NNS uniforms)) (ADVP (JJ next)))))))) (. .)))
K/KC/KCN.xml,KCNRE00U,27207,91,,B,34,1,Good god bank clerks have been wearing uniforms for these last three four five years.,"[Good/JJ, god/NNP, bank/NNP, clerks/NNS, have/VBP, been/VBN, wearing/VBG, uniforms/NNS, for/IN, these/DT, last/JJ, three/CD, four/CD, five/CD, years/NNS, ./.]",(ROOT (S (NP (JJ Good) (NNP god) (NNP bank) (NNS clerks)) (VP (VBP have) (VP (VBN been) (VP (VBG wearing) (NP (NNS uniforms)) (PP (IN for) (NP (DT these) (JJ last) (CD three) (CD four))) (NP (CD five) (NNS years))))) (. .)))
K/KC/KCN.xml,KCNRE00U,27207,92,,A,35,1,Oh I've never seen them.,"[Oh/UH, I/PRP, 've/VBP, never/RB, seen/VBN, them/PRP, ./.]",(ROOT (S (S (INTJ (UH Oh)) (NP (PRP I)) (VP (VBP 've) (ADVP (RB never)) (VP (VBN seen) (NP (PRP them))))) (. .)))
K/KC/KCN.xml,KCNRE00U,27207,93,,B,36,1,Well ,[Well/RB],(ROOT (INTJ (RB Well)))
K/KC/KCN.xml,KCNRE00U,27207,94,,A,37,1,Never seen that.,"[Never/RB, seen/VBN, that/IN, ./.]",(ROOT (S (VP (ADVP (RB Never)) (VBN seen) (PP (IN that))) (. .)))
K/KC/KCN.xml,KCNRE00U,27207,95,,B,38,1,Well they all have.,"[Well/RB, they/PRP, all/DT, have/VBP, ./.]",(ROOT (S (ADVP (RB Well)) (NP (PRP they)) (ADVP (DT all)) (VP (VBP have)) (. .)))
K/KC/KCN.xml,KCNRE00U,27207,96,,A,39,1,It's customary to go to work dressed in black or white or suits or ,"[It/PRP, 's/VBZ, customary/JJ, to/TO, go/VB, to/TO, work/VB, dressed/VBN, in/IN, black/JJ, or/CC, white/JJ, or/CC, suits/NNS, or/CC]",(ROOT (S (NP (PRP It)) (VP (VBZ 's) (ADJP (JJ customary) (S (VP (TO to) (VP (VB go) (S (VP (TO to) (VP (VB work) (S (VP (VP (VBN dressed) (PP (IN in) (NP (JJ black) (CC or) (JJ white)))) (CC or) (VP (NP (NNS suits)) (ADVP (CC or)))))))))))))))
K/KC/KCN.xml,KCNRE00U,27207,97,,B,40,1,Not at all.,"[Not/RB, at/IN, all/DT, ./.]",(ROOT (FRAG (RB Not) (PP (IN at) (NP (DT all))) (. .)))
K/KC/KCN.xml,KCNRE00U,27207,98,,B,40,2,It's navy blue with flowered blouse they've got.,"[It/PRP, 's/VBZ, navy/NN, blue/NN, with/IN, flowered/JJ, blouse/NN, they/PRP, 've/VBP, got/VBN, ./.]",(ROOT (S (NP (PRP It)) (VP (VBZ 's) (NP (NP (NN navy) (NN blue)) (PP (IN with) (NP (JJ flowered) (NN blouse))) (SBAR (S (NP (PRP they)) (VP (VBP 've) (VP (VBN got))))))) (. .)))
K/KC/KCN.xml,KCNRE00U,27207,99,,A,41,1,I've never seen it.,"[I/PRP, 've/VBP, never/RB, seen/VBN, it/PRP, ./.]",(ROOT (S (NP (PRP I)) (VP (VBP 've) (ADVP (RB never)) (VP (VBN seen) (NP (PRP it)))) (. .)))
K/KC/KCN.xml,KCNRE00U,27207,100,,B,42,1,Each bank's different.,"[Each/DT, bank/NN, 's/POS, different/JJ, ./.]",(ROOT (NP (NP (DT Each) (NP (NN bank) (POS 's))) (ADJP (JJ different)) (. .)))
K/KC/KCN.xml,KCNRE00U,27207,101,,B,42,2,Well they've had them for years.,"[Well/RB, they/PRP, 've/VBP, had/VBD, them/PRP, for/IN, years/NNS, ./.]",(ROOT (S (ADVP (RB Well)) (NP (PRP they)) (VP (VBP 've) (VP (VBD had) (NP (PRP them)) (PP (IN for) (NP (NNS years))))) (. .)))
K/KC/KCN.xml,KCNRE00U,27207,102,,A,43,1,(()) ,[],
K/KC/KCN.xml,KCNRE00U,27207,103,,B,44,1,Well in the Midland Bank and they were wearing them the last time you were there.,"[Well/RB, in/IN, the/DT, Midland/NNP, Bank/NNP, and/CC, they/PRP, were/VBD, wearing/VBG, them/PRP, the/DT, last/JJ, time/NN, you/PRP, were/VBD, there/EX, ./.]",(ROOT (S (PP (ADVP (RB Well)) (IN in) (NP (NP (DT the) (NNP Midland) (NNP Bank)) (CC and) (S (NP (PRP they)) (VP (VBD were) (VP (VBG wearing) (NP (PRP them)) (NP (DT the) (JJ last) (NN time))))))) (NP (PRP you)) (VP (VBD were) (NP (EX there))) (. .)))
K/KC/KCN.xml,KCNRE00U,27207,104,,B,44,2,The electric board wears them.,"[The/DT, electric/NNP, board/NNP, wears/VBZ, them/PRP, ./.]",(ROOT (S (NP (DT The) (NNP electric) (NNP board)) (VP (VBZ wears) (NP (PRP them))) (. .)))
K/KC/KCN.xml,KCNRE00U,27207,105,,B,44,3,The gas board wears them.,"[The/DT, gas/NN, board/NN, wears/VBZ, them/PRP, ./.]",(ROOT (S (NP (DT The) (NN gas) (NN board)) (VP (VBZ wears) (NP (PRP them))) (. .)))
K/KC/KCN.xml,KCNRE00U,27207,106,,B,44,4,Woolworths wear them.,"[Woolworths/NNP, wear/VB, them/PRP, ./.]",(ROOT (S (NP (NNP Woolworths)) (VP (VB wear) (NP (PRP them))) (. .)))
K/KC/KCN.xml,KCNRE00U,27207,107,,A,45,1,Mm.,"[Mm/NN, ./.]",(ROOT (NP (NN Mm) (. .)))
K/KC/KCN.xml,KCNRE00U,27207,108,,B,46,1,"And so really it is no different, just that they are making a song about it.","[And/CC, so/RB, really/RB, it/PRP, is/VBZ, no/RB, different/JJ, ,/,, just/RB, that/IN, they/PRP, are/VBP, making/VBG, a/DT, song/NN, about/IN, it/PRP, ./.]","(ROOT (S (CC And) (ADVP (RB so) (RB really)) (NP (PRP it)) (VP (VBZ is) (ADJP (RB no) (JJ different)) (, ,) (SBAR (RB just) (IN that) (S (NP (PRP they)) (VP (VBP are) (VP (VBG making) (NP (NP (DT a) (NN song)) (PP (IN about) (NP (PRP it))))))))) (. .)))"
K/KC/KCN.xml,KCNRE00U,27207,109,,B,46,2,But there's no need to go to that prices.,"[But/CC, there/EX, 's/VBZ, no/DT, need/NN, to/TO, go/VB, to/TO, that/DT, prices/NNS, ./.]",(ROOT (S (CC But) (NP (EX there)) (VP (VBZ 's) (NP (DT no) (NN need) (S (VP (TO to) (VP (VB go) (PP (TO to) (NP (DT that) (NNS prices)))))))) (. .)))
K/KC/KCN.xml,KCNRE00U,27207,110,,A,47,1,(()) a name on.,"[a/DT, name/NN, on/IN, ./.]",(ROOT (NP (NP (DT a) (NN name)) (PP (IN on)) (. .)))
K/KC/KCN.xml,KCNRE00U,27207,111,,A,47,2,You can have the firm's name and give them a brooch or something.,"[You/PRP, can/MD, have/VB, the/DT, firm/NN, 's/POS, name/NN, and/CC, give/VB, them/PRP, a/DT, brooch/NN, or/CC, something/NN, ./.]",(ROOT (S (NP (PRP You)) (VP (MD can) (VP (VP (VB have) (NP (NP (DT the) (NN firm) (POS 's)) (NN name))) (CC and) (VP (VB give) (NP (PRP them)) (NP (DT a) (NN brooch) (CC or) (NN something))))) (. .)))
K/KC/KCN.xml,KCNRE00U,27207,112,,B,48,1,"Well they've got them anyway, haven't they?","[Well/RB, they/PRP, 've/VBP, got/VBD, them/PRP, anyway/RB, ,/,, haven/NN, 't/PRP, they/PRP, ?/.]","(ROOT (S (S (INTJ (RB Well)) (NP (PRP they)) (VP (VBP 've) (VP (VBD got) (NP (PRP them)) (ADVP (RB anyway))))) (, ,) (S (NP (NP (NN haven)) (NP (PRP 't))) (NP (PRP they))) (. ?)))"
K/KC/KCN.xml,KCNRE00U,27207,113,,A,49,1,But  --,"[But/CC, Val/NN, was/VBD, on/IN, about/IN, it/PRP, last/JJ, summer/NN, ./.]",(ROOT (S (CC But) (NP (NN Val)) (VP (VBD was) (PP (IN on) (PP (IN about) (NP (PRP it)))) (NP (JJ last) (NN summer))) (. .)))
K/KC/KCN.xml,KCNRE00U,27207,114,,A,49,2,--Val was on about it last summer.,"[But/CC, Val/NN, was/VBD, on/IN, about/IN, it/PRP, last/JJ, summer/NN, ./.]",(ROOT (S (CC But) (NP (NN Val)) (VP (VBD was) (PP (IN on) (PP (IN about) (NP (PRP it)))) (NP (JJ last) (NN summer))) (. .)))
K/KC/KCN.xml,KCNRE00U,27207,115,,A,49,3,They was talking about it then.,"[They/PRP, was/VBD, talking/VBG, about/IN, it/PRP, then/RB, ./.]",(ROOT (S (NP (PRP They)) (VP (VBD was) (VP (VBG talking) (PP (IN about) (NP (PRP it))) (ADVP (RB then)))) (. .)))
K/KC/KCN.xml,KCNRE00U,27207,116,,A,49,4,But she said that they had been so many months  --,"[But/CC, she/PRP, said/VBD, that/IN, they/PRP, had/VBD, been/VBN, so/RB, many/JJ, months/NNS, or/CC, when/WRB, everybody/NN, else/RB, had/VBD, a/DT, pay/NN, rise/NN, they/PRP, only/RB, had/VBD, a/DT, little/JJ, bit/NN, ./.]",(ROOT (S (CC But) (NP (PRP she)) (VP (VBD said) (SBAR (SBAR (IN that) (S (NP (PRP they)) (VP (VBD had) (VP (VBN been) (NP (ADJP (RB so) (JJ many)) (NNS months)))))) (CC or) (SBAR (WHADVP (WRB when)) (S (NP (NN everybody) (RB else)) (VP (VBD had) (NP (NP (DT a) (NN pay) (NN rise)) (SBAR (S (NP (PRP they)) (ADVP (RB only)) (VP (VBD had) (NP (DT a) (JJ little) (NN bit))))))))))) (. .)))
K/KC/KCN.xml,KCNRE00U,27207,117,,A,49,5,--or when everybody else had a pay rise they only had a little bit.,"[But/CC, she/PRP, said/VBD, that/IN, they/PRP, had/VBD, been/VBN, so/RB, many/JJ, months/NNS, or/CC, when/WRB, everybody/NN, else/RB, had/VBD, a/DT, pay/NN, rise/NN, they/PRP, only/RB, had/VBD, a/DT, little/JJ, bit/NN, ./.]",(ROOT (S (CC But) (NP (PRP she)) (VP (VBD said) (SBAR (SBAR (IN that) (S (NP (PRP they)) (VP (VBD had) (VP (VBN been) (NP (ADJP (RB so) (JJ many)) (NNS months)))))) (CC or) (SBAR (WHADVP (WRB when)) (S (NP (NN everybody) (RB else)) (VP (VBD had) (NP (NP (DT a) (NN pay) (NN rise)) (SBAR (S (NP (PRP they)) (ADVP (RB only)) (VP (VBD had) (NP (DT a) (JJ little) (NN bit))))))))))) (. .)))
K/KC/KCN.xml,KCNRE00U,27207,118,,A,49,6,And the extra that they should have had is going to pay for these uniforms.,"[And/CC, the/DT, extra/JJ, that/IN, they/PRP, should/MD, have/VB, had/VBN, is/VBZ, going/VBG, to/TO, pay/VB, for/IN, these/DT, uniforms/NNS, ./.]",(ROOT (S (CC And) (NP (NP (DT the) (JJ extra)) (SBAR (IN that) (S (NP (PRP they)) (VP (MD should) (VP (VB have) (VP (VBN had))))))) (VP (VBZ is) (VP (VBG going) (S (VP (TO to) (VP (VB pay) (PP (IN for) (NP (DT these) (NNS uniforms)))))))) (. .)))
K/KC/KCN.xml,KCNRE00U,27207,119,,B,50,1,Oh.,"[Oh/UH, ./.]",(ROOT (INTJ (UH Oh) (. .)))
K/KC/KCN.xml,KCNRE00U,27207,120,,A,51,1,(()) didn't want the uniforms.,"[didn/NN, 't/PRP, want/VBP, the/DT, uniforms/NNS, ./.]",(ROOT (S (NP (NN didn)) (NP (PRP 't)) (VP (VBP want) (NP (DT the) (NNS uniforms))) (. .)))
K/KC/KCN.xml,KCNRE00U,27207,121,,B,52,1,Well a percentage is taken out of your money for them.,"[Well/RB, a/DT, percentage/NN, is/VBZ, taken/VBN, out/IN, of/IN, your/PRP$, money/NN, for/IN, them/PRP, ./.]",(ROOT (S (ADVP (RB Well)) (NP (DT a) (NN percentage)) (VP (VBZ is) (VP (VBN taken) (PRT (IN out)) (PP (IN of) (NP (NP (PRP$ your) (NN money)) (PP (IN for) (NP (PRP them))))))) (. .)))
K/KC/KCN.xml,KCNRE00U,27207,122,,B,52,2,There's no doubt about that.,"[There/EX, 's/VBZ, no/DT, doubt/NN, about/IN, that/DT, ./.]",(ROOT (S (NP (EX There)) (VP (VBZ 's) (NP (NP (DT no) (NN doubt)) (PP (IN about) (NP (DT that))))) (. .)))
K/KC/KCN.xml,KCNRE00U,27207,123,,A,53,1,Mm.,"[Mm/NN, ./.]",(ROOT (NP (NN Mm) (. .)))
K/KC/KCN.xml,KCNRE00U,27207,124,,A,53,2,"Well that's what she was on about that, and and they was  --","[Well/RB, that/DT, 's/VBZ, what/WP, she/PRP, was/VBD, on/IN, about/IN, that/DT, ,/,, and/CC, and/CC, they/PRP, was/VBD, they/PRP, were/VBD, going/VBG]","(ROOT (S (S (INTJ (RB Well)) (NP (DT that)) (VP (VBZ 's) (SBAR (WHNP (WP what)) (S (NP (PRP she)) (VP (VBD was) (PP (IN on) (PP (IN about) (NP (DT that))))))))) (, ,) (CC and) (S (CC and) (NP (PRP they)) (VP (VBD was) (SBAR (S (NP (PRP they)) (VP (VBD were) (VP (VBG going)))))))))"
K/KC/KCN.xml,KCNRE00U,27207,125,,A,53,3,--they were going ,"[Well/RB, that/DT, 's/VBZ, what/WP, she/PRP, was/VBD, on/IN, about/IN, that/DT, ,/,, and/CC, and/CC, they/PRP, was/VBD, they/PRP, were/VBD, going/VBG]","(ROOT (S (S (INTJ (RB Well)) (NP (DT that)) (VP (VBZ 's) (SBAR (WHNP (WP what)) (S (NP (PRP she)) (VP (VBD was) (PP (IN on) (PP (IN about) (NP (DT that))))))))) (, ,) (CC and) (S (CC and) (NP (PRP they)) (VP (VBD was) (SBAR (S (NP (PRP they)) (VP (VBD were) (VP (VBG going)))))))))"
K/KC/KCN.xml,KCNRE00U,27207,126,,B,54,1,Well everybody has got to do that.,"[Well/RB, everybody/NN, has/VBZ, got/VBN, to/TO, do/VB, that/DT, ./.]",(ROOT (S (ADVP (RB Well)) (NP (NN everybody)) (VP (VBZ has) (VP (VBN got) (S (VP (TO to) (VP (VB do) (NP (DT that))))))) (. .)))
K/KC/KCN.xml,KCNRE00U,27207,127,,A,55,1,to go on strike because of it.,"[to/TO, go/VB, on/IN, strike/NN, because/IN, of/IN, it/PRP, ./.]",(ROOT (S (VP (TO to) (VP (VB go) (PP (IN on) (NP (NN strike))) (SBAR (IN because) (FRAG (PP (IN of) (NP (PRP it))))))) (. .)))
K/KC/KCN.xml,KCNRE00U,27207,128,,B,56,1,"And really, it would be a good thing for Val.","[And/CC, really/RB, ,/,, it/PRP, would/MD, be/VB, a/DT, good/JJ, thing/NN, for/IN, Val/NN, ./.]","(ROOT (S (CC And) (ADVP (RB really)) (, ,) (NP (PRP it)) (VP (MD would) (VP (VB be) (NP (NP (DT a) (JJ good) (NN thing)) (PP (IN for) (NP (NN Val)))))) (. .)))"
K/KC/KCN.xml,KCNRE00U,27207,129,,A,57,1,Why?,"[Why/WRB, ?/.]",(ROOT (FRAG (WRB Why) (. ?)))
K/KC/KCN.xml,KCNRE00U,27207,130,,B,58,1,Well she's gotta pay so much for her bloody clothes.,"[Well/RB, she/PRP, 's/VBZ, gotta/NNP, pay/VB, so/RB, much/JJ, for/IN, her/PRP$, bloody/JJ, clothes/NNS, ./.]",(ROOT (S (ADVP (RB Well)) (NP (PRP she)) (VP (VBZ 's) (S (NP (NNP gotta)) (VP (VB pay) (ADJP (RB so) (JJ much) (PP (IN for) (NP (PRP$ her) (JJ bloody) (NNS clothes))))))) (. .)))
K/KC/KCN.xml,KCNRE00U,27207,131,,A,59,1,"She makes her own, a lot of them.","[She/PRP, makes/VBZ, her/PRP$, own/JJ, ,/,, a/DT, lot/NN, of/IN, them/PRP, ./.]","(ROOT (S (NP (PRP She)) (VP (VP (VBZ makes) (NP (PRP$ her) (JJ own))) (, ,) (NP (NP (DT a) (NN lot)) (PP (IN of) (NP (PRP them))))) (. .)))"
K/KC/KCN.xml,KCNRE00U,27207,132,,B,60,1,She's still gotta buy the material.,"[She/PRP, 's/VBZ, still/RB, gotta/NNP, buy/VB, the/DT, material/NN, ./.]",(ROOT (S (NP (PRP She)) (VP (VBZ 's) (ADVP (RB still)) (SBAR (S (NP (NNP gotta)) (VP (VB buy) (NP (DT the) (NN material)))))) (. .)))
K/KC/KCN.xml,KCNRE00U,27207,133,,A,61,1,Well she would rather have her own than be dressed up like  --,"[Well/RB, she/PRP, would/MD, rather/RB, have/VB, her/PRP$, own/JJ, than/IN, be/VB, dressed/VBN, up/RP, like/IN, looking/VBG, like/IN, rolled/VBN, doll/NN, she/PRP, said/VBD, ./.]",(ROOT (S (S (INTJ (RB Well)) (NP (PRP she)) (VP (MD would) (VP (RB rather) (VP (VB have) (NP (PRP$ her) (JJ own))) (IN than) (VP (VB be) (VP (VBN dressed) (PRT (RP up)) (PP (IN like) (S (VP (VBG looking) (PP (IN like) (NP (VBN rolled) (NN doll))))))))))) (NP (PRP she)) (VP (VBD said)) (. .)))
