swda_filename,ptb_basename,conversation_no,transcript_index,act_tag,caller,turn_index,subutterance_index,text,pos,trees
K/KC/KCN.xml,KCNRE00U,27207,0,,A,1,1,<reading> has had to tear up its election coverage plans because tory ministers are scared to meet top industrialists </reading> .,"[has/VBZ, had/VBN, to/TO, tear/VB, up/RP, its/PRP$, election/NN, coverage/NN, plans/NNS, because/IN, tory/NNP, ministers/NNS, are/VBP, scared/VBN, to/TO, meet/VB, top/JJ, industrialists/NNS, ./.]",(ROOT (S (VP (VBZ has) (VP (VBN had) (S (VP (TO to) (VP (VB tear) (PRT (RP up)) (NP (PRP$ its) (NN election) (NN coverage) (NNS plans))))) (SBAR (IN because) (S (NP (NNP tory) (NNS ministers)) (VP (VBP are) (ADJP (VBN scared) (S (VP (TO to) (VP (VB meet) (NP (JJ top) (NNS industrialists))))))))))) (. .)))
K/KC/KCN.xml,KCNRE00U,27207,1,,B,2,1,Mm.,"[Mm/NN, ./.]",(ROOT (NP (NN Mm) (. .)))
K/KC/KCN.xml,KCNRE00U,27207,2,,A,3,1,"Top industrialists, those are big business boys.","[Top/JJ, industrialists/NNS, ,/,, those/DT, are/VBP, big/JJ, business/NN, boys/NNS, ./.]","(ROOT (S (NP (NP (JJ Top) (NNS industrialists)) (, ,) (NP (DT those))) (VP (VBP are) (NP (JJ big) (NN business) (NNS boys))) (. .)))"
K/KC/KCN.xml,KCNRE00U,27207,3,,A,3,2,<reading> Chancellor Norman Lamont and treasury ministers were told  --,"[Chancellor/NNP, Norman/NNP, Lamont/NNP, and/CC, treasury/NNP, ministers/NNS, were/VBD, told/VBN, er/NN, chancellor/NN, Norman/NNP, Lamont/NNP, and/CC, treasury/NNP, ministers/NNS, were/VBD, to/TO, be/VB, grilled/JJ, like/IN, labour/NN, spokesmen/NNS, by/IN, a/DT, panel/NN, of/IN, businessmen/NNS, and/CC, just/RB, one/CD, union/NN, leader/NN, ./.]",(ROOT (S (NP (NNP Chancellor) (NNP Norman) (NNP Lamont) (CC and) (NNP treasury) (NNS ministers)) (VP (VBD were) (VP (VBN told) (NP (NP (NN er) (NN chancellor)) (SBAR (S (NP (NNP Norman) (NNP Lamont) (CC and) (NNP treasury) (NNS ministers)) (VP (VBD were) (S (VP (TO to) (VP (VB be) (ADJP (JJ grilled) (PP (IN like) (NP (NN labour) (NNS spokesmen)))) (PP (IN by) (NP (NP (DT a) (NN panel)) (PP (IN of) (NP (NP (NNS businessmen)) (CC and) (NP (QP (RB just) (CD one)) (NN union) (NN leader))))))))))))))) (. .)))
K/KC/KCN.xml,KCNRE00U,27207,4,,A,3,3,--er  --,"[Chancellor/NNP, Norman/NNP, Lamont/NNP, and/CC, treasury/NNP, ministers/NNS, were/VBD, told/VBN, er/NN, chancellor/NN, Norman/NNP, Lamont/NNP, and/CC, treasury/NNP, ministers/NNS, were/VBD, to/TO, be/VB, grilled/JJ, like/IN, labour/NN, spokesmen/NNS, by/IN, a/DT, panel/NN, of/IN, businessmen/NNS, and/CC, just/RB, one/CD, union/NN, leader/NN, ./.]",(ROOT (S (NP (NNP Chancellor) (NNP Norman) (NNP Lamont) (CC and) (NNP treasury) (NNS ministers)) (VP (VBD were) (VP (VBN told) (NP (NP (NN er) (NN chancellor)) (SBAR (S (NP (NNP Norman) (NNP Lamont) (CC and) (NNP treasury) (NNS ministers)) (VP (VBD were) (S (VP (TO to) (VP (VB be) (ADJP (JJ grilled) (PP (IN like) (NP (NN labour) (NNS spokesmen)))) (PP (IN by) (NP (NP (DT a) (NN panel)) (PP (IN of) (NP (NP (NNS businessmen)) (CC and) (NP (QP (RB just) (CD one)) (NN union) (NN leader))))))))))))))) (. .)))
K/KC/KCN.xml,KCNRE00U,27207,5,,A,3,4,--chancellor Norman Lamont and treasury ministers were to be grilled like labour spokesmen by a panel of businessmen  --,"[Chancellor/NNP, Norman/NNP, Lamont/NNP, and/CC, treasury/NNP, ministers/NNS, were/VBD, told/VBN, er/NN, chancellor/NN, Norman/NNP, Lamont/NNP, and/CC, treasury/NNP, ministers/NNS, were/VBD, to/TO, be/VB, grilled/JJ, like/IN, labour/NN, spokesmen/NNS, by/IN, a/DT, panel/NN, of/IN, businessmen/NNS, and/CC, just/RB, one/CD, union/NN, leader/NN, ./.]",(ROOT (S (NP (NNP Chancellor) (NNP Norman) (NNP Lamont) (CC and) (NNP treasury) (NNS ministers)) (VP (VBD were) (VP (VBN told) (NP (NP (NN er) (NN chancellor)) (SBAR (S (NP (NNP Norman) (NNP Lamont) (CC and) (NNP treasury) (NNS ministers)) (VP (VBD were) (S (VP (TO to) (VP (VB be) (ADJP (JJ grilled) (PP (IN like) (NP (NN labour) (NNS spokesmen)))) (PP (IN by) (NP (NP (DT a) (NN panel)) (PP (IN of) (NP (NP (NNS businessmen)) (CC and) (NP (QP (RB just) (CD one)) (NN union) (NN leader))))))))))))))) (. .)))
K/KC/KCN.xml,KCNRE00U,27207,6,,A,3,5,--and just one union leader </reading> .,"[Chancellor/NNP, Norman/NNP, Lamont/NNP, and/CC, treasury/NNP, ministers/NNS, were/VBD, told/VBN, er/NN, chancellor/NN, Norman/NNP, Lamont/NNP, and/CC, treasury/NNP, ministers/NNS, were/VBD, to/TO, be/VB, grilled/JJ, like/IN, labour/NN, spokesmen/NNS, by/IN, a/DT, panel/NN, of/IN, businessmen/NNS, and/CC, just/RB, one/CD, union/NN, leader/NN, ./.]",(ROOT (S (NP (NNP Chancellor) (NNP Norman) (NNP Lamont) (CC and) (NNP treasury) (NNS ministers)) (VP (VBD were) (VP (VBN told) (NP (NP (NN er) (NN chancellor)) (SBAR (S (NP (NNP Norman) (NNP Lamont) (CC and) (NNP treasury) (NNS ministers)) (VP (VBD were) (S (VP (TO to) (VP (VB be) (ADJP (JJ grilled) (PP (IN like) (NP (NN labour) (NNS spokesmen)))) (PP (IN by) (NP (NP (DT a) (NN panel)) (PP (IN of) (NP (NP (NNS businessmen)) (CC and) (NP (QP (RB just) (CD one)) (NN union) (NN leader))))))))))))))) (. .)))
K/KC/KCN.xml,KCNRE00U,27207,7,,A,3,6,But there was to be  --,"[But/CC, there/EX, was/VBD, to/TO, be/VB, Norman/NNP, Lamont/NNP, and/CC, a/DT, tr-/NN, and/CC, treasury/NN, ministers/NNS, ,/,, three/CD, or/CC, four/CD, of/IN, them/PRP, ./.]","(ROOT (S (CC But) (NP (EX there)) (VP (VBD was) (S (VP (TO to) (VP (VB be) (NP (NP (NP (NNP Norman) (NNP Lamont)) (CC and) (NP (DT a) (NN tr-))) (CC and) (NP (NP (NN treasury) (NNS ministers)) (, ,) (NP (NP (CD three) (CC or) (CD four)) (PP (IN of) (NP (PRP them)))))))))) (. .)))"
K/KC/KCN.xml,KCNRE00U,27207,8,,A,3,7,"--Norman Lamont and a tr- and treasury ministers, three or four of them.","[But/CC, there/EX, was/VBD, to/TO, be/VB, Norman/NNP, Lamont/NNP, and/CC, a/DT, tr-/NN, and/CC, treasury/NN, ministers/NNS, ,/,, three/CD, or/CC, four/CD, of/IN, them/PRP, ./.]","(ROOT (S (CC But) (NP (EX there)) (VP (VBD was) (S (VP (TO to) (VP (VB be) (NP (NP (NP (NNP Norman) (NNP Lamont)) (CC and) (NP (DT a) (NN tr-))) (CC and) (NP (NP (NN treasury) (NNS ministers)) (, ,) (NP (NP (CD three) (CC or) (CD four)) (PP (IN of) (NP (PRP them)))))))))) (. .)))"
K/KC/KCN.xml,KCNRE00U,27207,9,,A,3,8,"And there was to be the big industrialists, three or four of them.","[And/CC, there/EX, was/VBD, to/TO, be/VB, the/DT, big/JJ, industrialists/NNS, ,/,, three/CD, or/CC, four/CD, of/IN, them/PRP, ./.]","(ROOT (S (CC And) (NP (EX there)) (VP (VBD was) (S (VP (TO to) (VP (VB be) (NP (NP (DT the) (JJ big) (NNS industrialists)) (, ,) (NP (NP (CD three) (CC or) (CD four)) (PP (IN of) (NP (PRP them))))))))) (. .)))"
K/KC/KCN.xml,KCNRE00U,27207,10,,A,3,9,Same as labour was done the other day.,"[Same/JJ, as/IN, labour/NN, was/VBD, done/VBN, the/DT, other/JJ, day/NN, ./.]",(ROOT (S (NP (NP (JJ Same)) (PP (IN as) (NP (NN labour)))) (VP (VBD was) (VP (VBN done) (NP (DT the) (JJ other) (NN day)))) (. .)))
K/KC/KCN.xml,KCNRE00U,27207,11,,A,3,10,But the tories ,"[But/CC, the/DT, tories/NNPS]",(ROOT (FRAG (CC But) (NP (DT the) (NNPS tories))))
K/KC/KCN.xml,KCNRE00U,27207,12,,B,4,1,(()) ,[],
K/KC/KCN.xml,KCNRE00U,27207,13,,A,5,1,but the tories have scrapped agreed plans claiming the panel is not politically balanced.,"[but/CC, the/DT, tories/NNPS, have/VBP, scrapped/VBN, agreed/VBD, plans/NNS, claiming/VBG, the/DT, panel/NN, is/VBZ, not/RB, politically/RB, balanced/JJ, ./.]",(ROOT (S (CC but) (NP (DT the) (NNPS tories)) (VP (VBP have) (VP (VBN scrapped) (SBAR (S (VP (VBD agreed) (SBAR (S (NP (NP (NNS plans)) (VP (VBG claiming) (NP (DT the) (NN panel)))) (VP (VBZ is) (RB not) (ADJP (RB politically) (JJ balanced)))))))))) (. .)))
K/KC/KCN.xml,KCNRE00U,27207,14,,B,6,1,(()) ,[],
K/KC/KCN.xml,KCNRE00U,27207,15,,A,7,1,<reading> The B B C two programme is regularly pr- presented by Peter Jay who's Panorama Special on the slump was controversially axed last week </reading> .,"[The/DT, B/NN, B/NN, C/NN, two/CD, programme/NN, is/VBZ, regularly/RB, pr-/JJ, presented/VBN, by/IN, Peter/NNP, Jay/NNP, who/WP, 's/VBZ, Panorama/NNP, Special/JJ, on/IN, the/DT, slump/NN, was/VBD, controversially/RB, axed/VBN, last/JJ, week/NN, ./.]",(ROOT (S (NP (NP (DT The) (NN B) (NN B) (NN C)) (SBAR (S (NP (CD two) (NN programme)) (VP (VBZ is) (ADVP (RB regularly)) (ADJP (JJ pr-)))))) (VP (VBN presented) (PP (IN by) (NP (NP (NNP Peter) (NNP Jay)) (SBAR (WHNP (WP who)) (S (VP (VBZ 's) (NP (NP (NNP Panorama)) (SBAR (S (NP (NP (JJ Special)) (PP (IN on) (NP (DT the) (NN slump)))) (VP (VBD was) (ADVP (RB controversially)) (VP (VBN axed) (NP (JJ last) (NN week))))))))))))) (. .)))
K/KC/KCN.xml,KCNRE00U,27207,16,,A,7,2,They're not willing to stand up  --,"[They/PRP, 're/VBP, not/RB, willing/JJ, to/TO, stand/VB, up/RP, see/VB, erm/NN, er/NN, what/WP, 's/VBZ, it/PRP, ,/,, Richard/NNP, Dimbleby/NNP, was/VBD, it/PRP, Richard/NNP, or/CC, the/DT, other/JJ, one/CD, ?/.]","(ROOT (S (S (NP (PRP They)) (VP (VBP 're) (RB not) (ADJP (JJ willing) (S (VP (TO to) (VP (VB stand) (PRT (RP up)) (S (VP (VB see) (NP (NP (NN erm) (NN er)) (SBAR (WHNP (WP what)) (S (VP (VBZ 's) (NP (PRP it)))))))))))))) (, ,) (NP (NNP Richard) (NNP Dimbleby)) (VP (VBD was) (S (NP (PRP it)) (NP (NP (NNP Richard)) (CC or) (NP (DT the) (JJ other) (CD one))))) (. ?)))"
K/KC/KCN.xml,KCNRE00U,27207,17,,A,7,3,--see erm  --,"[They/PRP, 're/VBP, not/RB, willing/JJ, to/TO, stand/VB, up/RP, see/VB, erm/NN, er/NN, what/WP, 's/VBZ, it/PRP, ,/,, Richard/NNP, Dimbleby/NNP, was/VBD, it/PRP, Richard/NNP, or/CC, the/DT, other/JJ, one/CD, ?/.]","(ROOT (S (S (NP (PRP They)) (VP (VBP 're) (RB not) (ADJP (JJ willing) (S (VP (TO to) (VP (VB stand) (PRT (RP up)) (S (VP (VB see) (NP (NP (NN erm) (NN er)) (SBAR (WHNP (WP what)) (S (VP (VBZ 's) (NP (PRP it)))))))))))))) (, ,) (NP (NNP Richard) (NNP Dimbleby)) (VP (VBD was) (S (NP (PRP it)) (NP (NP (NNP Richard)) (CC or) (NP (DT the) (JJ other) (CD one))))) (. ?)))"
K/KC/KCN.xml,KCNRE00U,27207,18,,A,7,4,"--er what's it, Richard Dimbleby  --","[They/PRP, 're/VBP, not/RB, willing/JJ, to/TO, stand/VB, up/RP, see/VB, erm/NN, er/NN, what/WP, 's/VBZ, it/PRP, ,/,, Richard/NNP, Dimbleby/NNP, was/VBD, it/PRP, Richard/NNP, or/CC, the/DT, other/JJ, one/CD, ?/.]","(ROOT (S (S (NP (PRP They)) (VP (VBP 're) (RB not) (ADJP (JJ willing) (S (VP (TO to) (VP (VB stand) (PRT (RP up)) (S (VP (VB see) (NP (NP (NN erm) (NN er)) (SBAR (WHNP (WP what)) (S (VP (VBZ 's) (NP (PRP it)))))))))))))) (, ,) (NP (NNP Richard) (NNP Dimbleby)) (VP (VBD was) (S (NP (PRP it)) (NP (NP (NNP Richard)) (CC or) (NP (DT the) (JJ other) (CD one))))) (. ?)))"
K/KC/KCN.xml,KCNRE00U,27207,19,,A,7,5,--was it Richard  --,"[They/PRP, 're/VBP, not/RB, willing/JJ, to/TO, stand/VB, up/RP, see/VB, erm/NN, er/NN, what/WP, 's/VBZ, it/PRP, ,/,, Richard/NNP, Dimbleby/NNP, was/VBD, it/PRP, Richard/NNP, or/CC, the/DT, other/JJ, one/CD, ?/.]","(ROOT (S (S (NP (PRP They)) (VP (VBP 're) (RB not) (ADJP (JJ willing) (S (VP (TO to) (VP (VB stand) (PRT (RP up)) (S (VP (VB see) (NP (NP (NN erm) (NN er)) (SBAR (WHNP (WP what)) (S (VP (VBZ 's) (NP (PRP it)))))))))))))) (, ,) (NP (NNP Richard) (NNP Dimbleby)) (VP (VBD was) (S (NP (PRP it)) (NP (NP (NNP Richard)) (CC or) (NP (DT the) (JJ other) (CD one))))) (. ?)))"
K/KC/KCN.xml,KCNRE00U,27207,20,,A,7,6,--or the other one?,"[They/PRP, 're/VBP, not/RB, willing/JJ, to/TO, stand/VB, up/RP, see/VB, erm/NN, er/NN, what/WP, 's/VBZ, it/PRP, ,/,, Richard/NNP, Dimbleby/NNP, was/VBD, it/PRP, Richard/NNP, or/CC, the/DT, other/JJ, one/CD, ?/.]","(ROOT (S (S (NP (PRP They)) (VP (VBP 're) (RB not) (ADJP (JJ willing) (S (VP (TO to) (VP (VB stand) (PRT (RP up)) (S (VP (VB see) (NP (NP (NN erm) (NN er)) (SBAR (WHNP (WP what)) (S (VP (VBZ 's) (NP (PRP it)))))))))))))) (, ,) (NP (NNP Richard) (NNP Dimbleby)) (VP (VBD was) (S (NP (PRP it)) (NP (NP (NNP Richard)) (CC or) (NP (DT the) (JJ other) (CD one))))) (. ?)))"
K/KC/KCN.xml,KCNRE00U,27207,21,,A,7,7,Was  (()) ,[Was/VBD],(ROOT (FRAG (VP (VBD Was))))
K/KC/KCN.xml,KCNRE00U,27207,22,,B,8,1,Jonathon.,"[Jonathon/NNP, ./.]",(ROOT (FRAG (NP (NNP Jonathon)) (. .)))
K/KC/KCN.xml,KCNRE00U,27207,23,,B,8,2,Richard's dead.,"[Richard/NNP, 's/POS, dead/JJ, ./.]",(ROOT (NP (NP (NP (NNP Richard) (POS 's)) (NP (JJ dead))) (. .)))
K/KC/KCN.xml,KCNRE00U,27207,24,,A,9,1,"No the boy, the other boy.","[No/DT, the/DT, boy/NN, ,/,, the/DT, other/JJ, boy/NN, ./.]","(ROOT (NP (NP (DT No) (DT the) (NN boy)) (, ,) (NP (DT the) (JJ other) (NN boy)) (. .)))"
K/KC/KCN.xml,KCNRE00U,27207,25,,B,10,1,"Jonathon, Dick","[Jonathon/NNP, ,/,, Dick/NNP]","(ROOT (NP (NP (NNP Jonathon)) (, ,) (NP (NNP Dick))))"
K/KC/KCN.xml,KCNRE00U,27207,26,,A,11,1,No.,"[No/DT, ./.]",(ROOT (FRAG (NP (DT No)) (. .)))
K/KC/KCN.xml,KCNRE00U,27207,27,,A,11,2,What's his name?,"[What/WP, 's/VBZ, his/PRP$, name/NN, ?/.]",(ROOT (SBARQ (WHNP (WP What)) (SQ (VBZ 's) (NP (PRP$ his) (NN name))) (. ?)))
K/KC/KCN.xml,KCNRE00U,27207,28,,A,11,3,The other boy.,"[The/DT, other/JJ, boy/NN, ./.]",(ROOT (NP (DT The) (JJ other) (NN boy) (. .)))
K/KC/KCN.xml,KCNRE00U,27207,29,,A,11,4,There's two boys alive.,"[There/EX, 's/VBZ, two/CD, boys/NNS, alive/JJ, ./.]",(ROOT (S (NP (EX There)) (VP (VBZ 's) (ADJP (NP (CD two) (NNS boys)) (JJ alive))) (. .)))
K/KC/KCN.xml,KCNRE00U,27207,30,,B,12,1,David?,"[David/NNP, ?/.]",(ROOT (FRAG (NP (NNP David)) (. ?)))
K/KC/KCN.xml,KCNRE00U,27207,31,,A,13,1,Mm.,"[Mm/NN, ./.]",(ROOT (NP (NN Mm) (. .)))
K/KC/KCN.xml,KCNRE00U,27207,32,,A,13,2,I don't know one from the other  --,"[I/PRP, don/VBP, 't/PRP, know/VB, one/CD, from/IN, the/DT, other/JJ, by/IN, name/NN, ./.]",(ROOT (S (NP (PRP I)) (VP (VBP don) (S (NP (PRP 't)) (VP (VB know) (NP (CD one)) (PP (IN from) (NP (NP (DT the) (JJ other)) (PP (IN by) (NP (NN name)))))))) (. .)))
K/KC/KCN.xml,KCNRE00U,27207,33,,A,13,3,--by name.,"[I/PRP, don/VBP, 't/PRP, know/VB, one/CD, from/IN, the/DT, other/JJ, by/IN, name/NN, ./.]",(ROOT (S (NP (PRP I)) (VP (VBP don) (S (NP (PRP 't)) (VP (VB know) (NP (CD one)) (PP (IN from) (NP (NP (DT the) (JJ other)) (PP (IN by) (NP (NN name)))))))) (. .)))
K/KC/KCN.xml,KCNRE00U,27207,34,,A,13,4,"But the one was at him yesterday and he, well he didn't know what to say next.","[But/CC, the/DT, one/CD, was/VBD, at/IN, him/PRP, yesterday/NN, and/CC, he/PRP, ,/,, well/RB, he/PRP, didn/VB, 't/PRP, know/VB, what/WP, to/TO, say/VB, next/JJ, ./.]","(ROOT (S (CC But) (NP (DT the) (CD one)) (VP (VP (VBD was) (PP (IN at) (NP (PRP him))) (NP (NN yesterday))) (CC and) (VP (NP (PRP he)) (, ,) (PP (RB well) (S (NP (PRP he)) (VP (VB didn) (S (NP (PRP 't)) (VP (VB know) (SBAR (WHNP (WP what)) (S (VP (TO to) (VP (VB say) (ADVP (JJ next))))))))))))) (. .)))"
K/KC/KCN.xml,KCNRE00U,27207,35,,A,13,5,He did quiz him.,"[He/PRP, did/VBD, quiz/NN, him/PRP, ./.]",(ROOT (S (NP (PRP He)) (VP (VBD did) (S (NP (NN quiz)) (NP (PRP him)))) (. .)))
K/KC/KCN.xml,KCNRE00U,27207,36,,B,14,1,That's David.,"[That/DT, 's/VBZ, David/NNP, ./.]",(ROOT (S (NP (DT That)) (VP (VBZ 's) (NP (NNP David))) (. .)))
K/KC/KCN.xml,KCNRE00U,27207,37,,A,15,1,Is it?,"[Is/VBZ, it/PRP, ?/.]",(ROOT (S (VP (VBZ Is) (NP (PRP it))) (. ?)))
K/KC/KCN.xml,KCNRE00U,27207,38,,B,16,1,On a Sunday.,"[On/IN, a/DT, Sunday/NNP, ./.]",(ROOT (FRAG (PP (IN On) (NP (DT a) (NNP Sunday))) (. .)))
K/KC/KCN.xml,KCNRE00U,27207,39,,A,17,1,Well  --,"[Well/RB, And/CC, ,/,, and/CC, er/NN, Lamont/NN, even/RB, said/VBD, that/IN, er/NN, unemployment/NN, would/MD, get/VB, higher/JJR, ./.]","(ROOT (S (ADVP (RB Well)) (NP (CC And)) (, ,) (S (CC and) (S (NP (NN er) (NN Lamont)) (ADVP (RB even)) (VP (VBD said) (PP (IN that) (NP (NN er) (NN unemployment)))))) (VP (MD would) (VP (VB get) (NP (JJR higher)))) (. .)))"
K/KC/KCN.xml,KCNRE00U,27207,40,,A,17,2,"--And, and er  --","[Well/RB, And/CC, ,/,, and/CC, er/NN, Lamont/NN, even/RB, said/VBD, that/IN, er/NN, unemployment/NN, would/MD, get/VB, higher/JJR, ./.]","(ROOT (S (ADVP (RB Well)) (NP (CC And)) (, ,) (S (CC and) (S (NP (NN er) (NN Lamont)) (ADVP (RB even)) (VP (VBD said) (PP (IN that) (NP (NN er) (NN unemployment)))))) (VP (MD would) (VP (VB get) (NP (JJR higher)))) (. .)))"
K/KC/KCN.xml,KCNRE00U,27207,41,,A,17,3,--Lamont even said  --,"[Well/RB, And/CC, ,/,, and/CC, er/NN, Lamont/NN, even/RB, said/VBD, that/IN, er/NN, unemployment/NN, would/MD, get/VB, higher/JJR, ./.]","(ROOT (S (ADVP (RB Well)) (NP (CC And)) (, ,) (S (CC and) (S (NP (NN er) (NN Lamont)) (ADVP (RB even)) (VP (VBD said) (PP (IN that) (NP (NN er) (NN unemployment)))))) (VP (MD would) (VP (VB get) (NP (JJR higher)))) (. .)))"
K/KC/KCN.xml,KCNRE00U,27207,42,,A,17,4,--that er unemployment would get higher.,"[Well/RB, And/CC, ,/,, and/CC, er/NN, Lamont/NN, even/RB, said/VBD, that/IN, er/NN, unemployment/NN, would/MD, get/VB, higher/JJR, ./.]","(ROOT (S (ADVP (RB Well)) (NP (CC And)) (, ,) (S (CC and) (S (NP (NN er) (NN Lamont)) (ADVP (RB even)) (VP (VBD said) (PP (IN that) (NP (NN er) (NN unemployment)))))) (VP (MD would) (VP (VB get) (NP (JJR higher)))) (. .)))"
K/KC/KCN.xml,KCNRE00U,27207,43,,A,17,5,He even said so yesterday  (()) ,"[He/PRP, even/RB, said/VBD, so/RB, yesterday/NN]",(ROOT (S (NP (PRP He)) (VP (ADVP (RB even)) (VBD said) (NP (RB so) (NN yesterday)))))
K/KC/KCN.xml,KCNRE00U,27207,44,,B,18,1,Can't get no bloody higher can it?,"[Can/MD, 't/PRP, get/VB, no/DT, bloody/JJ, higher/JJR, can/MD, it/PRP, ?/.]",(ROOT (SQ (MD Can) (NP (PRP 't)) (VP (VB get) (SBAR (SINV (FRAG (ADJP (DT no) (JJ bloody) (JJR higher))) (VP (MD can)) (NP (PRP it))))) (. ?)))
K/KC/KCN.xml,KCNRE00U,27207,45,,A,19,1,Oh it could.,"[Oh/UH, it/PRP, could/MD, ./.]",(ROOT (S (S (INTJ (UH Oh)) (NP (PRP it)) (VP (MD could))) (. .)))
K/KC/KCN.xml,KCNRE00U,27207,46,,B,20,1,Twenty two percent VAT if the tories get back.,"[Twenty/CD, two/CD, percent/NN, VAT/NN, if/IN, the/DT, tories/NNPS, get/VB, back/RB, ./.]",(ROOT (S (NP (CD Twenty) (CD two)) (SBAR (NP (NN percent) (NN VAT)) (IN if) (S (NP (DT the) (NNPS tories)) (VP (VB get) (ADVP (RB back))))) (. .)))
K/KC/KCN.xml,KCNRE00U,27207,47,,A,21,1,Mm.,"[Mm/NN, ./.]",(ROOT (NP (NN Mm) (. .)))
K/KC/KCN.xml,KCNRE00U,27207,48,,A,21,2,<reading> Jobless er tory jobless figures were exposed yesterday as a fraud.,"[Jobless/JJ, er/NN, tory/NNP, jobless/JJ, figures/NNS, were/VBD, exposed/VBN, yesterday/NN, as/IN, a/DT, fraud/NN, ./.]",(ROOT (S (NP (NP (JJ Jobless) (NN er)) (NP (NNP tory) (JJ jobless) (NNS figures))) (VP (VBD were) (VP (VBN exposed) (NP (NN yesterday)) (PP (IN as) (NP (DT a) (NN fraud))))) (. .)))
K/KC/KCN.xml,KCNRE00U,27207,49,,A,21,3,The official unemployment total of  --,"[The/DT, official/JJ, unemployment/NN, total/NN, of/IN, two/CD, two/CD, million/CD, six/CD, hundred/CD, and/CC, four/CD, thousand/CD, one/CD, hundred/CD, is/VBZ, more/JJR, than/IN, a/DT, million/CD, short/JJ, of/IN, the/DT, real/JJ, figure/NN, because/IN, the/DT, tories/NNPS, have/VBP, found/VBN, thirty/CD, ways/NNS, not/RB, to/TO, count/VB, jobless/JJ, people/NNS, ./.]",(ROOT (S (NP (NP (DT The) (JJ official) (NN unemployment) (NN total)) (PP (IN of) (NP (NP (CD two)) (NP (QP (CD two) (CD million)) (QP (CD six) (CD hundred) (CC and) (CD four) (CD thousand) (CD one) (CD hundred)))))) (VP (VBZ is) (NP (NP (QP (JJR more) (IN than) (DT a) (CD million)) (JJ short)) (PP (IN of) (NP (DT the) (JJ real) (NN figure)))) (SBAR (IN because) (S (NP (DT the) (NNPS tories)) (VP (VBP have) (VP (VBN found) (NP (CD thirty) (NNS ways)) (S (RB not) (VP (TO to) (VP (VB count) (NP (JJ jobless) (NNS people)))))))))) (. .)))
K/KC/KCN.xml,KCNRE00U,27207,50,,A,21,4,--two  --,"[The/DT, official/JJ, unemployment/NN, total/NN, of/IN, two/CD, two/CD, million/CD, six/CD, hundred/CD, and/CC, four/CD, thousand/CD, one/CD, hundred/CD, is/VBZ, more/JJR, than/IN, a/DT, million/CD, short/JJ, of/IN, the/DT, real/JJ, figure/NN, because/IN, the/DT, tories/NNPS, have/VBP, found/VBN, thirty/CD, ways/NNS, not/RB, to/TO, count/VB, jobless/JJ, people/NNS, ./.]",(ROOT (S (NP (NP (DT The) (JJ official) (NN unemployment) (NN total)) (PP (IN of) (NP (NP (CD two)) (NP (QP (CD two) (CD million)) (QP (CD six) (CD hundred) (CC and) (CD four) (CD thousand) (CD one) (CD hundred)))))) (VP (VBZ is) (NP (NP (QP (JJR more) (IN than) (DT a) (CD million)) (JJ short)) (PP (IN of) (NP (DT the) (JJ real) (NN figure)))) (SBAR (IN because) (S (NP (DT the) (NNPS tories)) (VP (VBP have) (VP (VBN found) (NP (CD thirty) (NNS ways)) (S (RB not) (VP (TO to) (VP (VB count) (NP (JJ jobless) (NNS people)))))))))) (. .)))
K/KC/KCN.xml,KCNRE00U,27207,51,,A,21,5,--two million six hundred  --,"[The/DT, official/JJ, unemployment/NN, total/NN, of/IN, two/CD, two/CD, million/CD, six/CD, hundred/CD, and/CC, four/CD, thousand/CD, one/CD, hundred/CD, is/VBZ, more/JJR, than/IN, a/DT, million/CD, short/JJ, of/IN, the/DT, real/JJ, figure/NN, because/IN, the/DT, tories/NNPS, have/VBP, found/VBN, thirty/CD, ways/NNS, not/RB, to/TO, count/VB, jobless/JJ, people/NNS, ./.]",(ROOT (S (NP (NP (DT The) (JJ official) (NN unemployment) (NN total)) (PP (IN of) (NP (NP (CD two)) (NP (QP (CD two) (CD million)) (QP (CD six) (CD hundred) (CC and) (CD four) (CD thousand) (CD one) (CD hundred)))))) (VP (VBZ is) (NP (NP (QP (JJR more) (IN than) (DT a) (CD million)) (JJ short)) (PP (IN of) (NP (DT the) (JJ real) (NN figure)))) (SBAR (IN because) (S (NP (DT the) (NNPS tories)) (VP (VBP have) (VP (VBN found) (NP (CD thirty) (NNS ways)) (S (RB not) (VP (TO to) (VP (VB count) (NP (JJ jobless) (NNS people)))))))))) (. .)))
K/KC/KCN.xml,KCNRE00U,27207,52,,A,21,6,--and four thousand one hundred  --,"[The/DT, official/JJ, unemployment/NN, total/NN, of/IN, two/CD, two/CD, million/CD, six/CD, hundred/CD, and/CC, four/CD, thousand/CD, one/CD, hundred/CD, is/VBZ, more/JJR, than/IN, a/DT, million/CD, short/JJ, of/IN, the/DT, real/JJ, figure/NN, because/IN, the/DT, tories/NNPS, have/VBP, found/VBN, thirty/CD, ways/NNS, not/RB, to/TO, count/VB, jobless/JJ, people/NNS, ./.]",(ROOT (S (NP (NP (DT The) (JJ official) (NN unemployment) (NN total)) (PP (IN of) (NP (NP (CD two)) (NP (QP (CD two) (CD million)) (QP (CD six) (CD hundred) (CC and) (CD four) (CD thousand) (CD one) (CD hundred)))))) (VP (VBZ is) (NP (NP (QP (JJR more) (IN than) (DT a) (CD million)) (JJ short)) (PP (IN of) (NP (DT the) (JJ real) (NN figure)))) (SBAR (IN because) (S (NP (DT the) (NNPS tories)) (VP (VBP have) (VP (VBN found) (NP (CD thirty) (NNS ways)) (S (RB not) (VP (TO to) (VP (VB count) (NP (JJ jobless) (NNS people)))))))))) (. .)))
K/KC/KCN.xml,KCNRE00U,27207,53,,A,21,7,--is more than a million short of the real figure  --,"[The/DT, official/JJ, unemployment/NN, total/NN, of/IN, two/CD, two/CD, million/CD, six/CD, hundred/CD, and/CC, four/CD, thousand/CD, one/CD, hundred/CD, is/VBZ, more/JJR, than/IN, a/DT, million/CD, short/JJ, of/IN, the/DT, real/JJ, figure/NN, because/IN, the/DT, tories/NNPS, have/VBP, found/VBN, thirty/CD, ways/NNS, not/RB, to/TO, count/VB, jobless/JJ, people/NNS, ./.]",(ROOT (S (NP (NP (DT The) (JJ official) (NN unemployment) (NN total)) (PP (IN of) (NP (NP (CD two)) (NP (QP (CD two) (CD million)) (QP (CD six) (CD hundred) (CC and) (CD four) (CD thousand) (CD one) (CD hundred)))))) (VP (VBZ is) (NP (NP (QP (JJR more) (IN than) (DT a) (CD million)) (JJ short)) (PP (IN of) (NP (DT the) (JJ real) (NN figure)))) (SBAR (IN because) (S (NP (DT the) (NNPS tories)) (VP (VBP have) (VP (VBN found) (NP (CD thirty) (NNS ways)) (S (RB not) (VP (TO to) (VP (VB count) (NP (JJ jobless) (NNS people)))))))))) (. .)))
K/KC/KCN.xml,KCNRE00U,27207,54,,A,21,8,--because the tories have found  --,"[The/DT, official/JJ, unemployment/NN, total/NN, of/IN, two/CD, two/CD, million/CD, six/CD, hundred/CD, and/CC, four/CD, thousand/CD, one/CD, hundred/CD, is/VBZ, more/JJR, than/IN, a/DT, million/CD, short/JJ, of/IN, the/DT, real/JJ, figure/NN, because/IN, the/DT, tories/NNPS, have/VBP, found/VBN, thirty/CD, ways/NNS, not/RB, to/TO, count/VB, jobless/JJ, people/NNS, ./.]",(ROOT (S (NP (NP (DT The) (JJ official) (NN unemployment) (NN total)) (PP (IN of) (NP (NP (CD two)) (NP (QP (CD two) (CD million)) (QP (CD six) (CD hundred) (CC and) (CD four) (CD thousand) (CD one) (CD hundred)))))) (VP (VBZ is) (NP (NP (QP (JJR more) (IN than) (DT a) (CD million)) (JJ short)) (PP (IN of) (NP (DT the) (JJ real) (NN figure)))) (SBAR (IN because) (S (NP (DT the) (NNPS tories)) (VP (VBP have) (VP (VBN found) (NP (CD thirty) (NNS ways)) (S (RB not) (VP (TO to) (VP (VB count) (NP (JJ jobless) (NNS people)))))))))) (. .)))
K/KC/KCN.xml,KCNRE00U,27207,55,,A,21,9,--thirty ways not to count jobless people </reading> .,"[The/DT, official/JJ, unemployment/NN, total/NN, of/IN, two/CD, two/CD, million/CD, six/CD, hundred/CD, and/CC, four/CD, thousand/CD, one/CD, hundred/CD, is/VBZ, more/JJR, than/IN, a/DT, million/CD, short/JJ, of/IN, the/DT, real/JJ, figure/NN, because/IN, the/DT, tories/NNPS, have/VBP, found/VBN, thirty/CD, ways/NNS, not/RB, to/TO, count/VB, jobless/JJ, people/NNS, ./.]",(ROOT (S (NP (NP (DT The) (JJ official) (NN unemployment) (NN total)) (PP (IN of) (NP (NP (CD two)) (NP (QP (CD two) (CD million)) (QP (CD six) (CD hundred) (CC and) (CD four) (CD thousand) (CD one) (CD hundred)))))) (VP (VBZ is) (NP (NP (QP (JJR more) (IN than) (DT a) (CD million)) (JJ short)) (PP (IN of) (NP (DT the) (JJ real) (NN figure)))) (SBAR (IN because) (S (NP (DT the) (NNPS tories)) (VP (VBP have) (VP (VBN found) (NP (CD thirty) (NNS ways)) (S (RB not) (VP (TO to) (VP (VB count) (NP (JJ jobless) (NNS people)))))))))) (. .)))
K/KC/KCN.xml,KCNRE00U,27207,56,,B,22,1,That right?,"[That/DT, right/NN, ?/.]",(ROOT (NP (DT That) (NN right) (. ?)))
K/KC/KCN.xml,KCNRE00U,27207,57,,A,23,1,They say unless you've been unemployed six months you're not unemployed.,"[They/PRP, say/VBP, unless/IN, you/PRP, 've/VBP, been/VBN, unemployed/JJ, six/CD, months/NNS, you/PRP, 're/VBP, not/RB, unemployed/JJ, ./.]",(ROOT (S (NP (PRP They)) (VP (VBP say) (SBAR (IN unless) (S (NP (PRP you)) (VP (VBP 've) (VP (VBN been) (NP (NP (JJ unemployed) (CD six) (NNS months)) (SBAR (S (NP (PRP you)) (VP (VBP 're) (RB not) (ADJP (JJ unemployed))))))))))) (. .)))
