swda_filename,ptb_basename,conversation_no,transcript_index,act_tag,caller,turn_index,subutterance_index,text,pos,trees
K/KB/KBK.xml,KBKRE00A,2011,191,,A,107,6,"Oh yes well apparently they normally have a sort of rhythm and blues or something on a, on a Thursday.","[Oh/UH, yes/RB, well/RB, apparently/RB, they/PRP, normally/RB, have/VBP, a/DT, sort/NN, of/IN, rhythm/NN, and/CC, blues/NN, or/CC, something/NN, on/IN, a/DT, ,/,, on/IN, a/DT, Thursday/NNP, ./.]","(ROOT (INTJ (UH Oh) (PP (PP (RB yes) (ADVP (RB well))) (SBAR (RB apparently) (S (NP (PRP they)) (ADVP (RB normally)) (VP (VBP have) (NP (NP (DT a) (NN sort)) (PP (IN of) (NP (NN rhythm) (CC and) (NN blues) (CC or) (NN something)))) (ADVP (IN on) (DT a)) (, ,) (PP (IN on) (NP (DT a) (NNP Thursday))))))) (. .)))"
K/KB/KBK.xml,KBKRE00A,2011,192,,A,107,7,"Er or soul or something of that sort, which er  --","[Er/NN, or/CC, soul/NN, or/CC, something/NN, of/IN, that/DT, sort/NN, ,/,, which/WDT, er/NN, you/PRP, know/VBP, there/EX, were/VBD, loads/NNS, of/IN, youngsters/NNS, in/IN, the/DT, pub/NN, ./.]","(ROOT (S (NP (NP (NN Er)) (CC or) (NP (NP (NN soul) (CC or) (NN something)) (PP (IN of) (NP (DT that) (NN sort))) (, ,) (SBAR (WHNP (WDT which)) (S (NP (NN er)) (NP (PRP you)))))) (VP (VBP know) (SBAR (S (NP (EX there)) (VP (VBD were) (NP (NP (NNS loads)) (PP (IN of) (NP (NP (NNS youngsters)) (PP (IN in) (NP (DT the) (NN pub)))))))))) (. .)))"
K/KB/KBK.xml,KBKRE00A,2011,193,,A,107,8,--you know there were loads of youngsters in the pub.,"[Er/NN, or/CC, soul/NN, or/CC, something/NN, of/IN, that/DT, sort/NN, ,/,, which/WDT, er/NN, you/PRP, know/VBP, there/EX, were/VBD, loads/NNS, of/IN, youngsters/NNS, in/IN, the/DT, pub/NN, ./.]","(ROOT (S (NP (NP (NN Er)) (CC or) (NP (NP (NN soul) (CC or) (NN something)) (PP (IN of) (NP (DT that) (NN sort))) (, ,) (SBAR (WHNP (WDT which)) (S (NP (NN er)) (NP (PRP you)))))) (VP (VBP know) (SBAR (S (NP (EX there)) (VP (VBD were) (NP (NP (NNS loads)) (PP (IN of) (NP (NP (NNS youngsters)) (PP (IN in) (NP (DT the) (NN pub)))))))))) (. .)))"
K/KB/KBK.xml,KBKRE00A,2011,194,,A,107,9,Not under age youngsters I was pleased to see.,"[Not/RB, under/IN, age/NN, youngsters/NNS, I/PRP, was/VBD, pleased/VBN, to/TO, see/VB, ./.]",(ROOT (S (RB Not) (PP (IN under) (NP (NN age) (NNS youngsters))) (NP (PRP I)) (VP (VBD was) (VP (VBN pleased) (S (VP (TO to) (VP (VB see)))))) (. .)))
K/KB/KBK.xml,KBKRE00A,2011,195,,A,107,10,But er  --,"[But/CC, er/NN, there/EX, were/VBD, a/DT, goodly/JJ, proportion/NN, of/IN, people/NNS, who/WP, were/VBD, really/RB, enjoying/VBG, the/DT, er/NN, ,/,, the/DT, track/NN, ./.]","(ROOT (S (CC But) (NP (NN er)) (NP (EX there)) (VP (VBD were) (NP (NP (DT a) (JJ goodly) (NN proportion)) (PP (IN of) (NP (NP (NNS people)) (SBAR (WHNP (WP who)) (S (VP (VBD were) (ADVP (RB really)) (VP (VBG enjoying) (NP (NP (DT the) (NN er)) (, ,) (NP (DT the) (NN track))))))))))) (. .)))"
K/KB/KBK.xml,KBKRE00A,2011,196,,A,107,11,"--there were a goodly proportion of people who were really enjoying the er, the track.","[But/CC, er/NN, there/EX, were/VBD, a/DT, goodly/JJ, proportion/NN, of/IN, people/NNS, who/WP, were/VBD, really/RB, enjoying/VBG, the/DT, er/NN, ,/,, the/DT, track/NN, ./.]","(ROOT (S (CC But) (NP (NN er)) (NP (EX there)) (VP (VBD were) (NP (NP (DT a) (JJ goodly) (NN proportion)) (PP (IN of) (NP (NP (NNS people)) (SBAR (WHNP (WP who)) (S (VP (VBD were) (ADVP (RB really)) (VP (VBG enjoying) (NP (NP (DT the) (NN er)) (, ,) (NP (DT the) (NN track))))))))))) (. .)))"
K/KB/KBK.xml,KBKRE00A,2011,197,,B,108,1,I'm sorry I didn't feel up to going.,"[I/PRP, 'm/VBP, sorry/JJ, I/PRP, didn/VBP, 't/PRP, feel/VB, up/RP, to/TO, going/VBG, ./.]",(ROOT (S (NP (PRP I)) (VP (VBP 'm) (ADJP (JJ sorry) (SBAR (S (NP (PRP I)) (VP (VBP didn) (S (NP (PRP 't)) (VP (VB feel) (PRT (RP up)))) (PP (TO to) (S (VP (VBG going))))))))) (. .)))
K/KB/KBK.xml,KBKRE00A,2011,198,,A,109,1,Yeah.,"[Yeah/UH, ./.]",(ROOT (INTJ (UH Yeah) (. .)))
K/KB/KBK.xml,KBKRE00A,2011,199,,A,109,2,"Well we've got plenty of other, I've got the list.","[Well/RB, we/PRP, 've/VBP, got/VBN, plenty/NN, of/IN, other/JJ, ,/,, I/PRP, 've/VBP, got/VBD, the/DT, list/NN, ./.]","(ROOT (S (S (INTJ (RB Well)) (NP (PRP we)) (VP (VBP 've) (VP (VBN got) (NP (NP (NN plenty)) (PP (IN of) (NP (JJ other))))))) (, ,) (NP (PRP I)) (VP (VBP 've) (VP (VBD got) (NP (DT the) (NN list)))) (. .)))"
K/KB/KBK.xml,KBKRE00A,2011,200,,A,109,3,(()) opportunities to go and hear them again.,"[opportunities/NNS, to/TO, go/VB, and/CC, hear/VB, them/PRP, again/RB, ./.]",(ROOT (S (NP (NNS opportunities)) (VP (TO to) (VP (VB go) (CC and) (VB hear) (NP (PRP them)) (ADVP (RB again)))) (. .)))
K/KB/KBK.xml,KBKRE00A,2011,201,,A,109,4,He's a funny character though.,"[He/PRP, 's/VBZ, a/DT, funny/JJ, character/NN, though/IN, ./.]",(ROOT (S (NP (PRP He)) (VP (VBZ 's) (NP (DT a) (JJ funny) (NN character)) (ADVP (IN though))) (. .)))
K/KB/KBK.xml,KBKRE00A,2011,202,,B,110,1,Who?,"[Who/WP, ?/.]",(ROOT (FRAG (WHNP (WP Who)) (. ?)))
K/KB/KBK.xml,KBKRE00A,2011,203,,B,110,2,Who's a funny character?,"[Who/WP, 's/VBZ, a/DT, funny/JJ, character/NN, ?/.]",(ROOT (SBARQ (WHNP (WP Who)) (SQ (VBZ 's) (NP (DT a) (JJ funny) (NN character))) (. ?)))
K/KB/KBK.xml,KBKRE00A,2011,204,,A,111,1,"<<REDACTED (name)>> , who runs it.","[>/JJR, ,/,, who/WP, runs/VBZ, it/PRP, ./.]","(ROOT (FRAG (ADJP (JJR >)) (, ,) (SBAR (WHNP (WP who)) (S (VP (VBZ runs) (NP (PRP it))))) (. .)))"
K/KB/KBK.xml,KBKRE00A,2011,205,,B,112,1,(()) .,[./.],(ROOT (NP (. .)))
K/KB/KBK.xml,KBKRE00A,2011,206,,B,112,2,He seems to have a very popular pub there.,"[He/PRP, seems/VBZ, to/TO, have/VB, a/DT, very/RB, popular/JJ, pub/NN, there/RB, ./.]",(ROOT (S (NP (PRP He)) (VP (VBZ seems) (S (VP (TO to) (VP (VB have) (NP (DT a) (ADJP (RB very) (JJ popular)) (NN pub)) (ADVP (RB there)))))) (. .)))
K/KB/KBK.xml,KBKRE00A,2011,207,,A,113,1,"Oh, who runs the band sorry, runs the band.","[Oh/UH, ,/,, who/WP, runs/VBZ, the/DT, band/NN, sorry/JJ, ,/,, runs/VBZ, the/DT, band/NN, ./.]","(ROOT (S (INTJ (UH Oh)) (, ,) (NP (NP (WHNP (WP who)) (S (VP (VBZ runs) (S (NP (DT the) (NN band)) (ADJP (JJ sorry)))))) (, ,)) (VP (VBZ runs) (NP (DT the) (NN band))) (. .)))"
K/KB/KBK.xml,KBKRE00A,2011,208,,B,114,1,"Oh, who runs the band.","[Oh/UH, ,/,, who/WP, runs/VBZ, the/DT, band/NN, ./.]","(ROOT (S (INTJ (UH Oh)) (, ,) (NP (WP who)) (VP (VBZ runs) (NP (DT the) (NN band))) (. .)))"
K/KB/KBK.xml,KBKRE00A,2011,209,,A,115,1,"Yeah, it, it's a new interim landlord at the Crown.","[Yeah/UH, ,/,, it/PRP, ,/,, it/PRP, 's/VBZ, a/DT, new/JJ, interim/JJ, landlord/NN, at/IN, the/DT, Crown/NN, ./.]","(ROOT (S (FRAG (INTJ (UH Yeah)) (, ,) (NP (PRP it))) (, ,) (NP (PRP it)) (VP (VBZ 's) (NP (NP (DT a) (JJ new) (JJ interim) (NN landlord)) (PP (IN at) (NP (DT the) (NN Crown))))) (. .)))"
K/KB/KBK.xml,KBKRE00A,2011,210,,B,116,1,What happened to the old one?,"[What/WP, happened/VBD, to/TO, the/DT, old/JJ, one/CD, ?/.]",(ROOT (SBARQ (WHNP (WP What)) (SQ (VP (VBD happened) (PP (TO to) (NP (DT the) (JJ old) (CD one))))) (. ?)))
K/KB/KBK.xml,KBKRE00A,2011,211,,A,117,1,"Oh, they move on.","[Oh/UH, ,/,, they/PRP, move/VBP, on/IN, ./.]","(ROOT (S (INTJ (UH Oh)) (, ,) (NP (PRP they)) (VP (VBP move) (PP (IN on))) (. .)))"
K/KB/KBK.xml,KBKRE00A,2011,212,,A,117,2,Erm you know he found another pub.,"[Erm/NN, you/PRP, know/VBP, he/PRP, found/VBD, another/DT, pub/NN, ./.]",(ROOT (S (NP (NP (NN Erm)) (SBAR (S (NP (PRP you)) (VP (VBP know) (NP (PRP he)))))) (VP (VBD found) (NP (DT another) (NN pub))) (. .)))
K/KB/KBK.xml,KBKRE00A,2011,213,,A,117,3,"Sometimes they move from being managers to being licence, erm erm tenants, I mean","[Sometimes/RB, they/PRP, move/VBP, from/IN, being/VBG, managers/NNS, to/TO, being/VBG, licence/NN, ,/,, erm/NN, erm/NN, tenants/NNS, ,/,, I/PRP, mean/VBP]","(ROOT (S (SBAR (ADVP (RB Sometimes)) (S (NP (PRP they)) (VP (VBP move) (PP (IN from) (S (VP (VBG being) (NP (NP (NNS managers)) (PP (TO to) (S (VP (VBG being) (NP (NP (NN licence)) (, ,) (NP (NN erm) (NN erm) (NNS tenants))))))))))))) (, ,) (NP (PRP I)) (VP (VBP mean))))"
K/KB/KBK.xml,KBKRE00A,2011,214,,B,118,1,(()) ,[],X
K/KB/KBK.xml,KBKRE00A,2011,215,,A,119,1,when they're running their own business.,"[when/WRB, they/PRP, 're/VBP, running/VBG, their/PRP$, own/JJ, business/NN, ./.]",(ROOT (FRAG (SBAR (WHADVP (WRB when)) (S (NP (PRP they)) (VP (VBP 're) (VP (VBG running) (NP (PRP$ their) (JJ own) (NN business)))))) (. .)))
K/KB/KBK.xml,KBKRE00A,2011,216,,B,120,1,A bigger pub?,"[A/DT, bigger/JJR, pub/NN, ?/.]",(ROOT (FRAG (NP (DT A) (ADJP (JJR bigger)) (NN pub)) (. ?)))
K/KB/KBK.xml,KBKRE00A,2011,217,,A,121,1,Perhaps but I mean the Crown is quite a big pub.,"[Perhaps/RB, but/CC, I/PRP, mean/VBP, the/DT, Crown/NN, is/VBZ, quite/RB, a/DT, big/JJ, pub/NN, ./.]",(ROOT (S (S (ADVP (RB Perhaps)) (ADVP (CC but)) (NP (PRP I)) (VP (VBP mean))) (NP (DT the) (NN Crown)) (VP (VBZ is) (NP (RB quite) (DT a) (JJ big) (NN pub))) (. .)))
K/KB/KBK.xml,KBKRE00A,2011,218,,B,122,1,(()) more opportunities.,"[more/RBR, opportunities/NNS, ./.]",(ROOT (NP (NP (RBR more)) (NP (NNS opportunities)) (. .)))
K/KB/KBK.xml,KBKRE00A,2011,219,,A,123,1,Quite a big pub.,"[Quite/RB, a/DT, big/JJ, pub/NN, ./.]",(ROOT (NP (RB Quite) (DT a) (JJ big) (NN pub) (. .)))
K/KB/KBK.xml,KBKRE00A,2011,220,,A,123,2,"It's a, with its own kitchens and what have you.","[It/PRP, 's/VBZ, a/DT, ,/,, with/IN, its/PRP$, own/JJ, kitchens/NNS, and/CC, what/WP, have/VBP, you/PRP, ./.]","(ROOT (S (NP (PRP It)) (VP (VBZ 's) (UCP (NP (NP (DT a)) (, ,) (PP (IN with) (NP (PRP$ its) (JJ own) (NNS kitchens)))) (CC and) (SBAR (WHNP (WP what)) (S (VP (VBP have) (NP (PRP you))))))) (. .)))"
K/KB/KBK.xml,KBKRE00A,2011,221,,A,123,3,I should think you could make a good living there if you wanted to.,"[I/PRP, should/MD, think/VB, you/PRP, could/MD, make/VB, a/DT, good/JJ, living/NN, there/RB, if/IN, you/PRP, wanted/VBD, to/TO, ./.]",(ROOT (S (NP (PRP I)) (VP (MD should) (VP (VB think) (SBAR (S (NP (PRP you)) (VP (MD could) (VP (VB make) (NP (DT a) (JJ good) (NN living)) (ADVP (RB there)) (SBAR (IN if) (S (NP (PRP you)) (VP (VBD wanted) (PP (TO to))))))))))) (. .)))
K/KB/KBK.xml,KBKRE00A,2011,222,,A,123,4,And there have been long term er landlords there.,"[And/CC, there/EX, have/VBP, been/VBN, long/JJ, term/NN, er/NN, landlords/NNS, there/RB, ./.]",(ROOT (S (CC And) (NP (EX there)) (VP (VBP have) (VP (VBN been) (NP (JJ long) (NN term) (NN er) (NNS landlords)) (ADVP (RB there)))) (. .)))
K/KB/KBK.xml,KBKRE00A,2011,223,,B,124,1,(()) ,[],X
K/KB/KBK.xml,KBKRE00A,2011,224,,A,125,1,Sorry?,"[Sorry/JJ, ?/.]",(ROOT (FRAG (ADJP (JJ Sorry)) (. ?)))
K/KB/KBK.xml,KBKRE00A,2011,225,,B,126,1,(()) ,[],X
K/KB/KBK.xml,KBKRE00A,2011,226,,A,127,1,Mm.,"[Mm/NN, ./.]",(ROOT (NP (NN Mm) (. .)))
K/KB/KBK.xml,KBKRE00A,2011,227,,A,127,2,Well I'll go and shower now.,"[Well/RB, I/PRP, 'll/MD, go/VB, and/CC, shower/VB, now/RB, ./.]",(ROOT (S (ADVP (RB Well)) (NP (PRP I)) (VP (MD 'll) (VP (VB go) (CC and) (VB shower) (ADVP (RB now)))) (. .)))
K/KB/KBK.xml,KBKRE00A,2011,228,,A,127,3,Snoopy was off in a rush wasn't she?,"[Snoopy/NNP, was/VBD, off/RB, in/IN, a/DT, rush/NN, wasn/NN, 't/PRP, she/PRP, ?/.]",(ROOT (S (NP (NNP Snoopy)) (VP (VBD was) (ADVP (RB off) (PP (IN in) (NP (NP (DT a) (NN rush) (NN wasn)) (NP (PRP 't))))) (NP (PRP she))) (. ?)))
K/KB/KBK.xml,KBKRE00A,2011,229,,B,128,1,Well she was going on the train.,"[Well/RB, she/PRP, was/VBD, going/VBG, on/IN, the/DT, train/NN, ./.]",(ROOT (S (ADVP (RB Well)) (NP (PRP she)) (VP (VBD was) (VP (VBG going) (PP (IN on) (NP (DT the) (NN train))))) (. .)))
K/KB/KBK.xml,KBKRE00A,2011,230,,A,129,1,Didn't realize she was going quite so early but I suppose it's hardly early anyway now.,"[Didn/NN, 't/PRP, realize/VBP, she/PRP, was/VBD, going/VBG, quite/RB, so/RB, early/JJ, but/CC, I/PRP, suppose/VBP, it/PRP, 's/VBZ, hardly/RB, early/JJ, anyway/RB, now/RB, ./.]",(ROOT (S (S (NP (NP (NN Didn)) (SBAR (S (NP (PRP 't)) (VP (VBP realize) (NP (PRP she)))))) (VP (VBD was) (VP (VBG going) (ADVP (RB quite) (RB so) (JJ early))))) (CC but) (S (NP (PRP I)) (VP (VBP suppose) (SBAR (S (NP (PRP it)) (VP (VBZ 's) (ADJP (RB hardly) (JJ early)) (PRN (ADVP (RB anyway)) (ADVP (RB now)))))))) (. .)))
K/KB/KBK.xml,KBKRE00A,2011,231,,B,130,1,What time does Lynda come in these days?,"[What/WDT, time/NN, does/VBZ, Lynda/NNP, come/VBN, in/IN, these/DT, days/NNS, ?/.]",(ROOT (SBARQ (WHNP (WDT What) (NN time)) (SQ (VP (VBZ does) (NP (NP (NNP Lynda)) (VP (VBN come) (PP (IN in) (NP (DT these) (NNS days))))))) (. ?)))
K/KB/KBK.xml,KBKRE00A,2011,232,,A,131,1,Half past nineish.,"[Half/DT, past/JJ, nineish/JJ, ./.]",(ROOT (NP (NP (QP (DT Half)) (JJ past)) (ADJP (JJ nineish)) (. .)))
K/KB/KBK.xml,KBKRE00A,2011,233,,B,132,1,I wonder if she'll change her time because of half term and she won't have to be  --,"[I/PRP, wonder/VBP, if/IN, she/PRP, 'll/MD, change/VB, her/PRP$, time/NN, because/IN, of/IN, half/NN, term/NN, and/CC, she/PRP, won/VBD, 't/PRP, have/VB, to/TO, be/VB, taking/VBG, her/PRP$, daughter/NN, to/TO, nursery/NN, school/NN, today/NN, ,/,, half/NN, past/IN, one/CD, ./.]","(ROOT (S (NP (PRP I)) (VP (VBP wonder) (SBAR (IN if) (S (S (NP (PRP she)) (VP (MD 'll) (VP (VB change) (NP (PRP$ her) (NN time)) (PP (IN because) (PP (IN of) (NP (NN half) (NN term))))))) (CC and) (S (NP (PRP she)) (VP (VBD won) (S (NP (PRP 't)) (VP (VB have) (S (VP (TO to) (VP (VB be) (VP (VBG taking) (NP (PRP$ her) (NN daughter)) (PP (TO to) (NP (NN nursery) (NN school)))))) (NP (NN today)) (, ,) (ADVP (NN half))))))) (PP (IN past) (NP (CD one)))))) (. .)))"
K/KB/KBK.xml,KBKRE00A,2011,234,,B,132,2,"--taking her daughter to nursery school today, half past one.","[I/PRP, wonder/VBP, if/IN, she/PRP, 'll/MD, change/VB, her/PRP$, time/NN, because/IN, of/IN, half/NN, term/NN, and/CC, she/PRP, won/VBD, 't/PRP, have/VB, to/TO, be/VB, taking/VBG, her/PRP$, daughter/NN, to/TO, nursery/NN, school/NN, today/NN, ,/,, half/NN, past/IN, one/CD, ./.]","(ROOT (S (NP (PRP I)) (VP (VBP wonder) (SBAR (IN if) (S (S (NP (PRP she)) (VP (MD 'll) (VP (VB change) (NP (PRP$ her) (NN time)) (PP (IN because) (PP (IN of) (NP (NN half) (NN term))))))) (CC and) (S (NP (PRP she)) (VP (VBD won) (S (NP (PRP 't)) (VP (VB have) (S (VP (TO to) (VP (VB be) (VP (VBG taking) (NP (PRP$ her) (NN daughter)) (PP (TO to) (NP (NN nursery) (NN school)))))) (NP (NN today)) (, ,) (ADVP (NN half))))))) (PP (IN past) (NP (CD one)))))) (. .)))"
K/KB/KBK.xml,KBKRE00A,2011,235,,A,133,1,She may be.,"[She/PRP, may/MD, be/VB, ./.]",(ROOT (S (NP (PRP She)) (VP (MD may) (VP (VB be))) (. .)))
K/KB/KBK.xml,KBKRE00A,2011,236,,A,133,2,"Yes, yes she may be.","[Yes/UH, ,/,, yes/UH, she/PRP, may/MD, be/VB, ./.]","(ROOT (S (S (INTJ (UH Yes) (, ,) (UH yes)) (NP (PRP she)) (VP (MD may) (VP (VB be)))) (. .)))"
K/KB/KBK.xml,KBKRE00A,2011,237,,A,133,3,Yep.,"[Yep/NN, ./.]",(ROOT (NP (NN Yep) (. .)))
K/KB/KBK.xml,KBKRE00A,2011,238,,B,134,1,(()) isn't it?(()) bridesmaid's dress.,"[isn/NNP, 't/PRP, it/PRP, ?/., bridesmaid/NN, 's/POS, dress/NN, ./.]",(ROOT (S (NP (NNP isn)) (VP (PRP 't) (SBAR (FRAG (NP (PRP it)) (. ?)))) (NP (NP (NN bridesmaid) (POS 's)) (NN dress)) (. .)))
K/KB/KBK.xml,KBKRE00A,2011,239,,B,134,2,There's nothing the right colour at all.,"[There/EX, 's/VBZ, nothing/NN, the/DT, right/JJ, colour/NN, at/IN, all/DT, ./.]",(ROOT (S (NP (EX There)) (VP (VBZ 's) (ADVP (NN nothing)) (NP (NP (DT the) (JJ right) (NN colour)) (PP (IN at) (NP (DT all))))) (. .)))
K/KB/KBK.xml,KBKRE00A,2011,240,,A,135,1,Oh how annoying.,"[Oh/UH, how/WRB, annoying/JJ, ./.]",(ROOT (S (INTJ (UH Oh)) (VP (WRB how) (ADJP (JJ annoying))) (. .)))
K/KB/KBK.xml,KBKRE00A,2011,241,,B,136,1,I'll have to go into that little  --,"[I/PRP, 'll/MD, have/VB, to/TO, go/VB, into/IN, that/DT, little/JJ, Auntie/NN, Pat/NN, 's/POS, Textiles/NNS, or/CC, whatever/WDT, it/PRP, 's/VBZ, called/VBN, in/IN, the/DT, afternoon/NN, ./.]",(ROOT (S (NP (PRP I)) (VP (MD 'll) (VP (VB have) (S (VP (TO to) (VP (VB go) (UCP (PP (IN into) (NP (NP (DT that) (JJ little) (NN Auntie) (NN Pat) (POS 's)) (NNS Textiles))) (CC or) (SBAR (WHNP (WDT whatever)) (S (NP (PRP it)) (VP (VBZ 's) (VP (VBN called) (PP (IN in) (NP (DT the) (NN afternoon))))))))))))) (. .)))
K/KB/KBK.xml,KBKRE00A,2011,242,,B,136,2,--Auntie Pat's Textiles or whatever it's called in the afternoon.,"[I/PRP, 'll/MD, have/VB, to/TO, go/VB, into/IN, that/DT, little/JJ, Auntie/NN, Pat/NN, 's/POS, Textiles/NNS, or/CC, whatever/WDT, it/PRP, 's/VBZ, called/VBN, in/IN, the/DT, afternoon/NN, ./.]",(ROOT (S (NP (PRP I)) (VP (MD 'll) (VP (VB have) (S (VP (TO to) (VP (VB go) (UCP (PP (IN into) (NP (NP (DT that) (JJ little) (NN Auntie) (NN Pat) (POS 's)) (NNS Textiles))) (CC or) (SBAR (WHNP (WDT whatever)) (S (NP (PRP it)) (VP (VBZ 's) (VP (VBN called) (PP (IN in) (NP (DT the) (NN afternoon))))))))))))) (. .)))
K/KB/KBK.xml,KBKRE00A,2011,243,,A,137,1,You don't want to leave it to Veronica?,"[You/PRP, don/VBP, 't/PRP, want/VB, to/TO, leave/VB, it/PRP, to/TO, Veronica/NNP, ?/.]",(ROOT (S (NP (PRP You)) (VP (VBP don) (S (NP (PRP 't)) (VP (VB want) (S (VP (TO to) (VP (VB leave) (NP (PRP it)) (PP (TO to) (NP (NNP Veronica))))))))) (. ?)))
K/KB/KBK.xml,KBKRE00A,2011,244,,B,138,1,"Veronica doesn't want, want to do the shopping bit of it.","[Veronica/NNP, doesn/NNP, 't/PRP, want/VBP, ,/,, want/VBP, to/TO, do/VB, the/DT, shopping/NN, bit/NN, of/IN, it/PRP, ./.]","(ROOT (S (NP (NNP Veronica) (NNP doesn)) (PRN (S (NP (PRP 't)) (VP (VBP want))) (, ,)) (VP (VBP want) (S (VP (TO to) (VP (VB do) (NP (NP (DT the) (NN shopping) (NN bit)) (PP (IN of) (NP (PRP it)))))))) (. .)))"
K/KB/KBK.xml,KBKRE00A,2011,245,,A,139,1,No.,"[No/DT, ./.]",(ROOT (FRAG (NP (DT No)) (. .)))
K/KB/KBK.xml,KBKRE00A,2011,246,,B,140,1,I don't blame her either.,"[I/PRP, don/VBP, 't/PRP, blame/VB, her/PRP$, either/CC, ./.]",(ROOT (S (NP (PRP I)) (VP (VBP don) (S (NP (PRP 't)) (VP (VB blame) (NP (PRP$ her)) (ADVP (CC either))))) (. .)))
K/KB/KBK.xml,KBKRE00A,2011,247,,A,141,1,"<laugh> yes, it's certainly improving a bit ","[yes/UH, ,/,, it/PRP, 's/VBZ, certainly/RB, improving/VBG, a/DT, bit/NN]","(ROOT (S (ADVP (UH yes)) (, ,) (NP (PRP it)) (VP (VBZ 's) (ADVP (RB certainly)) (VP (VBG improving) (NP (DT a) (NN bit))))))"
K/KB/KBK.xml,KBKRE00A,2011,248,,B,142,1,I know she hasn't left all her customers.,"[I/PRP, know/VBP, she/PRP, hasn/VB, 't/PRP, left/VBD, all/DT, her/PRP$, customers/NNS, ./.]",(ROOT (S (NP (PRP I)) (VP (VBP know) (S (NP (PRP she)) (VP (VB hasn) (SBAR (S (NP (PRP 't)) (VP (VBD left) (NP (DT all) (PRP$ her) (NNS customers)))))))) (. .)))
K/KB/KBK.xml,KBKRE00A,2011,249,,A,143,1,"Oh quite, quite.","[Oh/UH, quite/RB, ,/,, quite/RB, ./.]","(ROOT (S (VP (PP (NP (UH Oh)) (NP (NP (RB quite)) (, ,) (ADVP (RB quite))))) (. .)))"
K/KB/KBK.xml,KBKRE00A,2011,250,,A,143,2,Does she have any other suggestions of shops for the linings?,"[Does/VBZ, she/PRP, have/VB, any/DT, other/JJ, suggestions/NNS, of/IN, shops/NNS, for/IN, the/DT, linings/NNS, ?/.]",(ROOT (SQ (VBZ Does) (NP (PRP she)) (VP (VB have) (NP (NP (DT any) (JJ other) (NNS suggestions)) (PP (IN of) (NP (NP (NNS shops)) (PP (IN for) (NP (DT the) (NNS linings))))))) (. ?)))
K/KB/KBK.xml,KBKRE00A,2011,251,,B,144,1,(()) .,[./.],(ROOT (NP (. .)))
K/KB/KBK.xml,KBKRE00A,2011,252,,B,144,2,Well John Lewis probably will have it but that means  --,"[Well/RB, John/NNP, Lewis/NNP, probably/RB, will/MD, have/VB, it/PRP, but/CC, that/DT, means/VBZ, burdening/VBG, Suzannah/NNP, with/IN, it/PRP, ./.]",(ROOT (S (ADVP (RB Well)) (S (NP (NNP John) (NNP Lewis)) (ADVP (RB probably)) (VP (MD will) (VP (VB have) (NP (PRP it))))) (CC but) (S (NP (DT that)) (VP (VBZ means) (S (VP (VBG burdening) (NP (NP (NNP Suzannah)) (PP (IN with) (NP (PRP it)))))))) (. .)))
K/KB/KBK.xml,KBKRE00A,2011,253,,B,144,3,--burdening Suzannah with it.,"[Well/RB, John/NNP, Lewis/NNP, probably/RB, will/MD, have/VB, it/PRP, but/CC, that/DT, means/VBZ, burdening/VBG, Suzannah/NNP, with/IN, it/PRP, ./.]",(ROOT (S (ADVP (RB Well)) (S (NP (NNP John) (NNP Lewis)) (ADVP (RB probably)) (VP (MD will) (VP (VB have) (NP (PRP it))))) (CC but) (S (NP (DT that)) (VP (VBZ means) (S (VP (VBG burdening) (NP (NP (NNP Suzannah)) (PP (IN with) (NP (PRP it)))))))) (. .)))
K/KB/KBK.xml,KBKRE00A,2011,254,,B,144,4,At a time when she's busy with her exams.,"[At/IN, a/DT, time/NN, when/WRB, she/PRP, 's/VBZ, busy/JJ, with/IN, her/PRP$, exams/NNS, ./.]",(ROOT (FRAG (PP (IN At) (NP (NP (DT a) (NN time)) (SBAR (WHADVP (WRB when)) (S (NP (PRP she)) (VP (VBZ 's) (ADJP (JJ busy) (PP (IN with) (NP (PRP$ her) (NNS exams))))))))) (. .)))
K/KB/KBK.xml,KBKRE00A,2011,255,,B,144,5,It also means sorting out the cash.,"[It/PRP, also/RB, means/VBZ, sorting/VBG, out/RP, the/DT, cash/NN, ./.]",(ROOT (S (NP (PRP It)) (ADVP (RB also)) (VP (VBZ means) (S (VP (VBG sorting) (PRT (RP out)) (NP (DT the) (NN cash))))) (. .)))
K/KB/KBK.xml,KBKRE00A,2011,256,,A,145,1,How interested is she in the preparation of this dress?,"[How/WRB, interested/JJ, is/VBZ, she/PRP, in/IN, the/DT, preparation/NN, of/IN, this/DT, dress/NN, ?/.]",(ROOT (SBARQ (WHADJP (WRB How) (ADJP (JJ interested))) (SQ (VBZ is) (NP (PRP she)) (PP (IN in) (NP (NP (DT the) (NN preparation)) (PP (IN of) (NP (DT this) (NN dress)))))) (. ?)))
K/KB/KBK.xml,KBKRE00A,2011,257,,B,146,1,Oh she's interested alright.,"[Oh/UH, she/PRP, 's/VBZ, interested/JJ, alright/NN, ./.]",(ROOT (S (S (INTJ (UH Oh)) (NP (PRP she)) (VP (VBZ 's) (NP (JJ interested) (NN alright)))) (. .)))
K/KB/KBK.xml,KBKRE00A,2011,258,,A,147,1,Interested enough to be enthusiastic and do the right thing?,"[Interested/JJ, enough/JJ, to/TO, be/VB, enthusiastic/JJ, and/CC, do/VBP, the/DT, right/JJ, thing/NN, ?/.]",(ROOT (FRAG (ADJP (JJ Interested) (JJ enough)) (S (VP (TO to) (VP (VP (VB be) (ADJP (JJ enthusiastic))) (CC and) (VP (VBP do) (NP (DT the) (JJ right) (NN thing)))))) (. ?)))
K/KB/KBK.xml,KBKRE00A,2011,259,,B,148,1,"Well she, she also (()) ","[Well/RB, she/PRP, ,/,, she/PRP, also/RB]","(ROOT (NP (NP (ADVP (RB Well)) (NP (PRP she)) (, ,) (NP (PRP she))) (NP (RB also))))"
K/KB/KBK.xml,KBKRE00A,2011,260,,A,149,1,Did she?,"[Did/VBD, she/PRP, ?/.]",(ROOT (S (VP (VBD Did) (NP (PRP she))) (. ?)))
K/KB/KBK.xml,KBKRE00A,2011,261,,B,150,1,but she is  --,"[but/CC, she/PRP, is/VBZ, preoccupied/VBN, at/IN, the/DT, moment/NN, with/IN, her/PRP$, exams/NNS, and/CC, in/IN, a/DT, way/NN, I/PRP, 'm/VBP, glad/JJ, ./.]",(ROOT (S (CC but) (S (NP (PRP she)) (VP (VBZ is) (VP (VBN preoccupied) (PP (IN at) (NP (NP (DT the) (NN moment)) (PP (IN with) (NP (PRP$ her) (NNS exams)))))))) (CC and) (S (PP (IN in) (NP (DT a) (NN way))) (NP (PRP I)) (VP (VBP 'm) (ADJP (JJ glad)))) (. .)))
K/KB/KBK.xml,KBKRE00A,2011,262,,B,150,2,--preoccupied at the moment with her exams and in a way I'm glad.,"[but/CC, she/PRP, is/VBZ, preoccupied/VBN, at/IN, the/DT, moment/NN, with/IN, her/PRP$, exams/NNS, and/CC, in/IN, a/DT, way/NN, I/PRP, 'm/VBP, glad/JJ, ./.]",(ROOT (S (CC but) (S (NP (PRP she)) (VP (VBZ is) (VP (VBN preoccupied) (PP (IN at) (NP (NP (DT the) (NN moment)) (PP (IN with) (NP (PRP$ her) (NNS exams)))))))) (CC and) (S (PP (IN in) (NP (DT a) (NN way))) (NP (PRP I)) (VP (VBP 'm) (ADJP (JJ glad)))) (. .)))
K/KB/KBK.xml,KBKRE00A,2011,263,,B,150,3,I didn't want to  --,"[I/PRP, didn/VBP, 't/PRP, want/VB, to/TO, send/VB, her/PRP$, material/NN, hunting/NN, if/IN, she/PRP, could/MD, be/VB, doing/VBG, something/NN, useful/JJ, at/IN, college/NN, ./.]",(ROOT (S (NP (PRP I)) (VP (VBP didn) (S (NP (PRP 't)) (VP (VB want) (S (VP (TO to) (VP (VB send) (NP (PRP$ her) (NN material) (NN hunting))))) (SBAR (IN if) (S (NP (PRP she)) (VP (MD could) (VP (VB be) (VP (VBG doing) (NP (NP (NN something)) (ADJP (JJ useful) (PP (IN at) (NP (NN college))))))))))))) (. .)))
K/KB/KBK.xml,KBKRE00A,2011,264,,B,150,4,--send her material hunting if she could be doing something useful at college.,"[I/PRP, didn/VBP, 't/PRP, want/VB, to/TO, send/VB, her/PRP$, material/NN, hunting/NN, if/IN, she/PRP, could/MD, be/VB, doing/VBG, something/NN, useful/JJ, at/IN, college/NN, ./.]",(ROOT (S (NP (PRP I)) (VP (VBP didn) (S (NP (PRP 't)) (VP (VB want) (S (VP (TO to) (VP (VB send) (NP (PRP$ her) (NN material) (NN hunting))))) (SBAR (IN if) (S (NP (PRP she)) (VP (MD could) (VP (VB be) (VP (VBG doing) (NP (NP (NN something)) (ADJP (JJ useful) (PP (IN at) (NP (NN college))))))))))))) (. .)))
K/KB/KBK.xml,KBKRE00A,2011,265,,A,151,1,"Yes, yes fair enough.","[Yes/UH, ,/,, yes/RB, fair/JJ, enough/RB, ./.]","(ROOT (FRAG (INTJ (UH Yes)) (, ,) (ADVP (ADVP (RB yes) (JJ fair)) (RB enough)) (. .)))"
K/KB/KBK.xml,KBKRE00A,2011,266,,A,151,2,"Anyway, O K ","[Anyway/RB, ,/,, O/NN, K/NN]","(ROOT (NP (NP (RB Anyway)) (, ,) (NP (NN O) (NN K))))"
K/KB/KBK.xml,KBKRE00A,2011,267,,B,152,1,Karen's given her an extra job from  --,"[Karen/NNP, 's/POS, given/VBN, her/PRP$, an/DT, extra/JJ, job/NN, from/IN]",(ROOT (FRAG (NP (NP (NNP Karen)) (SBAR (S (NP (POS 's)) (VP (VBN given) (NP (PRP$ her) (NX (NP (DT an) (JJ extra) (NN job)) (PP (IN from))))))))))
K/KB/KBK.xml,KBKRE00A,2011,268,,B,152,2,--(()) ,"[Karen/NNP, 's/POS, given/VBN, her/PRP$, an/DT, extra/JJ, job/NN, from/IN]",(ROOT (FRAG (NP (NP (NNP Karen)) (SBAR (S (NP (POS 's)) (VP (VBN given) (NP (PRP$ her) (NX (NP (DT an) (JJ extra) (NN job)) (PP (IN from))))))))))
K/KB/KBK.xml,KBKRE00A,2011,269,,A,153,1,Is she?,"[Is/VBZ, she/PRP, ?/.]",(ROOT (S (VP (VBZ Is) (NP (PRP she))) (. ?)))
K/KB/KBK.xml,KBKRE00A,2011,270,,B,154,1,(()) going in on Monday when she doesn't normally.,"[going/VBG, in/IN, on/IN, Monday/NNP, when/WRB, she/PRP, doesn/VBZ, 't/PRP, normally/RB, ./.]",(ROOT (S (VP (VBG going) (PP (IN in) (IN on) (NP (NP (NNP Monday)) (SBAR (WHADVP (WRB when)) (S (NP (PRP she)) (VP (VBZ doesn) (NP (PRP 't)) (ADVP (RB normally)))))))) (. .)))
K/KB/KBK.xml,KBKRE00A,2011,271,,A,155,1,"Half past ten, right.","[Half/DT, past/JJ, ten/CD, ,/,, right/RB, ./.]","(ROOT (NP (NP (QP (DT Half)) (JJ past)) (NP (NP (CD ten)) (, ,) (ADVP (RB right))) (. .)))"
K/KB/KBK.xml,KBKRE00A,2011,272,,B,156,1,(()) ,[],X
