swda_filename,ptb_basename,conversation_no,transcript_index,act_tag,caller,turn_index,subutterance_index,text,pos,trees
K/KC/KCN.xml,KCNRE01K,27602,247,,A,75,1,Mm.,"[Mm/NN, ./.]",(ROOT (NP (NN Mm) (. .)))
K/KC/KCN.xml,KCNRE01K,27602,248,,B,76,1,"Oh yes, she'll go probably, I should imagine.","[Oh/UH, yes/UH, ,/,, she/PRP, 'll/MD, go/VB, probably/RB, ,/,, I/PRP, should/MD, imagine/VB, ./.]","(ROOT (S (S (INTJ (UH Oh) (UH yes)) (, ,) (NP (PRP she)) (VP (MD 'll) (VP (VB go) (ADVP (RB probably))))) (, ,) (NP (PRP I)) (VP (MD should) (VP (VB imagine))) (. .)))"
K/KC/KCN.xml,KCNRE01K,27602,249,,B,76,2,"<reading> The mul- , and the Duchess of York will become a multi-millionairess, in her own right, as a result of the break up of the marriage to Andrew  --","[The/DT, mul-/JJ, ,/,, and/CC, the/DT, Duchess/NN, of/IN, York/NNP, will/MD, become/VB, a/DT, multi-millionairess/JJ, ,/,, in/IN, her/PRP$, own/JJ, right/NN, ,/,, as/IN, a/DT, result/NN, of/IN, the/DT, break/NN, up/IN, of/IN, the/DT, marriage/NN, to/TO, Andrew/NNP, we/PRP, can/MD, reveal/VB, today/NN, ./.]","(ROOT (S (NP (NP (DT The) (JJ mul-)) (, ,) (CC and) (NP (NP (DT the) (NN Duchess)) (PP (IN of) (NP (NNP York))))) (VP (MD will) (VP (VB become) (NP (DT a) (JJ multi-millionairess)) (, ,) (PP (IN in) (NP (PRP$ her) (JJ own) (NN right))) (, ,) (PP (IN as) (NP (NP (DT a) (NN result)) (PP (IN of) (NP (NP (DT the) (NN break)) (ADVP (IN up)) (PP (IN of) (NP (NP (DT the) (NN marriage)) (PP (TO to) (NP (NNP Andrew))))) (SBAR (S (NP (PRP we)) (VP (MD can) (VP (VB reveal) (NP (NN today)))))))))))) (. .)))"
K/KC/KCN.xml,KCNRE01K,27602,250,,B,76,3,--we can reveal today </reading> .,"[The/DT, mul-/JJ, ,/,, and/CC, the/DT, Duchess/NN, of/IN, York/NNP, will/MD, become/VB, a/DT, multi-millionairess/JJ, ,/,, in/IN, her/PRP$, own/JJ, right/NN, ,/,, as/IN, a/DT, result/NN, of/IN, the/DT, break/NN, up/IN, of/IN, the/DT, marriage/NN, to/TO, Andrew/NNP, we/PRP, can/MD, reveal/VB, today/NN, ./.]","(ROOT (S (NP (NP (DT The) (JJ mul-)) (, ,) (CC and) (NP (NP (DT the) (NN Duchess)) (PP (IN of) (NP (NNP York))))) (VP (MD will) (VP (VB become) (NP (DT a) (JJ multi-millionairess)) (, ,) (PP (IN in) (NP (PRP$ her) (JJ own) (NN right))) (, ,) (PP (IN as) (NP (NP (DT a) (NN result)) (PP (IN of) (NP (NP (DT the) (NN break)) (ADVP (IN up)) (PP (IN of) (NP (NP (DT the) (NN marriage)) (PP (TO to) (NP (NNP Andrew))))) (SBAR (S (NP (PRP we)) (VP (MD can) (VP (VB reveal) (NP (NN today)))))))))))) (. .)))"
K/KC/KCN.xml,KCNRE01K,27602,251,,B,76,4,"Possible job, they can reveal it because it said in the  --","[Possible/JJ, job/NN, ,/,, they/PRP, can/MD, reveal/VB, it/PRP, because/IN, it/PRP, said/VBD, in/IN, the/DT, on/IN, the/DT, front/JJ, page/NN, that/IN, there/EX, 's/VBZ, nothing/NN, been/VBN, decided/VBN, !/.]","(ROOT (S (NP (JJ Possible) (NN job)) (, ,) (NP (PRP they)) (VP (MD can) (VP (VB reveal) (NP (PRP it)) (SBAR (IN because) (S (NP (PRP it)) (VP (VBD said) (PP (IN in) (NP (NP (DT the)) (PP (IN on) (NP (DT the) (JJ front) (NN page))))) (SBAR (IN that) (S (NP (EX there)) (VP (VBZ 's) (NP (NP (NN nothing)) (VP (VBN been) (VP (VBN decided)))))))))))) (. !)))"
K/KC/KCN.xml,KCNRE01K,27602,252,,B,76,5,--on the front page that  --,"[Possible/JJ, job/NN, ,/,, they/PRP, can/MD, reveal/VB, it/PRP, because/IN, it/PRP, said/VBD, in/IN, the/DT, on/IN, the/DT, front/JJ, page/NN, that/IN, there/EX, 's/VBZ, nothing/NN, been/VBN, decided/VBN, !/.]","(ROOT (S (NP (JJ Possible) (NN job)) (, ,) (NP (PRP they)) (VP (MD can) (VP (VB reveal) (NP (PRP it)) (SBAR (IN because) (S (NP (PRP it)) (VP (VBD said) (PP (IN in) (NP (NP (DT the)) (PP (IN on) (NP (DT the) (JJ front) (NN page))))) (SBAR (IN that) (S (NP (EX there)) (VP (VBZ 's) (NP (NP (NN nothing)) (VP (VBN been) (VP (VBN decided)))))))))))) (. !)))"
K/KC/KCN.xml,KCNRE01K,27602,253,,B,76,6,--there's nothing been decided!,"[Possible/JJ, job/NN, ,/,, they/PRP, can/MD, reveal/VB, it/PRP, because/IN, it/PRP, said/VBD, in/IN, the/DT, on/IN, the/DT, front/JJ, page/NN, that/IN, there/EX, 's/VBZ, nothing/NN, been/VBN, decided/VBN, !/.]","(ROOT (S (NP (JJ Possible) (NN job)) (, ,) (NP (PRP they)) (VP (MD can) (VP (VB reveal) (NP (PRP it)) (SBAR (IN because) (S (NP (PRP it)) (VP (VBD said) (PP (IN in) (NP (NP (DT the)) (PP (IN on) (NP (DT the) (JJ front) (NN page))))) (SBAR (IN that) (S (NP (EX there)) (VP (VBZ 's) (NP (NP (NN nothing)) (VP (VBN been) (VP (VBN decided)))))))))))) (. !)))"
K/KC/KCN.xml,KCNRE01K,27602,254,,A,77,1,Mm.,"[Mm/NN, ./.]",(ROOT (NP (NN Mm) (. .)))
K/KC/KCN.xml,KCNRE01K,27602,255,,B,78,1,"<reading> Fergie will receive a mammoth payment of twenty millions pounds,(()) !","[Fergie/NNP, will/MD, receive/VB, a/DT, mammoth/JJ, payment/NN, of/IN, twenty/CD, millions/NNS, pounds/NNS, ,/,, !/.]","(ROOT (S (NP (NNP Fergie)) (VP (MD will) (VP (VB receive) (NP (NP (NP (DT a) (JJ mammoth) (NN payment)) (PP (IN of) (NP (CD twenty) (NNS millions) (NNS pounds)))) (, ,)))) (. !)))"
K/KC/KCN.xml,KCNRE01K,27602,256,,B,78,2,Which will come out of the Duke's personal trust fund.,"[Which/WDT, will/MD, come/VB, out/RB, of/IN, the/DT, Duke/NNP, 's/POS, personal/JJ, trust/NN, fund/NN, ./.]",(ROOT (S (NP (WDT Which)) (VP (MD will) (VP (VB come) (PRT (RB out)) (PP (IN of) (NP (NP (DT the) (NNP Duke) (POS 's)) (JJ personal) (NN trust) (NN fund))))) (. .)))
K/KC/KCN.xml,KCNRE01K,27602,257,,B,78,3,And another five  --,"[And/CC, another/DT, five/CD, hundred/CD, thousand/CD, every/DT, year/NN, paid/VBN, for/IN, by/IN, the/DT, Queen/NN, !/.]",(ROOT (FRAG (CC And) (NP (NP (NP (QP (DT another) (CD five)) (QP (CD hundred) (CD thousand))) (NP (DT every) (NN year))) (VP (VBN paid) (PP (IN for) (PP (IN by) (NP (DT the) (NN Queen)))))) (. !)))
K/KC/KCN.xml,KCNRE01K,27602,258,,B,78,4,--hundred thousand every year  --,"[And/CC, another/DT, five/CD, hundred/CD, thousand/CD, every/DT, year/NN, paid/VBN, for/IN, by/IN, the/DT, Queen/NN, !/.]",(ROOT (FRAG (CC And) (NP (NP (NP (QP (DT another) (CD five)) (QP (CD hundred) (CD thousand))) (NP (DT every) (NN year))) (VP (VBN paid) (PP (IN for) (PP (IN by) (NP (DT the) (NN Queen)))))) (. !)))
K/KC/KCN.xml,KCNRE01K,27602,259,,B,78,5,--paid for by the Queen!,"[And/CC, another/DT, five/CD, hundred/CD, thousand/CD, every/DT, year/NN, paid/VBN, for/IN, by/IN, the/DT, Queen/NN, !/.]",(ROOT (FRAG (CC And) (NP (NP (NP (QP (DT another) (CD five)) (QP (CD hundred) (CD thousand))) (NP (DT every) (NN year))) (VP (VBN paid) (PP (IN for) (PP (IN by) (NP (DT the) (NN Queen)))))) (. !)))
K/KC/KCN.xml,KCNRE01K,27602,260,,B,78,6,This will more than insure that she can continue to live  --,"[This/DT, will/MD, more/RBR, than/IN, insure/VBP, that/IN, she/PRP, can/MD, continue/VB, to/TO, live/VB, in/IN, the/DT, style/NN, she/PRP, 's/VBZ, enjoyed/VBN, since/IN, her/PRP$, marriage/NN, ./.]",(ROOT (S (NP (DT This)) (VP (MD will) (ADVP (RBR more) (IN than)) (VP (VBP insure) (SBAR (IN that) (S (NP (PRP she)) (VP (MD can) (VP (VB continue) (S (VP (TO to) (VP (VB live) (PP (IN in) (NP (NP (DT the) (NN style)) (SBAR (S (NP (PRP she)) (VP (VBZ 's) (VP (VBN enjoyed) (PP (IN since) (NP (PRP$ her) (NN marriage)))))))))))))))))) (. .)))
K/KC/KCN.xml,KCNRE01K,27602,261,,B,78,7,--in the style she's enjoyed since her marriage.,"[This/DT, will/MD, more/RBR, than/IN, insure/VBP, that/IN, she/PRP, can/MD, continue/VB, to/TO, live/VB, in/IN, the/DT, style/NN, she/PRP, 's/VBZ, enjoyed/VBN, since/IN, her/PRP$, marriage/NN, ./.]",(ROOT (S (NP (DT This)) (VP (MD will) (ADVP (RBR more) (IN than)) (VP (VBP insure) (SBAR (IN that) (S (NP (PRP she)) (VP (MD can) (VP (VB continue) (S (VP (TO to) (VP (VB live) (PP (IN in) (NP (NP (DT the) (NN style)) (SBAR (S (NP (PRP she)) (VP (VBZ 's) (VP (VBN enjoyed) (PP (IN since) (NP (PRP$ her) (NN marriage)))))))))))))))))) (. .)))
K/KC/KCN.xml,KCNRE01K,27602,262,,B,78,8,"Quite separately, the two children, Princess Beatrice, three, and Princess Eugenie, two, have been independently looked after again by the Queen!","[Quite/RB, separately/RB, ,/,, the/DT, two/CD, children/NNS, ,/,, Princess/NNP, Beatrice/NNP, ,/,, three/CD, ,/,, and/CC, Princess/NNP, Eugenie/NNP, ,/,, two/CD, ,/,, have/VBP, been/VBN, independently/RB, looked/VBN, after/IN, again/RB, by/IN, the/DT, Queen/NN, !/.]","(ROOT (S (NP (NP (RB Quite) (RB separately)) (, ,) (NP (DT the) (CD two) (NNS children)) (, ,) (NP (NP (NNP Princess) (NNP Beatrice)) (, ,) (NP (CD three)) (, ,) (CC and) (NP (NNP Princess) (NNP Eugenie))) (, ,) (NP (CD two)) (, ,)) (VP (VBP have) (VP (VBN been) (VP (ADVP (RB independently)) (VBN looked) (PP (IN after) (ADVP (RB again))) (PP (IN by) (NP (DT the) (NN Queen)))))) (. !)))"
K/KC/KCN.xml,KCNRE01K,27602,263,,B,78,9,On their births a trust a fund  --,"[On/IN, their/PRP$, births/NNS, a/DT, trust/NN, a/DT, fund/NN, of/IN, tens/NNS, of/IN, thousands/NNS, of/IN, pound/NN, was/VBD, started/VBN, for/IN, them/PRP, in/IN, their/PRP$, names/NNS, by/IN, their/PRP$, grandmother/NN, ./.]",(ROOT (S (PP (IN On) (NP (NP (PRP$ their) (NNS births)) (NP (DT a) (NN trust)))) (NP (NP (DT a) (NN fund)) (PP (IN of) (NP (NP (QP (NNS tens) (IN of) (NNS thousands))) (PP (IN of) (NP (NN pound)))))) (VP (VBD was) (VP (VBN started) (PP (IN for) (NP (PRP them))) (PP (IN in) (NP (PRP$ their) (NNS names))) (PP (IN by) (NP (PRP$ their) (NN grandmother))))) (. .)))
K/KC/KCN.xml,KCNRE01K,27602,264,,B,78,10,--of tens of thousands of pound  --,"[On/IN, their/PRP$, births/NNS, a/DT, trust/NN, a/DT, fund/NN, of/IN, tens/NNS, of/IN, thousands/NNS, of/IN, pound/NN, was/VBD, started/VBN, for/IN, them/PRP, in/IN, their/PRP$, names/NNS, by/IN, their/PRP$, grandmother/NN, ./.]",(ROOT (S (PP (IN On) (NP (NP (PRP$ their) (NNS births)) (NP (DT a) (NN trust)))) (NP (NP (DT a) (NN fund)) (PP (IN of) (NP (NP (QP (NNS tens) (IN of) (NNS thousands))) (PP (IN of) (NP (NN pound)))))) (VP (VBD was) (VP (VBN started) (PP (IN for) (NP (PRP them))) (PP (IN in) (NP (PRP$ their) (NNS names))) (PP (IN by) (NP (PRP$ their) (NN grandmother))))) (. .)))
K/KC/KCN.xml,KCNRE01K,27602,265,,B,78,11,--was started for them in their names by their grandmother  --,"[On/IN, their/PRP$, births/NNS, a/DT, trust/NN, a/DT, fund/NN, of/IN, tens/NNS, of/IN, thousands/NNS, of/IN, pound/NN, was/VBD, started/VBN, for/IN, them/PRP, in/IN, their/PRP$, names/NNS, by/IN, their/PRP$, grandmother/NN, ./.]",(ROOT (S (PP (IN On) (NP (NP (PRP$ their) (NNS births)) (NP (DT a) (NN trust)))) (NP (NP (DT a) (NN fund)) (PP (IN of) (NP (NP (QP (NNS tens) (IN of) (NNS thousands))) (PP (IN of) (NP (NN pound)))))) (VP (VBD was) (VP (VBN started) (PP (IN for) (NP (PRP them))) (PP (IN in) (NP (PRP$ their) (NNS names))) (PP (IN by) (NP (PRP$ their) (NN grandmother))))) (. .)))
K/KC/KCN.xml,KCNRE01K,27602,266,,B,78,12,--(()) .,"[On/IN, their/PRP$, births/NNS, a/DT, trust/NN, a/DT, fund/NN, of/IN, tens/NNS, of/IN, thousands/NNS, of/IN, pound/NN, was/VBD, started/VBN, for/IN, them/PRP, in/IN, their/PRP$, names/NNS, by/IN, their/PRP$, grandmother/NN, ./.]",(ROOT (S (PP (IN On) (NP (NP (PRP$ their) (NNS births)) (NP (DT a) (NN trust)))) (NP (NP (DT a) (NN fund)) (PP (IN of) (NP (NP (QP (NNS tens) (IN of) (NNS thousands))) (PP (IN of) (NP (NN pound)))))) (VP (VBD was) (VP (VBN started) (PP (IN for) (NP (PRP them))) (PP (IN in) (NP (PRP$ their) (NNS names))) (PP (IN by) (NP (PRP$ their) (NN grandmother))))) (. .)))
K/KC/KCN.xml,KCNRE01K,27602,267,,B,78,13,This will guarantee all their school fees  --,"[This/DT, will/MD, guarantee/VB, all/DT, their/PRP$, school/NN, fees/NNS, and/CC, the/DT, basis/NN, of/IN, their/PRP$, future/NN, ./.]",(ROOT (S (NP (DT This)) (VP (MD will) (VP (VB guarantee) (NP (NP (DT all) (PRP$ their) (NN school) (NNS fees)) (CC and) (NP (NP (DT the) (NN basis)) (PP (IN of) (NP (PRP$ their) (NN future))))))) (. .)))
K/KC/KCN.xml,KCNRE01K,27602,268,,B,78,14,--and the basis of their future (()) .,"[This/DT, will/MD, guarantee/VB, all/DT, their/PRP$, school/NN, fees/NNS, and/CC, the/DT, basis/NN, of/IN, their/PRP$, future/NN, ./.]",(ROOT (S (NP (DT This)) (VP (MD will) (VP (VB guarantee) (NP (NP (DT all) (PRP$ their) (NN school) (NNS fees)) (CC and) (NP (NP (DT the) (NN basis)) (PP (IN of) (NP (PRP$ their) (NN future))))))) (. .)))
K/KC/KCN.xml,KCNRE01K,27602,269,,B,78,15,The huge down payment will come from a trust fund  --,"[The/DT, huge/JJ, down/JJ, payment/NN, will/MD, come/VB, from/IN, a/DT, trust/NN, fund/NN, of/IN, one/CD, million/CD, ,/,, set/VBN, up/RP, by/IN, the/DT, Queen/NN, for/IN, Prince/NNP, Andrew/NNP, ,/,, the/DT, day/NN, he/PRP, was/VBD, born/VBN, ./.]","(ROOT (S (NP (DT The) (JJ huge) (JJ down) (NN payment)) (VP (MD will) (VP (VB come) (PP (IN from) (NP (NP (DT a) (NN trust) (NN fund)) (PP (IN of) (NP (QP (CD one) (CD million)))) (, ,) (VP (VBN set) (PRT (RP up)) (PP (IN by) (NP (NP (DT the) (NN Queen)) (PP (IN for) (NP (NNP Prince) (NNP Andrew))))) (, ,) (NP (NP (DT the) (NN day)) (SBAR (S (NP (PRP he)) (VP (VBD was) (VP (VBN born))))))))))) (. .)))"
K/KC/KCN.xml,KCNRE01K,27602,270,,B,78,16,"--of one million, set up by the Queen for Prince Andrew, the day he was born </reading> .","[The/DT, huge/JJ, down/JJ, payment/NN, will/MD, come/VB, from/IN, a/DT, trust/NN, fund/NN, of/IN, one/CD, million/CD, ,/,, set/VBN, up/RP, by/IN, the/DT, Queen/NN, for/IN, Prince/NNP, Andrew/NNP, ,/,, the/DT, day/NN, he/PRP, was/VBD, born/VBN, ./.]","(ROOT (S (NP (DT The) (JJ huge) (JJ down) (NN payment)) (VP (MD will) (VP (VB come) (PP (IN from) (NP (NP (DT a) (NN trust) (NN fund)) (PP (IN of) (NP (QP (CD one) (CD million)))) (, ,) (VP (VBN set) (PRT (RP up)) (PP (IN by) (NP (NP (DT the) (NN Queen)) (PP (IN for) (NP (NNP Prince) (NNP Andrew))))) (, ,) (NP (NP (DT the) (NN day)) (SBAR (S (NP (PRP he)) (VP (VBD was) (VP (VBN born))))))))))) (. .)))"
K/KC/KCN.xml,KCNRE01K,27602,271,,B,78,17,"See, they've put that million pound into  --","[See/VB, ,/,, they/PRP, 've/VBP, put/VBN, that/DT, million/CD, pound/NN, into/IN, into/IN, a/DT, fund/NN, for/IN, him/PRP, and/CC, that/DT, 's/VBZ, been/VBN, getting/VBG, erm/NN]","(ROOT (S (VP (VB See) (, ,) (S (S (NP (PRP they)) (VP (VBP 've) (VP (VBN put) (NP (DT that) (CD million) (NN pound)) (PP (IN into) (IN into) (NP (NP (DT a) (NN fund)) (PP (IN for) (NP (PRP him)))))))) (CC and) (S (NP (DT that)) (VP (VBZ 's) (VP (VBN been) (VP (VBG getting) (NP (NN erm))))))))))"
K/KC/KCN.xml,KCNRE01K,27602,272,,B,78,18,--into a fund for him and that's been getting  --,"[See/VB, ,/,, they/PRP, 've/VBP, put/VBN, that/DT, million/CD, pound/NN, into/IN, into/IN, a/DT, fund/NN, for/IN, him/PRP, and/CC, that/DT, 's/VBZ, been/VBN, getting/VBG, erm/NN]","(ROOT (S (VP (VB See) (, ,) (S (S (NP (PRP they)) (VP (VBP 've) (VP (VBN put) (NP (DT that) (CD million) (NN pound)) (PP (IN into) (IN into) (NP (NP (DT a) (NN fund)) (PP (IN for) (NP (PRP him)))))))) (CC and) (S (NP (DT that)) (VP (VBZ 's) (VP (VBN been) (VP (VBG getting) (NP (NN erm))))))))))"
K/KC/KCN.xml,KCNRE01K,27602,273,,B,78,19,--erm,"[See/VB, ,/,, they/PRP, 've/VBP, put/VBN, that/DT, million/CD, pound/NN, into/IN, into/IN, a/DT, fund/NN, for/IN, him/PRP, and/CC, that/DT, 's/VBZ, been/VBN, getting/VBG, erm/NN]","(ROOT (S (VP (VB See) (, ,) (S (S (NP (PRP they)) (VP (VBP 've) (VP (VBN put) (NP (DT that) (CD million) (NN pound)) (PP (IN into) (IN into) (NP (NP (DT a) (NN fund)) (PP (IN for) (NP (PRP him)))))))) (CC and) (S (NP (DT that)) (VP (VBZ 's) (VP (VBN been) (VP (VBG getting) (NP (NN erm))))))))))"
K/KC/KCN.xml,KCNRE01K,27602,274,,A,79,1,Interest and interest on it.,"[Interest/NN, and/CC, interest/NN, on/IN, it/PRP, ./.]",(ROOT (NP (NP (NN Interest) (CC and) (NN interest)) (PP (IN on) (NP (PRP it))) (. .)))
K/KC/KCN.xml,KCNRE01K,27602,275,,B,80,1,"twelve, twelve, thirteen, fourteen percent interest  --","[twelve/CD, ,/,, twelve/CD, ,/,, thirteen/CD, ,/,, fourteen/CD, percent/NN, interest/NN, a/DT, year/NN, !/.]","(ROOT (FRAG (NP (CD twelve)) (, ,) (NP (CD twelve)) (, ,) (NP (CD thirteen)) (, ,) (NP (NP (CD fourteen) (NN percent) (NN interest)) (NP (DT a) (NN year))) (. !)))"
K/KC/KCN.xml,KCNRE01K,27602,276,,B,80,2,--a year!,"[twelve/CD, ,/,, twelve/CD, ,/,, thirteen/CD, ,/,, fourteen/CD, percent/NN, interest/NN, a/DT, year/NN, !/.]","(ROOT (FRAG (NP (CD twelve)) (, ,) (NP (CD twelve)) (, ,) (NP (CD thirteen)) (, ,) (NP (NP (CD fourteen) (NN percent) (NN interest)) (NP (DT a) (NN year))) (. !)))"
K/KC/KCN.xml,KCNRE01K,27602,277,,B,80,3,"And, you know  --","[And/CC, ,/,, you/PRP, know/VBP, compound/JJ, interest/NN, ./.]","(ROOT (S (CC And) (, ,) (NP (PRP you)) (VP (VBP know) (NP (JJ compound) (NN interest))) (. .)))"
K/KC/KCN.xml,KCNRE01K,27602,278,,B,80,4,--compound interest.,"[And/CC, ,/,, you/PRP, know/VBP, compound/JJ, interest/NN, ./.]","(ROOT (S (CC And) (, ,) (NP (PRP you)) (VP (VBP know) (NP (JJ compound) (NN interest))) (. .)))"
K/KC/KCN.xml,KCNRE01K,27602,279,,B,80,5,<reading> His sister and both brothers have identical trust funds  --,"[His/PRP$, sister/NN, and/CC, both/DT, brothers/NNS, have/VBP, identical/JJ, trust/NN, funds/NNS, this/DT, million/CD, pound/NN, figure/NN, has/VBZ, grown/VBN, to/TO, the/DT, size/NN, ,/,, just/RB, today/NN, around/IN, forty/CD, million/CD, because/IN, Prince/NNP, because/IN, the/DT, Prince/NNP, has/VBZ, not/RB, touched/VBN, it/PRP, in/IN, all/DT, these/DT, years/NNS, ./.]","(ROOT (S (NP (NP (PRP$ His) (NN sister)) (CC and) (NP (DT both) (NNS brothers))) (VP (VBP have) (NP (NP (JJ identical) (NN trust) (NNS funds)) (SBAR (S (NP (DT this) (CD million) (NN pound) (NN figure)) (VP (VBZ has) (VP (VBN grown) (PP (TO to) (NP (DT the) (NN size))) (, ,) (ADVP (ADVP (RB just) (NN today) (PP (IN around) (NP (QP (CD forty) (CD million)))) (PP (IN because) (NP (NNP Prince)))) (SBAR (IN because) (S (NP (DT the) (NNP Prince)) (VP (VBZ has) (RB not) (VP (VBN touched) (NP (PRP it)) (ADVP (IN in) (DT all)) (NP (DT these) (NNS years))))))))))))) (. .)))"
K/KC/KCN.xml,KCNRE01K,27602,280,,B,80,6,--this million pound figure  --,"[His/PRP$, sister/NN, and/CC, both/DT, brothers/NNS, have/VBP, identical/JJ, trust/NN, funds/NNS, this/DT, million/CD, pound/NN, figure/NN, has/VBZ, grown/VBN, to/TO, the/DT, size/NN, ,/,, just/RB, today/NN, around/IN, forty/CD, million/CD, because/IN, Prince/NNP, because/IN, the/DT, Prince/NNP, has/VBZ, not/RB, touched/VBN, it/PRP, in/IN, all/DT, these/DT, years/NNS, ./.]","(ROOT (S (NP (NP (PRP$ His) (NN sister)) (CC and) (NP (DT both) (NNS brothers))) (VP (VBP have) (NP (NP (JJ identical) (NN trust) (NNS funds)) (SBAR (S (NP (DT this) (CD million) (NN pound) (NN figure)) (VP (VBZ has) (VP (VBN grown) (PP (TO to) (NP (DT the) (NN size))) (, ,) (ADVP (ADVP (RB just) (NN today) (PP (IN around) (NP (QP (CD forty) (CD million)))) (PP (IN because) (NP (NNP Prince)))) (SBAR (IN because) (S (NP (DT the) (NNP Prince)) (VP (VBZ has) (RB not) (VP (VBN touched) (NP (PRP it)) (ADVP (IN in) (DT all)) (NP (DT these) (NNS years))))))))))))) (. .)))"
K/KC/KCN.xml,KCNRE01K,27602,281,,B,80,7,"--has grown to the size, just today  --","[His/PRP$, sister/NN, and/CC, both/DT, brothers/NNS, have/VBP, identical/JJ, trust/NN, funds/NNS, this/DT, million/CD, pound/NN, figure/NN, has/VBZ, grown/VBN, to/TO, the/DT, size/NN, ,/,, just/RB, today/NN, around/IN, forty/CD, million/CD, because/IN, Prince/NNP, because/IN, the/DT, Prince/NNP, has/VBZ, not/RB, touched/VBN, it/PRP, in/IN, all/DT, these/DT, years/NNS, ./.]","(ROOT (S (NP (NP (PRP$ His) (NN sister)) (CC and) (NP (DT both) (NNS brothers))) (VP (VBP have) (NP (NP (JJ identical) (NN trust) (NNS funds)) (SBAR (S (NP (DT this) (CD million) (NN pound) (NN figure)) (VP (VBZ has) (VP (VBN grown) (PP (TO to) (NP (DT the) (NN size))) (, ,) (ADVP (ADVP (RB just) (NN today) (PP (IN around) (NP (QP (CD forty) (CD million)))) (PP (IN because) (NP (NNP Prince)))) (SBAR (IN because) (S (NP (DT the) (NNP Prince)) (VP (VBZ has) (RB not) (VP (VBN touched) (NP (PRP it)) (ADVP (IN in) (DT all)) (NP (DT these) (NNS years))))))))))))) (. .)))"
K/KC/KCN.xml,KCNRE01K,27602,282,,B,80,8,--around forty million  --,"[His/PRP$, sister/NN, and/CC, both/DT, brothers/NNS, have/VBP, identical/JJ, trust/NN, funds/NNS, this/DT, million/CD, pound/NN, figure/NN, has/VBZ, grown/VBN, to/TO, the/DT, size/NN, ,/,, just/RB, today/NN, around/IN, forty/CD, million/CD, because/IN, Prince/NNP, because/IN, the/DT, Prince/NNP, has/VBZ, not/RB, touched/VBN, it/PRP, in/IN, all/DT, these/DT, years/NNS, ./.]","(ROOT (S (NP (NP (PRP$ His) (NN sister)) (CC and) (NP (DT both) (NNS brothers))) (VP (VBP have) (NP (NP (JJ identical) (NN trust) (NNS funds)) (SBAR (S (NP (DT this) (CD million) (NN pound) (NN figure)) (VP (VBZ has) (VP (VBN grown) (PP (TO to) (NP (DT the) (NN size))) (, ,) (ADVP (ADVP (RB just) (NN today) (PP (IN around) (NP (QP (CD forty) (CD million)))) (PP (IN because) (NP (NNP Prince)))) (SBAR (IN because) (S (NP (DT the) (NNP Prince)) (VP (VBZ has) (RB not) (VP (VBN touched) (NP (PRP it)) (ADVP (IN in) (DT all)) (NP (DT these) (NNS years))))))))))))) (. .)))"
K/KC/KCN.xml,KCNRE01K,27602,283,,B,80,9,--because Prince  --,"[His/PRP$, sister/NN, and/CC, both/DT, brothers/NNS, have/VBP, identical/JJ, trust/NN, funds/NNS, this/DT, million/CD, pound/NN, figure/NN, has/VBZ, grown/VBN, to/TO, the/DT, size/NN, ,/,, just/RB, today/NN, around/IN, forty/CD, million/CD, because/IN, Prince/NNP, because/IN, the/DT, Prince/NNP, has/VBZ, not/RB, touched/VBN, it/PRP, in/IN, all/DT, these/DT, years/NNS, ./.]","(ROOT (S (NP (NP (PRP$ His) (NN sister)) (CC and) (NP (DT both) (NNS brothers))) (VP (VBP have) (NP (NP (JJ identical) (NN trust) (NNS funds)) (SBAR (S (NP (DT this) (CD million) (NN pound) (NN figure)) (VP (VBZ has) (VP (VBN grown) (PP (TO to) (NP (DT the) (NN size))) (, ,) (ADVP (ADVP (RB just) (NN today) (PP (IN around) (NP (QP (CD forty) (CD million)))) (PP (IN because) (NP (NNP Prince)))) (SBAR (IN because) (S (NP (DT the) (NNP Prince)) (VP (VBZ has) (RB not) (VP (VBN touched) (NP (PRP it)) (ADVP (IN in) (DT all)) (NP (DT these) (NNS years))))))))))))) (. .)))"
K/KC/KCN.xml,KCNRE01K,27602,284,,B,80,10,--because the Prince has not touched it  --,"[His/PRP$, sister/NN, and/CC, both/DT, brothers/NNS, have/VBP, identical/JJ, trust/NN, funds/NNS, this/DT, million/CD, pound/NN, figure/NN, has/VBZ, grown/VBN, to/TO, the/DT, size/NN, ,/,, just/RB, today/NN, around/IN, forty/CD, million/CD, because/IN, Prince/NNP, because/IN, the/DT, Prince/NNP, has/VBZ, not/RB, touched/VBN, it/PRP, in/IN, all/DT, these/DT, years/NNS, ./.]","(ROOT (S (NP (NP (PRP$ His) (NN sister)) (CC and) (NP (DT both) (NNS brothers))) (VP (VBP have) (NP (NP (JJ identical) (NN trust) (NNS funds)) (SBAR (S (NP (DT this) (CD million) (NN pound) (NN figure)) (VP (VBZ has) (VP (VBN grown) (PP (TO to) (NP (DT the) (NN size))) (, ,) (ADVP (ADVP (RB just) (NN today) (PP (IN around) (NP (QP (CD forty) (CD million)))) (PP (IN because) (NP (NNP Prince)))) (SBAR (IN because) (S (NP (DT the) (NNP Prince)) (VP (VBZ has) (RB not) (VP (VBN touched) (NP (PRP it)) (ADVP (IN in) (DT all)) (NP (DT these) (NNS years))))))))))))) (. .)))"
K/KC/KCN.xml,KCNRE01K,27602,285,,B,80,11,--in all these years.,"[His/PRP$, sister/NN, and/CC, both/DT, brothers/NNS, have/VBP, identical/JJ, trust/NN, funds/NNS, this/DT, million/CD, pound/NN, figure/NN, has/VBZ, grown/VBN, to/TO, the/DT, size/NN, ,/,, just/RB, today/NN, around/IN, forty/CD, million/CD, because/IN, Prince/NNP, because/IN, the/DT, Prince/NNP, has/VBZ, not/RB, touched/VBN, it/PRP, in/IN, all/DT, these/DT, years/NNS, ./.]","(ROOT (S (NP (NP (PRP$ His) (NN sister)) (CC and) (NP (DT both) (NNS brothers))) (VP (VBP have) (NP (NP (JJ identical) (NN trust) (NNS funds)) (SBAR (S (NP (DT this) (CD million) (NN pound) (NN figure)) (VP (VBZ has) (VP (VBN grown) (PP (TO to) (NP (DT the) (NN size))) (, ,) (ADVP (ADVP (RB just) (NN today) (PP (IN around) (NP (QP (CD forty) (CD million)))) (PP (IN because) (NP (NNP Prince)))) (SBAR (IN because) (S (NP (DT the) (NNP Prince)) (VP (VBZ has) (RB not) (VP (VBN touched) (NP (PRP it)) (ADVP (IN in) (DT all)) (NP (DT these) (NNS years))))))))))))) (. .)))"
K/KC/KCN.xml,KCNRE01K,27602,286,,B,80,12,"As Andrew's wife, Fergie can claim  --","[As/IN, Andrew/NNP, 's/POS, wife/NN, ,/,, Fergie/NNP, can/MD, claim/VB, half/NN, of/IN, everything/NN, he/PRP, owns/VBZ, !/.]","(ROOT (S (PP (IN As) (NP (NP (NNP Andrew) (POS 's)) (NN wife))) (, ,) (NP (NNP Fergie)) (VP (MD can) (VP (VB claim) (NP (NP (NN half)) (PP (IN of) (NP (NN everything))) (SBAR (S (NP (PRP he)) (VP (VBZ owns))))))) (. !)))"
K/KC/KCN.xml,KCNRE01K,27602,287,,B,80,13,--half of everything he owns </reading> !,"[As/IN, Andrew/NNP, 's/POS, wife/NN, ,/,, Fergie/NNP, can/MD, claim/VB, half/NN, of/IN, everything/NN, he/PRP, owns/VBZ, !/.]","(ROOT (S (PP (IN As) (NP (NP (NNP Andrew) (POS 's)) (NN wife))) (, ,) (NP (NNP Fergie)) (VP (MD can) (VP (VB claim) (NP (NP (NN half)) (PP (IN of) (NP (NN everything))) (SBAR (S (NP (PRP he)) (VP (VBZ owns))))))) (. !)))"
K/KC/KCN.xml,KCNRE01K,27602,288,,A,81,1,And they've given her half of it aren't they?,"[And/CC, they/PRP, 've/VBP, given/VBN, her/PRP$, half/NN, of/IN, it/PRP, aren/IN, 't/PRP, they/PRP, ?/.]",(ROOT (S (CC And) (NP (PRP they)) (VP (VBP 've) (VP (VBN given) (S (NP (NP (PRP$ her) (NN half)) (PP (IN of) (NP (PRP it))))) (SBAR (IN aren) (S (NP (PRP 't)) (NP (PRP they)))))) (. ?)))
K/KC/KCN.xml,KCNRE01K,27602,289,,B,82,1,Mm.,"[Mm/NN, ./.]",(ROOT (NP (NN Mm) (. .)))
K/KC/KCN.xml,KCNRE01K,27602,290,,B,82,2,Well everybody can do that.,"[Well/RB, everybody/NN, can/MD, do/VB, that/DT, ./.]",(ROOT (S (ADVP (RB Well)) (NP (NN everybody)) (VP (MD can) (VP (VB do) (NP (DT that)))) (. .)))
K/KC/KCN.xml,KCNRE01K,27602,291,,A,83,1,Mhm.,"[Mhm/NNP, ./.]",(ROOT (FRAG (NP (NNP Mhm)) (. .)))
K/KC/KCN.xml,KCNRE01K,27602,292,,B,84,1,Only it's just lucky that he's got a lot!,"[Only/RB, it/PRP, 's/VBZ, just/RB, lucky/JJ, that/IN, he/PRP, 's/VBZ, got/VBD, a/DT, lot/NN, !/.]",(ROOT (S (RB Only) (NP (PRP it)) (VP (VBZ 's) (ADJP (RB just) (JJ lucky)) (SBAR (IN that) (S (NP (PRP he)) (VP (VBZ 's) (VP (VBD got) (NP (DT a) (NN lot))))))) (. !)))
