swda_filename,ptb_basename,conversation_no,transcript_index,act_tag,caller,turn_index,subutterance_index,text,pos,trees
K/KB/KBK.xml,KBKRE02S,2324,0,,A,1,1,There's  (()) fallen tree in the park.,"[There/EX, 's/VBZ, fallen/VBN, tree/NN, in/IN, the/DT, park/NN, ./.]",(ROOT (S (NP (EX There)) (VP (VBZ 's) (VP (VBN fallen) (NP (NP (NN tree)) (PP (IN in) (NP (DT the) (NN park)))))) (. .)))
K/KB/KBK.xml,KBKRE02S,2324,1,,B,2,1,(()) .,[./.],(ROOT (NP (. .)))
K/KB/KBK.xml,KBKRE02S,2324,2,,B,2,2,Relatively recently.,"[Relatively/RB, recently/RB, ./.]",(ROOT (FRAG (ADJP (RB Relatively) (RB recently)) (. .)))
K/KB/KBK.xml,KBKRE02S,2324,3,,A,3,1,(()) .,[./.],(ROOT (NP (. .)))
K/KB/KBK.xml,KBKRE02S,2324,4,,A,3,2,They seemed to keep (()) .,"[They/PRP, seemed/VBD, to/TO, keep/VB, ./.]",(ROOT (S (NP (PRP They)) (VP (VBD seemed) (S (VP (TO to) (VP (VB keep))))) (. .)))
K/KB/KBK.xml,KBKRE02S,2324,5,,B,4,1,Yeah  --,"[Yeah/UH, yeah/UH, it/PRP, 's/VBZ, fascinating/JJ, to/TO, think/VB, why/WRB, that/DT, particular/JJ, tree/NN, actually/RB, keeled/VBD, over/RP, ,/,, and/CC, all/PDT, the/DT, others/NNS, around/RB, ,/,, it/PRP, 's/VBZ, no/RB, bigger/JJR, than/IN, the/DT, others/NNS, is/VBZ, it/PRP, ?/.]","(ROOT (S (S (INTJ (UH Yeah) (UH yeah)) (NP (PRP it)) (VP (VBZ 's) (ADJP (JJ fascinating) (S (VP (TO to) (VP (VB think) (SBAR (WHADVP (WRB why)) (S (NP (DT that) (JJ particular) (NN tree)) (ADVP (RB actually)) (VP (VBD keeled) (PRT (RP over))))))))))) (, ,) (CC and) (S (NP (PDT all) (DT the) (NNS others)) (ADVP (RB around)) (, ,) (NP (PRP it)) (VP (VBZ 's) (ADJP (RB no) (JJR bigger)) (SBAR (IN than) (S (NP (DT the) (NNS others)) (VP (VBZ is) (NP (PRP it))))))) (. ?)))"
K/KB/KBK.xml,KBKRE02S,2324,6,,B,4,2,"--yeah it's fascinating to think why that particular tree actually keeled over, and all the others around, it's no bigger than the others is it?","[Yeah/UH, yeah/UH, it/PRP, 's/VBZ, fascinating/JJ, to/TO, think/VB, why/WRB, that/DT, particular/JJ, tree/NN, actually/RB, keeled/VBD, over/RP, ,/,, and/CC, all/PDT, the/DT, others/NNS, around/RB, ,/,, it/PRP, 's/VBZ, no/RB, bigger/JJR, than/IN, the/DT, others/NNS, is/VBZ, it/PRP, ?/.]","(ROOT (S (S (INTJ (UH Yeah) (UH yeah)) (NP (PRP it)) (VP (VBZ 's) (ADJP (JJ fascinating) (S (VP (TO to) (VP (VB think) (SBAR (WHADVP (WRB why)) (S (NP (DT that) (JJ particular) (NN tree)) (ADVP (RB actually)) (VP (VBD keeled) (PRT (RP over))))))))))) (, ,) (CC and) (S (NP (PDT all) (DT the) (NNS others)) (ADVP (RB around)) (, ,) (NP (PRP it)) (VP (VBZ 's) (ADJP (RB no) (JJR bigger)) (SBAR (IN than) (S (NP (DT the) (NNS others)) (VP (VBZ is) (NP (PRP it))))))) (. ?)))"
K/KB/KBK.xml,KBKRE02S,2324,7,,A,5,1,(()) don't know (()) .,"[don/NNP, 't/PRP, know/VBP, ./.]",(ROOT (S (NP (NNP don) (PRP 't)) (VP (VBP know)) (. .)))
K/KB/KBK.xml,KBKRE02S,2324,8,,B,6,1,Well look at the size of it's trunk.,"[Well/RB, look/VB, at/IN, the/DT, size/NN, of/IN, it/PRP, 's/VBZ, trunk/NN, ./.]",(ROOT (S (INTJ (RB Well)) (VP (VB look) (PP (IN at) (NP (NP (DT the) (NN size)) (PP (IN of) (SBAR (S (NP (PRP it)) (VP (VBZ 's) (NP (NN trunk))))))))) (. .)))
K/KB/KBK.xml,KBKRE02S,2324,9,,A,7,1,It might have been (()) .,"[It/PRP, might/MD, have/VB, been/VBN, ./.]",(ROOT (S (NP (PRP It)) (VP (MD might) (VP (VB have) (VP (VBN been)))) (. .)))
K/KB/KBK.xml,KBKRE02S,2324,10,,B,8,1,"It might have been, yeah, just a  (()) one.","[It/PRP, might/MD, have/VB, been/VBN, ,/,, yeah/UH, ,/,, just/RB, a/DT, one/CD, ./.]","(ROOT (S (NP (PRP It)) (VP (MD might) (VP (VB have) (S (VP (VBN been) (PRN (, ,) (INTJ (UH yeah)) (, ,)) (PP (RB just) (NP (DT a) (CD one))))))) (. .)))"
