swda_filename,ptb_basename,conversation_no,transcript_index,act_tag,caller,turn_index,subutterance_index,text,pos,trees
K/KC/KCN.xml,KCNRE00U,27207,134,,A,61,2,--looking like rolled doll she said.,"[Well/RB, she/PRP, would/MD, rather/RB, have/VB, her/PRP$, own/JJ, than/IN, be/VB, dressed/VBN, up/RP, like/IN, looking/VBG, like/IN, rolled/VBN, doll/NN, she/PRP, said/VBD, ./.]",(ROOT (S (S (INTJ (RB Well)) (NP (PRP she)) (VP (MD would) (VP (RB rather) (VP (VB have) (NP (PRP$ her) (JJ own))) (IN than) (VP (VB be) (VP (VBN dressed) (PRT (RP up)) (PP (IN like) (S (VP (VBG looking) (PP (IN like) (NP (VBN rolled) (NN doll))))))))))) (NP (PRP she)) (VP (VBD said)) (. .)))
K/KC/KCN.xml,KCNRE00U,27207,135,,A,61,3,Cos they were all on about it.,"[Cos/NN, they/PRP, were/VBD, all/DT, on/IN, about/IN, it/PRP, ./.]",(ROOT (S (NP (NN Cos)) (NP (PRP they)) (VP (VBD were) (ADVP (DT all) (IN on)) (PP (IN about) (NP (PRP it)))) (. .)))
K/KC/KCN.xml,KCNRE00U,27207,136,,A,61,4,"(()) They were talking about going on strike over it, about it anyway.","[They/PRP, were/VBD, talking/VBG, about/IN, going/VBG, on/IN, strike/NN, over/IN, it/PRP, ,/,, about/IN, it/PRP, anyway/RB, ./.]","(ROOT (S (NP (PRP They)) (VP (VBD were) (VP (VBG talking) (PP (IN about) (S (VP (VBG going) (PP (IN on) (NP (NN strike))) (PP (IN over) (NP (PRP it))) (, ,) (PP (IN about) (NP (PRP it)))))) (ADVP (RB anyway)))) (. .)))"
K/KC/KCN.xml,KCNRE00U,27207,137,,A,61,5,Is it going to rain?,"[Is/VBZ, it/PRP, going/VBG, to/TO, rain/VB, ?/.]",(ROOT (SQ (VBZ Is) (NP (PRP it)) (VP (VBG going) (S (VP (TO to) (VP (VB rain))))) (. ?)))
K/KC/KCN.xml,KCNRE00U,27207,138,,B,62,1,(()) ,[],
K/KC/KCN.xml,KCNRE00U,27207,139,,A,63,1,Mm.,"[Mm/NN, ./.]",(ROOT (NP (NN Mm) (. .)))
K/KC/KCN.xml,KCNRE00U,27207,140,,A,63,2,Could have the odd little shower.,"[Could/MD, have/VB, the/DT, odd/JJ, little/JJ, shower/NN, ./.]",(ROOT (S (VP (MD Could) (VP (VB have) (NP (DT the) (JJ odd) (JJ little) (NN shower)))) (. .)))
K/KC/KCN.xml,KCNRE00U,27207,141,,B,64,1,No er tonight it's supposed to rain.,"[No/DT, er/NN, tonight/NN, it/PRP, 's/VBZ, supposed/VBN, to/TO, rain/NN, ./.]",(ROOT (S (NP (DT No) (NN er) (NN tonight)) (NP (PRP it)) (VP (VBZ 's) (VP (VBN supposed) (PP (TO to) (NP (NN rain))))) (. .)))
K/KC/KCN.xml,KCNRE00U,27207,142,,A,65,1,<reading> David  <<REDACTED (name)>> the chief economist of Nat West Bank expects output to rise by only point six percent this year.,"[David/NNP, >/JJR, the/DT, chief/JJ, economist/NN, of/IN, Nat/NNP, West/NNP, Bank/NNP, expects/VBZ, output/NN, to/TO, rise/VB, by/IN, only/RB, point/NN, six/CD, percent/NN, this/DT, year/NN, ./.]",(ROOT (S (NP (NP (NNP David)) (NP (JJR >)) (NP (NP (DT the) (JJ chief) (NN economist)) (PP (IN of) (NP (NNP Nat) (NNP West) (NNP Bank))))) (VP (VBZ expects) (NP (NN output)) (S (VP (TO to) (VP (VB rise) (PP (IN by) (NP (RB only) (NN point))) (NP (NP (CD six) (NN percent)) (NP (DT this) (NN year))))))) (. .)))
K/KC/KCN.xml,KCNRE00U,27207,143,,A,65,2,A much lower rate than predicted by chancellor Norman Lamont  --,"[A/DT, much/RB, lower/JJR, rate/NN, than/IN, predicted/VBN, by/IN, chancellor/NNP, Norman/NNP, Lamont/NNP, on/IN, last/JJ, week/NN, 's/POS, budget/NN, ./.]",(ROOT (S (NP (DT A) (ADJP (RB much) (JJR lower)) (NN rate)) (VP (ADVP (IN than)) (VBN predicted) (PP (IN by) (NP (NP (NNP chancellor) (NNP Norman) (NNP Lamont)) (PP (IN on) (NP (NP (JJ last) (NN week) (POS 's)) (NN budget)))))) (. .)))
K/KC/KCN.xml,KCNRE00U,27207,144,,A,65,3,--on last week's budget.,"[A/DT, much/RB, lower/JJR, rate/NN, than/IN, predicted/VBN, by/IN, chancellor/NNP, Norman/NNP, Lamont/NNP, on/IN, last/JJ, week/NN, 's/POS, budget/NN, ./.]",(ROOT (S (NP (DT A) (ADJP (RB much) (JJR lower)) (NN rate)) (VP (ADVP (IN than)) (VBN predicted) (PP (IN by) (NP (NP (NNP chancellor) (NNP Norman) (NNP Lamont)) (PP (IN on) (NP (NP (JJ last) (NN week) (POS 's)) (NN budget)))))) (. .)))
K/KC/KCN.xml,KCNRE00U,27207,145,,A,65,4,Mr  <<REDACTED (name)>> also believes interest and mortgage rates will remain high </reading> .,"[Mr/NNP, >/JJR, also/RB, believes/VBZ, interest/NN, and/CC, mortgage/NN, rates/NNS, will/MD, remain/VB, high/JJ, ./.]",(ROOT (S (NP (NP (NNP Mr)) (ADJP (JJR >))) (ADVP (RB also)) (VP (VBZ believes) (SBAR (S (NP (NN interest) (CC and) (NN mortgage) (NNS rates)) (VP (MD will) (VP (VB remain) (ADJP (JJ high))))))) (. .)))
K/KC/KCN.xml,KCNRE00U,27207,146,,A,65,5,So if people reads this paper  --,"[So/RB, if/IN, people/NNS, reads/VBZ, this/DT, paper/NN, which/WDT, is/VBZ, the/DT, ,/,, which/WDT, of/IN, the/DT, papers/NNS, are/VBP, read/VBN, the/DT, most/RBS, ?/.]","(ROOT (SBARQ (SBAR (ADVP (RB So)) (IN if) (S (NP (NNS people)) (VP (VBZ reads) (NP (NP (DT this) (NN paper)) (SBAR (WHNP (WDT which)) (S (VP (VBZ is) (NP (DT the))))))))) (, ,) (WHNP (WHNP (WDT which)) (PP (IN of) (NP (DT the) (NNS papers)))) (SQ (VBP are) (VP (VBN read) (NP (DT the) (RBS most)))) (. ?)))"
K/KC/KCN.xml,KCNRE00U,27207,147,,A,65,6,"--which is the, which of the papers are read the most?","[So/RB, if/IN, people/NNS, reads/VBZ, this/DT, paper/NN, which/WDT, is/VBZ, the/DT, ,/,, which/WDT, of/IN, the/DT, papers/NNS, are/VBP, read/VBN, the/DT, most/RBS, ?/.]","(ROOT (SBARQ (SBAR (ADVP (RB So)) (IN if) (S (NP (NNS people)) (VP (VBZ reads) (NP (NP (DT this) (NN paper)) (SBAR (WHNP (WDT which)) (S (VP (VBZ is) (NP (DT the))))))))) (, ,) (WHNP (WHNP (WDT which)) (PP (IN of) (NP (DT the) (NNS papers)))) (SQ (VBP are) (VP (VBN read) (NP (DT the) (RBS most)))) (. ?)))"
K/KC/KCN.xml,KCNRE00U,27207,148,,A,65,7,Which is the most popular paper?,"[Which/WDT, is/VBZ, the/DT, most/RBS, popular/JJ, paper/NN, ?/.]",(ROOT (SBARQ (WHNP (WDT Which)) (SQ (VBZ is) (NP (DT the) (ADJP (RBS most) (JJ popular)) (NN paper))) (. ?)))
K/KC/KCN.xml,KCNRE00U,27207,149,,B,66,1,The Mirror and The Sun.,"[The/DT, Mirror/NN, and/CC, The/DT, Sun/NN, ./.]",(ROOT (NP (NP (NP (DT The) (NN Mirror)) (CC and) (NP (DT The) (NN Sun))) (. .)))
K/KC/KCN.xml,KCNRE00U,27207,150,,B,66,2,And Today I think isn't it?,"[And/CC, Today/NN, I/PRP, think/VBP, isn/RB, 't/PRP, it/PRP, ?/.]",(ROOT (S (CC And) (NP (NN Today)) (NP (PRP I)) (VP (VBP think) (ADJP (RB isn) (NP (PRP 't))) (S (NP (PRP it)))) (. ?)))
K/KC/KCN.xml,KCNRE00U,27207,151,,A,67,1,Well The Sun is conservative.,"[Well/RB, The/DT, Sun/NN, is/VBZ, conservative/JJ, ./.]",(ROOT (S (ADVP (RB Well)) (NP (DT The) (NN Sun)) (VP (VBZ is) (ADJP (JJ conservative))) (. .)))
K/KC/KCN.xml,KCNRE00U,27207,152,,A,67,2,What's Today?,"[What/WP, 's/VBZ, Today/NN, ?/.]",(ROOT (SBARQ (WHNP (WP What)) (SQ (VBZ 's) (NP (NN Today))) (. ?)))
K/KC/KCN.xml,KCNRE00U,27207,153,,B,68,1,Conservative.,"[Conservative/JJ, ./.]",(ROOT (FRAG (ADJP (JJ Conservative)) (. .)))
K/KC/KCN.xml,KCNRE00U,27207,154,,A,69,1,I don't know.,"[I/PRP, don/VBP, 't/PRP, know/VB, ./.]",(ROOT (S (NP (PRP I)) (VP (VBP don) (S (NP (PRP 't)) (VP (VB know)))) (. .)))
K/KC/KCN.xml,KCNRE00U,27207,155,,A,69,2,Well The Sun  --,"[Well/RB, The/DT, Sun/NN, used/VBN, to/TO, be/VB, a/DT, labour/NN, paper/NN, ./.]",(ROOT (FRAG (ADVP (RB Well)) (NP (NP (DT The) (NN Sun)) (VP (VBN used) (S (VP (TO to) (VP (VB be) (NP (DT a) (NN labour) (NN paper))))))) (. .)))
K/KC/KCN.xml,KCNRE00U,27207,156,,A,69,3,--used to be a labour paper.,"[Well/RB, The/DT, Sun/NN, used/VBN, to/TO, be/VB, a/DT, labour/NN, paper/NN, ./.]",(ROOT (FRAG (ADVP (RB Well)) (NP (NP (DT The) (NN Sun)) (VP (VBN used) (S (VP (TO to) (VP (VB be) (NP (DT a) (NN labour) (NN paper))))))) (. .)))
K/KC/KCN.xml,KCNRE00U,27207,157,,B,70,1,Well didn't that er Rupert Murdoch take it over?(()) ,"[Well/RB, didn/JJ, 't/PRP, that/IN, er/NN, Rupert/NNP, Murdoch/NNP, take/VB, it/PRP, over/IN, ?/.]",(ROOT (FRAG (ADJP (ADVP (RB Well)) (JJ didn)) (SBAR (NP (PRP 't)) (IN that) (S (NP (NN er) (NNP Rupert) (NNP Murdoch)) (VP (VB take) (S (NP (PRP it)) (ADJP (IN over)))))) (. ?)))
K/KC/KCN.xml,KCNRE00U,27207,158,,A,71,1,I don't know.,"[I/PRP, don/VBP, 't/PRP, know/VB, ./.]",(ROOT (S (NP (PRP I)) (VP (VBP don) (S (NP (PRP 't)) (VP (VB know)))) (. .)))
K/KC/KCN.xml,KCNRE00U,27207,159,,A,71,2,Rupert Murdoch?,"[Rupert/NNP, Murdoch/NNP, ?/.]",(ROOT (NP (NNP Rupert) (NNP Murdoch) (. ?)))
K/KC/KCN.xml,KCNRE00U,27207,160,,A,71,3,And he's a conservative?,"[And/CC, he/PRP, 's/VBZ, a/DT, conservative/JJ, ?/.]",(ROOT (S (CC And) (NP (PRP he)) (VP (VBZ 's) (NP (DT a) (JJ conservative))) (. ?)))
K/KC/KCN.xml,KCNRE00U,27207,161,,A,71,4,He's an Australian isn't he?,"[He/PRP, 's/VBZ, an/DT, Australian/JJ, isn/NN, 't/PRP, he/PRP, ?/.]",(ROOT (S (NP (PRP He)) (VP (VBZ 's) (NP (NP (DT an) (JJ Australian) (NN isn)) (NP (NP (PRP 't)) (NP (PRP he))))) (. ?)))
K/KC/KCN.xml,KCNRE00U,27207,162,,B,72,1,Mm.,"[Mm/NN, ./.]",(ROOT (NP (NN Mm) (. .)))
K/KC/KCN.xml,KCNRE00U,27207,163,,A,73,1,Whatever  --,"[Whatever/WDT, I/PRP, can/MD, 't/PRP, remember/VB, ./.]",(ROOT (SBARQ (WHNP (WDT Whatever) (NP (PRP I))) (SQ (MD can) (NP (PRP 't)) (VP (VB remember))) (. .)))
K/KC/KCN.xml,KCNRE00U,27207,164,,A,73,2,--I can't remember.,"[Whatever/WDT, I/PRP, can/MD, 't/PRP, remember/VB, ./.]",(ROOT (SBARQ (WHNP (WDT Whatever) (NP (PRP I))) (SQ (MD can) (NP (PRP 't)) (VP (VB remember))) (. .)))
K/KC/KCN.xml,KCNRE00U,27207,165,,A,73,3,But I knew it before it was The Sun you see.,"[But/CC, I/PRP, knew/VBD, it/PRP, before/IN, it/PRP, was/VBD, The/DT, Sun/NN, you/PRP, see/VBP, ./.]",(ROOT (S (CC But) (NP (PRP I)) (VP (VBD knew) (NP (PRP it)) (SBAR (IN before) (S (NP (PRP it)) (VP (VBD was) (NP (NP (DT The) (NN Sun)) (SBAR (S (NP (PRP you)) (VP (VBP see))))))))) (. .)))
K/KC/KCN.xml,KCNRE00U,27207,166,,A,73,4,"No, what do you call it?","[No/DT, ,/,, what/WP, do/VBP, you/PRP, call/VB, it/PRP, ?/.]","(ROOT (FRAG (NP (DT No)) (, ,) (SBAR (WHNP (WP what)) (S (VP (VBP do) (S (NP (PRP you)) (VP (VB call) (NP (PRP it))))))) (. ?)))"
K/KC/KCN.xml,KCNRE00U,27207,167,,A,73,5,"Yes, The Sun.","[Yes/UH, ,/,, The/DT, Sun/NN, ./.]","(ROOT (FRAG (INTJ (UH Yes)) (, ,) (NP (DT The) (NN Sun)) (. .)))"
K/KC/KCN.xml,KCNRE00U,27207,168,,A,73,6,It was the Daily Herald wasn't it?,"[It/PRP, was/VBD, the/DT, Daily/JJ, Herald/NNP, wasn/NNP, 't/PRP, it/PRP, ?/.]",(ROOT (S (NP (PRP It)) (VP (VBD was) (S (NP (NP (DT the) (JJ Daily) (NNP Herald) (NNP wasn)) (NP (PRP 't))) (NP (PRP it)))) (. ?)))
K/KC/KCN.xml,KCNRE00U,27207,169,,A,73,7,When it came out first.,"[When/WRB, it/PRP, came/VBD, out/RP, first/RB, ./.]",(ROOT (FRAG (SBAR (WHADVP (WRB When)) (S (NP (PRP it)) (VP (VBD came) (PRT (RP out)) (ADVP (RB first))))) (. .)))
K/KC/KCN.xml,KCNRE00U,27207,170,,A,73,8,Ooh.,"[Ooh/NNP, ./.]",(ROOT (FRAG (NP (NNP Ooh)) (. .)))
K/KC/KCN.xml,KCNRE00U,27207,171,,A,73,9,<reading> Senator Ted Kennedy revealed yesterday that he is to wed lawyer Victoria   <<REDACTED (name)>> --,"[Senator/NNP, Ted/NNP, Kennedy/NNP, revealed/VBD, yesterday/NN, that/IN, he/PRP, is/VBZ, to/TO, wed/VBN, lawyer/NN, Victoria/NNP, >/JJR, who/WP, 's/VBZ, father/NN, is/VBZ, to/TO, stand/VB, trial/NN, over/IN, an/DT, alleged/JJ, fraud/NN, ./.]",(ROOT (S (NP (NNP Senator) (NNP Ted) (NNP Kennedy)) (VP (VBD revealed) (NP (NN yesterday)) (SBAR (IN that) (S (NP (PRP he)) (VP (VBZ is) (S (VP (TO to) (VP (VBN wed) (S (NP (NN lawyer) (NNP Victoria)) (ADJP (JJR >) (SBAR (WHNP (WP who)) (S (VP (VBZ 's) (NP (NP (NN father)) (SBAR (S (VP (VBZ is) (S (VP (TO to) (VP (VB stand) (NP (NN trial)) (PP (IN over) (NP (DT an) (JJ alleged) (NN fraud)))))))))))))))))))))) (. .)))
K/KC/KCN.xml,KCNRE00U,27207,172,,A,73,10,--who's father is to stand trial over an alleged  (()) fraud.,"[Senator/NNP, Ted/NNP, Kennedy/NNP, revealed/VBD, yesterday/NN, that/IN, he/PRP, is/VBZ, to/TO, wed/VBN, lawyer/NN, Victoria/NNP, >/JJR, who/WP, 's/VBZ, father/NN, is/VBZ, to/TO, stand/VB, trial/NN, over/IN, an/DT, alleged/JJ, fraud/NN, ./.]",(ROOT (S (NP (NNP Senator) (NNP Ted) (NNP Kennedy)) (VP (VBD revealed) (NP (NN yesterday)) (SBAR (IN that) (S (NP (PRP he)) (VP (VBZ is) (S (VP (TO to) (VP (VBN wed) (S (NP (NN lawyer) (NNP Victoria)) (ADJP (JJR >) (SBAR (WHNP (WP who)) (S (VP (VBZ 's) (NP (NP (NN father)) (SBAR (S (VP (VBZ is) (S (VP (TO to) (VP (VB stand) (NP (NN trial)) (PP (IN over) (NP (DT an) (JJ alleged) (NN fraud)))))))))))))))))))))) (. .)))
K/KC/KCN.xml,KCNRE00U,27207,173,,A,73,11,Kennedy sixty started dating the thirty eight year old divorced mother of two last June.,"[Kennedy/NNP, sixty/CD, started/VBD, dating/VBG, the/DT, thirty/CD, eight/CD, year/NN, old/JJ, divorced/VBN, mother/NN, of/IN, two/CD, last/JJ, June/NNP, ./.]",(ROOT (S (NP (NNP Kennedy) (CD sixty)) (VP (VBD started) (S (VP (VBG dating) (S (NP (DT the) (CD thirty)) (ADJP (NP (CD eight) (NN year)) (JJ old)) (S (VP (VBN divorced) (NP (NP (NN mother)) (PP (IN of) (NP (CD two)))) (NP (JJ last) (NNP June)))))))) (. .)))
K/KC/KCN.xml,KCNRE00U,27207,174,,A,73,12,I love her and her children very much  --,"[I/PRP, love/VBP, her/PRP, and/CC, her/PRP$, children/NNS, very/RB, much/RB, he/PRP, said/VBD, ./.]",(ROOT (S (NP (PRP I)) (VP (VBP love) (NP (NP (PRP her)) (CC and) (NP (PRP$ her) (NNS children))) (ADVP (RB very) (RB much) (SBAR (S (NP (PRP he)) (VP (VBD said)))))) (. .)))
K/KC/KCN.xml,KCNRE00U,27207,175,,A,73,13,--he said.,"[I/PRP, love/VBP, her/PRP, and/CC, her/PRP$, children/NNS, very/RB, much/RB, he/PRP, said/VBD, ./.]",(ROOT (S (NP (PRP I)) (VP (VBP love) (NP (NP (PRP her)) (CC and) (NP (PRP$ her) (NNS children))) (ADVP (RB very) (RB much) (SBAR (S (NP (PRP he)) (VP (VBD said)))))) (. .)))
K/KC/KCN.xml,KCNRE00U,27207,176,,A,73,14,Victoria's father retired   </reading> --,"[Victoria/NNP, 's/POS, father/NN, retired/VBD, oh/UH, he/PRP, 's/VBZ, father/NN, 's/POS, Victoria/NNP, 's/POS, father/NN, ,/,, retired/VBN, judge/NN, Edmund/NNP, >/JJR, denies/VBZ, fraud/NN, ./.]","(ROOT (S (NP (NP (NNP Victoria) (POS 's)) (NN father)) (VP (VBD retired) (SBAR (S (INTJ (UH oh)) (NP (PRP he)) (VP (VBZ 's) (NP (NP (NP (NP (NN father) (POS 's)) (NNP Victoria) (POS 's)) (NN father)) (, ,) (VP (VBN retired) (S (NP (NN judge) (NNP Edmund)) (ADJP (JJR >)) (S (VP (VBZ denies) (NP (NN fraud))))))))))) (. .)))"
K/KC/KCN.xml,KCNRE00U,27207,177,,A,73,15,--oh he's   --,"[Victoria/NNP, 's/POS, father/NN, retired/VBD, oh/UH, he/PRP, 's/VBZ, father/NN, 's/POS, Victoria/NNP, 's/POS, father/NN, ,/,, retired/VBN, judge/NN, Edmund/NNP, >/JJR, denies/VBZ, fraud/NN, ./.]","(ROOT (S (NP (NP (NNP Victoria) (POS 's)) (NN father)) (VP (VBD retired) (SBAR (S (INTJ (UH oh)) (NP (PRP he)) (VP (VBZ 's) (NP (NP (NP (NP (NN father) (POS 's)) (NNP Victoria) (POS 's)) (NN father)) (, ,) (VP (VBN retired) (S (NP (NN judge) (NNP Edmund)) (ADJP (JJR >)) (S (VP (VBZ denies) (NP (NN fraud))))))))))) (. .)))"
K/KC/KCN.xml,KCNRE00U,27207,178,,A,73,16,--<reading> father's  --,"[Victoria/NNP, 's/POS, father/NN, retired/VBD, oh/UH, he/PRP, 's/VBZ, father/NN, 's/POS, Victoria/NNP, 's/POS, father/NN, ,/,, retired/VBN, judge/NN, Edmund/NNP, >/JJR, denies/VBZ, fraud/NN, ./.]","(ROOT (S (NP (NP (NNP Victoria) (POS 's)) (NN father)) (VP (VBD retired) (SBAR (S (INTJ (UH oh)) (NP (PRP he)) (VP (VBZ 's) (NP (NP (NP (NP (NN father) (POS 's)) (NNP Victoria) (POS 's)) (NN father)) (, ,) (VP (VBN retired) (S (NP (NN judge) (NNP Edmund)) (ADJP (JJR >)) (S (VP (VBZ denies) (NP (NN fraud))))))))))) (. .)))"
K/KC/KCN.xml,KCNRE00U,27207,179,,A,73,17,"--Victoria's father, retired judge Edmund  <<REDACTED (name)>> denies fraud </reading> .","[Victoria/NNP, 's/POS, father/NN, retired/VBD, oh/UH, he/PRP, 's/VBZ, father/NN, 's/POS, Victoria/NNP, 's/POS, father/NN, ,/,, retired/VBN, judge/NN, Edmund/NNP, >/JJR, denies/VBZ, fraud/NN, ./.]","(ROOT (S (NP (NP (NNP Victoria) (POS 's)) (NN father)) (VP (VBD retired) (SBAR (S (INTJ (UH oh)) (NP (PRP he)) (VP (VBZ 's) (NP (NP (NP (NP (NN father) (POS 's)) (NNP Victoria) (POS 's)) (NN father)) (, ,) (VP (VBN retired) (S (NP (NN judge) (NNP Edmund)) (ADJP (JJR >)) (S (VP (VBZ denies) (NP (NN fraud))))))))))) (. .)))"
K/KC/KCN.xml,KCNRE00U,27207,180,,A,73,18,The Kennedy's are in  --,"[The/DT, Kennedy/NNP, 's/POS, are/VBP, in/IN, trouble/NN, every/DT, corner/NN, aren/NN, 't/PRP, they/PRP, ?/.]",(ROOT (S (NP (DT The) (NNP Kennedy) (POS 's)) (VP (VBP are) (PP (IN in) (NP (NP (NN trouble)) (NP (NP (DT every) (NN corner) (NN aren)) (NP (PRP 't)) (NP (PRP they)))))) (. ?)))
K/KC/KCN.xml,KCNRE00U,27207,181,,A,73,19,--trouble every corner aren't they?,"[The/DT, Kennedy/NNP, 's/POS, are/VBP, in/IN, trouble/NN, every/DT, corner/NN, aren/NN, 't/PRP, they/PRP, ?/.]",(ROOT (S (NP (DT The) (NNP Kennedy) (POS 's)) (VP (VBP are) (PP (IN in) (NP (NP (NN trouble)) (NP (NP (DT every) (NN corner) (NN aren)) (NP (PRP 't)) (NP (PRP they)))))) (. ?)))
K/KC/KCN.xml,KCNRE00U,27207,182,,B,74,1,It's nothing to do with him.,"[It/PRP, 's/VBZ, nothing/NN, to/TO, do/VB, with/IN, him/PRP, ./.]",(ROOT (S (NP (PRP It)) (VP (VBZ 's) (NP (NN nothing) (S (VP (TO to) (VP (VB do) (PP (IN with) (NP (PRP him)))))))) (. .)))
K/KC/KCN.xml,KCNRE00U,27207,183,,A,75,1,"No, but er I mean he's even marrying into trouble.","[No/DT, ,/,, but/CC, er/NN, I/PRP, mean/VBP, he/PRP, 's/VBZ, even/RB, marrying/VBG, into/IN, trouble/NN, ./.]","(ROOT (FRAG (NP (DT No)) (, ,) (CC but) (S (NP (NP (NN er)) (SBAR (S (NP (PRP I)) (VP (VBP mean) (NP (PRP he)))))) (VP (VBZ 's) (ADVP (RB even)) (VP (VBG marrying) (PP (IN into) (NP (NN trouble)))))) (. .)))"
K/KC/KCN.xml,KCNRE00U,27207,184,,A,75,2,The whole of his family.,"[The/DT, whole/NN, of/IN, his/PRP$, family/NN, ./.]",(ROOT (NP (NP (DT The) (NN whole)) (PP (IN of) (NP (PRP$ his) (NN family))) (. .)))
K/KC/KCN.xml,KCNRE00U,27207,185,,A,75,3,His father and all.,"[His/PRP$, father/NN, and/CC, all/DT, ./.]",(ROOT (NP (NP (NP (PRP$ His) (NN father)) (CC and) (NP (DT all))) (. .)))
K/KC/KCN.xml,KCNRE00U,27207,186,,A,75,4,<reading> Remand prisoners at a top security jail used a thin mobile phone to make threatening calls to court witnesses it was revealed yesterday.,"[Remand/VB, prisoners/NNS, at/IN, a/DT, top/JJ, security/NN, jail/NN, used/VBD, a/DT, thin/JJ, mobile/JJ, phone/NN, to/TO, make/VB, threatening/VBG, calls/NNS, to/TO, court/NN, witnesses/NNS, it/PRP, was/VBD, revealed/VBN, yesterday/NN, ./.]",(ROOT (S (S (S (VP (VB Remand) (NP (NNS prisoners)) (PP (IN at) (NP (DT a) (JJ top) (NN security) (NN jail))))) (VP (VBD used) (NP (DT a) (JJ thin) (JJ mobile) (NN phone)) (S (VP (TO to) (VP (VB make) (S (VP (VBG threatening) (NP (NNS calls)) (PP (TO to) (NP (NN court) (NNS witnesses)))))))))) (NP (PRP it)) (VP (VBD was) (VP (VBN revealed) (NP (NN yesterday)))) (. .)))
K/KC/KCN.xml,KCNRE00U,27207,187,,A,75,5,An astonished guard alerted Durham Jail chiefs when he heard a phone ringing in a cell.,"[An/DT, astonished/VBN, guard/NN, alerted/VBD, Durham/NNP, Jail/NN, chiefs/NNS, when/WRB, he/PRP, heard/VBD, a/DT, phone/NN, ringing/NN, in/IN, a/DT, cell/NN, ./.]",(ROOT (S (NP (DT An) (S (S (VP (VBN astonished) (NP (NN guard)))) (VP (VBD alerted) (NP (NNP Durham) (NN Jail) (NNS chiefs)) (SBAR (WHADVP (WRB when)) (S (NP (PRP he)) (VP (VBD heard) (NP (DT a) (NN phone)))))))) (VP (NN ringing) (PP (IN in) (NP (DT a) (NN cell)))) (. .)))
K/KC/KCN.xml,KCNRE00U,27207,188,,A,75,6,A search revealed the battery operated handset hidden under a mattress.,"[A/DT, search/NN, revealed/VBD, the/DT, battery/NN, operated/VBD, handset/NN, hidden/VBN, under/IN, a/DT, mattress/NNP, ./.]",(ROOT (S (NP (DT A) (NN search)) (VP (VBD revealed) (SBAR (S (NP (DT the) (NN battery)) (VP (VBD operated) (NP (NP (NN handset)) (VP (VBN hidden) (PP (IN under) (NP (DT a) (NNP mattress))))))))) (. .)))
K/KC/KCN.xml,KCNRE00U,27207,189,,A,75,7,Calls made from it were traced by police to the homes of witnesses due to give evidence in trials on Tyneside.,"[Calls/NNS, made/VBN, from/IN, it/PRP, were/VBD, traced/VBN, by/IN, police/NN, to/TO, the/DT, homes/NNS, of/IN, witnesses/NNS, due/JJ, to/TO, give/VB, evidence/NN, in/IN, trials/NNS, on/IN, Tyneside/NN, ./.]",(ROOT (S (NP (NP (NNS Calls)) (VP (VBN made) (PP (IN from) (NP (PRP it))))) (VP (VBD were) (VP (VBN traced) (PP (IN by) (NP (NN police))) (PP (TO to) (NP (NP (DT the) (NNS homes)) (PP (IN of) (NP (NP (NNS witnesses)) (ADJP (JJ due) (S (VP (TO to) (VP (VB give) (NP (NN evidence)) (PP (IN in) (NP (NP (NNS trials)) (PP (IN on) (NP (NN Tyneside))))))))))))))) (. .)))
K/KC/KCN.xml,KCNRE00U,27207,190,,A,75,8,At least one case is understood to be involved in a murder charge.,"[At/IN, least/JJS, one/CD, case/NN, is/VBZ, understood/VBN, to/TO, be/VB, involved/VBN, in/IN, a/DT, murder/NN, charge/NN, ./.]",(ROOT (S (NP (QP (IN At) (JJS least) (CD one)) (NN case)) (VP (VBZ is) (VP (VBN understood) (S (VP (TO to) (VP (VB be) (VP (VBN involved) (PP (IN in) (NP (DT a) (NN murder) (NN charge))))))))) (. .)))
K/KC/KCN.xml,KCNRE00U,27207,191,,A,75,9,A top level enquiry is underway into the racket.,"[A/DT, top/JJ, level/NN, enquiry/NN, is/VBZ, underway/JJ, into/IN, the/DT, racket/NN, ./.]",(ROOT (S (NP (DT A) (JJ top) (NN level) (NN enquiry)) (VP (VBZ is) (ADJP (JJ underway) (PP (IN into) (NP (DT the) (NN racket))))) (. .)))
K/KC/KCN.xml,KCNRE00U,27207,192,,A,75,10,Dubbed by prison wives the cellnet scandal after the cabinet mobile phones system.,"[Dubbed/VBN, by/IN, prison/NN, wives/NNS, the/DT, cellnet/NNP, scandal/NN, after/IN, the/DT, cabinet/NN, mobile/JJ, phones/NNS, system/NN, ./.]",(ROOT (S (VP (VBN Dubbed) (PP (IN by) (NP (NN prison) (NNS wives))) (NP (NP (DT the) (NNP cellnet) (NN scandal)) (PP (IN after) (NP (NP (DT the) (NN cabinet)) (NP (JJ mobile) (NNS phones) (NN system)))))) (. .)))
K/KC/KCN.xml,KCNRE00U,27207,193,,A,75,11,"Visitors are thoroughly searched before they are allowed in to the jail which houses two hundred remand prisoners, killers, I R A terrorists and rapists, and the investigation will examine whether a prison officer may have brought in the phone.","[Visitors/NNS, are/VBP, thoroughly/RB, searched/VBN, before/IN, they/PRP, are/VBP, allowed/VBN, in/IN, to/TO, the/DT, jail/NN, which/WDT, houses/VBZ, two/CD, hundred/CD, remand/NN, prisoners/NNS, ,/,, killers/NNS, ,/,, I/PRP, R/NN, A/DT, terrorists/NNS, and/CC, rapists/NNS, ,/,, and/CC, the/DT, investigation/NN, will/MD, examine/VB, whether/IN, a/DT, prison/NN, officer/NN, may/MD, have/VB, brought/VBN, in/IN, the/DT, phone/NN, ./.]","(ROOT (S (S (NP (NNS Visitors)) (VP (VBP are) (ADVP (RB thoroughly)) (VP (VBN searched) (SBAR (IN before) (S (NP (PRP they)) (VP (VBP are) (VP (VBN allowed) (PP (IN in) (PP (TO to) (NP (NP (DT the) (NN jail)) (SBAR (WHNP (WDT which)) (S (VP (VBZ houses) (NP (NP (QP (CD two) (CD hundred)) (NN remand) (NNS prisoners)) (, ,) (NP (NNS killers)))))))))))))))) (, ,) (S (NP (PRP I)) (NP (NP (NN R)) (NP (DT A) (NNS terrorists) (CC and) (NNS rapists)))) (, ,) (CC and) (S (NP (DT the) (NN investigation)) (VP (MD will) (VP (VB examine) (SBAR (IN whether) (S (NP (DT a) (NN prison) (NN officer)) (VP (MD may) (VP (VB have) (VP (VBN brought) (PP (IN in) (NP (DT the) (NN phone))))))))))) (. .)))"
K/KC/KCN.xml,KCNRE00U,27207,194,,A,75,12,One senior officer said  --,"[One/CD, senior/JJ, officer/NN, said/VBD, it/PRP, would/MD, be/VB, extremely/RB, difficult/JJ, to/TO, smuggle/VB, one/CD, in/IN, ,/,, security/NN, is/VBZ, so/RB, tight/JJ, here/RB, on/IN, visits/NNS, ./.]","(ROOT (S (S (NP (CD One) (JJ senior) (NN officer)) (VP (VBD said) (SBAR (S (NP (PRP it)) (VP (MD would) (VP (VB be) (ADJP (RB extremely) (JJ difficult) (S (VP (TO to) (VP (VB smuggle) (NP (CD one)) (PP (IN in)))))))))))) (, ,) (NP (NN security)) (VP (VBZ is) (ADJP (RB so) (JJ tight)) (ADVP (RB here)) (PP (IN on) (NP (NNS visits)))) (. .)))"
K/KC/KCN.xml,KCNRE00U,27207,195,,A,75,13,"--it would be extremely difficult to smuggle one in, security is so tight here on visits </reading> .","[One/CD, senior/JJ, officer/NN, said/VBD, it/PRP, would/MD, be/VB, extremely/RB, difficult/JJ, to/TO, smuggle/VB, one/CD, in/IN, ,/,, security/NN, is/VBZ, so/RB, tight/JJ, here/RB, on/IN, visits/NNS, ./.]","(ROOT (S (S (NP (CD One) (JJ senior) (NN officer)) (VP (VBD said) (SBAR (S (NP (PRP it)) (VP (MD would) (VP (VB be) (ADJP (RB extremely) (JJ difficult) (S (VP (TO to) (VP (VB smuggle) (NP (CD one)) (PP (IN in)))))))))))) (, ,) (NP (NN security)) (VP (VBZ is) (ADJP (RB so) (JJ tight)) (ADVP (RB here)) (PP (IN on) (NP (NNS visits)))) (. .)))"
K/KC/KCN.xml,KCNRE00U,27207,196,,A,75,14,"Oh well, there's always a lapse isn't there?","[Oh/UH, well/UH, ,/,, there/EX, 's/VBZ, always/RB, a/DT, lapse/NN, isn/NN, 't/PRP, there/EX, ?/.]","(ROOT (S (INTJ (UH Oh)) (INTJ (UH well)) (, ,) (NP (EX there)) (VP (VBZ 's) (ADVP (RB always)) (NP (NP (DT a) (NN lapse) (NN isn)) (NP (NP (PRP 't)) (NP (EX there))))) (. ?)))"
K/KC/KCN.xml,KCNRE00U,27207,197,,A,75,15,What time does this budget start today I wonder?,"[What/WDT, time/NN, does/VBZ, this/DT, budget/NN, start/NN, today/NN, I/PRP, wonder/VBP, ?/.]",(ROOT (SBARQ (WHNP (WDT What) (NN time)) (SQ (VP (VBZ does) (NP (NP (DT this) (NN budget) (NN start) (NN today)) (SBAR (S (NP (PRP I)) (VP (VBP wonder))))))) (. ?)))
K/KC/KCN.xml,KCNRE00U,27207,198,,A,75,16,Not that we've ,"[Not/RB, that/IN, we/PRP, 've/VBP]",(ROOT (SBAR (RB Not) (IN that) (S (NP (PRP we)) (VP (VBP 've)))))
K/KC/KCN.xml,KCNRE00U,27207,199,,B,76,1,What budget?,"[What/WDT, budget/NN, ?/.]",(ROOT (FRAG (WHNP (WDT What) (NP (NN budget))) (. ?)))
K/KC/KCN.xml,KCNRE00U,27207,200,,A,77,1,heard it all before.,"[heard/VBN, it/PRP, all/DT, before/RB, ./.]",(ROOT (S (VP (VBN heard) (NP (NP (PRP it)) (ADVP (DT all))) (ADVP (RB before))) (. .)))
K/KC/KCN.xml,KCNRE00U,27207,201,,B,78,1,What budget?,"[What/WDT, budget/NN, ?/.]",(ROOT (FRAG (WHNP (WDT What) (NP (NN budget))) (. ?)))
K/KC/KCN.xml,KCNRE00U,27207,202,,A,79,1,"This er, the labour giving their  --","[This/DT, er/NN, ,/,, the/DT, labour/NN, giving/VBG, their/PRP$, oh/NN, dear/RB]","(ROOT (FRAG (NP (NP (DT This) (NN er)) (, ,) (NP (NP (DT the) (NN labour)) (VP (VBG giving) (S (NP (PRP$ their) (NN oh)) (ADJP (RB dear))))))))"
