swda_filename,ptb_basename,conversation_no,transcript_index,act_tag,caller,turn_index,subutterance_index,text,pos,trees
K/KB/KBK.xml,KBKRE00A,2011,273,,A,157,1,"Well given that then, in that case she still can't ring the bank to find out what, how much she's now got in the account.","[Well/RB, given/VBN, that/IN, then/RB, ,/,, in/IN, that/DT, case/NN, she/PRP, still/RB, can/MD, 't/PRP, ring/VB, the/DT, bank/NN, to/TO, find/VB, out/RP, what/WP, ,/,, how/WRB, much/JJ, she/PRP, 's/VBZ, now/RB, got/VBN, in/IN, the/DT, account/NN, ./.]","(ROOT (S (VP (ADVP (RB Well)) (VBN given) (SBAR (IN that) (S (NP (RB then)) (, ,) (PP (IN in) (NP (DT that) (NN case))) (NP (PRP she)) (ADVP (RB still)) (VP (MD can) (NP (PRP 't)) (S (VP (VB ring) (NP (DT the) (NN bank)) (S (VP (TO to) (VP (VB find) (PRT (RP out)) (NP (WP what))))) (, ,) (SBAR (WHADJP (WRB how) (JJ much)) (S (NP (PRP she)) (VP (VBZ 's) (ADVP (RB now)) (VP (VBN got) (PP (IN in) (NP (DT the) (NN account))))))))))))) (. .)))"
K/KB/KBK.xml,KBKRE00A,2011,274,,B,158,1,Can't she?,"[Can/MD, 't/PRP, she/PRP, ?/.]",(ROOT (S (VP (MD Can) (VP (FRAG (NP (NP (PRP 't)) (NP (PRP she)))))) (. ?)))
K/KB/KBK.xml,KBKRE00A,2011,275,,B,158,2,Why not?,"[Why/WRB, not/RB, ?/.]",(ROOT (FRAG (WHADVP (WRB Why)) (NP (RB not)) (. ?)))
K/KB/KBK.xml,KBKRE00A,2011,276,,A,159,1,"Well she can do, but she can't do it from home.","[Well/RB, she/PRP, can/MD, do/VB, ,/,, but/CC, she/PRP, can/MD, 't/PRP, do/VB, it/PRP, from/IN, home/NN, ./.]","(ROOT (S (S (INTJ (RB Well)) (NP (PRP she)) (VP (MD can) (VP (VB do)))) (, ,) (CC but) (S (NP (PRP she)) (VP (MD can) (NP (PRP 't)) (S (VP (VB do) (NP (PRP it)) (PP (IN from) (NP (NN home))))))) (. .)))"
K/KB/KBK.xml,KBKRE00A,2011,277,,A,159,2,That's all.,"[That/DT, 's/VBZ, all/DT, ./.]",(ROOT (S (NP (DT That)) (VP (VBZ 's) (NP (DT all))) (. .)))
K/KB/KBK.xml,KBKRE00A,2011,278,,A,159,3,She won't be home.,"[She/PRP, won/VBD, 't/PRP, be/VB, home/NN, ./.]",(ROOT (S (NP (PRP She)) (VP (VBD won) (S (NP (PRP 't)) (VP (VB be) (NP (NN home))))) (. .)))
K/KB/KBK.xml,KBKRE00A,2011,279,,A,159,4,(()) will she?,"[will/MD, she/PRP, ?/.]",(ROOT (S (VP (MD will) (VP (NP (PRP she)))) (. ?)))
K/KB/KBK.xml,KBKRE00A,2011,280,,B,160,1,Banks open at nine don't they?,"[Banks/NNS, open/JJ, at/IN, nine/CD, don/NNP, 't/PRP, they/PRP, ?/.]",(ROOT (S (NP (NP (NNS Banks)) (ADJP (JJ open) (PP (IN at) (NP (CD nine))))) (VP (NNP don) (S (NP (PRP 't)) (NP (PRP they)))) (. ?)))
K/KB/KBK.xml,KBKRE00A,2011,281,,B,160,2,"I mean, not to the public but the office is.","[I/PRP, mean/VBP, ,/,, not/RB, to/TO, the/DT, public/JJ, but/CC, the/DT, office/NN, is/VBZ, ./.]","(ROOT (S (S (NP (PRP I)) (VP (VBP mean))) (, ,) (ADVP (RB not) (PP (TO to) (NP (DT the) (JJ public)))) (S (CC but) (NP (DT the) (NN office)) (VP (VBZ is))) (. .)))"
K/KB/KBK.xml,KBKRE00A,2011,282,,A,161,1,Yes.,"[Yes/UH, ./.]",(ROOT (INTJ (UH Yes) (. .)))
K/KB/KBK.xml,KBKRE00A,2011,283,,A,161,2,Anyway she's the one who 's  (()) find out ,"[Anyway/RB, she/PRP, 's/VBZ, the/DT, one/NN, who/WP, 's/VBZ, find/VB, out/RP]",(ROOT (FRAG (ADVP (RB Anyway)) (NP (NP (PRP she)) (SBAR (S (VP (VBZ 's) (NP (NP (DT the) (NN one)) (SBAR (WHNP (WP who)) (S (VP (VBZ 's) (VP (VB find) (PRT (RP out)))))))))))))
K/KB/KBK.xml,KBKRE00A,2011,284,,B,162,1,I mean anyway she'll be home again.,"[I/PRP, mean/VBP, anyway/RB, she/PRP, 'll/MD, be/VB, home/NN, again/RB, ./.]",(ROOT (S (NP (PRP I)) (VP (VBP mean) (S (ADVP (RB anyway)) (NP (PRP she)) (VP (MD 'll) (VP (VB be) (ADVP (NN home)) (ADVP (RB again)))))) (. .)))
K/KB/KBK.xml,KBKRE00A,2011,285,,A,163,1,Will she?,"[Will/MD, she/PRP, ?/.]",(ROOT (S (VP (MD Will) (VP (NP (PRP she)))) (. ?)))
K/KB/KBK.xml,KBKRE00A,2011,286,,B,164,1,She's only going for one class.,"[She/PRP, 's/VBZ, only/RB, going/VBG, for/IN, one/CD, class/NN, ./.]",(ROOT (S (NP (PRP She)) (VP (VBZ 's) (ADVP (RB only)) (VP (VBG going) (PP (IN for) (NP (CD one) (NN class))))) (. .)))
K/KB/KBK.xml,KBKRE00A,2011,287,,A,165,1,Mm.,"[Mm/NN, ./.]",(ROOT (NP (NN Mm) (. .)))
K/KB/KBK.xml,KBKRE00A,2011,288,,B,166,1,I mean she'll be home  (()) after lunch I imagine.,"[I/PRP, mean/VBP, she/PRP, 'll/MD, be/VB, home/NN, after/IN, lunch/NN, I/PRP, imagine/VBP, ./.]",(ROOT (S (S (NP (PRP I)) (VP (VBP mean) (SBAR (S (NP (PRP she)) (VP (MD 'll) (VP (VB be) (ADJP (ADVP (NN home) (IN after)) (NN lunch)))))))) (NP (PRP I)) (VP (VBP imagine)) (. .)))
K/KB/KBK.xml,KBKRE00A,2011,289,,A,167,1,Yes.,"[Yes/UH, ./.]",(ROOT (INTJ (UH Yes) (. .)))
K/KB/KBK.xml,KBKRE00A,2011,290,,A,167,2,Did you do anything about those tranquillisers?,"[Did/VBD, you/PRP, do/VBP, anything/NN, about/IN, those/DT, tranquillisers/NNS, ?/.]",(ROOT (S (VP (VBD Did) (SBAR (S (NP (PRP you)) (VP (VBP do) (NP (NP (NN anything)) (PP (IN about) (NP (DT those) (NNS tranquillisers)))))))) (. ?)))
K/KB/KBK.xml,KBKRE00A,2011,291,,B,168,1,What (()) ?,"[What/WDT, ?/.]",(ROOT (FRAG (WHNP (WDT What)) (. ?)))
K/KB/KBK.xml,KBKRE00A,2011,292,,A,169,1,"Lynda's got some, for Simon.","[Lynda/NNP, 's/POS, got/VBD, some/DT, ,/,, for/IN, Simon/NNP, ./.]","(ROOT (S (NP (NNP Lynda) (POS 's)) (VP (VBD got) (NP (DT some)) (, ,) (PP (IN for) (NP (NNP Simon)))) (. .)))"
K/KB/KBK.xml,KBKRE00A,2011,293,,A,169,2,For his driving test.,"[For/IN, his/PRP$, driving/VBG, test/NN, ./.]",(ROOT (FRAG (PP (IN For) (NP (PRP$ his) (VBG driving) (NN test))) (. .)))
K/KB/KBK.xml,KBKRE00A,2011,294,,B,170,1,I mentioned it to  (()) ,"[I/PRP, mentioned/VBD, it/PRP, to/TO]",(ROOT (S (NP (PRP I)) (VP (VBD mentioned) (NP (PRP it)) (PP (TO to)))))
K/KB/KBK.xml,KBKRE00A,2011,295,,A,171,1,Homeopathic ones.,"[Homeopathic/JJ, ones/NNS, ./.]",(ROOT (FRAG (NP (JJ Homeopathic) (NNS ones)) (. .)))
K/KB/KBK.xml,KBKRE00A,2011,296,,B,172,1,Well that's the kind I was after.,"[Well/RB, that/DT, 's/VBZ, the/DT, kind/NN, I/PRP, was/VBD, after/IN, ./.]",(ROOT (S (ADVP (RB Well)) (NP (DT that)) (VP (VBZ 's) (NP (NP (DT the) (NN kind)) (SBAR (S (NP (PRP I)) (VP (VBD was) (PP (IN after))))))) (. .)))
K/KB/KBK.xml,KBKRE00A,2011,297,,B,172,2,"Erm, I mentioned it to Suzannah.","[Erm/NN, ,/,, I/PRP, mentioned/VBD, it/PRP, to/TO, Suzannah/NNP, ./.]","(ROOT (S (NP (NN Erm)) (, ,) (NP (PRP I)) (VP (VBD mentioned) (NP (PRP it)) (PP (TO to) (NP (NNP Suzannah)))) (. .)))"
K/KB/KBK.xml,KBKRE00A,2011,298,,B,172,3,And she wasn't averse to the idea.,"[And/CC, she/PRP, wasn/VBD, 't/PRP, averse/JJ, to/TO, the/DT, idea/NN, ./.]",(ROOT (S (CC And) (NP (PRP she)) (VP (VBD wasn) (S (NP (PRP 't)) (ADJP (JJ averse) (PP (TO to) (NP (DT the) (NN idea)))))) (. .)))
K/KB/KBK.xml,KBKRE00A,2011,299,,B,172,4,But she said she doesn't need them for Monday because it's only when she takes the tests she gets in a panic not when she's  --,"[But/CC, she/PRP, said/VBD, she/PRP, doesn/VB, 't/PRP, need/VB, them/PRP, for/IN, Monday/NNP, because/IN, it/PRP, 's/VBZ, only/RB, when/WRB, she/PRP, takes/VBZ, the/DT, tests/NNS, she/PRP, gets/VBZ, in/IN, a/DT, panic/NN, not/RB, when/WRB, she/PRP, 's/VBZ, she/PRP, said/VBD, she/PRP, can/MD, do/VB, it/PRP, in/IN, the/DT, practice/NN, classes/NNS, ./.]",(ROOT (S (CC But) (NP (PRP she)) (VP (VBD said) (S (NP (PRP she)) (VP (VB doesn) (S (NP (PRP 't)) (VP (VB need) (NP (PRP them)) (PP (IN for) (NP (NNP Monday))))))) (SBAR (IN because) (S (NP (PRP it)) (VP (VBZ 's) (ADVP (RB only)) (SBAR (WHADVP (WRB when)) (S (NP (PRP she)) (VP (VBZ takes) (NP (NP (DT the) (NNS tests)) (SBAR (S (NP (PRP she)) (VP (VBZ gets) (PP (IN in) (NP (NP (DT a) (NN panic)) (SBAR (WHADVP (RB not) (WRB when)) (S (NP (PRP she)) (VP (VBZ 's) (SBAR (S (NP (PRP she)) (VP (VBD said) (SBAR (S (NP (PRP she)) (VP (MD can) (VP (VB do) (NP (PRP it)) (PP (IN in) (NP (DT the) (NN practice) (NNS classes)))))))))))))))))))))))))) (. .)))
K/KB/KBK.xml,KBKRE00A,2011,300,,B,172,5,--she said she can do it in the practice classes.,"[But/CC, she/PRP, said/VBD, she/PRP, doesn/VB, 't/PRP, need/VB, them/PRP, for/IN, Monday/NNP, because/IN, it/PRP, 's/VBZ, only/RB, when/WRB, she/PRP, takes/VBZ, the/DT, tests/NNS, she/PRP, gets/VBZ, in/IN, a/DT, panic/NN, not/RB, when/WRB, she/PRP, 's/VBZ, she/PRP, said/VBD, she/PRP, can/MD, do/VB, it/PRP, in/IN, the/DT, practice/NN, classes/NNS, ./.]",(ROOT (S (CC But) (NP (PRP she)) (VP (VBD said) (S (NP (PRP she)) (VP (VB doesn) (S (NP (PRP 't)) (VP (VB need) (NP (PRP them)) (PP (IN for) (NP (NNP Monday))))))) (SBAR (IN because) (S (NP (PRP it)) (VP (VBZ 's) (ADVP (RB only)) (SBAR (WHADVP (WRB when)) (S (NP (PRP she)) (VP (VBZ takes) (NP (NP (DT the) (NNS tests)) (SBAR (S (NP (PRP she)) (VP (VBZ gets) (PP (IN in) (NP (NP (DT a) (NN panic)) (SBAR (WHADVP (RB not) (WRB when)) (S (NP (PRP she)) (VP (VBZ 's) (SBAR (S (NP (PRP she)) (VP (VBD said) (SBAR (S (NP (PRP she)) (VP (MD can) (VP (VB do) (NP (PRP it)) (PP (IN in) (NP (DT the) (NN practice) (NNS classes)))))))))))))))))))))))))) (. .)))
K/KB/KBK.xml,KBKRE00A,2011,301,,A,173,1,Right.,"[Right/NN, ./.]",(ROOT (INTJ (NN Right) (. .)))
K/KB/KBK.xml,KBKRE00A,2011,302,,B,174,1,"What she needs, lots of practice with different, not all on one man like before","[What/WP, she/PRP, needs/VBZ, ,/,, lots/NNS, of/IN, practice/NN, with/IN, different/JJ, ,/,, not/RB, all/DT, on/IN, one/CD, man/NN, like/IN, before/IN]","(ROOT (SBAR (WHNP (WP What)) (S (NP (PRP she)) (VP (VBZ needs) (, ,) (NP (NP (NNS lots)) (PP (IN of) (NP (NP (NN practice)) (PP (PP (IN with) (ADJP (JJ different))) (, ,) (RB not) (ADVP (DT all)) (PP (IN on) (NP (CD one) (NN man))))))) (PP (IN like) (PP (IN before)))))))"
K/KB/KBK.xml,KBKRE00A,2011,303,,A,175,1,Yes.,"[Yes/UH, ./.]",(ROOT (INTJ (UH Yes) (. .)))
K/KB/KBK.xml,KBKRE00A,2011,304,,B,176,1,but a new person each time  (()) skill ,"[but/CC, a/DT, new/JJ, person/NN, each/DT, time/NN, skill/NN]",(ROOT (FRAG (PP (CC but) (NP (DT a) (JJ new) (NN person))) (NP (DT each) (NN time) (NN skill))))
K/KB/KBK.xml,KBKRE00A,2011,305,,A,177,1,"I, I doubt whether she's been properly taught on the subject quite frankly.","[I/PRP, ,/,, I/PRP, doubt/VBP, whether/IN, she/PRP, 's/VBZ, been/VBN, properly/RB, taught/VBN, on/IN, the/DT, subject/JJ, quite/RB, frankly/RB, ./.]","(ROOT (S (NP (PRP I)) (, ,) (NP (PRP I)) (VP (VBP doubt) (SBAR (IN whether) (S (NP (PRP she)) (VP (VBZ 's) (VP (VBN been) (VP (ADVP (RB properly)) (VBN taught) (PP (IN on) (NP (DT the) (ADJP (JJ subject) (RB quite))) (ADVP (RB frankly))))))))) (. .)))"
K/KB/KBK.xml,KBKRE00A,2011,306,,B,178,1,I mean other girls have passed.,"[I/PRP, mean/VBP, other/JJ, girls/NNS, have/VBP, passed/VBN, ./.]",(ROOT (S (NP (PRP I)) (VP (VBP mean) (SBAR (S (NP (JJ other) (NNS girls)) (VP (VBP have) (VP (VBN passed)))))) (. .)))
K/KB/KBK.xml,KBKRE00A,2011,307,,A,179,1,"Yes, yes.","[Yes/UH, ,/,, yes/UH, ./.]","(ROOT (INTJ (INTJ (UH Yes)) (, ,) (INTJ (UH yes) (. .))))"
K/KB/KBK.xml,KBKRE00A,2011,308,,B,180,1,And she likes Karen.,"[And/CC, she/PRP, likes/VBZ, Karen/NNP, ./.]",(ROOT (S (CC And) (NP (PRP she)) (VP (VBZ likes) (NP (NNP Karen))) (. .)))
K/KB/KBK.xml,KBKRE00A,2011,309,,B,180,2,Very much.,"[Very/RB, much/RB, ./.]",(ROOT (FRAG (ADVP (RB Very)) (NP (RB much)) (. .)))
K/KB/KBK.xml,KBKRE00A,2011,310,,A,181,1,Her teacher for (()) ?,"[Her/PRP$, teacher/NN, for/IN, ?/.]",(ROOT (NP (NP (PRP$ Her) (NN teacher)) (PP (IN for)) (. ?)))
K/KB/KBK.xml,KBKRE00A,2011,311,,B,182,1,Yes.,"[Yes/UH, ./.]",(ROOT (INTJ (UH Yes) (. .)))
K/KB/KBK.xml,KBKRE00A,2011,312,,A,183,1,"Oh, I","[Oh/UH, ,/,, I/PRP]","(ROOT (FRAG (INTJ (UH Oh)) (, ,) (NP (PRP I))))"
K/KB/KBK.xml,KBKRE00A,2011,313,,B,184,1,She's a young girl.,"[She/PRP, 's/VBZ, a/DT, young/JJ, girl/NN, ./.]",(ROOT (S (NP (PRP She)) (VP (VBZ 's) (NP (DT a) (JJ young) (NN girl))) (. .)))
K/KB/KBK.xml,KBKRE00A,2011,314,,A,185,1,Really?,"[Really/RB, ?/.]",(ROOT (FRAG (ADVP (RB Really)) (. ?)))
K/KB/KBK.xml,KBKRE00A,2011,315,,B,186,1,And she likes her very much and erm  --,"[And/CC, she/PRP, likes/VBZ, her/PRP$, very/RB, much/JJ, and/CC, erm/NN, I/PRP, told/VBD, you/PRP, she/PRP, by/IN, chance/NN, ./.]",(ROOT (S (CC And) (NP (PRP she)) (VP (VBZ likes) (NP (PRP$ her)) (UCP (ADJP (RB very) (JJ much)) (CC and) (NP (NP (NN erm)) (SBAR (S (NP (PRP I)) (VP (VBD told) (S (NP (PRP you)) (NP (PRP she))) (PP (IN by) (NP (NN chance))))))))) (. .)))
K/KB/KBK.xml,KBKRE00A,2011,316,,B,186,2,--I told you she  (()) by chance (()) .,"[And/CC, she/PRP, likes/VBZ, her/PRP$, very/RB, much/JJ, and/CC, erm/NN, I/PRP, told/VBD, you/PRP, she/PRP, by/IN, chance/NN, ./.]",(ROOT (S (CC And) (NP (PRP she)) (VP (VBZ likes) (NP (PRP$ her)) (UCP (ADJP (RB very) (JJ much)) (CC and) (NP (NP (NN erm)) (SBAR (S (NP (PRP I)) (VP (VBD told) (S (NP (PRP you)) (NP (PRP she))) (PP (IN by) (NP (NN chance))))))))) (. .)))
K/KB/KBK.xml,KBKRE00A,2011,317,,A,187,1,"Yes, indeed.","[Yes/UH, ,/,, indeed/RB, ./.]","(ROOT (FRAG (INTJ (UH Yes)) (, ,) (ADVP (RB indeed)) (. .)))"
K/KB/KBK.xml,KBKRE00A,2011,318,,B,188,1,And she spoke very highly of Suzannah.,"[And/CC, she/PRP, spoke/VBD, very/RB, highly/RB, of/IN, Suzannah/NNP, ./.]",(ROOT (S (CC And) (NP (PRP she)) (VP (VBD spoke) (ADJP (RB very) (RB highly) (PP (IN of) (NP (NNP Suzannah))))) (. .)))
K/KB/KBK.xml,KBKRE00A,2011,319,,A,189,1,Oh.,"[Oh/UH, ./.]",(ROOT (INTJ (UH Oh) (. .)))
K/KB/KBK.xml,KBKRE00A,2011,320,,B,190,1,And said what a nice girl she was and what a good student and  --,"[And/CC, said/VBD, what/WP, a/DT, nice/JJ, girl/NN, she/PRP, was/VBD, and/CC, what/WP, a/DT, good/JJ, student/NN, and/CC, Suzannah/NNP, said/VBD, oh/UH, that/DT, 's/VBZ, cos/NN, I/PRP, won/VBD, that/DT, make/VBP, up/RP, competition/NN, ./.]",(ROOT (S (CC And) (VP (VBD said) (SBAR (SBAR (WHNP (WP what) (DT a) (JJ nice) (NN girl)) (S (NP (PRP she)) (VP (VBD was)))) (CC and) (SBAR (WHNP (WP what)) (S (NP (NP (DT a) (JJ good) (NN student)) (CC and) (NP (NNP Suzannah))) (VP (VBD said) (SBAR (S (INTJ (UH oh)) (NP (DT that)) (VP (VBZ 's) (NP (NP (NN cos)) (SBAR (S (NP (PRP I)) (VP (VBD won) (SBAR (S (NP (DT that)) (VP (VBP make) (PRT (RP up)) (NP (NN competition))))))))))))))))) (. .)))
K/KB/KBK.xml,KBKRE00A,2011,321,,B,190,2,--Suzannah said oh that's cos I won that make up competition.,"[And/CC, said/VBD, what/WP, a/DT, nice/JJ, girl/NN, she/PRP, was/VBD, and/CC, what/WP, a/DT, good/JJ, student/NN, and/CC, Suzannah/NNP, said/VBD, oh/UH, that/DT, 's/VBZ, cos/NN, I/PRP, won/VBD, that/DT, make/VBP, up/RP, competition/NN, ./.]",(ROOT (S (CC And) (VP (VBD said) (SBAR (SBAR (WHNP (WP what) (DT a) (JJ nice) (NN girl)) (S (NP (PRP she)) (VP (VBD was)))) (CC and) (SBAR (WHNP (WP what)) (S (NP (NP (DT a) (JJ good) (NN student)) (CC and) (NP (NNP Suzannah))) (VP (VBD said) (SBAR (S (INTJ (UH oh)) (NP (DT that)) (VP (VBZ 's) (NP (NP (NN cos)) (SBAR (S (NP (PRP I)) (VP (VBD won) (SBAR (S (NP (DT that)) (VP (VBP make) (PRT (RP up)) (NP (NN competition))))))))))))))))) (. .)))
K/KB/KBK.xml,KBKRE00A,2011,322,,A,191,1,"<laugh> Right, I should get on.","[Right/NN, ,/,, I/PRP, should/MD, get/VB, on/IN, ./.]","(ROOT (S (NP (NN Right)) (, ,) (NP (PRP I)) (VP (MD should) (VP (VB get) (PP (IN on)))) (. .)))"
