swda_filename,ptb_basename,conversation_no,transcript_index,act_tag,caller,turn_index,subutterance_index,text,pos,trees
K/KC/KCF.xml,KCFRE001,28002,0,,A,1,1,Yeah but I'm saying they're not paying  --,"[Yeah/UH, but/CC, I/PRP, 'm/VBP, saying/VBG, they/PRP, 're/VBP, not/RB, paying/VBG, they/PRP, haven/NN, 't/PRP, gotta/NNP, pay/NN, for/IN, that/DT, machine/NN, ./.]",(ROOT (SINV (S (INTJ (UH Yeah)) (NP (CC but)) (ADVP (PRP I)) (VP (VBP 'm) (VP (VBG saying) (NP (PRP they))))) (VP (VBP 're) (RB not) (VP (VBG paying) (NP (PRP they) (NN haven)) (NP (PRP 't)))) (NP (NP (NNP gotta) (NN pay)) (PP (IN for) (NP (DT that) (NN machine)))) (. .)))
K/KC/KCF.xml,KCFRE001,28002,1,,A,1,2,--they haven't gotta pay for that machine.,"[Yeah/UH, but/CC, I/PRP, 'm/VBP, saying/VBG, they/PRP, 're/VBP, not/RB, paying/VBG, they/PRP, haven/NN, 't/PRP, gotta/NNP, pay/NN, for/IN, that/DT, machine/NN, ./.]",(ROOT (SINV (S (INTJ (UH Yeah)) (NP (CC but)) (ADVP (PRP I)) (VP (VBP 'm) (VP (VBG saying) (NP (PRP they))))) (VP (VBP 're) (RB not) (VP (VBG paying) (NP (PRP they) (NN haven)) (NP (PRP 't)))) (NP (NP (NNP gotta) (NN pay)) (PP (IN for) (NP (DT that) (NN machine)))) (. .)))
K/KC/KCF.xml,KCFRE001,28002,2,,B,2,1,Who hasn't gotta pay for the machine?,"[Who/WP, hasn/VBP, 't/PRP, gotta/NNP, pay/NN, for/IN, the/DT, machine/NN, ?/.]",(ROOT (SBARQ (WHNP (WP Who)) (SQ (VP (VBP hasn) (S (NP (PRP 't)) (NP (NP (NNP gotta) (NN pay)) (PP (IN for) (NP (DT the) (NN machine))))))) (. ?)))
K/KC/KCF.xml,KCFRE001,28002,3,,A,3,1,"Well if they're doing, somebody by hand's doing it, they haven't got that  (()) of paying for that machine.","[Well/RB, if/IN, they/PRP, 're/VBP, doing/VBG, ,/,, somebody/NN, by/IN, hand/NN, 's/POS, doing/VBG, it/PRP, ,/,, they/PRP, haven/NN, 't/PRP, got/VBD, that/IN, of/IN, paying/VBG, for/IN, that/DT, machine/NN, ./.]","(ROOT (S (SBAR (ADVP (RB Well)) (IN if) (S (NP (PRP they)) (VP (VBP 're) (VP (VBG doing) (, ,) (PP (NP (NN somebody)) (IN by) (NP (NP (NN hand) (POS 's)) (VP (VBG doing) (NP (PRP it))))))))) (, ,) (NP (PRP they)) (VP (NN haven) (SBAR (S (NP (PRP 't)) (VP (VBD got) (ADVP (IN that)) (PP (IN of) (S (VP (VBG paying) (PP (IN for) (NP (DT that) (NN machine)))))))))) (. .)))"
K/KC/KCF.xml,KCFRE001,28002,4,,B,4,1,Yeah but  --,"[Yeah/UH, but/CC, the/DT, machine/NN, could/MD, do/VB, what/WP, a/DT, hundred/CD, people/NNS, could/MD, do/VB, in/IN, a/DT, day/NN, ,/,, can/MD, 't/PRP, it/PRP, ?/.]","(ROOT (SINV (S (INTJ (UH Yeah)) (NP (CC but)) (ADVP (DT the) (NN machine)) (VP (MD could) (VP (VB do) (SBAR (WHNP (WP what)) (S (NP (DT a) (CD hundred) (NNS people)) (VP (MD could) (VP (VB do) (PP (IN in) (NP (DT a) (NN day)))))))))) (, ,) (VP (MD can)) (NP (NP (PRP 't)) (NP (PRP it))) (. ?)))"
K/KC/KCF.xml,KCFRE001,28002,5,,B,4,2,"--the machine could do what a hundred people could do in a day, can't it?","[Yeah/UH, but/CC, the/DT, machine/NN, could/MD, do/VB, what/WP, a/DT, hundred/CD, people/NNS, could/MD, do/VB, in/IN, a/DT, day/NN, ,/,, can/MD, 't/PRP, it/PRP, ?/.]","(ROOT (SINV (S (INTJ (UH Yeah)) (NP (CC but)) (ADVP (DT the) (NN machine)) (VP (MD could) (VP (VB do) (SBAR (WHNP (WP what)) (S (NP (DT a) (CD hundred) (NNS people)) (VP (MD could) (VP (VB do) (PP (IN in) (NP (DT a) (NN day)))))))))) (, ,) (VP (MD can)) (NP (NP (PRP 't)) (NP (PRP it))) (. ?)))"
K/KC/KCF.xml,KCFRE001,28002,6,,B,4,3,The machine doesn't get tired like people do.,"[The/DT, machine/NN, doesn/NN, 't/PRP, get/VBP, tired/VBN, like/IN, people/NNS, do/VBP, ./.]",(ROOT (S (NP (NP (DT The) (NN machine) (NN doesn)) (SBAR (S (NP (PRP 't)) (VP (VBP get) (ADJP (VBN tired) (PP (IN like) (NP (NNS people)))))))) (VP (VBP do)) (. .)))
K/KC/KCF.xml,KCFRE001,28002,7,,A,5,1,Yeah but I mean,"[Yeah/UH, but/CC, I/PRP, mean/VBP]",(ROOT (SBARQ (WHADVP (UH Yeah)) (S (CC but) (NP (PRP I)) (VP (VBP mean)))))
K/KC/KCF.xml,KCFRE001,28002,8,,B,6,1,The peo- the machine only goes off bad if somebody hasn't been maintaining it.,"[The/DT, peo-/JJ, the/DT, machine/NN, only/RB, goes/VBZ, off/RB, bad/JJ, if/IN, somebody/NN, hasn/NN, 't/PRP, been/VBN, maintaining/VBG, it/PRP, ./.]",(ROOT (S (NP (DT The) (JJ peo-)) (ADVP (NP (DT the) (NN machine)) (RB only)) (VP (VBZ goes) (S (ADJP (RB off) (JJ bad) (PP (IN if) (NP (NN somebody) (NN hasn)))) (NP (NP (PRP 't)) (VP (VBN been) (VP (VBG maintaining) (NP (PRP it))))))) (. .)))
K/KC/KCF.xml,KCFRE001,28002,9,,B,6,2,"And all you've gotta do is, with machine is put petrol or diesel or whatever it is to make  (()) and check all the oil ","[And/CC, all/DT, you/PRP, 've/VBP, gotta/NNP, do/VBP, is/VBZ, ,/,, with/IN, machine/NN, is/VBZ, put/VBN, petrol/NN, or/CC, diesel/NN, or/CC, whatever/WDT, it/PRP, is/VBZ, to/TO, make/VB, and/CC, check/VB, all/PDT, the/DT, oil/NN]","(ROOT (S (CC And) (NP (DT all) (PRP you)) (VP (VBP 've) (NP (NP (NNP gotta)) (SBAR (S (VP (VBP do) (SBAR (S (VP (VBZ is) (, ,) (PP (IN with) (NP (NN machine))) (SBAR (SBAR (S (VP (VBZ is) (VP (VBN put) (NP (NN petrol) (CC or) (NN diesel)))))) (CC or) (SBAR (WHNP (WDT whatever)) (S (NP (PRP it)) (VP (VBZ is) (S (VP (TO to) (VP (VB make) (CC and) (VB check) (NP (PDT all) (DT the) (NN oil)))))))))))))))))))"
K/KC/KCF.xml,KCFRE001,28002,10,,A,7,1,And  (()) ,[And/CC],(ROOT (NP (CC And)))
K/KC/KCF.xml,KCFRE001,28002,11,,B,8,1,I know  (()) but  --,"[I/PRP, know/VBP, but/CC, that/IN, offsets/NNS, the/DT, labour/NN, is/VBZ, the/DT, ,/,, labour/NN, is/VBZ, the/DT, thing/NN, that/WDT, costs/VBZ, a/DT, fortune/NN, ./.]","(ROOT (S (S (NP (PRP I)) (VP (VBP know))) (CC but) (S (SBAR (IN that) (S (NP (NP (NNS offsets)) (NP (DT the) (NN labour))) (VP (VBZ is) (NP (DT the))))) (, ,) (NP (NN labour)) (VP (VBZ is) (NP (NP (DT the) (NN thing)) (SBAR (WHNP (WDT that)) (S (VP (VBZ costs) (NP (DT a) (NN fortune)))))))) (. .)))"
K/KC/KCF.xml,KCFRE001,28002,12,,B,8,2,--that offsets  --,"[I/PRP, know/VBP, but/CC, that/IN, offsets/NNS, the/DT, labour/NN, is/VBZ, the/DT, ,/,, labour/NN, is/VBZ, the/DT, thing/NN, that/WDT, costs/VBZ, a/DT, fortune/NN, ./.]","(ROOT (S (S (NP (PRP I)) (VP (VBP know))) (CC but) (S (SBAR (IN that) (S (NP (NP (NNS offsets)) (NP (DT the) (NN labour))) (VP (VBZ is) (NP (DT the))))) (, ,) (NP (NN labour)) (VP (VBZ is) (NP (NP (DT the) (NN thing)) (SBAR (WHNP (WDT that)) (S (VP (VBZ costs) (NP (DT a) (NN fortune)))))))) (. .)))"
K/KC/KCF.xml,KCFRE001,28002,13,,B,8,3,"--the labour is the, labour is the thing that costs a fortune.","[I/PRP, know/VBP, but/CC, that/IN, offsets/NNS, the/DT, labour/NN, is/VBZ, the/DT, ,/,, labour/NN, is/VBZ, the/DT, thing/NN, that/WDT, costs/VBZ, a/DT, fortune/NN, ./.]","(ROOT (S (S (NP (PRP I)) (VP (VBP know))) (CC but) (S (SBAR (IN that) (S (NP (NP (NNS offsets)) (NP (DT the) (NN labour))) (VP (VBZ is) (NP (DT the))))) (, ,) (NP (NN labour)) (VP (VBZ is) (NP (NP (DT the) (NN thing)) (SBAR (WHNP (WDT that)) (S (VP (VBZ costs) (NP (DT a) (NN fortune)))))))) (. .)))"
K/KC/KCF.xml,KCFRE001,28002,14,,A,9,1,(()) ,[],
K/KC/KCF.xml,KCFRE001,28002,15,,B,10,1,Yeah.,"[Yeah/UH, ./.]",(ROOT (INTJ (UH Yeah) (. .)))
K/KC/KCF.xml,KCFRE001,28002,16,,A,11,1,Well why don't you do it all before  (()) and  (()) ,"[Well/RB, why/WRB, don/NNP, 't/PRP, you/PRP, do/VBP, it/PRP, all/DT, before/RB, and/CC]",(ROOT (FRAG (ADVP (RB Well)) (SBAR (WHADVP (WRB why) (NP (NP (NNP don)) (NP (PRP 't)))) (S (NP (PRP you)) (VP (VBP do) (NP (PRP it)) (ADVP (DT all) (RB before)) (ADVP (CC and)))))))
K/KC/KCF.xml,KCFRE001,28002,17,,B,12,1,Well they do.,"[Well/RB, they/PRP, do/VBP, ./.]",(ROOT (S (ADVP (RB Well)) (NP (PRP they)) (VP (VBP do)) (. .)))
K/KC/KCF.xml,KCFRE001,28002,18,,B,12,2,(()) and they've got it in but  --,"[and/CC, they/PRP, 've/VBP, got/VBD, it/PRP, in/IN, but/CC, it/PRP, wants/VBZ, it/PRP, at/IN, different/JJ, times/NNS, doesn/VBP, 't/PRP, it/PRP, ?/.]",(ROOT (SINV (S (S (CC and) (NP (PRP they)) (VP (VBP 've) (VP (VBD got) (NP (PRP it)) (PP (IN in))))) (CC but) (S (NP (PRP it)) (VP (VBZ wants) (NP (PRP it)) (PP (IN at) (NP (JJ different) (NNS times)))))) (VP (VBP doesn) (NP (PRP 't))) (NP (PRP it)) (. ?)))
K/KC/KCF.xml,KCFRE001,28002,19,,B,12,3,--it wants it at different times doesn't it?,"[and/CC, they/PRP, 've/VBP, got/VBD, it/PRP, in/IN, but/CC, it/PRP, wants/VBZ, it/PRP, at/IN, different/JJ, times/NNS, doesn/VBP, 't/PRP, it/PRP, ?/.]",(ROOT (SINV (S (S (CC and) (NP (PRP they)) (VP (VBP 've) (VP (VBD got) (NP (PRP it)) (PP (IN in))))) (CC but) (S (NP (PRP it)) (VP (VBZ wants) (NP (PRP it)) (PP (IN at) (NP (JJ different) (NNS times)))))) (VP (VBP doesn) (NP (PRP 't))) (NP (PRP it)) (. ?)))
K/KC/KCF.xml,KCFRE001,28002,20,,B,12,4,So you can't give it fertiliser.,"[So/RB, you/PRP, can/MD, 't/PRP, give/VB, it/PRP, fertiliser/NN, ./.]",(ROOT (S (RB So) (NP (PRP you)) (VP (MD can) (NP (PRP 't)) (S (VP (VB give) (NP (PRP it)) (NP (NN fertiliser))))) (. .)))
K/KC/KCF.xml,KCFRE001,28002,21,,A,13,1,Well I still think that  --,"[Well/RB, I/PRP, still/RB, think/VBP, that/IN, well/RB, say/VBP, you/PRP, have/VB, a/DT, big/JJ, massive/JJ, thing/NN, and/CC, ,/,, and/CC, say/VB, it/PRP, 'd/MD, take/VB, a/DT, hundred/CD, people/NNS, mm/JJ, er/NN, I/PRP, suppose/VBP, the/DT, bigger/JJR, it/PRP, is/VBZ, the/DT, more/RBR, economical/JJ, it/PRP, is/VBZ, ./.]","(ROOT (S (ADVP (RB Well)) (NP (PRP I)) (VP (ADVP (RB still)) (VBP think) (SBAR (IN that) (S (ADVP (RB well)) (VP (VBP say) (S (S (NP (PRP you)) (VP (VB have) (NP (DT a) (JJ big) (JJ massive) (NN thing)))) (CC and) (, ,) (CC and) (S (INTJ (VB say)) (NP (PRP it)) (VP (MD 'd) (VP (VB take) (NP (NP (DT a) (ADJP (NP (CD hundred) (NNS people)) (JJ mm)) (NN er)) (SBAR (S (NP (PRP I)) (VP (VBP suppose) (SBAR (S (SBAR (X (DT the) (JJR bigger)) (S (NP (PRP it)) (VP (VBZ is) (NP (DT the) (ADJP (RBR more) (JJ economical)))))) (NP (PRP it)) (VP (VBZ is)))))))))))))))) (. .)))"
K/KC/KCF.xml,KCFRE001,28002,22,,A,13,2,"--well say you have a big massive thing and, and say it'd take  --","[Well/RB, I/PRP, still/RB, think/VBP, that/IN, well/RB, say/VBP, you/PRP, have/VB, a/DT, big/JJ, massive/JJ, thing/NN, and/CC, ,/,, and/CC, say/VB, it/PRP, 'd/MD, take/VB, a/DT, hundred/CD, people/NNS, mm/JJ, er/NN, I/PRP, suppose/VBP, the/DT, bigger/JJR, it/PRP, is/VBZ, the/DT, more/RBR, economical/JJ, it/PRP, is/VBZ, ./.]","(ROOT (S (ADVP (RB Well)) (NP (PRP I)) (VP (ADVP (RB still)) (VBP think) (SBAR (IN that) (S (ADVP (RB well)) (VP (VBP say) (S (S (NP (PRP you)) (VP (VB have) (NP (DT a) (JJ big) (JJ massive) (NN thing)))) (CC and) (, ,) (CC and) (S (INTJ (VB say)) (NP (PRP it)) (VP (MD 'd) (VP (VB take) (NP (NP (DT a) (ADJP (NP (CD hundred) (NNS people)) (JJ mm)) (NN er)) (SBAR (S (NP (PRP I)) (VP (VBP suppose) (SBAR (S (SBAR (X (DT the) (JJR bigger)) (S (NP (PRP it)) (VP (VBZ is) (NP (DT the) (ADJP (RBR more) (JJ economical)))))) (NP (PRP it)) (VP (VBZ is)))))))))))))))) (. .)))"
K/KC/KCF.xml,KCFRE001,28002,23,,A,13,3,--a hundred people  --,"[Well/RB, I/PRP, still/RB, think/VBP, that/IN, well/RB, say/VBP, you/PRP, have/VB, a/DT, big/JJ, massive/JJ, thing/NN, and/CC, ,/,, and/CC, say/VB, it/PRP, 'd/MD, take/VB, a/DT, hundred/CD, people/NNS, mm/JJ, er/NN, I/PRP, suppose/VBP, the/DT, bigger/JJR, it/PRP, is/VBZ, the/DT, more/RBR, economical/JJ, it/PRP, is/VBZ, ./.]","(ROOT (S (ADVP (RB Well)) (NP (PRP I)) (VP (ADVP (RB still)) (VBP think) (SBAR (IN that) (S (ADVP (RB well)) (VP (VBP say) (S (S (NP (PRP you)) (VP (VB have) (NP (DT a) (JJ big) (JJ massive) (NN thing)))) (CC and) (, ,) (CC and) (S (INTJ (VB say)) (NP (PRP it)) (VP (MD 'd) (VP (VB take) (NP (NP (DT a) (ADJP (NP (CD hundred) (NNS people)) (JJ mm)) (NN er)) (SBAR (S (NP (PRP I)) (VP (VBP suppose) (SBAR (S (SBAR (X (DT the) (JJR bigger)) (S (NP (PRP it)) (VP (VBZ is) (NP (DT the) (ADJP (RBR more) (JJ economical)))))) (NP (PRP it)) (VP (VBZ is)))))))))))))))) (. .)))"
K/KC/KCF.xml,KCFRE001,28002,24,,A,13,4,--mm er I suppose the bigger it is the more economical it is.,"[Well/RB, I/PRP, still/RB, think/VBP, that/IN, well/RB, say/VBP, you/PRP, have/VB, a/DT, big/JJ, massive/JJ, thing/NN, and/CC, ,/,, and/CC, say/VB, it/PRP, 'd/MD, take/VB, a/DT, hundred/CD, people/NNS, mm/JJ, er/NN, I/PRP, suppose/VBP, the/DT, bigger/JJR, it/PRP, is/VBZ, the/DT, more/RBR, economical/JJ, it/PRP, is/VBZ, ./.]","(ROOT (S (ADVP (RB Well)) (NP (PRP I)) (VP (ADVP (RB still)) (VBP think) (SBAR (IN that) (S (ADVP (RB well)) (VP (VBP say) (S (S (NP (PRP you)) (VP (VB have) (NP (DT a) (JJ big) (JJ massive) (NN thing)))) (CC and) (, ,) (CC and) (S (INTJ (VB say)) (NP (PRP it)) (VP (MD 'd) (VP (VB take) (NP (NP (DT a) (ADJP (NP (CD hundred) (NNS people)) (JJ mm)) (NN er)) (SBAR (S (NP (PRP I)) (VP (VBP suppose) (SBAR (S (SBAR (X (DT the) (JJR bigger)) (S (NP (PRP it)) (VP (VBZ is) (NP (DT the) (ADJP (RBR more) (JJ economical)))))) (NP (PRP it)) (VP (VBZ is)))))))))))))))) (. .)))"
K/KC/KCF.xml,KCFRE001,28002,25,,A,13,5,But if you only had a small place it'd be more economical to have labour than it would to buy  --,"[But/CC, if/IN, you/PRP, only/RB, had/VBD, a/DT, small/JJ, place/NN, it/PRP, 'd/MD, be/VB, more/RBR, economical/JJ, to/TO, have/VB, labour/NN, than/IN, it/PRP, would/MD, to/TO, buy/VB, paying/VBG, out/IN, thousands/NNS, of/IN, pounds/NNS, for/IN, machines/NNS, and/CC]",(ROOT (FRAG (CC But) (PP (IN if) (NP (NP (NP (PRP you)) (RB only) (SBAR (S (VP (VBD had) (NP (NP (DT a) (JJ small) (NN place)) (SBAR (S (NP (PRP it)) (VP (MD 'd) (VP (VB be) (ADJP (RBR more) (JJ economical) (S (VP (TO to) (VP (VB have) (NP (NN labour)) (SBAR (IN than) (S (NP (PRP it)) (VP (MD would) (S (VP (TO to) (VP (VB buy)))))))))))))))))))) (VP (VBG paying) (NP (NP (IN out) (NNS thousands)) (PP (IN of) (NP (NP (NNS pounds)) (PP (IN for) (NP (NNS machines)))))) (CC and))))))
K/KC/KCF.xml,KCFRE001,28002,26,,A,13,6,--paying out thousands of pounds for machines and ,"[But/CC, if/IN, you/PRP, only/RB, had/VBD, a/DT, small/JJ, place/NN, it/PRP, 'd/MD, be/VB, more/RBR, economical/JJ, to/TO, have/VB, labour/NN, than/IN, it/PRP, would/MD, to/TO, buy/VB, paying/VBG, out/IN, thousands/NNS, of/IN, pounds/NNS, for/IN, machines/NNS, and/CC]",(ROOT (FRAG (CC But) (PP (IN if) (NP (NP (NP (PRP you)) (RB only) (SBAR (S (VP (VBD had) (NP (NP (DT a) (JJ small) (NN place)) (SBAR (S (NP (PRP it)) (VP (MD 'd) (VP (VB be) (ADJP (RBR more) (JJ economical) (S (VP (TO to) (VP (VB have) (NP (NN labour)) (SBAR (IN than) (S (NP (PRP it)) (VP (MD would) (S (VP (TO to) (VP (VB buy)))))))))))))))))))) (VP (VBG paying) (NP (NP (IN out) (NNS thousands)) (PP (IN of) (NP (NP (NNS pounds)) (PP (IN for) (NP (NNS machines)))))) (CC and))))))
K/KC/KCF.xml,KCFRE001,28002,27,,B,14,1,"No you don't buy the, they come round and do it for you don't they?","[No/DT, you/PRP, don/VBP, 't/PRP, buy/VB, the/DT, ,/,, they/PRP, come/VBP, round/NN, and/CC, do/VBP, it/PRP, for/IN, you/PRP, don/VBP, 't/PRP, they/PRP, ?/.]","(ROOT (S (S (NP (DT No) (PRP you)) (VP (VBP don) (S (NP (PRP 't)) (VP (VB buy) (NP (DT the)))))) (, ,) (NP (PRP they)) (VP (VP (VBP come) (NP (NN round))) (CC and) (VP (VBP do) (NP (PRP it)) (SBAR (IN for) (S (NP (PRP you)) (VP (VBP don) (S (NP (PRP 't)) (NP (PRP they)))))))) (. ?)))"
K/KC/KCF.xml,KCFRE001,28002,28,,A,15,1,Well alright then  (()) ,"[Well/RB, alright/JJ, then/RB]",(ROOT (FRAG (X (ADVP (RB Well)) (NP (JJ alright))) (NP (RB then))))
K/KC/KCF.xml,KCFRE001,28002,29,,B,16,1,You hire it for a day  --,"[You/PRP, hire/VBP, it/PRP, for/IN, a/DT, day/NN, or/CC, whatever/WDT, it/PRP, is/VBZ, ./.]",(ROOT (S (NP (PRP You)) (VP (VBP hire) (S (NP (PRP it)) (UCP (PP (IN for) (NP (DT a) (NN day))) (CC or) (SBAR (WHNP (WDT whatever)) (S (NP (PRP it)) (VP (VBZ is))))))) (. .)))
K/KC/KCF.xml,KCFRE001,28002,30,,B,16,2,--or whatever it is.,"[You/PRP, hire/VBP, it/PRP, for/IN, a/DT, day/NN, or/CC, whatever/WDT, it/PRP, is/VBZ, ./.]",(ROOT (S (NP (PRP You)) (VP (VBP hire) (S (NP (PRP it)) (UCP (PP (IN for) (NP (DT a) (NN day))) (CC or) (SBAR (WHNP (WDT whatever)) (S (NP (PRP it)) (VP (VBZ is))))))) (. .)))
K/KC/KCF.xml,KCFRE001,28002,31,,B,16,3,It costs  --,"[It/PRP, costs/VBZ, just/RB, say/VB, for/IN, instance/NN, two/CD, hundred/CD, pounds/NNS, for/IN, the/DT, tractor/NN, and/CC, ,/,, and/CC, his/PRP$, sprayer/NN, and/CC, er/NN, the/DT, chemicals/NNS, on/IN, top/NN, ./.]","(ROOT (S (NP (PRP It)) (VP (VBZ costs) (ADVP (RB just)) (VP (VB say) (PP (IN for) (NP (NN instance))) (NP (QP (CD two) (CD hundred)) (NNS pounds)) (PP (IN for) (NP (NP (DT the) (NN tractor)) (CC and) (, ,) (CC and) (NP (NP (PRP$ his) (NN sprayer) (CC and) (NN er)) (NP (DT the) (NNS chemicals))))) (PP (IN on) (NP (NN top))))) (. .)))"
K/KC/KCF.xml,KCFRE001,28002,32,,B,16,4,"--just say for instance two hundred pounds for the tractor and, and his sprayer  --","[It/PRP, costs/VBZ, just/RB, say/VB, for/IN, instance/NN, two/CD, hundred/CD, pounds/NNS, for/IN, the/DT, tractor/NN, and/CC, ,/,, and/CC, his/PRP$, sprayer/NN, and/CC, er/NN, the/DT, chemicals/NNS, on/IN, top/NN, ./.]","(ROOT (S (NP (PRP It)) (VP (VBZ costs) (ADVP (RB just)) (VP (VB say) (PP (IN for) (NP (NN instance))) (NP (QP (CD two) (CD hundred)) (NNS pounds)) (PP (IN for) (NP (NP (DT the) (NN tractor)) (CC and) (, ,) (CC and) (NP (NP (PRP$ his) (NN sprayer) (CC and) (NN er)) (NP (DT the) (NNS chemicals))))) (PP (IN on) (NP (NN top))))) (. .)))"
K/KC/KCF.xml,KCFRE001,28002,33,,B,16,5,--and er the chemicals on top.,"[It/PRP, costs/VBZ, just/RB, say/VB, for/IN, instance/NN, two/CD, hundred/CD, pounds/NNS, for/IN, the/DT, tractor/NN, and/CC, ,/,, and/CC, his/PRP$, sprayer/NN, and/CC, er/NN, the/DT, chemicals/NNS, on/IN, top/NN, ./.]","(ROOT (S (NP (PRP It)) (VP (VBZ costs) (ADVP (RB just)) (VP (VB say) (PP (IN for) (NP (NN instance))) (NP (QP (CD two) (CD hundred)) (NNS pounds)) (PP (IN for) (NP (NP (DT the) (NN tractor)) (CC and) (, ,) (CC and) (NP (NP (PRP$ his) (NN sprayer) (CC and) (NN er)) (NP (DT the) (NNS chemicals))))) (PP (IN on) (NP (NN top))))) (. .)))"
K/KC/KCF.xml,KCFRE001,28002,34,,B,16,6,That's done your whole field  --,"[That/DT, 's/VBZ, done/VBN, your/PRP$, whole/JJ, field/NN, big/JJ, field/NN, ./.]",(ROOT (S (NP (DT That)) (VP (VBZ 's) (VP (VBN done) (NP (PRP$ your) (JJ whole) (NN field) (JJ big) (NN field)))) (. .)))
K/KC/KCF.xml,KCFRE001,28002,35,,B,16,7,--big field.,"[That/DT, 's/VBZ, done/VBN, your/PRP$, whole/JJ, field/NN, big/JJ, field/NN, ./.]",(ROOT (S (NP (DT That)) (VP (VBZ 's) (VP (VBN done) (NP (PRP$ your) (JJ whole) (NN field) (JJ big) (NN field)))) (. .)))
K/KC/KCF.xml,KCFRE001,28002,36,,B,16,8,Now that two hundred pound will only pay one man for a  --,"[Now/RB, that/IN, two/CD, hundred/CD, pound/NN, will/MD, only/RB, pay/VB, one/CD, man/NN, for/IN, a/DT, for/IN, a/DT, week/NN, to/TO, do/VB, the/DT, same/JJ, thing/NN, ./.]",(ROOT (FRAG (ADVP (RB Now)) (SBAR (IN that) (S (NP (QP (CD two) (CD hundred)) (NN pound)) (VP (MD will) (ADVP (RB only)) (VP (VB pay) (NP (NP (CD one) (NN man)) (PP (IN for) (NP (NP (DT a)) (PP (IN for) (NP (DT a) (NN week)))))) (S (VP (TO to) (VP (VB do) (NP (DT the) (JJ same) (NN thing))))))))) (. .)))
K/KC/KCF.xml,KCFRE001,28002,37,,B,16,9,--for a week  --,"[Now/RB, that/IN, two/CD, hundred/CD, pound/NN, will/MD, only/RB, pay/VB, one/CD, man/NN, for/IN, a/DT, for/IN, a/DT, week/NN, to/TO, do/VB, the/DT, same/JJ, thing/NN, ./.]",(ROOT (FRAG (ADVP (RB Now)) (SBAR (IN that) (S (NP (QP (CD two) (CD hundred)) (NN pound)) (VP (MD will) (ADVP (RB only)) (VP (VB pay) (NP (NP (CD one) (NN man)) (PP (IN for) (NP (NP (DT a)) (PP (IN for) (NP (DT a) (NN week)))))) (S (VP (TO to) (VP (VB do) (NP (DT the) (JJ same) (NN thing))))))))) (. .)))
K/KC/KCF.xml,KCFRE001,28002,38,,B,16,10,--to do the same thing.,"[Now/RB, that/IN, two/CD, hundred/CD, pound/NN, will/MD, only/RB, pay/VB, one/CD, man/NN, for/IN, a/DT, for/IN, a/DT, week/NN, to/TO, do/VB, the/DT, same/JJ, thing/NN, ./.]",(ROOT (FRAG (ADVP (RB Now)) (SBAR (IN that) (S (NP (QP (CD two) (CD hundred)) (NN pound)) (VP (MD will) (ADVP (RB only)) (VP (VB pay) (NP (NP (CD one) (NN man)) (PP (IN for) (NP (NP (DT a)) (PP (IN for) (NP (DT a) (NN week)))))) (S (VP (TO to) (VP (VB do) (NP (DT the) (JJ same) (NN thing))))))))) (. .)))
K/KC/KCF.xml,KCFRE001,28002,39,,B,16,11,"And he's gotta do it a few times, so then the cost becomes  --","[And/CC, he/PRP, 's/VBZ, gotta/NNP, do/VB, it/PRP, a/DT, few/JJ, times/NNS, ,/,, so/RB, then/RB, the/DT, cost/NN, becomes/VBZ, and/CC, ,/,, and/CC, you/PRP, like/IN, let/VB, 's/POS, be/VB, fair/JJ, ,/,, we/PRP, 've/VBP, had/VBD, summers/NNS, where/WRB, it/PRP, 's/VBZ, the/DT, weeds/NNS, er/NN, the/DT, weeds/NNS, haven/NN, 't/PRP, grown/VBN, ,/,, but/CC, you/PRP, get/VBP, a/DT, wet/JJ, summer/NN, and/CC, the/DT, weather/NN, warms/NNS, and/CC, the/DT, wet/NNP, and/CC, the/DT, weeds/NNS, go/VBP, peooow/NN, up/RP, like/IN, that/DT, ./.]","(ROOT (S (CC And) (NP (PRP he)) (VP (VBZ 's) (S (S (S (NP (NNP gotta)) (VP (VB do) (S (NP (PRP it)) (NP (DT a) (JJ few) (NNS times))))) (, ,) (RB so) (S (ADVP (RB then)) (NP (DT the) (NN cost)) (VP (VBZ becomes)))) (CC and) (, ,) (CC and) (S (NP (PRP you)) (PP (IN like) (S (S (S (S (VP (VB let) (S (NP (POS 's)) (VP (VB be) (ADJP (JJ fair)))))) (, ,) (NP (PRP we)) (VP (VBP 've) (VP (VBD had) (NP (NP (NNS summers)) (SBAR (WHADVP (WRB where)) (S (NP (PRP it)) (VP (VBZ 's) (NP (NP (NP (DT the) (NNS weeds) (NN er)) (NP (DT the) (NNS weeds) (NN haven))) (SBAR (S (NP (PRP 't)) (VP (VBN grown)))))))))))) (, ,) (CC but) (S (NP (PRP you)) (VP (VBP get) (NP (NP (DT a) (JJ wet) (NN summer)) (CC and) (NP (NP (DT the) (NN weather) (NNS warms)) (CC and) (NP (DT the) (NNP wet))))))) (CC and) (S (NP (DT the) (NNS weeds)) (VP (VBP go) (NP (NN peooow)) (PRT (RP up)) (PP (IN like) (NP (DT that)))))))))) (. .)))"
K/KC/KCF.xml,KCFRE001,28002,40,,B,16,12,"--and, and you  --","[And/CC, he/PRP, 's/VBZ, gotta/NNP, do/VB, it/PRP, a/DT, few/JJ, times/NNS, ,/,, so/RB, then/RB, the/DT, cost/NN, becomes/VBZ, and/CC, ,/,, and/CC, you/PRP, like/IN, let/VB, 's/POS, be/VB, fair/JJ, ,/,, we/PRP, 've/VBP, had/VBD, summers/NNS, where/WRB, it/PRP, 's/VBZ, the/DT, weeds/NNS, er/NN, the/DT, weeds/NNS, haven/NN, 't/PRP, grown/VBN, ,/,, but/CC, you/PRP, get/VBP, a/DT, wet/JJ, summer/NN, and/CC, the/DT, weather/NN, warms/NNS, and/CC, the/DT, wet/NNP, and/CC, the/DT, weeds/NNS, go/VBP, peooow/NN, up/RP, like/IN, that/DT, ./.]","(ROOT (S (CC And) (NP (PRP he)) (VP (VBZ 's) (S (S (S (NP (NNP gotta)) (VP (VB do) (S (NP (PRP it)) (NP (DT a) (JJ few) (NNS times))))) (, ,) (RB so) (S (ADVP (RB then)) (NP (DT the) (NN cost)) (VP (VBZ becomes)))) (CC and) (, ,) (CC and) (S (NP (PRP you)) (PP (IN like) (S (S (S (S (VP (VB let) (S (NP (POS 's)) (VP (VB be) (ADJP (JJ fair)))))) (, ,) (NP (PRP we)) (VP (VBP 've) (VP (VBD had) (NP (NP (NNS summers)) (SBAR (WHADVP (WRB where)) (S (NP (PRP it)) (VP (VBZ 's) (NP (NP (NP (DT the) (NNS weeds) (NN er)) (NP (DT the) (NNS weeds) (NN haven))) (SBAR (S (NP (PRP 't)) (VP (VBN grown)))))))))))) (, ,) (CC but) (S (NP (PRP you)) (VP (VBP get) (NP (NP (DT a) (JJ wet) (NN summer)) (CC and) (NP (NP (DT the) (NN weather) (NNS warms)) (CC and) (NP (DT the) (NNP wet))))))) (CC and) (S (NP (DT the) (NNS weeds)) (VP (VBP go) (NP (NN peooow)) (PRT (RP up)) (PP (IN like) (NP (DT that)))))))))) (. .)))"
K/KC/KCF.xml,KCFRE001,28002,41,,B,16,13,"--like let's be fair, we've had summers where it's  --","[And/CC, he/PRP, 's/VBZ, gotta/NNP, do/VB, it/PRP, a/DT, few/JJ, times/NNS, ,/,, so/RB, then/RB, the/DT, cost/NN, becomes/VBZ, and/CC, ,/,, and/CC, you/PRP, like/IN, let/VB, 's/POS, be/VB, fair/JJ, ,/,, we/PRP, 've/VBP, had/VBD, summers/NNS, where/WRB, it/PRP, 's/VBZ, the/DT, weeds/NNS, er/NN, the/DT, weeds/NNS, haven/NN, 't/PRP, grown/VBN, ,/,, but/CC, you/PRP, get/VBP, a/DT, wet/JJ, summer/NN, and/CC, the/DT, weather/NN, warms/NNS, and/CC, the/DT, wet/NNP, and/CC, the/DT, weeds/NNS, go/VBP, peooow/NN, up/RP, like/IN, that/DT, ./.]","(ROOT (S (CC And) (NP (PRP he)) (VP (VBZ 's) (S (S (S (NP (NNP gotta)) (VP (VB do) (S (NP (PRP it)) (NP (DT a) (JJ few) (NNS times))))) (, ,) (RB so) (S (ADVP (RB then)) (NP (DT the) (NN cost)) (VP (VBZ becomes)))) (CC and) (, ,) (CC and) (S (NP (PRP you)) (PP (IN like) (S (S (S (S (VP (VB let) (S (NP (POS 's)) (VP (VB be) (ADJP (JJ fair)))))) (, ,) (NP (PRP we)) (VP (VBP 've) (VP (VBD had) (NP (NP (NNS summers)) (SBAR (WHADVP (WRB where)) (S (NP (PRP it)) (VP (VBZ 's) (NP (NP (NP (DT the) (NNS weeds) (NN er)) (NP (DT the) (NNS weeds) (NN haven))) (SBAR (S (NP (PRP 't)) (VP (VBN grown)))))))))))) (, ,) (CC but) (S (NP (PRP you)) (VP (VBP get) (NP (NP (DT a) (JJ wet) (NN summer)) (CC and) (NP (NP (DT the) (NN weather) (NNS warms)) (CC and) (NP (DT the) (NNP wet))))))) (CC and) (S (NP (DT the) (NNS weeds)) (VP (VBP go) (NP (NN peooow)) (PRT (RP up)) (PP (IN like) (NP (DT that)))))))))) (. .)))"
