swda_filename,ptb_basename,conversation_no,transcript_index,act_tag,caller,turn_index,subutterance_index,text,pos,trees
K/KB/KBK.xml,KBKRE03R,2421,0,,A,1,1,Go and live there.,"[Go/VB, and/CC, live/VB, there/RB, ./.]",(ROOT (S (VP (VB Go) (CC and) (VB live) (NP (RB there))) (. .)))
K/KB/KBK.xml,KBKRE03R,2421,1,,B,2,1,Don't seem to have any homes.,"[Don/NNP, 't/PRP, seem/VBP, to/TO, have/VB, any/DT, homes/NNS, ./.]",(ROOT (S (NP (NNP Don) (PRP 't)) (VP (VBP seem) (S (VP (TO to) (VP (VB have) (NP (DT any) (NNS homes)))))) (. .)))
K/KB/KBK.xml,KBKRE03R,2421,2,,A,3,1,They're doing away from their homes.,"[They/PRP, 're/VBP, doing/VBG, away/RB, from/IN, their/PRP$, homes/NNS, ./.]",(ROOT (S (NP (PRP They)) (VP (VBP 're) (VP (VBG doing) (ADVP (RB away)) (PP (IN from) (NP (PRP$ their) (NNS homes))))) (. .)))
K/KB/KBK.xml,KBKRE03R,2421,3,,B,4,1,You're driven away by the army.,"[You/PRP, 're/VBP, driven/VBN, away/RP, by/IN, the/DT, army/NNP, ./.]",(ROOT (S (NP (PRP You)) (VP (VBP 're) (VP (VBN driven) (PRT (RP away)) (PP (IN by) (NP (DT the) (NNP army))))) (. .)))
K/KB/KBK.xml,KBKRE03R,2421,4,,A,5,1,Yes.,"[Yes/UH, ./.]",(ROOT (INTJ (UH Yes) (. .)))
K/KB/KBK.xml,KBKRE03R,2421,5,,B,6,1,"Famine, the Army, I mean lack of rain and all that sort of thing.","[Famine/NN, ,/,, the/DT, Army/NNP, ,/,, I/PRP, mean/VBP, lack/NN, of/IN, rain/NN, and/CC, all/PDT, that/DT, sort/NN, of/IN, thing/NN, ./.]","(ROOT (NP (NP (NN Famine)) (, ,) (NP (DT the) (NNP Army)) (, ,) (S (NP (PRP I)) (VP (VBP mean) (NP (NP (NP (NN lack)) (PP (IN of) (NP (NN rain)))) (CC and) (NP (NP (PDT all) (DT that) (NN sort)) (PP (IN of) (NP (NN thing))))))) (. .)))"
