swda_filename,ptb_basename,conversation_no,transcript_index,act_tag,caller,turn_index,subutterance_index,text,pos,trees
K/KB/KBK.xml,KBKRE01E,2214,0,,A,1,1,"Lynda seems to be staying on a bit, oh no, no, she does have to stay till two sometimes.","[Lynda/NNP, seems/VBZ, to/TO, be/VB, staying/VBG, on/IN, a/DT, bit/NN, ,/,, oh/UH, no/UH, ,/,, no/DT, ,/,, she/PRP, does/VBZ, have/VB, to/TO, stay/VB, till/IN, two/CD, sometimes/RB, ./.]","(ROOT (S (S (NP (NNP Lynda)) (VP (VBZ seems) (S (VP (TO to) (VP (VP (VB be) (VP (VBG staying) (PP (IN on) (NP (DT a) (NN bit))))) (, ,) (FRAG (INTJ (UH oh) (UH no)) (, ,) (NP (DT no)))))))) (, ,) (NP (PRP she)) (VP (VBZ does) (VP (VB have) (S (VP (TO to) (VP (VB stay) (PP (IN till) (NP (CD two))) (ADVP (RB sometimes))))))) (. .)))"
K/KB/KBK.xml,KBKRE01E,2214,1,,B,2,1,She's been quite late lately.,"[She/PRP, 's/VBZ, been/VBN, quite/RB, late/JJ, lately/RB, ./.]",(ROOT (S (NP (PRP She)) (VP (VBZ 's) (VP (VBN been) (ADJP (RB quite) (JJ late)) (ADVP (RB lately)))) (. .)))
K/KB/KBK.xml,KBKRE01E,2214,2,,B,2,2,(()) four o'clock (()) .,"[four/CD, o/NN, 'clock/NN, ./.]",(ROOT (NP (NP (CD four) (NN o)) (NP (NN 'clock)) (. .)))
K/KB/KBK.xml,KBKRE01E,2214,3,,A,3,1,Right.,"[Right/NN, ./.]",(ROOT (INTJ (NN Right) (. .)))
K/KB/KBK.xml,KBKRE01E,2214,4,,B,4,1,She said if we didn't get stuck at the (()) .,"[She/PRP, said/VBD, if/IN, we/PRP, didn/VBP, 't/PRP, get/VB, stuck/VBN, at/IN, the/DT, ./.]",(ROOT (S (NP (PRP She)) (VP (VBD said) (SBAR (IN if) (S (NP (PRP we)) (VP (VBP didn) (S (NP (PRP 't)) (VP (VB get) (VP (VBN stuck) (ADVP (IN at) (DT the))))))))) (. .)))
