swda_filename,ptb_basename,conversation_no,transcript_index,act_tag,caller,turn_index,subutterance_index,text,pos,trees
K/KB/KBK.xml,KBKRE00A,2011,0,,A,1,1,Have you tried them on already?,"[Have/VB, you/PRP, tried/VBD, them/PRP, on/IN, already/RB, ?/.]",(ROOT (SQ (VP (VB Have) (S (NP (PRP you)) (VP (VBD tried) (NP (PRP them)) (PP (IN on) (ADVP (RB already)))))) (. ?)))
K/KB/KBK.xml,KBKRE00A,2011,1,,B,2,1,Not yet.,"[Not/RB, yet/RB, ./.]",(ROOT (FRAG (RB Not) (NP (RB yet)) (. .)))
K/KB/KBK.xml,KBKRE00A,2011,2,,A,3,1,I like the look of it very much.,"[I/PRP, like/VBP, the/DT, look/NN, of/IN, it/PRP, very/RB, much/RB, ./.]",(ROOT (S (NP (PRP I)) (VP (VBP like) (NP (NP (DT the) (NN look)) (PP (IN of) (NP (PRP it)))) (ADVP (RB very) (RB much))) (. .)))
K/KB/KBK.xml,KBKRE00A,2011,3,,B,4,1,Oh.,"[Oh/UH, ./.]",(ROOT (INTJ (UH Oh) (. .)))
K/KB/KBK.xml,KBKRE00A,2011,4,,A,5,1,(()) or something.,"[or/CC, something/NN, ./.]",(ROOT (FRAG (PP (CC or) (NP (NN something))) (. .)))
K/KB/KBK.xml,KBKRE00A,2011,5,,B,6,1,No (()) .--,"[No/DT, ./.]",(ROOT (FRAG (NP (DT No)) (. .)))
K/KB/KBK.xml,KBKRE00A,2011,6,,B,6,2,--(()) ,"[No/DT, ./.]",(ROOT (FRAG (NP (DT No)) (. .)))
K/KB/KBK.xml,KBKRE00A,2011,7,,A,7,1,Fits nicer than that one.,"[Fits/NNS, nicer/JJR, than/IN, that/DT, one/CD, ./.]",(ROOT (S (NP (NNS Fits)) (ADJP (ADJP (JJR nicer)) (PP (IN than) (NP (DT that) (CD one)))) (. .)))
K/KB/KBK.xml,KBKRE00A,2011,8,,A,7,2,Do you like it?,"[Do/VB, you/PRP, like/IN, it/PRP, ?/.]",(ROOT (SQ (VP (VB Do) (NP (PRP you)) (PP (IN like) (NP (PRP it)))) (. ?)))
K/KB/KBK.xml,KBKRE00A,2011,9,,B,8,1,Well I'm asking you.,"[Well/RB, I/PRP, 'm/VBP, asking/VBG, you/PRP, ./.]",(ROOT (S (ADVP (RB Well)) (NP (PRP I)) (VP (VBP 'm) (VP (VBG asking) (NP (PRP you)))) (. .)))
K/KB/KBK.xml,KBKRE00A,2011,10,,A,9,1,Yes I like it.,"[Yes/UH, I/PRP, like/VBP, it/PRP, ./.]",(ROOT (S (S (INTJ (UH Yes)) (NP (PRP I)) (VP (VBP like) (NP (PRP it)))) (. .)))
K/KB/KBK.xml,KBKRE00A,2011,11,,A,9,2,I like it.,"[I/PRP, like/VBP, it/PRP, ./.]",(ROOT (S (NP (PRP I)) (VP (VBP like) (NP (PRP it))) (. .)))
K/KB/KBK.xml,KBKRE00A,2011,12,,B,10,1,Well you think it fits alright?,"[Well/RB, you/PRP, think/VBP, it/PRP, fits/VBZ, alright/RB, ?/.]",(ROOT (S (ADVP (RB Well)) (NP (PRP you)) (VP (VBP think) (SBAR (S (NP (PRP it)) (VP (VBZ fits) (ADVP (RB alright)))))) (. ?)))
K/KB/KBK.xml,KBKRE00A,2011,13,,A,11,1,It seems to me to fit perfectly.,"[It/PRP, seems/VBZ, to/TO, me/PRP, to/TO, fit/VB, perfectly/RB, ./.]",(ROOT (S (NP (PRP It)) (VP (VBZ seems) (PP (TO to) (NP (PRP me))) (S (VP (TO to) (VP (VB fit) (ADVP (RB perfectly)))))) (. .)))
K/KB/KBK.xml,KBKRE00A,2011,14,,B,12,1,And the colour's not too drab?,"[And/CC, the/DT, colour/NN, 's/POS, not/RB, too/RB, drab/JJ, ?/.]",(ROOT (FRAG (CC And) (NP (NP (DT the) (NP (NN colour) (POS 's))) (PP (RB not) (ADJP (RB too) (JJ drab)))) (. ?)))
K/KB/KBK.xml,KBKRE00A,2011,15,,A,13,1,I don't think the colour's drab at all.,"[I/PRP, don/VBP, 't/PRP, think/VB, the/DT, colour/NN, 's/POS, drab/JJ, at/IN, all/DT, ./.]",(ROOT (S (NP (PRP I)) (VP (VBP don) (S (NP (PRP 't)) (VP (VB think) (NP (NP (DT the) (NN colour) (POS 's)) (JJ drab)) (ADVP (IN at) (DT all))))) (. .)))
K/KB/KBK.xml,KBKRE00A,2011,16,,A,13,2,I think the colour's fab.,"[I/PRP, think/VBP, the/DT, colour/NN, 's/POS, fab/NN, ./.]",(ROOT (S (NP (PRP I)) (VP (VBP think) (NP (NP (DT the) (NN colour) (POS 's)) (NN fab))) (. .)))
K/KB/KBK.xml,KBKRE00A,2011,17,,B,14,1,Right.,"[Right/NN, ./.]",(ROOT (INTJ (NN Right) (. .)))
K/KB/KBK.xml,KBKRE00A,2011,18,,A,15,1,Looks just fine to me.,"[Looks/VBZ, just/RB, fine/JJ, to/TO, me/PRP, ./.]",(ROOT (S (VP (VBZ Looks) (ADJP (RB just) (JJ fine) (PP (TO to) (NP (PRP me))))) (. .)))
K/KB/KBK.xml,KBKRE00A,2011,19,,B,16,1,Yes.,"[Yes/UH, ./.]",(ROOT (INTJ (UH Yes) (. .)))
K/KB/KBK.xml,KBKRE00A,2011,20,,B,16,2,Mm.,"[Mm/NN, ./.]",(ROOT (NP (NN Mm) (. .)))
K/KB/KBK.xml,KBKRE00A,2011,21,,B,16,3,I'll just slip on another one.,"[I/PRP, 'll/MD, just/RB, slip/VB, on/IN, another/DT, one/CD, ./.]",(ROOT (S (NP (PRP I)) (VP (MD 'll) (ADVP (RB just)) (VP (VB slip) (PP (IN on) (NP (DT another) (CD one))))) (. .)))
K/KB/KBK.xml,KBKRE00A,2011,22,,A,17,1,I like it.,"[I/PRP, like/VBP, it/PRP, ./.]",(ROOT (S (NP (PRP I)) (VP (VBP like) (NP (PRP it))) (. .)))
K/KB/KBK.xml,KBKRE00A,2011,23,,B,18,1,It wasn't too expensive.,"[It/PRP, wasn/VBD, 't/PRP, too/RB, expensive/JJ, ./.]",(ROOT (S (NP (PRP It)) (VP (VBD wasn) (S (NP (PRP 't)) (ADJP (RB too) (JJ expensive)))) (. .)))
K/KB/KBK.xml,KBKRE00A,2011,24,,B,18,2,"Thirty pounds, twenty-nine ninety five or something.","[Thirty/CD, pounds/NNS, ,/,, twenty-nine/CD, ninety/CD, five/CD, or/CC, something/NN, ./.]","(ROOT (NP (NP (CD Thirty) (NNS pounds)) (, ,) (NP (NP (QP (CD twenty-nine) (CD ninety)) (CD five)) (CC or) (NP (NN something))) (. .)))"
K/KB/KBK.xml,KBKRE00A,2011,25,,A,19,1,Good.,"[Good/JJ, ./.]",(ROOT (INTJ (JJ Good) (. .)))
K/KB/KBK.xml,KBKRE00A,2011,26,,B,20,1,Which isn't a bad price.,"[Which/WDT, isn/NNP, 't/PRP, a/DT, bad/JJ, price/NN, ./.]",(ROOT (S (NP (WDT Which)) (VP (NP (NP (NNP isn)) (NP (NP (PRP 't)) (NP (DT a) (JJ bad) (NN price))))) (. .)))
K/KB/KBK.xml,KBKRE00A,2011,27,,A,21,1,"Did you try, do you try any of them on in Marks?","[Did/VBD, you/PRP, try/VBP, ,/,, do/VBP, you/PRP, try/VB, any/DT, of/IN, them/PRP, on/IN, in/IN, Marks/NNS, ?/.]","(ROOT (SBARQ (SBAR (VBD Did) (S (NP (PRP you)) (VP (VBP try)))) (, ,) (SQ (VBP do) (NP (PRP you)) (VP (VB try) (NP (NP (DT any)) (PP (IN of) (NP (PRP them)))) (PP (IN on) (PP (IN in) (NP (NNS Marks)))))) (. ?)))"
K/KB/KBK.xml,KBKRE00A,2011,28,,B,22,1,No.,"[No/DT, ./.]",(ROOT (FRAG (NP (DT No)) (. .)))
K/KB/KBK.xml,KBKRE00A,2011,29,,A,23,1,What's the material like?,"[What/WP, 's/VBZ, the/DT, material/NN, like/IN, ?/.]",(ROOT (SBARQ (WHNP (WP What)) (SQ (VBZ 's) (NP (NP (DT the) (NN material)) (PP (IN like)))) (. ?)))
K/KB/KBK.xml,KBKRE00A,2011,30,,B,24,1,I don't know.,"[I/PRP, don/VBP, 't/PRP, know/VB, ./.]",(ROOT (S (NP (PRP I)) (VP (VBP don) (S (NP (PRP 't)) (VP (VB know)))) (. .)))
K/KB/KBK.xml,KBKRE00A,2011,31,,B,24,2,(()) . Now this one  --,"[./., Now/RB, this/DT, one/CD, I/PRP, 've/VBP, realized/VBN, now/RB, is/VBZ, actually/RB, meant/VBN, for/IN, wearing/VBG, outside/JJ, because/IN, it/PRP, 's/VBZ, got/VBD, a/DT, bit/NN, of/IN, shaping/VBG, here/RB, ,/,, see/VB, ?/.]","(ROOT (FRAG (. .) (ADVP (RB Now)) (NP (NP (DT this) (CD one)) (SBAR (S (NP (PRP I)) (VP (VBP 've) (VP (VBN realized) (SBAR (S (NP (RB now)) (VP (VBZ is) (ADVP (RB actually)) (VP (VBN meant) (PP (IN for) (S (VP (VBG wearing) (ADVP (JJ outside)) (SBAR (IN because) (S (NP (PRP it)) (VP (VBZ 's) (VP (VBD got) (NP (NP (DT a) (NN bit)) (PP (IN of) (S (VP (VBG shaping) (S (ADVP (RB here)) (, ,) (VP (VB see))))))))))))))))))))))) (. ?)))"
K/KB/KBK.xml,KBKRE00A,2011,32,,B,24,3,--I've realized now  --,"[./., Now/RB, this/DT, one/CD, I/PRP, 've/VBP, realized/VBN, now/RB, is/VBZ, actually/RB, meant/VBN, for/IN, wearing/VBG, outside/JJ, because/IN, it/PRP, 's/VBZ, got/VBD, a/DT, bit/NN, of/IN, shaping/VBG, here/RB, ,/,, see/VB, ?/.]","(ROOT (FRAG (. .) (ADVP (RB Now)) (NP (NP (DT this) (CD one)) (SBAR (S (NP (PRP I)) (VP (VBP 've) (VP (VBN realized) (SBAR (S (NP (RB now)) (VP (VBZ is) (ADVP (RB actually)) (VP (VBN meant) (PP (IN for) (S (VP (VBG wearing) (ADVP (JJ outside)) (SBAR (IN because) (S (NP (PRP it)) (VP (VBZ 's) (VP (VBD got) (NP (NP (DT a) (NN bit)) (PP (IN of) (S (VP (VBG shaping) (S (ADVP (RB here)) (, ,) (VP (VB see))))))))))))))))))))))) (. ?)))"
K/KB/KBK.xml,KBKRE00A,2011,33,,B,24,4,--is actually meant for wearing  --,"[./., Now/RB, this/DT, one/CD, I/PRP, 've/VBP, realized/VBN, now/RB, is/VBZ, actually/RB, meant/VBN, for/IN, wearing/VBG, outside/JJ, because/IN, it/PRP, 's/VBZ, got/VBD, a/DT, bit/NN, of/IN, shaping/VBG, here/RB, ,/,, see/VB, ?/.]","(ROOT (FRAG (. .) (ADVP (RB Now)) (NP (NP (DT this) (CD one)) (SBAR (S (NP (PRP I)) (VP (VBP 've) (VP (VBN realized) (SBAR (S (NP (RB now)) (VP (VBZ is) (ADVP (RB actually)) (VP (VBN meant) (PP (IN for) (S (VP (VBG wearing) (ADVP (JJ outside)) (SBAR (IN because) (S (NP (PRP it)) (VP (VBZ 's) (VP (VBD got) (NP (NP (DT a) (NN bit)) (PP (IN of) (S (VP (VBG shaping) (S (ADVP (RB here)) (, ,) (VP (VB see))))))))))))))))))))))) (. ?)))"
K/KB/KBK.xml,KBKRE00A,2011,34,,B,24,5,"--outside because it's got a bit of shaping here, see?","[./., Now/RB, this/DT, one/CD, I/PRP, 've/VBP, realized/VBN, now/RB, is/VBZ, actually/RB, meant/VBN, for/IN, wearing/VBG, outside/JJ, because/IN, it/PRP, 's/VBZ, got/VBD, a/DT, bit/NN, of/IN, shaping/VBG, here/RB, ,/,, see/VB, ?/.]","(ROOT (FRAG (. .) (ADVP (RB Now)) (NP (NP (DT this) (CD one)) (SBAR (S (NP (PRP I)) (VP (VBP 've) (VP (VBN realized) (SBAR (S (NP (RB now)) (VP (VBZ is) (ADVP (RB actually)) (VP (VBN meant) (PP (IN for) (S (VP (VBG wearing) (ADVP (JJ outside)) (SBAR (IN because) (S (NP (PRP it)) (VP (VBZ 's) (VP (VBD got) (NP (NP (DT a) (NN bit)) (PP (IN of) (S (VP (VBG shaping) (S (ADVP (RB here)) (, ,) (VP (VB see))))))))))))))))))))))) (. ?)))"
K/KB/KBK.xml,KBKRE00A,2011,35,,A,25,1,"Oh I see what you mean, yes, yes.","[Oh/UH, I/PRP, see/VBP, what/WP, you/PRP, mean/VBP, ,/,, yes/UH, ,/,, yes/UH, ./.]","(ROOT (S (S (INTJ (UH Oh)) (NP (PRP I)) (VP (VBP see) (SBAR (WHNP (WP what)) (S (NP (PRP you)) (VP (VBP mean)))))) (, ,) (FRAG (INTJ (UH yes) (, ,) (UH yes))) (. .)))"
K/KB/KBK.xml,KBKRE00A,2011,36,,B,26,1,Erm but whether that  --,"[Erm/NN, but/CC, whether/IN, that/DT, couldn/NN, 't/PRP, wear/VB, it/PRP, outside/IN, with/IN, this/DT]",(ROOT (NP (NP (NN Erm)) (PP (CC but) (NP (NP (IN whether) (DT that) (NN couldn)) (SBAR (S (NP (PRP 't)) (VP (VB wear) (NP (PRP it)) (PP (IN outside) (PP (IN with) (NP (DT this)))))))))))
K/KB/KBK.xml,KBKRE00A,2011,37,,B,26,2,--couldn't wear it outside with this,"[Erm/NN, but/CC, whether/IN, that/DT, couldn/NN, 't/PRP, wear/VB, it/PRP, outside/IN, with/IN, this/DT]",(ROOT (NP (NP (NN Erm)) (PP (CC but) (NP (NP (IN whether) (DT that) (NN couldn)) (SBAR (S (NP (PRP 't)) (VP (VB wear) (NP (PRP it)) (PP (IN outside) (PP (IN with) (NP (DT this)))))))))))
K/KB/KBK.xml,KBKRE00A,2011,38,,A,27,1,Out out out or in presumably (()) ?,"[Out/IN, out/RB, out/IN, or/CC, in/IN, presumably/RB, ?/.]",(ROOT (FRAG (PP (IN Out) (PP (PP (RB out) (ADVP (IN out))) (CC or) (PP (IN in) (ADVP (RB presumably))))) (. ?)))
K/KB/KBK.xml,KBKRE00A,2011,39,,B,28,1,Presumably.(()) .,"[Presumably/RB, ./., ./.]",(ROOT (FRAG (ADVP (RB Presumably) (. .)) (. .)))
K/KB/KBK.xml,KBKRE00A,2011,40,,A,29,1,What do you mean?,"[What/WP, do/VBP, you/PRP, mean/VB, ?/.]",(ROOT (SBARQ (WHNP (WP What)) (SQ (VBP do) (NP (PRP you)) (VP (VB mean))) (. ?)))
K/KB/KBK.xml,KBKRE00A,2011,41,,B,30,1,The collar ends in a point at the bottom in the styling.,"[The/DT, collar/NN, ends/VBZ, in/IN, a/DT, point/NN, at/IN, the/DT, bottom/NN, in/IN, the/DT, styling/NN, ./.]",(ROOT (S (NP (DT The) (NN collar)) (VP (VBZ ends) (PP (IN in) (NP (NP (DT a) (NN point)) (PP (IN at) (NP (NP (DT the) (NN bottom)) (PP (IN in) (NP (DT the) (NN styling)))))))) (. .)))
K/KB/KBK.xml,KBKRE00A,2011,42,,A,31,1,Oh I see.,"[Oh/UH, I/PRP, see/VBP, ./.]",(ROOT (S (S (INTJ (UH Oh)) (NP (PRP I)) (VP (VBP see))) (. .)))
K/KB/KBK.xml,KBKRE00A,2011,43,,A,31,2,"Oh yes yes yes yes I do see what you mean, yeah.","[Oh/UH, yes/UH, yes/UH, yes/UH, yes/UH, I/PRP, do/VBP, see/VB, what/WP, you/PRP, mean/VBP, ,/,, yeah/UH, ./.]","(ROOT (S (INTJ (UH Oh) (UH yes)) (INTJ (UH yes) (UH yes)) (UH yes) (NP (PRP I)) (VP (VBP do) (VP (VB see) (SBAR (WHNP (WP what)) (S (NP (PRP you)) (VP (VBP mean)))) (, ,) (NP (UH yeah)))) (. .)))"
K/KB/KBK.xml,KBKRE00A,2011,44,,B,32,1,I will say it's cut shorter at the back.(()) ,"[I/PRP, will/MD, say/VB, it/PRP, 's/VBZ, cut/VBN, shorter/JJR, at/IN, the/DT, back/NN, ./.]",(ROOT (S (NP (PRP I)) (VP (MD will) (VP (VB say) (SBAR (S (NP (PRP it)) (VP (VBZ 's) (VP (VBN cut) (S (ADJP (JJR shorter))) (PP (IN at) (NP (DT the) (NN back))))))))) (. .)))
K/KB/KBK.xml,KBKRE00A,2011,45,,A,33,1,(()) sort of waistcoaty in fact.,"[sort/NN, of/IN, waistcoaty/NN, in/IN, fact/NN, ./.]",(ROOT (NP (NP (NN sort)) (PP (IN of) (NP (NN waistcoaty))) (PP (IN in) (NP (NN fact))) (. .)))
K/KB/KBK.xml,KBKRE00A,2011,46,,B,34,1,(()) .,[./.],(ROOT (NP (. .)))
K/KB/KBK.xml,KBKRE00A,2011,47,,A,35,1,Well it looks fine tucked in like that.,"[Well/RB, it/PRP, looks/VBZ, fine/JJ, tucked/VBN, in/IN, like/IN, that/DT, ./.]",(ROOT (S (ADVP (RB Well)) (NP (PRP it)) (VP (VBZ looks) (ADJP (JJ fine)) (S (VP (VBN tucked) (PP (IN in) (PP (IN like) (NP (DT that))))))) (. .)))
K/KB/KBK.xml,KBKRE00A,2011,48,,B,36,1,I mean there's not much of it to tuck in.,"[I/PRP, mean/VBP, there/EX, 's/VBZ, not/RB, much/JJ, of/IN, it/PRP, to/TO, tuck/VB, in/IN, ./.]",(ROOT (S (NP (PRP I)) (VP (VBP mean) (SBAR (S (NP (EX there)) (VP (VBZ 's) (RB not) (ADJP (JJ much) (PP (IN of) (NP (PRP it)))) (S (VP (TO to) (VP (VB tuck) (PP (IN in))))))))) (. .)))
K/KB/KBK.xml,KBKRE00A,2011,49,,B,36,2,You know sort of ,"[You/PRP, know/VBP, sort/NN, of/IN]",(ROOT (S (NP (PRP You)) (VP (VBP know) (ADVP (NN sort) (IN of)))))
K/KB/KBK.xml,KBKRE00A,2011,50,,A,37,1,Well that looks very smart as it is.,"[Well/RB, that/IN, looks/VBZ, very/RB, smart/JJ, as/IN, it/PRP, is/VBZ, ./.]",(ROOT (FRAG (ADVP (RB Well)) (SBAR (IN that) (S (VP (VBZ looks) (ADJP (RB very) (JJ smart)) (SBAR (IN as) (S (NP (PRP it)) (VP (VBZ is))))))) (. .)))
K/KB/KBK.xml,KBKRE00A,2011,51,,B,38,1,But you couldn't wear it out on this particular blouse,"[But/CC, you/PRP, couldn/VBP, 't/PRP, wear/VB, it/PRP, out/RP, on/IN, this/DT, particular/JJ, blouse/NN]",(ROOT (S (CC But) (NP (PRP you)) (VP (VBP couldn) (S (NP (PRP 't)) (VP (VB wear) (NP (PRP it)) (PRT (RP out)))) (PP (IN on) (NP (DT this) (JJ particular) (NN blouse))))))
K/KB/KBK.xml,KBKRE00A,2011,52,,A,39,1,Well ca- w- ,"[Well/RB, ca-/JJ, w-/NN]",(ROOT (FRAG (ADVP (RB Well)) (NP (JJ ca-) (NN w-))))
K/KB/KBK.xml,KBKRE00A,2011,53,,B,40,1,because of the belt.,"[because/IN, of/IN, the/DT, belt/NN, ./.]",(ROOT (FRAG (PP (IN because) (PP (IN of) (NP (DT the) (NN belt)))) (. .)))
K/KB/KBK.xml,KBKRE00A,2011,54,,B,40,2,If you wore the erm ,"[If/IN, you/PRP, wore/VBD, the/DT, erm/NN]",(ROOT (SBAR (IN If) (S (NP (PRP you)) (VP (VBD wore) (NP (DT the) (NN erm))))))
K/KB/KBK.xml,KBKRE00A,2011,55,,A,41,1,Well try it.,"[Well/RB, try/VB, it/PRP, ./.]",(ROOT (S (INTJ (RB Well)) (VP (VB try) (NP (PRP it))) (. .)))
K/KB/KBK.xml,KBKRE00A,2011,56,,B,42,1,If you.,"[If/IN, you/PRP, ./.]",(ROOT (FRAG (PP (IN If) (NP (PRP you))) (. .)))
K/KB/KBK.xml,KBKRE00A,2011,57,,B,42,2,I will.,"[I/PRP, will/MD, ./.]",(ROOT (S (NP (PRP I)) (VP (MD will)) (. .)))
K/KB/KBK.xml,KBKRE00A,2011,58,,B,42,3,You think that the colours go and,"[You/PRP, think/VBP, that/IN, the/DT, colours/NNS, go/VBP, and/CC]",(ROOT (S (NP (PRP You)) (VP (VBP think) (SBAR (IN that) (S (NP (DT the) (NNS colours)) (VP (VBP go) (ADVP (CC and))))))))
K/KB/KBK.xml,KBKRE00A,2011,59,,A,43,1,I think the colours go very well indeed.,"[I/PRP, think/VBP, the/DT, colours/NNS, go/VBP, very/RB, well/RB, indeed/RB, ./.]",(ROOT (S (NP (PRP I)) (VP (VBP think) (SBAR (S (NP (DT the) (NNS colours)) (VP (VBP go) (ADVP (RB very) (RB well)) (ADVP (RB indeed)))))) (. .)))
K/KB/KBK.xml,KBKRE00A,2011,60,,A,43,2,I mean it doesn't pick up precisely the same colour but that in there ,"[I/PRP, mean/VBP, it/PRP, doesn/VB, 't/PRP, pick/VB, up/RP, precisely/RB, the/DT, same/JJ, colour/NN, but/CC, that/IN, in/IN, there/EX]",(ROOT (S (NP (PRP I)) (VP (VBP mean) (S (NP (PRP it)) (VP (VB doesn) (NP (PRP 't)) (VP (VB pick) (PRT (RP up)) (NP (RB precisely) (DT the) (JJ same) (NN colour)) (ADVP (CC but)) (SBAR (IN that) (FRAG (PP (IN in) (NP (EX there)))))))))))
K/KB/KBK.xml,KBKRE00A,2011,61,,B,44,1,(()) ,[],X
K/KB/KBK.xml,KBKRE00A,2011,62,,A,45,1,Yes it is.,"[Yes/UH, it/PRP, is/VBZ, ./.]",(ROOT (S (S (INTJ (UH Yes)) (NP (PRP it)) (VP (VBZ is))) (. .)))
K/KB/KBK.xml,KBKRE00A,2011,63,,A,45,2,Yes it is.,"[Yes/UH, it/PRP, is/VBZ, ./.]",(ROOT (S (S (INTJ (UH Yes)) (NP (PRP it)) (VP (VBZ is))) (. .)))
K/KB/KBK.xml,KBKRE00A,2011,64,,A,45,3,Yes.,"[Yes/UH, ./.]",(ROOT (INTJ (UH Yes) (. .)))
K/KB/KBK.xml,KBKRE00A,2011,65,,A,45,4,But it clashes very well indeed.,"[But/CC, it/PRP, clashes/NNS, very/RB, well/RB, indeed/RB, ./.]",(ROOT (FRAG (CC But) (NP (NP (PRP it)) (NP (NP (NNS clashes)) (ADVP (RB very) (PP (RB well) (ADVP (RB indeed)))))) (. .)))
K/KB/KBK.xml,KBKRE00A,2011,66,,A,45,5,Why can't you wear it out like that?,"[Why/WRB, can/MD, 't/PRP, you/PRP, wear/VBP, it/PRP, out/RP, like/IN, that/IN, ?/.]",(ROOT (SBARQ (WHADVP (WRB Why)) (SQ (MD can) (NP (PRP 't)) (VP (ADVP (PRP you)) (VBP wear) (NP (PRP it)) (PRT (RP out)) (PP (IN like) (ADVP (IN that))))) (. ?)))
K/KB/KBK.xml,KBKRE00A,2011,67,,B,46,1,"Because you destroy the blouse, the the way that the belt (()) ","[Because/IN, you/PRP, destroy/VBP, the/DT, blouse/NN, ,/,, the/DT, the/DT, way/NN, that/IN, the/DT, belt/NN]","(ROOT (SBAR (IN Because) (S (NP (PRP you)) (VP (VBP destroy) (NP (NP (DT the) (NN blouse)) (, ,) (NP (NP (DT the) (DT the) (NN way)) (PP (IN that) (NP (DT the) (NN belt)))))))))"
K/KB/KBK.xml,KBKRE00A,2011,68,,A,47,1,"Well that doesn't matter if you've got your, if you've got your jack- your jackety effect then haven't you?","[Well/RB, that/IN, doesn/NN, 't/PRP, matter/VBP, if/IN, you/PRP, 've/VBP, got/VBN, your/PRP$, ,/,, if/IN, you/PRP, 've/VBP, got/VBN, your/PRP$, jack-/JJ, your/PRP$, jackety/NN, effect/NN, then/RB, haven/NN, 't/PRP, you/PRP, ?/.]","(ROOT (FRAG (ADVP (RB Well)) (SBAR (IN that) (FRAG (NP (NP (NN doesn)) (SBAR (S (NP (PRP 't)) (VP (VBP matter) (SBAR (IN if) (S (NP (PRP you)) (VP (VBP 've) (VP (VBN got) (NP (PRP$ your)) (, ,) (SBAR (IN if) (S (NP (PRP you)) (VP (VBP 've) (VP (VBN got) (NP (PRP$ your) (JJ jack-) (NP (PRP$ your) (NN jackety) (NN effect) (RB then)) (NN haven)) (NP (NP (PRP 't)) (ADVP (PRP you))))))))))))))))) (. ?)))"
K/KB/KBK.xml,KBKRE00A,2011,69,,B,48,1,"I suppose you could, if you were going to wear it like that, you could take the belt right off.","[I/PRP, suppose/VBP, you/PRP, could/MD, ,/,, if/IN, you/PRP, were/VBD, going/VBG, to/TO, wear/VB, it/PRP, like/IN, that/DT, ,/,, you/PRP, could/MD, take/VB, the/DT, belt/NN, right/NN, off/RB, ./.]","(ROOT (S (S (NP (PRP I)) (VP (VBP suppose) (SBAR (S (NP (PRP you)) (VP (MD could)))) (, ,) (SBAR (IN if) (S (NP (PRP you)) (VP (VBD were) (VP (VBG going) (S (VP (TO to) (VP (VB wear) (NP (PRP it)) (PP (IN like) (NP (DT that)))))))))))) (, ,) (NP (PRP you)) (VP (MD could) (VP (VB take) (NP (DT the) (NN belt) (NN right)) (ADVP (RB off)))) (. .)))"
K/KB/KBK.xml,KBKRE00A,2011,70,,A,49,1,Well you don't have to.,"[Well/RB, you/PRP, don/VBP, 't/PRP, have/VB, to/TO, ./.]",(ROOT (S (ADVP (RB Well)) (NP (PRP you)) (VP (VBP don) (S (NP (PRP 't)) (VP (VB have) (PP (TO to))))) (. .)))
K/KB/KBK.xml,KBKRE00A,2011,71,,B,50,1,"Well no but you, it, it, it's quite a heavy belt and if it, if it's holding, if it's giving point to it.","[Well/RB, no/DT, but/CC, you/PRP, ,/,, it/PRP, ,/,, it/PRP, ,/,, it/PRP, 's/VBZ, quite/RB, a/DT, heavy/JJ, belt/NN, and/CC, if/IN, it/PRP, ,/,, if/IN, it/PRP, 's/VBZ, holding/VBG, ,/,, if/IN, it/PRP, 's/VBZ, giving/VBG, point/NN, to/TO, it/PRP, ./.]","(ROOT (S (ADVP (RB Well)) (ADVP (DT no) (CC but)) (NP (NP (PRP you)) (, ,) (NP (PRP it)) (, ,) (NP (PRP it)) (, ,) (NP (PRP it))) (VP (VBZ 's) (UCP (FRAG (NP (RB quite) (DT a) (JJ heavy) (NN belt))) (CC and) (SBAR (PP (IN if) (NP (PRP it))) (, ,) (IN if) (S (NP (PRP it)) (VP (VBZ 's) (VP (VBG holding)))))) (, ,) (SBAR (IN if) (S (NP (PRP it)) (VP (VBZ 's) (VP (VBG giving) (NP (NN point)) (PP (TO to) (NP (PRP it)))))))) (. .)))"
K/KB/KBK.xml,KBKRE00A,2011,72,,A,51,1,Yes.,"[Yes/UH, ./.]",(ROOT (INTJ (UH Yes) (. .)))
K/KB/KBK.xml,KBKRE00A,2011,73,,A,51,2,"And that would make it a, an even cooler outfit wouldn't it?","[And/CC, that/DT, would/MD, make/VB, it/PRP, a/DT, ,/,, an/DT, even/RB, cooler/JJR, outfit/NN, wouldn/NN, 't/PRP, it/PRP, ?/.]","(ROOT (S (S (CC And) (NP (DT that)) (VP (MD would) (VP (VB make) (NP (PRP it) (DT a))))) (, ,) (S (NP (NP (NP (DT an) (RB even) (JJR cooler) (NN outfit)) (NP (NN wouldn))) (NP (PRP 't))) (NP (PRP it))) (. ?)))"
K/KB/KBK.xml,KBKRE00A,2011,74,,B,52,1,Yes.,"[Yes/UH, ./.]",(ROOT (INTJ (UH Yes) (. .)))
K/KB/KBK.xml,KBKRE00A,2011,75,,B,52,2,Because I have got this    --,"[Because/IN, I/PRP, have/VBP, got/VBN, this/DT, this/DT, this/DT, creamy/JJ, shirt/NN, ./.]",(ROOT (S (PP (IN Because) (NP (PRP I))) (VP (VBP have) (VP (VBN got) (NP (DT this)))) (NP (NP (DT this)) (NP (DT this) (JJ creamy) (NN shirt))) (. .)))
K/KB/KBK.xml,KBKRE00A,2011,76,,B,52,3,--(()) --,"[Because/IN, I/PRP, have/VBP, got/VBN, this/DT, this/DT, this/DT, creamy/JJ, shirt/NN, ./.]",(ROOT (S (PP (IN Because) (NP (PRP I))) (VP (VBP have) (VP (VBN got) (NP (DT this)))) (NP (NP (DT this)) (NP (DT this) (JJ creamy) (NN shirt))) (. .)))
K/KB/KBK.xml,KBKRE00A,2011,77,,B,52,4,--this  --,"[Because/IN, I/PRP, have/VBP, got/VBN, this/DT, this/DT, this/DT, creamy/JJ, shirt/NN, ./.]",(ROOT (S (PP (IN Because) (NP (PRP I))) (VP (VBP have) (VP (VBN got) (NP (DT this)))) (NP (NP (DT this)) (NP (DT this) (JJ creamy) (NN shirt))) (. .)))
K/KB/KBK.xml,KBKRE00A,2011,78,,B,52,5,--this creamy shirt.,"[Because/IN, I/PRP, have/VBP, got/VBN, this/DT, this/DT, this/DT, creamy/JJ, shirt/NN, ./.]",(ROOT (S (PP (IN Because) (NP (PRP I))) (VP (VBP have) (VP (VBN got) (NP (DT this)))) (NP (NP (DT this)) (NP (DT this) (JJ creamy) (NN shirt))) (. .)))
K/KB/KBK.xml,KBKRE00A,2011,79,,B,52,6,Erm  --,"[Erm/NN, which/WDT, I/PRP, saw/VBD, again/RB, in/IN, Marks/NNS, this/DT, year/NN, which/WDT, you/PRP, could/MD, wear/VB, tucked/VBN, in/IN, with/IN, a/DT, belt/NN, ./.]",(ROOT (S (NP (NP (NN Erm)) (SBAR (WHNP (WDT which)) (S (NP (PRP I)) (VP (VBD saw) (ADVP (RB again)) (PP (IN in) (NP (NP (NNS Marks)) (NP (DT this) (NN year)))) (SBAR (WHNP (WDT which)) (S (NP (PRP you)) (VP (MD could) (VP (VB wear))))))))) (VP (VBN tucked) (PP (IN in) (PP (IN with) (NP (DT a) (NN belt))))) (. .)))
K/KB/KBK.xml,KBKRE00A,2011,80,,B,52,7,--which I saw again in Marks this year  --,"[Erm/NN, which/WDT, I/PRP, saw/VBD, again/RB, in/IN, Marks/NNS, this/DT, year/NN, which/WDT, you/PRP, could/MD, wear/VB, tucked/VBN, in/IN, with/IN, a/DT, belt/NN, ./.]",(ROOT (S (NP (NP (NN Erm)) (SBAR (WHNP (WDT which)) (S (NP (PRP I)) (VP (VBD saw) (ADVP (RB again)) (PP (IN in) (NP (NP (NNS Marks)) (NP (DT this) (NN year)))) (SBAR (WHNP (WDT which)) (S (NP (PRP you)) (VP (MD could) (VP (VB wear))))))))) (VP (VBN tucked) (PP (IN in) (PP (IN with) (NP (DT a) (NN belt))))) (. .)))
K/KB/KBK.xml,KBKRE00A,2011,81,,B,52,8,--which you could wear tucked in with a belt.,"[Erm/NN, which/WDT, I/PRP, saw/VBD, again/RB, in/IN, Marks/NNS, this/DT, year/NN, which/WDT, you/PRP, could/MD, wear/VB, tucked/VBN, in/IN, with/IN, a/DT, belt/NN, ./.]",(ROOT (S (NP (NP (NN Erm)) (SBAR (WHNP (WDT which)) (S (NP (PRP I)) (VP (VBD saw) (ADVP (RB again)) (PP (IN in) (NP (NP (NNS Marks)) (NP (DT this) (NN year)))) (SBAR (WHNP (WDT which)) (S (NP (PRP you)) (VP (MD could) (VP (VB wear))))))))) (VP (VBN tucked) (PP (IN in) (PP (IN with) (NP (DT a) (NN belt))))) (. .)))
K/KB/KBK.xml,KBKRE00A,2011,82,,A,53,1,Yes.,"[Yes/UH, ./.]",(ROOT (INTJ (UH Yes) (. .)))
K/KB/KBK.xml,KBKRE00A,2011,83,,A,53,2,Yes.,"[Yes/UH, ./.]",(ROOT (INTJ (UH Yes) (. .)))
K/KB/KBK.xml,KBKRE00A,2011,84,,A,53,3,"But that one is, is genuinely versatile.","[But/CC, that/DT, one/CD, is/VBZ, ,/,, is/VBZ, genuinely/RB, versatile/JJ, ./.]","(ROOT (S (CC But) (NP (DT that) (CD one)) (VP (VBZ is) (, ,) (SQ (VBZ is) (ADJP (RB genuinely) (JJ versatile)))) (. .)))"
K/KB/KBK.xml,KBKRE00A,2011,85,,A,53,4,Looks just as good tucked in as,"[Looks/VBZ, just/RB, as/RB, good/JJ, tucked/VBN, in/IN, as/IN]",(ROOT (SINV (VP (VBZ Looks)) (NP (NP (RB just) (RB as) (JJ good)) (VP (VBN tucked) (PP (IN in) (NP (IN as)))))))
K/KB/KBK.xml,KBKRE00A,2011,86,,B,54,1,Yes.,"[Yes/UH, ./.]",(ROOT (INTJ (UH Yes) (. .)))
K/KB/KBK.xml,KBKRE00A,2011,87,,B,54,2,As I say the problem with the tucking in on that one is there's not quite such a lot of length.,"[As/IN, I/PRP, say/VBP, the/DT, problem/NN, with/IN, the/DT, tucking/NN, in/IN, on/IN, that/DT, one/CD, is/VBZ, there/EX, 's/VBZ, not/RB, quite/RB, such/JJ, a/DT, lot/NN, of/IN, length/NN, ./.]",(ROOT (S (SBAR (IN As) (S (NP (PRP I)) (VP (VBP say) (NP (NP (DT the) (NN problem)) (PP (IN with) (NP (DT the) (NN tucking)))) (PP (IN in) (PP (IN on) (NP (DT that) (CD one))))))) (VP (VBZ is) (SBAR (S (NP (EX there)) (VP (VBZ 's) (RB not) (ADVP (RB quite) (JJ such)) (NP (NP (DT a) (NN lot)) (PP (IN of) (NP (NN length)))))))) (. .)))
K/KB/KBK.xml,KBKRE00A,2011,88,,B,54,3,So when you do this you might come out.,"[So/RB, when/WRB, you/PRP, do/VBP, this/DT, you/PRP, might/MD, come/VB, out/RP, ./.]",(ROOT (S (ADVP (RB So) (SBAR (WHADVP (WRB when)) (S (NP (PRP you)) (VP (VBP do) (NP (DT this)))))) (NP (PRP you)) (VP (MD might) (VP (VB come) (PRT (RP out)))) (. .)))
K/KB/KBK.xml,KBKRE00A,2011,89,,A,55,1,"It'd start pulling out, yes.","[It/PRP, 'd/MD, start/VB, pulling/VBG, out/RP, ,/,, yes/UH, ./.]","(ROOT (S (S (NP (PRP It)) (VP (MD 'd) (VP (VB start) (S (VP (VBG pulling) (PRT (RP out))))))) (, ,) (FRAG (INTJ (UH yes))) (. .)))"
K/KB/KBK.xml,KBKRE00A,2011,90,,B,56,1,"Erm and I don't think it looks good hanging out because it's, you, you paying in the skirt and the belt and that.","[Erm/NN, and/CC, I/PRP, don/VBP, 't/PRP, think/VB, it/PRP, looks/VBZ, good/JJ, hanging/VBG, out/RP, because/IN, it/PRP, 's/VBZ, ,/,, you/PRP, ,/,, you/PRP, paying/VBG, in/IN, the/DT, skirt/NN, and/CC, the/DT, belt/NN, and/CC, that/IN, ./.]","(ROOT (S (NP (NP (NN Erm)) (CC and) (NP (PRP I))) (VP (VBP don) (S (NP (PRP 't)) (VP (VB think) (SBAR (S (NP (PRP it)) (VP (VBZ looks) (ADJP (JJ good) (S (VP (VBG hanging) (PRT (RP out)) (SBAR (IN because) (S (NP (PRP it)) (VP (VBZ 's) (, ,) (NP (PRP you)))))))) (, ,) (S (NP (PRP you)) (UCP (VP (VBG paying) (PP (IN in) (NP (NP (DT the) (NN skirt)) (CC and) (NP (DT the) (NN belt))))) (CC and) (ADJP (IN that)))))))))) (. .)))"
