swda_filename,ptb_basename,conversation_no,transcript_index,act_tag,caller,turn_index,subutterance_index,text,pos,trees
K/KB/KBK.xml,KBKRE005,2006,0,,A,1,1,Thank you for getting this tomato juice specially from Safeway's.,"[Thank/VB, you/PRP, for/IN, getting/VBG, this/DT, tomato/NN, juice/NN, specially/RB, from/IN, Safeway/NNP, 's/POS, ./.]",(ROOT (S (VP (VB Thank) (NP (PRP you)) (PP (IN for) (S (VP (VBG getting) (S (NP (DT this) (NN tomato)) (VP (NN juice) (ADVP (RB specially)) (PP (IN from) (NP (NNP Safeway) (POS 's))))))))) (. .)))
K/KB/KBK.xml,KBKRE005,2006,1,,B,2,1,When I go on half term I ought to  (()) all things.,"[When/WRB, I/PRP, go/VBP, on/IN, half/JJ, term/NN, I/PRP, ought/MD, to/TO, all/DT, things/NNS, ./.]",(ROOT (S (SBAR (WHADVP (WRB When)) (S (NP (PRP I)) (VP (VBP go) (PP (IN on) (NP (JJ half) (NN term)))))) (NP (PRP I)) (VP (MD ought) (PP (TO to) (NP (DT all) (NNS things)))) (. .)))
K/KB/KBK.xml,KBKRE005,2006,2,,B,2,2,Actually has been rather (()) ,"[Actually/RB, has/VBZ, been/VBN, rather/RB]",(ROOT (FRAG (VP (ADVP (RB Actually)) (VBZ has) (VP (VBN been) (ADVP (RB rather))))))
K/KB/KBK.xml,KBKRE005,2006,3,,A,3,1,What?,"[What/WDT, ?/.]",(ROOT (FRAG (WHNP (WDT What)) (. ?)))
K/KB/KBK.xml,KBKRE005,2006,4,,A,3,2,"Just not enough,(()) happening?","[Just/RB, not/RB, enough/RB, ,/,, happening/VBG, ?/.]","(ROOT (S (NP (NP (RB Just) (RB not)) (ADJP (RB enough))) (, ,) (VP (VBG happening)) (. ?)))"
K/KB/KBK.xml,KBKRE005,2006,5,,B,4,1,Break.,"[Break/NN, ./.]",(ROOT (NP (NN Break) (. .)))
K/KB/KBK.xml,KBKRE005,2006,6,,A,5,1,Enough break yes.,"[Enough/JJ, break/NN, yes/RB, ./.]",(ROOT (NP (NP (JJ Enough) (NN break)) (NP (RB yes)) (. .)))
K/KB/KBK.xml,KBKRE005,2006,7,,A,5,2,That's right.,"[That/DT, 's/VBZ, right/NN, ./.]",(ROOT (S (NP (DT That)) (VP (VBZ 's) (NP (NN right))) (. .)))
K/KB/KBK.xml,KBKRE005,2006,8,,B,6,1,(()) organized.,"[organized/VBN, ./.]",(ROOT (S (VP (VBN organized)) (. .)))
K/KB/KBK.xml,KBKRE005,2006,9,,B,6,2,Not enough change in your rate.(()) ,"[Not/RB, enough/JJ, change/NN, in/IN, your/PRP$, rate/NN, ./.]",(ROOT (FRAG (RB Not) (NP (NP (JJ enough) (NN change)) (PP (IN in) (NP (PRP$ your) (NN rate)))) (. .)))
K/KB/KBK.xml,KBKRE005,2006,10,,A,7,1,Yeah.,"[Yeah/UH, ./.]",(ROOT (INTJ (UH Yeah) (. .)))
K/KB/KBK.xml,KBKRE005,2006,11,,B,8,1,I feel clearer in my mind about  (()) which is a help.,"[I/PRP, feel/VBP, clearer/JJR, in/IN, my/PRP$, mind/NN, about/IN, which/WDT, is/VBZ, a/DT, help/NN, ./.]",(ROOT (S (NP (PRP I)) (VP (VBP feel) (ADJP (JJR clearer) (PP (IN in) (NP (PRP$ my) (NN mind))) (PP (IN about) (SBAR (WHNP (WDT which)) (S (VP (VBZ is) (NP (DT a) (NN help)))))))) (. .)))
K/KB/KBK.xml,KBKRE005,2006,12,,B,8,2,And I don't feel clear of things to do which is very miserable (()) ,"[And/CC, I/PRP, don/VBP, 't/PRP, feel/VB, clear/JJ, of/IN, things/NNS, to/TO, do/VB, which/WDT, is/VBZ, very/RB, miserable/JJ]",(ROOT (S (CC And) (NP (PRP I)) (VP (VBP don) (S (NP (PRP 't)) (VP (VB feel) (ADJP (JJ clear) (PP (IN of) (NP (NNS things) (S (VP (TO to) (VP (VB do) (SBAR (WHNP (WDT which)) (S (VP (VBZ is) (ADJP (RB very) (JJ miserable))))))))))))))))
K/KB/KBK.xml,KBKRE005,2006,13,,A,9,1,Well you're not doing your reports till after that time are you?,"[Well/RB, you/PRP, 're/VBP, not/RB, doing/VBG, your/PRP$, reports/NNS, till/IN, after/IN, that/DT, time/NN, are/VBP, you/PRP, ?/.]",(ROOT (S (ADVP (RB Well)) (NP (PRP you)) (VP (VBP 're) (RB not) (VP (VBG doing) (NP (PRP$ your) (NNS reports)) (SBAR (IN till) (IN after) (S (NP (DT that) (NN time)) (VP (VBP are) (NP (PRP you))))))) (. ?)))
K/KB/KBK.xml,KBKRE005,2006,14,,B,10,1,No they have to be in by the twenty sixth of June.,"[No/DT, they/PRP, have/VBP, to/TO, be/VB, in/IN, by/IN, the/DT, twenty/CD, sixth/NN, of/IN, June/NNP, ./.]",(ROOT (S (NP (DT No) (PRP they)) (VP (VBP have) (S (VP (TO to) (VP (VB be) (PP (IN in) (IN by) (NP (NP (DT the) (CD twenty) (NN sixth)) (PP (IN of) (NP (NNP June))))))))) (. .)))
K/KB/KBK.xml,KBKRE005,2006,15,,B,10,2,And the ten days after open day are going to be  --,"[And/CC, the/DT, ten/CD, days/NNS, after/IN, open/JJ, day/NN, are/VBP, going/VBG, to/TO, be/VB, mad/JJ, ./.]",(ROOT (S (CC And) (NP (NP (DT the) (CD ten) (NNS days)) (PP (IN after) (NP (JJ open) (NN day)))) (VP (VBP are) (VP (VBG going) (S (VP (TO to) (VP (VB be) (ADJP (JJ mad))))))) (. .)))
K/KB/KBK.xml,KBKRE005,2006,16,,B,10,3,--mad.,"[And/CC, the/DT, ten/CD, days/NNS, after/IN, open/JJ, day/NN, are/VBP, going/VBG, to/TO, be/VB, mad/JJ, ./.]",(ROOT (S (CC And) (NP (NP (DT the) (CD ten) (NNS days)) (PP (IN after) (NP (JJ open) (NN day)))) (VP (VBP are) (VP (VBG going) (S (VP (TO to) (VP (VB be) (ADJP (JJ mad))))))) (. .)))
K/KB/KBK.xml,KBKRE005,2006,17,,A,11,1,"Twenty six days, yes, ten days.","[Twenty/CD, six/CD, days/NNS, ,/,, yes/UH, ,/,, ten/CD, days/NNS, ./.]","(ROOT (NP (NP (NP (ADJP (ADJP (NP (CD Twenty)) (NP (CD six) (NNS days))) (PRN (, ,) (INTJ (UH yes)) (, ,)))) (NP (CD ten) (NNS days))) (. .)))"
K/KB/KBK.xml,KBKRE005,2006,18,,A,11,2,You've got sixteen days to do them in in theory.,"[You/PRP, 've/VBP, got/VBN, sixteen/CD, days/NNS, to/TO, do/VB, them/PRP, in/IN, in/IN, theory/NN, ./.]",(ROOT (S (NP (PRP You)) (VP (VBP 've) (VP (VBN got) (NP (CD sixteen) (NNS days)) (S (VP (TO to) (VP (VB do) (NP (PRP them)) (PP (IN in) (PP (IN in) (NP (NN theory))))))))) (. .)))
K/KB/KBK.xml,KBKRE005,2006,19,,B,12,1,Well I won't have really will I if (()) ,"[Well/RB, I/PRP, won/VBD, 't/PRP, have/VB, really/RB, will/MD, I/PRP, if/IN]",(ROOT (FRAG (ADVP (RB Well)) (NP (NP (PRP I)) (SBAR (S (VP (VBD won) (S (NP (PRP 't)) (VP (VB have) (ADVP (RB really)))) (SBAR (SINV (MD will) (NP (PRP I)) (ADVP (IN if))))))))))
K/KB/KBK.xml,KBKRE005,2006,20,,A,13,1,Is that the earlier day you all complained about?,"[Is/VBZ, that/IN, the/DT, earlier/JJR, day/NN, you/PRP, all/DT, complained/VBD, about/IN, ?/.]",(ROOT (SQ (VBZ Is) (SBAR (IN that) (FRAG (NP (NP (DT the) (JJR earlier) (NN day)) (SBAR (S (NP (PRP you)) (ADVP (DT all)) (VP (VBD complained))))))) (ADJP (IN about)) (. ?)))
K/KB/KBK.xml,KBKRE005,2006,21,,B,14,1,(()) three days on.,"[three/CD, days/NNS, on/IN, ./.]",(ROOT (NP (NP (CD three) (NNS days)) (PP (IN on)) (. .)))
K/KB/KBK.xml,KBKRE005,2006,22,,B,14,2,And we asked for an extra  --,"[And/CC, we/PRP, asked/VBD, for/IN, an/DT, extra/JJ, ten/CD, days/NNS, ./.]",(ROOT (S (CC And) (NP (PRP we)) (VP (VBD asked) (PP (IN for) (NP (DT an) (JJ extra) (CD ten) (NNS days)))) (. .)))
K/KB/KBK.xml,KBKRE005,2006,23,,B,14,3,--ten days.,"[And/CC, we/PRP, asked/VBD, for/IN, an/DT, extra/JJ, ten/CD, days/NNS, ./.]",(ROOT (S (CC And) (NP (PRP we)) (VP (VBD asked) (PP (IN for) (NP (DT an) (JJ extra) (CD ten) (NNS days)))) (. .)))
K/KB/KBK.xml,KBKRE005,2006,24,,B,14,4,At the moment we've got three.,"[At/IN, the/DT, moment/NN, we/PRP, 've/VBP, got/VBD, three/CD, ./.]",(ROOT (S (PP (IN At) (NP (DT the) (NN moment))) (NP (PRP we)) (VP (VBP 've) (VP (VBD got) (NP (CD three)))) (. .)))
K/KB/KBK.xml,KBKRE005,2006,25,,A,15,1,Did you get any explanations why it was all required in earlier?,"[Did/VBD, you/PRP, get/VB, any/DT, explanations/NNS, why/WRB, it/PRP, was/VBD, all/DT, required/VBN, in/IN, earlier/JJR, ?/.]",(ROOT (SQ (VBD Did) (NP (PRP you)) (VP (VB get) (NP (DT any) (NNS explanations)) (SBAR (WHADVP (WRB why)) (S (NP (PRP it)) (VP (VBD was) (ADVP (DT all)) (VP (VBN required) (PP (IN in) (ADVP (JJR earlier)))))))) (. ?)))
K/KB/KBK.xml,KBKRE005,2006,26,,B,16,1,No.,"[No/DT, ./.]",(ROOT (FRAG (NP (DT No)) (. .)))
K/KB/KBK.xml,KBKRE005,2006,27,,B,16,2,She just feels she wanted the time to do it in her time.,"[She/PRP, just/RB, feels/VBZ, she/PRP, wanted/VBD, the/DT, time/NN, to/TO, do/VB, it/PRP, in/IN, her/PRP$, time/NN, ./.]",(ROOT (S (NP (PRP She)) (ADVP (RB just)) (VP (VBZ feels) (SBAR (S (NP (PRP she)) (VP (VBD wanted) (NP (DT the) (NN time) (S (VP (TO to) (VP (VB do) (NP (PRP it)) (PP (IN in) (NP (PRP$ her) (NN time))))))))))) (. .)))
K/KB/KBK.xml,KBKRE005,2006,28,,B,16,3,(()) calling the tune.,"[calling/VBG, the/DT, tune/NN, ./.]",(ROOT (S (VP (VBG calling) (NP (DT the) (NN tune))) (. .)))
K/KB/KBK.xml,KBKRE005,2006,29,,B,16,4,As long as you don't do it too often.,"[As/RB, long/RB, as/IN, you/PRP, don/VBP, 't/PRP, do/VB, it/PRP, too/RB, often/RB, ./.]",(ROOT (FRAG (ADVP (RB As) (RB long)) (SBAR (IN as) (S (NP (PRP you)) (VP (VBP don) (S (NP (PRP 't)) (VP (VB do) (NP (PRP it)) (ADVP (RB too) (RB often))))))) (. .)))
K/KB/KBK.xml,KBKRE005,2006,30,,B,16,5,Don't do it too often just call the tune without justifying it.,"[Don/NNP, 't/PRP, do/VBP, it/PRP, too/RB, often/RB, just/RB, call/VB, the/DT, tune/NN, without/IN, justifying/VBG, it/PRP, ./.]",(ROOT (S (NP (NNP Don) (PRP 't)) (VP (VBP do) (S (NP (PRP it)) (VP (ADVP (RB too) (RB often) (RB just)) (VB call) (NP (NP (DT the) (NN tune)) (PP (IN without) (S (VP (VBG justifying) (NP (PRP it))))))))) (. .)))
K/KB/KBK.xml,KBKRE005,2006,31,,B,16,6,People get a bit resentful.,"[People/NNS, get/VBP, a/DT, bit/NN, resentful/JJ, ./.]",(ROOT (S (NP (NNS People)) (VP (VBP get) (S (NP (DT a) (NN bit)) (ADJP (JJ resentful)))) (. .)))
K/KB/KBK.xml,KBKRE005,2006,32,,A,17,1,Yes.,"[Yes/UH, ./.]",(ROOT (INTJ (UH Yes) (. .)))
K/KB/KBK.xml,KBKRE005,2006,33,,A,17,2,Do you think that in all schools the head always looked at all the reports?,"[Do/VB, you/PRP, think/VBP, that/IN, in/IN, all/DT, schools/NNS, the/DT, head/NN, always/RB, looked/VBD, at/IN, all/DT, the/DT, reports/NNS, ?/.]",(ROOT (SQ (VP (VB Do) (SBAR (S (NP (PRP you)) (VP (VBP think) (SBAR (IN that) (S (PP (IN in) (NP (DT all) (NNS schools))) (NP (DT the) (NN head)) (ADVP (RB always)) (VP (VBD looked) (ADVP (IN at) (DT all)) (NP (DT the) (NNS reports))))))))) (. ?)))
K/KB/KBK.xml,KBKRE005,2006,34,,B,18,1,When I was at school they hadn't signed them.,"[When/WRB, I/PRP, was/VBD, at/IN, school/NN, they/PRP, hadn/VBP, 't/PRP, signed/VBD, them/PRP, ./.]",(ROOT (S (SBAR (WHADVP (WRB When)) (S (NP (PRP I)) (VP (VBD was) (PP (IN at) (NP (NN school)))))) (NP (PRP they)) (VP (VBP hadn) (SBAR (S (NP (PRP 't)) (VP (VBD signed) (NP (PRP them)))))) (. .)))
K/KB/KBK.xml,KBKRE005,2006,35,,B,18,2,(()) every school  (()) signed them.,"[every/DT, school/NN, signed/VBD, them/PRP, ./.]",(ROOT (S (NP (DT every) (NN school)) (VP (VBD signed) (NP (PRP them))) (. .)))
K/KB/KBK.xml,KBKRE005,2006,36,,B,18,3,I suspect Mrs  <<REDACTED (name)>> feels she ought to be signing them not the (()) ,"[I/PRP, suspect/VBP, Mrs/NNP, >/JJR, feels/VBZ, she/PRP, ought/MD, to/TO, be/VB, signing/VBG, them/PRP, not/RB, the/DT]",(ROOT (S (NP (PRP I)) (VP (VBP suspect) (S (NP (NNP Mrs)) (ADJP (JJR >)) (S (VP (VBZ feels) (SBAR (S (NP (PRP she)) (VP (MD ought) (S (VP (TO to) (VP (VB be) (VP (VBG signing) (S (NP (PRP them)) (NP (RB not) (DT the))))))))))))))))
K/KB/KBK.xml,KBKRE005,2006,37,,A,19,1,(()) .,[./.],(ROOT (NP (. .)))
K/KB/KBK.xml,KBKRE005,2006,38,,A,19,2,That pot's finished now.,"[That/DT, pot/NN, 's/POS, finished/VBN, now/RB, ./.]",(ROOT (NP (NP (DT That) (NP (NN pot) (POS 's))) (VP (VBN finished) (ADVP (RB now))) (. .)))
K/KB/KBK.xml,KBKRE005,2006,39,,A,19,3,What a funny idea this queue down  (()) parks isn't it?,"[What/WP, a/DT, funny/JJ, idea/NN, this/DT, queue/VB, down/RP, parks/NNS, isn/VBP, 't/PRP, it/PRP, ?/.]",(ROOT (SBARQ (WHNP (WHNP (WP What) (DT a) (JJ funny) (NN idea)) (NP (DT this))) (SQ (VP (VB queue) (PRT (RP down)) (NP (NP (NNS parks)) (SBAR (S (VP (VBP isn) (S (NP (PRP 't)) (NP (PRP it))))))))) (. ?)))
K/KB/KBK.xml,KBKRE005,2006,40,,B,20,1,Some people obviously overdo it.,"[Some/DT, people/NNS, obviously/RB, overdo/VBP, it/PRP, ./.]",(ROOT (S (NP (DT Some) (NNS people)) (ADVP (RB obviously)) (VP (VBP overdo) (NP (PRP it))) (. .)))
K/KB/KBK.xml,KBKRE005,2006,41,,A,21,1,Mm.,"[Mm/NN, ./.]",(ROOT (NP (NN Mm) (. .)))
K/KB/KBK.xml,KBKRE005,2006,42,,A,21,2,Did you see that   --,"[Did/VBD, you/PRP, see/VBP, that/IN, thing/NN, on/IN, television/NN, last/JJ, night/NN, ?/.]",(ROOT (S (VP (VBD Did) (SBAR (S (NP (PRP you)) (VP (VBP see) (PP (IN that) (NP (NP (NN thing)) (PP (IN on) (NP (NN television))) (NP (JJ last) (NN night)))))))) (. ?)))
K/KB/KBK.xml,KBKRE005,2006,43,,A,21,3,--(()) thing on television last night?,"[Did/VBD, you/PRP, see/VBP, that/IN, thing/NN, on/IN, television/NN, last/JJ, night/NN, ?/.]",(ROOT (S (VP (VBD Did) (SBAR (S (NP (PRP you)) (VP (VBP see) (PP (IN that) (NP (NP (NN thing)) (PP (IN on) (NP (NN television))) (NP (JJ last) (NN night)))))))) (. ?)))
K/KB/KBK.xml,KBKRE005,2006,44,,B,22,1,(()) got their hats back.,"[got/VBD, their/PRP$, hats/NNS, back/RB, ./.]",(ROOT (S (VP (VBD got) (NP (PRP$ their) (NNS hats)) (ADVP (RB back))) (. .)))
K/KB/KBK.xml,KBKRE005,2006,45,,A,23,1,I'm interested there were women mixed in with them.,"[I/PRP, 'm/VBP, interested/JJ, there/EX, were/VBD, women/NNS, mixed/VBN, in/IN, with/IN, them/PRP, ./.]",(ROOT (S (NP (PRP I)) (VP (VBP 'm) (ADJP (JJ interested) (SBAR (S (NP (EX there)) (VP (VBD were) (NP (NP (NNS women)) (ADJP (VBN mixed) (PP (IN in) (PP (IN with) (NP (PRP them))))))))))) (. .)))
K/KB/KBK.xml,KBKRE005,2006,46,,A,23,2,Just the same uniform.,"[Just/RB, the/DT, same/JJ, uniform/NN, ./.]",(ROOT (NP (RB Just) (DT the) (JJ same) (NN uniform) (. .)))
K/KB/KBK.xml,KBKRE005,2006,47,,B,24,1,I didn't notice that.,"[I/PRP, didn/VBP, 't/PRP, notice/VB, that/DT, ./.]",(ROOT (S (NP (PRP I)) (VP (VBP didn) (S (NP (PRP 't)) (VP (VB notice) (NP (DT that))))) (. .)))
K/KB/KBK.xml,KBKRE005,2006,48,,A,25,1,Look at this lovely picture of this High Commissioner in Sri Lanka who's been booted out in his Morris Minor.,"[Look/VB, at/IN, this/DT, lovely/JJ, picture/NN, of/IN, this/DT, High/JJ, Commissioner/NN, in/IN, Sri/NNP, Lanka/NNP, who/WP, 's/VBZ, been/VBN, booted/VBN, out/RP, in/IN, his/PRP$, Morris/NNP, Minor/NNP, ./.]",(ROOT (S (VP (VB Look) (PP (IN at) (NP (NP (DT this) (JJ lovely) (NN picture)) (PP (IN of) (NP (DT this) (JJ High) (NN Commissioner))))) (PP (IN in) (NP (NP (NNP Sri) (NNP Lanka)) (SBAR (WHNP (WP who)) (S (VP (VBZ 's) (VP (VBN been) (VP (VBN booted) (PRT (RP out)) (PP (IN in) (NP (PRP$ his) (NNP Morris) (NNP Minor))))))))))) (. .)))
K/KB/KBK.xml,KBKRE005,2006,49,,A,25,2,Somebody is about to set up,"[Somebody/NN, is/VBZ, about/IN, to/TO, set/VB, up/RP]",(ROOT (S (NP (NN Somebody)) (VP (VBZ is) (VP (IN about) (S (VP (TO to) (VP (VB set) (PRT (RP up)))))))))
K/KB/KBK.xml,KBKRE005,2006,50,,B,26,1,Who pays?,"[Who/WP, pays/VBZ, ?/.]",(ROOT (SBARQ (WHNP (WP Who)) (SQ (VP (VBZ pays))) (. ?)))
K/KB/KBK.xml,KBKRE005,2006,51,,A,27,1,"(()) convertible by the look of it, still.","[convertible/JJ, by/IN, the/DT, look/NN, of/IN, it/PRP, ,/,, still/RB, ./.]","(ROOT (FRAG (ADJP (JJ convertible) (PP (IN by) (NP (NP (NP (DT the) (NN look)) (PP (IN of) (NP (PRP it)))) (, ,) (ADVP (RB still))))) (. .)))"
K/KB/KBK.xml,KBKRE005,2006,52,,A,27,2,Mm about to set up a factory in Sri Lanka to make Morris Minor parts.,"[Mm/NN, about/IN, to/TO, set/VB, up/RP, a/DT, factory/NN, in/IN, Sri/NNP, Lanka/NNP, to/TO, make/VB, Morris/NNP, Minor/JJ, parts/NNS, ./.]",(ROOT (NP (NP (NN Mm)) (ADJP (IN about) (S (VP (TO to) (VP (VB set) (PRT (RP up)) (NP (NP (DT a) (NN factory)) (PP (IN in) (NP (NNP Sri) (NNP Lanka)))) (S (VP (TO to) (VP (VB make) (NP (NNP Morris) (JJ Minor) (NNS parts))))))))) (. .)))
K/KB/KBK.xml,KBKRE005,2006,53,,A,27,3,To rebuild them.,"[To/TO, rebuild/VB, them/PRP, ./.]",(ROOT (S (VP (TO To) (VP (VB rebuild) (NP (PRP them)))) (. .)))
K/KB/KBK.xml,KBKRE005,2006,54,,B,28,1,Will they find him another job now?,"[Will/MD, they/PRP, find/VB, him/PRP, another/DT, job/NN, now/RB, ?/.]",(ROOT (SQ (MD Will) (NP (PRP they)) (VP (VB find) (NP (PRP him)) (ADVP (NP (DT another) (NN job)) (RB now))) (. ?)))
K/KB/KBK.xml,KBKRE005,2006,55,,B,28,2,What do they do then then?,"[What/WP, do/VBP, they/PRP, do/VBP, then/RB, then/RB, ?/.]",(ROOT (SBARQ (WHNP (WP What)) (SQ (VBP do) (NP (PRP they)) (VP (VBP do) (NP (RB then)) (ADVP (RB then)))) (. ?)))
K/KB/KBK.xml,KBKRE005,2006,56,,A,29,1,Well he's employed by the Foreign Office.,"[Well/RB, he/PRP, 's/VBZ, employed/VBN, by/IN, the/DT, Foreign/JJ, Office/NN, ./.]",(ROOT (S (ADVP (RB Well)) (NP (PRP he)) (VP (VBZ 's) (VP (VBN employed) (PP (IN by) (NP (DT the) (JJ Foreign) (NN Office))))) (. .)))
K/KB/KBK.xml,KBKRE005,2006,57,,B,30,1,Mm.,"[Mm/NN, ./.]",(ROOT (NP (NN Mm) (. .)))
K/KB/KBK.xml,KBKRE005,2006,58,,B,30,2,So will they send him somewhere else?,"[So/RB, will/MD, they/PRP, send/VB, him/PRP, somewhere/RB, else/RB, ?/.]",(ROOT (SBARQ (WHADVP (RB So)) (SQ (MD will) (NP (PRP they)) (VP (VB send) (NP (PRP him)) (ADVP (RB somewhere) (RB else)))) (. ?)))
K/KB/KBK.xml,KBKRE005,2006,59,,A,31,1,Probably.,"[Probably/RB, ./.]",(ROOT (FRAG (ADVP (RB Probably)) (. .)))
K/KB/KBK.xml,KBKRE005,2006,60,,A,31,2,Or they'll keep him in London.,"[Or/CC, they/PRP, 'll/MD, keep/VB, him/PRP, in/IN, London/NNP, ./.]",(ROOT (S (CC Or) (NP (PRP they)) (VP (MD 'll) (VP (VB keep) (NP (PRP him)) (PP (IN in) (NP (NNP London))))) (. .)))
K/KB/KBK.xml,KBKRE005,2006,61,,A,31,3,Sri Lankan desk or something.,"[Sri/NNP, Lankan/NNP, desk/NN, or/CC, something/NN, ./.]",(ROOT (NP (NP (NNP Sri) (NNP Lankan)) (NP (NN desk) (CC or) (NN something)) (. .)))
K/KB/KBK.xml,KBKRE005,2006,62,,B,32,1,Wonder what happened to (()) .,"[Wonder/VB, what/WP, happened/VBD, to/TO, ./.]",(ROOT (S (VP (VB Wonder) (SBAR (WHNP (WP what)) (S (VP (VBD happened) (PP (TO to)))))) (. .)))
K/KB/KBK.xml,KBKRE005,2006,63,,B,32,2,after Washington.,"[after/IN, Washington/NNP, ./.]",(ROOT (FRAG (PP (IN after) (NP (NNP Washington))) (. .)))
K/KB/KBK.xml,KBKRE005,2006,64,,A,33,1,He'll  --,"[He/PRP, 'll/MD, probably/RB, merge/VB, back/RB, into/IN, the/DT, Department/NN, of/IN, Transport/NN, ./.]",(ROOT (S (NP (PRP He)) (VP (MD 'll) (ADVP (RB probably)) (VP (VB merge) (ADVP (RB back)) (PP (IN into) (NP (NP (DT the) (NN Department)) (PP (IN of) (NP (NN Transport))))))) (. .)))
K/KB/KBK.xml,KBKRE005,2006,65,,A,33,2,--probably merge back into the Department of Transport.,"[He/PRP, 'll/MD, probably/RB, merge/VB, back/RB, into/IN, the/DT, Department/NN, of/IN, Transport/NN, ./.]",(ROOT (S (NP (PRP He)) (VP (MD 'll) (ADVP (RB probably)) (VP (VB merge) (ADVP (RB back)) (PP (IN into) (NP (NP (DT the) (NN Department)) (PP (IN of) (NP (NN Transport))))))) (. .)))
K/KB/KBK.xml,KBKRE005,2006,66,,A,33,3,Might do something else in the environment.,"[Might/MD, do/VB, something/NN, else/RB, in/IN, the/DT, environment/NN, ./.]",(ROOT (S (VP (MD Might) (VP (VB do) (NP (NP (NN something) (RB else)) (PP (IN in) (NP (DT the) (NN environment)))))) (. .)))
K/KB/KBK.xml,KBKRE005,2006,67,,B,34,1,Oh there was some talk of  --,"[Oh/UH, there/EX, was/VBD, some/DT, talk/NN, of/IN, going/VBG, somewhere/RB, else/RB, ./.]",(ROOT (S (S (INTJ (UH Oh)) (NP (EX there)) (VP (VBD was) (NP (NP (DT some) (NN talk)) (PP (IN of) (S (VP (VBG going) (NP (RB somewhere) (RB else)))))))) (. .)))
K/KB/KBK.xml,KBKRE005,2006,68,,B,34,2,--going somewhere else.,"[Oh/UH, there/EX, was/VBD, some/DT, talk/NN, of/IN, going/VBG, somewhere/RB, else/RB, ./.]",(ROOT (S (S (INTJ (UH Oh)) (NP (EX there)) (VP (VBD was) (NP (NP (DT some) (NN talk)) (PP (IN of) (S (VP (VBG going) (NP (RB somewhere) (RB else)))))))) (. .)))
K/KB/KBK.xml,KBKRE005,2006,69,,A,35,1,Oh was there?,"[Oh/UH, was/VBD, there/EX, ?/.]",(ROOT (SBARQ (WHNP (UH Oh)) (SQ (VBD was) (NP (EX there))) (. ?)))
K/KB/KBK.xml,KBKRE005,2006,70,,B,36,1,Mm.,"[Mm/NN, ./.]",(ROOT (NP (NN Mm) (. .)))
K/KB/KBK.xml,KBKRE005,2006,71,,B,36,2,"Well I mean, not an offer but","[Well/RB, I/PRP, mean/VBP, ,/,, not/RB, an/DT, offer/NN, but/CC]","(ROOT (FRAG (ADVP (RB Well)) (NP (NP (PRP I)) (SBAR (S (VP (VBP mean) (, ,) (ADVP (RB not) (NP (DT an) (NN offer))) (ADVP (CC but))))))))"
K/KB/KBK.xml,KBKRE005,2006,72,,A,37,1,They would like to.,"[They/PRP, would/MD, like/VB, to/TO, ./.]",(ROOT (S (NP (PRP They)) (VP (MD would) (VP (VB like) (PP (TO to)))) (. .)))
K/KB/KBK.xml,KBKRE005,2006,73,,A,37,2,Mm.,"[Mm/NN, ./.]",(ROOT (NP (NN Mm) (. .)))
K/KB/KBK.xml,KBKRE005,2006,74,,B,38,1,"I don't know if (()) , but it's on the cards that one could.","[I/PRP, don/VBP, 't/PRP, know/VB, if/IN, ,/,, but/CC, it/PRP, 's/VBZ, on/IN, the/DT, cards/NNS, that/WDT, one/CD, could/MD, ./.]","(ROOT (S (S (NP (PRP I)) (VP (VBP don) (S (NP (PRP 't)) (VP (VB know) (ADVP (IN if)))))) (, ,) (CC but) (S (NP (PRP it)) (VP (VBZ 's) (PP (IN on) (NP (NP (DT the) (NNS cards)) (SBAR (WHNP (WDT that)) (S (NP (CD one)) (VP (MD could)))))))) (. .)))"
K/KB/KBK.xml,KBKRE005,2006,75,,A,39,1,Oh.,"[Oh/UH, ./.]",(ROOT (INTJ (UH Oh) (. .)))
K/KB/KBK.xml,KBKRE005,2006,76,,A,39,2,Roy's idea was that er might get some highly paid job in industry.,"[Roy/NNP, 's/POS, idea/NN, was/VBD, that/IN, er/NN, might/MD, get/VB, some/DT, highly/RB, paid/VBN, job/NN, in/IN, industry/NN, ./.]",(ROOT (S (NP (NP (NNP Roy) (POS 's)) (NN idea)) (VP (VBD was) (SBAR (IN that) (S (NP (NN er)) (VP (MD might) (VP (VB get) (NP (NP (DT some) (ADJP (RB highly) (VBN paid)) (NN job)) (PP (IN in) (NP (NN industry))))))))) (. .)))
K/KB/KBK.xml,KBKRE005,2006,77,,A,39,3,Aviation or something.,"[Aviation/NN, or/CC, something/NN, ./.]",(ROOT (NP (NP (NP (NN Aviation)) (CC or) (NP (NN something))) (. .)))
K/KB/KBK.xml,KBKRE005,2006,78,,B,40,1,Are you making more toast?,"[Are/VBP, you/PRP, making/VBG, more/JJR, toast/NN, ?/.]",(ROOT (SQ (VBP Are) (NP (PRP you)) (VP (VBG making) (NP (JJR more) (NN toast))) (. ?)))
K/KB/KBK.xml,KBKRE005,2006,79,,A,41,1,"Oh yes, yes I shall.","[Oh/UH, yes/UH, ,/,, yes/UH, I/PRP, shall/MD, ./.]","(ROOT (S (S (INTJ (INTJ (UH Oh) (UH yes)) (, ,) (INTJ (UH yes))) (NP (PRP I)) (VP (MD shall))) (. .)))"
K/KB/KBK.xml,KBKRE005,2006,80,,A,41,2,Gosh I'm not thinking straight.,"[Gosh/NNP, I/PRP, 'm/VBP, not/RB, thinking/VBG, straight/RB, ./.]",(ROOT (S (NP (NNP Gosh) (PRP I)) (VP (VBP 'm) (RB not) (VP (VBG thinking) (ADVP (RB straight)))) (. .)))
K/KB/KBK.xml,KBKRE005,2006,81,,A,41,3,I'll make some more.,"[I/PRP, 'll/MD, make/VB, some/DT, more/JJR, ./.]",(ROOT (S (NP (PRP I)) (VP (MD 'll) (VP (VB make) (NP (DT some) (JJR more)))) (. .)))
K/KB/KBK.xml,KBKRE005,2006,82,,B,42,1,(()) bit addictive with this at times.,"[bit/NN, addictive/JJ, with/IN, this/DT, at/IN, times/NNS, ./.]",(ROOT (NP (NP (NN bit) (JJ addictive)) (PP (IN with) (NP (DT this))) (PP (IN at) (NP (NNS times))) (. .)))
K/KB/KBK.xml,KBKRE005,2006,83,,B,42,2,That's why I try (()) .,"[That/DT, 's/VBZ, why/WRB, I/PRP, try/VBP, ./.]",(ROOT (S (NP (DT That)) (VP (VBZ 's) (SBAR (WHADVP (WRB why)) (S (NP (PRP I)) (VP (VBP try))))) (. .)))
K/KB/KBK.xml,KBKRE005,2006,84,,A,43,1,"It's, it's sitting down that's addictive is it?","[It/PRP, 's/VBZ, ,/,, it/PRP, 's/VBZ, sitting/VBG, down/RP, that/DT, 's/VBZ, addictive/JJ, is/VBZ, it/PRP, ?/.]","(ROOT (S (NP (PRP It)) (VP (VBZ 's) (, ,) (SBAR (S (NP (PRP it)) (VP (VBZ 's) (VP (VBG sitting) (PRT (RP down)) (NP (NP (DT that)) (SBAR (S (VP (VBZ 's) (ADJP (JJ addictive) (SBAR (S (VP (VBZ is) (NP (PRP it))))))))))))))) (. ?)))"
K/KB/KBK.xml,KBKRE005,2006,85,,A,43,2,Not having breakfast.,"[Not/RB, having/VBG, breakfast/NN, ./.]",(ROOT (S (VP (RB Not) (VBG having) (NP (NN breakfast))) (. .)))
K/KB/KBK.xml,KBKRE005,2006,86,,B,44,1,Having breakfast when you're sitting down.,"[Having/VBG, breakfast/NN, when/WRB, you/PRP, 're/VBP, sitting/VBG, down/RP, ./.]",(ROOT (S (VP (VBG Having) (NP (NP (NN breakfast)) (SBAR (WHADVP (WRB when)) (S (NP (PRP you)) (VP (VBP 're) (VP (VBG sitting) (PRT (RP down)))))))) (. .)))
K/KB/KBK.xml,KBKRE005,2006,87,,B,44,2,You don't actually,"[You/PRP, don/VBP, 't/PRP, actually/RB]",(ROOT (S (NP (PRP You)) (VP (VBP don) (NP (PRP 't)) (ADVP (RB actually)))))
K/KB/KBK.xml,KBKRE005,2006,88,,A,45,1,You mean you might get into a good habit?,"[You/PRP, mean/VBP, you/PRP, might/MD, get/VB, into/IN, a/DT, good/JJ, habit/NN, ?/.]",(ROOT (S (NP (PRP You)) (VP (VBP mean) (SBAR (S (NP (PRP you)) (VP (MD might) (VP (VB get) (PP (IN into) (NP (DT a) (JJ good) (NN habit)))))))) (. ?)))
K/KB/KBK.xml,KBKRE005,2006,89,,B,46,1,(()) late to school.,"[late/JJ, to/TO, school/NN, ./.]",(ROOT (NP (NP (JJ late)) (PP (TO to) (NP (NN school))) (. .)))
K/KB/KBK.xml,KBKRE005,2006,90,,A,47,1,I must say I like it.,"[I/PRP, must/MD, say/VB, I/PRP, like/IN, it/PRP, ./.]",(ROOT (S (NP (PRP I)) (VP (MD must) (VP (VB say) (NP (PRP I)) (PP (IN like) (NP (PRP it))))) (. .)))
K/KB/KBK.xml,KBKRE005,2006,91,,B,48,1,I'll tell you what.,"[I/PRP, 'll/MD, tell/VB, you/PRP, what/WDT, ./.]",(ROOT (S (NP (PRP I)) (VP (MD 'll) (VP (VB tell) (S (NP (PRP you)) (NP (WDT what))))) (. .)))
K/KB/KBK.xml,KBKRE005,2006,92,,B,48,2,Erm  --,"[Erm/NN, go/VB, without/IN, lunch/NN, to/TO, make/VB, up/RP, for/IN, it/PRP, ./.]",(ROOT (S (NP (NN Erm)) (VP (VB go) (PP (IN without) (NP (NN lunch))) (S (VP (TO to) (VP (VB make) (PRT (RP up)) (PP (IN for) (NP (PRP it))))))) (. .)))
K/KB/KBK.xml,KBKRE005,2006,93,,B,48,3,--go without lunch to make up for it.,"[Erm/NN, go/VB, without/IN, lunch/NN, to/TO, make/VB, up/RP, for/IN, it/PRP, ./.]",(ROOT (S (NP (NN Erm)) (VP (VB go) (PP (IN without) (NP (NN lunch))) (S (VP (TO to) (VP (VB make) (PRT (RP up)) (PP (IN for) (NP (PRP it))))))) (. .)))
K/KB/KBK.xml,KBKRE005,2006,94,,A,49,1,To make up for what?,"[To/TO, make/VB, up/RP, for/IN, what/WP, ?/.]",(ROOT (S (VP (TO To) (VP (VB make) (PRT (RP up)) (PP (IN for) (NP (WP what))))) (. ?)))
K/KB/KBK.xml,KBKRE005,2006,95,,A,49,2,My having my normal breakfast?,"[My/PRP$, having/VBG, my/PRP$, normal/JJ, breakfast/NN, ?/.]",(ROOT (NP (NP (PRP$ My)) (VP (VBG having) (NP (PRP$ my) (JJ normal) (NN breakfast))) (. ?)))
K/KB/KBK.xml,KBKRE005,2006,96,,B,50,1,Oh it's just me that's got to give up lunch is it?,"[Oh/UH, it/PRP, 's/VBZ, just/RB, me/PRP, that/DT, 's/VBZ, got/VBN, to/TO, give/VB, up/RP, lunch/NN, is/VBZ, it/PRP, ?/.]",(ROOT (S (S (INTJ (UH Oh)) (NP (PRP it)) (VP (VBZ 's) (ADVP (RB just)) (NP (PRP me)))) (NP (DT that)) (VP (VBZ 's) (VP (VBN got) (S (VP (TO to) (VP (VB give) (PRT (RP up)) (NP (NP (NN lunch)) (SBAR (S (VP (VBZ is) (NP (PRP it))))))))))) (. ?)))
