swda_filename,ptb_basename,conversation_no,transcript_index,act_tag,caller,turn_index,subutterance_index,text,pos,trees
K/KC/KCN.xml,KCNRE01K,27602,0,,A,1,1,Doing a fine job!,"[Doing/VBG, a/DT, fine/JJ, job/NN, !/.]",(ROOT (S (VP (VBG Doing) (NP (DT a) (JJ fine) (NN job))) (. !)))
K/KC/KCN.xml,KCNRE01K,27602,1,,B,2,1,Are you?,"[Are/VBP, you/PRP, ?/.]",(ROOT (S (VP (VBP Are) (NP (PRP you))) (. ?)))
K/KC/KCN.xml,KCNRE01K,27602,2,,B,2,2,What in?,"[What/WDT, in/IN, ?/.]",(ROOT (FRAG (WHNP (WDT What)) (PP (IN in)) (. ?)))
K/KC/KCN.xml,KCNRE01K,27602,3,,A,3,1,Polish!,"[Polish/JJ, !/.]",(ROOT (FRAG (ADJP (JJ Polish)) (. !)))
K/KC/KCN.xml,KCNRE01K,27602,4,,A,3,2,Polish!,"[Polish/JJ, !/.]",(ROOT (FRAG (ADJP (JJ Polish)) (. !)))
K/KC/KCN.xml,KCNRE01K,27602,5,,A,3,3,Polish!,"[Polish/JJ, !/.]",(ROOT (FRAG (ADJP (JJ Polish)) (. !)))
K/KC/KCN.xml,KCNRE01K,27602,6,,B,4,1,Oh!,"[Oh/UH, !/.]",(ROOT (INTJ (UH Oh) (. !)))
K/KC/KCN.xml,KCNRE01K,27602,7,,A,5,1,"Must make a Friday, a Polish day.","[Must/MD, make/VB, a/DT, Friday/NNP, ,/,, a/DT, Polish/JJ, day/NN, ./.]","(ROOT (S (VP (MD Must) (VP (VB make) (NP (NP (DT a) (NNP Friday)) (, ,) (NP (DT a) (JJ Polish) (NN day))))) (. .)))"
K/KC/KCN.xml,KCNRE01K,27602,8,,B,6,1,A what?,"[A/DT, what/WP, ?/.]",(ROOT (S (VP (NP (DT A) (NP (WP what)))) (. ?)))
K/KC/KCN.xml,KCNRE01K,27602,9,,A,7,1,A polish day.--,"[A/DT, polish/JJ, day/NN, ./.]",(ROOT (NP (DT A) (JJ polish) (NN day) (. .)))
K/KC/KCN.xml,KCNRE01K,27602,10,,A,7,2,--<laugh> ,"[A/DT, polish/JJ, day/NN, ./.]",(ROOT (NP (DT A) (JJ polish) (NN day) (. .)))
K/KC/KCN.xml,KCNRE01K,27602,11,,B,8,1,Right.,"[Right/NN, ./.]",(ROOT (INTJ (NN Right) (. .)))
K/KC/KCN.xml,KCNRE01K,27602,12,,A,9,1,Even just to  --,"[Even/RB, just/RB, to/TO, wipe/VB, the/DT, polish/JJ, round/NN]",(ROOT (ADJP (RB Even) (RB just) (S (VP (TO to) (VP (VB wipe) (NP (DT the) (JJ polish) (NN round)))))))
K/KC/KCN.xml,KCNRE01K,27602,13,,A,9,2,--wipe the polish round ,"[Even/RB, just/RB, to/TO, wipe/VB, the/DT, polish/JJ, round/NN]",(ROOT (ADJP (RB Even) (RB just) (S (VP (TO to) (VP (VB wipe) (NP (DT the) (JJ polish) (NN round)))))))
K/KC/KCN.xml,KCNRE01K,27602,14,,B,10,1,"No, it's (()) , yes.","[No/DT, ,/,, it/PRP, 's/VBZ, ,/,, yes/UH, ./.]","(ROOT (S (NP (DT No)) (, ,) (NP (PRP it)) (VP (VBZ 's) (, ,) (NP (UH yes))) (. .)))"
K/KC/KCN.xml,KCNRE01K,27602,15,,A,11,1,"And then you, you ","[And/CC, then/RB, you/PRP, ,/,, you/PRP]","(ROOT (FRAG (CC And) (S (VP (RB then) (NP (PRP you)) (, ,) (NP (PRP you))))))"
K/KC/KCN.xml,KCNRE01K,27602,16,,B,12,1,You polish them.,"[You/PRP, polish/VBP, them/PRP, ./.]",(ROOT (S (NP (PRP You)) (VP (VBP polish) (NP (PRP them))) (. .)))
K/KC/KCN.xml,KCNRE01K,27602,17,,B,12,2,Well you're supposed ,"[Well/RB, you/PRP, 're/VBP, supposed/VBN]",(ROOT (FRAG (ADVP (RB Well)) (NP (NP (PRP you)) (SBAR (S (VP (VBP 're) (VP (VBN supposed))))))))
K/KC/KCN.xml,KCNRE01K,27602,18,,A,13,1,You went on Monday  (()) ,"[You/PRP, went/VBD, on/IN, Monday/NNP]",(ROOT (S (NP (PRP You)) (VP (VBD went) (PP (IN on) (NP (NNP Monday))))))
K/KC/KCN.xml,KCNRE01K,27602,19,,B,14,1,you're supposed to give it a good bees waxing once a year!,"[you/PRP, 're/VBP, supposed/VBN, to/TO, give/VB, it/PRP, a/DT, good/JJ, bees/NNS, waxing/VBG, once/RB, a/DT, year/NN, !/.]",(ROOT (S (NP (PRP you)) (VP (VBP 're) (VP (VBN supposed) (S (VP (TO to) (VP (VB give) (NP (PRP it)) (NP (NP (DT a) (JJ good) (NNS bees)) (VP (VBG waxing) (ADVP (RB once)) (NP (DT a) (NN year))))))))) (. !)))
K/KC/KCN.xml,KCNRE01K,27602,20,,B,14,2,"The rest of the time you, you  --","[The/DT, rest/NN, of/IN, the/DT, time/NN, you/PRP, ,/,, you/PRP, you/PRP, warm/VBP, the/DT, polish/JJ, rag/NN, and/CC, rub/VB, that/DT, over/IN, ./.]","(ROOT (S (NP (NP (DT The) (NN rest)) (PP (IN of) (NP (DT the) (NN time) (PRP you)))) (, ,) (S (NP (PRP you))) (NP (PRP you)) (VP (VP (VBP warm) (NP (DT the) (JJ polish) (NN rag))) (CC and) (VP (VB rub) (NP (DT that)) (PP (IN over)))) (. .)))"
K/KC/KCN.xml,KCNRE01K,27602,21,,B,14,3,--you warm the polish rag and rub that over.,"[The/DT, rest/NN, of/IN, the/DT, time/NN, you/PRP, ,/,, you/PRP, you/PRP, warm/VBP, the/DT, polish/JJ, rag/NN, and/CC, rub/VB, that/DT, over/IN, ./.]","(ROOT (S (NP (NP (DT The) (NN rest)) (PP (IN of) (NP (DT the) (NN time) (PRP you)))) (, ,) (S (NP (PRP you))) (NP (PRP you)) (VP (VP (VBP warm) (NP (DT the) (JJ polish) (NN rag))) (CC and) (VP (VB rub) (NP (DT that)) (PP (IN over)))) (. .)))"
K/KC/KCN.xml,KCNRE01K,27602,22,,B,14,4,"And then I, I,(()) ","[And/CC, then/RB, I/PRP, ,/,, I/PRP, ,/,]","(ROOT (S (CC And) (ADVP (RB then)) (VP (PRP I) (, ,) (NP (PRP I))) (, ,)))"
K/KC/KCN.xml,KCNRE01K,27602,23,,A,15,1,Have you done the radiator?,"[Have/VB, you/PRP, done/VBN, the/DT, radiator/NN, ?/.]",(ROOT (SQ (VP (VB Have) (S (NP (PRP you)) (VP (VBN done) (NP (DT the) (NN radiator))))) (. ?)))
K/KC/KCN.xml,KCNRE01K,27602,24,,B,16,1,hard rubbing  --,"[hard/JJ, rubbing/NN, is/VBZ, the/DT, secret/NN, of/IN, it/PRP, all/DT, ./.]",(ROOT (S (NP (JJ hard) (NN rubbing)) (VP (VBZ is) (NP (NP (DT the) (NN secret)) (PP (IN of) (NP (PRP it) (DT all))))) (. .)))
K/KC/KCN.xml,KCNRE01K,27602,25,,B,16,2,--is the  --,"[hard/JJ, rubbing/NN, is/VBZ, the/DT, secret/NN, of/IN, it/PRP, all/DT, ./.]",(ROOT (S (NP (JJ hard) (NN rubbing)) (VP (VBZ is) (NP (NP (DT the) (NN secret)) (PP (IN of) (NP (PRP it) (DT all))))) (. .)))
K/KC/KCN.xml,KCNRE01K,27602,26,,B,16,3,--secret of it all.,"[hard/JJ, rubbing/NN, is/VBZ, the/DT, secret/NN, of/IN, it/PRP, all/DT, ./.]",(ROOT (S (NP (JJ hard) (NN rubbing)) (VP (VBZ is) (NP (NP (DT the) (NN secret)) (PP (IN of) (NP (PRP it) (DT all))))) (. .)))
K/KC/KCN.xml,KCNRE01K,27602,27,,A,17,1,And we've done the window sills all upstairs.,"[And/CC, we/PRP, 've/VBP, done/VBN, the/DT, window/NN, sills/NNP, all/DT, upstairs/NN, ./.]",(ROOT (S (CC And) (NP (PRP we)) (VP (VBP 've) (VP (VBN done) (NP (DT the) (NN window) (NNP sills)) (ADVP (DT all) (NN upstairs)))) (. .)))
K/KC/KCN.xml,KCNRE01K,27602,28,,B,18,1,And it absorbs it don't it?,"[And/CC, it/PRP, absorbs/VBZ, it/PRP, don/VB, 't/PRP, it/PRP, ?/.]",(ROOT (S (CC And) (NP (PRP it)) (VP (VBZ absorbs) (S (NP (PRP it)) (VP (VB don) (S (NP (PRP 't)) (NP (PRP it)))))) (. ?)))
K/KC/KCN.xml,KCNRE01K,27602,29,,A,19,1,I put a good bit on there and soaked it  --,"[I/PRP, put/VBD, a/DT, good/JJ, bit/NN, on/IN, there/EX, and/CC, soaked/VBD, it/PRP, let/VB, it/PRP, soak/VB, in/IN, ./.]",(ROOT (S (NP (PRP I)) (VP (VP (VBD put) (NP (DT a) (JJ good) (NN bit)) (PP (IN on) (NP (EX there)))) (CC and) (VP (VBD soaked) (S (NP (PRP it)) (VP (VB let) (S (NP (PRP it)) (VP (VB soak) (PP (IN in)))))))) (. .)))
K/KC/KCN.xml,KCNRE01K,27602,30,,A,19,2,--let it soak in.,"[I/PRP, put/VBD, a/DT, good/JJ, bit/NN, on/IN, there/EX, and/CC, soaked/VBD, it/PRP, let/VB, it/PRP, soak/VB, in/IN, ./.]",(ROOT (S (NP (PRP I)) (VP (VP (VBD put) (NP (DT a) (JJ good) (NN bit)) (PP (IN on) (NP (EX there)))) (CC and) (VP (VBD soaked) (S (NP (PRP it)) (VP (VB let) (S (NP (PRP it)) (VP (VB soak) (PP (IN in)))))))) (. .)))
K/KC/KCN.xml,KCNRE01K,27602,31,,A,19,3,as if you would  --,"[as/IN, if/IN, you/PRP, would/MD, have/VB, a/DT, polish/JJ, day/NN, every/DT, Friday/NNP, you/PRP, could/MD, put/VB, it/PRP, on/IN, Thursday/NNP, night/NN, ./.]",(ROOT (S (SBAR (IN as) (IN if) (S (NP (PRP you)) (VP (MD would) (VP (VB have) (NP (DT a) (JJ polish) (NN day)) (NP (DT every) (NNP Friday)))))) (NP (PRP you)) (VP (MD could) (VP (VB put) (NP (PRP it)) (PP (IN on) (NP (NNP Thursday))) (NP (NN night)))) (. .)))
K/KC/KCN.xml,KCNRE01K,27602,32,,A,19,4,--have a polish day every Friday  --,"[as/IN, if/IN, you/PRP, would/MD, have/VB, a/DT, polish/JJ, day/NN, every/DT, Friday/NNP, you/PRP, could/MD, put/VB, it/PRP, on/IN, Thursday/NNP, night/NN, ./.]",(ROOT (S (SBAR (IN as) (IN if) (S (NP (PRP you)) (VP (MD would) (VP (VB have) (NP (DT a) (JJ polish) (NN day)) (NP (DT every) (NNP Friday)))))) (NP (PRP you)) (VP (MD could) (VP (VB put) (NP (PRP it)) (PP (IN on) (NP (NNP Thursday))) (NP (NN night)))) (. .)))
K/KC/KCN.xml,KCNRE01K,27602,33,,A,19,5,--you could put it on  --,"[as/IN, if/IN, you/PRP, would/MD, have/VB, a/DT, polish/JJ, day/NN, every/DT, Friday/NNP, you/PRP, could/MD, put/VB, it/PRP, on/IN, Thursday/NNP, night/NN, ./.]",(ROOT (S (SBAR (IN as) (IN if) (S (NP (PRP you)) (VP (MD would) (VP (VB have) (NP (DT a) (JJ polish) (NN day)) (NP (DT every) (NNP Friday)))))) (NP (PRP you)) (VP (MD could) (VP (VB put) (NP (PRP it)) (PP (IN on) (NP (NNP Thursday))) (NP (NN night)))) (. .)))
K/KC/KCN.xml,KCNRE01K,27602,34,,A,19,6,--Thursday night.,"[as/IN, if/IN, you/PRP, would/MD, have/VB, a/DT, polish/JJ, day/NN, every/DT, Friday/NNP, you/PRP, could/MD, put/VB, it/PRP, on/IN, Thursday/NNP, night/NN, ./.]",(ROOT (S (SBAR (IN as) (IN if) (S (NP (PRP you)) (VP (MD would) (VP (VB have) (NP (DT a) (JJ polish) (NN day)) (NP (DT every) (NNP Friday)))))) (NP (PRP you)) (VP (MD could) (VP (VB put) (NP (PRP it)) (PP (IN on) (NP (NNP Thursday))) (NP (NN night)))) (. .)))
K/KC/KCN.xml,KCNRE01K,27602,35,,B,20,1,You don't want to put it on early but,"[You/PRP, don/VBP, 't/PRP, want/VB, to/TO, put/VB, it/PRP, on/IN, early/JJ, but/CC]",(ROOT (S (NP (PRP You)) (VP (VBP don) (S (NP (PRP 't)) (VP (VB want) (S (VP (TO to) (VP (VB put) (NP (PRP it)) (PP (IN on) (NP (JJ early))) (ADVP (CC but))))))))))
K/KC/KCN.xml,KCNRE01K,27602,36,,A,21,1,And polish it off ,"[And/CC, polish/VB, it/PRP, off/RP]",(ROOT (FRAG (CC And) (S (VP (VB polish) (NP (PRP it)) (PRT (RP off))))))
K/KC/KCN.xml,KCNRE01K,27602,37,,B,22,1,If you ,"[If/IN, you/PRP]",(ROOT (FRAG (IN If) (NP (PRP you))))
K/KC/KCN.xml,KCNRE01K,27602,38,,A,23,1,Friday.,"[Friday/NNP, ./.]",(ROOT (FRAG (NP (NNP Friday)) (. .)))
K/KC/KCN.xml,KCNRE01K,27602,39,,B,24,1,Yes  --,"[Yes/UH, but/CC, you/PRP, see/VBP, if/IN, you/PRP, put/VBP, a/DT, lot/NN, on/IN, it/PRP, 's/VBZ, sticky/JJ, !/.]",(ROOT (S (S (INTJ (UH Yes)) (NP (CC but)) (VP (ADVP (PRP you)) (VBP see) (SBAR (IN if) (S (NP (PRP you)) (VP (VBP put) (NP (DT a) (NN lot)) (PP (IN on))))))) (NP (PRP it)) (VP (VBZ 's) (ADJP (JJ sticky))) (. !)))
K/KC/KCN.xml,KCNRE01K,27602,40,,B,24,2,--but you see  --,"[Yes/UH, but/CC, you/PRP, see/VBP, if/IN, you/PRP, put/VBP, a/DT, lot/NN, on/IN, it/PRP, 's/VBZ, sticky/JJ, !/.]",(ROOT (S (S (INTJ (UH Yes)) (NP (CC but)) (VP (ADVP (PRP you)) (VBP see) (SBAR (IN if) (S (NP (PRP you)) (VP (VBP put) (NP (DT a) (NN lot)) (PP (IN on))))))) (NP (PRP it)) (VP (VBZ 's) (ADJP (JJ sticky))) (. !)))
K/KC/KCN.xml,KCNRE01K,27602,41,,B,24,3,--if you put a lot on it's sticky!,"[Yes/UH, but/CC, you/PRP, see/VBP, if/IN, you/PRP, put/VBP, a/DT, lot/NN, on/IN, it/PRP, 's/VBZ, sticky/JJ, !/.]",(ROOT (S (S (INTJ (UH Yes)) (NP (CC but)) (VP (ADVP (PRP you)) (VBP see) (SBAR (IN if) (S (NP (PRP you)) (VP (VBP put) (NP (DT a) (NN lot)) (PP (IN on))))))) (NP (PRP it)) (VP (VBZ 's) (ADJP (JJ sticky))) (. !)))
K/KC/KCN.xml,KCNRE01K,27602,42,,A,25,1,Oh yeah.,"[Oh/UH, yeah/UH, ./.]",(ROOT (S (INTJ (UH Oh)) (VP (UH yeah)) (. .)))
K/KC/KCN.xml,KCNRE01K,27602,43,,B,26,1,"You gotta keep them, you know?","[You/PRP, gotta/NNP, keep/VB, them/PRP, ,/,, you/PRP, know/VB, ?/.]","(ROOT (S (NP (PRP You)) (PRN (S (NP (NNP gotta)) (VP (VB keep) (NP (PRP them)))) (, ,)) (NP (PRP you)) (VP (VB know)) (. ?)))"
K/KC/KCN.xml,KCNRE01K,27602,44,,A,27,1,Mm.,"[Mm/NN, ./.]",(ROOT (NP (NN Mm) (. .)))
K/KC/KCN.xml,KCNRE01K,27602,45,,B,28,1,Rubbing it ahead with a duster will do for  --,"[Rubbing/VBG, it/PRP, ahead/RB, with/IN, a/DT, duster/NN, will/MD, do/VB, for/IN, weeks/NNS, !/.]",(ROOT (S (S (VP (VBG Rubbing) (NP (PRP it)) (ADVP (RB ahead)) (PP (IN with) (NP (DT a) (NN duster))))) (VP (MD will) (VP (VB do) (PP (IN for) (NP (NNS weeks))))) (. !)))
K/KC/KCN.xml,KCNRE01K,27602,46,,B,28,2,--weeks!,"[Rubbing/VBG, it/PRP, ahead/RB, with/IN, a/DT, duster/NN, will/MD, do/VB, for/IN, weeks/NNS, !/.]",(ROOT (S (S (VP (VBG Rubbing) (NP (PRP it)) (ADVP (RB ahead)) (PP (IN with) (NP (DT a) (NN duster))))) (VP (MD will) (VP (VB do) (PP (IN for) (NP (NNS weeks))))) (. !)))
K/KC/KCN.xml,KCNRE01K,27602,47,,A,29,1,Mm.,"[Mm/NN, ./.]",(ROOT (NP (NN Mm) (. .)))
K/KC/KCN.xml,KCNRE01K,27602,48,,B,30,1,Oh  (()) are going through the hoop!,"[Oh/UH, are/VBP, going/VBG, through/IN, the/DT, hoop/NN, !/.]",(ROOT (S (NP (UH Oh)) (VP (VBP are) (VP (VBG going) (PP (IN through) (NP (DT the) (NN hoop))))) (. !)))
K/KC/KCN.xml,KCNRE01K,27602,49,,B,30,2,It is erm  --,"[It/PRP, is/VBZ, erm/NN, a/DT, fact/NN, boys/NNS, pour/VBP, your/PRP$, money/NN, into/IN, BUPA/NNP, bank/NNP, robbed/VBD, ./.]",(ROOT (S (NP (PRP It)) (VP (VBZ is) (NP (NP (NN erm)) (SBAR (S (NP (DT a) (NN fact) (NNS boys)) (VP (VBP pour) (NP (PRP$ your) (NN money)) (PP (IN into) (NP (NNP BUPA) (NNP bank))) (ADVP (VBD robbed))))))) (. .)))
K/KC/KCN.xml,KCNRE01K,27602,50,,B,30,3,--a fact  --,"[It/PRP, is/VBZ, erm/NN, a/DT, fact/NN, boys/NNS, pour/VBP, your/PRP$, money/NN, into/IN, BUPA/NNP, bank/NNP, robbed/VBD, ./.]",(ROOT (S (NP (PRP It)) (VP (VBZ is) (NP (NP (NN erm)) (SBAR (S (NP (DT a) (NN fact) (NNS boys)) (VP (VBP pour) (NP (PRP$ your) (NN money)) (PP (IN into) (NP (NNP BUPA) (NNP bank))) (ADVP (VBD robbed))))))) (. .)))
K/KC/KCN.xml,KCNRE01K,27602,51,,B,30,4,--boys pour your money into BUPA bank robbed.,"[It/PRP, is/VBZ, erm/NN, a/DT, fact/NN, boys/NNS, pour/VBP, your/PRP$, money/NN, into/IN, BUPA/NNP, bank/NNP, robbed/VBD, ./.]",(ROOT (S (NP (PRP It)) (VP (VBZ is) (NP (NP (NN erm)) (SBAR (S (NP (DT a) (NN fact) (NNS boys)) (VP (VBP pour) (NP (PRP$ your) (NN money)) (PP (IN into) (NP (NNP BUPA) (NNP bank))) (ADVP (VBD robbed))))))) (. .)))
K/KC/KCN.xml,KCNRE01K,27602,52,,B,30,5,And they ,"[And/CC, they/PRP]",(ROOT (FRAG (CC And) (NP (PRP they))))
K/KC/KCN.xml,KCNRE01K,27602,53,,A,31,1,"(()) put it in, if he's ","[put/VB, it/PRP, in/IN, ,/,, if/IN, he/PRP, 's/VBZ]","(ROOT (S (VP (VB put) (NP (PRP it)) (PP (IN in)) (, ,) (SBAR (IN if) (S (NP (PRP he)) (VP (VBZ 's)))))))"
K/KC/KCN.xml,KCNRE01K,27602,54,,B,32,1,Mm.,"[Mm/NN, ./.]",(ROOT (NP (NN Mm) (. .)))
K/KC/KCN.xml,KCNRE01K,27602,55,,A,33,1,going.,"[going/VBG, ./.]",(ROOT (S (VP (VBG going)) (. .)))
K/KC/KCN.xml,KCNRE01K,27602,56,,B,34,1,Yeah.,"[Yeah/UH, ./.]",(ROOT (INTJ (UH Yeah) (. .)))
K/KC/KCN.xml,KCNRE01K,27602,57,,B,34,2,"And it says a- ,i- ,i- --","[And/CC, it/PRP, says/VBZ, a-/NN, ,i-/JJ, ,i-/NN, it/PRP, 's/VBZ, stating/VBG, things/NNS, here/RB, er/NN, if/IN, you/PRP, 've/VBP, been/VBN, wanted/VBN, operation/NN, a/DT, long/JJ, time/NN, the/DT, N/NN, S/NNS, H/NN, er/NN, N/NN, S/NNS, H/NN, that/WDT, is/VBZ, it/PRP, ,/,, yes/UH, ./.]","(ROOT (S (S (CC And) (NP (PRP it)) (VP (VBZ says) (NP (NP (NN a-) (JJ ,i-) (NN ,i-)) (SBAR (S (NP (PRP it)) (VP (VBZ 's) (VP (VBG stating) (S (NP (NNS things)) (ADVP (RB here)) (NP (NN er))) (SBAR (IN if) (S (NP (PRP you)) (VP (VBP 've) (VP (VBN been) (VP (VBN wanted) (X (X (NP (NP (NN operation)) (NP (DT a) (JJ long) (NN time))) (NP (DT the) (NN N)) (NP (NP (NNS S)) (NP (NN H) (NN er) (NN N) (NNS S)))) (NP (NP (NN H)) (SBAR (WHNP (WDT that)) (S (VP (VBZ is) (NP (PRP it))))))))))))))))))) (, ,) (FRAG (INTJ (UH yes))) (. .)))"
K/KC/KCN.xml,KCNRE01K,27602,58,,B,34,3,--it's stating things here  --,"[And/CC, it/PRP, says/VBZ, a-/NN, ,i-/JJ, ,i-/NN, it/PRP, 's/VBZ, stating/VBG, things/NNS, here/RB, er/NN, if/IN, you/PRP, 've/VBP, been/VBN, wanted/VBN, operation/NN, a/DT, long/JJ, time/NN, the/DT, N/NN, S/NNS, H/NN, er/NN, N/NN, S/NNS, H/NN, that/WDT, is/VBZ, it/PRP, ,/,, yes/UH, ./.]","(ROOT (S (S (CC And) (NP (PRP it)) (VP (VBZ says) (NP (NP (NN a-) (JJ ,i-) (NN ,i-)) (SBAR (S (NP (PRP it)) (VP (VBZ 's) (VP (VBG stating) (S (NP (NNS things)) (ADVP (RB here)) (NP (NN er))) (SBAR (IN if) (S (NP (PRP you)) (VP (VBP 've) (VP (VBN been) (VP (VBN wanted) (X (X (NP (NP (NN operation)) (NP (DT a) (JJ long) (NN time))) (NP (DT the) (NN N)) (NP (NP (NNS S)) (NP (NN H) (NN er) (NN N) (NNS S)))) (NP (NP (NN H)) (SBAR (WHNP (WDT that)) (S (VP (VBZ is) (NP (PRP it))))))))))))))))))) (, ,) (FRAG (INTJ (UH yes))) (. .)))"
K/KC/KCN.xml,KCNRE01K,27602,59,,B,34,4,--er  --,"[And/CC, it/PRP, says/VBZ, a-/NN, ,i-/JJ, ,i-/NN, it/PRP, 's/VBZ, stating/VBG, things/NNS, here/RB, er/NN, if/IN, you/PRP, 've/VBP, been/VBN, wanted/VBN, operation/NN, a/DT, long/JJ, time/NN, the/DT, N/NN, S/NNS, H/NN, er/NN, N/NN, S/NNS, H/NN, that/WDT, is/VBZ, it/PRP, ,/,, yes/UH, ./.]","(ROOT (S (S (CC And) (NP (PRP it)) (VP (VBZ says) (NP (NP (NN a-) (JJ ,i-) (NN ,i-)) (SBAR (S (NP (PRP it)) (VP (VBZ 's) (VP (VBG stating) (S (NP (NNS things)) (ADVP (RB here)) (NP (NN er))) (SBAR (IN if) (S (NP (PRP you)) (VP (VBP 've) (VP (VBN been) (VP (VBN wanted) (X (X (NP (NP (NN operation)) (NP (DT a) (JJ long) (NN time))) (NP (DT the) (NN N)) (NP (NP (NNS S)) (NP (NN H) (NN er) (NN N) (NNS S)))) (NP (NP (NN H)) (SBAR (WHNP (WDT that)) (S (VP (VBZ is) (NP (PRP it))))))))))))))))))) (, ,) (FRAG (INTJ (UH yes))) (. .)))"
K/KC/KCN.xml,KCNRE01K,27602,60,,B,34,5,--if you've been wanted operation a long time  --,"[And/CC, it/PRP, says/VBZ, a-/NN, ,i-/JJ, ,i-/NN, it/PRP, 's/VBZ, stating/VBG, things/NNS, here/RB, er/NN, if/IN, you/PRP, 've/VBP, been/VBN, wanted/VBN, operation/NN, a/DT, long/JJ, time/NN, the/DT, N/NN, S/NNS, H/NN, er/NN, N/NN, S/NNS, H/NN, that/WDT, is/VBZ, it/PRP, ,/,, yes/UH, ./.]","(ROOT (S (S (CC And) (NP (PRP it)) (VP (VBZ says) (NP (NP (NN a-) (JJ ,i-) (NN ,i-)) (SBAR (S (NP (PRP it)) (VP (VBZ 's) (VP (VBG stating) (S (NP (NNS things)) (ADVP (RB here)) (NP (NN er))) (SBAR (IN if) (S (NP (PRP you)) (VP (VBP 've) (VP (VBN been) (VP (VBN wanted) (X (X (NP (NP (NN operation)) (NP (DT a) (JJ long) (NN time))) (NP (DT the) (NN N)) (NP (NP (NNS S)) (NP (NN H) (NN er) (NN N) (NNS S)))) (NP (NP (NN H)) (SBAR (WHNP (WDT that)) (S (VP (VBZ is) (NP (PRP it))))))))))))))))))) (, ,) (FRAG (INTJ (UH yes))) (. .)))"
K/KC/KCN.xml,KCNRE01K,27602,61,,B,34,6,--the N S H  --,"[And/CC, it/PRP, says/VBZ, a-/NN, ,i-/JJ, ,i-/NN, it/PRP, 's/VBZ, stating/VBG, things/NNS, here/RB, er/NN, if/IN, you/PRP, 've/VBP, been/VBN, wanted/VBN, operation/NN, a/DT, long/JJ, time/NN, the/DT, N/NN, S/NNS, H/NN, er/NN, N/NN, S/NNS, H/NN, that/WDT, is/VBZ, it/PRP, ,/,, yes/UH, ./.]","(ROOT (S (S (CC And) (NP (PRP it)) (VP (VBZ says) (NP (NP (NN a-) (JJ ,i-) (NN ,i-)) (SBAR (S (NP (PRP it)) (VP (VBZ 's) (VP (VBG stating) (S (NP (NNS things)) (ADVP (RB here)) (NP (NN er))) (SBAR (IN if) (S (NP (PRP you)) (VP (VBP 've) (VP (VBN been) (VP (VBN wanted) (X (X (NP (NP (NN operation)) (NP (DT a) (JJ long) (NN time))) (NP (DT the) (NN N)) (NP (NP (NNS S)) (NP (NN H) (NN er) (NN N) (NNS S)))) (NP (NP (NN H)) (SBAR (WHNP (WDT that)) (S (VP (VBZ is) (NP (PRP it))))))))))))))))))) (, ,) (FRAG (INTJ (UH yes))) (. .)))"
K/KC/KCN.xml,KCNRE01K,27602,62,,B,34,7,--er  --,"[And/CC, it/PRP, says/VBZ, a-/NN, ,i-/JJ, ,i-/NN, it/PRP, 's/VBZ, stating/VBG, things/NNS, here/RB, er/NN, if/IN, you/PRP, 've/VBP, been/VBN, wanted/VBN, operation/NN, a/DT, long/JJ, time/NN, the/DT, N/NN, S/NNS, H/NN, er/NN, N/NN, S/NNS, H/NN, that/WDT, is/VBZ, it/PRP, ,/,, yes/UH, ./.]","(ROOT (S (S (CC And) (NP (PRP it)) (VP (VBZ says) (NP (NP (NN a-) (JJ ,i-) (NN ,i-)) (SBAR (S (NP (PRP it)) (VP (VBZ 's) (VP (VBG stating) (S (NP (NNS things)) (ADVP (RB here)) (NP (NN er))) (SBAR (IN if) (S (NP (PRP you)) (VP (VBP 've) (VP (VBN been) (VP (VBN wanted) (X (X (NP (NP (NN operation)) (NP (DT a) (JJ long) (NN time))) (NP (DT the) (NN N)) (NP (NP (NNS S)) (NP (NN H) (NN er) (NN N) (NNS S)))) (NP (NP (NN H)) (SBAR (WHNP (WDT that)) (S (VP (VBZ is) (NP (PRP it))))))))))))))))))) (, ,) (FRAG (INTJ (UH yes))) (. .)))"
K/KC/KCN.xml,KCNRE01K,27602,63,,B,34,8,--N S H  --,"[And/CC, it/PRP, says/VBZ, a-/NN, ,i-/JJ, ,i-/NN, it/PRP, 's/VBZ, stating/VBG, things/NNS, here/RB, er/NN, if/IN, you/PRP, 've/VBP, been/VBN, wanted/VBN, operation/NN, a/DT, long/JJ, time/NN, the/DT, N/NN, S/NNS, H/NN, er/NN, N/NN, S/NNS, H/NN, that/WDT, is/VBZ, it/PRP, ,/,, yes/UH, ./.]","(ROOT (S (S (CC And) (NP (PRP it)) (VP (VBZ says) (NP (NP (NN a-) (JJ ,i-) (NN ,i-)) (SBAR (S (NP (PRP it)) (VP (VBZ 's) (VP (VBG stating) (S (NP (NNS things)) (ADVP (RB here)) (NP (NN er))) (SBAR (IN if) (S (NP (PRP you)) (VP (VBP 've) (VP (VBN been) (VP (VBN wanted) (X (X (NP (NP (NN operation)) (NP (DT a) (JJ long) (NN time))) (NP (DT the) (NN N)) (NP (NP (NNS S)) (NP (NN H) (NN er) (NN N) (NNS S)))) (NP (NP (NN H)) (SBAR (WHNP (WDT that)) (S (VP (VBZ is) (NP (PRP it))))))))))))))))))) (, ,) (FRAG (INTJ (UH yes))) (. .)))"
K/KC/KCN.xml,KCNRE01K,27602,64,,B,34,9,"--that is it, yes.","[And/CC, it/PRP, says/VBZ, a-/NN, ,i-/JJ, ,i-/NN, it/PRP, 's/VBZ, stating/VBG, things/NNS, here/RB, er/NN, if/IN, you/PRP, 've/VBP, been/VBN, wanted/VBN, operation/NN, a/DT, long/JJ, time/NN, the/DT, N/NN, S/NNS, H/NN, er/NN, N/NN, S/NNS, H/NN, that/WDT, is/VBZ, it/PRP, ,/,, yes/UH, ./.]","(ROOT (S (S (CC And) (NP (PRP it)) (VP (VBZ says) (NP (NP (NN a-) (JJ ,i-) (NN ,i-)) (SBAR (S (NP (PRP it)) (VP (VBZ 's) (VP (VBG stating) (S (NP (NNS things)) (ADVP (RB here)) (NP (NN er))) (SBAR (IN if) (S (NP (PRP you)) (VP (VBP 've) (VP (VBN been) (VP (VBN wanted) (X (X (NP (NP (NN operation)) (NP (DT a) (JJ long) (NN time))) (NP (DT the) (NN N)) (NP (NP (NNS S)) (NP (NN H) (NN er) (NN N) (NNS S)))) (NP (NP (NN H)) (SBAR (WHNP (WDT that)) (S (VP (VBZ is) (NP (PRP it))))))))))))))))))) (, ,) (FRAG (INTJ (UH yes))) (. .)))"
K/KC/KCN.xml,KCNRE01K,27602,65,,A,35,1,N H S.,"[N/NN, H/NN, S/NNS, ./.]",(ROOT (NP (NP (NN N)) (NP (NN H) (NNS S)) (. .)))
K/KC/KCN.xml,KCNRE01K,27602,66,,B,36,1,N H S  --,"[N/NN, H/NN, S/NNS, they/PRP, will/MD, re-/VB, transfer/VB, your/PRP$, name/NN, to/TO, Bupa/NNP, and/CC, Bupa/NNP, will/MD, write/VB, to/TO, you/PRP, and/CC, say/VB, they/PRP, 've/VBP, got/VBD, a/DT, bed/NN, if/IN, you/PRP, 'd/MD, like/VB, to/TO, have/VB, it/PRP, ./.]",(ROOT (S (NP (NP (NN N) (NN H) (NNS S)) (SBAR (S (NP (PRP they)) (VP (MD will) (VP (VB re-) (VP (VB transfer) (NP (PRP$ your) (NN name)) (PP (TO to) (NP (NNP Bupa) (CC and) (NNP Bupa))))))))) (VP (MD will) (VP (VP (VB write) (PP (TO to) (NP (PRP you)))) (CC and) (VP (VB say) (SBAR (S (NP (PRP they)) (VP (VBP 've) (VP (VBD got) (NP (DT a) (NN bed)) (SBAR (IN if) (S (NP (PRP you)) (VP (MD 'd) (VP (VB like) (S (VP (TO to) (VP (VB have) (NP (PRP it)))))))))))))))) (. .)))
K/KC/KCN.xml,KCNRE01K,27602,67,,B,36,2,--they will re- transfer your name to Bupa  --,"[N/NN, H/NN, S/NNS, they/PRP, will/MD, re-/VB, transfer/VB, your/PRP$, name/NN, to/TO, Bupa/NNP, and/CC, Bupa/NNP, will/MD, write/VB, to/TO, you/PRP, and/CC, say/VB, they/PRP, 've/VBP, got/VBD, a/DT, bed/NN, if/IN, you/PRP, 'd/MD, like/VB, to/TO, have/VB, it/PRP, ./.]",(ROOT (S (NP (NP (NN N) (NN H) (NNS S)) (SBAR (S (NP (PRP they)) (VP (MD will) (VP (VB re-) (VP (VB transfer) (NP (PRP$ your) (NN name)) (PP (TO to) (NP (NNP Bupa) (CC and) (NNP Bupa))))))))) (VP (MD will) (VP (VP (VB write) (PP (TO to) (NP (PRP you)))) (CC and) (VP (VB say) (SBAR (S (NP (PRP they)) (VP (VBP 've) (VP (VBD got) (NP (DT a) (NN bed)) (SBAR (IN if) (S (NP (PRP you)) (VP (MD 'd) (VP (VB like) (S (VP (TO to) (VP (VB have) (NP (PRP it)))))))))))))))) (. .)))
K/KC/KCN.xml,KCNRE01K,27602,68,,B,36,3,--and Bupa will write to you  --,"[N/NN, H/NN, S/NNS, they/PRP, will/MD, re-/VB, transfer/VB, your/PRP$, name/NN, to/TO, Bupa/NNP, and/CC, Bupa/NNP, will/MD, write/VB, to/TO, you/PRP, and/CC, say/VB, they/PRP, 've/VBP, got/VBD, a/DT, bed/NN, if/IN, you/PRP, 'd/MD, like/VB, to/TO, have/VB, it/PRP, ./.]",(ROOT (S (NP (NP (NN N) (NN H) (NNS S)) (SBAR (S (NP (PRP they)) (VP (MD will) (VP (VB re-) (VP (VB transfer) (NP (PRP$ your) (NN name)) (PP (TO to) (NP (NNP Bupa) (CC and) (NNP Bupa))))))))) (VP (MD will) (VP (VP (VB write) (PP (TO to) (NP (PRP you)))) (CC and) (VP (VB say) (SBAR (S (NP (PRP they)) (VP (VBP 've) (VP (VBD got) (NP (DT a) (NN bed)) (SBAR (IN if) (S (NP (PRP you)) (VP (MD 'd) (VP (VB like) (S (VP (TO to) (VP (VB have) (NP (PRP it)))))))))))))))) (. .)))
K/KC/KCN.xml,KCNRE01K,27602,69,,B,36,4,--and say they've got a bed if you'd like to have it.,"[N/NN, H/NN, S/NNS, they/PRP, will/MD, re-/VB, transfer/VB, your/PRP$, name/NN, to/TO, Bupa/NNP, and/CC, Bupa/NNP, will/MD, write/VB, to/TO, you/PRP, and/CC, say/VB, they/PRP, 've/VBP, got/VBD, a/DT, bed/NN, if/IN, you/PRP, 'd/MD, like/VB, to/TO, have/VB, it/PRP, ./.]",(ROOT (S (NP (NP (NN N) (NN H) (NNS S)) (SBAR (S (NP (PRP they)) (VP (MD will) (VP (VB re-) (VP (VB transfer) (NP (PRP$ your) (NN name)) (PP (TO to) (NP (NNP Bupa) (CC and) (NNP Bupa))))))))) (VP (MD will) (VP (VP (VB write) (PP (TO to) (NP (PRP you)))) (CC and) (VP (VB say) (SBAR (S (NP (PRP they)) (VP (VBP 've) (VP (VBD got) (NP (DT a) (NN bed)) (SBAR (IN if) (S (NP (PRP you)) (VP (MD 'd) (VP (VB like) (S (VP (TO to) (VP (VB have) (NP (PRP it)))))))))))))))) (. .)))
K/KC/KCN.xml,KCNRE01K,27602,70,,B,36,5,Because you've gotta pay for that.,"[Because/IN, you/PRP, 've/VBP, gotta/NNP, pay/NN, for/IN, that/DT, ./.]",(ROOT (FRAG (SBAR (IN Because) (S (NP (PRP you)) (VP (VBP 've) (NP (NP (NNP gotta) (NN pay)) (PP (IN for) (NP (DT that))))))) (. .)))
K/KC/KCN.xml,KCNRE01K,27602,71,,A,37,1,Danny could have had his operation three years ago!,"[Danny/NNP, could/MD, have/VB, had/VBD, his/PRP$, operation/NN, three/CD, years/NNS, ago/RB, !/.]",(ROOT (S (NP (NNP Danny)) (VP (MD could) (VP (VB have) (VP (VBD had) (NP (PRP$ his) (NN operation)) (ADVP (NP (CD three) (NNS years)) (RB ago))))) (. !)))
K/KC/KCN.xml,KCNRE01K,27602,72,,B,38,1,If you'd been on Bupa.,"[If/IN, you/PRP, 'd/MD, been/VBN, on/IN, Bupa/NNP, ./.]",(ROOT (FRAG (SBAR (IN If) (S (NP (PRP you)) (VP (MD 'd) (VP (VBN been) (PP (IN on) (NP (NNP Bupa))))))) (. .)))
K/KC/KCN.xml,KCNRE01K,27602,73,,A,39,1,The first thing they asked him was how much money he'd got!,"[The/DT, first/JJ, thing/NN, they/PRP, asked/VBD, him/PRP, was/VBD, how/WRB, much/JJ, money/NN, he/PRP, 'd/VBD, got/VBN, !/.]",(ROOT (S (NP (NP (DT The) (JJ first) (NN thing)) (SBAR (S (NP (PRP they)) (VP (VBD asked) (NP (PRP him)))))) (VP (VBD was) (SBAR (WHNP (WHADJP (WRB how) (JJ much)) (NN money)) (S (NP (PRP he)) (VP (VBD 'd) (VP (VBN got)))))) (. !)))
K/KC/KCN.xml,KCNRE01K,27602,74,,B,40,1,Yes.,"[Yes/UH, ./.]",(ROOT (INTJ (UH Yes) (. .)))
