swda_filename,ptb_basename,conversation_no,transcript_index,act_tag,caller,turn_index,subutterance_index,text,pos,trees
K/KE/KE2.xml,KE2RE02S,39208,0,,A,1,1,Oh well I'm quite happy.,"[Oh/UH, well/UH, I/PRP, 'm/VBP, quite/RB, happy/JJ, ./.]",(ROOT (S (S (INTJ (UH Oh) (UH well)) (NP (PRP I)) (VP (VBP 'm) (ADJP (RB quite) (JJ happy)))) (. .)))
K/KE/KE2.xml,KE2RE02S,39208,1,,B,2,1,Sorry?,"[Sorry/JJ, ?/.]",(ROOT (FRAG (ADJP (JJ Sorry)) (. ?)))
K/KE/KE2.xml,KE2RE02S,39208,2,,A,3,1,I said I must admit I'm quite happy here.,"[I/PRP, said/VBD, I/PRP, must/MD, admit/VB, I/PRP, 'm/VBP, quite/RB, happy/JJ, here/RB, ./.]",(ROOT (S (NP (PRP I)) (VP (VBD said) (SBAR (S (NP (PRP I)) (VP (MD must) (VP (VB admit) (SBAR (S (NP (PRP I)) (VP (VBP 'm) (ADJP (RB quite) (JJ happy)) (ADVP (RB here)))))))))) (. .)))
K/KE/KE2.xml,KE2RE02S,39208,3,,B,4,1,Oh well I,"[Oh/UH, well/UH, I/PRP]",(ROOT (FRAG (INTJ (UH Oh)) (UH well) (NP (PRP I))))
K/KE/KE2.xml,KE2RE02S,39208,4,,A,5,1,Certainly  (()) Saint Gregory's I mean.,"[Certainly/RB, Saint/NNP, Gregory/NNP, 's/POS, I/PRP, mean/VBP, ./.]",(ROOT (S (ADVP (RB Certainly)) (NP (NP (NNP Saint) (NP (NNP Gregory) (POS 's))) (NP (PRP I))) (VP (VBP mean)) (. .)))
K/KE/KE2.xml,KE2RE02S,39208,5,,B,6,1,I think we can do without the erm  --,"[I/PRP, think/VBP, we/PRP, can/MD, do/VB, without/IN, the/DT, erm/NN, the/DT, other/JJ, things/NNS, ./.]",(ROOT (S (NP (PRP I)) (VP (VBP think) (SBAR (S (NP (PRP we)) (VP (MD can) (VP (VB do) (PP (IN without) (NP (NP (DT the) (NN erm)) (NP (DT the) (JJ other) (NNS things))))))))) (. .)))
K/KE/KE2.xml,KE2RE02S,39208,6,,B,6,2,--the other things.,"[I/PRP, think/VBP, we/PRP, can/MD, do/VB, without/IN, the/DT, erm/NN, the/DT, other/JJ, things/NNS, ./.]",(ROOT (S (NP (PRP I)) (VP (VBP think) (SBAR (S (NP (PRP we)) (VP (MD can) (VP (VB do) (PP (IN without) (NP (NP (DT the) (NN erm)) (NP (DT the) (JJ other) (NNS things))))))))) (. .)))
K/KE/KE2.xml,KE2RE02S,39208,7,,A,7,1,Yes.,"[Yes/UH, ./.]",(ROOT (INTJ (UH Yes) (. .)))
K/KE/KE2.xml,KE2RE02S,39208,8,,B,8,1,"You know, this fund raising, it's I mean we, we'll be giving them over a thousand pound, well a thousand pound anyway","[You/PRP, know/VBP, ,/,, this/DT, fund/NN, raising/NN, ,/,, it/PRP, 's/VBZ, I/PRP, mean/VB, we/PRP, ,/,, we/PRP, 'll/MD, be/VB, giving/VBG, them/PRP, over/IN, a/DT, thousand/CD, pound/NN, ,/,, well/RB, a/DT, thousand/CD, pound/NN, anyway/RB]","(ROOT (S (NP (PRP You)) (VP (VBP know) (, ,) (SBAR (S (NP (DT this) (NN fund) (NN raising)) (PRN (, ,) (S (NP (PRP it)) (VP (VBZ 's) (S (NP (PRP I)) (VP (VB mean) (NP (PRP we)))))) (, ,)) (NP (PRP we)) (VP (MD 'll) (VP (VB be) (VP (VBG giving) (NP (PRP them)) (PP (IN over) (NP (NP (DT a) (CD thousand) (NN pound)) (, ,) (RB well) (NP (DT a) (CD thousand) (NN pound)))) (ADVP (RB anyway))))))))))"
K/KE/KE2.xml,KE2RE02S,39208,9,,A,9,1,Well may ,"[Well/RB, may/MD]",(ROOT (FRAG (VP (ADVP (RB Well)) (VP (MD may)))))
K/KE/KE2.xml,KE2RE02S,39208,10,,B,10,1,well ,[well/RB],(ROOT (INTJ (RB well)))
K/KE/KE2.xml,KE2RE02S,39208,11,,A,11,1,may not be actually.,"[may/MD, not/RB, be/VB, actually/RB, ./.]",(ROOT (S (VP (MD may) (RB not) (VP (VB be) (ADVP (RB actually)))) (. .)))
K/KE/KE2.xml,KE2RE02S,39208,12,,B,12,1,Yeah well it may well be,"[Yeah/UH, well/RB, it/PRP, may/MD, well/RB, be/VB]",(ROOT (FRAG (VP (PP (NP (UH Yeah)) (NP (NP (RB well)) (NP (PRP it)))) (MD may) (VP (ADVP (RB well)) (VB be)))))
K/KE/KE2.xml,KE2RE02S,39208,13,,A,13,1,"But I think this will be, I mean I'm  --","[But/CC, I/PRP, think/VBP, this/DT, will/MD, be/VB, ,/,, I/PRP, mean/VBP, I/PRP, 'm/VBP, more/RBR, and/CC, more/RBR, I/PRP, 'm/VBP, thinking/VBG, that/IN, erm/NN]","(ROOT (S (CC But) (NP (PRP I)) (VP (VBP think) (SBAR (S (NP (DT this)) (VP (MD will) (VP (VB be) (, ,) (SBAR (S (NP (PRP I)) (VP (VBP mean) (SBAR (S (NP (PRP I)) (VP (VBP 'm) (ADVP (RBR more) (CC and) (RBR more)) (NP (NP (PRP I)) (SBAR (S (VP (VBP 'm) (VP (VBG thinking) (SBAR (IN that) (FRAG (NP (NN erm))))))))))))))))))))))"
K/KE/KE2.xml,KE2RE02S,39208,14,,A,13,2,--more and more I'm thinking that erm,"[But/CC, I/PRP, think/VBP, this/DT, will/MD, be/VB, ,/,, I/PRP, mean/VBP, I/PRP, 'm/VBP, more/RBR, and/CC, more/RBR, I/PRP, 'm/VBP, thinking/VBG, that/IN, erm/NN]","(ROOT (S (CC But) (NP (PRP I)) (VP (VBP think) (SBAR (S (NP (DT this)) (VP (MD will) (VP (VB be) (, ,) (SBAR (S (NP (PRP I)) (VP (VBP mean) (SBAR (S (NP (PRP I)) (VP (VBP 'm) (ADVP (RBR more) (CC and) (RBR more)) (NP (NP (PRP I)) (SBAR (S (VP (VBP 'm) (VP (VBG thinking) (SBAR (IN that) (FRAG (NP (NN erm))))))))))))))))))))))"
K/KE/KE2.xml,KE2RE02S,39208,15,,B,14,1,And erm  --,"[And/CC, erm/NN, you/PRP, know/VBP, the/DT, other/JJ, things/NNS, that/IN, you/PRP, do/VBP, ./.]",(ROOT (FRAG (CC And) (NP (NP (NN erm)) (SBAR (S (NP (PRP you)) (VP (VBP know) (NP (DT the) (JJ other) (NNS things)) (SBAR (IN that) (S (NP (PRP you)) (VP (VBP do)))))))) (. .)))
K/KE/KE2.xml,KE2RE02S,39208,16,,B,14,2,--you know the other things that you do.,"[And/CC, erm/NN, you/PRP, know/VBP, the/DT, other/JJ, things/NNS, that/IN, you/PRP, do/VBP, ./.]",(ROOT (FRAG (CC And) (NP (NP (NN erm)) (SBAR (S (NP (PRP you)) (VP (VBP know) (NP (DT the) (JJ other) (NNS things)) (SBAR (IN that) (S (NP (PRP you)) (VP (VBP do)))))))) (. .)))
K/KE/KE2.xml,KE2RE02S,39208,17,,B,14,3,They have come on well haven't they?,"[They/PRP, have/VBP, come/VBN, on/RP, well/NNP, haven/NNP, 't/PRP, they/PRP, ?/.]",(ROOT (S (NP (PRP They)) (VP (VBP have) (VP (VBN come) (PRT (RP on)) (NP (NP (NNP well)) (S (VP (NNP haven) (S (NP (PRP 't)) (NP (PRP they)))))))) (. ?)))
K/KE/KE2.xml,KE2RE02S,39208,18,,A,15,1,Yeah.,"[Yeah/UH, ./.]",(ROOT (INTJ (UH Yeah) (. .)))
K/KE/KE2.xml,KE2RE02S,39208,19,,A,15,2,"Yeah they have, I mean they're just","[Yeah/UH, they/PRP, have/VBP, ,/,, I/PRP, mean/VBP, they/PRP, 're/VBP, just/RB]","(ROOT (NP (S (S (INTJ (UH Yeah)) (NP (PRP they)) (VP (VBP have))) (, ,) (NP (PRP I)) (VP (VBP mean) (SBAR (S (NP (PRP they)) (VP (VBP 're) (ADVP (RB just)))))))))"
K/KE/KE2.xml,KE2RE02S,39208,20,,B,16,1,Yeah,[Yeah/UH],(ROOT (INTJ (UH Yeah)))
K/KE/KE2.xml,KE2RE02S,39208,21,,A,17,1,they're just sort of shooting ,"[they/PRP, 're/VBP, just/RB, sort/NN, of/IN, shooting/NN]",(ROOT (S (NP (PRP they)) (VP (VBP 're) (ADVP (RB just)) (NP (NP (NN sort)) (PP (IN of) (NP (NN shooting)))))))
K/KE/KE2.xml,KE2RE02S,39208,22,,B,18,1,(()) able to plant them out then  (()) ,"[able/JJ, to/TO, plant/VB, them/PRP, out/RP, then/RB]",(ROOT (ADJP (JJ able) (S (VP (TO to) (VP (VB plant) (NP (PRP them)) (PRT (RP out)) (ADVP (RB then)))))))
K/KE/KE2.xml,KE2RE02S,39208,23,,A,19,1,shooting up you see aren't they?,"[shooting/VBG, up/RB, you/PRP, see/VBP, aren/NNP, 't/PRP, they/PRP, ?/.]",(ROOT (SINV (VP (VBG shooting) (PRT (RB up)) (NP (PRP you))) (VP (VBP see) (S (NP (NNP aren)) (NP (PRP 't)))) (NP (PRP they)) (. ?)))
K/KE/KE2.xml,KE2RE02S,39208,24,,B,20,1,We could bring that other erm (()) ,"[We/PRP, could/MD, bring/VB, that/DT, other/JJ, erm/NN]",(ROOT (S (NP (PRP We)) (VP (MD could) (VP (VB bring) (NP (DT that) (JJ other) (NN erm))))))
K/KE/KE2.xml,KE2RE02S,39208,25,,A,21,1,"Yes I meant to do that, I'll do it when I come back down now.","[Yes/UH, I/PRP, meant/VBD, to/TO, do/VB, that/DT, ,/,, I/PRP, 'll/MD, do/VB, it/PRP, when/WRB, I/PRP, come/VBP, back/RB, down/RB, now/RB, ./.]","(ROOT (S (S (INTJ (UH Yes)) (NP (PRP I)) (VP (VBD meant) (S (VP (TO to) (VP (VB do) (NP (DT that))))))) (, ,) (NP (PRP I)) (VP (MD 'll) (VP (VB do) (NP (PRP it)) (SBAR (WHADVP (WRB when)) (S (NP (PRP I)) (VP (VBP come) (ADVP (RB back) (RB down)) (ADVP (RB now))))))) (. .)))"
K/KE/KE2.xml,KE2RE02S,39208,26,,B,22,1,There's erm  --,"[There/EX, 's/VBZ, erm/NN, And/CC, I/PRP, mean/VBP, looking/VBG, after/IN, the/DT, parish/NNP, hall/NNP, as/RB, well/RB, ,/,, why/WRB, should/MD, we/PRP, bother/VB, with/IN, that/DT, ?/.]","(ROOT (S (S (NP (EX There)) (VP (VBZ 's) (NP (NN erm)))) (CC And) (S (NP (PRP I)) (VP (VBP mean) (S (S (VP (VBG looking))) (SBARQ (SBAR (IN after) (FRAG (NP (NP (DT the) (NNP parish) (NNP hall)) (ADVP (RB as) (RB well))))) (, ,) (WHADVP (WRB why)) (SQ (MD should) (NP (PRP we)) (VP (VB bother) (PP (IN with) (NP (DT that))))))))) (. ?)))"
K/KE/KE2.xml,KE2RE02S,39208,27,,B,22,2,"--And I mean looking after the parish hall as well, why should we bother with that?","[There/EX, 's/VBZ, erm/NN, And/CC, I/PRP, mean/VBP, looking/VBG, after/IN, the/DT, parish/NNP, hall/NNP, as/RB, well/RB, ,/,, why/WRB, should/MD, we/PRP, bother/VB, with/IN, that/DT, ?/.]","(ROOT (S (S (NP (EX There)) (VP (VBZ 's) (NP (NN erm)))) (CC And) (S (NP (PRP I)) (VP (VBP mean) (S (S (VP (VBG looking))) (SBARQ (SBAR (IN after) (FRAG (NP (NP (DT the) (NNP parish) (NNP hall)) (ADVP (RB as) (RB well))))) (, ,) (WHADVP (WRB why)) (SQ (MD should) (NP (PRP we)) (VP (VB bother) (PP (IN with) (NP (DT that))))))))) (. ?)))"
K/KE/KE2.xml,KE2RE02S,39208,28,,A,23,1,Yeah that's right.,"[Yeah/UH, that/DT, 's/VBZ, right/NN, ./.]",(ROOT (S (S (INTJ (UH Yeah)) (NP (DT that)) (VP (VBZ 's) (NP (NN right)))) (. .)))
K/KE/KE2.xml,KE2RE02S,39208,29,,B,24,1,I mean we   --,"[I/PRP, mean/VBP, we/PRP, we/PRP, have/VBP, more/JJR, than/IN, done/VBN, what/WP, was/VBD, supposed/VBN, to/TO, be/VB, to/TO, start/VB, with/IN, to/TO, see/VB, that/IN, it/PRP, wasn/VBD, 't/PRP, a/DT, drain/NN, on/IN, the/DT, parish/NN, ./.]",(ROOT (S (NP (PRP I)) (VP (VBP mean) (NP (PRP we)) (SBAR (S (NP (PRP we)) (VP (VBP have) (ADVP (JJR more) (IN than)) (VP (VBN done) (SBAR (WHNP (WP what)) (S (VP (VBD was) (VP (VBN supposed) (S (VP (TO to) (VP (VB be) (S (VP (TO to) (VP (VB start) (PP (IN with)) (S (VP (TO to) (VP (VB see) (SBAR (IN that) (S (NP (PRP it)) (VP (VBD wasn) (S (NP (PRP 't)) (NP (NP (DT a) (NN drain)) (PP (IN on) (NP (DT the) (NN parish)))))))))))))))))))))))))) (. .)))
K/KE/KE2.xml,KE2RE02S,39208,30,,B,24,2,--<laugh> we have more than done  --,"[I/PRP, mean/VBP, we/PRP, we/PRP, have/VBP, more/JJR, than/IN, done/VBN, what/WP, was/VBD, supposed/VBN, to/TO, be/VB, to/TO, start/VB, with/IN, to/TO, see/VB, that/IN, it/PRP, wasn/VBD, 't/PRP, a/DT, drain/NN, on/IN, the/DT, parish/NN, ./.]",(ROOT (S (NP (PRP I)) (VP (VBP mean) (NP (PRP we)) (SBAR (S (NP (PRP we)) (VP (VBP have) (ADVP (JJR more) (IN than)) (VP (VBN done) (SBAR (WHNP (WP what)) (S (VP (VBD was) (VP (VBN supposed) (S (VP (TO to) (VP (VB be) (S (VP (TO to) (VP (VB start) (PP (IN with)) (S (VP (TO to) (VP (VB see) (SBAR (IN that) (S (NP (PRP it)) (VP (VBD wasn) (S (NP (PRP 't)) (NP (NP (DT a) (NN drain)) (PP (IN on) (NP (DT the) (NN parish)))))))))))))))))))))))))) (. .)))
K/KE/KE2.xml,KE2RE02S,39208,31,,B,24,3,--what was supposed to be to start with  --,"[I/PRP, mean/VBP, we/PRP, we/PRP, have/VBP, more/JJR, than/IN, done/VBN, what/WP, was/VBD, supposed/VBN, to/TO, be/VB, to/TO, start/VB, with/IN, to/TO, see/VB, that/IN, it/PRP, wasn/VBD, 't/PRP, a/DT, drain/NN, on/IN, the/DT, parish/NN, ./.]",(ROOT (S (NP (PRP I)) (VP (VBP mean) (NP (PRP we)) (SBAR (S (NP (PRP we)) (VP (VBP have) (ADVP (JJR more) (IN than)) (VP (VBN done) (SBAR (WHNP (WP what)) (S (VP (VBD was) (VP (VBN supposed) (S (VP (TO to) (VP (VB be) (S (VP (TO to) (VP (VB start) (PP (IN with)) (S (VP (TO to) (VP (VB see) (SBAR (IN that) (S (NP (PRP it)) (VP (VBD wasn) (S (NP (PRP 't)) (NP (NP (DT a) (NN drain)) (PP (IN on) (NP (DT the) (NN parish)))))))))))))))))))))))))) (. .)))
K/KE/KE2.xml,KE2RE02S,39208,32,,B,24,4,--to see that it wasn't a drain on the parish.,"[I/PRP, mean/VBP, we/PRP, we/PRP, have/VBP, more/JJR, than/IN, done/VBN, what/WP, was/VBD, supposed/VBN, to/TO, be/VB, to/TO, start/VB, with/IN, to/TO, see/VB, that/IN, it/PRP, wasn/VBD, 't/PRP, a/DT, drain/NN, on/IN, the/DT, parish/NN, ./.]",(ROOT (S (NP (PRP I)) (VP (VBP mean) (NP (PRP we)) (SBAR (S (NP (PRP we)) (VP (VBP have) (ADVP (JJR more) (IN than)) (VP (VBN done) (SBAR (WHNP (WP what)) (S (VP (VBD was) (VP (VBN supposed) (S (VP (TO to) (VP (VB be) (S (VP (TO to) (VP (VB start) (PP (IN with)) (S (VP (TO to) (VP (VB see) (SBAR (IN that) (S (NP (PRP it)) (VP (VBD wasn) (S (NP (PRP 't)) (NP (NP (DT a) (NN drain)) (PP (IN on) (NP (DT the) (NN parish)))))))))))))))))))))))))) (. .)))
K/KE/KE2.xml,KE2RE02S,39208,33,,A,25,1,Yeah.,"[Yeah/UH, ./.]",(ROOT (INTJ (UH Yeah) (. .)))
K/KE/KE2.xml,KE2RE02S,39208,34,,B,26,1,(()) --,"[must/MD, get/VB, bored/JJ, silly/JJ, not/RB, being/VBG, able/JJ, to/TO, get/VB, out/RP]",(ROOT (SINV (VP (MD must) (VP (VB get) (ADJP (JJ bored)))) (NP (NP (JJ silly)) (PP (RB not) (S (VP (VBG being) (ADJP (JJ able) (S (VP (TO to) (VP (VB get) (PRT (RP out))))))))))))
K/KE/KE2.xml,KE2RE02S,39208,35,,B,26,2,--must get bored silly  --,"[must/MD, get/VB, bored/JJ, silly/JJ, not/RB, being/VBG, able/JJ, to/TO, get/VB, out/RP]",(ROOT (SINV (VP (MD must) (VP (VB get) (ADJP (JJ bored)))) (NP (NP (JJ silly)) (PP (RB not) (S (VP (VBG being) (ADJP (JJ able) (S (VP (TO to) (VP (VB get) (PRT (RP out))))))))))))
K/KE/KE2.xml,KE2RE02S,39208,36,,B,26,3,--not being able to get out,"[must/MD, get/VB, bored/JJ, silly/JJ, not/RB, being/VBG, able/JJ, to/TO, get/VB, out/RP]",(ROOT (SINV (VP (MD must) (VP (VB get) (ADJP (JJ bored)))) (NP (NP (JJ silly)) (PP (RB not) (S (VP (VBG being) (ADJP (JJ able) (S (VP (TO to) (VP (VB get) (PRT (RP out))))))))))))
K/KE/KE2.xml,KE2RE02S,39208,37,,A,27,1,Yeah.,"[Yeah/UH, ./.]",(ROOT (INTJ (UH Yeah) (. .)))
K/KE/KE2.xml,KE2RE02S,39208,38,,B,28,1,(()) ,[],X
K/KE/KE2.xml,KE2RE02S,39208,39,,A,29,1,"No I, the other thing is if we're out here, I don't know what to do about this lamp for the bedside, I mean I don't know that I need it and it's another ten pounds isn't it?","[No/DT, I/PRP, ,/,, the/DT, other/JJ, thing/NN, is/VBZ, if/IN, we/PRP, 're/VBP, out/RP, here/RB, ,/,, I/PRP, don/VBP, 't/PRP, know/VB, what/WP, to/TO, do/VB, about/IN, this/DT, lamp/NN, for/IN, the/DT, bedside/NN, ,/,, I/PRP, mean/VBP, I/PRP, don/VB, 't/PRP, know/VB, that/IN, I/PRP, need/VBP, it/PRP, and/CC, it/PRP, 's/VBZ, another/DT, ten/CD, pounds/NNS, isn/VBP, 't/PRP, it/PRP, ?/.]","(ROOT (S (S (NP (DT No) (PRP I)) (PRN (, ,) (S (NP (DT the) (JJ other) (NN thing)) (VP (VBZ is) (SBAR (IN if) (S (NP (PRP we)) (VP (VBP 're) (ADVP (RP out)) (ADVP (RB here))))))) (, ,)) (NP (PRP I)) (VP (VBP don) (S (NP (PRP 't)) (VP (VB know) (SBAR (WHNP (WP what)) (S (VP (TO to) (VP (VB do) (PP (IN about) (NP (NP (DT this) (NN lamp)) (PP (IN for) (NP (DT the) (NN bedside))))))))))))) (, ,) (S (NP (PRP I)) (VP (VBP mean) (S (NP (PRP I)) (VP (VB don) (S (NP (PRP 't)) (VP (VB know) (SBAR (IN that) (S (NP (PRP I)) (VP (VBP need) (NP (PRP it))))))))))) (CC and) (S (NP (PRP it)) (VP (VBZ 's) (NP (NP (DT another) (CD ten) (NNS pounds)) (SBAR (S (VP (VBP isn) (S (NP (PRP 't)) (NP (PRP it))))))))) (. ?)))"
K/KE/KE2.xml,KE2RE02S,39208,40,,A,29,2,What do you think?,"[What/WP, do/VBP, you/PRP, think/VB, ?/.]",(ROOT (SBARQ (WHNP (WP What)) (SQ (VBP do) (NP (PRP you)) (VP (VB think))) (. ?)))
K/KE/KE2.xml,KE2RE02S,39208,41,,B,30,1,I mean you're gonna get twenty five pounds in vouchers or something aren't you?,"[I/PRP, mean/VBP, you/PRP, 're/VBP, gonna/NNP, get/VB, twenty/CD, five/CD, pounds/NNS, in/IN, vouchers/NNS, or/CC, something/NN, aren/NN, 't/PRP, you/PRP, ?/.]",(ROOT (S (NP (PRP I)) (VP (VBP mean) (SBAR (S (NP (PRP you)) (VP (VBP 're) (S (NP (NNP gonna)) (VP (VB get) (S (NP (NP (CD twenty) (CD five) (NNS pounds)) (PP (IN in) (NP (NP (NNS vouchers)) (CC or) (NP (NP (NN something) (NN aren)) (NP (PRP 't)))))) (NP (PRP you))))))))) (. ?)))
K/KE/KE2.xml,KE2RE02S,39208,42,,B,30,2,I don't know what  --,"[I/PRP, don/VBP, 't/PRP, know/VB, what/WP, kind/NN, of/IN, vou-/NN, did/VBD, she/PRP, say/VB, what/WP, ?/.]",(ROOT (S (NP (PRP I)) (VP (VBP don) (S (NP (PRP 't)) (VP (VB know) (SBAR (SBARQ (WHNP (WHNP (WP what) (NN kind)) (PP (IN of) (NP (NN vou-)))) (SQ (VBD did) (NP (PRP she)) (VP (VB say) (NP (WP what)))) (. ?))))))))
K/KE/KE2.xml,KE2RE02S,39208,43,,B,30,3,--kind of vou- did she say what?,"[I/PRP, don/VBP, 't/PRP, know/VB, what/WP, kind/NN, of/IN, vou-/NN, did/VBD, she/PRP, say/VB, what/WP, ?/.]",(ROOT (S (NP (PRP I)) (VP (VBP don) (S (NP (PRP 't)) (VP (VB know) (SBAR (SBARQ (WHNP (WHNP (WP what) (NN kind)) (PP (IN of) (NP (NN vou-)))) (SQ (VBD did) (NP (PRP she)) (VP (VB say) (NP (WP what)))) (. ?))))))))
K/KE/KE2.xml,KE2RE02S,39208,44,,A,31,1,"Oh I see, you mean not get it till then?","[Oh/UH, I/PRP, see/VBP, ,/,, you/PRP, mean/VBP, not/RB, get/VB, it/PRP, till/IN, then/RB, ?/.]","(ROOT (S (S (INTJ (UH Oh)) (NP (PRP I)) (VP (VBP see))) (, ,) (NP (PRP you)) (VP (VBP mean) (RB not) (VP (VB get) (NP (PRP it)) (PP (IN till) (NP (RB then))))) (. ?)))"
K/KE/KE2.xml,KE2RE02S,39208,45,,B,32,1,"Well it's only Friday, I mean we can ","[Well/RB, it/PRP, 's/VBZ, only/RB, Friday/NNP, ,/,, I/PRP, mean/VBP, we/PRP, can/MD]","(ROOT (S (SBAR (ADVP (RB Well)) (S (NP (PRP it)) (VP (VBZ 's) (NP (RB only) (NNP Friday))))) (, ,) (NP (PRP I)) (VP (VBP mean) (SBAR (S (NP (PRP we)) (VP (MD can)))))))"
K/KE/KE2.xml,KE2RE02S,39208,46,,A,33,1,Yes.,"[Yes/UH, ./.]",(ROOT (INTJ (UH Yes) (. .)))
K/KE/KE2.xml,KE2RE02S,39208,47,,B,34,1,pay for it now.,"[pay/NN, for/IN, it/PRP, now/RB, ./.]",(ROOT (NP (NP (NN pay)) (PP (IN for) (NP (PRP it))) (ADVP (RB now)) (. .)))
K/KE/KE2.xml,KE2RE02S,39208,48,,B,34,2,I mean what are the vouchers  (()) gonna be for?,"[I/PRP, mean/VBP, what/WP, are/VBP, the/DT, vouchers/NNS, gonna/NN, be/VB, for/IN, ?/.]",(ROOT (S (NP (PRP I)) (VP (VBP mean) (SBAR (SBARQ (WHNP (WP what)) (SQ (VBP are) (NP (DT the) (NNS vouchers) (NN gonna)) (VP (VB be) (PP (IN for)))) (. ?))))))
K/KE/KE2.xml,KE2RE02S,39208,49,,A,35,1,I've got no i- I've no idea.,"[I/PRP, 've/VBP, got/VBD, no/DT, i-/NN, I/PRP, 've/VBP, no/DT, idea/NN, ./.]",(ROOT (S (NP (PRP I)) (VP (VBP 've) (VP (VBD got) (NP (DT no) (NN i-)) (SBAR (S (NP (PRP I)) (VP (VBP 've) (NP (DT no) (NN idea))))))) (. .)))
K/KE/KE2.xml,KE2RE02S,39208,50,,B,36,1,Probably be Smith's.<laughing> (()) </laughing> ,"[Probably/RB, be/VB, Smith/NNP, 's/POS, ./.]",(ROOT (S (ADVP (RB Probably)) (VP (VB be) (S (NP (NNP Smith) (POS 's)))) (. .)))
K/KE/KE2.xml,KE2RE02S,39208,51,,A,37,1,<laugh> ,[],X
K/KE/KE2.xml,KE2RE02S,39208,52,,B,38,1,(()) taking off across the road like that in front of a car.,"[taking/VBG, off/RP, across/IN, the/DT, road/NN, like/IN, that/DT, in/IN, front/NN, of/IN, a/DT, car/NN, ./.]",(ROOT (S (VP (VBG taking) (PRT (RP off)) (PP (IN across) (NP (NP (DT the) (NN road)) (PP (IN like) (NP (NP (DT that)) (PP (IN in) (NP (NP (NN front)) (PP (IN of) (NP (DT a) (NN car)))))))))) (. .)))
K/KE/KE2.xml,KE2RE02S,39208,53,,B,38,2,You'd think they want to commit suicide wouldn't you?,"[You/PRP, 'd/MD, think/VB, they/PRP, want/VBP, to/TO, commit/VB, suicide/NN, wouldn/NN, 't/PRP, you/PRP, ?/.]",(ROOT (SINV (S (NP (PRP You)) (VP (MD 'd) (VP (VB think) (NP (PRP they))))) (VP (VBP want) (S (VP (TO to) (VP (VB commit) (S (NP (NN suicide) (NN wouldn)) (NP (PRP 't))))))) (NP (PRP you)) (. ?)))
K/KE/KE2.xml,KE2RE02S,39208,54,,A,39,1,You would wouldn't you?,"[You/PRP, would/MD, wouldn/VB, 't/PRP, you/PRP, ?/.]",(ROOT (S (NP (PRP You)) (VP (MD would) (VP (VB wouldn) (S (NP (PRP 't)) (NP (PRP you))))) (. ?)))
K/KE/KE2.xml,KE2RE02S,39208,55,,B,40,1,"There's ever so many more people about, it's a nice day of course ","[There/EX, 's/VBZ, ever/RB, so/RB, many/JJ, more/JJR, people/NNS, about/RB, ,/,, it/PRP, 's/VBZ, a/DT, nice/JJ, day/NN, of/IN, course/NN]","(ROOT (S (NP (EX There)) (VP (VBZ 's) (ADJP (RB ever) (RB so) (JJ many) (SBAR (S (NP (JJR more) (NNS people)) (ADVP (RB about)) (, ,) (NP (PRP it)) (VP (VBZ 's) (NP (NP (DT a) (JJ nice) (NN day)) (PP (IN of) (NP (NN course)))))))))))"
K/KE/KE2.xml,KE2RE02S,39208,56,,A,41,1,Yeah.,"[Yeah/UH, ./.]",(ROOT (INTJ (UH Yeah) (. .)))
K/KE/KE2.xml,KE2RE02S,39208,57,,B,42,1,but as well as that of course there are all the school children around.,"[but/CC, as/RB, well/RB, as/IN, that/DT, of/IN, course/NN, there/EX, are/VBP, all/PDT, the/DT, school/NN, children/NNS, around/IN, ./.]",(ROOT (S (CC but) (ADVP (RB as) (RB well)) (PP (IN as) (NP (NP (DT that)) (PP (IN of) (NP (NN course))))) (NP (EX there)) (VP (VBP are) (NP (PDT all) (DT the) (NN school) (NNS children)) (ADVP (IN around))) (. .)))
K/KE/KE2.xml,KE2RE02S,39208,58,,A,43,1,Mm.,"[Mm/NN, ./.]",(ROOT (NP (NN Mm) (. .)))
K/KE/KE2.xml,KE2RE02S,39208,59,,B,44,1,(()) ,[],X
K/KE/KE2.xml,KE2RE02S,39208,60,,A,45,1,Now where's he going?,"[Now/RB, where/WRB, 's/POS, he/PRP, going/VBG, ?/.]",(ROOT (SBARQ (WHADVP (ADVP (RB Now)) (WRB where)) (SQ (POS 's) (NP (PRP he)) (VP (VBG going))) (. ?)))
K/KE/KE2.xml,KE2RE02S,39208,61,,B,46,1,"No the fellow's stopped there, taking the cart off to go in there.","[No/DT, the/DT, fellow/NN, 's/POS, stopped/VBD, there/RB, ,/,, taking/VBG, the/DT, cart/NN, off/IN, to/TO, go/VB, in/IN, there/RB, ./.]","(ROOT (NP (NP (DT No) (NP (DT the) (NN fellow) (POS 's))) (SBAR (S (VP (VBD stopped) (ADVP (RB there)) (, ,) (S (VP (VBG taking) (NP (DT the) (NN cart)) (PRT (IN off)) (S (VP (TO to) (VP (VB go) (PP (IN in) (NP (RB there))))))))))) (. .)))"
K/KE/KE2.xml,KE2RE02S,39208,62,,A,47,1,"No indication, just --","[No/DT, indication/NN, ,/,, just/RB, !/.]","(ROOT (FRAG (NP (DT No) (NN indication)) (, ,) (ADVP (RB just) (. !))))"
K/KE/KE2.xml,KE2RE02S,39208,63,,A,47,2,--!,"[No/DT, indication/NN, ,/,, just/RB, !/.]","(ROOT (FRAG (NP (DT No) (NN indication)) (, ,) (ADVP (RB just) (. !))))"
K/KE/KE2.xml,KE2RE02S,39208,64,,B,48,1,Yeah.,"[Yeah/UH, ./.]",(ROOT (INTJ (UH Yeah) (. .)))
K/KE/KE2.xml,KE2RE02S,39208,65,,B,48,2,He's shaking his head like mad.,"[He/PRP, 's/VBZ, shaking/VBG, his/PRP$, head/NN, like/IN, mad/JJ, ./.]",(ROOT (S (NP (PRP He)) (VP (VBZ 's) (VP (VBG shaking) (NP (PRP$ his) (NN head)) (PP (IN like) (ADJP (JJ mad))))) (. .)))
K/KE/KE2.xml,KE2RE02S,39208,66,,A,49,1,Yeah he didn't indicate.,"[Yeah/UH, he/PRP, didn/VB, 't/PRP, indicate/VBP, ./.]",(ROOT (S (INTJ (UH Yeah)) (VP (ADVP (PRP he)) (VB didn) (NP (NP (PRP 't)) (SBAR (S (VP (VBP indicate)))))) (. .)))
K/KE/KE2.xml,KE2RE02S,39208,67,,B,50,1,What was he supposed to be shaking his head for?,"[What/WP, was/VBD, he/PRP, supposed/VBD, to/TO, be/VB, shaking/VBG, his/PRP$, head/NN, for/IN, ?/.]",(ROOT (SBARQ (WHNP (WP What)) (SQ (VP (VBD was) (SBAR (S (NP (PRP he)) (VP (VBD supposed) (S (VP (TO to) (VP (VB be) (VP (VBG shaking) (NP (PRP$ his) (NN head)) (PP (IN for))))))))))) (. ?)))
K/KE/KE2.xml,KE2RE02S,39208,68,,A,51,1,Goodness only knows.,"[Goodness/NN, only/RB, knows/VBZ, ./.]",(ROOT (S (NP (NN Goodness)) (ADVP (RB only)) (VP (VBZ knows)) (. .)))
K/KE/KE2.xml,KE2RE02S,39208,69,,B,52,1,Cos I was shaking mine at him  <laugh> ,"[Cos/NNP, I/PRP, was/VBD, shaking/VBG, mine/NN, at/IN, him/PRP]",(ROOT (FRAG (NP (NP (NNP Cos)) (SBAR (S (NP (PRP I)) (VP (VBD was) (VP (VBG shaking) (NP (NN mine)) (PP (IN at) (NP (PRP him))))))))))
K/KE/KE2.xml,KE2RE02S,39208,70,,A,53,1,"Oh, I see.","[Oh/UH, ,/,, I/PRP, see/VBP, ./.]","(ROOT (S (INTJ (UH Oh)) (, ,) (NP (PRP I)) (VP (VBP see)) (. .)))"
K/KE/KE2.xml,KE2RE02S,39208,71,,B,54,1,perhaps,[perhaps/RB],(ROOT (ADVP (RB perhaps)))
K/KE/KE2.xml,KE2RE02S,39208,72,,A,55,1,Well it was ridiculous!,"[Well/RB, it/PRP, was/VBD, ridiculous/JJ, !/.]",(ROOT (S (ADVP (RB Well)) (NP (PRP it)) (VP (VBD was) (ADJP (JJ ridiculous))) (. !)))
K/KE/KE2.xml,KE2RE02S,39208,73,,B,56,1,"It was, he didn't put on  (()) ","[It/PRP, was/VBD, ,/,, he/PRP, didn/VBD, 't/PRP, put/VB, on/RP]","(ROOT (S (NP (PRP It)) (VP (VBD was) (, ,) (SBAR (S (NP (PRP he)) (VP (VBD didn) (S (NP (PRP 't)) (VP (VB put) (PRT (RP on))))))))))"
K/KE/KE2.xml,KE2RE02S,39208,74,,A,57,1,There was no indication or anything.,"[There/EX, was/VBD, no/DT, indication/NN, or/CC, anything/NN, ./.]",(ROOT (S (NP (EX There)) (VP (VBD was) (NP (DT no) (NN indication) (CC or) (NN anything))) (. .)))
K/KE/KE2.xml,KE2RE02S,39208,75,,B,58,1,suddenly swept in there.,"[suddenly/RB, swept/VBN, in/IN, there/RB, ./.]",(ROOT (S (VP (ADVP (RB suddenly)) (VBN swept) (PP (IN in) (NP (RB there)))) (. .)))
K/KE/KE2.xml,KE2RE02S,39208,76,,B,58,2,"(()) another bank there, talking about a clothes bank  (()) ","[another/DT, bank/NN, there/RB, ,/,, talking/VBG, about/IN, a/DT, clothes/NNS, bank/NN]","(ROOT (FRAG (NP (NP (NP (DT another) (NN bank)) (NP (RB there))) (, ,) (NP (NP (VBG talking)) (PP (IN about) (NP (DT a) (NNS clothes) (NN bank)))))))"
K/KE/KE2.xml,KE2RE02S,39208,77,,A,59,1,"Oh that's right they've got, at the Cricketfield Lane erm car park there's a  --","[Oh/UH, that/DT, 's/VBZ, right/RB, they/PRP, 've/VBP, got/VBN, ,/,, at/IN, the/DT, Cricketfield/NNP, Lane/NNP, erm/NNP, car/NNP, park/NNP, there/EX, 's/VBZ, a/DT, where/WRB, ,/,, you/PRP, know/VBP, where/WRB, the/DT, bottle/NN, bank/NN, is/VBZ, on/IN, the/DT]","(ROOT (NP (S (S (INTJ (UH Oh)) (NP (DT that)) (VP (VBZ 's) (ADJP (RB right)) (SBAR (S (NP (PRP they)) (VP (VBP 've) (VP (VBN got))))))) (, ,) (X (X (IN at)) (NP (NP (DT the) (NNP Cricketfield) (NNP Lane) (NNP erm)) (NP (NNP car) (NNP park)))) (NP (EX there)) (VP (VBZ 's) (NP (DT a)) (SBAR (WHADVP (WRB where)) (, ,) (S (NP (PRP you)) (VP (VBP know) (SBAR (WHADVP (WRB where)) (S (NP (DT the) (NN bottle) (NN bank)) (VP (VBZ is) (PP (IN on) (NP (DT the)))))))))))))"
K/KE/KE2.xml,KE2RE02S,39208,78,,A,59,2,"--where, you know where the bottle bank is on the ","[Oh/UH, that/DT, 's/VBZ, right/RB, they/PRP, 've/VBP, got/VBN, ,/,, at/IN, the/DT, Cricketfield/NNP, Lane/NNP, erm/NNP, car/NNP, park/NNP, there/EX, 's/VBZ, a/DT, where/WRB, ,/,, you/PRP, know/VBP, where/WRB, the/DT, bottle/NN, bank/NN, is/VBZ, on/IN, the/DT]","(ROOT (NP (S (S (INTJ (UH Oh)) (NP (DT that)) (VP (VBZ 's) (ADJP (RB right)) (SBAR (S (NP (PRP they)) (VP (VBP 've) (VP (VBN got))))))) (, ,) (X (X (IN at)) (NP (NP (DT the) (NNP Cricketfield) (NNP Lane) (NNP erm)) (NP (NNP car) (NNP park)))) (NP (EX there)) (VP (VBZ 's) (NP (DT a)) (SBAR (WHADVP (WRB where)) (, ,) (S (NP (PRP you)) (VP (VBP know) (SBAR (WHADVP (WRB where)) (S (NP (DT the) (NN bottle) (NN bank)) (VP (VBZ is) (PP (IN on) (NP (DT the)))))))))))))"
K/KE/KE2.xml,KE2RE02S,39208,79,,B,60,1,Yeah?,"[Yeah/UH, ?/.]",(ROOT (INTJ (UH Yeah) (. ?)))
