swda_filename,ptb_basename,conversation_no,transcript_index,act_tag,caller,turn_index,subutterance_index,text,pos,trees
K/KE/KE2.xml,KE2RE02R,39207,0,,A,1,1,goes with that.,"[goes/VBZ, with/IN, that/DT, ./.]",(ROOT (S (VP (VBZ goes) (PP (IN with) (NP (DT that)))) (. .)))
K/KE/KE2.xml,KE2RE02R,39207,1,,B,2,1,Yeah but what would you get with the two?,"[Yeah/UH, but/CC, what/WP, would/MD, you/PRP, get/VB, with/IN, the/DT, two/CD, ?/.]",(ROOT (UCP (FRAG (INTJ (UH Yeah))) (CC but) (SBAR (WHNP (WP what)) (S (VP (MD would) (NP (PRP you)) (S (VP (VB get) (PP (IN with) (NP (DT the) (CD two))))))) (. ?))))
K/KE/KE2.xml,KE2RE02R,39207,2,,A,3,1,With the two you get  --,"[With/IN, the/DT, two/CD, you/PRP, get/VBP, Tesco/NNP, 's/POS, premium/NN, teabags/NNS, ,/,, a/DT, hundred/CD, plus/CC, Tesco/NNP, 's/POS, freeze/NN, dried/VBD, gold/JJ, coffee/NN, ,/,, two/CD, hundred/CD, grammes/NNS, of/IN, that/DT, plus/CC, packet/NN, of/IN, erm/NN, biscuits/NNS, ./.]","(ROOT (S (S (PP (IN With) (NP (DT the) (CD two))) (NP (PRP you)) (VP (VBP get) (NP (NP (NNP Tesco) (POS 's)) (NN premium) (NNS teabags)))) (, ,) (NP (DT a) (NP (CD hundred)) (CC plus) (NP (NP (NNP Tesco) (POS 's)) (NN freeze))) (VP (VBD dried) (NP (NP (NP (JJ gold) (NN coffee)) (, ,) (NP (NP (QP (CD two) (CD hundred)) (NNS grammes)) (PP (IN of) (NP (DT that))))) (CC plus) (NP (NP (NN packet)) (PP (IN of) (NP (NN erm) (NNS biscuits)))))) (. .)))"
K/KE/KE2.xml,KE2RE02R,39207,3,,A,3,2,"--Tesco's premium teabags, a hundred  --","[With/IN, the/DT, two/CD, you/PRP, get/VBP, Tesco/NNP, 's/POS, premium/NN, teabags/NNS, ,/,, a/DT, hundred/CD, plus/CC, Tesco/NNP, 's/POS, freeze/NN, dried/VBD, gold/JJ, coffee/NN, ,/,, two/CD, hundred/CD, grammes/NNS, of/IN, that/DT, plus/CC, packet/NN, of/IN, erm/NN, biscuits/NNS, ./.]","(ROOT (S (S (PP (IN With) (NP (DT the) (CD two))) (NP (PRP you)) (VP (VBP get) (NP (NP (NNP Tesco) (POS 's)) (NN premium) (NNS teabags)))) (, ,) (NP (DT a) (NP (CD hundred)) (CC plus) (NP (NP (NNP Tesco) (POS 's)) (NN freeze))) (VP (VBD dried) (NP (NP (NP (JJ gold) (NN coffee)) (, ,) (NP (NP (QP (CD two) (CD hundred)) (NNS grammes)) (PP (IN of) (NP (DT that))))) (CC plus) (NP (NP (NN packet)) (PP (IN of) (NP (NN erm) (NNS biscuits)))))) (. .)))"
K/KE/KE2.xml,KE2RE02R,39207,4,,A,3,3,"--plus Tesco's freeze dried gold coffee, two hundred grammes of that plus  --","[With/IN, the/DT, two/CD, you/PRP, get/VBP, Tesco/NNP, 's/POS, premium/NN, teabags/NNS, ,/,, a/DT, hundred/CD, plus/CC, Tesco/NNP, 's/POS, freeze/NN, dried/VBD, gold/JJ, coffee/NN, ,/,, two/CD, hundred/CD, grammes/NNS, of/IN, that/DT, plus/CC, packet/NN, of/IN, erm/NN, biscuits/NNS, ./.]","(ROOT (S (S (PP (IN With) (NP (DT the) (CD two))) (NP (PRP you)) (VP (VBP get) (NP (NP (NNP Tesco) (POS 's)) (NN premium) (NNS teabags)))) (, ,) (NP (DT a) (NP (CD hundred)) (CC plus) (NP (NP (NNP Tesco) (POS 's)) (NN freeze))) (VP (VBD dried) (NP (NP (NP (JJ gold) (NN coffee)) (, ,) (NP (NP (QP (CD two) (CD hundred)) (NNS grammes)) (PP (IN of) (NP (DT that))))) (CC plus) (NP (NP (NN packet)) (PP (IN of) (NP (NN erm) (NNS biscuits)))))) (. .)))"
K/KE/KE2.xml,KE2RE02R,39207,5,,A,3,4,--packet of erm biscuits.,"[With/IN, the/DT, two/CD, you/PRP, get/VBP, Tesco/NNP, 's/POS, premium/NN, teabags/NNS, ,/,, a/DT, hundred/CD, plus/CC, Tesco/NNP, 's/POS, freeze/NN, dried/VBD, gold/JJ, coffee/NN, ,/,, two/CD, hundred/CD, grammes/NNS, of/IN, that/DT, plus/CC, packet/NN, of/IN, erm/NN, biscuits/NNS, ./.]","(ROOT (S (S (PP (IN With) (NP (DT the) (CD two))) (NP (PRP you)) (VP (VBP get) (NP (NP (NNP Tesco) (POS 's)) (NN premium) (NNS teabags)))) (, ,) (NP (DT a) (NP (CD hundred)) (CC plus) (NP (NP (NNP Tesco) (POS 's)) (NN freeze))) (VP (VBD dried) (NP (NP (NP (JJ gold) (NN coffee)) (, ,) (NP (NP (QP (CD two) (CD hundred)) (NNS grammes)) (PP (IN of) (NP (DT that))))) (CC plus) (NP (NP (NN packet)) (PP (IN of) (NP (NN erm) (NNS biscuits)))))) (. .)))"
K/KE/KE2.xml,KE2RE02R,39207,6,,A,3,5,Well the teabags don't mean anything to us really  (()) ,"[Well/RB, the/DT, teabags/NNS, don/VBP, 't/PRP, mean/VB, anything/NN, to/TO, us/PRP, really/RB]",(ROOT (S (NP (ADVP (RB Well)) (DT the) (NNS teabags)) (VP (VBP don) (S (NP (PRP 't)) (VP (VB mean) (NP (NN anything)) (PP (TO to) (NP (NP (PRP us)) (ADVP (RB really)))))))))
K/KE/KE2.xml,KE2RE02R,39207,7,,B,4,1,Thought you said something about a chicken.,"[Thought/VBN, you/PRP, said/VBD, something/NN, about/IN, a/DT, chicken/NN, ./.]",(ROOT (S (S (VP (VBN Thought))) (NP (PRP you)) (VP (VBD said) (NP (NN something)) (PP (IN about) (NP (DT a) (NN chicken)))) (. .)))
K/KE/KE2.xml,KE2RE02R,39207,8,,A,5,1,"Well that's if you get the, the next page  --","[Well/RB, that/DT, 's/VBZ, if/IN, you/PRP, get/VBP, the/DT, ,/,, the/DT, next/JJ, page/NN, which/WDT, means/VBZ, that/IN, you/PRP, have/VBP, to/TO, have/VB, twenty/CD, stamps/NNS, in/IN, all/DT, ./.]","(ROOT (S (ADVP (RB Well)) (NP (DT that)) (VP (VBZ 's) (SBAR (IN if) (S (NP (PRP you)) (VP (VBP get) (NP (NP (DT the)) (, ,) (NP (NP (DT the) (JJ next) (NN page)) (SBAR (WHNP (WDT which)) (S (VP (VBZ means) (SBAR (IN that) (S (NP (PRP you)) (VP (VBP have) (S (VP (TO to) (VP (VB have) (NP (NP (CD twenty) (NNS stamps)) (PP (IN in) (NP (DT all))))))))))))))))))) (. .)))"
K/KE/KE2.xml,KE2RE02R,39207,9,,A,5,2,--which means that you have to have twenty stamps in all.,"[Well/RB, that/DT, 's/VBZ, if/IN, you/PRP, get/VBP, the/DT, ,/,, the/DT, next/JJ, page/NN, which/WDT, means/VBZ, that/IN, you/PRP, have/VBP, to/TO, have/VB, twenty/CD, stamps/NNS, in/IN, all/DT, ./.]","(ROOT (S (ADVP (RB Well)) (NP (DT that)) (VP (VBZ 's) (SBAR (IN if) (S (NP (PRP you)) (VP (VBP get) (NP (NP (DT the)) (, ,) (NP (NP (DT the) (JJ next) (NN page)) (SBAR (WHNP (WDT which)) (S (VP (VBZ means) (SBAR (IN that) (S (NP (PRP you)) (VP (VBP have) (S (VP (TO to) (VP (VB have) (NP (NP (CD twenty) (NNS stamps)) (PP (IN in) (NP (DT all))))))))))))))))))) (. .)))"
K/KE/KE2.xml,KE2RE02R,39207,10,,B,6,1,Oh I see.,"[Oh/UH, I/PRP, see/VBP, ./.]",(ROOT (S (S (INTJ (UH Oh)) (NP (PRP I)) (VP (VBP see))) (. .)))
K/KE/KE2.xml,KE2RE02R,39207,11,,A,7,1,You have to have four completed pages,"[You/PRP, have/VBP, to/TO, have/VB, four/CD, completed/VBN, pages/NNS]",(ROOT (S (NP (PRP You)) (VP (VBP have) (S (VP (TO to) (VP (VB have) (NP (NP (CD four)) (VP (VBN completed) (NP (NNS pages))))))))))
K/KE/KE2.xml,KE2RE02R,39207,12,,B,8,1,Oh I see.,"[Oh/UH, I/PRP, see/VBP, ./.]",(ROOT (S (S (INTJ (UH Oh)) (NP (PRP I)) (VP (VBP see))) (. .)))
K/KE/KE2.xml,KE2RE02R,39207,13,,A,9,1,and with that you would get erm,"[and/CC, with/IN, that/DT, you/PRP, would/MD, get/VB, erm/NN]",(ROOT (FRAG (CC and) (PP (IN with) (SBAR (WHNP (DT that)) (S (NP (PRP you)) (VP (MD would) (VP (VB get) (NP (NN erm)))))))))
K/KE/KE2.xml,KE2RE02R,39207,14,,B,10,1,Oh well ,"[Oh/UH, well/RB]",(ROOT (INTJ (UH Oh) (RB well)))
K/KE/KE2.xml,KE2RE02R,39207,15,,A,11,1,"I'm not likely to have that next week, that's ","[I/PRP, 'm/VBP, not/RB, likely/JJ, to/TO, have/VB, that/DT, next/JJ, week/NN, ,/,, that/DT, 's/VBZ]","(ROOT (S (NP (PRP I)) (VP (VBP 'm) (RB not) (ADJP (JJ likely) (S (VP (TO to) (VP (VB have) (NP (NP (DT that) (JJ next) (NN week)) (, ,) (SBAR (WHNP (DT that)) (S (VP (VBZ 's))))))))))))"
K/KE/KE2.xml,KE2RE02R,39207,16,,B,12,1,"No you won't get that, no.","[No/DT, you/PRP, won/VBD, 't/PRP, get/VB, that/DT, ,/,, no/DT, ./.]","(ROOT (S (NP (DT No) (PRP you)) (VP (VBD won) (S (NP (PRP 't)) (VP (VB get) (NP (NP (DT that)) (, ,) (NP (DT no)))))) (. .)))"
K/KE/KE2.xml,KE2RE02R,39207,17,,A,13,1,going to need,"[going/VBG, to/TO, need/VB]",(ROOT (S (VP (VBG going) (S (VP (TO to) (VP (VB need)))))))
K/KE/KE2.xml,KE2RE02R,39207,18,,B,14,1,So you're looking at either these  --,"[So/RB, you/PRP, 're/VBP, looking/VBG, at/IN, either/CC, these/DT, chocolates/NNS, or/CC, well/RB, you/PRP, don/VBP, 't/PRP, want/VB, the/DT, premium/NN, teabags/NNS, anyway/RB]",(ROOT (ADJP (RB So) (SBAR (S (NP (PRP you)) (VP (VBP 're) (VP (VBG looking) (PP (IN at) (NP (UCP (PP (CC either) (NP (DT these) (NNS chocolates))) (CC or) (RB well) (SBAR (S (NP (PRP you)) (VP (VBP don) (S (NP (PRP 't)) (VP (VB want) (NP (DT the) (NN premium)))))))) (NNS teabags))) (ADVP (RB anyway))))))))
K/KE/KE2.xml,KE2RE02R,39207,19,,B,14,2,--chocolates or  --,"[So/RB, you/PRP, 're/VBP, looking/VBG, at/IN, either/CC, these/DT, chocolates/NNS, or/CC, well/RB, you/PRP, don/VBP, 't/PRP, want/VB, the/DT, premium/NN, teabags/NNS, anyway/RB]",(ROOT (ADJP (RB So) (SBAR (S (NP (PRP you)) (VP (VBP 're) (VP (VBG looking) (PP (IN at) (NP (UCP (PP (CC either) (NP (DT these) (NNS chocolates))) (CC or) (RB well) (SBAR (S (NP (PRP you)) (VP (VBP don) (S (NP (PRP 't)) (VP (VB want) (NP (DT the) (NN premium)))))))) (NNS teabags))) (ADVP (RB anyway))))))))
K/KE/KE2.xml,KE2RE02R,39207,20,,B,14,3,--well you don't want the premium teabags anyway,"[So/RB, you/PRP, 're/VBP, looking/VBG, at/IN, either/CC, these/DT, chocolates/NNS, or/CC, well/RB, you/PRP, don/VBP, 't/PRP, want/VB, the/DT, premium/NN, teabags/NNS, anyway/RB]",(ROOT (ADJP (RB So) (SBAR (S (NP (PRP you)) (VP (VBP 're) (VP (VBG looking) (PP (IN at) (NP (UCP (PP (CC either) (NP (DT these) (NNS chocolates))) (CC or) (RB well) (SBAR (S (NP (PRP you)) (VP (VBP don) (S (NP (PRP 't)) (VP (VB want) (NP (DT the) (NN premium)))))))) (NNS teabags))) (ADVP (RB anyway))))))))
K/KE/KE2.xml,KE2RE02R,39207,21,,A,15,1,No.,"[No/DT, ./.]",(ROOT (FRAG (NP (DT No)) (. .)))
K/KE/KE2.xml,KE2RE02R,39207,22,,A,15,2,But then we don't use teabags do we?,"[But/CC, then/RB, we/PRP, don/VBP, 't/PRP, use/VB, teabags/NNS, do/VBP, we/PRP, ?/.]",(ROOT (S (CC But) (ADVP (RB then)) (NP (PRP we)) (VP (VBP don) (S (NP (PRP 't)) (VP (VB use) (SBAR (S (NP (NNS teabags)) (VP (VBP do) (NP (PRP we)))))))) (. ?)))
K/KE/KE2.xml,KE2RE02R,39207,23,,A,15,3,I mean ,"[I/PRP, mean/VBP]",(ROOT (S (NP (PRP I)) (VP (VBP mean))))
K/KE/KE2.xml,KE2RE02R,39207,24,,B,16,1,No.,"[No/DT, ./.]",(ROOT (FRAG (NP (DT No)) (. .)))
K/KE/KE2.xml,KE2RE02R,39207,25,,A,17,1,they could go to parish hall but I'm thinking to myself well  --,"[they/PRP, could/MD, go/VB, to/TO, parish/VB, hall/NN, but/CC, I/PRP, 'm/VBP, thinking/VBG, to/TO, myself/PRP, well/RB, why/WRB, bother/VB, ?/.]",(ROOT (S (NP (PRP they)) (VP (MD could) (VP (VB go) (S (VP (TO to) (VP (VB parish) (NP (NN hall)) (SBAR (CC but) (S (NP (PRP I)) (VP (VBP 'm) (VP (VBG thinking) (PP (TO to) (NP (PRP myself))))))) (FRAG (WHADVP (RB well) (WRB why)) (VP (VB bother)))))))) (. ?)))
K/KE/KE2.xml,KE2RE02R,39207,26,,A,17,2,--why bother?,"[they/PRP, could/MD, go/VB, to/TO, parish/VB, hall/NN, but/CC, I/PRP, 'm/VBP, thinking/VBG, to/TO, myself/PRP, well/RB, why/WRB, bother/VB, ?/.]",(ROOT (S (NP (PRP they)) (VP (MD could) (VP (VB go) (S (VP (TO to) (VP (VB parish) (NP (NN hall)) (SBAR (CC but) (S (NP (PRP I)) (VP (VBP 'm) (VP (VBG thinking) (PP (TO to) (NP (PRP myself))))))) (FRAG (WHADVP (RB well) (WRB why)) (VP (VB bother)))))))) (. ?)))
K/KE/KE2.xml,KE2RE02R,39207,27,,B,18,1,"Well you can always charge them, could always take the cash for that.","[Well/RB, you/PRP, can/MD, always/RB, charge/VB, them/PRP, ,/,, could/MD, always/RB, take/VB, the/DT, cash/NN, for/IN, that/DT, ./.]","(ROOT (S (S (INTJ (RB Well)) (NP (PRP you)) (VP (MD can) (ADVP (RB always)) (VP (VB charge) (NP (PRP them))))) (, ,) (VP (MD could) (ADVP (RB always)) (VP (VB take))) (NP (NP (DT the) (NN cash)) (PP (IN for) (NP (DT that)))) (. .)))"
K/KE/KE2.xml,KE2RE02R,39207,28,,A,19,1,But erm,"[But/CC, erm/NN]",(ROOT (FRAG (CC But) (NP (NN erm))))
K/KE/KE2.xml,KE2RE02R,39207,29,,B,20,1,So how much is the coffee?,"[So/RB, how/WRB, much/JJ, is/VBZ, the/DT, coffee/NN, ?/.]",(ROOT (SBARQ (RB So) (WHNP (WRB how) (JJ much)) (SQ (VBZ is) (NP (DT the) (NN coffee))) (. ?)))
K/KE/KE2.xml,KE2RE02R,39207,30,,A,21,1,Well the coffee is what we got the other day.,"[Well/RB, the/DT, coffee/NN, is/VBZ, what/WP, we/PRP, got/VBD, the/DT, other/JJ, day/NN, ./.]",(ROOT (S (ADVP (RB Well)) (NP (DT the) (NN coffee)) (VP (VBZ is) (SBAR (WHNP (WP what)) (S (NP (PRP we)) (VP (VBD got) (NP (DT the) (JJ other) (NN day)))))) (. .)))
K/KE/KE2.xml,KE2RE02R,39207,31,,B,22,1,Yeah that's about two fifty is it?,"[Yeah/UH, that/DT, 's/VBZ, about/IN, two/CD, fifty/CD, is/VBZ, it/PRP, ?/.]",(ROOT (S (S (INTJ (UH Yeah)) (NP (DT that)) (VP (VBZ 's) (PP (IN about) (NP (CD two))))) (NP (CD fifty)) (VP (VBZ is) (NP (PRP it))) (. ?)))
K/KE/KE2.xml,KE2RE02R,39207,32,,A,23,1,"Something like that, yeah.","[Something/NN, like/IN, that/DT, ,/,, yeah/UH, ./.]","(ROOT (FRAG (PP (NP (NN Something)) (PP (IN like) (NP (DT that)))) (, ,) (INTJ (UH yeah)) (. .)))"
K/KE/KE2.xml,KE2RE02R,39207,33,,B,24,1,And what else is ,"[And/CC, what/WP, else/RB, is/VBZ]",(ROOT (S (CC And) (NP (WP what)) (ADVP (RB else)) (VP (VBZ is))))
K/KE/KE2.xml,KE2RE02R,39207,34,,A,25,1,And I've got a spare one of those anyway haven't I?,"[And/CC, I/PRP, 've/VBP, got/VBD, a/DT, spare/JJ, one/CD, of/IN, those/DT, anyway/RB, haven/NN, 't/PRP, I/PRP, ?/.]",(ROOT (S (CC And) (NP (PRP I)) (VP (VBP 've) (VP (VBD got) (S (NP (NP (DT a) (JJ spare) (CD one)) (PP (IN of) (NP (NP (DT those) (ADVP (RB anyway)) (NN haven)) (NP (PRP 't))))) (NP (PRP I))))) (. ?)))
K/KE/KE2.xml,KE2RE02R,39207,35,,A,25,2,I bought a spare one anyway.,"[I/PRP, bought/VBD, a/DT, spare/JJ, one/CD, anyway/RB, ./.]",(ROOT (S (NP (PRP I)) (VP (VBD bought) (NP (DT a) (JJ spare) (CD one)) (ADVP (RB anyway))) (. .)))
K/KE/KE2.xml,KE2RE02R,39207,36,,B,26,1,Yeah.,"[Yeah/UH, ./.]",(ROOT (INTJ (UH Yeah) (. .)))
K/KE/KE2.xml,KE2RE02R,39207,37,,A,27,1,And you see other than that there's just the biscuits.,"[And/CC, you/PRP, see/VBP, other/JJ, than/IN, that/DT, there/EX, 's/VBZ, just/RB, the/DT, biscuits/NNS, ./.]",(ROOT (S (CC And) (NP (PRP you)) (VP (VBP see) (ADJP (JJ other) (PP (IN than) (SBAR (WHNP (DT that)) (S (NP (EX there)) (VP (VBZ 's) (ADVP (RB just)) (NP (DT the) (NNS biscuits)))))))) (. .)))
K/KE/KE2.xml,KE2RE02R,39207,38,,B,28,1,Yeah.,"[Yeah/UH, ./.]",(ROOT (INTJ (UH Yeah) (. .)))
K/KE/KE2.xml,KE2RE02R,39207,39,,A,29,1,And we've got plenty of biscuits there.,"[And/CC, we/PRP, 've/VBP, got/VBN, plenty/NN, of/IN, biscuits/NNS, there/RB, ./.]",(ROOT (S (CC And) (NP (PRP we)) (VP (VBP 've) (VP (VBN got) (NP (NP (NN plenty)) (PP (IN of) (NP (NNS biscuits)))) (ADVP (RB there)))) (. .)))
K/KE/KE2.xml,KE2RE02R,39207,40,,A,29,2,"Premium teabags, a hundred and sixty  --","[Premium/NN, teabags/NNS, ,/,, a/DT, hundred/CD, and/CC, sixty/CD, plus/CC, the/DT, freeze/NN, dried/VBD, gold/JJ, coffee/NN, plus/CC, spec-/JJ, erm/NN, Fox/NNP, 's/POS, speciality/NN, selection/NN, biscuits/NNS, ./.]","(ROOT (S (NP (NP (NN Premium) (NNS teabags)) (, ,) (NP (DT a) (CD hundred)) (CC and) (NP (NP (CD sixty)) (PP (CC plus) (NP (DT the) (NN freeze))))) (VP (VBD dried) (NP (NP (JJ gold) (NN coffee)) (PP (CC plus) (NP (JJ spec-) (NN erm) (NNP Fox) (POS 's) (NN speciality) (NN selection) (NNS biscuits))))) (. .)))"
K/KE/KE2.xml,KE2RE02R,39207,41,,A,29,3,--plus the freeze dried gold coffee  --,"[Premium/NN, teabags/NNS, ,/,, a/DT, hundred/CD, and/CC, sixty/CD, plus/CC, the/DT, freeze/NN, dried/VBD, gold/JJ, coffee/NN, plus/CC, spec-/JJ, erm/NN, Fox/NNP, 's/POS, speciality/NN, selection/NN, biscuits/NNS, ./.]","(ROOT (S (NP (NP (NN Premium) (NNS teabags)) (, ,) (NP (DT a) (CD hundred)) (CC and) (NP (NP (CD sixty)) (PP (CC plus) (NP (DT the) (NN freeze))))) (VP (VBD dried) (NP (NP (JJ gold) (NN coffee)) (PP (CC plus) (NP (JJ spec-) (NN erm) (NNP Fox) (POS 's) (NN speciality) (NN selection) (NNS biscuits))))) (. .)))"
K/KE/KE2.xml,KE2RE02R,39207,42,,A,29,4,--plus  --,"[Premium/NN, teabags/NNS, ,/,, a/DT, hundred/CD, and/CC, sixty/CD, plus/CC, the/DT, freeze/NN, dried/VBD, gold/JJ, coffee/NN, plus/CC, spec-/JJ, erm/NN, Fox/NNP, 's/POS, speciality/NN, selection/NN, biscuits/NNS, ./.]","(ROOT (S (NP (NP (NN Premium) (NNS teabags)) (, ,) (NP (DT a) (CD hundred)) (CC and) (NP (NP (CD sixty)) (PP (CC plus) (NP (DT the) (NN freeze))))) (VP (VBD dried) (NP (NP (JJ gold) (NN coffee)) (PP (CC plus) (NP (JJ spec-) (NN erm) (NNP Fox) (POS 's) (NN speciality) (NN selection) (NNS biscuits))))) (. .)))"
K/KE/KE2.xml,KE2RE02R,39207,43,,A,29,5,--spec- erm Fox's  --,"[Premium/NN, teabags/NNS, ,/,, a/DT, hundred/CD, and/CC, sixty/CD, plus/CC, the/DT, freeze/NN, dried/VBD, gold/JJ, coffee/NN, plus/CC, spec-/JJ, erm/NN, Fox/NNP, 's/POS, speciality/NN, selection/NN, biscuits/NNS, ./.]","(ROOT (S (NP (NP (NN Premium) (NNS teabags)) (, ,) (NP (DT a) (CD hundred)) (CC and) (NP (NP (CD sixty)) (PP (CC plus) (NP (DT the) (NN freeze))))) (VP (VBD dried) (NP (NP (JJ gold) (NN coffee)) (PP (CC plus) (NP (JJ spec-) (NN erm) (NNP Fox) (POS 's) (NN speciality) (NN selection) (NNS biscuits))))) (. .)))"
K/KE/KE2.xml,KE2RE02R,39207,44,,A,29,6,--speciality selection biscuits.,"[Premium/NN, teabags/NNS, ,/,, a/DT, hundred/CD, and/CC, sixty/CD, plus/CC, the/DT, freeze/NN, dried/VBD, gold/JJ, coffee/NN, plus/CC, spec-/JJ, erm/NN, Fox/NNP, 's/POS, speciality/NN, selection/NN, biscuits/NNS, ./.]","(ROOT (S (NP (NP (NN Premium) (NNS teabags)) (, ,) (NP (DT a) (CD hundred)) (CC and) (NP (NP (CD sixty)) (PP (CC plus) (NP (DT the) (NN freeze))))) (VP (VBD dried) (NP (NP (JJ gold) (NN coffee)) (PP (CC plus) (NP (JJ spec-) (NN erm) (NNP Fox) (POS 's) (NN speciality) (NN selection) (NNS biscuits))))) (. .)))"
K/KE/KE2.xml,KE2RE02R,39207,45,,A,29,7,With the four completed pages  --,"[With/IN, the/DT, four/CD, completed/VBN, pages/NNS, you/PRP, get/VBP, a/DT, large/JJ, frozen/JJ, chicken/NN, er/NN, six/CD, pounds/NNS, six/CD, pounds/NNS, four/CD, ounces/NNS, plus/CC, erm/NN, party/NN, size/NN, ,/,, fourteen/CD, portions/NNS, black/JJ, forest/NN, gateau/NN, plus/CC, a/DT, bottle/NN, of/IN, Bordeaux/NNP, white/NNP, wine/NNP, ./.]","(ROOT (S (PP (IN With) (NP (NP (DT the) (CD four)) (VP (VBN completed) (NP (NNS pages))))) (NP (PRP you)) (VP (VBP get) (NP (NP (NP (NP (DT a) (JJ large) (JJ frozen) (NN chicken) (NN er)) (NP (CD six) (NNS pounds))) (NP (NP (CD six) (NNS pounds)) (NP (CD four) (NNS ounces)))) (CC plus) (NP (NP (NN erm) (NN party) (NN size)) (, ,) (NP (NP (NP (CD fourteen) (NNS portions)) (NP (JJ black) (NN forest) (NN gateau))) (CC plus) (NP (NP (DT a) (NN bottle)) (PP (IN of) (NP (NNP Bordeaux) (NNP white) (NNP wine)))))))) (. .)))"
K/KE/KE2.xml,KE2RE02R,39207,46,,A,29,8,--you get a large frozen chicken er six pounds  --,"[With/IN, the/DT, four/CD, completed/VBN, pages/NNS, you/PRP, get/VBP, a/DT, large/JJ, frozen/JJ, chicken/NN, er/NN, six/CD, pounds/NNS, six/CD, pounds/NNS, four/CD, ounces/NNS, plus/CC, erm/NN, party/NN, size/NN, ,/,, fourteen/CD, portions/NNS, black/JJ, forest/NN, gateau/NN, plus/CC, a/DT, bottle/NN, of/IN, Bordeaux/NNP, white/NNP, wine/NNP, ./.]","(ROOT (S (PP (IN With) (NP (NP (DT the) (CD four)) (VP (VBN completed) (NP (NNS pages))))) (NP (PRP you)) (VP (VBP get) (NP (NP (NP (NP (DT a) (JJ large) (JJ frozen) (NN chicken) (NN er)) (NP (CD six) (NNS pounds))) (NP (NP (CD six) (NNS pounds)) (NP (CD four) (NNS ounces)))) (CC plus) (NP (NP (NN erm) (NN party) (NN size)) (, ,) (NP (NP (NP (CD fourteen) (NNS portions)) (NP (JJ black) (NN forest) (NN gateau))) (CC plus) (NP (NP (DT a) (NN bottle)) (PP (IN of) (NP (NNP Bordeaux) (NNP white) (NNP wine)))))))) (. .)))"
K/KE/KE2.xml,KE2RE02R,39207,47,,A,29,9,--six pounds four ounces plus  --,"[With/IN, the/DT, four/CD, completed/VBN, pages/NNS, you/PRP, get/VBP, a/DT, large/JJ, frozen/JJ, chicken/NN, er/NN, six/CD, pounds/NNS, six/CD, pounds/NNS, four/CD, ounces/NNS, plus/CC, erm/NN, party/NN, size/NN, ,/,, fourteen/CD, portions/NNS, black/JJ, forest/NN, gateau/NN, plus/CC, a/DT, bottle/NN, of/IN, Bordeaux/NNP, white/NNP, wine/NNP, ./.]","(ROOT (S (PP (IN With) (NP (NP (DT the) (CD four)) (VP (VBN completed) (NP (NNS pages))))) (NP (PRP you)) (VP (VBP get) (NP (NP (NP (NP (DT a) (JJ large) (JJ frozen) (NN chicken) (NN er)) (NP (CD six) (NNS pounds))) (NP (NP (CD six) (NNS pounds)) (NP (CD four) (NNS ounces)))) (CC plus) (NP (NP (NN erm) (NN party) (NN size)) (, ,) (NP (NP (NP (CD fourteen) (NNS portions)) (NP (JJ black) (NN forest) (NN gateau))) (CC plus) (NP (NP (DT a) (NN bottle)) (PP (IN of) (NP (NNP Bordeaux) (NNP white) (NNP wine)))))))) (. .)))"
K/KE/KE2.xml,KE2RE02R,39207,48,,A,29,10,--erm  --,"[With/IN, the/DT, four/CD, completed/VBN, pages/NNS, you/PRP, get/VBP, a/DT, large/JJ, frozen/JJ, chicken/NN, er/NN, six/CD, pounds/NNS, six/CD, pounds/NNS, four/CD, ounces/NNS, plus/CC, erm/NN, party/NN, size/NN, ,/,, fourteen/CD, portions/NNS, black/JJ, forest/NN, gateau/NN, plus/CC, a/DT, bottle/NN, of/IN, Bordeaux/NNP, white/NNP, wine/NNP, ./.]","(ROOT (S (PP (IN With) (NP (NP (DT the) (CD four)) (VP (VBN completed) (NP (NNS pages))))) (NP (PRP you)) (VP (VBP get) (NP (NP (NP (NP (DT a) (JJ large) (JJ frozen) (NN chicken) (NN er)) (NP (CD six) (NNS pounds))) (NP (NP (CD six) (NNS pounds)) (NP (CD four) (NNS ounces)))) (CC plus) (NP (NP (NN erm) (NN party) (NN size)) (, ,) (NP (NP (NP (CD fourteen) (NNS portions)) (NP (JJ black) (NN forest) (NN gateau))) (CC plus) (NP (NP (DT a) (NN bottle)) (PP (IN of) (NP (NNP Bordeaux) (NNP white) (NNP wine)))))))) (. .)))"
K/KE/KE2.xml,KE2RE02R,39207,49,,A,29,11,"--party size, fourteen portions  --","[With/IN, the/DT, four/CD, completed/VBN, pages/NNS, you/PRP, get/VBP, a/DT, large/JJ, frozen/JJ, chicken/NN, er/NN, six/CD, pounds/NNS, six/CD, pounds/NNS, four/CD, ounces/NNS, plus/CC, erm/NN, party/NN, size/NN, ,/,, fourteen/CD, portions/NNS, black/JJ, forest/NN, gateau/NN, plus/CC, a/DT, bottle/NN, of/IN, Bordeaux/NNP, white/NNP, wine/NNP, ./.]","(ROOT (S (PP (IN With) (NP (NP (DT the) (CD four)) (VP (VBN completed) (NP (NNS pages))))) (NP (PRP you)) (VP (VBP get) (NP (NP (NP (NP (DT a) (JJ large) (JJ frozen) (NN chicken) (NN er)) (NP (CD six) (NNS pounds))) (NP (NP (CD six) (NNS pounds)) (NP (CD four) (NNS ounces)))) (CC plus) (NP (NP (NN erm) (NN party) (NN size)) (, ,) (NP (NP (NP (CD fourteen) (NNS portions)) (NP (JJ black) (NN forest) (NN gateau))) (CC plus) (NP (NP (DT a) (NN bottle)) (PP (IN of) (NP (NNP Bordeaux) (NNP white) (NNP wine)))))))) (. .)))"
K/KE/KE2.xml,KE2RE02R,39207,50,,A,29,12,--black forest gateau  --,"[With/IN, the/DT, four/CD, completed/VBN, pages/NNS, you/PRP, get/VBP, a/DT, large/JJ, frozen/JJ, chicken/NN, er/NN, six/CD, pounds/NNS, six/CD, pounds/NNS, four/CD, ounces/NNS, plus/CC, erm/NN, party/NN, size/NN, ,/,, fourteen/CD, portions/NNS, black/JJ, forest/NN, gateau/NN, plus/CC, a/DT, bottle/NN, of/IN, Bordeaux/NNP, white/NNP, wine/NNP, ./.]","(ROOT (S (PP (IN With) (NP (NP (DT the) (CD four)) (VP (VBN completed) (NP (NNS pages))))) (NP (PRP you)) (VP (VBP get) (NP (NP (NP (NP (DT a) (JJ large) (JJ frozen) (NN chicken) (NN er)) (NP (CD six) (NNS pounds))) (NP (NP (CD six) (NNS pounds)) (NP (CD four) (NNS ounces)))) (CC plus) (NP (NP (NN erm) (NN party) (NN size)) (, ,) (NP (NP (NP (CD fourteen) (NNS portions)) (NP (JJ black) (NN forest) (NN gateau))) (CC plus) (NP (NP (DT a) (NN bottle)) (PP (IN of) (NP (NNP Bordeaux) (NNP white) (NNP wine)))))))) (. .)))"
K/KE/KE2.xml,KE2RE02R,39207,51,,A,29,13,--plus  --,"[With/IN, the/DT, four/CD, completed/VBN, pages/NNS, you/PRP, get/VBP, a/DT, large/JJ, frozen/JJ, chicken/NN, er/NN, six/CD, pounds/NNS, six/CD, pounds/NNS, four/CD, ounces/NNS, plus/CC, erm/NN, party/NN, size/NN, ,/,, fourteen/CD, portions/NNS, black/JJ, forest/NN, gateau/NN, plus/CC, a/DT, bottle/NN, of/IN, Bordeaux/NNP, white/NNP, wine/NNP, ./.]","(ROOT (S (PP (IN With) (NP (NP (DT the) (CD four)) (VP (VBN completed) (NP (NNS pages))))) (NP (PRP you)) (VP (VBP get) (NP (NP (NP (NP (DT a) (JJ large) (JJ frozen) (NN chicken) (NN er)) (NP (CD six) (NNS pounds))) (NP (NP (CD six) (NNS pounds)) (NP (CD four) (NNS ounces)))) (CC plus) (NP (NP (NN erm) (NN party) (NN size)) (, ,) (NP (NP (NP (CD fourteen) (NNS portions)) (NP (JJ black) (NN forest) (NN gateau))) (CC plus) (NP (NP (DT a) (NN bottle)) (PP (IN of) (NP (NNP Bordeaux) (NNP white) (NNP wine)))))))) (. .)))"
K/KE/KE2.xml,KE2RE02R,39207,52,,A,29,14,--a bottle of Bordeaux white wine.,"[With/IN, the/DT, four/CD, completed/VBN, pages/NNS, you/PRP, get/VBP, a/DT, large/JJ, frozen/JJ, chicken/NN, er/NN, six/CD, pounds/NNS, six/CD, pounds/NNS, four/CD, ounces/NNS, plus/CC, erm/NN, party/NN, size/NN, ,/,, fourteen/CD, portions/NNS, black/JJ, forest/NN, gateau/NN, plus/CC, a/DT, bottle/NN, of/IN, Bordeaux/NNP, white/NNP, wine/NNP, ./.]","(ROOT (S (PP (IN With) (NP (NP (DT the) (CD four)) (VP (VBN completed) (NP (NNS pages))))) (NP (PRP you)) (VP (VBP get) (NP (NP (NP (NP (DT a) (JJ large) (JJ frozen) (NN chicken) (NN er)) (NP (CD six) (NNS pounds))) (NP (NP (CD six) (NNS pounds)) (NP (CD four) (NNS ounces)))) (CC plus) (NP (NP (NN erm) (NN party) (NN size)) (, ,) (NP (NP (NP (CD fourteen) (NNS portions)) (NP (JJ black) (NN forest) (NN gateau))) (CC plus) (NP (NP (DT a) (NN bottle)) (PP (IN of) (NP (NNP Bordeaux) (NNP white) (NNP wine)))))))) (. .)))"
K/KE/KE2.xml,KE2RE02R,39207,53,,B,30,1,"Yes but you're never gonna get that, I mean that's ","[Yes/UH, but/CC, you/PRP, 're/VBP, never/RB, gonna/NNP, get/VB, that/IN, ,/,, I/PRP, mean/VBP, that/DT, 's/VBZ]","(ROOT (NP (S (S (INTJ (UH Yes)) (NP (CC but)) (VP (ADVP (PRP you)) (VP (VBP 're) (ADVP (ADVP (RB never)) (SBAR (S (NP (NNP gonna)) (VP (VB get) (ADVP (IN that))))))))) (, ,) (NP (PRP I)) (VP (VBP mean) (SBAR (S (NP (DT that)) (VP (VBZ 's))))))))"
K/KE/KE2.xml,KE2RE02R,39207,54,,A,31,1,"Yes that, that would be ridiculous wouldn't it?","[Yes/UH, that/IN, ,/,, that/WDT, would/MD, be/VB, ridiculous/JJ, wouldn/NN, 't/PRP, it/PRP, ?/.]","(ROOT (S (PP (NP (UH Yes)) (IN that)) (, ,) (NP (WDT that)) (VP (MD would) (VP (VB be) (NP (NP (JJ ridiculous) (NN wouldn)) (NP (NP (PRP 't)) (NP (PRP it)))))) (. ?)))"
K/KE/KE2.xml,KE2RE02R,39207,55,,B,32,1,"Well that would be what,f- ","[Well/RB, that/DT, would/MD, be/VB, what/WP, ,f-/NN]","(ROOT (FRAG (ADVP (RB Well)) (SBAR (WHNP (DT that)) (S (VP (MD would) (VP (VB be) (NP (NP (WP what)) (NP (NN ,f-)))))))))"
