swda_filename,ptb_basename,conversation_no,transcript_index,act_tag,caller,turn_index,subutterance_index,text,pos,trees
K/KE/KE2.xml,KE2RE04K,39804,86,,A,55,3,--cos I reckon it's very low,"[Cos/NNP, the/DT, other/JJ, thing/NN, I/PRP, was/VBD, gonna/NNP, do/VB, was/VBD, to/TO, go/VB, into/IN, Lloyds/NNP, ,/,, I/PRP, must/MD, do/VB, that/DT, some/DT, time/NN, about/IN, this/DT, interest/NN, on/IN, that/DT, account/NN, cos/NN, I/PRP, reckon/VBP, it/PRP, 's/VBZ, very/RB, low/JJ]","(ROOT (NP (NP (NP (NNP Cos)) (SBAR (S (S (NP (NP (DT the) (JJ other) (NN thing)) (SBAR (S (NP (PRP I)) (VP (VBD was) (S (NP (NNP gonna)) (VP (VB do))))))) (VP (VBD was) (S (VP (TO to) (VP (VB go) (PP (IN into) (NP (NNP Lloyds)))))))) (, ,) (S (NP (PRP I)) (VP (MD must) (VP (VB do) (NP (DT that)) (NP (DT some) (NN time)) (PP (IN about) (NP (DT this) (NN interest))))))))) (PP (IN on) (NP (NP (DT that) (NN account) (NN cos)) (SBAR (S (NP (PRP I)) (VP (VBP reckon) (SBAR (S (NP (PRP it)) (VP (VBZ 's) (ADJP (RB very) (JJ low))))))))))))"
K/KE/KE2.xml,KE2RE04K,39804,87,,B,56,1,Oh yes.,"[Oh/UH, yes/UH, ./.]",(ROOT (FRAG (UH Oh) (INTJ (UH yes)) (. .)))
K/KE/KE2.xml,KE2RE04K,39804,88,,A,57,1,"and I still haven't, I keep on forgetting that.","[and/CC, I/PRP, still/RB, haven/NN, 't/PRP, ,/,, I/PRP, keep/VBP, on/IN, forgetting/VBG, that/DT, ./.]","(ROOT (S (CC and) (NP (PRP I)) (ADVP (RB still)) (NP (NP (NP (NN haven)) (NP (PRP 't))) (, ,) (NP (PRP I))) (VP (VBP keep) (PP (IN on) (S (VP (VBG forgetting) (NP (DT that)))))) (. .)))"
K/KE/KE2.xml,KE2RE04K,39804,89,,B,58,1,You keep on forgetting to bring out the book.,"[You/PRP, keep/VBP, on/IN, forgetting/VBG, to/TO, bring/VB, out/RP, the/DT, book/NN, ./.]",(ROOT (S (NP (PRP You)) (VP (VBP keep) (PP (IN on) (S (VP (VBG forgetting) (S (VP (TO to) (VP (VB bring) (PRT (RP out)) (NP (DT the) (NN book))))))))) (. .)))
K/KE/KE2.xml,KE2RE04K,39804,90,,A,59,1,<cough> Yeah.,"[Yeah/UH, ./.]",(ROOT (INTJ (UH Yeah) (. .)))
K/KE/KE2.xml,KE2RE04K,39804,91,,B,60,1,(()) ,[],X
K/KE/KE2.xml,KE2RE04K,39804,92,,B,60,2,(()) ,[],X
K/KE/KE2.xml,KE2RE04K,39804,93,,A,61,1,Yes.,"[Yes/UH, ./.]",(ROOT (INTJ (UH Yes) (. .)))
K/KE/KE2.xml,KE2RE04K,39804,94,,B,62,1,Oh well that was lucky cos there haven't been any more ,"[Oh/UH, well/RB, that/DT, was/VBD, lucky/JJ, cos/NN, there/RB, haven/NN, 't/PRP, been/VBN, any/DT, more/JJR]",(ROOT (SINV (PP (NP (UH Oh)) (PP (RB well) (ADVP (DT that)))) (VP (VBD was) (NP (ADJP (JJ lucky)) (NN cos)) (NP (RB there))) (NP (NP (NN haven)) (NP (NP (PRP 't)) (VP (VBN been) (ADVP (DT any) (JJR more)))))))
K/KE/KE2.xml,KE2RE04K,39804,95,,A,63,1,"Another space, no, that's right.","[Another/DT, space/NN, ,/,, no/DT, ,/,, that/DT, 's/VBZ, right/NN, ./.]","(ROOT (S (NP (DT Another) (NN space)) (, ,) (ADVP (DT no)) (, ,) (NP (DT that)) (VP (VBZ 's) (NP (NN right))) (. .)))"
K/KE/KE2.xml,KE2RE04K,39804,96,,B,64,1,Anyway  --,"[Anyway/RB, you/PRP, just/RB, go/VBP, where/WRB, you/PRP, 've/VBP, got/VBN, to/TO, go/VB]",(ROOT (FRAG (ADVP (RB Anyway)) (NP (NP (PRP you)) (SBAR (S (VP (ADVP (RB just)) (VBP go) (SBAR (WHADVP (WRB where)) (S (NP (PRP you)) (VP (VBP 've) (VP (VBN got) (S (VP (TO to) (VP (VB go))))))))))))))
K/KE/KE2.xml,KE2RE04K,39804,97,,B,64,2,--you  --,"[Anyway/RB, you/PRP, just/RB, go/VBP, where/WRB, you/PRP, 've/VBP, got/VBN, to/TO, go/VB]",(ROOT (FRAG (ADVP (RB Anyway)) (NP (NP (PRP you)) (SBAR (S (VP (ADVP (RB just)) (VBP go) (SBAR (WHADVP (WRB where)) (S (NP (PRP you)) (VP (VBP 've) (VP (VBN got) (S (VP (TO to) (VP (VB go))))))))))))))
K/KE/KE2.xml,KE2RE04K,39804,98,,B,64,3,--just go where you've got to go,"[Anyway/RB, you/PRP, just/RB, go/VBP, where/WRB, you/PRP, 've/VBP, got/VBN, to/TO, go/VB]",(ROOT (FRAG (ADVP (RB Anyway)) (NP (NP (PRP you)) (SBAR (S (VP (ADVP (RB just)) (VBP go) (SBAR (WHADVP (WRB where)) (S (NP (PRP you)) (VP (VBP 've) (VP (VBN got) (S (VP (TO to) (VP (VB go))))))))))))))
K/KE/KE2.xml,KE2RE04K,39804,99,,A,65,1,Yes.,"[Yes/UH, ./.]",(ROOT (INTJ (UH Yes) (. .)))
K/KE/KE2.xml,KE2RE04K,39804,100,,B,66,1,the bank and the building society,"[the/DT, bank/NN, and/CC, the/DT, building/NN, society/NN]",(ROOT (NP (NP (DT the) (NN bank)) (CC and) (NP (DT the) (NN building) (NN society))))
K/KE/KE2.xml,KE2RE04K,39804,101,,A,67,1,and then I'll go down to Devon Travel  --,"[and/CC, then/RB, I/PRP, 'll/MD, go/VB, down/RB, to/TO, Devon/NNP, Travel/NNP, to/TO, pick/VB, up/RP, that/DT, er/NN]",(ROOT (FRAG (CC and) (NP (NP (RB then)) (SBAR (S (NP (PRP I)) (VP (MD 'll) (VP (VB go) (ADVP (RB down) (PP (TO to) (NP (NNP Devon) (NNP Travel)))) (S (VP (TO to) (VP (VB pick) (PRT (RP up)) (NP (DT that) (NN er))))))))))))
K/KE/KE2.xml,KE2RE04K,39804,102,,A,67,2,--to pick up that er,"[and/CC, then/RB, I/PRP, 'll/MD, go/VB, down/RB, to/TO, Devon/NNP, Travel/NNP, to/TO, pick/VB, up/RP, that/DT, er/NN]",(ROOT (FRAG (CC and) (NP (NP (RB then)) (SBAR (S (NP (PRP I)) (VP (MD 'll) (VP (VB go) (ADVP (RB down) (PP (TO to) (NP (NNP Devon) (NNP Travel)))) (S (VP (TO to) (VP (VB pick) (PRT (RP up)) (NP (DT that) (NN er))))))))))))
K/KE/KE2.xml,KE2RE04K,39804,103,,B,68,1,Right.,"[Right/NN, ./.]",(ROOT (INTJ (NN Right) (. .)))
K/KE/KE2.xml,KE2RE04K,39804,104,,A,69,1,so I'll see you back at the car.,"[so/IN, I/PRP, 'll/MD, see/VB, you/PRP, back/RB, at/IN, the/DT, car/NN, ./.]",(ROOT (S (IN so) (NP (PRP I)) (VP (MD 'll) (VP (VB see) (NP (PRP you)) (ADVP (RB back)) (PP (IN at) (NP (DT the) (NN car))))) (. .)))
K/KE/KE2.xml,KE2RE04K,39804,105,,B,70,1,Right.,"[Right/NN, ./.]",(ROOT (INTJ (NN Right) (. .)))
