swda_filename,ptb_basename,conversation_no,transcript_index,act_tag,caller,turn_index,subutterance_index,text,pos,trees
K/KE/KE2.xml,KE2RE02R,39207,56,,A,33,1,Cos I'd need to spend,"[Cos/NNP, I/PRP, 'd/MD, need/VB, to/TO, spend/VB]",(ROOT (FRAG (NP (NP (NNP Cos)) (SBAR (S (NP (PRP I)) (VP (MD 'd) (VP (VB need) (S (VP (TO to) (VP (VB spend)))))))))))
K/KE/KE2.xml,KE2RE02R,39207,57,,B,34,1,"hundred fifty pound, hundred and forty pound something.","[hundred/CD, fifty/CD, pound/NN, ,/,, hundred/CD, and/CC, forty/CD, pound/NN, something/NN, ./.]","(ROOT (NP (NP (CD hundred) (CD fifty) (NN pound)) (, ,) (NP (NP (CD hundred)) (CC and) (NP (CD forty) (NN pound) (NN something))) (. .)))"
K/KE/KE2.xml,KE2RE02R,39207,58,,A,35,1,Well erm  --,"[Well/RB, erm/IN, four/CD, completed/VBN, pages/NNS, ,/,, twenty/CD, stamps/NNS, you/PRP, need/VBP, to/TO, have/VB, two/CD, hundred/CD, pounds/NNS, in/IN, all/DT, ./.]","(ROOT (S (PP (ADVP (RB Well)) (IN erm) (NP (NP (CD four) (VBN completed) (NNS pages)) (, ,) (NP (CD twenty) (NNS stamps)))) (NP (PRP you)) (VP (VBP need) (S (VP (TO to) (VP (VB have) (NP (NP (QP (CD two) (CD hundred)) (NNS pounds)) (PP (IN in) (NP (DT all)))))))) (. .)))"
K/KE/KE2.xml,KE2RE02R,39207,59,,A,35,2,"--four completed pages, twenty stamps you need to have two hundred pounds in all.","[Well/RB, erm/IN, four/CD, completed/VBN, pages/NNS, ,/,, twenty/CD, stamps/NNS, you/PRP, need/VBP, to/TO, have/VB, two/CD, hundred/CD, pounds/NNS, in/IN, all/DT, ./.]","(ROOT (S (PP (ADVP (RB Well)) (IN erm) (NP (NP (CD four) (VBN completed) (NNS pages)) (, ,) (NP (CD twenty) (NNS stamps)))) (NP (PRP you)) (VP (VBP need) (S (VP (TO to) (VP (VB have) (NP (NP (QP (CD two) (CD hundred)) (NNS pounds)) (PP (IN in) (NP (DT all)))))))) (. .)))"
K/KE/KE2.xml,KE2RE02R,39207,60,,B,36,1,"Well that's ridiculous, I mean you won't","[Well/RB, that/DT, 's/VBZ, ridiculous/JJ, ,/,, I/PRP, mean/VBP, you/PRP, won/VBD, 't/PRP]","(ROOT (S (SBAR (ADVP (RB Well)) (S (NP (DT that)) (VP (VBZ 's) (ADJP (JJ ridiculous))))) (, ,) (NP (PRP I)) (VP (VBP mean) (SBAR (S (NP (PRP you)) (VP (VBD won) (NP (PRP 't))))))))"
K/KE/KE2.xml,KE2RE02R,39207,61,,A,37,1,And you see I've got ,"[And/CC, you/PRP, see/VBP, I/PRP, 've/VBP, got/VBN]",(ROOT (S (CC And) (NP (PRP you)) (VP (VBP see) (SBAR (S (NP (PRP I)) (VP (VBP 've) (VP (VBN got))))))))
K/KE/KE2.xml,KE2RE02R,39207,62,,B,38,1,"Fifty, sixty","[Fifty/CD, ,/,, sixty/CD]","(ROOT (NP (NP (CD Fifty)) (, ,) (NP (CD sixty))))"
K/KE/KE2.xml,KE2RE02R,39207,63,,A,39,1,I've got sixty.,"[I/PRP, 've/VBP, got/VBN, sixty/CD, ./.]",(ROOT (S (NP (PRP I)) (VP (VBP 've) (VP (VBN got) (NP (CD sixty)))) (. .)))
K/KE/KE2.xml,KE2RE02R,39207,64,,B,40,1,"So there's no, that's no point.","[So/RB, there/EX, 's/VBZ, no/DT, ,/,, that/DT, 's/VBZ, no/DT, point/NN, ./.]","(ROOT (S (RB So) (NP (EX there)) (VP (VBZ 's) (NP (NP (DT no)) (, ,) (SBAR (WHNP (DT that)) (S (VP (VBZ 's) (NP (DT no) (NN point))))))) (. .)))"
K/KE/KE2.xml,KE2RE02R,39207,65,,A,41,1,No point.,"[No/DT, point/NN, ./.]",(ROOT (NP (DT No) (NN point) (. .)))
K/KE/KE2.xml,KE2RE02R,39207,66,,B,42,1,"It's really only a question of whether you get the extra one page or, or leave it as it is.","[It/PRP, 's/VBZ, really/RB, only/RB, a/DT, question/NN, of/IN, whether/IN, you/PRP, get/VBP, the/DT, extra/JJ, one/CD, page/NN, or/CC, ,/,, or/CC, leave/VB, it/PRP, as/IN, it/PRP, is/VBZ, ./.]","(ROOT (S (S (NP (PRP It)) (VP (VBZ 's) (ADVP (RB really)) (NP (NP (RB only) (DT a) (NN question)) (PP (IN of) (SBAR (IN whether) (S (NP (PRP you)) (VP (VBP get) (NP (DT the) (JJ extra) (CD one) (NN page))))))))) (CC or) (, ,) (S (CC or) (VP (VB leave) (NP (PRP it)) (SBAR (IN as) (S (NP (PRP it)) (VP (VBZ is)))))) (. .)))"
K/KE/KE2.xml,KE2RE02R,39207,67,,A,43,1,I'll leave it as it is I think because,"[I/PRP, 'll/MD, leave/VB, it/PRP, as/IN, it/PRP, is/VBZ, I/PRP, think/VBP, because/IN]",(ROOT (S (NP (PRP I)) (VP (MD 'll) (VP (VB leave) (NP (PRP it)) (SBAR (IN as) (S (NP (PRP it)) (VP (VBZ is) (SBAR (S (NP (PRP I)) (VP (VBP think) (PP (IN because))))))))))))
K/KE/KE2.xml,KE2RE02R,39207,68,,B,44,1,Yeah.,"[Yeah/UH, ./.]",(ROOT (INTJ (UH Yeah) (. .)))
K/KE/KE2.xml,KE2RE02R,39207,69,,A,45,1,the teabags don't mean anything to us,"[the/DT, teabags/NNS, don/VBP, 't/PRP, mean/VB, anything/NN, to/TO, us/PRP]",(ROOT (S (NP (DT the) (NNS teabags)) (VP (VBP don) (S (NP (PRP 't)) (VP (VB mean) (NP (NN anything)) (PP (TO to) (NP (PRP us))))))))
K/KE/KE2.xml,KE2RE02R,39207,70,,B,46,1,No.,"[No/DT, ./.]",(ROOT (FRAG (NP (DT No)) (. .)))
K/KE/KE2.xml,KE2RE02R,39207,71,,A,47,1,and  --,"[and/CC, and/CC, I/PRP, have/VBP, got/VBN]",(ROOT (PRN (CC and) (S (CC and) (NP (PRP I)) (VP (VBP have) (VP (VBN got))))))
K/KE/KE2.xml,KE2RE02R,39207,72,,A,47,2,--and I have got,"[and/CC, and/CC, I/PRP, have/VBP, got/VBN]",(ROOT (PRN (CC and) (S (CC and) (NP (PRP I)) (VP (VBP have) (VP (VBN got))))))
K/KE/KE2.xml,KE2RE02R,39207,73,,B,48,1,Mm.,"[Mm/NN, ./.]",(ROOT (NP (NN Mm) (. .)))
K/KE/KE2.xml,KE2RE02R,39207,74,,A,49,1,I mean it would be just as well to buy another  --,"[I/PRP, mean/VBP, it/PRP, would/MD, be/VB, just/RB, as/RB, well/RB, to/TO, buy/VB, another/DT, thing/NN, of/IN, coffee/NN, because/IN, at/IN, the/DT, moment/NN, you/PRP, get/VBP, that/IN, extra/JJ, little/JJ, erm/NN]",(ROOT (S (NP (PRP I)) (VP (VBP mean) (SBAR (S (NP (PRP it)) (VP (MD would) (VP (VB be) (ADVP (RB just) (RB as) (RB well)) (S (VP (TO to) (VP (VB buy) (NP (NP (DT another) (NN thing)) (PP (IN of) (NP (NN coffee))))))) (SBAR (IN because) (S (PP (IN at) (NP (DT the) (NN moment))) (NP (PRP you)) (VP (VBP get) (PP (IN that) (NP (JJ extra) (JJ little) (NN erm)))))))))))))
K/KE/KE2.xml,KE2RE02R,39207,75,,A,49,2,--thing of coffee because at the moment you get that extra little erm,"[I/PRP, mean/VBP, it/PRP, would/MD, be/VB, just/RB, as/RB, well/RB, to/TO, buy/VB, another/DT, thing/NN, of/IN, coffee/NN, because/IN, at/IN, the/DT, moment/NN, you/PRP, get/VBP, that/IN, extra/JJ, little/JJ, erm/NN]",(ROOT (S (NP (PRP I)) (VP (VBP mean) (SBAR (S (NP (PRP it)) (VP (MD would) (VP (VB be) (ADVP (RB just) (RB as) (RB well)) (S (VP (TO to) (VP (VB buy) (NP (NP (DT another) (NN thing)) (PP (IN of) (NP (NN coffee))))))) (SBAR (IN because) (S (PP (IN at) (NP (DT the) (NN moment))) (NP (PRP you)) (VP (VBP get) (PP (IN that) (NP (JJ extra) (JJ little) (NN erm)))))))))))))
K/KE/KE2.xml,KE2RE02R,39207,76,,B,50,1,One anyway.,"[One/CD, anyway/RB, ./.]",(ROOT (FRAG (NP (CD One)) (ADVP (RB anyway)) (. .)))
K/KE/KE2.xml,KE2RE02R,39207,77,,A,51,1,"jar for any, any, free anyway.","[jar/NN, for/IN, any/DT, ,/,, any/DT, ,/,, free/JJ, anyway/RB, ./.]","(ROOT (NP (NP (NN jar)) (PP (IN for) (NP (NP (DT any)) (, ,) (NP (DT any)) (, ,) (ADVP (JJ free)))) (ADVP (RB anyway)) (. .)))"
K/KE/KE2.xml,KE2RE02R,39207,78,,B,52,1,Yeah.,"[Yeah/UH, ./.]",(ROOT (INTJ (UH Yeah) (. .)))
K/KE/KE2.xml,KE2RE02R,39207,79,,B,52,2,Mm.,"[Mm/NN, ./.]",(ROOT (NP (NN Mm) (. .)))
K/KE/KE2.xml,KE2RE02R,39207,80,,A,53,1,So  --,"[So/RB, well/RB, we/PRP, could/MD, go/VB, out/IN, there/RB, anyway/RB, to/TO, see/VB, whether/IN, they/PRP, 've/VBP, got/VBN, any/DT, er/NN, you/PRP, see/VBP, if/IN, they/PRP, carried/VBD, it/PRP, on/IN, for/IN, another/DT, month/NN]",(ROOT (FRAG (ADVP (RB So) (RB well)) (NP (NP (PRP we)) (SBAR (S (VP (MD could) (VP (VB go) (ADVP (IN out) (RB there)) (ADVP (RB anyway)) (S (VP (TO to) (VP (VB see) (SBAR (IN whether) (S (NP (PRP they)) (VP (VBP 've) (VP (VBN got) (NP (NP (DT any) (NN er)) (SBAR (S (NP (PRP you)) (VP (VBP see) (SBAR (IN if) (S (NP (PRP they)) (VP (VBD carried) (NP (PRP it)) (PP (IN on) (PP (IN for) (NP (DT another) (NN month)))))))))))))))))))))))))
K/KE/KE2.xml,KE2RE02R,39207,81,,A,53,2,--well we could go out there anyway   --,"[So/RB, well/RB, we/PRP, could/MD, go/VB, out/IN, there/RB, anyway/RB, to/TO, see/VB, whether/IN, they/PRP, 've/VBP, got/VBN, any/DT, er/NN, you/PRP, see/VBP, if/IN, they/PRP, carried/VBD, it/PRP, on/IN, for/IN, another/DT, month/NN]",(ROOT (FRAG (ADVP (RB So) (RB well)) (NP (NP (PRP we)) (SBAR (S (VP (MD could) (VP (VB go) (ADVP (IN out) (RB there)) (ADVP (RB anyway)) (S (VP (TO to) (VP (VB see) (SBAR (IN whether) (S (NP (PRP they)) (VP (VBP 've) (VP (VBN got) (NP (NP (DT any) (NN er)) (SBAR (S (NP (PRP you)) (VP (VBP see) (SBAR (IN if) (S (NP (PRP they)) (VP (VBD carried) (NP (PRP it)) (PP (IN on) (PP (IN for) (NP (DT another) (NN month)))))))))))))))))))))))))
K/KE/KE2.xml,KE2RE02R,39207,82,,A,53,3,--(()) to see whether they've got any er  --,"[So/RB, well/RB, we/PRP, could/MD, go/VB, out/IN, there/RB, anyway/RB, to/TO, see/VB, whether/IN, they/PRP, 've/VBP, got/VBN, any/DT, er/NN, you/PRP, see/VBP, if/IN, they/PRP, carried/VBD, it/PRP, on/IN, for/IN, another/DT, month/NN]",(ROOT (FRAG (ADVP (RB So) (RB well)) (NP (NP (PRP we)) (SBAR (S (VP (MD could) (VP (VB go) (ADVP (IN out) (RB there)) (ADVP (RB anyway)) (S (VP (TO to) (VP (VB see) (SBAR (IN whether) (S (NP (PRP they)) (VP (VBP 've) (VP (VBN got) (NP (NP (DT any) (NN er)) (SBAR (S (NP (PRP you)) (VP (VBP see) (SBAR (IN if) (S (NP (PRP they)) (VP (VBD carried) (NP (PRP it)) (PP (IN on) (PP (IN for) (NP (DT another) (NN month)))))))))))))))))))))))))
K/KE/KE2.xml,KE2RE02R,39207,83,,A,53,4,--you see if they carried it on for another month,"[So/RB, well/RB, we/PRP, could/MD, go/VB, out/IN, there/RB, anyway/RB, to/TO, see/VB, whether/IN, they/PRP, 've/VBP, got/VBN, any/DT, er/NN, you/PRP, see/VBP, if/IN, they/PRP, carried/VBD, it/PRP, on/IN, for/IN, another/DT, month/NN]",(ROOT (FRAG (ADVP (RB So) (RB well)) (NP (NP (PRP we)) (SBAR (S (VP (MD could) (VP (VB go) (ADVP (IN out) (RB there)) (ADVP (RB anyway)) (S (VP (TO to) (VP (VB see) (SBAR (IN whether) (S (NP (PRP they)) (VP (VBP 've) (VP (VBN got) (NP (NP (DT any) (NN er)) (SBAR (S (NP (PRP you)) (VP (VBP see) (SBAR (IN if) (S (NP (PRP they)) (VP (VBD carried) (NP (PRP it)) (PP (IN on) (PP (IN for) (NP (DT another) (NN month)))))))))))))))))))))))))
K/KE/KE2.xml,KE2RE02R,39207,84,,B,54,1,That would be different.,"[That/DT, would/MD, be/VB, different/JJ, ./.]",(ROOT (S (NP (DT That)) (VP (MD would) (VP (VB be) (ADJP (JJ different)))) (. .)))
K/KE/KE2.xml,KE2RE02R,39207,85,,A,55,1,but it was only for February.,"[but/CC, it/PRP, was/VBD, only/RB, for/IN, February/NNP, ./.]",(ROOT (S (CC but) (NP (PRP it)) (VP (VBD was) (ADVP (RB only)) (PP (IN for) (NP (NNP February)))) (. .)))
K/KE/KE2.xml,KE2RE02R,39207,86,,B,56,1,Yeah.,"[Yeah/UH, ./.]",(ROOT (INTJ (UH Yeah) (. .)))
K/KE/KE2.xml,KE2RE02R,39207,87,,B,56,2,"Right, so anyway you want bread and you want, we want milk powder don't we?","[Right/NN, ,/,, so/RB, anyway/RB, you/PRP, want/VBP, bread/NN, and/CC, you/PRP, want/VBP, ,/,, we/PRP, want/VBP, milk/NN, powder/NN, don/NNP, 't/PRP, we/PRP, ?/.]","(ROOT (S (NP (NN Right)) (, ,) (SBAR (RB so) (S (S (ADVP (RB anyway)) (NP (PRP you)) (VP (VBP want) (NP (NN bread)))) (CC and) (S (NP (PRP you)) (VP (VBP want))))) (, ,) (NP (PRP we)) (VP (VBP want) (S (NP (NN milk) (NN powder)) (VP (NNP don) (S (NP (PRP 't)) (NP (PRP we)))))) (. ?)))"
K/KE/KE2.xml,KE2RE02R,39207,88,,A,57,1,"Oh yes we could get that, yes.","[Oh/UH, yes/UH, we/PRP, could/MD, get/VB, that/IN, ,/,, yes/UH, ./.]","(ROOT (S (S (INTJ (UH Oh) (UH yes)) (NP (PRP we)) (VP (MD could) (VP (VB get) (ADVP (IN that))))) (, ,) (FRAG (INTJ (UH yes))) (. .)))"
K/KE/KE2.xml,KE2RE02R,39207,89,,A,57,2,<laughing> You crafty devil you </laughing> .,"[You/PRP, crafty/JJ, devil/NNP, you/PRP, ./.]",(ROOT (S (NP (PRP You)) (VP (JJ crafty) (NP (NNP devil)) (NP (PRP you))) (. .)))
K/KE/KE2.xml,KE2RE02R,39207,90,,A,57,3,"Erm what I do need, but I'll see how expensive they are,(()) a lettuce but I can go out and buy a lettuce anyway  --","[Erm/NN, what/WDT, I/PRP, do/VBP, need/VB, ,/,, but/CC, I/PRP, 'll/MD, see/VB, how/WRB, expensive/JJ, they/PRP, are/VBP, ,/,, a/DT, lettuce/NN, but/CC, I/PRP, can/MD, go/VB, out/RP, and/CC, buy/VB, a/DT, lettuce/NN, anyway/RB, erm/RB]","(ROOT (FRAG (NP (NN Erm)) (SBAR (WHNP (WDT what)) (S (S (S (NP (PRP I)) (VP (VBP do) (VP (VB need)))) (, ,) (CC but) (S (NP (PRP I)) (VP (MD 'll) (VP (VB see) (NP (SBAR (WHADVP (WRB how) (ADJP (JJ expensive))) (S (NP (PRP they)) (VP (VBP are)))) (, ,) (NP (DT a) (NN lettuce))))))) (CC but) (S (NP (PRP I)) (VP (MD can) (VP (VP (VB go) (PRT (RP out))) (CC and) (VP (VB buy) (NP (DT a) (NN lettuce)) (ADVP (RB anyway)) (ADVP (RB erm))))))))))"
K/KE/KE2.xml,KE2RE02R,39207,91,,A,57,4,--erm,"[Erm/NN, what/WDT, I/PRP, do/VBP, need/VB, ,/,, but/CC, I/PRP, 'll/MD, see/VB, how/WRB, expensive/JJ, they/PRP, are/VBP, ,/,, a/DT, lettuce/NN, but/CC, I/PRP, can/MD, go/VB, out/RP, and/CC, buy/VB, a/DT, lettuce/NN, anyway/RB, erm/RB]","(ROOT (FRAG (NP (NN Erm)) (SBAR (WHNP (WDT what)) (S (S (S (NP (PRP I)) (VP (VBP do) (VP (VB need)))) (, ,) (CC but) (S (NP (PRP I)) (VP (MD 'll) (VP (VB see) (NP (SBAR (WHADVP (WRB how) (ADJP (JJ expensive))) (S (NP (PRP they)) (VP (VBP are)))) (, ,) (NP (DT a) (NN lettuce))))))) (CC but) (S (NP (PRP I)) (VP (MD can) (VP (VP (VB go) (PRT (RP out))) (CC and) (VP (VB buy) (NP (DT a) (NN lettuce)) (ADVP (RB anyway)) (ADVP (RB erm))))))))))"
K/KE/KE2.xml,KE2RE02R,39207,92,,B,58,1,(()) thinking about salad stuff for tonight.,"[thinking/VBG, about/IN, salad/NN, stuff/NN, for/IN, tonight/NN, ./.]",(ROOT (S (VP (VBG thinking) (PP (IN about) (NP (NP (NN salad) (NN stuff)) (PP (IN for) (NP (NN tonight)))))) (. .)))
K/KE/KE2.xml,KE2RE02R,39207,93,,A,59,1,(()) salad for tonight.,"[salad/NN, for/IN, tonight/NN, ./.]",(ROOT (NP (NP (NN salad)) (PP (IN for) (NP (NN tonight))) (. .)))
K/KE/KE2.xml,KE2RE02R,39207,94,,A,59,2,Yes.,"[Yes/UH, ./.]",(ROOT (INTJ (UH Yes) (. .)))
K/KE/KE2.xml,KE2RE02R,39207,95,,A,59,3,What were you looking  (()) for?,"[What/WP, were/VBD, you/PRP, looking/VBG, for/IN, ?/.]",(ROOT (SBARQ (WHNP (WP What)) (SQ (VBD were) (NP (PRP you)) (VP (VBG looking) (PP (IN for)))) (. ?)))
K/KE/KE2.xml,KE2RE02R,39207,96,,B,60,1,I'm reading Wednesday.,"[I/PRP, 'm/VBP, reading/VBG, Wednesday/NNP, ./.]",(ROOT (S (NP (PRP I)) (VP (VBP 'm) (VP (VBG reading) (NP (NNP Wednesday)))) (. .)))
K/KE/KE2.xml,KE2RE02R,39207,97,,A,61,1,Oh (()) ,[Oh/UH],(ROOT (INTJ (UH Oh)))
