swda_filename,ptb_basename,conversation_no,transcript_index,act_tag,caller,turn_index,subutterance_index,text,pos,trees
K/KE/KE2.xml,KE2RE02S,39208,80,,A,61,1,they've got this clothing bank.,"[they/PRP, 've/VBP, got/VBN, this/DT, clothing/NN, bank/NN, ./.]",(ROOT (S (NP (PRP they)) (VP (VBP 've) (VP (VBN got) (NP (DT this) (NN clothing) (NN bank)))) (. .)))
K/KE/KE2.xml,KE2RE02S,39208,81,,B,62,1,Oh.,"[Oh/UH, ./.]",(ROOT (INTJ (UH Oh) (. .)))
K/KE/KE2.xml,KE2RE02S,39208,82,,B,62,2,It did say something in that little magazine that came yesterday.,"[It/PRP, did/VBD, say/VB, something/NN, in/IN, that/DT, little/JJ, magazine/NN, that/WDT, came/VBD, yesterday/NN, ./.]",(ROOT (S (NP (PRP It)) (VP (VBD did) (VP (VB say) (NP (NN something)) (PP (IN in) (NP (NP (DT that) (JJ little) (NN magazine)) (SBAR (WHNP (WDT that)) (S (VP (VBD came) (NP (NN yesterday))))))))) (. .)))
K/KE/KE2.xml,KE2RE02S,39208,83,,A,63,1,Did it?,"[Did/VBD, it/PRP, ?/.]",(ROOT (S (VP (VBD Did) (NP (PRP it))) (. ?)))
K/KE/KE2.xml,KE2RE02S,39208,84,,A,63,2,Mm.,"[Mm/NN, ./.]",(ROOT (NP (NN Mm) (. .)))
K/KE/KE2.xml,KE2RE02S,39208,85,,B,64,1,Yes it did come to think of it.,"[Yes/UH, it/PRP, did/VBD, come/VB, to/TO, think/VB, of/IN, it/PRP, ./.]",(ROOT (S (S (INTJ (UH Yes)) (NP (PRP it)) (VP (VBD did) (VP (VB come) (S (VP (TO to) (VP (VB think) (PP (IN of) (NP (PRP it))))))))) (. .)))
K/KE/KE2.xml,KE2RE02S,39208,86,,B,64,2,So they're actually doing something about this   (()) --,"[So/IN, they/PRP, 're/VBP, actually/RB, doing/VBG, something/NN, about/IN, this/DT, looks/VBZ, almost/RB, as/IN, if/IN, they/PRP, 're/VBP, putting/VBG, steps/NNS, in/IN, there/RB, ./.]",(ROOT (S (IN So) (NP (PRP they)) (VP (VBP 're) (ADVP (RB actually)) (VP (VBG doing) (NP (NN something)) (SBAR (IN about) (S (NP (DT this)) (VP (VBZ looks) (ADVP (RB almost)) (SBAR (IN as) (IN if) (S (NP (PRP they)) (VP (VBP 're) (VP (VBG putting) (NP (NP (NNS steps)) (PP (IN in) (NP (RB there))))))))))))) (. .)))
K/KE/KE2.xml,KE2RE02S,39208,87,,B,64,3,--looks almost as if they're putting steps in there.,"[So/IN, they/PRP, 're/VBP, actually/RB, doing/VBG, something/NN, about/IN, this/DT, looks/VBZ, almost/RB, as/IN, if/IN, they/PRP, 're/VBP, putting/VBG, steps/NNS, in/IN, there/RB, ./.]",(ROOT (S (IN So) (NP (PRP they)) (VP (VBP 're) (ADVP (RB actually)) (VP (VBG doing) (NP (NN something)) (SBAR (IN about) (S (NP (DT this)) (VP (VBZ looks) (ADVP (RB almost)) (SBAR (IN as) (IN if) (S (NP (PRP they)) (VP (VBP 're) (VP (VBG putting) (NP (NP (NNS steps)) (PP (IN in) (NP (RB there))))))))))))) (. .)))
K/KE/KE2.xml,KE2RE02S,39208,88,,A,65,1,Did it?,"[Did/VBD, it/PRP, ?/.]",(ROOT (S (VP (VBD Did) (NP (PRP it))) (. ?)))
K/KE/KE2.xml,KE2RE02S,39208,89,,A,65,2,I didn't notice at all.,"[I/PRP, didn/VBP, 't/PRP, notice/VB, at/IN, all/DT, ./.]",(ROOT (S (NP (PRP I)) (VP (VBP didn) (S (NP (PRP 't)) (VP (VB notice) (ADVP (IN at) (DT all))))) (. .)))
K/KE/KE2.xml,KE2RE02S,39208,90,,B,66,1,See where that erm thing is there  --,"[See/VB, where/WRB, that/DT, erm/NN, thing/NN, is/VBZ, there/EX, oh/UH, there/EX, 's/VBZ, a/DT, place/NN, there/RB, by/IN, the/DT]",(ROOT (S (VP (VB See) (SBAR (WHADVP (WRB where)) (S (NP (DT that) (NN erm) (NN thing)) (VP (VBZ is) (NP (NP (EX there)) (SBAR (S (INTJ (UH oh)) (NP (EX there)) (VP (VBZ 's) (ADVP (NP (DT a) (NN place)) (RB there)) (PP (IN by) (NP (DT the)))))))))))))
K/KE/KE2.xml,KE2RE02S,39208,91,,B,66,2,--oh there's a place there by the  (()) ,"[See/VB, where/WRB, that/DT, erm/NN, thing/NN, is/VBZ, there/EX, oh/UH, there/EX, 's/VBZ, a/DT, place/NN, there/RB, by/IN, the/DT]",(ROOT (S (VP (VB See) (SBAR (WHADVP (WRB where)) (S (NP (DT that) (NN erm) (NN thing)) (VP (VBZ is) (NP (NP (EX there)) (SBAR (S (INTJ (UH oh)) (NP (EX there)) (VP (VBZ 's) (ADVP (NP (DT a) (NN place)) (RB there)) (PP (IN by) (NP (DT the)))))))))))))
K/KE/KE2.xml,KE2RE02S,39208,92,,A,67,1,Oh someone's going out here.,"[Oh/UH, someone/NN, 's/POS, going/VBG, out/RB, here/RB, ./.]",(ROOT (S (INTJ (UH Oh)) (VP (NN someone) (S (NP (POS 's)) (VP (VBG going) (ADVP (RB out)) (ADVP (RB here))))) (. .)))
K/KE/KE2.xml,KE2RE02S,39208,93,,B,68,1,Oh someone here look see.,"[Oh/UH, someone/NN, here/RB, look/VBP, see/VB, ./.]",(ROOT (S (S (INTJ (UH Oh)) (NP (NN someone)) (VP (ADVP (RB here)) (VBP look) (S (VP (VB see))))) (. .)))
K/KE/KE2.xml,KE2RE02S,39208,94,,A,69,1,Oh is he going in there?,"[Oh/UH, is/VBZ, he/PRP, going/VBG, in/IN, there/EX, ?/.]",(ROOT (SBARQ (WHNP (UH Oh)) (SQ (VBZ is) (NP (PRP he)) (VP (VBG going) (PP (IN in) (NP (EX there))))) (. ?)))
K/KE/KE2.xml,KE2RE02S,39208,95,,A,69,2,Oh he's going in there.,"[Oh/UH, he/PRP, 's/VBZ, going/VBG, in/IN, there/RB, ./.]",(ROOT (S (S (INTJ (UH Oh)) (NP (PRP he)) (VP (VBZ 's) (VP (VBG going) (PP (IN in) (NP (RB there)))))) (. .)))
K/KE/KE2.xml,KE2RE02S,39208,96,,B,70,1,It wasn't a big enough room there.,"[It/PRP, wasn/VBD, 't/PRP, a/DT, big/JJ, enough/JJ, room/NN, there/RB, ./.]",(ROOT (S (NP (PRP It)) (VP (VBD wasn) (S (NP (PRP 't)) (NP (NP (DT a) (JJ big) (JJ enough) (NN room)) (ADVP (RB there))))) (. .)))
K/KE/KE2.xml,KE2RE02S,39208,97,,B,70,2,Oh I see they're painting up there.,"[Oh/UH, I/PRP, see/VBP, they/PRP, 're/VBP, painting/VBG, up/IN, there/RB, ./.]",(ROOT (S (S (INTJ (UH Oh)) (NP (PRP I)) (VP (VBP see))) (NP (PRP they)) (VP (VBP 're) (VP (VBG painting) (ADVP (IN up) (RB there)))) (. .)))
K/KE/KE2.xml,KE2RE02S,39208,98,,A,71,1,"You get out, I'll straighten up and come in.","[You/PRP, get/VBP, out/RP, ,/,, I/PRP, 'll/MD, straighten/VB, up/RB, and/CC, come/VB, in/IN, ./.]","(ROOT (S (S (NP (PRP You)) (VP (VBP get) (PRT (RP out)))) (, ,) (NP (PRP I)) (VP (MD 'll) (VP (VP (VB straighten) (ADVP (RB up))) (CC and) (VP (VB come) (PP (IN in))))) (. .)))"
