swda_filename,ptb_basename,conversation_no,transcript_index,act_tag,caller,turn_index,subutterance_index,text,pos,trees
K/KE/KE2.xml,KE2RE01K,38705,0,,A,1,1,Is that the news coming on now?,"[Is/VBZ, that/IN, the/DT, news/NN, coming/VBG, on/IN, now/RB, ?/.]",(ROOT (S (VP (VBZ Is) (ADVP (IN that) (NP (DT the) (NN news))) (VP (VBG coming) (PP (IN on) (NP (RB now))))) (. ?)))
K/KE/KE2.xml,KE2RE01K,38705,1,,A,1,2,Well  --,"[Well/RB, Woh/IN]",(ROOT (FRAG (ADVP (RB Well)) (PP (IN Woh))))
K/KE/KE2.xml,KE2RE01K,38705,2,,A,1,3,--Woh ,"[Well/RB, Woh/IN]",(ROOT (FRAG (ADVP (RB Well)) (PP (IN Woh))))
K/KE/KE2.xml,KE2RE01K,38705,3,,B,2,1,What?,"[What/WDT, ?/.]",(ROOT (FRAG (WHNP (WDT What)) (. ?)))
K/KE/KE2.xml,KE2RE01K,38705,4,,A,3,1,That's right.,"[That/DT, 's/VBZ, right/NN, ./.]",(ROOT (S (NP (DT That)) (VP (VBZ 's) (NP (NN right))) (. .)))
K/KE/KE2.xml,KE2RE01K,38705,5,,A,3,2,Is the news coming on now?,"[Is/VBZ, the/DT, news/NN, coming/VBG, on/IN, now/RB, ?/.]",(ROOT (SQ (VBZ Is) (NP (DT the) (NN news)) (VP (VBG coming) (PP (IN on) (NP (RB now)))) (. ?)))
K/KE/KE2.xml,KE2RE01K,38705,6,,B,4,1,"No,tha- , yeah it will be.","[No/DT, ,tha-/NN, ,/,, yeah/UH, it/PRP, will/MD, be/VB, ./.]","(ROOT (S (S (NP (DT No) (NN ,tha-))) (, ,) (S (INTJ (UH yeah)) (NP (PRP it)) (VP (MD will) (VP (VB be)))) (. .)))"
K/KE/KE2.xml,KE2RE01K,38705,7,,B,4,2,(()) cos it grows like that.,"[cos/NN, it/PRP, grows/VBZ, like/IN, that/DT, ./.]",(ROOT (S (NP (NN cos)) (NP (PRP it)) (VP (VBZ grows) (PP (IN like) (NP (DT that)))) (. .)))
K/KE/KE2.xml,KE2RE01K,38705,8,,A,5,1,Yeah.,"[Yeah/UH, ./.]",(ROOT (INTJ (UH Yeah) (. .)))
K/KE/KE2.xml,KE2RE01K,38705,9,,B,6,1,What's she been putting them in for (()) ?,"[What/WP, 's/VBZ, she/PRP, been/VBN, putting/VBG, them/PRP, in/IN, for/IN, ?/.]",(ROOT (SBARQ (WHNP (WP What)) (SQ (VBZ 's) (NP (PRP she)) (VP (VBN been) (VP (VBG putting) (NP (PRP them)) (PP (IN in) (PP (IN for)))))) (. ?)))
K/KE/KE2.xml,KE2RE01K,38705,10,,A,7,1,Well I think they're trying to pin the murder on him.,"[Well/RB, I/PRP, think/VBP, they/PRP, 're/VBP, trying/VBG, to/TO, pin/VB, the/DT, murder/NN, on/IN, him/PRP, ./.]",(ROOT (S (ADVP (RB Well)) (NP (PRP I)) (VP (VBP think) (SBAR (S (NP (PRP they)) (VP (VBP 're) (VP (VBG trying) (S (VP (TO to) (VP (VB pin) (NP (DT the) (NN murder)) (PP (IN on) (NP (PRP him))))))))))) (. .)))
K/KE/KE2.xml,KE2RE01K,38705,11,,A,7,2,I think  --,"[I/PRP, think/VBP, that/IN, i-/NN, i-/NN, i-/NN, I/PRP, don/VBP, 't/PRP, ,/,, I/PRP, 'd/MD, I/PRP, I/PRP, reckon/VBP, they/PRP, 've/VBP, got/VBD, him/PRP, on/IN, the/DT, kidnapping/NN, charge/NN, ./.]","(ROOT (S (S (NP (PRP I)) (VP (VBP think) (SBAR (IN that) (S (NP (NP (NN i-) (NN i-) (NN i-)) (SBAR (S (NP (PRP I)) (VP (VBP don) (NP (PRP 't)))))) (, ,) (NP (PRP I)) (VP (MD 'd) (VP (NP (PRP I)))))))) (NP (PRP I)) (VP (VBP reckon) (SBAR (S (NP (PRP they)) (VP (VBP 've) (VP (VBD got) (NP (PRP him)) (PP (IN on) (NP (DT the) (NN kidnapping) (NN charge)))))))) (. .)))"
K/KE/KE2.xml,KE2RE01K,38705,12,,A,7,3,--that i- i- i- --,"[I/PRP, think/VBP, that/IN, i-/NN, i-/NN, i-/NN, I/PRP, don/VBP, 't/PRP, ,/,, I/PRP, 'd/MD, I/PRP, I/PRP, reckon/VBP, they/PRP, 've/VBP, got/VBD, him/PRP, on/IN, the/DT, kidnapping/NN, charge/NN, ./.]","(ROOT (S (S (NP (PRP I)) (VP (VBP think) (SBAR (IN that) (S (NP (NP (NN i-) (NN i-) (NN i-)) (SBAR (S (NP (PRP I)) (VP (VBP don) (NP (PRP 't)))))) (, ,) (NP (PRP I)) (VP (MD 'd) (VP (NP (PRP I)))))))) (NP (PRP I)) (VP (VBP reckon) (SBAR (S (NP (PRP they)) (VP (VBP 've) (VP (VBD got) (NP (PRP him)) (PP (IN on) (NP (DT the) (NN kidnapping) (NN charge)))))))) (. .)))"
K/KE/KE2.xml,KE2RE01K,38705,13,,A,7,4,"--I don't, I'd I  --","[I/PRP, think/VBP, that/IN, i-/NN, i-/NN, i-/NN, I/PRP, don/VBP, 't/PRP, ,/,, I/PRP, 'd/MD, I/PRP, I/PRP, reckon/VBP, they/PRP, 've/VBP, got/VBD, him/PRP, on/IN, the/DT, kidnapping/NN, charge/NN, ./.]","(ROOT (S (S (NP (PRP I)) (VP (VBP think) (SBAR (IN that) (S (NP (NP (NN i-) (NN i-) (NN i-)) (SBAR (S (NP (PRP I)) (VP (VBP don) (NP (PRP 't)))))) (, ,) (NP (PRP I)) (VP (MD 'd) (VP (NP (PRP I)))))))) (NP (PRP I)) (VP (VBP reckon) (SBAR (S (NP (PRP they)) (VP (VBP 've) (VP (VBD got) (NP (PRP him)) (PP (IN on) (NP (DT the) (NN kidnapping) (NN charge)))))))) (. .)))"
K/KE/KE2.xml,KE2RE01K,38705,14,,A,7,5,--I reckon they've got him on the kidnapping charge.,"[I/PRP, think/VBP, that/IN, i-/NN, i-/NN, i-/NN, I/PRP, don/VBP, 't/PRP, ,/,, I/PRP, 'd/MD, I/PRP, I/PRP, reckon/VBP, they/PRP, 've/VBP, got/VBD, him/PRP, on/IN, the/DT, kidnapping/NN, charge/NN, ./.]","(ROOT (S (S (NP (PRP I)) (VP (VBP think) (SBAR (IN that) (S (NP (NP (NN i-) (NN i-) (NN i-)) (SBAR (S (NP (PRP I)) (VP (VBP don) (NP (PRP 't)))))) (, ,) (NP (PRP I)) (VP (MD 'd) (VP (NP (PRP I)))))))) (NP (PRP I)) (VP (VBP reckon) (SBAR (S (NP (PRP they)) (VP (VBP 've) (VP (VBD got) (NP (PRP him)) (PP (IN on) (NP (DT the) (NN kidnapping) (NN charge)))))))) (. .)))"
K/KE/KE2.xml,KE2RE01K,38705,15,,B,8,1,It sounds to me  --,"[It/PRP, sounds/VBZ, to/TO, me/PRP, with/IN, me/PRP, being/VBG, they/PRP, got/VBD, him/PRP, the/DT, first/JJ, the/DT, the/DT, their/PRP$, victims/NNS, ./.]",(ROOT (SINV (S (NP (PRP It)) (VP (VBZ sounds) (PP (TO to) (NP (PRP me))) (PP (IN with) (S (NP (PRP me)) (VP (VBG being) (NP (PRP they))))))) (VP (VBD got) (NP (PRP him))) (NP (NP (DT the) (JJ first)) (NP (DT the) (DT the) (PRP$ their) (NNS victims))) (. .)))
K/KE/KE2.xml,KE2RE01K,38705,16,,B,8,2,--with me being    (()) --,"[It/PRP, sounds/VBZ, to/TO, me/PRP, with/IN, me/PRP, being/VBG, they/PRP, got/VBD, him/PRP, the/DT, first/JJ, the/DT, the/DT, their/PRP$, victims/NNS, ./.]",(ROOT (SINV (S (NP (PRP It)) (VP (VBZ sounds) (PP (TO to) (NP (PRP me))) (PP (IN with) (S (NP (PRP me)) (VP (VBG being) (NP (PRP they))))))) (VP (VBD got) (NP (PRP him))) (NP (NP (DT the) (JJ first)) (NP (DT the) (DT the) (PRP$ their) (NNS victims))) (. .)))
K/KE/KE2.xml,KE2RE01K,38705,17,,B,8,3,--(()) they got him the first the  --,"[It/PRP, sounds/VBZ, to/TO, me/PRP, with/IN, me/PRP, being/VBG, they/PRP, got/VBD, him/PRP, the/DT, first/JJ, the/DT, the/DT, their/PRP$, victims/NNS, ./.]",(ROOT (SINV (S (NP (PRP It)) (VP (VBZ sounds) (PP (TO to) (NP (PRP me))) (PP (IN with) (S (NP (PRP me)) (VP (VBG being) (NP (PRP they))))))) (VP (VBD got) (NP (PRP him))) (NP (NP (DT the) (JJ first)) (NP (DT the) (DT the) (PRP$ their) (NNS victims))) (. .)))
K/KE/KE2.xml,KE2RE01K,38705,18,,B,8,4,--the  (()) their victims (()) .,"[It/PRP, sounds/VBZ, to/TO, me/PRP, with/IN, me/PRP, being/VBG, they/PRP, got/VBD, him/PRP, the/DT, first/JJ, the/DT, the/DT, their/PRP$, victims/NNS, ./.]",(ROOT (SINV (S (NP (PRP It)) (VP (VBZ sounds) (PP (TO to) (NP (PRP me))) (PP (IN with) (S (NP (PRP me)) (VP (VBG being) (NP (PRP they))))))) (VP (VBD got) (NP (PRP him))) (NP (NP (DT the) (JJ first)) (NP (DT the) (DT the) (PRP$ their) (NNS victims))) (. .)))
K/KE/KE2.xml,KE2RE01K,38705,19,,A,9,1,Oh is that so?,"[Oh/UH, is/VBZ, that/IN, so/RB, ?/.]",(ROOT (SBARQ (WHNP (UH Oh)) (SQ (VBZ is) (ADJP (IN that) (ADVP (RB so)))) (. ?)))
K/KE/KE2.xml,KE2RE01K,38705,20,,B,10,1,Well somewhere.,"[Well/RB, somewhere/RB, ./.]",(ROOT (FRAG (ADVP (RB Well)) (NP (RB somewhere)) (. .)))
K/KE/KE2.xml,KE2RE01K,38705,21,,A,11,1,Mm.,"[Mm/NN, ./.]",(ROOT (NP (NN Mm) (. .)))
