swda_filename,ptb_basename,conversation_no,transcript_index,act_tag,caller,turn_index,subutterance_index,text,pos,trees
K/KE/KE5.xml,KE5RE001,35202,0,,A,1,1,We are watching the brides of Christ probably never ever to be seen again in the year two thousand and fifty six.,"[We/PRP, are/VBP, watching/VBG, the/DT, brides/NNS, of/IN, Christ/NNP, probably/RB, never/RB, ever/RB, to/TO, be/VB, seen/VBN, again/RB, in/IN, the/DT, year/NN, two/CD, thousand/CD, and/CC, fifty/CD, six/CD, ./.]",(ROOT (S (NP (PRP We)) (VP (VBP are) (VP (VBG watching) (NP (NP (DT the) (NNS brides)) (PP (IN of) (NP (NNP Christ)))) (ADVP (RB probably)) (ADVP (RB never) (RB ever) (S (VP (TO to) (VP (VB be) (VP (VBN seen) (ADVP (RB again)) (PP (IN in) (NP (DT the) (NN year) (QP (CD two) (CD thousand) (CC and) (CD fifty) (CD six))))))))))) (. .)))
K/KE/KE5.xml,KE5RE001,35202,1,,A,1,2,Janice is writing away on her pad.,"[Janice/NNP, is/VBZ, writing/VBG, away/RP, on/IN, her/PRP$, pad/NN, ./.]",(ROOT (S (NP (NNP Janice)) (VP (VBZ is) (VP (VBG writing) (PRT (RP away)) (PP (IN on) (NP (PRP$ her) (NN pad))))) (. .)))
K/KE/KE5.xml,KE5RE001,35202,2,,B,2,1,Shaun's sitting cross legged,"[Shaun/NNP, 's/POS, sitting/VBG, cross/JJ, legged/VBN]",(ROOT (NP (NP (NP (NNP Shaun) (POS 's)) (VBG sitting)) (PP (JJ cross) (S (VP (VBN legged))))))
K/KE/KE5.xml,KE5RE001,35202,3,,A,3,1,"<laugh> And Darren looks like an oversized leprechaun, all dressed in green and ready to go, meanwhile I'm reporting this excellent news to you guys  <laugh> if you are listening out there from the national library association, er, er, er, er","[And/CC, Darren/NNP, looks/VBZ, like/IN, an/DT, oversized/JJ, leprechaun/NN, ,/,, all/DT, dressed/VBN, in/IN, green/JJ, and/CC, ready/JJ, to/TO, go/VB, ,/,, meanwhile/RB, I/PRP, 'm/VBP, reporting/VBG, this/DT, excellent/JJ, news/NN, to/TO, you/PRP, guys/NNS, if/IN, you/PRP, are/VBP, listening/VBG, out/IN, there/RB, from/IN, the/DT, national/NNP, library/NNP, association/NNP, ,/,, er/NN, ,/,, er/NN, ,/,, er/NN, ,/,, er/NN]","(ROOT (S (CC And) (NP (NNP Darren)) (VP (VBZ looks) (PP (IN like) (NP (NP (DT an) (JJ oversized) (NN leprechaun)) (, ,) (NP (NP (DT all)) (VP (VBN dressed) (PP (IN in) (ADJP (JJ green) (CC and) (JJ ready))) (S (VP (TO to) (VP (VB go) (SBAR (S (, ,) (ADVP (RB meanwhile)) (NP (PRP I)) (VP (VBP 'm) (VP (VBG reporting) (NP (DT this) (JJ excellent) (NN news)) (PP (TO to) (NP (PRP you) (NNS guys))) (SBAR (IN if) (S (NP (PRP you)) (VP (VBP are) (VP (VBG listening) (ADVP (IN out) (RB there)) (PP (IN from) (NP (DT the) (NNP national) (NNP library) (NNP association) (, ,) (NN er) (, ,) (NN er) (, ,) (NN er) (, ,) (NN er)))))))))))))))))))))"
K/KE/KE5.xml,KE5RE001,35202,4,,B,4,1,<laugh> ,[],
K/KE/KE5.xml,KE5RE001,35202,5,,A,5,1,"we, ee, ee, ee, ee, ee","[we/PRP, ,/,, ee/NNP, ,/,, ee/NNP, ,/,, ee/NNP, ,/,, ee/NNP, ,/,, ee/NNP]","(ROOT (NP (NP (PRP we)) (, ,) (NP (NNP ee) (, ,) (NNP ee) (, ,) (NNP ee) (, ,) (NNP ee) (, ,) (NNP ee))))"
K/KE/KE5.xml,KE5RE001,35202,6,,B,6,1,<laugh> ,[],
K/KE/KE5.xml,KE5RE001,35202,7,,A,7,1,"hello, hello","[hello/UH, ,/,, hello/UH]","(ROOT (INTJ (UH hello) (, ,) (UH hello)))"
K/KE/KE5.xml,KE5RE001,35202,8,,B,8,1,What does,"[What/WP, does/VBZ]",(ROOT (SBARQ (WHNP (WP What)) (SQ (VP (VBZ does)))))
K/KE/KE5.xml,KE5RE001,35202,9,,B,8,2,(()) ,[],
K/KE/KE5.xml,KE5RE001,35202,10,,B,8,3,"that word mean in the year twenty five, twenty thousand?","[that/DT, word/NN, mean/NN, in/IN, the/DT, year/NN, twenty/CD, five/CD, ,/,, twenty/CD, thousand/CD, ?/.]","(ROOT (NP (NP (NP (DT that) (NN word) (NN mean)) (PP (IN in) (NP (DT the) (NN year)))) (NP (NP (CD twenty) (CD five)) (, ,) (NP (CD twenty) (CD thousand))) (. ?)))"
K/KE/KE5.xml,KE5RE001,35202,11,,B,8,4,Oh I've got to phone my ma ,"[Oh/UH, I/PRP, 've/VBP, got/VBN, to/TO, phone/VB, my/PRP$, ma/NNP]",(ROOT (SINV (FRAG (INTJ (UH Oh))) (VP (ADVP (PRP I)) (VBP 've) (VP (VBN got) (S (VP (TO to) (VP (VB phone) (NP (PRP$ my))))))) (NP (NNP ma))))
K/KE/KE5.xml,KE5RE001,35202,12,,A,9,1,Blik blik slogger logger a ,"[Blik/NNP, blik/NNP, slogger/NNP, logger/NNP, a/DT]",(ROOT (NP (NP (NNP Blik) (NNP blik) (NNP slogger)) (NP (NNP logger) (DT a))))
K/KE/KE5.xml,KE5RE001,35202,13,,B,10,1,Masturbate explain masturbate,"[Masturbate/VB, explain/VB, masturbate/VBP]",(ROOT (S (VP (VB Masturbate) (VP (VB explain) (SBAR (S (VP (VBP masturbate))))))))
K/KE/KE5.xml,KE5RE001,35202,14,,A,11,1,by the way,"[by/IN, the/DT, way/NN]",(ROOT (PP (IN by) (NP (DT the) (NN way))))
K/KE/KE5.xml,KE5RE001,35202,15,,B,12,1,Well if you take a,"[Well/RB, if/IN, you/PRP, take/VBP, a/DT]",(ROOT (FRAG (ADVP (RB Well)) (SBAR (IN if) (S (NP (PRP you)) (VP (VBP take) (NP (DT a)))))))
K/KE/KE5.xml,KE5RE001,35202,16,,B,12,2,(()) ,[],
K/KE/KE5.xml,KE5RE001,35202,17,,B,12,3,and cross it with a fuel injection between her and nitro oxide,"[and/CC, cross/VB, it/PRP, with/IN, a/DT, fuel/NN, injection/NN, between/IN, her/PRP, and/CC, nitro/NN, oxide/NN]",(ROOT (FRAG (CC and) (S (VP (VB cross) (NP (PRP it)) (PP (IN with) (NP (NP (DT a) (NN fuel) (NN injection)) (PP (IN between) (NP (NP (PRP her)) (CC and) (NP (NN nitro) (NN oxide))))))))))
K/KE/KE5.xml,KE5RE001,35202,18,,A,13,1,And take with crystals from the ,"[And/CC, take/VB, with/IN, crystals/NNS, from/IN, the/DT]",(ROOT (FRAG (CC And) (S (VP (VB take) (PP (IN with) (NP (NP (NNS crystals)) (PP (IN from) (NP (DT the)))))))))
K/KE/KE5.xml,KE5RE001,35202,19,,B,14,1,"you'll put it with a box of speed with about seven hundred leggings, twelve per hour.","[you/PRP, 'll/MD, put/VB, it/PRP, with/IN, a/DT, box/NN, of/IN, speed/NN, with/IN, about/RB, seven/CD, hundred/CD, leggings/NNS, ,/,, twelve/CD, per/IN, hour/NN, ./.]","(ROOT (S (NP (PRP you)) (VP (MD 'll) (VP (VB put) (NP (PRP it)) (PP (IN with) (NP (NP (DT a) (NN box)) (PP (IN of) (NP (NN speed))))) (PP (IN with) (NP (NP (QP (RB about) (CD seven) (CD hundred)) (NNS leggings)) (, ,) (NP (NP (CD twelve)) (PP (IN per) (NP (NN hour)))))))) (. .)))"
K/KE/KE5.xml,KE5RE001,35202,20,,A,15,1,"I'd like you to ring us back up in the past and ask us, tell us if there's a war and how often you have sex in them days.","[I/PRP, 'd/MD, like/VB, you/PRP, to/TO, ring/VB, us/PRP, back/VB, up/RP, in/IN, the/DT, past/NN, and/CC, ask/VB, us/PRP, ,/,, tell/VB, us/PRP, if/IN, there/EX, 's/VBZ, a/DT, war/NN, and/CC, how/WRB, often/RB, you/PRP, have/VBP, sex/NN, in/IN, them/PRP, days/NNS, ./.]","(ROOT (S (NP (PRP I)) (VP (MD 'd) (VP (VB like) (S (NP (PRP you)) (VP (TO to) (VP (VB ring) (S (NP (PRP us)) (VP (VP (VP (VB back) (PRT (RP up)) (PP (IN in) (NP (DT the) (NN past)))) (CC and) (VP (VB ask) (NP (PRP us)))) (, ,) (VP (VB tell) (NP (PRP us)) (SBAR (SBAR (IN if) (S (NP (EX there)) (VP (VBZ 's) (NP (DT a) (NN war))))) (CC and) (SBAR (WHADVP (WRB how) (RB often)) (S (NP (PRP you)) (VP (VBP have) (NP (NP (NN sex)) (PP (IN in) (NP (PRP them))))))))) (NP (NNS days))))))))) (. .)))"
K/KE/KE5.xml,KE5RE001,35202,21,,B,16,1,"We do it seven days a, seven, seven times a day, seven times a week, in the year nineteen ninety two","[We/PRP, do/VBP, it/PRP, seven/CD, days/NNS, a/DT, ,/,, seven/CD, ,/,, seven/CD, times/NNS, a/DT, day/NN, ,/,, seven/CD, times/NNS, a/DT, week/NN, ,/,, in/IN, the/DT, year/NN, nineteen/CD, ninety/CD, two/CD]","(ROOT (S (NP (PRP We)) (VP (VBP do) (NP (NP (ADJP (NP (PRP it)) (NP (CD seven) (NNS days))) (DT a)) (, ,) (NP (CD seven)) (, ,) (NP (NP (CD seven) (NNS times)) (NP (DT a) (NN day))) (, ,) (NP (NP (CD seven) (NNS times)) (NP (DT a) (NN week))) (, ,) (PP (IN in) (NP (NP (DT the) (NN year) (CD nineteen)) (QP (CD ninety) (CD two))))))))"
K/KE/KE5.xml,KE5RE001,35202,22,,A,17,1,Excluding bank holiday Mondays,"[Excluding/VBG, bank/NN, holiday/NN, Mondays/NNS]",(ROOT (PP (VBG Excluding) (NP (NP (NN bank) (NN holiday)) (NP (NNS Mondays)))))
K/KE/KE5.xml,KE5RE001,35202,23,,B,18,1,fifty two weeks a year,"[fifty/CD, two/CD, weeks/NNS, a/DT, year/NN]",(ROOT (NP (NP (CD fifty)) (NP (NP (CD two) (NNS weeks)) (NP (DT a) (NN year)))))
K/KE/KE5.xml,KE5RE001,35202,24,,A,19,1,excluding bank holiday Mondays,"[excluding/VBG, bank/NN, holiday/NN, Mondays/NNS]",(ROOT (PP (VBG excluding) (NP (NP (NN bank) (NN holiday)) (NP (NNS Mondays)))))
K/KE/KE5.xml,KE5RE001,35202,25,,B,20,1,and Christmas Day,"[and/CC, Christmas/NNP, Day/NNP]",(ROOT (FRAG (CC and) (NP (NNP Christmas) (NNP Day))))
K/KE/KE5.xml,KE5RE001,35202,26,,A,21,1,excluding bank holiday Mondays and Christmas Day,"[excluding/VBG, bank/NN, holiday/NN, Mondays/NNS, and/CC, Christmas/NNP, Day/NNP]",(ROOT (PP (VBG excluding) (NP (NP (NN bank) (NN holiday) (NNS Mondays)) (CC and) (NP (NNP Christmas) (NNP Day)))))
K/KE/KE5.xml,KE5RE001,35202,27,,B,22,1,all too pissed,"[all/DT, too/RB, pissed/VBN]",(ROOT (S (NP (DT all)) (VP (ADVP (RB too)) (VBN pissed))))
K/KE/KE5.xml,KE5RE001,35202,28,,A,23,1,Thank you very much for listening and,"[Thank/VB, you/PRP, very/RB, much/RB, for/IN, listening/VBG, and/CC]",(ROOT (S (VP (VB Thank) (NP (PRP you)) (ADVP (RB very) (RB much)) (PP (IN for) (S (VP (VBG listening) (ADVP (CC and))))))))
K/KE/KE5.xml,KE5RE001,35202,29,,B,24,1,"this is er, er","[this/DT, is/VBZ, er/NN, ,/,, er/NN]","(ROOT (S (NP (DT this)) (VP (VBZ is) (NP (NP (NN er)) (, ,) (NP (NN er))))))"
K/KE/KE5.xml,KE5RE001,35202,30,,A,25,1,I should work for the B B C shouldn't I as a news reporter,"[I/PRP, should/MD, work/VB, for/IN, the/DT, B/NN, B/NN, C/NN, shouldn/NN, 't/PRP, I/PRP, as/IN, a/DT, news/NN, reporter/NN]",(ROOT (S (NP (PRP I)) (VP (MD should) (VP (VB work) (PP (IN for) (NP (DT the) (NN B) (NN B) (NN C) (NN shouldn))) (NP (PRP 't) (NP (NP (PRP I)) (PP (IN as) (NP (DT a) (NN news) (NN reporter)))))))))
K/KE/KE5.xml,KE5RE001,35202,31,,B,26,1,this is Nigel  <<REDACTED (name)>> ,"[this/DT, is/VBZ, Nigel/NNP, >/JJR]",(ROOT (S (NP (DT this)) (VP (VBZ is) (NP (NP (NNP Nigel)) (JJR >)))))
K/KE/KE5.xml,KE5RE001,35202,32,,B,26,2,<belch> That's a burp you may not experience that word from where you come from,"[That/DT, 's/VBZ, a/DT, burp/NN, you/PRP, may/MD, not/RB, experience/VB, that/IN, word/NN, from/IN, where/WRB, you/PRP, come/VBP, from/IN]",(ROOT (S (NP (DT That)) (VP (VBZ 's) (NP (NP (DT a) (NN burp)) (SBAR (S (NP (PRP you)) (VP (MD may) (RB not) (VP (VB experience) (SBAR (IN that) (FRAG (NP (NN word)) (PP (IN from) (SBAR (WHADVP (WRB where)) (S (NP (PRP you)) (VP (VBP come) (PP (IN from))))))))))))))))
K/KE/KE5.xml,KE5RE001,35202,33,,A,27,1,"Yes by the year two thousand and fifty six comes, burps may be anonymous","[Yes/RB, by/IN, the/DT, year/NN, two/CD, thousand/CD, and/CC, fifty/CD, six/CD, comes/VBZ, ,/,, burps/VBZ, may/MD, be/VB, anonymous/JJ]","(ROOT (PP (ADVP (RB Yes)) (IN by) (NP (NP (DT the) (NN year)) (SBAR (S (NP (NP (CD two) (CD thousand)) (CC and) (NP (CD fifty) (CD six))) (VP (VP (VBZ comes)) (, ,) (VP (VBZ burps))))) (SBAR (S (VP (MD may) (VP (VB be) (ADJP (JJ anonymous)))))))))"
