swda_filename,ptb_basename,conversation_no,transcript_index,act_tag,caller,turn_index,subutterance_index,text,pos,trees
K/KD/KDM.xml,KDMRE02K,30717,0,,A,1,1,Oh  <laughing> I see </laughing> !,"[Oh/UH, I/PRP, see/VBP, !/.]",(ROOT (S (S (INTJ (UH Oh)) (NP (PRP I)) (VP (VBP see))) (. !)))
K/KD/KDM.xml,KDMRE02K,30717,1,,B,2,1,He keeps filming us!,"[He/PRP, keeps/VBZ, filming/VBG, us/PRP, !/.]",(ROOT (S (NP (PRP He)) (VP (VBZ keeps) (S (VP (VBG filming) (NP (PRP us))))) (. !)))
K/KD/KDM.xml,KDMRE02K,30717,2,,A,3,1,You get a surprise.,"[You/PRP, get/VBP, a/DT, surprise/NN, ./.]",(ROOT (S (NP (PRP You)) (VP (VBP get) (NP (DT a) (NN surprise))) (. .)))
K/KD/KDM.xml,KDMRE02K,30717,3,,A,3,2,<laughing> Where's it gone </laughing> ?,"[Where/WRB, 's/VBZ, it/PRP, gone/VBN, ?/.]",(ROOT (SBARQ (WHADVP (WRB Where)) (SQ (VBZ 's) (NP (PRP it)) (VP (VBN gone))) (. ?)))
K/KD/KDM.xml,KDMRE02K,30717,4,,B,4,1,It's very good he  --,"[It/PRP, 's/VBZ, very/RB, good/JJ, he/PRP, the/DT, video/NN, 's/POS, just/RB, as/IN, safe/JJ, as/IN, if/IN, children/NNS, that/WDT, needs/VBZ, character/NN, what/WP, do/VBP, you/PRP, think/VB, ?/.]",(ROOT (S (NP (PRP It)) (VP (VBZ 's) (ADJP (RB very) (JJ good)) (NP (NP (NP (NP (PRP he)) (NP (DT the) (NN video) (POS 's))) (ADJP (RB just) (IN as) (JJ safe))) (CONJP (IN as) (IN if)) (NP (NP (NNS children)) (SBAR (WHNP (WDT that)) (S (VP (VBZ needs) (NP (NP (NN character)) (SBAR (WHNP (WP what)) (S (VP (VBP do) (S (NP (PRP you)) (VP (VB think))))))))))))) (. ?)))
K/KD/KDM.xml,KDMRE02K,30717,5,,B,4,2,--the video's just as safe as if  --,"[It/PRP, 's/VBZ, very/RB, good/JJ, he/PRP, the/DT, video/NN, 's/POS, just/RB, as/IN, safe/JJ, as/IN, if/IN, children/NNS, that/WDT, needs/VBZ, character/NN, what/WP, do/VBP, you/PRP, think/VB, ?/.]",(ROOT (S (NP (PRP It)) (VP (VBZ 's) (ADJP (RB very) (JJ good)) (NP (NP (NP (NP (PRP he)) (NP (DT the) (NN video) (POS 's))) (ADJP (RB just) (IN as) (JJ safe))) (CONJP (IN as) (IN if)) (NP (NP (NNS children)) (SBAR (WHNP (WDT that)) (S (VP (VBZ needs) (NP (NP (NN character)) (SBAR (WHNP (WP what)) (S (VP (VBP do) (S (NP (PRP you)) (VP (VB think))))))))))))) (. ?)))
K/KD/KDM.xml,KDMRE02K,30717,6,,B,4,3,--children   (()) --,"[It/PRP, 's/VBZ, very/RB, good/JJ, he/PRP, the/DT, video/NN, 's/POS, just/RB, as/IN, safe/JJ, as/IN, if/IN, children/NNS, that/WDT, needs/VBZ, character/NN, what/WP, do/VBP, you/PRP, think/VB, ?/.]",(ROOT (S (NP (PRP It)) (VP (VBZ 's) (ADJP (RB very) (JJ good)) (NP (NP (NP (NP (PRP he)) (NP (DT the) (NN video) (POS 's))) (ADJP (RB just) (IN as) (JJ safe))) (CONJP (IN as) (IN if)) (NP (NP (NNS children)) (SBAR (WHNP (WDT that)) (S (VP (VBZ needs) (NP (NP (NN character)) (SBAR (WHNP (WP what)) (S (VP (VBP do) (S (NP (PRP you)) (VP (VB think))))))))))))) (. ?)))
K/KD/KDM.xml,KDMRE02K,30717,7,,B,4,4,--that needs character  --,"[It/PRP, 's/VBZ, very/RB, good/JJ, he/PRP, the/DT, video/NN, 's/POS, just/RB, as/IN, safe/JJ, as/IN, if/IN, children/NNS, that/WDT, needs/VBZ, character/NN, what/WP, do/VBP, you/PRP, think/VB, ?/.]",(ROOT (S (NP (PRP It)) (VP (VBZ 's) (ADJP (RB very) (JJ good)) (NP (NP (NP (NP (PRP he)) (NP (DT the) (NN video) (POS 's))) (ADJP (RB just) (IN as) (JJ safe))) (CONJP (IN as) (IN if)) (NP (NP (NNS children)) (SBAR (WHNP (WDT that)) (S (VP (VBZ needs) (NP (NP (NN character)) (SBAR (WHNP (WP what)) (S (VP (VBP do) (S (NP (PRP you)) (VP (VB think))))))))))))) (. ?)))
K/KD/KDM.xml,KDMRE02K,30717,8,,B,4,5,--what do you think?,"[It/PRP, 's/VBZ, very/RB, good/JJ, he/PRP, the/DT, video/NN, 's/POS, just/RB, as/IN, safe/JJ, as/IN, if/IN, children/NNS, that/WDT, needs/VBZ, character/NN, what/WP, do/VBP, you/PRP, think/VB, ?/.]",(ROOT (S (NP (PRP It)) (VP (VBZ 's) (ADJP (RB very) (JJ good)) (NP (NP (NP (NP (PRP he)) (NP (DT the) (NN video) (POS 's))) (ADJP (RB just) (IN as) (JJ safe))) (CONJP (IN as) (IN if)) (NP (NP (NNS children)) (SBAR (WHNP (WDT that)) (S (VP (VBZ needs) (NP (NP (NN character)) (SBAR (WHNP (WP what)) (S (VP (VBP do) (S (NP (PRP you)) (VP (VB think))))))))))))) (. ?)))
K/KD/KDM.xml,KDMRE02K,30717,9,,A,5,1,Well I don't know whether you can  --,"[Well/RB, I/PRP, don/VBP, 't/PRP, know/VB, whether/IN, you/PRP, can/MD, sort/VB, of/IN, ,/,, tape/NN, in/IN, advance/NN, can/MD, you/PRP, ?/.]","(ROOT (S (S (INTJ (RB Well)) (NP (PRP I)) (VP (VBP don) (S (NP (PRP 't)) (VP (VB know) (SBAR (IN whether) (S (NP (PRP you)) (VP (MD can) (VP (VB sort) (PP (IN of)))))))))) (, ,) (NP (NP (NN tape)) (PP (IN in) (NP (NN advance)))) (VP (MD can) (VP (NP (PRP you)))) (. ?)))"
K/KD/KDM.xml,KDMRE02K,30717,10,,A,5,2,"--sort of, tape in advance  --","[Well/RB, I/PRP, don/VBP, 't/PRP, know/VB, whether/IN, you/PRP, can/MD, sort/VB, of/IN, ,/,, tape/NN, in/IN, advance/NN, can/MD, you/PRP, ?/.]","(ROOT (S (S (INTJ (RB Well)) (NP (PRP I)) (VP (VBP don) (S (NP (PRP 't)) (VP (VB know) (SBAR (IN whether) (S (NP (PRP you)) (VP (MD can) (VP (VB sort) (PP (IN of)))))))))) (, ,) (NP (NP (NN tape)) (PP (IN in) (NP (NN advance)))) (VP (MD can) (VP (NP (PRP you)))) (. ?)))"
K/KD/KDM.xml,KDMRE02K,30717,11,,A,5,3,--can you?,"[Well/RB, I/PRP, don/VBP, 't/PRP, know/VB, whether/IN, you/PRP, can/MD, sort/VB, of/IN, ,/,, tape/NN, in/IN, advance/NN, can/MD, you/PRP, ?/.]","(ROOT (S (S (INTJ (RB Well)) (NP (PRP I)) (VP (VBP don) (S (NP (PRP 't)) (VP (VB know) (SBAR (IN whether) (S (NP (PRP you)) (VP (MD can) (VP (VB sort) (PP (IN of)))))))))) (, ,) (NP (NP (NN tape)) (PP (IN in) (NP (NN advance)))) (VP (MD can) (VP (NP (PRP you)))) (. ?)))"
K/KD/KDM.xml,KDMRE02K,30717,12,,A,5,4,"We, we can't, no ","[We/PRP, ,/,, we/PRP, can/MD, 't/PRP, ,/,, no/DT]","(ROOT (NP (S (NP (PRP We)) (, ,) (NP (PRP we)) (VP (MD can) (VP (NP (NP (PRP 't)) (, ,) (NP (DT no))))))))"
K/KD/KDM.xml,KDMRE02K,30717,13,,B,6,1,I don't understand it!,"[I/PRP, don/VBP, 't/PRP, understand/VB, it/PRP, !/.]",(ROOT (S (NP (PRP I)) (VP (VBP don) (S (NP (PRP 't)) (VP (VB understand) (NP (PRP it))))) (. !)))
K/KD/KDM.xml,KDMRE02K,30717,14,,B,6,2,I don't mess with the thing.,"[I/PRP, don/VBP, 't/PRP, mess/NN, with/IN, the/DT, thing/NN, ./.]",(ROOT (S (NP (PRP I)) (VP (VBP don) (S (NP (PRP 't)) (NP (NP (NN mess)) (PP (IN with) (NP (DT the) (NN thing)))))) (. .)))
K/KD/KDM.xml,KDMRE02K,30717,15,,B,6,3,I just let ,"[I/PRP, just/RB, let/VB]",(ROOT (S (NP (PRP I)) (VP (ADVP (RB just)) (S (VP (VB let))))))
K/KD/KDM.xml,KDMRE02K,30717,16,,A,7,1,No.,"[No/DT, ./.]",(ROOT (FRAG (NP (DT No)) (. .)))
K/KD/KDM.xml,KDMRE02K,30717,17,,B,8,1,them do it.<laugh> ,"[them/PRP, do/VBP, it/PRP, ./.]",(ROOT (S (NP (PRP them)) (VP (VBP do) (NP (PRP it))) (. .)))
K/KD/KDM.xml,KDMRE02K,30717,18,,A,9,1,"Son told us how to do it once, so he got the book out and he said, oh, then he gave up in the end!","[Son/NN, told/VBD, us/PRP, how/WRB, to/TO, do/VB, it/PRP, once/RB, ,/,, so/IN, he/PRP, got/VBD, the/DT, book/NN, out/IN, and/CC, he/PRP, said/VBD, ,/,, oh/UH, ,/,, then/RB, he/PRP, gave/VBD, up/RP, in/IN, the/DT, end/NN, !/.]","(ROOT (S (S (NP (NN Son)) (VP (VBD told) (NP (PRP us)) (SBAR (WHADVP (WRB how)) (S (VP (TO to) (VP (VB do) (NP (PRP it)) (ADVP (RB once)))))))) (, ,) (IN so) (S (NP (PRP he)) (VP (VBD got) (ADVP (NP (DT the) (NN book)) (IN out)))) (CC and) (S (NP (PRP he)) (VP (VBD said) (, ,) (S (INTJ (UH oh)) (, ,) (ADVP (RB then)) (NP (PRP he)) (VP (VBD gave) (PRT (RP up)) (PP (IN in) (NP (DT the) (NN end))))))) (. !)))"
K/KD/KDM.xml,KDMRE02K,30717,19,,A,9,2,Because er  --,"[Because/IN, er/NN, we/PRP, tried/VBD, it/PRP, and/CC, we/PRP, got/VBD, the/DT, wrong/JJ, ruddy/NN, film/NN, !/.]",(ROOT (S (PP (IN Because) (NP (NN er))) (NP (PRP we)) (VP (VBD tried) (SBAR (S (NP (PRP it) (CC and) (PRP we)) (VP (VBD got) (NP (DT the) (JJ wrong) (NN ruddy) (NN film)))))) (. !)))
K/KD/KDM.xml,KDMRE02K,30717,20,,A,9,3,--we tried it and we got the wrong ruddy film!,"[Because/IN, er/NN, we/PRP, tried/VBD, it/PRP, and/CC, we/PRP, got/VBD, the/DT, wrong/JJ, ruddy/NN, film/NN, !/.]",(ROOT (S (PP (IN Because) (NP (NN er))) (NP (PRP we)) (VP (VBD tried) (SBAR (S (NP (PRP it) (CC and) (PRP we)) (VP (VBD got) (NP (DT the) (JJ wrong) (NN ruddy) (NN film)))))) (. !)))
K/KD/KDM.xml,KDMRE02K,30717,21,,B,10,1,Ya.,"[Ya/PRP, ./.]",(ROOT (FRAG (NP (PRP Ya)) (. .)))
K/KD/KDM.xml,KDMRE02K,30717,22,,A,11,1,"You know yo- , it's all these buttons isn't it, you've gotta  --","[You/PRP, know/VBP, yo-/RB, ,/,, it/PRP, 's/VBZ, all/PDT, these/DT, buttons/NNS, isn/VBP, 't/PRP, it/PRP, ,/,, you/PRP, 've/VBP, gotta/NNP, you/PRP, 've/VBP, really/RB, got/VBN, to/TO, be/VB, into/IN, it/PRP, ./.]","(ROOT (S (S (NP (PRP You)) (VP (VBP know) (SBAR (S (ADVP (RB yo-)) (, ,) (NP (PRP it)) (VP (VBZ 's) (NP (NP (PDT all) (DT these) (NNS buttons)) (SBAR (S (VP (VBP isn) (S (NP (PRP 't)) (NP (PRP it)))))))))))) (, ,) (NP (PRP you)) (VP (VBP 've) (NP (NP (NNP gotta)) (SBAR (S (NP (PRP you)) (VP (VBP 've) (ADVP (RB really)) (VP (VBN got) (S (VP (TO to) (VP (VB be) (PP (IN into) (NP (PRP it)))))))))))) (. .)))"
K/KD/KDM.xml,KDMRE02K,30717,23,,A,11,2,--you've really got to be into it.,"[You/PRP, know/VBP, yo-/RB, ,/,, it/PRP, 's/VBZ, all/PDT, these/DT, buttons/NNS, isn/VBP, 't/PRP, it/PRP, ,/,, you/PRP, 've/VBP, gotta/NNP, you/PRP, 've/VBP, really/RB, got/VBN, to/TO, be/VB, into/IN, it/PRP, ./.]","(ROOT (S (S (NP (PRP You)) (VP (VBP know) (SBAR (S (ADVP (RB yo-)) (, ,) (NP (PRP it)) (VP (VBZ 's) (NP (NP (PDT all) (DT these) (NNS buttons)) (SBAR (S (VP (VBP isn) (S (NP (PRP 't)) (NP (PRP it)))))))))))) (, ,) (NP (PRP you)) (VP (VBP 've) (NP (NP (NNP gotta)) (SBAR (S (NP (PRP you)) (VP (VBP 've) (ADVP (RB really)) (VP (VBN got) (S (VP (TO to) (VP (VB be) (PP (IN into) (NP (PRP it)))))))))))) (. .)))"
K/KD/KDM.xml,KDMRE02K,30717,24,,B,12,1,<laughing> You know   </laughing> --,"[You/PRP, know/VBP, you/PRP, know/VB, my/PRP$, three/CD, year/NN, old/JJ, grandson/NN, he/PRP, knows/VBZ, how/WRB, to/TO, do/VB, it/PRP]",(ROOT (S (NP (PRP You)) (VP (VBP know) (S (NP (PRP you)) (VP (VB know) (NP (NP (PRP$ my) (ADJP (NP (CD three) (NN year)) (JJ old)) (NN grandson)) (SBAR (S (NP (PRP he)) (VP (VBZ knows) (SBAR (WHADVP (WRB how)) (S (VP (TO to) (VP (VB do) (NP (PRP it)))))))))))))))
K/KD/KDM.xml,KDMRE02K,30717,25,,B,12,2,--you know my three year old grandson  --,"[You/PRP, know/VBP, you/PRP, know/VB, my/PRP$, three/CD, year/NN, old/JJ, grandson/NN, he/PRP, knows/VBZ, how/WRB, to/TO, do/VB, it/PRP]",(ROOT (S (NP (PRP You)) (VP (VBP know) (S (NP (PRP you)) (VP (VB know) (NP (NP (PRP$ my) (ADJP (NP (CD three) (NN year)) (JJ old)) (NN grandson)) (SBAR (S (NP (PRP he)) (VP (VBZ knows) (SBAR (WHADVP (WRB how)) (S (VP (TO to) (VP (VB do) (NP (PRP it)))))))))))))))
K/KD/KDM.xml,KDMRE02K,30717,26,,B,12,3,--he knows  <laughing> how to do it  (()) ,"[You/PRP, know/VBP, you/PRP, know/VB, my/PRP$, three/CD, year/NN, old/JJ, grandson/NN, he/PRP, knows/VBZ, how/WRB, to/TO, do/VB, it/PRP]",(ROOT (S (NP (PRP You)) (VP (VBP know) (S (NP (PRP you)) (VP (VB know) (NP (NP (PRP$ my) (ADJP (NP (CD three) (NN year)) (JJ old)) (NN grandson)) (SBAR (S (NP (PRP he)) (VP (VBZ knows) (SBAR (WHADVP (WRB how)) (S (VP (TO to) (VP (VB do) (NP (PRP it)))))))))))))))
K/KD/KDM.xml,KDMRE02K,30717,27,,A,13,1,Oh I know!,"[Oh/UH, I/PRP, know/VBP, !/.]",(ROOT (S (S (INTJ (UH Oh)) (NP (PRP I)) (VP (VBP know))) (. !)))
K/KD/KDM.xml,KDMRE02K,30717,28,,B,14,1,his nana !,"[his/PRP$, nana/NN, !/.]",(ROOT (FRAG (NP (PRP$ his) (NN nana)) (. !)))
K/KD/KDM.xml,KDMRE02K,30717,29,,A,15,1,Yeah.,"[Yeah/UH, ./.]",(ROOT (INTJ (UH Yeah) (. .)))
K/KD/KDM.xml,KDMRE02K,30717,30,,B,16,1,"Try and  (()) look nana, that one  --","[Try/VB, and/CC, look/VB, nana/NNP, ,/,, that/IN, one/CD, and/CC, that/DT]","(ROOT (S (VP (VP (VB Try)) (CC and) (VP (VB look) (NP (NNP nana)) (, ,) (SBAR (IN that) (S (NP (NP (CD one)) (CC and) (NP (DT that)))))))))"
K/KD/KDM.xml,KDMRE02K,30717,31,,B,16,2,--and that ,"[Try/VB, and/CC, look/VB, nana/NNP, ,/,, that/IN, one/CD, and/CC, that/DT]","(ROOT (S (VP (VP (VB Try)) (CC and) (VP (VB look) (NP (NNP nana)) (, ,) (SBAR (IN that) (S (NP (NP (CD one)) (CC and) (NP (DT that)))))))))"
K/KD/KDM.xml,KDMRE02K,30717,32,,A,17,1,Experts ,[Experts/NNS],(ROOT (NP (NNS Experts)))
K/KD/KDM.xml,KDMRE02K,30717,33,,B,18,1,one.,"[one/CD, ./.]",(ROOT (FRAG (NP (CD one)) (. .)))
K/KD/KDM.xml,KDMRE02K,30717,34,,A,19,1,"aren't they kids, though!","[aren/NNP, 't/PRP, they/PRP, kids/NNS, ,/,, though/IN, !/.]","(ROOT (NP (NP (NNP aren)) (NP (NP (PRP 't)) (NP (NP (PRP they)) (NP (NNS kids)) (, ,) (ADJP (IN though)))) (. !)))"
K/KD/KDM.xml,KDMRE02K,30717,35,,A,19,2,Brought up quick you see.,"[Brought/VBN, up/RP, quick/JJ, you/PRP, see/VBP, ./.]",(ROOT (S (S (VP (VBN Brought) (PRT (RP up)) (NP (JJ quick)))) (NP (PRP you)) (VP (VBP see)) (. .)))
K/KD/KDM.xml,KDMRE02K,30717,36,,A,19,3,"I don't envy them though, I don't","[I/PRP, don/VBP, 't/PRP, envy/VB, them/PRP, though/RB, ,/,, I/PRP, don/VBP, 't/PRP]","(ROOT (S (NP (PRP I)) (VP (VBP don) (S (NP (PRP 't)) (VP (VB envy) (SBAR (S (NP (PRP them)) (ADVP (RB though)) (, ,) (NP (PRP I)) (VP (VBP don) (NP (PRP 't))))))))))"
K/KD/KDM.xml,KDMRE02K,30717,37,,B,20,1,Oh no I don't.,"[Oh/UH, no/DT, I/PRP, don/VBP, 't/PRP, ./.]",(ROOT (S (S (INTJ (UH Oh)) (NP (DT no) (PRP I)) (VP (VBP don) (NP (PRP 't)))) (. .)))
K/KD/KDM.xml,KDMRE02K,30717,38,,A,21,1,I'm old fashioned and that's it!,"[I/PRP, 'm/VBP, old/JJ, fashioned/VBN, and/CC, that/DT, 's/VBZ, it/PRP, !/.]",(ROOT (S (S (NP (PRP I)) (VP (VBP 'm) (ADJP (JJ old) (SBAR (S (VP (VBN fashioned))))))) (CC and) (S (NP (DT that)) (VP (VBZ 's) (NP (PRP it)))) (. !)))
K/KD/KDM.xml,KDMRE02K,30717,39,,A,21,2,I don't know.,"[I/PRP, don/VBP, 't/PRP, know/VB, ./.]",(ROOT (S (NP (PRP I)) (VP (VBP don) (S (NP (PRP 't)) (VP (VB know)))) (. .)))
K/KD/KDM.xml,KDMRE02K,30717,40,,B,22,1,No.,"[No/DT, ./.]",(ROOT (FRAG (NP (DT No)) (. .)))
K/KD/KDM.xml,KDMRE02K,30717,41,,B,22,2,Too old  <laughing> to change aren't we </laughing> ?,"[Too/RB, old/JJ, to/TO, change/VB, aren/NNP, 't/PRP, we/PRP, ?/.]",(ROOT (FRAG (ADJP (RB Too) (JJ old)) (S (VP (TO to) (VP (VB change) (S (NP (NNP aren) (PRP 't)) (NP (PRP we)))))) (. ?)))
K/KD/KDM.xml,KDMRE02K,30717,42,,A,23,1,But i- --,"[But/CC, i-/NN, I/PRP, must/MD, say/VB, I/PRP, like/IN, it/PRP, is/VBZ, a/DT, marvellous/JJ, thing/NN, to/TO, be/VB, able/JJ, to/TO, do/VB, that/DT, !/.]",(ROOT (S (CC But) (NP (NP (NN i-)) (SBAR (S (NP (PRP I)) (VP (MD must) (VP (VB say) (NP (PRP I)) (PP (IN like) (NP (PRP it)))))))) (VP (VBZ is) (NP (DT a) (JJ marvellous) (NN thing) (S (VP (TO to) (VP (VB be) (ADJP (JJ able) (S (VP (TO to) (VP (VB do) (NP (DT that))))))))))) (. !)))
K/KD/KDM.xml,KDMRE02K,30717,43,,A,23,2,--I must say I like  --,"[But/CC, i-/NN, I/PRP, must/MD, say/VB, I/PRP, like/IN, it/PRP, is/VBZ, a/DT, marvellous/JJ, thing/NN, to/TO, be/VB, able/JJ, to/TO, do/VB, that/DT, !/.]",(ROOT (S (CC But) (NP (NP (NN i-)) (SBAR (S (NP (PRP I)) (VP (MD must) (VP (VB say) (NP (PRP I)) (PP (IN like) (NP (PRP it)))))))) (VP (VBZ is) (NP (DT a) (JJ marvellous) (NN thing) (S (VP (TO to) (VP (VB be) (ADJP (JJ able) (S (VP (TO to) (VP (VB do) (NP (DT that))))))))))) (. !)))
K/KD/KDM.xml,KDMRE02K,30717,44,,A,23,3,--it is  --,"[But/CC, i-/NN, I/PRP, must/MD, say/VB, I/PRP, like/IN, it/PRP, is/VBZ, a/DT, marvellous/JJ, thing/NN, to/TO, be/VB, able/JJ, to/TO, do/VB, that/DT, !/.]",(ROOT (S (CC But) (NP (NP (NN i-)) (SBAR (S (NP (PRP I)) (VP (MD must) (VP (VB say) (NP (PRP I)) (PP (IN like) (NP (PRP it)))))))) (VP (VBZ is) (NP (DT a) (JJ marvellous) (NN thing) (S (VP (TO to) (VP (VB be) (ADJP (JJ able) (S (VP (TO to) (VP (VB do) (NP (DT that))))))))))) (. !)))
K/KD/KDM.xml,KDMRE02K,30717,45,,A,23,4,--a marvellous thing to be able to do that!,"[But/CC, i-/NN, I/PRP, must/MD, say/VB, I/PRP, like/IN, it/PRP, is/VBZ, a/DT, marvellous/JJ, thing/NN, to/TO, be/VB, able/JJ, to/TO, do/VB, that/DT, !/.]",(ROOT (S (CC But) (NP (NP (NN i-)) (SBAR (S (NP (PRP I)) (VP (MD must) (VP (VB say) (NP (PRP I)) (PP (IN like) (NP (PRP it)))))))) (VP (VBZ is) (NP (DT a) (JJ marvellous) (NN thing) (S (VP (TO to) (VP (VB be) (ADJP (JJ able) (S (VP (TO to) (VP (VB do) (NP (DT that))))))))))) (. !)))
K/KD/KDM.xml,KDMRE02K,30717,46,,B,24,1,Oh yeah.,"[Oh/UH, yeah/UH, ./.]",(ROOT (S (INTJ (UH Oh)) (VP (UH yeah)) (. .)))
K/KD/KDM.xml,KDMRE02K,30717,47,,A,25,1,Just sit down and watch a ruddy tape you know and,"[Just/RB, sit/VB, down/RB, and/CC, watch/VB, a/DT, ruddy/JJ, tape/NN, you/PRP, know/VBP, and/CC]",(ROOT (S (ADVP (RB Just)) (VP (VP (VB sit) (ADVP (RB down))) (CC and) (VP (VB watch) (NP (NP (DT a) (JJ ruddy) (NN tape)) (SBAR (S (NP (PRP you)) (VP (VBP know) (ADVP (CC and))))))))))
K/KD/KDM.xml,KDMRE02K,30717,48,,B,26,1,Yeah.,"[Yeah/UH, ./.]",(ROOT (INTJ (UH Yeah) (. .)))
K/KD/KDM.xml,KDMRE02K,30717,49,,A,27,1,"pre- , put it in and","[pre-/JJ, ,/,, put/VBD, it/PRP, in/IN, and/CC]","(ROOT (SINV (ADJP (JJ pre-)) (, ,) (VP (VBD put) (NP (PRP it))) (NP (NP (IN in)) (ADVP (CC and)))))"
K/KD/KDM.xml,KDMRE02K,30717,50,,B,28,1,Mm.,"[Mm/NN, ./.]",(ROOT (NP (NN Mm) (. .)))
K/KD/KDM.xml,KDMRE02K,30717,51,,A,29,1,I mean to say er  --,"[I/PRP, mean/VBP, to/TO, say/VB, er/NN, used/VBN, to/TO, see/VB, people/NNS, years/NNS, ago/RB, and/CC, they/PRP, got/VBD, these/DT, cine/JJ, cameras/NNS, and/CC, and/CC, all/DT, ,/,, we/PRP, could/MD, never/RB, have/VB, one/CD, of/IN, those/DT, you/PRP, know/VBP, and/CC, a/DT, record/NN, of/IN, the/DT, kids/NNS, when/WRB, they/PRP, were/VBD, young/JJ, ./.]","(ROOT (S (S (NP (PRP I)) (VP (VBP mean) (S (VP (TO to) (VP (VB say) (NP (NP (NN er)) (VP (VBN used) (S (VP (TO to) (VP (VB see) (NP (NNS people)) (ADVP (NP (NNS years)) (RB ago)))))))))))) (CC and) (S (NP (PRP they)) (VP (VP (VBD got) (NP (DT these) (JJ cine) (NNS cameras))) (CC and) (PRN (CC and) (S (NP (DT all)) (, ,) (NP (PRP we)) (VP (MD could) (ADVP (RB never)) (VP (VB have) (NP (NP (CD one)) (PP (IN of) (NP (NP (NP (DT those)) (SBAR (S (NP (PRP you)) (VP (VBP know))))) (CC and) (NP (NP (DT a) (NN record)) (PP (IN of) (NP (DT the) (NNS kids))))))))))) (SBAR (WHADVP (WRB when)) (S (NP (PRP they)) (VP (VBD were) (ADJP (JJ young))))))) (. .)))"
K/KD/KDM.xml,KDMRE02K,30717,52,,A,29,2,--used to see people years ago and they got these cine cameras and  --,"[I/PRP, mean/VBP, to/TO, say/VB, er/NN, used/VBN, to/TO, see/VB, people/NNS, years/NNS, ago/RB, and/CC, they/PRP, got/VBD, these/DT, cine/JJ, cameras/NNS, and/CC, and/CC, all/DT, ,/,, we/PRP, could/MD, never/RB, have/VB, one/CD, of/IN, those/DT, you/PRP, know/VBP, and/CC, a/DT, record/NN, of/IN, the/DT, kids/NNS, when/WRB, they/PRP, were/VBD, young/JJ, ./.]","(ROOT (S (S (NP (PRP I)) (VP (VBP mean) (S (VP (TO to) (VP (VB say) (NP (NP (NN er)) (VP (VBN used) (S (VP (TO to) (VP (VB see) (NP (NNS people)) (ADVP (NP (NNS years)) (RB ago)))))))))))) (CC and) (S (NP (PRP they)) (VP (VP (VBD got) (NP (DT these) (JJ cine) (NNS cameras))) (CC and) (PRN (CC and) (S (NP (DT all)) (, ,) (NP (PRP we)) (VP (MD could) (ADVP (RB never)) (VP (VB have) (NP (NP (CD one)) (PP (IN of) (NP (NP (NP (DT those)) (SBAR (S (NP (PRP you)) (VP (VBP know))))) (CC and) (NP (NP (DT a) (NN record)) (PP (IN of) (NP (DT the) (NNS kids))))))))))) (SBAR (WHADVP (WRB when)) (S (NP (PRP they)) (VP (VBD were) (ADJP (JJ young))))))) (. .)))"
K/KD/KDM.xml,KDMRE02K,30717,53,,A,29,3,"--and all, we could never have one of those you know and  --","[I/PRP, mean/VBP, to/TO, say/VB, er/NN, used/VBN, to/TO, see/VB, people/NNS, years/NNS, ago/RB, and/CC, they/PRP, got/VBD, these/DT, cine/JJ, cameras/NNS, and/CC, and/CC, all/DT, ,/,, we/PRP, could/MD, never/RB, have/VB, one/CD, of/IN, those/DT, you/PRP, know/VBP, and/CC, a/DT, record/NN, of/IN, the/DT, kids/NNS, when/WRB, they/PRP, were/VBD, young/JJ, ./.]","(ROOT (S (S (NP (PRP I)) (VP (VBP mean) (S (VP (TO to) (VP (VB say) (NP (NP (NN er)) (VP (VBN used) (S (VP (TO to) (VP (VB see) (NP (NNS people)) (ADVP (NP (NNS years)) (RB ago)))))))))))) (CC and) (S (NP (PRP they)) (VP (VP (VBD got) (NP (DT these) (JJ cine) (NNS cameras))) (CC and) (PRN (CC and) (S (NP (DT all)) (, ,) (NP (PRP we)) (VP (MD could) (ADVP (RB never)) (VP (VB have) (NP (NP (CD one)) (PP (IN of) (NP (NP (NP (DT those)) (SBAR (S (NP (PRP you)) (VP (VBP know))))) (CC and) (NP (NP (DT a) (NN record)) (PP (IN of) (NP (DT the) (NNS kids))))))))))) (SBAR (WHADVP (WRB when)) (S (NP (PRP they)) (VP (VBD were) (ADJP (JJ young))))))) (. .)))"
K/KD/KDM.xml,KDMRE02K,30717,54,,A,29,4,--a record of the kids when they were young.,"[I/PRP, mean/VBP, to/TO, say/VB, er/NN, used/VBN, to/TO, see/VB, people/NNS, years/NNS, ago/RB, and/CC, they/PRP, got/VBD, these/DT, cine/JJ, cameras/NNS, and/CC, and/CC, all/DT, ,/,, we/PRP, could/MD, never/RB, have/VB, one/CD, of/IN, those/DT, you/PRP, know/VBP, and/CC, a/DT, record/NN, of/IN, the/DT, kids/NNS, when/WRB, they/PRP, were/VBD, young/JJ, ./.]","(ROOT (S (S (NP (PRP I)) (VP (VBP mean) (S (VP (TO to) (VP (VB say) (NP (NP (NN er)) (VP (VBN used) (S (VP (TO to) (VP (VB see) (NP (NNS people)) (ADVP (NP (NNS years)) (RB ago)))))))))))) (CC and) (S (NP (PRP they)) (VP (VP (VBD got) (NP (DT these) (JJ cine) (NNS cameras))) (CC and) (PRN (CC and) (S (NP (DT all)) (, ,) (NP (PRP we)) (VP (MD could) (ADVP (RB never)) (VP (VB have) (NP (NP (CD one)) (PP (IN of) (NP (NP (NP (DT those)) (SBAR (S (NP (PRP you)) (VP (VBP know))))) (CC and) (NP (NP (DT a) (NN record)) (PP (IN of) (NP (DT the) (NNS kids))))))))))) (SBAR (WHADVP (WRB when)) (S (NP (PRP they)) (VP (VBD were) (ADJP (JJ young))))))) (. .)))"
K/KD/KDM.xml,KDMRE02K,30717,55,,B,30,1,Yeah.,"[Yeah/UH, ./.]",(ROOT (INTJ (UH Yeah) (. .)))
K/KD/KDM.xml,KDMRE02K,30717,56,,A,31,1,And I mean,"[And/CC, I/PRP, mean/VBP]",(ROOT (S (CC And) (NP (PRP I)) (VP (VBP mean))))
K/KD/KDM.xml,KDMRE02K,30717,57,,B,32,1,Well look at me  (()) stupid ,"[Well/RB, look/VB, at/IN, me/PRP, stupid/JJ]",(ROOT (S (ADVP (RB Well)) (VP (VB look) (PP (IN at) (NP (NP (PRP me)) (ADJP (JJ stupid)))))))
K/KD/KDM.xml,KDMRE02K,30717,58,,A,33,1,You only got a few minutes didn't you?,"[You/PRP, only/RB, got/VBD, a/DT, few/JJ, minutes/NNS, didn/VBP, 't/PRP, you/PRP, ?/.]",(ROOT (S (NP (PRP You)) (ADVP (RB only)) (VP (VBD got) (SBAR (S (NP (DT a) (JJ few) (NNS minutes)) (VP (VBP didn) (S (NP (PRP 't)) (NP (PRP you))))))) (. ?)))
K/KD/KDM.xml,KDMRE02K,30717,59,,B,34,1,this stupid thing is is  --,"[this/DT, stupid/JJ, thing/NN, is/VBZ, is/VBZ, going/VBG, and/CC, taping/VBG, rugby/JJ, matches/NNS, all/PDT, the/DT, time/NN, !/.]",(ROOT (S (NP (DT this) (JJ stupid) (NN thing)) (VP (VBZ is) (VP (VBZ is) (VP (VP (VBG going)) (CC and) (VP (VBG taping) (NP (JJ rugby) (NNS matches)) (NP (PDT all) (DT the) (NN time)))))) (. !)))
K/KD/KDM.xml,KDMRE02K,30717,60,,B,34,2,--going and taping rugby matches  <laughing> all the time </laughing> !,"[this/DT, stupid/JJ, thing/NN, is/VBZ, is/VBZ, going/VBG, and/CC, taping/VBG, rugby/JJ, matches/NNS, all/PDT, the/DT, time/NN, !/.]",(ROOT (S (NP (DT this) (JJ stupid) (NN thing)) (VP (VBZ is) (VP (VBZ is) (VP (VP (VBG going)) (CC and) (VP (VBG taping) (NP (JJ rugby) (NNS matches)) (NP (PDT all) (DT the) (NN time)))))) (. !)))
K/KD/KDM.xml,KDMRE02K,30717,61,,A,35,1,Oh yes!,"[Oh/UH, yes/UH, !/.]",(ROOT (FRAG (UH Oh) (INTJ (UH yes)) (. !)))
K/KD/KDM.xml,KDMRE02K,30717,62,,B,36,1,"But,(()) ","[But/CC, ,/,]","(ROOT (FRAG (CC But) (NP (, ,))))"
K/KD/KDM.xml,KDMRE02K,30717,63,,A,37,1,Well of course he would!,"[Well/RB, of/IN, course/NN, he/PRP, would/MD, !/.]",(ROOT (S (ADVP (RB Well)) (PP (IN of) (NP (NN course))) (NP (PRP he)) (VP (MD would)) (. !)))
K/KD/KDM.xml,KDMRE02K,30717,64,,B,38,1,you kno- ,"[you/PRP, kno-/VBP]",(ROOT (S (NP (PRP you)) (VP (VBP kno-))))
K/KD/KDM.xml,KDMRE02K,30717,65,,A,39,1,That's what he wants to see.,"[That/DT, 's/VBZ, what/WP, he/PRP, wants/VBZ, to/TO, see/VB, ./.]",(ROOT (S (NP (DT That)) (VP (VBZ 's) (SBAR (WHNP (WP what)) (S (NP (PRP he)) (VP (VBZ wants) (S (VP (TO to) (VP (VB see)))))))) (. .)))
K/KD/KDM.xml,KDMRE02K,30717,66,,B,40,1,I know.,"[I/PRP, know/VBP, ./.]",(ROOT (S (NP (PRP I)) (VP (VBP know)) (. .)))
K/KD/KDM.xml,KDMRE02K,30717,67,,B,40,2,"Yes, but he doesn't stop and think  --","[Yes/UH, ,/,, but/CC, he/PRP, doesn/VBZ, 't/PRP, stop/VB, and/CC, think/VB, you/PRP, know/VB, ,/,, what/WP, else/RB, can/MD, we/PRP, do/VB, ?/., to/TO, get/VB, this/DT, tape/NN, in/IN, ./.]","(ROOT (S (INTJ (UH Yes)) (, ,) (ADVP (CC but)) (NP (PRP he)) (VP (VBZ doesn) (S (NP (PRP 't)) (VP (VB stop)) (CC and) (VP (VB think) (NP (PRP you)) (VP (VB know) (, ,) (SBARQ (WHNP (WP what) (RB else)) (SQ (MD can) (NP (PRP we)) (VP (VB do))) (. ?))))) (SBAR (S (VP (TO to) (VP (VB get) (NP (DT this) (NN tape)) (PP (IN in))))))) (. .)))"
K/KD/KDM.xml,KDMRE02K,30717,68,,B,40,3,"--you know, what else can we do?--","[Yes/UH, ,/,, but/CC, he/PRP, doesn/VBZ, 't/PRP, stop/VB, and/CC, think/VB, you/PRP, know/VB, ,/,, what/WP, else/RB, can/MD, we/PRP, do/VB, ?/., to/TO, get/VB, this/DT, tape/NN, in/IN, ./.]","(ROOT (S (INTJ (UH Yes)) (, ,) (ADVP (CC but)) (NP (PRP he)) (VP (VBZ doesn) (S (NP (PRP 't)) (VP (VB stop)) (CC and) (VP (VB think) (NP (PRP you)) (VP (VB know) (, ,) (SBARQ (WHNP (WP what) (RB else)) (SQ (MD can) (NP (PRP we)) (VP (VB do))) (. ?))))) (SBAR (S (VP (TO to) (VP (VB get) (NP (DT this) (NN tape)) (PP (IN in))))))) (. .)))"
K/KD/KDM.xml,KDMRE02K,30717,69,,B,40,4,--(()) to get this  --,"[Yes/UH, ,/,, but/CC, he/PRP, doesn/VBZ, 't/PRP, stop/VB, and/CC, think/VB, you/PRP, know/VB, ,/,, what/WP, else/RB, can/MD, we/PRP, do/VB, ?/., to/TO, get/VB, this/DT, tape/NN, in/IN, ./.]","(ROOT (S (INTJ (UH Yes)) (, ,) (ADVP (CC but)) (NP (PRP he)) (VP (VBZ doesn) (S (NP (PRP 't)) (VP (VB stop)) (CC and) (VP (VB think) (NP (PRP you)) (VP (VB know) (, ,) (SBARQ (WHNP (WP what) (RB else)) (SQ (MD can) (NP (PRP we)) (VP (VB do))) (. ?))))) (SBAR (S (VP (TO to) (VP (VB get) (NP (DT this) (NN tape)) (PP (IN in))))))) (. .)))"
