swda_filename,ptb_basename,conversation_no,transcript_index,act_tag,caller,turn_index,subutterance_index,text,pos,trees
K/KE/KE6.xml,KE6RE018,37504,0,,A,1,1,"No I did, this week.","[No/DT, I/PRP, did/VBD, ,/,, this/DT, week/NN, ./.]","(ROOT (S (NP (DT No) (PRP I)) (VP (VP (VBD did)) (, ,) (NP (DT this) (NN week))) (. .)))"
K/KE/KE6.xml,KE6RE018,37504,1,,B,2,1,The other ones  --,"[The/DT, other/JJ, ones/NNS, wasn/VBP, 't/PRP, it/PRP, ?/.]",(ROOT (S (NP (DT The) (JJ other) (NNS ones)) (VP (VBP wasn) (S (NP (PRP 't)) (NP (PRP it)))) (. ?)))
K/KE/KE6.xml,KE6RE018,37504,2,,B,2,2,--wasn't it?,"[The/DT, other/JJ, ones/NNS, wasn/VBP, 't/PRP, it/PRP, ?/.]",(ROOT (S (NP (DT The) (JJ other) (NNS ones)) (VP (VBP wasn) (S (NP (PRP 't)) (NP (PRP it)))) (. ?)))
K/KE/KE6.xml,KE6RE018,37504,3,,A,3,1,"No we, we all take a turn on it where you do it.","[No/DT, we/PRP, ,/,, we/PRP, all/DT, take/VBP, a/DT, turn/NN, on/IN, it/PRP, where/WRB, you/PRP, do/VBP, it/PRP, ./.]","(ROOT (S (NP (DT No) (PRP we)) (, ,) (NP (PRP we)) (ADVP (DT all)) (VP (VBP take) (NP (DT a) (NN turn)) (PP (IN on) (NP (PRP it))) (SBAR (WHADVP (WRB where)) (S (NP (PRP you)) (VP (VBP do) (NP (PRP it)))))) (. .)))"
K/KE/KE6.xml,KE6RE018,37504,4,,B,4,1,"Where do you go, Tesco's?","[Where/WRB, do/VBP, you/PRP, go/VB, ,/,, Tesco/NNP, 's/POS, ?/.]","(ROOT (SBARQ (WHADVP (WRB Where)) (SQ (VP (VBP do) (NP (NP (NP (PRP you)) (SBAR (S (VP (VB go))))) (, ,) (NP (NNP Tesco) (POS 's))))) (. ?)))"
K/KE/KE6.xml,KE6RE018,37504,5,,A,5,1,"I will do, yeah.","[I/PRP, will/MD, do/VB, ,/,, yeah/UH, ./.]","(ROOT (S (S (NP (PRP I)) (VP (MD will) (VP (VB do)))) (, ,) (FRAG (INTJ (UH yeah))) (. .)))"
K/KE/KE6.xml,KE6RE018,37504,6,,B,6,1,Oh you will do.,"[Oh/UH, you/PRP, will/MD, do/VB, ./.]",(ROOT (S (S (INTJ (UH Oh)) (NP (PRP you)) (VP (MD will) (VP (VB do)))) (. .)))
K/KE/KE6.xml,KE6RE018,37504,7,,A,7,1,Yeah I'll go tomorrow then.,"[Yeah/UH, I/PRP, 'll/MD, go/VB, tomorrow/NN, then/RB, ./.]",(ROOT (S (S (INTJ (UH Yeah)) (NP (PRP I)) (VP (MD 'll) (VP (VB go) (NP (NN tomorrow)) (ADVP (RB then))))) (. .)))
