swda_filename,ptb_basename,conversation_no,transcript_index,act_tag,caller,turn_index,subutterance_index,text,pos,trees
K/KE/KE2.xml,KE2RE04K,39804,0,,A,1,1,It's really quite warm now out  --,"[It/PRP, 's/VBZ, really/RB, quite/RB, warm/JJ, now/RB, out/IN, sort/NN, of/IN, out/IN, of/IN, the/DT, wind/NN, ./.]",(ROOT (S (NP (PRP It)) (VP (VBZ 's) (ADJP (RB really) (RB quite) (JJ warm)) (ADVP (ADVP (RB now) (IN out) (NN sort)) (PP (IN of) (ADVP (IN out)))) (PP (IN of) (NP (DT the) (NN wind)))) (. .)))
K/KE/KE2.xml,KE2RE04K,39804,1,,A,1,2,--sort of out of the wind.,"[It/PRP, 's/VBZ, really/RB, quite/RB, warm/JJ, now/RB, out/IN, sort/NN, of/IN, out/IN, of/IN, the/DT, wind/NN, ./.]",(ROOT (S (NP (PRP It)) (VP (VBZ 's) (ADJP (RB really) (RB quite) (JJ warm)) (ADVP (ADVP (RB now) (IN out) (NN sort)) (PP (IN of) (ADVP (IN out)))) (PP (IN of) (NP (DT the) (NN wind)))) (. .)))
K/KE/KE2.xml,KE2RE04K,39804,2,,B,2,1,Yes   (()) --,"[Yes/RB, well/RB, I/PRP, think/VBP, that/IN, the/DT, erm/NN, I/PRP, mean/VBP, the/DT, sun/NN, is/VBZ, a/DT, surprise/NN, ./.]",(ROOT (S (ADVP (RB Yes) (RB well)) (NP (PRP I)) (VP (VBP think) (SBAR (IN that) (S (NP (NP (DT the) (NN erm)) (SBAR (S (NP (PRP I)) (VP (VBP mean) (NP (DT the) (NN sun)))))) (VP (VBZ is) (NP (DT a) (NN surprise)))))) (. .)))
K/KE/KE2.xml,KE2RE04K,39804,3,,B,2,2,--well I think that the erm  --,"[Yes/RB, well/RB, I/PRP, think/VBP, that/IN, the/DT, erm/NN, I/PRP, mean/VBP, the/DT, sun/NN, is/VBZ, a/DT, surprise/NN, ./.]",(ROOT (S (ADVP (RB Yes) (RB well)) (NP (PRP I)) (VP (VBP think) (SBAR (IN that) (S (NP (NP (DT the) (NN erm)) (SBAR (S (NP (PRP I)) (VP (VBP mean) (NP (DT the) (NN sun)))))) (VP (VBZ is) (NP (DT a) (NN surprise)))))) (. .)))
K/KE/KE2.xml,KE2RE04K,39804,4,,B,2,3,--I mean the sun is a surprise.,"[Yes/RB, well/RB, I/PRP, think/VBP, that/IN, the/DT, erm/NN, I/PRP, mean/VBP, the/DT, sun/NN, is/VBZ, a/DT, surprise/NN, ./.]",(ROOT (S (ADVP (RB Yes) (RB well)) (NP (PRP I)) (VP (VBP think) (SBAR (IN that) (S (NP (NP (DT the) (NN erm)) (SBAR (S (NP (PRP I)) (VP (VBP mean) (NP (DT the) (NN sun)))))) (VP (VBZ is) (NP (DT a) (NN surprise)))))) (. .)))
K/KE/KE2.xml,KE2RE04K,39804,5,,A,3,1,Yeah.,"[Yeah/UH, ./.]",(ROOT (INTJ (UH Yeah) (. .)))
K/KE/KE2.xml,KE2RE04K,39804,6,,A,3,2,Yeah that tub of daffs is really erm looking good isn't it?,"[Yeah/UH, that/WDT, tub/NN, of/IN, daffs/NNS, is/VBZ, really/RB, erm/JJ, looking/VBG, good/JJ, isn/NN, 't/PRP, it/PRP, ?/.]",(ROOT (SINV (PP (NP (UH Yeah)) (PP (NP (WDT that) (NN tub)) (IN of) (NP (NNS daffs)))) (VP (VBZ is) (ADVP (RB really)) (ADJP (JJ erm) (S (VP (VBG looking) (S (NP (JJ good) (NN isn)) (NP (PRP 't))))))) (NP (PRP it)) (. ?)))
K/KE/KE2.xml,KE2RE04K,39804,7,,B,4,1,Mm  (()) They look as if they're all planted near the top you know,"[Mm/NN, They/PRP, look/VBP, as/IN, if/IN, they/PRP, 're/VBP, all/DT, planted/VBN, near/IN, the/DT, top/NN, you/PRP, know/VBP]",(ROOT (FRAG (NP (NP (NN Mm)) (SBAR (S (NP (PRP They)) (VP (VBP look) (SBAR (IN as) (S (SBAR (IN if) (S (NP (PRP they)) (VP (VBP 're) (ADVP (DT all)) (VP (VBN planted) (PP (IN near) (NP (DT the) (NN top))))))) (NP (PRP you)) (VP (VBP know))))))))))
K/KE/KE2.xml,KE2RE04K,39804,8,,A,5,1,Yeah.,"[Yeah/UH, ./.]",(ROOT (INTJ (UH Yeah) (. .)))
K/KE/KE2.xml,KE2RE04K,39804,9,,B,6,1,as if you put a whole heap of  --,"[as/IN, if/IN, you/PRP, put/VBP, a/DT, whole/JJ, heap/NN, of/IN, as/IN, you/PRP, say/VBP, th-/IN, the/DT, t-/NN, the/DT, two/CD, of/IN, them/PRP]",(ROOT (SBAR (IN as) (IN if) (S (NP (PRP you)) (VP (VBP put) (NP (NP (DT a) (JJ whole) (NN heap)) (PP (IN of) (SBAR (IN as) (S (NP (PRP you)) (VP (VBP say) (PP (IN th-) (NP (DT the) (NN t-))) (NP (NP (DT the) (CD two)) (PP (IN of) (NP (PRP them)))))))))))))
K/KE/KE2.xml,KE2RE04K,39804,10,,B,6,2,--as you say th- the t- the two of them (()) ,"[as/IN, if/IN, you/PRP, put/VBP, a/DT, whole/JJ, heap/NN, of/IN, as/IN, you/PRP, say/VBP, th-/IN, the/DT, t-/NN, the/DT, two/CD, of/IN, them/PRP]",(ROOT (SBAR (IN as) (IN if) (S (NP (PRP you)) (VP (VBP put) (NP (NP (DT a) (JJ whole) (NN heap)) (PP (IN of) (SBAR (IN as) (S (NP (PRP you)) (VP (VBP say) (PP (IN th-) (NP (DT the) (NN t-))) (NP (NP (DT the) (CD two)) (PP (IN of) (NP (PRP them)))))))))))))
K/KE/KE2.xml,KE2RE04K,39804,11,,A,7,1,Yeah.,"[Yeah/UH, ./.]",(ROOT (INTJ (UH Yeah) (. .)))
K/KE/KE2.xml,KE2RE04K,39804,12,,B,8,1,in the wheelbarrow  (()) ,"[in/IN, the/DT, wheelbarrow/NN]",(ROOT (PP (IN in) (NP (DT the) (NN wheelbarrow))))
K/KE/KE2.xml,KE2RE04K,39804,13,,A,9,1,"Yeah, both out, yeah ","[Yeah/UH, ,/,, both/DT, out/RP, ,/,, yeah/UH]","(ROOT (FRAG (S (VP (UH Yeah) (, ,) (ADVP (DT both) (RP out)) (, ,) (NP (UH yeah))))))"
K/KE/KE2.xml,KE2RE04K,39804,14,,B,10,1,sort of ,"[sort/NN, of/IN]",(ROOT (PP (ADVP (NN sort)) (IN of)))
K/KE/KE2.xml,KE2RE04K,39804,15,,A,11,1,So we just wanna go and park somewhere don't we really?,"[So/IN, we/PRP, just/RB, wanna/NNP, go/VB, and/CC, park/VB, somewhere/RB, don/NNP, 't/PRP, we/PRP, really/RB, ?/.]",(ROOT (FRAG (ADVP (IN So)) (NP (NP (PRP we)) (SBAR (S (NP (RB just) (NNP wanna)) (VP (VP (VB go)) (CC and) (VP (VB park) (S (NP (RB somewhere)) (VP (NNP don) (S (NP (PRP 't)) (NP (PRP we))))) (ADVP (RB really))))))) (. ?)))
K/KE/KE2.xml,KE2RE04K,39804,16,,B,12,1,Well really it's about it  --,"[Well/RB, really/RB, it/PRP, 's/VBZ, about/IN, it/PRP, I/PRP, 'll/MD, have/VB, to/TO, see/VB, if/IN, there/EX, 's/VBZ, a/DT, carrier/NN]",(ROOT (FRAG (ADVP (RB Well)) (SBAR (RB really) (S (NP (PRP it)) (VP (VBZ 's) (PP (IN about) (NP (NP (PRP it)) (SBAR (S (NP (PRP I)) (VP (MD 'll) (VP (VB have) (S (VP (TO to) (VP (VB see) (SBAR (IN if) (S (NP (EX there)) (VP (VBZ 's) (NP (DT a) (NN carrier)))))))))))))))))))
K/KE/KE2.xml,KE2RE04K,39804,17,,B,12,2,--I'll have to see if there's a carrier   --,"[Well/RB, really/RB, it/PRP, 's/VBZ, about/IN, it/PRP, I/PRP, 'll/MD, have/VB, to/TO, see/VB, if/IN, there/EX, 's/VBZ, a/DT, carrier/NN]",(ROOT (FRAG (ADVP (RB Well)) (SBAR (RB really) (S (NP (PRP it)) (VP (VBZ 's) (PP (IN about) (NP (NP (PRP it)) (SBAR (S (NP (PRP I)) (VP (MD 'll) (VP (VB have) (S (VP (TO to) (VP (VB see) (SBAR (IN if) (S (NP (EX there)) (VP (VBZ 's) (NP (DT a) (NN carrier)))))))))))))))))))
K/KE/KE2.xml,KE2RE04K,39804,18,,B,12,3,--(()) ,"[Well/RB, really/RB, it/PRP, 's/VBZ, about/IN, it/PRP, I/PRP, 'll/MD, have/VB, to/TO, see/VB, if/IN, there/EX, 's/VBZ, a/DT, carrier/NN]",(ROOT (FRAG (ADVP (RB Well)) (SBAR (RB really) (S (NP (PRP it)) (VP (VBZ 's) (PP (IN about) (NP (NP (PRP it)) (SBAR (S (NP (PRP I)) (VP (MD 'll) (VP (VB have) (S (VP (TO to) (VP (VB see) (SBAR (IN if) (S (NP (EX there)) (VP (VBZ 's) (NP (DT a) (NN carrier)))))))))))))))))))
K/KE/KE2.xml,KE2RE04K,39804,19,,A,13,1,"I think there is one in the box, yes.","[I/PRP, think/VBP, there/EX, is/VBZ, one/CD, in/IN, the/DT, box/NN, ,/,, yes/UH, ./.]","(ROOT (S (NP (PRP I)) (VP (VBP think) (SBAR (S (NP (EX there)) (VP (VBZ is) (ADJP (CD one) (PP (IN in) (NP (DT the) (NN box)))) (, ,) (INTJ (UH yes)))))) (. .)))"
K/KE/KE2.xml,KE2RE04K,39804,20,,B,14,1,If we put one back in again.,"[If/IN, we/PRP, put/VBD, one/CD, back/RB, in/IN, again/RB, ./.]",(ROOT (FRAG (SBAR (IN If) (S (NP (PRP we)) (VP (VBD put) (NP (CD one)) (ADVP (RB back) (PP (IN in) (ADVP (RB again))))))) (. .)))
K/KE/KE2.xml,KE2RE04K,39804,21,,B,14,2,I haven't got as much room in this one to put the bag.,"[I/PRP, haven/NN, 't/PRP, got/VBD, as/RB, much/JJ, room/NN, in/IN, this/DT, one/CD, to/TO, put/VB, the/DT, bag/NN, ./.]",(ROOT (S (NP (PRP I)) (VP (NN haven) (SBAR (S (NP (PRP 't)) (VP (VBD got) (NP (RB as) (JJ much) (NN room)) (PP (IN in) (NP (DT this) (CD one))) (S (VP (TO to) (VP (VB put) (NP (DT the) (NN bag))))))))) (. .)))
K/KE/KE2.xml,KE2RE04K,39804,22,,A,15,1,Have you not?,"[Have/VB, you/PRP, not/RB, ?/.]",(ROOT (SQ (VP (VB Have) (NP (PRP you)) (ADVP (RB not))) (. ?)))
K/KE/KE2.xml,KE2RE04K,39804,23,,A,15,2,No.,"[No/DT, ./.]",(ROOT (FRAG (NP (DT No)) (. .)))
K/KE/KE2.xml,KE2RE04K,39804,24,,B,16,1,Gosh ,[Gosh/NNP],(ROOT (NP (NNP Gosh)))
K/KE/KE2.xml,KE2RE04K,39804,25,,A,17,1,Mm  --,"[Mm/NN, Oh/UH, the/DT, moor/NN, is/VBZ, visible/JJ, again/RB, ./.]",(ROOT (NP (NP (NN Mm)) (SBAR (S (INTJ (UH Oh)) (NP (DT the) (NN moor)) (VP (VBZ is) (ADJP (JJ visible)) (ADVP (RB again))))) (. .)))
K/KE/KE2.xml,KE2RE04K,39804,26,,A,17,2,--Oh the moor is  <cough> visible again.,"[Mm/NN, Oh/UH, the/DT, moor/NN, is/VBZ, visible/JJ, again/RB, ./.]",(ROOT (NP (NP (NN Mm)) (SBAR (S (INTJ (UH Oh)) (NP (DT the) (NN moor)) (VP (VBZ is) (ADJP (JJ visible)) (ADVP (RB again))))) (. .)))
K/KE/KE2.xml,KE2RE04K,39804,27,,B,18,1,Yeah.,"[Yeah/UH, ./.]",(ROOT (INTJ (UH Yeah) (. .)))
K/KE/KE2.xml,KE2RE04K,39804,28,,B,18,2,Oh well perhaps  --,"[Oh/UH, well/RB, perhaps/RB, the/DT, fog/NN, and/CC, erm/NN, got/VBD, a/DT, appointment/NN, on/IN, the/DT, Saturday/NNP, hasn/NNP, 't/PRP, she/PRP, ?/.]",(ROOT (INTJ (UH Oh) (PP (PP (RB well) (ADVP (RB perhaps))) (SBAR (WHNP (WHNP (DT the)) (NP (NN fog) (CC and) (NN erm))) (S (VP (VBD got) (S (NP (NP (DT a) (NN appointment)) (PP (IN on) (NP (DT the) (NNP Saturday) (NNP hasn)))) (NP (PRP 't)))) (NP (PRP she))))) (. ?)))
K/KE/KE2.xml,KE2RE04K,39804,29,,B,18,3,--the fog and erm   --,"[Oh/UH, well/RB, perhaps/RB, the/DT, fog/NN, and/CC, erm/NN, got/VBD, a/DT, appointment/NN, on/IN, the/DT, Saturday/NNP, hasn/NNP, 't/PRP, she/PRP, ?/.]",(ROOT (INTJ (UH Oh) (PP (PP (RB well) (ADVP (RB perhaps))) (SBAR (WHNP (WHNP (DT the)) (NP (NN fog) (CC and) (NN erm))) (S (VP (VBD got) (S (NP (NP (DT a) (NN appointment)) (PP (IN on) (NP (DT the) (NNP Saturday) (NNP hasn)))) (NP (PRP 't)))) (NP (PRP she))))) (. ?)))
K/KE/KE2.xml,KE2RE04K,39804,30,,B,18,4,--(()) got a appointment on the Saturday hasn't she?,"[Oh/UH, well/RB, perhaps/RB, the/DT, fog/NN, and/CC, erm/NN, got/VBD, a/DT, appointment/NN, on/IN, the/DT, Saturday/NNP, hasn/NNP, 't/PRP, she/PRP, ?/.]",(ROOT (INTJ (UH Oh) (PP (PP (RB well) (ADVP (RB perhaps))) (SBAR (WHNP (WHNP (DT the)) (NP (NN fog) (CC and) (NN erm))) (S (VP (VBD got) (S (NP (NP (DT a) (NN appointment)) (PP (IN on) (NP (DT the) (NNP Saturday) (NNP hasn)))) (NP (PRP 't)))) (NP (PRP she))))) (. ?)))
K/KE/KE2.xml,KE2RE04K,39804,31,,A,19,1,Has she?,"[Has/VBZ, she/PRP, ?/.]",(ROOT (S (VP (VBZ Has) (NP (PRP she))) (. ?)))
K/KE/KE2.xml,KE2RE04K,39804,32,,A,19,2,For hair ,"[For/IN, hair/NN]",(ROOT (PP (IN For) (NP (NN hair))))
K/KE/KE2.xml,KE2RE04K,39804,33,,B,20,1,(()) hair,[hair/NN],(ROOT (NP (NN hair)))
K/KE/KE2.xml,KE2RE04K,39804,34,,A,21,1,Yeah.,"[Yeah/UH, ./.]",(ROOT (INTJ (UH Yeah) (. .)))
K/KE/KE2.xml,KE2RE04K,39804,35,,B,22,1,and erm  --,"[and/CC, erm/NNP, well/RB, perhaps/RB, young/JJ, Bob/NNP, and/CC, Jess/NNP, can/MD, go/VB, on/IN, the/DT, moor/NN, on/IN, Saturday/NNP, ./.]",(ROOT (S (CC and) (NP (NNP erm)) (ADVP (RB well)) (PP (RB perhaps) (ADJP (JJ young))) (NP (NNP Bob) (CC and) (NNP Jess)) (VP (MD can) (VP (VB go) (PP (IN on) (NP (NP (DT the) (NN moor)) (PP (IN on) (NP (NNP Saturday))))))) (. .)))
K/KE/KE2.xml,KE2RE04K,39804,36,,B,22,2,--well perhaps  --,"[and/CC, erm/NNP, well/RB, perhaps/RB, young/JJ, Bob/NNP, and/CC, Jess/NNP, can/MD, go/VB, on/IN, the/DT, moor/NN, on/IN, Saturday/NNP, ./.]",(ROOT (S (CC and) (NP (NNP erm)) (ADVP (RB well)) (PP (RB perhaps) (ADJP (JJ young))) (NP (NNP Bob) (CC and) (NNP Jess)) (VP (MD can) (VP (VB go) (PP (IN on) (NP (NP (DT the) (NN moor)) (PP (IN on) (NP (NNP Saturday))))))) (. .)))
K/KE/KE2.xml,KE2RE04K,39804,37,,B,22,3,--young Bob and Jess can go on the moor on Saturday.,"[and/CC, erm/NNP, well/RB, perhaps/RB, young/JJ, Bob/NNP, and/CC, Jess/NNP, can/MD, go/VB, on/IN, the/DT, moor/NN, on/IN, Saturday/NNP, ./.]",(ROOT (S (CC and) (NP (NNP erm)) (ADVP (RB well)) (PP (RB perhaps) (ADJP (JJ young))) (NP (NNP Bob) (CC and) (NNP Jess)) (VP (MD can) (VP (VB go) (PP (IN on) (NP (NP (DT the) (NN moor)) (PP (IN on) (NP (NNP Saturday))))))) (. .)))
K/KE/KE2.xml,KE2RE04K,39804,38,,A,23,1,Yes ,[Yes/UH],(ROOT (INTJ (UH Yes)))
K/KE/KE2.xml,KE2RE04K,39804,39,,B,24,1,"If it, I mean if it were like today it will be lovely.","[If/IN, it/PRP, ,/,, I/PRP, mean/VBP, if/IN, it/PRP, were/VBD, like/IN, today/NN, it/PRP, will/MD, be/VB, lovely/JJ, ./.]","(ROOT (S (SBAR (IN If) (S (NP (PRP it)))) (, ,) (NP (PRP I)) (VP (VBP mean) (SBAR (IN if) (S (NP (PRP it)) (VP (VBD were) (SBAR (IN like) (S (NP (NN today)) (NP (PRP it)) (VP (MD will) (VP (VB be) (ADJP (JJ lovely)))))))))) (. .)))"
K/KE/KE2.xml,KE2RE04K,39804,40,,A,25,1,Yeah.,"[Yeah/UH, ./.]",(ROOT (INTJ (UH Yeah) (. .)))
K/KE/KE2.xml,KE2RE04K,39804,41,,A,25,2,Yes well I hope we get the opportunity.,"[Yes/RB, well/RB, I/PRP, hope/VBP, we/PRP, get/VB, the/DT, opportunity/NN, ./.]",(ROOT (S (ADVP (RB Yes) (RB well)) (NP (PRP I)) (VP (VBP hope) (S (NP (PRP we)) (VP (VB get) (NP (DT the) (NN opportunity))))) (. .)))
K/KE/KE2.xml,KE2RE04K,39804,42,,B,26,1,Yeah.,"[Yeah/UH, ./.]",(ROOT (INTJ (UH Yeah) (. .)))
K/KE/KE2.xml,KE2RE04K,39804,43,,A,27,1,Gosh that car looks a bit rusty doesn't it?,"[Gosh/NNP, that/WDT, car/NN, looks/VBZ, a/DT, bit/NN, rusty/JJ, doesn/NN, 't/PRP, it/PRP, ?/.]",(ROOT (FRAG (NP (NP (NNP Gosh)) (SBAR (WHNP (WDT that) (NN car)) (S (VP (VBZ looks) (S (NP (NP (DT a) (NN bit) (JJ rusty) (NN doesn)) (NP (PRP 't))) (NP (PRP it))))))) (. ?)))
K/KE/KE2.xml,KE2RE04K,39804,44,,A,27,2,That's a Fiat of course you see.,"[That/DT, 's/VBZ, a/DT, Fiat/NNP, of/IN, course/NN, you/PRP, see/VBP, ./.]",(ROOT (S (NP (DT That)) (VP (VBZ 's) (NP (NP (DT a) (NNP Fiat)) (PP (IN of) (NP (NN course))) (SBAR (S (NP (PRP you)) (VP (VBP see)))))) (. .)))
K/KE/KE2.xml,KE2RE04K,39804,45,,B,28,1,"Oh yes, yeah","[Oh/UH, yes/UH, ,/,, yeah/UH]","(ROOT (INTJ (INTJ (UH Oh) (UH yes)) (, ,) (INTJ (UH yeah))))"
K/KE/KE2.xml,KE2RE04K,39804,46,,A,29,1,"It's like Richard's old car, you remember that, Fiat?","[It/PRP, 's/VBZ, like/IN, Richard/NNP, 's/POS, old/JJ, car/NN, ,/,, you/PRP, remember/VBP, that/IN, ,/,, Fiat/NNP, ?/.]","(ROOT (S (S (NP (PRP It)) (VP (VBZ 's) (PP (IN like) (NP (NP (NNP Richard) (POS 's)) (JJ old) (NN car))))) (, ,) (NP (PRP you)) (VP (VBP remember) (ADVP (IN that)) (, ,) (S (ADJP (NNP Fiat)))) (. ?)))"
K/KE/KE2.xml,KE2RE04K,39804,47,,B,30,1,(()) Fiat one two seven like that one is.,"[Fiat/NNP, one/CD, two/CD, seven/CD, like/IN, that/DT, one/CD, is/VBZ, ./.]",(ROOT (S (NP (NP (NNP Fiat) (CD one)) (PP (NP (QP (CD two) (CD seven))) (IN like) (NP (DT that) (CD one)))) (VP (VBZ is)) (. .)))
K/KE/KE2.xml,KE2RE04K,39804,48,,A,31,1,Yeah that's right.,"[Yeah/UH, that/DT, 's/VBZ, right/NN, ./.]",(ROOT (S (S (INTJ (UH Yeah)) (NP (DT that)) (VP (VBZ 's) (NP (NN right)))) (. .)))
K/KE/KE2.xml,KE2RE04K,39804,49,,A,31,2,--,"[Oh/UH, no/DT, he/PRP, 's/VBZ, coming/VBG, off/RP, on/IN, ,/,, off/IN, the/DT, lorry/NN, so/IN, that/DT, 's/VBZ, no/DT, good/JJ, ./.]","(ROOT (S (S (INTJ (UH Oh)) (NP (DT no) (PRP he)) (VP (VBZ 's) (VP (VBG coming) (PRT (RP off)) (PP (IN on)) (, ,) (PP (IN off) (NP (DT the) (NN lorry)))))) (IN so) (S (NP (DT that)) (VP (VBZ 's) (ADJP (DT no) (JJ good)))) (. .)))"
K/KE/KE2.xml,KE2RE04K,39804,50,,A,31,3,--<laugh> --,"[Oh/UH, no/DT, he/PRP, 's/VBZ, coming/VBG, off/RP, on/IN, ,/,, off/IN, the/DT, lorry/NN, so/IN, that/DT, 's/VBZ, no/DT, good/JJ, ./.]","(ROOT (S (S (INTJ (UH Oh)) (NP (DT no) (PRP he)) (VP (VBZ 's) (VP (VBG coming) (PRT (RP off)) (PP (IN on)) (, ,) (PP (IN off) (NP (DT the) (NN lorry)))))) (IN so) (S (NP (DT that)) (VP (VBZ 's) (ADJP (DT no) (JJ good)))) (. .)))"
K/KE/KE2.xml,KE2RE04K,39804,51,,A,31,4,"--Oh no he's coming off on, off the lorry so that's no good.","[Oh/UH, no/DT, he/PRP, 's/VBZ, coming/VBG, off/RP, on/IN, ,/,, off/IN, the/DT, lorry/NN, so/IN, that/DT, 's/VBZ, no/DT, good/JJ, ./.]","(ROOT (S (S (INTJ (UH Oh)) (NP (DT no) (PRP he)) (VP (VBZ 's) (VP (VBG coming) (PRT (RP off)) (PP (IN on)) (, ,) (PP (IN off) (NP (DT the) (NN lorry)))))) (IN so) (S (NP (DT that)) (VP (VBZ 's) (ADJP (DT no) (JJ good)))) (. .)))"
K/KE/KE2.xml,KE2RE04K,39804,52,,B,32,1,Well it would be a bit tight to get in I feel.,"[Well/RB, it/PRP, would/MD, be/VB, a/DT, bit/NN, tight/JJ, to/TO, get/VB, in/IN, I/PRP, feel/VBP, ./.]",(ROOT (S (ADVP (RB Well)) (NP (PRP it)) (VP (MD would) (VP (VB be) (ADJP (NP (DT a) (NN bit)) (JJ tight)) (S (VP (TO to) (VP (VB get) (SBAR (IN in) (S (NP (PRP I)) (VP (VBP feel))))))))) (. .)))
K/KE/KE2.xml,KE2RE04K,39804,53,,A,33,1,There's nowhere up there is there?,"[There/EX, 's/VBZ, nowhere/RB, up/RB, there/EX, is/VBZ, there/EX, ?/.]",(ROOT (S (NP (EX There)) (VP (VBZ 's) (ADVP (RB nowhere) (RB up) (SBAR (S (NP (EX there)) (VP (VBZ is) (NP (EX there))))))) (. ?)))
K/KE/KE2.xml,KE2RE04K,39804,54,,A,33,2,No she's just got in ,"[No/DT, she/PRP, 's/VBZ, just/RB, got/VBN, in/IN]",(ROOT (S (NP (DT No) (PRP she)) (VP (VBZ 's) (ADVP (RB just)) (VP (VBN got) (PP (IN in))))))
K/KE/KE2.xml,KE2RE04K,39804,55,,B,34,1,It's very difficult to get in ,"[It/PRP, 's/VBZ, very/RB, difficult/JJ, to/TO, get/VB, in/IN]",(ROOT (S (NP (PRP It)) (VP (VBZ 's) (ADJP (RB very) (JJ difficult)) (S (VP (TO to) (VP (VB get) (PP (IN in))))))))
K/KE/KE2.xml,KE2RE04K,39804,56,,A,35,1,Yeah.,"[Yeah/UH, ./.]",(ROOT (INTJ (UH Yeah) (. .)))
K/KE/KE2.xml,KE2RE04K,39804,57,,A,35,2,"Well we will just hope for the best, he's not going up there so that's one less.","[Well/RB, we/PRP, will/MD, just/RB, hope/VB, for/IN, the/DT, best/JJS, ,/,, he/PRP, 's/VBZ, not/RB, going/VBG, up/RB, there/RB, so/IN, that/DT, 's/VBZ, one/CD, less/JJR, ./.]","(ROOT (S (S (INTJ (RB Well)) (NP (PRP we)) (VP (MD will) (ADVP (RB just)) (VP (VB hope) (PP (IN for) (NP (DT the) (JJS best)))))) (, ,) (NP (PRP he)) (VP (VBZ 's) (RB not) (VP (VBG going) (ADVP (ADVP (RB up) (RB there)) (SBAR (IN so) (S (NP (DT that)) (VP (VBZ 's) (ADJP (NP (CD one)) (JJR less)))))))) (. .)))"
K/KE/KE2.xml,KE2RE04K,39804,58,,B,36,1,(()) wondered if  (()) ,"[wondered/VBN, if/IN]",(ROOT (VP (VBN wondered) (S (ADJP (IN if)))))
K/KE/KE2.xml,KE2RE04K,39804,59,,A,37,1,Yes I did too.,"[Yes/UH, I/PRP, did/VBD, too/RB, ./.]",(ROOT (S (S (INTJ (UH Yes)) (NP (PRP I)) (VP (VBD did) (ADVP (RB too)))) (. .)))
K/KE/KE2.xml,KE2RE04K,39804,60,,B,38,1,"Oh look, we've just got one there.","[Oh/UH, look/VB, ,/,, we/PRP, 've/VBP, just/RB, got/VBN, one/CD, there/RB, ./.]","(ROOT (S (INTJ (UH Oh)) (VP (VB look) (, ,) (S (NP (PRP we)) (VP (VBP 've) (ADVP (RB just)) (VP (VBN got) (NP (CD one)) (ADVP (RB there)))))) (. .)))"
K/KE/KE2.xml,KE2RE04K,39804,61,,A,39,1,Oh yes.,"[Oh/UH, yes/UH, ./.]",(ROOT (FRAG (UH Oh) (INTJ (UH yes)) (. .)))
K/KE/KE2.xml,KE2RE04K,39804,62,,A,39,2,Great.,"[Great/NNP, ./.]",(ROOT (FRAG (NP (NNP Great)) (. .)))
K/KE/KE2.xml,KE2RE04K,39804,63,,B,40,1,Oh look it's one of these that's nice because  <laughing> you can just sort of nothing can come in behind you and  --,"[Oh/UH, look/VB, it/PRP, 's/VBZ, one/CD, of/IN, these/DT, that/WDT, 's/VBZ, nice/JJ, because/IN, you/PRP, can/MD, just/RB, sort/VB, of/IN, nothing/NN, can/MD, come/VB, in/IN, behind/IN, you/PRP, and/CC, that/IN, sort/NN, of/IN, thing/NN, ./.]",(ROOT (S (INTJ (UH Oh)) (VP (VB look) (SBAR (S (NP (PRP it)) (VP (VBZ 's) (NP (NP (CD one)) (PP (IN of) (NP (NP (DT these)) (SBAR (WHNP (WDT that)) (S (VP (VBZ 's) (ADJP (JJ nice)) (SBAR (IN because) (S (NP (PRP you)) (VP (MD can) (ADVP (RB just)) (VP (VB sort) (PP (IN of) (NP (NP (NN nothing)) (SBAR (S (VP (MD can) (VP (VB come) (PP (IN in) (UCP (PP (IN behind) (NP (PRP you))) (CC and) (SBAR (IN that) (S (VP (NN sort) (PP (IN of) (NP (NN thing)))))))))))))))))))))))))))) (. .)))
K/KE/KE2.xml,KE2RE04K,39804,64,,B,40,2,--that sort of thing.,"[Oh/UH, look/VB, it/PRP, 's/VBZ, one/CD, of/IN, these/DT, that/WDT, 's/VBZ, nice/JJ, because/IN, you/PRP, can/MD, just/RB, sort/VB, of/IN, nothing/NN, can/MD, come/VB, in/IN, behind/IN, you/PRP, and/CC, that/IN, sort/NN, of/IN, thing/NN, ./.]",(ROOT (S (INTJ (UH Oh)) (VP (VB look) (SBAR (S (NP (PRP it)) (VP (VBZ 's) (NP (NP (CD one)) (PP (IN of) (NP (NP (DT these)) (SBAR (WHNP (WDT that)) (S (VP (VBZ 's) (ADJP (JJ nice)) (SBAR (IN because) (S (NP (PRP you)) (VP (MD can) (ADVP (RB just)) (VP (VB sort) (PP (IN of) (NP (NP (NN nothing)) (SBAR (S (VP (MD can) (VP (VB come) (PP (IN in) (UCP (PP (IN behind) (NP (PRP you))) (CC and) (SBAR (IN that) (S (VP (NN sort) (PP (IN of) (NP (NN thing)))))))))))))))))))))))))))) (. .)))
K/KE/KE2.xml,KE2RE04K,39804,65,,A,41,1,"Mind the disabled person just coming past you here, that's it.","[Mind/VB, the/DT, disabled/JJ, person/NN, just/RB, coming/VBG, past/IN, you/PRP, here/RB, ,/,, that/DT, 's/VBZ, it/PRP, ./.]","(ROOT (S (S (VP (VB Mind) (NP (NP (DT the) (JJ disabled) (NN person)) (VP (ADVP (RB just)) (VBG coming) (PP (IN past) (NP (PRP you))) (ADVP (RB here)))))) (, ,) (NP (DT that)) (VP (VBZ 's) (NP (PRP it))) (. .)))"
K/KE/KE2.xml,KE2RE04K,39804,66,,A,41,2,"Good, right, so I will do what I've got to do, you will do what you've got to do ","[Good/JJ, ,/,, right/JJ, ,/,, so/IN, I/PRP, will/MD, do/VB, what/WP, I/PRP, 've/VBP, got/VBN, to/TO, do/VB, ,/,, you/PRP, will/MD, do/VB, what/WP, you/PRP, 've/VBP, got/VBN, to/TO, do/VB]","(ROOT (FRAG (WHNP (WHNP (JJ Good)) (PRN (, ,) (INTJ (JJ right)) (, ,))) (SBAR (IN so) (S (NP (PRP I)) (VP (MD will) (VP (VB do) (S (SBAR (WHNP (WP what)) (S (NP (PRP I)) (VP (VBP 've) (VP (VBN got) (S (VP (TO to) (VP (VB do)))))))) (, ,) (NP (PRP you)) (VP (MD will) (VP (VB do) (SBAR (WHNP (WP what)) (S (NP (PRP you)) (VP (VBP 've) (VP (VBN got) (S (VP (TO to) (VP (VB do)))))))))))))))))"
K/KE/KE2.xml,KE2RE04K,39804,67,,B,42,1,"This is all mucky at the back, what happened to it?","[This/DT, is/VBZ, all/DT, mucky/JJ, at/IN, the/DT, back/NN, ,/,, what/WP, happened/VBD, to/TO, it/PRP, ?/.]","(ROOT (SBARQ (S (NP (DT This)) (VP (VBZ is) (ADJP (DT all) (JJ mucky) (PP (IN at) (NP (DT the) (NN back)))))) (, ,) (WHNP (WP what)) (SQ (VP (VBD happened) (PP (TO to) (NP (PRP it))))) (. ?)))"
K/KE/KE2.xml,KE2RE04K,39804,68,,A,43,1,You got a bag there?,"[You/PRP, got/VBD, a/DT, bag/NN, there/EX, ?/.]",(ROOT (S (NP (PRP You)) (VP (VBD got) (S (NP (DT a) (NN bag)) (NP (EX there)))) (. ?)))
K/KE/KE2.xml,KE2RE04K,39804,69,,A,43,2,(()) Oh.,"[Oh/UH, ./.]",(ROOT (INTJ (UH Oh) (. .)))
K/KE/KE2.xml,KE2RE04K,39804,70,,B,44,1,Oh that will be alright,"[Oh/UH, that/WDT, will/MD, be/VB, alright/JJ]",(ROOT (FRAG (ADVP (UH Oh)) (SBAR (WHNP (WDT that)) (S (VP (MD will) (VP (VB be) (ADJP (JJ alright))))))))
K/KE/KE2.xml,KE2RE04K,39804,71,,A,45,1,Yes.,"[Yes/UH, ./.]",(ROOT (INTJ (UH Yes) (. .)))
K/KE/KE2.xml,KE2RE04K,39804,72,,B,46,1,(()) very strong.,"[very/RB, strong/JJ, ./.]",(ROOT (FRAG (ADJP (RB very) (JJ strong)) (. .)))
K/KE/KE2.xml,KE2RE04K,39804,73,,A,47,1,"Well it's probably stronger than that one, still.","[Well/RB, it/PRP, 's/VBZ, probably/RB, stronger/JJR, than/IN, that/DT, one/CD, ,/,, still/RB, ./.]","(ROOT (S (ADVP (RB Well)) (NP (PRP it)) (VP (VBZ 's) (ADVP (RB probably)) (ADJP (ADJP (JJR stronger)) (PP (IN than) (NP (DT that) (CD one)))) (, ,) (ADVP (RB still))) (. .)))"
K/KE/KE2.xml,KE2RE04K,39804,74,,B,48,1,"Mm, that's the  (()) one, no, leave that one.","[Mm/NN, ,/,, that/DT, 's/VBZ, the/DT, one/CD, ,/,, no/DT, ,/,, leave/VBP, that/IN, one/CD, ./.]","(ROOT (S (NP (NP (NN Mm)) (, ,) (SBAR (WHNP (DT that)) (S (VP (VBZ 's) (NP (NP (DT the) (CD one)) (, ,) (NP (DT no)))))) (, ,)) (VP (VBP leave) (ADVP (IN that) (NP (CD one)))) (. .)))"
K/KE/KE2.xml,KE2RE04K,39804,75,,A,49,1,Erm ,[Erm/NN],(ROOT (NP (NN Erm)))
K/KE/KE2.xml,KE2RE04K,39804,76,,B,50,1,This one will be alright.--,"[This/DT, one/CD, will/MD, be/VB, alright/JJ, ./.]",(ROOT (S (NP (DT This) (CD one)) (VP (MD will) (VP (VB be) (ADJP (JJ alright)))) (. .)))
K/KE/KE2.xml,KE2RE04K,39804,77,,B,50,2,--(()) ,"[This/DT, one/CD, will/MD, be/VB, alright/JJ, ./.]",(ROOT (S (NP (DT This) (CD one)) (VP (MD will) (VP (VB be) (ADJP (JJ alright)))) (. .)))
K/KE/KE2.xml,KE2RE04K,39804,78,,A,51,1,(()) stay here now.,"[stay/VB, here/RB, now/RB, ./.]",(ROOT (S (VP (VB stay) (ADVP (RB here) (RB now))) (. .)))
K/KE/KE2.xml,KE2RE04K,39804,79,,B,52,1,(()) wasn't there anyway.,"[wasn/NNP, 't/PRP, there/EX, anyway/RB, ./.]",(ROOT (NP (NP (NNP wasn)) (NP (NP (PRP 't)) (NP (NP (EX there)) (ADVP (RB anyway)))) (. .)))
K/KE/KE2.xml,KE2RE04K,39804,80,,B,52,2,"I thought it was sort of a er you know, by the  (()) ","[I/PRP, thought/VBD, it/PRP, was/VBD, sort/NN, of/IN, a/DT, er/NN, you/PRP, know/VBP, ,/,, by/IN, the/DT]","(ROOT (S (NP (PRP I)) (VP (VBD thought) (SBAR (S (NP (PRP it)) (VP (VBD was) (NP (NP (NN sort)) (PP (IN of) (NP (NP (DT a) (NN er)) (SBAR (S (NP (PRP you)) (VP (VBP know))))))) (, ,) (PP (IN by) (NP (DT the)))))))))"
K/KE/KE2.xml,KE2RE04K,39804,81,,A,53,1,<cough> ,[],X
K/KE/KE2.xml,KE2RE04K,39804,82,,B,54,1,so  --,"[so/IN, I/PRP, was/VBD, wrong/JJ]",(ROOT (SBAR (IN so) (S (NP (PRP I)) (VP (VBD was) (ADJP (JJ wrong))))))
K/KE/KE2.xml,KE2RE04K,39804,83,,B,54,2,--I was wrong  (()) ,"[so/IN, I/PRP, was/VBD, wrong/JJ]",(ROOT (SBAR (IN so) (S (NP (PRP I)) (VP (VBD was) (ADJP (JJ wrong))))))
K/KE/KE2.xml,KE2RE04K,39804,84,,A,55,1,Yes.,"[Yes/UH, ./.]",(ROOT (INTJ (UH Yes) (. .)))
K/KE/KE2.xml,KE2RE04K,39804,85,,A,55,2,"Cos the other thing I was gonna do was to go into Lloyds, I must do that some time about this interest on that account  --","[Cos/NNP, the/DT, other/JJ, thing/NN, I/PRP, was/VBD, gonna/NNP, do/VB, was/VBD, to/TO, go/VB, into/IN, Lloyds/NNP, ,/,, I/PRP, must/MD, do/VB, that/DT, some/DT, time/NN, about/IN, this/DT, interest/NN, on/IN, that/DT, account/NN, cos/NN, I/PRP, reckon/VBP, it/PRP, 's/VBZ, very/RB, low/JJ]","(ROOT (NP (NP (NP (NNP Cos)) (SBAR (S (S (NP (NP (DT the) (JJ other) (NN thing)) (SBAR (S (NP (PRP I)) (VP (VBD was) (S (NP (NNP gonna)) (VP (VB do))))))) (VP (VBD was) (S (VP (TO to) (VP (VB go) (PP (IN into) (NP (NNP Lloyds)))))))) (, ,) (S (NP (PRP I)) (VP (MD must) (VP (VB do) (NP (DT that)) (NP (DT some) (NN time)) (PP (IN about) (NP (DT this) (NN interest))))))))) (PP (IN on) (NP (NP (DT that) (NN account) (NN cos)) (SBAR (S (NP (PRP I)) (VP (VBP reckon) (SBAR (S (NP (PRP it)) (VP (VBZ 's) (ADJP (RB very) (JJ low))))))))))))"
