swda_filename,ptb_basename,conversation_no,transcript_index,act_tag,caller,turn_index,subutterance_index,text,pos,trees
K/KS/KSV.xml,KSVRE00J,43405,0,,A,1,1,Ah!,"[Ah/NN, !/.]",(ROOT (INTJ (NN Ah) (. !)))
K/KS/KSV.xml,KSVRE00J,43405,1,,A,1,2,I saw what's his name today by the way.,"[I/PRP, saw/VBD, what/WP, 's/VBZ, his/PRP$, name/NN, today/NN, by/IN, the/DT, way/NN, ./.]",(ROOT (S (NP (PRP I)) (VP (VBD saw) (SBAR (WHNP (WP what)) (S (VP (VBZ 's) (NP (PRP$ his) (NN name) (NN today)) (PP (IN by) (NP (DT the) (NN way))))))) (. .)))
K/KS/KSV.xml,KSVRE00J,43405,2,,A,1,3,<<REDACTED (name)>> . And  <<REDACTED (name)>> clobbered me again!,"[>/JJR, ./., And/CC, >/JJR, clobbered/VBD, me/PRP, again/RB, !/.]",(ROOT (FRAG (ADJP (JJR >) (. .)) (S (CC And) (NP (JJR >)) (VP (VBD clobbered) (NP (PRP me)) (ADVP (RB again)))) (. !)))
K/KS/KSV.xml,KSVRE00J,43405,3,,A,1,4,Wanted to know if you'd said anything.,"[Wanted/VBN, to/TO, know/VB, if/IN, you/PRP, 'd/MD, said/VBD, anything/NN, ./.]",(ROOT (S (S (VP (VBN Wanted) (S (VP (TO to) (VP (VB know) (SBAR (IN if) (S (NP (PRP you)) (VP (MD 'd))))))))) (VP (VBD said) (NP (NN anything))) (. .)))
K/KS/KSV.xml,KSVRE00J,43405,4,,A,1,5,Mum?,"[Mum/NN, ?/.]",(ROOT (FRAG (NP (NN Mum)) (. ?)))
K/KS/KSV.xml,KSVRE00J,43405,5,,B,2,1,I said anything?,"[I/PRP, said/VBD, anything/NN, ?/.]",(ROOT (S (NP (PRP I)) (VP (VBD said) (NP (NN anything))) (. ?)))
K/KS/KSV.xml,KSVRE00J,43405,6,,A,3,1,"I mean, if I said anything to you.","[I/PRP, mean/VBP, ,/,, if/IN, I/PRP, said/VBD, anything/NN, to/TO, you/PRP, ./.]","(ROOT (S (NP (PRP I)) (VP (VP (VBP mean)) (, ,) (SBAR (IN if) (S (NP (PRP I)) (VP (VBD said) (NP (NN anything)) (PP (TO to) (NP (PRP you))))))) (. .)))"
K/KS/KSV.xml,KSVRE00J,43405,7,,B,4,1,About what?,"[About/IN, what/WP, ?/.]",(ROOT (FRAG (PP (IN About) (WHNP (WP what))) (. ?)))
K/KS/KSV.xml,KSVRE00J,43405,8,,A,5,1,"Me- me- me- mention yo- , something in the newsletter.","[Me-/NN, me-/NN, me-/NN, mention/NN, yo-/NN, ,/,, something/NN, in/IN, the/DT, newsletter/NN, ./.]","(ROOT (NP (NP (NN Me-) (NN me-) (NN me-) (NN mention) (NN yo-)) (, ,) (NP (NP (NN something)) (PP (IN in) (NP (DT the) (NN newsletter)))) (. .)))"
K/KS/KSV.xml,KSVRE00J,43405,9,,A,5,2,Wa- wondered if you  --,"[Wa-/NN, wondered/VBD, if/IN, you/PRP, were/VBD, gonna/NN, do/VBP, anything/NN, ./.]",(ROOT (S (NP (NN Wa-)) (VP (VBD wondered) (SBAR (IN if) (S (NP (PRP you)) (VP (VBD were) (NP (NP (NN gonna)) (SBAR (S (VP (VBP do) (NP (NN anything)))))))))) (. .)))
K/KS/KSV.xml,KSVRE00J,43405,10,,A,5,3,--were gonna do anything.,"[Wa-/NN, wondered/VBD, if/IN, you/PRP, were/VBD, gonna/NN, do/VBP, anything/NN, ./.]",(ROOT (S (NP (NN Wa-)) (VP (VBD wondered) (SBAR (IN if) (S (NP (PRP you)) (VP (VBD were) (NP (NP (NN gonna)) (SBAR (S (VP (VBP do) (NP (NN anything)))))))))) (. .)))
K/KS/KSV.xml,KSVRE00J,43405,11,,A,5,4,"So, I said no, I'd mentioned it to you and talked about it.","[So/RB, ,/,, I/PRP, said/VBD, no/UH, ,/,, I/PRP, 'd/MD, mentioned/VBN, it/PRP, to/TO, you/PRP, and/CC, talked/VBD, about/IN, it/PRP, ./.]","(ROOT (S (ADVP (RB So)) (, ,) (NP (PRP I)) (VP (VP (VBD said) (S (INTJ (UH no)) (, ,) (NP (PRP I)) (VP (MD 'd) (VP (VBN mentioned) (NP (PRP it)) (PP (TO to) (NP (PRP you))))))) (CC and) (VP (VBD talked) (PP (IN about) (NP (PRP it))))) (. .)))"
K/KS/KSV.xml,KSVRE00J,43405,12,,A,5,5,I think he must think we're complete idiots or something!,"[I/PRP, think/VBP, he/PRP, must/MD, think/VB, we/PRP, 're/VBP, complete/JJ, idiots/NNS, or/CC, something/NN, !/.]",(ROOT (S (NP (PRP I)) (VP (VBP think) (SBAR (S (NP (PRP he)) (VP (MD must) (VP (VB think) (SBAR (S (NP (PRP we)) (VP (VBP 're) (NP (NP (JJ complete) (NNS idiots)) (CC or) (NP (NN something))))))))))) (. !)))
K/KS/KSV.xml,KSVRE00J,43405,13,,A,5,6,"I've got a temperature, by the way.","[I/PRP, 've/VBP, got/VBD, a/DT, temperature/NN, ,/,, by/IN, the/DT, way/NN, ./.]","(ROOT (S (NP (PRP I)) (VP (VBP 've) (VP (VBD got) (NP (DT a) (NN temperature)) (, ,) (PP (IN by) (NP (DT the) (NN way))))) (. .)))"
K/KS/KSV.xml,KSVRE00J,43405,14,,A,5,7,Mum?,"[Mum/NN, ?/.]",(ROOT (FRAG (NP (NN Mum)) (. ?)))
K/KS/KSV.xml,KSVRE00J,43405,15,,A,5,8,"Are you going to sit there and read the paper, or do nothing?","[Are/VBP, you/PRP, going/VBG, to/TO, sit/VB, there/RB, and/CC, read/VB, the/DT, paper/NN, ,/,, or/CC, do/VBP, nothing/NN, ?/.]","(ROOT (SQ (VBP Are) (NP (PRP you)) (VP (VBG going) (S (VP (TO to) (VP (VP (VB sit) (ADVP (RB there))) (CC and) (VP (VP (VB read) (NP (DT the) (NN paper))) (, ,) (CC or) (VP (VBP do) (NP (NN nothing)))))))) (. ?)))"
K/KS/KSV.xml,KSVRE00J,43405,16,,B,6,1,I'm reading the paper!,"[I/PRP, 'm/VBP, reading/VBG, the/DT, paper/NN, !/.]",(ROOT (S (NP (PRP I)) (VP (VBP 'm) (VP (VBG reading) (NP (DT the) (NN paper)))) (. !)))
K/KS/KSV.xml,KSVRE00J,43405,17,,B,6,2,I wanted my cup of tea and I'm tired!,"[I/PRP, wanted/VBD, my/PRP$, cup/NN, of/IN, tea/NN, and/CC, I/PRP, 'm/VBP, tired/JJ, !/.]",(ROOT (S (S (NP (PRP I)) (VP (VBD wanted) (NP (NP (PRP$ my) (NN cup)) (PP (IN of) (NP (NN tea)))))) (CC and) (S (NP (PRP I)) (VP (VBP 'm) (ADJP (JJ tired)))) (. !)))
K/KS/KSV.xml,KSVRE00J,43405,18,,A,7,1,"Well you gonna, oh I've gotta bring a cup of tea in for you, have I now?","[Well/RB, you/PRP, gonna/NNP, ,/,, oh/UH, I/PRP, 've/VBP, gotta/NNP, bring/VB, a/DT, cup/NN, of/IN, tea/NN, in/IN, for/IN, you/PRP, ,/,, have/VBP, I/PRP, now/RB, ?/.]","(ROOT (FRAG (ADVP (RB Well)) (NP (NP (PRP you)) (SBAR (S (NP (NP (NNP gonna)) (, ,) (SBAR (S (INTJ (UH oh)) (NP (PRP I)) (VP (VBP 've) (S (NP (NNP gotta)) (VP (VB bring) (NP (NP (DT a) (NN cup)) (PP (IN of) (NP (NN tea)))) (PP (IN in) (PP (IN for) (NP (PRP you))))))))) (, ,)) (VP (VBP have) (NP (PRP I)) (NP (RB now)))))) (. ?)))"
K/KS/KSV.xml,KSVRE00J,43405,19,,B,8,1,Yeah.,"[Yeah/UH, ./.]",(ROOT (INTJ (UH Yeah) (. .)))
K/KS/KSV.xml,KSVRE00J,43405,20,,A,9,1,Oh right!,"[Oh/UH, right/RB, !/.]",(ROOT (S (VP (NP (INTJ (UH Oh)) (NP (RB right)))) (. !)))
K/KS/KSV.xml,KSVRE00J,43405,21,,A,9,2,I'll get up and get the damn thing shall I?,"[I/PRP, 'll/MD, get/VB, up/RB, and/CC, get/VB, the/DT, damn/JJ, thing/NN, shall/MD, I/PRP, ?/.]",(ROOT (SINV (S (NP (PRP I)) (VP (MD 'll) (VP (VP (VB get) (ADVP (RB up))) (CC and) (VP (VB get) (NP (DT the) (JJ damn) (NN thing)))))) (VP (MD shall)) (NP (PRP I)) (. ?)))
K/KS/KSV.xml,KSVRE00J,43405,22,,A,9,3,Do you want me to do anything else while I'm up  --,"[Do/VB, you/PRP, want/VB, me/PRP, to/TO, do/VB, anything/NN, else/RB, while/IN, I/PRP, 'm/VBP, up/RP, up/RB, and/CC, about/RB, ?/.]",(ROOT (SQ (VP (VB Do) (S (NP (PRP you)) (VP (VB want) (S (NP (PRP me)) (VP (TO to) (VP (VB do) (S (NP (NN anything)) (ADJP (RB else)) (SBAR (IN while) (S (NP (PRP I)) (VP (VBP 'm) (ADVP (RP up)) (ADVP (RB up) (CC and) (RB about)))))))))))) (. ?)))
K/KS/KSV.xml,KSVRE00J,43405,23,,A,9,4,--up and about?,"[Do/VB, you/PRP, want/VB, me/PRP, to/TO, do/VB, anything/NN, else/RB, while/IN, I/PRP, 'm/VBP, up/RP, up/RB, and/CC, about/RB, ?/.]",(ROOT (SQ (VP (VB Do) (S (NP (PRP you)) (VP (VB want) (S (NP (PRP me)) (VP (TO to) (VP (VB do) (S (NP (NN anything)) (ADJP (RB else)) (SBAR (IN while) (S (NP (PRP I)) (VP (VBP 'm) (ADVP (RP up)) (ADVP (RB up) (CC and) (RB about)))))))))))) (. ?)))
K/KS/KSV.xml,KSVRE00J,43405,24,,A,9,5,There we go!,"[There/EX, we/PRP, go/VBP, !/.]",(ROOT (S (NP (EX There)) (NP (PRP we)) (VP (VBP go)) (. !)))
K/KS/KSV.xml,KSVRE00J,43405,25,,A,9,6,Anything else you'd like while I'm up?,"[Anything/NN, else/RB, you/PRP, 'd/MD, like/VB, while/IN, I/PRP, 'm/VBP, up/RP, ?/.]",(ROOT (FRAG (NP (NP (NN Anything) (RB else)) (SBAR (S (NP (PRP you)) (VP (MD 'd) (VP (VB like) (SBAR (IN while) (S (NP (PRP I)) (VP (VBP 'm) (ADVP (RP up)))))))))) (. ?)))
K/KS/KSV.xml,KSVRE00J,43405,26,,A,9,7,"Scratch your back, or get the paper, or the get the post in, or  --","[Scratch/VB, your/PRP$, back/NN, ,/,, or/CC, get/VB, the/DT, paper/NN, ,/,, or/CC, the/DT, get/VB, the/DT, post/NN, in/IN, ,/,, or/CC, take/VB, the/DT, dog/NN, for/IN, a/DT, walk/NN, or/CC, then/RB, ,/,, shall/MD, I/PRP, ?/.]","(ROOT (SINV (S (VP (VP (VB Scratch) (NP (PRP$ your) (NN back))) (, ,) (CC or) (VP (VP (VB get) (NP (DT the) (NN paper))) (, ,) (CC or) (ADVP (DT the)) (VP (VB get) (NP (DT the) (NN post)) (PP (IN in))) (, ,) (CC or) (VP (VB take) (NP (DT the) (NN dog)) (PP (IN for) (NP (NP (DT a) (NN walk)) (CC or) (NP (RB then)))))))) (, ,) (VP (MD shall)) (NP (PRP I)) (. ?)))"
K/KS/KSV.xml,KSVRE00J,43405,27,,A,9,8,"--take the dog for a walk or then, shall I?","[Scratch/VB, your/PRP$, back/NN, ,/,, or/CC, get/VB, the/DT, paper/NN, ,/,, or/CC, the/DT, get/VB, the/DT, post/NN, in/IN, ,/,, or/CC, take/VB, the/DT, dog/NN, for/IN, a/DT, walk/NN, or/CC, then/RB, ,/,, shall/MD, I/PRP, ?/.]","(ROOT (SINV (S (VP (VP (VB Scratch) (NP (PRP$ your) (NN back))) (, ,) (CC or) (VP (VP (VB get) (NP (DT the) (NN paper))) (, ,) (CC or) (ADVP (DT the)) (VP (VB get) (NP (DT the) (NN post)) (PP (IN in))) (, ,) (CC or) (VP (VB take) (NP (DT the) (NN dog)) (PP (IN for) (NP (NP (DT a) (NN walk)) (CC or) (NP (RB then)))))))) (, ,) (VP (MD shall)) (NP (PRP I)) (. ?)))"
K/KS/KSV.xml,KSVRE00J,43405,28,,B,10,1,"Richard, on the odd occasion you something for me Richard  --","[Richard/NNP, ,/,, on/IN, the/DT, odd/JJ, occasion/NN, you/PRP, something/NN, for/IN, me/PRP, Richard/NNP, I/NNP, ought/MD, to/TO, be/VB, a/DT, lot/NN, for/IN, you/PRP, !/.]","(ROOT (S (NP (NNP Richard)) (, ,) (PP (IN on) (NP (DT the) (JJ odd) (NN occasion) (PRP you))) (NP (NP (NN something)) (PP (IN for) (NP (PRP me)))) (NP (NNP Richard) (NNP I)) (VP (MD ought) (S (VP (TO to) (VP (VB be) (NP (NP (DT a) (NN lot)) (PP (IN for) (NP (PRP you)))))))) (. !)))"
K/KS/KSV.xml,KSVRE00J,43405,29,,B,10,2,--I ought to be a lot  (()) for you!,"[Richard/NNP, ,/,, on/IN, the/DT, odd/JJ, occasion/NN, you/PRP, something/NN, for/IN, me/PRP, Richard/NNP, I/NNP, ought/MD, to/TO, be/VB, a/DT, lot/NN, for/IN, you/PRP, !/.]","(ROOT (S (NP (NNP Richard)) (, ,) (PP (IN on) (NP (DT the) (JJ odd) (NN occasion) (PRP you))) (NP (NP (NN something)) (PP (IN for) (NP (PRP me)))) (NP (NNP Richard) (NNP I)) (VP (MD ought) (S (VP (TO to) (VP (VB be) (NP (NP (DT a) (NN lot)) (PP (IN for) (NP (PRP you)))))))) (. !)))"
K/KS/KSV.xml,KSVRE00J,43405,30,,A,11,1,(()) ,[],X
K/KS/KSV.xml,KSVRE00J,43405,31,,B,12,1,Altogether  (()) ,[Altogether/RB],(ROOT (ADVP (RB Altogether)))
K/KS/KSV.xml,KSVRE00J,43405,32,,A,13,1,"I said , I can do tea.","[I/PRP, said/VBD, ,/,, I/PRP, can/MD, do/VB, tea/NN, ./.]","(ROOT (S (S (NP (PRP I)) (VP (VBD said))) (, ,) (NP (PRP I)) (VP (MD can) (VP (VB do) (NP (NN tea)))) (. .)))"
K/KS/KSV.xml,KSVRE00J,43405,33,,A,13,2,"Well I'm not doing tea, Alistare can do it, he's been home all day!","[Well/RB, I/PRP, 'm/VBP, not/RB, doing/VBG, tea/NN, ,/,, Alistare/NN, can/MD, do/VB, it/PRP, ,/,, he/PRP, 's/VBZ, been/VBN, home/RB, all/DT, day/NN, !/.]","(ROOT (S (ADVP (RB Well)) (PRN (S (NP (PRP I)) (VP (VBP 'm) (RB not) (VP (VBG doing) (NP (NN tea))))) (, ,) (S (NP (NN Alistare)) (VP (MD can) (VP (VB do) (NP (PRP it))))) (, ,)) (NP (PRP he)) (VP (VBZ 's) (VP (VBN been) (ADVP (RB home)) (NP (DT all) (NN day)))) (. !)))"
K/KS/KSV.xml,KSVRE00J,43405,34,,B,14,1,Alistare does something  (()) ,"[Alistare/NN, does/VBZ, something/NN]",(ROOT (S (NP (NN Alistare)) (VP (VBZ does) (NP (NN something)))))
K/KS/KSV.xml,KSVRE00J,43405,35,,A,15,1,He's been home all day.,"[He/PRP, 's/VBZ, been/VBN, home/RB, all/DT, day/NN, ./.]",(ROOT (S (NP (PRP He)) (VP (VBZ 's) (VP (VBN been) (ADVP (RB home)) (NP (DT all) (NN day)))) (. .)))
K/KS/KSV.xml,KSVRE00J,43405,36,,B,16,1,No!,"[No/DT, !/.]",(ROOT (FRAG (NP (DT No)) (. !)))
K/KS/KSV.xml,KSVRE00J,43405,37,,B,16,2,He did,"[He/PRP, did/VBD]",(ROOT (S (NP (PRP He)) (VP (VBD did))))
K/KS/KSV.xml,KSVRE00J,43405,38,,A,17,1,"Yes, he's been home all day I'm not doing it tonight!","[Yes/UH, ,/,, he/PRP, 's/VBZ, been/VBN, home/RB, all/DT, day/NN, I/PRP, 'm/VBP, not/RB, doing/VBG, it/PRP, tonight/RB, !/.]","(ROOT (S (S (INTJ (UH Yes)) (, ,) (NP (PRP he)) (VP (VBZ 's) (VP (VBN been) (ADVP (RB home)) (NP (DT all) (NN day))))) (NP (PRP I)) (VP (VBP 'm) (RB not) (VP (VBG doing) (NP (PRP it)) (NP (RB tonight)))) (. !)))"
K/KS/KSV.xml,KSVRE00J,43405,39,,A,17,2,I've got things to do.,"[I/PRP, 've/VBP, got/VBN, things/NNS, to/TO, do/VB, ./.]",(ROOT (S (NP (PRP I)) (VP (VBP 've) (VP (VBN got) (NP (NNS things)) (S (VP (TO to) (VP (VB do)))))) (. .)))
K/KS/KSV.xml,KSVRE00J,43405,40,,B,18,1,Fabulous!,"[Fabulous/JJ, !/.]",(ROOT (FRAG (ADJP (JJ Fabulous)) (. !)))
K/KS/KSV.xml,KSVRE00J,43405,41,,B,18,2,He'll ,"[He/PRP, 'll/MD]",(ROOT (S (NP (PRP He)) (VP (MD 'll))))
K/KS/KSV.xml,KSVRE00J,43405,42,,A,19,1,Yeah.,"[Yeah/UH, ./.]",(ROOT (INTJ (UH Yeah) (. .)))
K/KS/KSV.xml,KSVRE00J,43405,43,,B,20,1,I'll do it!,"[I/PRP, 'll/MD, do/VB, it/PRP, !/.]",(ROOT (S (NP (PRP I)) (VP (MD 'll) (VP (VB do) (NP (PRP it)))) (. !)))
K/KS/KSV.xml,KSVRE00J,43405,44,,A,21,1,Yeah!,"[Yeah/UH, !/.]",(ROOT (INTJ (UH Yeah) (. !)))
K/KS/KSV.xml,KSVRE00J,43405,45,,A,21,2,Don't see why you can't do it.,"[Don/NNP, 't/PRP, see/VBP, why/WRB, you/PRP, can/MD, 't/PRP, do/VB, it/PRP, ./.]",(ROOT (S (NP (NNP Don) (PRP 't)) (VP (VBP see) (SBAR (WHADVP (WRB why)) (S (NP (PRP you)) (VP (MD can) (NP (PRP 't)) (S (VP (VB do) (NP (PRP it)))))))) (. .)))
K/KS/KSV.xml,KSVRE00J,43405,46,,B,22,1,"Don't ask me to take that in again tomorrow, cos I can't!","[Don/NNP, 't/PRP, ask/VB, me/PRP, to/TO, take/VB, that/DT, in/IN, again/RB, tomorrow/NN, ,/,, cos/NN, I/PRP, can/MD, 't/PRP, !/.]","(ROOT (S (NP (NNP Don) (PRP 't)) (VP (VB ask) (S (NP (PRP me)) (VP (TO to) (VP (VB take) (NP (NP (DT that)) (PP (IN in) (ADVP (RB again)))) (NP (NN tomorrow)) (, ,) (NP (NP (NN cos)) (SBAR (S (NP (PRP I)) (VP (MD can) (VP (NP (PRP 't))))))))))) (. !)))"
K/KS/KSV.xml,KSVRE00J,43405,47,,A,23,1,If I'm supposed to be doing it.,"[If/IN, I/PRP, 'm/VBP, supposed/VBN, to/TO, be/VB, doing/VBG, it/PRP, ./.]",(ROOT (FRAG (SBAR (IN If) (S (NP (PRP I)) (VP (VBP 'm) (VP (VBN supposed) (S (VP (TO to) (VP (VB be) (VP (VBG doing) (NP (PRP it)))))))))) (. .)))
K/KS/KSV.xml,KSVRE00J,43405,48,,A,23,2,Can you take it in tomorrow mum?,"[Can/MD, you/PRP, take/VB, it/PRP, in/IN, tomorrow/NN, mum/NN, ?/.]",(ROOT (SQ (MD Can) (NP (PRP you)) (VP (VB take) (NP (PRP it)) (PP (IN in) (NP (NN tomorrow) (NN mum)))) (. ?)))
K/KS/KSV.xml,KSVRE00J,43405,49,,A,23,3,I better take it back tomorrow  --,"[I/PRP, better/JJR, take/VB, it/PRP, back/RB, tomorrow/NN, hadn/NN, 't/PRP, I/PRP, ?/.]",(ROOT (S (NP (PRP I)) (ADVP (JJR better)) (VP (VB take) (S (NP (NP (PRP it)) (RRC (ADVP (RB back)) (NP (NP (NN tomorrow) (NN hadn)) (NP (PRP 't))))) (NP (PRP I)))) (. ?)))
K/KS/KSV.xml,KSVRE00J,43405,50,,A,23,4,--hadn't I?,"[I/PRP, better/JJR, take/VB, it/PRP, back/RB, tomorrow/NN, hadn/NN, 't/PRP, I/PRP, ?/.]",(ROOT (S (NP (PRP I)) (ADVP (JJR better)) (VP (VB take) (S (NP (NP (PRP it)) (RRC (ADVP (RB back)) (NP (NP (NN tomorrow) (NN hadn)) (NP (PRP 't))))) (NP (PRP I)))) (. ?)))
K/KS/KSV.xml,KSVRE00J,43405,51,,A,23,5,Mum?,"[Mum/NN, ?/.]",(ROOT (FRAG (NP (NN Mum)) (. ?)))
K/KS/KSV.xml,KSVRE00J,43405,52,,B,24,1,"I would have, you said she's calling here to pick it up er, isn't she?","[I/PRP, would/MD, have/VB, ,/,, you/PRP, said/VBD, she/PRP, 's/VBZ, calling/VBG, here/RB, to/TO, pick/VB, it/PRP, up/RP, er/NN, ,/,, isn/NN, 't/PRP, she/PRP, ?/.]","(ROOT (S (NP (PRP I)) (VP (MD would) (VP (VB have) (PRN (, ,) (S (NP (PRP you)) (VP (VBD said) (SBAR (S (NP (PRP she)) (VP (VBZ 's) (VP (VBG calling) (ADVP (RB here)) (S (VP (TO to) (VP (VB pick) (NP (PRP it)) (PP (RP up) (NP (NN er)))))))))))) (, ,)) (NP (NP (NN isn)) (NP (NP (PRP 't)) (NP (PRP she)))))) (. ?)))"
K/KS/KSV.xml,KSVRE00J,43405,53,,A,25,1,Yes.,"[Yes/UH, ./.]",(ROOT (INTJ (UH Yes) (. .)))
K/KS/KSV.xml,KSVRE00J,43405,54,,A,25,2,Four thirty.,"[Four/CD, thirty/CD, ./.]",(ROOT (FRAG (NP (CD Four) (CD thirty)) (. .)))
K/KS/KSV.xml,KSVRE00J,43405,55,,A,25,3,And you won't be home before four thirty will you?,"[And/CC, you/PRP, won/VBD, 't/PRP, be/VB, home/NN, before/IN, four/CD, thirty/CD, will/MD, you/PRP, ?/.]",(ROOT (SINV (S (CC And) (NP (PRP you)) (VP (VBD won) (S (NP (PRP 't)) (VP (VB be) (NP (NP (NN home)) (PP (IN before) (NP (CD four) (CD thirty)))))))) (VP (MD will)) (NP (PRP you)) (. ?)))
K/KS/KSV.xml,KSVRE00J,43405,56,,A,25,4,If you can take it in tomorrow I'll be much obliged!,"[If/IN, you/PRP, can/MD, take/VB, it/PRP, in/IN, tomorrow/NN, I/PRP, 'll/MD, be/VB, much/JJ, obliged/JJ, !/.]",(ROOT (S (SBAR (IN If) (S (NP (PRP you)) (VP (MD can) (VP (VB take) (NP (PRP it)) (PP (IN in) (NP (NN tomorrow))))))) (NP (PRP I)) (VP (MD 'll) (VP (VB be) (ADJP (JJ much) (JJ obliged)))) (. !)))
K/KS/KSV.xml,KSVRE00J,43405,57,,B,26,1,Nope!,"[Nope/UH, !/.]",(ROOT (INTJ (UH Nope) (. !)))
K/KS/KSV.xml,KSVRE00J,43405,58,,B,26,2,Sorry!,"[Sorry/JJ, !/.]",(ROOT (FRAG (ADJP (JJ Sorry)) (. !)))
K/KS/KSV.xml,KSVRE00J,43405,59,,A,27,1,Why can't you just leave it on?,"[Why/WRB, can/MD, 't/PRP, you/PRP, just/RB, leave/VBP, it/PRP, on/IN, ?/.]",(ROOT (SBARQ (WHADVP (WRB Why)) (SQ (VP (MD can)) (NP (PRP 't)) (NP (NP (PRP you)) (SBAR (S (VP (ADVP (RB just)) (VBP leave) (NP (PRP it)) (PP (IN on))))))) (. ?)))
K/KS/KSV.xml,KSVRE00J,43405,60,,B,28,1,Did you ring the coach back?,"[Did/VBD, you/PRP, ring/VBP, the/DT, coach/NN, back/RB, ?/.]",(ROOT (S (VP (VBD Did) (SBAR (S (NP (PRP you)) (VP (VBP ring) (NP (DT the) (NN coach)) (ADVP (RB back)))))) (. ?)))
K/KS/KSV.xml,KSVRE00J,43405,61,,A,29,1,"Yes, I did.","[Yes/UH, ,/,, I/PRP, did/VBD, ./.]","(ROOT (S (INTJ (UH Yes)) (, ,) (NP (PRP I)) (VP (VBD did)) (. .)))"
K/KS/KSV.xml,KSVRE00J,43405,62,,B,30,1,We're here at Blackpool presumably?,"[We/PRP, 're/VBP, here/RB, at/IN, Blackpool/NNP, presumably/RB, ?/.]",(ROOT (S (NP (PRP We)) (VP (VBP 're) (ADVP (RB here)) (PP (IN at) (NP (NNP Blackpool))) (ADVP (RB presumably))) (. ?)))
