swda_filename,ptb_basename,conversation_no,transcript_index,act_tag,caller,turn_index,subutterance_index,text,pos,trees
K/KD/KDD.xml,KDDRE001,42902,66,,A,39,4,"--she's thinking of having a couple for her living room that can't be pictures of somebody else's room she's putting up, he must be taking snaps.","[But/CC, er/NN, but/CC, when/WRB, Marguerite/NNP, says/VBZ, she/PRP, 's/VBZ, thinking/VBG, of/IN, having/VBG, a/DT, couple/NN, for/IN, her/PRP$, living/NN, room/NN, that/WDT, can/MD, 't/PRP, be/VB, pictures/NNS, of/IN, somebody/NN, else/RB, 's/POS, room/NN, she/PRP, 's/VBZ, putting/VBG, up/RP, ,/,, he/PRP, must/MD, be/VB, taking/VBG, snaps/VBZ, ./.]","(ROOT (S (CC But) (NP (NN er)) (ADVP (CC but)) (SBAR (WHADVP (WRB when)) (S (NP (NNP Marguerite)) (VP (VBZ says) (SBAR (S (NP (PRP she)) (VP (VBZ 's) (VP (VBG thinking) (PP (IN of) (S (VP (VBG having) (NP (NP (DT a) (NN couple)) (PP (IN for) (NP (PRP$ her) (NN living) (NN room))) (SBAR (WHNP (WDT that)) (SINV (MD can) (NP (PRP 't)) (VP (VB be) (NP (NP (NNS pictures)) (PP (IN of) (NP (NP (NN somebody) (RB else) (POS 's)) (NN room))) (SBAR (S (NP (PRP she)) (VP (VBZ 's) (VP (VBG putting) (PRT (RP up))))))))))))))))))))) (, ,) (NP (PRP he)) (VP (MD must) (VP (VB be) (VP (VBG taking) (VP (VBZ snaps))))) (. .)))"
K/KD/KDD.xml,KDDRE001,42902,67,,B,40,1,Er the hunting snaps they're on about.,"[Er/NN, the/DT, hunting/NN, snaps/VBZ, they/PRP, 're/VBP, on/IN, about/RB, ./.]",(ROOT (S (NP (NP (NN Er)) (NP (DT the) (NN hunting))) (VP (VBZ snaps) (SBAR (S (NP (PRP they)) (VP (VBP 're) (PP (IN on) (ADVP (RB about))))))) (. .)))
K/KD/KDD.xml,KDDRE001,42902,68,,A,41,1,Oh the hunting snaps.,"[Oh/UH, the/DT, hunting/NN, snaps/VBZ, ./.]",(ROOT (S (S (INTJ (UH Oh)) (NP (DT the) (NN hunting)) (VP (VBZ snaps))) (. .)))
K/KD/KDD.xml,KDDRE001,42902,69,,B,42,1,The deer.,"[The/DT, deer/NNS, ./.]",(ROOT (NP (DT The) (NNS deer) (. .)))
K/KD/KDD.xml,KDDRE001,42902,70,,A,43,1,Well it didn't mention that though did it?,"[Well/RB, it/PRP, didn/VB, 't/PRP, mention/VB, that/DT, though/IN, did/VBD, it/PRP, ?/.]",(ROOT (FRAG (ADVP (RB Well)) (NP (NP (PRP it)) (SBAR (S (VP (VB didn) (S (NP (PRP 't)) (VP (VB mention) (NP (DT that)) (SBAR (IN though) (SINV (VBD did) (NP (PRP it)))))))))) (. ?)))
K/KD/KDD.xml,KDDRE001,42902,71,,A,43,2,"It just said he carries a portfolio and he, you know, when he goes out to work.","[It/PRP, just/RB, said/VBD, he/PRP, carries/VBZ, a/DT, portfolio/NN, and/CC, he/PRP, ,/,, you/PRP, know/VBP, ,/,, when/WRB, he/PRP, goes/VBZ, out/IN, to/TO, work/VB, ./.]","(ROOT (S (NP (PRP It)) (ADVP (RB just)) (VP (VBD said) (SBAR (S (NP (PRP he)) (VP (VBZ carries) (NP (NP (DT a) (NN portfolio)) (CC and) (NP (PRP he))) (PRN (, ,) (S (NP (PRP you)) (VP (VBP know))) (, ,)) (SBAR (WHADVP (WRB when)) (S (NP (PRP he)) (VP (VBZ goes) (PRT (IN out)) (S (VP (TO to) (VP (VB work))))))))))) (. .)))"
K/KD/KDD.xml,KDDRE001,42902,72,,B,44,1,I imagine he's had an enlargement of  --,"[I/PRP, imagine/VBP, he/PRP, 's/VBZ, had/VBD, an/DT, enlargement/NN, of/IN, the/DT, deer/NNS, he/PRP, killed/VBD, ./.]",(ROOT (S (S (NP (PRP I)) (VP (VBP imagine) (SBAR (S (NP (PRP he)) (VP (VBZ 's) (VP (VBD had) (NP (NP (DT an) (NN enlargement)) (PP (IN of) (NP (DT the) (NNS deer)))))))))) (NP (PRP he)) (VP (VBD killed)) (. .)))
K/KD/KDD.xml,KDDRE001,42902,73,,B,44,2,--the deer he killed.,"[I/PRP, imagine/VBP, he/PRP, 's/VBZ, had/VBD, an/DT, enlargement/NN, of/IN, the/DT, deer/NNS, he/PRP, killed/VBD, ./.]",(ROOT (S (S (NP (PRP I)) (VP (VBP imagine) (SBAR (S (NP (PRP he)) (VP (VBZ 's) (VP (VBD had) (NP (NP (DT an) (NN enlargement)) (PP (IN of) (NP (DT the) (NNS deer)))))))))) (NP (PRP he)) (VP (VBD killed)) (. .)))
K/KD/KDD.xml,KDDRE001,42902,74,,A,45,1,Yeah.,"[Yeah/UH, ./.]",(ROOT (INTJ (UH Yeah) (. .)))
K/KD/KDD.xml,KDDRE001,42902,75,,A,45,2,I didn't realize Harry was that age.,"[I/PRP, didn/VBP, 't/PRP, realize/VB, Harry/NNP, was/VBD, that/IN, age/NN, ./.]",(ROOT (S (NP (PRP I)) (VP (VBP didn) (S (NP (PRP 't)) (VP (VB realize) (SBAR (S (NP (NNP Harry)) (VP (VBD was) (PP (IN that) (NP (NN age))))))))) (. .)))
K/KD/KDD.xml,KDDRE001,42902,76,,A,45,3,Cos I forget that he's that much older than you.,"[Cos/NN, I/PRP, forget/VBP, that/IN, he/PRP, 's/VBZ, that/IN, much/JJ, older/JJR, than/IN, you/PRP, ./.]",(ROOT (S (NP (NN Cos)) (NP (PRP I)) (VP (VBP forget) (SBAR (IN that) (S (NP (PRP he)) (VP (VBZ 's) (ADJP (ADJP (IN that) (JJ much)) (JJR older)) (PP (IN than) (NP (PRP you))))))) (. .)))
K/KD/KDD.xml,KDDRE001,42902,77,,B,46,1,Who was?,"[Who/WP, was/VBD, ?/.]",(ROOT (SBARQ (WHNP (WP Who)) (SQ (VP (VBD was))) (. ?)))
K/KD/KDD.xml,KDDRE001,42902,78,,A,47,1,Ha- ,[Ha-/NN],(ROOT (NP (NN Ha-)))
