swda_filename,ptb_basename,conversation_no,transcript_index,act_tag,caller,turn_index,subutterance_index,text,pos,trees
K/KD/KDD.xml,KDDRE001,42902,0,,A,1,1,wrong number on the phone?,"[wrong/JJ, number/NN, on/IN, the/DT, phone/NN, ?/.]",(ROOT (NP (NP (JJ wrong) (NN number)) (PP (IN on) (NP (DT the) (NN phone))) (. ?)))
K/KD/KDD.xml,KDDRE001,42902,1,,B,2,1,Yeah.,"[Yeah/UH, ./.]",(ROOT (INTJ (UH Yeah) (. .)))
K/KD/KDD.xml,KDDRE001,42902,2,,A,3,1,Said the erm wind chill factor is twenty two below  --,"[Said/VBD, the/DT, erm/NN, wind/NN, chill/NN, factor/NN, is/VBZ, twenty/CD, two/CD, below/IN, so/RB, that/DT, 's/VBZ, wind/NN, chill/NN, factor/NN, ,/,, that/WDT, means/VBZ, it/PRP, 's/VBZ, not/RB, that/IN, temperature/NN, otherwise/RB, when/WRB, there/EX, 's/VBZ, a/DT, you/PRP, know/VBP, the/DT, ,/,, the/DT, gale/NNP, force/NNP, wind/NN, or/CC, erm/NN]","(ROOT (SINV (VP (VBD Said) (SBAR (S (NP (DT the) (NN erm) (NN wind) (NN chill) (NN factor)) (VP (VBZ is) (NP (NP (CD twenty) (CD two)) (ADVP (IN below) (RB so)) (SBAR (WHNP (DT that)) (S (VP (VBZ 's) (NP (NP (NN wind) (NN chill) (NN factor)) (, ,) (SBAR (WHNP (WDT that)) (S (VP (VBZ means) (SBAR (S (NP (PRP it)) (VP (VBZ 's) (RB not) (SBAR (IN that) (S (NP (NN temperature)) (ADJP (RB otherwise) (SBAR (WHADVP (WRB when)) (S (NP (EX there)) (VP (VBZ 's) (NP (DT a) (S (NP (PRP you)) (VP (VBP know))))))))))))))))))))))))) (NP (NP (DT the)) (, ,) (NP (NP (DT the) (NNP gale) (NNP force) (NN wind)) (CC or) (NP (NN erm))))))"
K/KD/KDD.xml,KDDRE001,42902,3,,A,3,2,--so that's  --,"[Said/VBD, the/DT, erm/NN, wind/NN, chill/NN, factor/NN, is/VBZ, twenty/CD, two/CD, below/IN, so/RB, that/DT, 's/VBZ, wind/NN, chill/NN, factor/NN, ,/,, that/WDT, means/VBZ, it/PRP, 's/VBZ, not/RB, that/IN, temperature/NN, otherwise/RB, when/WRB, there/EX, 's/VBZ, a/DT, you/PRP, know/VBP, the/DT, ,/,, the/DT, gale/NNP, force/NNP, wind/NN, or/CC, erm/NN]","(ROOT (SINV (VP (VBD Said) (SBAR (S (NP (DT the) (NN erm) (NN wind) (NN chill) (NN factor)) (VP (VBZ is) (NP (NP (CD twenty) (CD two)) (ADVP (IN below) (RB so)) (SBAR (WHNP (DT that)) (S (VP (VBZ 's) (NP (NP (NN wind) (NN chill) (NN factor)) (, ,) (SBAR (WHNP (WDT that)) (S (VP (VBZ means) (SBAR (S (NP (PRP it)) (VP (VBZ 's) (RB not) (SBAR (IN that) (S (NP (NN temperature)) (ADJP (RB otherwise) (SBAR (WHADVP (WRB when)) (S (NP (EX there)) (VP (VBZ 's) (NP (DT a) (S (NP (PRP you)) (VP (VBP know))))))))))))))))))))))))) (NP (NP (DT the)) (, ,) (NP (NP (DT the) (NNP gale) (NNP force) (NN wind)) (CC or) (NP (NN erm))))))"
K/KD/KDD.xml,KDDRE001,42902,4,,A,3,3,"--wind chill factor, that means it's not that temperature otherwise when there's a  --","[Said/VBD, the/DT, erm/NN, wind/NN, chill/NN, factor/NN, is/VBZ, twenty/CD, two/CD, below/IN, so/RB, that/DT, 's/VBZ, wind/NN, chill/NN, factor/NN, ,/,, that/WDT, means/VBZ, it/PRP, 's/VBZ, not/RB, that/IN, temperature/NN, otherwise/RB, when/WRB, there/EX, 's/VBZ, a/DT, you/PRP, know/VBP, the/DT, ,/,, the/DT, gale/NNP, force/NNP, wind/NN, or/CC, erm/NN]","(ROOT (SINV (VP (VBD Said) (SBAR (S (NP (DT the) (NN erm) (NN wind) (NN chill) (NN factor)) (VP (VBZ is) (NP (NP (CD twenty) (CD two)) (ADVP (IN below) (RB so)) (SBAR (WHNP (DT that)) (S (VP (VBZ 's) (NP (NP (NN wind) (NN chill) (NN factor)) (, ,) (SBAR (WHNP (WDT that)) (S (VP (VBZ means) (SBAR (S (NP (PRP it)) (VP (VBZ 's) (RB not) (SBAR (IN that) (S (NP (NN temperature)) (ADJP (RB otherwise) (SBAR (WHADVP (WRB when)) (S (NP (EX there)) (VP (VBZ 's) (NP (DT a) (S (NP (PRP you)) (VP (VBP know))))))))))))))))))))))))) (NP (NP (DT the)) (, ,) (NP (NP (DT the) (NNP gale) (NNP force) (NN wind)) (CC or) (NP (NN erm))))))"
K/KD/KDD.xml,KDDRE001,42902,5,,A,3,4,"--you know the, the gale force wind or erm","[Said/VBD, the/DT, erm/NN, wind/NN, chill/NN, factor/NN, is/VBZ, twenty/CD, two/CD, below/IN, so/RB, that/DT, 's/VBZ, wind/NN, chill/NN, factor/NN, ,/,, that/WDT, means/VBZ, it/PRP, 's/VBZ, not/RB, that/IN, temperature/NN, otherwise/RB, when/WRB, there/EX, 's/VBZ, a/DT, you/PRP, know/VBP, the/DT, ,/,, the/DT, gale/NNP, force/NNP, wind/NN, or/CC, erm/NN]","(ROOT (SINV (VP (VBD Said) (SBAR (S (NP (DT the) (NN erm) (NN wind) (NN chill) (NN factor)) (VP (VBZ is) (NP (NP (CD twenty) (CD two)) (ADVP (IN below) (RB so)) (SBAR (WHNP (DT that)) (S (VP (VBZ 's) (NP (NP (NN wind) (NN chill) (NN factor)) (, ,) (SBAR (WHNP (WDT that)) (S (VP (VBZ means) (SBAR (S (NP (PRP it)) (VP (VBZ 's) (RB not) (SBAR (IN that) (S (NP (NN temperature)) (ADJP (RB otherwise) (SBAR (WHADVP (WRB when)) (S (NP (EX there)) (VP (VBZ 's) (NP (DT a) (S (NP (PRP you)) (VP (VBP know))))))))))))))))))))))))) (NP (NP (DT the)) (, ,) (NP (NP (DT the) (NNP gale) (NNP force) (NN wind)) (CC or) (NP (NN erm))))))"
K/KD/KDD.xml,KDDRE001,42902,6,,B,4,1,It's twenty  --,"[It/PRP, 's/VBZ, twenty/CD, two/CD, below/IN, from/IN, thirty/CD, two/CD]",(ROOT (S (NP (PRP It)) (VP (VBZ 's) (ADVP (NP (CD twenty) (CD two)) (IN below)) (PP (IN from) (NP (CD thirty) (CD two))))))
K/KD/KDD.xml,KDDRE001,42902,7,,B,4,2,--two  --,"[It/PRP, 's/VBZ, twenty/CD, two/CD, below/IN, from/IN, thirty/CD, two/CD]",(ROOT (S (NP (PRP It)) (VP (VBZ 's) (ADVP (NP (CD twenty) (CD two)) (IN below)) (PP (IN from) (NP (CD thirty) (CD two))))))
K/KD/KDD.xml,KDDRE001,42902,8,,B,4,3,--below  --,"[It/PRP, 's/VBZ, twenty/CD, two/CD, below/IN, from/IN, thirty/CD, two/CD]",(ROOT (S (NP (PRP It)) (VP (VBZ 's) (ADVP (NP (CD twenty) (CD two)) (IN below)) (PP (IN from) (NP (CD thirty) (CD two))))))
K/KD/KDD.xml,KDDRE001,42902,9,,B,4,4,--from thirty two,"[It/PRP, 's/VBZ, twenty/CD, two/CD, below/IN, from/IN, thirty/CD, two/CD]",(ROOT (S (NP (PRP It)) (VP (VBZ 's) (ADVP (NP (CD twenty) (CD two)) (IN below)) (PP (IN from) (NP (CD thirty) (CD two))))))
K/KD/KDD.xml,KDDRE001,42902,10,,A,5,1,Mm.,"[Mm/NN, ./.]",(ROOT (NP (NN Mm) (. .)))
K/KD/KDD.xml,KDDRE001,42902,11,,B,6,1,it's twenty two so that means that it's ten degrees  --,"[it/PRP, 's/VBZ, twenty/CD, two/CD, so/IN, that/IN, means/VBZ, that/IN, it/PRP, 's/VBZ, ten/CD, degrees/NNS, ten/CD, above/IN, zero/CD, ./.]",(ROOT (S (NP (PRP it)) (VP (VBZ 's) (NP (CD twenty) (CD two)) (SBAR (IN so) (IN that) (S (VP (VBZ means) (SBAR (IN that) (S (NP (PRP it)) (VP (VBZ 's) (NP (NP (CD ten) (NNS degrees)) (NP (NP (CD ten)) (PP (IN above) (NP (CD zero)))))))))))) (. .)))
K/KD/KDD.xml,KDDRE001,42902,12,,B,6,2,--ten above zero.,"[it/PRP, 's/VBZ, twenty/CD, two/CD, so/IN, that/IN, means/VBZ, that/IN, it/PRP, 's/VBZ, ten/CD, degrees/NNS, ten/CD, above/IN, zero/CD, ./.]",(ROOT (S (NP (PRP it)) (VP (VBZ 's) (NP (CD twenty) (CD two)) (SBAR (IN so) (IN that) (S (VP (VBZ means) (SBAR (IN that) (S (NP (PRP it)) (VP (VBZ 's) (NP (NP (CD ten) (NNS degrees)) (NP (NP (CD ten)) (PP (IN above) (NP (CD zero)))))))))))) (. .)))
K/KD/KDD.xml,KDDRE001,42902,13,,A,7,1,Mm.,"[Mm/NN, ./.]",(ROOT (NP (NN Mm) (. .)))
K/KD/KDD.xml,KDDRE001,42902,14,,B,8,1,That is very cold.,"[That/DT, is/VBZ, very/RB, cold/JJ, ./.]",(ROOT (S (NP (DT That)) (VP (VBZ is) (ADJP (RB very) (JJ cold))) (. .)))
K/KD/KDD.xml,KDDRE001,42902,15,,A,9,1,Yeah.,"[Yeah/UH, ./.]",(ROOT (INTJ (UH Yeah) (. .)))
K/KD/KDD.xml,KDDRE001,42902,16,,A,9,2,It says  <reading> wish you could see the shots John has taken.,"[It/PRP, says/VBZ, wish/VB, you/PRP, could/MD, see/VB, the/DT, shots/NNS, John/NNP, has/VBZ, taken/VBN, ./.]",(ROOT (S (NP (PRP It)) (VP (VBZ says) (S (VP (VB wish) (SBAR (S (NP (PRP you)) (VP (MD could) (VP (VB see) (NP (NP (DT the) (NNS shots)) (SBAR (S (NP (NNP John)) (VP (VBZ has) (VP (VBN taken))))))))))))) (. .)))
K/KD/KDD.xml,KDDRE001,42902,17,,A,9,3,He carries a portfolio with him when he goes out to work  --,"[He/PRP, carries/VBZ, a/DT, portfolio/NN, with/IN, him/PRP, when/WRB, he/PRP, goes/VBZ, out/IN, to/TO, work/VB, he/PRP, has/VBZ, them/PRP, blown/VBN, up/RP, ./.]",(ROOT (S (NP (PRP He)) (VP (VBZ carries) (NP (DT a) (NN portfolio)) (PP (IN with) (NP (PRP him))) (SBAR (WHADVP (WRB when)) (S (NP (PRP he)) (VP (VBZ goes) (PRT (IN out)) (S (VP (TO to) (VP (VB work) (SBAR (S (NP (PRP he)) (VP (VBZ has) (S (NP (PRP them)) (VP (VBN blown) (PRT (RP up)))))))))))))) (. .)))
K/KD/KDD.xml,KDDRE001,42902,18,,A,9,4,--he has them blown up </reading> .,"[He/PRP, carries/VBZ, a/DT, portfolio/NN, with/IN, him/PRP, when/WRB, he/PRP, goes/VBZ, out/IN, to/TO, work/VB, he/PRP, has/VBZ, them/PRP, blown/VBN, up/RP, ./.]",(ROOT (S (NP (PRP He)) (VP (VBZ carries) (NP (DT a) (NN portfolio)) (PP (IN with) (NP (PRP him))) (SBAR (WHADVP (WRB when)) (S (NP (PRP he)) (VP (VBZ goes) (PRT (IN out)) (S (VP (TO to) (VP (VB work) (SBAR (S (NP (PRP he)) (VP (VBZ has) (S (NP (PRP them)) (VP (VBN blown) (PRT (RP up)))))))))))))) (. .)))
K/KD/KDD.xml,KDDRE001,42902,19,,A,9,5,"He goes out to work, that means he's going round to the various houses and ","[He/PRP, goes/VBZ, out/IN, to/TO, work/VB, ,/,, that/DT, means/VBZ, he/PRP, 's/VBZ, going/VBG, round/NN, to/TO, the/DT, various/JJ, houses/NNS, and/CC]","(ROOT (S (NP (PRP He)) (VP (VBZ goes) (PP (IN out) (NP (S (VP (TO to) (VP (VB work)))) (, ,) (SBAR (WHNP (DT that)) (S (VP (VBZ means) (SBAR (S (NP (PRP he)) (VP (VBZ 's) (VP (VBG going) (NP (NP (NN round)) (PP (TO to) (NP (DT the) (JJ various) (NNS houses)))) (CC and)))))))))))))"
K/KD/KDD.xml,KDDRE001,42902,20,,B,10,1,Yeah.,"[Yeah/UH, ./.]",(ROOT (INTJ (UH Yeah) (. .)))
K/KD/KDD.xml,KDDRE001,42902,21,,A,11,1,and taking photographs of the erm rooms before he does all the changing I suppose?,"[and/CC, taking/VBG, photographs/NNS, of/IN, the/DT, erm/NN, rooms/NNS, before/IN, he/PRP, does/VBZ, all/PDT, the/DT, changing/VBG, I/PRP, suppose/VB, ?/.]",(ROOT (S (CC and) (S (VP (VBG taking) (NP (NP (NNS photographs)) (PP (IN of) (NP (DT the) (NN erm) (NNS rooms)))) (PP (IN before) (NP (PRP he))))) (VP (VBZ does) (S (NP (PDT all) (DT the)) (VP (VBG changing) (S (NP (PRP I)) (VP (VB suppose)))))) (. ?)))
K/KD/KDD.xml,KDDRE001,42902,22,,B,12,1,Yeah absolutely.,"[Yeah/UH, absolutely/RB, ./.]",(ROOT (S (VP (NP (INTJ (UH Yeah)) (NP (RB absolutely)))) (. .)))
K/KD/KDD.xml,KDDRE001,42902,23,,A,13,1,The upholstery and the curtains and whatever ,"[The/DT, upholstery/NN, and/CC, the/DT, curtains/NNS, and/CC, whatever/WDT]",(ROOT (NP (NP (NP (DT The) (NN upholstery)) (CC and) (NP (DT the) (NNS curtains))) (PP (CC and) (NP (WDT whatever)))))
K/KD/KDD.xml,KDDRE001,42902,24,,B,14,1,"It doesn't show it on this but you see there's two zeros, there's your freezing mark there right?","[It/PRP, doesn/VBD, 't/PRP, show/VB, it/PRP, on/IN, this/DT, but/CC, you/PRP, see/VBP, there/EX, 's/VBZ, two/CD, zeros/NNS, ,/,, there/EX, 's/VBZ, your/PRP$, freezing/NN, mark/NN, there/RB, right/RB, ?/.]","(ROOT (S (S (S (NP (PRP It)) (VP (VBD doesn) (S (NP (PRP 't)) (VP (VB show) (NP (PRP it)) (PP (IN on) (NP (DT this))))))) (CC but) (S (NP (PRP you)) (VP (VBP see) (SBAR (S (NP (EX there)) (VP (VBZ 's) (NP (CD two) (NNS zeros)))))))) (, ,) (NP (EX there)) (VP (VBZ 's) (NP (PRP$ your) (NN freezing) (NN mark)) (ADVP (RB there) (RB right))) (. ?)))"
K/KD/KDD.xml,KDDRE001,42902,25,,A,15,1,Yeah.,"[Yeah/UH, ./.]",(ROOT (INTJ (UH Yeah) (. .)))
K/KD/KDD.xml,KDDRE001,42902,26,,A,15,2,Yeah.,"[Yeah/UH, ./.]",(ROOT (INTJ (UH Yeah) (. .)))
K/KD/KDD.xml,KDDRE001,42902,27,,B,16,1,That's thirty two.,"[That/DT, 's/VBZ, thirty/CD, two/CD, ./.]",(ROOT (S (NP (DT That)) (VP (VBZ 's) (NP (CD thirty) (CD two))) (. .)))
K/KD/KDD.xml,KDDRE001,42902,28,,A,17,1,Yeah.,"[Yeah/UH, ./.]",(ROOT (INTJ (UH Yeah) (. .)))
K/KD/KDD.xml,KDDRE001,42902,29,,B,18,1,"Now down here, under the ten","[Now/RB, down/RB, here/RB, ,/,, under/IN, the/DT, ten/CD]","(ROOT (UCP (ADVP (RB Now) (RB down) (RB here)) (, ,) (PP (IN under) (NP (DT the) (CD ten)))))"
K/KD/KDD.xml,KDDRE001,42902,30,,A,19,1,Well look what's ,"[Well/RB, look/VB, what/WP, 's/POS]",(ROOT (S (ADVP (RB Well)) (VP (VB look) (NP (WP what)) (S (NP (POS 's))))))
K/KD/KDD.xml,KDDRE001,42902,31,,B,20,1,there's another zero,"[there/EX, 's/VBZ, another/DT, zero/CD]",(ROOT (S (NP (EX there)) (VP (VBZ 's) (NP (DT another) (CD zero)))))
K/KD/KDD.xml,KDDRE001,42902,32,,A,21,1,what's that twenty two there?,"[what/WP, 's/VBZ, that/DT, twenty/CD, two/CD, there/EX, ?/.]",(ROOT (SBARQ (WHNP (WP what)) (SQ (VBZ 's) (NP (NP (DT that) (CD twenty) (CD two)) (NP (EX there)))) (. ?)))
K/KD/KDD.xml,KDDRE001,42902,33,,A,21,2,Is that the bottom of the er gauge?,"[Is/VBZ, that/IN, the/DT, bottom/NN, of/IN, the/DT, er/NN, gauge/NN, ?/.]",(ROOT (S (VP (VBZ Is) (ADJP (IN that) (NP (NP (DT the) (NN bottom)) (PP (IN of) (NP (DT the) (NN er) (NN gauge)))))) (. ?)))
K/KD/KDD.xml,KDDRE001,42902,34,,B,22,1,"Bottom of the scale, yeah.","[Bottom/NN, of/IN, the/DT, scale/NN, ,/,, yeah/UH, ./.]","(ROOT (FRAG (PP (NP (NN Bottom)) (PP (IN of) (NP (DT the) (NN scale)))) (, ,) (INTJ (UH yeah)) (. .)))"
K/KD/KDD.xml,KDDRE001,42902,35,,A,23,1,So they couldn't get much colder?,"[So/IN, they/PRP, couldn/VBP, 't/PRP, get/VB, much/JJ, colder/JJR, ?/.]",(ROOT (S (IN So) (NP (PRP they)) (VP (VBP couldn) (S (NP (PRP 't)) (VP (VB get) (NP (JJ much) (JJR colder))))) (. ?)))
K/KD/KDD.xml,KDDRE001,42902,36,,B,24,1,No.,"[No/DT, ./.]",(ROOT (FRAG (NP (DT No)) (. .)))
K/KD/KDD.xml,KDDRE001,42902,37,,B,24,2,No but when they say  --,"[No/DT, but/CC, when/WRB, they/PRP, say/VBP, when/WRB, they/PRP, say/VBP, i-/NN, it/PRP, 's/VBZ, twenty/CD, twenty/CD, below/IN, ,/,, it/PRP, 's/VBZ, twenty/CD, below/IN, that/DT, zero/CD, there/EX, ,/,, see/VB, there/EX, 's/VBZ, ten/CD]","(ROOT (S (ADVP (DT No) (CC but)) (SBAR (WHADVP (WRB when)) (S (NP (PRP they)) (VP (VBP say) (SBAR (WHADVP (WRB when)) (S (NP (PRP they)) (VP (VBP say) (NP (NP (NN i-)) (SBAR (S (NP (PRP it)) (VP (VBZ 's) (ADVP (NP (CD twenty) (CD twenty)) (IN below)))))))))))) (, ,) (NP (PRP it)) (VP (VBZ 's) (S (NP (NP (CD twenty)) (PP (IN below) (NP (DT that) (CD zero)))) (NP (EX there))) (, ,) (S (VP (VB see) (SBAR (S (NP (EX there)) (VP (VBZ 's) (NP (CD ten))))))))))"
K/KD/KDD.xml,KDDRE001,42902,38,,B,24,3,--when they say i- it's twenty  --,"[No/DT, but/CC, when/WRB, they/PRP, say/VBP, when/WRB, they/PRP, say/VBP, i-/NN, it/PRP, 's/VBZ, twenty/CD, twenty/CD, below/IN, ,/,, it/PRP, 's/VBZ, twenty/CD, below/IN, that/DT, zero/CD, there/EX, ,/,, see/VB, there/EX, 's/VBZ, ten/CD]","(ROOT (S (ADVP (DT No) (CC but)) (SBAR (WHADVP (WRB when)) (S (NP (PRP they)) (VP (VBP say) (SBAR (WHADVP (WRB when)) (S (NP (PRP they)) (VP (VBP say) (NP (NP (NN i-)) (SBAR (S (NP (PRP it)) (VP (VBZ 's) (ADVP (NP (CD twenty) (CD twenty)) (IN below)))))))))))) (, ,) (NP (PRP it)) (VP (VBZ 's) (S (NP (NP (CD twenty)) (PP (IN below) (NP (DT that) (CD zero)))) (NP (EX there))) (, ,) (S (VP (VB see) (SBAR (S (NP (EX there)) (VP (VBZ 's) (NP (CD ten))))))))))"
K/KD/KDD.xml,KDDRE001,42902,39,,B,24,4,"--twenty below, it's twenty below that zero there, see there's ten","[No/DT, but/CC, when/WRB, they/PRP, say/VBP, when/WRB, they/PRP, say/VBP, i-/NN, it/PRP, 's/VBZ, twenty/CD, twenty/CD, below/IN, ,/,, it/PRP, 's/VBZ, twenty/CD, below/IN, that/DT, zero/CD, there/EX, ,/,, see/VB, there/EX, 's/VBZ, ten/CD]","(ROOT (S (ADVP (DT No) (CC but)) (SBAR (WHADVP (WRB when)) (S (NP (PRP they)) (VP (VBP say) (SBAR (WHADVP (WRB when)) (S (NP (PRP they)) (VP (VBP say) (NP (NP (NN i-)) (SBAR (S (NP (PRP it)) (VP (VBZ 's) (ADVP (NP (CD twenty) (CD twenty)) (IN below)))))))))))) (, ,) (NP (PRP it)) (VP (VBZ 's) (S (NP (NP (CD twenty)) (PP (IN below) (NP (DT that) (CD zero)))) (NP (EX there))) (, ,) (S (VP (VB see) (SBAR (S (NP (EX there)) (VP (VBZ 's) (NP (CD ten))))))))))"
K/KD/KDD.xml,KDDRE001,42902,40,,A,25,1,Oh yeah I realize that.,"[Oh/UH, yeah/UH, I/PRP, realize/VBP, that/IN, ./.]",(ROOT (S (S (INTJ (UH Oh) (UH yeah)) (NP (PRP I)) (VP (VBP realize) (ADVP (IN that)))) (. .)))
K/KD/KDD.xml,KDDRE001,42902,41,,A,25,2,Yes I realize that.,"[Yes/UH, I/PRP, realize/VBP, that/IN, ./.]",(ROOT (S (S (INTJ (UH Yes)) (NP (PRP I)) (VP (VBP realize) (ADVP (IN that)))) (. .)))
K/KD/KDD.xml,KDDRE001,42902,42,,A,25,3,"But erm twenty, twenty two below   --","[But/CC, erm/NN, twenty/CD, ,/,, twenty/CD, two/CD, below/IN, you/PRP, know/VBP, it/PRP, 's/VBZ]","(ROOT (S (CC But) (NP (NN erm) (CD twenty)) (, ,) (NP (NP (CD twenty) (CD two)) (PP (IN below) (NP (PRP you)))) (VP (VBP know) (SBAR (S (NP (PRP it)) (VP (VBZ 's)))))))"
K/KD/KDD.xml,KDDRE001,42902,43,,A,25,4,--<laugh> you know it's ,"[But/CC, erm/NN, twenty/CD, ,/,, twenty/CD, two/CD, below/IN, you/PRP, know/VBP, it/PRP, 's/VBZ]","(ROOT (S (CC But) (NP (NN erm) (CD twenty)) (, ,) (NP (NP (CD twenty) (CD two)) (PP (IN below) (NP (PRP you)))) (VP (VBP know) (SBAR (S (NP (PRP it)) (VP (VBZ 's)))))))"
K/KD/KDD.xml,KDDRE001,42902,44,,B,26,1,Well I've been in eighteen below zero ,"[Well/RB, I/PRP, 've/VBP, been/VBN, in/IN, eighteen/CD, below/IN, zero/CD]",(ROOT (FRAG (ADVP (RB Well)) (NP (NP (PRP I)) (SBAR (S (VP (VBP 've) (VP (VBN been) (PP (IN in) (NP (CD eighteen))) (PP (IN below) (NP (CD zero))))))))))
K/KD/KDD.xml,KDDRE001,42902,45,,A,27,1,I know so have I.,"[I/PRP, know/VBP, so/RB, have/VB, I/PRP, ./.]",(ROOT (S (NP (PRP I)) (VP (VBP know) (RB so) (VP (VB have) (NP (PRP I)))) (. .)))
K/KD/KDD.xml,KDDRE001,42902,46,,B,28,1,and that  --,"[and/CC, that/IN, that/DT]",(ROOT (FRAG (CC and) (PP (IN that) (NP (DT that)))))
K/KD/KDD.xml,KDDRE001,42902,47,,B,28,2,--that ,"[and/CC, that/IN, that/DT]",(ROOT (FRAG (CC and) (PP (IN that) (NP (DT that)))))
K/KD/KDD.xml,KDDRE001,42902,48,,A,29,1,"So have I, it was eighteen below  --","[So/RB, have/VB, I/PRP, ,/,, it/PRP, was/VBD, eighteen/CD, below/IN, when/WRB, we/PRP, was/VBD, there/EX, that/WDT, time/NN, ./.]","(ROOT (S (S (ADVP (RB So)) (VP (VB have) (NP (PRP I)))) (, ,) (NP (PRP it)) (VP (VBD was) (PP (NP (CD eighteen)) (IN below) (SBAR (WHADVP (WRB when)) (S (NP (PRP we)) (VP (VBD was) (S (NP (EX there)) (NP (WDT that))))))) (NP (NN time))) (. .)))"
K/KD/KDD.xml,KDDRE001,42902,49,,A,29,2,--when we was there that time.,"[So/RB, have/VB, I/PRP, ,/,, it/PRP, was/VBD, eighteen/CD, below/IN, when/WRB, we/PRP, was/VBD, there/EX, that/WDT, time/NN, ./.]","(ROOT (S (S (ADVP (RB So)) (VP (VB have) (NP (PRP I)))) (, ,) (NP (PRP it)) (VP (VBD was) (PP (NP (CD eighteen)) (IN below) (SBAR (WHADVP (WRB when)) (S (NP (PRP we)) (VP (VBD was) (S (NP (EX there)) (NP (WDT that))))))) (NP (NN time))) (. .)))"
K/KD/KDD.xml,KDDRE001,42902,50,,A,29,3,I remember eighteen below.<laugh> ,"[I/PRP, remember/VBP, eighteen/CD, below/IN, ./.]",(ROOT (S (NP (PRP I)) (VP (VBP remember) (ADVP (NP (CD eighteen)) (IN below))) (. .)))
K/KD/KDD.xml,KDDRE001,42902,51,,B,30,1,"And I'm telling you, boy that is cold.","[And/CC, I/PRP, 'm/VBP, telling/VBG, you/PRP, ,/,, boy/NN, that/WDT, is/VBZ, cold/JJ, ./.]","(ROOT (S (CC And) (NP (PRP I)) (VP (VBP 'm) (VP (VBG telling) (NP (NP (PRP you)) (, ,) (NP (NP (NN boy)) (SBAR (WHNP (WDT that)) (S (VP (VBZ is) (ADJP (JJ cold))))))))) (. .)))"
K/KD/KDD.xml,KDDRE001,42902,52,,A,31,1,I  <laughing> know </laughing> .,"[I/PRP, know/VBP, ./.]",(ROOT (S (NP (PRP I)) (VP (VBP know)) (. .)))
K/KD/KDD.xml,KDDRE001,42902,53,,B,32,1,Mind you there's a difference between below zero and below freezing.,"[Mind/VB, you/PRP, there/EX, 's/VBZ, a/DT, difference/NN, between/IN, below/IN, zero/CD, and/CC, below/IN, freezing/NN, ./.]",(ROOT (S (VP (VB Mind) (NP (PRP you)) (SBAR (S (NP (EX there)) (VP (VBZ 's) (NP (NP (DT a) (NN difference)) (PP (PP (IN between) (PP (IN below) (NP (CD zero)))) (CC and) (PP (IN below) (NP (NN freezing))))))))) (. .)))
K/KD/KDD.xml,KDDRE001,42902,54,,A,33,1,Yeah.,"[Yeah/UH, ./.]",(ROOT (INTJ (UH Yeah) (. .)))
K/KD/KDD.xml,KDDRE001,42902,55,,A,33,2,I realize that.,"[I/PRP, realize/VBP, that/IN, ./.]",(ROOT (S (NP (PRP I)) (VP (VBP realize) (ADVP (IN that))) (. .)))
K/KD/KDD.xml,KDDRE001,42902,56,,A,33,3,Er n- back to these snaps that erm John takes  --,"[Er/NN, n-/NN, back/RB, to/TO, these/DT, snaps/VBZ, that/IN, erm/NNP, John/NNP, takes/VBZ, but/CC, as/IN, I/PRP, said/VBD, they/PRP, 're/VBP, pictures/NNS, of/IN, the/DT, rooms/NNS, before/IN, he/PRP, alters/VBZ, them/PRP, ,/,, before/IN, he/PRP, puts/VBZ, in/IN, a/DT, new/JJ, decor/NN, ,th-/NN, the/DT, upholstery/NN, ,/,, furnishings/NNS, and/CC, the/DT, erm/NN]","(ROOT (S (NP (NN Er) (NN n-)) (VP (ADVP (RB back) (PP (TO to) (NP (DT these)))) (VBZ snaps) (SBAR (IN that) (S (NP (NNP erm) (NNP John)) (VP (VBZ takes) (PRN (CC but) (SBAR (IN as) (S (NP (PRP I)) (VP (VBD said) (SBAR (S (NP (PRP they)) (VP (VBP 're) (NP (NP (NNS pictures)) (PP (IN of) (NP (DT the) (NNS rooms))))))))))) (SBAR (IN before) (S (NP (PRP he)) (VP (VBZ alters) (NP (PRP them)))))))) (, ,) (SBAR (IN before) (S (NP (PRP he)) (VP (VBZ puts) (PP (IN in) (NP (DT a) (JJ new) (NN decor) (NN ,th-))) (NP (NP (DT the) (NN upholstery)) (, ,) (NP (NNS furnishings)) (CC and) (NP (DT the) (NN erm)))))))))"
K/KD/KDD.xml,KDDRE001,42902,57,,A,33,4,"--but as I said they're pictures of the rooms before he alters them, before he puts in a new decor,th- the upholstery, furnishings and the erm","[Er/NN, n-/NN, back/RB, to/TO, these/DT, snaps/VBZ, that/IN, erm/NNP, John/NNP, takes/VBZ, but/CC, as/IN, I/PRP, said/VBD, they/PRP, 're/VBP, pictures/NNS, of/IN, the/DT, rooms/NNS, before/IN, he/PRP, alters/VBZ, them/PRP, ,/,, before/IN, he/PRP, puts/VBZ, in/IN, a/DT, new/JJ, decor/NN, ,th-/NN, the/DT, upholstery/NN, ,/,, furnishings/NNS, and/CC, the/DT, erm/NN]","(ROOT (S (NP (NN Er) (NN n-)) (VP (ADVP (RB back) (PP (TO to) (NP (DT these)))) (VBZ snaps) (SBAR (IN that) (S (NP (NNP erm) (NNP John)) (VP (VBZ takes) (PRN (CC but) (SBAR (IN as) (S (NP (PRP I)) (VP (VBD said) (SBAR (S (NP (PRP they)) (VP (VBP 're) (NP (NP (NNS pictures)) (PP (IN of) (NP (DT the) (NNS rooms))))))))))) (SBAR (IN before) (S (NP (PRP he)) (VP (VBZ alters) (NP (PRP them)))))))) (, ,) (SBAR (IN before) (S (NP (PRP he)) (VP (VBZ puts) (PP (IN in) (NP (DT a) (JJ new) (NN decor) (NN ,th-))) (NP (NP (DT the) (NN upholstery)) (, ,) (NP (NNS furnishings)) (CC and) (NP (DT the) (NN erm)))))))))"
K/KD/KDD.xml,KDDRE001,42902,58,,B,34,1,Well he alre- he already deals in curtains ,"[Well/RB, he/PRP, alre-/RB, he/PRP, already/RB, deals/VBZ, in/IN, curtains/NNS]",(ROOT (X (X (ADVP (RB Well)) (NP (PRP he))) (ADJP (RB alre-) (SBAR (S (NP (PRP he)) (ADVP (RB already)) (VP (VBZ deals) (PP (IN in) (NP (NNS curtains)))))))))
K/KD/KDD.xml,KDDRE001,42902,59,,A,35,1,er curt- drapes ,"[er/NN, curt-/JJ, drapes/NNS]",(ROOT (NP (NP (NN er)) (NP (JJ curt-) (NNS drapes))))
K/KD/KDD.xml,KDDRE001,42902,60,,B,36,1,and drapes.,"[and/CC, drapes/NNS, ./.]",(ROOT (FRAG (PP (CC and) (NP (NNS drapes))) (. .)))
K/KD/KDD.xml,KDDRE001,42902,61,,A,37,1,Yeah well he probably does the soft covers and what not,"[Yeah/UH, well/RB, he/PRP, probably/RB, does/VBZ, the/DT, soft/JJ, covers/NNS, and/CC, what/WP, not/RB]",(ROOT (SINV (FRAG (INTJ (UH Yeah))) (VP (ADVP (RB well) (NP (NP (PRP he)) (ADVP (RB probably)))) (VBZ does) (NP (NP (DT the) (JJ soft) (NNS covers)) (CC and) (NP (WP what)))) (NP (RB not))))
K/KD/KDD.xml,KDDRE001,42902,62,,B,38,1,Yeah.,"[Yeah/UH, ./.]",(ROOT (INTJ (UH Yeah) (. .)))
K/KD/KDD.xml,KDDRE001,42902,63,,A,39,1,you know?,"[you/PRP, know/VB, ?/.]",(ROOT (S (NP (PRP you)) (VP (VB know)) (. ?)))
K/KD/KDD.xml,KDDRE001,42902,64,,A,39,2,But er  --,"[But/CC, er/NN, but/CC, when/WRB, Marguerite/NNP, says/VBZ, she/PRP, 's/VBZ, thinking/VBG, of/IN, having/VBG, a/DT, couple/NN, for/IN, her/PRP$, living/NN, room/NN, that/WDT, can/MD, 't/PRP, be/VB, pictures/NNS, of/IN, somebody/NN, else/RB, 's/POS, room/NN, she/PRP, 's/VBZ, putting/VBG, up/RP, ,/,, he/PRP, must/MD, be/VB, taking/VBG, snaps/VBZ, ./.]","(ROOT (S (CC But) (NP (NN er)) (ADVP (CC but)) (SBAR (WHADVP (WRB when)) (S (NP (NNP Marguerite)) (VP (VBZ says) (SBAR (S (NP (PRP she)) (VP (VBZ 's) (VP (VBG thinking) (PP (IN of) (S (VP (VBG having) (NP (NP (DT a) (NN couple)) (PP (IN for) (NP (PRP$ her) (NN living) (NN room))) (SBAR (WHNP (WDT that)) (SINV (MD can) (NP (PRP 't)) (VP (VB be) (NP (NP (NNS pictures)) (PP (IN of) (NP (NP (NN somebody) (RB else) (POS 's)) (NN room))) (SBAR (S (NP (PRP she)) (VP (VBZ 's) (VP (VBG putting) (PRT (RP up))))))))))))))))))))) (, ,) (NP (PRP he)) (VP (MD must) (VP (VB be) (VP (VBG taking) (VP (VBZ snaps))))) (. .)))"
K/KD/KDD.xml,KDDRE001,42902,65,,A,39,3,--but when Marguerite says  --,"[But/CC, er/NN, but/CC, when/WRB, Marguerite/NNP, says/VBZ, she/PRP, 's/VBZ, thinking/VBG, of/IN, having/VBG, a/DT, couple/NN, for/IN, her/PRP$, living/NN, room/NN, that/WDT, can/MD, 't/PRP, be/VB, pictures/NNS, of/IN, somebody/NN, else/RB, 's/POS, room/NN, she/PRP, 's/VBZ, putting/VBG, up/RP, ,/,, he/PRP, must/MD, be/VB, taking/VBG, snaps/VBZ, ./.]","(ROOT (S (CC But) (NP (NN er)) (ADVP (CC but)) (SBAR (WHADVP (WRB when)) (S (NP (NNP Marguerite)) (VP (VBZ says) (SBAR (S (NP (PRP she)) (VP (VBZ 's) (VP (VBG thinking) (PP (IN of) (S (VP (VBG having) (NP (NP (DT a) (NN couple)) (PP (IN for) (NP (PRP$ her) (NN living) (NN room))) (SBAR (WHNP (WDT that)) (SINV (MD can) (NP (PRP 't)) (VP (VB be) (NP (NP (NNS pictures)) (PP (IN of) (NP (NP (NN somebody) (RB else) (POS 's)) (NN room))) (SBAR (S (NP (PRP she)) (VP (VBZ 's) (VP (VBG putting) (PRT (RP up))))))))))))))))))))) (, ,) (NP (PRP he)) (VP (MD must) (VP (VB be) (VP (VBG taking) (VP (VBZ snaps))))) (. .)))"
