swda_filename,ptb_basename,conversation_no,transcript_index,act_tag,caller,turn_index,subutterance_index,text,pos,trees
K/KC/KCD.xml,KCDRE02K,5211,0,,A,1,1,Well it doesn't like vinyl paper for some reason.,"[Well/RB, it/PRP, doesn/VBD, 't/PRP, like/IN, vinyl/NN, paper/NN, for/IN, some/DT, reason/NN, ./.]",(ROOT (S (ADVP (RB Well)) (NP (PRP it)) (VP (VBD doesn) (NP (PRP 't)) (PP (IN like) (NP (NN vinyl) (NN paper))) (PP (IN for) (NP (DT some) (NN reason)))) (. .)))
K/KC/KCD.xml,KCDRE02K,5211,1,,B,2,1,"No, it'll dry out (()) .","[No/DT, ,/,, it/PRP, 'll/MD, dry/VB, out/RP, ./.]","(ROOT (S (NP (DT No)) (, ,) (NP (PRP it)) (VP (MD 'll) (VP (VB dry) (PRT (RP out)))) (. .)))"
K/KC/KCD.xml,KCDRE02K,5211,2,,A,3,1,Yeah  --,"[Yeah/UH, It/PRP, wasn/VBD, 't/PRP, that/IN, it/PRP, wasn/VBD, 't/PRP, the/DT, lumps/NNS, that/WDT, bothered/VBD, me/PRP, it/PRP, was/VBD, the/DT, uhum/NN, ,/,, the/DT, fact/NN, that/IN, the/DT, edges/NNS, just/RB, doesn/VBP, 't/PRP, stay/VB, down/RP, ./.]","(ROOT (S (S (INTJ (UH Yeah)) (NP (PRP It)) (VP (VBD wasn) (NP (PRP 't)) (SBAR (IN that) (S (NP (PRP it)) (VP (VBD wasn) (S (NP (PRP 't)) (NP (NP (DT the) (NNS lumps)) (SBAR (WHNP (WDT that)) (S (VP (VBD bothered) (NP (PRP me)))))))))))) (NP (PRP it)) (VP (VBD was) (NP (NP (DT the) (NN uhum)) (, ,) (NP (NP (DT the) (NN fact)) (SBAR (IN that) (S (NP (DT the) (NNS edges)) (ADVP (RB just)) (VP (VBP doesn) (S (NP (PRP 't)) (VP (VB stay) (PRT (RP down)))))))))) (. .)))"
K/KC/KCD.xml,KCDRE02K,5211,3,,A,3,2,--It wasn't that  --,"[Yeah/UH, It/PRP, wasn/VBD, 't/PRP, that/IN, it/PRP, wasn/VBD, 't/PRP, the/DT, lumps/NNS, that/WDT, bothered/VBD, me/PRP, it/PRP, was/VBD, the/DT, uhum/NN, ,/,, the/DT, fact/NN, that/IN, the/DT, edges/NNS, just/RB, doesn/VBP, 't/PRP, stay/VB, down/RP, ./.]","(ROOT (S (S (INTJ (UH Yeah)) (NP (PRP It)) (VP (VBD wasn) (NP (PRP 't)) (SBAR (IN that) (S (NP (PRP it)) (VP (VBD wasn) (S (NP (PRP 't)) (NP (NP (DT the) (NNS lumps)) (SBAR (WHNP (WDT that)) (S (VP (VBD bothered) (NP (PRP me)))))))))))) (NP (PRP it)) (VP (VBD was) (NP (NP (DT the) (NN uhum)) (, ,) (NP (NP (DT the) (NN fact)) (SBAR (IN that) (S (NP (DT the) (NNS edges)) (ADVP (RB just)) (VP (VBP doesn) (S (NP (PRP 't)) (VP (VB stay) (PRT (RP down)))))))))) (. .)))"
K/KC/KCD.xml,KCDRE02K,5211,4,,A,3,3,"--it wasn't the lumps that bothered me it was the uhum, the fact that the edges just doesn't stay down.","[Yeah/UH, It/PRP, wasn/VBD, 't/PRP, that/IN, it/PRP, wasn/VBD, 't/PRP, the/DT, lumps/NNS, that/WDT, bothered/VBD, me/PRP, it/PRP, was/VBD, the/DT, uhum/NN, ,/,, the/DT, fact/NN, that/IN, the/DT, edges/NNS, just/RB, doesn/VBP, 't/PRP, stay/VB, down/RP, ./.]","(ROOT (S (S (INTJ (UH Yeah)) (NP (PRP It)) (VP (VBD wasn) (NP (PRP 't)) (SBAR (IN that) (S (NP (PRP it)) (VP (VBD wasn) (S (NP (PRP 't)) (NP (NP (DT the) (NNS lumps)) (SBAR (WHNP (WDT that)) (S (VP (VBD bothered) (NP (PRP me)))))))))))) (NP (PRP it)) (VP (VBD was) (NP (NP (DT the) (NN uhum)) (, ,) (NP (NP (DT the) (NN fact)) (SBAR (IN that) (S (NP (DT the) (NNS edges)) (ADVP (RB just)) (VP (VBP doesn) (S (NP (PRP 't)) (VP (VB stay) (PRT (RP down)))))))))) (. .)))"
K/KC/KCD.xml,KCDRE02K,5211,5,,B,4,1,Yeah.,"[Yeah/UH, ./.]",(ROOT (INTJ (UH Yeah) (. .)))
K/KC/KCD.xml,KCDRE02K,5211,6,,A,5,1,"I think I might cut another piece of paper, the side won't stay flat.","[I/PRP, think/VBP, I/PRP, might/MD, cut/VB, another/DT, piece/NN, of/IN, paper/NN, ,/,, the/DT, side/NN, won/VBD, 't/PRP, stay/VB, flat/JJ, ./.]","(ROOT (S (S (NP (PRP I)) (VP (VBP think) (SBAR (S (NP (PRP I)) (VP (MD might) (VP (VB cut) (NP (NP (DT another) (NN piece)) (PP (IN of) (NP (NN paper)))))))))) (, ,) (NP (DT the) (NN side)) (VP (VBD won) (S (NP (PRP 't)) (VP (VB stay) (ADJP (JJ flat))))) (. .)))"
