swda_filename,ptb_basename,conversation_no,transcript_index,act_tag,caller,turn_index,subutterance_index,text,pos,trees
K/KC/KC4.xml,KC4RE008,6501,0,,A,1,1,Will it pick everything up?,"[Will/MD, it/PRP, pick/VB, everything/NN, up/IN, ?/.]",(ROOT (SQ (MD Will) (NP (PRP it)) (VP (VB pick) (NP (NN everything)) (ADVP (IN up))) (. ?)))
K/KC/KC4.xml,KC4RE008,6501,1,,B,2,1,It should pick it up yes.,"[It/PRP, should/MD, pick/VB, it/PRP, up/RP, yes/RB, ./.]",(ROOT (S (NP (PRP It)) (VP (MD should) (VP (VB pick) (NP (PRP it)) (PRT (RP up)) (NP (RB yes)))) (. .)))
K/KC/KC4.xml,KC4RE008,6501,2,,B,2,2,"They carried it away every year, but eh, I mean it's be in the room it should pick it up.","[They/PRP, carried/VBD, it/PRP, away/RB, every/DT, year/NN, ,/,, but/CC, eh/UH, ,/,, I/PRP, mean/VBP, it/PRP, 's/VBZ, be/VB, in/IN, the/DT, room/NN, it/PRP, should/MD, pick/VB, it/PRP, up/RP, ./.]","(ROOT (S (S (NP (PRP They)) (VP (VBD carried) (NP (PRP it)) (NP (RB away) (DT every) (NN year)))) (, ,) (CC but) (S (INTJ (UH eh)) (, ,) (NP (PRP I)) (VP (VBP mean) (SBAR (S (NP (PRP it)) (VP (VBZ 's) (VP (VB be) (PP (IN in) (NP (NP (DT the) (NN room)) (SBAR (S (NP (PRP it)) (VP (MD should) (VP (VB pick) (NP (PRP it)) (PRT (RP up)))))))))))))) (. .)))"
K/KC/KC4.xml,KC4RE008,6501,3,,B,2,3,Forty five minutes one side of the tape is ,"[Forty/CD, five/CD, minutes/NNS, one/CD, side/NN, of/IN, the/DT, tape/NN, is/VBZ]",(ROOT (S (NP (NP (NP (QP (CD Forty) (CD five)) (NNS minutes)) (NP (CD one) (NN side))) (PP (IN of) (NP (DT the) (NN tape)))) (VP (VBZ is))))
K/KC/KC4.xml,KC4RE008,6501,4,,A,3,1,Market research (()) .,"[Market/NN, research/NN, ./.]",(ROOT (NP (NP (NN Market)) (NP (NN research)) (. .)))
K/KC/KC4.xml,KC4RE008,6501,5,,B,4,1,Yeah.,"[Yeah/UH, ./.]",(ROOT (INTJ (UH Yeah) (. .)))
K/KC/KC4.xml,KC4RE008,6501,6,,A,5,1,(()) ,[],X
K/KC/KC4.xml,KC4RE008,6501,7,,B,6,1,"Well that's just to show people, you know, it wasn't so bad.","[Well/RB, that/DT, 's/VBZ, just/RB, to/TO, show/VB, people/NNS, ,/,, you/PRP, know/VBP, ,/,, it/PRP, wasn/VBD, 't/PRP, so/RB, bad/JJ, ./.]","(ROOT (S (ADVP (RB Well)) (PRN (S (NP (DT that)) (VP (VBZ 's) (ADVP (RB just)) (S (VP (TO to) (VP (VB show) (NP (NNS people))))))) (, ,) (S (NP (PRP you)) (VP (VBP know))) (, ,)) (NP (PRP it)) (VP (VBD wasn) (S (NP (PRP 't)) (ADJP (RB so) (JJ bad)))) (. .)))"
K/KC/KC4.xml,KC4RE008,6501,8,,B,6,2,They did tape conversation detail when (()) .,"[They/PRP, did/VBD, tape/NN, conversation/NN, detail/NN, when/WRB, ./.]",(ROOT (S (NP (PRP They)) (VP (VBD did) (NP (NP (NN tape) (NN conversation) (NN detail)) (FRAG (WHADVP (WRB when))))) (. .)))
K/KC/KC4.xml,KC4RE008,6501,9,,A,7,1,(()) .,[./.],(ROOT (NP (. .)))
K/KC/KC4.xml,KC4RE008,6501,10,,A,7,2,Picked that up as well will it?,"[Picked/VBN, that/IN, up/RB, as/RB, well/RB, will/MD, it/PRP, ?/.]",(ROOT (S (VP (VBN Picked) (SBAR (IN that) (SINV (ADVP (RB up) (RB as) (RB well)) (VP (MD will)) (NP (PRP it))))) (. ?)))
K/KC/KC4.xml,KC4RE008,6501,11,,B,8,1,"Oh yes, pick anything up in the room I think, you know, that's reasonable loud, not to worry  <laugh> we were talking, talking about Shetland's Lowe weren't we?<laugh> ","[Oh/UH, yes/UH, ,/,, pick/VB, anything/NN, up/RB, in/IN, the/DT, room/NN, I/PRP, think/VBP, ,/,, you/PRP, know/VBP, ,/,, that/DT, 's/VBZ, reasonable/JJ, loud/JJ, ,/,, not/RB, to/TO, worry/VB, we/PRP, were/VBD, talking/VBG, ,/,, talking/VBG, about/IN, Shetland/NNP, 's/POS, Lowe/NNP, weren/NNP, 't/PRP, we/PRP, ?/.]","(ROOT (S (S (INTJ (UH Oh) (UH yes)) (, ,) (VP (VB pick) (NP (NN anything)) (ADVP (RB up) (PP (IN in) (NP (NP (DT the) (NN room)) (SBAR (S (NP (PRP I)) (VP (VBP think))))))))) (, ,) (NP (PRP you)) (VP (VBP know) (PRN (, ,) (S (NP (DT that)) (VP (VBZ 's) (ADJP (JJ reasonable) (JJ loud)) (, ,) (S (RB not) (VP (TO to) (VP (VB worry) (SBAR (S (NP (PRP we)) (VP (VBD were) (VP (VBG talking) (, ,) (S (VP (VBG talking) (PP (IN about) (NP (NP (NNP Shetland) (POS 's)) (NNP Lowe) (NNP weren))) (NP (PRP 't)))))))))))))) (NP (PRP we))) (. ?)))"
K/KC/KC4.xml,KC4RE008,6501,12,,A,9,1,"Shetland's Lowe, yeah.","[Shetland/NNP, 's/POS, Lowe/NNP, ,/,, yeah/UH, ./.]","(ROOT (S (NP (NP (NNP Shetland) (POS 's)) (NNP Lowe)) (, ,) (VP (UH yeah)) (. .)))"
K/KC/KC4.xml,KC4RE008,6501,13,,B,10,1,Yeah .,"[Yeah/UH, ./.]",(ROOT (INTJ (UH Yeah) (. .)))
K/KC/KC4.xml,KC4RE008,6501,14,,B,10,2,"Haven't you ever been up, you've never been up there?","[Haven/NNP, 't/PRP, you/PRP, ever/RB, been/VBN, up/RB, ,/,, you/PRP, 've/VBP, never/RB, been/VBN, up/IN, there/EX, ?/.]","(ROOT (NP (NP (NP (NNP Haven)) (NP (PRP 't))) (ADJP (NP (PRP you)) (RB ever)) (VP (VBN been) (ADVP (RB up))) (, ,) (S (NP (PRP you)) (VP (VBP 've) (ADVP (RB never)) (VP (VBN been) (PP (IN up) (NP (EX there)))))) (. ?)))"
K/KC/KC4.xml,KC4RE008,6501,15,,A,11,1,"I, no, I've never been round much.","[I/PRP, ,/,, no/DT, ,/,, I/PRP, 've/VBP, never/RB, been/VBN, round/JJ, much/RB, ./.]","(ROOT (S (NP (PRP I)) (, ,) (ADVP (DT no)) (, ,) (NP (PRP I)) (VP (VBP 've) (ADVP (RB never)) (VP (VBN been) (ADJP (JJ round) (RB much)))) (. .)))"
K/KC/KC4.xml,KC4RE008,6501,16,,B,12,1,"Well no, we always, we always ","[Well/RB, no/DT, ,/,, we/PRP, always/RB, ,/,, we/PRP, always/RB]","(ROOT (S (NP (NP (NP (ADVP (RB Well)) (DT no)) (, ,) (NP (NP (PRP we)) (ADVP (RB always)))) (, ,) (NP (PRP we))) (ADJP (RB always))))"
K/KC/KC4.xml,KC4RE008,6501,17,,A,13,1,(()) high.,"[high/JJ, ./.]",(ROOT (FRAG (ADJP (JJ high)) (. .)))
K/KC/KC4.xml,KC4RE008,6501,18,,B,14,1,We always went the other way didn't we?,"[We/PRP, always/RB, went/VBD, the/DT, other/JJ, way/NN, didn/NN, 't/PRP, we/PRP, ?/.]",(ROOT (S (NP (PRP We)) (ADVP (RB always)) (VP (VBD went) (S (NP (NP (DT the) (JJ other) (NN way) (NN didn)) (NP (PRP 't))) (NP (PRP we)))) (. ?)))
K/KC/KC4.xml,KC4RE008,6501,19,,B,14,2,Into erm ,"[Into/IN, erm/NN]",(ROOT (PP (IN Into) (NP (NN erm))))
K/KC/KC4.xml,KC4RE008,6501,20,,A,15,1,"Which , which you can come up through through the Ambridge ","[Which/WDT, ,/,, which/WDT, you/PRP, can/MD, come/VB, up/RP, through/IN, through/IN, the/DT, Ambridge/NNP]","(ROOT (SBARQ (WHNP (WDT Which)) (, ,) (WHNP (WDT which) (NP (PRP you))) (SQ (MD can) (VP (VB come) (PRT (RP up)) (PP (IN through) (PP (IN through) (NP (DT the) (NNP Ambridge))))))))"
K/KC/KC4.xml,KC4RE008,6501,21,,B,16,1,"Danbridge or you can come up Danbridge in the  (()) up to Wolvercloth, yes, but I've never been, it's the first time I've ever been anywhere near the shopping  (()) ","[Danbridge/NNP, or/CC, you/PRP, can/MD, come/VB, up/RP, Danbridge/NNP, in/IN, the/DT, up/NN, to/TO, Wolvercloth/NN, ,/,, yes/UH, ,/,, but/CC, I/PRP, 've/VBP, never/RB, been/VBN, ,/,, it/PRP, 's/VBZ, the/DT, first/JJ, time/NN, I/PRP, 've/VBP, ever/RB, been/VBN, anywhere/RB, near/IN, the/DT, shopping/NN]","(ROOT (S (NP (NNP Danbridge) (CC or) (PRP you)) (VP (MD can) (VP (VB come) (PRT (RP up)) (NP (NP (NNP Danbridge)) (PP (IN in) (NP (NP (DT the) (NN up)) (PP (TO to) (NP (NN Wolvercloth)))))) (, ,) (S (S (INTJ (UH yes)) (, ,) (CC but) (NP (PRP I)) (VP (VBP 've) (ADVP (RB never)) (VP (VBN been)))) (, ,) (S (NP (PRP it)) (VP (VBZ 's) (NP (NP (DT the) (JJ first) (NN time)) (SBAR (S (NP (PRP I)) (VP (VBP 've) (ADVP (RB ever)) (VP (VBN been) (ADVP (RB anywhere)) (PP (IN near) (NP (DT the) (NN shopping)))))))))))))))"
K/KC/KC4.xml,KC4RE008,6501,22,,A,17,1,"But, that where we went to that pub that time with Geoff, that's the first time I've been up there.","[But/CC, ,/,, that/IN, where/WRB, we/PRP, went/VBD, to/TO, that/DT, pub/NN, that/WDT, time/NN, with/IN, Geoff/NNP, ,/,, that/DT, 's/VBZ, the/DT, first/JJ, time/NN, I/PRP, 've/VBP, been/VBN, up/RB, there/RB, ./.]","(ROOT (S (CC But) (, ,) (SBAR (IN that) (S (SBAR (WHADVP (WRB where)) (S (NP (PRP we)) (VP (VBD went) (PP (TO to) (NP (NP (DT that) (NN pub)) (SBAR (WHNP (WDT that)) (S (VP (NN time) (PP (IN with) (NP (NNP Geoff))))))))))) (, ,) (NP (DT that)) (VP (VBZ 's) (NP (DT the) (JJ first) (NN time))))) (NP (PRP I)) (VP (VBP 've) (VP (VBN been) (ADVP (RB up) (RB there)))) (. .)))"
K/KC/KC4.xml,KC4RE008,6501,23,,B,18,1,"I can't remember the name of that pub, I can't remember the names of anything ","[I/PRP, can/MD, 't/PRP, remember/VB, the/DT, name/NN, of/IN, that/DT, pub/NN, ,/,, I/PRP, can/MD, 't/PRP, remember/VB, the/DT, names/NNS, of/IN, anything/NN]","(ROOT (S (NP (PRP I)) (VP (MD can) (NP (PRP 't)) (S (VP (VB remember) (NP (NP (DT the) (NN name)) (PP (IN of) (NP (DT that) (NN pub))) (, ,) (SBAR (S (NP (PRP I)) (VP (MD can) (NP (PRP 't)) (S (VP (VB remember) (NP (NP (DT the) (NNS names)) (PP (IN of) (NP (NN anything)))))))))))))))"
K/KC/KC4.xml,KC4RE008,6501,24,,A,19,1,"I forgotten the name but in the hollow, in the  (()) yes, a very narrow valley, just in the hollow ","[I/PRP, forgotten/VBD, the/DT, name/NN, but/CC, in/IN, the/DT, hollow/JJ, ,/,, in/IN, the/DT, yes/NNP, ,/,, a/DT, very/RB, narrow/JJ, valley/NNP, ,/,, just/RB, in/IN, the/DT, hollow/JJ]","(ROOT (S (NP (PRP I)) (VP (VBD forgotten) (NP (NP (DT the) (NN name)) (PP (CC but) (PP (IN in) (NP (DT the) (JJ hollow))) (, ,) (PP (IN in) (NP (NP (DT the) (NNP yes)) (, ,) (NP (DT a) (ADJP (RB very) (JJ narrow)) (NNP valley)) (, ,))) (PRN (PP (ADVP (RB just)) (IN in) (NP (DT the) (JJ hollow)))))))))"
K/KC/KC4.xml,KC4RE008,6501,25,,B,20,1,Yes.,"[Yes/UH, ./.]",(ROOT (INTJ (UH Yes) (. .)))
K/KC/KC4.xml,KC4RE008,6501,26,,B,20,2,It's in the (()) .,"[It/PRP, 's/VBZ, in/IN, the/DT, ./.]",(ROOT (S (NP (PRP It)) (VP (VBZ 's) (PP (IN in) (NP (DT the)))) (. .)))
K/KC/KC4.xml,KC4RE008,6501,27,,A,21,1,I gave them a  (()) right across Cheshire from that.,"[I/PRP, gave/VBD, them/PRP, a/DT, right/JJ, across/IN, Cheshire/NNP, from/IN, that/DT, ./.]",(ROOT (S (NP (PRP I)) (VP (VBD gave) (NP (PRP them)) (NP (NP (DT a) (JJ right)) (PP (IN across) (NP (NNP Cheshire)))) (PP (IN from) (NP (DT that)))) (. .)))
K/KC/KC4.xml,KC4RE008,6501,28,,B,22,1,"Yeah, and there's a nice little erm, stream runs through the valley.","[Yeah/UH, ,/,, and/CC, there/EX, 's/VBZ, a/DT, nice/JJ, little/JJ, erm/NN, ,/,, stream/NN, runs/VBZ, through/IN, the/DT, valley/NNP, ./.]","(ROOT (S (S (INTJ (UH Yeah)) (, ,) (CC and) (NP (EX there)) (VP (VBZ 's) (NP (DT a) (JJ nice) (JJ little) (NN erm)))) (, ,) (NP (NN stream)) (VP (VBZ runs) (PP (IN through) (NP (DT the) (NNP valley)))) (. .)))"
K/KC/KC4.xml,KC4RE008,6501,29,,A,23,1,"It's over that forest, what'll they call it?","[It/PRP, 's/VBZ, over/IN, that/DT, forest/NN, ,/,, what/WDT, 'll/MD, they/PRP, call/VB, it/PRP, ?/.]","(ROOT (S (NP (PRP It)) (VP (VBZ 's) (PP (IN over) (NP (NP (DT that) (NN forest)) (, ,) (SBAR (WHNP (WDT what)) (S (VP (MD 'll) (NP (PRP they)) (S (VP (VB call) (NP (PRP it)))))))))) (. ?)))"
K/KC/KC4.xml,KC4RE008,6501,30,,B,24,1,Macclesfield forest.,"[Macclesfield/NNP, forest/NNP, ./.]",(ROOT (NP (NNP Macclesfield) (NNP forest) (. .)))
K/KC/KC4.xml,KC4RE008,6501,31,,A,25,1,"Macclesfield forest, yes.","[Macclesfield/NNP, forest/NNP, ,/,, yes/RB, ./.]","(ROOT (NP (NP (NNP Macclesfield) (NNP forest)) (, ,) (NP (RB yes)) (. .)))"
K/KC/KC4.xml,KC4RE008,6501,32,,B,26,1,"Well Macclesfield forest is the other side of Shuttlings Road, do way the pub, pub is ","[Well/RB, Macclesfield/NNP, forest/NNP, is/VBZ, the/DT, other/JJ, side/NN, of/IN, Shuttlings/NNS, Road/NN, ,/,, do/VBP, way/NN, the/DT, pub/NN, ,/,, pub/NN, is/VBZ]","(ROOT (SINV (ADVP (RB Well)) (VP (S (NP (NP (NNP Macclesfield) (NNP forest)) (SBAR (S (VP (VBZ is) (NP (NP (DT the) (JJ other) (NN side)) (PP (IN of) (NP (NNS Shuttlings) (NN Road))))))))) (, ,) (VP (VBP do) (NP (NN way)))) (NP (NP (DT the) (NN pub)) (, ,) (NP (NP (NN pub)) (VP (VBZ is))))))"
K/KC/KC4.xml,KC4RE008,6501,33,,A,27,1,"Yes, the other side of the road.","[Yes/UH, ,/,, the/DT, other/JJ, side/NN, of/IN, the/DT, road/NN, ./.]","(ROOT (FRAG (INTJ (UH Yes)) (, ,) (NP (NP (DT the) (JJ other) (NN side)) (PP (IN of) (NP (DT the) (NN road)))) (. .)))"
K/KC/KC4.xml,KC4RE008,6501,34,,B,28,1,"To where eh Wilbur club, that's Wilbur club, that erm, the Wilbur club, cos we  (()) ","[To/TO, where/WRB, eh/UH, Wilbur/NNP, club/NNP, ,/,, that/DT, 's/VBZ, Wilbur/NNP, club/NNP, ,/,, that/IN, erm/NN, ,/,, the/DT, Wilbur/NNP, club/NNP, ,/,, cos/NN, we/PRP]","(ROOT (X (SBAR (X (TO To)) (S (SBAR (WHADVP (WRB where)) (S (VP (NP (INTJ (UH eh)) (NP (NNP Wilbur) (NNP club)))))) (, ,) (NP (DT that)) (VP (VBZ 's) (NP (NNP Wilbur) (NNP club))))) (, ,) (X (X (IN that)) (NP (NP (NN erm)) (, ,) (NP (DT the) (NNP Wilbur) (NNP club)) (, ,) (NP (NN cos)))) (NP (PRP we))))"
K/KC/KC4.xml,KC4RE008,6501,35,,A,29,1,You're really not far from Swithen  (()) there.,"[You/PRP, 're/VBP, really/RB, not/RB, far/RB, from/IN, Swithen/NN, there/RB, ./.]",(ROOT (S (NP (PRP You)) (VP (VBP 're) (ADVP (RB really)) (ADJP (RB not) (RB far) (PP (IN from) (NP (NN Swithen)))) (ADVP (RB there))) (. .)))
K/KC/KC4.xml,KC4RE008,6501,36,,B,30,1,From where?,"[From/IN, where/WRB, ?/.]",(ROOT (S (VP (PP (IN From) (FRAG (WHADVP (WRB where))))) (. ?)))
K/KC/KC4.xml,KC4RE008,6501,37,,B,30,2,"Swithen, we know, you're not far.","[Swithen/NNP, ,/,, we/PRP, know/VBP, ,/,, you/PRP, 're/VBP, not/RB, far/RB, ./.]","(ROOT (S (NP (NNP Swithen)) (, ,) (PRN (S (NP (PRP we)) (VP (VBP know)))) (, ,) (NP (PRP you)) (VP (VBP 're) (RB not) (ADVP (RB far))) (. .)))"
K/KC/KC4.xml,KC4RE008,6501,38,,B,30,3,"Well Danbridge, yes ","[Well/RB, Danbridge/NNP, ,/,, yes/NNP]","(ROOT (NP (NP (RB Well) (NNP Danbridge)) (, ,) (NP (NNP yes))))"
K/KC/KC4.xml,KC4RE008,6501,39,,A,31,1,That's Swithen is just down ,"[That/DT, 's/VBZ, Swithen/NN, is/VBZ, just/RB, down/RB]",(ROOT (S (NP (DT That)) (VP (VBZ 's) (NP (NP (NN Swithen)) (SBAR (S (VP (VBZ is) (ADVP (RB just) (RB down)))))))))
K/KC/KC4.xml,KC4RE008,6501,40,,B,32,1,It's Weathernly as it's more or less.,"[It/PRP, 's/VBZ, Weathernly/RB, as/IN, it/PRP, 's/VBZ, more/JJR, or/CC, less/JJR, ./.]",(ROOT (S (NP (PRP It)) (VP (VBZ 's) (ADVP (RB Weathernly)) (SBAR (IN as) (S (NP (PRP it)) (VP (VBZ 's) (ADJP (JJR more) (CC or) (JJR less)))))) (. .)))
K/KC/KC4.xml,KC4RE008,6501,41,,A,33,1,No it's Danbridge.,"[No/DT, it/PRP, 's/VBZ, Danbridge/NNP, ./.]",(ROOT (S (NP (DT No) (PRP it)) (VP (VBZ 's) (NP (NNP Danbridge))) (. .)))
K/KC/KC4.xml,KC4RE008,6501,42,,A,33,2,"Back of Danbridge, back of Danbridge, that's right.","[Back/RB, of/IN, Danbridge/NNP, ,/,, back/RB, of/IN, Danbridge/NNP, ,/,, that/DT, 's/VBZ, right/NN, ./.]","(ROOT (S (ADVP (RB Back) (PP (IN of) (NP (NNP Danbridge)))) (, ,) (PP (ADVP (RB back)) (IN of) (NP (NNP Danbridge))) (, ,) (NP (DT that)) (VP (VBZ 's) (NP (NN right))) (. .)))"
K/KC/KC4.xml,KC4RE008,6501,43,,A,33,3,Yeah.,"[Yeah/UH, ./.]",(ROOT (INTJ (UH Yeah) (. .)))
K/KC/KC4.xml,KC4RE008,6501,44,,B,34,1,(()) that  (()) of body of whatever it was who where there have left.,"[that/DT, of/IN, body/NN, of/IN, whatever/WDT, it/PRP, was/VBD, who/WP, where/WRB, there/EX, have/VBP, left/VBN, ./.]",(ROOT (NP (NP (DT that)) (PP (IN of) (NP (NP (NN body)) (SBAR (WHPP (IN of) (WHNP (WDT whatever))) (S (NP (PRP it)) (VP (VBD was) (NP (WP who)) (SBAR (WHADVP (WRB where)) (S (NP (EX there)) (VP (VBP have) (VP (VBN left)))))))))) (. .)))
K/KC/KC4.xml,KC4RE008,6501,45,,A,35,1,<<REDACTED (name)>> Sir   (()) <<REDACTED (name)>> lived there.,"[>/JJR, Sir/NNP, >/JJR, lived/VBD, there/EX, ./.]",(ROOT (S (NP (NP (ADJP (JJR >)) (NNP Sir)) (ADJP (JJR >))) (VP (VBD lived) (S (NP (EX there)))) (. .)))
K/KC/KC4.xml,KC4RE008,6501,46,,B,36,1,"<<REDACTED (name)>> yes , ah  <<REDACTED (name)>> sold it but, it went to us, some eh, either Indian or Buddhist erm","[>/JJR, yes/UH, ,/,, ah/NN, >/JJR, sold/VBD, it/PRP, but/CC, ,/,, it/PRP, went/VBD, to/TO, us/PRP, ,/,, some/DT, eh/UH, ,/,, either/CC, Indian/JJ, or/CC, Buddhist/JJ, erm/NN]","(ROOT (NP (NP (NP (NP (JJR >)) (SBAR (S (INTJ (UH yes)) (, ,) (NP (NP (NN ah)) (ADJP (JJR >))) (VP (VBD sold) (SBAR (S (NP (PRP it)) (ADVP (CC but)) (, ,) (NP (PRP it)) (VP (VBD went) (PP (TO to) (NP (PRP us)))))))))) (PRN (, ,) (SBAR (WHNP (DT some)) (FRAG (INTJ (UH eh)))) (, ,))) (PP (CC either) (NP (JJ Indian) (CC or) (JJ Buddhist) (NN erm)))))"
K/KC/KC4.xml,KC4RE008,6501,47,,A,37,1,Oh did he?,"[Oh/UH, did/VBD, he/PRP, ?/.]",(ROOT (SBARQ (WHNP (UH Oh)) (SQ (VP (VBD did) (NP (PRP he)))) (. ?)))
K/KC/KC4.xml,KC4RE008,6501,48,,B,38,1,"Yeah, Buddhist religious group, but they, no they've eh, apparently it's been sold again now.","[Yeah/UH, ,/,, Buddhist/NNP, religious/JJ, group/NN, ,/,, but/CC, they/PRP, ,/,, no/DT, they/PRP, 've/VBP, eh/UH, ,/,, apparently/RB, it/PRP, 's/VBZ, been/VBN, sold/VBN, again/RB, now/RB, ./.]","(ROOT (S (INTJ (UH Yeah)) (, ,) (NP (NNP Buddhist) (JJ religious) (NN group)) (PRN (, ,) (PP (CC but) (NP (PRP they))) (, ,)) (NP (DT no) (PRP they)) (VP (VBP 've) (S (INTJ (UH eh)) (, ,) (ADVP (RB apparently)) (NP (PRP it)) (VP (VBZ 's) (VP (VBN been) (VP (VBN sold) (ADVP (RB again)) (ADVP (RB now))))))) (. .)))"
K/KC/KC4.xml,KC4RE008,6501,49,,A,39,1,(()) ,[],X
K/KC/KC4.xml,KC4RE008,6501,50,,B,40,1,"It's not, they haven't got it anymore.","[It/PRP, 's/VBZ, not/RB, ,/,, they/PRP, haven/NN, 't/PRP, got/VBD, it/PRP, anymore/RB, ./.]","(ROOT (S (S (S (NP (PRP It)) (VP (VBZ 's) (RB not))) (, ,) (S (NP (PRP they)) (NP (NN haven)))) (NP (PRP 't)) (VP (VBD got) (NP (PRP it)) (ADVP (RB anymore))) (. .)))"
K/KC/KC4.xml,KC4RE008,6501,51,,A,41,1,What was the name of that place at Broadhurst something Hall?,"[What/WP, was/VBD, the/DT, name/NN, of/IN, that/DT, place/NN, at/IN, Broadhurst/NNP, something/NN, Hall/NN, ?/.]",(ROOT (SBARQ (WHNP (WP What)) (SQ (VBD was) (NP (NP (DT the) (NN name)) (PP (IN of) (NP (NP (DT that) (NN place)) (PP (IN at) (NP (NNP Broadhurst) (NN something) (NN Hall))))))) (. ?)))
K/KC/KC4.xml,KC4RE008,6501,52,,B,42,1,"Swithinly Hall, isn't it?","[Swithinly/NNP, Hall/NNP, ,/,, isn/NNP, 't/PRP, it/PRP, ?/.]","(ROOT (NP (NP (NNP Swithinly) (NNP Hall) (, ,) (NNP isn)) (NP (NP (PRP 't)) (NP (PRP it))) (. ?)))"
K/KC/KC4.xml,KC4RE008,6501,53,,A,43,1,Swithinly Hall ah.,"[Swithinly/NNP, Hall/NNP, ah/NN, ./.]",(ROOT (NP (NP (NNP Swithinly) (NNP Hall)) (NP (NN ah)) (. .)))
K/KC/KC4.xml,KC4RE008,6501,54,,B,44,1,But it was a nice walk.,"[But/CC, it/PRP, was/VBD, a/DT, nice/JJ, walk/NN, ./.]",(ROOT (S (CC But) (NP (PRP it)) (VP (VBD was) (NP (DT a) (JJ nice) (NN walk))) (. .)))
K/KC/KC4.xml,KC4RE008,6501,55,,A,45,1,"When, when you come to think about it, around  (()) in that area.","[When/WRB, ,/,, when/WRB, you/PRP, come/VBP, to/TO, think/VB, about/IN, it/PRP, ,/,, around/IN, in/IN, that/DT, area/NN, ./.]","(ROOT (SBARQ (WHADVP (WRB When)) (, ,) (WHADVP (WRB when)) (SQ (NP (PRP you)) (VP (VBP come) (S (VP (TO to) (VP (VB think) (PP (IN about) (NP (PRP it))) (, ,) (ADVP (IN around) (PP (IN in) (NP (DT that) (NN area))))))))) (. .)))"
K/KC/KC4.xml,KC4RE008,6501,56,,B,46,1,I like that side of the steep ditch there.,"[I/PRP, like/VBP, that/DT, side/NN, of/IN, the/DT, steep/JJ, ditch/NN, there/RB, ./.]",(ROOT (S (NP (PRP I)) (VP (VBP like) (NP (NP (DT that) (NN side)) (PP (IN of) (NP (DT the) (JJ steep) (NN ditch)))) (ADVP (RB there))) (. .)))
K/KC/KC4.xml,KC4RE008,6501,57,,A,47,1,There's always the Tulip valley there.,"[There/EX, 's/VBZ, always/RB, the/DT, Tulip/NNP, valley/NNP, there/RB, ./.]",(ROOT (S (NP (EX There)) (VP (VBZ 's) (ADVP (RB always)) (NP (NP (DT the) (NNP Tulip) (NNP valley)) (ADVP (RB there)))) (. .)))
K/KC/KC4.xml,KC4RE008,6501,58,,B,48,1,Yeah Tulip valley.,"[Yeah/UH, Tulip/NNP, valley/NNP, ./.]",(ROOT (S (VP (NP (INTJ (UH Yeah)) (NP (NNP Tulip) (NNP valley)))) (. .)))
K/KC/KC4.xml,KC4RE008,6501,59,,A,49,1,Ditch and Consul.,"[Ditch/NN, and/CC, Consul/NN, ./.]",(ROOT (NP (NP (NP (NN Ditch)) (CC and) (NP (NN Consul))) (. .)))
K/KC/KC4.xml,KC4RE008,6501,60,,B,50,1,Consul.,"[Consul/NN, ./.]",(ROOT (NP (NN Consul) (. .)))
K/KC/KC4.xml,KC4RE008,6501,61,,A,51,1,It's,"[It/PRP, 's/VBZ]",(ROOT (S (NP (PRP It)) (VP (VBZ 's))))
K/KC/KC4.xml,KC4RE008,6501,62,,B,52,1,"They've got a big eh, what, erm,(()) park there now, country park.","[They/PRP, 've/VBP, got/VBD, a/DT, big/JJ, eh/UH, ,/,, what/WP, ,/,, erm/NN, ,/,, park/NN, there/RB, now/RB, ,/,, country/NN, park/NN, ./.]","(ROOT (S (NP (PRP They)) (VP (VBP 've) (VP (VBD got) (NP (NP (DT a) (JJ big)) (FRAG (INTJ (UH eh)))))) (, ,) (X (NP (NP (WP what)) (, ,) (NP (NN erm)) (, ,) (NP (NP (NN park)) (ADVP (RB there) (RB now))) (, ,) (NP (NN country) (NN park)))) (. .)))"
K/KC/KC4.xml,KC4RE008,6501,63,,A,53,1,"Has it got, got over the who?","[Has/VBZ, it/PRP, got/VBD, ,/,, got/VBD, over/IN, the/DT, who/WP, ?/.]","(ROOT (S (S (VP (VBZ Has) (SBAR (S (NP (PRP it)) (VP (VBD got)))))) (, ,) (VP (VBD got) (PP (IN over) (NP (NP (DT the)) (SBAR (WHNP (WP who)))))) (. ?)))"
K/KC/KC4.xml,KC4RE008,6501,64,,B,54,1,The Consul.,"[The/DT, Consul/NN, ./.]",(ROOT (NP (DT The) (NN Consul) (. .)))
K/KC/KC4.xml,KC4RE008,6501,65,,A,55,1,But on the other side you've got Dovedale and Manifold ,"[But/CC, on/IN, the/DT, other/JJ, side/NN, you/PRP, 've/VBP, got/VBN, Dovedale/NN, and/CC, Manifold/NN]",(ROOT (FRAG (CC But) (PP (IN on) (NP (NP (DT the) (JJ other) (NN side)) (SBAR (S (NP (PRP you)) (VP (VBP 've) (VP (VBN got) (NP (NN Dovedale) (CC and) (NN Manifold))))))))))
K/KC/KC4.xml,KC4RE008,6501,66,,B,56,1,"Don't know , oh Dovedale is one of the, one, one of the prettiest Dales in England I think, and eh the Manifold.","[Don/NNP, 't/PRP, know/VBP, ,/,, oh/UH, Dovedale/FW, is/VBZ, one/CD, of/IN, the/DT, ,/,, one/CD, ,/,, one/CD, of/IN, the/DT, prettiest/JJS, Dales/NNS, in/IN, England/NNP, I/PRP, think/VBP, ,/,, and/CC, eh/UH, the/DT, Manifold/NN, ./.]","(ROOT (S (S (NP (NNP Don) (PRP 't)) (VP (VBP know))) (, ,) (S (INTJ (UH oh)) (NP (FW Dovedale)) (VP (VBZ is) (NP (NP (CD one)) (PP (IN of) (NP (NP (DT the)) (, ,) (NP (NP (CD one)) (, ,) (NP (NP (CD one)) (PP (IN of) (NP (NP (DT the) (JJS prettiest) (NNS Dales)) (PP (IN in) (UCP (NP (NP (NNP England)) (SBAR (S (NP (PRP I)) (VP (VBP think))))) (, ,) (CC and) (FRAG (INTJ (UH eh))))))))))) (NP (DT the) (NN Manifold))))) (. .)))"
K/KC/KC4.xml,KC4RE008,6501,67,,B,56,2,It doesn't seem to vanish as much as it used to.,"[It/PRP, doesn/VBD, 't/PRP, seem/VB, to/TO, vanish/VB, as/RB, much/JJ, as/IN, it/PRP, used/VBD, to/TO, ./.]",(ROOT (S (NP (PRP It)) (VP (VBD doesn) (S (NP (PRP 't)) (VP (VB seem) (S (VP (TO to) (VP (VB vanish) (ADVP (ADVP (RB as) (JJ much)) (SBAR (IN as) (S (NP (PRP it)) (VP (VBD used) (PP (TO to)))))))))))) (. .)))
K/KC/KC4.xml,KC4RE008,6501,68,,A,57,1,Mm.,"[Mm/NN, ./.]",(ROOT (NP (NN Mm) (. .)))
K/KC/KC4.xml,KC4RE008,6501,69,,B,58,1,"Doesn't seem to vanish as much as it used to, the Manifold, used to be dry in places most of the summer.","[Doesn/NNP, 't/PRP, seem/VBP, to/TO, vanish/VB, as/RB, much/JJ, as/IN, it/PRP, used/VBD, to/TO, ,/,, the/DT, Manifold/NN, ,/,, used/VBN, to/TO, be/VB, dry/JJ, in/IN, places/NNS, most/JJS, of/IN, the/DT, summer/NN, ./.]","(ROOT (S (NP (NP (NP (NNP Doesn)) (SBAR (S (NP (PRP 't)) (VP (VBP seem) (S (VP (TO to) (VP (VB vanish) (ADVP (ADVP (RB as) (JJ much)) (SBAR (IN as) (S (NP (PRP it)) (VP (VBD used) (PP (TO to))))))))))))) (, ,) (NP (DT the) (NN Manifold)) (, ,)) (VP (VBN used) (S (VP (TO to) (VP (VB be) (ADJP (JJ dry) (PP (IN in) (NP (NNS places)))) (NP (NP (JJS most)) (PP (IN of) (NP (DT the) (NN summer)))))))) (. .)))"
K/KC/KC4.xml,KC4RE008,6501,70,,A,59,1,It goes underground.,"[It/PRP, goes/VBZ, underground/RB, ./.]",(ROOT (S (NP (PRP It)) (VP (VBZ goes) (ADVP (RB underground))) (. .)))
K/KC/KC4.xml,KC4RE008,6501,71,,B,60,1,"I know it goes underground, but it doesn't seem to so much these days.","[I/PRP, know/VBP, it/PRP, goes/VBZ, underground/JJ, ,/,, but/CC, it/PRP, doesn/VBD, 't/PRP, seem/VB, to/TO, so/RB, much/JJ, these/DT, days/NNS, ./.]","(ROOT (S (S (NP (PRP I)) (VP (VBP know) (SBAR (S (NP (PRP it)) (VP (VBZ goes) (NP (JJ underground))))))) (, ,) (CC but) (S (NP (PRP it)) (VP (VBD doesn) (S (NP (PRP 't)) (VP (VB seem) (PP (TO to) (NP (ADVP (RB so) (JJ much)) (DT these) (NNS days))))))) (. .)))"
K/KC/KC4.xml,KC4RE008,6501,72,,A,61,1,Doesn't it?,"[Doesn/NNP, 't/PRP, it/PRP, ?/.]",(ROOT (NP (NP (NNP Doesn)) (NP (NP (PRP 't)) (NP (PRP it))) (. ?)))
K/KC/KC4.xml,KC4RE008,6501,73,,B,62,1,"No, why I haven't seen it for dry down there for years.","[No/DT, ,/,, why/WRB, I/PRP, haven/NN, 't/PRP, seen/VBD, it/PRP, for/IN, dry/JJ, down/IN, there/EX, for/IN, years/NNS, ./.]","(ROOT (S (NP (NP (DT No)) (, ,) (SBAR (WHADVP (WRB why)) (S (NP (PRP I)) (VP (NN haven) (NP (PRP 't)))))) (VP (VBD seen) (NP (PRP it)) (PP (IN for) (ADJP (JJ dry))) (PP (IN down) (NP (EX there))) (PP (IN for) (NP (NNS years)))) (. .)))"
K/KC/KC4.xml,KC4RE008,6501,74,,A,63,1,Of course.,"[Of/IN, course/NN, ./.]",(ROOT (FRAG (PP (IN Of) (NP (NN course))) (. .)))
K/KC/KC4.xml,KC4RE008,6501,75,,A,63,2,Contact why (()) .,"[Contact/NN, why/WRB, ./.]",(ROOT (S (VP (NN Contact) (FRAG (WHADVP (WRB why)))) (. .)))
K/KC/KC4.xml,KC4RE008,6501,76,,B,64,1,"Yes, well  --","[Yes/UH, ,/,, well/RB, I/PRP, like/VBP, Eadales/NNS, too/RB, ./.]","(ROOT (S (INTJ (UH Yes)) (, ,) (ADVP (RB well)) (NP (PRP I)) (VP (VBP like) (NP (NNS Eadales)) (ADVP (RB too))) (. .)))"
K/KC/KC4.xml,KC4RE008,6501,77,,B,64,2,--I like Eadales too.,"[Yes/UH, ,/,, well/RB, I/PRP, like/VBP, Eadales/NNS, too/RB, ./.]","(ROOT (S (INTJ (UH Yes)) (, ,) (ADVP (RB well)) (NP (PRP I)) (VP (VBP like) (NP (NNS Eadales)) (ADVP (RB too))) (. .)))"
K/KC/KC4.xml,KC4RE008,6501,78,,A,65,1,(()) ,[],X
K/KC/KC4.xml,KC4RE008,6501,79,,B,66,1,"No,(()) Loinshendale isn't it?","[No/DT, ,/,, Loinshendale/JJ, isn/NN, 't/PRP, it/PRP, ?/.]","(ROOT (NP (NP (DT No)) (, ,) (NP (NP (JJ Loinshendale) (NN isn)) (NP (PRP 't)) (NP (PRP it))) (. ?)))"
K/KC/KC4.xml,KC4RE008,6501,80,,A,67,1,"Stop, stop (()) .","[Stop/VB, ,/,, stop/VB, ./.]","(ROOT (S (VP (VP (VB Stop)) (, ,) (VP (VB stop))) (. .)))"
K/KC/KC4.xml,KC4RE008,6501,81,,B,68,1,"Yeah, Walscott (()) .","[Yeah/UH, ,/,, Walscott/NNP, ./.]","(ROOT (FRAG (INTJ (UH Yeah)) (, ,) (NP (NNP Walscott)) (. .)))"
K/KC/KC4.xml,KC4RE008,6501,82,,A,69,1,"Walscott Dale, yeah.","[Walscott/NNP, Dale/NNP, ,/,, yeah/UH, ./.]","(ROOT (NP (NP (NNP Walscott) (NNP Dale)) (, ,) (NP (UH yeah)) (. .)))"
