swda_filename,ptb_basename,conversation_no,transcript_index,act_tag,caller,turn_index,subutterance_index,text,pos,trees
K/KB/KB9.xml,KB9RE00S,62314,0,,A,1,1,What are the ser- terms?,"[What/WP, are/VBP, the/DT, ser-/JJ, terms/NNS, ?/.]",(ROOT (SBARQ (WHNP (WP What)) (SQ (VBP are) (NP (DT the) (JJ ser-) (NNS terms))) (. ?)))
K/KB/KB9.xml,KB9RE00S,62314,1,,A,1,2,Thirty days.,"[Thirty/CD, days/NNS, ./.]",(ROOT (NP (CD Thirty) (NNS days) (. .)))
K/KB/KB9.xml,KB9RE00S,62314,2,,A,1,3,But they're not paying thirty days.,"[But/CC, they/PRP, 're/VBP, not/RB, paying/VBG, thirty/CD, days/NNS, ./.]",(ROOT (S (CC But) (NP (PRP they)) (VP (VBP 're) (RB not) (VP (VBG paying) (NP (CD thirty) (NNS days)))) (. .)))
K/KB/KB9.xml,KB9RE00S,62314,3,,B,2,1,I've just explained that to him.,"[I/PRP, 've/VBP, just/RB, explained/VBN, that/IN, to/TO, him/PRP, ./.]",(ROOT (S (NP (PRP I)) (VP (VBP 've) (ADVP (RB just)) (VP (VBN explained) (SBAR (IN that) (S (VP (TO to) (NP (PRP him))))))) (. .)))
K/KB/KB9.xml,KB9RE00S,62314,4,,B,2,2,"And he said he didn't know that, that he would get hold of Sen and ring me first thing, thing in the morning  --","[And/CC, he/PRP, said/VBD, he/PRP, didn/VB, 't/PRP, know/VB, that/DT, ,/,, that/IN, he/PRP, would/MD, get/VB, hold/VB, of/IN, Sen/NNP, and/CC, ring/VB, me/PRP, first/JJ, thing/NN, ,/,, thing/NN, in/IN, the/DT, morning/NN, er/NN, ,/,, to/TO, tell/VB, me/PRP, why/WRB, Sen/NNP, hasn/NNP, 't/PRP, paid/VBD, ./.]","(ROOT (S (CC And) (NP (PRP he)) (VP (VBD said) (S (NP (PRP he)) (VP (VB didn) (S (NP (PRP 't)) (VP (VB know) (S (NP (NP (DT that)) (, ,) (SBAR (IN that) (S (NP (PRP he)) (VP (MD would) (VP (VP (VB get) (NP (NP (VB hold)) (PP (IN of) (NP (NNP Sen))))) (CC and) (VP (VB ring) (S (NP (PRP me)) (NP (NP (JJ first) (NN thing)) (, ,) (NP (NP (NN thing)) (PP (IN in) (NP (DT the) (NN morning) (NN er))))))))))) (, ,)) (VP (TO to) (VP (VB tell) (NP (PRP me)) (SBAR (WHADVP (WRB why)) (S (NP (NNP Sen) (NNP hasn) (PRP 't)) (VP (VBD paid)))))))))))) (. .)))"
K/KB/KB9.xml,KB9RE00S,62314,5,,B,2,3,"--er, to tell me why Sen hasn't paid.","[And/CC, he/PRP, said/VBD, he/PRP, didn/VB, 't/PRP, know/VB, that/DT, ,/,, that/IN, he/PRP, would/MD, get/VB, hold/VB, of/IN, Sen/NNP, and/CC, ring/VB, me/PRP, first/JJ, thing/NN, ,/,, thing/NN, in/IN, the/DT, morning/NN, er/NN, ,/,, to/TO, tell/VB, me/PRP, why/WRB, Sen/NNP, hasn/NNP, 't/PRP, paid/VBD, ./.]","(ROOT (S (CC And) (NP (PRP he)) (VP (VBD said) (S (NP (PRP he)) (VP (VB didn) (S (NP (PRP 't)) (VP (VB know) (S (NP (NP (DT that)) (, ,) (SBAR (IN that) (S (NP (PRP he)) (VP (MD would) (VP (VP (VB get) (NP (NP (VB hold)) (PP (IN of) (NP (NNP Sen))))) (CC and) (VP (VB ring) (S (NP (PRP me)) (NP (NP (JJ first) (NN thing)) (, ,) (NP (NP (NN thing)) (PP (IN in) (NP (DT the) (NN morning) (NN er))))))))))) (, ,)) (VP (TO to) (VP (VB tell) (NP (PRP me)) (SBAR (WHADVP (WRB why)) (S (NP (NNP Sen) (NNP hasn) (PRP 't)) (VP (VBD paid)))))))))))) (. .)))"
K/KB/KB9.xml,KB9RE00S,62314,6,,B,2,4,He's got the invoice and everything.,"[He/PRP, 's/VBZ, got/VBD, the/DT, invoice/NN, and/CC, everything/NN, ./.]",(ROOT (S (NP (PRP He)) (VP (VBZ 's) (VP (VBD got) (NP (DT the) (NN invoice) (CC and) (NN everything)))) (. .)))
K/KB/KB9.xml,KB9RE00S,62314,7,,B,2,5,I said well you've sent us twenty thou- --,"[I/PRP, said/VBD, well/RB, you/PRP, 've/VBP, sent/VBN, us/PRP, twenty/CD, thou-/JJ, I/NN, said/VBD, there/EX, is/VBZ, no/DT, V/NN, A/DT, T/NN, on/IN, it/PRP, which/WDT, it/PRP, should/MD, be/VB, !/.]",(ROOT (S (NP (PRP I)) (VP (VBD said) (ADVP (RB well)) (SBAR (S (NP (PRP you)) (VP (VBP 've) (VP (VBN sent) (NP (PRP us)) (NP (NP (CD twenty) (JJ thou-) (NN I)) (SBAR (S (VP (VBD said) (SBAR (S (NP (EX there)) (VP (VBZ is) (ADVP (DT no) (NN V)) (NP (NP (DT A) (NN T)) (PP (IN on) (NP (PRP it))) (SBAR (WHNP (WDT which)) (S (NP (PRP it)) (VP (MD should) (VP (VB be)))))))))))))))))) (. !)))
K/KB/KB9.xml,KB9RE00S,62314,8,,B,2,6,--I said there is no V A T on it which it should be!,"[I/PRP, said/VBD, well/RB, you/PRP, 've/VBP, sent/VBN, us/PRP, twenty/CD, thou-/JJ, I/NN, said/VBD, there/EX, is/VBZ, no/DT, V/NN, A/DT, T/NN, on/IN, it/PRP, which/WDT, it/PRP, should/MD, be/VB, !/.]",(ROOT (S (NP (PRP I)) (VP (VBD said) (ADVP (RB well)) (SBAR (S (NP (PRP you)) (VP (VBP 've) (VP (VBN sent) (NP (PRP us)) (NP (NP (CD twenty) (JJ thou-) (NN I)) (SBAR (S (VP (VBD said) (SBAR (S (NP (EX there)) (VP (VBZ is) (ADVP (DT no) (NN V)) (NP (NP (DT A) (NN T)) (PP (IN on) (NP (PRP it))) (SBAR (WHNP (WDT which)) (S (NP (PRP it)) (VP (MD should) (VP (VB be)))))))))))))))))) (. !)))
K/KB/KB9.xml,KB9RE00S,62314,9,,B,2,7,Deary me!,"[Deary/VB, me/PRP, !/.]",(ROOT (S (VP (VB Deary) (NP (PRP me))) (. !)))
K/KB/KB9.xml,KB9RE00S,62314,10,,B,2,8,He says.,"[He/PRP, says/VBZ, ./.]",(ROOT (S (NP (PRP He)) (VP (VBZ says)) (. .)))
K/KB/KB9.xml,KB9RE00S,62314,11,,B,2,9,Has he got the invoi- ?,"[Has/VBZ, he/PRP, got/VBD, the/DT, invoi-/NN, ?/.]",(ROOT (S (VP (VBZ Has) (SBAR (S (NP (PRP he)) (VP (VBD got) (NP (DT the) (NN invoi-)))))) (. ?)))
K/KB/KB9.xml,KB9RE00S,62314,12,,B,2,10,I said yes.,"[I/PRP, said/VBD, yes/UH, ./.]",(ROOT (S (NP (PRP I)) (VP (VBD said) (INTJ (UH yes))) (. .)))
K/KB/KB9.xml,KB9RE00S,62314,13,,B,2,11,"And I said, we've been having, having the invoice outstanding since October at two and half thousand pound!","[And/CC, I/PRP, said/VBD, ,/,, we/PRP, 've/VBP, been/VBN, having/VBG, ,/,, having/VBG, the/DT, invoice/NN, outstanding/JJ, since/IN, October/NNP, at/IN, two/CD, and/CC, half/NN, thousand/CD, pound/NN, !/.]","(ROOT (S (S (CC And) (NP (PRP I)) (VP (VBD said))) (, ,) (NP (PRP we)) (VP (VBP 've) (VP (VBN been) (VP (VBG having) (S (VP (VP (, ,) (S (VP (VBG having) (NP (NP (DT the) (NN invoice)) (ADJP (JJ outstanding) (PP (IN since) (NP (NNP October))))) (PP (IN at) (NP (CD two)))))) (CC and) (VP (ADVP (NN half)) (NP (CD thousand) (NN pound)))))))) (. !)))"
K/KB/KB9.xml,KB9RE00S,62314,14,,B,2,12,"I said, you actually owe me six thousand, one hundred and odd!","[I/PRP, said/VBD, ,/,, you/PRP, actually/RB, owe/VBP, me/PRP, six/CD, thousand/CD, ,/,, one/CD, hundred/CD, and/CC, odd/JJ, !/.]","(ROOT (S (S (NP (PRP I)) (VP (VBD said))) (, ,) (NP (PRP you)) (ADVP (RB actually)) (VP (VBP owe) (NP (PRP me)) (NP (NP (QP (CD six) (CD thousand))) (, ,) (ADJP (ADJP (QP (CD one) (CD hundred))) (CC and) (ADJP (JJ odd))))) (. !)))"
K/KB/KB9.xml,KB9RE00S,62314,15,,B,2,13,"And I said, you must realize I've a small company, and that's, in one respect that I've had to send those conditions because you're failing to meet the agreed thirty days payment!","[And/CC, I/PRP, said/VBD, ,/,, you/PRP, must/MD, realize/VB, I/PRP, 've/VBP, a/DT, small/JJ, company/NN, ,/,, and/CC, that/DT, 's/VBZ, ,/,, in/IN, one/CD, respect/NN, that/IN, I/PRP, 've/VBP, had/VBN, to/TO, send/VB, those/DT, conditions/NNS, because/IN, you/PRP, 're/VBP, failing/VBG, to/TO, meet/VB, the/DT, agreed/NN, thirty/CD, days/NNS, payment/NN, !/.]","(ROOT (S (CC And) (S (NP (PRP I)) (VP (VBD said))) (PRN (, ,) (S (NP (PRP you)) (VP (MD must) (VP (VB realize) (SBAR (S (NP (PRP I)) (VP (VBP 've) (NP (DT a) (JJ small) (NN company)))))))) (, ,)) (CC and) (S (NP (DT that)) (VP (VBZ 's) (, ,) (PP (IN in) (NP (CD one) (NN respect))) (SBAR (IN that) (S (NP (PRP I)) (VP (VBP 've) (VP (VBN had) (S (VP (TO to) (VP (VB send) (NP (DT those) (NNS conditions))))) (SBAR (IN because) (S (NP (PRP you)) (VP (VBP 're) (VP (VBG failing) (S (VP (TO to) (VP (VB meet) (NP (DT the) (NN agreed) (CD thirty) (NNS days) (NN payment))))))))))))))) (. !)))"
K/KB/KB9.xml,KB9RE00S,62314,16,,A,3,1,Yeah.,"[Yeah/UH, ./.]",(ROOT (INTJ (UH Yeah) (. .)))
K/KB/KB9.xml,KB9RE00S,62314,17,,B,4,1,And I said it's not on!,"[And/CC, I/PRP, said/VBD, it/PRP, 's/VBZ, not/RB, on/IN, !/.]",(ROOT (S (CC And) (NP (PRP I)) (VP (VBD said) (SBAR (S (NP (PRP it)) (VP (VBZ 's) (RB not) (PP (IN on)))))) (. !)))
K/KB/KB9.xml,KB9RE00S,62314,18,,B,4,2,I said we couldn't survive like that.,"[I/PRP, said/VBD, we/PRP, couldn/VBP, 't/PRP, survive/VB, like/IN, that/DT, ./.]",(ROOT (S (NP (PRP I)) (VP (VBD said) (SBAR (S (NP (PRP we)) (VP (VBP couldn) (S (NP (PRP 't)) (VP (VB survive) (PP (IN like) (NP (DT that))))))))) (. .)))
K/KB/KB9.xml,KB9RE00S,62314,19,,B,4,3,"And he said, well would you like to carry on with the contract?","[And/CC, he/PRP, said/VBD, ,/,, well/RB, would/MD, you/PRP, like/VB, to/TO, carry/VB, on/RP, with/IN, the/DT, contract/NN, ?/.]","(ROOT (SINV (S (CC And) (NP (PRP he)) (VP (VBD said))) (, ,) (ADVP (RB well)) (VP (MD would)) (NP (PRP you)) (S (VP (VB like) (S (VP (TO to) (VP (VB carry) (PRT (RP on)) (PP (IN with) (NP (DT the) (NN contract)))))))) (. ?)))"
K/KB/KB9.xml,KB9RE00S,62314,20,,B,4,4,"I said we're too far committed now to, I says to back out.","[I/PRP, said/VBD, we/PRP, 're/VBP, too/RB, far/RB, committed/VBN, now/RB, to/TO, ,/,, I/PRP, says/VBZ, to/TO, back/VB, out/RP, ./.]","(ROOT (S (S (NP (PRP I)) (VP (VBD said) (SBAR (S (NP (PRP we)) (VP (VBP 're) (ADVP (RB too) (RB far)) (VP (VBN committed) (ADVP (RB now)) (PP (TO to)))))))) (, ,) (NP (PRP I)) (VP (VBZ says) (S (VP (TO to) (VP (VB back) (PRT (RP out)))))) (. .)))"
K/KB/KB9.xml,KB9RE00S,62314,21,,B,4,5,"I said, you know, we can't back out at this stage.","[I/PRP, said/VBD, ,/,, you/PRP, know/VBP, ,/,, we/PRP, can/MD, 't/PRP, back/VB, out/RP, at/IN, this/DT, stage/NN, ./.]","(ROOT (S (S (NP (PRP I)) (VP (VBD said))) (, ,) (S (NP (PRP you)) (VP (VBP know))) (, ,) (S (NP (PRP we)) (VP (MD can) (NP (PRP 't)) (S (VP (VB back) (PRT (RP out)) (PP (IN at) (NP (DT this) (NN stage))))))) (. .)))"
K/KB/KB9.xml,KB9RE00S,62314,22,,B,4,6,"And I said, but I said if there isn't the payments of the invoice when they are sent  --","[And/CC, I/PRP, said/VBD, ,/,, but/CC, I/PRP, said/VBD, if/IN, there/EX, isn/SYM, 't/PRP, the/DT, payments/NNS, of/IN, the/DT, invoice/NN, when/WRB, they/PRP, are/VBP, sent/VBN, then/RB, you/PRP, know/VBP, ,/,, we/PRP, 've/VBP, go-/JJ, you/PRP, 've/VBP, gotta/NNP, look/VB, at/IN, it/PRP, ./.]","(ROOT (S (S (S (CC And) (NP (PRP I)) (VP (VBD said))) (, ,) (CC but) (S (NP (PRP I)) (VP (VP (VBD said) (SBAR (IN if) (S (NP (EX there)) (VP (SYM isn) (NP (PRP 't)))))) (NP (NP (DT the) (NNS payments)) (PP (IN of) (NP (DT the) (NN invoice))) (SBAR (WHADVP (WRB when)) (S (NP (PRP they)) (VP (VBP are) (VP (VBN sent) (ADVP (RB then)) (SBAR (S (NP (PRP you)) (VP (VBP know)))))))))))) (, ,) (NP (PRP we)) (VP (VBP 've) (NP (NP (JJ go-)) (SBAR (S (NP (PRP you)) (VP (VBP 've) (S (NP (NNP gotta)) (VP (VB look) (PP (IN at) (NP (PRP it)))))))))) (. .)))"
K/KB/KB9.xml,KB9RE00S,62314,23,,B,4,7,--then  --,"[And/CC, I/PRP, said/VBD, ,/,, but/CC, I/PRP, said/VBD, if/IN, there/EX, isn/SYM, 't/PRP, the/DT, payments/NNS, of/IN, the/DT, invoice/NN, when/WRB, they/PRP, are/VBP, sent/VBN, then/RB, you/PRP, know/VBP, ,/,, we/PRP, 've/VBP, go-/JJ, you/PRP, 've/VBP, gotta/NNP, look/VB, at/IN, it/PRP, ./.]","(ROOT (S (S (S (CC And) (NP (PRP I)) (VP (VBD said))) (, ,) (CC but) (S (NP (PRP I)) (VP (VP (VBD said) (SBAR (IN if) (S (NP (EX there)) (VP (SYM isn) (NP (PRP 't)))))) (NP (NP (DT the) (NNS payments)) (PP (IN of) (NP (DT the) (NN invoice))) (SBAR (WHADVP (WRB when)) (S (NP (PRP they)) (VP (VBP are) (VP (VBN sent) (ADVP (RB then)) (SBAR (S (NP (PRP you)) (VP (VBP know)))))))))))) (, ,) (NP (PRP we)) (VP (VBP 've) (NP (NP (JJ go-)) (SBAR (S (NP (PRP you)) (VP (VBP 've) (S (NP (NNP gotta)) (VP (VB look) (PP (IN at) (NP (PRP it)))))))))) (. .)))"
K/KB/KB9.xml,KB9RE00S,62314,24,,B,4,8,"--you know, we've go- you've gotta look at it.","[And/CC, I/PRP, said/VBD, ,/,, but/CC, I/PRP, said/VBD, if/IN, there/EX, isn/SYM, 't/PRP, the/DT, payments/NNS, of/IN, the/DT, invoice/NN, when/WRB, they/PRP, are/VBP, sent/VBN, then/RB, you/PRP, know/VBP, ,/,, we/PRP, 've/VBP, go-/JJ, you/PRP, 've/VBP, gotta/NNP, look/VB, at/IN, it/PRP, ./.]","(ROOT (S (S (S (CC And) (NP (PRP I)) (VP (VBD said))) (, ,) (CC but) (S (NP (PRP I)) (VP (VP (VBD said) (SBAR (IN if) (S (NP (EX there)) (VP (SYM isn) (NP (PRP 't)))))) (NP (NP (DT the) (NNS payments)) (PP (IN of) (NP (DT the) (NN invoice))) (SBAR (WHADVP (WRB when)) (S (NP (PRP they)) (VP (VBP are) (VP (VBN sent) (ADVP (RB then)) (SBAR (S (NP (PRP you)) (VP (VBP know)))))))))))) (, ,) (NP (PRP we)) (VP (VBP 've) (NP (NP (JJ go-)) (SBAR (S (NP (PRP you)) (VP (VBP 've) (S (NP (NNP gotta)) (VP (VB look) (PP (IN at) (NP (PRP it)))))))))) (. .)))"
K/KB/KB9.xml,KB9RE00S,62314,25,,B,4,9,So that invoice wants,"[So/RB, that/IN, invoice/NN, wants/VBZ]",(ROOT (FRAG (ADVP (RB So)) (SBAR (IN that) (S (NP (NN invoice)) (VP (VBZ wants))))))
K/KB/KB9.xml,KB9RE00S,62314,26,,A,5,1,Doing.,"[Doing/VBG, ./.]",(ROOT (S (VP (VBG Doing)) (. .)))
K/KB/KB9.xml,KB9RE00S,62314,27,,A,5,2,Yeah.,"[Yeah/UH, ./.]",(ROOT (INTJ (UH Yeah) (. .)))
K/KB/KB9.xml,KB9RE00S,62314,28,,B,6,1,"it wants doing and sending, and put in i- put twenty eight days on.","[it/PRP, wants/VBZ, doing/VBG, and/CC, sending/VBG, ,/,, and/CC, put/VBN, in/IN, i-/NN, put/VBD, twenty/CD, eight/CD, days/NNS, on/IN, ./.]","(ROOT (S (S (NP (PRP it)) (VP (VBZ wants) (S (VP (VBG doing) (CC and) (VBG sending))))) (, ,) (CC and) (S (S (VP (VBN put) (PP (IN in) (NP (NN i-))))) (VP (VBD put) (NP (CD twenty) (CD eight) (NNS days)) (PP (IN on)))) (. .)))"
K/KB/KB9.xml,KB9RE00S,62314,29,,A,7,1,Yeah.,"[Yeah/UH, ./.]",(ROOT (INTJ (UH Yeah) (. .)))
K/KB/KB9.xml,KB9RE00S,62314,30,,B,8,1,"Had to be paid, it can't be paid by the twenty eighth it's er  --","[Had/VBD, to/TO, be/VB, paid/VBN, ,/,, it/PRP, can/MD, 't/PRP, be/VB, paid/VBN, by/IN, the/DT, twenty/CD, eighth/JJ, it/PRP, 's/VBZ, er/NN, you/PRP, know/VBP, well/RB, if/IN, I/PRP, could/MD, 've/VB, got/VBD, hold/NN, of/IN, David/NNP, or/CC, er/NN, ,/,, Andrew/NNP, >/JJR, ,/,, I/PRP, was/VBD, gonna/NNP, give/VB, Andrew/NNP, >/JJR, a/DT, right/JJ, bollocking/NN, for/IN, just/RB, pushing/VBG, it/PRP, in/IN, and/CC, he/PRP, should/MD, 've/VB, sent/VBN, it/PRP, to/TO, er/NN, ,/,, Michael/NNP, >/JJR, ,/,, Michael/NNP, >/JJR, 's/POS, just/RB, got/VBD, it/PRP, shoved/VBD, in/IN, front/NN, of/IN, his/PRP$, nose/NN, a-/NN, in/IN, Edinburgh/NNP, ./.]","(ROOT (S (S (S (VP (VBD Had) (S (VP (TO to) (VP (VB be) (VP (VBN paid))))))) (, ,) (NP (PRP it)) (VP (MD can) (NP (PRP 't)) (S (VP (VB be) (VP (VBN paid) (PP (IN by) (NP (NP (DT the) (ADJP (CD twenty) (JJ eighth))) (SBAR (S (NP (PRP it)) (VP (VBZ 's) (NP (NP (NN er)) (SBAR (S (NP (PRP you)) (VP (VBP know) (ADVP (RB well)) (SBAR (IN if) (S (NP (PRP I)) (VP (MD could) (VP (VB 've) (VP (VBD got) (NP (NP (NN hold)) (PP (IN of) (NP (NP (NNP David)) (CC or) (NP (NN er)))))))))))))))))))))))) (, ,) (S (NP (NNP Andrew)) (ADJP (JJR >))) (, ,) (S (NP (PRP I)) (VP (VBD was) (S (NP (NNP gonna)) (VP (VB give) (S (NP (NNP Andrew)) (ADJP (JJR >)) (S (NP (NP (DT a) (JJ right) (NN bollocking)) (PP (IN for) (S (VP (ADVP (RB just)) (VBG pushing) (NP (PRP it)) (PP (IN in)))))))))))) (CC and) (S (NP (PRP he)) (VP (MD should) (VP (VB 've) (VP (VBN sent) (NP (PRP it)) (PP (TO to) (NP (NN er))) (, ,) (NP (NP (NNP Michael)) (SBAR (S (NP (NP (JJR >)) (, ,) (NP (NP (NNP Michael)) (ADJP (JJR >)) (POS 's))) (ADVP (RB just)) (VP (VBD got) (SBAR (S (NP (PRP it)) (VP (VBD shoved) (PP (IN in) (NP (NP (NN front)) (PP (IN of) (NP (PRP$ his) (NN nose) (NN a-))))) (PP (IN in) (NP (NNP Edinburgh)))))))))))))) (. .)))"
K/KB/KB9.xml,KB9RE00S,62314,31,,B,8,2,--you know  --,"[Had/VBD, to/TO, be/VB, paid/VBN, ,/,, it/PRP, can/MD, 't/PRP, be/VB, paid/VBN, by/IN, the/DT, twenty/CD, eighth/JJ, it/PRP, 's/VBZ, er/NN, you/PRP, know/VBP, well/RB, if/IN, I/PRP, could/MD, 've/VB, got/VBD, hold/NN, of/IN, David/NNP, or/CC, er/NN, ,/,, Andrew/NNP, >/JJR, ,/,, I/PRP, was/VBD, gonna/NNP, give/VB, Andrew/NNP, >/JJR, a/DT, right/JJ, bollocking/NN, for/IN, just/RB, pushing/VBG, it/PRP, in/IN, and/CC, he/PRP, should/MD, 've/VB, sent/VBN, it/PRP, to/TO, er/NN, ,/,, Michael/NNP, >/JJR, ,/,, Michael/NNP, >/JJR, 's/POS, just/RB, got/VBD, it/PRP, shoved/VBD, in/IN, front/NN, of/IN, his/PRP$, nose/NN, a-/NN, in/IN, Edinburgh/NNP, ./.]","(ROOT (S (S (S (VP (VBD Had) (S (VP (TO to) (VP (VB be) (VP (VBN paid))))))) (, ,) (NP (PRP it)) (VP (MD can) (NP (PRP 't)) (S (VP (VB be) (VP (VBN paid) (PP (IN by) (NP (NP (DT the) (ADJP (CD twenty) (JJ eighth))) (SBAR (S (NP (PRP it)) (VP (VBZ 's) (NP (NP (NN er)) (SBAR (S (NP (PRP you)) (VP (VBP know) (ADVP (RB well)) (SBAR (IN if) (S (NP (PRP I)) (VP (MD could) (VP (VB 've) (VP (VBD got) (NP (NP (NN hold)) (PP (IN of) (NP (NP (NNP David)) (CC or) (NP (NN er)))))))))))))))))))))))) (, ,) (S (NP (NNP Andrew)) (ADJP (JJR >))) (, ,) (S (NP (PRP I)) (VP (VBD was) (S (NP (NNP gonna)) (VP (VB give) (S (NP (NNP Andrew)) (ADJP (JJR >)) (S (NP (NP (DT a) (JJ right) (NN bollocking)) (PP (IN for) (S (VP (ADVP (RB just)) (VBG pushing) (NP (PRP it)) (PP (IN in)))))))))))) (CC and) (S (NP (PRP he)) (VP (MD should) (VP (VB 've) (VP (VBN sent) (NP (PRP it)) (PP (TO to) (NP (NN er))) (, ,) (NP (NP (NNP Michael)) (SBAR (S (NP (NP (JJR >)) (, ,) (NP (NP (NNP Michael)) (ADJP (JJR >)) (POS 's))) (ADVP (RB just)) (VP (VBD got) (SBAR (S (NP (PRP it)) (VP (VBD shoved) (PP (IN in) (NP (NP (NN front)) (PP (IN of) (NP (PRP$ his) (NN nose) (NN a-))))) (PP (IN in) (NP (NNP Edinburgh)))))))))))))) (. .)))"
K/KB/KB9.xml,KB9RE00S,62314,32,,B,8,3,"--well if I could've got hold of David or er, Andrew <<REDACTED (name)>> , I was gonna give Andrew  <<REDACTED (name)>> a right bollocking for just pushing it in and he should've sent it to er, Michael <<REDACTED (name)>> , Michael  <<REDACTED (name)>> 's just got it shoved in front of his nose a- in Edinburgh.","[Had/VBD, to/TO, be/VB, paid/VBN, ,/,, it/PRP, can/MD, 't/PRP, be/VB, paid/VBN, by/IN, the/DT, twenty/CD, eighth/JJ, it/PRP, 's/VBZ, er/NN, you/PRP, know/VBP, well/RB, if/IN, I/PRP, could/MD, 've/VB, got/VBD, hold/NN, of/IN, David/NNP, or/CC, er/NN, ,/,, Andrew/NNP, >/JJR, ,/,, I/PRP, was/VBD, gonna/NNP, give/VB, Andrew/NNP, >/JJR, a/DT, right/JJ, bollocking/NN, for/IN, just/RB, pushing/VBG, it/PRP, in/IN, and/CC, he/PRP, should/MD, 've/VB, sent/VBN, it/PRP, to/TO, er/NN, ,/,, Michael/NNP, >/JJR, ,/,, Michael/NNP, >/JJR, 's/POS, just/RB, got/VBD, it/PRP, shoved/VBD, in/IN, front/NN, of/IN, his/PRP$, nose/NN, a-/NN, in/IN, Edinburgh/NNP, ./.]","(ROOT (S (S (S (VP (VBD Had) (S (VP (TO to) (VP (VB be) (VP (VBN paid))))))) (, ,) (NP (PRP it)) (VP (MD can) (NP (PRP 't)) (S (VP (VB be) (VP (VBN paid) (PP (IN by) (NP (NP (DT the) (ADJP (CD twenty) (JJ eighth))) (SBAR (S (NP (PRP it)) (VP (VBZ 's) (NP (NP (NN er)) (SBAR (S (NP (PRP you)) (VP (VBP know) (ADVP (RB well)) (SBAR (IN if) (S (NP (PRP I)) (VP (MD could) (VP (VB 've) (VP (VBD got) (NP (NP (NN hold)) (PP (IN of) (NP (NP (NNP David)) (CC or) (NP (NN er)))))))))))))))))))))))) (, ,) (S (NP (NNP Andrew)) (ADJP (JJR >))) (, ,) (S (NP (PRP I)) (VP (VBD was) (S (NP (NNP gonna)) (VP (VB give) (S (NP (NNP Andrew)) (ADJP (JJR >)) (S (NP (NP (DT a) (JJ right) (NN bollocking)) (PP (IN for) (S (VP (ADVP (RB just)) (VBG pushing) (NP (PRP it)) (PP (IN in)))))))))))) (CC and) (S (NP (PRP he)) (VP (MD should) (VP (VB 've) (VP (VBN sent) (NP (PRP it)) (PP (TO to) (NP (NN er))) (, ,) (NP (NP (NNP Michael)) (SBAR (S (NP (NP (JJR >)) (, ,) (NP (NP (NNP Michael)) (ADJP (JJR >)) (POS 's))) (ADVP (RB just)) (VP (VBD got) (SBAR (S (NP (PRP it)) (VP (VBD shoved) (PP (IN in) (NP (NP (NN front)) (PP (IN of) (NP (PRP$ his) (NN nose) (NN a-))))) (PP (IN in) (NP (NNP Edinburgh)))))))))))))) (. .)))"
K/KB/KB9.xml,KB9RE00S,62314,33,,B,8,4,He's just gone in to see if everything's alright at Edinburgh  --,"[He/PRP, 's/VBZ, just/RB, gone/VBN, in/IN, to/TO, see/VB, if/IN, everything/NN, 's/POS, alright/NN, at/IN, Edinburgh/NNP, and/CC, of/IN, course/NN, ,/,, that/DT, 's/VBZ, why/WRB, he/PRP, 's/VBZ, had/VBN, to/TO, report/VB, for/IN, that/DT, ./.]","(ROOT (S (S (NP (PRP He)) (VP (VBZ 's) (ADVP (RB just)) (VP (VBN gone) (PP (IN in) (UCP (S (VP (TO to) (VP (VB see) (PP (IN if) (NP (NP (NN everything) (POS 's)) (NN alright))) (PP (IN at) (NP (NNP Edinburgh)))))) (CC and) (PP (IN of) (NP (NN course)))))))) (, ,) (NP (DT that)) (VP (VBZ 's) (SBAR (WHADVP (WRB why)) (S (NP (PRP he)) (VP (VBZ 's) (VP (VBN had) (S (VP (TO to) (VP (VB report) (PP (IN for) (NP (DT that))))))))))) (. .)))"
K/KB/KB9.xml,KB9RE00S,62314,34,,B,8,5,"--and of course, that's why he's had to report for that.","[He/PRP, 's/VBZ, just/RB, gone/VBN, in/IN, to/TO, see/VB, if/IN, everything/NN, 's/POS, alright/NN, at/IN, Edinburgh/NNP, and/CC, of/IN, course/NN, ,/,, that/DT, 's/VBZ, why/WRB, he/PRP, 's/VBZ, had/VBN, to/TO, report/VB, for/IN, that/DT, ./.]","(ROOT (S (S (NP (PRP He)) (VP (VBZ 's) (ADVP (RB just)) (VP (VBN gone) (PP (IN in) (UCP (S (VP (TO to) (VP (VB see) (PP (IN if) (NP (NP (NN everything) (POS 's)) (NN alright))) (PP (IN at) (NP (NNP Edinburgh)))))) (CC and) (PP (IN of) (NP (NN course)))))))) (, ,) (NP (DT that)) (VP (VBZ 's) (SBAR (WHADVP (WRB why)) (S (NP (PRP he)) (VP (VBZ 's) (VP (VBN had) (S (VP (TO to) (VP (VB report) (PP (IN for) (NP (DT that))))))))))) (. .)))"
K/KB/KB9.xml,KB9RE00S,62314,35,,B,8,6,"Which was fair play to him, but bloody Andrew should have told him!","[Which/WDT, was/VBD, fair/JJ, play/NN, to/TO, him/PRP, ,/,, but/CC, bloody/JJ, Andrew/NNP, should/MD, have/VB, told/VBN, him/PRP, !/.]","(ROOT (S (S (NP (WDT Which)) (VP (VBD was) (NP (NP (JJ fair) (NN play)) (PP (TO to) (NP (PRP him)))))) (, ,) (CC but) (S (NP (JJ bloody) (NNP Andrew)) (VP (MD should) (VP (VB have) (VP (VBN told) (NP (PRP him)))))) (. !)))"
K/KB/KB9.xml,KB9RE00S,62314,36,,B,8,7,"It's agreed, the system of stage payments, it's all written to him.","[It/PRP, 's/VBZ, agreed/VBN, ,/,, the/DT, system/NN, of/IN, stage/NN, payments/NNS, ,/,, it/PRP, 's/VBZ, all/DT, written/VBN, to/TO, him/PRP, ./.]","(ROOT (S (S (NP (PRP It)) (VP (VP (VBZ 's) (VP (VBN agreed))) (, ,) (NP (NP (DT the) (NN system)) (PP (IN of) (NP (NN stage) (NNS payments)))))) (, ,) (NP (PRP it)) (VP (VBZ 's) (NP (NP (DT all)) (VP (VBN written) (PP (TO to) (NP (PRP him)))))) (. .)))"
K/KB/KB9.xml,KB9RE00S,62314,37,,A,9,1,And you've just spoken to him have you?,"[And/CC, you/PRP, 've/VBP, just/RB, spoken/VBN, to/TO, him/PRP, have/VBP, you/PRP, ?/.]",(ROOT (S (CC And) (NP (PRP you)) (VP (VBP 've) (ADVP (RB just)) (VP (VBN spoken) (SBAR (TO to) (S (NP (PRP him)) (VP (VBP have) (NP (PRP you))))))) (. ?)))
K/KB/KB9.xml,KB9RE00S,62314,38,,B,10,1,I've just spoken to Michael <<REDACTED (name)>> .,"[I/PRP, 've/VBP, just/RB, spoken/VBN, to/TO, Michael/NNP, >/JJR, ./.]",(ROOT (S (NP (PRP I)) (VP (VBP 've) (ADVP (RB just)) (VP (VBN spoken) (PP (TO to) (NP (NP (NNP Michael)) (ADJP (JJR >)))))) (. .)))
K/KB/KB9.xml,KB9RE00S,62314,39,,B,10,2,Michael's great!,"[Michael/NNP, 's/POS, great/JJ, !/.]",(ROOT (NP (NP (NP (NNP Michael) (POS 's)) (NP (JJ great))) (. !)))
K/KB/KB9.xml,KB9RE00S,62314,40,,A,11,1,"And you, you  --","[And/CC, you/PRP, ,/,, you/PRP, so/RB, he/PRP, understands/VBZ, after/IN, he/PRP, 's/VBZ, sent/VBN, you/PRP, this/DT, ?/.]","(ROOT (S (CC And) (NP (PRP you)) (, ,) (NP (PRP you)) (RB so) (NP (PRP he)) (VP (VBZ understands) (SBAR (IN after) (S (NP (PRP he)) (VP (VBZ 's) (VP (VBN sent) (S (NP (PRP you)) (NP (DT this)))))))) (. ?)))"
K/KB/KB9.xml,KB9RE00S,62314,41,,A,11,2,--so he understands after he's sent you this?,"[And/CC, you/PRP, ,/,, you/PRP, so/RB, he/PRP, understands/VBZ, after/IN, he/PRP, 's/VBZ, sent/VBN, you/PRP, this/DT, ?/.]","(ROOT (S (CC And) (NP (PRP you)) (, ,) (NP (PRP you)) (RB so) (NP (PRP he)) (VP (VBZ understands) (SBAR (IN after) (S (NP (PRP he)) (VP (VBZ 's) (VP (VBN sent) (S (NP (PRP you)) (NP (DT this)))))))) (. ?)))"
K/KB/KB9.xml,KB9RE00S,62314,42,,B,12,1,What?,"[What/WDT, ?/.]",(ROOT (FRAG (WHNP (WDT What)) (. ?)))
K/KB/KB9.xml,KB9RE00S,62314,43,,A,13,1,What's going on.,"[What/WP, 's/VBZ, going/VBG, on/RP, ./.]",(ROOT (S (NP (WP What)) (VP (VBZ 's) (VP (VBG going) (PRT (RP on)))) (. .)))
K/KB/KB9.xml,KB9RE00S,62314,44,,B,14,1,Yeah.,"[Yeah/UH, ./.]",(ROOT (INTJ (UH Yeah) (. .)))
K/KB/KB9.xml,KB9RE00S,62314,45,,B,14,2,"Because yo- di- I said I had to send that agreement because you're failing to meet the standard agreement, you're not paying within the twenty eight days or the thirty days!","[Because/IN, yo-/JJ, di-/NN, I/NN, said/VBD, I/PRP, had/VBD, to/TO, send/VB, that/DT, agreement/NN, because/IN, you/PRP, 're/VBP, failing/VBG, to/TO, meet/VB, the/DT, standard/JJ, agreement/NN, ,/,, you/PRP, 're/VBP, not/RB, paying/VBG, within/IN, the/DT, twenty/CD, eight/CD, days/NNS, or/CC, the/DT, thirty/CD, days/NNS, !/.]","(ROOT (S (SBAR (IN Because) (S (NP (JJ yo-) (NN di-) (NN I)) (VP (VBD said) (SBAR (S (NP (PRP I)) (VP (VBD had) (S (VP (TO to) (VP (VB send) (NP (DT that) (NN agreement)) (SBAR (IN because) (S (NP (PRP you)) (VP (VBP 're) (VP (VBG failing) (S (VP (TO to) (VP (VB meet) (NP (DT the) (JJ standard) (NN agreement)))))))))))))))))) (, ,) (NP (PRP you)) (VP (VBP 're) (RB not) (VP (VBG paying) (PP (IN within) (NP (NP (DT the) (CD twenty) (CD eight) (NNS days)) (CC or) (NP (DT the) (CD thirty) (NNS days)))))) (. !)))"
K/KB/KB9.xml,KB9RE00S,62314,46,,A,15,1,Mm.,"[Mm/NN, ./.]",(ROOT (NP (NN Mm) (. .)))
K/KB/KB9.xml,KB9RE00S,62314,47,,B,16,1,"I said I've got an invoice outstanding for October, and I said I can't afford to do that!","[I/PRP, said/VBD, I/PRP, 've/VBP, got/VBD, an/DT, invoice/NN, outstanding/JJ, for/IN, October/NNP, ,/,, and/CC, I/PRP, said/VBD, I/PRP, can/MD, 't/PRP, afford/VB, to/TO, do/VB, that/DT, !/.]","(ROOT (S (S (NP (PRP I)) (VP (VBD said) (SBAR (S (NP (PRP I)) (VP (VBP 've) (VP (VBD got) (S (NP (DT an) (NN invoice)) (ADJP (JJ outstanding) (PP (IN for) (NP (NNP October))))))))))) (, ,) (CC and) (S (NP (PRP I)) (VP (VBD said) (SBAR (S (NP (PRP I)) (VP (MD can) (NP (PRP 't)) (S (VP (VB afford) (S (VP (TO to) (VP (VB do) (NP (DT that)))))))))))) (. !)))"
K/KB/KB9.xml,KB9RE00S,62314,48,,B,16,2,"He said, I realize that.","[He/PRP, said/VBD, ,/,, I/PRP, realize/VBP, that/IN, ./.]","(ROOT (S (S (NP (PRP He)) (VP (VBD said))) (, ,) (NP (PRP I)) (VP (VBP realize) (ADVP (IN that))) (. .)))"
