swda_filename,ptb_basename,conversation_no,transcript_index,act_tag,caller,turn_index,subutterance_index,text,pos,trees
K/KD/KDY.xml,KDYRE006,6207,0,,A,1,1,"Did he tell you then, Dave?","[Did/VBD, he/PRP, tell/VB, you/PRP, then/RB, ,/,, Dave/NNP, ?/.]","(ROOT (SQ (VBD Did) (NP (PRP he)) (VP (VB tell) (NP (PRP you)) (ADVP (RB then)) (, ,) (NP (NNP Dave))) (. ?)))"
K/KD/KDY.xml,KDYRE006,6207,1,,B,2,1,Well I said to him I said tickets (()) ,"[Well/RB, I/PRP, said/VBD, to/TO, him/PRP, I/PRP, said/VBD, tickets/NNS]",(ROOT (FRAG (ADVP (RB Well)) (NP (NP (PRP I)) (SBAR (S (VP (VBD said) (PP (TO to) (NP (PRP him))) (SBAR (S (NP (PRP I)) (VP (VBD said) (NP (NNS tickets)))))))))))
K/KD/KDY.xml,KDYRE006,6207,2,,A,3,1,"Yeah, yeah.(()) ","[Yeah/UH, ,/,, yeah/UH, ./.]","(ROOT (INTJ (INTJ (UH Yeah)) (, ,) (INTJ (UH yeah) (. .))))"
K/KD/KDY.xml,KDYRE006,6207,3,,B,4,1,Bloody financial (()) .,"[Bloody/JJ, financial/JJ, ./.]",(ROOT (FRAG (ADJP (JJ Bloody) (JJ financial)) (. .)))
K/KD/KDY.xml,KDYRE006,6207,4,,A,5,1,Yes.,"[Yes/UH, ./.]",(ROOT (INTJ (UH Yes) (. .)))
K/KD/KDY.xml,KDYRE006,6207,5,,A,5,2,Silly isn't it?,"[Silly/JJ, isn/NN, 't/PRP, it/PRP, ?/.]",(ROOT (NP (NP (JJ Silly) (NN isn)) (NP (NP (PRP 't)) (NP (PRP it))) (. ?)))
K/KD/KDY.xml,KDYRE006,6207,6,,A,5,3,Think about it  (()) driving thirty hours (()) .,"[Think/VB, about/IN, it/PRP, driving/VBG, thirty/CD, hours/NNS, ./.]",(ROOT (S (VP (VB Think) (PP (IN about) (S (NP (PRP it)) (VP (VBG driving) (NP (CD thirty) (NNS hours)))))) (. .)))
K/KD/KDY.xml,KDYRE006,6207,7,,B,6,1,(()) ,[],X
K/KD/KDY.xml,KDYRE006,6207,8,,A,7,1,Say well we're not doing the trade you know and  --,"[Say/VB, well/RB, we/PRP, 're/VBP, not/RB, doing/VBG, the/DT, trade/NN, you/PRP, know/VBP, and/CC, Liz/NNP, was/VBD, saying/VBG, to/TO, me/PRP]",(ROOT (S (VP (VB Say) (S (S (ADVP (RB well)) (NP (PRP we)) (VP (VBP 're) (RB not) (VP (VBG doing) (NP (NP (DT the) (NN trade)) (SBAR (S (NP (PRP you)) (VP (VBP know)))))))) (CC and) (S (NP (NNP Liz)) (VP (VBD was) (VP (VBG saying) (PP (TO to) (NP (PRP me))))))))))
K/KD/KDY.xml,KDYRE006,6207,9,,A,7,2,--Liz was saying to me ,"[Say/VB, well/RB, we/PRP, 're/VBP, not/RB, doing/VBG, the/DT, trade/NN, you/PRP, know/VBP, and/CC, Liz/NNP, was/VBD, saying/VBG, to/TO, me/PRP]",(ROOT (S (VP (VB Say) (S (S (ADVP (RB well)) (NP (PRP we)) (VP (VBP 're) (RB not) (VP (VBG doing) (NP (NP (DT the) (NN trade)) (SBAR (S (NP (PRP you)) (VP (VBP know)))))))) (CC and) (S (NP (NNP Liz)) (VP (VBD was) (VP (VBG saying) (PP (TO to) (NP (PRP me))))))))))
K/KD/KDY.xml,KDYRE006,6207,10,,B,8,1,I've been doing fair bit more than a lot of them because they,"[I/PRP, 've/VBP, been/VBN, doing/VBG, fair/JJ, bit/NN, more/JJR, than/IN, a/DT, lot/NN, of/IN, them/PRP, because/IN, they/PRP]",(ROOT (S (NP (PRP I)) (VP (VBP 've) (VP (VBN been) (VP (VBG doing) (NP (NP (JJ fair) (NN bit)) (PP (NP (QP (JJR more) (IN than) (DT a)) (NN lot)) (IN of) (NP (PRP them)))) (PP (IN because) (NP (PRP they))))))))
K/KD/KDY.xml,KDYRE006,6207,11,,A,9,1,Yeah.,"[Yeah/UH, ./.]",(ROOT (INTJ (UH Yeah) (. .)))
K/KD/KDY.xml,KDYRE006,6207,12,,A,9,2,"But Liz was saying to me erm, I was there just before the (()) , about  (()) now where's the letter?","[But/CC, Liz/NNP, was/VBD, saying/VBG, to/TO, me/PRP, erm/NN, ,/,, I/PRP, was/VBD, there/RB, just/RB, before/IN, the/DT, ,/,, about/RB, now/RB, where/WRB, 's/VBZ, the/DT, letter/NN, ?/.]","(ROOT (S (S (CC But) (NP (NNP Liz)) (VP (VBD was) (VP (VBG saying) (PP (TO to) (NP (NP (PRP me)) (NP (NN erm))))))) (, ,) (NP (PRP I)) (VP (VBD was) (ADVP (RB there)) (ADVP (ADVP (RB just) (IN before) (DT the)) (, ,) (ADVP (ADVP (RB about) (RB now)) (SBAR (WHADVP (WRB where)) (S (VP (VBZ 's) (NP (DT the) (NN letter)))))))) (. ?)))"
K/KD/KDY.xml,KDYRE006,6207,13,,A,9,3,"What letter, she didn't know what letter Chip was referring to.","[What/WDT, letter/NN, ,/,, she/PRP, didn/VBZ, 't/PRP, know/VB, what/WP, letter/NN, Chip/NN, was/VBD, referring/VBG, to/TO, ./.]","(ROOT (S (SBAR (WHNP (WDT What)) (FRAG (NP (NN letter)))) (, ,) (NP (PRP she)) (VP (VBZ didn) (S (NP (PRP 't)) (VP (VB know) (SBAR (WHNP (WP what)) (S (NP (NN letter) (NN Chip)) (VP (VBD was) (VP (VBG referring) (PP (TO to))))))))) (. .)))"
K/KD/KDY.xml,KDYRE006,6207,14,,A,9,4,He said what letter?,"[He/PRP, said/VBD, what/WP, letter/NN, ?/.]",(ROOT (S (NP (PRP He)) (VP (VBD said) (SBAR (FRAG (X (WP what)) (NP (NN letter))))) (. ?)))
K/KD/KDY.xml,KDYRE006,6207,15,,A,9,5,She said you've got a letter.,"[She/PRP, said/VBD, you/PRP, 've/VBP, got/VBD, a/DT, letter/NN, ./.]",(ROOT (S (NP (PRP She)) (VP (VBD said) (SBAR (S (NP (PRP you)) (VP (VBP 've) (VP (VBD got) (NP (DT a) (NN letter))))))) (. .)))
K/KD/KDY.xml,KDYRE006,6207,16,,A,9,6,He said I don't know  --,"[He/PRP, said/VBD, I/PRP, don/VBP, 't/PRP, know/VB, She/PRP, said/VBD, come/VBN, on/IN, Chip/NN, you/PRP, 've/VBP, got/VBD, a/DT, letter/NN, she/PRP, said/VBD, ./.]",(ROOT (S (S (NP (PRP He)) (VP (VBD said) (SBAR (S (NP (PRP I)) (VP (VBP don) (S (NP (PRP 't)) (VP (VB know) (SBAR (S (NP (PRP She)) (VP (VBD said) (VP (VBN come) (PP (IN on) (NP (NN Chip)))))))))))))) (NP (PRP you)) (VP (VBP 've) (VP (VBD got) (NP (DT a) (NN letter)) (SBAR (S (NP (PRP she)) (VP (VBD said)))))) (. .)))
K/KD/KDY.xml,KDYRE006,6207,17,,A,9,7,--She said come on Chip you've got a letter she said.,"[He/PRP, said/VBD, I/PRP, don/VBP, 't/PRP, know/VB, She/PRP, said/VBD, come/VBN, on/IN, Chip/NN, you/PRP, 've/VBP, got/VBD, a/DT, letter/NN, she/PRP, said/VBD, ./.]",(ROOT (S (S (NP (PRP He)) (VP (VBD said) (SBAR (S (NP (PRP I)) (VP (VBP don) (S (NP (PRP 't)) (VP (VB know) (SBAR (S (NP (PRP She)) (VP (VBD said) (VP (VBN come) (PP (IN on) (NP (NN Chip)))))))))))))) (NP (PRP you)) (VP (VBP 've) (VP (VBD got) (NP (DT a) (NN letter)) (SBAR (S (NP (PRP she)) (VP (VBD said)))))) (. .)))
K/KD/KDY.xml,KDYRE006,6207,18,,A,9,8,I know all about it don't worry.,"[I/PRP, know/VBP, all/DT, about/IN, it/PRP, don/NNP, 't/PRP, worry/VBP, ./.]",(ROOT (S (NP (PRP I)) (VP (VBP know) (PP (DT all) (IN about) (NP (PRP it))) (NP (NP (NNP don)) (SBAR (S (NP (PRP 't)) (VP (VBP worry)))))) (. .)))
K/KD/KDY.xml,KDYRE006,6207,19,,A,9,9,Oh she said well it's no good me telling you then.,"[Oh/UH, she/PRP, said/VBD, well/RB, it/PRP, 's/VBZ, no/DT, good/JJ, me/PRP, telling/VBG, you/PRP, then/RB, ./.]",(ROOT (S (S (INTJ (UH Oh)) (NP (PRP she)) (VP (VBD said) (ADVP (RB well)))) (NP (PRP it)) (VP (VBZ 's) (NP (NP (DT no) (JJ good)) (S (NP (PRP me)) (VP (VBG telling) (NP (PRP you)) (ADVP (RB then)))))) (. .)))
K/KD/KDY.xml,KDYRE006,6207,20,,A,9,10,She said well you didn't tell me in any case did you?,"[She/PRP, said/VBD, well/RB, you/PRP, didn/VBP, 't/PRP, tell/VB, me/PRP, in/IN, any/DT, case/NN, did/VBD, you/PRP, ?/.]",(ROOT (SINV (S (NP (PRP She)) (VP (VBD said) (ADVP (RB well)) (SBAR (S (NP (PRP you)) (VP (VBP didn) (S (NP (PRP 't)) (VP (VB tell) (NP (PRP me)) (PP (IN in) (NP (DT any) (NN case)))))))))) (VP (VBD did)) (NP (PRP you)) (. ?)))
K/KD/KDY.xml,KDYRE006,6207,21,,A,9,11,"It, cos the erm  --","[It/PRP, ,/,, cos/NNP, the/DT, erm/NN, cashiers/NNS, in/IN, ,/,, desk/NN, cashiers/NNS, ./.]","(ROOT (NP (NP (PRP It)) (, ,) (NP (NP (NNP cos)) (NP (NP (DT the) (NN erm) (NNS cashiers)) (PP (IN in)))) (, ,) (NP (NN desk) (NNS cashiers)) (. .)))"
K/KD/KDY.xml,KDYRE006,6207,22,,A,9,12,"--cashiers in, desk cashiers (()) .","[It/PRP, ,/,, cos/NNP, the/DT, erm/NN, cashiers/NNS, in/IN, ,/,, desk/NN, cashiers/NNS, ./.]","(ROOT (NP (NP (PRP It)) (, ,) (NP (NP (NNP cos)) (NP (NP (DT the) (NN erm) (NNS cashiers)) (PP (IN in)))) (, ,) (NP (NN desk) (NNS cashiers)) (. .)))"
K/KD/KDY.xml,KDYRE006,6207,23,,B,10,1,Yeah.,"[Yeah/UH, ./.]",(ROOT (INTJ (UH Yeah) (. .)))
K/KD/KDY.xml,KDYRE006,6207,24,,A,11,1,"And they totalled the produce, putting all the produce down.","[And/CC, they/PRP, totalled/VBD, the/DT, produce/NN, ,/,, putting/VBG, all/PDT, the/DT, produce/VBP, down/RP, ./.]","(ROOT (S (CC And) (NP (PRP they)) (VP (VBD totalled) (NP (DT the) (NN produce)) (, ,) (S (VP (VBG putting) (SBAR (S (NP (PDT all) (DT the)) (VP (VBP produce) (PRT (RP down)))))))) (. .)))"
K/KD/KDY.xml,KDYRE006,6207,25,,A,11,2,Where others don't bother.,"[Where/WRB, others/NNS, don/VBP, 't/PRP, bother/VB, ./.]",(ROOT (S (SBAR (WHADVP (WRB Where)) (S (NP (NNS others)) (VP (VBP don) (NP (PRP 't))))) (VP (VB bother)) (. .)))
K/KD/KDY.xml,KDYRE006,6207,26,,A,11,3,(()) .(()) old bloody tin thing  (()) car.,"[./., old/JJ, bloody/JJ, tin/NN, thing/NN, car/NN, ./.]",(ROOT (NP (. .) (JJ old) (JJ bloody) (NN tin) (NN thing) (NN car) (. .)))
K/KD/KDY.xml,KDYRE006,6207,27,,A,11,4,He's the second hand bloke she bought (()) .,"[He/PRP, 's/VBZ, the/DT, second/JJ, hand/NN, bloke/NN, she/PRP, bought/VBD, ./.]",(ROOT (S (NP (PRP He)) (VP (VBZ 's) (NP (NP (DT the) (JJ second) (NN hand) (NN bloke)) (SBAR (S (NP (PRP she)) (VP (VBD bought)))))) (. .)))
K/KD/KDY.xml,KDYRE006,6207,28,,A,11,5,Rag and bone merchant you know?,"[Rag/NN, and/CC, bone/NN, merchant/NN, you/PRP, know/VB, ?/.]",(ROOT (FRAG (NP (NP (NN Rag) (CC and) (NN bone) (NN merchant)) (SBAR (S (NP (PRP you)) (VP (VB know))))) (. ?)))
K/KD/KDY.xml,KDYRE006,6207,29,,A,11,6,(()) . You alright there?,"[./., You/PRP, alright/JJ, there/EX, ?/.]",(ROOT (SQ (. .) (NP (PRP You)) (NP (JJ alright) (NP (EX there))) (. ?)))
K/KD/KDY.xml,KDYRE006,6207,30,,B,12,1,Yeah.,"[Yeah/UH, ./.]",(ROOT (INTJ (UH Yeah) (. .)))
K/KD/KDY.xml,KDYRE006,6207,31,,A,13,1,(()) looked up that word.,"[looked/VBD, up/RP, that/DT, word/NN, ./.]",(ROOT (S (VP (VBD looked) (PRT (RP up)) (NP (DT that) (NN word))) (. .)))
K/KD/KDY.xml,KDYRE006,6207,32,,B,14,1,Which word?,"[Which/WDT, word/NN, ?/.]",(ROOT (FRAG (WHNP (WDT Which) (NN word)) (. ?)))
K/KD/KDY.xml,KDYRE006,6207,33,,A,15,1,Delicious.,"[Delicious/NNP, ./.]",(ROOT (FRAG (NP (NNP Delicious)) (. .)))
K/KD/KDY.xml,KDYRE006,6207,34,,A,15,2,"No, most delicious.","[No/DT, ,/,, most/JJS, delicious/NNP, ./.]","(ROOT (NP (NP (DT No)) (, ,) (NP (NP (JJS most)) (NP (NNP delicious))) (. .)))"
K/KD/KDY.xml,KDYRE006,6207,35,,B,16,1,Oh yes.,"[Oh/UH, yes/UH, ./.]",(ROOT (FRAG (UH Oh) (INTJ (UH yes)) (. .)))
K/KD/KDY.xml,KDYRE006,6207,36,,A,17,1,Loveliest.,"[Loveliest/JJS, ./.]",(ROOT (S (VP (ADVP (JJS Loveliest))) (. .)))
K/KD/KDY.xml,KDYRE006,6207,37,,B,18,1,I don't believe it.,"[I/PRP, don/VBP, 't/PRP, believe/VB, it/PRP, ./.]",(ROOT (S (NP (PRP I)) (VP (VBP don) (S (NP (PRP 't)) (VP (VB believe) (NP (PRP it))))) (. .)))
K/KD/KDY.xml,KDYRE006,6207,38,,B,18,2,Oh it was an anagram of that ,"[Oh/UH, it/PRP, was/VBD, an/DT, anagram/NN, of/IN, that/DT]",(ROOT (SINV (FRAG (INTJ (UH Oh))) (VP (ADVP (PRP it)) (VBD was) (NP (NP (DT an) (NN anagram)) (PP (IN of)))) (NP (DT that))))
K/KD/KDY.xml,KDYRE006,6207,39,,A,19,1,Yummiest.,"[Yummiest/JJS, ./.]",(ROOT (S (VP (ADVP (JJS Yummiest))) (. .)))
K/KD/KDY.xml,KDYRE006,6207,40,,A,19,2,Oh it would be wouldn't it?,"[Oh/UH, it/PRP, would/MD, be/VB, wouldn/VBN, 't/PRP, it/PRP, ?/.]",(ROOT (S (S (INTJ (UH Oh)) (NP (PRP it)) (VP (MD would) (VP (VB be) (VP (VBN wouldn) (S (NP (PRP 't)) (NP (PRP it))))))) (. ?)))
K/KD/KDY.xml,KDYRE006,6207,41,,B,20,1,Yes.,"[Yes/UH, ./.]",(ROOT (INTJ (UH Yes) (. .)))
K/KD/KDY.xml,KDYRE006,6207,42,,B,20,2,"Course, you know also","[Course/NN, ,/,, you/PRP, know/VBP, also/RB]","(ROOT (S (ADVP (NN Course)) (, ,) (NP (PRP you)) (VP (VBP know) (ADVP (RB also)))))"
K/KD/KDY.xml,KDYRE006,6207,43,,A,21,1,Yeah.,"[Yeah/UH, ./.]",(ROOT (INTJ (UH Yeah) (. .)))
K/KD/KDY.xml,KDYRE006,6207,44,,B,22,1,well we couldn't the er,"[well/RB, we/PRP, couldn/VBP, 't/PRP, the/DT, er/NN]",(ROOT (ADJP (RB well) (SBAR (S (NP (PRP we)) (VP (VBP couldn) (S (NP (PRP 't)) (NP (DT the) (NN er))))))))
K/KD/KDY.xml,KDYRE006,6207,45,,A,23,1,I don't know what the one was across.,"[I/PRP, don/VBP, 't/PRP, know/VB, what/WP, the/DT, one/CD, was/VBD, across/IN, ./.]",(ROOT (S (NP (PRP I)) (VP (VBP don) (S (NP (PRP 't)) (VP (VB know) (SBAR (WHNP (WP what)) (S (NP (DT the) (CD one)) (VP (VBD was) (ADVP (IN across)))))))) (. .)))
K/KD/KDY.xml,KDYRE006,6207,46,,A,23,2,"It wasn't lumber or  (()) it was a funny name, backscratch or something, a dance.","[It/PRP, wasn/VBD, 't/PRP, lumber/NN, or/CC, it/PRP, was/VBD, a/DT, funny/JJ, name/NN, ,/,, backscratch/NN, or/CC, something/NN, ,/,, a/DT, dance/NN, ./.]","(ROOT (S (NP (PRP It)) (VP (VBD wasn) (SBAR (S (S (NP (PRP 't)) (NP (NN lumber))) (CC or) (S (NP (PRP it)) (VP (VBD was) (NP (NP (NP (DT a) (JJ funny) (NN name)) (, ,) (NP (NN backscratch) (CC or) (NN something)) (, ,)) (NP (DT a) (NN dance)))))))) (. .)))"
K/KD/KDY.xml,KDYRE006,6207,47,,A,23,3,A Brazilian dance.,"[A/DT, Brazilian/JJ, dance/NN, ./.]",(ROOT (NP (DT A) (JJ Brazilian) (NN dance) (. .)))
K/KD/KDY.xml,KDYRE006,6207,48,,B,24,1,"Oh that's in, that's in the Mirror isn't it?","[Oh/UH, that/DT, 's/VBZ, in/IN, ,/,, that/DT, 's/VBZ, in/IN, the/DT, Mirror/NN, isn/NN, 't/PRP, it/PRP, ?/.]","(ROOT (S (S (INTJ (UH Oh)) (NP (DT that)) (VP (VBZ 's) (PP (IN in)))) (, ,) (NP (DT that)) (VP (VBZ 's) (PP (IN in) (NP (DT the) (NN Mirror) (NN isn))) (NP (NP (PRP 't)) (NP (PRP it)))) (. ?)))"
K/KD/KDY.xml,KDYRE006,6207,49,,A,25,1,Oh I don't know.,"[Oh/UH, I/PRP, don/VBP, 't/PRP, know/VB, ./.]",(ROOT (S (S (INTJ (UH Oh)) (NP (PRP I)) (VP (VBP don) (S (NP (PRP 't)) (VP (VB know))))) (. .)))
K/KD/KDY.xml,KDYRE006,6207,50,,B,26,1,And it's like we said.,"[And/CC, it/PRP, 's/VBZ, like/IN, we/PRP, said/VBD, ./.]",(ROOT (S (CC And) (NP (PRP it)) (VP (VBZ 's) (SBAR (IN like) (S (NP (PRP we)) (VP (VBD said))))) (. .)))
K/KD/KDY.xml,KDYRE006,6207,51,,B,26,2,Cos they got it wrong.,"[Cos/NN, they/PRP, got/VBD, it/PRP, wrong/JJ, ./.]",(ROOT (S (NP (NN Cos)) (NP (PRP they)) (VP (VBD got) (S (NP (PRP it)) (ADJP (JJ wrong)))) (. .)))
K/KD/KDY.xml,KDYRE006,6207,52,,B,26,3,Because the word down the fish was the salmon.,"[Because/IN, the/DT, word/NN, down/IN, the/DT, fish/NN, was/VBD, the/DT, salmon/NN, ./.]",(ROOT (S (PP (IN Because) (ADVP (NP (DT the) (NN word)) (IN down))) (NP (DT the) (NN fish)) (VP (VBD was) (NP (DT the) (NN salmon))) (. .)))
K/KD/KDY.xml,KDYRE006,6207,53,,A,27,1,Was it salmon?,"[Was/VBD, it/PRP, salmon/NN, ?/.]",(ROOT (SQ (VBD Was) (NP (PRP it)) (NP (NN salmon)) (. ?)))
K/KD/KDY.xml,KDYRE006,6207,54,,B,28,1,And the one across was monopoly there's no way it can fit is there?,"[And/CC, the/DT, one/CD, across/IN, was/VBD, monopoly/NNP, there/EX, 's/VBZ, no/DT, way/NN, it/PRP, can/MD, fit/VB, is/VBZ, there/EX, ?/.]",(ROOT (S (CC And) (NP (DT the) (CD one)) (ADVP (IN across)) (VP (VBD was) (NP (NP (NNP monopoly)) (SBAR (S (NP (EX there)) (VP (VBZ 's) (NP (NP (DT no) (NN way)) (SBAR (S (NP (PRP it)) (VP (MD can) (VP (VB fit) (SBAR (S (VP (VBZ is) (NP (EX there))))))))))))))) (. ?)))
K/KD/KDY.xml,KDYRE006,6207,55,,B,28,2,So they're wrong.,"[So/IN, they/PRP, 're/VBP, wrong/JJ, ./.]",(ROOT (S (IN So) (NP (PRP they)) (VP (VBP 're) (ADJP (JJ wrong))) (. .)))
K/KD/KDY.xml,KDYRE006,6207,56,,B,28,3,"That's all it is, ask, look.","[That/DT, 's/VBZ, all/DT, it/PRP, is/VBZ, ,/,, ask/VB, ,/,, look/VB, ./.]","(ROOT (S (NP (DT That)) (VP (VBZ 's) (NP (NP (DT all)) (SBAR (S (NP (PRP it)) (VP (VP (VBZ is)) (, ,) (VP (VB ask)) (, ,) (VP (VB look))))))) (. .)))"
K/KD/KDY.xml,KDYRE006,6207,57,,B,28,4,"No, the one with the fish was in the Mirror.","[No/DT, ,/,, the/DT, one/CD, with/IN, the/DT, fish/NN, was/VBD, in/IN, the/DT, Mirror/NN, ./.]","(ROOT (S (NP (NP (DT No)) (, ,) (NP (NP (DT the) (CD one)) (PP (IN with) (NP (DT the) (NN fish))))) (VP (VBD was) (PP (IN in) (NP (DT the) (NN Mirror)))) (. .)))"
K/KD/KDY.xml,KDYRE006,6207,58,,A,29,1,Oh what was the Sun one?,"[Oh/UH, what/WP, was/VBD, the/DT, Sun/NNP, one/CD, ?/.]",(ROOT (S (S (INTJ (UH Oh)) (NP (WP what)) (VP (VBD was) (NP (DT the) (NNP Sun) (CD one)))) (. ?)))
K/KD/KDY.xml,KDYRE006,6207,59,,B,30,1,"Yeah, no, we did two wasn't there?","[Yeah/UH, ,/,, no/DT, ,/,, we/PRP, did/VBD, two/CD, wasn/NN, 't/PRP, there/EX, ?/.]","(ROOT (S (FRAG (INTJ (UH Yeah)) (, ,) (NP (DT no))) (, ,) (NP (PRP we)) (VP (VBD did) (S (NP (NP (CD two) (NN wasn)) (NP (PRP 't))) (NP (EX there)))) (. ?)))"
K/KD/KDY.xml,KDYRE006,6207,60,,B,30,2,"The yummiest was in the, is in the Sun.","[The/DT, yummiest/JJS, was/VBD, in/IN, the/DT, ,/,, is/VBZ, in/IN, the/DT, Sun/NN, ./.]","(ROOT (S (NP (NP (DT The) (JJS yummiest)) (VP (VBD was) (ADVP (IN in) (DT the)))) (, ,) (VP (VBZ is) (PP (IN in) (NP (DT the) (NN Sun)))) (. .)))"
K/KD/KDY.xml,KDYRE006,6207,61,,B,30,3,But the salmon and the monopoly was in the Mirror.,"[But/CC, the/DT, salmon/NN, and/CC, the/DT, monopoly/NN, was/VBD, in/IN, the/DT, Mirror/NN, ./.]",(ROOT (S (CC But) (NP (NP (DT the) (NN salmon)) (CC and) (NP (DT the) (NN monopoly))) (VP (VBD was) (PP (IN in) (NP (DT the) (NN Mirror)))) (. .)))
K/KD/KDY.xml,KDYRE006,6207,62,,A,31,1,It was the samba was it?,"[It/PRP, was/VBD, the/DT, samba/NN, was/VBD, it/PRP, ?/.]",(ROOT (S (NP (PRP It)) (VP (VBD was) (NP (NP (DT the) (NN samba)) (SBAR (S (VP (VBD was) (NP (PRP it))))))) (. ?)))
K/KD/KDY.xml,KDYRE006,6207,63,,B,32,1,"It was, samba?","[It/PRP, was/VBD, ,/,, samba/NN, ?/.]","(ROOT (UCP (S (NP (PRP It)) (VP (VBD was))) (, ,) (NP (NN samba)) (. ?)))"
K/KD/KDY.xml,KDYRE006,6207,64,,B,32,2,Salmon for the fish.,"[Salmon/NN, for/IN, the/DT, fish/NN, ./.]",(ROOT (NP (NP (NN Salmon)) (PP (IN for) (NP (DT the) (NN fish))) (. .)))
K/KD/KDY.xml,KDYRE006,6207,65,,A,33,1,Oh so they'd made a mistake.,"[Oh/UH, so/IN, they/PRP, 'd/MD, made/VBN, a/DT, mistake/NN, ./.]",(ROOT (INTJ (UH Oh) (PP (IN so) (S (NP (PRP they)) (VP (MD 'd) (VP (VBN made) (NP (DT a) (NN mistake)))))) (. .)))
K/KD/KDY.xml,KDYRE006,6207,66,,B,34,1,Yes.,"[Yes/UH, ./.]",(ROOT (INTJ (UH Yes) (. .)))
K/KD/KDY.xml,KDYRE006,6207,67,,B,34,2,That's what I've just said.,"[That/DT, 's/VBZ, what/WP, I/PRP, 've/VBP, just/RB, said/VBN, ./.]",(ROOT (S (NP (DT That)) (VP (VBZ 's) (SBAR (WHNP (WP what)) (S (NP (PRP I)) (VP (VBP 've) (ADVP (RB just)) (VP (VBN said)))))) (. .)))
K/KD/KDY.xml,KDYRE006,6207,68,,B,34,3,So in other words their monopoly begins with an N.,"[So/RB, in/IN, other/JJ, words/NNS, their/PRP$, monopoly/NN, begins/VBZ, with/IN, an/DT, N/NN, ./.]",(ROOT (S (RB So) (PP (IN in) (NP (JJ other) (NNS words))) (NP (PRP$ their) (NN monopoly)) (VP (VBZ begins) (PP (IN with) (NP (DT an) (NN N)))) (. .)))
