swda_filename,ptb_basename,conversation_no,transcript_index,act_tag,caller,turn_index,subutterance_index,text,pos,trees
K/KC/KC4.xml,KC4RE008,6501,83,,B,70,1,That's erm.,"[That/DT, 's/VBZ, erm/NN, ./.]",(ROOT (S (NP (DT That)) (VP (VBZ 's) (NP (NN erm))) (. .)))
K/KC/KC4.xml,KC4RE008,6501,84,,B,70,2,That one's in Col- --,"[That/DT, one/NN, 's/VBZ, in/IN, Col-/NNP, just/RB, outside/RB, ,/,, we/PRP, used/VBD, to/TO, go/VB, there/RB, ./.]","(ROOT (S (S (NP (DT That) (NN one)) (VP (VBZ 's) (PP (IN in) (NP (NNP Col-))) (ADVP (RB just) (RB outside)))) (, ,) (NP (PRP we)) (VP (VBD used) (S (VP (TO to) (VP (VB go) (ADVP (RB there)))))) (. .)))"
K/KC/KC4.xml,KC4RE008,6501,85,,B,70,3,"--just outside, we used to go there.","[That/DT, one/NN, 's/VBZ, in/IN, Col-/NNP, just/RB, outside/RB, ,/,, we/PRP, used/VBD, to/TO, go/VB, there/RB, ./.]","(ROOT (S (S (NP (DT That) (NN one)) (VP (VBZ 's) (PP (IN in) (NP (NNP Col-))) (ADVP (RB just) (RB outside)))) (, ,) (NP (PRP we)) (VP (VBD used) (S (VP (TO to) (VP (VB go) (ADVP (RB there)))))) (. .)))"
K/KC/KC4.xml,KC4RE008,6501,86,,B,70,4,From Colchester.,"[From/IN, Colchester/NNP, ./.]",(ROOT (FRAG (PP (IN From) (NP (NNP Colchester))) (. .)))
K/KC/KC4.xml,KC4RE008,6501,87,,A,71,1,Oh that's erm,"[Oh/UH, that/DT, 's/VBZ, erm/NN]",(ROOT (SINV (FRAG (INTJ (UH Oh))) (VP (ADVP (DT that)) (VP (VBZ 's))) (NP (NN erm))))
K/KC/KC4.xml,KC4RE008,6501,88,,B,72,1,(()) ,[],X
K/KC/KC4.xml,KC4RE008,6501,89,,A,73,1,Ain't that one of Constable's?,"[Ain/NNP, 't/PRP, that/IN, one/CD, of/IN, Constable/NNP, 's/POS, ?/.]",(ROOT (NP (NP (NNP Ain)) (NP (NP (PRP 't)) (PP (IN that) (NP (CD one)))) (PP (IN of) (NP (NNP Constable) (POS 's))) (. ?)))
K/KC/KC4.xml,KC4RE008,6501,90,,B,74,1,"Yes, it some Constable that come too (()) .","[Yes/UH, ,/,, it/PRP, some/DT, Constable/NNP, that/WDT, come/VBP, too/RB, ./.]","(ROOT (S (INTJ (UH Yes)) (, ,) (NP (NP (PRP it)) (NP (DT some) (NNP Constable))) (NP (WDT that)) (VP (VBP come) (ADVP (RB too))) (. .)))"
K/KC/KC4.xml,KC4RE008,6501,91,,A,75,1,Oh.,"[Oh/UH, ./.]",(ROOT (INTJ (UH Oh) (. .)))
K/KC/KC4.xml,KC4RE008,6501,92,,B,76,1,(()) ,[],X
K/KC/KC4.xml,KC4RE008,6501,93,,A,77,1,It's a  (()) isn't he?,"[It/PRP, 's/VBZ, a/DT, isn/NN, 't/PRP, he/PRP, ?/.]",(ROOT (S (NP (PRP It)) (VP (VBZ 's) (NP (NP (DT a) (NN isn)) (NP (NP (PRP 't)) (NP (PRP he))))) (. ?)))
K/KC/KC4.xml,KC4RE008,6501,94,,B,78,1,If it's the one that goes through Colchester.,"[If/IN, it/PRP, 's/VBZ, the/DT, one/CD, that/WDT, goes/VBZ, through/IN, Colchester/NNP, ./.]",(ROOT (S (SBAR (IN If) (S (NP (PRP it)) (VP (VBZ 's) (NP (DT the) (CD one))))) (NP (WDT that)) (VP (VBZ goes) (PP (IN through) (NP (NNP Colchester)))) (. .)))
K/KC/KC4.xml,KC4RE008,6501,95,,A,79,1,"No,(()) , didn't got through Colchester.","[No/DT, ,/,, ,/,, didn/JJ, 't/PRP, got/VBD, through/IN, Colchester/NNP, ./.]","(ROOT (NP (NP (NP (DT No)) (, ,) (VP (, ,) (S (ADJP (JJ didn) (SBAR (S (NP (PRP 't)) (VP (VBD got) (PP (IN through) (NP (NNP Colchester)))))))))) (. .)))"
K/KC/KC4.xml,KC4RE008,6501,96,,B,80,1,Oh it's not the (()) ?,"[Oh/UH, it/PRP, 's/VBZ, not/RB, the/DT, ?/.]",(ROOT (S (S (INTJ (UH Oh)) (NP (PRP it)) (VP (VBZ 's) (NP (RB not) (DT the)))) (. ?)))
K/KC/KC4.xml,KC4RE008,6501,97,,A,81,1,"No, it's not.","[No/DT, ,/,, it/PRP, 's/VBZ, not/RB, ./.]","(ROOT (S (NP (DT No)) (, ,) (NP (PRP it)) (VP (VBZ 's) (RB not)) (. .)))"
K/KC/KC4.xml,KC4RE008,6501,98,,B,82,1,"No, no.","[No/DT, ,/,, no/DT, ./.]","(ROOT (NP (NP (DT No)) (, ,) (NP (DT no)) (. .)))"
K/KC/KC4.xml,KC4RE008,6501,99,,A,83,1,Tomorrow (()) .,"[Tomorrow/NN, ./.]",(ROOT (NP (NN Tomorrow) (. .)))
K/KC/KC4.xml,KC4RE008,6501,100,,B,84,1,"Ah yes, going up towards the er, towards the, not the Baddens the erm","[Ah/NN, yes/RB, ,/,, going/VBG, up/RP, towards/IN, the/DT, er/NN, ,/,, towards/IN, the/DT, ,/,, not/RB, the/DT, Baddens/NNS, the/DT, erm/NN]","(ROOT (NP (NP (NP (NN Ah) (RB yes)) (PRN (, ,) (S (VP (VBG going) (PRT (RP up)) (PP (IN towards) (NP (DT the) (NN er))))) (, ,))) (PP (IN towards) (NP (DT the) (PRN (, ,) (RB not) (NP (NP (DT the) (NNS Baddens)) (NP (DT the) (NN erm))))))))"
K/KC/KC4.xml,KC4RE008,6501,101,,A,85,1,"(()) , well he was up the side of the (()) .","[,/,, well/RB, he/PRP, was/VBD, up/IN, the/DT, side/NN, of/IN, the/DT, ./.]","(ROOT (PRN (, ,) (S (ADVP (RB well)) (NP (PRP he)) (VP (VBD was) (ADVP (IN up)) (NP (NP (DT the) (NN side)) (PP (IN of) (FRAG (NP (DT the)) (. .))))))))"
K/KC/KC4.xml,KC4RE008,6501,102,,B,86,1,Yeah  --,"[Yeah/UH, I/PRP, had/VBD, some/DT, good/JJ, times/NNS, around/IN, Norwich/NNP, ,/,, when/WRB, I/PRP, was/VBD, on/IN, travelling/VBG, order/NN, job/NN, ./.]","(ROOT (S (S (INTJ (UH Yeah)) (NP (PRP I)) (VP (VBD had) (NP (NP (DT some) (JJ good) (NNS times)) (PP (IN around) (NP (NNP Norwich)))))) (, ,) (SBAR (WHADVP (WRB when)) (S (NP (PRP I)) (VP (VBD was) (PP (IN on) (S (VP (VBG travelling) (NP (NN order) (NN job)))))))) (. .)))"
K/KC/KC4.xml,KC4RE008,6501,103,,B,86,2,"--I had some good times around Norwich, when I was on travelling order job.","[Yeah/UH, I/PRP, had/VBD, some/DT, good/JJ, times/NNS, around/IN, Norwich/NNP, ,/,, when/WRB, I/PRP, was/VBD, on/IN, travelling/VBG, order/NN, job/NN, ./.]","(ROOT (S (S (INTJ (UH Yeah)) (NP (PRP I)) (VP (VBD had) (NP (NP (DT some) (JJ good) (NNS times)) (PP (IN around) (NP (NNP Norwich)))))) (, ,) (SBAR (WHADVP (WRB when)) (S (NP (PRP I)) (VP (VBD was) (PP (IN on) (S (VP (VBG travelling) (NP (NN order) (NN job)))))))) (. .)))"
K/KC/KC4.xml,KC4RE008,6501,104,,A,87,1,Good town Norwich.,"[Good/JJ, town/NN, Norwich/NNP, ./.]",(ROOT (NP (NP (JJ Good) (NN town)) (NP (NNP Norwich)) (. .)))
K/KC/KC4.xml,KC4RE008,6501,105,,B,88,1,"It's got a pub for every week of the year, no, wrong, it's got a, it's got a church for every week in the year and a pub for every day in the year.","[It/PRP, 's/VBZ, got/VBD, a/DT, pub/NN, for/IN, every/DT, week/NN, of/IN, the/DT, year/NN, ,/,, no/DT, ,/,, wrong/JJ, ,/,, it/PRP, 's/VBZ, got/VBD, a/DT, ,/,, it/PRP, 's/VBZ, got/VBD, a/DT, church/NN, for/IN, every/DT, week/NN, in/IN, the/DT, year/NN, and/CC, a/DT, pub/NN, for/IN, every/DT, day/NN, in/IN, the/DT, year/NN, ./.]","(ROOT (S (S (NP (PRP It)) (VP (VBZ 's) (VP (VBD got) (S (NP (NP (DT a) (NN pub)) (PP (IN for) (NP (NP (DT every) (NN week)) (PP (IN of) (NP (NP (DT the) (NN year)) (, ,) (NP (DT no)) (, ,)))))) (ADJP (JJ wrong)))))) (, ,) (S (NP (PRP it)) (VP (VBZ 's) (VP (VBD got) (NP (DT a))))) (, ,) (S (NP (PRP it)) (VP (VBZ 's) (VP (VBD got) (NP (DT a) (NN church)) (PP (IN for) (NP (NP (DT every) (NN week)) (PP (IN in) (NP (NP (DT the) (NN year)) (CC and) (NP (DT a) (NN pub)))))) (PP (IN for) (NP (NP (DT every) (NN day)) (PP (IN in) (NP (DT the) (NN year)))))))) (. .)))"
K/KC/KC4.xml,KC4RE008,6501,106,,A,89,1,What Norwich?,"[What/WDT, Norwich/NNP, ?/.]",(ROOT (FRAG (WHNP (WDT What) (NP (NNP Norwich))) (. ?)))
K/KC/KC4.xml,KC4RE008,6501,107,,B,90,1,"Yes, three hundred and sixty odd pubs in Norwich.","[Yes/UH, ,/,, three/CD, hundred/CD, and/CC, sixty/CD, odd/JJ, pubs/NNS, in/IN, Norwich/NNP, ./.]","(ROOT (FRAG (INTJ (UH Yes)) (, ,) (NP (NP (NP (CD three) (CD hundred)) (CC and) (NP (CD sixty) (JJ odd) (NNS pubs))) (PP (IN in) (NP (NNP Norwich)))) (. .)))"
K/KC/KC4.xml,KC4RE008,6501,108,,B,90,2,<laugh> We had the  (()) used to go to Norwich on.,"[We/PRP, had/VBD, the/DT, used/VBN, to/TO, go/VB, to/TO, Norwich/NNP, on/IN, ./.]",(ROOT (S (NP (PRP We)) (VP (VBD had) (NP (NP (DT the)) (VP (VBN used) (S (VP (TO to) (VP (VB go) (PP (TO to) (NP (NNP Norwich))) (PP (IN on)))))))) (. .)))
K/KC/KC4.xml,KC4RE008,6501,109,,B,90,3,"Me  (()) and an aunt, just outside Norwich  <laugh> we used to go up for Sunday dinner  <laugh> it was very nice along the river there, and a, I thought the  (()) very nice part of cathedral, there's a cathedral lies very low it had some very nice erm, mm, what you call it, close, is it (()) ?","[Me/PRP, and/CC, an/DT, aunt/NN, ,/,, just/RB, outside/IN, Norwich/NNP, we/PRP, used/VBD, to/TO, go/VB, up/RP, for/IN, Sunday/NNP, dinner/NN, it/PRP, was/VBD, very/RB, nice/JJ, along/IN, the/DT, river/NN, there/RB, ,/,, and/CC, a/DT, ,/,, I/PRP, thought/VBD, the/DT, very/RB, nice/JJ, part/NN, of/IN, cathedral/NN, ,/,, there/EX, 's/VBZ, a/DT, cathedral/NN, lies/VBZ, very/RB, low/JJ, it/PRP, had/VBD, some/DT, very/RB, nice/JJ, erm/NN, ,/,, mm/NN, ,/,, what/WP, you/PRP, call/VBP, it/PRP, ,/,, close/RB, ,/,, is/VBZ, it/PRP, ?/.]","(ROOT (S (NP (NP (NP (PRP Me)) (CC and) (NP (DT an) (NN aunt))) (, ,) (RB just) (IN outside) (NP (NP (NNP Norwich)) (SBAR (S (NP (PRP we)) (VP (VBD used) (S (VP (TO to) (VP (VB go) (PRT (RP up)) (PP (IN for) (NP (NNP Sunday))) (NP (NP (NN dinner)) (SBAR (S (S (NP (PRP it)) (VP (VBD was) (ADJP (RB very) (JJ nice) (PP (IN along) (ADVP (NP (DT the) (NN river)) (RB there)))))) (, ,) (CC and) (S (NP (DT a)) (PRN (, ,) (S (NP (PRP I)) (VP (VBD thought) (NP (NP (DT the) (ADJP (RB very) (JJ nice)) (NN part)) (PP (IN of) (NP (NN cathedral)))))) (, ,)) (NP (EX there)) (VP (VBZ 's) (NP (NP (DT a) (NN cathedral)) (SBAR (S (VP (VBZ lies) (ADJP (RB very) (JJ low) (SBAR (S (NP (PRP it)) (VP (VBD had) (NP (NP (DT some) (ADJP (RB very) (JJ nice)) (NN erm)) (, ,) (NP (NN mm)) (, ,) (SBAR (WHNP (WP what)) (S (NP (PRP you)) (VP (VP (VBP call) (NP (PRP it))) (, ,) (VP (RB close)))))))))))))))))))))))))) (, ,)) (VP (VBZ is) (NP (PRP it))) (. ?)))"
K/KC/KC4.xml,KC4RE008,6501,110,,A,91,1,(()) very low.,"[very/RB, low/JJ, ./.]",(ROOT (FRAG (ADJP (RB very) (JJ low)) (. .)))
K/KC/KC4.xml,KC4RE008,6501,111,,A,91,2,"Close, erm (()) .","[Close/RB, ,/,, erm/NN, ./.]","(ROOT (FRAG (ADJP (RB Close)) (, ,) (NP (NN erm)) (. .)))"
K/KC/KC4.xml,KC4RE008,6501,112,,A,91,3,They had some lovely  (()) in the  (()) cathedral.,"[They/PRP, had/VBD, some/DT, lovely/JJ, in/IN, the/DT, cathedral/NN, ./.]",(ROOT (S (NP (PRP They)) (VP (VBD had) (NP (NP (DT some) (JJ lovely)) (PP (IN in) (NP (DT the) (NN cathedral))))) (. .)))
K/KC/KC4.xml,KC4RE008,6501,113,,B,92,1,"Very peaceful too, down, down there.","[Very/RB, peaceful/JJ, too/RB, ,/,, down/RB, ,/,, down/IN, there/RB, ./.]","(ROOT (NP (NP (ADJP (RB Very) (JJ peaceful)) (ADVP (RB too))) (PRN (, ,) (ADVP (RB down)) (, ,)) (PP (IN down) (NP (RB there))) (. .)))"
K/KC/KC4.xml,KC4RE008,6501,114,,A,93,1,(()) since I was round there.,"[since/IN, I/PRP, was/VBD, round/JJ, there/RB, ./.]",(ROOT (FRAG (SBAR (IN since) (S (NP (PRP I)) (VP (VBD was) (ADJP (JJ round)) (ADVP (RB there))))) (. .)))
K/KC/KC4.xml,KC4RE008,6501,115,,B,94,1,(()) cos it was the fifties when I was there.,"[cos/NN, it/PRP, was/VBD, the/DT, fifties/NNS, when/WRB, I/PRP, was/VBD, there/RB, ./.]",(ROOT (S (NP (NN cos)) (NP (PRP it)) (VP (VBD was) (NP (NP (DT the) (NNS fifties)) (SBAR (WHADVP (WRB when)) (S (NP (PRP I)) (VP (VBD was) (ADVP (RB there))))))) (. .)))
K/KC/KC4.xml,KC4RE008,6501,116,,B,94,2,"Oh, I've been with Joyce since then, when  (()) had, used to live at Southwold, or near Southwold,(()) and eh, we used to go there and she, she got killed where all the (()) , she had a, a garden wall of felt sort of Fred Flintstone one, and there was a bend on the Ipswich erm, oh Ipswich Lowestoft road, right where she had this cottage","[Oh/UH, ,/,, I/PRP, 've/VBP, been/VBN, with/IN, Joyce/NNP, since/IN, then/RB, ,/,, when/WRB, had/VBN, ,/,, used/VBN, to/TO, live/VB, at/IN, Southwold/NNP, ,/,, or/CC, near/IN, Southwold/NNP, ,/,, and/CC, eh/UH, ,/,, we/PRP, used/VBD, to/TO, go/VB, there/RB, and/CC, she/PRP, ,/,, she/PRP, got/VBD, killed/VBN, where/WRB, all/PDT, the/DT, ,/,, she/PRP, had/VBD, a/DT, ,/,, a/DT, garden/NN, wall/NN, of/IN, felt/VBD, sort/NN, of/IN, Fred/NNP, Flintstone/NNP, one/CD, ,/,, and/CC, there/EX, was/VBD, a/DT, bend/NN, on/IN, the/DT, Ipswich/NNP, erm/NNP, ,/,, oh/UH, Ipswich/NNP, Lowestoft/NNP, road/NNP, ,/,, right/RB, where/WRB, she/PRP, had/VBD, this/DT, cottage/NN]","(ROOT (S (S (INTJ (UH Oh)) (, ,) (NP (PRP I)) (VP (VBP 've) (VP (VBN been) (PP (IN with) (NP (NNP Joyce))) (PP (IN since) (NP (RB then))) (, ,) (SBAR (WHADVP (WRB when)) (S (VP (VP (VBN had)) (, ,) (VP (VBN used)) (S (VP (TO to) (VP (VB live) (PP (PP (IN at) (NP (NNP Southwold))) (, ,) (CC or) (PP (IN near) (NP (NNP Southwold))))))))))))) (, ,) (CC and) (S (INTJ (UH eh)) (, ,) (S (NP (PRP we)) (VP (VBD used) (S (VP (TO to) (VP (VB go) (ADVP (RB there))))))) (CC and) (S (NP (PRP she)) (, ,) (NP (PRP she)) (VP (VBD got) (VP (VBN killed) (SBAR (SBAR (WHADVP (WRB where)) (S (S (NP (PDT all) (DT the)) (, ,) (NP (PRP she)) (VP (VBD had) (NP (DT a)))) (, ,) (S (NP (NP (DT a) (NN garden) (NN wall)) (PP (IN of))) (VP (VBD felt) (NP (NP (NN sort)) (PP (IN of) (NP (NNP Fred) (NNP Flintstone) (CD one)))))) (, ,) (CC and) (S (NP (EX there)) (VP (VBD was) (NP (DT a) (NN bend)) (PP (IN on) (NP (DT the) (NNP Ipswich) (NNP erm))) (, ,) (NP (INTJ (UH oh)) (NP (NNP Ipswich) (NNP Lowestoft) (NNP road))))))) (, ,) (ADVP (RB right)) (SBAR (WHADVP (WRB where)) (S (NP (PRP she)) (VP (VBD had) (NP (DT this) (NN cottage))))))))))))"
K/KC/KC4.xml,KC4RE008,6501,117,,A,95,1,Oh yeah.,"[Oh/UH, yeah/UH, ./.]",(ROOT (S (INTJ (UH Oh)) (VP (UH yeah)) (. .)))
K/KC/KC4.xml,KC4RE008,6501,118,,B,96,1,"and some car came through out of control, went straight into the wall, the wall collapsed on top of her and killed her.","[and/CC, some/DT, car/NN, came/VBD, through/IN, out/IN, of/IN, control/NN, ,/,, went/VBD, straight/RB, into/IN, the/DT, wall/NN, ,/,, the/DT, wall/NN, collapsed/VBD, on/IN, top/NN, of/IN, her/PRP$, and/CC, killed/VBD, her/PRP, ./.]","(ROOT (S (CC and) (NP (DT some) (NN car)) (VP (VP (VBD came) (PP (IN through) (PP (IN out) (PP (IN of) (NP (NN control)))))) (, ,) (VP (VBD went) (SBAR (S (PP (RB straight) (PP (IN into) (NP (DT the) (NN wall)))) (, ,) (NP (DT the) (NN wall)) (VP (VBD collapsed) (PP (IN on) (NP (NP (NN top)) (PP (IN of) (NP (PRP$ her))))))))) (CC and) (VP (VBD killed) (NP (PRP her)))) (. .)))"
K/KC/KC4.xml,KC4RE008,6501,119,,B,96,2,"Oh she was, well, she was over sixty, she'd retired, was about sixty five.","[Oh/UH, she/PRP, was/VBD, ,/,, well/RB, ,/,, she/PRP, was/VBD, over/IN, sixty/CD, ,/,, she/PRP, 'd/MD, retired/VBN, ,/,, was/VBD, about/IN, sixty/CD, five/CD, ./.]","(ROOT (S (S (INTJ (UH Oh)) (NP (PRP she)) (VP (VBD was) (, ,) (INTJ (RB well)) (, ,) (S (NP (PRP she)) (VP (VBD was) (PP (IN over) (NP (CD sixty))))))) (, ,) (NP (PRP she)) (VP (MD 'd) (S (ADJP (VBN retired))) (, ,) (VP (VBD was) (PP (IN about) (NP (CD sixty) (CD five))))) (. .)))"
K/KC/KC4.xml,KC4RE008,6501,120,,B,96,3,"Nice woman, she was a (()) .","[Nice/JJ, woman/NN, ,/,, she/PRP, was/VBD, a/DT, ./.]","(ROOT (S (NP (JJ Nice) (NN woman)) (, ,) (NP (PRP she)) (VP (VBD was) (NP (DT a))) (. .)))"
K/KC/KC4.xml,KC4RE008,6501,121,,B,96,4,"(()) I don't really know her name, oh eh, oh, no she married and she (()) .","[I/PRP, don/VBP, 't/PRP, really/RB, know/VB, her/PRP$, name/NN, ,/,, oh/UH, eh/UH, ,/,, oh/UH, ,/,, no/DT, she/PRP, married/VBD, and/CC, she/PRP, ./.]","(ROOT (S (NP (PRP I)) (VP (VBP don) (SBAR (S (NP (PRP 't)) (ADVP (RB really)) (VP (VB know) (S (NP (PRP$ her) (NN name)) (, ,) (INTJ (UH oh) (UH eh)) (, ,) (INTJ (UH oh)) (, ,) (NP (DT no) (PRP she)) (VP (VP (VBD married)) (CC and) (VP (NP (PRP she))))))))) (. .)))"
K/KC/KC4.xml,KC4RE008,6501,122,,A,97,1,Trying to think the name of the  (()) place.,"[Trying/VBG, to/TO, think/VB, the/DT, name/NN, of/IN, the/DT, place/NN, ./.]",(ROOT (S (VP (VBG Trying) (S (VP (TO to) (VP (VB think) (NP (NP (DT the) (NN name)) (PP (IN of) (NP (DT the) (NN place)))))))) (. .)))
K/KC/KC4.xml,KC4RE008,6501,123,,B,98,1,She was always called Mac.,"[She/PRP, was/VBD, always/RB, called/VBN, Mac/NNP, ./.]",(ROOT (S (NP (PRP She)) (VP (VBD was) (ADVP (RB always)) (VP (VBN called) (NP (NNP Mac)))) (. .)))
K/KC/KC4.xml,KC4RE008,6501,124,,A,99,1,Eh?,"[Eh/UH, ?/.]",(ROOT (INTJ (UH Eh) (. ?)))
K/KC/KC4.xml,KC4RE008,6501,125,,B,100,1,She was always called Mac.,"[She/PRP, was/VBD, always/RB, called/VBN, Mac/NNP, ./.]",(ROOT (S (NP (PRP She)) (VP (VBD was) (ADVP (RB always)) (VP (VBN called) (NP (NNP Mac)))) (. .)))
K/KC/KC4.xml,KC4RE008,6501,126,,B,100,2,"<laugh> she was Mac something  (()) no I, no I tell you, I tell you what that reminds me of, you know the little, I don't know if you do, if you walk along the canal towards Berkhamstead, by a lock","[she/PRP, was/VBD, Mac/NNP, something/NN, no/DT, I/PRP, ,/,, no/DT, I/PRP, tell/VBP, you/PRP, ,/,, I/PRP, tell/VBP, you/PRP, what/WP, that/WDT, reminds/VBZ, me/PRP, of/IN, ,/,, you/PRP, know/VBP, the/DT, little/JJ, ,/,, I/PRP, don/VBP, 't/PRP, know/VB, if/IN, you/PRP, do/VBP, ,/,, if/IN, you/PRP, walk/VBP, along/IN, the/DT, canal/NN, towards/IN, Berkhamstead/NN, ,/,, by/IN, a/DT, lock/NN]","(ROOT (S (NP (PRP she)) (VP (VBD was) (NP (NP (NNP Mac) (NN something)) (SBAR (S (NP (DT no) (PRP I)) (PRN (, ,) (S (NP (DT no) (PRP I)) (VP (VBP tell) (NP (PRP you)))) (, ,)) (NP (PRP I)) (VP (VBP tell) (NP (PRP you)) (SBAR (WHNP (WP what)) (S (SBAR (WHNP (WDT that)) (S (VP (VBZ reminds) (NP (PRP me)) (PP (IN of))))) (, ,) (NP (PRP you)) (VP (VBP know) (NP (DT the) (JJ little)) (, ,) (SBAR (S (NP (PRP I)) (VP (VBP don) (S (NP (PRP 't)) (VP (VB know) (SBAR (IN if) (S (NP (PRP you)) (VP (VBP do)))))) (, ,) (SBAR (IN if) (S (NP (PRP you)) (VP (VBP walk) (ADVP (IN along) (NP (DT the) (NN canal)) (PP (IN towards) (NP (NN Berkhamstead))) (, ,) (PP (IN by) (NP (DT a) (NN lock))))))))))))))))))))"
K/KC/KC4.xml,KC4RE008,6501,127,,A,101,1,"Oh yes, I (()) .","[Oh/UH, yes/UH, ,/,, I/PRP, ./.]","(ROOT (FRAG (INTJ (UH Oh) (UH yes)) (, ,) (NP (PRP I)) (. .)))"
K/KC/KC4.xml,KC4RE008,6501,128,,B,102,1,"There's a pub that's very similar in constructions to that, that lies low beside the lock.","[There/EX, 's/VBZ, a/DT, pub/NN, that/WDT, 's/VBZ, very/RB, similar/JJ, in/IN, constructions/NNS, to/TO, that/DT, ,/,, that/IN, lies/VBZ, low/JJ, beside/IN, the/DT, lock/NN, ./.]","(ROOT (S (NP (EX There)) (VP (VBZ 's) (NP (NP (DT a) (NN pub)) (SBAR (WHNP (WDT that)) (S (VP (VBZ 's) (ADJP (RB very) (JJ similar) (PP (IN in) (NP (NP (NNS constructions)) (PP (TO to) (NP (NP (DT that)) (, ,) (SBAR (WHNP (IN that)) (S (VP (VBZ lies) (ADJP (JJ low) (PP (IN beside) (NP (DT the) (NN lock))))))))))))))))) (. .)))"
K/KC/KC4.xml,KC4RE008,6501,129,,A,103,1,"It's on just across the where, where the bridge (()) .","[It/PRP, 's/VBZ, on/IN, just/RB, across/IN, the/DT, where/WRB, ,/,, where/WRB, the/DT, bridge/NN, ./.]","(ROOT (S (NP (PRP It)) (VP (VBZ 's) (ADJP (ADVP (IN on) (RB just)) (PP (IN across) (NP (NP (DT the)) (FRAG (WHADVP (WRB where)))))) (, ,) (SBAR (WHADVP (WRB where)) (FRAG (NP (DT the) (NN bridge))))) (. .)))"
K/KC/KC4.xml,KC4RE008,6501,130,,B,104,1,"You cross where the little bridge goes, you've got a little bridge like that.","[You/PRP, cross/VBP, where/WRB, the/DT, little/JJ, bridge/NN, goes/VBZ, ,/,, you/PRP, 've/VBP, got/VBD, a/DT, little/JJ, bridge/NN, like/IN, that/DT, ./.]","(ROOT (S (S (NP (PRP You)) (VP (VBP cross) (SBAR (WHADVP (WRB where)) (S (NP (DT the) (JJ little) (NN bridge)) (VP (VBZ goes)))))) (, ,) (NP (PRP you)) (VP (VBP 've) (VP (VBD got) (NP (DT a) (JJ little) (NN bridge)) (PP (IN like) (NP (DT that))))) (. .)))"
K/KC/KC4.xml,KC4RE008,6501,131,,A,105,1,Mm.,"[Mm/NN, ./.]",(ROOT (NP (NN Mm) (. .)))
K/KC/KC4.xml,KC4RE008,6501,132,,B,106,1,"Because you've got, I don't think cars can cross it, or  (()) if it'll lift up.","[Because/IN, you/PRP, 've/VBP, got/VBN, ,/,, I/PRP, don/VBP, 't/PRP, think/VB, cars/NNS, can/MD, cross/VB, it/PRP, ,/,, or/CC, if/IN, it/PRP, 'll/MD, lift/VB, up/RP, ./.]","(ROOT (S (SBAR (IN Because) (S (NP (PRP you)) (VP (VBP 've) (VP (VBN got))))) (, ,) (NP (PRP I)) (VP (VBP don) (S (NP (PRP 't)) (VP (VB think) (SBAR (SBAR (S (NP (NNS cars)) (VP (MD can) (VP (VB cross) (NP (PRP it)))))) (, ,) (CC or) (SBAR (IN if) (S (NP (PRP it)) (VP (MD 'll) (VP (VB lift) (PRT (RP up)))))))))) (. .)))"
K/KC/KC4.xml,KC4RE008,6501,133,,A,107,1,"Yes, that's a lift up bridge.","[Yes/UH, ,/,, that/DT, 's/VBZ, a/DT, lift/NN, up/RP, bridge/NN, ./.]","(ROOT (S (INTJ (UH Yes)) (, ,) (NP (DT that)) (VP (VBZ 's) (NP (NP (DT a) (NN lift)) (PP (RP up) (NP (NN bridge))))) (. .)))"
K/KC/KC4.xml,KC4RE008,6501,134,,B,108,1,A lift up bridge that's right.,"[A/DT, lift/NN, up/RP, bridge/NN, that/WDT, 's/VBZ, right/NN, ./.]",(ROOT (NP (NP (DT A) (NN lift) (PRT (RP up))) (NP (NP (NN bridge)) (SBAR (WHNP (WDT that)) (S (VP (VBZ 's) (NP (NN right)))))) (. .)))
K/KC/KC4.xml,KC4RE008,6501,135,,A,109,1,Mm.,"[Mm/NN, ./.]",(ROOT (NP (NN Mm) (. .)))
K/KC/KC4.xml,KC4RE008,6501,136,,A,109,2,"Yes, it's over the canal.","[Yes/UH, ,/,, it/PRP, 's/VBZ, over/IN, the/DT, canal/NN, ./.]","(ROOT (S (INTJ (UH Yes)) (, ,) (NP (PRP it)) (VP (VBZ 's) (PP (IN over) (NP (DT the) (NN canal)))) (. .)))"
K/KC/KC4.xml,KC4RE008,6501,137,,B,110,1,"Over the canal, yes.","[Over/IN, the/DT, canal/NN, ,/,, yes/UH, ./.]","(ROOT (FRAG (PP (IN Over) (NP (DT the) (NN canal))) (, ,) (INTJ (UH yes)) (. .)))"
K/KC/KC4.xml,KC4RE008,6501,138,,B,110,2,"Mm, but it, that, that reminds me of that, not exactly the same, it's a very similar, very similar building, a long sloping roof, not very high building.","[Mm/NN, ,/,, but/CC, it/PRP, ,/,, that/IN, ,/,, that/IN, reminds/VBZ, me/PRP, of/IN, that/DT, ,/,, not/RB, exactly/RB, the/DT, same/JJ, ,/,, it/PRP, 's/VBZ, a/DT, very/RB, similar/JJ, ,/,, very/RB, similar/JJ, building/NN, ,/,, a/DT, long/JJ, sloping/NN, roof/NN, ,/,, not/RB, very/RB, high/JJ, building/NN, ./.]","(ROOT (FRAG (NP (NN Mm)) (, ,) (PP (CC but) (NP (PRP it))) (, ,) (SBAR (IN that) (, ,) (S (SBAR (WHNP (IN that)) (S (VP (VBZ reminds) (NP (PRP me)) (PP (IN of) (NP (NP (DT that)) (, ,) (RB not) (RB exactly) (NP (DT the) (JJ same))))))) (, ,) (NP (PRP it)) (VP (VBZ 's) (NP (NP (DT a) (ADJP (RB very) (JJ similar)) (, ,) (ADJP (RB very) (JJ similar)) (NN building)) (, ,) (NP (DT a) (JJ long) (NN sloping) (NN roof)) (, ,) (NP (ADJP (RB not) (RB very) (JJ high)) (NN building)))))) (. .)))"
K/KC/KC4.xml,KC4RE008,6501,139,,B,110,3,"Isn't that, isn't that second  (()) isn't he, with a, a, a (()) ?","[Isn/NNP, 't/PRP, that/IN, ,/,, isn/NNP, 't/PRP, that/IN, second/JJ, isn/NN, 't/PRP, he/PRP, ,/,, with/IN, a/DT, ,/,, a/DT, ,/,, a/DT, ?/.]","(ROOT (NP (NP (NNP Isn)) (NP (NP (NP (PRP 't)) (SBAR (WHNP (IN that)))) (, ,) (NP (NNP isn))) (NP (NP (PRP 't)) (PP (IN that) (NP (JJ second) (NN isn)))) (NP (NP (PRP 't)) (NP (PRP he))) (, ,) (PP (IN with) (NP (NP (DT a)) (, ,) (NP (NP (DT a)) (, ,) (NP (DT a))))) (. ?)))"
K/KC/KC4.xml,KC4RE008,6501,140,,A,111,1,Who is?,"[Who/WP, is/VBZ, ?/.]",(ROOT (SBARQ (WHNP (WP Who)) (SQ (VP (VBZ is))) (. ?)))
K/KC/KC4.xml,KC4RE008,6501,141,,B,112,1,"(()) , isn't it?","[,/,, isn/NNP, 't/PRP, it/PRP, ?/.]","(ROOT (FRAG (FRAG (, ,) (NP (NNP isn))) (PRP 't) (FRAG (NP (PRP it)) (. ?))))"
K/KC/KC4.xml,KC4RE008,6501,142,,A,113,1,"It's a, a little river (()) .","[It/PRP, 's/VBZ, a/DT, ,/,, a/DT, little/JJ, river/NN, ./.]","(ROOT (S (NP (PRP It)) (VP (VBZ 's) (NP (NP (DT a)) (, ,) (NP (DT a) (JJ little) (NN river)))) (. .)))"
K/KC/KC4.xml,KC4RE008,6501,143,,B,114,1,(()) Stour.,"[Stour/NNP, ./.]",(ROOT (FRAG (NP (NNP Stour)) (. .)))
K/KC/KC4.xml,KC4RE008,6501,144,,A,115,1,"Stour, Stewer, S T O U R the river Stour.","[Stour/NNP, ,/,, Stewer/NNP, ,/,, S/NNP, T/NN, O/NN, U/NN, R/NN, the/DT, river/NN, Stour/NNP, ./.]","(ROOT (NP (NP (NNP Stour)) (, ,) (NP (NNP Stewer)) (, ,) (NP (NP (NNP S) (NN T) (NN O) (NN U)) (NP (NN R))) (NP (NP (DT the) (NN river)) (NP (NNP Stour))) (. .)))"
K/KC/KC4.xml,KC4RE008,6501,145,,B,116,1,"Oh, Stour, the river Stour , yeah, eh, erm, that looks as if he's  (()) that looks as if is","[Oh/UH, ,/,, Stour/NNP, ,/,, the/DT, river/NN, Stour/NNP, ,/,, yeah/UH, ,/,, eh/UH, ,/,, erm/NN, ,/,, that/WDT, looks/VBZ, as/IN, if/IN, he/PRP, 's/VBZ, that/DT, looks/VBZ, as/IN, if/IN, is/VBZ]","(ROOT (S (INTJ (UH Oh)) (, ,) (NP (NNP Stour)) (, ,) (NP (NP (DT the) (NN river) (NNP Stour)) (PRN (, ,) (FRAG (INTJ (UH yeah) (, ,) (UH eh)) (, ,) (NP (NN erm))) (, ,)) (SBAR (WHNP (WDT that)) (S (VP (VBZ looks) (SBAR (IN as) (IN if) (S (NP (PRP he)) (VP (VBZ 's) (NP (DT that))))))))) (VP (VBZ looks) (SBAR (IN as) (IN if) (S (VP (VBZ is)))))))"
K/KC/KC4.xml,KC4RE008,6501,146,,A,117,1,<whispering> ,[],X
K/KC/KC4.xml,KC4RE008,6501,147,,A,117,2,(()) ,[],X
K/KC/KC4.xml,KC4RE008,6501,148,,A,117,3,</whispering> ,[],X
K/KC/KC4.xml,KC4RE008,6501,149,,B,118,1,"Ain't he got a longboat there, by the side of the trees?","[Ain/NNP, 't/PRP, he/PRP, got/VBD, a/DT, longboat/RB, there/RB, ,/,, by/IN, the/DT, side/NN, of/IN, the/DT, trees/NNS, ?/.]","(ROOT (S (NP (NNP Ain) (PRP 't)) (NP (PRP he)) (VP (VBD got) (NP (DT a) (X (ADVP (RB longboat)) (NP (RB there)))) (, ,) (PP (IN by) (NP (NP (DT the) (NN side)) (PP (IN of) (NP (DT the) (NNS trees)))))) (. ?)))"
K/KC/KC4.xml,KC4RE008,6501,150,,A,119,1,Yeah.,"[Yeah/UH, ./.]",(ROOT (INTJ (UH Yeah) (. .)))
K/KC/KC4.xml,KC4RE008,6501,151,,B,120,1,Yeah.,"[Yeah/UH, ./.]",(ROOT (INTJ (UH Yeah) (. .)))
K/KC/KC4.xml,KC4RE008,6501,152,,A,121,1,"These are all reeds along here, that's  (()) the cottage.","[These/DT, are/VBP, all/DT, reeds/NNS, along/IN, here/RB, ,/,, that/DT, 's/VBZ, the/DT, cottage/NN, ./.]","(ROOT (S (S (NP (DT These)) (VP (VBP are) (NP (NP (DT all) (NNS reeds)) (PP (IN along) (NP (RB here)))))) (, ,) (NP (DT that)) (VP (VBZ 's) (NP (DT the) (NN cottage))) (. .)))"
K/KC/KC4.xml,KC4RE008,6501,153,,B,122,1,"Yeah , yeah.","[Yeah/UH, ,/,, yeah/UH, ./.]","(ROOT (INTJ (INTJ (UH Yeah)) (, ,) (INTJ (UH yeah) (. .))))"
K/KC/KC4.xml,KC4RE008,6501,154,,A,123,1,"Is it here, or is it there?","[Is/VBZ, it/PRP, here/RB, ,/,, or/CC, is/VBZ, it/PRP, there/EX, ?/.]","(ROOT (SQ (SQ (VBZ Is) (NP (PRP it)) (ADVP (RB here))) (, ,) (CC or) (SQ (VBZ is) (NP (NP (PRP it)) (NP (EX there)))) (. ?)))"
